{"run":1015,"commit":"5f36188","metric":14,"metrics":{"compiler_test262_cases":500,"compiler_test262_pass":486,"compiler_test262_failures":14,"compiler_test262_compiler_errors":0,"compiler_test262_compiler_crashes":0,"compiler_test262_compiler_fails":1,"compiler_test262_both_fail":12,"compiler_test262_interpreter_fail_compiler_pass":1,"compatibility_pass":486,"compatibility_cases":500,"compiler_errors":0,"compiler_crashes":0,"compiler_fails":1,"both_fail":12,"interpreter_fail_compiler_pass":1,"elapsed_ms":41186},"status":"discard","description":"Copy within typed-array receivers","timestamp":1778594656851,"segment":42,"confidence":5.085106382978723,"iterationTokens":11104,"asi":{"hypothesis":"Array.prototype.copyWithin should use TypedArray element reads/writes for typed-array receivers and no-op when resizable-buffer views are out of bounds.","rollback_reason":"Primary metric stayed flat at 14 and introduced an interpreter_fail_compiler_pass split for copyWithin/resizable-buffer.js, despite compiler/source probes passing.","next_action_hint":"Do not retry typed-array copyWithin unchanged; investigate native bytecode/interpreter element write semantics for typed-array receivers under Test262 harness before another attempt."}}
{"run":1016,"commit":"7ee282f","metric":13,"metrics":{"compiler_test262_cases":500,"compiler_test262_pass":487,"compiler_test262_failures":13,"compiler_test262_compiler_errors":0,"compiler_test262_compiler_crashes":0,"compiler_test262_compiler_fails":0,"compiler_test262_both_fail":13,"compiler_test262_interpreter_fail_compiler_pass":0,"compatibility_pass":487,"compatibility_cases":500,"compiler_errors":0,"compiler_crashes":0,"compiler_fails":0,"both_fail":13,"interpreter_fail_compiler_pass":0,"elapsed_ms":42237},"status":"keep","description":"Check Object prototype in HasProperty fallback","timestamp":1778595516060,"segment":42,"confidence":5.161290322580645,"iterationTokens":11663,"asi":{"hypothesis":"Ordinary object HasProperty should mirror Get's fallback to Object.prototype when an object map has no explicit prototype slot, while avoiding recursion on Object.prototype itself.","improvement":"Reduced Array failures from 14 to 13 and eliminated the remaining compiler-only failure by letting compiled array-like objects observe Object.prototype properties added by getters during Array.every.","next_action_hint":"Remaining failures are shared: realm cases, RegExp concat spreadability identity, copyWithin coercion/resizable behavior, and Array.at typed-array case which stayed flat previously."}}
{"run":1017,"commit":"7ee282f","metric":13,"metrics":{"compiler_test262_cases":500,"compiler_test262_pass":487,"compiler_test262_failures":13,"compiler_test262_compiler_errors":0,"compiler_test262_compiler_crashes":0,"compiler_test262_compiler_fails":0,"compiler_test262_both_fail":13,"compiler_test262_interpreter_fail_compiler_pass":0,"compatibility_pass":487,"compatibility_cases":500,"compiler_errors":0,"compiler_crashes":0,"compiler_fails":0,"both_fail":13,"interpreter_fail_compiler_pass":0,"elapsed_ms":73987},"status":"discard","description":"Read typed-array receivers in Array.at after HasProperty fixes","timestamp":1778595960557,"segment":42,"confidence":4.8979591836734695,"iterationTokens":2402,"asi":{"hypothesis":"After eliminating compiler-only HasProperty failure, focused Array.prototype.at typed-array receiver support might now reduce the remaining Array workload.","rollback_reason":"Primary metric stayed flat at 13 even though the focused typed-array-resizable-buffer at() case passes; this workload likely has another case shifting or same limited accounting behavior as prior at() retry.","next_action_hint":"Do not retry Array.at typed-array support unchanged on this workload. Remaining tractable non-realm targets are copyWithin semantics and RegExp object identity/spreadability."}}
{"run":1018,"commit":"2a3e02b","metric":12,"metrics":{"compiler_test262_cases":500,"compiler_test262_pass":488,"compiler_test262_failures":12,"compiler_test262_compiler_errors":0,"compiler_test262_compiler_crashes":0,"compiler_test262_compiler_fails":0,"compiler_test262_both_fail":12,"compiler_test262_interpreter_fail_compiler_pass":0,"compatibility_pass":488,"compatibility_cases":500,"compiler_errors":0,"compiler_crashes":0,"compiler_fails":0,"both_fail":12,"interpreter_fail_compiler_pass":0,"elapsed_ms":43008},"status":"keep","description":"Give RegExp literals per-instance properties","timestamp":1778596808010,"segment":42,"confidence":4.8686868686868685,"iterationTokens":21600,"asi":{"hypothesis":"RegExp literals need per-instance identity for ordinary property writes like Symbol.isConcatSpreadable and numeric indices, while still reading RegExp.prototype mutations for concat spreadability.","improvement":"Reduced Array failures from 13 to 12 by fixing RegExp concat spreadability without leaking properties between identical regexp literals.","next_action_hint":"Remaining failures are realm-related plus copyWithin coercion/resizable behavior and Array.at typed-array flat case. RegExp property storage is now ref-keyed; consider broader RegExp/object descriptor support in another workload."}}
{"run":1019,"commit":"050695a","metric":6,"metrics":{"compiler_test262_cases":500,"compiler_test262_pass":494,"compiler_test262_failures":6,"compiler_test262_compiler_errors":0,"compiler_test262_compiler_crashes":0,"compiler_test262_compiler_fails":0,"compiler_test262_both_fail":6,"compiler_test262_interpreter_fail_compiler_pass":0,"compatibility_pass":494,"compatibility_cases":500,"compiler_errors":0,"compiler_crashes":0,"compiler_fails":0,"both_fail":6,"interpreter_fail_compiler_pass":0,"elapsed_ms":63169},"status":"keep","description":"Add minimal Test262 realm host support","timestamp":1778598101490,"segment":42,"confidence":4.94,"iterationTokens":37417,"asi":{"hypothesis":"Implementing a minimal Test262 $262.createRealm host hook with distinct realm constructors/prototypes and realm-aware constructor fallback should fix cross-realm Array constructor/species tests without faking test outcomes.","improvement":"Reduced Array failures from 12 to 6 by enabling cross-realm Array constructor, concat species, and length overflow realm cases; from/of custom constructor realm cases still need object-prototype preservation through Array.from/of target creation.","next_action_hint":"Inspect remaining failures. Likely left: Array.from/of realm prototype preservation plus copyWithin coercion/resizable and Array.at typed-array flat case. Avoid returning same-realm intrinsics; keep realm objects distinct."}}
{"run":1020,"commit":"a56b5f5","metric":4,"metrics":{"compiler_test262_cases":500,"compiler_test262_pass":496,"compiler_test262_failures":4,"compiler_test262_compiler_errors":0,"compiler_test262_compiler_crashes":0,"compiler_test262_compiler_fails":0,"compiler_test262_both_fail":4,"compiler_test262_interpreter_fail_compiler_pass":0,"compatibility_pass":496,"compatibility_cases":500,"compiler_errors":0,"compiler_crashes":0,"compiler_fails":0,"both_fail":4,"interpreter_fail_compiler_pass":0,"elapsed_ms":37591},"status":"keep","description":"Treat realm-created builtin functions as constructors","timestamp":1778598442181,"segment":42,"confidence":5.081632653061225,"iterationTokens":2754,"asi":{"hypothesis":"Realm-created builtin function values with a class prototype should be considered constructable by Array.from/of, even when they do not have named builtin metadata.","improvement":"Reduced Array failures from 6 to 4 by fixing Array.from/of cross-realm constructor prototype fallback.","next_action_hint":"Remaining failures are likely Array.at typed-array (flat previously) and copyWithin coercion/resizable cases. Avoid retrying unchanged typed-array at/copyWithin attempts."}}
{"run":1021,"commit":"a56b5f5","metric":4,"metrics":{"compiler_test262_cases":500,"compiler_test262_pass":496,"compiler_test262_failures":4,"compiler_test262_compiler_errors":0,"compiler_test262_compiler_crashes":0,"compiler_test262_compiler_fails":0,"compiler_test262_both_fail":4,"compiler_test262_interpreter_fail_compiler_pass":0,"compatibility_pass":496,"compatibility_cases":500,"compiler_errors":0,"compiler_crashes":0,"compiler_fails":0,"both_fail":4,"interpreter_fail_compiler_pass":0,"elapsed_ms":41850},"status":"discard","description":"Read typed-array receivers in Array.at after realm fixes","timestamp":1778598720875,"segment":42,"confidence":5.1875,"iterationTokens":2022,"asi":{"hypothesis":"With realm failures removed, Array.prototype.at typed-array receiver support should now reduce the remaining Array workload.","rollback_reason":"Focused typed-array-resizable-buffer at() passes, but the primary metric stayed flat at 4; the limited workload still reports the same number of failures, so discard under autoresearch rules.","next_action_hint":"Do not retry Array.at typed-array unchanged. Only copyWithin coercion/resizable cases remain tractable in this 500-case workload."}}
{"run":1022,"commit":"a3863c1","metric":3,"metrics":{"compiler_test262_cases":500,"compiler_test262_pass":497,"compiler_test262_failures":3,"compiler_test262_compiler_errors":0,"compiler_test262_compiler_crashes":0,"compiler_test262_compiler_fails":0,"compiler_test262_both_fail":3,"compiler_test262_interpreter_fail_compiler_pass":0,"compatibility_pass":497,"compatibility_cases":500,"compiler_errors":0,"compiler_crashes":0,"compiler_fails":0,"both_fail":3,"interpreter_fail_compiler_pass":0,"elapsed_ms":23909},"status":"keep","description":"Preserve sparse tail copyWithin after shrink","timestamp":1778599204891,"segment":42,"confidence":5.2631578947368425,"iterationTokens":14563,"asi":{"hypothesis":"When Array.prototype.copyWithin argument coercion shrinks an array and the already-computed target is beyond the new length, copied values should be stored as sparse tail properties and length should grow only to the copied tail extent, without materializing explicit undefined holes.","improvement":"Reduced Array failures from 4 to 3 by fixing copyWithin/coerced-values-start-change-target.js.","next_action_hint":"Remaining failures are Array.at typed-array (focused passes but metric flat), copyWithin start-change-start prototype behavior, and copyWithin resizable-buffer typed-array behavior."}}
{"run":1023,"commit":"e86c6bd","metric":2,"metrics":{"compiler_test262_cases":500,"compiler_test262_pass":498,"compiler_test262_failures":2,"compiler_test262_compiler_errors":0,"compiler_test262_compiler_crashes":0,"compiler_test262_compiler_fails":0,"compiler_test262_both_fail":2,"compiler_test262_interpreter_fail_compiler_pass":0,"compatibility_pass":498,"compatibility_cases":500,"compiler_errors":0,"compiler_crashes":0,"compiler_fails":0,"both_fail":2,"interpreter_fail_compiler_pass":0,"elapsed_ms":23690},"status":"keep","description":"Read sparse copyWithin sources from array prototypes","timestamp":1778599749390,"segment":42,"confidence":5.340425531914893,"iterationTokens":8971,"asi":{"hypothesis":"When copyWithin start coercion shrinks an array so source indices are beyond the new length, HasProperty/Get should still observe inherited array prototype indices and write sparse results while deleting absent targets.","improvement":"Reduced Array failures from 3 to 2 by fixing copyWithin/coerced-values-start-change-start.js, including Object.setPrototypeOf on array objects and inherited sparse source reads.","next_action_hint":"Remaining failures are Array.at typed-array (focused passes but metric flat) and copyWithin/resizable-buffer typed-array behavior; typed-array copyWithin previously stayed flat with interpreter split, so inspect native bytecode element writes before retrying."}}
{"run":1024,"commit":"e86c6bd","metric":2,"metrics":{"compiler_test262_cases":500,"compiler_test262_pass":498,"compiler_test262_failures":2,"compiler_test262_compiler_errors":0,"compiler_test262_compiler_crashes":0,"compiler_test262_compiler_fails":0,"compiler_test262_both_fail":2,"compiler_test262_interpreter_fail_compiler_pass":0,"compatibility_pass":498,"compatibility_cases":500,"compiler_errors":0,"compiler_crashes":0,"compiler_fails":0,"both_fail":2,"interpreter_fail_compiler_pass":0,"elapsed_ms":24071},"status":"discard","description":"Read typed-array receivers in Array.at at two failures","timestamp":1778600009045,"segment":42,"confidence":5.397849462365591,"iterationTokens":2618,"asi":{"hypothesis":"With copyWithin coercion failures reduced, Array.prototype.at typed-array receiver support might now reduce the remaining workload.","rollback_reason":"Focused typed-array-resizable-buffer at() passes, but the primary metric stayed flat at 2, so discard unchanged primary metric.","next_action_hint":"Array.at typed-array remains a focused pass but workload-flat case; do not retry unchanged. Investigate copyWithin/resizable-buffer typed-array semantics and benchmark failure accounting before changing workloads."}}
{"run":1025,"commit":"e86c6bd","metric":2,"metrics":{"compiler_test262_cases":500,"compiler_test262_pass":498,"compiler_test262_failures":2,"compiler_test262_compiler_errors":0,"compiler_test262_compiler_crashes":0,"compiler_test262_compiler_fails":0,"compiler_test262_both_fail":1,"compiler_test262_interpreter_fail_compiler_pass":1,"compatibility_pass":498,"compatibility_cases":500,"compiler_errors":0,"compiler_crashes":0,"compiler_fails":0,"both_fail":1,"interpreter_fail_compiler_pass":1,"elapsed_ms":34279},"status":"discard","description":"Route typed-array copyWithin through indexed properties","timestamp":1778600642839,"segment":42,"confidence":5.456521739130435,"iterationTokens":10195,"asi":{"hypothesis":"Generic copyWithin can support typed-array receivers if HasProperty sees typed indices, Get reads typed indices, and Put writes typed indices.","rollback_reason":"Primary metric stayed flat at 2 and introduced an interpreter/compiler split: compiler/source path passes copyWithin/resizable-buffer, but native bytecode interpreter still reads undefined for typed-array elements in the builtin path.","next_action_hint":"Do not retry typed-array copyWithin unchanged. Investigate native bytecode typed-array element writes/reads and why Runtime.TypedArray.get_element/Get.get return undefined inside builtins while JS ToNumbers observes values."}}
{"run":1026,"commit":"fdb9ca5","metric":1,"metrics":{"compiler_test262_cases":500,"compiler_test262_pass":499,"compiler_test262_failures":1,"compiler_test262_compiler_errors":0,"compiler_test262_compiler_crashes":0,"compiler_test262_compiler_fails":0,"compiler_test262_both_fail":1,"compiler_test262_interpreter_fail_compiler_pass":0,"compatibility_pass":499,"compatibility_cases":500,"compiler_errors":0,"compiler_crashes":0,"compiler_fails":0,"both_fail":1,"interpreter_fail_compiler_pass":0,"elapsed_ms":25202},"status":"keep","description":"Support typed-array receivers in Array.at","timestamp":1778600972717,"segment":42,"confidence":5.538461538461538,"iterationTokens":8180,"asi":{"hypothesis":"Array.prototype.at should use LengthOfArrayLike before index coercion and read typed-array elements through TypedArray.element_count/get_element, returning undefined for out-of-bounds resizable-buffer views after coercion side effects.","improvement":"Reduced Array failures from 2 to 1 by fixing typed-array resizable-buffer Array.at cases, including coerced-index resize ordering.","next_action_hint":"Only copyWithin/resizable-buffer remains in the 500-case Array workload. Previous typed-array copyWithin attempts pass compiler/source but fail native bytecode interpreter; inspect typed-array storage in native-bytecode path."}}
{"run":1027,"commit":"HEAD","metric":1,"metrics":{"compiler_test262_cases":500,"compiler_test262_pass":499,"compiler_test262_failures":1,"compiler_test262_compiler_errors":0,"compiler_test262_compiler_crashes":0,"compiler_test262_compiler_fails":0,"compiler_test262_both_fail":0,"compiler_test262_interpreter_fail_compiler_pass":1,"compatibility_pass":499,"compatibility_cases":500,"compiler_errors":0,"compiler_crashes":0,"compiler_fails":0,"both_fail":0,"interpreter_fail_compiler_pass":1,"elapsed_ms":25978},"status":"discard","description":"Route Array.copyWithin through typed-array element access and fallback malformed ArrayBuffer views","timestamp":1778603286689,"segment":42,"confidence":5.6,"iterationTokens":8180,"asi":{"hypothesis":"Direct typed-array copyWithin plus typed-array indexed string writes would resolve resizable-buffer copyWithin; malformed Float16 ArrayBuffer fallback might address interpreter-only undefined reads.","rollback_reason":"Primary metric remained at 1 failure and shifted to interpreter_fail_compiler_pass=1; Float16Array in the native interpreter still exposed stale/undefined values after earlier resizable-buffer assertions.","next_action_hint":"Investigate why interpreter-created Float16Array ArrayBuffer objects lose public byteLength/own props after prior assertions, and why resize/view updates do not run for that malformed buffer before retrying typed-array copyWithin."}}
{"run":1028,"commit":"HEAD","metric":1,"metrics":{"compiler_test262_cases":500,"compiler_test262_pass":499,"compiler_test262_failures":1,"compiler_test262_compiler_errors":0,"compiler_test262_compiler_crashes":0,"compiler_test262_compiler_fails":0,"compiler_test262_both_fail":0,"compiler_test262_interpreter_fail_compiler_pass":1,"compatibility_pass":499,"compatibility_cases":500,"compiler_errors":0,"compiler_crashes":0,"compiler_fails":0,"both_fail":0,"interpreter_fail_compiler_pass":1,"elapsed_ms":24801},"status":"discard","description":"Route generic typed-array copyWithin through typed element presence and writes","timestamp":1778604527831,"segment":42,"confidence":5.7272727272727275,"iterationTokens":12364,"asi":{"hypothesis":"Generic Array.prototype.copyWithin can pass typed-array receivers by making HasProperty and Put recognize typed-array integer keys and by repairing malformed external buffer writes.","rollback_reason":"Primary metric stayed at 1 and the remaining failure became interpreter-only; compiler path passed, but native interpreter still exposes Float16Array views with undefined elements/stale length after resize.","next_action_hint":"Do not retry only HasProperty/Put typed-array index routing. Root cause is lower in native interpreter/new ArrayBuffer/Float16 view registration or view update state, where Float16Array after prior assertions has a malformed backing ArrayBuffer."}}
{"type":"config","name":"QuickBEAM Test262 built-ins/WeakMap compatibility","metricName":"compatibility_failures","metricUnit":"","bestDirection":"lower"}
{"run":1029,"commit":"cbc0404","metric":72,"metrics":{"compiler_test262_cases":141,"compiler_test262_pass":69,"compiler_test262_failures":72,"compiler_test262_compiler_errors":0,"compiler_test262_compiler_crashes":0,"compiler_test262_compiler_fails":0,"compiler_test262_both_fail":72,"compiler_test262_interpreter_fail_compiler_pass":0,"compatibility_pass":69,"compatibility_cases":141,"compiler_errors":0,"compiler_crashes":0,"compiler_fails":0,"both_fail":72,"interpreter_fail_compiler_pass":0,"elapsed_ms":7863},"status":"keep","description":"Baseline built-ins/WeakMap compatibility after Array blocked at one failure","timestamp":1778605962438,"segment":43,"confidence":null,"iterationTokens":129,"asi":{"hypothesis":"Array 500-case workload is blocked on native interpreter typed-array/ArrayBuffer state, so establish a fresh WeakMap compatibility baseline with the same primary metric before continuing semantic compatibility work."}}
{"run":1030,"commit":"8d6892c","metric":50,"metrics":{"compiler_test262_cases":141,"compiler_test262_pass":91,"compiler_test262_failures":50,"compiler_test262_compiler_errors":0,"compiler_test262_compiler_crashes":0,"compiler_test262_compiler_fails":0,"compiler_test262_both_fail":50,"compiler_test262_interpreter_fail_compiler_pass":0,"compatibility_pass":91,"compatibility_cases":141,"compiler_errors":0,"compiler_crashes":0,"compiler_fails":0,"both_fail":50,"interpreter_fail_compiler_pass":0,"elapsed_ms":5803},"status":"keep","description":"Install WeakMap prototype and instance prototype links","timestamp":1778606298009,"segment":43,"confidence":null,"iterationTokens":16198,"asi":{"hypothesis":"WeakMap instances lacked the registered WeakMap.prototype and the constructor did not expose a concrete prototype object with methods/descriptors; installing them should fix prototype, method metadata, and instance prototype checks."}}
{"run":1031,"commit":"c7a00a4","metric":34,"metrics":{"compiler_test262_cases":141,"compiler_test262_pass":107,"compiler_test262_failures":34,"compiler_test262_compiler_errors":0,"compiler_test262_compiler_crashes":0,"compiler_test262_compiler_fails":0,"compiler_test262_both_fail":34,"compiler_test262_interpreter_fail_compiler_pass":0,"compatibility_pass":107,"compatibility_cases":141,"compiler_errors":0,"compiler_crashes":0,"compiler_fails":0,"both_fail":34,"interpreter_fail_compiler_pass":0,"elapsed_ms":6321},"status":"keep","description":"Honor collection prototype overrides and weak symbol keys","timestamp":1778606837043,"segment":43,"confidence":2.375,"iterationTokens":13921,"asi":{"hypothesis":"WeakMap constructor should call the observable instance set method from WeakMap.prototype, prototype overrides should shadow virtual collection methods, and symbols are valid weak keys; this should fix iterable construction and symbol-key method clusters."}}
