{"run":998,"commit":"29f8f34","metric":32,"metrics":{"compiler_test262_cases":500,"compiler_test262_pass":468,"compiler_test262_failures":32,"compiler_test262_compiler_errors":0,"compiler_test262_compiler_crashes":0,"compiler_test262_compiler_fails":1,"compiler_test262_both_fail":29,"compiler_test262_interpreter_fail_compiler_pass":0,"compatibility_pass":468,"compatibility_cases":500,"compiler_errors":0,"compiler_crashes":0,"compiler_fails":1,"both_fail":29,"interpreter_fail_compiler_pass":0,"elapsed_ms":19092},"status":"keep","description":"Preserve arrays on non-strict failed shrink","timestamp":1778562336558,"segment":42,"confidence":6.138888888888889,"iterationTokens":4452,"asi":{"hypothesis":"When shrinking Array.length cannot delete a non-configurable index, non-strict assignment should preserve the array up to the failing index and fail silently rather than throwing or continuing to shrink","improvement":"Reduced Array failures from 33 to 32 (−1), fixing Array.every mutation over non-configurable elements during length shrink","next_action_hint":"Continue with remaining concat spreadability/realm/proxy cases or Array.from descriptor overwrite."}}
{"run":999,"commit":"1c53079","metric":26,"metrics":{"compiler_test262_cases":500,"compiler_test262_pass":474,"compiler_test262_failures":26,"compiler_test262_compiler_errors":0,"compiler_test262_compiler_crashes":0,"compiler_test262_compiler_fails":1,"compiler_test262_both_fail":23,"compiler_test262_interpreter_fail_compiler_pass":0,"compatibility_pass":474,"compatibility_cases":500,"compiler_errors":0,"compiler_crashes":0,"compiler_fails":1,"both_fail":23,"interpreter_fail_compiler_pass":0,"elapsed_ms":19003},"status":"keep","description":"Grow array length on index define","timestamp":1778562848957,"segment":42,"confidence":6.305555555555555,"iterationTokens":33796,"asi":{"hypothesis":"Defining an array index property at or beyond the current length should update the array length even for accessor descriptors","improvement":"Reduced Array failures from 32 to 26 (−6), fixing multiple Array.every accessor/index defineProperty cases","next_action_hint":"Continue with remaining concat RegExp/string/proxy/realm, Array.from descriptor/realm, copyWithin coercion, and resizable-buffer unsupported cases."}}
{"run":1000,"commit":"d2f7524","metric":25,"metrics":{"compiler_test262_cases":500,"compiler_test262_pass":475,"compiler_test262_failures":25,"compiler_test262_compiler_errors":0,"compiler_test262_compiler_crashes":0,"compiler_test262_compiler_fails":1,"compiler_test262_both_fail":22,"compiler_test262_interpreter_fail_compiler_pass":0,"compatibility_pass":475,"compatibility_cases":500,"compiler_errors":0,"compiler_crashes":0,"compiler_fails":1,"both_fail":22,"interpreter_fail_compiler_pass":0,"elapsed_ms":23506},"status":"keep","description":"Respect builtin species descriptors","timestamp":1778577824333,"segment":42,"confidence":6.2465753424657535,"iterationTokens":33796,"asi":{"hypothesis":"Builtin static accessor descriptors such as Array[Symbol.species] should be getter-only, non-enumerable, configurable, and symbol-key deletes must preserve the symbol key rather than stringify it.","improvement":"Reduced Array failures from 26 to 25 by fixing the interpreter side of Array[Symbol.species] descriptor/propertyHelper semantics; remaining compiler-only failure is same-process descriptor mutation leakage.","next_action_hint":"Avoid non-configurable descriptor hacks. Continue with concat order/proxy/string wrapper or copyWithin coercion-order cases."}}
{"run":1001,"commit":"d2f7524","metric":32,"metrics":{"compiler_test262_cases":500,"compiler_test262_pass":468,"compiler_test262_failures":32,"compiler_test262_compiler_errors":0,"compiler_test262_compiler_crashes":0,"compiler_test262_compiler_fails":1,"compiler_test262_both_fail":29,"compiler_test262_interpreter_fail_compiler_pass":0,"compatibility_pass":468,"compatibility_cases":500,"compiler_errors":0,"compiler_crashes":0,"compiler_fails":1,"both_fail":29,"interpreter_fail_compiler_pass":0,"elapsed_ms":26054},"status":"discard","description":"Route array copyWithin through live indexed access","timestamp":1778578567481,"segment":42,"confidence":6,"iterationTokens":17292,"asi":{"hypothesis":"Array.prototype.copyWithin should use live HasProperty/Get/Set/Delete semantics after argument coercion side effects, and Object.setPrototypeOf on arrays should provide an internal prototype for inherited source reads.","rollback_reason":"Although focused copyWithin coercion-order tests passed, the broad Array workload regressed from 25 to 32, likely because routing all array copyWithin through generic prototype-aware indexed operations altered existing dense-array behavior and broader array prototype handling.","next_action_hint":"Retry copyWithin much narrower: preserve dense snapshot path except when argument coercion mutates length/prototype, or first isolate which previously passing copyWithin/Array cases regressed from the failure log."}}
{"run":1002,"commit":"349472b","metric":24,"metrics":{"compiler_test262_cases":500,"compiler_test262_pass":476,"compiler_test262_failures":24,"compiler_test262_compiler_errors":0,"compiler_test262_compiler_crashes":0,"compiler_test262_compiler_fails":1,"compiler_test262_both_fail":21,"compiler_test262_interpreter_fail_compiler_pass":0,"compatibility_pass":476,"compatibility_cases":500,"compiler_errors":0,"compiler_crashes":0,"compiler_fails":1,"both_fail":21,"interpreter_fail_compiler_pass":0,"elapsed_ms":26823},"status":"keep","description":"Create concat species target before spreadability","timestamp":1778578862930,"segment":42,"confidence":5.654320987654321,"iterationTokens":5146,"asi":{"hypothesis":"Array.prototype.concat must run ArraySpeciesCreate and observe the receiver constructor before looking up Symbol.isConcatSpreadable on the receiver or arguments.","improvement":"Reduced Array failures from 25 to 24 by fixing concat observable getter order for constructor vs Symbol.isConcatSpreadable.","next_action_hint":"Remaining safe targets include Array.from CreateDataProperty overwrite semantics, concat string wrapper/RegExp object storage, and inherited Object.prototype index copying without prototype leakage."}}
{"run":1003,"commit":"349472b","metric":24,"metrics":{"compiler_test262_cases":500,"compiler_test262_pass":476,"compiler_test262_failures":24,"compiler_test262_compiler_errors":0,"compiler_test262_compiler_crashes":0,"compiler_test262_compiler_fails":1,"compiler_test262_both_fail":21,"compiler_test262_interpreter_fail_compiler_pass":0,"compatibility_pass":476,"compatibility_cases":500,"compiler_errors":0,"compiler_crashes":0,"compiler_fails":1,"both_fail":21,"interpreter_fail_compiler_pass":0,"elapsed_ms":24889},"status":"discard","description":"Centralize Object prototype helpers","timestamp":1778586076889,"segment":42,"confidence":5.585365853658536,"iterationTokens":24642,"asi":{"hypothesis":"Centralizing prototype get/set/chain helpers should preserve semantics while providing a safer base for subsequent prototype-chain fixes.","rollback_reason":"The structural refactor preserved the Array metric at 24 but did not improve the primary optimization metric, so autoresearch rules require discarding unchanged runs.","next_action_hint":"If pursuing maintainability outside autoresearch, reapply the Prototype module refactor separately. For metric improvement, focus on Array.from CreateDataProperty overwrite, concat inherited Object.prototype index copying, or string wrapper spreadability."}}
{"run":1004,"commit":"349472b","metric":24,"metrics":{"compiler_test262_cases":500,"compiler_test262_pass":476,"compiler_test262_failures":24,"compiler_test262_compiler_errors":0,"compiler_test262_compiler_crashes":0,"compiler_test262_compiler_fails":1,"compiler_test262_both_fail":21,"compiler_test262_interpreter_fail_compiler_pass":0,"compatibility_pass":476,"compatibility_cases":500,"compiler_errors":0,"compiler_crashes":0,"compiler_fails":1,"both_fail":21,"interpreter_fail_compiler_pass":0,"elapsed_ms":24427},"status":"discard","description":"Treat iterator-like Array.from sources as iterators","timestamp":1778586348544,"segment":42,"confidence":5.518072289156627,"iterationTokens":3845,"asi":{"hypothesis":"Array.from should consume VM generator objects via their next method when Symbol.iterator is missing, approximating generator iterator self-iterability narrowly inside Array.from.","rollback_reason":"Focused iter-set-elem-prop-non-writable passed, but the broad Array workload stayed unchanged at 24 failures, implying the focused fix displaced another case or did not improve the primary metric.","next_action_hint":"Compare failure logs before/after if retrying; a broader generator iterator self-iterable fix was previously flat and increased compiler-only failures, so avoid unchanged retries."}}
{"run":1005,"commit":"0d413c2","metric":23,"metrics":{"compiler_test262_cases":500,"compiler_test262_pass":477,"compiler_test262_failures":23,"compiler_test262_compiler_errors":0,"compiler_test262_compiler_crashes":0,"compiler_test262_compiler_fails":1,"compiler_test262_both_fail":20,"compiler_test262_interpreter_fail_compiler_pass":0,"compatibility_pass":477,"compatibility_cases":500,"compiler_errors":0,"compiler_crashes":0,"compiler_fails":1,"both_fail":20,"interpreter_fail_compiler_pass":0,"elapsed_ms":25640},"status":"keep","description":"Consume iterator-like sources in Array.from","timestamp":1778586638675,"segment":42,"confidence":5.476190476190476,"iterationTokens":3510,"asi":{"hypothesis":"VM generator objects currently lack inherited Symbol.iterator, but Array.from can narrowly recognize object sources with callable next and no length as iterator-like while keeping strings on the existing codepoint path.","improvement":"Reduced Array failures from 24 to 23 by fixing Array.from over generator/iterator-like sources with custom constructors and CreateDataProperty overwrite semantics without regressing from-string.","next_action_hint":"Remaining failures are mostly realm/resizable/typed-array plus concat RegExp/string-wrapper/proxy/Object.prototype index and copyWithin coercion-order cases."}}
{"run":1006,"commit":"6a4966a","metric":22,"metrics":{"compiler_test262_cases":500,"compiler_test262_pass":478,"compiler_test262_failures":22,"compiler_test262_compiler_errors":0,"compiler_test262_compiler_crashes":0,"compiler_test262_compiler_fails":1,"compiler_test262_both_fail":19,"compiler_test262_interpreter_fail_compiler_pass":0,"compatibility_pass":478,"compatibility_cases":500,"compiler_errors":0,"compiler_crashes":0,"compiler_fails":1,"both_fail":19,"interpreter_fail_compiler_pass":0,"elapsed_ms":26879},"status":"keep","description":"Read wrapped string UTF-16 indices","timestamp":1778587017572,"segment":42,"confidence":5.5,"iterationTokens":8590,"asi":{"hypothesis":"String wrapper indexed property reads should return JavaScript UTF-16 code units, including surrogate halves, not Unicode grapheme clusters.","improvement":"Reduced Array failures from 23 to 22 by fixing concat spread of String wrapper objects containing astral symbols.","next_action_hint":"This may also help String built-ins later; remaining concat targets include RegExp arbitrary property storage, proxy species prototype, Object.prototype inherited index leakage, and typed-array unsupported cases."}}
{"run":1007,"commit":"99ed0a2","metric":20,"metrics":{"compiler_test262_cases":500,"compiler_test262_pass":480,"compiler_test262_failures":20,"compiler_test262_compiler_errors":0,"compiler_test262_compiler_crashes":0,"compiler_test262_compiler_fails":1,"compiler_test262_both_fail":17,"compiler_test262_interpreter_fail_compiler_pass":0,"compatibility_pass":480,"compatibility_cases":500,"compiler_errors":0,"compiler_crashes":0,"compiler_fails":1,"both_fail":17,"interpreter_fail_compiler_pass":0,"elapsed_ms":26513},"status":"keep","description":"Share UTF-16 string indexing and refine concat species","timestamp":1778588537728,"segment":42,"confidence":5.5476190476190474,"iterationTokens":8590,"asi":{"hypothesis":"Centralizing UTF-16 string indexing lets Object.entries/Object.assign/descriptors share JS string-index semantics, while concat should read Symbol.species from callable constructors and array holes should see Object.prototype indices through Array.prototype during concat.","improvement":"Reduced Array failures from 22 to 20. Fixed concat proxy species constructor results and interpreter inherited Object.prototype index copying; preserved shared UTF-16 string indexing cleanup.","next_action_hint":"Remaining failures are mostly realm/resizable/typed-array, RegExp spreadability needing RegExp identity/object storage, copyWithin coercion-order, and one compiler-only same-process prototype leakage case."}}
{"run":1008,"commit":"7c4c17b","metric":18,"metrics":{"compiler_test262_cases":500,"compiler_test262_pass":482,"compiler_test262_failures":18,"compiler_test262_compiler_errors":0,"compiler_test262_compiler_crashes":0,"compiler_test262_compiler_fails":1,"compiler_test262_both_fail":17,"compiler_test262_interpreter_fail_compiler_pass":0,"compatibility_pass":482,"compatibility_cases":500,"compiler_errors":0,"compiler_crashes":0,"compiler_fails":1,"both_fail":17,"interpreter_fail_compiler_pass":0,"elapsed_ms":25809},"status":"keep","description":"Handle typed-array symbol properties","timestamp":1778591441058,"segment":42,"confidence":5.280898876404494,"iterationTokens":81850,"asi":{"hypothesis":"TypedArray property lookup and descriptors should classify array indices through PropertyKey.array_index rather than parsing every key as a string, so symbol lookups like Symbol.isConcatSpreadable miss instead of crashing.","improvement":"Reduced Array failures from 20 to 18 by fixing typed-array concat symbol-property crashes for large and small typed arrays.","next_action_hint":"Continue with Array length coercion-order or copyWithin coercion-order; realm/resizable-buffer cases remain architectural and RegExp spreadability needs RegExp instance identity."}}
{"run":1009,"commit":"d6b3c7f","metric":17,"metrics":{"compiler_test262_cases":500,"compiler_test262_pass":483,"compiler_test262_failures":17,"compiler_test262_compiler_errors":0,"compiler_test262_compiler_crashes":0,"compiler_test262_compiler_fails":1,"compiler_test262_both_fail":16,"compiler_test262_interpreter_fail_compiler_pass":0,"compatibility_pass":483,"compatibility_cases":500,"compiler_errors":0,"compiler_crashes":0,"compiler_fails":1,"both_fail":16,"interpreter_fail_compiler_pass":0,"elapsed_ms":21978},"status":"keep","description":"Use number hint for Array length coercion","timestamp":1778591989979,"segment":42,"confidence":5.0212765957446805,"iterationTokens":11503,"asi":{"hypothesis":"Array length assignment should perform ArraySetLength numeric coercions with Symbol.toPrimitive hint 'number' before checking the current length descriptor writability, and Reflect.set should return false for failed non-writable length writes.","improvement":"Reduced Array failures from 18 to 17 by fixing Array.length coercion order and Reflect.set result semantics for non-writable lengths.","next_action_hint":"Remaining safe targets are copyWithin coercion-order or perhaps typed-array/resizable support; skip realm failures and RegExp spreadability until architecture supports realms/RegExp identity."}}
{"run":1010,"commit":"d6b3c7f","metric":24,"metrics":{"compiler_test262_cases":500,"compiler_test262_pass":476,"compiler_test262_failures":24,"compiler_test262_compiler_errors":0,"compiler_test262_compiler_crashes":0,"compiler_test262_compiler_fails":1,"compiler_test262_both_fail":23,"compiler_test262_interpreter_fail_compiler_pass":0,"compatibility_pass":476,"compatibility_cases":500,"compiler_errors":0,"compiler_crashes":0,"compiler_fails":1,"both_fail":23,"interpreter_fail_compiler_pass":0,"elapsed_ms":28612},"status":"discard","description":"Use live copyWithin after length coercion side effects","timestamp":1778592906947,"segment":42,"confidence":4.968421052631579,"iterationTokens":11503,"asi":{"hypothesis":"Switch array copyWithin to live HasProperty/Get/Delete when argument coercion changes length, so side effects during start coercion are observed.","rollback_reason":"Regressed Array workload from 17 to 24 despite fixing the target-change focused case; start-change with prototype still failed and broader array/prototype semantics regressed.","next_action_hint":"Do not retry broad live copyWithin or per-array prototype storage unchanged. If revisiting copyWithin, isolate only the target-change-target case or first fix array own-property deletion/hole/prototype semantics."}}
{"run":1011,"commit":"d6b3c7f","metric":17,"metrics":{"compiler_test262_cases":500,"compiler_test262_pass":483,"compiler_test262_failures":17,"compiler_test262_compiler_errors":0,"compiler_test262_compiler_crashes":0,"compiler_test262_compiler_fails":1,"compiler_test262_both_fail":16,"compiler_test262_interpreter_fail_compiler_pass":0,"compatibility_pass":483,"compatibility_cases":500,"compiler_errors":0,"compiler_crashes":0,"compiler_fails":1,"both_fail":16,"interpreter_fail_compiler_pass":0,"elapsed_ms":28087},"status":"discard","description":"Handle typed arrays in Array.at","timestamp":1778593231751,"segment":42,"confidence":5.0212765957446805,"iterationTokens":6293,"asi":{"hypothesis":"Array.prototype.at should use TypedArray element_count/get_element for typed-array receivers instead of Heap.obj_to_list, fixing typed-array backed by resizable-buffer cases.","rollback_reason":"Focused at/typed-array-resizable-buffer.js passed, but primary Array workload stayed flat at 17 failures, so autoresearch rules discard unchanged primary metric.","next_action_hint":"The focused case likely is outside the first 500 limited ordering or offset by another failure; revisit if switching workloads or if typed-array cases become primary."}}
{"run":1012,"commit":"535c3c3","metric":16,"metrics":{"compiler_test262_cases":500,"compiler_test262_pass":484,"compiler_test262_failures":16,"compiler_test262_compiler_errors":0,"compiler_test262_compiler_crashes":0,"compiler_test262_compiler_fails":1,"compiler_test262_both_fail":15,"compiler_test262_interpreter_fail_compiler_pass":0,"compatibility_pass":484,"compatibility_cases":500,"compiler_errors":0,"compiler_crashes":0,"compiler_fails":1,"both_fail":15,"interpreter_fail_compiler_pass":0,"elapsed_ms":25013},"status":"keep","description":"Iterate typed-array receivers in Array iterators","timestamp":1778593508857,"segment":42,"confidence":5.042553191489362,"iterationTokens":4619,"asi":{"hypothesis":"Array.prototype values/keys/entries should build live iterator lists from TypedArray.element_count/get_element when called on typed-array receivers, rather than treating them as empty ordinary objects.","improvement":"Reduced Array failures from 17 to 16; focused resizable typed-array entries grow-mid-iteration case now passes.","next_action_hint":"Array.prototype.at typed-array support also passes focused tests but was flat alone; consider batching with broader typed-array array-method receiver support if another typed-array failure remains in the limited workload."}}
{"run":1013,"commit":"535c3c3","metric":16,"metrics":{"compiler_test262_cases":500,"compiler_test262_pass":484,"compiler_test262_failures":16,"compiler_test262_compiler_errors":0,"compiler_test262_compiler_crashes":0,"compiler_test262_compiler_fails":1,"compiler_test262_both_fail":15,"compiler_test262_interpreter_fail_compiler_pass":0,"compatibility_pass":484,"compatibility_cases":500,"compiler_errors":0,"compiler_crashes":0,"compiler_fails":1,"both_fail":15,"interpreter_fail_compiler_pass":0,"elapsed_ms":22532},"status":"discard","description":"Read typed-array receivers in Array.at","timestamp":1778593717213,"segment":42,"confidence":5.042553191489362,"iterationTokens":1685,"asi":{"hypothesis":"With typed-array iterator support kept, adding Array.prototype.at typed-array receiver support might now reduce the remaining limited Array failures.","rollback_reason":"Primary metric stayed flat at 16 even though the focused at/typed-array-resizable-buffer.js case passes, so discard under autoresearch rules.","next_action_hint":"Do not retry Array.at typed-array support on this 500-case Array workload unless batching with another primary-improving typed-array change or changing workload."}}
{"run":1014,"commit":"5f36188","metric":14,"metrics":{"compiler_test262_cases":500,"compiler_test262_pass":486,"compiler_test262_failures":14,"compiler_test262_compiler_errors":0,"compiler_test262_compiler_crashes":0,"compiler_test262_compiler_fails":1,"compiler_test262_both_fail":13,"compiler_test262_interpreter_fail_compiler_pass":0,"compatibility_pass":486,"compatibility_cases":500,"compiler_errors":0,"compiler_crashes":0,"compiler_fails":1,"both_fail":13,"interpreter_fail_compiler_pass":0,"elapsed_ms":29087},"status":"keep","description":"Throw on out-of-bounds typed-array iteration","timestamp":1778594114652,"segment":42,"confidence":5.085106382978723,"iterationTokens":12400,"asi":{"hypothesis":"Array.prototype iterator objects over TypedArray receivers should detect resizable-buffer out-of-bounds views at iteration time and throw TypeError, while length-tracking in-bounds views keep producing current elements.","improvement":"Reduced Array failures from 16 to 14 by making resizable typed-array entries tests pass, including shrink-mid-iteration behavior.","next_action_hint":"Remaining Array failures are now mostly realm cases, RegExp concat spreadability identity, copyWithin coercion/resizable behavior, Array.at typed-array flat on current workload, and one compiler-only every/prototype leakage case."}}
