{"run":948,"commit":"c241252","metric":222,"metrics":{"compiler_test262_cases":500,"compiler_test262_pass":278,"compiler_test262_failures":222,"compiler_test262_compiler_errors":0,"compiler_test262_compiler_crashes":0,"compiler_test262_compiler_fails":0,"compiler_test262_both_fail":212,"compiler_test262_interpreter_fail_compiler_pass":0,"compatibility_pass":278,"compatibility_cases":500,"compiler_errors":0,"compiler_crashes":0,"compiler_fails":0,"both_fail":212,"interpreter_fail_compiler_pass":0,"elapsed_ms":45256},"status":"keep","description":"Add Array.fromAsync builtin metadata","timestamp":1778530351793,"segment":42,"confidence":4.769230769230769,"iterationTokens":22497,"asi":{"hypothesis":"Array.fromAsync should exist as an extensible non-constructor builtin function with length/name metadata and at least resolved synchronous behavior for simple inputs","improvement":"Reduced Array failures from 227 to 222 (−5) by adding Array.fromAsync static property and named metadata, returning a resolved promise around Array.from-style conversion","caveat":"Length/name/property descriptor cases still compiler-fail after propertyHelper mutates descriptors in the interpreter pass within the same BEAM process; do not mask this by making configurable descriptors immutable.","next_action_hint":"Remaining Array: Array.from mutation/delete shape tombstones, Array.of precise constructor/Put semantics, length define semantics, concat species/string wrapper behavior, proxy revoked handling."}}
{"run":949,"commit":"f80588c","metric":217,"metrics":{"compiler_test262_cases":500,"compiler_test262_pass":283,"compiler_test262_failures":217,"compiler_test262_compiler_errors":0,"compiler_test262_compiler_crashes":0,"compiler_test262_compiler_fails":0,"compiler_test262_both_fail":210,"compiler_test262_interpreter_fail_compiler_pass":0,"compatibility_pass":283,"compatibility_cases":500,"compiler_errors":0,"compiler_crashes":0,"compiler_fails":0,"both_fail":210,"interpreter_fail_compiler_pass":0,"elapsed_ms":44965},"status":"keep","description":"Fix Array iterator lengths and copyWithin indexes","timestamp":1778530669140,"segment":42,"confidence":6,"iterationTokens":8831,"asi":{"hypothesis":"Array iterator methods need explicit zero length metadata and copyWithin should use ToIntegerOrInfinity-style bounds, treating explicit null end as 0 and infinities as clamped endpoints","improvement":"Reduced Array failures from 222 to 217 (−5) by adding length metadata for Array keys/values/entries and fixing copyWithin end/Infinity normalization plus negative slice length handling","caveat":"Iterator length descriptor cases still compiler-fail after destructive propertyHelper mutation in the same BEAM process, but direct value/descriptor behavior is correct before mutation.","next_action_hint":"Remaining Array: copyWithin ToObject/proxy/abrupt delete semantics, Array.from shape delete/update tombstones and constructor/species, Array.of precise constructor/Put semantics, concat species/string wrapper, array length define semantics."}}
{"run":950,"commit":"f80588c","metric":218,"metrics":{"compiler_test262_cases":500,"compiler_test262_pass":282,"compiler_test262_failures":218,"compiler_test262_compiler_errors":0,"compiler_test262_compiler_crashes":0,"compiler_test262_compiler_fails":0,"compiler_test262_both_fail":211,"compiler_test262_interpreter_fail_compiler_pass":0,"compatibility_pass":282,"compatibility_cases":500,"compiler_errors":0,"compiler_crashes":0,"compiler_fails":0,"both_fail":211,"interpreter_fail_compiler_pass":0,"elapsed_ms":44923},"status":"discard","description":"Wrap primitive copyWithin receivers","timestamp":1778530939237,"segment":42,"confidence":4.5,"iterationTokens":4365,"asi":{"hypothesis":"Array.prototype.copyWithin should ToObject primitive receivers and preserve zero-length wrapper objects rather than returning undefined","rollback_reason":"Focused boolean receiver passed but broad Array regressed from 217 to 218, likely because wrapping non-array primitive receivers changed unrelated copyWithin abrupt/length cases","next_action_hint":"Retry copyWithin ToObject only with exact LengthOfArrayLike and abrupt property access semantics; do not broadly wrap primitives with the generic Object constructor shortcut."}}
{"run":951,"commit":"caab9c5","metric":216,"metrics":{"compiler_test262_cases":500,"compiler_test262_pass":284,"compiler_test262_failures":216,"compiler_test262_compiler_errors":0,"compiler_test262_compiler_crashes":0,"compiler_test262_compiler_fails":0,"compiler_test262_both_fail":209,"compiler_test262_interpreter_fail_compiler_pass":0,"compatibility_pass":284,"compatibility_cases":500,"compiler_errors":0,"compiler_crashes":0,"compiler_fails":0,"both_fail":209,"interpreter_fail_compiler_pass":0,"elapsed_ms":45091},"status":"keep","description":"Fallback builtin descriptors after missing module statics","timestamp":1778531160345,"segment":42,"confidence":4.111111111111111,"iterationTokens":2748,"asi":{"hypothesis":"When a module-backed builtin lacks a requested static property, descriptor synthesis should fall back to standard builtin name/length/prototype metadata instead of treating :undefined as an actual descriptor value","improvement":"Reduced Array failures from 217 to 216 (−1) by making builtin descriptor lookup ignore missing module static properties and synthesize Array.name correctly before destructive descriptor mutation","next_action_hint":"Remaining Array: same-process descriptor deletion leakage, Array.from delete/update shaped-object tombstones, Array.of constructor/Put semantics, copyWithin ToObject/proxy semantics, concat species/string wrapper behavior, length define semantics."}}
{"run":952,"commit":"64f2c97","metric":213,"metrics":{"compiler_test262_cases":500,"compiler_test262_pass":287,"compiler_test262_failures":213,"compiler_test262_compiler_errors":0,"compiler_test262_compiler_crashes":0,"compiler_test262_compiler_fails":0,"compiler_test262_both_fail":207,"compiler_test262_interpreter_fail_compiler_pass":0,"compatibility_pass":287,"compatibility_cases":500,"compiler_errors":0,"compiler_crashes":0,"compiler_fails":0,"both_fail":207,"interpreter_fail_compiler_pass":0,"elapsed_ms":31203},"status":"keep","description":"Apply Array.from mapfn during iteration","timestamp":1778531527552,"segment":42,"confidence":4,"iterationTokens":9421,"asi":{"hypothesis":"Array.from must invoke mapfn as iterator values are produced rather than snapshotting an iterable before mapping, and array iterators should observe live array length/value changes","improvement":"Reduced Array failures from 216 to 213 (−3) by making Array.from consume iterable values with mapfn inline and by making Array iterators read current array storage on each next()","next_action_hint":"Remaining Array.from failures involve constructor/species, iterator closing on abrupt mapfn/element writes, and array-like source length/Put semantics; continue avoiding broad descriptor-leak hacks."}}
{"run":953,"commit":"0908ab9","metric":211,"metrics":{"compiler_test262_cases":500,"compiler_test262_pass":289,"compiler_test262_failures":211,"compiler_test262_compiler_errors":0,"compiler_test262_compiler_crashes":0,"compiler_test262_compiler_fails":0,"compiler_test262_both_fail":205,"compiler_test262_interpreter_fail_compiler_pass":0,"compatibility_pass":289,"compatibility_cases":500,"compiler_errors":0,"compiler_crashes":0,"compiler_fails":0,"both_fail":205,"interpreter_fail_compiler_pass":0,"elapsed_ms":31020},"status":"keep","description":"Preserve exhausted array iterators","timestamp":1778531804048,"segment":42,"confidence":3.8181818181818183,"iterationTokens":20613,"asi":{"hypothesis":"Array iterators should remain done after exhaustion even if the underlying array later grows, and copyWithin should treat explicit undefined end as len rather than 0","improvement":"Reduced Array failures from 213 to 211 (−2) by adding an exhausted flag to array iterators and correcting copyWithin(undefined end) handling","next_action_hint":"Remaining Array: Array.from constructor/species and iterator-close abrupt paths, copyWithin ToObject/proxy/abrupt delete, concat species/string wrapper, array length define semantics."}}
{"run":954,"commit":"0908ab9","metric":0,"metrics":{"compiler_test262_cases":0,"compiler_test262_pass":0,"compiler_test262_failures":0,"compiler_test262_compiler_errors":0,"compiler_test262_compiler_crashes":0,"compiler_test262_compiler_fails":0,"compiler_test262_both_fail":0,"compiler_test262_interpreter_fail_compiler_pass":0,"compatibility_pass":0,"compatibility_cases":0,"compiler_errors":0,"compiler_crashes":0,"compiler_fails":0,"both_fail":0,"interpreter_fail_compiler_pass":0,"elapsed_ms":47200},"status":"crash","description":"Generic Array.every object semantics","timestamp":1778532010590,"segment":42,"confidence":3.8181818181818183,"iterationTokens":6041,"asi":{"hypothesis":"Array.prototype.every should validate callback/nullish receivers and iterate generic array-like objects with [[Get]]","rollback_reason":"Broad Array run was killed with exit 137 before metrics, despite some focused every cases passing. Likely generic Get over broad receiver types or runtime resource growth caused instability.","next_action_hint":"Retry every in narrower pieces: first callback/nullish TypeError only, then object array-like support for ordinary objects; avoid broad builtin-object Math/JSON semantics until builtin property writes are fixed."}}
{"run":955,"commit":"ef20361","metric":205,"metrics":{"compiler_test262_cases":500,"compiler_test262_pass":295,"compiler_test262_failures":205,"compiler_test262_compiler_errors":0,"compiler_test262_compiler_crashes":0,"compiler_test262_compiler_fails":0,"compiler_test262_both_fail":199,"compiler_test262_interpreter_fail_compiler_pass":0,"compatibility_pass":295,"compatibility_cases":500,"compiler_errors":0,"compiler_crashes":0,"compiler_fails":0,"both_fail":199,"interpreter_fail_compiler_pass":0,"elapsed_ms":31184},"status":"keep","description":"Validate Array.every nullish and callback","timestamp":1778532203991,"segment":42,"confidence":4.571428571428571,"iterationTokens":2213,"asi":{"hypothesis":"Array.prototype.every should throw TypeError for nullish receivers and non-callable/missing callbacks without enabling broad generic object iteration","improvement":"Reduced Array failures from 211 to 205 (−6) by keeping the narrow every validation subset after the broad generic object semantics attempt was killed","next_action_hint":"Remaining every Math/JSON/generic builtin-object cases need builtin object property write/read support before generic array-like iteration is safe; continue with non-every clusters such as Array.from constructor/iterator close, concat species, length define semantics."}}
{"run":956,"commit":"dbfeaad","metric":203,"metrics":{"compiler_test262_cases":500,"compiler_test262_pass":297,"compiler_test262_failures":203,"compiler_test262_compiler_errors":0,"compiler_test262_compiler_crashes":0,"compiler_test262_compiler_fails":0,"compiler_test262_both_fail":197,"compiler_test262_interpreter_fail_compiler_pass":0,"compatibility_pass":297,"compatibility_cases":500,"compiler_errors":0,"compiler_crashes":0,"compiler_fails":0,"both_fail":197,"interpreter_fail_compiler_pass":0,"elapsed_ms":30998},"status":"keep","description":"Wrap primitive concat receivers","timestamp":1778532400345,"segment":42,"confidence":4.545454545454546,"iterationTokens":4284,"asi":{"hypothesis":"Array.prototype.concat should ToObject its receiver before processing concat items, so primitive receivers such as booleans/numbers appear as wrapper objects in the result","improvement":"Reduced Array failures from 205 to 203 (−2) by wrapping only the concat receiver (not all primitive inputs) and preserving nullish TypeError behavior","next_action_hint":"Remaining concat failures include function/regExp spreadability defaults, string wrapper code units, species/custom constructor, and proxy revoked handling."}}
{"run":957,"commit":"c09b14d","metric":135,"metrics":{"compiler_test262_cases":500,"compiler_test262_pass":365,"compiler_test262_failures":135,"compiler_test262_compiler_errors":0,"compiler_test262_compiler_crashes":0,"compiler_test262_compiler_fails":0,"compiler_test262_both_fail":129,"compiler_test262_interpreter_fail_compiler_pass":0,"compatibility_pass":365,"compatibility_cases":500,"compiler_errors":0,"compiler_crashes":0,"compiler_fails":0,"both_fail":129,"interpreter_fail_compiler_pass":0,"elapsed_ms":30439},"status":"keep","description":"Support Array.every array-like receivers","timestamp":1778532660555,"segment":42,"confidence":9.833333333333334,"iterationTokens":5997,"asi":{"hypothesis":"Array.prototype.every should support ordinary object, array object, and primitive-wrapper array-like receivers while keeping the earlier narrow validation semantics","improvement":"Reduced Array failures from 203 to 135 (−68) by adding array-like length/index traversal for object and primitive receivers with callback validation","lessons":"The previous broad every attempt crashed because it also tried to support builtin singleton receivers like Math/JSON; the kept version avoids builtin tuples and is stable.","next_action_hint":"Similar generic array-like receiver handling may benefit some/filter/find/etc., but apply incrementally; remaining clusters include Array.from constructor/iterator-close, length define semantics, concat species/proxy/string wrapper, copyWithin ToObject/proxy."}}
{"run":958,"commit":"7f87134","metric":131,"metrics":{"compiler_test262_cases":500,"compiler_test262_pass":369,"compiler_test262_failures":131,"compiler_test262_compiler_errors":0,"compiler_test262_compiler_crashes":0,"compiler_test262_compiler_fails":0,"compiler_test262_both_fail":125,"compiler_test262_interpreter_fail_compiler_pass":0,"compatibility_pass":369,"compatibility_cases":500,"compiler_errors":0,"compiler_crashes":0,"compiler_fails":0,"both_fail":125,"interpreter_fail_compiler_pass":0,"elapsed_ms":30369},"status":"keep","description":"Mark revoked proxies for Array.isArray","timestamp":1778532903408,"segment":42,"confidence":11.090909090909092,"iterationTokens":5890,"asi":{"hypothesis":"Proxy.revocable should mark its proxy as revoked, and Array.isArray should throw TypeError when asked to inspect a revoked proxy","improvement":"Reduced Array failures from 135 to 131 (−4) by adding a revocation marker to Proxy.revocable and checking it during Array.isArray proxy recursion","next_action_hint":"The same revoked-proxy marker may help concat IsConcatSpreadable proxy-revoked cases if Get/proxy operations learn to throw on the marker; remaining Array clusters include concat species/proxy/string wrapper, Array.from constructor/iterator close, Array.of, and length define semantics."}}
{"run":959,"commit":"25f6efb","metric":129,"metrics":{"compiler_test262_cases":500,"compiler_test262_pass":371,"compiler_test262_failures":129,"compiler_test262_compiler_errors":0,"compiler_test262_compiler_crashes":0,"compiler_test262_compiler_fails":0,"compiler_test262_both_fail":123,"compiler_test262_interpreter_fail_compiler_pass":0,"compatibility_pass":371,"compatibility_cases":500,"compiler_errors":0,"compiler_crashes":0,"compiler_fails":0,"both_fail":123,"interpreter_fail_compiler_pass":0,"elapsed_ms":30436},"status":"keep","description":"Construct Array.from results with this","timestamp":1778533198939,"segment":42,"confidence":9.185185185185185,"iterationTokens":7100,"asi":{"hypothesis":"Array.from should use the this value as a constructor when constructable, passing length for array-like inputs and no length for iterable inputs","improvement":"Reduced Array failures from 131 to 129 (−2) by constructing Array.from results with custom constructors for array-like and iterable sources while preserving Array fast path","limitations":"Iterator constructor abrupt cases still report TypeError instead of original Test262Error, so iterator closing/constructor error propagation remains incomplete.","next_action_hint":"Remaining Array.from failures are mostly iterator-close/abrupt Put paths and realm/prototype cases; continue with concat species/proxy/string wrapper or length semantics."}}
{"run":960,"commit":"ac31940","metric":125,"metrics":{"compiler_test262_cases":500,"compiler_test262_pass":375,"compiler_test262_failures":125,"compiler_test262_compiler_errors":0,"compiler_test262_compiler_crashes":0,"compiler_test262_compiler_fails":0,"compiler_test262_both_fail":119,"compiler_test262_interpreter_fail_compiler_pass":0,"compatibility_pass":375,"compatibility_cases":500,"compiler_errors":0,"compiler_crashes":0,"compiler_fails":0,"both_fail":119,"interpreter_fail_compiler_pass":0,"elapsed_ms":30435},"status":"keep","description":"Virtualize large Array constructor lengths","timestamp":1778533443979,"segment":42,"confidence":9.142857142857142,"iterationTokens":5065,"asi":{"hypothesis":"Array constructor with a single numeric length should accept uint32 lengths including 2^32-1 without materializing enormous backing storage, while rejecting invalid lengths","improvement":"Reduced Array failures from 129 to 125 (−4) by virtualizing large valid Array lengths and handling integer-like numeric length arguments","next_action_hint":"Length assignment/defineProperty still needs RangeError and truncation semantics; remaining Array clusters include concat species/proxy/string wrapper, Array.from iterator close/Put abrupt paths, and Array.of constructors."}}
{"run":961,"commit":"c9f20d9","metric":100,"metrics":{"compiler_test262_cases":500,"compiler_test262_pass":400,"compiler_test262_failures":100,"compiler_test262_compiler_errors":0,"compiler_test262_compiler_crashes":0,"compiler_test262_compiler_fails":0,"compiler_test262_both_fail":94,"compiler_test262_interpreter_fail_compiler_pass":0,"compatibility_pass":400,"compatibility_cases":500,"compiler_errors":0,"compiler_crashes":0,"compiler_fails":0,"both_fail":94,"interpreter_fail_compiler_pass":0,"elapsed_ms":30311},"status":"keep","description":"Broaden Array.every callable and thisArg semantics","timestamp":1778533866712,"segment":42,"confidence":10.551724137931034,"iterationTokens":5065,"asi":{"hypothesis":"Array.prototype.every should treat callable receivers as array-like objects and should pass the optional thisArg as the callback receiver for both dense arrays and array-like objects","improvement":"Reduced Array failures from 125 to 100 (−25) by supporting function receivers and callback thisArg for Array.every, plus preserving arguments out-of-range writes as side properties instead of extending list storage","limitations":"Some arguments-object and builtin singleton receiver cases still fail because arguments length still observes side index writes in some paths and Math/JSON builtin object writes are incomplete.","next_action_hint":"Remaining every cluster may need proper arguments-object length storage and builtin singleton object property writes; continue with concat species/proxy/string wrapper or array length assignment RangeError semantics."}}
{"run":962,"commit":"8db8753","metric":95,"metrics":{"compiler_test262_cases":500,"compiler_test262_pass":405,"compiler_test262_failures":95,"compiler_test262_compiler_errors":0,"compiler_test262_compiler_crashes":0,"compiler_test262_compiler_fails":0,"compiler_test262_both_fail":89,"compiler_test262_interpreter_fail_compiler_pass":0,"compatibility_pass":405,"compatibility_cases":500,"compiler_errors":0,"compiler_crashes":0,"compiler_fails":0,"both_fail":89,"interpreter_fail_compiler_pass":0,"elapsed_ms":30230},"status":"keep","description":"Validate Array length assignments","timestamp":1778534074546,"segment":42,"confidence":10.533333333333333,"iterationTokens":6985,"asi":{"hypothesis":"Writing Array length should use ArrayLength semantics, accepting only integral uint32 values and throwing RangeError for invalid lengths instead of blindly truncating with ToInt","improvement":"Reduced Array failures from 100 to 95 (−5) by validating list/qb_arr length assignments before resizing or virtualizing length","limitations":"Object.defineProperty length-error cases still throw TypeError in descriptor code; coercion-order cases remain.","next_action_hint":"Extend the same array length validation into ArrayExotic define_length_property while preserving descriptor attribute validation order."}}
{"run":963,"commit":"061236f","metric":92,"metrics":{"compiler_test262_cases":500,"compiler_test262_pass":408,"compiler_test262_failures":92,"compiler_test262_compiler_errors":0,"compiler_test262_compiler_crashes":0,"compiler_test262_compiler_fails":0,"compiler_test262_both_fail":86,"compiler_test262_interpreter_fail_compiler_pass":0,"compatibility_pass":408,"compatibility_cases":500,"compiler_errors":0,"compiler_crashes":0,"compiler_fails":0,"both_fail":86,"interpreter_fail_compiler_pass":0,"elapsed_ms":30350},"status":"keep","description":"Validate Array defineProperty length value first","timestamp":1778534259469,"segment":42,"confidence":8.944444444444445,"iterationTokens":3033,"asi":{"hypothesis":"ArraySetLength should coerce and validate the new length before rejecting invalid descriptor attributes, so invalid numeric length throws RangeError even when configurable/enumerable is also present","improvement":"Reduced Array failures from 95 to 92 (−3) by moving ArrayExotic length value validation before descriptor attribute rejection","limitations":"Strict assignment to non-writable Array length still does not throw in one coercion-order case.","next_action_hint":"Address strict failed writes to non-writable Array length via Put.put length path, or move to concat species/proxy/string wrapper cluster."}}
