{"run":1117,"commit":"ea5cf70","metric":36,"metrics":{"compiler_test262_cases":509,"compiler_test262_pass":473,"compiler_test262_failures":36,"compiler_test262_compiler_errors":0,"compiler_test262_compiler_crashes":0,"compiler_test262_compiler_fails":0,"compiler_test262_both_fail":33,"compiler_test262_interpreter_fail_compiler_pass":1,"compatibility_pass":473,"compatibility_cases":509,"compiler_errors":0,"compiler_crashes":0,"compiler_fails":0,"both_fail":33,"interpreter_fail_compiler_pass":1,"elapsed_ms":53967},"status":"keep","description":"Preserve Function constructor line comments","timestamp":1778639605632,"segment":54,"confidence":3.611111111111111,"iterationTokens":8781,"asi":{"hypothesis":"Dynamic Function construction must insert line terminators between the parameter list, closing paren, body, and closing brace so line comments in parameter/body source do not consume generated syntax and Function.prototype.toString can preserve the expected source form.","focused_cases":["built-ins/Function/prototype/toString/Function.js"],"focused_result":"Focused interpreter case passes; broad workload improves by one shared failure.","checks":"Backpressure checks passed."}}
{"run":1118,"commit":"9a016de","metric":35,"metrics":{"compiler_test262_cases":509,"compiler_test262_pass":474,"compiler_test262_failures":35,"compiler_test262_compiler_errors":0,"compiler_test262_compiler_crashes":0,"compiler_test262_compiler_fails":0,"compiler_test262_both_fail":32,"compiler_test262_interpreter_fail_compiler_pass":1,"compatibility_pass":474,"compatibility_cases":509,"compiler_errors":0,"compiler_crashes":0,"compiler_fails":0,"both_fail":32,"interpreter_fail_compiler_pass":1,"elapsed_ms":54354},"status":"keep","description":"Expose RegExp symbol-named builtins","timestamp":1778639904461,"segment":54,"confidence":3.6666666666666665,"iterationTokens":6495,"asi":{"hypothesis":"RegExp.prototype[Symbol.match] and RegExp[Symbol.species] are real symbol-named builtins/accessors; exposing them with native-function-shaped builtin values should fix Function.prototype.toString symbol-named builtin coverage without special-casing the test.","focused_cases":["built-ins/Function/prototype/toString/symbol-named-builtins.js"],"focused_result":"Focused interpreter case passes; broad workload improves by one shared failure.","checks":"Backpressure checks passed."}}
{"run":1119,"commit":"5d68eba","metric":32,"metrics":{"compiler_test262_cases":509,"compiler_test262_pass":477,"compiler_test262_failures":32,"compiler_test262_compiler_errors":0,"compiler_test262_compiler_crashes":0,"compiler_test262_compiler_fails":0,"compiler_test262_both_fail":29,"compiler_test262_interpreter_fail_compiler_pass":1,"compatibility_pass":477,"compatibility_cases":509,"compiler_errors":0,"compiler_crashes":0,"compiler_fails":0,"both_fail":29,"interpreter_fail_compiler_pass":1,"elapsed_ms":55130},"status":"keep","description":"Respect deleted callable length fast path","timestamp":1778640573411,"segment":54,"confidence":3.6315789473684212,"iterationTokens":38661,"asi":{"hypothesis":"QuickJS emits get_length for callable .length reads, bypassing ordinary Get.get tombstones. Respecting constructor-static length deletion in the length fast path should fix dynamic Function length deletion without broad static property rewrites.","focused_cases":["built-ins/Function/length/S15.3.5.1_A2_T1.js","built-ins/Function/length/S15.3.5.1_A2_T2.js","built-ins/Function/length/S15.3.5.1_A2_T3.js"],"focused_result":"All three focused length delete cases pass in beam and beam_compiler modes; probe shows f.length falls from 3 to 0 after delete while hasOwnProperty is false.","checks":"Backpressure checks passed."}}
{"run":1120,"commit":"2fc1489","metric":28,"metrics":{"compiler_test262_cases":509,"compiler_test262_pass":481,"compiler_test262_failures":28,"compiler_test262_compiler_errors":0,"compiler_test262_compiler_crashes":0,"compiler_test262_compiler_fails":0,"compiler_test262_both_fail":25,"compiler_test262_interpreter_fail_compiler_pass":1,"compatibility_pass":481,"compatibility_cases":509,"compiler_errors":0,"compiler_crashes":0,"compiler_fails":0,"both_fail":25,"interpreter_fail_compiler_pass":1,"elapsed_ms":54310},"status":"keep","description":"Describe callable static accessors","timestamp":1778641046386,"segment":54,"confidence":3.65,"iterationTokens":16364,"asi":{"hypothesis":"Callable statics can store accessor pairs for static class getters/setters, but OwnProperty descriptors were exposing them as data values. Returning accessor descriptors should make Object.getOwnPropertyDescriptor(...).get/.set visible and preserve function source for toString.","focused_cases":["built-ins/Function/prototype/toString/getter-class-expression-static.js","built-ins/Function/prototype/toString/setter-class-expression-static.js"],"focused_result":"Focused static getter/setter toString cases pass in interpreter; broad workload improves by four shared failures.","checks":"Backpressure checks passed."}}
{"run":1121,"commit":"2fc1489","metric":35,"metrics":{"compiler_test262_cases":509,"compiler_test262_pass":474,"compiler_test262_failures":35,"compiler_test262_compiler_errors":0,"compiler_test262_compiler_crashes":0,"compiler_test262_compiler_fails":0,"compiler_test262_both_fail":31,"compiler_test262_interpreter_fail_compiler_pass":1,"compatibility_pass":474,"compatibility_cases":509,"compiler_errors":0,"compiler_crashes":0,"compiler_fails":0,"both_fail":31,"interpreter_fail_compiler_pass":1,"elapsed_ms":52169},"status":"discard","description":"Inherit callable Symbol.hasInstance","timestamp":1778641459009,"segment":54,"confidence":3.4761904761904763,"iterationTokens":8009,"asi":{"hypothesis":"Let callable values inherit Function.prototype[Symbol.hasInstance] for symbol property lookup, fixing missing method errors on function(){}[Symbol.hasInstance].","rollback_reason":"Focused non-object and negative hasInstance cases passed, but the broad Function workload regressed from 28 to 35 failures, consistent with earlier hasInstance inheritance attempts exposing incomplete OrdinaryHasInstance positive/proxy semantics.","next_action_hint":"Do not retry symbol fallback alone; implement full OrdinaryHasInstance semantics, including prototype-chain walking and abrupt propagation, before re-enabling callable Symbol.hasInstance inheritance.","checks":"Backpressure checks passed but primary metric worsened."}}
{"run":1122,"commit":"8b33cf5","metric":26,"metrics":{"compiler_test262_cases":509,"compiler_test262_pass":483,"compiler_test262_failures":26,"compiler_test262_compiler_errors":0,"compiler_test262_compiler_crashes":0,"compiler_test262_compiler_fails":0,"compiler_test262_both_fail":23,"compiler_test262_interpreter_fail_compiler_pass":1,"compatibility_pass":483,"compatibility_cases":509,"compiler_errors":0,"compiler_crashes":0,"compiler_fails":0,"both_fail":23,"interpreter_fail_compiler_pass":1,"elapsed_ms":51883},"status":"keep","description":"Expose async dynamic function constructors","timestamp":1778642083163,"segment":54,"confidence":3.5714285714285716,"iterationTokens":19987,"asi":{"hypothesis":"Async function values should expose AsyncFunction/AsyncGeneratorFunction-style constructors that create dynamic functions with async source prefixes, while ordinary functions keep the Function constructor. This should fix toString source expectations for async dynamic function constructors without modeling full prototype objects yet.","focused_cases":["built-ins/Function/prototype/toString/AsyncFunction.js","built-ins/Function/prototype/toString/AsyncGenerator.js"],"focused_result":"AsyncFunction and AsyncGenerator focused cases pass; GeneratorFunction remains blocked because generator prototype constructor lookup still resolves to Function.","checks":"Backpressure checks passed."}}
{"run":1123,"commit":"61eed44","metric":25,"metrics":{"compiler_test262_cases":509,"compiler_test262_pass":484,"compiler_test262_failures":25,"compiler_test262_compiler_errors":0,"compiler_test262_compiler_crashes":0,"compiler_test262_compiler_fails":0,"compiler_test262_both_fail":22,"compiler_test262_interpreter_fail_compiler_pass":1,"compatibility_pass":484,"compatibility_cases":509,"compiler_errors":0,"compiler_crashes":0,"compiler_fails":0,"both_fail":22,"interpreter_fail_compiler_pass":1,"elapsed_ms":52122},"status":"keep","description":"Expose generator function prototypes","timestamp":1778642499430,"segment":54,"confidence":3.5348837209302326,"iterationTokens":19987,"asi":{"hypothesis":"Generator, async, and async-generator function objects should report function-kind-specific prototype objects whose constructor properties are the matching dynamic function constructors. This should let Object.getPrototypeOf(function*(){}).constructor create generator functions for toString tests.","focused_cases":["built-ins/Function/prototype/toString/GeneratorFunction.js","built-ins/Function/prototype/toString/AsyncFunction.js","built-ins/Function/prototype/toString/AsyncGenerator.js"],"focused_result":"GeneratorFunction and async focused cases pass in interpreter; compiler focused runner lacks the nativeFunctionMatcher harness but broad workload confirms the improvement.","checks":"Backpressure checks passed."}}
{"run":1124,"commit":"05347a8","metric":24,"metrics":{"compiler_test262_cases":509,"compiler_test262_pass":485,"compiler_test262_failures":24,"compiler_test262_compiler_errors":0,"compiler_test262_compiler_crashes":0,"compiler_test262_compiler_fails":0,"compiler_test262_both_fail":21,"compiler_test262_interpreter_fail_compiler_pass":1,"compatibility_pass":485,"compatibility_cases":509,"compiler_errors":0,"compiler_crashes":0,"compiler_fails":0,"both_fail":21,"interpreter_fail_compiler_pass":1,"elapsed_ms":53543},"status":"keep","description":"Use realm Date prototypes for bound construction","timestamp":1778643081852,"segment":54,"confidence":3.5,"iterationTokens":40499,"asi":{"hypothesis":"Reflect.construct(Date, ..., bound realm functions) should use the target function realm's Date.prototype when newTarget.prototype is not an object. Adding Date to Test262 realm intrinsics and letting Date construction initialize the allocated this object should fix the non-recursive GetFunctionRealm Date case.","focused_cases":["built-ins/Function/prototype/bind/get-fn-realm.js"],"focused_result":"Non-recursive bind/get-fn-realm passes in interpreter and compiler; recursive bound target realm identity still fails and needs bound-function realm unwrapping/intrinsics propagation.","checks":"Backpressure checks passed."}}
{"run":1125,"commit":"e930d2b","metric":18,"metrics":{"compiler_test262_cases":509,"compiler_test262_pass":491,"compiler_test262_failures":18,"compiler_test262_compiler_errors":0,"compiler_test262_compiler_crashes":0,"compiler_test262_compiler_fails":0,"compiler_test262_both_fail":15,"compiler_test262_interpreter_fail_compiler_pass":1,"compatibility_pass":491,"compatibility_cases":509,"compiler_errors":0,"compiler_crashes":0,"compiler_fails":0,"both_fail":15,"interpreter_fail_compiler_pass":1,"elapsed_ms":52368},"status":"keep","description":"Implement ordinary hasInstance semantics","timestamp":1778643546525,"segment":54,"confidence":3.688888888888889,"iterationTokens":19082,"asi":{"hypothesis":"Expose Function.prototype[Symbol.hasInstance] to callable values only after replacing the old call-target behavior with OrdinaryHasInstance: bound target recursion, prototype property Get abrupt propagation, non-object prototype TypeError, and prototype-chain walking through Object.getPrototypeOf so proxy getPrototypeOf traps are observable.","focused_cases":["built-ins/Function/prototype/Symbol.hasInstance/value-non-obj.js","built-ins/Function/prototype/Symbol.hasInstance/value-negative.js","built-ins/Function/prototype/Symbol.hasInstance/value-positive.js","built-ins/Function/prototype/Symbol.hasInstance/this-val-poisoned-prototype.js","built-ins/Function/prototype/Symbol.hasInstance/value-get-prototype-of-err.js","built-ins/Function/prototype/Symbol.hasInstance/this-val-bound-target.js"],"focused_result":"All focused Symbol.hasInstance cases pass in interpreter; core compiler/vm tests pass.","checks":"Backpressure checks passed."}}
{"run":1126,"commit":"e930d2b","metric":25,"metrics":{"compiler_test262_cases":509,"compiler_test262_pass":484,"compiler_test262_failures":25,"compiler_test262_compiler_errors":0,"compiler_test262_compiler_crashes":0,"compiler_test262_compiler_fails":0,"compiler_test262_both_fail":23,"compiler_test262_interpreter_fail_compiler_pass":0,"compatibility_pass":484,"compatibility_cases":509,"compiler_errors":0,"compiler_crashes":0,"compiler_fails":0,"both_fail":23,"interpreter_fail_compiler_pass":0,"elapsed_ms":52602},"status":"discard","description":"Install restricted Function prototype accessors","timestamp":1778643786504,"segment":54,"confidence":3.608695652173913,"iterationTokens":5647,"asi":{"hypothesis":"Install actual configurable Function.prototype caller/arguments restricted accessor properties so descriptor tests and cross-pair accessor identity pass through the normal object property model.","rollback_reason":"Focused descriptor/accessor cases passed, but broad Function workload regressed from 18 to 25 failures, similar to the earlier restricted-accessor attempt; making the accessors visible changes Annex B/Sputnik caller-stack cases and loses more than it gains.","next_action_hint":"Do not retry restricted Function.prototype accessors unchanged. A future approach must distinguish Function.prototype descriptor reflection from legacy caller stack semantics, likely by implementing Annex B caller behavior first.","checks":"Backpressure checks passed but primary metric worsened."}}
{"run":1127,"commit":"bdeb2f5","metric":17,"metrics":{"compiler_test262_cases":509,"compiler_test262_pass":492,"compiler_test262_failures":17,"compiler_test262_compiler_errors":0,"compiler_test262_compiler_crashes":0,"compiler_test262_compiler_fails":0,"compiler_test262_both_fail":14,"compiler_test262_interpreter_fail_compiler_pass":1,"compatibility_pass":492,"compatibility_cases":509,"compiler_errors":0,"compiler_crashes":0,"compiler_fails":0,"both_fail":14,"interpreter_fail_compiler_pass":1,"elapsed_ms":51706},"status":"keep","description":"Reuse allocated objects for Object construction","timestamp":1778644485464,"segment":54,"confidence":3.652173913043478,"iterationTokens":34707,"asi":{"hypothesis":"Object construction through Reflect.construct should initialize and return the already allocated this object when it has an internal prototype, so GetPrototypeFromConstructor(newTarget, %Object.prototype%) realm selection is preserved instead of allocating a fresh global-realm ordinary object.","focused_cases":["built-ins/Function/prototype/bind/get-fn-realm-recursive.js"],"focused_result":"Recursive bound get-fn-realm passes in interpreter and compiler; direct realm Object construction probe now uses the realm newTarget prototype.","checks":"Backpressure checks passed."}}
{"run":1128,"commit":"f53c5c0","metric":15,"metrics":{"compiler_test262_cases":509,"compiler_test262_pass":494,"compiler_test262_failures":15,"compiler_test262_compiler_errors":0,"compiler_test262_compiler_crashes":0,"compiler_test262_compiler_fails":0,"compiler_test262_both_fail":14,"compiler_test262_interpreter_fail_compiler_pass":1,"compatibility_pass":494,"compatibility_cases":509,"compiler_errors":0,"compiler_crashes":0,"compiler_fails":0,"both_fail":14,"interpreter_fail_compiler_pass":1,"elapsed_ms":25579},"status":"keep","description":"Avoid GC cycles through callable statics","timestamp":1778645131168,"segment":54,"confidence":3.739130434782609,"iterationTokens":33752,"asi":{"hypothesis":"Private static methods create callable/static/home-object cycles that make heap GC recurse forever after evaluation. Marking callable values by stable visited keys during GC should preserve reachability while avoiding cyclic traversal and turning private static toString timeouts into ordinary passes.","focused_cases":["built-ins/Function/prototype/toString/private-static-method-class-expression.js","built-ins/Function/prototype/toString/private-static-method-class-statement.js"],"focused_result":"Minimal static private method QuickBEAM.eval no longer times out; focused private static toString cases pass in interpreter. Compiler focused runner lacks nativeFunctionMatcher but broad workload confirms improvement and runtime roughly halves by removing timeout cases.","checks":"Backpressure checks passed."}}
{"run":1129,"commit":"17de20d","metric":14,"metrics":{"compiler_test262_cases":509,"compiler_test262_pass":495,"compiler_test262_failures":14,"compiler_test262_compiler_errors":0,"compiler_test262_compiler_crashes":0,"compiler_test262_compiler_fails":0,"compiler_test262_both_fail":14,"compiler_test262_interpreter_fail_compiler_pass":0,"compatibility_pass":495,"compatibility_cases":509,"compiler_errors":0,"compiler_crashes":0,"compiler_fails":0,"both_fail":14,"interpreter_fail_compiler_pass":0,"elapsed_ms":25674},"status":"keep","description":"Describe restricted Function prototype properties","timestamp":1778645515058,"segment":54,"confidence":3.702127659574468,"iterationTokens":16444,"asi":{"hypothesis":"Expose Function.prototype caller/arguments as virtual own accessor descriptors for reflection without installing actual accessors into ordinary Get semantics. This should fix descriptor equality/hasOwnProperty reflection while avoiding the broad Annex B caller-stack regression from real accessors.","focused_cases":["built-ins/Function/prototype/caller-arguments/accessor-properties.js"],"focused_result":"Accessor-properties focused case passes; prop-desc cases still fail later because direct get/set throws are not implemented, but broad workload improves by removing the interpreter/compiler split.","checks":"Backpressure checks passed."}}
{"run":1130,"commit":"17de20d","metric":22,"metrics":{"compiler_test262_cases":509,"compiler_test262_pass":487,"compiler_test262_failures":22,"compiler_test262_compiler_errors":0,"compiler_test262_compiler_crashes":0,"compiler_test262_compiler_fails":0,"compiler_test262_both_fail":22,"compiler_test262_interpreter_fail_compiler_pass":0,"compatibility_pass":487,"compatibility_cases":509,"compiler_errors":0,"compiler_crashes":0,"compiler_fails":0,"both_fail":22,"interpreter_fail_compiler_pass":0,"elapsed_ms":25674},"status":"discard","description":"Throw on restricted Function prototype access","timestamp":1778645861100,"segment":54,"confidence":3.782608695652174,"iterationTokens":11269,"asi":{"hypothesis":"Make virtual Function.prototype caller/arguments restricted descriptors configurable/deletable/restorable and throw on inherited/direct access via Function.prototype to satisfy both prop-desc tests and old strict caller Sputnik cases.","rollback_reason":"Focused prop-desc and one strict caller case passed, but broad Function regressed from 14 to 22 because inherited throwing accessors changed too many Annex B caller/arguments cases and/or propertyHelper same-process descriptor restoration polluted later tests.","next_action_hint":"Do not retry broad restricted Function.prototype Get/Put/Delete semantics unchanged. A viable approach needs true Annex B function caller stack semantics for function objects, while keeping Function.prototype descriptor reflection virtual and avoiding global inherited throws.","checks":"Backpressure checks passed but primary metric worsened."}}
{"run":1131,"commit":"d8960c1","metric":12,"metrics":{"compiler_test262_cases":509,"compiler_test262_pass":497,"compiler_test262_failures":12,"compiler_test262_compiler_errors":0,"compiler_test262_compiler_crashes":0,"compiler_test262_compiler_fails":0,"compiler_test262_both_fail":12,"compiler_test262_interpreter_fail_compiler_pass":0,"compatibility_pass":497,"compatibility_cases":509,"compiler_errors":0,"compiler_crashes":0,"compiler_fails":0,"both_fail":12,"interpreter_fail_compiler_pass":0,"elapsed_ms":26359},"status":"keep","description":"Restore virtual restricted descriptors","timestamp":1778646168012,"segment":54,"confidence":3.7872340425531914,"iterationTokens":14148,"asi":{"hypothesis":"Keep Function.prototype caller/arguments as virtual descriptors for reflection, but make their configurability observable by allowing delete to tombstone the virtual descriptor and defineProperty restore to treat the tombstone as absent. Avoid broad inherited Get/Put throwing semantics that previously regressed Annex B caller cases.","focused_cases":["built-ins/Function/prototype/caller/prop-desc.js","built-ins/Function/prototype/arguments/prop-desc.js"],"focused_result":"Both prop-desc cases pass in interpreter; core compiler/vm tests pass.","checks":"Backpressure checks passed."}}
