{"run":411,"commit":"2141eca","metric":501,"metrics":{"test262_language_sample_error_files":13,"test262_language_sample_unique_errors":3,"test262_language_sample_files":1000,"test_language_errors":0,"test_language_unique_errors":0,"test_language_parse_ok":1,"quickjs_parser_tests":763,"parser_tests":429,"parser_test_ms":900},"status":"keep","description":"Expand Test262 compatibility sample to 1000 files","timestamp":1777294188100,"segment":4,"confidence":null,"iterationTokens":107,"asi":{"hypothesis":"The first 300 Test262 language files now parse cleanly, so expanding the deterministic non-negative sample to 1000 files should expose the next broad compatibility gaps.","changes":"Raised the Test262 language compatibility sample limit from 300 to 1000 and updated autoresearch docs. Reinitialized the compatibility metric for the broader workload.","baseline":"test262_language_sample_errors=501 across 13 files; test_language_errors remains 0; parser_tests=429; quickjs_parser_tests=763.","first_failures":"Directive-prologue strict tests fail on reserved/restricted identifiers in function names or expressions; bigint-arithmetic contributes 480 invalid bigint literal errors.","next_action_hint":"Tackle bigint literal validation first because it accounts for most errors, then inspect directive-prologue strict test syntax to distinguish valid sloppy syntax from strict early errors."}}
{"run":412,"commit":"0462425","metric":21,"metrics":{"test262_language_sample_error_files":12,"test262_language_sample_unique_errors":2,"test262_language_sample_files":1000,"test_language_errors":0,"test_language_unique_errors":0,"test_language_parse_ok":1,"quickjs_parser_tests":764,"parser_tests":431,"parser_test_ms":1400},"status":"keep","description":"Accept prefixed BigInt exponent letters","timestamp":1777294299932,"segment":4,"confidence":null,"iterationTokens":3800,"asi":{"hypothesis":"Most 1000-file sample errors come from prefixed BigInt literals containing hex exponent letters E/e being misclassified as decimal exponent syntax.","changes":"Limited invalid BigInt exponent validation to non-prefixed decimal BigInt literals and added QuickJS-port tests for prefixed BigInts containing E/e while preserving decimal exponent BigInt errors.","benchmark_after":"test262_language_sample_errors reduced from 501 to 21; error_files reduced from 13 to 12; test_language_errors remains 0; parser tests increased to 431 and QuickJS-port coverage to 764. Backpressure checks passed.","next_action_hint":"Remaining failures are directive-prologue tests around non-strict reserved words and eval string literals; inspect whether tokenizer/parser treats public/static/etc. as non-bindable in sloppy mode and whether eval string content should be ignored as runtime data."}}
{"run":413,"commit":"666ec73","metric":0,"metrics":{"test262_language_sample_error_files":0,"test262_language_sample_unique_errors":0,"test262_language_sample_files":1000,"test_language_errors":0,"test_language_unique_errors":0,"test_language_parse_ok":1,"quickjs_parser_tests":765,"parser_tests":434,"parser_test_ms":800},"status":"keep","description":"Allow sloppy future reserved identifiers","timestamp":1777294440586,"segment":4,"confidence":null,"iterationTokens":6932,"asi":{"hypothesis":"Remaining 1000-file sample errors are directive-prologue tests using strict-mode future reserved words as sloppy bindings/references. The parser lexes them as keywords and rejects them even when strict mode is not active.","changes":"Allowed implements/interface/package/private/protected/public as identifier-like tokens in sloppy syntax while marking them restricted in strict binding validation. Updated reserved-name tests and added focused future-reserved-word coverage.","benchmark_after":"test262_language_sample_errors reduced from 21 to 0; test_language_errors remains 0; parser tests increased to 434 and QuickJS-port coverage to 765. Backpressure checks passed.","next_action_hint":"Broaden the deterministic Test262 language sample beyond 1000 files to expose the next compatibility gaps."}}
{"type":"config","name":"JavaScript Parser Test262 Compatibility 2000 Sample","metricName":"test262_language_sample_errors","metricUnit":"","bestDirection":"lower"}
{"run":414,"commit":"bb72292","metric":119,"metrics":{"test262_language_sample_error_files":40,"test262_language_sample_unique_errors":10,"test262_language_sample_files":2000,"test_language_errors":0,"test_language_unique_errors":0,"test_language_parse_ok":1,"quickjs_parser_tests":765,"parser_tests":434,"parser_test_ms":1000},"status":"keep","description":"Expand Test262 compatibility sample to 2000 files","timestamp":1777294550206,"segment":5,"confidence":null,"iterationTokens":107,"asi":{"hypothesis":"The first 1000 Test262 language files now parse cleanly, so expanding the deterministic non-negative sample to 2000 files should expose the next compatibility gaps.","changes":"Raised the Test262 language compatibility sample limit from 1000 to 2000 and updated autoresearch docs. Reinitialized the compatibility metric for the broader workload.","baseline":"test262_language_sample_errors=119 across 40 files; test_language_errors remains 0; parser_tests=434; quickjs_parser_tests=765.","first_failures":"Many failures involve yield used as an identifier in non-strict/non-generator contexts, destructuring assignment with yield defaults/targets, duplicate __proto__ in destructuring assignment object literals, and object literal method/accessor patterns in iterator-return tests.","next_action_hint":"Tackle yield-as-identifier handling in sloppy arrow/destructuring contexts first because it appears across many files."}}
{"run":415,"commit":"2fa4ab4","metric":12,"metrics":{"test262_language_sample_error_files":4,"test262_language_sample_unique_errors":6,"test262_language_sample_files":2000,"test_language_errors":0,"test_language_unique_errors":0,"test_language_parse_ok":1,"quickjs_parser_tests":766,"parser_tests":437,"parser_test_ms":1000},"status":"keep","description":"Track yield context while parsing functions","timestamp":1777295122826,"segment":5,"confidence":null,"iterationTokens":25122,"asi":{"hypothesis":"Most 2000-file sample errors come from treating yield as a YieldExpression everywhere. Yield should be an identifier in sloppy non-generator contexts, but a YieldExpression inside generator bodies.","changes":"Added parser yield_allowed? context, parsed function bodies with generator-specific yield context, allowed yield as identifier-like outside generators/modules, stopped bare yield before delimiters, and added focused QuickJS-port tests for sloppy yield identifiers and generator yield defaults.","benchmark_after":"test262_language_sample_errors reduced from 119 to 12; error files reduced from 40 to 4; test_language_errors remains 0; parser tests increased to 437 and QuickJS-port coverage to 766. Backpressure checks passed.","next_action_hint":"Remaining failures include object literal/destructuring __proto__ handling, object literal methods named return, and await identifier/assignment-target handling in script contexts."}}
{"run":416,"commit":"0e74c93","metric":2,"metrics":{"test262_language_sample_error_files":1,"test262_language_sample_unique_errors":1,"test262_language_sample_files":2000,"test_language_errors":0,"test_language_unique_errors":0,"test_language_parse_ok":1,"quickjs_parser_tests":767,"parser_tests":438,"parser_test_ms":1000},"status":"keep","description":"Track await context and keyword accessor keys","timestamp":1777295337103,"segment":5,"confidence":11.7,"iterationTokens":11090,"asi":{"hypothesis":"Remaining 2000-file sample errors include await used as a sloppy script identifier/assignment target and object literal accessors whose property name is a keyword such as return.","changes":"Added await_allowed? parser context, parsed async function/arrow bodies and parameters with await enabled, treated await as an identifier outside async/module contexts, and allowed keyword property names after get/set accessor prefixes. Updated await diagnostics tests.","benchmark_after":"test262_language_sample_errors reduced from 12 to 2; only duplicate __proto__ in destructuring assignment remains. test_language_errors remains 0; parser tests increased to 438 and QuickJS-port coverage to 767. Backpressure checks passed.","next_action_hint":"Handle duplicate __proto__ validation only for object initializers, not object assignment patterns produced from assignment targets."}}
{"run":417,"commit":"5187d0e","metric":0,"metrics":{"test262_language_sample_error_files":0,"test262_language_sample_unique_errors":0,"test262_language_sample_files":2000,"test_language_errors":0,"test_language_unique_errors":0,"test_language_parse_ok":1,"quickjs_parser_tests":768,"parser_tests":440,"parser_test_ms":1400},"status":"keep","description":"Allow duplicate proto in assignment patterns","timestamp":1777295509063,"segment":5,"confidence":11.7,"iterationTokens":6403,"asi":{"hypothesis":"The last 2000-file sample errors come from applying duplicate __proto__ object-initializer validation before assignment-target conversion. Duplicate __proto__ is invalid for object initializers but allowed in object assignment patterns.","changes":"Moved duplicate __proto__ validation from parse_object_expression/1 to a post-parse AST validation pass over ObjectExpression nodes, which skips converted ObjectPattern assignment targets. Added tests for duplicate __proto__ in assignment patterns while preserving object initializer diagnostics.","benchmark_after":"test262_language_sample_errors reduced from 2 to 0; error files reduced from 1 to 0; test_language_errors remains 0; parser tests increased to 440 and QuickJS-port coverage to 768. Backpressure checks passed.","next_action_hint":"Broaden the deterministic Test262 language sample beyond 2000 files or target another language subdirectory group."}}
{"type":"config","name":"JavaScript Parser Test262 Compatibility 4000 Sample","metricName":"test262_language_sample_errors","metricUnit":"","bestDirection":"lower"}
{"run":418,"commit":"2c9817e","metric":68,"metrics":{"test262_language_sample_error_files":16,"test262_language_sample_unique_errors":5,"test262_language_sample_files":4000,"test_language_errors":0,"test_language_unique_errors":0,"test_language_parse_ok":1,"quickjs_parser_tests":768,"parser_tests":440,"parser_test_ms":900},"status":"keep","description":"Expand Test262 compatibility sample to 4000 files","timestamp":1777295738899,"segment":6,"confidence":null,"iterationTokens":107,"asi":{"hypothesis":"The first 2000 Test262 language files now parse cleanly, so expanding the deterministic non-negative sample to 4000 files should expose the next compatibility gaps.","changes":"Raised the Test262 language compatibility sample limit from 2000 to 4000 and updated autoresearch docs. Reinitialized the compatibility metric for the broader workload.","baseline":"test262_language_sample_errors=68 across 16 files; test_language_errors remains 0; parser_tests=440; quickjs_parser_tests=768.","first_failures":"Async generator yield spread object cases, class accessor computed key with in-expression, and decorators syntax using @.","next_action_hint":"Tackle non-decorator syntax first: async generator yield *{} / yield identifier spread object and computed accessor names involving in. Decorators are a larger syntax feature and may need separate AST support."}}
{"run":419,"commit":"8a66457","metric":48,"metrics":{"test262_language_sample_error_files":8,"test262_language_sample_unique_errors":2,"test262_language_sample_files":4000,"test_language_errors":0,"test_language_unique_errors":0,"test_language_parse_ok":1,"quickjs_parser_tests":770,"parser_tests":443,"parser_test_ms":800},"status":"keep","description":"Parse yield spread and boolean property names","timestamp":1777295903691,"segment":6,"confidence":null,"iterationTokens":8060,"asi":{"hypothesis":"Non-decorator failures in the 4000-file sample are from yield expression arguments consuming comma-separated object spread siblings, and dot-property names like .false after computed accessor tests.","changes":"Parsed non-delegated yield arguments at assignment precedence instead of comma precedence, allowed boolean/null tokens as dot property identifiers, and added focused QuickJS-port tests for yield object spread and boolean property names/computed accessor names.","benchmark_after":"test262_language_sample_errors reduced from 68 to 48; remaining failures are decorator syntax using @. test_language_errors remains 0; parser tests increased to 443 and QuickJS-port coverage to 770. Backpressure checks passed.","next_action_hint":"Implement minimal decorator syntax parsing for accepted class decorator tests, or expand benchmark beyond decorator cluster if decorators are intentionally out of current scope."}}
{"run":420,"commit":"4412699","metric":0,"metrics":{"test262_language_sample_error_files":0,"test262_language_sample_unique_errors":0,"test262_language_sample_files":4000,"test_language_errors":0,"test_language_unique_errors":0,"test_language_parse_ok":1,"quickjs_parser_tests":771,"parser_tests":445,"parser_test_ms":900},"status":"keep","description":"Parse decorator syntax before class expressions","timestamp":1777296041312,"segment":6,"confidence":null,"iterationTokens":4734,"asi":{"hypothesis":"The remaining 4000-file sample errors are accepted decorator syntax before class expressions. Even without representing decorators in AST, the parser can consume decorator lists and parse the decorated class expression.","changes":"Added @ as a lexer punctuator and a minimal decorated-class expression parser that skips decorator expressions until the following class token. Added QuickJS-port tests for call/member/parenthesized/private-member decorator forms.","benchmark_after":"test262_language_sample_errors reduced from 48 to 0; error files reduced from 8 to 0; test_language_errors remains 0; parser tests increased to 445 and QuickJS-port coverage to 771. Backpressure checks passed.","next_action_hint":"Broaden the deterministic Test262 language sample beyond 4000 files to expose the next compatibility gaps; if decorators recur in declarations/elements, add structured decorator AST support later."}}
{"type":"config","name":"JavaScript Parser Test262 Compatibility 8000 Sample","metricName":"test262_language_sample_errors","metricUnit":"","bestDirection":"lower"}
{"run":421,"commit":"99c44d5","metric":1467,"metrics":{"test262_language_sample_error_files":438,"test262_language_sample_unique_errors":12,"test262_language_sample_files":8000,"test_language_errors":0,"test_language_unique_errors":0,"test_language_parse_ok":1,"quickjs_parser_tests":771,"parser_tests":445,"parser_test_ms":1000},"status":"keep","description":"Expand Test262 compatibility sample to 8000 files","timestamp":1777296196175,"segment":7,"confidence":null,"iterationTokens":107,"asi":{"hypothesis":"The first 4000 Test262 language files now parse cleanly, so expanding the deterministic non-negative sample to 8000 files should expose broader compatibility gaps.","changes":"Raised the Test262 language compatibility sample limit from 4000 to 8000 and updated autoresearch docs. Reinitialized the compatibility metric for the broader workload.","baseline":"test262_language_sample_errors=1467 across 438 files; test_language_errors remains 0; parser_tests=445; quickjs_parser_tests=771.","first_failures":"Class fields named static, compound-assignment whitespace tests around parenthesized assignment targets, division vs regexp lexical goal errors, dynamic import parsing, module fixture source-type handling, and likely many explicit resource management/import attributes later in the sample.","next_action_hint":"Tackle high-volume broad grammar gaps first. Inspect error frequencies and earliest failure clusters; class static-as-field and parenthesized assignment targets are likely small targeted fixes, division/regexp lexical goal is larger."}}
{"run":422,"commit":"4a274a4","metric":636,"metrics":{"test262_language_sample_error_files":178,"test262_language_sample_unique_errors":12,"test262_language_sample_files":8000,"test_language_errors":0,"test_language_unique_errors":0,"test_language_parse_ok":1,"quickjs_parser_tests":772,"parser_tests":447,"parser_test_ms":1000},"status":"keep","description":"Parse dynamic import at statement position","timestamp":1777296344159,"segment":7,"confidence":null,"iterationTokens":18725,"asi":{"hypothesis":"Most 8000-file errors are dynamic import expressions being parsed as static import declarations whenever import appears at statement position.","changes":"Dispatch statement-position import followed by '(' to expression parsing rather than parse_import_declaration/1. Added focused QuickJS-port tests for dynamic import calls and import options objects at statement position.","benchmark_after":"test262_language_sample_errors reduced from 1467 to 636; error files reduced from 438 to 178; test_language_errors remains 0; parser tests increased to 447 and QuickJS-port coverage to 772. Backpressure checks passed.","next_action_hint":"Remaining large clusters include module fixture source-type detection, compound assignment parenthesized targets, division-vs-regexp lexing, and class fields named static."}}
{"run":423,"commit":"f66db5a","metric":134,"metrics":{"test262_language_sample_error_files":79,"test262_language_sample_unique_errors":8,"test262_language_sample_files":8000,"test_language_errors":0,"test_language_unique_errors":0,"test_language_parse_ok":1,"quickjs_parser_tests":773,"parser_tests":449,"parser_test_ms":1100},"status":"keep","description":"Parse import dot dynamic expressions","timestamp":1777296495019,"segment":7,"confidence":2.6553784860557768,"iterationTokens":3782,"asi":{"hypothesis":"Many remaining dynamic-import errors are import.defer/import.source call expressions being parsed as static import declarations or import.meta meta-properties.","changes":"Statement-position import followed by dot now parses as an expression. In prefix parsing, only import.meta becomes a MetaProperty; other import dot forms parse as an import identifier and normal member/call expression. Added focused QuickJS-port tests for import.defer and import.meta.","benchmark_after":"test262_language_sample_errors reduced from 636 to 134; error files reduced from 178 to 79; test_language_errors remains 0; parser tests increased to 449 and QuickJS-port coverage to 773. Backpressure checks passed.","next_action_hint":"Remaining clusters include module fixture source-type detection for *_FIXTURE.js modules, parenthesized assignment targets, division-vs-regexp lexical goals, and class fields named static."}}
{"type":"config","name":"JavaScript Parser Test262 Compatibility Clean 8000 Sample","metricName":"test262_language_sample_errors","metricUnit":"","bestDirection":"lower"}
{"run":424,"commit":"21f45d0","metric":94,"metrics":{"test262_language_sample_error_files":39,"test262_language_sample_unique_errors":7,"test262_language_sample_files":8000,"test262_language_sample_module_files":158,"test_language_errors":0,"test_language_unique_errors":0,"test_language_parse_ok":1,"quickjs_parser_tests":773,"parser_tests":449,"parser_test_ms":1200},"status":"keep","description":"Clean Test262 compatibility autoresearch setup","timestamp":1777296923937,"segment":8,"confidence":null,"iterationTokens":108,"asi":{"hypothesis":"The autoresearch setup had accumulated ad hoc segment edits and limited diagnostics. A cleaner deterministic benchmark with source-type detection, cluster summaries, and environment controls should make remaining parser compatibility work easier and less error-prone.","changes":"Rewrote bench/js_parser_compat.exs into a structured benchmark module with configurable sample limit/offset/error output, source-type detection for module metadata/static import-export syntax, error message and directory clustering, and additional source-type metrics. Rewrote autoresearch.md and tidied autoresearch.sh.","baseline":"Clean 8000-file sample baseline is test262_language_sample_errors=94 across 39 files, with test_language_errors=0, parser_tests=449, quickjs_parser_tests=773.","next_action_hint":"Use ERROR_MESSAGE/ERROR_DIR clusters first. Current high-value clusters are parenthesized assignment/exponentiation expected-), division-vs-regexp lexical goals, class fields named static, and static-init await/yield function binding cases."}}
{"run":425,"commit":"f047ddd","metric":92,"metrics":{"test262_language_sample_error_files":37,"test262_language_sample_unique_errors":6,"test262_language_sample_files":8000,"test262_language_sample_module_files":158,"test_language_errors":0,"test_language_unique_errors":0,"test_language_parse_ok":1,"quickjs_parser_tests":774,"parser_tests":451,"parser_test_ms":1000},"status":"keep","description":"Parse static as instance class field","timestamp":1777297123155,"segment":8,"confidence":null,"iterationTokens":8621,"asi":{"hypothesis":"Two remaining 8000-sample files use static as an instance class field name. The parser always consumed static as the static modifier unless followed by '(', so 'static;' and 'static = value;' failed before parsing a field key.","changes":"Changed class static modifier consumption to leave static as a field key when followed by ';' or '='. Added focused QuickJS-port tests for bare and assigned instance fields named static.","benchmark_after":"test262_language_sample_errors reduced from 94 to 92; error files from 39 to 37; test_language_errors remains 0; parser tests increased to 451 and QuickJS-port coverage to 774. Backpressure checks passed.","next_action_hint":"Tackle parenthesized compound-assignment/exponentiation expected-')' cluster next; likely parse parens currently produce expression rather than assignment target in contexts like (x) += y or exponentiation with parenthesized unary expressions."}}
