{"run":1773,"commit":"d63ecd8","metric":187,"metrics":{"compiler_test262_cases":500,"compiler_test262_pass":313,"compiler_test262_failures":187,"compiler_test262_compiler_errors":0,"compiler_test262_compiler_crashes":18,"compiler_test262_compiler_fails":81,"compiler_test262_both_fail":72,"compiler_test262_interpreter_fail_compiler_pass":2,"compatibility_pass":313,"compatibility_cases":500,"compiler_errors":0,"compiler_crashes":18,"compiler_fails":81,"both_fail":72,"interpreter_fail_compiler_pass":2,"elapsed_ms":168547},"status":"keep","description":"Forward Iterator concat return","timestamp":1778890571605,"segment":180,"confidence":8.5,"iterationTokens":1825,"asi":{"hypothesis":"Once Iterator.concat has opened an active inner iterator, closing the concat helper should forward return to that active iterator exactly once, with zero arguments.","result":"Iterator failures improved from 188 to 187; focused concat return forwarding cases pass and checks passed.","remaining":"Concat argument/spread counting and generator-running cases remain, alongside Iterator.from wrapper edge cases and compiler-only helper behavior."}}
{"run":1774,"commit":"3d32ac0","metric":185,"metrics":{"compiler_test262_cases":500,"compiler_test262_pass":315,"compiler_test262_failures":185,"compiler_test262_compiler_errors":0,"compiler_test262_compiler_crashes":17,"compiler_test262_compiler_fails":83,"compiler_test262_both_fail":71,"compiler_test262_interpreter_fail_compiler_pass":2,"compatibility_pass":315,"compatibility_cases":500,"compiler_errors":0,"compiler_crashes":17,"compiler_fails":83,"both_fail":71,"interpreter_fail_compiler_pass":2,"elapsed_ms":152530},"status":"keep","description":"Use flattenable iterators for flatMap","timestamp":1778890971347,"segment":180,"confidence":8.555555555555555,"iterationTokens":28301,"asi":{"hypothesis":"Iterator.prototype.flatMap should use GetIteratorFlattenable on mapper results: primitive results throw instead of being flattened, objects with null/undefined @@iterator fall back to next, and abrupt mapper-result validation closes the outer iterator.","result":"Iterator failures improved from 187 to 185; focused interpreter flatMap primitive string and fallback cases pass, checks passed.","remaining":"Compiler-only flatMap generator helper cases still fail/crash, and primitive wrapper iterable behavior remains limited by broader Number/String object iteration semantics."}}
{"run":1775,"commit":"68d8a83","metric":168,"metrics":{"compiler_test262_cases":500,"compiler_test262_pass":332,"compiler_test262_failures":168,"compiler_test262_compiler_errors":0,"compiler_test262_compiler_crashes":0,"compiler_test262_compiler_fails":83,"compiler_test262_both_fail":73,"compiler_test262_interpreter_fail_compiler_pass":5,"compatibility_pass":332,"compatibility_cases":500,"compiler_errors":0,"compiler_crashes":0,"compiler_fails":83,"both_fail":73,"interpreter_fail_compiler_pass":5,"elapsed_ms":162264},"status":"keep","description":"Wrap escaped compiled generator yields","timestamp":1778891306581,"segment":180,"confidence":9.027777777777779,"iterationTokens":2467,"asi":{"hypothesis":"Some compiled generator functions reach the generic compiled invocation path and throw generator_yield tuples; catching those yields and building a suspended compiled generator iterator should eliminate compiler crash clusters without changing generator source semantics.","result":"Iterator failures improved from 185 to 168 and compiler crashes dropped from 17 to 0; checks passed.","remaining":"Compiler semantic failures remain for helper callback arguments/this and iterator consumption; interpreter/compiler skew rose slightly because crash cases now run far enough to expose behavior mismatches."}}
{"run":1776,"commit":"68d8a83","metric":168,"metrics":{"compiler_test262_cases":500,"compiler_test262_pass":332,"compiler_test262_failures":168,"compiler_test262_compiler_errors":0,"compiler_test262_compiler_crashes":0,"compiler_test262_compiler_fails":83,"compiler_test262_both_fail":73,"compiler_test262_interpreter_fail_compiler_pass":6,"compatibility_pass":332,"compatibility_cases":500,"compiler_errors":0,"compiler_crashes":0,"compiler_fails":83,"both_fail":73,"interpreter_fail_compiler_pass":6,"elapsed_ms":147692},"status":"discard","description":"Retry Iterator.from wrapper next caching","timestamp":1778891622277,"segment":180,"confidence":8.333333333333334,"iterationTokens":2149,"asi":{"hypothesis":"After compiled generator yield wrapping removed the crash cluster, Iterator.from wrappers that cache the underlying next method once may now reduce the broad workload instead of just moving failures to compiler crashes.","rollback_reason":"Primary metric stayed at 168 and interpreter/compiler skew increased; focused Iterator.from cases pass, but the first 500-case workload gains no net compatibility from wrapper next caching yet.","next_action_hint":"Do not retry Iterator.from wrapper next caching unchanged. Investigate remaining Iterator.from failures and compiler helper consumption before reintroducing it."}}
{"run":1777,"commit":"7b018c2","metric":163,"metrics":{"compiler_test262_cases":500,"compiler_test262_pass":337,"compiler_test262_failures":163,"compiler_test262_compiler_errors":0,"compiler_test262_compiler_crashes":0,"compiler_test262_compiler_fails":83,"compiler_test262_both_fail":70,"compiler_test262_interpreter_fail_compiler_pass":4,"compatibility_pass":337,"compatibility_cases":500,"compiler_errors":0,"compiler_crashes":0,"compiler_fails":83,"both_fail":70,"interpreter_fail_compiler_pass":4,"elapsed_ms":153794},"status":"keep","description":"Defer Iterator helper next callability","timestamp":1778891988718,"segment":180,"confidence":7.857142857142857,"iterationTokens":6556,"asi":{"hypothesis":"Lazy Iterator helper constructors should capture the receiver and next value but defer non-callable next TypeErrors until the helper is advanced, while consuming helpers still throw during their immediate iteration.","result":"Iterator failures improved from 168 to 163; focused map/filter/drop/take non-callable-next lazy helper cases pass and checks passed.","remaining":"Iterator.from still needs eager next validation/caching separately, and compiler-only helper semantic failures around callback args/this and exhausted generator consumption remain."}}
{"run":1778,"commit":"eea6893","metric":161,"metrics":{"compiler_test262_cases":500,"compiler_test262_pass":339,"compiler_test262_failures":161,"compiler_test262_compiler_errors":0,"compiler_test262_compiler_crashes":1,"compiler_test262_compiler_fails":83,"compiler_test262_both_fail":67,"compiler_test262_interpreter_fail_compiler_pass":4,"compatibility_pass":339,"compatibility_cases":500,"compiler_errors":0,"compiler_crashes":1,"compiler_fails":83,"both_fail":67,"interpreter_fail_compiler_pass":4,"elapsed_ms":153729},"status":"keep","description":"Close Iterator take at limit","timestamp":1778892308712,"segment":180,"confidence":8.405063291139241,"iterationTokens":2274,"asi":{"hypothesis":"Iterator.prototype.take should close its underlying iterator once the requested limit is exhausted instead of silently returning done forever.","result":"Iterator failures improved from 163 to 161; checks passed, despite one compiler crash appearing in the residual list.","remaining":"Focused generator-heavy take exhaustion still exposes generator/callability quirks, so further take work should inspect compiled/interpreter generator interaction before changing return ordering again."}}
{"run":1779,"commit":"0650441","metric":78,"metrics":{"compiler_test262_cases":500,"compiler_test262_pass":422,"compiler_test262_failures":78,"compiler_test262_compiler_errors":0,"compiler_test262_compiler_crashes":1,"compiler_test262_compiler_fails":0,"compiler_test262_both_fail":62,"compiler_test262_interpreter_fail_compiler_pass":3,"compatibility_pass":422,"compatibility_cases":500,"compiler_errors":0,"compiler_crashes":1,"compiler_fails":0,"both_fail":62,"interpreter_fail_compiler_pass":3,"elapsed_ms":239717},"status":"keep","description":"Make compiled generators iterable","timestamp":1778892727701,"segment":180,"confidence":11.216216216216216,"iterationTokens":5144,"asi":{"hypothesis":"Compiled generator iterator objects should be ordinary iterable iterator objects inheriting from Iterator.prototype; otherwise compiler-mode helper tests fail when Array.from/spread or helper methods consume compiled generator results.","result":"Iterator failures improved from 161 to 78; compiler_fails dropped from 83 to 0 and checks passed.","remaining":"Residual is now mostly shared runtime semantics plus one compiler crash and a few interpreter/compiler skews; inspect current failure list before further broad helper changes."}}
{"run":1780,"commit":"d299577","metric":74,"metrics":{"compiler_test262_cases":500,"compiler_test262_pass":426,"compiler_test262_failures":74,"compiler_test262_compiler_errors":0,"compiler_test262_compiler_crashes":1,"compiler_test262_compiler_fails":0,"compiler_test262_both_fail":63,"compiler_test262_interpreter_fail_compiler_pass":4,"compatibility_pass":426,"compatibility_cases":500,"compiler_errors":0,"compiler_crashes":1,"compiler_fails":0,"both_fail":63,"interpreter_fail_compiler_pass":4,"elapsed_ms":206439},"status":"keep","description":"Mark Iterator helpers nonconstructible","timestamp":1778893112803,"segment":180,"confidence":12.892307692307693,"iterationTokens":5605,"asi":{"hypothesis":"Iterator helper functions such as drop/take/toArray and static zip/zipKeyed are built-in functions without [[Construct]], so their builtin metadata should reject new calls consistently in both interpreter and compiler paths.","result":"Iterator failures improved from 78 to 74; focused drop/take/zip non-constructible cases pass and checks passed.","remaining":"Residual is dominated by Iterator.zip/zipKeyed semantics, Iterator.from wrapper edge cases, constructor weird-setter inherited accessor assignment, and generator-running reentrancy crashes."}}
{"run":1781,"commit":"d299577","metric":0,"metrics":{"compiler_test262_cases":0,"compiler_test262_pass":0,"compiler_test262_failures":0,"compiler_test262_compiler_errors":0,"compiler_test262_compiler_crashes":1,"compiler_test262_compiler_fails":0,"compiler_test262_both_fail":0,"compiler_test262_interpreter_fail_compiler_pass":0,"compatibility_pass":0,"compatibility_cases":0,"compiler_errors":0,"compiler_crashes":1,"compiler_fails":0,"both_fail":0,"interpreter_fail_compiler_pass":0,"elapsed_ms":384200},"status":"crash","description":"Validate Iterator zip options and padding","timestamp":1778893643356,"segment":180,"confidence":12.892307692307693,"iterationTokens":22805,"asi":{"hypothesis":"Iterator.zip/zipKeyed should validate options/mode/padding at construction and precompute longest padding values through the iterator protocol.","rollback_reason":"The broad Iterator workload timed out, likely because eager padding iteration or option validation on the current broad slice introduced slow/hanging zip paths even though focused option tests passed.","next_action_hint":"Do not retry eager zip padding validation unchanged. If revisiting, isolate only cheap mode/options validation or implement padding lazily with robust IteratorClose and timeout-safe iteration."}}
{"run":1782,"commit":"212d488","metric":70,"metrics":{"compiler_test262_cases":500,"compiler_test262_pass":430,"compiler_test262_failures":70,"compiler_test262_compiler_errors":0,"compiler_test262_compiler_crashes":4,"compiler_test262_compiler_fails":0,"compiler_test262_both_fail":58,"compiler_test262_interpreter_fail_compiler_pass":1,"compatibility_pass":430,"compatibility_cases":500,"compiler_errors":0,"compiler_crashes":4,"compiler_fails":0,"both_fail":58,"interpreter_fail_compiler_pass":1,"elapsed_ms":237251},"status":"keep","description":"Validate Iterator zip options cheaply","timestamp":1778894070422,"segment":180,"confidence":10.575,"iterationTokens":2803,"asi":{"hypothesis":"Iterator.zip/zipKeyed can safely validate options objects, string modes, non-longest padding suppression, longest padding object/iterability, and basic strict length mismatch without eagerly consuming the padding iterator at construction.","result":"Iterator failures improved from 74 to 70; focused options/mode/padding and basic strict tests pass, and checks passed.","remaining":"Eager padding-iteration semantics timed out when tried unchanged and must be implemented lazily/with proper close behavior rather than precomputing padding values."}}
{"run":1783,"commit":"2cef349","metric":67,"metrics":{"compiler_test262_cases":500,"compiler_test262_pass":433,"compiler_test262_failures":67,"compiler_test262_compiler_errors":0,"compiler_test262_compiler_crashes":2,"compiler_test262_compiler_fails":0,"compiler_test262_both_fail":55,"compiler_test262_interpreter_fail_compiler_pass":1,"compatibility_pass":433,"compatibility_cases":500,"compiler_errors":0,"compiler_crashes":2,"compiler_fails":0,"both_fail":55,"interpreter_fail_compiler_pass":1,"elapsed_ms":238508},"status":"keep","description":"Reject noncallable Iterator.from methods","timestamp":1778894498857,"segment":180,"confidence":10.65,"iterationTokens":6368,"asi":{"hypothesis":"Iterator.from/GetIteratorFlattenable should fall back to direct iterator mode only when @@iterator is null or undefined; present non-callable values must throw TypeError without needing wrapper next caching.","result":"Iterator failures improved from 70 to 67; focused non-callable @@iterator fallback cases pass and checks passed.","remaining":"Full Iterator.from next caching still stayed flat when tried; remaining from failures need targeted return/next caching or primitive wrapper semantics without changing broad helper behavior."}}
{"run":1784,"commit":"86c8fe1","metric":65,"metrics":{"compiler_test262_cases":500,"compiler_test262_pass":435,"compiler_test262_failures":65,"compiler_test262_compiler_errors":0,"compiler_test262_compiler_crashes":2,"compiler_test262_compiler_fails":0,"compiler_test262_both_fail":55,"compiler_test262_interpreter_fail_compiler_pass":1,"compatibility_pass":435,"compatibility_cases":500,"compiler_errors":0,"compiler_crashes":2,"compiler_fails":0,"both_fail":55,"interpreter_fail_compiler_pass":1,"elapsed_ms":209182},"status":"keep","description":"Truncate Iterator helper limits before range check","timestamp":1778894898889,"segment":180,"confidence":11.88888888888889,"iterationTokens":4753,"asi":{"hypothesis":"Iterator.prototype.drop/take should apply ToIntegerOrInfinity before the negative range check, so fractional values like -0.5 truncate to -0 and are valid.","result":"Iterator failures improved from 67 to 65; focused drop/take limit RangeError cases pass and checks passed.","remaining":"Limit coercion ordering around throwing valueOf and closure behavior still has residuals, but the numeric range semantics are now closer to spec."}}
{"run":1785,"commit":"9d8b75a","metric":63,"metrics":{"compiler_test262_cases":500,"compiler_test262_pass":437,"compiler_test262_failures":63,"compiler_test262_compiler_errors":0,"compiler_test262_compiler_crashes":1,"compiler_test262_compiler_fails":0,"compiler_test262_both_fail":45,"compiler_test262_interpreter_fail_compiler_pass":1,"compatibility_pass":437,"compatibility_cases":500,"compiler_errors":0,"compiler_crashes":1,"compiler_fails":0,"both_fail":45,"interpreter_fail_compiler_pass":1,"elapsed_ms":259603},"status":"keep","description":"Read keyed Iterator zip padding by key","timestamp":1778895582474,"segment":180,"confidence":10.117647058823529,"iterationTokens":6005,"asi":{"hypothesis":"Iterator.zipKeyed longest mode uses the padding object as a property bag keyed by the zipped keys, while Iterator.zip longest mode uses an iterable padding source.","result":"Iterator failures improved from 65 to 63; focused zipKeyed basic-longest passes in interpreter and checks passed.","remaining":"zipKeyed compiler still exposes generator result shape in focused output, and many zip/zipKeyed iteration/closing cases remain shared failures."}}
{"run":1786,"commit":"8bbd4be","metric":60,"metrics":{"compiler_test262_cases":500,"compiler_test262_pass":440,"compiler_test262_failures":60,"compiler_test262_compiler_errors":0,"compiler_test262_compiler_crashes":0,"compiler_test262_compiler_fails":0,"compiler_test262_both_fail":52,"compiler_test262_interpreter_fail_compiler_pass":1,"compatibility_pass":440,"compatibility_cases":500,"compiler_errors":0,"compiler_crashes":0,"compiler_fails":0,"both_fail":52,"interpreter_fail_compiler_pass":1,"elapsed_ms":184229},"status":"keep","description":"Honor shape accessors on writes and compiled reads","timestamp":1778896546972,"segment":180,"confidence":8.83673469387755,"iterationTokens":6005,"asi":{"hypothesis":"Shape-backed accessor properties must still invoke setters when frozen, and compiled shape reads must route through Get.get so accessor getters are called instead of returning raw accessor tuples. This should fix Iterator.prototype.constructor weird-setter without Iterator-specific assignment hacks.","result":"Iterator failures improved from 63 to 60; compiler crashes dropped to 0; focused Iterator.prototype.constructor weird-setter passes in both modes; checks passed.","remaining":"Further shape fast paths should preserve accessors explicitly before reintroducing raw tuple element reads."}}
{"run":1787,"commit":"8bbd4be","metric":66,"metrics":{"compiler_test262_cases":500,"compiler_test262_pass":434,"compiler_test262_failures":66,"compiler_test262_compiler_errors":0,"compiler_test262_compiler_crashes":6,"compiler_test262_compiler_fails":0,"compiler_test262_both_fail":47,"compiler_test262_interpreter_fail_compiler_pass":1,"compatibility_pass":434,"compatibility_cases":500,"compiler_errors":0,"compiler_crashes":6,"compiler_fails":0,"both_fail":47,"interpreter_fail_compiler_pass":1,"elapsed_ms":269217},"status":"discard","description":"Cache Iterator.from wrapper next methods","timestamp":1778897207582,"segment":180,"confidence":8.247619047619047,"iterationTokens":16505,"asi":{"hypothesis":"After shape accessor fixes removed compiler raw-accessor crashes, targeted Iterator.from wrapper next caching plus correct Symbol.keyFor for well-known symbols might clear get-next-only-once and return-method observation cases.","rollback_reason":"Primary regressed from 60 to 66 and compiler crashes rose to 6. Focused get-next-only-once passed, but return-method tests still failed on harness property-name formatting and broad workload regressed, matching the prior warning that wrapper next caching alone is unsafe.","next_action_hint":"Do not retry Iterator.from wrapper next caching unchanged. If revisiting, first fix the crash source or combine with a narrower condition; keep the Symbol.keyFor idea separate only if a non-regressing workload requires it."}}
{"run":1788,"commit":"8bbd4be","metric":65,"metrics":{"compiler_test262_cases":500,"compiler_test262_pass":435,"compiler_test262_failures":65,"compiler_test262_compiler_errors":0,"compiler_test262_compiler_crashes":3,"compiler_test262_compiler_fails":0,"compiler_test262_both_fail":56,"compiler_test262_interpreter_fail_compiler_pass":0,"compatibility_pass":435,"compatibility_cases":500,"compiler_errors":0,"compiler_crashes":3,"compiler_fails":0,"both_fail":56,"interpreter_fail_compiler_pass":0,"elapsed_ms":187410},"status":"discard","description":"Iterate Iterator.zip inputs through protocol","timestamp":1778897675482,"segment":180,"confidence":7.732142857142857,"iterationTokens":10986,"asi":{"hypothesis":"Iterator.zip should reject primitive/non-iterable outer inputs and collect input iterator records through the outer iterable protocol rather than Heap.to_list, while inner elements use GetIteratorFlattenable reject-primitives semantics.","rollback_reason":"Primary regressed from 60 to 65. Focused primitive/non-iterable outer cases passed, but basic-shortest and ordering tests exposed that eager collection and validation still do not match the required interleaved IteratorStepValue/GetIteratorFlattenable order and introduced compiler crashes.","next_action_hint":"Do not retry eager iterable_values!/zip_state collection unchanged. A future zip fix should build iterator records in the exact loop order with IteratorClose, or target a narrower primitive validation without changing array/basic behavior."}}
{"run":1789,"commit":"8bbd4be","metric":67,"metrics":{"compiler_test262_cases":500,"compiler_test262_pass":433,"compiler_test262_failures":67,"compiler_test262_compiler_errors":0,"compiler_test262_compiler_crashes":6,"compiler_test262_compiler_fails":0,"compiler_test262_both_fail":28,"compiler_test262_interpreter_fail_compiler_pass":1,"compatibility_pass":433,"compatibility_cases":500,"compiler_errors":0,"compiler_crashes":6,"compiler_fails":0,"both_fail":28,"interpreter_fail_compiler_pass":1,"elapsed_ms":403473},"status":"discard","description":"Expose Iterator in Test262 realms","timestamp":1778898523439,"segment":180,"confidence":7.277310924369748,"iterationTokens":25332,"asi":{"hypothesis":"Iterator proto-from-ctor-realm needs other.Iterator exposed in Test262 realms and Function-created newTarget realm intrinsics for Iterator default prototypes, analogous to prior Promise realm fixes.","rollback_reason":"Focused proto-from-ctor-realm passed in both modes, but the broad Iterator workload regressed from 60 to 67 and compiler crashes rose to 6, likely because exposing realm Iterator enabled additional helper/zip cases to run into existing generator crashes within the first 500 slice.","next_action_hint":"Do not land realm Iterator exposure alone while the active slice regresses. Revisit after generator-running/zip crash clusters are fixed, or validate on a realm-focused slice where the new exposure is not masking broader Iterator instability."}}
