{"run":807,"commit":"b9da385","metric":80,"metrics":{"compiler_test262_cases":2500,"compiler_test262_pass":2420,"compiler_test262_failures":80,"compiler_test262_compiler_errors":0,"compiler_test262_compiler_crashes":0,"compiler_test262_compiler_fails":2,"compiler_test262_both_fail":67,"compiler_test262_interpreter_fail_compiler_pass":8,"compatibility_pass":2420,"compatibility_cases":2500,"compiler_errors":0,"compiler_crashes":0,"compiler_fails":2,"both_fail":67,"interpreter_fail_compiler_pass":8,"elapsed_ms":202080},"status":"keep","description":"Avoid missing static fallback crashes","timestamp":1778144871144,"segment":33,"confidence":5.823529411764706,"iterationTokens":7104,"asi":{"hypothesis":"Registering modules for constructors should not make property lookup call missing static_property/1 functions for modules that only define prototype methods","improvement":"Reduced 2500-case Object failures from 84 to 80 by fixing Boolean/RegExp static fallback crashes in Object.create/defineProperties cases","next_action_hint":"Remaining failures are now semantic clusters rather than missing descriptor crashes; focus on Object.entries ordering and Object.fromEntries iterator semantics or proxy/freeze descriptor behavior."}}
{"run":808,"commit":"55d2aa4","metric":75,"metrics":{"compiler_test262_cases":2500,"compiler_test262_pass":2425,"compiler_test262_failures":75,"compiler_test262_compiler_errors":0,"compiler_test262_compiler_crashes":0,"compiler_test262_compiler_fails":2,"compiler_test262_both_fail":62,"compiler_test262_interpreter_fail_compiler_pass":8,"compatibility_pass":2425,"compatibility_cases":2500,"compiler_errors":0,"compiler_crashes":0,"compiler_fails":2,"both_fail":62,"interpreter_fail_compiler_pass":8,"elapsed_ms":202568},"status":"keep","description":"Tighten Object.fromEntries basics","timestamp":1778145368362,"segment":33,"confidence":5.777777777777778,"iterationTokens":11515,"asi":{"hypothesis":"Object.fromEntries should expose builtin length/constructability metadata, reject missing iterable arguments, preserve symbol keys, and create ordinary Object-prototype results","improvement":"Reduced 2500-case Object failures from 80 to 75 by fixing Object.fromEntries length/not-a-constructor/requires-argument/prototype/symbol basics","next_action_hint":"Continue Object.fromEntries iterator closing and ToPropertyKey/key-order semantics, or target Object.entries ordering/proxy clusters."}}
{"run":809,"commit":"ec5a75e","metric":74,"metrics":{"compiler_test262_cases":2500,"compiler_test262_pass":2426,"compiler_test262_failures":74,"compiler_test262_compiler_errors":0,"compiler_test262_compiler_crashes":0,"compiler_test262_compiler_fails":2,"compiler_test262_both_fail":61,"compiler_test262_interpreter_fail_compiler_pass":8,"compatibility_pass":2426,"compatibility_cases":2500,"compiler_errors":0,"compiler_crashes":0,"compiler_fails":2,"both_fail":61,"interpreter_fail_compiler_pass":8,"elapsed_ms":201270},"status":"keep","description":"Use string hint for fromEntries keys","timestamp":1778145738945,"segment":33,"confidence":5.526315789473684,"iterationTokens":6697,"asi":{"hypothesis":"Object.fromEntries should apply ToPropertyKey with string hint to object keys before creating properties","improvement":"Reduced 2500-case Object failures from 75 to 74 by fixing Object.fromEntries Symbol.toPrimitive key coercion","next_action_hint":"Continue fromEntries iterator-closing and key-order semantics, or switch to Object.entries ordering/proxy clusters."}}
{"run":810,"commit":"758bae0","metric":73,"metrics":{"compiler_test262_cases":2500,"compiler_test262_pass":2427,"compiler_test262_failures":73,"compiler_test262_compiler_errors":0,"compiler_test262_compiler_crashes":0,"compiler_test262_compiler_fails":2,"compiler_test262_both_fail":60,"compiler_test262_interpreter_fail_compiler_pass":8,"compatibility_pass":2427,"compatibility_cases":2500,"compiler_errors":0,"compiler_crashes":0,"compiler_fails":2,"both_fail":60,"interpreter_fail_compiler_pass":8,"elapsed_ms":201821},"status":"keep","description":"Preserve fromEntries property order","timestamp":1778146239640,"segment":33,"confidence":5.0476190476190474,"iterationTokens":7104,"asi":{"hypothesis":"Object.fromEntries result objects should preserve first-insertion string key order, and Object.getOwnPropertyNames should use the same descriptor key ordering as other own-key operations","improvement":"Reduced 2500-case Object failures from 74 to 73 by fixing Object.fromEntries key order","next_action_hint":"Remaining fromEntries failures are mostly iterator-closing/error propagation and string entry object handling; Object.entries ordering/proxy clusters are also promising."}}
{"run":811,"commit":"ddf8266","metric":70,"metrics":{"compiler_test262_cases":2500,"compiler_test262_pass":2430,"compiler_test262_failures":70,"compiler_test262_compiler_errors":0,"compiler_test262_compiler_crashes":0,"compiler_test262_compiler_fails":2,"compiler_test262_both_fail":57,"compiler_test262_interpreter_fail_compiler_pass":8,"compatibility_pass":2430,"compatibility_cases":2500,"compiler_errors":0,"compiler_crashes":0,"compiler_fails":2,"both_fail":57,"interpreter_fail_compiler_pass":8,"elapsed_ms":201184},"status":"keep","description":"Read wrapped string entries","timestamp":1778146777561,"segment":33,"confidence":5.190476190476191,"iterationTokens":6159,"asi":{"hypothesis":"String wrapper objects should expose indexed character properties, allowing Object.fromEntries to accept boxed string entry objects","improvement":"Reduced 2500-case Object failures from 73 to 70 by reading indexed properties from Object('ab') and new String('ab') entries","next_action_hint":"Remaining fromEntries failures are iterator closing/error propagation; other clusters include Object.entries ordering and freeze/proxy/symbol semantics."}}
{"run":812,"commit":"ef6562d","metric":65,"metrics":{"compiler_test262_cases":2500,"compiler_test262_pass":2435,"compiler_test262_failures":65,"compiler_test262_compiler_errors":0,"compiler_test262_compiler_crashes":0,"compiler_test262_compiler_fails":2,"compiler_test262_both_fail":52,"compiler_test262_interpreter_fail_compiler_pass":8,"compatibility_pass":2435,"compatibility_cases":2500,"compiler_errors":0,"compiler_crashes":0,"compiler_fails":2,"both_fail":52,"interpreter_fail_compiler_pass":8,"elapsed_ms":206274},"status":"keep","description":"Close fromEntries iterators on entry errors","timestamp":1778147182696,"segment":33,"confidence":5.428571428571429,"iterationTokens":3914,"asi":{"hypothesis":"Object.fromEntries should consume iterators incrementally and call iterator.return when entry validation/key/value access throws","improvement":"Reduced 2500-case Object failures from 70 to 65 by fixing fromEntries iterator closing for null/string entries and throwing key/value accessors plus evaluation order","next_action_hint":"Remaining fromEntries failures likely include key toString error closing and uses-keys-not-iterator; otherwise prioritize Object.entries proxy/order cluster or freeze/proxy semantics."}}
{"run":813,"commit":"ef6562d","metric":65,"metrics":{"compiler_test262_cases":2500,"compiler_test262_pass":2435,"compiler_test262_failures":65,"compiler_test262_compiler_errors":0,"compiler_test262_compiler_crashes":0,"compiler_test262_compiler_fails":2,"compiler_test262_both_fail":52,"compiler_test262_interpreter_fail_compiler_pass":8,"compatibility_pass":2435,"compatibility_cases":2500,"compiler_errors":0,"compiler_crashes":0,"compiler_fails":2,"both_fail":52,"interpreter_fail_compiler_pass":8,"elapsed_ms":392475},"status":"discard","description":"Prioritize fromEntries key coercion errors","timestamp":1778147852391,"segment":33,"confidence":6.909090909090909,"iterationTokens":3852,"asi":{"hypothesis":"Object.fromEntries should coerce entry key before reading entry value so key toString errors close the iterator and propagate before missing-value TypeErrors","rollback_reason":"Focused key-toString iterator-closing case passed, but the 2500-case primary metric stayed flat at 65 and runtime nearly doubled, indicating a regression or expensive broad path elsewhere","next_action_hint":"Do not keep this broad refactor. If retrying, preserve the incremental iterator close path but avoid changing list/fast entry processing or profile the slowdown first."}}
{"run":814,"commit":"42d2816","metric":64,"metrics":{"compiler_test262_cases":2500,"compiler_test262_pass":2436,"compiler_test262_failures":64,"compiler_test262_compiler_errors":0,"compiler_test262_compiler_crashes":0,"compiler_test262_compiler_fails":2,"compiler_test262_both_fail":51,"compiler_test262_interpreter_fail_compiler_pass":8,"compatibility_pass":2436,"compatibility_cases":2500,"compiler_errors":0,"compiler_crashes":0,"compiler_fails":2,"both_fail":51,"interpreter_fail_compiler_pass":8,"elapsed_ms":211213},"status":"keep","description":"Propagate fromEntries key coercion errors","timestamp":1778148226928,"segment":33,"confidence":7.1875,"iterationTokens":4261,"asi":{"hypothesis":"When an Object.fromEntries entry lacks value index 1, key ToPropertyKey coercion still happens first and its abrupt completion should close the iterator and propagate","improvement":"Reduced 2500-case Object failures from 65 to 64 by fixing fromEntries key toString error propagation and iterator closing without the broader slow refactor","next_action_hint":"Object.fromEntries cluster is mostly exhausted in first 2500 slice; focus next on Object.entries ordering/proxy/primitive strings or freeze/proxy/symbol behavior."}}
{"run":815,"commit":"e53187f","metric":63,"metrics":{"compiler_test262_cases":2500,"compiler_test262_pass":2437,"compiler_test262_failures":63,"compiler_test262_compiler_errors":0,"compiler_test262_compiler_crashes":0,"compiler_test262_compiler_fails":2,"compiler_test262_both_fail":50,"compiler_test262_interpreter_fail_compiler_pass":8,"compatibility_pass":2437,"compatibility_cases":2500,"compiler_errors":0,"compiler_crashes":0,"compiler_fails":2,"both_fail":50,"interpreter_fail_compiler_pass":8,"elapsed_ms":229993},"status":"keep","description":"Support Object.entries on strings","timestamp":1778148984874,"segment":33,"confidence":6.823529411764706,"iterationTokens":12565,"asi":{"hypothesis":"Object.entries should coerce string primitives to string wrapper-like enumerable index entries","improvement":"Reduced 2500-case Object failures from 64 to 63 by returning index/value pairs for primitive strings","next_action_hint":"Continue Object.entries ordering/proxy behavior or move to Object.freeze/proxy and defineProperty descriptor edge cases."}}
{"run":816,"commit":"06b870b","metric":61,"metrics":{"compiler_test262_cases":2500,"compiler_test262_pass":2439,"compiler_test262_failures":61,"compiler_test262_compiler_errors":0,"compiler_test262_compiler_crashes":0,"compiler_test262_compiler_fails":2,"compiler_test262_both_fail":48,"compiler_test262_interpreter_fail_compiler_pass":8,"compatibility_pass":2439,"compatibility_cases":2500,"compiler_errors":0,"compiler_crashes":0,"compiler_fails":2,"both_fail":48,"interpreter_fail_compiler_pass":8,"elapsed_ms":206994},"status":"keep","description":"Interleave Object.entries descriptors and values","timestamp":1778149370221,"segment":33,"confidence":7.375,"iterationTokens":2619,"asi":{"hypothesis":"Object.entries should snapshot own keys, then for each key check the current descriptor/enumerability and get the value before moving to the next key","improvement":"Reduced 2500-case Object failures from 63 to 61 by fixing proxy observable order and getters that alter future key enumerability/deletion","next_action_hint":"Object.entries return-order remains; inspect key insertion/order semantics around delete/re-add and defineProperty during enumeration."}}
{"run":817,"commit":"5513fec","metric":60,"metrics":{"compiler_test262_cases":2500,"compiler_test262_pass":2440,"compiler_test262_failures":60,"compiler_test262_compiler_errors":0,"compiler_test262_compiler_crashes":0,"compiler_test262_compiler_fails":2,"compiler_test262_both_fail":47,"compiler_test262_interpreter_fail_compiler_pass":8,"compatibility_pass":2440,"compatibility_cases":2500,"compiler_errors":0,"compiler_crashes":0,"compiler_fails":2,"both_fail":47,"interpreter_fail_compiler_pass":8,"elapsed_ms":208939},"status":"keep","description":"Update key order on property deletion","timestamp":1778149793281,"segment":33,"confidence":7.67741935483871,"iterationTokens":4004,"asi":{"hypothesis":"Deleting an own string property should remove it from insertion-order metadata so re-adding it moves it to the end of the string-key order","improvement":"Reduced 2500-case Object failures from 61 to 60 by fixing Object.entries return-order after delete and re-add","next_action_hint":"Object.entries cluster is mostly reduced; remaining high-value clusters are defineProperty descriptor/prototype semantics and Object.freeze/proxy/symbol behavior."}}
{"run":818,"commit":"fd393df","metric":59,"metrics":{"compiler_test262_cases":2500,"compiler_test262_pass":2441,"compiler_test262_failures":59,"compiler_test262_compiler_errors":0,"compiler_test262_compiler_crashes":0,"compiler_test262_compiler_fails":2,"compiler_test262_both_fail":46,"compiler_test262_interpreter_fail_compiler_pass":8,"compatibility_pass":2441,"compatibility_cases":2500,"compiler_errors":0,"compiler_crashes":0,"compiler_fails":2,"both_fail":46,"interpreter_fail_compiler_pass":8,"elapsed_ms":228291},"status":"keep","description":"Omit symbols from Object.entries","timestamp":1778150210066,"segment":33,"confidence":8.571428571428571,"iterationTokens":3262,"asi":{"hypothesis":"Object.entries should only include own enumerable string-keyed properties and omit enumerable symbol keys","improvement":"Reduced 2500-case Object failures from 60 to 59 by filtering symbol keys from Object.entries","next_action_hint":"Remaining Object.entries failures are function-property descriptor/order and compiler-only global tamper; then focus defineProperty/freeze clusters."}}
{"run":819,"commit":"c88dafe","metric":44,"metrics":{"compiler_test262_cases":2500,"compiler_test262_pass":2456,"compiler_test262_failures":44,"compiler_test262_compiler_errors":0,"compiler_test262_compiler_crashes":0,"compiler_test262_compiler_fails":2,"compiler_test262_both_fail":31,"compiler_test262_interpreter_fail_compiler_pass":8,"compatibility_pass":2456,"compatibility_cases":2500,"compiler_errors":0,"compiler_crashes":0,"compiler_fails":2,"both_fail":31,"interpreter_fail_compiler_pass":8,"elapsed_ms":226417},"status":"keep","description":"Detect module static own properties","timestamp":1778150695211,"segment":33,"confidence":9.642857142857142,"iterationTokens":3262,"asi":{"hypothesis":"Own-property presence for builtin constructors should include module-declared static methods, not only explicitly stored ctor statics","improvement":"Reduced 2500-case Object failures from 59 to 44, but this broad run was more than needed after focused validation","next_action_hint":"User noted too many broad reruns. Next iterations should batch focused probes and only run full autoresearch after multiple focused fixes or uncertainty, unless a single change is high-risk."}}
{"run":820,"commit":"357bd18","metric":40,"metrics":{"compiler_test262_cases":2500,"compiler_test262_pass":2460,"compiler_test262_failures":40,"compiler_test262_compiler_errors":0,"compiler_test262_compiler_crashes":0,"compiler_test262_compiler_fails":2,"compiler_test262_both_fail":27,"compiler_test262_interpreter_fail_compiler_pass":8,"compatibility_pass":2460,"compatibility_cases":2500,"compiler_errors":0,"compiler_crashes":0,"compiler_fails":2,"both_fail":27,"interpreter_fail_compiler_pass":8,"elapsed_ms":217979},"status":"keep","description":"Batch callable entries and freeze metadata fixes","timestamp":1778151591267,"segment":33,"confidence":9.928571428571429,"iterationTokens":3262,"asi":{"hypothesis":"Batching focused semantic fixes should reduce Object failures without excessive full reruns: Object.entries must handle callable own keys/descriptor attrs, Object.freeze must reject failed proxy preventExtensions, and Object freeze/seal predicates must be non-constructors","improvement":"Reduced 2500-case Object failures from 44 to 40 after focused probes for entries order-after-define-property-with-function, freeze throws-when-false, and freeze not-a-constructor","next_action_hint":"Continue batching focused probes before the next full run. Remaining failures are now mainly defineProperty descriptor/arguments/symbol cases, freeze proxy/symbol/seal cases, typed-array resizable-buffer crashes, and two compiler-fail entries/global cases."}}
{"run":821,"commit":"357bd18","metric":42,"metrics":{"compiler_test262_cases":2500,"compiler_test262_pass":2458,"compiler_test262_failures":42,"compiler_test262_compiler_errors":0,"compiler_test262_compiler_crashes":0,"compiler_test262_compiler_fails":2,"compiler_test262_both_fail":29,"compiler_test262_interpreter_fail_compiler_pass":8,"compatibility_pass":2458,"compatibility_cases":2500,"compiler_errors":0,"compiler_crashes":0,"compiler_fails":2,"both_fail":29,"interpreter_fail_compiler_pass":8,"elapsed_ms":241265},"status":"discard","description":"Route Object.freeze through descriptor definitions","timestamp":1778152136520,"segment":33,"confidence":9.928571428571429,"iterationTokens":10773,"asi":{"hypothesis":"Using DefinePropertyOrThrow-shaped descriptor updates for freeze should fix proxy defineProperty observability and callable property freezing","rollback_reason":"Despite focused passes for proxy-with-defineProperty-handler and function property freezing, broad Object failures regressed from 40 to 42 and runtime increased; ordinary array/object freeze interactions still fail","next_action_hint":"Do not retry this broad freeze refactor unchanged. If revisiting, split callable freeze support from proxy DefineProperty behavior and first fix Define.property compatibility for reducing writable true->false on non-configurable or array length edge cases."}}
{"run":822,"commit":"eb2af51","metric":39,"metrics":{"compiler_test262_cases":2500,"compiler_test262_pass":2461,"compiler_test262_failures":39,"compiler_test262_compiler_errors":0,"compiler_test262_compiler_crashes":0,"compiler_test262_compiler_fails":2,"compiler_test262_both_fail":26,"compiler_test262_interpreter_fail_compiler_pass":8,"compatibility_pass":2461,"compatibility_cases":2500,"compiler_errors":0,"compiler_crashes":0,"compiler_fails":2,"both_fail":26,"interpreter_fail_compiler_pass":8,"elapsed_ms":230985},"status":"keep","description":"Describe wrapped string indexes","timestamp":1778152690849,"segment":33,"confidence":10,"iterationTokens":15570,"asi":{"hypothesis":"String wrapper objects should synthesize own indexed data descriptors for Object.getOwnPropertyDescriptor, with non-writable enumerable non-configurable character values","improvement":"Reduced 2500-case Object failures from 40 to 39 by fixing getOwnPropertyDescriptor on new String indexed properties","next_action_hint":"Continue with focused probes and batch before next full run. Remaining clusters: array length boundary defineProperty/defineProperties, defineProperty arguments/symbol cases, freeze proxy/symbol/array cases, typed-array resizable-buffer crashes, compiler-fail tamper/global cases."}}
{"run":823,"commit":"ace5605","metric":32,"metrics":{"compiler_test262_cases":2500,"compiler_test262_pass":2468,"compiler_test262_failures":32,"compiler_test262_compiler_errors":0,"compiler_test262_compiler_crashes":0,"compiler_test262_compiler_fails":2,"compiler_test262_both_fail":22,"compiler_test262_interpreter_fail_compiler_pass":5,"compatibility_pass":2468,"compatibility_cases":2500,"compiler_errors":0,"compiler_crashes":0,"compiler_fails":2,"both_fail":22,"interpreter_fail_compiler_pass":5,"elapsed_ms":207372},"status":"keep","description":"Batch array length and symbol property fixes","timestamp":1778153131478,"segment":33,"confidence":8.166666666666666,"iterationTokens":12771,"asi":{"hypothesis":"Array length bytecode reads should observe virtual huge lengths stored by array descriptor updates, and the interpreter in-operator should preserve symbol property keys instead of stringifying them","improvement":"Reduced 2500-case Object failures from 39 to 32 by fixing array length boundary defineProperty/defineProperties cases and interpreter symbol-key in-operator cases","next_action_hint":"Continue focused batching. Remaining clusters include defineProperty arguments aliasing/getter-only strict writes/getterless inherited descriptors, freeze proxy/symbol/array cases, typed-array resizable-buffer crashes, and two compiler-fail global/tamper cases."}}
{"run":824,"commit":"ace5605","metric":0,"metrics":{"compiler_test262_cases":2500,"compiler_test262_pass":0,"compiler_test262_failures":2500,"compiler_test262_compiler_errors":0,"compiler_test262_compiler_crashes":0,"compiler_test262_compiler_fails":0,"compiler_test262_both_fail":0,"compiler_test262_interpreter_fail_compiler_pass":0,"compatibility_pass":0,"compatibility_cases":2500,"compiler_errors":0,"compiler_crashes":0,"compiler_fails":0,"both_fail":0,"interpreter_fail_compiler_pass":0,"elapsed_ms":650000},"status":"crash","description":"Prototype setter batch caused broad Object run to hang","timestamp":1778154042627,"segment":33,"confidence":8.166666666666666,"iterationTokens":12771,"asi":{"hypothesis":"Array and callable writes should route through inherited prototype setters/getter-only blockers to fix remaining defineProperty prototype accessor cases","rollback_reason":"The broad 2500-case Object run exceeded 8 minutes and had to be killed, so the change is too slow or may have introduced a hang despite focused passes","next_action_hint":"Do not run full broad benchmark for prototype-write changes without a small timeout-bounded slice first. Revisit with per-case profiling or narrower callable-only/array-only variants."}}
