{"run":1191,"commit":"cafaf70","metric":36,"metrics":{"compiler_test262_cases":350,"compiler_test262_pass":314,"compiler_test262_failures":36,"compiler_test262_compiler_errors":0,"compiler_test262_compiler_crashes":0,"compiler_test262_compiler_fails":3,"compiler_test262_both_fail":31,"compiler_test262_interpreter_fail_compiler_pass":0,"compatibility_pass":314,"compatibility_cases":350,"compiler_errors":0,"compiler_crashes":0,"compiler_fails":3,"both_fail":31,"interpreter_fail_compiler_pass":0,"elapsed_ms":15039},"status":"discard","description":"Enumerate virtual string indices for Object.keys","timestamp":1778671860490,"segment":57,"confidence":6.8,"iterationTokens":5436,"asi":{"hypothesis":"Object.keys should include enumerable virtual string indices for boxed String objects so propertyHelper sees indexed string descriptors as enumerable.","rollback_reason":"The broad String workload stayed flat at 36 failures and focused numeric-properties still reported the indexed descriptor as non-enumerable via propertyHelper, so the change did not reach the actual enumeration path used by Object.keys/verifyEnumerable.","next_action_hint":"Inspect Object.keys/OwnProperty.descriptor_keys dispatch for constructed String wrappers and shape-backed wrapped objects before retrying virtual string index enumeration; do not retry only map enumerable_key_pairs unchanged."}}
{"run":1192,"commit":"5dce3ea","metric":31,"metrics":{"compiler_test262_cases":350,"compiler_test262_pass":319,"compiler_test262_failures":31,"compiler_test262_compiler_errors":0,"compiler_test262_compiler_crashes":0,"compiler_test262_compiler_fails":3,"compiler_test262_both_fail":28,"compiler_test262_interpreter_fail_compiler_pass":0,"compatibility_pass":319,"compatibility_cases":350,"compiler_errors":0,"compiler_crashes":0,"compiler_fails":3,"both_fail":28,"interpreter_fail_compiler_pass":0,"elapsed_ms":15058},"status":"keep","description":"Use UTF-16 string code units","timestamp":1778672258008,"segment":57,"confidence":11,"iterationTokens":7153,"asi":{"hypothesis":"String character operations should operate on JavaScript UTF-16 code units, including WTF-8 encoded lone surrogates, so codePointAt does not crash on surrogate test cases and handles Infinity/out-of-range positions correctly."}}
{"run":1193,"commit":"5dce3ea","metric":31,"metrics":{"compiler_test262_cases":350,"compiler_test262_pass":319,"compiler_test262_failures":31,"compiler_test262_compiler_errors":0,"compiler_test262_compiler_crashes":0,"compiler_test262_compiler_fails":3,"compiler_test262_both_fail":28,"compiler_test262_interpreter_fail_compiler_pass":0,"compatibility_pass":319,"compatibility_cases":350,"compiler_errors":0,"compiler_crashes":0,"compiler_fails":3,"both_fail":28,"interpreter_fail_compiler_pass":0,"elapsed_ms":16812},"status":"discard","description":"Detect lone surrogate well-formedness","timestamp":1778672462482,"segment":57,"confidence":7.333333333333333,"iterationTokens":1661,"asi":{"hypothesis":"String.prototype.isWellFormed should inspect UTF-16 code units and report unpaired surrogates as not well-formed.","rollback_reason":"The broad String workload stayed flat at 31 failures and the focused returns-boolean case still failed on a surrogate pair sliced to a leading surrogate, indicating the remaining issue is slice/substring preserving UTF-16 code-unit boundaries rather than only isWellFormed detection.","next_action_hint":"Before retrying isWellFormed, inspect String.prototype.slice/substring UTF-16 behavior for surrogate-pair half slices and ensure lone surrogate code units survive into isWellFormed."}}
{"run":1194,"commit":"2409c6e","metric":29,"metrics":{"compiler_test262_cases":350,"compiler_test262_pass":321,"compiler_test262_failures":29,"compiler_test262_compiler_errors":0,"compiler_test262_compiler_crashes":0,"compiler_test262_compiler_fails":3,"compiler_test262_both_fail":26,"compiler_test262_interpreter_fail_compiler_pass":0,"compatibility_pass":321,"compatibility_cases":350,"compiler_errors":0,"compiler_crashes":0,"compiler_fails":3,"both_fail":26,"interpreter_fail_compiler_pass":0,"elapsed_ms":15361},"status":"keep","description":"Honor Symbol.match in string search","timestamp":1778672772129,"segment":57,"confidence":6,"iterationTokens":5998,"asi":{"hypothesis":"String.prototype.includes/endsWith should implement IsRegExp by reading @@match through Get and honoring falsey overrides before rejecting regular-expression search strings."}}
{"run":1195,"commit":"66452de","metric":27,"metrics":{"compiler_test262_cases":350,"compiler_test262_pass":323,"compiler_test262_failures":27,"compiler_test262_compiler_errors":0,"compiler_test262_compiler_crashes":0,"compiler_test262_compiler_fails":3,"compiler_test262_both_fail":24,"compiler_test262_interpreter_fail_compiler_pass":0,"compatibility_pass":323,"compatibility_cases":350,"compiler_errors":0,"compiler_crashes":0,"compiler_fails":3,"both_fail":24,"interpreter_fail_compiler_pass":0,"elapsed_ms":15564},"status":"keep","description":"Reject symbol string search values","timestamp":1778673034314,"segment":57,"confidence":5.2,"iterationTokens":8825,"asi":{"hypothesis":"String search methods should use ToString search-string semantics that reject Symbol values, rather than generic String() conversion that formats symbols."}}
{"run":1196,"commit":"937d973","metric":24,"metrics":{"compiler_test262_cases":350,"compiler_test262_pass":326,"compiler_test262_failures":24,"compiler_test262_compiler_errors":0,"compiler_test262_compiler_crashes":0,"compiler_test262_compiler_fails":3,"compiler_test262_both_fail":21,"compiler_test262_interpreter_fail_compiler_pass":0,"compatibility_pass":326,"compatibility_cases":350,"compiler_errors":0,"compiler_crashes":0,"compiler_fails":3,"both_fail":21,"interpreter_fail_compiler_pass":0,"elapsed_ms":14051},"status":"keep","description":"Preserve primitive this for builtins","timestamp":1778673370229,"segment":57,"confidence":5.8,"iterationTokens":17851,"asi":{"hypothesis":"Function.prototype.call/apply should not apply non-strict user-function this boxing before invoking builtins; builtins perform their own receiver coercion and must see primitive Symbol receivers so String methods throw where ToString(Symbol) is abrupt."}}
{"run":1197,"commit":"62a5262","metric":23,"metrics":{"compiler_test262_cases":350,"compiler_test262_pass":327,"compiler_test262_failures":23,"compiler_test262_compiler_errors":0,"compiler_test262_compiler_crashes":0,"compiler_test262_compiler_fails":3,"compiler_test262_both_fail":20,"compiler_test262_interpreter_fail_compiler_pass":0,"compatibility_pass":327,"compatibility_cases":350,"compiler_errors":0,"compiler_crashes":0,"compiler_fails":3,"both_fail":20,"interpreter_fail_compiler_pass":0,"elapsed_ms":17894},"status":"keep","description":"Validate string iterator receivers","timestamp":1778673568319,"segment":57,"confidence":6,"iterationTokens":5499,"asi":{"hypothesis":"String.prototype[Symbol.iterator] should use normal string receiver coercion so null, undefined, and Symbol receivers throw instead of being silently stringified."}}
{"run":1198,"commit":"39733d5","metric":22,"metrics":{"compiler_test262_cases":350,"compiler_test262_pass":328,"compiler_test262_failures":22,"compiler_test262_compiler_errors":0,"compiler_test262_compiler_crashes":0,"compiler_test262_compiler_fails":3,"compiler_test262_both_fail":19,"compiler_test262_interpreter_fail_compiler_pass":0,"compatibility_pass":328,"compatibility_cases":350,"compiler_errors":0,"compiler_crashes":0,"compiler_fails":3,"both_fail":19,"interpreter_fail_compiler_pass":0,"elapsed_ms":14786},"status":"keep","description":"Mark string iterator non-constructable","timestamp":1778673793948,"segment":57,"confidence":6.2,"iterationTokens":9339,"asi":{"hypothesis":"String.prototype[Symbol.iterator] builtin metadata should mark the function as non-constructable, matching built-in function constructability checks."}}
{"run":1199,"commit":"39733d5","metric":22,"metrics":{"compiler_test262_cases":350,"compiler_test262_pass":328,"compiler_test262_failures":22,"compiler_test262_compiler_errors":0,"compiler_test262_compiler_crashes":0,"compiler_test262_compiler_fails":3,"compiler_test262_both_fail":19,"compiler_test262_interpreter_fail_compiler_pass":0,"compatibility_pass":328,"compatibility_cases":350,"compiler_errors":0,"compiler_crashes":0,"compiler_fails":3,"both_fail":19,"interpreter_fail_compiler_pass":0,"elapsed_ms":14092},"status":"discard","description":"Use integer coercion for string search positions","timestamp":1778673995305,"segment":57,"confidence":4.769230769230769,"iterationTokens":1996,"asi":{"hypothesis":"String indexOf/lastIndexOf position arguments should use ToInteger-style coercion so BigInt positions throw instead of being converted through Number().","rollback_reason":"Focused indexOf BigInt passed, but the broad String workload stayed flat at 22 failures because this case is outside or offset by no net improvement in the bounded slice.","next_action_hint":"Do not retry only the indexOf/lastIndexOf position coercion change unchanged. If revisiting, batch with the broader remaining String search ToString/ToPrimitive fixes so the primary metric improves."}}
{"run":1200,"commit":"1c41039","metric":19,"metrics":{"compiler_test262_cases":350,"compiler_test262_pass":331,"compiler_test262_failures":19,"compiler_test262_compiler_errors":0,"compiler_test262_compiler_crashes":0,"compiler_test262_compiler_fails":0,"compiler_test262_both_fail":19,"compiler_test262_interpreter_fail_compiler_pass":0,"compatibility_pass":331,"compatibility_cases":350,"compiler_errors":0,"compiler_crashes":0,"compiler_fails":0,"both_fail":19,"interpreter_fail_compiler_pass":0,"elapsed_ms":14377},"status":"keep","description":"Preserve shaped string virtual writes","timestamp":1778674293047,"segment":57,"confidence":4.857142857142857,"iterationTokens":7655,"asi":{"hypothesis":"Compiled String wrapper objects can be shape-backed; writes to virtual String length and indexed properties should be ignored there just like map-backed wrapped strings, preserving non-writable descriptor semantics and removing compiler-only String failures."}}
{"run":1201,"commit":"1903334","metric":18,"metrics":{"compiler_test262_cases":350,"compiler_test262_pass":332,"compiler_test262_failures":18,"compiler_test262_compiler_errors":0,"compiler_test262_compiler_crashes":0,"compiler_test262_compiler_fails":0,"compiler_test262_both_fail":18,"compiler_test262_interpreter_fail_compiler_pass":0,"compatibility_pass":332,"compatibility_cases":350,"compiler_errors":0,"compiler_crashes":0,"compiler_fails":0,"both_fail":18,"interpreter_fail_compiler_pass":0,"elapsed_ms":14185},"status":"keep","description":"Enumerate virtual string indices","timestamp":1778674621194,"segment":57,"confidence":4.666666666666667,"iterationTokens":8802,"asi":{"hypothesis":"for-in enumeration should include virtual UTF-16 string indices for map-backed and shape-backed String exotic objects so propertyHelper observes indexed string descriptors as enumerable."}}
{"run":1202,"commit":"d97a0e0","metric":17,"metrics":{"compiler_test262_cases":350,"compiler_test262_pass":333,"compiler_test262_failures":17,"compiler_test262_compiler_errors":0,"compiler_test262_compiler_crashes":0,"compiler_test262_compiler_fails":0,"compiler_test262_both_fail":17,"compiler_test262_interpreter_fail_compiler_pass":0,"compatibility_pass":333,"compatibility_cases":350,"compiler_errors":0,"compiler_crashes":0,"compiler_fails":0,"both_fail":17,"interpreter_fail_compiler_pass":0,"elapsed_ms":14075},"status":"keep","description":"Use realm String prototypes for construction","timestamp":1778674861938,"segment":57,"confidence":4.5,"iterationTokens":5860,"asi":{"hypothesis":"Reflect.construct(String, args, newTarget) should fall back to the newTarget realm's String.prototype when newTarget.prototype is not an object, matching OrdinaryCreateFromConstructor for String wrappers."}}
{"run":1203,"commit":"c3b08d1","metric":16,"metrics":{"compiler_test262_cases":350,"compiler_test262_pass":334,"compiler_test262_failures":16,"compiler_test262_compiler_errors":0,"compiler_test262_compiler_crashes":0,"compiler_test262_compiler_fails":0,"compiler_test262_both_fail":16,"compiler_test262_interpreter_fail_compiler_pass":0,"compatibility_pass":334,"compatibility_cases":350,"compiler_errors":0,"compiler_crashes":0,"compiler_fails":0,"both_fail":16,"interpreter_fail_compiler_pass":0,"elapsed_ms":15099},"status":"keep","description":"Return UTF-16 units from String.at","timestamp":1778675091154,"segment":57,"confidence":4.625,"iterationTokens":5011,"asi":{"hypothesis":"String.prototype.at should index JavaScript UTF-16 code units rather than Unicode scalar codepoints, returning lone surrogate code-unit strings for surrogate pairs."}}
{"run":1204,"commit":"5b7e3f8","metric":14,"metrics":{"compiler_test262_cases":350,"compiler_test262_pass":336,"compiler_test262_failures":14,"compiler_test262_compiler_errors":0,"compiler_test262_compiler_crashes":0,"compiler_test262_compiler_fails":0,"compiler_test262_both_fail":14,"compiler_test262_interpreter_fail_compiler_pass":0,"compatibility_pass":336,"compatibility_cases":350,"compiler_errors":0,"compiler_crashes":0,"compiler_fails":0,"both_fail":14,"interpreter_fail_compiler_pass":0,"elapsed_ms":14551},"status":"keep","description":"Store RegExp accessor descriptors","timestamp":1778675471786,"segment":57,"confidence":4.875,"iterationTokens":8400,"asi":{"hypothesis":"Object.defineProperty on RegExp instances should store accessor descriptors, and string search IsRegExp should invoke an own @@match accessor before falling back to built-in RegExp rejection."}}
{"run":1205,"commit":"56bb01b","metric":12,"metrics":{"compiler_test262_cases":350,"compiler_test262_pass":338,"compiler_test262_failures":12,"compiler_test262_compiler_errors":0,"compiler_test262_compiler_crashes":0,"compiler_test262_compiler_fails":0,"compiler_test262_both_fail":12,"compiler_test262_interpreter_fail_compiler_pass":0,"compatibility_pass":338,"compatibility_cases":350,"compiler_errors":0,"compiler_crashes":0,"compiler_fails":0,"both_fail":12,"interpreter_fail_compiler_pass":0,"elapsed_ms":13184},"status":"keep","description":"Reject Symbol ToString in search","timestamp":1778675687240,"segment":57,"confidence":4.555555555555555,"iterationTokens":4735,"asi":{"hypothesis":"String search-string coercion should perform ToPrimitive with string hint and reject Symbol primitives returned directly or from wrappers, instead of using generic String() formatting for symbols."}}
{"run":1206,"commit":"d7832ee","metric":10,"metrics":{"compiler_test262_cases":350,"compiler_test262_pass":340,"compiler_test262_failures":10,"compiler_test262_compiler_errors":0,"compiler_test262_compiler_crashes":0,"compiler_test262_compiler_fails":0,"compiler_test262_both_fail":10,"compiler_test262_interpreter_fail_compiler_pass":0,"compatibility_pass":340,"compatibility_cases":350,"compiler_errors":0,"compiler_crashes":0,"compiler_fails":0,"both_fail":10,"interpreter_fail_compiler_pass":0,"elapsed_ms":13337},"status":"keep","description":"Preserve null object prototypes","timestamp":1778677943590,"segment":57,"confidence":4.777777777777778,"iterationTokens":4735,"asi":{"hypothesis":"Object.create(null) must preserve a distinct null prototype instead of falling through to Object.prototype; ToPrimitive on null-prototype objects should fail when no own coercion methods exist."}}
{"run":1207,"commit":"0afcb7e","metric":9,"metrics":{"compiler_test262_cases":350,"compiler_test262_pass":341,"compiler_test262_failures":9,"compiler_test262_compiler_errors":0,"compiler_test262_compiler_crashes":0,"compiler_test262_compiler_fails":0,"compiler_test262_both_fail":9,"compiler_test262_interpreter_fail_compiler_pass":0,"compatibility_pass":341,"compatibility_cases":350,"compiler_errors":0,"compiler_crashes":0,"compiler_fails":0,"both_fail":9,"interpreter_fail_compiler_pass":0,"elapsed_ms":13209},"status":"keep","description":"Use UTF-16 string slicing","timestamp":1778678344222,"segment":57,"confidence":4.4,"iterationTokens":13308,"asi":{"hypothesis":"String slice/substring/substr should operate on JavaScript UTF-16 code-unit positions, clamp substring endpoints before swapping, and preserve lone surrogate halves when slicing."}}
{"run":1208,"commit":"d17cc62","metric":8,"metrics":{"compiler_test262_cases":350,"compiler_test262_pass":342,"compiler_test262_failures":8,"compiler_test262_compiler_errors":0,"compiler_test262_compiler_crashes":0,"compiler_test262_compiler_fails":0,"compiler_test262_both_fail":8,"compiler_test262_interpreter_fail_compiler_pass":0,"compatibility_pass":342,"compatibility_cases":350,"compiler_errors":0,"compiler_crashes":0,"compiler_fails":0,"both_fail":8,"interpreter_fail_compiler_pass":0,"elapsed_ms":13202},"status":"keep","description":"Detect lone UTF-16 surrogates","timestamp":1778678529812,"segment":57,"confidence":4.5,"iterationTokens":1880,"asi":{"hypothesis":"String.prototype.isWellFormed should scan UTF-16 code units, accepting valid high/low surrogate pairs and rejecting lone or wrong-ordered surrogate halves, including halves preserved by UTF-16 slicing."}}
{"run":1209,"commit":"d17cc62","metric":8,"metrics":{"compiler_test262_cases":350,"compiler_test262_pass":342,"compiler_test262_failures":8,"compiler_test262_compiler_errors":0,"compiler_test262_compiler_crashes":0,"compiler_test262_compiler_fails":0,"compiler_test262_both_fail":8,"compiler_test262_interpreter_fail_compiler_pass":0,"compatibility_pass":342,"compatibility_cases":350,"compiler_errors":0,"compiler_crashes":0,"compiler_fails":0,"both_fail":8,"interpreter_fail_compiler_pass":0,"elapsed_ms":13302},"status":"discard","description":"Use ToInteger for indexOf positions","timestamp":1778678739615,"segment":57,"confidence":4.285714285714286,"iterationTokens":3867,"asi":{"hypothesis":"indexOf position coercion should use ToIntegerOrInfinity so BigInt positions throw and infinities clamp correctly.","rollback_reason":"Focused BigInt position passed, but the bounded String workload stayed flat at 8 failures, so the primary metric did not improve.","next_action_hint":"Only retry indexOf position coercion if paired with fixes for the remaining object ToPrimitive position/wrapped-value cases so the broad metric improves."}}
{"run":1210,"commit":"8e409f6","metric":7,"metrics":{"compiler_test262_cases":350,"compiler_test262_pass":343,"compiler_test262_failures":7,"compiler_test262_compiler_errors":0,"compiler_test262_compiler_crashes":0,"compiler_test262_compiler_fails":0,"compiler_test262_both_fail":7,"compiler_test262_interpreter_fail_compiler_pass":0,"compatibility_pass":343,"compatibility_cases":350,"compiler_errors":0,"compiler_crashes":0,"compiler_fails":0,"both_fail":7,"interpreter_fail_compiler_pass":0,"elapsed_ms":13332},"status":"keep","description":"Honor String prototype tombstones","timestamp":1778678998974,"segment":57,"confidence":4.181818181818182,"iterationTokens":6245,"asi":{"hypothesis":"Deleting String.prototype methods should leave a tombstone observed by boxed and primitive string property lookup, so instances fall through to Object.prototype instead of resurrecting virtual String builtins."}}
{"run":1211,"commit":"83e96cb","metric":6,"metrics":{"compiler_test262_cases":350,"compiler_test262_pass":344,"compiler_test262_failures":6,"compiler_test262_compiler_errors":0,"compiler_test262_compiler_crashes":0,"compiler_test262_compiler_fails":0,"compiler_test262_both_fail":6,"compiler_test262_interpreter_fail_compiler_pass":0,"compatibility_pass":344,"compatibility_cases":350,"compiler_errors":0,"compiler_crashes":0,"compiler_fails":0,"both_fail":6,"interpreter_fail_compiler_pass":0,"elapsed_ms":13319},"status":"keep","description":"Expose BigInt prototype object","timestamp":1778679328714,"segment":57,"confidence":4.086956521739131,"iterationTokens":8930,"asi":{"hypothesis":"The BigInt constructor should expose a prototype object so tests and user code can mutate BigInt.prototype without treating it as undefined; primitive BigInt string coercion remains handled by internal slots."}}
{"run":1212,"commit":"223aa00","metric":4,"metrics":{"compiler_test262_cases":350,"compiler_test262_pass":346,"compiler_test262_failures":4,"compiler_test262_compiler_errors":0,"compiler_test262_compiler_crashes":0,"compiler_test262_compiler_fails":0,"compiler_test262_both_fail":4,"compiler_test262_interpreter_fail_compiler_pass":0,"compatibility_pass":346,"compatibility_cases":350,"compiler_errors":0,"compiler_crashes":0,"compiler_fails":0,"both_fail":4,"interpreter_fail_compiler_pass":0,"elapsed_ms":13290},"status":"keep","description":"Preserve null ToPrimitive results","timestamp":1778679722603,"segment":57,"confidence":4.083333333333333,"iterationTokens":7128,"asi":{"hypothesis":"Ordinary ToPrimitive must distinguish a successful null primitive result from method failure, so valueOf/toString returning null participates in string and numeric coercion instead of falling through to TypeError."}}
