{"run":914,"commit":"35d44e4","metric":35,"metrics":{"compiler_test262_cases":300,"compiler_test262_pass":265,"compiler_test262_failures":35,"compiler_test262_compiler_errors":0,"compiler_test262_compiler_crashes":0,"compiler_test262_compiler_fails":0,"compiler_test262_both_fail":34,"compiler_test262_interpreter_fail_compiler_pass":0,"compatibility_pass":265,"compatibility_cases":300,"compiler_errors":0,"compiler_crashes":0,"compiler_fails":0,"both_fail":34,"interpreter_fail_compiler_pass":0,"elapsed_ms":12142},"status":"keep","description":"Optimize Set difference and intersection order","timestamp":1778518609614,"segment":40,"confidence":4.328767123287672,"iterationTokens":2450,"asi":{"hypothesis":"Set.prototype.difference/intersection should choose between iterating this set and the operand's keys based on relative sizes, preserving required observable order and avoiding unnecessary keys calls","improvement":"Reduced Set failures from 42 to 35 (−7) by using size-aware difference/intersection algorithms; focused allows-set-like-object/class and intersection result-order tests pass","next_action_hint":"Apply similar size/order semantics to isSubsetOf/isSupersetOf/isDisjointFrom and maybe symmetricDifference; remaining weak receiver/prototype descriptor failures may need WeakSet prototype separation."}}
{"run":915,"commit":"35d44e4","metric":34,"metrics":{"compiler_test262_cases":300,"compiler_test262_pass":266,"compiler_test262_failures":34,"compiler_test262_compiler_errors":0,"compiler_test262_compiler_crashes":0,"compiler_test262_compiler_fails":0,"compiler_test262_both_fail":34,"compiler_test262_interpreter_fail_compiler_pass":0,"compatibility_pass":266,"compatibility_cases":300,"compiler_errors":0,"compiler_crashes":0,"compiler_fails":0,"both_fail":34,"interpreter_fail_compiler_pass":0,"elapsed_ms":17162},"status":"discard","description":"Use Set set-like records for predicates","timestamp":1778519525195,"segment":40,"confidence":4.9375,"iterationTokens":18964,"asi":{"hypothesis":"Set predicates should cache set-like size/has/keys in spec order and use has vs keys based on relative sizes","rollback_reason":"Only improved Set 35→34 and required adding an arbitrary 10k iterator cap to avoid a hang in accessor-based iterators; that cap is not spec-correct and not worth keeping","next_action_hint":"Investigate the underlying hang in accessor-result iterator handling before retrying set-like record/order changes for isSupersetOf/isDisjointFrom."}}
{"run":916,"commit":"1e564ff","metric":34,"metrics":{"compiler_test262_cases":300,"compiler_test262_pass":266,"compiler_test262_failures":34,"compiler_test262_compiler_errors":0,"compiler_test262_compiler_crashes":0,"compiler_test262_compiler_fails":0,"compiler_test262_both_fail":33,"compiler_test262_interpreter_fail_compiler_pass":0,"compatibility_pass":266,"compatibility_cases":300,"compiler_errors":0,"compiler_crashes":0,"compiler_fails":0,"both_fail":33,"interpreter_fail_compiler_pass":0,"elapsed_ms":11896},"status":"keep","description":"Return false for missing Set delete entries","timestamp":1778519717510,"segment":40,"confidence":5.781818181818182,"iterationTokens":2354,"asi":{"hypothesis":"Set.prototype.delete should return true only when an entry was removed and false for no-op deletes","improvement":"Reduced Set failures from 35 to 34 (−1) by returning membership status from delete","next_action_hint":"Remaining Set: weak receiver distinction, entries/constructor metadata length, set-like algorithm order, prototype inheritance, realm case."}}
{"run":917,"commit":"40022a1","metric":32,"metrics":{"compiler_test262_cases":300,"compiler_test262_pass":268,"compiler_test262_failures":32,"compiler_test262_compiler_errors":0,"compiler_test262_compiler_crashes":0,"compiler_test262_compiler_fails":0,"compiler_test262_both_fail":31,"compiler_test262_interpreter_fail_compiler_pass":0,"compatibility_pass":268,"compatibility_cases":300,"compiler_errors":0,"compiler_crashes":0,"compiler_fails":0,"both_fail":31,"interpreter_fail_compiler_pass":0,"elapsed_ms":12573},"status":"keep","description":"Normalize zero from Set-like iterators","timestamp":1778520053321,"segment":40,"confidence":8.944444444444445,"iterationTokens":7492,"asi":{"hypothesis":"Set-like iterator values and has operands should normalize -0 to +0 to match SetData SameValueZero semantics","improvement":"Reduced Set failures from 34 to 32 (−2) by normalizing zero values read from set-like key iterators and passed to set-like has","next_action_hint":"Remaining Set: isDisjointFrom/isSupersetOf zero likely need size/order record changes; other clusters include weak receiver distinction, metadata length, prototype inheritance, realm case."}}
{"run":918,"commit":"8c493f9","metric":28,"metrics":{"compiler_test262_cases":300,"compiler_test262_pass":272,"compiler_test262_failures":28,"compiler_test262_compiler_errors":0,"compiler_test262_compiler_crashes":0,"compiler_test262_compiler_fails":0,"compiler_test262_both_fail":27,"compiler_test262_interpreter_fail_compiler_pass":0,"compatibility_pass":272,"compatibility_cases":300,"compiler_errors":0,"compiler_crashes":0,"compiler_fails":0,"both_fail":27,"interpreter_fail_compiler_pass":0,"elapsed_ms":12089},"status":"keep","description":"Separate WeakSet instance helpers from Set prototype","timestamp":1778520278923,"segment":40,"confidence":8.91891891891892,"iterationTokens":4510,"asi":{"hypothesis":"WeakSet instances need their own add/has/delete helpers while Set.prototype methods should reject WeakSet receivers that lack [[SetData]] strong Set internal slot","improvement":"Reduced Set failures from 32 to 28 (−4) by routing weak objects to weak_proto_property while making Set prototype has/add/delete/clear/values/entries require strong Set receivers; compiler WeakSet mutation helper check remains passing","next_action_hint":"Remaining Set: set-like algorithm order/ToNumber, entries/constructor metadata length, prototype inheritance/realm, symmetricDifference builtin extensibility."}}
{"run":919,"commit":"21be25d","metric":22,"metrics":{"compiler_test262_cases":300,"compiler_test262_pass":278,"compiler_test262_failures":22,"compiler_test262_compiler_errors":0,"compiler_test262_compiler_crashes":0,"compiler_test262_compiler_fails":0,"compiler_test262_both_fail":21,"compiler_test262_interpreter_fail_compiler_pass":0,"compatibility_pass":278,"compatibility_cases":300,"compiler_errors":0,"compiler_crashes":0,"compiler_fails":0,"both_fail":21,"interpreter_fail_compiler_pass":0,"elapsed_ms":12285},"status":"keep","description":"Treat callable builtins as extensible","timestamp":1778520894382,"segment":40,"confidence":9,"iterationTokens":16027,"asi":{"hypothesis":"Built-in callable objects are objects and should be extensible by default for Object.isExtensible; returning false fails built-in object invariants for Set algebra methods","improvement":"Reduced Set failures from 28 to 22 (−6) by making Object.isExtensible return true for callable builtins/closures/functions while preserving false for primitives","next_action_hint":"Remaining Set failures: constructor/entries length metadata, set-like ToNumber/order semantics, prototype inheritance/realm, Symbol.species descriptor mutation edge."}}
{"run":920,"commit":"bb1db62","metric":21,"metrics":{"compiler_test262_cases":300,"compiler_test262_pass":279,"compiler_test262_failures":21,"compiler_test262_compiler_errors":0,"compiler_test262_compiler_crashes":0,"compiler_test262_compiler_fails":0,"compiler_test262_both_fail":20,"compiler_test262_interpreter_fail_compiler_pass":0,"compatibility_pass":279,"compatibility_cases":300,"compiler_errors":0,"compiler_crashes":0,"compiler_fails":0,"both_fail":20,"interpreter_fail_compiler_pass":0,"elapsed_ms":13358},"status":"keep","description":"Describe Set constructor length","timestamp":1778521135178,"segment":40,"confidence":8.390243902439025,"iterationTokens":3767,"asi":{"hypothesis":"Set constructor needs builtin metadata declaring length 0 so direct Set.length access matches its descriptor","improvement":"Reduced Set failures from 22 to 21 (−1) by adding Set constructor builtin metadata","next_action_hint":"Remaining Set failures: Set.prototype.entries.length, prototype inheritance/realm, set-like ToNumber/order, Symbol.species descriptor mutation, forEach re-add loop."}}
{"run":921,"commit":"bb1db62","metric":21,"metrics":{"compiler_test262_cases":300,"compiler_test262_pass":279,"compiler_test262_failures":21,"compiler_test262_compiler_errors":0,"compiler_test262_compiler_crashes":0,"compiler_test262_compiler_fails":0,"compiler_test262_both_fail":20,"compiler_test262_interpreter_fail_compiler_pass":0,"compatibility_pass":279,"compatibility_cases":300,"compiler_errors":0,"compiler_crashes":0,"compiler_fails":0,"both_fail":20,"interpreter_fail_compiler_pass":0,"elapsed_ms":13407},"status":"discard","description":"Respect callable accessor descriptors in writes/enumerability","timestamp":1778521544113,"segment":40,"confidence":7.818181818181818,"iterationTokens":10713,"asi":{"hypothesis":"Callable accessor statics such as Set[Symbol.species] should ignore writes without a setter and propertyIsEnumerable should consult callable descriptor metadata","rollback_reason":"Set metric stayed flat at 21; focused run_one improved writable/enumerability but still suffers same-runtime configurable/delete mutation leakage and broad workload unchanged","next_action_hint":"Fix callable configurable/delete restoration or per-case mode isolation before retrying Symbol.species descriptor mutation behavior."}}
{"run":922,"commit":"76600e9","metric":16,"metrics":{"compiler_test262_cases":300,"compiler_test262_pass":284,"compiler_test262_failures":16,"compiler_test262_compiler_errors":0,"compiler_test262_compiler_crashes":0,"compiler_test262_compiler_fails":0,"compiler_test262_both_fail":15,"compiler_test262_interpreter_fail_compiler_pass":0,"compatibility_pass":284,"compatibility_cases":300,"compiler_errors":0,"compiler_crashes":0,"compiler_fails":0,"both_fail":15,"interpreter_fail_compiler_pass":0,"elapsed_ms":12033},"status":"keep","description":"Coerce Set-like sizes with ToNumber","timestamp":1778521747912,"segment":40,"confidence":8.232558139534884,"iterationTokens":2520,"asi":{"hypothesis":"GetSetRecord must coerce the set-like size property with ToNumber while rejecting BigInt sizes with TypeError","improvement":"Reduced Set failures from 21 to 16 (−5) by applying ToNumber to set-like size and rejecting BigInt; focused size-is-a-number tests for all Set algebra methods pass","next_action_hint":"Remaining Set failures: set-like order/predicate algorithms, entries length metadata, prototype inheritance/realm, Symbol.species descriptor mutation, forEach delete/re-add."}}
{"run":923,"commit":"89d66d3","metric":12,"metrics":{"compiler_test262_cases":300,"compiler_test262_pass":288,"compiler_test262_failures":12,"compiler_test262_compiler_errors":0,"compiler_test262_compiler_crashes":0,"compiler_test262_compiler_fails":0,"compiler_test262_both_fail":12,"compiler_test262_interpreter_fail_compiler_pass":0,"compatibility_pass":288,"compatibility_cases":300,"compiler_errors":0,"compiler_crashes":0,"compiler_fails":0,"both_fail":12,"interpreter_fail_compiler_pass":0,"elapsed_ms":12409},"status":"keep","description":"Use Set-like has for isSubsetOf","timestamp":1778521998713,"segment":40,"confidence":8.619047619047619,"iterationTokens":4450,"asi":{"hypothesis":"Set.prototype.isSubsetOf should validate set-like operands once, avoid calling keys for membership, compare this size to operand size, and call the cached has function in spec order","improvement":"Reduced Set failures from 16 to 12 (−4) by making isSubsetOf use cached size/has from GetSetRecord instead of enumerating keys","next_action_hint":"Remaining Set: isSupersetOf/isDisjointFrom order/zero still tricky due accessor-iterator hang, entries length metadata, prototype inheritance/realm, Symbol.species same-runtime deletion, forEach delete/re-add."}}
{"run":924,"commit":"21bdb45","metric":10,"metrics":{"compiler_test262_cases":300,"compiler_test262_pass":290,"compiler_test262_failures":10,"compiler_test262_compiler_errors":0,"compiler_test262_compiler_crashes":0,"compiler_test262_compiler_fails":0,"compiler_test262_both_fail":10,"compiler_test262_interpreter_fail_compiler_pass":0,"compatibility_pass":290,"compatibility_cases":300,"compiler_errors":0,"compiler_crashes":0,"compiler_fails":0,"both_fail":10,"interpreter_fail_compiler_pass":0,"elapsed_ms":13140},"status":"keep","description":"Normalize iterator values in Set predicates","timestamp":1778522225182,"segment":40,"confidence":10.457142857142857,"iterationTokens":3435,"asi":{"hypothesis":"Set predicate iteration over set-like keys should normalize -0 to +0 before SameValueZero membership checks","improvement":"Reduced Set failures from 12 to 10 (−2) by normalizing iterator values in isSupersetOf/isDisjointFrom membership loops","next_action_hint":"Remaining Set: prototype inheritance/realm, entries length metadata, Symbol.species same-runtime descriptor mutation, forEach delete/re-add, set-like order for difference/intersection/superset/disjoint."}}
{"run":925,"commit":"01a6f54","metric":9,"metrics":{"compiler_test262_cases":300,"compiler_test262_pass":291,"compiler_test262_failures":9,"compiler_test262_compiler_errors":0,"compiler_test262_compiler_crashes":0,"compiler_test262_compiler_fails":0,"compiler_test262_both_fail":9,"compiler_test262_interpreter_fail_compiler_pass":0,"compatibility_pass":291,"compatibility_cases":300,"compiler_errors":0,"compiler_crashes":0,"compiler_fails":0,"both_fail":9,"interpreter_fail_compiler_pass":0,"elapsed_ms":12701},"status":"keep","description":"Revisit Set forEach re-added values","timestamp":1778522667753,"segment":40,"confidence":12.266666666666667,"iterationTokens":11380,"asi":{"hypothesis":"Set.prototype.forEach should use live SetData order so values deleted after visit and re-added before completion are visited again","improvement":"Reduced Set failures from 10 to 9 (−1) by replacing index-based live iteration with next-values-from-current-order traversal; focused delete/re-add forEach test passes","next_action_hint":"Remaining Set: prototype inheritance/realm, entries length metadata, Symbol.species descriptor mutation, and set-like order cases for difference/intersection/superset/disjoint."}}
{"type":"config","name":"QuickBEAM built-ins/Map compatibility reprise","metricName":"compatibility_failures","metricUnit":"","bestDirection":"lower"}
{"run":926,"commit":"47b4047","metric":107,"metrics":{"compiler_test262_cases":204,"compiler_test262_pass":97,"compiler_test262_failures":107,"compiler_test262_compiler_errors":0,"compiler_test262_compiler_crashes":0,"compiler_test262_compiler_fails":4,"compiler_test262_both_fail":85,"compiler_test262_interpreter_fail_compiler_pass":0,"compatibility_pass":97,"compatibility_cases":204,"compiler_errors":0,"compiler_crashes":0,"compiler_fails":4,"both_fail":85,"interpreter_fail_compiler_pass":0,"elapsed_ms":10099},"status":"keep","description":"Rebaseline built-ins/Map after Set fixes","timestamp":1778523370388,"segment":41,"confidence":null,"iterationTokens":127,"asi":{"hypothesis":"Rebaseline Map after extensive Set/runtime fixes to continue collection compatibility work","improvement":"Map remains at 107/204; Set-specific work did not change Map baseline"}}
{"run":927,"commit":"b7a9413","metric":82,"metrics":{"compiler_test262_cases":204,"compiler_test262_pass":122,"compiler_test262_failures":82,"compiler_test262_compiler_errors":0,"compiler_test262_compiler_crashes":0,"compiler_test262_compiler_fails":4,"compiler_test262_both_fail":60,"compiler_test262_interpreter_fail_compiler_pass":0,"compatibility_pass":122,"compatibility_cases":204,"compiler_errors":0,"compiler_crashes":0,"compiler_fails":4,"both_fail":60,"interpreter_fail_compiler_pass":0,"elapsed_ms":10910},"status":"keep","description":"Implement Map getOrInsert methods","timestamp":1778523721334,"segment":41,"confidence":null,"iterationTokens":9780,"asi":{"hypothesis":"Map.prototype.getOrInsert and getOrInsertComputed are missing prototype methods and should insert/return values with canonicalized keys and callback validation","improvement":"Reduced Map failures from 107 to 82 (−25) by implementing getOrInsert/getOrInsertComputed, materializing them on Map.prototype, adding metadata, key normalization, and computed callback behavior","next_action_hint":"Remaining Map: forEach live iteration/thisArg/validation, Map prototype size/species/toStringTag descriptors, WeakMap receiver distinction, constructor iterator protocol."}}
{"run":928,"commit":"37e8f4a","metric":41,"metrics":{"compiler_test262_cases":204,"compiler_test262_pass":163,"compiler_test262_failures":41,"compiler_test262_compiler_errors":0,"compiler_test262_compiler_crashes":0,"compiler_test262_compiler_fails":4,"compiler_test262_both_fail":37,"compiler_test262_interpreter_fail_compiler_pass":0,"compatibility_pass":163,"compatibility_cases":204,"compiler_errors":0,"compiler_crashes":0,"compiler_fails":4,"both_fail":37,"interpreter_fail_compiler_pass":0,"elapsed_ms":10070},"status":"keep","description":"Validate Map receivers and live forEach","timestamp":1778523987013,"segment":41,"confidence":2.64,"iterationTokens":8105,"asi":{"hypothesis":"Map prototype methods should reject non-Map/WeakMap receivers, WeakMap instances need separate helper methods, delete should return false for missing keys, and forEach needs callable validation, thisArg, and live key iteration","improvement":"Reduced Map failures from 82 to 41 (−41) by adding strong Map receiver validation, weak helper routing, delete no-op false, and live forEach with thisArg/callable validation","next_action_hint":"Remaining Map: size accessor/constructor metadata, Symbol.species/toStringTag, groupBy edge cases, constructor iterator protocol."}}
{"run":929,"commit":"a31424c","metric":30,"metrics":{"compiler_test262_cases":204,"compiler_test262_pass":174,"compiler_test262_failures":30,"compiler_test262_compiler_errors":0,"compiler_test262_compiler_crashes":0,"compiler_test262_compiler_fails":4,"compiler_test262_both_fail":26,"compiler_test262_interpreter_fail_compiler_pass":0,"compatibility_pass":174,"compatibility_cases":204,"compiler_errors":0,"compiler_crashes":0,"compiler_fails":4,"both_fail":26,"interpreter_fail_compiler_pass":0,"elapsed_ms":9800},"status":"keep","description":"Add Map metadata and prototype accessors","timestamp":1778524216489,"segment":41,"confidence":2.9615384615384617,"iterationTokens":4272,"asi":{"hypothesis":"Map constructor/prototype needs length metadata, Symbol.species, size accessor, and Symbol.toStringTag like Set","improvement":"Reduced Map failures from 41 to 30 (−11) by adding Map constructor metadata, Symbol.species accessor, Map.prototype.size accessor, and Map.prototype[Symbol.toStringTag]","next_action_hint":"Remaining Map: groupBy edge cases, constructor iterator protocol, prototype inheritance/realm, entries/keys/values length metadata, species descriptor mutation."}}
{"run":930,"commit":"d2155bd","metric":26,"metrics":{"compiler_test262_cases":204,"compiler_test262_pass":178,"compiler_test262_failures":26,"compiler_test262_compiler_errors":0,"compiler_test262_compiler_crashes":0,"compiler_test262_compiler_fails":0,"compiler_test262_both_fail":26,"compiler_test262_interpreter_fail_compiler_pass":0,"compatibility_pass":178,"compatibility_cases":204,"compiler_errors":0,"compiler_crashes":0,"compiler_fails":0,"both_fail":26,"interpreter_fail_compiler_pass":0,"elapsed_ms":9720},"status":"keep","description":"Set Map instance prototype","timestamp":1778524434751,"segment":41,"confidence":5.4,"iterationTokens":2888,"asi":{"hypothesis":"Map constructor should create objects whose internal prototype is Map.prototype","improvement":"Reduced Map failures from 30 to 26 (−4) and eliminated compiler-only failures by storing Runtime.global_class_proto(\"Map\") on constructed Map instances","next_action_hint":"Remaining Map: groupBy, constructor iterator protocol, prototype descriptor/constructor, entries/keys/values length metadata, species descriptor mutation, iterator delete/clear behavior."}}
{"run":931,"commit":"2abe85a","metric":24,"metrics":{"compiler_test262_cases":204,"compiler_test262_pass":180,"compiler_test262_failures":24,"compiler_test262_compiler_errors":0,"compiler_test262_compiler_crashes":0,"compiler_test262_compiler_fails":0,"compiler_test262_both_fail":24,"compiler_test262_interpreter_fail_compiler_pass":0,"compatibility_pass":180,"compatibility_cases":204,"compiler_errors":0,"compiler_crashes":0,"compiler_fails":0,"both_fail":24,"interpreter_fail_compiler_pass":0,"elapsed_ms":10005},"status":"keep","description":"Make Map size a prototype accessor","timestamp":1778524707768,"segment":41,"confidence":7.904761904761905,"iterationTokens":3832,"asi":{"hypothesis":"Map.prototype.size lookups should be accessor descriptors, including type-specialized Map object lookup paths that currently returned a builtin function","improvement":"Reduced Map failures from 26 to 24 (−2) by making JSMap.proto_property(\"size\") return an accessor getter instead of a callable builtin","next_action_hint":"Remaining Map: groupBy key iteration/Array.from interaction, constructor iterator protocol, prototype inheritance/realm, entries/keys/values length metadata, Symbol.species descriptor mutation."}}
