{"run":426,"commit":"fd55371","metric":54,"metrics":{"test262_language_sample_error_files":10,"test262_language_sample_unique_errors":6,"test262_language_sample_files":8000,"test262_language_sample_module_files":158,"test_language_errors":0,"test_language_unique_errors":0,"test_language_parse_ok":1,"quickjs_parser_tests":776,"parser_tests":453,"parser_test_ms":1200},"status":"keep","description":"Parse punctuation-valued strings and unicode whitespace","timestamp":1777297332420,"segment":8,"confidence":20,"iterationTokens":8296,"asi":{"hypothesis":"The exponentiation and compound-assignment clusters share lexer/parser confusion from string literal values that look like punctuators and non-ASCII ECMAScript whitespace/line separators not being skipped as trivia.","changes":"Parsed literal tokens before value-based punctuator branches in parse_prefix/1, and taught skip_trivia/1 to consume non-ASCII ECMAScript whitespace/line terminators such as NBSP, LS, and PS. Added focused QuickJS-port tests for punctuation-valued strings and Unicode whitespace around compound assignment.","benchmark_after":"test262_language_sample_errors reduced from 92 to 54; error files reduced from 37 to 10; test_language_errors remains 0; parser tests increased to 453 and QuickJS-port coverage to 776. Backpressure checks passed.","next_action_hint":"Remaining clusters are division-vs-regexp lexical goals, static-init await/yield binding function-expression syntax, and invalid string escape handling in relational expression tests."}}
{"run":427,"commit":"f1fa9ff","metric":45,"metrics":{"test262_language_sample_error_files":7,"test262_language_sample_unique_errors":5,"test262_language_sample_files":8000,"test262_language_sample_module_files":158,"test_language_errors":0,"test_language_unique_errors":0,"test_language_parse_ok":1,"quickjs_parser_tests":777,"parser_tests":455,"parser_test_ms":900},"status":"keep","description":"Allow contextual keyword function expression names","timestamp":1777297512523,"segment":8,"confidence":2.45,"iterationTokens":8296,"asi":{"hypothesis":"Remaining static-block/generator files use await/yield as function expression binding identifiers in contexts where they are valid identifiers, but the parser only accepted identifier tokens for optional function expression names.","changes":"Function expression name parsing now accepts identifier-like contextual keyword tokens and still routes through parse_binding_identifier/1 for existing validation. Added focused tests for await in class static blocks and yield inside generator bodies.","benchmark_after":"test262_language_sample_errors reduced from 54 to 45; error files reduced from 10 to 7; test_language_errors remains 0; parser tests increased to 455 and QuickJS-port coverage to 777. Backpressure checks passed.","next_action_hint":"Remaining failures are concentrated in division lexical-goal handling and surrogate escape acceptance for strings."}}
{"run":428,"commit":"d982b85","metric":41,"metrics":{"test262_language_sample_error_files":5,"test262_language_sample_unique_errors":4,"test262_language_sample_files":8000,"test262_language_sample_module_files":158,"test_language_errors":0,"test_language_unique_errors":0,"test_language_parse_ok":1,"quickjs_parser_tests":778,"parser_tests":456,"parser_test_ms":700},"status":"keep","description":"Accept fixed surrogate unicode string escapes","timestamp":1777297613726,"segment":8,"confidence":4.076923076923077,"iterationTokens":5355,"asi":{"hypothesis":"Relational-expression failures use lone surrogate fixed Unicode escapes such as \\uD800 and \\uDC00 inside strings. ECMAScript strings store UTF-16 code units, so these escapes are accepted even though they are not scalar Unicode code points.","changes":"Fixed-length string Unicode escapes now accept code units through 0xFFFF and represent surrogate code units as raw 16-bit binaries instead of trying to encode them as UTF-8. Added focused QuickJS-port coverage for comparing strings containing lone surrogate escapes.","benchmark_after":"test262_language_sample_errors reduced from 45 to 41; error files reduced from 7 to 5; unique errors reduced from 5 to 4; test_language_errors remains 0. Backpressure checks passed.","next_action_hint":"Only division-expression files remain; inspect regex-vs-division lexical-goal decisions and string/regexp scanning around nested slash-heavy assertion strings."}}
{"run":429,"commit":"1b2ef38","metric":0,"metrics":{"test262_language_sample_error_files":0,"test262_language_sample_unique_errors":0,"test262_language_sample_files":8000,"test262_language_sample_module_files":158,"test_language_errors":0,"test_language_unique_errors":0,"test_language_parse_ok":1,"quickjs_parser_tests":780,"parser_tests":459,"parser_test_ms":700},"status":"keep","description":"Improve division lexical goal after braces and contextual keywords","timestamp":1777297816045,"segment":8,"confidence":4.076923076923077,"iterationTokens":10821,"asi":{"hypothesis":"The final division failures come from lexer lexical-goal heuristics: slash after object/function bodies followed by whitespace and an expression starter was scanned as a regexp, and slash after contextual keyword identifiers such as 'of' was also scanned as a regexp.","changes":"Generalized regexp_allowed?/1 to inspect lexer state, treat identifier-like contextual keywords as expression-ending tokens for slash lexing, and classify slash after '}' plus horizontal whitespace plus an expression starter as division while preserving regexp literals immediately after block statements. Added focused tests for object/function division, regexp after blocks, and division after contextual keyword identifiers.","benchmark_after":"test262_language_sample_errors reached 0 for the 8000-file sample; error files and unique errors reached 0; test_language_errors remains 0; parser tests increased to 459 and QuickJS-port coverage to 780. Backpressure checks passed.","next_action_hint":"Expand the deterministic Test262 language sample beyond 8000 files, likely 12000 or 16000, and continue fixing broad syntax gaps found in the next slice."}}
{"type":"config","name":"JavaScript Parser Test262 Compatibility Clean 12000 Sample","metricName":"test262_language_sample_errors","metricUnit":"","bestDirection":"lower"}
{"run":430,"commit":"47ab081","metric":469,"metrics":{"test262_language_sample_error_files":157,"test262_language_sample_unique_errors":20,"test262_language_sample_files":12000,"test262_language_sample_module_files":850,"test_language_errors":0,"test_language_unique_errors":0,"test_language_parse_ok":1,"quickjs_parser_tests":780,"parser_tests":459,"parser_test_ms":800},"status":"keep","description":"Expand Test262 compatibility sample to 12000 files","timestamp":1777297897956,"segment":9,"confidence":null,"iterationTokens":108,"asi":{"hypothesis":"The first 8000 deterministic Test262 non-negative language files are now parse-clean, so expanding the sample to 12000 should expose the next broad compatibility gaps without changing the parser implementation.","changes":"Raised the default benchmark sample limit from 8000 to 12000 and updated autoresearch.md to document the new workload and next-slice commands.","baseline":"New 12000-file baseline is test262_language_sample_errors=469 across 157 files, with 20 unique error messages and 850 module files. test_language_errors remains 0.","next_action_hint":"The largest new cluster is import defer syntax under test/test262/test/language/import/import-defer, followed by top-level await/module source handling and await-using statements. Start with broad import defer grammar support rather than file-specific fixes."}}
{"run":431,"commit":"2608ae8","metric":167,"metrics":{"test262_language_sample_error_files":59,"test262_language_sample_unique_errors":20,"test262_language_sample_files":12000,"test262_language_sample_module_files":850,"test_language_errors":0,"test_language_unique_errors":0,"test_language_parse_ok":1,"quickjs_parser_tests":781,"parser_tests":460,"parser_test_ms":2100},"status":"keep","description":"Parse static import defer namespace declarations","timestamp":1777298031884,"segment":9,"confidence":null,"iterationTokens":9321,"asi":{"hypothesis":"The dominant 12000-sample cluster is static import-defer declarations of the form 'import defer * as ns from ...'. The existing module parser treats 'defer' as a default import name and then expects 'from'.","changes":"Added a generic static import defer modifier consumer before import specifier parsing when 'defer' is followed by '*'. Added focused QuickJS-port test coverage for deferred namespace imports.","benchmark_after":"test262_language_sample_errors reduced from 469 to 167; error files from 157 to 59; test_language_errors remains 0. Backpressure checks passed.","next_action_hint":"Next high-volume cluster is top-level await with regexp operands; likely await expression parsing does not allow regexp literal argument because slash lexical goal after await keyword or parse_await_expression precedence is wrong."}}
{"type":"config","name":"JS bytecode compiler frontier","metricName":"js_bytecode_frontier_failures","metricUnit":"","bestDirection":"lower"}
{"run":680,"commit":"72604ca","metric":16,"metrics":{"js_bytecode_frontier_cases":20,"js_bytecode_frontier_compiled":5,"js_bytecode_frontier_unsupported":15,"js_bytecode_frontier_mismatches":1,"js_bytecode_frontier_native_loadable":4,"js_bytecode_compiler_cases":53,"js_bytecode_compiler_compiled":53,"js_bytecode_compiler_unsupported":0,"js_bytecode_compiler_mismatches":0,"js_bytecode_compiler_native_loadable":53,"js_bytecode_compiler_failures":0},"status":"keep","description":"Baseline JS bytecode compiler frontier","timestamp":1777822691860,"segment":19,"confidence":null,"iterationTokens":106,"asi":{"hypothesis":"Baseline for a QuickJS-oracle frontier benchmark covering remaining JS bytecode compiler semantic clusters: block scope, var/let, closures, switch, try/throw, constructors, logical assignment, delete/in, for-in, and builtin side effects.","quickjs_reference":"Each frontier case compares native QuickBEAM.eval with frontend-compiled interpreter, BEAM compiler, and QuickJS load_bytecode results.","baseline_failures":"16/20 frontier cases currently fail; 15 unsupported and 1 mismatch (block let shadowing outer).","next_action_hint":"Start with the smallest broad cluster such as logical assignment or block-scope shadowing before attempting closures or try/catch."}}
{"type":"config","name":"JS bytecode compiler existing corpus","metricName":"js_bytecode_existing_failures","metricUnit":"","bestDirection":"lower"}
{"run":681,"commit":"beae0fa","metric":24,"metrics":{"js_bytecode_existing_cases":120,"js_bytecode_existing_compiled":99,"js_bytecode_existing_unsupported":20,"js_bytecode_existing_mismatches":3,"js_bytecode_existing_native_loadable":99,"js_bytecode_compiler_cases":53,"js_bytecode_compiler_compiled":53,"js_bytecode_compiler_unsupported":0,"js_bytecode_compiler_mismatches":0,"js_bytecode_compiler_native_loadable":53,"js_bytecode_compiler_failures":0},"status":"keep","description":"Baseline existing corpus bytecode compiler autoresearch","timestamp":1777823227636,"segment":20,"confidence":null,"iterationTokens":106,"asi":{"hypothesis":"Baseline for existing QuickBEAM VM/compiler corpus as primary autoresearch workload instead of curated frontier.","quickjs_reference":"Each case uses QuickBEAM.eval as oracle and compares frontend bytecode interpreter, BEAM compiler, and QuickJS load_bytecode paths.","baseline_failures":"24/120 existing corpus cases fail: 20 unsupported, 3 mismatches, plus compile exception classified as error in output.","next_action_hint":"Start with broad low-risk unsupported operators/globals from existing corpus: undefined literal, bitwise operators, delete/in; avoid large closures/constructors first."}}
{"run":682,"commit":"9b19bbc","metric":16,"metrics":{"js_bytecode_existing_cases":120,"js_bytecode_existing_compiled":105,"js_bytecode_existing_unsupported":14,"js_bytecode_existing_mismatches":1,"js_bytecode_existing_native_loadable":104,"js_bytecode_compiler_cases":61,"js_bytecode_compiler_compiled":61,"js_bytecode_compiler_unsupported":0,"js_bytecode_compiler_mismatches":0,"js_bytecode_compiler_native_loadable":61,"js_bytecode_compiler_failures":0},"status":"keep","description":"Support existing corpus bitwise basics","timestamp":1777823520777,"segment":20,"confidence":null,"iterationTokens":14092,"asi":{"hypothesis":"Adding undefined and bitwise operator coverage from existing QuickBEAM VM corpus will convert several unsupported cases into passing frontend bytecode cases.","result":"Existing corpus failures improved 24 -> 16; unsupported dropped 20 -> 14; stable frontend audit expanded 53 -> 61 with zero failures.","normalization":"JS bytecode audit now normalizes VM internal values/objects similarly to existing VM compiler audit so QuickJS external nil/arrays/objects compare fairly against interpreter/compiler internals.","next_action_hint":"Remaining easy clusters include delete/in and Object global; optional chaining currently compiles but mismatches due interpreter/native-load error vs BEAM compiler true."}}
{"run":683,"commit":"eec1afb","metric":14,"metrics":{"js_bytecode_existing_cases":120,"js_bytecode_existing_compiled":107,"js_bytecode_existing_unsupported":12,"js_bytecode_existing_mismatches":1,"js_bytecode_existing_native_loadable":106,"js_bytecode_compiler_cases":64,"js_bytecode_compiler_compiled":64,"js_bytecode_compiler_unsupported":0,"js_bytecode_compiler_mismatches":0,"js_bytecode_compiler_native_loadable":64,"js_bytecode_compiler_failures":0},"status":"keep","description":"Support existing corpus delete and in","timestamp":1777823733045,"segment":20,"confidence":5,"iterationTokens":8347,"asi":{"hypothesis":"Implementing generic delete member expressions and in operator from existing corpus will remove two unsupported corpus failures without regressing stable audit.","result":"Existing corpus failures improved 16 -> 14; unsupported dropped 14 -> 12; stable frontend audit expanded 61 -> 64 with zero failures.","vm_compiler_note":"Compiled delete needed shaped-object alias invalidation after delete_call to avoid stale shaped reads in BEAM compiler path.","next_action_hint":"Next low-risk targets: Object.is global/member call for negative zero sign or destructuring declaration compile exception; larger clusters remain for-of/for-in/template/try/switch/classes/closures."}}
{"run":684,"commit":"0f7785c","metric":13,"metrics":{"js_bytecode_existing_cases":120,"js_bytecode_existing_compiled":108,"js_bytecode_existing_unsupported":12,"js_bytecode_existing_mismatches":1,"js_bytecode_existing_native_loadable":107,"js_bytecode_compiler_cases":66,"js_bytecode_compiler_compiled":66,"js_bytecode_compiler_unsupported":0,"js_bytecode_compiler_mismatches":0,"js_bytecode_compiler_native_loadable":66,"js_bytecode_compiler_failures":0},"status":"keep","description":"Support simple object destructuring","timestamp":1777823866120,"segment":20,"confidence":7.333333333333333,"iterationTokens":5699,"asi":{"hypothesis":"Simple object destructuring declarations in existing corpus can be handled generically by declaring ObjectPattern identifiers and lowering property reads into local slots.","result":"Existing corpus failures improved 14 -> 13; stable audit expanded 64 -> 66 with zero failures.","scope":"Supports simple noncomputed object pattern properties where values are identifiers, including multiple properties; other destructuring forms still return unsupported.","next_action_hint":"Remaining failures: Object.is/global support, recursion/closures, optional chaining mismatch, for-of/for-in, template literal, try/switch, regexp literal, classes."}}
{"run":685,"commit":"f1cfb30","metric":12,"metrics":{"js_bytecode_existing_cases":120,"js_bytecode_existing_compiled":109,"js_bytecode_existing_unsupported":11,"js_bytecode_existing_mismatches":1,"js_bytecode_existing_native_loadable":108,"js_bytecode_compiler_cases":68,"js_bytecode_compiler_compiled":68,"js_bytecode_compiler_unsupported":0,"js_bytecode_compiler_mismatches":0,"js_bytecode_compiler_native_loadable":68,"js_bytecode_compiler_failures":0},"status":"keep","description":"Support simple template literals","timestamp":1777824015624,"segment":20,"confidence":6,"iterationTokens":4850,"asi":{"hypothesis":"Lowering template literals as string-addition chains will cover simple existing corpus template cases using existing JS addition coercion semantics.","result":"Existing corpus failures improved 13 -> 12; unsupported dropped 12 -> 11; stable audit expanded 66 -> 68 with zero failures.","scope":"Supports untagged TemplateLiteral quasis/expressions by compiling first quasi then alternating expression/add and nonempty quasi/add; tagged templates remain unsupported by absence of TaggedTemplateExpression handling.","next_action_hint":"Remaining small-ish targets: Object.is via global runtime access, optional chaining semantics, switch; large targets: closures/recursion, for-of/for-in, try/catch, regexp, classes."}}
{"run":686,"commit":"b1faed2","metric":11,"metrics":{"js_bytecode_existing_cases":120,"js_bytecode_existing_compiled":110,"js_bytecode_existing_unsupported":10,"js_bytecode_existing_mismatches":1,"js_bytecode_existing_native_loadable":109,"js_bytecode_compiler_cases":70,"js_bytecode_compiler_compiled":70,"js_bytecode_compiler_unsupported":0,"js_bytecode_compiler_mismatches":0,"js_bytecode_compiler_native_loadable":70,"js_bytecode_compiler_failures":0},"status":"keep","description":"Support selected existing globals","timestamp":1777824317092,"segment":20,"confidence":6.5,"iterationTokens":10634,"asi":{"hypothesis":"Adding generic get_var support for known built-in globals used by existing corpus will cover Object.is and similar global member calls without turning arbitrary missing globals into compiled code.","result":"Existing corpus failures improved 12 -> 11; stable audit expanded 68 -> 70 with zero failures.","scope":"Assembler now supports get_var atom operands; expressions compile selected built-in global identifiers Object/Math/Array/String/Number/Boolean plus NaN via get_var. Arbitrary missing identifiers still return unsupported.","next_action_hint":"Remaining failures are bigger clusters: recursion/closures, optional chaining mismatch, for-of/for-in, try/switch, regexp literal, and classes."}}
{"run":687,"commit":"542c7e7","metric":10,"metrics":{"js_bytecode_existing_cases":120,"js_bytecode_existing_compiled":111,"js_bytecode_existing_unsupported":9,"js_bytecode_existing_mismatches":1,"js_bytecode_existing_native_loadable":110,"js_bytecode_compiler_cases":71,"js_bytecode_compiler_compiled":71,"js_bytecode_compiler_unsupported":0,"js_bytecode_compiler_mismatches":0,"js_bytecode_compiler_native_loadable":71,"js_bytecode_compiler_failures":0},"status":"keep","description":"Support simple break-only switch","timestamp":1777824509239,"segment":20,"confidence":7,"iterationTokens":10634,"asi":{"hypothesis":"A generic subset of switch statements where each case terminates with break can be lowered via discriminant duplication, strict equality tests, labels, and existing break-label handling.","result":"Existing corpus failures improved 11 -> 10; stable audit expanded 70 -> 71 with zero failures.","scope":"Supports non-default SwitchCase entries whose consequent ends in break; fallthrough/default remain explicitly unsupported instead of compiled incorrectly.","next_action_hint":"Remaining unsupported clusters require larger semantics: recursion/closures, for-of/for-in iteration, try/catch/throw, regexp literal serialization/runtime, classes/new. Optional chaining remains a mismatch to investigate separately."}}
{"run":688,"commit":"db4fe39","metric":9,"metrics":{"js_bytecode_existing_cases":120,"js_bytecode_existing_compiled":111,"js_bytecode_existing_unsupported":9,"js_bytecode_existing_mismatches":0,"js_bytecode_existing_native_loadable":111,"js_bytecode_compiler_cases":73,"js_bytecode_compiler_compiled":73,"js_bytecode_compiler_unsupported":0,"js_bytecode_compiler_mismatches":0,"js_bytecode_compiler_native_loadable":73,"js_bytecode_compiler_failures":0},"status":"keep","description":"Support optional member reads","timestamp":1777824677027,"segment":20,"confidence":7.5,"iterationTokens":11691,"asi":{"hypothesis":"Lowering optional noncomputed member expressions with is_undefined_or_null and branch labels will fix the existing optional chaining semantic mismatch across interpreter, BEAM compiler, and QuickJS native load.","result":"Existing corpus failures improved 10 -> 9; mismatches reached 0; native-loadable compiled cases now 111/111; stable audit expanded 71 -> 73 with zero failures.","scope":"Supports optional noncomputed member reads such as o?.x. Optional calls and computed optional members remain unsupported by normal fallback paths until explicitly implemented.","next_action_hint":"Remaining failures are unsupported feature clusters only: recursion/closures, for-of/for-in, try/catch/throw, regexp literal, classes/new."}}
