{"run":1360,"commit":"e6d010d","metric":22,"metrics":{"compiler_test262_cases":1700,"compiler_test262_pass":1678,"compiler_test262_failures":22,"compiler_test262_compiler_errors":0,"compiler_test262_compiler_crashes":0,"compiler_test262_compiler_fails":8,"compiler_test262_both_fail":12,"compiler_test262_interpreter_fail_compiler_pass":0,"compatibility_pass":1678,"compatibility_cases":1700,"compiler_errors":0,"compiler_crashes":0,"compiler_fails":8,"both_fail":12,"interpreter_fail_compiler_pass":0,"elapsed_ms":70036},"status":"keep","description":"Reject oversized Array map results","timestamp":1778723413110,"segment":105,"confidence":null,"iterationTokens":129,"asi":{"hypothesis":"Array.prototype.map must throw RangeError during ArraySpeciesCreate when LengthOfArrayLike exceeds the maximum Array length, rather than iterating or allocating a huge sparse result.","fixed_focus":["Array/prototype/map/15.4.4.19-3-8.js","Array/prototype/map/15.4.4.19-3-14.js","Array/prototype/map/15.4.4.19-3-28.js","Array/prototype/map/15.4.4.19-3-29.js"],"remaining_cluster":"Array 1700 now back to 22 failures; remaining failures match the 1600 plateau plus typed-array/resizable-buffer and sparse search clusters."}}
{"run":1361,"commit":"e1cf228","metric":21,"metrics":{"compiler_test262_cases":1700,"compiler_test262_pass":1679,"compiler_test262_failures":21,"compiler_test262_compiler_errors":0,"compiler_test262_compiler_crashes":0,"compiler_test262_compiler_fails":8,"compiler_test262_both_fail":11,"compiler_test262_interpreter_fail_compiler_pass":0,"compatibility_pass":1679,"compatibility_cases":1700,"compiler_errors":0,"compiler_crashes":0,"compiler_fails":8,"both_fail":11,"interpreter_fail_compiler_pass":0,"elapsed_ms":69895},"status":"keep","description":"Return undefined for ordinary object lengths","timestamp":1778723762438,"segment":105,"confidence":5,"iterationTokens":30318,"asi":{"hypothesis":"The bytecode get_length fast path should only synthesize string/wrapped-string and array/callable lengths; ordinary objects without an own/inherited length property must read undefined, not their map/shape size.","fixed_focus":"Array/prototype/join/S15.4.4.5_A2_T1.js","semantic_scope":"Changed Get.length_of fallback for ordinary map/shape objects from map_size to undefined while preserving wrapped string length handling."}}
{"type":"config","name":"Array Test262 compatibility 1800-case expansion","metricName":"compatibility_failures","metricUnit":"","bestDirection":"lower"}
{"run":1362,"commit":"51dd688","metric":21,"metrics":{"compiler_test262_cases":1800,"compiler_test262_pass":1779,"compiler_test262_failures":21,"compiler_test262_compiler_errors":0,"compiler_test262_compiler_crashes":0,"compiler_test262_compiler_fails":8,"compiler_test262_both_fail":11,"compiler_test262_interpreter_fail_compiler_pass":0,"compatibility_pass":1779,"compatibility_cases":1800,"compiler_errors":0,"compiler_crashes":0,"compiler_fails":8,"both_fail":11,"interpreter_fail_compiler_pass":0,"elapsed_ms":76059},"status":"keep","description":"Baseline Array 1800-case expansion","timestamp":1778724325333,"segment":106,"confidence":null,"iterationTokens":129,"asi":{"hypothesis":"Expand Array workload from 1700 to 1800 after reducing 1700 to 21 failures; the next 100 cases may be covered by existing generic map/reduce semantics or expose new focused clusters.","workload":"AUTORESEARCH_TEST262_CATEGORY=built-ins/Array TEST262_LIMIT=1800 TEST262_ERROR_LIMIT=1220 ./autoresearch.sh","baseline_note":"Array 1800 baseline remains 21 failures, so the added slice introduced no new failures under current semantics."}}
{"type":"config","name":"Array Test262 compatibility 1900-case expansion","metricName":"compatibility_failures","metricUnit":"","bestDirection":"lower"}
{"run":1363,"commit":"af1a819","metric":84,"metrics":{"compiler_test262_cases":1900,"compiler_test262_pass":1816,"compiler_test262_failures":84,"compiler_test262_compiler_errors":0,"compiler_test262_compiler_crashes":0,"compiler_test262_compiler_fails":8,"compiler_test262_both_fail":60,"compiler_test262_interpreter_fail_compiler_pass":0,"compatibility_pass":1816,"compatibility_cases":1900,"compiler_errors":0,"compiler_crashes":0,"compiler_fails":8,"both_fail":60,"interpreter_fail_compiler_pass":0,"elapsed_ms":78781},"status":"keep","description":"Baseline Array 1900-case expansion","timestamp":1778724536911,"segment":107,"confidence":null,"iterationTokens":129,"asi":{"hypothesis":"Expand Array workload to include the next 100 Test262 cases; this slice likely introduces reduce/reduceRight clusters after the 1800 plateau.","workload":"AUTORESEARCH_TEST262_CATEGORY=built-ins/Array TEST262_LIMIT=1900 TEST262_ERROR_LIMIT=1290 ./autoresearch.sh","baseline_note":"Array 1900 baseline jumps to 84 failures with both_fail increasing to 60; inspect new reduce/reduceRight clusters before making broad changes."}}
{"run":1364,"commit":"f991eab","metric":66,"metrics":{"compiler_test262_cases":1900,"compiler_test262_pass":1834,"compiler_test262_failures":66,"compiler_test262_compiler_errors":0,"compiler_test262_compiler_crashes":0,"compiler_test262_compiler_fails":8,"compiler_test262_both_fail":43,"compiler_test262_interpreter_fail_compiler_pass":0,"compatibility_pass":1834,"compatibility_cases":1900,"compiler_errors":0,"compiler_crashes":0,"compiler_fails":8,"both_fail":43,"interpreter_fail_compiler_pass":0,"elapsed_ms":79825},"status":"keep","description":"Apply generic Array push and pop semantics","timestamp":1778724853507,"segment":107,"confidence":null,"iterationTokens":7672,"asi":{"hypothesis":"Array.prototype.push/pop are intentionally generic and should operate through LengthOfArrayLike plus ordinary Set/Delete semantics instead of heap-list-only helpers; this should fix ordinary object and primitive receiver clusters while preserving array behavior.","fixed_focus":["Array/prototype/push/S15.4.4.7_A2_T1.js","Array/prototype/push/call-with-boolean.js","Array/prototype/pop/S15.4.4.6_A2_T1.js"],"remaining_cluster":"Array 1900 reduced 84 to 66; residuals still include persistent 1800 failures plus pop/push edge cases and reduce cluster."}}
{"run":1365,"commit":"7ef8bd6","metric":43,"metrics":{"compiler_test262_cases":1900,"compiler_test262_pass":1857,"compiler_test262_failures":43,"compiler_test262_compiler_errors":0,"compiler_test262_compiler_crashes":0,"compiler_test262_compiler_fails":12,"compiler_test262_both_fail":29,"compiler_test262_interpreter_fail_compiler_pass":0,"compatibility_pass":1857,"compatibility_cases":1900,"compiler_errors":0,"compiler_crashes":0,"compiler_fails":12,"both_fail":29,"interpreter_fail_compiler_pass":0,"elapsed_ms":78961},"status":"keep","description":"Apply generic Array reduce semantics","timestamp":1778725148598,"segment":107,"confidence":2.2777777777777777,"iterationTokens":6496,"asi":{"hypothesis":"Array.prototype.reduce/reduceRight should use generic LengthOfArrayLike, HasProperty/Get, initial accumulator search, callback validation, and original receiver argument semantics rather than materializing heap lists.","fixed_focus":["Array/prototype/reduce/15.4.4.21-1-1.js","Array/prototype/reduce/15.4.4.21-1-11.js","Array/prototype/reduce/15.4.4.21-2-1.js"],"tradeoff":"Primary compatibility improved substantially, but compiler-only failures increased from 8 to 12; inspect residual compiler-only reduce cases before further broad reduce changes."}}
{"run":1366,"commit":"52aa29d","metric":41,"metrics":{"compiler_test262_cases":1900,"compiler_test262_pass":1859,"compiler_test262_failures":41,"compiler_test262_compiler_errors":0,"compiler_test262_compiler_crashes":0,"compiler_test262_compiler_fails":12,"compiler_test262_both_fail":27,"compiler_test262_interpreter_fail_compiler_pass":0,"compatibility_pass":1859,"compatibility_cases":1900,"compiler_errors":0,"compiler_crashes":0,"compiler_fails":12,"both_fail":27,"interpreter_fail_compiler_pass":0,"elapsed_ms":80702},"status":"keep","description":"Reject string receivers in Array push and pop","timestamp":1778725435509,"segment":107,"confidence":3.44,"iterationTokens":4670,"asi":{"hypothesis":"String wrapper indexed and length properties are effectively non-writable for Array.prototype.push/pop, so attempting their mandatory Set operations with Throw=true should throw TypeError.","fixed_focus":["Array/prototype/push/throws-with-string-receiver.js","Array/prototype/pop/throws-with-string-receiver.js"],"next_action_hint":"Remaining push/pop failures are frozen/non-writable length and integer-limit edge cases, not primitive string receiver validation."}}
{"run":1367,"commit":"a4c885e","metric":40,"metrics":{"compiler_test262_cases":1900,"compiler_test262_pass":1860,"compiler_test262_failures":40,"compiler_test262_compiler_errors":0,"compiler_test262_compiler_crashes":0,"compiler_test262_compiler_fails":12,"compiler_test262_both_fail":26,"compiler_test262_interpreter_fail_compiler_pass":0,"compatibility_pass":1860,"compatibility_cases":1900,"compiler_errors":0,"compiler_crashes":0,"compiler_fails":12,"both_fail":26,"interpreter_fail_compiler_pass":0,"elapsed_ms":79608},"status":"keep","description":"Reject nullish Array prototype function calls","timestamp":1778725967588,"segment":107,"confidence":14.666666666666666,"iterationTokens":27293,"asi":{"hypothesis":"Array.prototype methods used as bare functions must reject nullish this before coercing callback, index, separator, or prototype/global properties; several legacy helpers still returned defaults for nil receivers.","fixed_focus":"Array/prototype/methods-called-as-functions.js","semantic_scope":"Added nullish receiver rejection for reverse/shift/unshift/slice/splice/sort/some/toString and installed Array.prototype.toLocaleString with the same nullish check."}}
{"run":1368,"commit":"a809537","metric":37,"metrics":{"compiler_test262_cases":1900,"compiler_test262_pass":1863,"compiler_test262_failures":37,"compiler_test262_compiler_errors":0,"compiler_test262_compiler_crashes":0,"compiler_test262_compiler_fails":12,"compiler_test262_both_fail":20,"compiler_test262_interpreter_fail_compiler_pass":0,"compatibility_pass":1863,"compatibility_cases":1900,"compiler_errors":0,"compiler_crashes":0,"compiler_fails":12,"both_fail":20,"interpreter_fail_compiler_pass":0,"elapsed_ms":128397},"status":"keep","description":"Honor virtual lengths in Array push","timestamp":1778726288462,"segment":107,"confidence":13.428571428571429,"iterationTokens":2664,"asi":{"hypothesis":"Array push/pop and generic array-like helpers should observe virtual/side-property array length rather than dense storage size, and push should perform indexed writes before the final length Set so integer-limit side effects are preserved.","fixed_focus":["Array/prototype/push/S15.4.4.7_A3.js","Array/prototype/push/S15.4.4.7_A4_T1.js","Array/prototype/push/S15.4.4.7_A4_T2.js","Array/prototype/push/clamps-to-integer-limit.js","Array/prototype/push/length-near-integer-limit.js"],"tradeoff":"Runtime increased in this run; primary improvement is real but monitor whether using Get.length_of in array_like_length affects hot paths."}}
{"run":1369,"commit":"814a809","metric":35,"metrics":{"compiler_test262_cases":1900,"compiler_test262_pass":1865,"compiler_test262_failures":35,"compiler_test262_compiler_errors":0,"compiler_test262_compiler_crashes":0,"compiler_test262_compiler_fails":12,"compiler_test262_both_fail":18,"compiler_test262_interpreter_fail_compiler_pass":0,"compatibility_pass":1865,"compatibility_cases":1900,"compiler_errors":0,"compiler_crashes":0,"compiler_fails":12,"both_fail":18,"interpreter_fail_compiler_pass":0,"elapsed_ms":129284},"status":"keep","description":"Reject Array push past safe length","timestamp":1778726597296,"segment":107,"confidence":12.25,"iterationTokens":4329,"asi":{"hypothesis":"Array.prototype.push should reject lengths above the safe integer limit with TypeError before indexed writes, while still allowing the 2^32-1 edge path to write the non-array-index property before the final length RangeError.","fixed_focus":["Array/prototype/push/S15.4.4.7_A2_T2.js","Array/prototype/push/throws-if-integer-limit-exceeded.js"],"remaining_push_cluster":"Frozen/non-writable length cases remain; max Array length edge behavior is now preserved."}}
{"run":1370,"commit":"b662219","metric":29,"metrics":{"compiler_test262_cases":1900,"compiler_test262_pass":1871,"compiler_test262_failures":29,"compiler_test262_compiler_errors":0,"compiler_test262_compiler_crashes":0,"compiler_test262_compiler_fails":12,"compiler_test262_both_fail":12,"compiler_test262_interpreter_fail_compiler_pass":0,"compatibility_pass":1871,"compatibility_cases":1900,"compiler_errors":0,"compiler_crashes":0,"compiler_fails":12,"both_fail":12,"interpreter_fail_compiler_pass":0,"elapsed_ms":129077},"status":"keep","description":"Throw on failed Array push and pop length writes","timestamp":1778726979247,"segment":107,"confidence":12.222222222222221,"iterationTokens":13215,"asi":{"hypothesis":"Array.prototype.push/pop perform their final length Set with Throw=true, so non-writable length descriptors must raise TypeError instead of silently preserving the old length.","fixed_focus":["Array/prototype/push/set-length-array-length-is-non-writable.js","Array/prototype/push/set-length-zero-array-length-is-non-writable.js","Array/prototype/pop/set-length-zero-array-length-is-non-writable.js"],"known_residual":"pop/set-length-array-length-is-non-writable.js still double-observes the inherited getter before the final length Set; investigate array hole Get/Delete interaction separately."}}
{"run":1371,"commit":"b662219","metric":29,"metrics":{"compiler_test262_cases":1900,"compiler_test262_pass":1871,"compiler_test262_failures":29,"compiler_test262_compiler_errors":0,"compiler_test262_compiler_crashes":0,"compiler_test262_compiler_fails":12,"compiler_test262_both_fail":15,"compiler_test262_interpreter_fail_compiler_pass":0,"compatibility_pass":1871,"compatibility_cases":1900,"compiler_errors":0,"compiler_crashes":0,"compiler_fails":12,"both_fail":15,"interpreter_fail_compiler_pass":0,"elapsed_ms":80005},"status":"discard","description":"Scan sparse keys for huge lastIndexOf ranges","timestamp":1778727378440,"segment":107,"confidence":11,"iterationTokens":10562,"asi":{"hypothesis":"For huge virtual array lengths, indexOf/lastIndexOf can scan present own descriptor keys instead of enumerating billions of holes.","rollback_reason":"The timeout/crash classification improved to ordinary failures and runtime improved, but primary compatibility stayed unchanged at 29 and focused sparse high-index lastIndexOf cases still returned -1.","next_action_hint":"If revisiting sparse high-index search, inspect where high index writes are stored and why OwnProperty.descriptor_keys does not surface index 4294967294; do not retry descriptor-key scanning unchanged."}}
{"run":1372,"commit":"5bc24dc","metric":28,"metrics":{"compiler_test262_cases":1900,"compiler_test262_pass":1872,"compiler_test262_failures":28,"compiler_test262_compiler_errors":0,"compiler_test262_compiler_crashes":0,"compiler_test262_compiler_fails":12,"compiler_test262_both_fail":11,"compiler_test262_interpreter_fail_compiler_pass":0,"compatibility_pass":1872,"compatibility_cases":1900,"compiler_errors":0,"compiler_crashes":0,"compiler_fails":12,"both_fail":11,"interpreter_fail_compiler_pass":0,"elapsed_ms":128998},"status":"keep","description":"Report Object prototype for Array prototype","timestamp":1778727695020,"segment":107,"confidence":8,"iterationTokens":3701,"asi":{"hypothesis":"The cached Array.prototype object should report Object.prototype as its internal prototype to Object.getPrototypeOf without mutating the prototype map or installing a raw __proto__ link.","fixed_focus":"Array/prototype/proto.js","caution":"This is a query-path fix only; previous attempts to mutate collection/array prototype parent links hung or OOMed, so keep avoiding raw prototype-chain rewrites."}}
{"type":"config","name":"Array Test262 compatibility 2000-case expansion","metricName":"compatibility_failures","metricUnit":"","bestDirection":"lower"}
{"run":1373,"commit":"28ccb0d","metric":28,"metrics":{"compiler_test262_cases":2000,"compiler_test262_pass":1972,"compiler_test262_failures":28,"compiler_test262_compiler_errors":0,"compiler_test262_compiler_crashes":0,"compiler_test262_compiler_fails":12,"compiler_test262_both_fail":11,"compiler_test262_interpreter_fail_compiler_pass":0,"compatibility_pass":1972,"compatibility_cases":2000,"compiler_errors":0,"compiler_crashes":0,"compiler_fails":12,"both_fail":11,"interpreter_fail_compiler_pass":0,"elapsed_ms":134900},"status":"keep","description":"Baseline Array 2000-case expansion","timestamp":1778727974479,"segment":108,"confidence":null,"iterationTokens":129,"asi":{"hypothesis":"Expand Array workload from 1900 to 2000 after reducing 1900 to 28 failures; the next 100 cases may be covered by current push/pop/reduce/reverse/shift semantics.","workload":"AUTORESEARCH_TEST262_CATEGORY=built-ins/Array TEST262_LIMIT=2000 TEST262_ERROR_LIMIT=1360 ./autoresearch.sh","baseline_note":"Array 2000 baseline remains 28 failures, so the added slice introduced no new failures."}}
{"type":"config","name":"Array Test262 compatibility 2100-case expansion","metricName":"compatibility_failures","metricUnit":"","bestDirection":"lower"}
{"run":1374,"commit":"92ecd96","metric":28,"metrics":{"compiler_test262_cases":2100,"compiler_test262_pass":2072,"compiler_test262_failures":28,"compiler_test262_compiler_errors":0,"compiler_test262_compiler_crashes":0,"compiler_test262_compiler_fails":12,"compiler_test262_both_fail":11,"compiler_test262_interpreter_fail_compiler_pass":0,"compatibility_pass":2072,"compatibility_cases":2100,"compiler_errors":0,"compiler_crashes":0,"compiler_fails":12,"both_fail":11,"interpreter_fail_compiler_pass":0,"elapsed_ms":142258},"status":"keep","description":"Baseline Array 2100-case expansion","timestamp":1778728257607,"segment":109,"confidence":null,"iterationTokens":129,"asi":{"hypothesis":"Continue Array workload expansion after the 2000-case plateau; the next 100 cases may reveal reverse/slice/sort clusters or remain covered by current generic semantics.","workload":"AUTORESEARCH_TEST262_CATEGORY=built-ins/Array TEST262_LIMIT=2100 TEST262_ERROR_LIMIT=1430 ./autoresearch.sh","baseline_note":"Array 2100 baseline remains 28 failures; no new failures in the added slice."}}
{"type":"config","name":"Array Test262 compatibility 2200-case expansion","metricName":"compatibility_failures","metricUnit":"","bestDirection":"lower"}
{"run":1375,"commit":"beeb212","metric":32,"metrics":{"compiler_test262_cases":2200,"compiler_test262_pass":2168,"compiler_test262_failures":32,"compiler_test262_compiler_errors":0,"compiler_test262_compiler_crashes":0,"compiler_test262_compiler_fails":16,"compiler_test262_both_fail":11,"compiler_test262_interpreter_fail_compiler_pass":0,"compatibility_pass":2168,"compatibility_cases":2200,"compiler_errors":0,"compiler_crashes":0,"compiler_fails":16,"both_fail":11,"interpreter_fail_compiler_pass":0,"elapsed_ms":148136},"status":"keep","description":"Baseline Array 2200-case expansion","timestamp":1778728541063,"segment":110,"confidence":null,"iterationTokens":129,"asi":{"hypothesis":"Expand Array workload to 2200 after 2100 remained flat; new slice may expose reduceRight compiler parity or remaining method metadata cases.","workload":"AUTORESEARCH_TEST262_CATEGORY=built-ins/Array TEST262_LIMIT=2200 TEST262_ERROR_LIMIT=1500 ./autoresearch.sh","baseline_note":"Array 2200 baseline is 32 failures: four new compiler-only failures, both_fail unchanged at 11."}}
{"run":1376,"commit":"523d5ac","metric":24,"metrics":{"compiler_test262_cases":2200,"compiler_test262_pass":2176,"compiler_test262_failures":24,"compiler_test262_compiler_errors":0,"compiler_test262_compiler_crashes":0,"compiler_test262_compiler_fails":8,"compiler_test262_both_fail":11,"compiler_test262_interpreter_fail_compiler_pass":0,"compatibility_pass":2176,"compatibility_cases":2200,"compiler_errors":0,"compiler_crashes":0,"compiler_fails":8,"both_fail":11,"interpreter_fail_compiler_pass":0,"elapsed_ms":148253},"status":"keep","description":"Read inherited indexed values for array-like reductions","timestamp":1778729041683,"segment":110,"confidence":null,"iterationTokens":7199,"asi":{"hypothesis":"Array-like algorithms should observe inherited length and indexed values from an object's prototype when no own length/index exists; compiled constructor-prototype objects exposed a path where Get returned zero/undefined despite inherited array data.","fixed_focus":["Array/prototype/reduce/15.4.4.21-10-3.js","Array/prototype/reduce/15.4.4.21-10-4.js","Array/prototype/reduce/15.4.4.21-10-6.js","Array/prototype/reduce/15.4.4.21-10-7.js","Array/prototype/reduceRight/15.4.4.22-10-3.js","Array/prototype/reduceRight/15.4.4.22-10-4.js","Array/prototype/reduceRight/15.4.4.22-10-6.js","Array/prototype/reduceRight/15.4.4.22-10-7.js"],"semantic_scope":"Narrowed to array-like length/value helpers: if there is no own length/index and the computed value is zero/undefined, consult the immediate prototype value."}}
{"type":"config","name":"Array Test262 compatibility 2300-case expansion","metricName":"compatibility_failures","metricUnit":"","bestDirection":"lower"}
