{"run":599,"commit":"842b6b0","metric":41,"metrics":{"compiler_test262_cases":946,"compiler_test262_pass":905,"compiler_test262_failures":41,"compiler_test262_compiler_errors":0,"compiler_test262_compiler_crashes":0,"compiler_test262_compiler_fails":9,"compiler_test262_both_fail":21,"compiler_test262_interpreter_fail_compiler_pass":11,"compatibility_pass":905,"compatibility_cases":946,"compiler_errors":0,"compiler_crashes":0,"compiler_fails":9,"both_fail":21,"interpreter_fail_compiler_pass":11,"elapsed_ms":31525},"status":"discard","description":"Reset method name and length tombstones on definition","timestamp":1778026038829,"segment":20,"confidence":6.095238095238095,"iterationTokens":10301,"asi":{"hypothesis":"Compiler-only failures from method name/length static metadata are caused by delete tombstones persisting between interpreter and compiler runs; reset tombstones when defining method metadata.","rollback_reason":"Focused descriptor probes still pass, but primary metric unchanged at 41 and the same 9 compiler-only failures remain.","next_action_hint":"Tombstone persistence is not the root cause. Inspect propertyHelper execution in compiled mode for function statics; compiler sees obj['length']/name mismatch during verification despite simple probes passing."}}
{"run":600,"commit":"842b6b0","metric":41,"metrics":{"compiler_test262_cases":946,"compiler_test262_pass":905,"compiler_test262_failures":41,"compiler_test262_compiler_errors":0,"compiler_test262_compiler_crashes":0,"compiler_test262_compiler_fails":0,"compiler_test262_both_fail":30,"compiler_test262_interpreter_fail_compiler_pass":11,"compatibility_pass":905,"compatibility_cases":946,"compiler_errors":0,"compiler_crashes":0,"compiler_fails":0,"both_fail":30,"interpreter_fail_compiler_pass":11,"elapsed_ms":33389},"status":"discard","description":"Throw on null-prototype ToPropertyKey without broad stringification changes","timestamp":1778026290566,"segment":20,"confidence":5.818181818181818,"iterationTokens":3187,"asi":{"hypothesis":"A narrower ToPropertyKey fix for null-prototype objects, limited to PropertyKey.normalize and caught in define_method_computed, should pass focused computed accessor abrupt-completion tests without the earlier suite regression.","rollback_reason":"Focused repro passed and no checks failed, but primary compatibility_failures stayed at current best 41, so discard under primary metric rule.","next_action_hint":"The remaining accessor-name-computed-err-to-prop-key failure may have additional setter half or harness ordering issues; inspect exact full Test262 case with this narrow fix before retrying."}}
{"run":601,"commit":"48a9bbd","metric":45,"metrics":{"compiler_test262_cases":946,"compiler_test262_pass":901,"compiler_test262_failures":45,"compiler_test262_compiler_errors":0,"compiler_test262_compiler_crashes":0,"compiler_test262_compiler_fails":0,"compiler_test262_both_fail":31,"compiler_test262_interpreter_fail_compiler_pass":11,"compatibility_pass":901,"compatibility_cases":946,"compiler_errors":0,"compiler_crashes":0,"compiler_fails":0,"both_fail":31,"interpreter_fail_compiler_pass":11,"elapsed_ms":30334},"status":"discard","description":"Fix dup1 stack order and proxy rest symbol exclusion","timestamp":1778027514205,"segment":20,"confidence":5.818181818181818,"iterationTokens":15775,"asi":{"hypothesis":"QuickJS OP_dup1 stack behavior should duplicate the deeper operand, making object-rest CopyDataProperties receive the proxy source instead of the excluded symbol; combined with symbol-aware copy/exclusion this should fix proxy rest cases.","rollback_reason":"Focused proxy rest repro passed, but primary compatibility_failures regressed from current best 41 to 45 despite checks passing.","next_action_hint":"Do not combine broad dup1 semantics change with symbol-copy. Investigate whether OP_dup1 correction regresses other bytecode patterns, and isolate copy_data_properties mask/source handling separately."}}
{"run":602,"commit":"48a9bbd","metric":41,"metrics":{"compiler_test262_cases":946,"compiler_test262_pass":905,"compiler_test262_failures":41,"compiler_test262_compiler_errors":0,"compiler_test262_compiler_crashes":0,"compiler_test262_compiler_fails":0,"compiler_test262_both_fail":30,"compiler_test262_interpreter_fail_compiler_pass":11,"compatibility_pass":905,"compatibility_cases":946,"compiler_errors":0,"compiler_crashes":0,"compiler_fails":0,"both_fail":30,"interpreter_fail_compiler_pass":11,"elapsed_ms":33115},"status":"discard","description":"Match QuickJS dup1 stack semantics","timestamp":1778027779362,"segment":20,"confidence":5.818181818181818,"iterationTokens":15775,"asi":{"hypothesis":"QuickJS OP_dup1 is documented as `a b -> a a b`; correcting interpreter and compiler lowering should fix stack-sensitive object rest bytecode without changing copy semantics.","rollback_reason":"Primary metric unchanged at 41, so discard under autoresearch primary metric rule despite passing checks.","next_action_hint":"OP_dup1 correction alone is neutral on object workload. If revisited, justify as independent correctness outside autoresearch or combine only after isolating regressing copy symbol behavior."}}
{"run":603,"commit":"48a9bbd","metric":49,"metrics":{"compiler_test262_cases":946,"compiler_test262_pass":897,"compiler_test262_failures":49,"compiler_test262_compiler_errors":0,"compiler_test262_compiler_crashes":0,"compiler_test262_compiler_fails":9,"compiler_test262_both_fail":29,"compiler_test262_interpreter_fail_compiler_pass":11,"compatibility_pass":897,"compatibility_cases":946,"compiler_errors":0,"compiler_crashes":0,"compiler_fails":9,"both_fail":29,"interpreter_fail_compiler_pass":11,"elapsed_ms":29427},"status":"discard","description":"Expose virtual function name and length descriptors","timestamp":1778028143274,"segment":20,"confidence":5.565217391304348,"iterationTokens":26941,"asi":{"hypothesis":"Function objects can expose virtual own non-enumerable configurable non-writable name/length descriptors from VM function metadata, with delete tombstones and blocked writes, instead of method-definition static metadata.","rollback_reason":"Focused descriptor/delete probe passed, but primary regressed from 41 to 49 and compiler-only failures reappeared.","next_action_hint":"Virtual function metadata broadly perturbs propertyHelper because configurable deletion in one mode/run affects subsequent checks or compiled identity differently. Do not retry without isolating object/function identity and restoration semantics."}}
{"run":604,"commit":"48a9bbd","metric":49,"metrics":{"compiler_test262_cases":946,"compiler_test262_pass":897,"compiler_test262_failures":49,"compiler_test262_compiler_errors":0,"compiler_test262_compiler_crashes":0,"compiler_test262_compiler_fails":0,"compiler_test262_both_fail":38,"compiler_test262_interpreter_fail_compiler_pass":11,"compatibility_pass":897,"compatibility_cases":946,"compiler_errors":0,"compiler_crashes":0,"compiler_fails":0,"both_fail":38,"interpreter_fail_compiler_pass":11,"elapsed_ms":28280},"status":"discard","description":"Write back direct eval transient globals into caller locals","timestamp":1778028369997,"segment":20,"confidence":5.333333333333333,"iterationTokens":10044,"asi":{"hypothesis":"Native direct eval assignments such as eval('o = {...};') are lost because write_back_eval_vars reads only persistent globals, not final eval context globals; merging transient globals into writeback should fix direct-eval object accessor cases.","rollback_reason":"Focused semicolon assignment repro passed, but the object suite regressed from 41 to 49 failures.","next_action_hint":"Transient writeback is too broad and changes eval scoping/restoration semantics. Target only assignments to existing caller var_refs or inspect exact eval accessor bytecode write path before retrying."}}
{"run":605,"commit":"ac10431","metric":40,"metrics":{"compiler_test262_cases":946,"compiler_test262_pass":906,"compiler_test262_failures":40,"compiler_test262_compiler_errors":0,"compiler_test262_compiler_crashes":0,"compiler_test262_compiler_fails":0,"compiler_test262_both_fail":29,"compiler_test262_interpreter_fail_compiler_pass":11,"compatibility_pass":906,"compatibility_cases":946,"compiler_errors":0,"compiler_crashes":0,"compiler_fails":0,"both_fail":29,"interpreter_fail_compiler_pass":11,"elapsed_ms":27817},"status":"keep","description":"Reuse global Function.prototype for function object prototype lookups","timestamp":1778028604501,"segment":20,"confidence":5.2,"iterationTokens":5740,"asi":{"hypothesis":"Function objects should have the same [[Prototype]] as the global Function.prototype object; the lazy Object.func_proto cache was creating a separate prototype object and breaking identity checks.","improvement":"Fixed Object.getPrototypeOf(function(){}) === Function.prototype and object method prototype identity, reducing object compatibility failures from 41 to 40.","next_action_hint":"Continue with generator method prototype identity or remaining direct-eval/accessor clusters; Function.prototype cache identity is now canonicalized."}}
{"run":606,"commit":"ac10431","metric":40,"metrics":{"compiler_test262_cases":946,"compiler_test262_pass":906,"compiler_test262_failures":40,"compiler_test262_compiler_errors":0,"compiler_test262_compiler_crashes":0,"compiler_test262_compiler_fails":0,"compiler_test262_both_fail":29,"compiler_test262_interpreter_fail_compiler_pass":11,"compatibility_pass":906,"compatibility_cases":946,"compiler_errors":0,"compiler_crashes":0,"compiler_fails":0,"both_fail":29,"interpreter_fail_compiler_pass":11,"elapsed_ms":28909},"status":"discard","description":"Cache generator function prototypes and expose generator method prototype descriptors","timestamp":1778028919134,"segment":20,"confidence":5,"iterationTokens":8563,"asi":{"hypothesis":"Generator functions need a distinct GeneratorFunction.prototype whose own prototype property is the shared GeneratorPrototype, and generator methods need an own non-enumerable non-configurable prototype descriptor.","rollback_reason":"Focused interpreter generator method prototype probe improved, but compiled chained identity still failed and primary metric stayed at 40.","next_action_hint":"The remaining generator-prototype failure is compiled identity-specific. Inspect BEAM lowering/runtime helper evaluation of chained Object.getPrototypeOf(function*(){}).prototype before changing heap caches again."}}
{"run":607,"commit":"2bac4b5","metric":40,"metrics":{"compiler_test262_cases":946,"compiler_test262_pass":906,"compiler_test262_failures":40,"compiler_test262_compiler_errors":0,"compiler_test262_compiler_crashes":0,"compiler_test262_compiler_fails":0,"compiler_test262_both_fail":26,"compiler_test262_interpreter_fail_compiler_pass":11,"compatibility_pass":906,"compatibility_cases":946,"compiler_errors":0,"compiler_crashes":0,"compiler_fails":0,"both_fail":26,"interpreter_fail_compiler_pass":11,"elapsed_ms":27996},"status":"discard","description":"Copy enumerable symbol keys from proxies","timestamp":1778029142008,"segment":20,"confidence":5,"iterationTokens":3915,"asi":{"hypothesis":"Object spread/rest copying should include enumerable symbol keys returned by proxy ownKeys, reducing proxy symbol copy failures without changing rest exclusion stack handling.","rollback_reason":"Focused proxy spread symbol repro passed and both_fail dropped, but total compatibility_failures stayed at 40 due offsetting category shifts, so discard under primary metric rule.","next_action_hint":"Symbol copying is semantically needed but not independently improving this workload. Revisit with exact rest exclusion/gopd-not-called behavior so total failures decrease."}}
{"run":608,"commit":"23325e4","metric":40,"metrics":{"compiler_test262_cases":946,"compiler_test262_pass":906,"compiler_test262_failures":40,"compiler_test262_compiler_errors":0,"compiler_test262_compiler_crashes":0,"compiler_test262_compiler_fails":4,"compiler_test262_both_fail":25,"compiler_test262_interpreter_fail_compiler_pass":11,"compatibility_pass":906,"compatibility_cases":946,"compiler_errors":0,"compiler_crashes":0,"compiler_fails":4,"both_fail":25,"interpreter_fail_compiler_pass":11,"elapsed_ms":29583},"status":"checks_failed","description":"Store function name as non-writable static descriptor","timestamp":1778029548972,"segment":20,"confidence":4.642857142857143,"iterationTokens":19718,"asi":{"hypothesis":"Real static descriptor storage for renamed function name properties may avoid the earlier virtual metadata regressions by giving Object.defineProperty/delete/write coherent descriptor state.","rollback_reason":"Backpressure checks failed due grouped-clause compiler warning, and primary metric did not improve anyway; compiler-only failures remained.","next_action_hint":"If retrying, group callable getOwnPropertyDescriptor clauses with existing clauses first, but primary was unchanged and compiler_fails=4, so inspect exact compiler-only failures before pursuing name metadata further."}}
{"run":609,"commit":"23325e4","metric":40,"metrics":{"compiler_test262_cases":946,"compiler_test262_pass":906,"compiler_test262_failures":40,"compiler_test262_compiler_errors":0,"compiler_test262_compiler_crashes":0,"compiler_test262_compiler_fails":0,"compiler_test262_both_fail":29,"compiler_test262_interpreter_fail_compiler_pass":11,"compatibility_pass":906,"compatibility_cases":946,"compiler_errors":0,"compiler_crashes":0,"compiler_fails":0,"both_fail":29,"interpreter_fail_compiler_pass":11,"elapsed_ms":28461},"status":"discard","description":"Throw for null-prototype computed accessor property keys","timestamp":1778029727170,"segment":20,"confidence":4.482758620689655,"iterationTokens":2451,"asi":{"hypothesis":"Computed accessor names using Object.create(null) should throw TypeError during ToPropertyKey; adding a narrow PropertyKey.normalize object path and catching JS throws in computed method definition should fix that case.","rollback_reason":"Focused Test262 case passed, but primary metric stayed at current best 40, implying an offsetting failure shift or no net workload gain.","next_action_hint":"Do not retry the same null-prototype ToPropertyKey fix alone. Compare full failure list before/after to identify the offsetting case if this semantic is needed later."}}
{"run":610,"commit":"23325e4","metric":40,"metrics":{"compiler_test262_cases":946,"compiler_test262_pass":906,"compiler_test262_failures":40,"compiler_test262_compiler_errors":0,"compiler_test262_compiler_crashes":0,"compiler_test262_compiler_fails":9,"compiler_test262_both_fail":20,"compiler_test262_interpreter_fail_compiler_pass":11,"compatibility_pass":906,"compatibility_cases":946,"compiler_errors":0,"compiler_crashes":0,"compiler_fails":9,"both_fail":20,"interpreter_fail_compiler_pass":11,"elapsed_ms":29458},"status":"discard","description":"Store object method name and length descriptors","timestamp":1778029972048,"segment":20,"confidence":4.333333333333333,"iterationTokens":6315,"asi":{"hypothesis":"Object method/accessor functions should carry real own name and length data descriptors with non-writable, non-enumerable, configurable attributes; descriptor-aware write/delete/defineProperty handling should avoid previous metadata regressions.","rollback_reason":"Focused setter length probe passed and both_fail dropped, but primary stayed at 40 and 9 compiler-only failures appeared, so discard.","next_action_hint":"Method metadata fixes interpreter/shared failures but creates compiled-only propertyHelper failures. Inspect the 9 compiler_fails under this patch before retrying, likely compiled identity/restore semantics for method function statics."}}
{"run":611,"commit":"23325e4","metric":44,"metrics":{"compiler_test262_cases":946,"compiler_test262_pass":902,"compiler_test262_failures":44,"compiler_test262_compiler_errors":0,"compiler_test262_compiler_crashes":0,"compiler_test262_compiler_fails":0,"compiler_test262_both_fail":37,"compiler_test262_interpreter_fail_compiler_pass":7,"compatibility_pass":902,"compatibility_cases":946,"compiler_errors":0,"compiler_crashes":0,"compiler_fails":0,"both_fail":37,"interpreter_fail_compiler_pass":7,"elapsed_ms":28393},"status":"discard","description":"Return direct eval assignments through caller globals","timestamp":1778030236134,"segment":20,"confidence":4.333333333333333,"iterationTokens":5974,"asi":{"hypothesis":"Direct eval assignments to existing caller-visible variables should be returned as transient globals and merged into caller context, fixing eval-created object accessor cases without broad declared-var writeback.","rollback_reason":"Focused eval assignment probes passed and interpreter_fail_compiler_pass dropped, but total compatibility_failures regressed from 40 to 44 by increasing shared failures.","next_action_hint":"Assignment propagation must distinguish eval var declarations from assignment expressions and avoid changing var-declaration semantics. Inspect cases newly shifted to both_fail before retrying."}}
{"run":612,"commit":"c7673c5","metric":40,"metrics":{"compiler_test262_cases":946,"compiler_test262_pass":906,"compiler_test262_failures":40,"compiler_test262_compiler_errors":0,"compiler_test262_compiler_crashes":0,"compiler_test262_compiler_fails":1,"compiler_test262_both_fail":28,"compiler_test262_interpreter_fail_compiler_pass":11,"compatibility_pass":906,"compatibility_cases":946,"compiler_errors":0,"compiler_crashes":0,"compiler_fails":1,"both_fail":28,"interpreter_fail_compiler_pass":11,"elapsed_ms":30660},"status":"discard","description":"Expose setter length descriptors only","timestamp":1778030753689,"segment":20,"confidence":4.333333333333333,"iterationTokens":14542,"asi":{"hypothesis":"A narrow descriptor fix for object literal setters' length property may fix setter-length-dflt without the broad method name/length metadata regressions.","rollback_reason":"Focused setter length probe passed and both_fail decreased by one, but total compatibility_failures stayed at 40 and one compiler-only failure appeared.","next_action_hint":"Setter length descriptor is semantically useful but still shifts a compiler-only propertyHelper failure. Inspect the single compiler_fail under this narrow patch before retrying."}}
{"type":"config","name":"QuickBEAM function-expression compatibility","metricName":"compatibility_failures","metricUnit":"","bestDirection":"lower"}
{"run":613,"commit":"a6f6a29","metric":13,"metrics":{"compiler_test262_cases":264,"compiler_test262_pass":251,"compiler_test262_failures":13,"compiler_test262_compiler_errors":0,"compiler_test262_compiler_crashes":0,"compiler_test262_compiler_fails":4,"compiler_test262_both_fail":9,"compiler_test262_interpreter_fail_compiler_pass":0,"compatibility_pass":251,"compatibility_cases":264,"compiler_errors":0,"compiler_crashes":0,"compiler_fails":4,"both_fail":9,"interpreter_fail_compiler_pass":0,"elapsed_ms":10669},"status":"keep","description":"Baseline function-expression compatibility workload","timestamp":1778030900809,"segment":21,"confidence":null,"iterationTokens":113,"asi":{"hypothesis":"Object-expression compatibility has plateaued at 40 after many neutral/regressing object-focused trials, so start the next planned Test262 phase for language/expressions/function.","improvement":"Established the baseline for the new workload: 13 compatibility failures across 264 function-expression cases.","next_action_hint":"List function-expression failures and target clusters that improve total compatibility_failures while preserving object/backpressure checks."}}
{"run":614,"commit":"a6f6a29","metric":13,"metrics":{"compiler_test262_cases":264,"compiler_test262_pass":251,"compiler_test262_failures":13,"compiler_test262_compiler_errors":0,"compiler_test262_compiler_crashes":0,"compiler_test262_compiler_fails":4,"compiler_test262_both_fail":9,"compiler_test262_interpreter_fail_compiler_pass":0,"compatibility_pass":251,"compatibility_cases":264,"compiler_errors":0,"compiler_crashes":0,"compiler_fails":4,"both_fail":9,"interpreter_fail_compiler_pass":0,"elapsed_ms":9582},"status":"discard","description":"Keep local reference writes out of globals","timestamp":1778031319956,"segment":21,"confidence":null,"iterationTokens":18468,"asi":{"hypothesis":"With-statement unscopables fall through to make_loc_ref, but put_ref_value writes every cell reference back to globals; tagging global refs separately should keep local writes local and fix unscopables-with failures.","rollback_reason":"Focused with/unscopables assignment probe passed, but function-expression primary metric stayed at 13, so discard under the primary metric rule.","next_action_hint":"The two unscopables Test262 failures likely have an additional nested function/captured var path not covered by the simple probe. Inspect their bytecode refs before retrying."}}
