{"run":582,"commit":"d31298e","metric":62,"metrics":{"compiler_test262_cases":946,"compiler_test262_pass":884,"compiler_test262_failures":62,"compiler_test262_compiler_errors":0,"compiler_test262_compiler_crashes":0,"compiler_test262_compiler_fails":0,"compiler_test262_both_fail":48,"compiler_test262_interpreter_fail_compiler_pass":11,"compatibility_pass":884,"compatibility_cases":946,"compiler_errors":0,"compiler_crashes":0,"compiler_fails":0,"both_fail":48,"interpreter_fail_compiler_pass":11,"elapsed_ms":38857},"status":"discard","description":"Copy symbol keys during proxy object spread","timestamp":1778019858605,"segment":20,"confidence":8.6,"iterationTokens":8255,"asi":{"hypothesis":"Object spread/rest should copy enumerable symbol keys from proxy ownKeys and Object.getOwnPropertyDescriptor must accept symbol property keys.","rollback_reason":"Focused proxy symbol repro passed and both_fail decreased, but primary compatibility_failures stayed at the current best 62, so this is not kept under the primary-metric rule.","next_action_hint":"Symbol spread likely needs additional compareArray/excluded-name semantics before it reduces total failures; combine with exact failing Test262 inspection rather than reapplying this alone."}}
{"run":583,"commit":"d31298e","metric":70,"metrics":{"compiler_test262_cases":946,"compiler_test262_pass":876,"compiler_test262_failures":70,"compiler_test262_compiler_errors":0,"compiler_test262_compiler_crashes":0,"compiler_test262_compiler_fails":0,"compiler_test262_both_fail":59,"compiler_test262_interpreter_fail_compiler_pass":11,"compatibility_pass":876,"compatibility_cases":946,"compiler_errors":0,"compiler_crashes":0,"compiler_fails":0,"both_fail":59,"interpreter_fail_compiler_pass":11,"elapsed_ms":38397},"status":"discard","description":"Expose virtual own function name and length descriptors","timestamp":1778020188381,"segment":20,"confidence":8.6,"iterationTokens":13821,"asi":{"hypothesis":"Function objects should expose own non-writable non-enumerable configurable name/length descriptors for object literal function-name Test262 cases.","rollback_reason":"Primary metric regressed badly to 70. Partial virtual properties interact poorly with delete/configurability and function prototype lookup.","next_action_hint":"Do not retry virtual name/length without a real function property store/tombstone model and verified delete semantics; propertyHelper delete still left hasOwnProperty true in focused probe."}}
{"run":584,"commit":"e4c5968","metric":130,"metrics":{"compiler_test262_cases":946,"compiler_test262_pass":816,"compiler_test262_failures":130,"compiler_test262_compiler_errors":2,"compiler_test262_compiler_crashes":0,"compiler_test262_compiler_fails":0,"compiler_test262_both_fail":108,"compiler_test262_interpreter_fail_compiler_pass":11,"compatibility_pass":816,"compatibility_cases":946,"compiler_errors":2,"compiler_crashes":0,"compiler_fails":0,"both_fail":108,"interpreter_fail_compiler_pass":11,"elapsed_ms":76298},"status":"checks_failed","description":"Normalize property keys before computed property values","timestamp":1778020649628,"segment":20,"confidence":7.166666666666667,"iterationTokens":21363,"asi":{"hypothesis":"Computed property keys should undergo ToPropertyKey before evaluating the property value expression, so inserted to_propkey before define_array_el value evaluation and lowered to_propkey.","rollback_reason":"Regressed object compatibility badly and failed checks. QuickJS bytecode has subtle stack/closure interactions; naive decoder insertion disrupts many cases and still did not fix value-capture order because nested method writes did not update the caller local before value load.","next_action_hint":"Do not insert to_propkey generically in InstructionDecoder. Investigate closure/local writeback for nested object methods before retrying computed-property-name-topropertykey-before-value-evaluation."}}
{"run":585,"commit":"4a5f395","metric":60,"metrics":{"compiler_test262_cases":946,"compiler_test262_pass":886,"compiler_test262_failures":60,"compiler_test262_compiler_errors":0,"compiler_test262_compiler_crashes":0,"compiler_test262_compiler_fails":0,"compiler_test262_both_fail":49,"compiler_test262_interpreter_fail_compiler_pass":11,"compatibility_pass":886,"compatibility_cases":946,"compiler_errors":0,"compiler_crashes":0,"compiler_fails":0,"both_fail":49,"interpreter_fail_compiler_pass":11,"elapsed_ms":35957},"status":"keep","description":"Preserve strict this for direct function calls","timestamp":1778021342527,"segment":20,"confidence":7.5,"iterationTokens":5743,"asi":{"hypothesis":"Strict functions called without an explicit receiver should observe this === undefined instead of globalThis in both interpreter and BEAM-compiled paths.","learned":"The fix needed both invocation context selection and push_this behavior; a backpressure test encoded the old gap and was updated to the correct JS strict-mode expectation.","fixed_cluster":"object method strict this cases, including method-definition/name-invoke-fn-strict and generator-invoke-fn-strict style failures","active_category":"language/expressions/object"}}
{"run":586,"commit":"18f98ae","metric":59,"metrics":{"compiler_test262_cases":946,"compiler_test262_pass":887,"compiler_test262_failures":59,"compiler_test262_compiler_errors":0,"compiler_test262_compiler_crashes":0,"compiler_test262_compiler_fails":0,"compiler_test262_both_fail":48,"compiler_test262_interpreter_fail_compiler_pass":11,"compatibility_pass":887,"compatibility_cases":946,"compiler_errors":0,"compiler_crashes":0,"compiler_fails":0,"both_fail":48,"interpreter_fail_compiler_pass":11,"elapsed_ms":37480},"status":"keep","description":"Reject non-constructor object methods","timestamp":1778021638714,"segment":20,"confidence":7.666666666666667,"iterationTokens":5707,"asi":{"hypothesis":"Functions without a prototype are generally not constructable, but class constructor bytecode also lacks has_prototype; rejecting has_prototype=false except class-source constructors should fix object method construction without regressing class construction.","learned":"The earlier broad has_prototype=false trial failed because class constructors need an exception. A source-based class guard is imperfect but matches current bytecode metadata and passes backpressure.","fixed_cluster":"method-definition/name-invoke-ctor","active_category":"language/expressions/object"}}
{"run":587,"commit":"18f98ae","metric":59,"metrics":{"compiler_test262_cases":946,"compiler_test262_pass":887,"compiler_test262_failures":59,"compiler_test262_compiler_errors":0,"compiler_test262_compiler_crashes":0,"compiler_test262_compiler_fails":0,"compiler_test262_both_fail":48,"compiler_test262_interpreter_fail_compiler_pass":11,"compatibility_pass":887,"compatibility_cases":946,"compiler_errors":0,"compiler_crashes":0,"compiler_fails":0,"both_fail":48,"interpreter_fail_compiler_pass":11,"elapsed_ms":34751},"status":"discard","description":"Add generator function prototype objects","timestamp":1778022008862,"segment":20,"confidence":7.666666666666667,"iterationTokens":7234,"asi":{"hypothesis":"Generator methods should have prototype objects whose prototype is the shared GeneratorPrototype, and Object.getPrototypeOf(function*(){}).prototype should expose that shared object.","rollback_reason":"Focused interpreter repro improved, but compiled equality still failed and primary compatibility_failures did not improve from current best 59.","next_action_hint":"Investigate BEAM-compiled object identity/prototype path for generator function prototypes before retrying; just adding Heap-level generator prototype caches is insufficient."}}
{"run":588,"commit":"8e8020a","metric":58,"metrics":{"compiler_test262_cases":946,"compiler_test262_pass":888,"compiler_test262_failures":58,"compiler_test262_compiler_errors":0,"compiler_test262_compiler_crashes":0,"compiler_test262_compiler_fails":0,"compiler_test262_both_fail":47,"compiler_test262_interpreter_fail_compiler_pass":11,"compatibility_pass":888,"compatibility_cases":946,"compiler_errors":0,"compiler_crashes":0,"compiler_fails":0,"both_fail":47,"interpreter_fail_compiler_pass":11,"elapsed_ms":36307},"status":"keep","description":"Normalize bigint literal method keys","timestamp":1778022505973,"segment":20,"confidence":6.714285714285714,"iterationTokens":9502,"asi":{"hypothesis":"QuickJS decodes BigInt literal method keys as tagged integers, so define_method must normalize tagged integer keys to their string property names instead of treating them as atom indexes.","learned":"Data property BigInt keys were already atomized correctly; method keys needed interpreter and compiler define_method paths to special-case tagged_int before atom lookup.","fixed_cluster":"literal-property-name-bigint method declaration portion","active_category":"language/expressions/object"}}
{"run":589,"commit":"8e8020a","metric":58,"metrics":{"compiler_test262_cases":946,"compiler_test262_pass":888,"compiler_test262_failures":58,"compiler_test262_compiler_errors":0,"compiler_test262_compiler_crashes":0,"compiler_test262_compiler_fails":9,"compiler_test262_both_fail":38,"compiler_test262_interpreter_fail_compiler_pass":11,"compatibility_pass":888,"compatibility_cases":946,"compiler_errors":0,"compiler_crashes":0,"compiler_fails":9,"both_fail":38,"interpreter_fail_compiler_pass":11,"elapsed_ms":37695},"status":"discard","description":"Store method name and length descriptors","timestamp":1778022903422,"segment":20,"confidence":6.714285714285714,"iterationTokens":7227,"asi":{"hypothesis":"Object methods should carry own non-writable non-enumerable configurable name/length data descriptors stored in function statics, with delete tombstones and non-writable assignment behavior.","rollback_reason":"Focused descriptor probes passed and both_fail dropped, but total compatibility_failures did not improve from current best 58 because the change introduced compiler-only semantic failures. Primary metric unchanged, so discard.","next_action_hint":"Inspect new compiler_fails before retrying. Likely compiled function static metadata identity/cache differs from interpreter or propertyHelper delete/restore semantics diverges under compiled calls."}}
{"run":590,"commit":"07eb18d","metric":51,"metrics":{"compiler_test262_cases":946,"compiler_test262_pass":895,"compiler_test262_failures":51,"compiler_test262_compiler_errors":0,"compiler_test262_compiler_crashes":0,"compiler_test262_compiler_fails":0,"compiler_test262_both_fail":40,"compiler_test262_interpreter_fail_compiler_pass":11,"compatibility_pass":895,"compatibility_cases":946,"compiler_errors":0,"compiler_crashes":0,"compiler_fails":0,"both_fail":40,"interpreter_fail_compiler_pass":11,"elapsed_ms":35856},"status":"keep","description":"Reject eval var conflicts with lexical locals","timestamp":1778023217747,"segment":20,"confidence":7.714285714285714,"iterationTokens":6702,"asi":{"hypothesis":"In non-strict functions, direct eval var/function declarations must throw SyntaxError when they conflict with top-level lexical declarations in the caller body environment.","learned":"Checking eval declared names against current function lexical locals fixed a broad method/getter/setter/generator eval-var-scope cluster without introducing compiler-only failures.","fixed_cluster":"object method/accessor/generator direct eval var-vs-let body scope SyntaxError cases","active_category":"language/expressions/object"}}
{"run":591,"commit":"d272172","metric":41,"metrics":{"compiler_test262_cases":946,"compiler_test262_pass":905,"compiler_test262_failures":41,"compiler_test262_compiler_errors":0,"compiler_test262_compiler_crashes":0,"compiler_test262_compiler_fails":0,"compiler_test262_both_fail":30,"compiler_test262_interpreter_fail_compiler_pass":11,"compatibility_pass":905,"compatibility_cases":946,"compiler_errors":0,"compiler_crashes":0,"compiler_fails":0,"both_fail":30,"interpreter_fail_compiler_pass":11,"elapsed_ms":39774},"status":"keep","description":"Let function objects inherit object prototype methods","timestamp":1778023504073,"segment":20,"confidence":9.142857142857142,"iterationTokens":5034,"asi":{"hypothesis":"Function objects should inherit Object.prototype methods through Function.prototype, so method.hasOwnProperty('arguments') and similar caller/arguments forbidden-extension checks should be callable.","learned":"Falling back from Function.proto_property to Object.prototype fixed a large forbidden-extension cluster without compiler regressions.","fixed_cluster":"method-definition forbidden-ext caller/arguments hasOwnProperty direct/indirect access cases","active_category":"language/expressions/object"}}
{"run":592,"commit":"d272172","metric":41,"metrics":{"compiler_test262_cases":946,"compiler_test262_pass":905,"compiler_test262_failures":41,"compiler_test262_compiler_errors":0,"compiler_test262_compiler_crashes":0,"compiler_test262_compiler_fails":9,"compiler_test262_both_fail":21,"compiler_test262_interpreter_fail_compiler_pass":11,"compatibility_pass":905,"compatibility_cases":946,"compiler_errors":0,"compiler_crashes":0,"compiler_fails":9,"both_fail":21,"interpreter_fail_compiler_pass":11,"elapsed_ms":37076},"status":"discard","description":"Store method name and length descriptors after function prototype fix","timestamp":1778023802690,"segment":20,"confidence":9.142857142857142,"iterationTokens":4773,"asi":{"hypothesis":"After function objects inherit Object.prototype, adding real method name/length statics might now reduce total failures without the previous side effects.","rollback_reason":"Primary compatibility_failures stayed at current best 41 and the change introduced 9 compiler-only failures, so discard despite reducing both_fail.","next_action_hint":"Need inspect compiler-only failures caused by metadata statics before retrying. Likely BEAM-compiled propertyHelper delete/restore or static metadata identity differs from interpreter."}}
{"run":593,"commit":"d272172","metric":41,"metrics":{"compiler_test262_cases":946,"compiler_test262_pass":905,"compiler_test262_failures":41,"compiler_test262_compiler_errors":0,"compiler_test262_compiler_crashes":0,"compiler_test262_compiler_fails":0,"compiler_test262_both_fail":27,"compiler_test262_interpreter_fail_compiler_pass":11,"compatibility_pass":905,"compatibility_cases":946,"compiler_errors":0,"compiler_crashes":0,"compiler_fails":0,"both_fail":27,"interpreter_fail_compiler_pass":11,"elapsed_ms":38197},"status":"discard","description":"Copy symbol keys during proxy object spread after function prototype fixes","timestamp":1778024035262,"segment":20,"confidence":8.533333333333333,"iterationTokens":2243,"asi":{"hypothesis":"Now that other object clusters are fixed, symbol-aware object spread/rest over proxies plus symbol-aware descriptors might reduce the remaining proxy symbol failures.","rollback_reason":"Focused proxy symbol repro passed and both_fail shifted, but primary compatibility_failures remained at current best 41. Discard under primary metric rule.","next_action_hint":"Exact remaining proxy symbol failures likely involve excluded-name handling or compareArray Symbol representation; inspect those cases before retrying symbol copy."}}
{"run":594,"commit":"d272172","metric":42,"metrics":{"compiler_test262_cases":946,"compiler_test262_pass":904,"compiler_test262_failures":42,"compiler_test262_compiler_errors":0,"compiler_test262_compiler_crashes":0,"compiler_test262_compiler_fails":0,"compiler_test262_both_fail":31,"compiler_test262_interpreter_fail_compiler_pass":11,"compatibility_pass":904,"compatibility_cases":946,"compiler_errors":0,"compiler_crashes":0,"compiler_fails":0,"both_fail":31,"interpreter_fail_compiler_pass":11,"elapsed_ms":50210},"status":"discard","description":"Throw on object ToPropertyKey for computed accessors","timestamp":1778024274537,"segment":20,"confidence":9.142857142857142,"iterationTokens":2506,"asi":{"hypothesis":"Computed accessor names should perform ToPropertyKey and throw TypeError for Object.create(null), with interpreter define_method_computed catches propagating to JS try/catch.","rollback_reason":"Focused repro passed, but primary compatibility_failures regressed from current best 41 to 42; the broader ToPrimitive/null-prototype change breaks another object case.","next_action_hint":"Avoid broad Coercion null-prototype fallback changes. A future attempt needs exact ToPropertyKey semantics without changing ordinary object stringification behavior globally."}}
{"run":595,"commit":"d272172","metric":41,"metrics":{"compiler_test262_cases":946,"compiler_test262_pass":905,"compiler_test262_failures":41,"compiler_test262_compiler_errors":0,"compiler_test262_compiler_crashes":0,"compiler_test262_compiler_fails":4,"compiler_test262_both_fail":26,"compiler_test262_interpreter_fail_compiler_pass":11,"compatibility_pass":905,"compatibility_cases":946,"compiler_errors":0,"compiler_crashes":0,"compiler_fails":4,"both_fail":26,"interpreter_fail_compiler_pass":11,"elapsed_ms":30492},"status":"discard","description":"Store method name descriptors only","timestamp":1778024626510,"segment":20,"confidence":8.533333333333333,"iterationTokens":10722,"asi":{"hypothesis":"Adding only method name descriptors, without length descriptors, might reduce fn-name failures while avoiding the previous compiler-only failures from length metadata.","rollback_reason":"Primary compatibility_failures stayed at current best 41 and 4 compiler-only failures were introduced. Discard under primary metric rule.","next_action_hint":"Need inspect compiler-only fn-name failures; likely propertyHelper destructive delete/restore differs when compiled code shares function static metadata by id."}}
{"run":596,"commit":"d272172","metric":41,"metrics":{"compiler_test262_cases":946,"compiler_test262_pass":905,"compiler_test262_failures":41,"compiler_test262_compiler_errors":0,"compiler_test262_compiler_crashes":0,"compiler_test262_compiler_fails":0,"compiler_test262_both_fail":30,"compiler_test262_interpreter_fail_compiler_pass":11,"compatibility_pass":905,"compatibility_cases":946,"compiler_errors":0,"compiler_crashes":0,"compiler_fails":0,"both_fail":30,"interpreter_fail_compiler_pass":11,"elapsed_ms":36716},"status":"discard","description":"Add generator function prototype objects after object prototype fixes","timestamp":1778024870601,"segment":20,"confidence":8,"iterationTokens":3413,"asi":{"hypothesis":"With function-object prototype fallback fixed, a shared GeneratorFunction.prototype / GeneratorPrototype cache might now reduce generator-prototype object method failures.","rollback_reason":"Primary compatibility_failures remained at current best 41, so discard. Focused compiled chain expression still has identity issues unless an intermediate variable is used.","next_action_hint":"Investigate compiled chained member access for Object.getPrototypeOf(function*(){}).prototype; storing Object.getPrototypeOf(function*(){}) first passes, direct chaining fails."}}
{"run":597,"commit":"d272172","metric":49,"metrics":{"compiler_test262_cases":946,"compiler_test262_pass":897,"compiler_test262_failures":49,"compiler_test262_compiler_errors":0,"compiler_test262_compiler_crashes":0,"compiler_test262_compiler_fails":0,"compiler_test262_both_fail":38,"compiler_test262_interpreter_fail_compiler_pass":11,"compatibility_pass":897,"compatibility_cases":946,"compiler_errors":0,"compiler_crashes":0,"compiler_fails":0,"both_fail":38,"interpreter_fail_compiler_pass":11,"elapsed_ms":41344},"status":"discard","description":"Compile interpreter direct eval through source compiler","timestamp":1778025225757,"segment":20,"confidence":7.111111111111111,"iterationTokens":5863,"asi":{"hypothesis":"Using the source compiler for interpreter direct eval may close native-bytecode eval accessor environment skew now that source compiler/runtime semantics have improved.","rollback_reason":"Primary compatibility_failures regressed from current best 41 to 49, although checks passed. Broad source compiler eval remains too incompatible.","next_action_hint":"Do not broadly switch direct eval compilation. Target the native-bytecode eval closure environment issue or use a much narrower semantic fix."}}
{"run":598,"commit":"fe5eadc","metric":42,"metrics":{"compiler_test262_cases":946,"compiler_test262_pass":904,"compiler_test262_failures":42,"compiler_test262_compiler_errors":0,"compiler_test262_compiler_crashes":0,"compiler_test262_compiler_fails":0,"compiler_test262_both_fail":30,"compiler_test262_interpreter_fail_compiler_pass":12,"compatibility_pass":904,"compatibility_cases":946,"compiler_errors":0,"compiler_crashes":0,"compiler_fails":0,"both_fail":30,"interpreter_fail_compiler_pass":12,"elapsed_ms":35536},"status":"discard","description":"Capture eval method globals for accessor closures","timestamp":1778025628400,"segment":20,"confidence":6.4,"iterationTokens":9980,"asi":{"hypothesis":"Accessor methods created inside direct eval should capture the eval/caller globals so later getter/setter invocation can resolve caller variables such as s1/s2/s3.","rollback_reason":"Primary metric regressed from current best 41 to 42 and interpreter/compiler skew increased. Focused native eval accessor still failed after merging captured globals, indicating closure identity or writeback issues remain.","next_action_hint":"Do not capture whole ctx.globals on method definitions. Inspect eval assignment/writeback and accessor closure identity more narrowly; broad ctor_static lexical globals perturb behavior."}}
