{"run":1577,"commit":"4d50dc5","metric":25,"metrics":{"compiler_test262_cases":165,"compiler_test262_pass":140,"compiler_test262_failures":25,"compiler_test262_compiler_errors":0,"compiler_test262_compiler_crashes":0,"compiler_test262_compiler_fails":0,"compiler_test262_both_fail":25,"compiler_test262_interpreter_fail_compiler_pass":0,"compatibility_pass":140,"compatibility_cases":165,"compiler_errors":0,"compiler_crashes":0,"compiler_fails":0,"both_fail":25,"interpreter_fail_compiler_pass":0,"elapsed_ms":7780},"status":"keep","description":"Coerce boxed JSON primitives observably","timestamp":1778828412584,"segment":136,"confidence":5.6,"iterationTokens":3237,"asi":{"hypothesis":"Boxed Number and String values in JSON.stringify should use observable ToNumber/ToString coercion so own valueOf/toString overrides and abrupt completions are respected."}}
{"run":1578,"commit":"HEAD","metric":25,"metrics":{"compiler_test262_cases":165,"compiler_test262_pass":140,"compiler_test262_failures":25,"compiler_test262_compiler_errors":0,"compiler_test262_compiler_crashes":0,"compiler_test262_compiler_fails":0,"compiler_test262_both_fail":25,"compiler_test262_interpreter_fail_compiler_pass":0,"compatibility_pass":140,"compatibility_cases":165,"compiler_errors":0,"compiler_crashes":0,"compiler_fails":0,"both_fail":25,"interpreter_fail_compiler_pass":0,"elapsed_ms":7738},"status":"discard","description":"Treat symbols as omitted JSON values after replacer work","timestamp":1778828575948,"segment":136,"confidence":5.6,"iterationTokens":1859,"asi":{"hypothesis":"After replacer/boxed primitive improvements, treating Symbol values as undefined might now reduce the remaining value-symbol failure.","rollback_reason":"Primary metric stayed unchanged at 25; value-symbol remains blocked by context-sensitive array/top-level handling or another offset.","next_action_hint":"Inspect focused value-symbol with this patch before retrying; may need a distinct array sentinel rather than plain :undefined."}}
{"run":1579,"commit":"HEAD","metric":25,"metrics":{"compiler_test262_cases":165,"compiler_test262_pass":140,"compiler_test262_failures":25,"compiler_test262_compiler_errors":0,"compiler_test262_compiler_crashes":0,"compiler_test262_compiler_fails":0,"compiler_test262_both_fail":25,"compiler_test262_interpreter_fail_compiler_pass":0,"compatibility_pass":140,"compatibility_cases":165,"compiler_errors":0,"compiler_crashes":0,"compiler_fails":0,"both_fail":25,"interpreter_fail_compiler_pass":0,"elapsed_ms":7766},"status":"discard","description":"Throw on JSON BigInt after replacer work","timestamp":1778828729988,"segment":136,"confidence":5.333333333333333,"iterationTokens":1362,"asi":{"hypothesis":"With replacer ordering improved, direct BigInt rejection might now reduce remaining BigInt JSON.stringify failures.","rollback_reason":"Primary metric stayed unchanged at 25; BigInt failures likely need BigInt.prototype.toJSON lookup or rawJSON parse source semantics rather than direct rejection alone.","next_action_hint":"Inspect value-bigint focused cases; implement BigInt wrapper/prototype toJSON lookup before retrying rejection."}}
{"run":1580,"commit":"HEAD","metric":26,"metrics":{"compiler_test262_cases":165,"compiler_test262_pass":139,"compiler_test262_failures":26,"compiler_test262_compiler_errors":0,"compiler_test262_compiler_crashes":0,"compiler_test262_compiler_fails":0,"compiler_test262_both_fail":26,"compiler_test262_interpreter_fail_compiler_pass":0,"compatibility_pass":139,"compatibility_cases":165,"compiler_errors":0,"compiler_crashes":0,"compiler_fails":0,"both_fail":26,"interpreter_fail_compiler_pass":0,"elapsed_ms":7709},"status":"discard","description":"Pass keys and receivers to JSON toJSON hooks","timestamp":1778828975724,"segment":136,"confidence":5.090909090909091,"iterationTokens":7951,"asi":{"hypothesis":"JSON toJSON hooks should receive the current property key and value receiver, including arrays and nested properties.","rollback_reason":"Primary metric regressed from 25 to 26; current-key threading fixed some hooks but broke/offset existing serialization order semantics.","next_action_hint":"Retry only as part of a fuller SerializeJSONProperty refactor that calls toJSON before replacer but does not recursively serialize before replacer."}}
{"run":1581,"commit":"HEAD","metric":28,"metrics":{"compiler_test262_cases":165,"compiler_test262_pass":137,"compiler_test262_failures":28,"compiler_test262_compiler_errors":0,"compiler_test262_compiler_crashes":0,"compiler_test262_compiler_fails":0,"compiler_test262_both_fail":28,"compiler_test262_interpreter_fail_compiler_pass":0,"compatibility_pass":137,"compatibility_cases":165,"compiler_errors":0,"compiler_crashes":0,"compiler_fails":0,"both_fail":28,"interpreter_fail_compiler_pass":0,"elapsed_ms":8039},"status":"discard","description":"Try full JSON parse reviver traversal","timestamp":1778829181192,"segment":136,"confidence":4.869565217391305,"iterationTokens":4641,"asi":{"hypothesis":"JSON.parse should traverse arrays and objects with a reviver using an ordinary root wrapper and holder receiver semantics.","rollback_reason":"Primary metric regressed from 25 to 28; partial reviver traversal lacks correct source text and mutation/key snapshot semantics and breaks existing passes.","next_action_hint":"Retry reviver only with exact property enumeration/mutation semantics and source argument handling; inspect which reviver cases regressed/passed."}}
{"run":1582,"commit":"HEAD","metric":25,"metrics":{"compiler_test262_cases":165,"compiler_test262_pass":140,"compiler_test262_failures":25,"compiler_test262_compiler_errors":0,"compiler_test262_compiler_crashes":0,"compiler_test262_compiler_fails":0,"compiler_test262_both_fail":25,"compiler_test262_interpreter_fail_compiler_pass":0,"compatibility_pass":140,"compatibility_cases":165,"compiler_errors":0,"compiler_crashes":0,"compiler_fails":0,"both_fail":25,"interpreter_fail_compiler_pass":0,"elapsed_ms":7788},"status":"discard","description":"Ignore non-callable JSON toJSON after boxed fixes","timestamp":1778829367781,"segment":136,"confidence":4.666666666666667,"iterationTokens":2736,"asi":{"hypothesis":"Non-callable toJSON properties should be serialized as ordinary data rather than invoked, now with helper placement that preserves grouped to_json clauses.","rollback_reason":"Primary metric stayed unchanged at 25; focused case still likely fails due array/RegExp serialization of property values, not just non-callable detection.","next_action_hint":"Inspect value-tojson-not-function after this patch; array literal and RegExp value serialization may be remaining blockers."}}
{"run":1583,"commit":"HEAD","metric":25,"metrics":{"compiler_test262_cases":165,"compiler_test262_pass":140,"compiler_test262_failures":25,"compiler_test262_compiler_errors":0,"compiler_test262_compiler_crashes":0,"compiler_test262_compiler_fails":0,"compiler_test262_both_fail":25,"compiler_test262_interpreter_fail_compiler_pass":0,"compatibility_pass":140,"compatibility_cases":165,"compiler_errors":0,"compiler_crashes":0,"compiler_fails":0,"both_fail":25,"interpreter_fail_compiler_pass":0,"elapsed_ms":7743},"status":"discard","description":"Preserve undefined JSON toJSON results","timestamp":1778829538725,"segment":136,"confidence":4.666666666666667,"iterationTokens":2242,"asi":{"hypothesis":"A toJSON hook returning undefined should propagate an omitted value rather than being converted to null immediately.","rollback_reason":"Primary metric stayed unchanged at 25; top-level or array/object context handling for undefined remains more nuanced than this local hook return change.","next_action_hint":"Implement context-aware SerializeJSONProperty instead of converting all undefined values in to_json/1."}}
{"run":1584,"commit":"970f7ef","metric":23,"metrics":{"compiler_test262_cases":165,"compiler_test262_pass":142,"compiler_test262_failures":23,"compiler_test262_compiler_errors":0,"compiler_test262_compiler_crashes":0,"compiler_test262_compiler_fails":0,"compiler_test262_both_fail":23,"compiler_test262_interpreter_fail_compiler_pass":0,"compatibility_pass":142,"compatibility_cases":165,"compiler_errors":0,"compiler_crashes":0,"compiler_fails":0,"both_fail":23,"interpreter_fail_compiler_pass":0,"elapsed_ms":7782},"status":"keep","description":"Handle JSON BigInt serialization hooks","timestamp":1778829798023,"segment":136,"confidence":4.833333333333333,"iterationTokens":12122,"asi":{"hypothesis":"JSON.stringify should look up callable BigInt toJSON hooks before rejecting primitive or boxed BigInt values, and throw TypeError when BigInt remains after replacer/toJSON processing."}}
{"run":1585,"commit":"b2847ef","metric":22,"metrics":{"compiler_test262_cases":165,"compiler_test262_pass":143,"compiler_test262_failures":22,"compiler_test262_compiler_errors":0,"compiler_test262_compiler_crashes":0,"compiler_test262_compiler_fails":0,"compiler_test262_both_fail":22,"compiler_test262_interpreter_fail_compiler_pass":0,"compatibility_pass":143,"compatibility_cases":165,"compiler_errors":0,"compiler_crashes":0,"compiler_fails":0,"both_fail":22,"interpreter_fail_compiler_pass":0,"elapsed_ms":7789},"status":"keep","description":"Use primitive BigInt receivers for prototype accessors","timestamp":1778830040629,"segment":136,"confidence":4.72,"iterationTokens":4480,"asi":{"hypothesis":"BigInt primitive prototype lookups should invoke accessors with the primitive BigInt receiver, and BigInt wrappers should observe the primitive prototype fallback so JSON toJSON receiver checks pass."}}
{"run":1586,"commit":"0d1d4c9","metric":21,"metrics":{"compiler_test262_cases":165,"compiler_test262_pass":144,"compiler_test262_failures":21,"compiler_test262_compiler_errors":0,"compiler_test262_compiler_crashes":0,"compiler_test262_compiler_fails":0,"compiler_test262_both_fail":21,"compiler_test262_interpreter_fail_compiler_pass":0,"compatibility_pass":144,"compatibility_cases":165,"compiler_errors":0,"compiler_crashes":0,"compiler_fails":0,"both_fail":21,"interpreter_fail_compiler_pass":0,"elapsed_ms":7721},"status":"keep","description":"Apply root JSON toJSON before replacers","timestamp":1778830221592,"segment":136,"confidence":5,"iterationTokens":2536,"asi":{"hypothesis":"For the root JSON property, callable toJSON hooks on objects and BigInts should run before the replacer function, matching SerializeJSONProperty ordering."}}
{"run":1587,"commit":"9bee9e0","metric":20,"metrics":{"compiler_test262_cases":165,"compiler_test262_pass":145,"compiler_test262_failures":20,"compiler_test262_compiler_errors":0,"compiler_test262_compiler_crashes":0,"compiler_test262_compiler_fails":0,"compiler_test262_both_fail":20,"compiler_test262_interpreter_fail_compiler_pass":0,"compatibility_pass":145,"compatibility_cases":165,"compiler_errors":0,"compiler_crashes":0,"compiler_fails":0,"both_fail":20,"interpreter_fail_compiler_pass":0,"elapsed_ms":7882},"status":"keep","description":"Reject BigInt after JSON hooks","timestamp":1778830886799,"segment":136,"confidence":4.88,"iterationTokens":2536,"asi":{"hypothesis":"Once root toJSON and replacer callbacks have run, a remaining BigInt value must throw instead of looking up toJSON again, avoiding repeated hook invocation and matching SerializeJSONProperty ordering."}}
{"run":1588,"commit":"HEAD","metric":20,"metrics":{"compiler_test262_cases":165,"compiler_test262_pass":145,"compiler_test262_failures":20,"compiler_test262_compiler_errors":0,"compiler_test262_compiler_crashes":0,"compiler_test262_compiler_fails":0,"compiler_test262_both_fail":20,"compiler_test262_interpreter_fail_compiler_pass":0,"compatibility_pass":145,"compatibility_cases":165,"compiler_errors":0,"compiler_crashes":0,"compiler_fails":0,"both_fail":20,"interpreter_fail_compiler_pass":0,"elapsed_ms":7712},"status":"discard","description":"Treat JSON symbol values as omitted after BigInt fixes","timestamp":1778831047493,"segment":136,"confidence":4.6923076923076925,"iterationTokens":3638,"asi":{"hypothesis":"Symbol primitives should serialize as omitted values, giving undefined at root, null in arrays, and omitted object properties.","rollback_reason":"Primary metric stayed unchanged at 20; value-symbol remains blocked by context or unrelated symbol-key handling in the current implementation.","next_action_hint":"Inspect focused value-symbol before retrying; symbol omission alone is still not reducing the active JSON slice."}}
{"run":1589,"commit":"07c7921","metric":19,"metrics":{"compiler_test262_cases":165,"compiler_test262_pass":146,"compiler_test262_failures":19,"compiler_test262_compiler_errors":0,"compiler_test262_compiler_crashes":0,"compiler_test262_compiler_fails":0,"compiler_test262_both_fail":19,"compiler_test262_interpreter_fail_compiler_pass":0,"compatibility_pass":146,"compatibility_cases":165,"compiler_errors":0,"compiler_crashes":0,"compiler_fails":0,"both_fail":19,"interpreter_fail_compiler_pass":0,"elapsed_ms":7697},"status":"keep","description":"Handle undefined JSON hook results by context","timestamp":1778831226055,"segment":136,"confidence":4.769230769230769,"iterationTokens":2298,"asi":{"hypothesis":"Undefined results from root replacers and toJSON hooks should return undefined at the root, become null in arrays, and omit object properties rather than always converting to null."}}
{"run":1590,"commit":"384a882","metric":16,"metrics":{"compiler_test262_cases":165,"compiler_test262_pass":149,"compiler_test262_failures":16,"compiler_test262_compiler_errors":0,"compiler_test262_compiler_crashes":0,"compiler_test262_compiler_fails":0,"compiler_test262_both_fail":16,"compiler_test262_interpreter_fail_compiler_pass":0,"compatibility_pass":149,"compatibility_cases":165,"compiler_errors":0,"compiler_crashes":0,"compiler_fails":0,"both_fail":16,"interpreter_fail_compiler_pass":0,"elapsed_ms":7752},"status":"keep","description":"Order JSON toJSON before replacers","timestamp":1778831422967,"segment":136,"confidence":5,"iterationTokens":3450,"asi":{"hypothesis":"SerializeJSONProperty should invoke callable toJSON hooks with the current key and value receiver before applying the replacer, and should not re-run toJSON on values returned by replacers."}}
{"run":1591,"commit":"HEAD","metric":15,"metrics":{"compiler_test262_cases":165,"compiler_test262_pass":150,"compiler_test262_failures":15,"compiler_test262_compiler_errors":0,"compiler_test262_compiler_crashes":0,"compiler_test262_compiler_fails":0,"compiler_test262_both_fail":15,"compiler_test262_interpreter_fail_compiler_pass":0,"compatibility_pass":150,"compatibility_cases":165,"compiler_errors":0,"compiler_crashes":0,"compiler_fails":0,"both_fail":15,"interpreter_fail_compiler_pass":0,"elapsed_ms":7791},"status":"checks_failed","description":"Try snapshot-key JSON property reads","timestamp":1778831462796,"segment":136,"confidence":5.2,"iterationTokens":1742,"asi":{"hypothesis":"JSON object serialization should snapshot enumerable keys but read each property value later with Get, so deletions caused by earlier getters are observed by the replacer.","rollback_reason":"Backpressure checks failed due warnings from the now-unused mapped value and obsolete resolve_value helper.","next_action_hint":"Retry the same semantic change with the unused variable renamed and resolve_value/2 removed; benchmark indicated improvement to 15."}}
{"run":1592,"commit":"3d0939c","metric":15,"metrics":{"compiler_test262_cases":165,"compiler_test262_pass":150,"compiler_test262_failures":15,"compiler_test262_compiler_errors":0,"compiler_test262_compiler_crashes":0,"compiler_test262_compiler_fails":0,"compiler_test262_both_fail":15,"compiler_test262_interpreter_fail_compiler_pass":0,"compatibility_pass":150,"compatibility_cases":165,"compiler_errors":0,"compiler_crashes":0,"compiler_fails":0,"both_fail":15,"interpreter_fail_compiler_pass":0,"elapsed_ms":7722},"status":"keep","description":"Read JSON properties after key snapshot","timestamp":1778831613706,"segment":136,"confidence":5.5,"iterationTokens":1537,"asi":{"hypothesis":"JSON object serialization should snapshot enumerable keys but read each property value later with Get, so deletions and getters caused by earlier properties are observed by replacers."}}
{"run":1593,"commit":"HEAD","metric":15,"metrics":{"compiler_test262_cases":165,"compiler_test262_pass":150,"compiler_test262_failures":15,"compiler_test262_compiler_errors":0,"compiler_test262_compiler_crashes":0,"compiler_test262_compiler_fails":0,"compiler_test262_both_fail":15,"compiler_test262_interpreter_fail_compiler_pass":0,"compatibility_pass":150,"compatibility_cases":165,"compiler_errors":0,"compiler_crashes":0,"compiler_fails":0,"both_fail":15,"interpreter_fail_compiler_pass":0,"elapsed_ms":7729},"status":"discard","description":"Treat JSON symbol values as omitted after serialization ordering fixes","timestamp":1778831762576,"segment":136,"confidence":5.739130434782608,"iterationTokens":1545,"asi":{"hypothesis":"After SerializeJSONProperty ordering fixes, symbol primitive values may now reduce the value-symbol failure when treated as omitted values.","rollback_reason":"Primary metric stayed unchanged at 15; the focused symbol failure is likely due symbol-key object handling or a separate context issue.","next_action_hint":"Run focused value-symbol instrumentation before retrying; do not repeat plain to_json symbol omission unchanged."}}
{"run":1594,"commit":"d3348fd","metric":14,"metrics":{"compiler_test262_cases":165,"compiler_test262_pass":151,"compiler_test262_failures":14,"compiler_test262_compiler_errors":0,"compiler_test262_compiler_crashes":0,"compiler_test262_compiler_fails":0,"compiler_test262_both_fail":14,"compiler_test262_interpreter_fail_compiler_pass":0,"compatibility_pass":151,"compatibility_cases":165,"compiler_errors":0,"compiler_crashes":0,"compiler_fails":0,"both_fail":14,"interpreter_fail_compiler_pass":0,"elapsed_ms":7769},"status":"keep","description":"Serialize JSON RegExp values as objects","timestamp":1778831948876,"segment":136,"confidence":6.090909090909091,"iterationTokens":4744,"asi":{"hypothesis":"RegExp values are ordinary objects for JSON.stringify and, with no enumerable own data in the current representation, should serialize as empty JSON objects instead of causing encoding failure."}}
{"run":1595,"commit":"HEAD","metric":14,"metrics":{"compiler_test262_cases":165,"compiler_test262_pass":151,"compiler_test262_failures":14,"compiler_test262_compiler_errors":0,"compiler_test262_compiler_crashes":0,"compiler_test262_compiler_fails":0,"compiler_test262_both_fail":14,"compiler_test262_interpreter_fail_compiler_pass":0,"compatibility_pass":151,"compatibility_cases":165,"compiler_errors":0,"compiler_crashes":0,"compiler_fails":0,"both_fail":14,"interpreter_fail_compiler_pass":0,"elapsed_ms":7767},"status":"discard","description":"Use ordered JSON parse pairs for duplicate keys","timestamp":1778832125959,"segment":136,"confidence":5.826086956521739,"iterationTokens":3279,"asi":{"hypothesis":"JSON.parse should preserve the last value for duplicate object keys by building parsed objects from ordered pairs rather than from the default decoded map.","rollback_reason":"Primary metric stayed unchanged at 14; duplicate __proto__ likely needs special object-model/prototype handling beyond latest duplicate value storage.","next_action_hint":"Inspect focused duplicate-proto with the patch before retrying; property access for parsed __proto__ may still route through prototype semantics."}}
{"run":1596,"commit":"HEAD","metric":14,"metrics":{"compiler_test262_cases":165,"compiler_test262_pass":151,"compiler_test262_failures":14,"compiler_test262_compiler_errors":0,"compiler_test262_compiler_crashes":0,"compiler_test262_compiler_fails":0,"compiler_test262_both_fail":14,"compiler_test262_interpreter_fail_compiler_pass":0,"compatibility_pass":151,"compatibility_cases":165,"compiler_errors":0,"compiler_crashes":0,"compiler_fails":0,"both_fail":14,"interpreter_fail_compiler_pass":0,"elapsed_ms":7853},"status":"discard","description":"Try root JSON parse reviver source context","timestamp":1778832291458,"segment":136,"confidence":5.583333333333333,"iterationTokens":2318,"asi":{"hypothesis":"JSON.parse with a callable reviver should at least invoke the root reviver with a wrapper receiver and a source context for primitive values.","rollback_reason":"Primary metric stayed unchanged at 14; root-only reviver support is insufficient for remaining parse/source failures and may be offset.","next_action_hint":"Do not retry root-only reviver. Implement full InternalizeJSONProperty traversal with exact mutation/key snapshot/source semantics if returning to parse reviver."}}
{"run":1597,"commit":"HEAD","metric":0,"metrics":{"compiler_test262_cases":0,"compiler_test262_pass":0,"compiler_test262_failures":0,"compiler_test262_compiler_errors":0,"compiler_test262_compiler_crashes":0,"compiler_test262_compiler_fails":0,"compiler_test262_both_fail":0,"compiler_test262_interpreter_fail_compiler_pass":0,"compatibility_pass":0,"compatibility_cases":0,"compiler_errors":0,"compiler_crashes":0,"compiler_fails":0,"both_fail":0,"interpreter_fail_compiler_pass":0,"elapsed_ms":0},"status":"crash","description":"Try well-formed JSON string escaping","timestamp":1778832367157,"segment":136,"confidence":5.583333333333333,"iterationTokens":3086,"asi":{"hypothesis":"Invalid WTF-8 lone surrogate strings should be quoted as well-formed JSON \\u escapes before Jason encoding.","rollback_reason":"Compile crashed due invalid Elixir bitstring pipeline syntax while constructing a one-codepoint UTF-8 binary.","next_action_hint":"Retry with `escaped = Jason.encode!(<<cp::utf8>>) |> String.slice(1..-2//1)` syntax."}}
