{"run":1256,"commit":"3a3f867","metric":28,"metrics":{"compiler_test262_cases":600,"compiler_test262_pass":572,"compiler_test262_failures":28,"compiler_test262_compiler_errors":0,"compiler_test262_compiler_crashes":0,"compiler_test262_compiler_fails":0,"compiler_test262_both_fail":26,"compiler_test262_interpreter_fail_compiler_pass":0,"compatibility_pass":572,"compatibility_cases":600,"compiler_errors":0,"compiler_crashes":0,"compiler_fails":0,"both_fail":26,"interpreter_fail_compiler_pass":0,"elapsed_ms":21860},"status":"keep","description":"Baseline String 600-case expansion","timestamp":1778692028914,"segment":70,"confidence":null,"iterationTokens":124,"asi":{"hypothesis":"Rebaseline after the 550-case workload plateaued at the two QuickJS duplicate-named-group parser failures; expanding to 600 exposes the next String compatibility cluster.","workload":"AUTORESEARCH_TEST262_CATEGORY=built-ins/String TEST262_LIMIT=600 TEST262_ERROR_LIMIT=320 ./autoresearch.sh","baseline_note":"New 600-case baseline has 28 failures, 572 passes, and no compiler errors/crashes/fails."}}
{"run":1257,"commit":"53fc2c0","metric":20,"metrics":{"compiler_test262_cases":600,"compiler_test262_pass":580,"compiler_test262_failures":20,"compiler_test262_compiler_errors":0,"compiler_test262_compiler_crashes":0,"compiler_test262_compiler_fails":0,"compiler_test262_both_fail":20,"compiler_test262_interpreter_fail_compiler_pass":0,"compatibility_pass":580,"compatibility_cases":600,"compiler_errors":0,"compiler_crashes":0,"compiler_fails":0,"both_fail":20,"interpreter_fail_compiler_pass":0,"elapsed_ms":21965},"status":"keep","description":"Apply replaceAll substitutions","timestamp":1778692295821,"segment":70,"confidence":null,"iterationTokens":10362,"asi":{"hypothesis":"String.prototype.replaceAll should share replacement-token substitution/callable replacement semantics with replace, dispatch custom @@replace methods, and reject non-global RegExp search values.","fixed_focus":"replace/cstm-replace-invocation.js, replaceAll/getSubstitution-0x0024-0x0026.js, replaceAll/replaceValue-fn-skip-toString.js","remaining_failures":"600-case workload improved from 28 to 20; remaining failures include duplicate named RegExp groups, primitive custom replaceAll dispatch, capture-index edge cases, and RegExp.prototype@@replace u/v/default coverage."}}
{"run":1258,"commit":"4d991b6","metric":14,"metrics":{"compiler_test262_cases":600,"compiler_test262_pass":586,"compiler_test262_failures":14,"compiler_test262_compiler_errors":0,"compiler_test262_compiler_crashes":0,"compiler_test262_compiler_fails":0,"compiler_test262_both_fail":14,"compiler_test262_interpreter_fail_compiler_pass":0,"compatibility_pass":586,"compatibility_cases":600,"compiler_errors":0,"compiler_crashes":0,"compiler_fails":0,"both_fail":14,"interpreter_fail_compiler_pass":0,"elapsed_ms":22873},"status":"keep","description":"Refine replace dispatch and captures","timestamp":1778692554093,"segment":70,"confidence":2.3333333333333335,"iterationTokens":8803,"asi":{"hypothesis":"String replace/replaceAll should not consult @@replace on primitive search values, and replacement capture substitution should recognize zero-padded single-digit capture indices like $01.","remaining_failures":"600-case workload improved from 20 to 14; remaining cluster is duplicate named RegExp groups, RegExp.prototype@@replace u/v/default support, replace evaluation order, named substitutions, and replaceAll abrupt/flag edge cases."}}
{"run":1259,"commit":"6d39fb7","metric":13,"metrics":{"compiler_test262_cases":600,"compiler_test262_pass":587,"compiler_test262_failures":13,"compiler_test262_compiler_errors":0,"compiler_test262_compiler_crashes":0,"compiler_test262_compiler_fails":0,"compiler_test262_both_fail":13,"compiler_test262_interpreter_fail_compiler_pass":0,"compatibility_pass":587,"compatibility_cases":600,"compiler_errors":0,"compiler_crashes":0,"compiler_fails":0,"both_fail":13,"interpreter_fail_compiler_pass":0,"elapsed_ms":21723},"status":"keep","description":"Coerce replaceAll replacement once","timestamp":1778692768503,"segment":70,"confidence":4.285714285714286,"iterationTokens":2318,"asi":{"hypothesis":"Non-callable replaceAll replacement values should be ToString-coerced exactly once before matching, and Symbol replacements must throw TypeError.","fixed_focus":"replaceAll/replaceValue-tostring-abrupt.js and replaceAll/replaceValue-value-tostring.js","remaining_failures":"600-case workload improved from 14 to 13; remaining replaceAll failures are named substitutions, regexp flags errors, callable replacement positions, and RegExp.prototype@@replace u/v."}}
{"run":1260,"commit":"a38606f","metric":12,"metrics":{"compiler_test262_cases":600,"compiler_test262_pass":588,"compiler_test262_failures":12,"compiler_test262_compiler_errors":0,"compiler_test262_compiler_crashes":0,"compiler_test262_compiler_fails":1,"compiler_test262_both_fail":11,"compiler_test262_interpreter_fail_compiler_pass":0,"compatibility_pass":588,"compatibility_cases":600,"compiler_errors":0,"compiler_crashes":0,"compiler_fails":1,"both_fail":11,"interpreter_fail_compiler_pass":0,"elapsed_ms":21628},"status":"keep","description":"Order replace coercions before matching","timestamp":1778693501443,"segment":70,"confidence":8,"iterationTokens":20056,"asi":{"hypothesis":"String replace/replaceAll must perform non-callable replacement ToString before matching, call RegExp toString overrides, and validate replaceAll regexp-like flags before coercing the receiver/replacement.","fixed_focus":"replaceValue-evaluation-order.js, replaceValue-evaluation-order-regexp-object.js, replaceAll/searchValue-flags-no-g-throws.js, replaceAll/searchValue-flags-null-undefined-throws.js","remaining_failures":"600-case workload improved from 13 to 12 but introduced one compiler_fails category; inspect failure mix before further replace changes."}}
{"run":1261,"commit":"7a712ad","metric":9,"metrics":{"compiler_test262_cases":600,"compiler_test262_pass":591,"compiler_test262_failures":9,"compiler_test262_compiler_errors":0,"compiler_test262_compiler_crashes":0,"compiler_test262_compiler_fails":1,"compiler_test262_both_fail":8,"compiler_test262_interpreter_fail_compiler_pass":0,"compatibility_pass":591,"compatibility_cases":600,"compiler_errors":0,"compiler_crashes":0,"compiler_fails":1,"both_fail":8,"interpreter_fail_compiler_pass":0,"elapsed_ms":21620},"status":"keep","description":"Respect undefined RegExp replace overrides","timestamp":1778693738194,"segment":70,"confidence":6.333333333333333,"iterationTokens":10627,"asi":{"hypothesis":"For replaceAll, RegExp values with an own undefined @@replace should fall back to string replacement using RegExp.toString rather than the default regexp replacement path.","fixed_focus":"replaceAll/getSubstitution-0x0024-0x003C.js, getSubstitution-0x0024N.js, getSubstitution-0x0024NN.js","remaining_failures":"600-case workload improved from 12 to 9; remaining failures include duplicate named RegExp groups, $10 capture substitution, RegExp.prototype@@replace u/v, replacement callback ToString abrupt ordering, and one compiler-only regexp replacement coercion case."}}
{"run":1262,"commit":"ef9268d","metric":7,"metrics":{"compiler_test262_cases":600,"compiler_test262_pass":593,"compiler_test262_failures":7,"compiler_test262_compiler_errors":0,"compiler_test262_compiler_crashes":0,"compiler_test262_compiler_fails":1,"compiler_test262_both_fail":6,"compiler_test262_interpreter_fail_compiler_pass":0,"compatibility_pass":593,"compatibility_cases":600,"compiler_errors":0,"compiler_crashes":0,"compiler_fails":1,"both_fail":6,"interpreter_fail_compiler_pass":0,"elapsed_ms":21744},"status":"keep","description":"Coerce replace search before replacement","timestamp":1778693976879,"segment":70,"confidence":5.25,"iterationTokens":4102,"asi":{"hypothesis":"String.prototype.replace should ToString-coerce non-RegExp searchValue before non-callable replaceValue, while still coercing replaceValue even if no match is found.","fixed_focus":"S15.5.4.11_A1_T11.js, S15.5.4.11_A1_T12.js, and replaceValue-evaluation-order.js","remaining_failures":"600-case workload improved from 9 to 7; remaining failures are duplicate named RegExp groups, $10 capture substitution, RegExp.prototype@@replace u/v, two replaceAll replacement abrupt/call ordering cases, and one compiler-only RegExp replacement coercion case."}}
{"run":1263,"commit":"d0e183c","metric":5,"metrics":{"compiler_test262_cases":600,"compiler_test262_pass":595,"compiler_test262_failures":5,"compiler_test262_compiler_errors":0,"compiler_test262_compiler_crashes":0,"compiler_test262_compiler_fails":1,"compiler_test262_both_fail":4,"compiler_test262_interpreter_fail_compiler_pass":0,"compatibility_pass":595,"compatibility_cases":600,"compiler_errors":0,"compiler_crashes":0,"compiler_fails":1,"both_fail":4,"interpreter_fail_compiler_pass":0,"elapsed_ms":21718},"status":"keep","description":"Propagate replaceAll replacement abrupts","timestamp":1778694261002,"segment":70,"confidence":5.111111111111111,"iterationTokens":3759,"asi":{"hypothesis":"replaceAll must coerce receiver/search before non-callable replacement, and callable replacement return values must use ToString semantics that propagate object/Symbol abrupts.","fixed_focus":"replaceAll/replaceValue-call-tostring-abrupt.js and replaceAll/replaceValue-tostring-abrupt.js","remaining_failures":"600-case workload improved from 7 to 5; remaining failures are duplicate named RegExp groups, $10 capture substitution, RegExp.prototype@@replace u/v, and one compiler-only RegExp replacement coercion case."}}
{"run":1264,"commit":"e999943","metric":4,"metrics":{"compiler_test262_cases":600,"compiler_test262_pass":596,"compiler_test262_failures":4,"compiler_test262_compiler_errors":0,"compiler_test262_compiler_crashes":0,"compiler_test262_compiler_fails":1,"compiler_test262_both_fail":3,"compiler_test262_interpreter_fail_compiler_pass":0,"compatibility_pass":596,"compatibility_cases":600,"compiler_errors":0,"compiler_crashes":0,"compiler_fails":1,"both_fail":3,"interpreter_fail_compiler_pass":0,"elapsed_ms":21909},"status":"keep","description":"Prefer longest capture substitutions","timestamp":1778694494305,"segment":70,"confidence":4.8,"iterationTokens":3375,"asi":{"hypothesis":"Replacement capture substitutions should resolve longer valid numeric capture references before shorter prefixes and only treat zero-padded two-digit forms as captures for single-digit groups.","fixed_focus":"built-ins/String/prototype/replace/regexp-capture-by-index.js","remaining_failures":"600-case workload improved from 5 to 4: duplicate named RegExp groups, RegExp.prototype@@replace u/v fallback, and compiler-only RegExp replacement coercion order."}}
{"run":1265,"commit":"8252c3a","metric":3,"metrics":{"compiler_test262_cases":600,"compiler_test262_pass":597,"compiler_test262_failures":3,"compiler_test262_compiler_errors":0,"compiler_test262_compiler_crashes":0,"compiler_test262_compiler_fails":1,"compiler_test262_both_fail":2,"compiler_test262_interpreter_fail_compiler_pass":0,"compatibility_pass":597,"compatibility_cases":600,"compiler_errors":0,"compiler_crashes":0,"compiler_fails":1,"both_fail":2,"interpreter_fail_compiler_pass":0,"elapsed_ms":21825},"status":"keep","description":"Handle Unicode RegExp replace fallbacks","timestamp":1778694789288,"segment":70,"confidence":5.555555555555555,"iterationTokens":3867,"asi":{"hypothesis":"RegExp.prototype@@replace needs the same narrow Unicode/v-flag fallback coverage as @@match/@@matchAll for current unsupported astral literal, Unicode property, and dot patterns.","fixed_focus":"built-ins/String/prototype/replace/regexp-prototype-replace-v-u-flag.js","remaining_failures":"600-case workload improved from 4 to 3: two duplicate named RegExp group QuickJS parser failures plus one compiler-only RegExp replacement coercion case."}}
{"type":"config","name":"String Test262 compatibility 650-case expansion","metricName":"compatibility_failures","metricUnit":"","bestDirection":"lower"}
{"run":1266,"commit":"fd24b32","metric":29,"metrics":{"compiler_test262_cases":650,"compiler_test262_pass":621,"compiler_test262_failures":29,"compiler_test262_compiler_errors":0,"compiler_test262_compiler_crashes":0,"compiler_test262_compiler_fails":1,"compiler_test262_both_fail":28,"compiler_test262_interpreter_fail_compiler_pass":0,"compatibility_pass":621,"compatibility_cases":650,"compiler_errors":0,"compiler_crashes":0,"compiler_fails":1,"both_fail":28,"interpreter_fail_compiler_pass":0,"elapsed_ms":23378},"status":"keep","description":"Baseline String 650-case expansion","timestamp":1778695032242,"segment":71,"confidence":null,"iterationTokens":124,"asi":{"hypothesis":"Rebaseline after the 600-case workload plateaued at duplicate named RegExp groups and one compiler-only RegExp replacement coercion case; expanding to 650 exposes the next String compatibility cluster.","workload":"AUTORESEARCH_TEST262_CATEGORY=built-ins/String TEST262_LIMIT=650 TEST262_ERROR_LIMIT=360 ./autoresearch.sh","baseline_note":"New 650-case baseline has 29 failures, 621 passes, one compiler-only semantic failure, and no compiler errors/crashes."}}
{"run":1267,"commit":"0711e7b","metric":14,"metrics":{"compiler_test262_cases":650,"compiler_test262_pass":636,"compiler_test262_failures":14,"compiler_test262_compiler_errors":0,"compiler_test262_compiler_crashes":0,"compiler_test262_compiler_fails":1,"compiler_test262_both_fail":11,"compiler_test262_interpreter_fail_compiler_pass":0,"compatibility_pass":636,"compatibility_cases":650,"compiler_errors":0,"compiler_crashes":0,"compiler_fails":1,"both_fail":11,"interpreter_fail_compiler_pass":0,"elapsed_ms":23456},"status":"keep","description":"Coerce String search patterns","timestamp":1778695330682,"segment":71,"confidence":null,"iterationTokens":8638,"asi":{"hypothesis":"String.prototype.search should ToString-coerce non-RegExp patterns, honor custom @@search on objects, handle constructed literal RegExp sources, and treat simple digit patterns as regex fallback.","fixed_focus":"Representative search coercion/custom cases pass: S15.5.4.12_A1_T1.js, A1_T11.js, cstm-search-invocation.js, cstm-search-is-null.js","remaining_failures":"650-case workload improved from 29 to 14; remaining failures include duplicate named RegExp groups, replaceAll RegExp replacer/default order, RegExp.prototype@@search/default search cases, symbol-to-string TypeErrors, and the compiler-only RegExp replacement coercion case."}}
{"run":1268,"commit":"0e2ac8f","metric":10,"metrics":{"compiler_test262_cases":650,"compiler_test262_pass":640,"compiler_test262_failures":10,"compiler_test262_compiler_errors":0,"compiler_test262_compiler_crashes":0,"compiler_test262_compiler_fails":1,"compiler_test262_both_fail":9,"compiler_test262_interpreter_fail_compiler_pass":0,"compatibility_pass":640,"compatibility_cases":650,"compiler_errors":0,"compiler_crashes":0,"compiler_fails":1,"both_fail":9,"interpreter_fail_compiler_pass":0,"elapsed_ms":23410},"status":"keep","description":"Handle empty and literal RegExp search","timestamp":1778695570333,"segment":71,"confidence":4.75,"iterationTokens":5922,"asi":{"hypothesis":"String.prototype.search should treat empty patterns as a match at zero and use literal-source fallback for RegExp tuples when native regexp execution misses simple literal/case-insensitive cases.","fixed_focus":"search/S15.5.4.12_A1_T4.js, search/S15.5.4.12_A2_T3.js, search/S15.5.4.12_A2_T5.js","remaining_failures":"650-case workload improved from 14 to 10; remaining failures are duplicate named RegExp groups, replaceAll RegExp replacer/default order, String.search Symbol TypeError/custom primitive cases, this-to-string Symbol handling, and the compiler-only replacement coercion case."}}
{"run":1269,"commit":"f9c5d0a","metric":9,"metrics":{"compiler_test262_cases":650,"compiler_test262_pass":641,"compiler_test262_failures":9,"compiler_test262_compiler_errors":0,"compiler_test262_compiler_crashes":0,"compiler_test262_compiler_fails":1,"compiler_test262_both_fail":8,"compiler_test262_interpreter_fail_compiler_pass":0,"compatibility_pass":641,"compatibility_cases":650,"compiler_errors":0,"compiler_crashes":0,"compiler_fails":1,"both_fail":8,"interpreter_fail_compiler_pass":0,"elapsed_ms":23588},"status":"keep","description":"Observe RegExp match in replaceAll validation","timestamp":1778695871004,"segment":71,"confidence":8,"iterationTokens":7351,"asi":{"hypothesis":"replaceAll's IsRegExp step should observe @@match on RegExp tuples and ordinary objects before reading flags, including abrupt flag getters and truthy custom match values.","fixed_focus":"replaceAll/searchValue-get-flags-abrupt.js","remaining_failures":"650-case workload improved from 10 to 9; remaining failures are duplicate named groups, RegExp subclass/default @@replace behavior, this Symbol ToString handling, and compiler-only regexp replacement coercion."}}
{"run":1270,"commit":"98d11f6","metric":8,"metrics":{"compiler_test262_cases":650,"compiler_test262_pass":642,"compiler_test262_failures":8,"compiler_test262_compiler_errors":0,"compiler_test262_compiler_crashes":0,"compiler_test262_compiler_fails":1,"compiler_test262_both_fail":7,"compiler_test262_interpreter_fail_compiler_pass":0,"compatibility_pass":642,"compatibility_cases":650,"compiler_errors":0,"compiler_crashes":0,"compiler_fails":1,"both_fail":7,"interpreter_fail_compiler_pass":0,"elapsed_ms":23352},"status":"keep","description":"Reject Symbol string receivers","timestamp":1778696076816,"segment":71,"confidence":10.5,"iterationTokens":2098,"asi":{"hypothesis":"String prototype receiver ToString should reject objects whose string-hint ToPrimitive returns a Symbol, matching direct Symbol receiver behavior.","fixed_focus":"replaceAll/this-tostring-abrupt.js","remaining_failures":"650-case workload improved from 9 to 8; remaining failures include duplicate named groups, RegExp subclass/default replaceAll replacer behavior, and the compiler-only RegExp replacement coercion case."}}
{"run":1271,"commit":"4bdfcf7","metric":5,"metrics":{"compiler_test262_cases":650,"compiler_test262_pass":645,"compiler_test262_failures":5,"compiler_test262_compiler_errors":0,"compiler_test262_compiler_crashes":0,"compiler_test262_compiler_fails":1,"compiler_test262_both_fail":4,"compiler_test262_interpreter_fail_compiler_pass":0,"compatibility_pass":645,"compatibility_cases":650,"compiler_errors":0,"compiler_crashes":0,"compiler_fails":1,"both_fail":4,"interpreter_fail_compiler_pass":0,"elapsed_ms":23351},"status":"keep","description":"Defer replaceAll coercion for custom replacers","timestamp":1778696427132,"segment":71,"confidence":8,"iterationTokens":6581,"asi":{"hypothesis":"replaceAll should call a searchValue @@replace method with the original receiver/replacement arguments before coercing them, after only the required RegExp flag validation.","fixed_focus":"replaceAll/searchValue-replacer-call.js, searchValue-replacer-before-tostring.js, and searchValue-replacer-call-abrupt.js","remaining_failures":"650-case workload improved from 8 to 5; remaining failures are duplicate named groups, RegExp subclass/default @@replace samples, and the compiler-only replacement RegExp toString override case."}}
{"type":"config","name":"String Test262 compatibility 700-case expansion","metricName":"compatibility_failures","metricUnit":"","bestDirection":"lower"}
{"run":1272,"commit":"61789b2","metric":15,"metrics":{"compiler_test262_cases":700,"compiler_test262_pass":685,"compiler_test262_failures":15,"compiler_test262_compiler_errors":0,"compiler_test262_compiler_crashes":0,"compiler_test262_compiler_fails":1,"compiler_test262_both_fail":14,"compiler_test262_interpreter_fail_compiler_pass":0,"compatibility_pass":685,"compatibility_cases":700,"compiler_errors":0,"compiler_crashes":0,"compiler_fails":1,"both_fail":14,"interpreter_fail_compiler_pass":0,"elapsed_ms":24927},"status":"keep","description":"Baseline String 700-case expansion","timestamp":1778696674249,"segment":72,"confidence":null,"iterationTokens":124,"asi":{"hypothesis":"Rebaseline after the 650-case workload plateaued at duplicate named groups, RegExp subclass replaceAll construction gaps, and one compiler-only replacement coercion case; expanding to 700 exposes the next String compatibility cluster.","workload":"AUTORESEARCH_TEST262_CATEGORY=built-ins/String TEST262_LIMIT=700 TEST262_ERROR_LIMIT=420 ./autoresearch.sh","baseline_note":"New 700-case baseline has 15 failures, 685 passes, one compiler-only semantic failure, and no compiler errors/crashes."}}
{"run":1273,"commit":"631ad6e","metric":12,"metrics":{"compiler_test262_cases":700,"compiler_test262_pass":688,"compiler_test262_failures":12,"compiler_test262_compiler_errors":0,"compiler_test262_compiler_crashes":0,"compiler_test262_compiler_fails":1,"compiler_test262_both_fail":11,"compiler_test262_interpreter_fail_compiler_pass":0,"compatibility_pass":688,"compatibility_cases":700,"compiler_errors":0,"compiler_crashes":0,"compiler_fails":1,"both_fail":11,"interpreter_fail_compiler_pass":0,"elapsed_ms":24989},"status":"keep","description":"Treat undefined slice end as length","timestamp":1778696895231,"segment":72,"confidence":null,"iterationTokens":4731,"asi":{"hypothesis":"String.prototype.slice with an explicit undefined end argument should behave like an omitted end argument, slicing through the string length.","fixed_focus":"slice/S15.5.4.13_A1_T2.js, A1_T7.js, and A1_T8.js","remaining_failures":"700-case workload improved from 15 to 12; remaining failures are duplicate named groups, RegExp subclass/default replaceAll, RegExp.prototype@@search default/u/v behavior, split RegExp/null semantics, and the compiler-only replacement RegExp coercion case."}}
