{"run":722,"commit":"baade1c","metric":83,"metrics":{"js_bytecode_existing_cases":157,"js_bytecode_existing_compiled":82,"js_bytecode_existing_unsupported":66,"js_bytecode_existing_mismatches":8,"js_bytecode_existing_native_loadable":76,"js_bytecode_compiler_cases":105,"js_bytecode_compiler_compiled":105,"js_bytecode_compiler_unsupported":0,"js_bytecode_compiler_mismatches":0,"js_bytecode_compiler_native_loadable":105,"js_bytecode_compiler_failures":0},"status":"keep","description":"Support compound member assignments","timestamp":1777831502003,"segment":28,"confidence":3,"iterationTokens":7259,"asi":{"hypothesis":"Compound assignments to computed and named members can reuse the generic read-modify-write stack patterns already validated for member update expressions.","result":"Offset-2000 failures improved 84 -> 83; unsupported count dropped 67 -> 66; stable audit expanded to 105; checks passed.","scope":"Adds non-logical compound assignment lowering for member expressions using get_field2/get_array_el, the existing compound operator table, and put_field/put_array_el.","next_action_hint":"Logical member assignment can likely use similar stack patterns with branch labels; otherwise investigate simple parameter forms or function declaration captures."}}
{"run":723,"commit":"c403d10","metric":82,"metrics":{"js_bytecode_existing_cases":157,"js_bytecode_existing_compiled":83,"js_bytecode_existing_unsupported":66,"js_bytecode_existing_mismatches":8,"js_bytecode_existing_native_loadable":77,"js_bytecode_compiler_cases":106,"js_bytecode_compiler_compiled":106,"js_bytecode_compiler_unsupported":0,"js_bytecode_compiler_mismatches":0,"js_bytecode_compiler_native_loadable":106,"js_bytecode_compiler_failures":0},"status":"keep","description":"Support simple default parameters","timestamp":1777831628775,"segment":28,"confidence":3.3333333333333335,"iterationTokens":6397,"asi":{"hypothesis":"Simple identifier default parameters can be lowered by normalizing parameter names and prepending undefined checks/default assignments in function bytecode.","result":"Offset-2000 failures improved 83 -> 82; stable audit expanded to 106; checks passed.","scope":"Supports default parameters whose binding target is an identifier. Rest and destructured parameters still fail explicitly and require separate generic lowering.","next_action_hint":"Rest parameters are adjacent and may be implementable by collecting surplus args into an array local if the FunctionBuilder/arg metadata permits it."}}
{"run":724,"commit":"c403d10","metric":69,"metrics":{"js_bytecode_existing_cases":157,"js_bytecode_existing_compiled":96,"js_bytecode_existing_unsupported":53,"js_bytecode_existing_mismatches":8,"js_bytecode_existing_native_loadable":90,"js_bytecode_compiler_cases":108,"js_bytecode_compiler_compiled":108,"js_bytecode_compiler_unsupported":0,"js_bytecode_compiler_mismatches":0,"js_bytecode_compiler_native_loadable":108,"js_bytecode_compiler_failures":0},"status":"checks_failed","description":"Try function declaration value captures","timestamp":1777832022280,"segment":28,"confidence":3.3333333333333335,"iterationTokens":14749,"asi":{"hypothesis":"Nested function declarations can use the same value-capture bind lowering as function expressions to cover non-mutating local/argument captures without closure metadata.","rollback_reason":"Backpressure checks failed ExDNA clone budget because capture helper code was duplicated between Expressions and Statements.","result":"Benchmark improved offset-2000 failures 82 -> 69, but changes were not kept due to clone budget.","next_action_hint":"Re-implement by extracting shared capture analysis/binding helpers into a dedicated module (or otherwise avoid duplication) before rerunning checks."}}
{"run":725,"commit":"ac2f563","metric":69,"metrics":{"js_bytecode_existing_cases":157,"js_bytecode_existing_compiled":96,"js_bytecode_existing_unsupported":53,"js_bytecode_existing_mismatches":8,"js_bytecode_existing_native_loadable":90,"js_bytecode_compiler_cases":108,"js_bytecode_compiler_compiled":108,"js_bytecode_compiler_unsupported":0,"js_bytecode_compiler_mismatches":0,"js_bytecode_compiler_native_loadable":108,"js_bytecode_compiler_failures":0},"status":"keep","description":"Support function declaration value captures","timestamp":1777832205825,"segment":28,"confidence":7.666666666666667,"iterationTokens":10238,"asi":{"hypothesis":"Nested function declarations can share the existing safe value-capture bind lowering if capture analysis/binding is extracted into a reusable helper instead of duplicating code.","result":"Offset-2000 failures improved 82 -> 69; unsupported count dropped 66 -> 53; stable audit expanded 106 -> 108; checks passed including ExDNA clone budget.","scope":"Extracts capture analysis/binding to QuickBEAM.JS.BytecodeCompiler.Captures and applies it to function expressions and declarations. This remains value capture, not mutable closure-cell semantics.","next_action_hint":"Continue with non-closure-cell clusters such as simple rest parameters, destructured params, tagged templates, or class static elements; mutable closure mismatch remains future closure metadata work."}}
{"run":726,"commit":"3a81bc8","metric":68,"metrics":{"js_bytecode_existing_cases":157,"js_bytecode_existing_compiled":97,"js_bytecode_existing_unsupported":53,"js_bytecode_existing_mismatches":8,"js_bytecode_existing_native_loadable":91,"js_bytecode_compiler_cases":109,"js_bytecode_compiler_compiled":109,"js_bytecode_compiler_unsupported":0,"js_bytecode_compiler_mismatches":0,"js_bytecode_compiler_native_loadable":109,"js_bytecode_compiler_failures":0},"status":"keep","description":"Support simple rest parameters","timestamp":1777832412881,"segment":28,"confidence":8,"iterationTokens":9139,"asi":{"hypothesis":"Simple terminal identifier rest parameters can use QuickJS's rest opcode plus an argument slot write, with defined_arg_count set to the number of non-rest params.","result":"Offset-2000 failures improved 69 -> 68; stable audit expanded 108 -> 109; checks passed.","scope":"Supports rest parameters when the rest binding is the final identifier parameter. Destructured rest/default combinations beyond this subset still fail explicitly.","next_action_hint":"Destructured parameters are adjacent, but require generic pattern binding from arg slots; other options are tagged templates or static class subsets."}}
{"run":727,"commit":"9bd2647","metric":68,"metrics":{"js_bytecode_existing_cases":157,"js_bytecode_existing_compiled":97,"js_bytecode_existing_unsupported":53,"js_bytecode_existing_mismatches":8,"js_bytecode_existing_native_loadable":91,"js_bytecode_compiler_cases":109,"js_bytecode_compiler_compiled":109,"js_bytecode_compiler_unsupported":0,"js_bytecode_compiler_mismatches":0,"js_bytecode_compiler_native_loadable":109,"js_bytecode_compiler_failures":0},"status":"keep","description":"Resume baseline offset 2000","timestamp":1777832509367,"segment":28,"confidence":5.333333333333333,"iterationTokens":1912,"asi":{"hypothesis":"Re-running the current offset-2000 workload after context resumption should confirm the active baseline before trying new compiler changes.","result":"Confirmed offset-2000 baseline remains 68 failures with stable frontend audit clean and checks passing.","scope":"No code changes; establishes current best after resumed context.","next_action_hint":"Inspect remaining unsupported/error clusters and target generic improvements without special-casing corpus strings."}}
{"run":728,"commit":"91f742f","metric":67,"metrics":{"js_bytecode_existing_cases":157,"js_bytecode_existing_compiled":98,"js_bytecode_existing_unsupported":52,"js_bytecode_existing_mismatches":8,"js_bytecode_existing_native_loadable":92,"js_bytecode_compiler_cases":110,"js_bytecode_compiler_compiled":110,"js_bytecode_compiler_unsupported":0,"js_bytecode_compiler_mismatches":0,"js_bytecode_compiler_native_loadable":110,"js_bytecode_compiler_failures":0},"status":"keep","description":"Support object spread literals","timestamp":1777832732873,"segment":28,"confidence":4.166666666666667,"iterationTokens":24039,"asi":{"hypothesis":"Object spread literals can use QuickJS's copy_data_properties opcode to copy enumerable properties into the object currently being constructed.","result":"Offset-2000 failures improved 68 -> 67; unsupported count dropped 53 -> 52; stable audit expanded 109 -> 110; checks passed.","scope":"Adds copy_data_properties assembler support and generic object literal spread lowering. Uses the same stack shape as QuickJS with null exclusions and preserves later property definitions.","next_action_hint":"Remaining low-risk clusters include destructured params, object/array destructuring declarations, and possibly tagged template literals."}}
{"run":729,"commit":"2d5872f","metric":66,"metrics":{"js_bytecode_existing_cases":157,"js_bytecode_existing_compiled":99,"js_bytecode_existing_unsupported":52,"js_bytecode_existing_mismatches":8,"js_bytecode_existing_native_loadable":93,"js_bytecode_compiler_cases":111,"js_bytecode_compiler_compiled":111,"js_bytecode_compiler_unsupported":0,"js_bytecode_compiler_mismatches":0,"js_bytecode_compiler_native_loadable":111,"js_bytecode_compiler_failures":0},"status":"keep","description":"Support wide closure constants","timestamp":1777832889413,"segment":28,"confidence":3.7142857142857144,"iterationTokens":6121,"asi":{"hypothesis":"Programs with more than 255 function constants need the wide QuickJS fclosure opcode instead of fclosure8.","result":"Offset-2000 failures improved 67 -> 66; stable audit expanded 110 -> 111; checks passed.","scope":"Adds wide fclosure encoding for closure constant indexes beyond 255 and regression coverage with many function declarations.","next_action_hint":"Remaining clusters include destructuring/pattern binding, tagged templates, class/static/private elements, eval/arguments, and known semantic mismatches."}}
{"run":730,"commit":"e55a7f3","metric":65,"metrics":{"js_bytecode_existing_cases":157,"js_bytecode_existing_compiled":100,"js_bytecode_existing_unsupported":52,"js_bytecode_existing_mismatches":8,"js_bytecode_existing_native_loadable":94,"js_bytecode_compiler_cases":112,"js_bytecode_compiler_compiled":112,"js_bytecode_compiler_unsupported":0,"js_bytecode_compiler_mismatches":0,"js_bytecode_compiler_native_loadable":112,"js_bytecode_compiler_failures":0},"status":"keep","description":"Support simple destructured parameters","timestamp":1777833088861,"segment":28,"confidence":3.375,"iterationTokens":9646,"asi":{"hypothesis":"Simple object/array destructured parameters can be represented as synthetic argument slots plus prologue pattern extraction into local bindings.","result":"Offset-2000 failures improved 66 -> 65; stable audit expanded 111 -> 112; checks passed.","scope":"Supports identifier-only object and array destructured function parameters. Nested/rest/default destructuring remains unsupported and explicit.","next_action_hint":"Reuse pattern extraction helpers for simple array destructuring declarations or for-of destructuring, while avoiding full pattern semantics overreach."}}
{"run":731,"commit":"6d82a5d","metric":64,"metrics":{"js_bytecode_existing_cases":157,"js_bytecode_existing_compiled":101,"js_bytecode_existing_unsupported":51,"js_bytecode_existing_mismatches":8,"js_bytecode_existing_native_loadable":95,"js_bytecode_compiler_cases":113,"js_bytecode_compiler_compiled":113,"js_bytecode_compiler_unsupported":0,"js_bytecode_compiler_mismatches":0,"js_bytecode_compiler_native_loadable":113,"js_bytecode_compiler_failures":0},"status":"keep","description":"Support simple array destructuring declarations","timestamp":1777833269736,"segment":28,"confidence":3.111111111111111,"iterationTokens":8449,"asi":{"hypothesis":"Array destructuring declarations can reuse the same identifier-only element extraction model used for destructured parameters.","result":"Offset-2000 failures improved 65 -> 64; unsupported count dropped 52 -> 51; stable audit expanded to 113; checks passed.","scope":"Supports simple array-pattern variable declarations with identifier elements and elisions. Nested/rest/default array patterns remain unsupported.","next_action_hint":"For-of destructuring over array-of-arrays may be next if loop-head pattern binding can reuse array pattern extraction."}}
{"run":732,"commit":"a8cc4cc","metric":64,"metrics":{"js_bytecode_existing_cases":157,"js_bytecode_existing_compiled":101,"js_bytecode_existing_unsupported":51,"js_bytecode_existing_mismatches":8,"js_bytecode_existing_native_loadable":95,"js_bytecode_compiler_cases":113,"js_bytecode_compiler_compiled":113,"js_bytecode_compiler_unsupported":0,"js_bytecode_compiler_mismatches":0,"js_bytecode_compiler_native_loadable":113,"js_bytecode_compiler_failures":0},"status":"keep","description":"Confirm array destructuring declarations","timestamp":1777833523164,"segment":28,"confidence":2.8,"iterationTokens":7193,"asi":{"hypothesis":"After reverting an unsafe for-of destructuring attempt, the array destructuring declaration improvement should remain valid and pass backpressure checks.","result":"Offset-2000 failures remain improved at 64; stable audit remains clean; checks passed.","scope":"No additional code beyond the kept array destructuring declaration support; unsafe for-of pattern iteration was removed because the BEAM compiler path returned :error.","next_action_hint":"Record the for-of destructuring compiler-path issue in ideas and target other generic clusters."}}
{"run":733,"commit":"768dd19","metric":63,"metrics":{"js_bytecode_existing_cases":157,"js_bytecode_existing_compiled":102,"js_bytecode_existing_unsupported":50,"js_bytecode_existing_mismatches":8,"js_bytecode_existing_native_loadable":96,"js_bytecode_compiler_cases":114,"js_bytecode_compiler_compiled":114,"js_bytecode_compiler_unsupported":0,"js_bytecode_compiler_mismatches":0,"js_bytecode_compiler_native_loadable":114,"js_bytecode_compiler_failures":0},"status":"keep","description":"Support delete identifier expressions","timestamp":1777833735631,"segment":28,"confidence":2.9,"iterationTokens":6065,"asi":{"hypothesis":"Unary delete on identifiers can be lowered generically to the JavaScript binding-delete result without evaluating the identifier value.","result":"Offset-2000 failures improved 64 -> 63; unsupported count dropped 51 -> 50; stable audit expanded to 114; checks passed.","scope":"Supports delete on declared identifiers as false and unresolvable identifiers as true. Property delete semantics were already supported.","next_action_hint":"Avoid for-of destructuring until BEAM compiler stack-shape issue is understood; continue with tagged templates, simple class static, or arguments support."}}
{"run":734,"commit":"65272bd","metric":62,"metrics":{"js_bytecode_existing_cases":157,"js_bytecode_existing_compiled":103,"js_bytecode_existing_unsupported":49,"js_bytecode_existing_mismatches":8,"js_bytecode_existing_native_loadable":97,"js_bytecode_compiler_cases":115,"js_bytecode_compiler_compiled":115,"js_bytecode_compiler_unsupported":0,"js_bytecode_compiler_mismatches":0,"js_bytecode_compiler_native_loadable":115,"js_bytecode_compiler_failures":0},"status":"keep","description":"Declare nested for-loop bindings","timestamp":1777834590827,"segment":28,"confidence":4.285714285714286,"iterationTokens":6065,"asi":{"hypothesis":"Function/program scope predeclaration should discover variable declarations in nested loop bodies so inner for-loop locals resolve during body compilation.","result":"Offset-2000 failures improved 63 -> 62; unsupported count dropped 50 -> 49; stable audit expanded to 115; checks passed.","scope":"Recurses declaration discovery through for/while/do bodies and declares for-init binding patterns found in nested loops. This matches the compiler's current function-wide local-slot model rather than implementing full lexical environments.","next_action_hint":"Remaining easy unsupported clusters include direct eval as a real semantic feature, object-pattern assignment targets, tagged templates once object argument preservation is understood, and class property clauses."}}
{"run":735,"commit":"1407906","metric":61,"metrics":{"js_bytecode_existing_cases":157,"js_bytecode_existing_compiled":104,"js_bytecode_existing_unsupported":48,"js_bytecode_existing_mismatches":8,"js_bytecode_existing_native_loadable":98,"js_bytecode_compiler_cases":117,"js_bytecode_compiler_compiled":117,"js_bytecode_compiler_unsupported":0,"js_bytecode_compiler_mismatches":0,"js_bytecode_compiler_native_loadable":117,"js_bytecode_compiler_failures":0},"status":"keep","description":"Support simple arrow functions","timestamp":1777834795493,"segment":28,"confidence":4.133333333333334,"iterationTokens":9523,"asi":{"hypothesis":"Simple synchronous arrow functions can reuse FunctionExpression compilation by wrapping expression bodies in return statements, covering array callback cases without special-casing Array.map.","result":"Offset-2000 failures improved 62 -> 61; unsupported count dropped 49 -> 48; stable audit expanded to 117; checks passed.","scope":"Supports non-async arrow functions with expression or block bodies through existing function-expression lowering. This does not implement lexical `this`, `arguments`, or async arrow semantics.","next_action_hint":"Investigate class property field clauses or object pattern assignment targets next; avoid tagged templates until nested object property preservation across function calls is understood."}}
{"run":736,"commit":"eb0d585","metric":60,"metrics":{"js_bytecode_existing_cases":157,"js_bytecode_existing_compiled":105,"js_bytecode_existing_unsupported":48,"js_bytecode_existing_mismatches":8,"js_bytecode_existing_native_loadable":99,"js_bytecode_compiler_cases":118,"js_bytecode_compiler_compiled":118,"js_bytecode_compiler_unsupported":0,"js_bytecode_compiler_mismatches":0,"js_bytecode_compiler_native_loadable":118,"js_bytecode_compiler_failures":0},"status":"keep","description":"Support class static fields and methods","timestamp":1777835114369,"segment":28,"confidence":4,"iterationTokens":44257,"asi":{"hypothesis":"Static class members can be compiled as property assignments on the factory function after class creation, splitting static/instance members before factory construction.","result":"Offset-2000 failures improved 61 -> 60; stable audit expanded to 118; checks passed.","scope":"Supports non-computed static methods and static fields with expression initializers. Private/computed static members remain unsupported."}}
{"run":737,"commit":"986f26c","metric":59,"metrics":{"js_bytecode_existing_cases":157,"js_bytecode_existing_compiled":105,"js_bytecode_existing_unsupported":48,"js_bytecode_existing_mismatches":7,"js_bytecode_existing_native_loadable":100,"js_bytecode_compiler_cases":119,"js_bytecode_compiler_compiled":119,"js_bytecode_compiler_unsupported":0,"js_bytecode_compiler_mismatches":0,"js_bytecode_compiler_native_loadable":119,"js_bytecode_compiler_failures":0},"status":"keep","description":"Support __proto__ object literals and set_proto opcode","timestamp":1777835266534,"segment":28,"confidence":4.125,"iterationTokens":8919,"asi":{"hypothesis":"Object literal __proto__ should use QuickJS set_proto opcode instead of define_field to correctly set the prototype chain.","result":"Offset-2000 failures improved 60 -> 59; mismatches dropped 8 -> 7; native loadable hit 100; stable audit at 119.","scope":"Added set_proto and nip assembler opcodes; __proto__ identified properties in object literals now use set_proto. Also fixed constructor fields mismatch by this native-load change."}}
{"run":738,"commit":"986f26c","metric":57,"metrics":{"js_bytecode_existing_cases":157,"js_bytecode_existing_compiled":107,"js_bytecode_existing_unsupported":46,"js_bytecode_existing_mismatches":7,"js_bytecode_existing_native_loadable":102,"js_bytecode_compiler_cases":121,"js_bytecode_compiler_compiled":121,"js_bytecode_compiler_unsupported":0,"js_bytecode_compiler_mismatches":0,"js_bytecode_compiler_native_loadable":121,"js_bytecode_compiler_failures":0},"status":"checks_failed","description":"Try computed class methods and captures (Credo reject chain)","timestamp":1777835523241,"segment":28,"confidence":4.125,"iterationTokens":14281,"asi":{"hypothesis":"Class factory captures for computed keys plus computed instance/static methods.","rollback_reason":"Credo found chained Enum.reject calls that should be merged.","next_action_hint":"Merge the two Enum.reject calls into one, then re-run."}}
{"run":739,"commit":"f4c1b7f","metric":57,"metrics":{"js_bytecode_existing_cases":157,"js_bytecode_existing_compiled":107,"js_bytecode_existing_unsupported":46,"js_bytecode_existing_mismatches":7,"js_bytecode_existing_native_loadable":102,"js_bytecode_compiler_cases":121,"js_bytecode_compiler_compiled":121,"js_bytecode_compiler_unsupported":0,"js_bytecode_compiler_mismatches":0,"js_bytecode_compiler_native_loadable":121,"js_bytecode_compiler_failures":0},"status":"keep","description":"Support computed class methods and class factory captures","timestamp":1777835619540,"segment":28,"confidence":4.117647058823529,"iterationTokens":5363,"asi":{"hypothesis":"Computed class methods can use the existing object-property computed key lowering and class factory captures can propagate outer-scope names (excluding self and superclass) via value-capture bind.","result":"Offset-2000 failures improved 59 -> 57; unsupported dropped 48 -> 46; compiled increased to 107; native loadable to 102; checks passed.","scope":"Supports computed instance methods, computed static methods, and outer-scope captures for class factories with computed keys. Excludes class name and superclass name from captures to avoid parameter-list pollution."}}
