{"run":120,"commit":"1e05482","metric":232,"metrics":{"parser_tests":129,"parser_test_ms":300},"status":"keep","description":"Port catch destructuring coverage","timestamp":1777211253979,"segment":0,"confidence":4.411764705882353,"iterationTokens":1035,"asi":{"hypothesis":"Catch binding parsing should compose with existing object/array binding patterns, including defaults and rest elements.","learned":"No implementation change was required; catch clauses already call `parse_binding_pattern/1`, so destructuring catch params share variable/function parameter pattern support.","quickjs_cases":"Adds QuickJS-compatible catch binding coverage for object and array destructuring catch parameters."}}
{"run":121,"commit":"ff67497","metric":234,"metrics":{"parser_tests":130,"parser_test_ms":200},"status":"keep","description":"Port super property assignment coverage","timestamp":1777211339419,"segment":0,"confidence":4.365384615384615,"iterationTokens":1160,"asi":{"hypothesis":"Existing super/member parsing should cover assignment to super properties and computed super properties inside class methods.","learned":"No implementation change was required; `super` is parsed as an identifier-like primary and composes with member access on the left side of assignment expressions.","quickjs_cases":"Adds QuickJS-compatible class coverage for `super.value = value` and `super[\"other\"] = value`."}}
{"run":122,"commit":"bdcc571","metric":236,"metrics":{"parser_tests":131,"parser_test_ms":200},"status":"keep","description":"Port rest parameter diagnostics","timestamp":1777211428649,"segment":0,"confidence":4.403846153846154,"iterationTokens":1147,"asi":{"hypothesis":"Existing rest parameter parser recovery should report errors when rest parameters are not final.","learned":"No implementation change was required; the parameter parser expects `)` immediately after a rest binding, causing non-final rest parameter forms to return parser errors.","quickjs_cases":"Adds QuickJS-compatible syntax-error coverage for `function f(...rest, extra) {}` and `(...rest, extra) => rest`."}}
{"run":123,"commit":"7ef4681","metric":238,"metrics":{"parser_tests":132,"parser_test_ms":300},"status":"keep","description":"Port spread trailing argument coverage","timestamp":1777211496126,"segment":0,"confidence":4.4423076923076925,"iterationTokens":922,"asi":{"hypothesis":"Argument-list parsing should accept a trailing comma after a spread argument where supported by modern JavaScript parsers.","learned":"No implementation change was required; the argument parser's spread branch already accepts comma followed by a closing parenthesis.","quickjs_cases":"Adds QuickJS-compatible spread-call coverage for `f(...args,)`."}}
{"run":124,"commit":"512d037","metric":240,"metrics":{"parser_tests":133,"parser_test_ms":200},"status":"keep","description":"Port string line continuation coverage","timestamp":1777211592794,"segment":0,"confidence":4.39622641509434,"iterationTokens":1511,"asi":{"hypothesis":"String escape scanning should implement JavaScript line continuations by omitting escaped line terminators from cooked string values.","learned":"Escaped line terminators are now consumed through the existing line-terminator handling and contribute an empty string to the cooked literal.","quickjs_cases":"Adds QuickJS-compatible string literal coverage for a backslash-newline continuation in `\"a\\\nb\"` producing `ab`."}}
{"run":125,"commit":"1565000","metric":242,"metrics":{"parser_tests":134,"parser_test_ms":200},"status":"keep","description":"Port CRLF string continuation coverage","timestamp":1777211680010,"segment":0,"confidence":4.351851851851852,"iterationTokens":1020,"asi":{"hypothesis":"The string line-continuation support should handle CRLF as a single escaped line terminator, not as two cooked characters.","learned":"No implementation change was required after using `consume_line_terminator/1`; CRLF continuations are consumed as a single omitted line continuation.","quickjs_cases":"Adds QuickJS-compatible string literal coverage for a backslash-CRLF continuation."}}
{"run":126,"commit":"439e84a","metric":244,"metrics":{"parser_tests":135,"parser_test_ms":200},"status":"keep","description":"Port hashbang coverage","timestamp":1777211800433,"segment":0,"confidence":4.3090909090909095,"iterationTokens":1020,"asi":{"hypothesis":"Lexer trivia handling should treat an initial `#!` line as a hashbang comment before normal tokenization.","learned":"Added hashbang skipping only at offset 0, reusing line-comment advancement semantics so later `#` remains available for private names and diagnostics.","quickjs_cases":"Adds QuickJS-compatible hashbang coverage for a script beginning with `#!/usr/bin/env quickjs`."}}
{"run":127,"commit":"3ebec70","metric":246,"metrics":{"parser_tests":136,"parser_test_ms":300},"status":"keep","description":"Port string null escape coverage","timestamp":1777211858791,"segment":0,"confidence":4.267857142857143,"iterationTokens":2038,"asi":{"hypothesis":"String escape cooking should decode `\\0` to a NUL byte instead of leaving it as the character `0`.","learned":"The lexer already had a NUL escape branch; the new focused QuickJS-derived coverage verifies the cooked value and compile checks caught an accidental duplicate branch during development.","quickjs_cases":"Adds QuickJS-compatible string literal coverage for `\"a\\0b\"` producing a cooked NUL byte."}}
{"run":128,"commit":"5dcd636","metric":248,"metrics":{"parser_tests":137,"parser_test_ms":400},"status":"keep","description":"Port private method coverage","timestamp":1777211924233,"segment":0,"confidence":4.303571428571429,"iterationTokens":1095,"asi":{"hypothesis":"Existing private-name class element parsing should support private methods and private method calls via member expressions.","learned":"No implementation change was required; private class keys are parsed by property-key parsing and `this.#method(value)` is handled by member/call expression parsing.","quickjs_cases":"Adds QuickJS-compatible class coverage for `#method(value) {}` and `this.#method(value)`."}}
{"run":129,"commit":"9aa82e5","metric":250,"metrics":{"parser_tests":138,"parser_test_ms":400},"status":"keep","description":"Port static private method coverage","timestamp":1777211978382,"segment":0,"confidence":4.339285714285714,"iterationTokens":958,"asi":{"hypothesis":"Static class member parsing should combine with private method keys for modern class private static methods.","learned":"No implementation change was required; static modifier handling feeds into the same private-key method parser used by instance private methods.","quickjs_cases":"Adds QuickJS-compatible class coverage for `static #method(value) {}` and a static caller method."}}
{"run":130,"commit":"5c861d4","metric":252,"metrics":{"parser_tests":139,"parser_test_ms":400},"status":"keep","description":"Port private accessor coverage","timestamp":1777212065619,"segment":0,"confidence":4.375,"iterationTokens":7342,"asi":{"hypothesis":"Class accessor detection should recognize `get #name()` and `set #name(...)` as accessors rather than fields followed by methods.","learned":"Accessor lookahead now includes the private-name token pattern `# identifier (` alongside normal identifier and computed keys.","quickjs_cases":"Adds QuickJS-compatible private accessor coverage for `get #value()` and `set #value(value)`."}}
{"run":131,"commit":"ed14f0c","metric":254,"metrics":{"parser_tests":140,"parser_test_ms":300},"status":"keep","description":"Port async private method coverage","timestamp":1777212131666,"segment":0,"confidence":4.410714285714286,"iterationTokens":1963,"asi":{"hypothesis":"Async method lookahead should recognize private method keys so `async #name()` is parsed as one async method.","learned":"Async method detection now includes private-name and async-generator private-name lookahead shapes in addition to identifier and computed keys.","quickjs_cases":"Adds QuickJS-compatible class coverage for `async #method(value) { return await value; }`."}}
{"run":132,"commit":"ed14f0c","metric":256,"metrics":{"parser_tests":141,"parser_test_ms":300},"status":"checks_failed","description":"Port async generator private method coverage","timestamp":1777212178975,"segment":0,"confidence":4.371681415929204,"iterationTokens":936,"asi":{"hypothesis":"Async generator private method parsing should be covered by the private-name async method lookahead added for the previous experiment.","rollback_reason":"Backpressure failed in `mix test test/web_apis` due the known transient Process.monitor test returning `noproc` instead of `kaboom`; parser tests passed and the failure is unrelated, so retry the same experiment from a clean tree.","next_action_hint":"Re-add the focused async-generator private method parser test and rerun the experiment; if checks pass, keep it.","quickjs_cases":"Attempted QuickJS-compatible class coverage for `async *#method(value) { yield await value; }`."}}
{"run":133,"commit":"8266186","metric":256,"metrics":{"parser_tests":141,"parser_test_ms":300},"status":"keep","description":"Port async generator private method coverage","timestamp":1777212235300,"segment":0,"confidence":4.368421052631579,"iterationTokens":1693,"asi":{"hypothesis":"Async generator private method parsing should be covered by the private-name async method lookahead added for async private methods.","learned":"No implementation change was required after the async-method lookahead expansion; `async *#method` parses as an async generator MethodDefinition with a PrivateIdentifier key.","quickjs_cases":"Adds QuickJS-compatible class coverage for `async *#method(value) { yield await value; }` after retrying a transient web API check failure."}}
{"run":134,"commit":"620c716","metric":258,"metrics":{"parser_tests":142,"parser_test_ms":700},"status":"keep","description":"Port static private accessor coverage","timestamp":1777212292643,"segment":0,"confidence":4.3652173913043475,"iterationTokens":1026,"asi":{"hypothesis":"Static modifier handling should compose with private accessor lookahead for `static get #x()` and `static set #x(v)`.","learned":"No implementation change was required after private accessor support; the class static modifier is consumed before the same accessor parser runs.","quickjs_cases":"Adds QuickJS-compatible class coverage for static private getters and setters."}}
{"run":135,"commit":"ddeff65","metric":260,"metrics":{"parser_tests":143,"parser_test_ms":300},"status":"keep","description":"Port static async private method coverage","timestamp":1777212339754,"segment":0,"confidence":4.362068965517241,"iterationTokens":1026,"asi":{"hypothesis":"Static method parsing should compose with async private method lookahead for `static async #name()`.","learned":"No implementation change was required; static modifier consumption leaves the parser positioned at the async private method start recognized in the previous lookahead fix.","quickjs_cases":"Adds QuickJS-compatible class coverage for `static async #method(value) { return await value; }`."}}
{"run":136,"commit":"3ec7856","metric":262,"metrics":{"parser_tests":144,"parser_test_ms":300},"status":"keep","description":"Port static async generator private method coverage","timestamp":1777212395260,"segment":0,"confidence":4.358974358974359,"iterationTokens":944,"asi":{"hypothesis":"Static modifier handling should also compose with async generator private method lookahead for `static async *#name()`.","learned":"No implementation change was required after the async private generator lookahead branch; static members reuse the same async class method parser.","quickjs_cases":"Adds QuickJS-compatible class coverage for `static async *#method(value) { yield await value; }`."}}
{"run":137,"commit":"cf0a88c","metric":264,"metrics":{"parser_tests":145,"parser_test_ms":300},"status":"keep","description":"Port default re-export specifier coverage","timestamp":1777212449225,"segment":0,"confidence":4.3559322033898304,"iterationTokens":986,"asi":{"hypothesis":"Named export specifier parsing should treat contextual `default` as an exportable local name in re-export lists.","learned":"No implementation change was required; export specifier key parsing accepts keyword tokens, so `default as namedDefault` is represented as an ExportSpecifier from a `default` identifier.","quickjs_cases":"Adds QuickJS-compatible module coverage for `export { default as namedDefault } from \"dep\"`."}}
{"run":138,"commit":"be7d6e0","metric":266,"metrics":{"parser_tests":146,"parser_test_ms":500},"status":"keep","description":"Port default named import coverage","timestamp":1777212509610,"segment":0,"confidence":4.316666666666666,"iterationTokens":1078,"asi":{"hypothesis":"Named import parsing should support the contextual `default as local` form in import specifier lists.","learned":"No implementation change was required; import specifier parsing accepts keyword-like property names and preserves the imported/local identifier distinction.","quickjs_cases":"Adds QuickJS-compatible module coverage for `import { default as namedDefault } from \"dep\"`."}}
{"run":139,"commit":"be7d6e0","metric":268,"metrics":{"parser_tests":147,"parser_test_ms":600},"status":"checks_failed","description":"Port string import name coverage","timestamp":1777212566339,"segment":0,"confidence":4.245901639344262,"iterationTokens":983,"asi":{"hypothesis":"Named import specifier parsing should accept string-literal imported names with local aliases.","rollback_reason":"Backpressure failed in the known transient Process.monitor web API test (`noproc` instead of `kaboom`) while parser tests passed; the parser coverage change is unrelated and should be retried cleanly.","next_action_hint":"Re-add the string import-name test and rerun; keep if web API checks pass.","quickjs_cases":"Attempted module coverage for `import { \"external-name\" as localName } from \"dep\"`."}}
{"run":140,"commit":"be7d6e0","metric":268,"metrics":{"parser_tests":147,"parser_test_ms":400},"status":"checks_failed","description":"Retry string import name coverage","timestamp":1777212617037,"segment":0,"confidence":4.211382113821138,"iterationTokens":1599,"asi":{"hypothesis":"Retrying the string import-name coverage should pass once the known Process.monitor timing flake does not occur.","rollback_reason":"Backpressure failed again in the same unrelated Process.monitor web API test (`noproc` instead of `kaboom`); parser tests still pass.","next_action_hint":"Defer or retry later after a clean web API run; avoid keeping while checks fail.","quickjs_cases":"Retried module coverage for `import { \"external-name\" as localName } from \"dep\"`."}}
{"run":141,"commit":"5e6c71e","metric":268,"metrics":{"parser_tests":147,"parser_test_ms":300},"status":"keep","description":"Port string import name coverage","timestamp":1777212680316,"segment":0,"confidence":4.209677419354839,"iterationTokens":2490,"asi":{"hypothesis":"Named import specifier parsing should accept string-literal imported names with local aliases.","learned":"No implementation change was required; import specifier parsing already uses property-key parsing for imported names, which accepts string literals.","quickjs_cases":"Adds QuickJS-compatible module coverage for `import { \"external-name\" as localName } from \"dep\"` after retrying transient web API flakes."}}
{"run":142,"commit":"5435fe3","metric":270,"metrics":{"parser_tests":148,"parser_test_ms":300},"status":"keep","description":"Port string import local diagnostics","timestamp":1777212727645,"segment":0,"confidence":4.208,"iterationTokens":922,"asi":{"hypothesis":"Import specifier parsing should reject string literals as local binding names even when string imported names are accepted.","learned":"No implementation change was required; after `as`, import parsing calls binding identifier parsing, which emits a diagnostic for a string literal local name.","quickjs_cases":"Adds QuickJS-compatible module syntax-error coverage for `import { \"external-name\" as \"local-name\" } from \"dep\"`."}}
{"run":143,"commit":"9107784","metric":272,"metrics":{"parser_tests":149,"parser_test_ms":400},"status":"keep","description":"Port regexp character class coverage","timestamp":1777212783859,"segment":0,"confidence":4.2063492063492065,"iterationTokens":2081,"asi":{"hypothesis":"Regexp literal scanning should not terminate on slash characters that appear inside a character class.","learned":"No implementation change was required; regexp scanning already tracks character-class state and preserves flags in the regexp literal payload.","quickjs_cases":"Adds QuickJS-compatible regexp literal coverage for a character class containing `/` and `\\]`, with `gi` flags."}}
{"run":144,"commit":"cec7215","metric":274,"metrics":{"parser_tests":150,"parser_test_ms":400},"status":"keep","description":"Port regexp named capture coverage","timestamp":1777212839904,"segment":0,"confidence":4.2047244094488185,"iterationTokens":921,"asi":{"hypothesis":"Regexp literal tokenization should preserve modern regexp syntax such as named capture groups and named backreferences without parser-level interpretation.","learned":"No implementation change was required; regexp scanning treats the pattern body opaquely while respecting escapes and terminators, so named captures/backreferences are preserved in the literal payload.","quickjs_cases":"Adds QuickJS-compatible regexp literal coverage for `/(?<name>[a-z]+)\\k<name>/u`."}}
{"run":145,"commit":"c628d8c","metric":276,"metrics":{"parser_tests":151,"parser_test_ms":300},"status":"keep","description":"Port regexp unicode property coverage","timestamp":1777212893340,"segment":0,"confidence":4.203125,"iterationTokens":999,"asi":{"hypothesis":"Regexp literal tokenization should preserve Unicode property escapes and flags without trying to parse the regexp grammar itself.","learned":"No implementation change was required; escaped sequences remain part of the opaque regexp pattern and the `u` flag is preserved.","quickjs_cases":"Adds QuickJS-compatible regexp literal coverage for `/\\p{Script=Greek}+/u`."}}
{"run":146,"commit":"a02e9ab","metric":279,"metrics":{"parser_tests":153,"parser_test_ms":300},"status":"keep","description":"Port import attributes coverage","timestamp":1777213015664,"segment":0,"confidence":4.217054263565892,"iterationTokens":8073,"asi":{"hypothesis":"Static import parsing should accept modern import attribute clauses after the module source for both normal and side-effect imports.","learned":"ImportDeclaration now carries optional attributes parsed as an object expression after `with { ... }` or `assert { ... }`; existing import declarations keep attributes nil.","quickjs_cases":"Adds QuickJS-compatible module coverage for `import data from \"./data.json\" with { type: \"json\" }` and side-effect import assertions."}}
{"run":147,"commit":"e7f18e7","metric":281,"metrics":{"parser_tests":154,"parser_test_ms":300},"status":"keep","description":"Port re-export attributes coverage","timestamp":1777213103120,"segment":0,"confidence":4.2153846153846155,"iterationTokens":2980,"asi":{"hypothesis":"Module re-export parsing should accept import-attribute clauses after the source string for named and export-all declarations.","learned":"ExportNamedDeclaration and ExportAllDeclaration now carry optional attributes parsed through the same object-expression clause helper as imports.","quickjs_cases":"Adds QuickJS-compatible module coverage for named re-export `with { type: \"json\" }` and export-all `assert { type: \"json\" }` attributes."}}
{"run":148,"commit":"df060ce","metric":283,"metrics":{"parser_tests":155,"parser_test_ms":400},"status":"keep","description":"Port dynamic import attributes coverage","timestamp":1777213169035,"segment":0,"confidence":4.181818181818182,"iterationTokens":1684,"asi":{"hypothesis":"Dynamic import parsing should naturally support an options object with import attributes as a second call argument.","learned":"No implementation change was required; dynamic import is represented as a CallExpression and its second argument reuses normal object literal parsing, including `with` as a property key.","quickjs_cases":"Adds QuickJS-compatible module coverage for `import(\"./data.json\", { with: { type: \"json\" } })`."}}
{"run":149,"commit":"9dff12b","metric":285,"metrics":{"parser_tests":156,"parser_test_ms":400},"status":"keep","description":"Port division tokenization coverage","timestamp":1777213237524,"segment":0,"confidence":4.149253731343284,"iterationTokens":1501,"asi":{"hypothesis":"Regexp/division lexical goal heuristics should treat `/` after identifiers, member expressions, and calls as division operators rather than regexp starts.","learned":"No implementation change was required for these cases; the lexer emits division punctuators after expression-ending tokens and Pratt parsing builds left-associative BinaryExpression nodes.","quickjs_cases":"Adds QuickJS-compatible expression coverage for chained division, member-result division, and call-result division."}}
{"run":150,"commit":"1ab4128","metric":287,"metrics":{"parser_tests":157,"parser_test_ms":400},"status":"keep","description":"Port tagged template coverage","timestamp":1777213301164,"segment":0,"confidence":4.148148148148148,"iterationTokens":1384,"asi":{"hypothesis":"Template literal parsing should compose with identifier and member-expression tags to represent tagged template expressions.","learned":"No implementation change was required; postfix-tail parsing already recognizes template tokens after expressions and wraps them as TaggedTemplateExpression nodes.","quickjs_cases":"Adds QuickJS-compatible tagged template coverage for identifier tags, member tags, and templates containing `${...}`."}}
