{"type":"config","name":"Expand QuickJS-compatible JavaScript parser coverage","metricName":"quickjs_parser_tests","metricUnit":"","bestDirection":"higher"}
{"run":1,"commit":"93d8357","metric":7,"metrics":{"parser_tests":0,"parser_test_ms":100},"status":"keep","description":"Baseline JS parser autoresearch coverage","timestamp":1777198136907,"segment":0,"confidence":null,"iterationTokens":90,"asi":{"hypothesis":"Baseline captures current QuickJS-port parser test coverage before new parser experiments.","note":"parser_tests secondary metric parsed as 0 due autoresearch.sh summary extraction bug; fix script in next experiment before interpreting that secondary metric."}}
{"run":2,"commit":"80911bc","metric":10,"metrics":{"parser_tests":12,"parser_test_ms":90},"status":"keep","description":"Port QuickJS numeric separator parser coverage","timestamp":1777198267522,"segment":0,"confidence":null,"iterationTokens":4456,"asi":{"hypothesis":"Adding numeric separator lexing and tests for QuickJS number literal cases should increase parser coverage while preserving existing behavior.","learned":"Lexer needed underscore-aware digit scanning and explicit legacy-leading-zero separator validation. Fixed autoresearch.sh parser_tests metric extraction in the same kept experiment.","quickjs_cases":"Covers valid 1_0 and invalid 0_0, 00_0, 01_0, 08_0, 09_0 from test_number_literals."}}
{"run":3,"commit":"a3c9417","metric":12,"metrics":{"parser_tests":13,"parser_test_ms":100},"status":"keep","description":"Port QuickJS regexp literal skip coverage","timestamp":1777198357453,"segment":0,"confidence":2.5,"iterationTokens":2883,"asi":{"hypothesis":"Adding lexer regexp-goal tracking and regexp literal AST support should parse QuickJS regexp-skip cases where `/` follows assignment operators.","learned":"A minimal previous-token regexp_allowed? heuristic is enough for current parser coverage; future work must refine lexical goals for division-heavy expressions.","quickjs_cases":"Ports test_regexp_skip forms `[a, b = /abc\\(/] = [1]` and `[a, b =/abc\\(/] = [2]`."}}
{"run":4,"commit":"2f289f7","metric":15,"metrics":{"parser_tests":15,"parser_test_ms":100},"status":"keep","description":"Port QuickJS template literal coverage","timestamp":1777198476111,"segment":0,"confidence":3.2,"iterationTokens":2931,"asi":{"hypothesis":"Adding whole-template tokenization and tagged-template postfix parsing should cover QuickJS template parser skip cases without full template AST semantics yet.","learned":"A scanner that skips nested `${...}` and nested backtick templates is enough for parser-level coverage of current QuickJS template tests; future semantic lowering will need real quasis/expressions.","quickjs_cases":"Ports test_template plain/tagged template examples and test_template_skip nested template example."}}
{"run":5,"commit":"1eb7ddd","metric":18,"metrics":{"parser_tests":17,"parser_test_ms":100},"status":"keep","description":"Port QuickJS array destructuring coverage","timestamp":1777198604235,"segment":0,"confidence":3.6666666666666665,"iterationTokens":5866,"asi":{"hypothesis":"Adding array binding pattern AST support should cover QuickJS destructuring declaration syntax and prepare for arrow/function parameter patterns.","learned":"Parser declarations now branch through parse_binding_pattern; array patterns support holes, defaults, and rest elements without affecting array expression parsing.","quickjs_cases":"Ports test_destructuring `function * g () { return 0; }; var [x] = g();` and adds adjacent default/rest binding syntax coverage."}}
{"run":6,"commit":"6d48102","metric":20,"metrics":{"parser_tests":18,"parser_test_ms":200},"status":"keep","description":"Port QuickJS arrow parameter syntax coverage","timestamp":1777198692934,"segment":0,"confidence":3.25,"iterationTokens":3356,"asi":{"hypothesis":"Adding parenthesized arrow-parameter detection plus object patterns and parameter defaults should cover QuickJS function-length syntax forms without implementing function length semantics.","learned":"A token scan for matching paren followed by `=>` cleanly distinguishes parenthesized arrow params from grouping for current coverage. Formal params now reuse binding patterns and assignment patterns.","quickjs_cases":"Ports syntax shape from test_function_length: `(a,b=1,c)=>{}`, `([a,b])=>{}`, `({a,b})=>{}`, `(c,[a,b]=1,d)=>{}`."}}
{"run":7,"commit":"d3e8b63","metric":22,"metrics":{"parser_tests":19,"parser_test_ms":100},"status":"keep","description":"Port QuickJS private field parse coverage","timestamp":1777198777856,"segment":0,"confidence":3,"iterationTokens":3111,"asi":{"hypothesis":"Adding minimal class body parsing and private identifiers should cover QuickJS parser regression where division after a private field must not be lexed as regexp.","learned":"Existing regexp_allowed? heuristic already treats identifier before slash as division context; adding `#` punctuator plus private member parsing lets the regression be expressed in parser tests.","quickjs_cases":"Ports syntax from test_op1 class Q private field division case: `class Q { #x = 10; f() { return (this.#x / 2); } }`."}}
{"run":8,"commit":"8c8b9e3","metric":23,"metrics":{"parser_tests":20,"parser_test_ms":100},"status":"keep","description":"Port QuickJS new expression call chain coverage","timestamp":1777198907454,"segment":0,"confidence":3.2,"iterationTokens":4070,"asi":{"hypothesis":"Adding `new` expression parsing should let parser tests represent the full QuickJS private-field regression assertion shape rather than only the class body.","learned":"Prefix `new` parsing composes with existing postfix call/member parsing, producing `new Q().f()` as a NewExpression wrapped by member/call nodes.","quickjs_cases":"Extends private-field regression coverage with `assert(new Q().f(), 5);` call-chain syntax."}}
{"run":9,"commit":"98cb855","metric":25,"metrics":{"parser_tests":21,"parser_test_ms":100},"status":"keep","description":"Port QuickJS try catch parser coverage","timestamp":1777199024327,"segment":0,"confidence":3.6,"iterationTokens":5956,"asi":{"hypothesis":"Adding try/catch/finally statement parsing should cover QuickJS constructor/delete parser shapes and enable more syntax-test ports.","learned":"TryStatement can reuse existing block and binding-pattern parsing; optional catch binding and finally block compose without touching expression parser.","quickjs_cases":"Ports try/catch forms used by test_constructor and test_delete: `try { new G() } catch (ex_) { ... }` and catch/finally syntax."}}
{"run":10,"commit":"68e74dd","metric":27,"metrics":{"parser_tests":22,"parser_test_ms":200},"status":"keep","description":"Port QuickJS switch parser coverage","timestamp":1777199129763,"segment":0,"confidence":4,"iterationTokens":2516,"asi":{"hypothesis":"Adding switch/case/default statement parsing should cover QuickJS assert_throws helper syntax and broaden statement parser coverage.","learned":"Switch consequent parsing needs a statement-list variant that stops at `case`, `default`, or `}`; existing statement parser can otherwise be reused.","quickjs_cases":"Ports assert_throws switch over `typeof func` with `case 'string'`, `case 'function'`, default, and break statements."}}
{"run":11,"commit":"a8c1c59","metric":29,"metrics":{"parser_tests":23,"parser_test_ms":200},"status":"keep","description":"Port QuickJS optional chaining parser coverage","timestamp":1777199272589,"segment":0,"confidence":4.4,"iterationTokens":3108,"asi":{"hypothesis":"Adding optional chaining postfix parsing should cover QuickJS optional-chaining syntactic forms and expose unary/postfix precedence issues.","learned":"Lexer needs `?.` punctuator. Unary parsing must let postfix tails bind to its operand so `delete a?.b` becomes delete of the optional member expression rather than optional member of `(delete a)`.","quickjs_cases":"Ports optional chaining syntax forms `a?.b`, `a?.b()`, `a?.[\"b\"]()`, and `delete a?.b[\"c\"]`."}}
{"run":12,"commit":"2b548f0","metric":32,"metrics":{"parser_tests":25,"parser_test_ms":400},"status":"keep","description":"Port QuickJS throw statement parser coverage","timestamp":1777199368410,"segment":0,"confidence":4.166666666666667,"iterationTokens":1739,"asi":{"hypothesis":"Adding throw statement parsing and its line-terminator restricted production should cover QuickJS assert helper syntax and an important ASI rule.","learned":"Throw is a statement, not a prefix expression; parser now emits a dedicated ThrowStatement and reports a targeted error when a line terminator follows `throw`.","quickjs_cases":"Ports assert helper `throw Error(...)` syntax and QuickJS syntax coverage for throw line-terminator errors."}}
{"run":13,"commit":"206ea65","metric":34,"metrics":{"parser_tests":26,"parser_test_ms":200},"status":"keep","description":"Port QuickJS sequence expression parser coverage","timestamp":1777199438230,"segment":0,"confidence":3.857142857142857,"iterationTokens":1560,"asi":{"hypothesis":"Representing comma operators as SequenceExpression should improve AST fidelity for QuickJS template and expression syntax coverage.","learned":"The existing Pratt comma precedence could be preserved; only binary node construction needed special handling to flatten comma chains.","quickjs_cases":"Ports comma sequence syntax used by test_template expression `${a, b}` via direct parser coverage of `(a, b, c)`."}}
{"run":14,"commit":"5799e25","metric":37,"metrics":{"parser_tests":28,"parser_test_ms":200},"status":"keep","description":"Port QuickJS class feature parser coverage","timestamp":1777199545901,"segment":0,"confidence":4.285714285714286,"iterationTokens":4146,"asi":{"hypothesis":"Enhancing class parsing for static modifiers, accessors, extends, and class expressions should cover a substantial QuickJS class syntax slice without changing runtime semantics.","learned":"`static()` must remain a method named static, while `static F()` and `static x = ...` use a modifier; accessor parsing reuses class key/formal parameter/block helpers.","quickjs_cases":"Ports test_class syntax for static methods, getters, extends, super member calls, static fields, and `var E1 = class E { ... }` class expressions."}}
{"run":15,"commit":"cd673c1","metric":39,"metrics":{"parser_tests":29,"parser_test_ms":200},"status":"keep","description":"Port QuickJS argument-scope parser coverage","timestamp":1777199619131,"segment":0,"confidence":4,"iterationTokens":2494,"asi":{"hypothesis":"Existing function/arrow/default-parameter support should be validated against QuickJS argument-scope syntax, and autoresearch notes should be refreshed to avoid repeating completed candidates.","learned":"Current parser already handles the argument-scope syntax slice after prior arrow/default/class work; added non-redundant regression coverage and updated autoresearch.md with completed areas and next candidates.","quickjs_cases":"Ports test_argument_scope syntax forms with function default parameters, arrow defaults, eval calls, named function expressions, and nested arrow default parameters."}}
{"run":16,"commit":"9a8a2cb","metric":42,"metrics":{"parser_tests":31,"parser_test_ms":200},"status":"keep","description":"Port QuickJS reserved binding name coverage","timestamp":1777199723301,"segment":0,"confidence":4.117647058823529,"iterationTokens":1639,"asi":{"hypothesis":"Classifying future reserved words as keywords and tightening binding identifier acceptance should cover QuickJS reserved-name parser errors while preserving await contextual binding allowance.","learned":"Adding implements/interface/package/private/protected/public to keyword lexing makes declaration binding validation catch them uniformly; `await` remains a contextual binding name in script-mode parser coverage.","quickjs_cases":"Ports test_reserved_names coverage for yield, implements, interface, let, package, private, protected, public, static as invalid var bindings and await as allowed."}}
{"run":17,"commit":"83d6957","metric":44,"metrics":{"parser_tests":32,"parser_test_ms":200},"status":"keep","description":"Port QuickJS template destructuring parser coverage","timestamp":1777199834674,"segment":0,"confidence":4.111111111111111,"iterationTokens":5549,"asi":{"hypothesis":"Exact QuickJS template-skip destructuring declaration should now be representable by the combined object-pattern and nested-template parser support; adding regression coverage verifies the composition.","learned":"No parser change was needed: object binding default initializers compose with whole-template tokenization and object expression initializers.","quickjs_cases":"Ports exact shape from test_template_skip: `var { b = `${a + `a${a}` }baz` } = {};`."}}
{"run":18,"commit":"df36b02","metric":46,"metrics":{"parser_tests":33,"parser_test_ms":200},"status":"keep","description":"Port QuickJS function expression name parser coverage","timestamp":1777199895393,"segment":0,"confidence":4.105263157894737,"iterationTokens":1299,"asi":{"hypothesis":"Existing function expression and parenthesized callee parsing should cover QuickJS function-expression-name and IIFE syntax; adding tests verifies composition without parser changes.","learned":"FunctionExpression IDs, parenthesized function expressions, and parenthesized arrow functions already compose with postfix call parsing.","quickjs_cases":"Ports representative syntax from test_function_expr_name: named function expression assignment plus function and arrow IIFEs."}}
{"run":19,"commit":"29fc99d","metric":48,"metrics":{"parser_tests":34,"parser_test_ms":200},"status":"keep","description":"Port QuickJS super call parser coverage","timestamp":1777199963798,"segment":0,"confidence":4.1,"iterationTokens":1486,"asi":{"hypothesis":"Existing class and call/member parsing should cover super constructor calls and super member calls from QuickJS class tests; adding explicit coverage guards that composition.","learned":"No parser changes needed: `super` is represented as an Identifier and composes with CallExpression and MemberExpression nodes inside class methods.","quickjs_cases":"Ports class D syntax from test_class: `super(); this.z = 20;`, `return super.f();`, and `return super[\"F\"]();`."}}
{"run":20,"commit":"ce2981c","metric":50,"metrics":{"parser_tests":35,"parser_test_ms":200},"status":"keep","description":"Port QuickJS prototype parser coverage","timestamp":1777200026858,"segment":0,"confidence":4.095238095238095,"iterationTokens":1161,"asi":{"hypothesis":"Existing member-call and object-literal parsing should cover QuickJS prototype descriptor syntax; adding coverage prevents regressions in nested member chains and object literal booleans.","learned":"No parser change needed: nested member expressions, CallExpression arguments, FunctionExpression initializers, and boolean object properties compose correctly.","quickjs_cases":"Ports representative test_prototype syntax: `Object.defineProperty(g, \"prototype\", { writable: false })` and `f.prototype.constructor` assertion call."}}
{"run":21,"commit":"d3aa185","metric":52,"metrics":{"parser_tests":36,"parser_test_ms":300},"status":"keep","description":"Port QuickJS-compatible for loop coverage","timestamp":1777200126392,"segment":0,"confidence":4.090909090909091,"iterationTokens":3649,"asi":{"hypothesis":"Adding for/for-in/for-of parsing broadens statement support needed for JavaScript/QuickJS compatibility without changing runtime behavior.","learned":"Classic for loops can reuse expression parsing, but for-in/of needs a small no-in fast path for simple identifiers before parsing the initializer as a binary `in` expression.","quickjs_cases":"Adds QuickJS-compatible parser coverage for `for (var i=...; ...; i++)`, `for (x in obj)`, and `for (let x of xs)` forms."}}
{"run":22,"commit":"c71350e","metric":54,"metrics":{"parser_tests":37,"parser_test_ms":300},"status":"keep","description":"Port QuickJS-compatible continue coverage","timestamp":1777200202275,"segment":0,"confidence":3.9166666666666665,"iterationTokens":1512,"asi":{"hypothesis":"Adding continue statement parsing complements existing break/label/loop support and improves JavaScript statement compatibility.","learned":"Continue parsing mirrors break parsing, including optional labels and ASI line-terminator handling via existing token metadata.","quickjs_cases":"Adds QuickJS-compatible coverage for `continue`, labeled `continue loop`, and composition with labeled while and for loops."}}
{"run":23,"commit":"8af2eb6","metric":56,"metrics":{"parser_tests":38,"parser_test_ms":300},"status":"keep","description":"Port QuickJS-compatible module syntax coverage","timestamp":1777200332430,"segment":0,"confidence":4.083333333333333,"iterationTokens":4837,"asi":{"hypothesis":"Adding static import/export parsing expands parser compatibility beyond script-only QuickJS language tests while preserving hand-written parser architecture.","learned":"`from`/`as` are contextual identifiers rather than keywords in the lexer; module parser should check identifier values instead of keyword tokens.","quickjs_cases":"Adds QuickJS-compatible ES module syntax coverage for side-effect imports, default/named/namespace imports, named re-exports, and export declarations."}}
{"run":24,"commit":"05052e8","metric":58,"metrics":{"parser_tests":39,"parser_test_ms":300},"status":"keep","description":"Port QuickJS-compatible object spread coverage","timestamp":1777200415988,"segment":0,"confidence":3.923076923076923,"iterationTokens":3603,"asi":{"hypothesis":"Adding object spread parsing complements existing array spread and object literal support without affecting property parsing.","learned":"Object literal parser can emit the existing SpreadElement node for `...expr` before falling through to accessor/regular property parsing.","quickjs_cases":"Adds QuickJS-compatible object spread literal coverage for `{ a: 1, ...rest, b }`, extending spread support beyond array literals."}}
{"run":25,"commit":"bc16047","metric":60,"metrics":{"parser_tests":40,"parser_test_ms":400},"status":"keep","description":"Port QuickJS-compatible async arrow coverage","timestamp":1777200494112,"segment":0,"confidence":3.7857142857142856,"iterationTokens":1574,"asi":{"hypothesis":"Adding async arrow recognition should handle JavaScript async parameter syntax and preserve line-terminator sensitivity after `async`.","learned":"Async arrow detection can reuse the existing parenthesized-arrow lookahead after temporarily advancing past `async`; single-parameter async arrows need a separate two-token lookahead.","quickjs_cases":"Adds QuickJS-compatible coverage for `async x => await x` and `async (a, b = 1) => { return await a; }`."}}
{"run":26,"commit":"e84708f","metric":63,"metrics":{"parser_tests":42,"parser_test_ms":500},"status":"keep","description":"Port QuickJS syntax error parser coverage","timestamp":1777200566507,"segment":0,"confidence":4,"iterationTokens":1037,"asi":{"hypothesis":"Existing error-tolerant parser paths should report errors for a representative subset of QuickJS syntax-error tests; adding assertions verifies no silent ok results for incomplete constructs.","learned":"Current parser already returns error tuples for incomplete do/if/while/class/switch/try forms; no implementation change needed for this coverage slice.","quickjs_cases":"Ports representative test_syntax error inputs including `do`, `do;`, `do{}`, `if`, `if 1`, `if ;`, `while`, `class`, `switch`, and `try {}`."}}
{"run":27,"commit":"311460f","metric":65,"metrics":{"parser_tests":43,"parser_test_ms":300},"status":"keep","description":"Port QuickJS-compatible default export coverage","timestamp":1777200642197,"segment":0,"confidence":3.8666666666666667,"iterationTokens":1618,"asi":{"hypothesis":"Adding export default parsing completes a common ES module declaration shape missing from the previous module syntax pass.","learned":"Default export can dispatch to existing function/class declaration parsing or expression parsing with semicolon consumption for expression defaults.","quickjs_cases":"Adds QuickJS-compatible coverage for `export default function`, `export default class`, and `export default expression` module forms."}}
{"run":28,"commit":"311460f","metric":67,"metrics":{"parser_tests":44,"parser_test_ms":300},"status":"checks_failed","description":"Attempt dynamic import parser coverage","timestamp":1777200712774,"segment":0,"confidence":3.7419354838709675,"iterationTokens":1117,"asi":{"hypothesis":"Treating `import` as an identifier only in call position should add dynamic import expression coverage without impacting static import declarations.","rollback_reason":"Backpressure check failed in known flaky BeamProcess monitor timing test (`noproc` vs `kaboom`), so autoresearch rules require checks_failed despite focused parser benchmark passing.","next_action_hint":"Reapply the small dynamic import change and rerun; if the same unrelated check flakes, rerun checks/focused web APIs before deciding whether to retry the experiment."}}
{"run":29,"commit":"e95c71a","metric":67,"metrics":{"parser_tests":44,"parser_test_ms":300},"status":"keep","description":"Port QuickJS-compatible dynamic import coverage","timestamp":1777200787167,"segment":0,"confidence":3.75,"iterationTokens":2258,"asi":{"hypothesis":"Treating `import` as an identifier only when followed by `(` should support dynamic import expressions while leaving static import declarations statement-level.","learned":"The change is safely localized to prefix parsing; static `import ...` is still captured earlier by statement parsing, while expression `import(\"mod\")` becomes a normal CallExpression.","quickjs_cases":"Adds QuickJS-compatible dynamic import expression coverage for `value = import(\"mod\");`."}}
