{"run":1430,"commit":"c4b1ea8","metric":11,"metrics":{"compiler_test262_cases":2991,"compiler_test262_pass":2980,"compiler_test262_failures":11,"compiler_test262_compiler_errors":0,"compiler_test262_compiler_crashes":0,"compiler_test262_compiler_fails":0,"compiler_test262_both_fail":10,"compiler_test262_interpreter_fail_compiler_pass":0,"compatibility_pass":2980,"compatibility_cases":2991,"compiler_errors":0,"compiler_crashes":0,"compiler_fails":0,"both_fail":10,"interpreter_fail_compiler_pass":0,"elapsed_ms":161063},"status":"keep","description":"Encode special typed array floats","timestamp":1778758379946,"segment":118,"confidence":7.3,"iterationTokens":17910,"asi":{"hypothesis":"Resizable float typed-array includes/indexOf crashes come from writing VM special numeric atoms (:nan/:infinity/:neg_infinity) through float32/float64 bit syntax without explicit IEEE encoding.","fixed_focus":["Array/prototype/includes/resizable-buffer-special-float-values.js","Array/prototype/indexOf/resizable-buffer-special-float-values.js"],"semantic_scope":"Encode and decode NaN and infinities explicitly for Float32Array/Float64Array element storage, matching existing Float16 special-value handling."}}
{"run":1431,"commit":"4b48013","metric":10,"metrics":{"compiler_test262_cases":2991,"compiler_test262_pass":2981,"compiler_test262_failures":10,"compiler_test262_compiler_errors":0,"compiler_test262_compiler_crashes":0,"compiler_test262_compiler_fails":0,"compiler_test262_both_fail":10,"compiler_test262_interpreter_fail_compiler_pass":0,"compatibility_pass":2981,"compatibility_cases":2991,"compiler_errors":0,"compiler_crashes":0,"compiler_fails":0,"both_fail":10,"interpreter_fail_compiler_pass":0,"elapsed_ms":131362},"status":"keep","description":"Preserve huge sparse array length","timestamp":1778759094397,"segment":118,"confidence":7.4,"iterationTokens":17255,"asi":{"hypothesis":"The high-index lastIndexOf hang/failure is caused by later sparse writes below an existing virtual huge array length overwriting the stored length with a smaller value, making the true max index invisible and forcing expensive scans.","fixed_focus":["Array/prototype/lastIndexOf/15.4.4.15-8-9.js"],"semantic_scope":"When storing huge sparse array elements, update the virtual length monotonically with max(current length, index+1) so lower subsequent sparse writes do not shrink length."}}
{"run":1432,"commit":"1a816e6","metric":9,"metrics":{"compiler_test262_cases":2991,"compiler_test262_pass":2982,"compiler_test262_failures":9,"compiler_test262_compiler_errors":0,"compiler_test262_compiler_crashes":0,"compiler_test262_compiler_fails":0,"compiler_test262_both_fail":9,"compiler_test262_interpreter_fail_compiler_pass":0,"compatibility_pass":2982,"compatibility_cases":2991,"compiler_errors":0,"compiler_crashes":0,"compiler_fails":0,"both_fail":9,"interpreter_fail_compiler_pass":0,"elapsed_ms":131344},"status":"keep","description":"Preserve flatMap strict thisArg","timestamp":1778759861968,"segment":118,"confidence":7.5,"iterationTokens":28595,"asi":{"hypothesis":"The remaining flatMap thisArg case needs both strict null preservation in OP_push_this and strict callback invocation; either piece alone was insufficient in earlier discarded attempts.","fixed_focus":["Array/prototype/flatMap/thisArg-argument.js"],"semantic_scope":"Mark flatMap mapper callbacks as strict for invocation and preserve nil as `this` in strict bytecode functions, so null/primitive thisArg values are not boxed or replaced by globalThis."}}
{"run":1433,"commit":"a77b0a0","metric":8,"metrics":{"compiler_test262_cases":2991,"compiler_test262_pass":2983,"compiler_test262_failures":8,"compiler_test262_compiler_errors":0,"compiler_test262_compiler_crashes":0,"compiler_test262_compiler_fails":0,"compiler_test262_both_fail":8,"compiler_test262_interpreter_fail_compiler_pass":0,"compatibility_pass":2983,"compatibility_cases":2991,"compiler_errors":0,"compiler_crashes":0,"compiler_fails":0,"both_fail":8,"interpreter_fail_compiler_pass":0,"elapsed_ms":144969},"status":"keep","description":"Define proxy receiver writes in reverse","timestamp":1778760481547,"segment":118,"confidence":7.238095238095238,"iterationTokens":18945,"asi":{"hypothesis":"Proxy reverse trap ordering needs Set with receiver semantics: after the set trap delegates to Reflect.set, writes to a proxy receiver should perform GetOwnPropertyDescriptor and DefineProperty rather than calling the proxy set trap again or doing a raw put.","fixed_focus":["Array/prototype/reverse/length-exceeding-integer-limit-with-proxy.js"],"semantic_scope":"Route Array.prototype.reverse proxy writes through Put.set with receiver, and teach receiver writes to proxy objects to define a data property after observing its own descriptor."}}
{"run":1434,"commit":"8bbf7ad","metric":7,"metrics":{"compiler_test262_cases":2991,"compiler_test262_pass":2984,"compiler_test262_failures":7,"compiler_test262_compiler_errors":0,"compiler_test262_compiler_crashes":0,"compiler_test262_compiler_fails":0,"compiler_test262_both_fail":7,"compiler_test262_interpreter_fail_compiler_pass":0,"compatibility_pass":2984,"compatibility_cases":2991,"compiler_errors":0,"compiler_crashes":0,"compiler_fails":0,"both_fail":7,"interpreter_fail_compiler_pass":0,"elapsed_ms":147658},"status":"keep","description":"Set splice species length through proxy","timestamp":1778761063115,"segment":118,"confidence":7,"iterationTokens":8532,"asi":{"hypothesis":"Splice removed-array species results that are proxies must receive the final length update through Set(A, length, ..., true), preserving proxy set/getOwnPropertyDescriptor/defineProperty trap ordering.","fixed_focus":["Array/prototype/splice/property-traps-order-with-species.js"],"semantic_scope":"Use Put.set for proxy species removed-array length and let array length Set with a distinct receiver fall through to ordinary receiver definition rather than directly resizing the target array."}}
{"run":1435,"commit":"66e70bf","metric":7,"metrics":{"compiler_test262_cases":2991,"compiler_test262_pass":2984,"compiler_test262_failures":7,"compiler_test262_compiler_errors":0,"compiler_test262_compiler_crashes":0,"compiler_test262_compiler_fails":0,"compiler_test262_both_fail":6,"compiler_test262_interpreter_fail_compiler_pass":1,"compatibility_pass":2984,"compatibility_cases":2991,"compiler_errors":0,"compiler_crashes":0,"compiler_fails":0,"both_fail":6,"interpreter_fail_compiler_pass":1,"elapsed_ms":174930},"status":"discard","description":"Typed-array-specific Array.copyWithin path for resizable buffers","timestamp":1778790967235,"segment":118,"confidence":6.695652173913044,"iterationTokens":8532,"asi":{"hypothesis":"Route Array.prototype.copyWithin on typed-array receivers through TypedArray get/set with resizable-buffer-aware length and no-op out-of-bounds views.","rollback_reason":"Primary metric stayed unchanged at 7 and introduced an interpreter_fail_compiler_pass split, so the typed-array path only shifted failure classification without improving compatibility.","next_action_hint":"Inspect the focused copyWithin/resizable-buffer failure by phase; native-bytecode/interpreter typed-array element writes may differ from source/compiler, and a narrow fix should avoid changing the full copyWithin receiver path until the mismatch is isolated."}}
{"run":1436,"commit":"66e70bf","metric":7,"metrics":{"compiler_test262_cases":2991,"compiler_test262_pass":2984,"compiler_test262_failures":7,"compiler_test262_compiler_errors":0,"compiler_test262_compiler_crashes":0,"compiler_test262_compiler_fails":0,"compiler_test262_both_fail":7,"compiler_test262_interpreter_fail_compiler_pass":0,"compatibility_pass":2984,"compatibility_cases":2991,"compiler_errors":0,"compiler_crashes":0,"compiler_fails":0,"both_fail":7,"interpreter_fail_compiler_pass":0,"elapsed_ms":135998},"status":"discard","description":"Use typed-array internal length for indexed property presence","timestamp":1778791319050,"segment":118,"confidence":6.416666666666667,"iterationTokens":4350,"asi":{"hypothesis":"For fake typed-array length in Array.concat, indexed presence should use internal fixed/length-tracking element count rather than a user-defined public length property.","rollback_reason":"Focused fake-length probe improved key presence, but the full Array primary metric stayed unchanged at 7; concat_large-typed-array still fails elsewhere or compareArray still observes a mismatch.","next_action_hint":"Instrument concat_large-typed-array by phase for all constructors; the fake-length hole model is only one part. Check descriptor/has/get behavior for holes and large expected arrays before retrying a narrower kept change."}}
{"run":1437,"commit":"b0be9a8","metric":6,"metrics":{"compiler_test262_cases":2991,"compiler_test262_pass":2985,"compiler_test262_failures":6,"compiler_test262_compiler_errors":0,"compiler_test262_compiler_crashes":0,"compiler_test262_compiler_fails":0,"compiler_test262_both_fail":6,"compiler_test262_interpreter_fail_compiler_pass":0,"compatibility_pass":2985,"compatibility_cases":2991,"compiler_errors":0,"compiler_crashes":0,"compiler_fails":0,"both_fail":6,"interpreter_fail_compiler_pass":0,"elapsed_ms":140881},"status":"keep","description":"Preserve typed-array indexed presence after backing buffer GC","timestamp":1778791987435,"segment":118,"confidence":6,"iterationTokens":22781,"asi":{"hypothesis":"Array.concat large typed-array failure comes from GC sweeping typed-array backing ArrayBuffer refs during harness compare loops; use typed-array internal buffer fallback for out-of-bounds checks and internal fixed/length-tracking counts for indexed presence.","result":"Fixed concat_large-typed-array and reduced full bounded Array failures from 7 to 6 while checks passed.","next_action_hint":"Continue with copyWithin/resizable-buffer; previous typed-array copyWithin path was flat because native-bytecode/interpreter element writes diverged, so instrument the failing phases and preserve current typed-array presence fallback."}}
{"run":1438,"commit":"b0be9a8","metric":8,"metrics":{"compiler_test262_cases":2991,"compiler_test262_pass":2983,"compiler_test262_failures":8,"compiler_test262_compiler_errors":0,"compiler_test262_compiler_crashes":0,"compiler_test262_compiler_fails":0,"compiler_test262_both_fail":7,"compiler_test262_interpreter_fail_compiler_pass":1,"compatibility_pass":2983,"compatibility_cases":2991,"compiler_errors":0,"compiler_crashes":0,"compiler_fails":0,"both_fail":7,"interpreter_fail_compiler_pass":1,"elapsed_ms":141090},"status":"discard","description":"Typed-array Array.copyWithin and visible OOB length handling","timestamp":1778792471080,"segment":118,"confidence":5.571428571428571,"iterationTokens":9216,"asi":{"hypothesis":"After preserving typed-array backing buffers, a typed-array-specific Array.copyWithin plus OOB-visible length 0 would fix resizable-buffer copyWithin phases.","rollback_reason":"Primary regressed from 6 to 8 and introduced interpreter/compiler skew; focused behavior was gas/GC-sensitive and the broad workload worsened.","next_action_hint":"Do not retry broad typed-array copyWithin/length handling unchanged. Isolate exact failing phases under original assert.compareArray; failures appear GC/gas sensitive, so inspect roots/backing buffer lifetime and native-bytecode vs compiler typed-array element writes before changing copyWithin semantics."}}
{"run":1439,"commit":"b0be9a8","metric":6,"metrics":{"compiler_test262_cases":2991,"compiler_test262_pass":2985,"compiler_test262_failures":6,"compiler_test262_compiler_errors":0,"compiler_test262_compiler_crashes":0,"compiler_test262_compiler_fails":0,"compiler_test262_both_fail":6,"compiler_test262_interpreter_fail_compiler_pass":0,"compatibility_pass":2985,"compatibility_cases":2991,"compiler_errors":0,"compiler_crashes":0,"compiler_fails":0,"both_fail":6,"interpreter_fail_compiler_pass":0,"elapsed_ms":140768},"status":"discard","description":"Probe typed-array copyWithin and array accessor sort reads","timestamp":1778792913385,"segment":118,"confidence":4.875,"iterationTokens":9032,"asi":{"hypothesis":"Combining typed-array copyWithin/OOB length probes with invoking array side-property accessors during sort collection might reduce copyWithin or precise sort failures after the typed-array buffer fallback was kept.","rollback_reason":"Primary metric stayed unchanged at 6; focused sort getter-decreases-length still failed and typed-array copyWithin remained unstable under original compareArray.","next_action_hint":"For sort, inspect Object.defineProperty on list-backed arrays: accessors appear stored as descriptors/side props but Get during sort does not invoke them. For copyWithin, avoid broad typed-array length changes; failures are compareArray/gas-sensitive."}}
{"run":1440,"commit":"e31e90d","metric":2,"metrics":{"compiler_test262_cases":2991,"compiler_test262_pass":2989,"compiler_test262_failures":2,"compiler_test262_compiler_errors":0,"compiler_test262_compiler_crashes":0,"compiler_test262_compiler_fails":0,"compiler_test262_both_fail":2,"compiler_test262_interpreter_fail_compiler_pass":0,"compatibility_pass":2989,"compatibility_cases":2991,"compiler_errors":0,"compiler_crashes":0,"compiler_fails":0,"both_fail":2,"interpreter_fail_compiler_pass":0,"elapsed_ms":137611},"status":"keep","description":"Preserve shrunk array length during sort deletes","timestamp":1778793372505,"segment":118,"confidence":4.555555555555555,"iterationTokens":7352,"asi":{"hypothesis":"Precise sort length-side-effect failures are caused by deleting indices beyond a shrunk array length through Heap.array_set/3, which re-grows list-backed arrays. Avoid materializing deleted indices at or beyond the visible length, and make sort collection observe current length after accessor side effects.","result":"Reduced full bounded Array failures from 6 to 2, fixing getter/setter length-shrink precise sort cases while checks passed.","next_action_hint":"Remaining failures should be copyWithin/resizable-buffer and sort/precise-prototype-accessors. For prototype-accessors, sort write-back still bypasses inherited prototype setter observation for index 2."}}
{"run":1441,"commit":"da5137d","metric":1,"metrics":{"compiler_test262_cases":2991,"compiler_test262_pass":2990,"compiler_test262_failures":1,"compiler_test262_compiler_errors":0,"compiler_test262_compiler_crashes":0,"compiler_test262_compiler_fails":0,"compiler_test262_both_fail":1,"compiler_test262_interpreter_fail_compiler_pass":0,"compatibility_pass":2990,"compatibility_cases":2991,"compiler_errors":0,"compiler_crashes":0,"compiler_fails":0,"both_fail":1,"interpreter_fail_compiler_pass":0,"elapsed_ms":135482},"status":"keep","description":"Invoke inherited array index setters during sort","timestamp":1778793852582,"segment":118,"confidence":4.486486486486487,"iterationTokens":8032,"asi":{"hypothesis":"The remaining precise prototype-accessor sort case needs sort write-back to observe inherited Object.prototype indexed setters for holes within qb_arr/list-backed arrays.","result":"Reduced full bounded Array failures from 2 to 1; only copyWithin/resizable-buffer remains in the 2991-case workload.","next_action_hint":"Focus exclusively on copyWithin/resizable-buffer. Avoid prior broad typed-array copyWithin/visible length attempts; they regressed. The kept typed-array buffer fallback may make a narrower phase-specific fix possible."}}
{"run":1442,"commit":"da5137d","metric":1,"metrics":{"compiler_test262_cases":2991,"compiler_test262_pass":2990,"compiler_test262_failures":1,"compiler_test262_compiler_errors":0,"compiler_test262_compiler_crashes":0,"compiler_test262_compiler_fails":0,"compiler_test262_both_fail":0,"compiler_test262_interpreter_fail_compiler_pass":1,"compatibility_pass":2990,"compatibility_cases":2991,"compiler_errors":0,"compiler_crashes":0,"compiler_fails":0,"both_fail":0,"interpreter_fail_compiler_pass":1,"elapsed_ms":131763},"status":"discard","description":"Typed-array-specific Array.copyWithin after buffer fallback","timestamp":1778794172533,"segment":118,"confidence":4.368421052631579,"iterationTokens":2805,"asi":{"hypothesis":"With typed-array backing buffer fallback kept, Array.copyWithin can use TypedArray get/set directly for typed-array receivers and fix resizable-buffer phases.","rollback_reason":"Primary stayed at 1 and the remaining failure became interpreter-only; compiler path passes but native-bytecode interpreter path still fails after shrink/OOB phases.","next_action_hint":"The source/compiler semantics are now enough for copyWithin/resizable-buffer, but native bytecode interpreter typed-array length/OOB reads in ToNumbers remain wrong. Focus on interpreter-visible typed-array length after resize, not Array.copyWithin itself."}}
{"run":1443,"commit":"3a70978","metric":0,"metrics":{"compiler_test262_cases":2991,"compiler_test262_pass":2991,"compiler_test262_failures":0,"compiler_test262_compiler_errors":0,"compiler_test262_compiler_crashes":0,"compiler_test262_compiler_fails":0,"compiler_test262_both_fail":0,"compiler_test262_interpreter_fail_compiler_pass":0,"compatibility_pass":2991,"compatibility_cases":2991,"compiler_errors":0,"compiler_crashes":0,"compiler_fails":0,"both_fail":0,"interpreter_fail_compiler_pass":0,"elapsed_ms":133444},"status":"keep","description":"Use live typed-array lengths for resizable copyWithin","timestamp":1778794751941,"segment":118,"confidence":4.368421052631579,"iterationTokens":14762,"asi":{"hypothesis":"The last Array failure needs Array.copyWithin to write typed-array receivers through TypedArray get/set and array-like length reads to use live typed-array length/OOB state rather than stored public length after resize.","result":"Full bounded built-ins/Array workload reached 0 failures across 2991 cases with checks passing.","next_action_hint":"Run cross-category sanity (Object/Reflect/String/Function/Date/Set) before moving the active workload to the next category; update autoresearch ideas to mark Array complete and preserve cautions for discarded broad copyWithin attempts."}}
{"type":"config","name":"Optimize QuickBEAM built-ins/Set Test262 compatibility after Array completion","metricName":"compatibility_failures","metricUnit":"","bestDirection":"lower"}
{"run":1444,"commit":"0232147","metric":4,"metrics":{"compiler_test262_cases":300,"compiler_test262_pass":296,"compiler_test262_failures":4,"compiler_test262_compiler_errors":0,"compiler_test262_compiler_crashes":0,"compiler_test262_compiler_fails":0,"compiler_test262_both_fail":4,"compiler_test262_interpreter_fail_compiler_pass":0,"compatibility_pass":296,"compatibility_cases":300,"compiler_errors":0,"compiler_crashes":0,"compiler_fails":0,"both_fail":4,"interpreter_fail_compiler_pass":0,"elapsed_ms":13286},"status":"keep","description":"Baseline Set 300-case workload after Array completion","timestamp":1778794979722,"segment":119,"confidence":null,"iterationTokens":131,"asi":{"hypothesis":"Rebaseline built-ins/Set after full Array reached zero failures to make the remaining Set set-like observable-order cluster the active optimization target.","result":"Set baseline is 4 failures out of 300, all shared interpreter/compiler failures in set-like class order cases for difference/intersection/isDisjointFrom/isSupersetOf.","next_action_hint":"Investigate set-like class-order tests with focused probes; previous simple cached set-like record/order attempts timed out, so inspect iterator/getter/call_with_this semantics before broad record caching."}}
{"run":1445,"commit":"0232147","metric":4,"metrics":{"compiler_test262_cases":300,"compiler_test262_pass":296,"compiler_test262_failures":4,"compiler_test262_compiler_errors":0,"compiler_test262_compiler_crashes":0,"compiler_test262_compiler_fails":0,"compiler_test262_both_fail":4,"compiler_test262_interpreter_fail_compiler_pass":0,"compatibility_pass":296,"compatibility_cases":300,"compiler_errors":0,"compiler_crashes":0,"compiler_fails":0,"both_fail":4,"interpreter_fail_compiler_pass":0,"elapsed_ms":11232},"status":"discard","description":"Reuse Set-like record getters for Set methods","timestamp":1778796093710,"segment":119,"confidence":null,"iterationTokens":131,"asi":{"hypothesis":"Set methods should use the already-validated Set-like record (size/has/keys) instead of re-reading getters, matching the observable getter order required by the set-like class-order tests.","rollback_reason":"Primary metric stayed at 4. The getter-order part improves early phases, but larger-argument phases expose a deeper accessor-closure mutation bug: a getter returning `values[index++]` repeatedly observes index as 0, causing iterator values to repeat and result contents to remain wrong/hang without bounds.","next_action_hint":"Focus next on accessor closure environment mutation (`let i=0; let o={get v(){return i++;}}; [o.v,o.v,o.v,i]` returns [0,1,2,0]). Fixing getter closure writeback is more fundamental than adding Set-specific iterator bounds."}}
