{"run":1413,"commit":"656cedd","metric":42,"metrics":{"compiler_test262_cases":2991,"compiler_test262_pass":2949,"compiler_test262_failures":42,"compiler_test262_compiler_errors":0,"compiler_test262_compiler_crashes":0,"compiler_test262_compiler_fails":8,"compiler_test262_both_fail":28,"compiler_test262_interpreter_fail_compiler_pass":1,"compatibility_pass":2949,"compatibility_cases":2991,"compiler_errors":0,"compiler_crashes":0,"compiler_fails":8,"both_fail":28,"interpreter_fail_compiler_pass":1,"elapsed_ms":211894},"status":"keep","description":"Honor Array toString fallback branding","timestamp":1778746428077,"segment":118,"confidence":14,"iterationTokens":8798,"asi":{"hypothesis":"Array.prototype.toString fallback should behave like the Object.prototype.toString intrinsic: revoked proxies throw on Get, arguments objects do not inherit Array.prototype.join, error objects carry Error branding, RegExp observes Symbol.toStringTag overrides, and collection branding should come from the toStringTag property rather than hard-coded Set/Map slots.","fixed_focus":"Array/prototype/toString/non-callable-join-string-tag.js","semantic_scope":"Add revoked-proxy rejection to Get, avoid Array prototype fallback for arguments objects, add an internal error marker for Error branding, honor RegExp Symbol.toStringTag, and stop hard-coding Map/Set tags when Symbol.toStringTag is absent."}}
{"run":1414,"commit":"b9e2747","metric":39,"metrics":{"compiler_test262_cases":2991,"compiler_test262_pass":2952,"compiler_test262_failures":39,"compiler_test262_compiler_errors":0,"compiler_test262_compiler_crashes":0,"compiler_test262_compiler_fails":8,"compiler_test262_both_fail":26,"compiler_test262_interpreter_fail_compiler_pass":0,"compatibility_pass":2952,"compatibility_cases":2991,"compiler_errors":0,"compiler_crashes":0,"compiler_fails":8,"both_fail":26,"interpreter_fail_compiler_pass":0,"elapsed_ms":212144},"status":"keep","description":"Preserve explicit undefined array literals","timestamp":1778747126885,"segment":118,"confidence":15,"iterationTokens":26739,"asi":{"hypothesis":"Array literals created from concrete stack elements should create present data properties even when the element value is undefined; holes are represented by zero-argument array construction plus length writes and should remain absent.","fixed_focus":"Array/prototype/toReversed/holes-not-preserved.js","semantic_scope":"Mark array_from elements with standard data property descriptors in both interpreter and BEAM compiler runtime helpers; also keep define_array_el descriptor marking for created elements."}}
{"run":1415,"commit":"b9e2747","metric":42,"metrics":{"compiler_test262_cases":2991,"compiler_test262_pass":2949,"compiler_test262_failures":42,"compiler_test262_compiler_errors":0,"compiler_test262_compiler_crashes":0,"compiler_test262_compiler_fails":8,"compiler_test262_both_fail":29,"compiler_test262_interpreter_fail_compiler_pass":0,"compatibility_pass":2949,"compatibility_cases":2991,"compiler_errors":0,"compiler_crashes":0,"compiler_fails":8,"both_fail":29,"interpreter_fail_compiler_pass":0,"elapsed_ms":221696},"status":"discard","description":"Use property-aware copyWithin for dense arrays","timestamp":1778747603390,"segment":118,"confidence":12.857142857142858,"iterationTokens":5335,"asi":{"hypothesis":"Dense Array.prototype.copyWithin should use HasProperty/Get/Put/Delete so copied holes delete target properties instead of materializing undefined.","rollback_reason":"Focused copyWithin/fill-holes passed, but broad full Array regressed from 39 to 42, likely because the generic path changed copyWithin behavior for other sparse/resizable or descriptor cases.","next_action_hint":"If revisiting copyWithin holes, inspect the three broad regressions from /var/folders/9h/3929cvvx09s_cc_p24rq7jh80000gn/T/pi-experiment-1c66f4ac75957ed8.log and avoid replacing the whole dense fast path unchanged."}}
{"run":1416,"commit":"5203b4c","metric":38,"metrics":{"compiler_test262_cases":2991,"compiler_test262_pass":2953,"compiler_test262_failures":38,"compiler_test262_compiler_errors":0,"compiler_test262_compiler_crashes":0,"compiler_test262_compiler_fails":8,"compiler_test262_both_fail":25,"compiler_test262_interpreter_fail_compiler_pass":0,"compatibility_pass":2953,"compatibility_cases":2991,"compiler_errors":0,"compiler_crashes":0,"compiler_fails":8,"both_fail":25,"interpreter_fail_compiler_pass":0,"elapsed_ms":223486},"status":"keep","description":"Read inherited numeric constructor properties","timestamp":1778748528510,"segment":118,"confidence":11.5,"iterationTokens":26985,"asi":{"hypothesis":"Element reads on builtin constructor functions such as Array[1] should normalize integer property keys and then traverse Function.prototype/Object.prototype, so prototype properties added during Array.prototype.filter iteration are observable.","fixed_focus":"Array/prototype/filter/15.4.4.20-9-b-6.js","semantic_scope":"Route integer get_element reads on builtin functions through Get.get, and allow builtin fallback lookup to continue to Object.prototype when Function.prototype has no own property."}}
{"run":1417,"commit":"70075a4","metric":37,"metrics":{"compiler_test262_cases":2991,"compiler_test262_pass":2954,"compiler_test262_failures":37,"compiler_test262_compiler_errors":0,"compiler_test262_compiler_crashes":0,"compiler_test262_compiler_fails":8,"compiler_test262_both_fail":24,"compiler_test262_interpreter_fail_compiler_pass":0,"compatibility_pass":2954,"compatibility_cases":2991,"compiler_errors":0,"compiler_crashes":0,"compiler_fails":8,"both_fail":24,"interpreter_fail_compiler_pass":0,"elapsed_ms":230859},"status":"keep","description":"Throw on read-only push element writes","timestamp":1778749038493,"segment":118,"confidence":10.444444444444445,"iterationTokens":5554,"asi":{"hypothesis":"Array.prototype.push performs Set(O, index, value, true) for each inserted element, so a non-writable target index near the safe-integer limit must raise TypeError after earlier writes are applied.","fixed_focus":"Array/prototype/push/length-near-integer-limit-set-failure.js","semantic_scope":"Reuse the Array method put_or_throw helper for push element writes before the final length update."}}
{"run":1418,"commit":"3bd9140","metric":36,"metrics":{"compiler_test262_cases":2991,"compiler_test262_pass":2955,"compiler_test262_failures":36,"compiler_test262_compiler_errors":0,"compiler_test262_compiler_crashes":0,"compiler_test262_compiler_fails":8,"compiler_test262_both_fail":23,"compiler_test262_interpreter_fail_compiler_pass":0,"compatibility_pass":2955,"compatibility_cases":2991,"compiler_errors":0,"compiler_crashes":0,"compiler_fails":8,"both_fail":23,"interpreter_fail_compiler_pass":0,"elapsed_ms":271460},"status":"keep","description":"Model Array prototype length descriptor","timestamp":1778750223193,"segment":118,"confidence":9.6,"iterationTokens":27131,"asi":{"hypothesis":"Array.prototype is an Array exotic object with a non-enumerable, non-configurable, writable length data property, so descriptor reads, assignment, defineProperty, delete, and hasOwnProperty must agree without materializing length in the ordinary prototype map.","fixed_focus":"Array/prototype/length.js","semantic_scope":"Virtualize Array.prototype length descriptor/presence, store length updates in array side properties, preserve non-configurable attributes during defineProperty, and make delete report false."}}
{"run":1419,"commit":"3bd9140","metric":48,"metrics":{"compiler_test262_cases":2991,"compiler_test262_pass":2943,"compiler_test262_failures":48,"compiler_test262_compiler_errors":0,"compiler_test262_compiler_crashes":0,"compiler_test262_compiler_fails":8,"compiler_test262_both_fail":35,"compiler_test262_interpreter_fail_compiler_pass":0,"compatibility_pass":2943,"compatibility_cases":2991,"compiler_errors":0,"compiler_crashes":0,"compiler_fails":8,"both_fail":35,"interpreter_fail_compiler_pass":0,"elapsed_ms":234211},"status":"checks_failed","description":"Avoid repeated inherited undefined array getter reads","timestamp":1778750983949,"segment":118,"confidence":10.666666666666666,"iterationTokens":15368,"asi":{"hypothesis":"Array inherited accessors that return undefined should not be invoked twice by Get.get when resolving list-backed array holes through Array.prototype.","rollback_reason":"Focused pop/shift non-writable length tests passed, but broad Array regressed from 36 to 48 and checks failed in compiler iterator/Map/Set/Reflect tests because the sentinel path changed array iterator/property resolution too broadly.","next_action_hint":"Do not retry the broad inherited_array_property_present? sentinel unchanged. A safer fix must be local to pop/shift element Get or otherwise avoid changing general array Get semantics used by iterators."}}
{"run":1420,"commit":"f00266f","metric":34,"metrics":{"compiler_test262_cases":2991,"compiler_test262_pass":2957,"compiler_test262_failures":34,"compiler_test262_compiler_errors":0,"compiler_test262_compiler_crashes":0,"compiler_test262_compiler_fails":8,"compiler_test262_both_fail":21,"compiler_test262_interpreter_fail_compiler_pass":0,"compatibility_pass":2957,"compatibility_cases":2991,"compiler_errors":0,"compiler_crashes":0,"compiler_fails":8,"both_fail":21,"interpreter_fail_compiler_pass":0,"elapsed_ms":234417},"status":"keep","description":"Avoid repeated pop shift inherited reads","timestamp":1778751514807,"segment":118,"confidence":10,"iterationTokens":5649,"asi":{"hypothesis":"Array.prototype.pop/shift should read inherited hole values only once before their final Throw=true length write; inherited accessors returning undefined must not be retried by the generic array Get fallback.","fixed_focus":["Array/prototype/pop/set-length-array-length-is-non-writable.js","Array/prototype/shift/set-length-array-length-is-non-writable.js"],"semantic_scope":"Add a pop/shift-local hole-aware element read that checks own array storage/descriptors first, then reads Array.prototype/Object.prototype directly for inherited holes without changing general array Get semantics."}}
{"run":1421,"commit":"3b3a50f","metric":30,"metrics":{"compiler_test262_cases":2991,"compiler_test262_pass":2961,"compiler_test262_failures":30,"compiler_test262_compiler_errors":0,"compiler_test262_compiler_crashes":0,"compiler_test262_compiler_fails":8,"compiler_test262_both_fail":19,"compiler_test262_interpreter_fail_compiler_pass":0,"compatibility_pass":2961,"compatibility_cases":2991,"compiler_errors":0,"compiler_crashes":0,"compiler_fails":8,"both_fail":19,"interpreter_fail_compiler_pass":0,"elapsed_ms":159336},"status":"keep","description":"Expose sparse high array side properties","timestamp":1778751982376,"segment":118,"confidence":12,"iterationTokens":10557,"asi":{"hypothesis":"Array index presence checks should include sparse side properties stored with Heap.put_array_prop, including very large integer-index keys beyond dense array storage, so HasProperty sees high-index writes used by slice/indexOf/lastIndexOf.","fixed_focus":["Array/prototype/slice/length-exceeding-integer-limit-proxied-array.js","Array/prototype/indexOf/15.4.4.14-9-9.js"],"semantic_scope":"Extend array OwnProperty presence for numeric keys to consult array side properties in addition to dense storage and descriptor metadata."}}
{"run":1422,"commit":"5906094","metric":29,"metrics":{"compiler_test262_cases":2991,"compiler_test262_pass":2962,"compiler_test262_failures":29,"compiler_test262_compiler_errors":0,"compiler_test262_compiler_crashes":0,"compiler_test262_compiler_fails":8,"compiler_test262_both_fail":18,"compiler_test262_interpreter_fail_compiler_pass":0,"compatibility_pass":2962,"compatibility_cases":2991,"compiler_errors":0,"compiler_crashes":0,"compiler_fails":8,"both_fail":18,"interpreter_fail_compiler_pass":0,"elapsed_ms":161519},"status":"keep","description":"Delete copyWithin target holes narrowly","timestamp":1778752635106,"segment":118,"confidence":9.166666666666666,"iterationTokens":12146,"asi":{"hypothesis":"Array.prototype.copyWithin should delete target positions when the corresponding source positions are holes, but dense arrays should keep the existing fast path to preserve coercion and out-of-bounds behavior.","fixed_focus":"Array/prototype/copyWithin/fill-holes.js","semantic_scope":"Only switch copyWithin to HasProperty/Get/Put/Delete semantics when the source copy range contains absent properties; otherwise retain the dense list slice implementation."}}
{"run":1423,"commit":"c88ab88","metric":28,"metrics":{"compiler_test262_cases":2991,"compiler_test262_pass":2963,"compiler_test262_failures":28,"compiler_test262_compiler_errors":0,"compiler_test262_compiler_crashes":0,"compiler_test262_compiler_fails":8,"compiler_test262_both_fail":17,"compiler_test262_interpreter_fail_compiler_pass":0,"compatibility_pass":2963,"compatibility_cases":2991,"compiler_errors":0,"compiler_crashes":0,"compiler_fails":8,"both_fail":17,"interpreter_fail_compiler_pass":0,"elapsed_ms":160505},"status":"keep","description":"Link symbol primitive wrappers","timestamp":1778753325776,"segment":118,"confidence":9.333333333333334,"iterationTokens":15977,"asi":{"hypothesis":"ToObject for Symbol and BigInt primitives used by generic Array methods should create wrapper objects with the corresponding prototype, so Array.prototype.sort.call(Symbol()) returns an object that passes instanceof Symbol/BigInt.","fixed_focus":"Array/prototype/sort/call-with-primitive.js","semantic_scope":"Route Symbol wrappers through the shared WrappedPrimitive constructor-prototype path and allow Array receiver coercion for Symbol/BigInt primitives."}}
{"run":1424,"commit":"87b9ff3","metric":25,"metrics":{"compiler_test262_cases":2991,"compiler_test262_pass":2966,"compiler_test262_failures":25,"compiler_test262_compiler_errors":0,"compiler_test262_compiler_crashes":0,"compiler_test262_compiler_fails":8,"compiler_test262_both_fail":14,"compiler_test262_interpreter_fail_compiler_pass":0,"compatibility_pass":2966,"compatibility_cases":2991,"compiler_errors":0,"compiler_crashes":0,"compiler_fails":8,"both_fail":14,"interpreter_fail_compiler_pass":0,"elapsed_ms":159721},"status":"keep","description":"Use BigInt prototype lookup for primitives","timestamp":1778754015234,"segment":118,"confidence":9.833333333333334,"iterationTokens":16112,"asi":{"hypothesis":"BigInt primitives should resolve prototype methods such as toLocaleString through BigInt.prototype, allowing Array.prototype.toLocaleString on BigInt typed-array values to observe user-provided prototype overrides.","fixed_focus":["Array/prototype/toLocaleString/user-provided-tolocalestring-grow.js","Array/prototype/toLocaleString/user-provided-tolocalestring-shrink.js"],"semantic_scope":"Add BigInt primitive prototype fallback through the same class-prototype lookup path used by Symbol primitives."}}
{"run":1425,"commit":"e5117bb","metric":22,"metrics":{"compiler_test262_cases":2991,"compiler_test262_pass":2969,"compiler_test262_failures":22,"compiler_test262_compiler_errors":0,"compiler_test262_compiler_crashes":0,"compiler_test262_compiler_fails":8,"compiler_test262_both_fail":11,"compiler_test262_interpreter_fail_compiler_pass":0,"compatibility_pass":2969,"compatibility_cases":2991,"compiler_errors":0,"compiler_crashes":0,"compiler_fails":8,"both_fail":11,"interpreter_fail_compiler_pass":0,"elapsed_ms":160244},"status":"keep","description":"Write sorted typed array elements","timestamp":1778754422578,"segment":118,"confidence":9.538461538461538,"iterationTokens":4893,"asi":{"hypothesis":"Array.prototype.sort is generic, but when the receiver is a typed array its indexed write-back must update typed-array elements rather than ordinary side properties.","fixed_focus":["Array/prototype/sort/comparefn-grow.js","Array/prototype/sort/comparefn-resizable-buffer.js","Array/prototype/sort/resizable-buffer-default-comparator.js"],"semantic_scope":"Use Put.put_element for sort write-back so typed-array receivers route through TypedArray.set_element while ordinary arrays still use indexed element semantics."}}
{"run":1426,"commit":"e5117bb","metric":27,"metrics":{"compiler_test262_cases":2991,"compiler_test262_pass":2964,"compiler_test262_failures":27,"compiler_test262_compiler_errors":0,"compiler_test262_compiler_crashes":0,"compiler_test262_compiler_fails":8,"compiler_test262_both_fail":16,"compiler_test262_interpreter_fail_compiler_pass":0,"compatibility_pass":2964,"compatibility_cases":2991,"compiler_errors":0,"compiler_crashes":0,"compiler_fails":8,"both_fail":16,"interpreter_fail_compiler_pass":0,"elapsed_ms":156594},"status":"discard","description":"Use fixed typed-array length for indexed presence","timestamp":1778755760020,"segment":118,"confidence":8.857142857142858,"iterationTokens":4893,"asi":{"hypothesis":"Typed-array indexed HasProperty should ignore a fake ordinary length property and use the fixed internal element count.","rollback_reason":"The focused concat fake-length shape still failed and the broad Array workload regressed from 22 to 27 failures, likely because resizable/length-tracking cases rely on current length/property handling beyond this narrow element_count change.","next_action_hint":"If revisiting concat fake length, separate two concepts explicitly: concat length should observe the ordinary/fake length property, while typed-array indexed presence should use internal element_count; avoid globally changing element_count alone."}}
{"run":1427,"commit":"3fce25f","metric":21,"metrics":{"compiler_test262_cases":2991,"compiler_test262_pass":2970,"compiler_test262_failures":21,"compiler_test262_compiler_errors":0,"compiler_test262_compiler_crashes":0,"compiler_test262_compiler_fails":8,"compiler_test262_both_fail":10,"compiler_test262_interpreter_fail_compiler_pass":0,"compatibility_pass":2970,"compatibility_cases":2991,"compiler_errors":0,"compiler_crashes":0,"compiler_fails":8,"both_fail":10,"interpreter_fail_compiler_pass":0,"elapsed_ms":158879},"status":"keep","description":"Write reversed typed array elements","timestamp":1778756152614,"segment":118,"confidence":8.4,"iterationTokens":22075,"asi":{"hypothesis":"Array.prototype.reverse on typed-array receivers must write back through typed-array integer-index element semantics rather than ordinary named properties, analogous to the kept sort typed-array write-back fix.","fixed_focus":["Array/prototype/reverse/resizable-buffer.js"],"semantic_scope":"Route reverse swap writes through Put.put_element only for typed-array receivers, preserving ordinary/proxy receiver Set trap behavior elsewhere."}}
{"run":1428,"commit":"3fce25f","metric":21,"metrics":{"compiler_test262_cases":2991,"compiler_test262_pass":2970,"compiler_test262_failures":21,"compiler_test262_compiler_errors":0,"compiler_test262_compiler_crashes":0,"compiler_test262_compiler_fails":8,"compiler_test262_both_fail":9,"compiler_test262_interpreter_fail_compiler_pass":1,"compatibility_pass":2970,"compatibility_cases":2991,"compiler_errors":0,"compiler_crashes":0,"compiler_fails":8,"both_fail":9,"interpreter_fail_compiler_pass":1,"elapsed_ms":158747},"status":"discard","description":"Route copyWithin typed array writes","timestamp":1778757000252,"segment":118,"confidence":7.875,"iterationTokens":28512,"asi":{"hypothesis":"Array.prototype.copyWithin on typed-array receivers should copy via typed-array indexed Get/Set semantics like the kept sort/reverse typed-array write-back fixes.","rollback_reason":"Primary stayed flat at 21 and introduced an interpreter_fail_compiler_pass split. Focused full resizable-buffer test still failed for a Float16Array stage even though smaller typed-array probes passed, so the change is incomplete.","next_action_hint":"Do not retry unchanged. If revisiting copyWithin typed arrays, first isolate the Float16Array/full-sequence mismatch and native bytecode/helper rest-spread interaction; then preserve compiler/interpreter parity before broad run."}}
{"run":1429,"commit":"a6c306c","metric":13,"metrics":{"compiler_test262_cases":2991,"compiler_test262_pass":2978,"compiler_test262_failures":13,"compiler_test262_compiler_errors":0,"compiler_test262_compiler_crashes":0,"compiler_test262_compiler_fails":0,"compiler_test262_both_fail":10,"compiler_test262_interpreter_fail_compiler_pass":0,"compatibility_pass":2978,"compatibility_cases":2991,"compiler_errors":0,"compiler_crashes":0,"compiler_fails":0,"both_fail":10,"interpreter_fail_compiler_pass":0,"elapsed_ms":161008},"status":"keep","description":"Recognize typed array builtin instances","timestamp":1778757862669,"segment":118,"confidence":7.888888888888889,"iterationTokens":18047,"asi":{"hypothesis":"Compiler-only resizable typed-array includes/indexOf/lastIndexOf failures come from compiled instanceof not recognizing typed-array instances, causing Test262 MayNeedBigInt to pass Number search values for BigInt typed arrays.","fixed_focus":["Array/prototype/includes/coerced-searchelement-fromindex-resize.js","Array/prototype/indexOf/coerced-searchelement-fromindex-grow.js","Array/prototype/indexOf/coerced-searchelement-fromindex-shrink.js","Array/prototype/lastIndexOf/coerced-position-grow.js","Array/prototype/lastIndexOf/coerced-position-shrink.js","Array/prototype/includes/resizable-buffer.js","Array/prototype/indexOf/resizable-buffer.js","Array/prototype/lastIndexOf/resizable-buffer.js"],"semantic_scope":"Teach Function.prototype[Symbol.hasInstance] and instanceof helpers to recognize VM typed-array objects for their builtin constructors, preserving BigInt typed-array coercion behavior in compiler and interpreter paths."}}
