{"run":89,"commit":"659596c","metric":171,"metrics":{"parser_tests":98,"parser_test_ms":200},"status":"keep","description":"Port number literal member coverage","timestamp":1777208374292,"segment":0,"confidence":4.4324324324324325,"iterationTokens":4883,"asi":{"hypothesis":"Existing number lexing and member parsing should cover QuickJS number literal property access forms except the deliberately invalid `0.a` case.","learned":"No implementation change was required; decimal, hex, binary, and octal numeric literals all compose with member access when the numeric token is complete before the dot.","quickjs_cases":"Ports QuickJS `test_number_literals` valid member syntax shapes `0.1.a`, `0x1.a`, `0b1.a`, and `0o1.a`."}}
{"run":90,"commit":"351bc13","metric":173,"metrics":{"parser_tests":99,"parser_test_ms":300},"status":"keep","description":"Port parse number call coverage","timestamp":1777208442713,"segment":0,"confidence":4.426666666666667,"iterationTokens":1060,"asi":{"hypothesis":"Existing call parsing should cover QuickJS parseInt/parseFloat number-literal test helpers with string and radix arguments.","learned":"No implementation change was required; ordinary call expressions preserve string literal arguments containing numeric separators and Infinity-like text.","quickjs_cases":"Ports QuickJS `test_number_literals` call syntax shapes for `parseInt(\"0_1\")`, `parseInt(\"1_0\", 8)`, and `parseFloat(\"Infinity.\")`/`parseFloat(\"Infinity_\")`."}}
{"run":91,"commit":"96467d8","metric":175,"metrics":{"parser_tests":100,"parser_test_ms":200},"status":"keep","description":"Port function call method coverage","timestamp":1777208512564,"segment":0,"confidence":4.421052631578948,"iterationTokens":1126,"asi":{"hypothesis":"Existing call/member tail parsing should cover QuickJS argument-scope call shapes with method calls and repeated call/index tails.","learned":"No implementation change was required; nested call expressions continue through computed member and property member tails correctly.","quickjs_cases":"Ports QuickJS `test_argument_scope` syntax shapes such as `f.call(123)`, `f(12)()[0]`, and further member access on nested calls."}}
{"run":92,"commit":"cc7ac22","metric":177,"metrics":{"parser_tests":101,"parser_test_ms":300},"status":"keep","description":"Port strict directive prologue coverage","timestamp":1777208589216,"segment":0,"confidence":4.415584415584416,"iterationTokens":988,"asi":{"hypothesis":"Existing string literal expression statement parsing should cover QuickJS directive prologue syntax at program and function-body positions.","learned":"No implementation change was required; directive prologues are currently represented as Literal expression statements, while full strict-mode semantic validation remains separate.","quickjs_cases":"Ports QuickJS `test_reserved_names` syntax shape for top-level and function-body `\"use strict\";` directives."}}
{"run":93,"commit":"14217b7","metric":179,"metrics":{"parser_tests":102,"parser_test_ms":200},"status":"keep","description":"Port string escape literal coverage","timestamp":1777208670928,"segment":0,"confidence":4.410256410256411,"iterationTokens":2046,"asi":{"hypothesis":"String literal scanning should decode common JavaScript hex and Unicode escapes instead of treating `x`/`u` as literal escaped characters.","learned":"String escape scanning now handles `\\xNN`, `\\uNNNN`, and `\\u{...}` escapes with codepoint validation, sharing the same validity ranges as identifier escapes.","quickjs_cases":"Adds QuickJS-compatible string literal escape coverage for `\"\\x61\\u0062\\u{63}\"` producing `abc`."}}
{"run":94,"commit":"14217b7","metric":181,"metrics":{"parser_tests":103,"parser_test_ms":200},"status":"checks_failed","description":"Attempt invalid string escape diagnostics","timestamp":1777208721500,"segment":0,"confidence":4.3544303797468356,"iterationTokens":940,"asi":{"hypothesis":"String escape scanner should surface diagnostics for malformed hex/unicode escapes and invalid codepoints.","rollback_reason":"Backpressure checks hit the known flaky BeamProcess monitor timing failure (`noproc` instead of `kaboom`), so autoresearch rules require checks_failed and auto-revert.","next_action_hint":"Reapply the invalid string escape diagnostics test and rerun; implementation already passed focused parser tests and failure was unrelated."}}
{"run":95,"commit":"53bbed6","metric":181,"metrics":{"parser_tests":103,"parser_test_ms":200},"status":"keep","description":"Port invalid string escape diagnostics","timestamp":1777208787306,"segment":0,"confidence":4.35,"iterationTokens":1458,"asi":{"hypothesis":"String escape scanner should surface diagnostics for malformed hex/unicode escapes and invalid codepoints.","learned":"Malformed `\\x`, fixed `\\u`, and braced `\\u{...}` string escapes now flow through lexer errors and parser error tuples without crashing.","quickjs_cases":"Adds QuickJS-compatible invalid string escape coverage for malformed `\\x`, malformed `\\u`, and out-of-range braced Unicode string escapes."}}
{"run":96,"commit":"01c90e5","metric":183,"metrics":{"parser_tests":104,"parser_test_ms":300},"status":"keep","description":"Port QuickJS object names call-chain coverage","timestamp":1777209214162,"segment":0,"confidence":4.345679012345679,"iterationTokens":16390,"asi":{"hypothesis":"Existing call/member tail parsing should cover QuickJS spread-test helper syntax that chains `Object.getOwnPropertyNames(x).toString()`.","learned":"No implementation change was required; nested member calls continue through an additional member-call tail after the first call expression.","quickjs_cases":"Ports QuickJS `test_spread` syntax shape `Object.getOwnPropertyNames(x).toString()`."}}
{"run":97,"commit":"303104b","metric":185,"metrics":{"parser_tests":105,"parser_test_ms":300},"status":"keep","description":"Port QuickJS class instance call-chain coverage","timestamp":1777209282190,"segment":0,"confidence":4.341463414634147,"iterationTokens":1043,"asi":{"hypothesis":"Existing `new` expression and member-call tail parsing should cover QuickJS class instance method calls, including contextual property names.","learned":"No implementation change was required; `new P()` composes with member call tails for ordinary, contextual, and `static` property names.","quickjs_cases":"Ports QuickJS `test_class` syntax shapes `new P().get()`, `.set()`, `.async()`, and `.static()`."}}
{"run":98,"commit":"835f1a1","metric":187,"metrics":{"parser_tests":106,"parser_test_ms":200},"status":"keep","description":"Port QuickJS static class call-chain coverage","timestamp":1777209380472,"segment":0,"confidence":4.337349397590361,"iterationTokens":2100,"asi":{"hypothesis":"Existing member-call parsing should cover QuickJS static class method call assertions from `test_class`.","learned":"No implementation change was required; identifier member call chains with empty argument lists cover static class method calls and class-expression name-scope calls.","quickjs_cases":"Ports QuickJS `test_class` syntax shapes `C.F()`, `D.F()`, `D.G()`, `D.H()`, and `E1.F()`."}}
{"run":99,"commit":"4b2891e","metric":189,"metrics":{"parser_tests":107,"parser_test_ms":200},"status":"keep","description":"Port QuickJS strict equality logical coverage","timestamp":1777209449581,"segment":0,"confidence":4.333333333333333,"iterationTokens":1173,"asi":{"hypothesis":"Existing Pratt precedence should cover QuickJS increment/decrement assertions that combine strict equality comparisons with logical AND.","learned":"No implementation change was required; strict equality binds tighter than `&&`, and member/index expressions compose on the left side of strict equality.","quickjs_cases":"Ports QuickJS `test_inc_dec` syntax shapes like `r === 1 && a === 2` and member/index strict-equality chains."}}
{"run":100,"commit":"2594b4e","metric":191,"metrics":{"parser_tests":108,"parser_test_ms":200},"status":"keep","description":"Port QuickJS regexp member coverage","timestamp":1777209524397,"segment":0,"confidence":4.329411764705882,"iterationTokens":1165,"asi":{"hypothesis":"Regexp lexical-goal handling should accept regexp literals after `return` and allow member-call tails on regexp literals.","learned":"No implementation change was required; regexp tokens carry flags and compose with member/call postfix parsing after literal scanning.","quickjs_cases":"Extends QuickJS regexp literal coverage with `return /abc/g` and `/abc/.test(value)` syntax shapes."}}
{"run":101,"commit":"724a4f2","metric":193,"metrics":{"parser_tests":109,"parser_test_ms":200},"status":"keep","description":"Port QuickJS typeof switch coverage","timestamp":1777209599086,"segment":0,"confidence":4.325581395348837,"iterationTokens":1054,"asi":{"hypothesis":"Existing switch, unary, throw, and call parsing should cover QuickJS helper dispatch syntax using `switch (typeof func)`.","learned":"No implementation change was required; switch discriminants accept unary expressions and case/default consequents compose with break and throw statements.","quickjs_cases":"Ports QuickJS helper syntax shape `switch (typeof func) { case \"function\": break; default: throw Error(\"bad\"); }`."}}
{"run":102,"commit":"7342838","metric":195,"metrics":{"parser_tests":110,"parser_test_ms":300},"status":"keep","description":"Port QuickJS catch instanceof assignment coverage","timestamp":1777209655998,"segment":0,"confidence":4.32183908045977,"iterationTokens":1101,"asi":{"hypothesis":"Existing try/catch, delete, assignment, and instanceof parsing should cover QuickJS delete-error handling syntax.","learned":"No implementation change was required; catch bodies parse assignment expressions whose right-hand side is a parenthesized `instanceof` binary expression.","quickjs_cases":"Ports QuickJS `test_delete` syntax shape `try { delete null.a; } catch(e) { err = (e instanceof TypeError); }`."}}
{"run":103,"commit":"fda9e15","metric":197,"metrics":{"parser_tests":111,"parser_test_ms":300},"status":"keep","description":"Port QuickJS this assignment coverage","timestamp":1777209726990,"segment":0,"confidence":4.318181818181818,"iterationTokens":1116,"asi":{"hypothesis":"Existing function, `this`, member, and assignment parsing should cover QuickJS constructor function syntax.","learned":"No implementation change was required; `this` is represented as an identifier and composes with member assignment in function bodies.","quickjs_cases":"Ports QuickJS constructor helper syntax `function F(x) { this.x = x; }`."}}
{"run":104,"commit":"dc9efa9","metric":199,"metrics":{"parser_tests":112,"parser_test_ms":200},"status":"keep","description":"Port QuickJS contextual property access coverage","timestamp":1777209790432,"segment":0,"confidence":4.314606741573034,"iterationTokens":1122,"asi":{"hypothesis":"Object literal and property-member parsing should handle contextual keyword property names from QuickJS object operator tests.","learned":"No implementation change was required; property keys and property identifiers accept keyword tokens such as `if` and `async` where JavaScript treats them as property names.","quickjs_cases":"Ports QuickJS `test_op2` syntax shapes `{ x: 1, if: 2, async: 3 }`, `a.if === 2`, and `a.async === 3`."}}
{"run":105,"commit":"e60e219","metric":201,"metrics":{"parser_tests":113,"parser_test_ms":300},"status":"keep","description":"Port QuickJS delegated yield coverage","timestamp":1777209869723,"segment":0,"confidence":4.311111111111111,"iterationTokens":1189,"asi":{"hypothesis":"Existing yield-expression parsing should cover delegated and bare yield forms in generator bodies.","learned":"No implementation change was required; `parse_yield_expression/1` already recognizes `yield *expr` and ASI/bare-yield endings.","quickjs_cases":"Adds QuickJS-compatible generator coverage for `yield *iterable;` and bare `yield;`."}}
{"run":106,"commit":"39891d6","metric":203,"metrics":{"parser_tests":114,"parser_test_ms":200},"status":"keep","description":"Port top-level await module coverage","timestamp":1777209957002,"segment":0,"confidence":4.3076923076923075,"iterationTokens":1724,"asi":{"hypothesis":"Await parsing should include postfix call/member tails so module-level `await import(\"dep\")` parses as await of the dynamic import call rather than a call of an await expression.","learned":"`parse_await_expression/1` needed the same postfix-tail handling as unary expressions to bind calls/members to the awaited operand.","quickjs_cases":"Adds QuickJS-compatible module coverage for top-level `await import(\"dep\")` and `value = await promise`."}}
{"run":107,"commit":"0c75adf","metric":205,"metrics":{"parser_tests":115,"parser_test_ms":300},"status":"keep","description":"Port await call member coverage","timestamp":1777210031508,"segment":0,"confidence":4.304347826086956,"iterationTokens":1065,"asi":{"hypothesis":"The await postfix-tail fix should also cover ordinary awaited method calls and member access inside async functions.","learned":"No additional implementation change was required after the await binding fix; await now wraps CallExpression and MemberExpression operands correctly.","quickjs_cases":"Adds QuickJS-compatible async-function coverage for `await obj.method(arg)` and `await obj.value`."}}
{"run":108,"commit":"4931d2e","metric":207,"metrics":{"parser_tests":116,"parser_test_ms":200},"status":"keep","description":"Port anonymous default export coverage","timestamp":1777210181358,"segment":0,"confidence":4.301075268817204,"iterationTokens":2589,"asi":{"hypothesis":"Default export parsing should allow anonymous function and class declarations, which are valid module syntax even though ordinary declarations require names.","learned":"Function and class declaration parsers now take a `require_name?` flag; default export dispatch uses optional-name parsing while normal statement/export declarations keep requiring names.","quickjs_cases":"Adds QuickJS-compatible module coverage for anonymous `export default function()`, `export default async function()`, and `export default class {}`."}}
{"run":109,"commit":"67e29d2","metric":209,"metrics":{"parser_tests":117,"parser_test_ms":200},"status":"keep","description":"Port anonymous default generator export coverage","timestamp":1777210266903,"segment":0,"confidence":4.297872340425532,"iterationTokens":991,"asi":{"hypothesis":"The optional-name default export path should also compose with generator and async-generator function declarations.","learned":"No implementation change was required after optional default function names; generator markers are already consumed before the optional identifier check.","quickjs_cases":"Adds QuickJS-compatible module coverage for anonymous `export default function*()` and `export default async function*()`."}}
{"run":110,"commit":"194ac4f","metric":211,"metrics":{"parser_tests":118,"parser_test_ms":200},"status":"keep","description":"Port class static block coverage","timestamp":1777210367965,"segment":0,"confidence":4.340425531914893,"iterationTokens":1871,"asi":{"hypothesis":"Adding class static block parsing expands QuickJS-compatible class syntax coverage with a focused AST node and should not affect existing static fields/methods.","learned":"Class element parsing can distinguish `static {` before normal static member parsing and reuse block parsing to populate a StaticBlock AST node.","quickjs_cases":"Adds QuickJS-compatible class static initialization block coverage for `class C { static { this.value = 1; } }`."}}
{"run":111,"commit":"0973a34","metric":213,"metrics":{"parser_tests":119,"parser_test_ms":200},"status":"keep","description":"Port for destructuring coverage","timestamp":1777210438247,"segment":0,"confidence":4.478260869565218,"iterationTokens":1565,"asi":{"hypothesis":"Existing for-in/for-of parsing should compose with array and object binding patterns in loop variable declarations.","learned":"No implementation change was required; for-loop declaration parsing uses the same declarator and binding-pattern paths as variable declarations.","quickjs_cases":"Adds QuickJS-compatible loop coverage for `for (const [key, value] of entries)` and `for (let { name } in objects)`."}}
{"run":112,"commit":"9b1b2ed","metric":215,"metrics":{"parser_tests":120,"parser_test_ms":300},"status":"keep","description":"Port nullish logical expression coverage","timestamp":1777210514236,"segment":0,"confidence":4.425531914893617,"iterationTokens":1153,"asi":{"hypothesis":"Existing Pratt operator tables should cover modern QuickJS-compatible nullish coalescing and logical assignment syntax.","learned":"No implementation change was required; `??` is represented as LogicalExpression and `??=`/`||=`/`&&=` as right-associative AssignmentExpression operators.","quickjs_cases":"Adds QuickJS-compatible modern expression coverage for `??`, `??=`, `||=`, and `&&=`."}}
{"run":113,"commit":"3eae8f9","metric":218,"metrics":{"parser_tests":122,"parser_test_ms":200},"status":"keep","description":"Port bigint literal coverage","timestamp":1777210637933,"segment":0,"confidence":4.395833333333333,"iterationTokens":2403,"asi":{"hypothesis":"Lexer number scanning should keep `n` suffixes on integer literals as a single token and reject decimal bigint forms.","learned":"Number scanning now consumes a trailing `n`, keeps it in `raw`, parses the numeric value from the suffix-less literal, and emits an invalid-bigint diagnostic for decimal/exponent bigint forms.","quickjs_cases":"Adds QuickJS-compatible BigInt literal coverage for decimal, hex, binary, octal BigInts and invalid `1.2n`."}}
{"run":114,"commit":"85a6daf","metric":220,"metrics":{"parser_tests":123,"parser_test_ms":300},"status":"keep","description":"Port bigint separator coverage","timestamp":1777210716477,"segment":0,"confidence":4.4375,"iterationTokens":1026,"asi":{"hypothesis":"BigInt literal scanning should compose with the numeric separator support already present for normal integer literals.","learned":"No implementation change was required after BigInt suffix handling; separator stripping in integer parsing also works for decimal, hex, and binary BigInt literals.","quickjs_cases":"Adds QuickJS-compatible BigInt numeric separator coverage for `1_000n`, `0xff_ffn`, and `0b1010_0101n`."}}
{"run":115,"commit":"6902927","metric":222,"metrics":{"parser_tests":124,"parser_test_ms":300},"status":"keep","description":"Port string export name coverage","timestamp":1777210868778,"segment":0,"confidence":4.479166666666667,"iterationTokens":1316,"asi":{"hypothesis":"Export specifier parsing should support string-literal export names introduced in modern module syntax without changing import parsing.","learned":"No implementation change was required; export specifier parsing already uses property-key parsing for both local and exported names, which accepts string literals.","quickjs_cases":"Adds QuickJS-compatible module coverage for `export { value as \"external-name\" }` and string-named re-exports from another module."}}
{"run":116,"commit":"2a4d7d2","metric":224,"metrics":{"parser_tests":125,"parser_test_ms":300},"status":"keep","description":"Port private-in expression coverage","timestamp":1777210967672,"segment":0,"confidence":4.428571428571429,"iterationTokens":2667,"asi":{"hypothesis":"Class private-name parsing should support private identifiers in expression position for modern `#x in object` brand checks.","learned":"Adding a prefix parser branch for `#` lets PrivateIdentifier participate in normal binary parsing, including the existing `in` operator.","quickjs_cases":"Adds QuickJS-compatible private brand-check syntax coverage for `return #x in object` inside a class method."}}
{"run":117,"commit":"8a01694","metric":226,"metrics":{"parser_tests":126,"parser_test_ms":300},"status":"keep","description":"Port const for-in/of coverage","timestamp":1777211025645,"segment":0,"confidence":4.38,"iterationTokens":1068,"asi":{"hypothesis":"Existing for-in/for-of declaration parsing should cover const loop declarations in addition to var/let forms.","learned":"No implementation change was required; loop declaration parsing preserves the `:const` kind for both for-in and for-of left-hand declarations.","quickjs_cases":"Adds QuickJS-compatible loop coverage for `for (const key in object)` and `for (const value of iterable)`."}}
{"run":118,"commit":"a16cf15","metric":228,"metrics":{"parser_tests":127,"parser_test_ms":300},"status":"keep","description":"Port switch fallthrough coverage","timestamp":1777211103061,"segment":0,"confidence":4.42,"iterationTokens":1066,"asi":{"hypothesis":"Existing switch parsing should preserve empty fallthrough cases and multi-statement consequents.","learned":"No implementation change was required; switch case parsing emits empty consequent lists for fallthrough cases and accumulates statements until the next case/default label.","quickjs_cases":"Adds QuickJS-compatible switch fallthrough coverage with adjacent case labels, assignment update, break, and default assignment."}}
{"run":119,"commit":"946e2e7","metric":230,"metrics":{"parser_tests":128,"parser_test_ms":300},"status":"keep","description":"Port object rest assignment coverage","timestamp":1777211181648,"segment":0,"confidence":4.46,"iterationTokens":1029,"asi":{"hypothesis":"Existing object expression spread parsing should cover object rest syntax in destructuring assignment-left contexts.","learned":"No implementation change was required; object rest assignment is represented with ObjectExpression plus SpreadElement on the assignment left-hand side.","quickjs_cases":"Adds QuickJS-compatible destructuring assignment coverage for `({ a, ...rest } = object)`."}}
