{"run":59,"commit":"03b5d5b","metric":113,"metrics":{"parser_tests":69,"parser_test_ms":100},"status":"keep","description":"Port QuickJS generator constructor coverage","timestamp":1777205860415,"segment":0,"confidence":4.608695652173913,"iterationTokens":1587,"asi":{"hypothesis":"Existing generator, `new`, and try/catch parsing should cover QuickJS generator-constructor TypeError syntax setup.","learned":"No implementation change was required for `function *G() {}`, `let ex;`, or `try { new G(); } catch (ex_) { ... }`; the retry passed after the unrelated web API flake cleared.","quickjs_cases":"Ports QuickJS `test_constructor` syntax setup for attempting `new G()` on a generator inside try/catch."}}
{"run":60,"commit":"efb1391","metric":115,"metrics":{"parser_tests":70,"parser_test_ms":200},"status":"keep","description":"Port QuickJS numeric conversion expression coverage","timestamp":1777205908538,"segment":0,"confidence":4.595744680851064,"iterationTokens":1129,"asi":{"hypothesis":"Existing binary/unary precedence should cover QuickJS numeric conversion syntax involving identifiers, strings, parenthesized unary expressions, multiplication/subtraction, bitwise OR, and unsigned shift.","learned":"No implementation change was required; the Pratt parser produces the expected top-level bitwise/shift expressions and preserves nested arithmetic precedence.","quickjs_cases":"Ports QuickJS `test_cvt` syntax shapes such as `NaN | 0`, `Infinity | 0`, `(-Infinity) | 0`, string `>>> 0`, and `(4294967296 * 3 - 4) >>> 0`."}}
{"run":61,"commit":"05d4860","metric":117,"metrics":{"parser_tests":71,"parser_test_ms":200},"status":"keep","description":"Port QuickJS void expression coverage","timestamp":1777205976046,"segment":0,"confidence":4.583333333333333,"iterationTokens":2338,"asi":{"hypothesis":"Existing unary parsing should cover QuickJS `void 0` syntax used in destructuring result assertions.","learned":"No implementation change was required; `void` is already part of the unary operator set and composes with numeric literals.","quickjs_cases":"Ports QuickJS `test_destructuring` syntax shape `void 0`."}}
{"run":62,"commit":"491b25e","metric":119,"metrics":{"parser_tests":72,"parser_test_ms":200},"status":"keep","description":"Port QuickJS module clause coverage","timestamp":1777206053878,"segment":0,"confidence":4.571428571428571,"iterationTokens":2642,"asi":{"hypothesis":"Existing module parser support should cover common default-only imports, named-only imports, and local named exports in addition to the previously covered mixed/re-export forms.","learned":"No implementation change was required; contextual `from` handling and import/export specifier parsing already handle these module clause variants.","quickjs_cases":"Adds QuickJS-compatible ES module syntax coverage for `import defaultExport from`, `import { foo } from`, and `export { foo };`."}}
{"run":63,"commit":"3d17146","metric":121,"metrics":{"parser_tests":73,"parser_test_ms":200},"status":"keep","description":"Port QuickJS new.target coverage","timestamp":1777206128568,"segment":0,"confidence":4.56,"iterationTokens":1649,"asi":{"hypothesis":"Adding `new.target` as a meta-property mirrors the existing `import.meta` handling and improves function meta-property syntax coverage.","learned":"`new` needs a prefix special case before normal NewExpression parsing when followed by `.`, producing MetaProperty instead of trying to parse a constructor callee.","quickjs_cases":"Adds QuickJS-compatible meta-property coverage for `function f() { return new.target; }`."}}
{"run":64,"commit":"617cbf3","metric":123,"metrics":{"parser_tests":74,"parser_test_ms":100},"status":"keep","description":"Port QuickJS arrow length member coverage","timestamp":1777206201624,"segment":0,"confidence":4.549019607843137,"iterationTokens":1383,"asi":{"hypothesis":"Existing arrow-function grouping and member-tail parsing should cover QuickJS function-length assertions that access `.length` on parenthesized arrow functions.","learned":"No implementation change was required; grouped ArrowFunctionExpression values compose with member access for both default-parameter and destructuring-parameter cases.","quickjs_cases":"Ports QuickJS `test_function_length` syntax shapes `((a, b = 1, c) => {}).length` and `(({a,b}) => {}).length`."}}
{"run":65,"commit":"dd90d1e","metric":125,"metrics":{"parser_tests":75,"parser_test_ms":200},"status":"keep","description":"Port QuickJS class descriptor chain coverage","timestamp":1777206298401,"segment":0,"confidence":4.538461538461538,"iterationTokens":4357,"asi":{"hypothesis":"Existing call/member chain parsing should cover the long QuickJS class getter descriptor assertion syntax.","learned":"No implementation change was required for nested member arguments and chained call/member/property access through `Object.getOwnPropertyDescriptor(...).get.name`.","quickjs_cases":"Ports QuickJS `test_class` syntax shape `Object.getOwnPropertyDescriptor(C.prototype, \"y\").get.name === \"get y\"`."}}
{"run":66,"commit":"c9fbca9","metric":127,"metrics":{"parser_tests":76,"parser_test_ms":100},"status":"keep","description":"Port computed class element coverage","timestamp":1777206397557,"segment":0,"confidence":4.528301886792453,"iterationTokens":11868,"asi":{"hypothesis":"Class element parsing should preserve computed keys and support computed getters instead of losing the computed flag or treating `get [x]()` as a field named get.","learned":"Class keys now reuse the computed-property helper; accessor detection must treat `get [`/`set [` as accessor starts in addition to identifier keys.","quickjs_cases":"Adds QuickJS-compatible computed class element coverage for `[method]() {}`, `static [field] = 1`, and `get [value]() { ... }`."}}
{"run":67,"commit":"f677511","metric":129,"metrics":{"parser_tests":77,"parser_test_ms":200},"status":"keep","description":"Port computed object accessor coverage","timestamp":1777206462657,"segment":0,"confidence":4.518518518518518,"iterationTokens":1954,"asi":{"hypothesis":"Object literal accessor parsing should support computed keys just like class accessors and regular object properties.","learned":"Object accessor detection must recognize `get [`/`set [` starts, and accessor property creation should carry the computed flag from the shared property-key helper.","quickjs_cases":"Adds QuickJS-compatible computed object accessor coverage for `get [name]()` and `set [name](value)`."}}
{"run":68,"commit":"29e2591","metric":131,"metrics":{"parser_tests":78,"parser_test_ms":200},"status":"keep","description":"Port QuickJS unary relational coverage","timestamp":1777206541865,"segment":0,"confidence":4.509090909090909,"iterationTokens":1198,"asi":{"hypothesis":"Existing unary and relational operator parsing should cover additional QuickJS operator syntax from test_op1 without implementation changes.","learned":"No implementation change was required for bitwise-not, logical-not, numeric relational, or string relational expressions in assignment/parenthesized contexts.","quickjs_cases":"Ports QuickJS `test_op1` syntax shapes `~1`, `!1`, `(1 < 2)`, `(2 > 1)`, and `('b' > 'a')`."}}
{"run":69,"commit":"dfa7bee","metric":133,"metrics":{"parser_tests":79,"parser_test_ms":200},"status":"keep","description":"Port QuickJS primitive equality coverage","timestamp":1777206622480,"segment":0,"confidence":4.5,"iterationTokens":2456,"asi":{"hypothesis":"Existing equality parsing should cover QuickJS primitive equality and inequality syntax across null, undefined, booleans, strings, numbers, and object literals in expression contexts.","learned":"No implementation change was required; object-literal inequality needs expression grouping when used as a standalone expression statement, matching JavaScript's block-vs-object ambiguity.","quickjs_cases":"Ports QuickJS `test_eq` syntax shapes for `null == undefined`, primitive equality comparisons, string/number comparisons, and grouped object-literal inequality."}}
{"run":70,"commit":"61204ec","metric":135,"metrics":{"parser_tests":80,"parser_test_ms":200},"status":"keep","description":"Port QuickJS async method coverage","timestamp":1777206761771,"segment":0,"confidence":4.491228070175438,"iterationTokens":6692,"asi":{"hypothesis":"Object and class method parsing should distinguish `async m()`/`async [m]()` methods from fields named `async`, preserving async flags on the FunctionExpression.","learned":"An async-method lookahead handles identifier and computed method keys without affecting `async;` or `async = ...` fields because it only triggers when the key is followed by a parameter list.","quickjs_cases":"Adds QuickJS-compatible async object/class method coverage for `async m()`, `async [name]()`, and `static async [name]()`."}}
{"run":71,"commit":"7525cb7","metric":137,"metrics":{"parser_tests":81,"parser_test_ms":300},"status":"keep","description":"Port QuickJS async generator method coverage","timestamp":1777206855615,"segment":0,"confidence":4.482758620689655,"iterationTokens":4018,"asi":{"hypothesis":"Async method parsing should also accept generator markers so object/class `async *m()` syntax composes with existing generator function AST fields.","learned":"The async-method parser can reuse `consume_generator_marker/1` after consuming `async`; lookahead must recognize `async *name(` as an async method start.","quickjs_cases":"Adds QuickJS-compatible async generator method coverage for object and class `async *m() { yield await x; }`."}}
{"run":72,"commit":"b74b868","metric":139,"metrics":{"parser_tests":82,"parser_test_ms":200},"status":"keep","description":"Port QuickJS generator method coverage","timestamp":1777206967752,"segment":0,"confidence":4.47457627118644,"iterationTokens":1844,"asi":{"hypothesis":"Object and class member parsing should accept generator method syntax and avoid parser recovery loops on leading `*` class/object elements.","learned":"Explicit generator-method branches for object and class elements parse `*m()` and computed `*[name]()` keys cleanly, preserving FunctionExpression.generator.","quickjs_cases":"Adds QuickJS-compatible generator method coverage for object `*m()`, class `*m()`, and static computed class generator `static *[name]()`."}}
{"run":73,"commit":"37f3501","metric":141,"metrics":{"parser_tests":83,"parser_test_ms":300},"status":"keep","description":"Port rest parameter and spread call coverage","timestamp":1777207096042,"segment":0,"confidence":4.466666666666667,"iterationTokens":11725,"asi":{"hypothesis":"Formal parameter and argument-list parsing should support rest/spread syntax using existing RestElement and SpreadElement AST nodes.","learned":"Adding explicit `...` branches to parameter and argument parsers enables rest parameters and spread call arguments without changing expression parsing elsewhere.","quickjs_cases":"Adds QuickJS-compatible coverage for `function f(...args)`, `f(1, ...args)`, and `((...args) => args)(...[1, 2])`."}}
{"run":74,"commit":"5cdd780","metric":143,"metrics":{"parser_tests":84,"parser_test_ms":200},"status":"keep","description":"Port optional catch binding coverage","timestamp":1777207169103,"segment":0,"confidence":4.459016393442623,"iterationTokens":1519,"asi":{"hypothesis":"Existing try/catch parsing should already support optional catch binding and catch/finally combinations.","learned":"No implementation change was required; `parse_catch_clause/1` returns nil params when no parenthesized binding is present and composes with finally blocks.","quickjs_cases":"Adds QuickJS-compatible control-flow coverage for `try {} catch {}` and `try {} catch (e) {} finally {}`."}}
{"run":75,"commit":"cde714c","metric":145,"metrics":{"parser_tests":85,"parser_test_ms":200},"status":"keep","description":"Port QuickJS array spread elision coverage","timestamp":1777207237329,"segment":0,"confidence":4.451612903225806,"iterationTokens":1322,"asi":{"hypothesis":"Existing array spread and elision parsing should cover QuickJS spread over an array literal hole.","learned":"No implementation change was required; array elisions are represented as nil elements and compose inside SpreadElement arguments.","quickjs_cases":"Ports QuickJS `test_spread` syntax shape `x = [ ...[ , ] ];`."}}
{"run":76,"commit":"78e4b4f","metric":147,"metrics":{"parser_tests":86,"parser_test_ms":200},"status":"keep","description":"Port async function export coverage","timestamp":1777207326390,"segment":0,"confidence":4.590163934426229,"iterationTokens":1394,"asi":{"hypothesis":"Existing module export and async function parsing should compose for named and default async function exports, including async generators.","learned":"No implementation change was required; export declaration dispatch already uses `function_start?/1`, which recognizes `async function` before parsing function declarations.","quickjs_cases":"Adds QuickJS-compatible module coverage for `export async function`, `export default async function`, and `export default async function *`."}}
{"run":77,"commit":"1059a03","metric":149,"metrics":{"parser_tests":87,"parser_test_ms":200},"status":"keep","description":"Port object rest binding coverage","timestamp":1777207399086,"segment":0,"confidence":4.580645161290323,"iterationTokens":1136,"asi":{"hypothesis":"Existing object binding pattern parsing should cover object rest properties in declarations and function parameters.","learned":"No implementation change was required; object pattern parsing already emits RestElement for `...rest` and composes inside formal parameter parsing.","quickjs_cases":"Adds QuickJS-compatible destructuring coverage for `var { a, ...rest } = obj` and `function f({ a, ...rest }) {}`."}}
{"run":78,"commit":"20693f8","metric":151,"metrics":{"parser_tests":88,"parser_test_ms":300},"status":"keep","description":"Port computed object pattern coverage","timestamp":1777207481429,"segment":0,"confidence":4.571428571428571,"iterationTokens":1307,"asi":{"hypothesis":"Object binding patterns should preserve computed keys just like object literals and class elements.","learned":"Object pattern parsing can reuse `parse_property_key_with_computed/1` and set the Property.computed flag while preserving shorthand/default behavior.","quickjs_cases":"Adds QuickJS-compatible destructuring coverage for computed object binding keys: `var { [key]: value } = obj` and defaulted computed parameters."}}
{"run":79,"commit":"c5e3a5b","metric":153,"metrics":{"parser_tests":89,"parser_test_ms":400},"status":"keep","description":"Port optional call coverage","timestamp":1777207553104,"segment":0,"confidence":4.5625,"iterationTokens":1143,"asi":{"hypothesis":"Existing optional-chain parsing should handle optional calls on identifiers, member expressions, and optional-member chains.","learned":"No implementation change was required; `parse_optional_chain_tail/2` already supports `?.(` after any postfix expression and preserves optional flags on CallExpression.","quickjs_cases":"Adds QuickJS-compatible optional chaining coverage for `fn?.()`, `obj.method?.()`, and `obj?.method?.(x)`."}}
{"run":80,"commit":"5b0b684","metric":155,"metrics":{"parser_tests":90,"parser_test_ms":300},"status":"checks_failed","description":"Attempt default arrow export coverage","timestamp":1777207639686,"segment":0,"confidence":4.492307692307692,"iterationTokens":1266,"asi":{"hypothesis":"Default export expression parsing should cover async and parenthesized arrow functions without parser changes.","rollback_reason":"Backpressure checks hit the known flaky BeamProcess monitor timing failure (`noproc` instead of `kaboom`), so autoresearch rules require checks_failed and auto-revert.","next_action_hint":"Reapply the default arrow export test and rerun; no parser implementation change was involved."}}
{"run":81,"commit":"d47a1c5","metric":155,"metrics":{"parser_tests":90,"parser_test_ms":200},"status":"keep","description":"Port default arrow export coverage","timestamp":1777207691234,"segment":0,"confidence":4.484848484848484,"iterationTokens":1474,"asi":{"hypothesis":"Default export expression parsing should cover async and parenthesized arrow functions without parser changes.","learned":"No implementation change was required; `parse_export_default_declaration/1` falls through to expression parsing, which already recognizes async and parenthesized arrows.","quickjs_cases":"Adds QuickJS-compatible module coverage for `export default async x => x` and `export default (x) => x`."}}
{"run":82,"commit":"62ec1ae","metric":157,"metrics":{"parser_tests":91,"parser_test_ms":400},"status":"keep","description":"Port default specifier export coverage","timestamp":1777207790220,"segment":0,"confidence":4.477611940298507,"iterationTokens":1033,"asi":{"hypothesis":"Export specifier parsing should treat `default` as a contextual property key so default re-export forms parse without lexer changes.","learned":"No implementation change was required; `parse_property_key/1` accepts keyword tokens as Identifier keys, so `default as foo` and `foo as default` both work.","quickjs_cases":"Adds QuickJS-compatible module coverage for `export { default as foo } from \"dep\"` and `export { foo as default }`."}}
{"run":83,"commit":"496be27","metric":159,"metrics":{"parser_tests":92,"parser_test_ms":300},"status":"keep","description":"Port default specifier import coverage","timestamp":1777207851797,"segment":0,"confidence":4.470588235294118,"iterationTokens":957,"asi":{"hypothesis":"Named import specifier parsing should also accept `default` as a contextual imported binding name.","learned":"No implementation change was required; named import parsing shares property-key handling with exports and accepts keyword tokens for imported names.","quickjs_cases":"Adds QuickJS-compatible module coverage for `import { default as foo } from \"dep\"`."}}
{"run":84,"commit":"6c59ff9","metric":161,"metrics":{"parser_tests":93,"parser_test_ms":400},"status":"keep","description":"Port unicode identifier coverage","timestamp":1777207938675,"segment":0,"confidence":4.463768115942029,"iterationTokens":5751,"asi":{"hypothesis":"The lexer should accept non-ASCII identifier characters so QuickJS-compatible Unicode identifier syntax can parse at least for direct UTF-8 source characters.","learned":"Allowing codepoints above ASCII in identifier start/part handling enables UTF-8 identifiers like `ȣ`; full Unicode escape identifier support remains a separate, more precise lexer task.","quickjs_cases":"Adds QuickJS-compatible Unicode identifier coverage for `var ȣ = 1;`, related to QuickJS `test_syntax` Unicode identifier inputs."}}
{"run":85,"commit":"0df553f","metric":163,"metrics":{"parser_tests":94,"parser_test_ms":300},"status":"keep","description":"Port unicode escape identifier coverage","timestamp":1777208021409,"segment":0,"confidence":4.457142857142857,"iterationTokens":2075,"asi":{"hypothesis":"The lexer should decode `\\uXXXX` escapes in identifiers so QuickJS-compatible escaped identifier names parse to their cooked identifier value.","learned":"Identifier scanning now accumulates cooked parts and decodes simple four-digit Unicode escapes while preserving raw token text for diagnostics.","quickjs_cases":"Adds QuickJS-compatible Unicode escape identifier coverage for `var abc\\u0064 = 1;`, related to QuickJS `test_syntax` escaped identifier inputs."}}
{"run":86,"commit":"e4e44e8","metric":165,"metrics":{"parser_tests":95,"parser_test_ms":200},"status":"keep","description":"Port braced unicode escape identifier coverage","timestamp":1777208075593,"segment":0,"confidence":4.450704225352113,"iterationTokens":1653,"asi":{"hypothesis":"Identifier escape decoding should also handle ES6 braced Unicode escapes so parser coverage is not limited to four-digit `\\uXXXX` forms.","learned":"A small braced escape scanner can decode `\\u{...}` identifier parts and continue the same cooked identifier accumulation path.","quickjs_cases":"Adds QuickJS-compatible braced Unicode escape identifier coverage for `var smile\\u{79} = 1;`."}}
{"run":87,"commit":"3c11b6e","metric":167,"metrics":{"parser_tests":96,"parser_test_ms":300},"status":"keep","description":"Port invalid unicode escape diagnostics","timestamp":1777208193327,"segment":0,"confidence":4.444444444444445,"iterationTokens":3791,"asi":{"hypothesis":"Unicode escape identifier support should reject invalid escape forms and invalid codepoints instead of crashing or silently accepting malformed identifiers.","learned":"Identifier escape decoding now guards against surrogate/out-of-range codepoints and non-hex escape payloads, returning parser errors through the lexer error path.","quickjs_cases":"Adds QuickJS-compatible invalid Unicode identifier escape coverage for out-of-range, surrogate, and malformed `\\u` identifier escapes."}}
{"run":88,"commit":"d0d441e","metric":169,"metrics":{"parser_tests":97,"parser_test_ms":200},"status":"keep","description":"Port private unicode identifier coverage","timestamp":1777208263875,"segment":0,"confidence":4.438356164383562,"iterationTokens":1288,"asi":{"hypothesis":"Unicode escape identifier decoding should also work after private-name markers in class fields and private member expressions.","learned":"No implementation change was required after lexer escape support; private-name parsing consumes the decoded identifier token after `#` in both field keys and member properties.","quickjs_cases":"Adds QuickJS-compatible private identifier escape coverage for `#\\u0061` declarations and `this.#\\u0061` access."}}
