{"run":1326,"commit":"b3f082d","metric":2,"metrics":{"compiler_test262_cases":800,"compiler_test262_pass":798,"compiler_test262_failures":2,"compiler_test262_compiler_errors":0,"compiler_test262_compiler_crashes":0,"compiler_test262_compiler_fails":0,"compiler_test262_both_fail":2,"compiler_test262_interpreter_fail_compiler_pass":0,"compatibility_pass":798,"compatibility_cases":800,"compiler_errors":0,"compiler_crashes":0,"compiler_fails":0,"both_fail":2,"interpreter_fail_compiler_pass":0,"elapsed_ms":34698},"status":"keep","description":"Use species constructors for Array filter","timestamp":1778712840973,"segment":94,"confidence":null,"iterationTokens":7502,"asi":{"hypothesis":"Array.prototype.filter should create its result with ArraySpeciesCreate(O, 0), invoking custom species constructors, rejecting non-constructors/non-object returns, and supporting proxy/realm species paths just like concat result creation.","fixed_focus":["Array/prototype/filter/create-species.js","Array/prototype/filter/create-species-non-ctor.js","Array/prototype/filter/create-ctor-non-object.js","Array/prototype/filter/create-proto-from-ctor-realm-non-array.js","Array/prototype/filter/create-proxy.js","Array/prototype/filter/create-revoked-proxy.js"],"remaining_failures":"Array 800 now has two failures: copyWithin/resizable-buffer and the suspicious filter/15.4.4.20-9-b-6 Array[1] assertion."}}
{"type":"config","name":"Array Test262 compatibility 850-case expansion","metricName":"compatibility_failures","metricUnit":"","bestDirection":"lower"}
{"run":1327,"commit":"0e3cd0b","metric":24,"metrics":{"compiler_test262_cases":850,"compiler_test262_pass":826,"compiler_test262_failures":24,"compiler_test262_compiler_errors":0,"compiler_test262_compiler_crashes":0,"compiler_test262_compiler_fails":0,"compiler_test262_both_fail":24,"compiler_test262_interpreter_fail_compiler_pass":0,"compatibility_pass":826,"compatibility_cases":850,"compiler_errors":0,"compiler_crashes":0,"compiler_fails":0,"both_fail":24,"interpreter_fail_compiler_pass":0,"elapsed_ms":37763},"status":"keep","description":"Baseline Array 850-case expansion","timestamp":1778713015830,"segment":95,"confidence":null,"iterationTokens":125,"asi":{"hypothesis":"Expand Array workload from 800 to 850 cases after filter species support reduced the 800 slice to two residuals; the next slice likely starts the find/findIndex cluster.","workload":"AUTORESEARCH_TEST262_CATEGORY=built-ins/Array TEST262_LIMIT=850 TEST262_ERROR_LIMIT=480 ./autoresearch.sh","baseline_note":"Array 850-case expansion has 24 failures, 826 passes, and no compiler-only failures/errors/crashes."}}
{"run":1328,"commit":"a774ea2","metric":4,"metrics":{"compiler_test262_cases":850,"compiler_test262_pass":846,"compiler_test262_failures":4,"compiler_test262_compiler_errors":0,"compiler_test262_compiler_crashes":0,"compiler_test262_compiler_fails":0,"compiler_test262_both_fail":4,"compiler_test262_interpreter_fail_compiler_pass":0,"compatibility_pass":846,"compatibility_cases":850,"compiler_errors":0,"compiler_crashes":0,"compiler_fails":0,"both_fail":4,"interpreter_fail_compiler_pass":0,"elapsed_ms":38023},"status":"keep","description":"Apply generic find iteration semantics","timestamp":1778713286480,"segment":95,"confidence":null,"iterationTokens":7610,"asi":{"hypothesis":"Array.prototype.find/findIndex should use generic LengthOfArrayLike/Get iteration, validate predicate callability, pass value/index/object parameters, observe live array mutations, and support resizable typed-array element reads similarly to every/filter.","fixed_focus":["Array/prototype/find/predicate-call-parameters.js","Array/prototype/find/predicate-is-not-callable-throws.js","Array/prototype/find/array-altered-during-loop.js","Array/prototype/findIndex/predicate-call-parameters.js"],"remaining_failures":"Array 850 reduced from 24 to 4; remaining failures are copyWithin/resizable-buffer, suspicious filter Array[1], and find/findIndex strict this binding for omitted thisArg."}}
{"type":"config","name":"Array Test262 compatibility 900-case expansion","metricName":"compatibility_failures","metricUnit":"","bestDirection":"lower"}
{"run":1329,"commit":"fbb3883","metric":37,"metrics":{"compiler_test262_cases":900,"compiler_test262_pass":863,"compiler_test262_failures":37,"compiler_test262_compiler_errors":0,"compiler_test262_compiler_crashes":0,"compiler_test262_compiler_fails":0,"compiler_test262_both_fail":37,"compiler_test262_interpreter_fail_compiler_pass":0,"compatibility_pass":863,"compatibility_cases":900,"compiler_errors":0,"compiler_crashes":0,"compiler_fails":0,"both_fail":37,"interpreter_fail_compiler_pass":0,"elapsed_ms":41302},"status":"keep","description":"Baseline Array 900-case expansion","timestamp":1778713565257,"segment":96,"confidence":null,"iterationTokens":125,"asi":{"hypothesis":"Expand Array workload from 850 to 900 cases to expose the next array method cluster after generic find/findIndex reduced the 850 slice to four residuals.","workload":"AUTORESEARCH_TEST262_CATEGORY=built-ins/Array TEST262_LIMIT=900 TEST262_ERROR_LIMIT=520 ./autoresearch.sh","baseline_note":"Array 900-case expansion has 37 failures, 863 passes, and no compiler-only failures/errors/crashes."}}
{"run":1330,"commit":"a539c3a","metric":7,"metrics":{"compiler_test262_cases":900,"compiler_test262_pass":893,"compiler_test262_failures":7,"compiler_test262_compiler_errors":0,"compiler_test262_compiler_crashes":0,"compiler_test262_compiler_fails":0,"compiler_test262_both_fail":7,"compiler_test262_interpreter_fail_compiler_pass":0,"compatibility_pass":893,"compatibility_cases":900,"compiler_errors":0,"compiler_crashes":0,"compiler_fails":0,"both_fail":7,"interpreter_fail_compiler_pass":0,"elapsed_ms":41688},"status":"keep","description":"Install generic findLast methods","timestamp":1778713997188,"segment":96,"confidence":null,"iterationTokens":13735,"asi":{"hypothesis":"Array.prototype.findLast/findLastIndex should be installed as prototype methods with generic reverse-direction LengthOfArrayLike/Get iteration and the same predicate validation/parameter semantics as find/findIndex.","fixed_focus":["Array/prototype/find/predicate-not-called-on-empty-array.js","Array/prototype/findLast/predicate-call-parameters.js","Array/prototype/findLast/predicate-is-not-callable-throws.js","Array/prototype/findLast/array-altered-during-loop.js","Array/prototype/findLastIndex/predicate-call-parameters.js"],"remaining_failures":"Array 900 reduced from 37 to 7; residuals are copyWithin/resizable-buffer, suspicious filter Array[1], and strict/this binding for find/findIndex/findLast/findLastIndex."}}
{"run":1331,"commit":"5c1f93c","metric":3,"metrics":{"compiler_test262_cases":900,"compiler_test262_pass":897,"compiler_test262_failures":3,"compiler_test262_compiler_errors":0,"compiler_test262_compiler_crashes":0,"compiler_test262_compiler_fails":0,"compiler_test262_both_fail":3,"compiler_test262_interpreter_fail_compiler_pass":0,"compatibility_pass":897,"compatibility_cases":900,"compiler_errors":0,"compiler_crashes":0,"compiler_fails":0,"both_fail":3,"interpreter_fail_compiler_pass":0,"elapsed_ms":39828},"status":"keep","description":"Describe findLast builtin metadata","timestamp":1778714245875,"segment":96,"confidence":8.5,"iterationTokens":6844,"asi":{"hypothesis":"Newly installed findLast/findLastIndex prototype methods need builtin metadata so length/name/constructability descriptor tests see non-constructable functions with length 1.","fixed_focus":["Array/prototype/findLast/length.js","Array/prototype/findLast/not-a-constructor.js","Array/prototype/findLastIndex/length.js","Array/prototype/findLastIndex/not-a-constructor.js"],"remaining_failures":"Array 900 now has three failures: copyWithin/resizable-buffer, suspicious filter Array[1], and flat/array-like-objects."}}
{"run":1332,"commit":"912acca","metric":2,"metrics":{"compiler_test262_cases":900,"compiler_test262_pass":898,"compiler_test262_failures":2,"compiler_test262_compiler_errors":0,"compiler_test262_compiler_crashes":0,"compiler_test262_compiler_fails":0,"compiler_test262_both_fail":2,"compiler_test262_interpreter_fail_compiler_pass":0,"compatibility_pass":898,"compatibility_cases":900,"compiler_errors":0,"compiler_crashes":0,"compiler_fails":0,"both_fail":2,"interpreter_fail_compiler_pass":0,"elapsed_ms":39881},"status":"keep","description":"Flatten generic array-like receivers","timestamp":1778714487522,"segment":96,"confidence":14,"iterationTokens":2662,"asi":{"hypothesis":"Array.prototype.flat should use LengthOfArrayLike and indexed Get for non-array object receivers, flattening array values found on arguments/ordinary array-like objects instead of converting the receiver with Heap.obj_to_list.","fixed_focus":"Array/prototype/flat/array-like-objects.js","remaining_failures":"Array 900 now has two failures: copyWithin/resizable-buffer and suspicious filter/15.4.4.20-9-b-6 Array[1] assertion."}}
{"type":"config","name":"Array Test262 compatibility 950-case expansion","metricName":"compatibility_failures","metricUnit":"","bestDirection":"lower"}
{"run":1333,"commit":"8e35ac9","metric":37,"metrics":{"compiler_test262_cases":950,"compiler_test262_pass":913,"compiler_test262_failures":37,"compiler_test262_compiler_errors":0,"compiler_test262_compiler_crashes":0,"compiler_test262_compiler_fails":0,"compiler_test262_both_fail":37,"compiler_test262_interpreter_fail_compiler_pass":0,"compatibility_pass":913,"compatibility_cases":950,"compiler_errors":0,"compiler_crashes":0,"compiler_fails":0,"both_fail":37,"interpreter_fail_compiler_pass":0,"elapsed_ms":41528},"status":"keep","description":"Baseline Array 950-case expansion","timestamp":1778714671890,"segment":97,"confidence":null,"iterationTokens":125,"asi":{"hypothesis":"Expand Array workload from 900 to 950 cases after the 900 slice returned to two residuals; the next slice likely starts flatMap/forEach clusters.","workload":"AUTORESEARCH_TEST262_CATEGORY=built-ins/Array TEST262_LIMIT=950 TEST262_ERROR_LIMIT=560 ./autoresearch.sh","baseline_note":"Array 950-case expansion has 37 failures, 913 passes, and no compiler-only failures/errors/crashes."}}
{"run":1334,"commit":"4d190d0","metric":29,"metrics":{"compiler_test262_cases":950,"compiler_test262_pass":921,"compiler_test262_failures":29,"compiler_test262_compiler_errors":0,"compiler_test262_compiler_crashes":0,"compiler_test262_compiler_fails":0,"compiler_test262_both_fail":29,"compiler_test262_interpreter_fail_compiler_pass":0,"compatibility_pass":921,"compatibility_cases":950,"compiler_errors":0,"compiler_crashes":0,"compiler_fails":0,"both_fail":29,"interpreter_fail_compiler_pass":0,"elapsed_ms":41827},"status":"keep","description":"Apply generic forEach iteration semantics","timestamp":1778715172662,"segment":97,"confidence":null,"iterationTokens":125,"asi":{"hypothesis":"Array.prototype.forEach should reject nullish receivers/non-callable callbacks and iterate generic array-like receivers through LengthOfArrayLike, HasProperty, Get, and callback thisArg binding instead of Heap.obj_to_list.","fixed_focus":["Array/prototype/forEach/15.4.4.18-1-1.js","Array/prototype/forEach/15.4.4.18-1-10.js","Array/prototype/forEach/15.4.4.18-1-11.js","Array/prototype/forEach/15.4.4.18-1-12.js","Array/prototype/forEach/15.4.4.18-1-13.js","Array/prototype/forEach/15.4.4.18-1-14.js"],"remaining_failures":"Array 950 reduced from 37 to 29; remaining cluster includes flat/flatMap species/depth/target-property semantics plus copyWithin/resizable-buffer and suspicious filter Array[1]."}}
{"run":1335,"commit":"e9f836d","metric":16,"metrics":{"compiler_test262_cases":950,"compiler_test262_pass":934,"compiler_test262_failures":16,"compiler_test262_compiler_errors":0,"compiler_test262_compiler_crashes":0,"compiler_test262_compiler_fails":0,"compiler_test262_both_fail":16,"compiler_test262_interpreter_fail_compiler_pass":0,"compatibility_pass":934,"compatibility_cases":950,"compiler_errors":0,"compiler_crashes":0,"compiler_fails":0,"both_fail":16,"interpreter_fail_compiler_pass":0,"elapsed_ms":41268},"status":"keep","description":"Apply generic flatMap iteration semantics","timestamp":1778715472989,"segment":97,"confidence":2.625,"iterationTokens":23775,"asi":{"hypothesis":"Array.prototype.flatMap should share generic array-like iteration with filter/find/forEach: nullish rejection, LengthOfArrayLike before mapper validation, HasProperty/Get for live indexed values, mapper thisArg forwarding, one-level flattening, and species-backed result creation.","fixed_focus":["Array/prototype/flatMap/array-like-objects.js","Array/prototype/flatMap/array-like-objects-nested.js","Array/prototype/flatMap/array-like-objects-typedarrays.js","Array/prototype/flatMap/call-with-boolean.js","Array/prototype/flatMap/non-callable-argument-throws.js"],"known_residual":"flatMap/thisArg-argument still fails for strict null thisArg because invocation boxes/substitutes null; broad still improves 29 to 16."}}
{"run":1336,"commit":"3cc8e86","metric":11,"metrics":{"compiler_test262_cases":950,"compiler_test262_pass":939,"compiler_test262_failures":11,"compiler_test262_compiler_errors":0,"compiler_test262_compiler_crashes":0,"compiler_test262_compiler_fails":0,"compiler_test262_both_fail":11,"compiler_test262_interpreter_fail_compiler_pass":0,"compatibility_pass":939,"compatibility_cases":950,"compiler_errors":0,"compiler_crashes":0,"compiler_fails":0,"both_fail":11,"interpreter_fail_compiler_pass":0,"elapsed_ms":41461},"status":"keep","description":"Honor Array flat depth and nullish errors","timestamp":1778715743673,"segment":97,"confidence":2.888888888888889,"iterationTokens":4940,"asi":{"hypothesis":"Array.prototype.flat should reject nullish receivers and use ToIntegerOrInfinity depth semantics, including default depth for explicit undefined, zero-depth preservation, positive-infinity recursive flattening, and explicit undefined element preservation for array receivers.","fixed_focus":["Array/prototype/flat/non-numeric-depth-should-not-throw.js","Array/prototype/flat/null-undefined-input-throws.js","Array/prototype/flat/null-undefined-elements.js","Array/prototype/flat/positive-infinity.js"],"remaining_failures":"Array 950 reduced from 16 to 11; remaining flat failures are species/target/proxy observability rather than depth/nullish basics."}}
{"run":1337,"commit":"cef604b","metric":7,"metrics":{"compiler_test262_cases":950,"compiler_test262_pass":943,"compiler_test262_failures":7,"compiler_test262_compiler_errors":0,"compiler_test262_compiler_crashes":0,"compiler_test262_compiler_fails":0,"compiler_test262_both_fail":7,"compiler_test262_interpreter_fail_compiler_pass":0,"compatibility_pass":943,"compatibility_cases":950,"compiler_errors":0,"compiler_crashes":0,"compiler_fails":0,"both_fail":7,"interpreter_fail_compiler_pass":0,"elapsed_ms":41624},"status":"keep","description":"Create flat results through species targets","timestamp":1778715974594,"segment":97,"confidence":3.3333333333333335,"iterationTokens":3386,"asi":{"hypothesis":"Array.prototype.flat result creation should go through ArraySpeciesCreate-style target creation and CreateDataPropertyOrThrow, so constructor/species access, non-object constructors, non-extensible targets, and non-configurable target collisions are observable.","fixed_focus":["Array/prototype/flat/non-object-ctor-throws.js","Array/prototype/flat/target-array-non-extensible.js","Array/prototype/flat/target-array-with-non-configurable-property.js"],"remaining_failures":"Array 950 reduced from 11 to 7; flat proxy access order still differs, plus target non-writable/propertyHelper, flatMap proxy/species/thisArg, concat large typed-array, copyWithin resizable-buffer, and suspicious filter Array[1]."}}
{"run":1338,"commit":"1f04381","metric":6,"metrics":{"compiler_test262_cases":950,"compiler_test262_pass":944,"compiler_test262_failures":6,"compiler_test262_compiler_errors":0,"compiler_test262_compiler_crashes":0,"compiler_test262_compiler_fails":0,"compiler_test262_both_fail":6,"compiler_test262_interpreter_fail_compiler_pass":0,"compatibility_pass":944,"compatibility_cases":950,"compiler_errors":0,"compiler_crashes":0,"compiler_fails":0,"both_fail":6,"interpreter_fail_compiler_pass":0,"elapsed_ms":41232},"status":"keep","description":"Avoid explicit flat result length writes","timestamp":1778716231245,"segment":97,"confidence":4.428571428571429,"iterationTokens":6387,"asi":{"hypothesis":"flat/flatMap should populate their species target with CreateDataPropertyOrThrow entries but should not explicitly define an own length property on custom constructor results; array targets grow their length through indexed creates.","fixed_focus":"Array/prototype/flatMap/this-value-ctor-object-species-custom-ctor.js","remaining_failures":"Array 950 now has six failures: concat large typed-array, copyWithin resizable-buffer, suspicious filter Array[1], flat/flatMap proxy access order, and flatMap strict null thisArg."}}
{"run":1339,"commit":"16c079b","metric":4,"metrics":{"compiler_test262_cases":950,"compiler_test262_pass":946,"compiler_test262_failures":4,"compiler_test262_compiler_errors":0,"compiler_test262_compiler_crashes":0,"compiler_test262_compiler_fails":0,"compiler_test262_both_fail":4,"compiler_test262_interpreter_fail_compiler_pass":0,"compatibility_pass":946,"compatibility_cases":950,"compiler_errors":0,"compiler_crashes":0,"compiler_fails":0,"both_fail":4,"interpreter_fail_compiler_pass":0,"elapsed_ms":41761},"status":"keep","description":"Align flat proxy and nested array access","timestamp":1778716560654,"segment":97,"confidence":6.6,"iterationTokens":5729,"asi":{"hypothesis":"flat/flatMap should read source length before species constructor creation and should recursively flatten proxy/array-like Array values through HasProperty/Get instead of treating proxy arrays as scalar elements.","fixed_focus":["Array/prototype/flat/proxy-access-count.js","Array/prototype/flatMap/proxy-access-count.js"],"remaining_failures":"Array 950 now has four failures: concat large typed-array, copyWithin resizable-buffer, suspicious filter Array[1], and flatMap strict null thisArg binding."}}
{"type":"config","name":"Array Test262 compatibility 1000-case expansion","metricName":"compatibility_failures","metricUnit":"","bestDirection":"lower"}
{"run":1340,"commit":"1082788","metric":4,"metrics":{"compiler_test262_cases":1000,"compiler_test262_pass":996,"compiler_test262_failures":4,"compiler_test262_compiler_errors":0,"compiler_test262_compiler_crashes":0,"compiler_test262_compiler_fails":0,"compiler_test262_both_fail":4,"compiler_test262_interpreter_fail_compiler_pass":0,"compatibility_pass":996,"compatibility_cases":1000,"compiler_errors":0,"compiler_crashes":0,"compiler_fails":0,"both_fail":4,"interpreter_fail_compiler_pass":0,"elapsed_ms":44837},"status":"keep","description":"Baseline Array 1000-case expansion","timestamp":1778716950125,"segment":98,"confidence":null,"iterationTokens":127,"asi":{"hypothesis":"Expand Array workload from 950 to 1000 cases after reducing the 950 slice to four residual failures; also prune stale Array ideas to reflect current plateau and discarded strict-this attempt.","workload":"AUTORESEARCH_TEST262_CATEGORY=built-ins/Array TEST262_LIMIT=1000 TEST262_ERROR_LIMIT=620 ./autoresearch.sh","baseline_note":"Array 1000-case expansion stays at the same four residual failures with 996 passes and no compiler-only errors/crashes/fails."}}
{"type":"config","name":"Array Test262 compatibility 1100-case expansion","metricName":"compatibility_failures","metricUnit":"","bestDirection":"lower"}
{"run":1341,"commit":"b90c49c","metric":4,"metrics":{"compiler_test262_cases":1100,"compiler_test262_pass":1096,"compiler_test262_failures":4,"compiler_test262_compiler_errors":0,"compiler_test262_compiler_crashes":0,"compiler_test262_compiler_fails":0,"compiler_test262_both_fail":4,"compiler_test262_interpreter_fail_compiler_pass":0,"compatibility_pass":1096,"compatibility_cases":1100,"compiler_errors":0,"compiler_crashes":0,"compiler_fails":0,"both_fail":4,"interpreter_fail_compiler_pass":0,"elapsed_ms":48382},"status":"keep","description":"Baseline Array 1100-case expansion","timestamp":1778717142636,"segment":99,"confidence":null,"iterationTokens":127,"asi":{"hypothesis":"Expand Array workload from 1000 to 1100 cases to look for new clusters beyond the current residual plateau.","workload":"AUTORESEARCH_TEST262_CATEGORY=built-ins/Array TEST262_LIMIT=1100 TEST262_ERROR_LIMIT=700 ./autoresearch.sh","baseline_note":"Array 1100 stays at four shared failures, no compiler-only failures/errors/crashes."}}
{"type":"config","name":"Array Test262 compatibility 1200-case expansion","metricName":"compatibility_failures","metricUnit":"","bestDirection":"lower"}
{"run":1342,"commit":"7c5a7d9","metric":45,"metrics":{"compiler_test262_cases":1200,"compiler_test262_pass":1155,"compiler_test262_failures":45,"compiler_test262_compiler_errors":0,"compiler_test262_compiler_crashes":0,"compiler_test262_compiler_fails":0,"compiler_test262_both_fail":44,"compiler_test262_interpreter_fail_compiler_pass":0,"compatibility_pass":1155,"compatibility_cases":1200,"compiler_errors":0,"compiler_crashes":0,"compiler_fails":0,"both_fail":44,"interpreter_fail_compiler_pass":0,"elapsed_ms":51486},"status":"keep","description":"Baseline Array 1200-case expansion","timestamp":1778717341050,"segment":100,"confidence":null,"iterationTokens":127,"asi":{"hypothesis":"Expand Array workload from 1100 to 1200 cases; this enters a new cluster after the 1100 slice stayed at the four residual failures.","workload":"AUTORESEARCH_TEST262_CATEGORY=built-ins/Array TEST262_LIMIT=1200 TEST262_ERROR_LIMIT=780 ./autoresearch.sh","baseline_note":"Array 1200 baseline has 45 compatibility failures; compiler-only error/crash/fail metrics remain zero."}}
