{"run":1309,"commit":"806c0e1","metric":6,"metrics":{"compiler_test262_cases":550,"compiler_test262_pass":544,"compiler_test262_failures":6,"compiler_test262_compiler_errors":0,"compiler_test262_compiler_crashes":0,"compiler_test262_compiler_fails":0,"compiler_test262_both_fail":6,"compiler_test262_interpreter_fail_compiler_pass":0,"compatibility_pass":544,"compatibility_cases":550,"compiler_errors":0,"compiler_crashes":0,"compiler_fails":0,"both_fail":6,"interpreter_fail_compiler_pass":0,"elapsed_ms":22819},"status":"keep","description":"Preserve object receivers in Array fill","timestamp":1778707650330,"segment":89,"confidence":3,"iterationTokens":3097,"asi":{"hypothesis":"Array.prototype.fill on non-array object receivers should write indexed properties through ordinary Set without replacing the receiver storage, preserving boxed primitive prototypes and supporting sparse near-limit array-like objects.","fixed_focus":["Array/prototype/fill/call-with-boolean.js","Array/prototype/fill/length-near-integer-limit.js"],"remaining_failures":"Array 550 reduced to six failures: resizable ArrayBuffer/every typed-array parity, copyWithin resizable buffer, and exotic-array behavior."}}
{"run":1310,"commit":"15e6b2a","metric":5,"metrics":{"compiler_test262_cases":550,"compiler_test262_pass":545,"compiler_test262_failures":5,"compiler_test262_compiler_errors":0,"compiler_test262_compiler_crashes":0,"compiler_test262_compiler_fails":0,"compiler_test262_both_fail":5,"compiler_test262_interpreter_fail_compiler_pass":0,"compatibility_pass":545,"compatibility_cases":550,"compiler_errors":0,"compiler_crashes":0,"compiler_fails":0,"both_fail":5,"interpreter_fail_compiler_pass":0,"elapsed_ms":23199},"status":"keep","description":"Virtualize Array prototype exotic identity","timestamp":1778707975424,"segment":89,"confidence":4.666666666666667,"iterationTokens":8998,"asi":{"hypothesis":"Array.prototype should behave like an Array exotic for length growth and Object.prototype.toString while avoiding storing an actual prototype length property that previously caused OOM.","fixed_focus":"Array/prototype/exotic-array.js","remaining_failures":"Array 550 now has five failures, all in resizable-buffer typed-array/copyWithin/every territory."}}
{"run":1311,"commit":"9897761","metric":2,"metrics":{"compiler_test262_cases":550,"compiler_test262_pass":548,"compiler_test262_failures":2,"compiler_test262_compiler_errors":0,"compiler_test262_compiler_crashes":0,"compiler_test262_compiler_fails":0,"compiler_test262_both_fail":2,"compiler_test262_interpreter_fail_compiler_pass":0,"compatibility_pass":548,"compatibility_cases":550,"compiler_errors":0,"compiler_crashes":0,"compiler_fails":0,"both_fail":2,"interpreter_fail_compiler_pass":0,"elapsed_ms":24571},"status":"keep","description":"Recognize live typed-array indices","timestamp":1778708311513,"segment":89,"confidence":5,"iterationTokens":30210,"asi":{"hypothesis":"Generic Array methods that use HasProperty must treat currently in-bounds typed-array numeric indices as present, using live element_count/out_of_bounds state for resizable buffers rather than relying on stored map keys.","fixed_focus":["Array/prototype/every/resizable-buffer.js","Array/prototype/every/resizable-buffer-grow-mid-iteration.js","Array/prototype/every/resizable-buffer-shrink-mid-iteration.js"],"remaining_failures":"Array 550 now has two failures: callbackfn-resize-arraybuffer where harness sees ArrayBuffer.prototype.resize as undefined in a later constructor slice, and copyWithin/resizable-buffer where generic typed-array writes still do not update the backing buffer in native bytecode path."}}
{"run":1312,"commit":"7a54759","metric":1,"metrics":{"compiler_test262_cases":550,"compiler_test262_pass":549,"compiler_test262_failures":1,"compiler_test262_compiler_errors":0,"compiler_test262_compiler_crashes":0,"compiler_test262_compiler_fails":0,"compiler_test262_both_fail":1,"compiler_test262_interpreter_fail_compiler_pass":0,"compatibility_pass":549,"compatibility_cases":550,"compiler_errors":0,"compiler_crashes":0,"compiler_fails":0,"both_fail":1,"interpreter_fail_compiler_pass":0,"elapsed_ms":24753},"status":"keep","description":"Install ArrayBuffer prototype methods","timestamp":1778708665511,"segment":89,"confidence":3.6666666666666665,"iterationTokens":9112,"asi":{"hypothesis":"ArrayBuffer.prototype should expose resize/transfer/slice methods on the shared prototype object, not only through instance fallback, so feature-detection tests observe resizable ArrayBuffer support correctly.","fixed_focus":"Array/prototype/every/callbackfn-resize-arraybuffer.js","remaining_failures":"Array 550 is back to the single copyWithin/resizable-buffer typed-array backing-store failure."}}
{"run":1313,"commit":"7a54759","metric":1,"metrics":{"compiler_test262_cases":550,"compiler_test262_pass":549,"compiler_test262_failures":1,"compiler_test262_compiler_errors":0,"compiler_test262_compiler_crashes":0,"compiler_test262_compiler_fails":0,"compiler_test262_both_fail":0,"compiler_test262_interpreter_fail_compiler_pass":1,"compatibility_pass":549,"compatibility_cases":550,"compiler_errors":0,"compiler_crashes":0,"compiler_fails":0,"both_fail":0,"interpreter_fail_compiler_pass":1,"elapsed_ms":24824},"status":"discard","description":"Route generic copyWithin typed-array writes","timestamp":1778709365918,"segment":89,"confidence":3.6666666666666665,"iterationTokens":21610,"asi":{"hypothesis":"Generic Array.prototype.copyWithin on typed-array receivers should write string numeric keys into the typed-array backing store and snapshot typed-array source values before overlapping writes.","rollback_reason":"Primary compatibility_failures stayed at 1. The shared failure became interpreter-only, but the active primary metric did not improve and focused native-bytecode Test262 still failed after prior Float16/compareArray state.","next_action_hint":"Investigate why native bytecode interpreter fails copyWithin/resizable-buffer around Float16 after prior compareArray/assert sequences while direct source/compiler probes pass; avoid keeping partial typed-array write routing solely for secondary metric movement."}}
{"type":"config","name":"Array Test262 compatibility 600-case expansion","metricName":"compatibility_failures","metricUnit":"","bestDirection":"lower"}
{"run":1314,"commit":"1589b81","metric":27,"metrics":{"compiler_test262_cases":600,"compiler_test262_pass":573,"compiler_test262_failures":27,"compiler_test262_compiler_errors":0,"compiler_test262_compiler_crashes":0,"compiler_test262_compiler_fails":0,"compiler_test262_both_fail":27,"compiler_test262_interpreter_fail_compiler_pass":0,"compatibility_pass":573,"compatibility_cases":600,"compiler_errors":0,"compiler_crashes":0,"compiler_fails":0,"both_fail":27,"interpreter_fail_compiler_pass":0,"elapsed_ms":28181},"status":"keep","description":"Baseline Array 600-case expansion","timestamp":1778709578277,"segment":90,"confidence":null,"iterationTokens":125,"asi":{"hypothesis":"Expand Array workload after the 550-case slice plateaued at the single copyWithin/resizable-buffer failure to expose the next generic array-method cluster.","workload":"AUTORESEARCH_TEST262_CATEGORY=built-ins/Array TEST262_LIMIT=600 TEST262_ERROR_LIMIT=330 ./autoresearch.sh","baseline_note":"Array 600-case expansion has 27 failures, 573 passes, and no compiler-only failures/errors/crashes."}}
{"run":1315,"commit":"e8f07c8","metric":14,"metrics":{"compiler_test262_cases":600,"compiler_test262_pass":586,"compiler_test262_failures":14,"compiler_test262_compiler_errors":0,"compiler_test262_compiler_crashes":0,"compiler_test262_compiler_fails":0,"compiler_test262_both_fail":14,"compiler_test262_interpreter_fail_compiler_pass":0,"compatibility_pass":586,"compatibility_cases":600,"compiler_errors":0,"compiler_crashes":0,"compiler_fails":0,"both_fail":14,"interpreter_fail_compiler_pass":0,"elapsed_ms":26388},"status":"keep","description":"Apply generic array-like filter semantics","timestamp":1778709837825,"segment":90,"confidence":null,"iterationTokens":8480,"asi":{"hypothesis":"Array.prototype.filter should mirror the generic array-like receiver handling already used by every: nullish ToObject rejection, length-before-callback validation, HasProperty/Get iteration over objects/builtins/regexps, callback thisArg forwarding, and a real array result.","fixed_focus":["Array/prototype/filter/15.4.4.20-1-1.js","Array/prototype/filter/15.4.4.20-1-10.js","Array/prototype/filter/15.4.4.20-2-1.js"],"remaining_failures":"Array 600 reduced from 27 to 14; remaining failures include resizable typed-array copy/fill plus later filter edge cases."}}
{"run":1316,"commit":"34e3989","metric":9,"metrics":{"compiler_test262_cases":600,"compiler_test262_pass":591,"compiler_test262_failures":9,"compiler_test262_compiler_errors":0,"compiler_test262_compiler_crashes":0,"compiler_test262_compiler_fails":0,"compiler_test262_both_fail":9,"compiler_test262_interpreter_fail_compiler_pass":0,"compatibility_pass":591,"compatibility_cases":600,"compiler_errors":0,"compiler_crashes":0,"compiler_fails":0,"both_fail":9,"interpreter_fail_compiler_pass":0,"elapsed_ms":26329},"status":"keep","description":"Wrap primitive and callable filter receivers","timestamp":1778710144761,"segment":90,"confidence":3.6,"iterationTokens":7474,"asi":{"hypothesis":"Array.prototype.filter generic semantics should ToObject-wrap primitive receivers and support callable objects/functions as array-like receivers, matching the kept every receiver handling.","fixed_focus":["Array/prototype/filter/15.4.4.20-1-3.js","Array/prototype/filter/15.4.4.20-1-5.js","Array/prototype/filter/15.4.4.20-1-7.js","Array/prototype/filter/15.4.4.20-1-9.js"],"remaining_failures":"Array 600 reduced from 14 to 9; residual filter failures involve ordinary constructed objects with inherited length/prototype behavior, plus resizable typed-array fill/copyWithin."}}
{"run":1317,"commit":"34e3989","metric":9,"metrics":{"compiler_test262_cases":600,"compiler_test262_pass":591,"compiler_test262_failures":9,"compiler_test262_compiler_errors":0,"compiler_test262_compiler_crashes":0,"compiler_test262_compiler_fails":0,"compiler_test262_both_fail":9,"compiler_test262_interpreter_fail_compiler_pass":0,"compatibility_pass":591,"compatibility_cases":600,"compiler_errors":0,"compiler_crashes":0,"compiler_fails":0,"both_fail":9,"interpreter_fail_compiler_pass":0,"elapsed_ms":26675},"status":"discard","description":"Delegate shaped accessor reads through Get","timestamp":1778710582313,"segment":90,"confidence":7.2,"iterationTokens":12593,"asi":{"hypothesis":"Residual filter inherited/own accessor length cases might be caused by bytecode property reads returning accessor placeholders rather than invoking getters, so route shaped/map reads through Get accessor semantics.","rollback_reason":"Primary metric stayed flat at 9 and focused filter accessor-length cases still failed; direct probes still read accessor length as [object], so the attempted path did not reach the actual bytecode property access representation.","next_action_hint":"Inspect Object.defineProperty storage and bytecode property-read dispatch for accessor descriptors; do not retry simple Get.get/Put.get_element delegation unchanged."}}
{"run":1318,"commit":"967b7b8","metric":8,"metrics":{"compiler_test262_cases":600,"compiler_test262_pass":592,"compiler_test262_failures":8,"compiler_test262_compiler_errors":0,"compiler_test262_compiler_crashes":0,"compiler_test262_compiler_fails":0,"compiler_test262_both_fail":8,"compiler_test262_interpreter_fail_compiler_pass":0,"compatibility_pass":592,"compatibility_cases":600,"compiler_errors":0,"compiler_crashes":0,"compiler_fails":0,"both_fail":8,"interpreter_fail_compiler_pass":0,"elapsed_ms":26719},"status":"keep","description":"Reject nullish Array fill receivers","timestamp":1778710769700,"segment":90,"confidence":19,"iterationTokens":1685,"asi":{"hypothesis":"Array.prototype.fill must perform ToObject on the receiver and throw TypeError for null/undefined rather than silently returning undefined.","fixed_focus":"Array/prototype/fill/return-abrupt-from-this.js","remaining_failures":"Array 600 now at 8 failures: resizable-buffer fill/copyWithin typed-array cases plus filter inherited/accessor length cases."}}
{"run":1319,"commit":"3e288ae","metric":6,"metrics":{"compiler_test262_cases":600,"compiler_test262_pass":594,"compiler_test262_failures":6,"compiler_test262_compiler_errors":0,"compiler_test262_compiler_crashes":0,"compiler_test262_compiler_fails":0,"compiler_test262_both_fail":6,"compiler_test262_interpreter_fail_compiler_pass":0,"compatibility_pass":594,"compatibility_cases":600,"compiler_errors":0,"compiler_crashes":0,"compiler_fails":0,"both_fail":6,"interpreter_fail_compiler_pass":0,"elapsed_ms":27174},"status":"keep","description":"Fill generic typed-array receivers","timestamp":1778711051829,"segment":90,"confidence":10.5,"iterationTokens":4671,"asi":{"hypothesis":"Array.prototype.fill on typed-array receivers should use live typed-array length/state and write through the typed-array backing store; value coercion can resize the buffer before writes and BigInt object conversion should observe valueOf.","fixed_focus":["Array/prototype/fill/resizable-buffer.js","Array/prototype/fill/typed-array-resize.js"],"remaining_failures":"Array 600 now at 6 failures: copyWithin/resizable-buffer plus filter inherited/accessor length cases."}}
{"run":1320,"commit":"f2f2d70","metric":1,"metrics":{"compiler_test262_cases":600,"compiler_test262_pass":599,"compiler_test262_failures":1,"compiler_test262_compiler_errors":0,"compiler_test262_compiler_crashes":0,"compiler_test262_compiler_fails":0,"compiler_test262_both_fail":1,"compiler_test262_interpreter_fail_compiler_pass":0,"compatibility_pass":599,"compatibility_cases":600,"compiler_errors":0,"compiler_crashes":0,"compiler_fails":0,"both_fail":1,"interpreter_fail_compiler_pass":0,"elapsed_ms":26901},"status":"keep","description":"Honor accessor and inherited lengths","timestamp":1778711329313,"segment":90,"confidence":8.666666666666666,"iterationTokens":3642,"asi":{"hypothesis":"LengthOfArrayLike should observe own accessor length descriptors and inherited length properties through ordinary Get instead of reading raw shape/map length storage or falling back to virtual object lengths.","fixed_focus":["Array/prototype/filter/15.4.4.20-2-6.js","Array/prototype/filter/15.4.4.20-2-7.js","Array/prototype/filter/15.4.4.20-2-8.js","Array/prototype/filter/15.4.4.20-2-9.js","Array/prototype/filter/15.4.4.20-2-10.js"],"remaining_failures":"Array 600 is down to the known copyWithin/resizable-buffer typed-array failure."}}
{"type":"config","name":"Array Test262 compatibility 650-case expansion","metricName":"compatibility_failures","metricUnit":"","bestDirection":"lower"}
{"run":1321,"commit":"cf6d265","metric":1,"metrics":{"compiler_test262_cases":650,"compiler_test262_pass":649,"compiler_test262_failures":1,"compiler_test262_compiler_errors":0,"compiler_test262_compiler_crashes":0,"compiler_test262_compiler_fails":0,"compiler_test262_both_fail":1,"compiler_test262_interpreter_fail_compiler_pass":0,"compatibility_pass":649,"compatibility_cases":650,"compiler_errors":0,"compiler_crashes":0,"compiler_fails":0,"both_fail":1,"interpreter_fail_compiler_pass":0,"elapsed_ms":28312},"status":"keep","description":"Baseline Array 650-case expansion","timestamp":1778711497892,"segment":91,"confidence":null,"iterationTokens":125,"asi":{"hypothesis":"Expand Array workload after the 600-case slice returned to the single copyWithin/resizable-buffer plateau; the next 50 cases may already be covered by generic filter/fill/length fixes.","workload":"AUTORESEARCH_TEST262_CATEGORY=built-ins/Array TEST262_LIMIT=650 TEST262_ERROR_LIMIT=360 ./autoresearch.sh","baseline_note":"Array 650-case expansion still has only the single copyWithin/resizable-buffer failure."}}
{"type":"config","name":"Array Test262 compatibility 700-case expansion","metricName":"compatibility_failures","metricUnit":"","bestDirection":"lower"}
{"run":1322,"commit":"5842d06","metric":2,"metrics":{"compiler_test262_cases":700,"compiler_test262_pass":698,"compiler_test262_failures":2,"compiler_test262_compiler_errors":0,"compiler_test262_compiler_crashes":0,"compiler_test262_compiler_fails":0,"compiler_test262_both_fail":2,"compiler_test262_interpreter_fail_compiler_pass":0,"compatibility_pass":698,"compatibility_cases":700,"compiler_errors":0,"compiler_crashes":0,"compiler_fails":0,"both_fail":2,"interpreter_fail_compiler_pass":0,"elapsed_ms":30055},"status":"keep","description":"Baseline Array 700-case expansion","timestamp":1778711665711,"segment":92,"confidence":null,"iterationTokens":125,"asi":{"hypothesis":"Expand Array workload from 650 to 700 cases to expose the next residual beyond the known copyWithin/resizable-buffer plateau.","workload":"AUTORESEARCH_TEST262_CATEGORY=built-ins/Array TEST262_LIMIT=700 TEST262_ERROR_LIMIT=390 ./autoresearch.sh","baseline_note":"Array 700-case expansion has 2 failures, 698 passes, and no compiler-only failures/errors/crashes."}}
{"type":"config","name":"Array Test262 compatibility 750-case expansion","metricName":"compatibility_failures","metricUnit":"","bestDirection":"lower"}
{"run":1323,"commit":"b8abedc","metric":3,"metrics":{"compiler_test262_cases":750,"compiler_test262_pass":747,"compiler_test262_failures":3,"compiler_test262_compiler_errors":0,"compiler_test262_compiler_crashes":0,"compiler_test262_compiler_fails":0,"compiler_test262_both_fail":3,"compiler_test262_interpreter_fail_compiler_pass":0,"compatibility_pass":747,"compatibility_cases":750,"compiler_errors":0,"compiler_crashes":0,"compiler_fails":0,"both_fail":3,"interpreter_fail_compiler_pass":0,"elapsed_ms":32391},"status":"keep","description":"Baseline Array 750-case expansion","timestamp":1778711883387,"segment":93,"confidence":null,"iterationTokens":125,"asi":{"hypothesis":"Expand Array workload from 700 to 750 cases to see whether the next slice exposes more generic array-method issues beyond the current copyWithin/filter residuals.","workload":"AUTORESEARCH_TEST262_CATEGORY=built-ins/Array TEST262_LIMIT=750 TEST262_ERROR_LIMIT=420 ./autoresearch.sh","baseline_note":"Array 750-case expansion has 3 failures, 747 passes, and no compiler-only failures/errors/crashes."}}
{"run":1324,"commit":"b8abedc","metric":4,"metrics":{"compiler_test262_cases":750,"compiler_test262_pass":746,"compiler_test262_failures":4,"compiler_test262_compiler_errors":0,"compiler_test262_compiler_crashes":0,"compiler_test262_compiler_fails":0,"compiler_test262_both_fail":4,"compiler_test262_interpreter_fail_compiler_pass":0,"compatibility_pass":746,"compatibility_cases":750,"compiler_errors":0,"compiler_crashes":0,"compiler_fails":0,"both_fail":4,"interpreter_fail_compiler_pass":0,"elapsed_ms":32598},"status":"discard","description":"Preserve undefined filter result elements","timestamp":1778712315948,"segment":93,"confidence":null,"iterationTokens":16269,"asi":{"hypothesis":"The residual filter setter-only accessor case may require preserving explicit undefined elements in filter results and treating getterless array accessors as own undefined values.","rollback_reason":"Primary regressed from 3 to 4 and focused setter-only array accessor case still failed; the attempted result-marking did not address the actual failure path and introduced an extra failure.","next_action_hint":"Inspect ArrayExotic.define_own_property/Heap.get_array_prop for numeric accessor properties on arrays; do not retry result-presence marking without first making arr[0] getterless own accessor shadow Array.prototype[0] during Get."}}
{"type":"config","name":"Array Test262 compatibility 800-case expansion","metricName":"compatibility_failures","metricUnit":"","bestDirection":"lower"}
{"run":1325,"commit":"a5e69d6","metric":9,"metrics":{"compiler_test262_cases":800,"compiler_test262_pass":791,"compiler_test262_failures":9,"compiler_test262_compiler_errors":0,"compiler_test262_compiler_crashes":0,"compiler_test262_compiler_fails":0,"compiler_test262_both_fail":9,"compiler_test262_interpreter_fail_compiler_pass":0,"compatibility_pass":791,"compatibility_cases":800,"compiler_errors":0,"compiler_crashes":0,"compiler_fails":0,"both_fail":9,"interpreter_fail_compiler_pass":0,"elapsed_ms":35966},"status":"keep","description":"Baseline Array 800-case expansion","timestamp":1778712493765,"segment":94,"confidence":null,"iterationTokens":125,"asi":{"hypothesis":"Expand Array workload from 750 to 800 cases to expose the next generic array-method clusters after the 750 slice reached three residuals.","workload":"AUTORESEARCH_TEST262_CATEGORY=built-ins/Array TEST262_LIMIT=800 TEST262_ERROR_LIMIT=450 ./autoresearch.sh","baseline_note":"Array 800-case expansion has 9 failures, 791 passes, and no compiler-only failures/errors/crashes."}}
