{"run":1721,"commit":"204a280","metric":79,"metrics":{"compiler_test262_cases":296,"compiler_test262_pass":217,"compiler_test262_failures":79,"compiler_test262_compiler_errors":0,"compiler_test262_compiler_crashes":0,"compiler_test262_compiler_fails":0,"compiler_test262_both_fail":76,"compiler_test262_interpreter_fail_compiler_pass":0,"compatibility_pass":217,"compatibility_cases":296,"compiler_errors":0,"compiler_crashes":0,"compiler_fails":0,"both_fail":76,"interpreter_fail_compiler_pass":0,"elapsed_ms":14745},"status":"keep","description":"Observe Promise combinator resolve calls","timestamp":1778870126323,"segment":174,"confidence":4.689655172413793,"iterationTokens":5992,"asi":{"hypothesis":"Promise combinators must invoke the receiver constructor's resolve method once per iterated value with the constructor as this; doing this observational step before the existing simplified combinator result should clear invoke-resolve tests without adopting the previously regressing full this.resolve routing.","result":"Promise failures improved from 83 to 79; checks passed.","remaining":"The returned promises from constructor.resolve are still not used for true PerformPromiseAll/Any/Race semantics, so thenable and iterator-closing cases remain."}}
{"run":1722,"commit":"02ae51a","metric":75,"metrics":{"compiler_test262_cases":296,"compiler_test262_pass":221,"compiler_test262_failures":75,"compiler_test262_compiler_errors":0,"compiler_test262_compiler_crashes":0,"compiler_test262_compiler_fails":0,"compiler_test262_both_fail":72,"compiler_test262_interpreter_fail_compiler_pass":0,"compatibility_pass":221,"compatibility_cases":296,"compiler_errors":0,"compiler_crashes":0,"compiler_fails":0,"both_fail":72,"interpreter_fail_compiler_pass":0,"elapsed_ms":14874},"status":"keep","description":"Use Promise combinator resolve results","timestamp":1778870311596,"segment":174,"confidence":4.5,"iterationTokens":2213,"asi":{"hypothesis":"After observing constructor.resolve for Promise combinators, the combinator input list should use the returned promises/thenables rather than the raw iterated values, matching PerformPromiseAll's nextPromise step more closely.","result":"Promise failures improved from 79 to 75; checks passed.","remaining":"Then invocation is still not fully observable for pending/thenable cases, and iterator-closing/error ordering remains incomplete."}}
{"run":1723,"commit":"d1dd6fe","metric":72,"metrics":{"compiler_test262_cases":296,"compiler_test262_pass":224,"compiler_test262_failures":72,"compiler_test262_compiler_errors":0,"compiler_test262_compiler_crashes":0,"compiler_test262_compiler_fails":0,"compiler_test262_both_fail":69,"compiler_test262_interpreter_fail_compiler_pass":0,"compatibility_pass":224,"compatibility_cases":296,"compiler_errors":0,"compiler_crashes":0,"compiler_fails":0,"both_fail":69,"interpreter_fail_compiler_pass":0,"elapsed_ms":14943},"status":"keep","description":"Invoke Promise combinator input then methods","timestamp":1778870498830,"segment":174,"confidence":6,"iterationTokens":2572,"asi":{"hypothesis":"PerformPromiseAll/Any/Race invokes then on each resolved nextPromise with resolving element functions; adding an observable then invocation step should clear invoke-then clusters while preserving the existing simplified settlement result.","result":"Promise failures improved from 75 to 72; checks passed.","remaining":"Iterator closing and rejection/resolve element state are still simplified; then-error-close and same-thenable cases remain."}}
{"run":1724,"commit":"61bcba8","metric":68,"metrics":{"compiler_test262_cases":296,"compiler_test262_pass":228,"compiler_test262_failures":68,"compiler_test262_compiler_errors":0,"compiler_test262_compiler_crashes":0,"compiler_test262_compiler_fails":0,"compiler_test262_both_fail":65,"compiler_test262_interpreter_fail_compiler_pass":0,"compatibility_pass":228,"compatibility_cases":296,"compiler_errors":0,"compiler_crashes":0,"compiler_fails":0,"both_fail":65,"interpreter_fail_compiler_pass":0,"elapsed_ms":14698},"status":"keep","description":"Name promise resolving element functions","timestamp":1778870729033,"segment":174,"confidence":6.583333333333333,"iterationTokens":3785,"asi":{"hypothesis":"Thenable adoption and combinator resolve/reject element callbacks should be anonymous built-in functions with length 1/name empty descriptors; reusing the existing anonymous finalizer wrapper should clear propertyHelper metadata cases.","result":"Promise failures improved from 72 to 68; checks passed.","remaining":"Capability executor ordering/called-twice, iterator closing on abrupt resolve/then, same-thenable behavior, and subclass constructor identity remain."}}
{"run":1725,"commit":"65daba9","metric":67,"metrics":{"compiler_test262_cases":296,"compiler_test262_pass":229,"compiler_test262_failures":67,"compiler_test262_compiler_errors":0,"compiler_test262_compiler_crashes":0,"compiler_test262_compiler_fails":0,"compiler_test262_both_fail":59,"compiler_test262_interpreter_fail_compiler_pass":0,"compatibility_pass":229,"compatibility_cases":296,"compiler_errors":0,"compiler_crashes":0,"compiler_fails":0,"both_fail":59,"interpreter_fail_compiler_pass":0,"elapsed_ms":15448},"status":"keep","description":"Close Promise combinator iterators on abrupt steps","timestamp":1778871094282,"segment":174,"confidence":6.666666666666667,"iterationTokens":45056,"asi":{"hypothesis":"Promise combinators should consume iterable protocol values directly and close the iterator when constructor.resolve or the resolved promise's then step abruptly completes, rather than using array-like Heap.to_list materialization.","result":"Promise failures improved from 68 to 67; checks passed. Focused resolve/then abrupt-close cases now pass.","remaining":"Some broad failures shifted from shared to compiler-only; residual includes capability executor ordering, same-thenable behavior, and subclass/newTarget identity."}}
{"run":1726,"commit":"37da688","metric":49,"metrics":{"compiler_test262_cases":296,"compiler_test262_pass":247,"compiler_test262_failures":49,"compiler_test262_compiler_errors":0,"compiler_test262_compiler_crashes":0,"compiler_test262_compiler_fails":0,"compiler_test262_both_fail":46,"compiler_test262_interpreter_fail_compiler_pass":0,"compatibility_pass":247,"compatibility_cases":296,"compiler_errors":0,"compiler_crashes":0,"compiler_fails":0,"both_fail":46,"interpreter_fail_compiler_pass":0,"elapsed_ms":15300},"status":"keep","description":"Adopt Promise combinator resolve outputs","timestamp":1778871373232,"segment":174,"confidence":7.538461538461538,"iterationTokens":4318,"asi":{"hypothesis":"Promise combinators should adopt the result of constructor.resolve before applying the combinator result logic; this lets thenables settle resolve-element functions instead of treating them as plain fulfilled objects.","result":"Promise failures improved from 67 to 49; checks passed. Focused Promise.all/allSettled resolve-element double-call tests now pass.","remaining":"Same-thenable/race behavior and capability/subclass/newTarget clusters remain; ensure future changes do not reintroduce duplicate then calls."}}
{"run":1727,"commit":"0899fd1","metric":48,"metrics":{"compiler_test262_cases":296,"compiler_test262_pass":248,"compiler_test262_failures":48,"compiler_test262_compiler_errors":0,"compiler_test262_compiler_crashes":0,"compiler_test262_compiler_fails":0,"compiler_test262_both_fail":45,"compiler_test262_interpreter_fail_compiler_pass":0,"compatibility_pass":248,"compatibility_cases":296,"compiler_errors":0,"compiler_crashes":0,"compiler_fails":0,"both_fail":45,"interpreter_fail_compiler_pass":0,"elapsed_ms":15223},"status":"keep","description":"Pass non-callable Promise finally handlers through","timestamp":1778871579939,"segment":174,"confidence":7.071428571428571,"iterationTokens":2754,"asi":{"hypothesis":"Promise.prototype.finally should only synthesize onFinally handlers when the argument is callable; non-callable values are forwarded directly to then for both fulfillment and rejection positions.","result":"Promise failures improved from 49 to 48; checks passed.","remaining":"Capability executor, same-thenable, subclass/newTarget, and iterator return non-callable cases remain."}}
{"run":1728,"commit":"8bd6cf3","metric":44,"metrics":{"compiler_test262_cases":296,"compiler_test262_pass":252,"compiler_test262_failures":44,"compiler_test262_compiler_errors":0,"compiler_test262_compiler_crashes":0,"compiler_test262_compiler_fails":0,"compiler_test262_both_fail":41,"compiler_test262_interpreter_fail_compiler_pass":0,"compatibility_pass":252,"compatibility_cases":296,"compiler_errors":0,"compiler_crashes":0,"compiler_fails":0,"both_fail":41,"interpreter_fail_compiler_pass":0,"elapsed_ms":16365},"status":"keep","description":"Preserve Promise iterator close abrupt reasons","timestamp":1778871773449,"segment":174,"confidence":6.866666666666666,"iterationTokens":2772,"asi":{"hypothesis":"When Promise combinator iteration has already hit an abrupt completion, IteratorClose should not replace that original throw with a non-callable return-method TypeError; preserving the original reason should clear return-is-not-callable close cases.","result":"Promise failures improved from 48 to 44; checks passed.","remaining":"Residual Promise failures are mostly capability executor ordering/called-twice, subclass/newTarget ctx-ctor identity, and same-thenable race/all/any behavior."}}
{"run":1729,"commit":"2434b04","metric":32,"metrics":{"compiler_test262_cases":296,"compiler_test262_pass":264,"compiler_test262_failures":32,"compiler_test262_compiler_errors":0,"compiler_test262_compiler_crashes":0,"compiler_test262_compiler_fails":0,"compiler_test262_both_fail":29,"compiler_test262_interpreter_fail_compiler_pass":0,"compatibility_pass":264,"compatibility_cases":296,"compiler_errors":0,"compiler_crashes":0,"compiler_fails":0,"both_fail":29,"interpreter_fail_compiler_pass":0,"elapsed_ms":15565},"status":"keep","description":"Store Promise capability executor state exactly","timestamp":1778872073414,"segment":174,"confidence":7.419354838709677,"iterationTokens":7465,"asi":{"hypothesis":"NewPromiseCapability executor functions should record raw resolve/reject slots and validate callability only after construction, allowing initial undefined calls but rejecting later calls once either slot is non-undefined.","result":"Promise failures improved from 44 to 32; checks passed. Static combinator/resolve/reject capability-executor clusters now pass focused cases.","remaining":"Prototype.then capability cases still need complete species/custom constructor capability wiring; same-thenable and ctx-ctor/newTarget identity clusters remain."}}
{"run":1730,"commit":"664bfb5","metric":29,"metrics":{"compiler_test262_cases":296,"compiler_test262_pass":267,"compiler_test262_failures":29,"compiler_test262_compiler_errors":0,"compiler_test262_compiler_crashes":0,"compiler_test262_compiler_fails":0,"compiler_test262_both_fail":26,"compiler_test262_interpreter_fail_compiler_pass":0,"compatibility_pass":267,"compatibility_cases":296,"compiler_errors":0,"compiler_crashes":0,"compiler_fails":0,"both_fail":26,"interpreter_fail_compiler_pass":0,"elapsed_ms":16503},"status":"keep","description":"Reject Promise capability resolve abrupts","timestamp":1778875099300,"segment":174,"confidence":7.375,"iterationTokens":7465,"asi":{"hypothesis":"If a Promise combinator result capability's resolve function throws after iteration is complete, the combinator should reject through the capability rather than closing an already-done iterator or propagating the throw.","result":"Promise failures improved from 32 to 29; checks passed. Focused capability-resolve-throws-no-close cases now pass.","remaining":"Residual Promise failures are mainly prototype.then custom species capability wiring, same-thenable/race behavior, and subclass/newTarget ctx-ctor identity."}}
{"run":1731,"commit":"83436ef","metric":27,"metrics":{"compiler_test262_cases":296,"compiler_test262_pass":269,"compiler_test262_failures":27,"compiler_test262_compiler_errors":0,"compiler_test262_compiler_crashes":0,"compiler_test262_compiler_fails":0,"compiler_test262_both_fail":24,"compiler_test262_interpreter_fail_compiler_pass":0,"compatibility_pass":269,"compatibility_cases":296,"compiler_errors":0,"compiler_crashes":0,"compiler_fails":0,"both_fail":24,"interpreter_fail_compiler_pass":0,"elapsed_ms":16347},"status":"keep","description":"Use Promise prototype methods for instances","timestamp":1778875462153,"segment":174,"confidence":5.1063829787234045,"iterationTokens":7465,"asi":{"hypothesis":"Promise instances should not carry own then/catch closures; storing state slots and relying on Promise.prototype lets prototype overrides and proxy forwarding observe then/finally correctly.","result":"Promise failures improved from 29 to 27; checks passed. Focused Promise.prototype.finally proxy and existing then/combinator focused probes pass.","remaining":"Same-thenable/race behavior, ctx-ctor/subclass newTarget identity, and prototype.then custom species capability wiring remain."}}
{"run":1732,"commit":"83436ef","metric":27,"metrics":{"compiler_test262_cases":296,"compiler_test262_pass":269,"compiler_test262_failures":27,"compiler_test262_compiler_errors":0,"compiler_test262_compiler_crashes":0,"compiler_test262_compiler_fails":0,"compiler_test262_both_fail":24,"compiler_test262_interpreter_fail_compiler_pass":0,"compatibility_pass":269,"compatibility_cases":296,"compiler_errors":0,"compiler_crashes":0,"compiler_fails":0,"both_fail":24,"interpreter_fail_compiler_pass":0,"elapsed_ms":16964},"status":"discard","description":"Retry Promise constructor receiver reuse after prototype methods","timestamp":1778875694376,"segment":174,"confidence":4,"iterationTokens":2786,"asi":{"hypothesis":"Now that Promise instances use prototype methods, populating the preallocated constructor receiver might begin fixing subclass ctx-ctor and species capability cases without previous side effects.","rollback_reason":"Primary metric stayed at 27 and focused ctx-ctor/prototype.then species cases still failed; the issue is not just Promise constructor map population.","next_action_hint":"Inspect derived class constructor/super construction and Function/Class coalescing/newTarget behavior before retrying receiver reuse."}}
{"run":1733,"commit":"83436ef","metric":27,"metrics":{"compiler_test262_cases":296,"compiler_test262_pass":269,"compiler_test262_failures":27,"compiler_test262_compiler_errors":0,"compiler_test262_compiler_crashes":0,"compiler_test262_compiler_fails":0,"compiler_test262_both_fail":24,"compiler_test262_interpreter_fail_compiler_pass":0,"compatibility_pass":269,"compatibility_cases":296,"compiler_errors":0,"compiler_crashes":0,"compiler_fails":0,"both_fail":24,"interpreter_fail_compiler_pass":0,"elapsed_ms":17498},"status":"discard","description":"Attach async Promise combinator settlement state","timestamp":1778875990823,"segment":174,"confidence":4.2105263157894735,"iterationTokens":5685,"asi":{"hypothesis":"For pending inputs, Promise.all/allSettled/any/race should keep shared remaining/count state and settle a result promise when input reactions later fire, which might fix same-thenable and resolve-before-loop-exit cases.","rollback_reason":"Primary metric stayed at 27 and focused same-thenable cases still failed; current architecture adopts thenables before combinator resolve-element functions, so the externally captured callbacks are adoption callbacks rather than combinator element callbacks.","next_action_hint":"Implement PerformPromiseAll-style direct nextPromise.then(resolveElement, rejectElement) per combinator rather than layering post-hoc state on adopted inputs."}}
{"run":1734,"commit":"b34a354","metric":26,"metrics":{"compiler_test262_cases":296,"compiler_test262_pass":270,"compiler_test262_failures":26,"compiler_test262_compiler_errors":0,"compiler_test262_compiler_crashes":0,"compiler_test262_compiler_fails":0,"compiler_test262_both_fail":23,"compiler_test262_interpreter_fail_compiler_pass":0,"compatibility_pass":270,"compatibility_cases":296,"compiler_errors":0,"compiler_crashes":0,"compiler_fails":0,"both_fail":23,"interpreter_fail_compiler_pass":0,"elapsed_ms":16491},"status":"keep","description":"Reject direct Promise constructor calls","timestamp":1778876252787,"segment":174,"confidence":4.481481481481482,"iterationTokens":5426,"asi":{"hypothesis":"Promise is constructable but not callable, matching other constructor-only built-ins; adding it to builtin direct-call rejection should fix undefined-newtarget without affecting construct_runtime calls used by NewPromiseCapability.","result":"Promise failures improved from 27 to 26; checks passed.","remaining":"Residual clusters are same-thenable combinator behavior, ctx-ctor/subclass newTarget identity, and prototype.then custom species capability wiring."}}
{"run":1735,"commit":"cfcae71","metric":25,"metrics":{"compiler_test262_cases":296,"compiler_test262_pass":271,"compiler_test262_failures":25,"compiler_test262_compiler_errors":0,"compiler_test262_compiler_crashes":0,"compiler_test262_compiler_fails":0,"compiler_test262_both_fail":22,"compiler_test262_interpreter_fail_compiler_pass":0,"compatibility_pass":271,"compatibility_cases":296,"compiler_errors":0,"compiler_crashes":0,"compiler_fails":0,"both_fail":22,"interpreter_fail_compiler_pass":0,"elapsed_ms":16499},"status":"keep","description":"Respect Promise.resolve constructor identity","timestamp":1778876497902,"segment":174,"confidence":4.4363636363636365,"iterationTokens":2647,"asi":{"hypothesis":"Promise.resolve should return an existing promise only when its constructor property is SameValue with the receiver constructor; a Promise instance with a different/null constructor should produce a distinct promise.","result":"Promise failures improved from 26 to 25; checks passed.","remaining":"ctx-ctor subclass identity, prototype.then custom species capability wiring, same-thenable combinator behavior, and realm prototype residuals remain."}}
{"run":1736,"commit":"194844c","metric":24,"metrics":{"compiler_test262_cases":296,"compiler_test262_pass":272,"compiler_test262_failures":24,"compiler_test262_compiler_errors":0,"compiler_test262_compiler_crashes":0,"compiler_test262_compiler_fails":0,"compiler_test262_both_fail":21,"compiler_test262_interpreter_fail_compiler_pass":0,"compatibility_pass":272,"compatibility_cases":296,"compiler_errors":0,"compiler_crashes":0,"compiler_fails":0,"both_fail":21,"interpreter_fail_compiler_pass":0,"elapsed_ms":16975},"status":"keep","description":"Validate Promise executor before prototype lookup","timestamp":1778876731356,"segment":174,"confidence":4.392857142857143,"iterationTokens":2268,"asi":{"hypothesis":"Promise construction must check executor callability before GetPrototypeFromConstructor reads newTarget.prototype; prevalidating constructor args should preserve TypeError priority over abrupt prototype getters.","result":"Promise failures improved from 25 to 24; checks passed.","remaining":"Remaining failures are concentrated in ctx-ctor/subclass newTarget identity, prototype.then custom species capability, same-thenable combinator behavior, and one realm prototype case."}}
{"run":1737,"commit":"194844c","metric":24,"metrics":{"compiler_test262_cases":296,"compiler_test262_pass":272,"compiler_test262_failures":24,"compiler_test262_compiler_errors":0,"compiler_test262_compiler_crashes":0,"compiler_test262_compiler_fails":0,"compiler_test262_both_fail":21,"compiler_test262_interpreter_fail_compiler_pass":0,"compatibility_pass":272,"compatibility_cases":296,"compiler_errors":0,"compiler_crashes":0,"compiler_fails":0,"both_fail":21,"interpreter_fail_compiler_pass":0,"elapsed_ms":17120},"status":"discard","description":"Add Promise realm intrinsic prototype","timestamp":1778877381207,"segment":174,"confidence":3.84375,"iterationTokens":13229,"asi":{"hypothesis":"Test262 realm support lacks Promise intrinsics, so adding a realm Promise constructor/prototype and Promise realm fallback may fix proto-from-ctor-realm.","rollback_reason":"Primary metric stayed at 24 and the focused proto-from-ctor-realm case still used the global Promise prototype; realm Function/newTarget metadata does not carry the new Promise intrinsic through this path.","next_action_hint":"Inspect realm Function-created constructor metadata/GetFunctionRealm rather than only adding Promise to the realm intrinsic map."}}
{"run":1738,"commit":"8a69c5f","metric":22,"metrics":{"compiler_test262_cases":296,"compiler_test262_pass":274,"compiler_test262_failures":22,"compiler_test262_compiler_errors":0,"compiler_test262_compiler_crashes":0,"compiler_test262_compiler_fails":0,"compiler_test262_both_fail":19,"compiler_test262_interpreter_fail_compiler_pass":0,"compatibility_pass":274,"compatibility_cases":296,"compiler_errors":0,"compiler_crashes":0,"compiler_fails":0,"both_fail":19,"interpreter_fail_compiler_pass":0,"elapsed_ms":17425},"status":"keep","description":"Preserve Promise construction receiver prototype","timestamp":1778877776307,"segment":174,"confidence":3.4722222222222223,"iterationTokens":17962,"asi":{"hypothesis":"Promise constructors used through NewPromiseCapability should populate the preallocated construction receiver but must preserve its existing newTarget prototype rather than overwriting it with Promise.prototype.","result":"Promise failures improved from 24 to 22; checks passed. Focused withResolvers ctx-ctor now passes; other subclass ctx-ctor paths still need deeper derived-constructor/newTarget handling.","remaining":"Static resolve/reject/all/try ctx-ctor still fail, as do prototype.then custom species and same-thenable combinator cases."}}
