{"run":1149,"commit":"82d384a","metric":15,"metrics":{"compiler_test262_cases":594,"compiler_test262_pass":579,"compiler_test262_failures":15,"compiler_test262_compiler_errors":0,"compiler_test262_compiler_crashes":0,"compiler_test262_compiler_fails":0,"compiler_test262_both_fail":15,"compiler_test262_interpreter_fail_compiler_pass":0,"compatibility_pass":579,"compatibility_cases":594,"compiler_errors":0,"compiler_crashes":0,"compiler_fails":0,"both_fail":15,"interpreter_fail_compiler_pass":0,"elapsed_ms":24994},"status":"keep","description":"Clip numeric Date constructor values","timestamp":1778653192817,"segment":55,"confidence":3.7,"iterationTokens":32778,"asi":{"hypothesis":"The one-argument numeric Date constructor should apply TimeClip and store NaN for values outside ±8.64e15 so toISOString throws RangeError for invalid Dates.","focused_cases":["built-ins/Date/prototype/toISOString/15.9.5.43-0-13.js"],"focused_result":"Focused out-of-range numeric Date constructor toISOString case passes in interpreter/compiler; compiler/vm core checks and autoresearch backpressure checks pass."}}
{"run":1150,"commit":"bc92166","metric":14,"metrics":{"compiler_test262_cases":594,"compiler_test262_pass":580,"compiler_test262_failures":14,"compiler_test262_compiler_errors":0,"compiler_test262_compiler_crashes":0,"compiler_test262_compiler_fails":0,"compiler_test262_both_fail":14,"compiler_test262_interpreter_fail_compiler_pass":0,"compatibility_pass":580,"compatibility_cases":594,"compiler_errors":0,"compiler_crashes":0,"compiler_fails":0,"both_fail":14,"interpreter_fail_compiler_pass":0,"elapsed_ms":24872},"status":"keep","description":"Parse UTC date strings","timestamp":1778653416779,"segment":55,"confidence":3.1666666666666665,"iterationTokens":5018,"asi":{"hypothesis":"Date.parse should accept the UTC string format emitted by Date.prototype.toUTCString, which uses day-month-year order after the weekday prefix.","focused_cases":["built-ins/Date/parse/zero.js"],"focused_result":"Focused zero Date parse roundtrip passes in interpreter/compiler; compiler/vm core checks and autoresearch backpressure checks pass."}}
{"run":1151,"commit":"7370e3d","metric":10,"metrics":{"compiler_test262_cases":594,"compiler_test262_pass":584,"compiler_test262_failures":10,"compiler_test262_compiler_errors":0,"compiler_test262_compiler_crashes":0,"compiler_test262_compiler_fails":0,"compiler_test262_both_fail":10,"compiler_test262_interpreter_fail_compiler_pass":0,"compatibility_pass":584,"compatibility_cases":594,"compiler_errors":0,"compiler_crashes":0,"compiler_fails":0,"both_fail":10,"interpreter_fail_compiler_pass":0,"elapsed_ms":24973},"status":"keep","description":"Clip local Date boundary values","timestamp":1778653705365,"segment":55,"confidence":3.36,"iterationTokens":9556,"asi":{"hypothesis":"Date component construction should apply local-time offset before TimeClip at the valid-time boundary; doing this narrowly for near-boundary component values fixes toISOString range cases without changing ordinary local constructor behavior.","focused_cases":["built-ins/Date/prototype/toISOString/15.9.5.43-0-9.js","built-ins/Date/prototype/toISOString/15.9.5.43-0-10.js","built-ins/Date/prototype/toISOString/15.9.5.43-0-11.js","built-ins/Date/prototype/toISOString/15.9.5.43-0-12.js"],"focused_result":"Focused near-boundary local Date toISOString cases pass in interpreter/compiler; compiler/vm core checks and autoresearch backpressure checks pass."}}
{"type":"config","name":"QuickBEAM Number Test262 compatibility rebaseline","metricName":"compatibility_failures","metricUnit":"","bestDirection":"lower"}
{"run":1152,"commit":"cffae2e","metric":156,"metrics":{"compiler_test262_cases":340,"compiler_test262_pass":184,"compiler_test262_failures":156,"compiler_test262_compiler_errors":0,"compiler_test262_compiler_crashes":0,"compiler_test262_compiler_fails":0,"compiler_test262_both_fail":149,"compiler_test262_interpreter_fail_compiler_pass":2,"compatibility_pass":184,"compatibility_cases":340,"compiler_errors":0,"compiler_crashes":0,"compiler_fails":0,"both_fail":149,"interpreter_fail_compiler_pass":2,"elapsed_ms":21009},"status":"keep","description":"Rebaseline Number workload after Date work","timestamp":1778653920911,"segment":56,"confidence":null,"iterationTokens":126,"asi":{"hypothesis":"Rebaseline the bounded built-ins/Number workload after recent global, realm, Function, and Date compatibility fixes before choosing the next optimization target.","focused_result":"Number bounded workload baseline is 156/340 with no compiler errors/crashes/fails; autoresearch backpressure checks pass."}}
{"run":1153,"commit":"8e5931e","metric":152,"metrics":{"compiler_test262_cases":340,"compiler_test262_pass":188,"compiler_test262_failures":152,"compiler_test262_compiler_errors":0,"compiler_test262_compiler_crashes":0,"compiler_test262_compiler_fails":0,"compiler_test262_both_fail":149,"compiler_test262_interpreter_fail_compiler_pass":2,"compatibility_pass":188,"compatibility_cases":340,"compiler_errors":0,"compiler_crashes":0,"compiler_fails":0,"both_fail":149,"interpreter_fail_compiler_pass":2,"elapsed_ms":22109},"status":"keep","description":"Handle missing Number predicate arguments","timestamp":1778654128274,"segment":56,"confidence":null,"iterationTokens":18402,"asi":{"hypothesis":"Number.isNaN/isFinite/isInteger/isSafeInteger should treat missing arguments as undefined instead of crashing on hd([]), returning false for non-number inputs.","focused_cases":["built-ins/Number/isNaN/arg-is-not-number.js","built-ins/Number/isFinite/arg-is-not-number.js","built-ins/Number/isInteger/arg-is-not-number.js","built-ins/Number/isSafeInteger/arg-is-not-number.js"],"focused_result":"Focused predicate missing/non-number argument cases pass in interpreter/compiler; compiler/vm core checks and autoresearch backpressure checks pass."}}
{"run":1154,"commit":"bb6b636","metric":94,"metrics":{"compiler_test262_cases":340,"compiler_test262_pass":246,"compiler_test262_failures":94,"compiler_test262_compiler_errors":0,"compiler_test262_compiler_crashes":0,"compiler_test262_compiler_fails":0,"compiler_test262_both_fail":91,"compiler_test262_interpreter_fail_compiler_pass":2,"compatibility_pass":246,"compatibility_cases":340,"compiler_errors":0,"compiler_crashes":0,"compiler_fails":0,"both_fail":91,"interpreter_fail_compiler_pass":2,"elapsed_ms":20229},"status":"keep","description":"Materialize Number prototype metadata","timestamp":1778654486440,"segment":56,"confidence":15.5,"iterationTokens":12306,"asi":{"hypothesis":"Number constructor constants need non-writable/non-configurable descriptors, Number.prototype needs the boxed numeric value 0, Object.prototype parent, and a non-writable/non-configurable constructor prototype descriptor.","focused_cases":["built-ins/Number/EPSILON.js","built-ins/Number/MAX_VALUE/S15.7.3.2_A2.js","built-ins/Number/prototype/prop-desc.js","built-ins/Number/prototype/S15.7.3.1_A3.js","built-ins/Number/prototype/S15.7.4_A2.js","built-ins/Number/15.7.4-1.js"],"focused_result":"Representative Number constant descriptor and Number.prototype boxed-value/prototype-chain cases pass; compiler/vm core checks and autoresearch backpressure checks pass."}}
{"run":1155,"commit":"246389d","metric":54,"metrics":{"compiler_test262_cases":340,"compiler_test262_pass":286,"compiler_test262_failures":54,"compiler_test262_compiler_errors":0,"compiler_test262_compiler_crashes":0,"compiler_test262_compiler_fails":0,"compiler_test262_both_fail":51,"compiler_test262_interpreter_fail_compiler_pass":2,"compatibility_pass":286,"compatibility_cases":340,"compiler_errors":0,"compiler_crashes":0,"compiler_fails":0,"both_fail":51,"interpreter_fail_compiler_pass":2,"elapsed_ms":20670},"status":"keep","description":"Expose Number methods on NaN and infinities","timestamp":1778654701853,"segment":56,"confidence":3.2903225806451615,"iterationTokens":15763,"asi":{"hypothesis":"NaN and ±Infinity are numeric primitive values and should fall through to Number.prototype methods for property reads, like ordinary numeric primitives.","focused_cases":["built-ins/Number/prototype/toString/numeric-literal-tostring-default-radix.js","built-ins/Number/prototype/toExponential/nan.js","built-ins/Number/prototype/toExponential/infinity.js"],"focused_result":"NaN/Infinity toString/toExponential focused cases pass; compiler/vm core checks and autoresearch backpressure checks pass."}}
{"run":1156,"commit":"195af9a","metric":50,"metrics":{"compiler_test262_cases":340,"compiler_test262_pass":290,"compiler_test262_failures":50,"compiler_test262_compiler_errors":0,"compiler_test262_compiler_crashes":0,"compiler_test262_compiler_fails":0,"compiler_test262_both_fail":47,"compiler_test262_interpreter_fail_compiler_pass":2,"compatibility_pass":290,"compatibility_cases":340,"compiler_errors":0,"compiler_crashes":0,"compiler_fails":0,"both_fail":47,"interpreter_fail_compiler_pass":2,"elapsed_ms":21174},"status":"keep","description":"Describe Number prototype method lengths","timestamp":1778654927916,"segment":56,"confidence":2.409090909090909,"iterationTokens":11662,"asi":{"hypothesis":"Number prototype methods need spec length metadata and non-writable/non-enumerable/configurable length descriptors, especially toString/toFixed/toExponential/toPrecision length 1.","focused_cases":["built-ins/Number/prototype/toString/length.js","built-ins/Number/prototype/toFixed/length.js","built-ins/Number/prototype/toExponential/length.js","built-ins/Number/prototype/toPrecision/length.js"],"focused_result":"Focused Number prototype length descriptor cases pass; compiler/vm core checks and autoresearch backpressure checks pass."}}
{"run":1157,"commit":"fd18b66","metric":39,"metrics":{"compiler_test262_cases":340,"compiler_test262_pass":301,"compiler_test262_failures":39,"compiler_test262_compiler_errors":0,"compiler_test262_compiler_crashes":0,"compiler_test262_compiler_fails":0,"compiler_test262_both_fail":32,"compiler_test262_interpreter_fail_compiler_pass":6,"compatibility_pass":301,"compatibility_cases":340,"compiler_errors":0,"compiler_crashes":0,"compiler_fails":0,"both_fail":32,"interpreter_fail_compiler_pass":6,"elapsed_ms":20615},"status":"keep","description":"Validate Number method receivers","timestamp":1778655257390,"segment":56,"confidence":3.9661016949152543,"iterationTokens":2611,"asi":{"hypothesis":"Number prototype methods should accept number primitives/boxed Number objects (including NaN and infinities) and throw TypeError for incompatible receivers instead of treating them as NaN.","focused_cases":["built-ins/Number/prototype/toExponential/this-type-not-number-or-number-object.js","built-ins/Number/prototype/toPrecision/this-type-not-number-or-number-object.js","built-ins/Number/prototype/valueOf/S15.7.4.4_A2_T01.js","built-ins/Number/prototype/toString/S15.7.4.2_A4_T01.js"],"focused_result":"toExponential/toPrecision incompatible receiver focused cases pass; valueOf/toString legacy instanceof checks still fail due error realm/prototype identity, but broad metric improves; compiler/vm core checks and autoresearch backpressure checks pass.","remaining_caveat":"interpreter_fail_compiler_pass rose from 2 to 6, but primary failures improved significantly and no compiler-only failures/crashes/errors were introduced."}}
{"run":1158,"commit":"34677c3","metric":36,"metrics":{"compiler_test262_cases":340,"compiler_test262_pass":304,"compiler_test262_failures":36,"compiler_test262_compiler_errors":0,"compiler_test262_compiler_crashes":0,"compiler_test262_compiler_fails":0,"compiler_test262_both_fail":29,"compiler_test262_interpreter_fail_compiler_pass":6,"compatibility_pass":304,"compatibility_cases":340,"compiler_errors":0,"compiler_crashes":0,"compiler_fails":0,"both_fail":29,"interpreter_fail_compiler_pass":6,"elapsed_ms":20333},"status":"keep","description":"Parse JS decimal numeric strings","timestamp":1778655558564,"segment":56,"confidence":6.666666666666667,"iterationTokens":23438,"asi":{"hypothesis":"ToNumber string parsing should accept JS decimal forms with leading or trailing decimal points before exponents, and Infinity must match exactly rather than as a prefix so U+180E suffixes produce NaN.","focused_cases":["built-ins/Number/S9.3.1_A11.js","built-ins/Number/S9.3.1_A8.js","built-ins/Number/S9.3.1_A3_T2_U180E.js"],"focused_result":"Focused JS decimal grammar and U+180E non-whitespace numeric parsing cases pass in interpreter/compiler; compiler/vm core checks and autoresearch backpressure checks pass."}}
{"run":1159,"commit":"fc22a9c","metric":35,"metrics":{"compiler_test262_cases":340,"compiler_test262_pass":305,"compiler_test262_failures":35,"compiler_test262_compiler_errors":0,"compiler_test262_compiler_crashes":0,"compiler_test262_compiler_fails":0,"compiler_test262_both_fail":28,"compiler_test262_interpreter_fail_compiler_pass":6,"compatibility_pass":305,"compatibility_cases":340,"compiler_errors":0,"compiler_crashes":0,"compiler_fails":0,"both_fail":28,"interpreter_fail_compiler_pass":6,"elapsed_ms":21102},"status":"keep","description":"Round BigInt Number conversions","timestamp":1778656287492,"segment":56,"confidence":7.333333333333333,"iterationTokens":18351,"asi":{"hypothesis":"Number(BigInt) should convert through IEEE-754 Number semantics, preserving safe integers and rounding larger BigInts to the nearest representable double.","focused_cases":["built-ins/Number/bigint-conversion.js"],"focused_result":"Focused BigInt-to-Number conversion case passes in interpreter/compiler; compiler/vm core checks and autoresearch backpressure checks pass."}}
{"run":1160,"commit":"8b7af3a","metric":33,"metrics":{"compiler_test262_cases":340,"compiler_test262_pass":307,"compiler_test262_failures":33,"compiler_test262_compiler_errors":0,"compiler_test262_compiler_crashes":0,"compiler_test262_compiler_fails":0,"compiler_test262_both_fail":26,"compiler_test262_interpreter_fail_compiler_pass":6,"compatibility_pass":307,"compatibility_cases":340,"compiler_errors":0,"compiler_crashes":0,"compiler_fails":0,"both_fail":26,"interpreter_fail_compiler_pass":6,"elapsed_ms":19869},"status":"keep","description":"Reuse global Number parse functions","timestamp":1778656566300,"segment":56,"confidence":8.2,"iterationTokens":5135,"asi":{"hypothesis":"Number.parseInt and Number.parseFloat should be the same built-in function objects as the global parseInt/parseFloat bindings, not wrapper functions with separate identity.","focused_cases":["built-ins/Number/parseInt.js","built-ins/Number/parseFloat.js"],"focused_result":"Focused interpreter identity/descriptor cases pass; direct compiler helper without harness includes still reports missing propertyHelper but broad harness run passes the cases; compiler/vm core checks and autoresearch backpressure checks pass."}}
{"run":1161,"commit":"339a111","metric":32,"metrics":{"compiler_test262_cases":340,"compiler_test262_pass":308,"compiler_test262_failures":32,"compiler_test262_compiler_errors":0,"compiler_test262_compiler_crashes":0,"compiler_test262_compiler_fails":0,"compiler_test262_both_fail":25,"compiler_test262_interpreter_fail_compiler_pass":6,"compatibility_pass":308,"compatibility_cases":340,"compiler_errors":0,"compiler_crashes":0,"compiler_fails":0,"both_fail":25,"interpreter_fail_compiler_pass":6,"elapsed_ms":19969},"status":"keep","description":"Handle undefined Number precision","timestamp":1778656849967,"segment":56,"confidence":11.80952380952381,"iterationTokens":10143,"asi":{"hypothesis":"Number.prototype.toPrecision(undefined) should return ToString(thisNumberValue) directly instead of treating undefined as precision 1.","focused_cases":["built-ins/Number/prototype/toPrecision/undefined-precision-arg.js"],"focused_result":"Focused undefined precision case passes in interpreter/compiler; compiler/vm core checks and autoresearch backpressure checks pass."}}
{"run":1162,"commit":"a490525","metric":29,"metrics":{"compiler_test262_cases":340,"compiler_test262_pass":311,"compiler_test262_failures":29,"compiler_test262_compiler_errors":0,"compiler_test262_compiler_crashes":0,"compiler_test262_compiler_fails":0,"compiler_test262_both_fail":22,"compiler_test262_interpreter_fail_compiler_pass":6,"compatibility_pass":311,"compatibility_cases":340,"compiler_errors":0,"compiler_crashes":0,"compiler_fails":0,"both_fail":22,"interpreter_fail_compiler_pass":6,"elapsed_ms":20702},"status":"keep","description":"Validate Number formatting precision ranges","timestamp":1778659165457,"segment":56,"confidence":12.7,"iterationTokens":10143,"asi":{"hypothesis":"Number.prototype.toFixed/toExponential/toPrecision must reject out-of-range fraction/precision arguments instead of clamping them, fixing range-focused Test262 failures."}}
{"run":1163,"commit":"a490525","metric":31,"metrics":{"compiler_test262_cases":340,"compiler_test262_pass":309,"compiler_test262_failures":31,"compiler_test262_compiler_errors":0,"compiler_test262_compiler_crashes":0,"compiler_test262_compiler_fails":0,"compiler_test262_both_fail":20,"compiler_test262_interpreter_fail_compiler_pass":6,"compatibility_pass":309,"compatibility_cases":340,"compiler_errors":0,"compiler_crashes":0,"compiler_fails":0,"both_fail":20,"interpreter_fail_compiler_pass":6,"elapsed_ms":19834},"status":"discard","description":"Format Number exponential defaults and large toFixed","timestamp":1778659578273,"segment":56,"confidence":16.933333333333334,"iterationTokens":13304,"asi":{"hypothesis":"Adding default toExponential formatting and large-magnitude toFixed handling might clear remaining formatting cases.","rollback_reason":"Primary metric regressed from the kept Number best 29 to 31 despite fixing the focused undefined-fractiondigits case, likely due broad formatting side effects.","next_action_hint":"Retry only with a narrower toExponential undefined-path implementation or inspect the exact added failures before changing generic formatting."}}
{"run":1164,"commit":"d376fb4","metric":28,"metrics":{"compiler_test262_cases":340,"compiler_test262_pass":312,"compiler_test262_failures":28,"compiler_test262_compiler_errors":0,"compiler_test262_compiler_crashes":0,"compiler_test262_compiler_fails":0,"compiler_test262_both_fail":21,"compiler_test262_interpreter_fail_compiler_pass":6,"compatibility_pass":312,"compatibility_cases":340,"compiler_errors":0,"compiler_crashes":0,"compiler_fails":0,"both_fail":21,"interpreter_fail_compiler_pass":6,"elapsed_ms":19878},"status":"keep","description":"Coerce Number precision before NaN formatting","timestamp":1778659811199,"segment":56,"confidence":18.285714285714285,"iterationTokens":2459,"asi":{"hypothesis":"Number.prototype.toPrecision must coerce a provided precision argument before returning NaN for NaN receivers, preserving observable valueOf side effects."}}
{"run":1165,"commit":"5d10577","metric":27,"metrics":{"compiler_test262_cases":340,"compiler_test262_pass":313,"compiler_test262_failures":27,"compiler_test262_compiler_errors":0,"compiler_test262_compiler_crashes":0,"compiler_test262_compiler_fails":0,"compiler_test262_both_fail":20,"compiler_test262_interpreter_fail_compiler_pass":6,"compatibility_pass":313,"compatibility_cases":340,"compiler_errors":0,"compiler_crashes":0,"compiler_fails":0,"both_fail":20,"interpreter_fail_compiler_pass":6,"elapsed_ms":20661},"status":"keep","description":"Reject BigInt Number formatting arguments","timestamp":1778660093234,"segment":56,"confidence":18.428571428571427,"iterationTokens":2880,"asi":{"hypothesis":"Number prototype formatting methods use ToInteger-style argument coercion for radix, fractionDigits, and precision, which must reject BigInt inputs with TypeError instead of converting them through Number()."}}
{"run":1166,"commit":"1ea7f7e","metric":25,"metrics":{"compiler_test262_cases":340,"compiler_test262_pass":315,"compiler_test262_failures":25,"compiler_test262_compiler_errors":0,"compiler_test262_compiler_crashes":0,"compiler_test262_compiler_fails":0,"compiler_test262_both_fail":18,"compiler_test262_interpreter_fail_compiler_pass":6,"compatibility_pass":315,"compatibility_cases":340,"compiler_errors":0,"compiler_crashes":0,"compiler_fails":0,"both_fail":18,"interpreter_fail_compiler_pass":6,"elapsed_ms":20557},"status":"keep","description":"Preserve wrapped primitive method deletions","timestamp":1778660720946,"segment":56,"confidence":18.714285714285715,"iterationTokens":17470,"asi":{"hypothesis":"Deleting virtual wrapped-primitive prototype methods should create a tombstone so Number.prototype method fallbacks do not reappear and Object.prototype.toString can be reached."}}
{"run":1167,"commit":"309fbc7","metric":24,"metrics":{"compiler_test262_cases":340,"compiler_test262_pass":316,"compiler_test262_failures":24,"compiler_test262_compiler_errors":0,"compiler_test262_compiler_crashes":0,"compiler_test262_compiler_fails":0,"compiler_test262_both_fail":17,"compiler_test262_interpreter_fail_compiler_pass":6,"compatibility_pass":316,"compatibility_cases":340,"compiler_errors":0,"compiler_crashes":0,"compiler_fails":0,"both_fail":17,"interpreter_fail_compiler_pass":6,"elapsed_ms":20520},"status":"keep","description":"Honor Number prototype tombstones on instances","timestamp":1778661179236,"segment":56,"confidence":20.307692307692307,"iterationTokens":28367,"asi":{"hypothesis":"Boxed Number instances should respect delete tombstones on Number.prototype virtual methods before falling back to Object.prototype, without routing every lookup through the broader primitive_class_proto path that previously hung."}}
