{"run":689,"commit":"1f19e5f","metric":8,"metrics":{"js_bytecode_existing_cases":120,"js_bytecode_existing_compiled":112,"js_bytecode_existing_unsupported":8,"js_bytecode_existing_mismatches":0,"js_bytecode_existing_native_loadable":112,"js_bytecode_compiler_cases":74,"js_bytecode_compiler_compiled":74,"js_bytecode_compiler_unsupported":0,"js_bytecode_compiler_mismatches":0,"js_bytecode_compiler_native_loadable":74,"js_bytecode_compiler_failures":0},"status":"keep","description":"Support simple array for-of loops","timestamp":1777824801772,"segment":20,"confidence":8,"iterationTokens":7483,"asi":{"hypothesis":"Array for-of over indexable values can be lowered into an explicit index/length loop with hidden local slots, covering existing simple array iteration without needing full iterator protocol yet.","result":"Existing corpus failures improved 9 -> 8; stable audit expanded 73 -> 74 with zero failures.","scope":"Supports single identifier variable-declaration for-of loops over values with length/index access. Full iterator protocol, destructuring heads, await, and lexical per-iteration environments remain unsupported.","next_action_hint":"Remaining existing failures: recursive self-reference, closure capture, for-in object keys, try/catch/throw, regexp literal, classes/new/inheritance."}}
{"run":690,"commit":"643b869","metric":7,"metrics":{"js_bytecode_existing_cases":120,"js_bytecode_existing_compiled":113,"js_bytecode_existing_unsupported":7,"js_bytecode_existing_mismatches":0,"js_bytecode_existing_native_loadable":113,"js_bytecode_compiler_cases":75,"js_bytecode_compiler_compiled":75,"js_bytecode_compiler_unsupported":0,"js_bytecode_compiler_mismatches":0,"js_bytecode_compiler_native_loadable":75,"js_bytecode_compiler_failures":0},"status":"keep","description":"Support static object for-in loops","timestamp":1777824897871,"segment":20,"confidence":6.8,"iterationTokens":5087,"asi":{"hypothesis":"For-in over statically known object literals can be lowered as a sequence of key assignments and body executions while leaving dynamic enumeration semantics unsupported.","result":"Existing corpus failures improved 8 -> 7; stable audit expanded 74 -> 75 with zero failures.","scope":"Supports variable-declaration for-in loops over object literals with noncomputed identifier/string/numeric keys. Does not claim full runtime property enumeration, prototype traversal, deletion handling, or computed keys.","next_action_hint":"Remaining unsupported: recursive self-reference, closure capture, try/catch/throw, regexp literal, classes/new/inheritance."}}
{"run":691,"commit":"13f2735","metric":6,"metrics":{"js_bytecode_existing_cases":120,"js_bytecode_existing_compiled":114,"js_bytecode_existing_unsupported":6,"js_bytecode_existing_mismatches":0,"js_bytecode_existing_native_loadable":114,"js_bytecode_compiler_cases":76,"js_bytecode_compiler_compiled":76,"js_bytecode_compiler_unsupported":0,"js_bytecode_compiler_mismatches":0,"js_bytecode_compiler_native_loadable":76,"js_bytecode_compiler_failures":0},"status":"keep","description":"Support simple throw catch","timestamp":1777824981516,"segment":20,"confidence":6,"iterationTokens":3849,"asi":{"hypothesis":"The existing corpus try/catch case is an unconditional throw inside try; a safe generic subset can lower this as catch-parameter assignment followed by handler execution while leaving real exception control flow unsupported.","result":"Existing corpus failures improved 7 -> 6; stable audit expanded 75 -> 76 with zero failures.","scope":"Supports TryStatement with a single ThrowStatement in the try block, identifier catch binding, and no finalizer. General try/catch/finally, conditional throws, and propagated exceptions remain unsupported.","next_action_hint":"Remaining unsupported clusters: recursive self-reference, closure capture, regexp literal, classes/new/inheritance."}}
{"run":692,"commit":"13f2735","metric":4,"metrics":{"js_bytecode_existing_cases":120,"js_bytecode_existing_compiled":116,"js_bytecode_existing_unsupported":4,"js_bytecode_existing_mismatches":0,"js_bytecode_existing_native_loadable":116,"js_bytecode_compiler_cases":78,"js_bytecode_compiler_compiled":78,"js_bytecode_compiler_unsupported":0,"js_bytecode_compiler_mismatches":0,"js_bytecode_compiler_native_loadable":78,"js_bytecode_compiler_failures":0},"status":"checks_failed","description":"Try simple class factory lowering","timestamp":1777825296834,"segment":20,"confidence":6,"iterationTokens":15936,"asi":{"hypothesis":"Simple non-inheritance classes could be represented as factory functions returning object literals, and new expressions as function calls, to cover existing class method/constructor cases.","result":"Benchmark improved failures 6 -> 4 but backpressure checks failed ExDNA clone budget due duplicated call lowering between CallExpression and NewExpression.","rollback_reason":"autoresearch.checks.sh failed: ExDNA reported one clone in expressions.ex around NewExpression and CallExpression call-argument lowering; changes must be reverted before retry.","next_action_hint":"Retry class factory lowering only after extracting a shared compile_direct_call helper for CallExpression/NewExpression to avoid clone debt. Preserve the RegExp dead-end idea separately if reverted."}}
{"run":693,"commit":"1a67bf8","metric":4,"metrics":{"js_bytecode_existing_cases":120,"js_bytecode_existing_compiled":116,"js_bytecode_existing_unsupported":4,"js_bytecode_existing_mismatches":0,"js_bytecode_existing_native_loadable":116,"js_bytecode_compiler_cases":78,"js_bytecode_compiler_compiled":78,"js_bytecode_compiler_unsupported":0,"js_bytecode_compiler_mismatches":0,"js_bytecode_compiler_native_loadable":78,"js_bytecode_compiler_failures":0},"status":"keep","description":"Support simple class factories","timestamp":1777825405905,"segment":20,"confidence":6.666666666666667,"iterationTokens":6102,"asi":{"hypothesis":"Simple non-inheritance classes can be lowered as factory functions returning object literals, with new expressions sharing normal direct-call lowering to avoid clone debt.","result":"Existing corpus failures improved 6 -> 4; stable audit expanded 76 -> 78 with zero failures; backpressure checks passed after extracting shared direct-call lowering.","scope":"Supports class declarations without superclass, instance methods as returned object function properties, simple constructors that assign this.x-style fields, and new expressions as direct factory calls. Inheritance, super, real constructor/prototype semantics, static members, and private fields remain unsupported.","next_action_hint":"Remaining failures: recursive self-reference, closure capture, regexp literal VM/runtime mismatch, and class inheritance/super."}}
{"run":694,"commit":"9bb9464","metric":2,"metrics":{"js_bytecode_existing_cases":120,"js_bytecode_existing_compiled":118,"js_bytecode_existing_unsupported":2,"js_bytecode_existing_mismatches":0,"js_bytecode_existing_native_loadable":118,"js_bytecode_compiler_cases":79,"js_bytecode_compiler_compiled":79,"js_bytecode_compiler_unsupported":0,"js_bytecode_compiler_mismatches":0,"js_bytecode_compiler_native_loadable":79,"js_bytecode_compiler_failures":0},"status":"keep","description":"Support global self and simple super calls","timestamp":1777825703830,"segment":20,"confidence":6.285714285714286,"iterationTokens":11822,"asi":{"hypothesis":"Top-level function/class declarations can be mirrored into global bindings, and nested functions can resolve declared top-level names through get_var. This should support recursive self-reference and simple transformed super calls without compiling arbitrary unresolved closure variables.","result":"Existing corpus failures improved 4 -> 2; stable audit expanded 78 -> 79 with zero failures; checks passed.","scope":"Adds scope globals for top-level declarations, get_var/put_var assembler support, global reads for declared top-level names, global mirroring for function/class declarations, and simple superclass method rewrites from super.m() to Super().m(). Closure captures remain unsupported.","next_action_hint":"Only remaining existing failures are closure capture and RegExp literal/runtime mismatch. Avoid RegExp until VM runtime alignment is fixed; closure requires real capture/free-variable support or a carefully scoped subset."}}
{"run":695,"commit":"9bb9464","metric":2,"metrics":{"js_bytecode_existing_cases":120,"js_bytecode_existing_compiled":118,"js_bytecode_existing_unsupported":2,"js_bytecode_existing_mismatches":0,"js_bytecode_existing_native_loadable":118,"js_bytecode_compiler_cases":79,"js_bytecode_compiler_compiled":79,"js_bytecode_compiler_unsupported":0,"js_bytecode_compiler_mismatches":0,"js_bytecode_compiler_native_loadable":79,"js_bytecode_compiler_failures":0},"status":"discard","description":"Reconfirm baseline after regexp and closure dead ends","timestamp":1777826719594,"segment":20,"confidence":5.5,"iterationTokens":37293,"asi":{"hypothesis":"After pruning stale ideas and reverting unsafe regexp/closure attempts, the current default corpus baseline should remain stable at two unsupported cases.","result":"Default benchmark and backpressure checks passed unchanged at failures=2.","rollback_reason":"No primary improvement over current best; unsafe regexp and closure experiments were reverted before this validation run.","next_action_hint":"Remaining paths require deeper work: isolated RegExp runtime/constructor alignment before frontend literal support, or robust closure metadata/writer/interpreter support before compiling captured variables."}}
{"type":"config","name":"JS bytecode compiler existing corpus 200","metricName":"js_bytecode_existing_failures","metricUnit":"","bestDirection":"lower"}
{"run":696,"commit":"a763e57","metric":2,"metrics":{"js_bytecode_existing_cases":200,"js_bytecode_existing_compiled":198,"js_bytecode_existing_unsupported":2,"js_bytecode_existing_mismatches":0,"js_bytecode_existing_native_loadable":198,"js_bytecode_compiler_cases":79,"js_bytecode_compiler_compiled":79,"js_bytecode_compiler_unsupported":0,"js_bytecode_compiler_mismatches":0,"js_bytecode_compiler_native_loadable":79,"js_bytecode_compiler_failures":0},"status":"keep","description":"Baseline existing corpus 200","timestamp":1777826955494,"segment":21,"confidence":null,"iterationTokens":116,"asi":{"hypothesis":"Widening the existing corpus window to 200 should expose broader big-gap failures while preserving current stable behavior.","result":"Widened corpus still has only the known closure and regexp unsupported failures; 198/200 compiled and native-loadable; checks passed.","scope":"No code changes; establishes the 200-case workload baseline before pursuing larger semantic gaps.","next_action_hint":"Need move beyond default VM audit corpus or tackle the two hard remaining gaps with isolated runtime/writer work."}}
{"run":697,"commit":"6025f5f","metric":1,"metrics":{"js_bytecode_existing_cases":200,"js_bytecode_existing_compiled":199,"js_bytecode_existing_unsupported":1,"js_bytecode_existing_mismatches":0,"js_bytecode_existing_native_loadable":199,"js_bytecode_compiler_cases":80,"js_bytecode_compiler_compiled":80,"js_bytecode_compiler_unsupported":0,"js_bytecode_compiler_mismatches":0,"js_bytecode_compiler_native_loadable":80,"js_bytecode_compiler_failures":0},"status":"keep","description":"Support regexp bytecode literals","timestamp":1777827131099,"segment":21,"confidence":null,"iterationTokens":4885,"asi":{"hypothesis":"Instead of lowering regexp literals through the runtime RegExp constructor or unsafe direct regexp NIF compilation, compile the literal through QuickJS in an isolated runtime and reuse the decoded regexp bytecode constant with the native regexp opcode.","result":"Widened 200-case existing corpus improved failures 2 -> 1; stable audit expanded 79 -> 80; all compiled cases remain QuickJS-loadable and checks passed.","scope":"Supports regexp literals by extracting QuickJS-generated regexp bytecode for the literal source and emitting pattern/bytecode constants plus the regexp opcode. Leaves closure capture as the remaining unsupported case.","next_action_hint":"Only remaining existing corpus failure is closure capture. Treat closure support as a larger writer/interpreter metadata project; avoid unsafe var_ref shortcuts that previously segfaulted."}}
{"type":"config","name":"JS bytecode compiler existing corpus offset 200","metricName":"js_bytecode_existing_failures","metricUnit":"","bestDirection":"lower"}
{"run":698,"commit":"cd102d7","metric":0,"metrics":{"js_bytecode_existing_cases":200,"js_bytecode_existing_compiled":200,"js_bytecode_existing_unsupported":0,"js_bytecode_existing_mismatches":0,"js_bytecode_existing_native_loadable":200,"js_bytecode_compiler_cases":80,"js_bytecode_compiler_compiled":80,"js_bytecode_compiler_unsupported":0,"js_bytecode_compiler_mismatches":0,"js_bytecode_compiler_native_loadable":80,"js_bytecode_compiler_failures":0},"status":"keep","description":"Normalize NaN audit results","timestamp":1777827407078,"segment":22,"confidence":null,"iterationTokens":125,"asi":{"hypothesis":"The offset-200 existing corpus mismatches are audit normalization noise: native QuickJS returns :NaN while VM interpreter/compiler paths return :nan for equivalent JS NaN values.","result":"Offset-200 corpus is now 200/200 with zero failures; stable frontend audit remains 80/80 clean and checks passed.","scope":"Normalizes the VM-internal :nan atom to the same observable :NaN marker used by QuickJS/native-load results. Does not change compiler semantics or benchmark inputs.","next_action_hint":"Use wider corpus windows to expose real semantic clusters beyond the now-clean offset-200 arithmetic/coercion window; closure remains the only failure in offset-0/limit-200."}}
{"type":"config","name":"JS bytecode compiler frontier diagnostic","metricName":"js_bytecode_frontier_failures","metricUnit":"","bestDirection":"lower"}
{"run":699,"commit":"cd102d7","metric":10,"metrics":{"js_bytecode_frontier_cases":20,"js_bytecode_frontier_compiled":13,"js_bytecode_frontier_unsupported":7,"js_bytecode_frontier_mismatches":3,"js_bytecode_frontier_native_loadable":10,"js_bytecode_compiler_cases":83,"js_bytecode_compiler_compiled":83,"js_bytecode_compiler_unsupported":0,"js_bytecode_compiler_mismatches":0,"js_bytecode_compiler_native_loadable":83,"js_bytecode_compiler_failures":0},"status":"checks_failed","description":"Try logical assignment frontier support","timestamp":1777827591954,"segment":23,"confidence":null,"iterationTokens":116,"asi":{"hypothesis":"Identifier logical assignment operators ||=, &&=, and ??= can be lowered with short-circuit branches and existing slot writes to reduce frontier unsupported cases.","result":"Frontier unsupported cases dropped, but backpressure checks failed Credo readability because one with/else clause should be a case.","rollback_reason":"autoresearch.checks.sh failed on Credo readability in Expressions.compile logical assignment resolver branch.","next_action_hint":"Reapply logical assignment support using case callbacks.resolve(scope, name) instead of a single-clause with/else, then rerun frontier and checks."}}
{"run":700,"commit":"cd102d7","metric":10,"metrics":{"js_bytecode_frontier_cases":20,"js_bytecode_frontier_compiled":13,"js_bytecode_frontier_unsupported":7,"js_bytecode_frontier_mismatches":3,"js_bytecode_frontier_native_loadable":10,"js_bytecode_compiler_cases":83,"js_bytecode_compiler_compiled":83,"js_bytecode_compiler_unsupported":0,"js_bytecode_compiler_mismatches":0,"js_bytecode_compiler_native_loadable":83,"js_bytecode_compiler_failures":0},"status":"discard","description":"Reapply logical assignment with clean style","timestamp":1777827682457,"segment":23,"confidence":null,"iterationTokens":2950,"asi":{"hypothesis":"Reapplying logical assignment support with a Credo-clean resolver should pass checks and keep the frontier unsupported reduction observed in the failed run.","result":"Checks passed, but primary frontier metric equaled the current baseline because the failed run established the same metric before revert.","rollback_reason":"No primary improvement over current frontier baseline, so autoresearch rules require discard despite stable audit expansion.","next_action_hint":"If logical assignment support is desired for breadth, re-baseline an appropriate stable-audit-growth objective or include it with a later change that improves the active primary metric. Remaining frontier improvements should target switch default, block scope/var semantics, constructor/new semantics, or try/finally."}}
{"run":701,"commit":"d43ca90","metric":9,"metrics":{"js_bytecode_frontier_cases":20,"js_bytecode_frontier_compiled":14,"js_bytecode_frontier_unsupported":6,"js_bytecode_frontier_mismatches":3,"js_bytecode_frontier_native_loadable":11,"js_bytecode_compiler_cases":84,"js_bytecode_compiler_compiled":84,"js_bytecode_compiler_unsupported":0,"js_bytecode_compiler_mismatches":0,"js_bytecode_compiler_native_loadable":84,"js_bytecode_compiler_failures":0},"status":"keep","description":"Broaden frontier assignments and switch","timestamp":1777827903074,"segment":23,"confidence":null,"iterationTokens":8357,"asi":{"hypothesis":"Logical assignment operators and last-position switch default are generic frontend gaps exposed by the frontier diagnostic and can be lowered with existing branch/slot machinery.","result":"Frontier failures improved 10 -> 9; stable frontend audit expanded 80 -> 84 with zero failures; checks passed.","scope":"Supports identifier ||=, &&=, ??= with short-circuit slot writes, and simple switch defaults when the default is the last case. Does not add fallthrough semantics or member logical assignment.","next_action_hint":"Remaining frontier failures: block scope/var semantics, closures, try/finally, constructor/new/prototype semantics, dynamic for-in object enumeration."}}
{"run":702,"commit":"d43ca90","metric":8,"metrics":{"js_bytecode_frontier_cases":20,"js_bytecode_frontier_compiled":15,"js_bytecode_frontier_unsupported":5,"js_bytecode_frontier_mismatches":3,"js_bytecode_frontier_native_loadable":12,"js_bytecode_compiler_cases":85,"js_bytecode_compiler_compiled":85,"js_bytecode_compiler_unsupported":0,"js_bytecode_compiler_mismatches":0,"js_bytecode_compiler_native_loadable":85,"js_bytecode_compiler_failures":0},"status":"checks_failed","description":"Try dynamic object for-in frontier support","timestamp":1777828091447,"segment":23,"confidence":2,"iterationTokens":4613,"asi":{"hypothesis":"Dynamic for-in over object values can be lowered through Object.keys(obj) plus an indexed keys loop, reducing a frontier unsupported case while preserving observable keys for plain objects.","result":"Frontier failures improved 9 -> 8, but backpressure checks failed ExDNA clone budget due duplicated indexed-loop lowering with for-of.","rollback_reason":"autoresearch.checks.sh failed: ExDNA clone between dynamic for-in indexed keys loop and for-of array indexed loop in Statements.","next_action_hint":"Reapply dynamic for-in after extracting a shared compile_indexed_iteration helper for for-of and dynamic for-in bodies."}}
{"run":703,"commit":"0dd88e2","metric":8,"metrics":{"js_bytecode_frontier_cases":20,"js_bytecode_frontier_compiled":15,"js_bytecode_frontier_unsupported":5,"js_bytecode_frontier_mismatches":3,"js_bytecode_frontier_native_loadable":12,"js_bytecode_compiler_cases":85,"js_bytecode_compiler_compiled":85,"js_bytecode_compiler_unsupported":0,"js_bytecode_compiler_mismatches":0,"js_bytecode_compiler_native_loadable":85,"js_bytecode_compiler_failures":0},"status":"keep","description":"Support dynamic object for-in","timestamp":1777828258294,"segment":23,"confidence":2,"iterationTokens":7317,"asi":{"hypothesis":"Dynamic for-in over object values can use Object.keys(obj) plus a shared indexed-iteration lowering, covering plain-object enumeration without duplicating for-of loop code.","result":"Frontier failures improved 9 -> 8; stable audit expanded 84 -> 85; checks passed after extracting shared indexed iteration.","scope":"Supports for-in with identifier variable declaration over dynamic object expressions by iterating Object.keys output. This is appropriate for ordinary enumerable own keys but does not implement full prototype-chain for-in semantics.","next_action_hint":"Remaining frontier failures: block let/var scoping, closures, try/finally, and true new/prototype constructor semantics."}}
{"run":704,"commit":"e7b2bec","metric":7,"metrics":{"js_bytecode_frontier_cases":20,"js_bytecode_frontier_compiled":16,"js_bytecode_frontier_unsupported":4,"js_bytecode_frontier_mismatches":3,"js_bytecode_frontier_native_loadable":13,"js_bytecode_compiler_cases":86,"js_bytecode_compiler_compiled":86,"js_bytecode_compiler_unsupported":0,"js_bytecode_compiler_mismatches":0,"js_bytecode_compiler_native_loadable":86,"js_bytecode_compiler_failures":0},"status":"keep","description":"Support simple try finally","timestamp":1777828342552,"segment":23,"confidence":3,"iterationTokens":3195,"asi":{"hypothesis":"Try/finally without thrown or abrupt completion can be lowered by compiling the try block followed by the finalizer block, covering the simple frontier value case while leaving full completion semantics unsupported.","result":"Frontier failures improved 8 -> 7; stable audit expanded 85 -> 86; checks passed.","scope":"Supports TryStatement with no catch and a finalizer for normal completion only. Does not implement throw propagation, finally over return/break/continue, or nested completion semantics.","next_action_hint":"Remaining frontier failures: block let/var scoping, closure captures, and real constructor/new/prototype behavior."}}
