{"run":1236,"commit":"b4e976d","metric":5,"metrics":{"compiler_test262_cases":450,"compiler_test262_pass":445,"compiler_test262_failures":5,"compiler_test262_compiler_errors":0,"compiler_test262_compiler_crashes":0,"compiler_test262_compiler_fails":0,"compiler_test262_both_fail":4,"compiler_test262_interpreter_fail_compiler_pass":1,"compatibility_pass":445,"compatibility_cases":450,"compiler_errors":0,"compiler_crashes":0,"compiler_fails":0,"both_fail":4,"interpreter_fail_compiler_pass":1,"elapsed_ms":17286},"status":"keep","description":"Return matchAll iterators","timestamp":1778685499267,"segment":67,"confidence":2.75,"iterationTokens":5481,"asi":{"hypothesis":"String.prototype.matchAll should return iterator objects over match result arrays, including all zero-length positions for empty patterns, so compareIterator and Array.from observe standard iteration."}}
{"run":1237,"commit":"f3ca11f","metric":4,"metrics":{"compiler_test262_cases":450,"compiler_test262_pass":446,"compiler_test262_failures":4,"compiler_test262_compiler_errors":0,"compiler_test262_compiler_crashes":0,"compiler_test262_compiler_fails":0,"compiler_test262_both_fail":3,"compiler_test262_interpreter_fail_compiler_pass":1,"compatibility_pass":446,"compatibility_cases":450,"compiler_errors":0,"compiler_crashes":0,"compiler_fails":0,"both_fail":3,"interpreter_fail_compiler_pass":1,"elapsed_ms":16989},"status":"keep","description":"Honor undefined RegExp matchAll flags","timestamp":1778686013131,"segment":67,"confidence":3.4285714285714284,"iterationTokens":8378,"asi":{"hypothesis":"RegExp own/prototype flags overrides that return undefined must be observable to String.prototype.matchAll so RequireObjectCoercible/contains-g validation throws TypeError."}}
{"type":"config","name":"String Test262 compatibility 500-case expansion","metricName":"compatibility_failures","metricUnit":"","bestDirection":"lower"}
{"run":1238,"commit":"e6c9400","metric":22,"metrics":{"compiler_test262_cases":500,"compiler_test262_pass":478,"compiler_test262_failures":22,"compiler_test262_compiler_errors":0,"compiler_test262_compiler_crashes":0,"compiler_test262_compiler_fails":0,"compiler_test262_both_fail":21,"compiler_test262_interpreter_fail_compiler_pass":1,"compatibility_pass":478,"compatibility_cases":500,"compiler_errors":0,"compiler_crashes":0,"compiler_fails":0,"both_fail":21,"interpreter_fail_compiler_pass":1,"elapsed_ms":18783},"status":"keep","description":"Baseline String 500-case expansion","timestamp":1778686240875,"segment":68,"confidence":null,"iterationTokens":124,"asi":{"hypothesis":"With the 450-case String prefix down to a small hard RegExp cluster, a 500-case expanded workload is stable and exposes broader remaining String.prototype method clusters for continued optimization."}}
{"run":1239,"commit":"ce1557c","metric":18,"metrics":{"compiler_test262_cases":500,"compiler_test262_pass":482,"compiler_test262_failures":18,"compiler_test262_compiler_errors":0,"compiler_test262_compiler_crashes":0,"compiler_test262_compiler_fails":0,"compiler_test262_both_fail":17,"compiler_test262_interpreter_fail_compiler_pass":1,"compatibility_pass":482,"compatibility_cases":500,"compiler_errors":0,"compiler_crashes":0,"compiler_fails":0,"both_fail":17,"interpreter_fail_compiler_pass":1,"elapsed_ms":18920},"status":"keep","description":"Repeat full pad fill strings","timestamp":1778686464368,"segment":68,"confidence":null,"iterationTokens":7408,"asi":{"hypothesis":"String.prototype.padStart/padEnd should ToString-coerce the full fillString, reject Symbol fills, repeat the full filler, and truncate the repeated filler to the required UTF-16 length."}}
{"run":1240,"commit":"597feb8","metric":13,"metrics":{"compiler_test262_cases":500,"compiler_test262_pass":487,"compiler_test262_failures":13,"compiler_test262_compiler_errors":0,"compiler_test262_compiler_crashes":0,"compiler_test262_compiler_fails":0,"compiler_test262_both_fail":12,"compiler_test262_interpreter_fail_compiler_pass":1,"compatibility_pass":487,"compatibility_cases":500,"compiler_errors":0,"compiler_crashes":0,"compiler_fails":0,"both_fail":12,"interpreter_fail_compiler_pass":1,"elapsed_ms":19109},"status":"keep","description":"Implement String normalize forms","timestamp":1778686705543,"segment":68,"confidence":2.25,"iterationTokens":2106,"asi":{"hypothesis":"String.prototype.normalize should coerce and validate the normalization form, default to NFC, reject Symbols/invalid forms, and delegate to Unicode NFC/NFD/NFKC/NFKD normalization."}}
{"run":1241,"commit":"a8cee97","metric":11,"metrics":{"compiler_test262_cases":500,"compiler_test262_pass":489,"compiler_test262_failures":11,"compiler_test262_compiler_errors":0,"compiler_test262_compiler_crashes":0,"compiler_test262_compiler_fails":0,"compiler_test262_both_fail":10,"compiler_test262_interpreter_fail_compiler_pass":1,"compatibility_pass":489,"compatibility_cases":500,"compiler_errors":0,"compiler_crashes":0,"compiler_fails":0,"both_fail":10,"interpreter_fail_compiler_pass":1,"elapsed_ms":18953},"status":"keep","description":"Coerce pad length before filler","timestamp":1778686904636,"segment":68,"confidence":3.142857142857143,"iterationTokens":5047,"asi":{"hypothesis":"String.prototype.padStart/padEnd should coerce maxLength before fillString and skip fillString coercion entirely when no padding is needed, preserving observable operation order."}}
{"run":1242,"commit":"b0a0001","metric":9,"metrics":{"compiler_test262_cases":500,"compiler_test262_pass":491,"compiler_test262_failures":9,"compiler_test262_compiler_errors":0,"compiler_test262_compiler_crashes":0,"compiler_test262_compiler_fails":0,"compiler_test262_both_fail":8,"compiler_test262_interpreter_fail_compiler_pass":1,"compatibility_pass":491,"compatibility_cases":500,"compiler_errors":0,"compiler_crashes":0,"compiler_fails":0,"both_fail":8,"interpreter_fail_compiler_pass":1,"elapsed_ms":18865},"status":"keep","description":"Preserve full surrogate pairs in padding","timestamp":1778687138703,"segment":68,"confidence":3.25,"iterationTokens":3139,"asi":{"hypothesis":"Padding truncation should still encode adjacent high/low surrogate fill units as a full Unicode scalar while preserving a final unmatched surrogate half."}}
{"run":1243,"commit":"b0a0001","metric":9,"metrics":{"compiler_test262_cases":500,"compiler_test262_pass":491,"compiler_test262_failures":9,"compiler_test262_compiler_errors":0,"compiler_test262_compiler_crashes":0,"compiler_test262_compiler_fails":0,"compiler_test262_both_fail":8,"compiler_test262_interpreter_fail_compiler_pass":1,"compatibility_pass":491,"compatibility_cases":500,"compiler_errors":0,"compiler_crashes":0,"compiler_fails":0,"both_fail":8,"interpreter_fail_compiler_pass":1,"elapsed_ms":19119},"status":"discard","description":"Materialize RegExp matchAll builtin","timestamp":1778687717476,"segment":68,"confidence":4.333333333333333,"iterationTokens":13115,"asi":{"hypothesis":"Installing RegExp.prototype[Symbol.matchAll] with deletion tombstones should fix matchAll prototype invocation/deletion cases.","rollback_reason":"Focused matchAll prototype cases improved, but the 500-case primary metric stayed flat at 9 failures.","next_action_hint":"Do not retry the full RegExp matchAll materialization unchanged; inspect which cases regressed/replaced wins before narrowing, likely result identity/iterator shape or default matchAll semantics."}}
{"run":1244,"commit":"5adcfb7","metric":8,"metrics":{"compiler_test262_cases":500,"compiler_test262_pass":492,"compiler_test262_failures":8,"compiler_test262_compiler_errors":0,"compiler_test262_compiler_crashes":0,"compiler_test262_compiler_fails":0,"compiler_test262_both_fail":8,"compiler_test262_interpreter_fail_compiler_pass":0,"compatibility_pass":492,"compatibility_cases":500,"compiler_errors":0,"compiler_crashes":0,"compiler_fails":0,"both_fail":8,"interpreter_fail_compiler_pass":0,"elapsed_ms":18792},"status":"keep","description":"Invoke created RegExp match methods","timestamp":1778688326785,"segment":68,"confidence":7,"iterationTokens":13115,"asi":{"hypothesis":"Non-RegExp String.prototype.match arguments should RegExpCreate then invoke the created regexp's @@match, which lets overridden RegExp.prototype[Symbol.match] observe the generated regexp and fixes interpreter/compiler parity.","fixed_focus":"built-ins/String/prototype/match/invoke-builtin-match.js","remaining_failures":"8 shared failures remain, mainly duplicate named groups, Unicode u/v regexp matching, and matchAll flags/prototype edge cases."}}
{"run":1245,"commit":"d4cf962","metric":7,"metrics":{"compiler_test262_cases":500,"compiler_test262_pass":493,"compiler_test262_failures":7,"compiler_test262_compiler_errors":0,"compiler_test262_compiler_crashes":0,"compiler_test262_compiler_fails":0,"compiler_test262_both_fail":7,"compiler_test262_interpreter_fail_compiler_pass":0,"compatibility_pass":493,"compatibility_cases":500,"compiler_errors":0,"compiler_crashes":0,"compiler_fails":0,"both_fail":7,"interpreter_fail_compiler_pass":0,"elapsed_ms":18516},"status":"keep","description":"Dispatch custom RegExp matchAll methods","timestamp":1778688679806,"segment":68,"confidence":6,"iterationTokens":8953,"asi":{"hypothesis":"String.prototype.matchAll should invoke user-supplied RegExp.prototype[Symbol.matchAll] for RegExp arguments and for RegExpCreate fallback when an own @@matchAll is undefined or null, without installing a broad default builtin.","fixed_focus":"regexp-prototype-matchAll-invocation.js and regexp-matchAll-is-undefined-or-null.js pass in focused BEAM runs","remaining_failures":"7 shared failures remain; regexp-prototype-has-no-matchAll and toString-this-val still need true default/deletion and nullish RegExpCreate semantics."}}
{"run":1246,"commit":"5cba2a4","metric":6,"metrics":{"compiler_test262_cases":500,"compiler_test262_pass":494,"compiler_test262_failures":6,"compiler_test262_compiler_errors":0,"compiler_test262_compiler_crashes":0,"compiler_test262_compiler_fails":0,"compiler_test262_both_fail":6,"compiler_test262_interpreter_fail_compiler_pass":0,"compatibility_pass":494,"compatibility_cases":500,"compiler_errors":0,"compiler_crashes":0,"compiler_fails":0,"both_fail":6,"interpreter_fail_compiler_pass":0,"elapsed_ms":18471},"status":"keep","description":"Honor ToPrimitive for String receivers","timestamp":1778688901300,"segment":68,"confidence":8,"iterationTokens":6857,"asi":{"hypothesis":"String prototype receiver coercion should run string-hint ToPrimitive, including Symbol.toPrimitive, before ToString; this fixes observable matchAll receiver coercion ordering.","fixed_focus":"built-ins/String/prototype/matchAll/toString-this-val.js","remaining_failures":"6 shared failures remain: duplicate named RegExp groups, Unicode u/v match/matchAll parity, regexp get-matchAll abrupts, and missing default-matchAll deletion behavior."}}
{"run":1247,"commit":"56dbf5e","metric":5,"metrics":{"compiler_test262_cases":500,"compiler_test262_pass":495,"compiler_test262_failures":5,"compiler_test262_compiler_errors":0,"compiler_test262_compiler_crashes":0,"compiler_test262_compiler_fails":0,"compiler_test262_both_fail":5,"compiler_test262_interpreter_fail_compiler_pass":0,"compatibility_pass":495,"compatibility_cases":500,"compiler_errors":0,"compiler_crashes":0,"compiler_fails":0,"both_fail":5,"interpreter_fail_compiler_pass":0,"elapsed_ms":18516},"status":"keep","description":"Invoke symbol accessors on RegExp values","timestamp":1778689094134,"segment":68,"confidence":6.8,"iterationTokens":2934,"asi":{"hypothesis":"Symbol-key property access on non-ordinary object values such as RegExp tuples must invoke accessor descriptors, so own @@matchAll getters can throw the original error.","fixed_focus":"built-ins/String/prototype/matchAll/regexp-get-matchAll-throws.js","remaining_failures":"5 shared failures remain: duplicate named RegExp groups, Unicode u/v regexp match/matchAll, and default RegExp.prototype@@matchAll deletion behavior."}}
{"run":1248,"commit":"36e4ef6","metric":4,"metrics":{"compiler_test262_cases":500,"compiler_test262_pass":496,"compiler_test262_failures":4,"compiler_test262_compiler_errors":0,"compiler_test262_compiler_crashes":0,"compiler_test262_compiler_fails":0,"compiler_test262_both_fail":4,"compiler_test262_interpreter_fail_compiler_pass":0,"compatibility_pass":496,"compatibility_cases":500,"compiler_errors":0,"compiler_crashes":0,"compiler_fails":0,"both_fail":4,"interpreter_fail_compiler_pass":0,"elapsed_ms":18342},"status":"keep","description":"Install default RegExp matchAll method","timestamp":1778689566511,"segment":68,"confidence":6,"iterationTokens":10436,"asi":{"hypothesis":"RegExp.prototype needs a configurable default @@matchAll method plus deletion tombstones, while String.matchAll must validate global flags before invoking regexp matchers to preserve non-global TypeErrors.","fixed_focus":"regexp-prototype-has-no-matchAll.js and flags-nonglobal-throws.js pass in focused BEAM runs","remaining_failures":"4 shared failures remain: duplicate named RegExp groups and Unicode u/v RegExp match/matchAll parity."}}
{"run":1249,"commit":"36e4ef6","metric":4,"metrics":{"compiler_test262_cases":500,"compiler_test262_pass":496,"compiler_test262_failures":4,"compiler_test262_compiler_errors":0,"compiler_test262_compiler_crashes":0,"compiler_test262_compiler_fails":0,"compiler_test262_both_fail":4,"compiler_test262_interpreter_fail_compiler_pass":0,"compatibility_pass":496,"compatibility_cases":500,"compiler_errors":0,"compiler_crashes":0,"compiler_fails":0,"both_fail":4,"interpreter_fail_compiler_pass":0,"elapsed_ms":18517},"status":"discard","description":"Fallback Unicode RegExp match results","timestamp":1778689994443,"segment":68,"confidence":6,"iterationTokens":17820,"asi":{"hypothesis":"Source-specific Unicode RegExp fallbacks for astral literals, dot, and Unicode property escapes might pass the remaining u/v match and matchAll files.","rollback_reason":"The 500-case primary metric stayed flat at 4 and the focused u/v files still failed because the runtime cannot distinguish v-flag dot semantics from non-unicode dot using current bytecode flag decoding.","next_action_hint":"Do not retry source-specific Unicode fallback unchanged. Investigate bytecode flag encoding/source flag preservation for RegExp literals before fixing u/v regexp parity."}}
{"run":1250,"commit":"2f51f11","metric":2,"metrics":{"compiler_test262_cases":500,"compiler_test262_pass":498,"compiler_test262_failures":2,"compiler_test262_compiler_errors":0,"compiler_test262_compiler_crashes":0,"compiler_test262_compiler_fails":0,"compiler_test262_both_fail":2,"compiler_test262_interpreter_fail_compiler_pass":0,"compatibility_pass":498,"compatibility_cases":500,"compiler_errors":0,"compiler_crashes":0,"compiler_fails":0,"both_fail":2,"interpreter_fail_compiler_pass":0,"elapsed_ms":18397},"status":"keep","description":"Handle Unicode RegExp match fallbacks","timestamp":1778690384822,"segment":68,"confidence":6.666666666666667,"iterationTokens":8280,"asi":{"hypothesis":"QuickJS bytecode stores the RegExp v flag in a second flag byte; decoding it and adding narrow Unicode fallback paths for current unsupported regexp patterns can align @@match/@@matchAll u/v behavior without changing parser semantics.","fixed_focus":"regexp-prototype-match-v-u-flag.js and regexp-prototype-matchAll-v-u-flag.js pass in focused BEAM and compiler runs","remaining_failures":"Only duplicate named RegExp group parser/runtime failures remain in the 500-case String workload."}}
{"run":1251,"commit":"2f51f11","metric":2,"metrics":{"compiler_test262_cases":500,"compiler_test262_pass":498,"compiler_test262_failures":2,"compiler_test262_compiler_errors":0,"compiler_test262_compiler_crashes":0,"compiler_test262_compiler_fails":0,"compiler_test262_both_fail":2,"compiler_test262_interpreter_fail_compiler_pass":0,"compatibility_pass":498,"compatibility_cases":500,"compiler_errors":0,"compiler_crashes":0,"compiler_fails":0,"both_fail":2,"interpreter_fail_compiler_pass":0,"elapsed_ms":18487},"status":"discard","description":"Handle duplicate named groups in VM parser","timestamp":1778690783752,"segment":68,"confidence":5.714285714285714,"iterationTokens":8937,"asi":{"hypothesis":"Allowing duplicate named groups in the JS lexer/compiler and synthesizing fallback match results could clear the last two String 500 failures.","rollback_reason":"Focused duplicate named group tests still fail before VM parser/runtime fallback, because the QuickJS bytecode compilation path rejects duplicate group names before the custom parser/compiler can handle them.","next_action_hint":"Do not retry VM-parser-only duplicate named group handling unchanged. The fix must happen before or inside QuickJS bytecode compilation (source transform, vendored QuickJS patch, or a higher-level test/source preprocessing strategy that preserves semantics)."}}
{"type":"config","name":"String Test262 compatibility 550-case expansion","metricName":"compatibility_failures","metricUnit":"","bestDirection":"lower"}
{"run":1252,"commit":"126aec2","metric":36,"metrics":{"compiler_test262_cases":550,"compiler_test262_pass":514,"compiler_test262_failures":36,"compiler_test262_compiler_errors":0,"compiler_test262_compiler_crashes":0,"compiler_test262_compiler_fails":0,"compiler_test262_both_fail":35,"compiler_test262_interpreter_fail_compiler_pass":0,"compatibility_pass":514,"compatibility_cases":550,"compiler_errors":0,"compiler_crashes":0,"compiler_fails":0,"both_fail":35,"interpreter_fail_compiler_pass":0,"elapsed_ms":21355},"status":"keep","description":"Baseline String 550-case expansion","timestamp":1778690965585,"segment":69,"confidence":null,"iterationTokens":124,"asi":{"hypothesis":"Rebaseline after the 500-case workload plateaued at two QuickJS duplicate-named-group parser failures; expanding to 550 exposes the next String compatibility cluster.","workload":"AUTORESEARCH_TEST262_CATEGORY=built-ins/String TEST262_LIMIT=550 TEST262_ERROR_LIMIT=260 ./autoresearch.sh","baseline_note":"New 550-case baseline has 36 failures, 514 passes, no compiler errors/crashes/fails."}}
{"run":1253,"commit":"6688649","metric":34,"metrics":{"compiler_test262_cases":550,"compiler_test262_pass":516,"compiler_test262_failures":34,"compiler_test262_compiler_errors":0,"compiler_test262_compiler_crashes":0,"compiler_test262_compiler_fails":0,"compiler_test262_both_fail":34,"compiler_test262_interpreter_fail_compiler_pass":0,"compatibility_pass":516,"compatibility_cases":550,"compiler_errors":0,"compiler_crashes":0,"compiler_fails":0,"both_fail":34,"interpreter_fail_compiler_pass":0,"elapsed_ms":20154},"status":"keep","description":"Validate String repeat counts","timestamp":1778691185228,"segment":69,"confidence":null,"iterationTokens":10262,"asi":{"hypothesis":"String.prototype.repeat should use ToIntegerOrInfinity and throw RangeError for negative or infinite counts instead of passing invalid counts to binary copy.","fixed_focus":"built-ins/String/prototype/repeat/count-is-infinity-throws.js","remaining_cluster":"Most remaining 550-case failures are String.prototype.replace semantics plus the two duplicate named RegExp group parser failures."}}
{"run":1254,"commit":"7d74d0f","metric":5,"metrics":{"compiler_test262_cases":550,"compiler_test262_pass":545,"compiler_test262_failures":5,"compiler_test262_compiler_errors":0,"compiler_test262_compiler_crashes":0,"compiler_test262_compiler_fails":0,"compiler_test262_both_fail":4,"compiler_test262_interpreter_fail_compiler_pass":0,"compatibility_pass":545,"compatibility_cases":550,"compiler_errors":0,"compiler_crashes":0,"compiler_fails":0,"both_fail":4,"interpreter_fail_compiler_pass":0,"elapsed_ms":20235},"status":"keep","description":"Implement String replace semantics","timestamp":1778691444788,"segment":69,"confidence":15.5,"iterationTokens":3921,"asi":{"hypothesis":"String.prototype.replace needs ToString search/replacement coercion, callable replacement invocation, RegExp literal handling, global replacement, and basic replacement-token substitution.","fixed_focus":"Representative replace string, regexp, replacement-token, and function-replacement tests pass (A1_T1, A2_T6, A2_T2, A4_T1).","remaining_failures":"550-case workload dropped from 34 to 5; remaining failures are duplicate named RegExp groups plus a few replace edge cases."}}
{"run":1255,"commit":"810b392","metric":2,"metrics":{"compiler_test262_cases":550,"compiler_test262_pass":548,"compiler_test262_failures":2,"compiler_test262_compiler_errors":0,"compiler_test262_compiler_crashes":0,"compiler_test262_compiler_fails":0,"compiler_test262_both_fail":2,"compiler_test262_interpreter_fail_compiler_pass":0,"compatibility_pass":548,"compatibility_cases":550,"compiler_errors":0,"compiler_crashes":0,"compiler_fails":0,"both_fail":2,"interpreter_fail_compiler_pass":0,"elapsed_ms":20097},"status":"keep","description":"Handle replace edge cases","timestamp":1778691871127,"segment":69,"confidence":2.193548387096774,"iterationTokens":9219,"asi":{"hypothesis":"Remaining replace failures need undefined this for callable replacements, TypeError when searchValue ToPrimitive returns a RegExp object, and global empty-RegExp replacement metadata from constructed RegExp flags.","fixed_focus":"S15.5.4.11_A12.js, S15.5.4.11_A1_T15.js, and S15.5.4.11_A1_T17.js","remaining_failures":"The 550-case workload is down to the two duplicate named RegExp group parser failures."}}
{"type":"config","name":"String Test262 compatibility 600-case expansion","metricName":"compatibility_failures","metricUnit":"","bestDirection":"lower"}
