{"run":280,"commit":"7e255bb","metric":525,"metrics":{"parser_tests":276,"parser_test_ms":500},"status":"keep","description":"Port super constructor call coverage","timestamp":1777223703530,"segment":0,"confidence":4.015503875968992,"iterationTokens":976,"asi":{"hypothesis":"Derived class constructors should preserve direct `super(...)` calls and arguments in the AST.","learned":"No implementation change was required; `super(value)` parses as a CallExpression with callee identifier `super` inside a constructor method body.","quickjs_cases":"Adds QuickJS-compatible class coverage for `constructor(value) { super(value); }`."}}
{"run":281,"commit":"4d30dd7","metric":527,"metrics":{"parser_tests":277,"parser_test_ms":500},"status":"keep","description":"Port object spread coverage","timestamp":1777223794795,"segment":0,"confidence":4.0310077519379846,"iterationTokens":3735,"asi":{"hypothesis":"Object expression parsing should preserve spread elements among data and shorthand properties.","learned":"No implementation change was required; object literal parsing represents `...rest` as a SpreadElement in property order.","quickjs_cases":"Adds QuickJS-compatible object literal coverage for `{ a: 1, ...rest, b }`."}}
{"run":282,"commit":"e1c7598","metric":529,"metrics":{"parser_tests":278,"parser_test_ms":500},"status":"keep","description":"Port object rest not-last diagnostics","timestamp":1777223889187,"segment":0,"confidence":4.015384615384615,"iterationTokens":2045,"asi":{"hypothesis":"Object binding patterns should diagnose a rest element followed by another binding property while recovering the remaining pattern.","learned":"Object pattern parsing now reports `rest element must be last` when a comma follows a rest element and continues parsing later properties for recovery.","quickjs_cases":"Adds QuickJS-compatible destructuring diagnostics for `var { ...rest, after } = object;`."}}
{"run":283,"commit":"a270e92","metric":531,"metrics":{"parser_tests":279,"parser_test_ms":500},"status":"keep","description":"Port array rest not-last diagnostics","timestamp":1777223952518,"segment":0,"confidence":4,"iterationTokens":1668,"asi":{"hypothesis":"Array binding patterns should diagnose a rest element followed by another binding element while recovering the remaining pattern.","learned":"Array pattern parsing now reports `rest element must be last` when a comma follows a rest element and continues parsing later elements for recovery.","quickjs_cases":"Adds QuickJS-compatible destructuring diagnostics for `var [first, ...rest, after] = value;`."}}
{"run":284,"commit":"f6c1aeb","metric":533,"metrics":{"parser_tests":280,"parser_test_ms":500},"status":"keep","description":"Port module await binding diagnostics","timestamp":1777224108695,"segment":0,"confidence":4.015267175572519,"iterationTokens":6138,"asi":{"hypothesis":"`await` should be rejected as a binding identifier when parsing module source, even though it remains allowed in script bindings.","learned":"Binding identifier parsing now checks parser source_type and emits the existing binding diagnostic for keyword `await` in modules.","quickjs_cases":"Adds QuickJS-compatible module diagnostics for `var await;` with `source_type: :module`."}}
{"run":285,"commit":"e69d27f","metric":536,"metrics":{"parser_tests":282,"parser_test_ms":500},"status":"keep","description":"Port strict function name diagnostics","timestamp":1777224222092,"segment":0,"confidence":4.038167938931298,"iterationTokens":4189,"asi":{"hypothesis":"Strict function bodies should reject declaration/expression binding names `eval` and `arguments`.","learned":"Function declaration/expression parsing now validates restricted function names when the body directive prologue contains `use strict`.","quickjs_cases":"Adds QuickJS-compatible strict diagnostics for `function eval() { \"use strict\"; }` and named function expression `arguments`."}}
{"run":286,"commit":"527ab23","metric":539,"metrics":{"parser_tests":284,"parser_test_ms":500},"status":"keep","description":"Port strict program binding diagnostics","timestamp":1777224315215,"segment":0,"confidence":4.03030303030303,"iterationTokens":2585,"asi":{"hypothesis":"A top-level strict directive should reject `eval` and `arguments` as program binding names.","learned":"Program parsing now validates top-level variable/function/class binding names when the directive prologue contains `use strict`, reusing binding-name extraction for patterns.","quickjs_cases":"Adds QuickJS-compatible strict diagnostics for top-level `var eval` and `function arguments()`."}}
{"run":287,"commit":"67f393a","metric":542,"metrics":{"parser_tests":286,"parser_test_ms":600},"status":"keep","description":"Port strict function body binding diagnostics","timestamp":1777224384519,"segment":0,"confidence":4.022556390977444,"iterationTokens":1390,"asi":{"hypothesis":"Strict function bodies should reject `eval` and `arguments` declarations in the function body, not only in parameter lists or function names.","learned":"Strict function-parameter validation now also checks top-level bindings parsed from the strict function body using the same restricted-name helper.","quickjs_cases":"Adds QuickJS-compatible strict diagnostics for `var eval` and nested `function arguments()` inside a strict function body."}}
{"run":288,"commit":"cb289a9","metric":544,"metrics":{"parser_tests":287,"parser_test_ms":500},"status":"keep","description":"Port strict catch binding diagnostics","timestamp":1777224490532,"segment":0,"confidence":4.037593984962406,"iterationTokens":4259,"asi":{"hypothesis":"Strict function body validation should include catch binding parameters such as `catch (eval)`.","learned":"Strict body binding collection now walks blocks, control-flow statements, switch clauses, and try/catch/finally, including catch parameters while avoiding nested function bodies.","quickjs_cases":"Adds QuickJS-compatible strict diagnostics for `catch (eval)` inside a strict function."}}
{"run":289,"commit":"7cd12c6","metric":546,"metrics":{"parser_tests":288,"parser_test_ms":500},"status":"keep","description":"Port strict loop binding diagnostics","timestamp":1777224553363,"segment":0,"confidence":4.052631578947368,"iterationTokens":968,"asi":{"hypothesis":"Strict body binding validation should include declarations introduced by for-in loop heads.","learned":"The recursive strict binding collector handles ForInStatement left declarations, so `var arguments in object` is reported under a strict function body.","quickjs_cases":"Adds QuickJS-compatible strict diagnostics for `for (var arguments in object)` inside a strict function."}}
{"run":290,"commit":"95b5a3e","metric":548,"metrics":{"parser_tests":289,"parser_test_ms":500},"status":"keep","description":"Port strict switch binding diagnostics","timestamp":1777224616882,"segment":0,"confidence":4.037313432835821,"iterationTokens":1047,"asi":{"hypothesis":"Strict body binding validation should include declarations inside switch case consequents.","learned":"The recursive strict binding collector handles SwitchStatement cases, so restricted names declared in case consequents are diagnosed.","quickjs_cases":"Adds QuickJS-compatible strict diagnostics for `switch (...) { case 1: var eval; }` inside a strict function."}}
{"run":291,"commit":"ed1c855","metric":551,"metrics":{"parser_tests":291,"parser_test_ms":500},"status":"keep","description":"Port strict class body binding diagnostics","timestamp":1777224774340,"segment":0,"confidence":4.059701492537314,"iterationTokens":9644,"asi":{"hypothesis":"Class method bodies and static blocks are strict contexts and should reject body bindings named `eval` or `arguments`.","learned":"Class method/accessor parsing and static block parsing now validate strict body bindings, reusing the recursive body binding collector.","quickjs_cases":"Adds QuickJS-compatible diagnostics for `var eval` inside a class method and `var arguments` inside a static block."}}
{"run":292,"commit":"d98d8e5","metric":553,"metrics":{"parser_tests":292,"parser_test_ms":500},"status":"keep","description":"Port strict object method body binding diagnostics","timestamp":1777224837862,"segment":0,"confidence":4.044444444444444,"iterationTokens":966,"asi":{"hypothesis":"Object methods with a strict directive should reject restricted body bindings just like regular strict functions.","learned":"No implementation change was required after strict function body binding validation; object method parsing reuses validate_strict_function_params for directive-sensitive strict body checks.","quickjs_cases":"Adds QuickJS-compatible diagnostics for `object = { method() { \"use strict\"; var eval; } };`."}}
{"run":293,"commit":"a0427bb","metric":555,"metrics":{"parser_tests":293,"parser_test_ms":500},"status":"keep","description":"Port strict arrow body binding diagnostics","timestamp":1777224895986,"segment":0,"confidence":4.029411764705882,"iterationTokens":942,"asi":{"hypothesis":"Arrow functions with a strict directive body should reject restricted body bindings.","learned":"No implementation change was required; arrow parsing reuses strict function validation and now benefits from recursive body binding checks.","quickjs_cases":"Adds QuickJS-compatible diagnostics for `() => { \"use strict\"; var arguments; }`."}}
{"run":294,"commit":"a90ac20","metric":558,"metrics":{"parser_tests":295,"parser_test_ms":600},"status":"keep","description":"Port module strict binding diagnostics","timestamp":1777224961611,"segment":0,"confidence":4.051470588235294,"iterationTokens":1731,"asi":{"hypothesis":"Modules are strict contexts and should reject top-level `eval` and `arguments` binding names even without a strict directive.","learned":"Program strict binding validation now treats `source_type: :module` as strict in addition to explicit directive prologues.","quickjs_cases":"Adds QuickJS-compatible module diagnostics for `var eval;` and `function arguments() {}` in module source."}}
{"run":295,"commit":"4a58e5c","metric":560,"metrics":{"parser_tests":296,"parser_test_ms":500},"status":"keep","description":"Port module nested strict binding diagnostics","timestamp":1777225020158,"segment":0,"confidence":4.0661764705882355,"iterationTokens":944,"asi":{"hypothesis":"Module strict binding validation should include nested statement bindings such as declarations inside block statements.","learned":"No implementation change was required after module strict mode validation; the recursive binding collector catches `let eval` inside an if-block.","quickjs_cases":"Adds QuickJS-compatible module diagnostics for `if (enabled) { let eval = value; }`."}}
{"run":296,"commit":"7006827","metric":563,"metrics":{"parser_tests":298,"parser_test_ms":500},"status":"keep","description":"Port strict with statement diagnostics","timestamp":1777225117805,"segment":0,"confidence":4.0583941605839415,"iterationTokens":2660,"asi":{"hypothesis":"Strict script/function contexts should reject with-statements while preserving parsed statement AST for recovery.","learned":"Strict validation now traverses statement bodies and emits `with statement not allowed in strict mode` for strict program and function bodies.","quickjs_cases":"Adds QuickJS-compatible diagnostics for top-level strict `with` and function-body strict `with`."}}
{"run":297,"commit":"3094d25","metric":565,"metrics":{"parser_tests":299,"parser_test_ms":500},"status":"keep","description":"Port module with statement diagnostics","timestamp":1777225177179,"segment":0,"confidence":4.043478260869565,"iterationTokens":899,"asi":{"hypothesis":"Module source is strict and should reject with-statements without requiring an explicit directive.","learned":"No implementation change was required after module strict validation; source_type module now feeds strict with-statement checks.","quickjs_cases":"Adds QuickJS-compatible module diagnostics for `with (object) { value; }`."}}
{"run":298,"commit":"748eb35","metric":567,"metrics":{"parser_tests":300,"parser_test_ms":500},"status":"keep","description":"Port class with statement diagnostics","timestamp":1777225233902,"segment":0,"confidence":4.057971014492754,"iterationTokens":874,"asi":{"hypothesis":"Class method bodies are strict and should reject with-statements even without a strict directive.","learned":"No implementation change was required after class strict body validation; class methods feed implicit strict with-statement checks.","quickjs_cases":"Adds QuickJS-compatible diagnostics for `with` inside a class method body."}}
{"run":299,"commit":"a168734","metric":570,"metrics":{"parser_tests":302,"parser_test_ms":500},"status":"keep","description":"Port strict delete identifier diagnostics","timestamp":1777225374344,"segment":0,"confidence":4.079710144927536,"iterationTokens":6464,"asi":{"hypothesis":"Strict code should reject `delete identifier` while allowing `delete object.property`.","learned":"Strict validation now traverses statement expressions and reports `delete of identifier not allowed in strict mode` for delete unary expressions whose argument is an identifier.","quickjs_cases":"Adds QuickJS-compatible strict diagnostics for `delete value` and allowance coverage for `delete object.value`."}}
{"run":300,"commit":"f61b96f","metric":572,"metrics":{"parser_tests":303,"parser_test_ms":600},"status":"keep","description":"Port module delete identifier diagnostics","timestamp":1777225431538,"segment":0,"confidence":4.0647482014388485,"iterationTokens":897,"asi":{"hypothesis":"Module source should reject `delete identifier` because modules are strict contexts.","learned":"No implementation change was required after strict delete validation; module strict mode feeds the same delete-identifier check.","quickjs_cases":"Adds QuickJS-compatible module diagnostics for `delete value;`."}}
{"run":301,"commit":"01f75ae","metric":574,"metrics":{"parser_tests":304,"parser_test_ms":500},"status":"keep","description":"Port class delete identifier diagnostics","timestamp":1777225498558,"segment":0,"confidence":4.05,"iterationTokens":957,"asi":{"hypothesis":"Class method bodies should reject `delete identifier` because class bodies are strict contexts.","learned":"No implementation change was required after class strict body validation; class methods feed the strict delete-identifier traversal.","quickjs_cases":"Adds QuickJS-compatible diagnostics for `delete value` inside a class method."}}
{"run":302,"commit":"9a57044","metric":577,"metrics":{"parser_tests":306,"parser_test_ms":500},"status":"keep","description":"Port strict legacy octal diagnostics","timestamp":1777225609215,"segment":0,"confidence":4.071428571428571,"iterationTokens":2968,"asi":{"hypothesis":"Strict code should reject legacy decimal-looking octal integer literals while sloppy scripts remain accepted.","learned":"Strict validation now traverses statement expressions and reports `legacy octal literal not allowed in strict mode` for numeric literal raw forms like `010`.","quickjs_cases":"Adds QuickJS-compatible strict diagnostics for `\"use strict\"; value = 010;` plus sloppy allowance coverage."}}
{"run":303,"commit":"f8b395b","metric":579,"metrics":{"parser_tests":307,"parser_test_ms":500},"status":"keep","description":"Port module legacy octal diagnostics","timestamp":1777225679524,"segment":0,"confidence":4.085714285714285,"iterationTokens":1193,"asi":{"hypothesis":"Module source should reject legacy octal literals because modules are strict contexts.","learned":"No implementation change was required after strict legacy-octal validation; module strict mode feeds the same literal raw-form check.","quickjs_cases":"Adds QuickJS-compatible module diagnostics for `value = 010;`."}}
{"run":304,"commit":"ff1d64c","metric":581,"metrics":{"parser_tests":308,"parser_test_ms":500},"status":"keep","description":"Port class legacy octal diagnostics","timestamp":1777225746488,"segment":0,"confidence":4.070921985815603,"iterationTokens":890,"asi":{"hypothesis":"Class method bodies should reject legacy octal literals because class method code is strict.","learned":"No implementation change was required after class strict body validation; class method return expressions feed strict legacy-octal checks.","quickjs_cases":"Adds QuickJS-compatible diagnostics for `return 010` inside a class method."}}
{"run":305,"commit":"47b7f3b","metric":584,"metrics":{"parser_tests":310,"parser_test_ms":600},"status":"keep","description":"Port strict restricted assignment diagnostics","timestamp":1777225832584,"segment":0,"confidence":4.063380281690141,"iterationTokens":2130,"asi":{"hypothesis":"Strict code should reject assignments and compound assignments targeting `eval` or `arguments`.","learned":"Strict validation now traverses statement expressions and reports `restricted assignment target in strict mode` for assignment expressions whose left side is `eval` or `arguments`.","quickjs_cases":"Adds QuickJS-compatible diagnostics for strict `eval = value` and `arguments += value`."}}
{"run":306,"commit":"bd2c1f3","metric":587,"metrics":{"parser_tests":312,"parser_test_ms":500},"status":"keep","description":"Port strict restricted update diagnostics","timestamp":1777225960146,"segment":0,"confidence":4.084507042253521,"iterationTokens":5021,"asi":{"hypothesis":"Strict code should reject prefix and postfix update expressions targeting `eval` or `arguments`.","learned":"Strict restricted-target validation now treats UpdateExpression targets named `eval` or `arguments` like assignment targets.","quickjs_cases":"Adds QuickJS-compatible diagnostics for strict `eval++` and `++arguments`."}}
{"run":307,"commit":"21950b0","metric":589,"metrics":{"parser_tests":313,"parser_test_ms":600},"status":"keep","description":"Port module restricted update diagnostics","timestamp":1777226016545,"segment":0,"confidence":4.098591549295775,"iterationTokens":890,"asi":{"hypothesis":"Module source should reject update expressions targeting `eval` because modules are strict contexts.","learned":"No implementation change was required after strict update target validation; module strict mode feeds the same restricted-target checks.","quickjs_cases":"Adds QuickJS-compatible module diagnostics for `eval++;`."}}
{"run":308,"commit":"d38741d","metric":592,"metrics":{"parser_tests":315,"parser_test_ms":500},"status":"keep","description":"Port strict destructuring assignment diagnostics","timestamp":1777226120855,"segment":0,"confidence":4.090909090909091,"iterationTokens":2630,"asi":{"hypothesis":"Strict destructuring assignments should reject `eval` and `arguments` within object or array assignment targets.","learned":"Restricted assignment target validation now descends through object/array expression targets, properties, spread elements, and assignment patterns.","quickjs_cases":"Adds QuickJS-compatible diagnostics for strict `({ eval } = object)` and `[arguments] = array`."}}
{"run":309,"commit":"6494d93","metric":594,"metrics":{"parser_tests":316,"parser_test_ms":500},"status":"keep","description":"Port module destructuring assignment diagnostics","timestamp":1777226186028,"segment":0,"confidence":4.076388888888889,"iterationTokens":911,"asi":{"hypothesis":"Module destructuring assignments should reject restricted names in assignment targets because modules are strict contexts.","learned":"No implementation change was required after strict destructuring target validation; module strict mode feeds the same target traversal.","quickjs_cases":"Adds QuickJS-compatible module diagnostics for `({ eval } = object);`."}}
{"run":310,"commit":"904ca5a","metric":596,"metrics":{"parser_tests":317,"parser_test_ms":600},"status":"keep","description":"Port strict class name diagnostics","timestamp":1777226270804,"segment":0,"confidence":4.090277777777778,"iterationTokens":1213,"asi":{"hypothesis":"Strict programs should reject class declaration binding names `eval` and `arguments`.","learned":"No implementation change was required; strict program binding collection already includes class declaration identifiers.","quickjs_cases":"Adds QuickJS-compatible strict diagnostics for `\"use strict\"; class eval {}`."}}
{"run":311,"commit":"7eefb2c","metric":598,"metrics":{"parser_tests":318,"parser_test_ms":600},"status":"keep","description":"Port module class name diagnostics","timestamp":1777226334668,"segment":0,"confidence":4.104166666666667,"iterationTokens":875,"asi":{"hypothesis":"Module class declarations should reject restricted binding names because modules are strict contexts.","learned":"No implementation change was required; module strict binding collection includes class declaration identifiers.","quickjs_cases":"Adds QuickJS-compatible module diagnostics for `class arguments {}`."}}
{"run":312,"commit":"a52ebae","metric":600,"metrics":{"parser_tests":319,"parser_test_ms":500},"status":"keep","description":"Port module await function name diagnostics","timestamp":1777226394767,"segment":0,"confidence":4.089655172413793,"iterationTokens":1025,"asi":{"hypothesis":"Module function declarations should reject `await` as a binding name.","learned":"No implementation change was required; binding identifier parsing rejects keyword `await` when source_type is module.","quickjs_cases":"Adds QuickJS-compatible module diagnostics for `function await() {}`."}}
{"run":313,"commit":"25f7421","metric":602,"metrics":{"parser_tests":320,"parser_test_ms":600},"status":"keep","description":"Port module await class name diagnostics","timestamp":1777226452910,"segment":0,"confidence":4.075342465753424,"iterationTokens":870,"asi":{"hypothesis":"Module class declarations should reject `await` as a binding name.","learned":"No implementation change was required; class declaration parsing uses the same module-aware binding identifier parser.","quickjs_cases":"Adds QuickJS-compatible module diagnostics for `class await {}`."}}
