{"run":30,"commit":"5f0b06b","metric":69,"metrics":{"parser_tests":45,"parser_test_ms":300},"status":"keep","description":"Port QuickJS-compatible computed property coverage","timestamp":1777200902207,"segment":0,"confidence":3.757575757575758,"iterationTokens":4078,"asi":{"hypothesis":"Adding computed property keys to object literal parsing should improve compatibility with dynamic property names and object methods.","learned":"A `parse_property_key_with_computed/1` helper lets regular properties and methods carry a computed flag while preserving existing parse_property_key callers for imports/exports/classes.","quickjs_cases":"Adds QuickJS-compatible coverage for object literal computed property and computed method syntax: `{ [name]: 1, [method]() { ... } }`."}}
{"run":31,"commit":"87867d2","metric":72,"metrics":{"parser_tests":47,"parser_test_ms":400},"status":"keep","description":"Port QuickJS-compatible const initializer coverage","timestamp":1777200983556,"segment":0,"confidence":3.823529411764706,"iterationTokens":1482,"asi":{"hypothesis":"Adding a const-declaration initializer check improves syntax diagnostics without changing the parser AST shape for valid declarations.","learned":"Validation can run after declarator parsing and before semicolon consumption; it reports an error while preserving the partial VariableDeclaration AST.","quickjs_cases":"Adds QuickJS-compatible coverage for invalid `const value;` and valid `const value = 1;` declaration syntax."}}
{"run":32,"commit":"87867d2","metric":74,"metrics":{"parser_tests":48,"parser_test_ms":300},"status":"checks_failed","description":"Attempt QuickJS debugger statement coverage","timestamp":1777201074016,"segment":0,"confidence":3.7142857142857144,"iterationTokens":1221,"asi":{"hypothesis":"Adding DebuggerStatement parsing should cover a simple JavaScript statement form with negligible parser risk.","rollback_reason":"Backpressure checks failed in known flaky BeamProcess monitor timing test (`noproc` instead of `kaboom`), requiring checks_failed and auto-revert.","next_action_hint":"Reapply the DebuggerStatement AST/parser/test change and rerun; likely keep if web_apis check does not hit the unrelated timing flake."}}
{"run":33,"commit":"3833dd3","metric":74,"metrics":{"parser_tests":48,"parser_test_ms":400},"status":"keep","description":"Port QuickJS-compatible debugger statement coverage","timestamp":1777201160480,"segment":0,"confidence":3.526315789473684,"iterationTokens":1725,"asi":{"hypothesis":"Adding DebuggerStatement parsing should cover a simple JavaScript statement form with negligible parser risk.","learned":"Debugger parsing is a statement-level keyword case that can consume an optional semicolon using the existing ASI helper.","quickjs_cases":"Adds QuickJS-compatible parser coverage for `debugger;`."}}
{"run":34,"commit":"eb7ffb3","metric":76,"metrics":{"parser_tests":49,"parser_test_ms":400},"status":"keep","description":"Port QuickJS-compatible async generator coverage","timestamp":1777201204066,"segment":0,"confidence":3.6315789473684212,"iterationTokens":965,"asi":{"hypothesis":"Existing async-function and generator parsing should compose for async generator declarations and expressions; explicit coverage guards that combination.","learned":"No implementation change required: `consume_async_modifier/1` followed by `consume_generator_marker/1` handles `async function *` in both declarations and expressions.","quickjs_cases":"Adds QuickJS-compatible coverage for `async function *g() { ... }` and `async function *h() { ... }` expression syntax."}}
{"run":35,"commit":"eb7ffb3","metric":78,"metrics":{"parser_tests":50,"parser_test_ms":400},"status":"checks_failed","description":"Attempt QuickJS for-await-of parser coverage","timestamp":1777201348651,"segment":0,"confidence":3.6315789473684212,"iterationTokens":965,"asi":{"hypothesis":"Parsing optional `await` after `for` should support async iteration syntax while reusing existing ForOfStatement AST shape.","rollback_reason":"Backpressure checks failed in known Process.monitor timing flake (`noproc` instead of expected exit reason), so rules require checks_failed and revert.","next_action_hint":"Reapply for-await-of parser/test changes and rerun; consider running the focused flaky web API test separately only for diagnosis, not as a substitute for autoresearch checks."}}
{"run":36,"commit":"03fdb24","metric":78,"metrics":{"parser_tests":50,"parser_test_ms":300},"status":"keep","description":"Port QuickJS-compatible for-await-of coverage","timestamp":1777201403865,"segment":0,"confidence":3.55,"iterationTokens":2303,"asi":{"hypothesis":"Parsing optional `await` after `for` should support async iteration syntax while reusing existing ForOfStatement AST shape.","learned":"The existing for-of parser only needs to carry an `await?` flag from the `for await (` prefix into ForOfStatement; classic for and for-in remain unchanged structurally.","quickjs_cases":"Adds QuickJS-compatible coverage for `for await (const value of iterable) { await value; }` inside an async function."}}
{"run":37,"commit":"fe9e1ea","metric":80,"metrics":{"parser_tests":51,"parser_test_ms":400},"status":"keep","description":"Port QuickJS-compatible export-all coverage","timestamp":1777201472468,"segment":0,"confidence":3.8421052631578947,"iterationTokens":2809,"asi":{"hypothesis":"Adding export-all module declarations expands ES module coverage beyond named/default exports without touching script parsing.","learned":"`as` is another contextual identifier; export-all parsing must inspect the current token value rather than lexer keyword type.","quickjs_cases":"Adds QuickJS-compatible coverage for `export * from \"dep\";` and `export * as ns from \"dep2\";`."}}
{"run":38,"commit":"8256a18","metric":82,"metrics":{"parser_tests":52,"parser_test_ms":400},"status":"keep","description":"Port QuickJS-compatible import.meta coverage","timestamp":1777201535873,"segment":0,"confidence":3.75,"iterationTokens":1915,"asi":{"hypothesis":"Adding import.meta as a prefix meta-property handles another ES module-only expression without conflating it with dynamic import calls.","learned":"`import` now has two expression-level special cases: `import(` stays a call callee and `import.` creates a MetaProperty that can continue through normal member parsing.","quickjs_cases":"Adds QuickJS-compatible module expression coverage for `url = import.meta.url;`."}}
{"run":39,"commit":"6f886ed","metric":84,"metrics":{"parser_tests":53,"parser_test_ms":300},"status":"checks_failed","description":"Attempt QuickJS operator and update syntax coverage","timestamp":1777203440672,"segment":0,"confidence":3.5714285714285716,"iterationTokens":13037,"asi":{"hypothesis":"Porting QuickJS operator/update syntax should verify existing precedence handling and fix prefix update parsing for member/index operands.","rollback_reason":"Backpressure checks timed out without output after the focused parser benchmark passed, so autoresearch rules require checks_failed and auto-revert.","next_action_hint":"Reapply the small prefix-update/member-tail fix and QuickJS operator syntax test, then rerun; the parser change is localized to prefix update parsing."}}
{"run":40,"commit":"6f886ed","metric":84,"metrics":{"parser_tests":53,"parser_test_ms":300},"status":"checks_failed","description":"Retry QuickJS operator and update syntax coverage","timestamp":1777204211652,"segment":0,"confidence":3.488372093023256,"iterationTokens":1426,"asi":{"hypothesis":"Reapplying the prefix-update/member-tail fix should keep parser coverage passing and allow backpressure checks to recover after a timeout.","rollback_reason":"Backpressure checks timed out again with no captured output, so the experiment cannot be kept under autoresearch rules.","next_action_hint":"Defer this operator/update fix or investigate why `autoresearch.checks.sh` is timing out before retrying; try a no-op checks run from a clean tree to distinguish environment flake from parser changes."}}
{"run":41,"commit":"b2bf052","metric":84,"metrics":{"parser_tests":53,"parser_test_ms":400},"status":"keep","description":"Port QuickJS constructor and unary syntax coverage","timestamp":1777204311188,"segment":0,"confidence":3.5,"iterationTokens":1598,"asi":{"hypothesis":"Existing parser support for `new`, `delete`, and `typeof` should cover QuickJS constructor/delete/type queries from test_language without new implementation risk.","learned":"No parser changes were required for `new Object`, `new F(2)`, `delete a.x`, or `typeof unknown_var`; current prefix/new/member composition already handles them.","quickjs_cases":"Ports QuickJS `test_op2`/`test_delete` syntax shapes for constructor calls with and without arguments, delete of a member expression, and typeof of an identifier."}}
{"run":42,"commit":"5cda291","metric":86,"metrics":{"parser_tests":54,"parser_test_ms":500},"status":"keep","description":"Port QuickJS binary operator syntax coverage","timestamp":1777204371659,"segment":0,"confidence":3.761904761904762,"iterationTokens":1328,"asi":{"hypothesis":"Existing Pratt precedence and update-expression parsing should cover representative QuickJS arithmetic, exponentiation, postfix member updates, `in`, `instanceof`, and logical syntax.","learned":"No implementation change was required for binary/logical precedence or postfix member/index updates; prefix update of member/index operands remains a deferred parser-correctness issue from failed attempts.","quickjs_cases":"Ports QuickJS `test_op1`, `test_inc_dec`, and `test_op2` syntax shapes for exponentiation precedence, postfix updates, `in`, `instanceof`, and `&&`."}}
{"run":43,"commit":"6ecbe94","metric":88,"metrics":{"parser_tests":55,"parser_test_ms":400},"status":"keep","description":"Port QuickJS parameter pattern coverage","timestamp":1777204432787,"segment":0,"confidence":3.6818181818181817,"iterationTokens":1869,"asi":{"hypothesis":"Existing formal-parameter parsing should already cover QuickJS function-length syntax involving array/object patterns and defaulted pattern parameters.","learned":"No implementation change was required for arrow parameters using array patterns, object patterns, or defaulted array patterns.","quickjs_cases":"Ports QuickJS `test_function_length` syntax shapes for `([a,b]) => {}`, `({a,b}) => {}`, and `(c, [a,b] = 1, d) => {}`."}}
{"run":44,"commit":"6ecbe94","metric":90,"metrics":{"parser_tests":57,"parser_test_ms":400},"status":"checks_failed","description":"Attempt QuickJS invalid number literal coverage","timestamp":1777204570961,"segment":0,"confidence":3.6818181818181817,"iterationTokens":5286,"asi":{"hypothesis":"Porting QuickJS invalid number literal diagnostics should catch `0.a` and numeric-separator errors while preserving valid `0.` syntax.","rollback_reason":"Backpressure checks timed out immediately with no output, so autoresearch rules require checks_failed and auto-revert before switching tasks.","next_action_hint":"If resuming parser coverage later, reapply the localized lexer validation for dotted numeric literals followed by identifiers and split tests into focused files first."}}
{"run":45,"commit":"3389f33","metric":89,"metrics":{"parser_tests":57,"parser_test_ms":100},"status":"keep","description":"Port QuickJS dotted number literal coverage","timestamp":1777204876718,"segment":0,"confidence":3.727272727272727,"iterationTokens":12832,"asi":{"hypothesis":"QuickJS rejects `0.a` while accepting `0.`; adding a lexer-side check for dotted number literals followed by an identifier improves numeric literal diagnostics without changing valid tokenization.","learned":"The lexer already has the next byte available after number scanning, so validation can reject only the ambiguous `number.` + identifier case and preserve standalone `0.`.","quickjs_cases":"Ports QuickJS `test_number_literals` syntax coverage for invalid `0.a` and keeps valid `0.;` as a guard."}}
{"run":46,"commit":"3389f33","metric":89,"metrics":{"parser_tests":57,"parser_test_ms":100},"status":"discard","description":"Attempt inline QuickJS prefix update coverage","timestamp":1777204934393,"segment":0,"confidence":3.727272727272727,"iterationTokens":2656,"asi":{"hypothesis":"Adding prefix update member parsing to the existing binary operator test should improve QuickJS update-expression compatibility.","rollback_reason":"Focused tests and checks passed, but the primary metric did not improve because the coverage was folded into an existing QuickJS test rather than a distinct tracked coverage item.","next_action_hint":"Reapply the parser fix with a separate meaningful QuickJS prefix-update test so the coverage metric reflects the new case without redundant assertions."}}
{"run":47,"commit":"ab2ee4b","metric":91,"metrics":{"parser_tests":58,"parser_test_ms":100},"status":"keep","description":"Port QuickJS prefix update member coverage","timestamp":1777205004495,"segment":0,"confidence":3.8181818181818183,"iterationTokens":1347,"asi":{"hypothesis":"Prefix update parsing should accept member and computed-member operands just like postfix updates in QuickJS syntax.","learned":"Prefix update parsing must allow postfix member/index tails on the prefix operand before wrapping it in UpdateExpression; otherwise `++a[0]` parses as member access on `++a`.","quickjs_cases":"Ports QuickJS `test_inc_dec` syntax shapes for prefix update of object members and array elements: `++a.x` and `--a[0]`."}}
{"run":48,"commit":"adde1d2","metric":93,"metrics":{"parser_tests":59,"parser_test_ms":200},"status":"keep","description":"Port QuickJS delete member coverage","timestamp":1777205076446,"segment":0,"confidence":3.8222222222222224,"iterationTokens":2673,"asi":{"hypothesis":"Existing delete/member parsing should cover QuickJS delete edge syntax for computed string indexes and super-member deletion inside methods.","learned":"No implementation change was required; unary delete already allows member tails on its operand, including literal computed members and `super` member expressions inside object methods.","quickjs_cases":"Ports QuickJS `test_delete` syntax shapes for `delete \"abc\"[100]` and `delete super.a` inside an object method."}}
{"run":49,"commit":"2fb338e","metric":95,"metrics":{"parser_tests":60,"parser_test_ms":100},"status":"keep","description":"Port QuickJS arguments object syntax coverage","timestamp":1777205137633,"segment":0,"confidence":3.8260869565217392,"iterationTokens":2330,"asi":{"hypothesis":"Existing member/call parsing should cover QuickJS `arguments` object syntax and ordinary function calls from test_arguments.","learned":"No implementation change was required for `arguments.length`, `arguments[0]`, bare `arguments`, `gc()`, or calls with numeric arguments.","quickjs_cases":"Ports QuickJS `test_arguments` syntax shapes for `arguments.length`, indexed `arguments`, bare `arguments`, `gc()`, and `f2(1, 3)`/`f3(0)` calls."}}
{"run":50,"commit":"3a2a032","metric":97,"metrics":{"parser_tests":61,"parser_test_ms":100},"status":"keep","description":"Port QuickJS contextual class field coverage","timestamp":1777205198230,"segment":0,"confidence":4,"iterationTokens":3738,"asi":{"hypothesis":"Existing class-member parsing should handle QuickJS contextual `get`, `set`, `async`, and `static` class element syntax without treating every contextual word as a modifier.","learned":"No implementation change was required; class fields named `get`/`set`/`async`, arrow-valued fields, and a method literally named `static` already parse distinctly from accessors/static modifiers.","quickjs_cases":"Ports QuickJS `test_class` syntax shapes for class P: `get;`, `set;`, `async;`, arrow-valued class fields, and `static() { ... }` as a non-static method."}}
{"run":51,"commit":"ca6c58f","metric":99,"metrics":{"parser_tests":62,"parser_test_ms":100},"status":"keep","description":"Port QuickJS if syntax error coverage","timestamp":1777205259993,"segment":0,"confidence":4.380952380952381,"iterationTokens":1873,"asi":{"hypothesis":"Existing parser diagnostics should reject QuickJS `if` forms that omit required parenthesized conditions across literals, regexp/template literals, identifiers, and unicode escapes.","learned":"No implementation change was required; `parse_if_statement/1` already expects `(` and reports syntax errors for these QuickJS `test_syntax` inputs.","quickjs_cases":"Ports additional QuickJS `test_syntax` invalid inputs: `if 'abc'`, `if `abc``, `if /abc/`, `if abcd`, `if abc\\\\u0064`, and `if \\\\u0123`."}}
{"run":52,"commit":"7d397c1","metric":101,"metrics":{"parser_tests":63,"parser_test_ms":100},"status":"keep","description":"Port object destructuring assignment defaults","timestamp":1777205342108,"segment":0,"confidence":4.2727272727272725,"iterationTokens":2612,"asi":{"hypothesis":"Supporting shorthand default properties inside object assignment patterns expands destructuring coverage beyond declarations while staying within the existing AST shape.","learned":"Object property parsing can represent `b = 1` as a shorthand property whose value is an AssignmentPattern; this fixes `({ a, b = 1 } = obj)` without changing declaration binding-pattern parsing.","quickjs_cases":"Adds QuickJS-compatible object destructuring assignment coverage for `({ a, b = 1 } = obj);`, extending the QuickJS destructuring/template-skip coverage area."}}
{"run":53,"commit":"aa3f4a4","metric":103,"metrics":{"parser_tests":64,"parser_test_ms":100},"status":"keep","description":"Port array destructuring assignment rest coverage","timestamp":1777205407233,"segment":0,"confidence":4.173913043478261,"iterationTokens":1036,"asi":{"hypothesis":"Existing array spread parsing should cover the syntax shape used by rest elements in array destructuring assignment contexts.","learned":"No implementation change was required; `[a, ...rest] = value` is represented with the existing ArrayExpression and SpreadElement nodes in assignment-left position.","quickjs_cases":"Adds QuickJS-compatible array destructuring assignment coverage for `[a, ...rest] = value;`, complementing the existing QuickJS array binding and spread coverage."}}
{"run":54,"commit":"39c7b72","metric":105,"metrics":{"parser_tests":65,"parser_test_ms":100},"status":"keep","description":"Port QuickJS static this field coverage","timestamp":1777205492713,"segment":0,"confidence":4.355555555555555,"iterationTokens":2016,"asi":{"hypothesis":"Existing class field initializer parsing should cover QuickJS static field initializers that reference `this` through member expressions.","learned":"No implementation change was required; `this` is represented as an Identifier in expression position and composes with member parsing inside static field initializers.","quickjs_cases":"Ports QuickJS `test_class` syntax shape `class S { static z = this.x; }`."}}
{"run":55,"commit":"2cfa29f","metric":107,"metrics":{"parser_tests":66,"parser_test_ms":100},"status":"keep","description":"Port QuickJS grouped optional call coverage","timestamp":1777205617111,"segment":0,"confidence":4.545454545454546,"iterationTokens":1086,"asi":{"hypothesis":"Existing parenthesized-expression, optional-member, call, and member-tail parsing should compose for QuickJS grouped optional call chains.","learned":"No implementation change was required for `(a?.b)().c` or `(a?.[\"b\"])().c`; optional member expressions continue through call/member tails after grouping.","quickjs_cases":"Ports QuickJS `test_optional_chaining` syntax shapes `(a?.b)().c` and `(a?.[\"b\"])().c`."}}
{"run":56,"commit":"ee888d7","metric":109,"metrics":{"parser_tests":67,"parser_test_ms":100},"status":"keep","description":"Port QuickJS number member call coverage","timestamp":1777205684574,"segment":0,"confidence":4.533333333333333,"iterationTokens":1254,"asi":{"hypothesis":"Existing parenthesized literal and member-call parsing should cover QuickJS numeric conversion syntax using a large number followed by `.toString()`.","learned":"No implementation change was required for parenthesized number member calls; the parser preserves the large integer literal and composes member/call tails correctly.","quickjs_cases":"Ports QuickJS `test_cvt` syntax shape `(19686109595169230000).toString()`."}}
{"run":57,"commit":"fa2754c","metric":111,"metrics":{"parser_tests":68,"parser_test_ms":100},"status":"keep","description":"Port QuickJS boxed constructor syntax coverage","timestamp":1777205737276,"segment":0,"confidence":4.521739130434782,"iterationTokens":1317,"asi":{"hypothesis":"Existing `new` and equality parsing should cover QuickJS boxed primitive constructor expressions in comparison contexts.","learned":"No implementation change was required for parenthesized `new Number(...)`/`new String(...)` expressions on either side of equality operators.","quickjs_cases":"Ports QuickJS `test_eq` syntax shapes `(new Number(1)) == 1`, `2 == (new Number(2))`, and `(new String(\"abc\")) == \"abc\"`."}}
{"run":58,"commit":"fa2754c","metric":113,"metrics":{"parser_tests":69,"parser_test_ms":100},"status":"checks_failed","description":"Attempt QuickJS generator constructor coverage","timestamp":1777205805089,"segment":0,"confidence":4.622222222222222,"iterationTokens":1194,"asi":{"hypothesis":"Existing generator, `new`, and try/catch parsing should cover QuickJS generator-constructor TypeError syntax setup.","rollback_reason":"Backpressure checks failed in the known flaky BeamProcess monitor timing test (`noproc` instead of `kaboom`), so autoresearch rules require checks_failed and auto-revert.","next_action_hint":"Reapply the generator constructor syntax test and rerun; no parser implementation change was involved, so a clean retry should keep if web_apis does not hit the unrelated flake."}}
