{"run":667,"commit":"d8c318e","metric":117,"metrics":{"compiler_test262_cases":500,"compiler_test262_pass":383,"compiler_test262_failures":117,"compiler_test262_compiler_errors":0,"compiler_test262_compiler_crashes":0,"compiler_test262_compiler_fails":2,"compiler_test262_both_fail":109,"compiler_test262_interpreter_fail_compiler_pass":0,"compatibility_pass":383,"compatibility_cases":500,"compiler_errors":0,"compiler_crashes":0,"compiler_fails":2,"both_fail":109,"interpreter_fail_compiler_pass":0,"elapsed_ms":21682},"status":"keep","description":"Accept callable property descriptor objects","timestamp":1778052634604,"segment":24,"confidence":6.380952380952381,"iterationTokens":4730,"asi":{"hypothesis":"Object.create/defineProperties descriptor containers may be callable objects with own/inherited descriptor fields; treating functions/builtins/closures as descriptor objects should fix a large descriptor cluster.","improvement":"Fixed a large descriptor-container cluster, reducing bounded built-ins/Object failures from 148 to 117 and eliminating interpreter_fail_compiler_pass cases, with checks passing.","next_action_hint":"Continue descriptor validation clusters: non-object descriptor inputs, accessor/data conflicts, and Object.defineProperties pre-validation likely explain many of the remaining create/defineProperties failures."}}
{"run":668,"commit":"a50efb1","metric":115,"metrics":{"compiler_test262_cases":500,"compiler_test262_pass":385,"compiler_test262_failures":115,"compiler_test262_compiler_errors":0,"compiler_test262_compiler_crashes":0,"compiler_test262_compiler_fails":2,"compiler_test262_both_fail":107,"compiler_test262_interpreter_fail_compiler_pass":0,"compatibility_pass":385,"compatibility_cases":500,"compiler_errors":0,"compiler_crashes":0,"compiler_fails":2,"both_fail":107,"interpreter_fail_compiler_pass":0,"elapsed_ms":19646},"status":"keep","description":"Throw for invalid defineProperties inputs","timestamp":1778053005347,"segment":24,"confidence":4.857142857142857,"iterationTokens":5084,"asi":{"hypothesis":"ObjectDefineProperties must ToObject the properties argument and reject null/undefined and non-empty string descriptor containers whose enumerable chars are primitive descriptors.","improvement":"Fixed invalid properties-argument cases, reducing bounded built-ins/Object failures from 117 to 115 with checks passing.","next_action_hint":"Continue descriptor validation: many remaining failures expect TypeError for invalid descriptor combinations or non-configurable/non-writable attributes."}}
{"run":669,"commit":"233e727","metric":112,"metrics":{"compiler_test262_cases":500,"compiler_test262_pass":388,"compiler_test262_failures":112,"compiler_test262_compiler_errors":0,"compiler_test262_compiler_crashes":0,"compiler_test262_compiler_fails":2,"compiler_test262_both_fail":104,"compiler_test262_interpreter_fail_compiler_pass":0,"compatibility_pass":388,"compatibility_cases":500,"compiler_errors":0,"compiler_crashes":0,"compiler_fails":2,"both_fail":104,"interpreter_fail_compiler_pass":0,"elapsed_ms":20290},"status":"keep","description":"Validate Object.create properties argument","timestamp":1778053280527,"segment":24,"confidence":4.793103448275862,"iterationTokens":2723,"asi":{"hypothesis":"Object.create should invoke ObjectDefineProperties for any non-undefined Properties argument, so null and primitive property containers must be validated instead of ignored.","improvement":"Fixed Object.create invalid properties-argument cases, reducing bounded built-ins/Object failures from 115 to 112 with checks passing.","next_action_hint":"Continue TypeError cluster by validating getter/setter descriptor callability and data/accessor descriptor conflicts."}}
{"run":670,"commit":"67b6ca0","metric":100,"metrics":{"compiler_test262_cases":500,"compiler_test262_pass":400,"compiler_test262_failures":100,"compiler_test262_compiler_errors":0,"compiler_test262_compiler_crashes":0,"compiler_test262_compiler_fails":2,"compiler_test262_both_fail":92,"compiler_test262_interpreter_fail_compiler_pass":0,"compatibility_pass":400,"compatibility_cases":500,"compiler_errors":0,"compiler_crashes":0,"compiler_fails":2,"both_fail":92,"interpreter_fail_compiler_pass":0,"elapsed_ms":21356},"status":"keep","description":"Validate accessor property descriptors","timestamp":1778053714980,"segment":24,"confidence":5.033333333333333,"iterationTokens":13204,"asi":{"hypothesis":"ToPropertyDescriptor must reject descriptors that mix accessor/data fields and reject present get/set values that are neither undefined nor callable.","improvement":"Fixed the getter/setter callability and accessor/data conflict cluster, reducing bounded built-ins/Object failures from 112 to 100 with checks passing.","next_action_hint":"Continue descriptor validation clusters: non-configurable/non-writable attribute assertions and defineProperties pre-validation/order remain prominent."}}
{"run":671,"commit":"4df05ff","metric":88,"metrics":{"compiler_test262_cases":500,"compiler_test262_pass":412,"compiler_test262_failures":88,"compiler_test262_compiler_errors":0,"compiler_test262_compiler_crashes":0,"compiler_test262_compiler_fails":2,"compiler_test262_both_fail":80,"compiler_test262_interpreter_fail_compiler_pass":0,"compatibility_pass":412,"compatibility_cases":500,"compiler_errors":0,"compiler_crashes":0,"compiler_fails":2,"both_fail":80,"interpreter_fail_compiler_pass":0,"elapsed_ms":20657},"status":"keep","description":"Read accessor descriptor fields through getters","timestamp":1778054055681,"segment":24,"confidence":4.794117647058823,"iterationTokens":3557,"asi":{"hypothesis":"ToPropertyDescriptor must read descriptor fields via [[Get]], so accessor properties on descriptor objects should invoke getters instead of treating raw accessor tuples as descriptor values.","improvement":"Fixed accessor descriptor-field getter cases, reducing bounded built-ins/Object failures from 100 to 88 with checks passing.","next_action_hint":"Continue descriptor clusters: non-configurable/non-writable defaults and Object.assign Throw=true/array target semantics remain."}}
{"run":672,"commit":"1622f56","metric":61,"metrics":{"compiler_test262_cases":500,"compiler_test262_pass":439,"compiler_test262_failures":61,"compiler_test262_compiler_errors":0,"compiler_test262_compiler_crashes":0,"compiler_test262_compiler_fails":2,"compiler_test262_both_fail":53,"compiler_test262_interpreter_fail_compiler_pass":0,"compatibility_pass":439,"compatibility_cases":500,"compiler_errors":0,"compiler_crashes":0,"compiler_fails":2,"both_fail":53,"interpreter_fail_compiler_pass":0,"elapsed_ms":21171},"status":"keep","description":"Coerce descriptor attributes to booleans","timestamp":1778054542905,"segment":24,"confidence":5,"iterationTokens":4624,"asi":{"hypothesis":"Property descriptor boolean attributes writable/enumerable/configurable must be ToBoolean-coerced, including undefined or accessor-returned values, instead of stored as raw JS values.","improvement":"Fixed a large descriptor attribute cluster, reducing bounded built-ins/Object failures from 88 to 61 with checks passing.","next_action_hint":"Remaining failures are now likely Object.assign Throw=true/array semantics, builtin static function metadata/constructability, and smaller descriptor/prevalidation gaps."}}
{"run":673,"commit":"1622f56","metric":61,"metrics":{"compiler_test262_cases":500,"compiler_test262_pass":439,"compiler_test262_failures":61,"compiler_test262_compiler_errors":0,"compiler_test262_compiler_crashes":0,"compiler_test262_compiler_fails":2,"compiler_test262_both_fail":53,"compiler_test262_interpreter_fail_compiler_pass":0,"compatibility_pass":439,"compatibility_cases":500,"compiler_errors":0,"compiler_crashes":0,"compiler_fails":2,"both_fail":53,"interpreter_fail_compiler_pass":0,"elapsed_ms":21017},"status":"discard","description":"Expose builtin own metadata descriptors","timestamp":1778054873149,"segment":24,"confidence":5,"iterationTokens":5169,"asi":{"hypothesis":"Object static descriptor/name/length failures may require hasOwnProperty and getOwnPropertyDescriptor to expose builtin function name/length and Object static module methods as own non-enumerable properties.","rollback_reason":"Primary metric stayed at 61; these failures are not solved by virtual builtin metadata alone or are offset by descriptor expectation changes.","next_action_hint":"Do not retry standalone builtin metadata; inspect propertyHelper failure path for Object.assign/Object.create metadata before changing function statics again."}}
{"run":674,"commit":"1622f56","metric":56,"metrics":{"compiler_test262_cases":500,"compiler_test262_pass":444,"compiler_test262_failures":56,"compiler_test262_compiler_errors":0,"compiler_test262_compiler_crashes":0,"compiler_test262_compiler_fails":2,"compiler_test262_both_fail":48,"compiler_test262_interpreter_fail_compiler_pass":0,"compatibility_pass":444,"compatibility_cases":500,"compiler_errors":0,"compiler_crashes":0,"compiler_fails":2,"both_fail":48,"interpreter_fail_compiler_pass":0,"elapsed_ms":21527},"status":"checks_failed","description":"Throw on failed Object.assign sets","timestamp":1778054982766,"segment":24,"confidence":5,"iterationTokens":1571,"asi":{"hypothesis":"Object.assign should perform Set with Throw=true, throwing when setting read-only or non-extensible targets fails.","rollback_reason":"Primary metric improved from 61 to 56 but backpressure checks failed again, so the broad Set/Throw change is not safe.","next_action_hint":"Run the check command manually or targeted default suite to reveal which baseline regresses; likely Object.assign or Put.set behavior on arrays/prototypes needs a narrower Throw=true path."}}
{"run":675,"commit":"381e698","metric":44,"metrics":{"compiler_test262_cases":500,"compiler_test262_pass":456,"compiler_test262_failures":44,"compiler_test262_compiler_errors":0,"compiler_test262_compiler_crashes":0,"compiler_test262_compiler_fails":2,"compiler_test262_both_fail":36,"compiler_test262_interpreter_fail_compiler_pass":0,"compatibility_pass":456,"compatibility_cases":500,"compiler_errors":0,"compiler_crashes":0,"compiler_fails":2,"both_fail":36,"interpreter_fail_compiler_pass":0,"elapsed_ms":21996},"status":"keep","description":"Validate defineProperties targets and callable sources","timestamp":1778055351363,"segment":24,"confidence":5.376623376623376,"iterationTokens":11184,"asi":{"hypothesis":"Object.defineProperties must reject non-object targets, while ObjectDefineProperties must also enumerate callable properties objects such as functions with own descriptor properties.","improvement":"Fixed invalid defineProperties target cases and callable properties-object enumeration, reducing bounded built-ins/Object failures from 61 to 44 with checks passing.","next_action_hint":"Cluster remaining 44 failures; likely Object.assign Throw=true/array target, builtin static metadata/constructability, and isolated descriptor/callable edge cases."}}
{"run":676,"commit":"381e698","metric":44,"metrics":{"compiler_test262_cases":500,"compiler_test262_pass":456,"compiler_test262_failures":44,"compiler_test262_compiler_errors":0,"compiler_test262_compiler_crashes":0,"compiler_test262_compiler_fails":2,"compiler_test262_both_fail":35,"compiler_test262_interpreter_fail_compiler_pass":0,"compatibility_pass":456,"compatibility_cases":500,"compiler_errors":0,"compiler_crashes":0,"compiler_fails":2,"both_fail":35,"interpreter_fail_compiler_pass":0,"elapsed_ms":40876},"status":"discard","description":"Enumerate sparse qb_arr keys in Object.assign","timestamp":1778055742907,"segment":24,"confidence":5.3076923076923075,"iterationTokens":4826,"asi":{"hypothesis":"Array sources represented as sparse qb_arr should enumerate present indices for Object.assign and related object key enumeration.","rollback_reason":"Primary metric stayed at 44; qb_arr key enumeration only shifted failure categories and did not fix target-Array.","next_action_hint":"Do not retry raw qb_arr enumeration. Inspect focused Object.assign target-Array execution; target writes or dense list source representation are likely the issue."}}
{"run":677,"commit":"3a05882","metric":42,"metrics":{"compiler_test262_cases":500,"compiler_test262_pass":458,"compiler_test262_failures":42,"compiler_test262_compiler_errors":0,"compiler_test262_compiler_crashes":0,"compiler_test262_compiler_fails":2,"compiler_test262_both_fail":33,"compiler_test262_interpreter_fail_compiler_pass":0,"compatibility_pass":458,"compatibility_cases":500,"compiler_errors":0,"compiler_crashes":0,"compiler_fails":2,"both_fail":33,"interpreter_fail_compiler_pass":0,"elapsed_ms":38289},"status":"keep","description":"Enumerate custom array properties","timestamp":1778056315412,"segment":24,"confidence":5.428571428571429,"iterationTokens":5784,"asi":{"hypothesis":"ObjectDefineProperties should enumerate named own properties stored separately on array objects, not only numeric indices.","improvement":"Fixed array properties-object descriptor cases, reducing bounded built-ins/Object failures from 44 to 42 with checks passing.","next_action_hint":"Continue properties-object enumeration for other exotic objects such as arguments/errors, and inspect remaining crashes."}}
{"run":678,"commit":"ccd9e4e","metric":37,"metrics":{"compiler_test262_cases":500,"compiler_test262_pass":463,"compiler_test262_failures":37,"compiler_test262_compiler_errors":0,"compiler_test262_compiler_crashes":0,"compiler_test262_compiler_fails":2,"compiler_test262_both_fail":28,"compiler_test262_interpreter_fail_compiler_pass":0,"compatibility_pass":463,"compatibility_cases":500,"compiler_errors":0,"compiler_crashes":0,"compiler_fails":2,"both_fail":28,"interpreter_fail_compiler_pass":0,"elapsed_ms":37105},"status":"keep","description":"Return undefined for getterless accessors","timestamp":1778056697455,"segment":24,"confidence":5.631578947368421,"iterationTokens":3364,"asi":{"hypothesis":"Reading an accessor property without a getter through the prototype chain should return undefined, not the internal accessor tuple, so descriptor fields inherited as setter-only accessors default correctly.","improvement":"Fixed setter-only inherited descriptor field cases, reducing bounded built-ins/Object failures from 42 to 37 with checks passing.","next_action_hint":"Remaining failures are mostly Object.assign Throw=true/array target, builtin static metadata/constructability, and a few Object.create/defineProperties crash/compiler-only edge cases."}}
{"run":679,"commit":"ccd9e4e","metric":37,"metrics":{"compiler_test262_cases":500,"compiler_test262_pass":463,"compiler_test262_failures":37,"compiler_test262_compiler_errors":0,"compiler_test262_compiler_crashes":0,"compiler_test262_compiler_fails":2,"compiler_test262_both_fail":28,"compiler_test262_interpreter_fail_compiler_pass":0,"compatibility_pass":463,"compatibility_cases":500,"compiler_errors":0,"compiler_crashes":0,"compiler_fails":2,"both_fail":28,"interpreter_fail_compiler_pass":0,"elapsed_ms":41251},"status":"checks_failed","description":"Expose builtin function length reads","timestamp":1778056885062,"segment":24,"confidence":4.919540229885057,"iterationTokens":2619,"asi":{"hypothesis":"PropertyHelper metadata checks may require direct reads of builtin function length/name values through Get.get, not only descriptors.","rollback_reason":"Primary metric stayed at 37 and checks failed due ungrouped get_own/2 clauses; the approach is not promising as a standalone metadata fix.","next_action_hint":"Revert and avoid standalone builtin metadata changes; inspect actual propertyHelper path before retrying."}}
{"run":680,"commit":"ccd9e4e","metric":37,"metrics":{"compiler_test262_cases":500,"compiler_test262_pass":463,"compiler_test262_failures":37,"compiler_test262_compiler_errors":0,"compiler_test262_compiler_crashes":0,"compiler_test262_compiler_fails":2,"compiler_test262_both_fail":28,"compiler_test262_interpreter_fail_compiler_pass":0,"compatibility_pass":463,"compatibility_cases":500,"compiler_errors":0,"compiler_crashes":0,"compiler_fails":2,"both_fail":28,"interpreter_fail_compiler_pass":0,"elapsed_ms":34344},"status":"discard","description":"Include extra property keys in own descriptors","timestamp":1778057268434,"segment":24,"confidence":4.36734693877551,"iterationTokens":12975,"asi":{"hypothesis":"Remaining Error/Arguments properties-object cases may store named own keys outside the object map, so Object.getOwnPropertyDescriptors should include auxiliary array property keys.","rollback_reason":"Primary metric stayed at 37; auxiliary key enumeration does not address the remaining properties-object failures.","next_action_hint":"Inspect focused Error/arguments properties-object storage and descriptor enumeration rather than adding generic extra keys."}}
{"run":681,"commit":"aa22264","metric":33,"metrics":{"compiler_test262_cases":500,"compiler_test262_pass":467,"compiler_test262_failures":33,"compiler_test262_compiler_errors":0,"compiler_test262_compiler_crashes":0,"compiler_test262_compiler_fails":2,"compiler_test262_both_fail":30,"compiler_test262_interpreter_fail_compiler_pass":0,"compatibility_pass":467,"compatibility_cases":500,"compiler_errors":0,"compiler_crashes":0,"compiler_fails":2,"both_fail":30,"interpreter_fail_compiler_pass":0,"elapsed_ms":37155},"status":"keep","description":"Define named properties on array objects","timestamp":1778057709595,"segment":24,"confidence":4.36,"iterationTokens":19723,"asi":{"hypothesis":"Object.defineProperty should support non-index named properties on array objects via the array auxiliary property store instead of treating array storage as a plain map.","improvement":"Fixed remaining array descriptor-object crashes, reducing bounded built-ins/Object failures from 37 to 33 with checks passing.","next_action_hint":"Continue remaining create/defineProperties compiler-only and exotic properties-object failures; Object.assign Throw=true/metadata clusters still dominate."}}
{"run":682,"commit":"aa22264","metric":33,"metrics":{"compiler_test262_cases":500,"compiler_test262_pass":467,"compiler_test262_failures":33,"compiler_test262_compiler_errors":0,"compiler_test262_compiler_crashes":0,"compiler_test262_compiler_fails":2,"compiler_test262_both_fail":30,"compiler_test262_interpreter_fail_compiler_pass":0,"compatibility_pass":467,"compatibility_cases":500,"compiler_errors":0,"compiler_crashes":0,"compiler_fails":2,"both_fail":30,"interpreter_fail_compiler_pass":0,"elapsed_ms":39303},"status":"discard","description":"Fallback Object constructor reads to Object prototype","timestamp":1778058267392,"segment":24,"confidence":4.1923076923076925,"iterationTokens":13060,"asi":{"hypothesis":"The Object constructor should inherit Object.prototype methods such as hasOwnProperty when no Object static method matches, instead of treating Object.static_property as exhaustive.","rollback_reason":"Primary metric stayed at 33; focused metadata failures need a more coherent own/static property model, not just prototype fallback for reads.","next_action_hint":"Avoid single-path Object metadata tweaks; inspect focused propertyHelper/Object.hasOwnProperty behavior before retrying."}}
{"run":683,"commit":"416731e","metric":31,"metrics":{"compiler_test262_cases":500,"compiler_test262_pass":469,"compiler_test262_failures":31,"compiler_test262_compiler_errors":0,"compiler_test262_compiler_crashes":0,"compiler_test262_compiler_fails":2,"compiler_test262_both_fail":28,"compiler_test262_interpreter_fail_compiler_pass":0,"compatibility_pass":469,"compatibility_cases":500,"compiler_errors":0,"compiler_crashes":0,"compiler_fails":2,"both_fail":28,"interpreter_fail_compiler_pass":0,"elapsed_ms":36694},"status":"keep","description":"Hide built-in Error instance fields","timestamp":1778058508090,"segment":24,"confidence":4.11214953271028,"iterationTokens":2586,"asi":{"hypothesis":"Native Error objects used as ObjectDefineProperties properties containers should not expose built-in message/name/stack fields as enumerable descriptor candidates.","improvement":"Fixed Error properties-object cases, reducing bounded built-ins/Object failures from 33 to 31 with checks passing.","next_action_hint":"Continue Date/arguments properties-object edge cases and Object.assign/static metadata clusters."}}
{"run":684,"commit":"416731e","metric":31,"metrics":{"compiler_test262_cases":500,"compiler_test262_pass":469,"compiler_test262_failures":31,"compiler_test262_compiler_errors":0,"compiler_test262_compiler_crashes":0,"compiler_test262_compiler_fails":2,"compiler_test262_both_fail":28,"compiler_test262_interpreter_fail_compiler_pass":0,"compatibility_pass":469,"compatibility_cases":500,"compiler_errors":0,"compiler_crashes":0,"compiler_fails":2,"both_fail":28,"interpreter_fail_compiler_pass":0,"elapsed_ms":34386},"status":"discard","description":"Expose builtin own property descriptors","timestamp":1778058968503,"segment":24,"confidence":4,"iterationTokens":6211,"asi":{"hypothesis":"Object static methods and builtin functions should expose own property descriptors for propertyHelper metadata checks.","rollback_reason":"Focused descriptor probes improved, but primary metric stayed at 31; remaining metadata failures require Object constructor prototype/function inheritance or constructability, not descriptors alone.","next_action_hint":"Do not retry descriptor-only metadata. Investigate Object.hasOwnProperty/get prototype chain and isConstructor handling together."}}
