{"run":633,"commit":"f4aa5c7","metric":1,"metrics":{"compiler_test262_cases":52,"compiler_test262_pass":51,"compiler_test262_failures":1,"compiler_test262_compiler_errors":0,"compiler_test262_compiler_crashes":0,"compiler_test262_compiler_fails":0,"compiler_test262_both_fail":1,"compiler_test262_interpreter_fail_compiler_pass":0,"compatibility_pass":51,"compatibility_cases":52,"compiler_errors":0,"compiler_crashes":0,"compiler_fails":0,"both_fail":1,"interpreter_fail_compiler_pass":0,"elapsed_ms":2450},"status":"discard","description":"Track symbol keys in copy order metadata","timestamp":1778035546844,"segment":22,"confidence":2.782608695652174,"iterationTokens":13970,"asi":{"hypothesis":"Remaining spread-order failure is caused by incomplete key_order metadata for symbol keys and shape-backed sources, so preserving symbol keys in order metadata and ordering copy keys should make CopyDataProperties visit keys in OwnPropertyKeys order.","rollback_reason":"Focused ordering internals changed but the primary array metric remained at 1; spread-obj-spread-order still reported Symbol(foo) first.","next_action_hint":"The remaining order problem likely bypasses enumerable_copy_keys or originates before CopyDataProperties observes the source. Inspect decoded object-spread bytecode stack/source representation before changing copy helpers again."}}
{"type":"config","name":"QuickBEAM call-expression compatibility","metricName":"compatibility_failures","metricUnit":"","bestDirection":"lower"}
{"run":634,"commit":"3d8ee33","metric":11,"metrics":{"compiler_test262_cases":92,"compiler_test262_pass":81,"compiler_test262_failures":11,"compiler_test262_compiler_errors":0,"compiler_test262_compiler_crashes":0,"compiler_test262_compiler_fails":4,"compiler_test262_both_fail":4,"compiler_test262_interpreter_fail_compiler_pass":2,"compatibility_pass":81,"compatibility_cases":92,"compiler_errors":0,"compiler_crashes":0,"compiler_fails":4,"both_fail":4,"interpreter_fail_compiler_pass":2,"elapsed_ms":11278},"status":"keep","description":"Baseline call-expression compatibility workload","timestamp":1778035807035,"segment":23,"confidence":null,"iterationTokens":114,"asi":{"hypothesis":"Array expressions plateaued at one remaining shared order failure, so rebaseline the next broad compatibility phase on language/expressions/call.","baseline":"Call-expression workload baseline established at 11 compatibility failures out of 92 cases.","next_action_hint":"List and cluster call-expression failures, prioritizing clusters that improve total failures without benchmark-specific filtering."}}
{"run":635,"commit":"3bff918","metric":10,"metrics":{"compiler_test262_cases":92,"compiler_test262_pass":82,"compiler_test262_failures":10,"compiler_test262_compiler_errors":0,"compiler_test262_compiler_crashes":0,"compiler_test262_compiler_fails":4,"compiler_test262_both_fail":4,"compiler_test262_interpreter_fail_compiler_pass":2,"compatibility_pass":82,"compatibility_cases":92,"compiler_errors":0,"compiler_crashes":0,"compiler_fails":4,"both_fail":4,"interpreter_fail_compiler_pass":2,"elapsed_ms":11073},"status":"keep","description":"Reject non-callable builtin objects","timestamp":1778036095079,"segment":23,"confidence":null,"iterationTokens":14093,"asi":{"hypothesis":"Global builtin namespace objects like Math are represented as builtin tuples with a map payload, and Builtin.call/3 should treat them as non-callable instead of invoking the map as an Elixir function.","improvement":"Math() now throws a JavaScript TypeError instead of crashing, reducing call-expression failures from 11 to 10.","next_action_hint":"Remaining failures cluster around eval direct/spread semantics, one non-eval dynamic call compiler failure, the shared spread object order gap, and one old fooCalled case."}}
{"run":636,"commit":"3bff918","metric":10,"metrics":{"compiler_test262_cases":92,"compiler_test262_pass":82,"compiler_test262_failures":10,"compiler_test262_compiler_errors":0,"compiler_test262_compiler_crashes":0,"compiler_test262_compiler_fails":4,"compiler_test262_both_fail":4,"compiler_test262_interpreter_fail_compiler_pass":2,"compatibility_pass":82,"compatibility_cases":92,"compiler_errors":0,"compiler_crashes":0,"compiler_fails":4,"both_fail":4,"interpreter_fail_compiler_pass":2,"elapsed_ms":11239},"status":"discard","description":"Route compiled apply_eval through direct eval helper","timestamp":1778036552015,"segment":23,"confidence":null,"iterationTokens":14827,"asi":{"hypothesis":"Compiled eval(...spread) failures come from apply_eval lowering through generic Invocation.invoke_runtime instead of RuntimeHelpers.eval_or_call direct-eval handling.","rollback_reason":"Metric stayed at 10 and focused eval spread still left the local binding unchanged in compiled mode; direct eval local writeback is missing deeper than apply_eval dispatch.","next_action_hint":"Do not retry apply_eval routing alone. Inspect RuntimeHelpers.eval_source local/captured writeback for compiled direct eval before changing eval spread again."}}
{"run":637,"commit":"3bff918","metric":10,"metrics":{"compiler_test262_cases":92,"compiler_test262_pass":82,"compiler_test262_failures":10,"compiler_test262_compiler_errors":0,"compiler_test262_compiler_crashes":0,"compiler_test262_compiler_fails":4,"compiler_test262_both_fail":4,"compiler_test262_interpreter_fail_compiler_pass":2,"compatibility_pass":82,"compatibility_cases":92,"compiler_errors":0,"compiler_crashes":0,"compiler_fails":4,"both_fail":4,"interpreter_fail_compiler_pass":2,"elapsed_ms":11355},"status":"discard","description":"Track top-level current function for strict eval","timestamp":1778036934123,"segment":23,"confidence":null,"iterationTokens":6317,"asi":{"hypothesis":"Direct eval strictness failures come from top-level interpreter contexts not recording the current strict function, so eval code is compiled as sloppy code.","rollback_reason":"Focused top-level interpreter strict eval improved partially, but the call workload primary metric stayed at 10 and compiled mode still lacked strict caller propagation.","next_action_hint":"Strict eval needs a coherent interpreter+compiler context fix, including Runner/compiled current_func propagation and strict unresolvable assignment behavior; do not keep top-level-only current_func tracking."}}
{"run":638,"commit":"c987c3a","metric":9,"metrics":{"compiler_test262_cases":92,"compiler_test262_pass":83,"compiler_test262_failures":9,"compiler_test262_compiler_errors":0,"compiler_test262_compiler_crashes":0,"compiler_test262_compiler_fails":4,"compiler_test262_both_fail":4,"compiler_test262_interpreter_fail_compiler_pass":1,"compatibility_pass":83,"compatibility_cases":92,"compiler_errors":0,"compiler_crashes":0,"compiler_fails":4,"both_fail":4,"interpreter_fail_compiler_pass":1,"elapsed_ms":11343},"status":"keep","description":"Propagate simple eval assignment results","timestamp":1778037211031,"segment":23,"confidence":null,"iterationTokens":2243,"asi":{"hypothesis":"Native-bytecode direct eval of a simple assignment updates the eval context but was only propagating declared var names back to the caller, so `eval(\"x = 1\", ...)` lost the assignment result.","improvement":"Track simple identifier assignment expression names as eval transients, fixing eval-first-arg and reducing call-expression failures from 10 to 9.","next_action_hint":"Remaining eval failures need stricter caller-mode handling and compiled direct-eval local writeback; keep this narrow to simple `Identifier = ...` eval assignments."}}
{"run":639,"commit":"c987c3a","metric":9,"metrics":{"compiler_test262_cases":92,"compiler_test262_pass":83,"compiler_test262_failures":9,"compiler_test262_compiler_errors":0,"compiler_test262_compiler_crashes":0,"compiler_test262_compiler_fails":4,"compiler_test262_both_fail":4,"compiler_test262_interpreter_fail_compiler_pass":1,"compatibility_pass":83,"compatibility_cases":92,"compiler_errors":0,"compiler_crashes":0,"compiler_fails":4,"both_fail":4,"interpreter_fail_compiler_pass":1,"elapsed_ms":11250},"status":"discard","description":"Propagate nested eval assignment names","timestamp":1778037590047,"segment":23,"confidence":4,"iterationTokens":4946,"asi":{"hypothesis":"Non-strict eval strictness failure may need assignment-name propagation for compound assignments nested after with statements, not only top-level simple assignments.","rollback_reason":"Primary metric stayed at 9; focused snippets showed some standalone compound assignments already propagate, but the full non-strict strictness case still fails elsewhere.","next_action_hint":"Do not broaden eval assignment-name collection alone. Investigate sequential eval writeback and `var static`/`with` handling in native eval before retrying."}}
{"run":640,"commit":"c987c3a","metric":9,"metrics":{"compiler_test262_cases":92,"compiler_test262_pass":83,"compiler_test262_failures":9,"compiler_test262_compiler_errors":0,"compiler_test262_compiler_crashes":0,"compiler_test262_compiler_fails":4,"compiler_test262_both_fail":4,"compiler_test262_interpreter_fail_compiler_pass":1,"compatibility_pass":83,"compatibility_cases":92,"compiler_errors":0,"compiler_crashes":0,"compiler_fails":4,"both_fail":4,"interpreter_fail_compiler_pass":1,"elapsed_ms":11238},"status":"discard","description":"Compile eval member-call expressions with source compiler","timestamp":1778037927919,"segment":23,"confidence":2,"iterationTokens":3635,"asi":{"hypothesis":"The eval member-call argument-order failure might be isolated by compiling only direct-eval member calls with arguments via the source compiler instead of native QuickJS bytecode.","rollback_reason":"Metric stayed at 9 and the focused fooCalled eval case still failed; the source compiler path also checks callability before evaluating member-call arguments in this shape.","next_action_hint":"Fix member-call argument evaluation order in call lowering/interpreter semantics rather than switching eval compilation paths."}}
{"run":641,"commit":"c987c3a","metric":9,"metrics":{"compiler_test262_cases":92,"compiler_test262_pass":83,"compiler_test262_failures":9,"compiler_test262_compiler_errors":0,"compiler_test262_compiler_crashes":0,"compiler_test262_compiler_fails":4,"compiler_test262_both_fail":4,"compiler_test262_interpreter_fail_compiler_pass":1,"compatibility_pass":83,"compatibility_cases":92,"compiler_errors":0,"compiler_crashes":0,"compiler_fails":4,"both_fail":4,"interpreter_fail_compiler_pass":1,"elapsed_ms":11306},"status":"discard","description":"Propagate top-level compound eval assignments","timestamp":1778038671676,"segment":23,"confidence":4,"iterationTokens":10404,"asi":{"hypothesis":"Non-strict eval strictness failure may be due to `count += 1` assignments not being propagated like simple `x = 1` assignments.","rollback_reason":"Primary metric stayed at 9; focused sequential eval still ended at 1 instead of 3, so propagation also needs caller context/frame refresh between evals, not just assignment-name recognition.","next_action_hint":"Inspect write_back_eval_vars and ctx.globals refresh after each direct eval before retrying compound assignment propagation."}}
{"run":642,"commit":"c987c3a","metric":9,"metrics":{"compiler_test262_cases":92,"compiler_test262_pass":83,"compiler_test262_failures":9,"compiler_test262_compiler_errors":0,"compiler_test262_compiler_crashes":0,"compiler_test262_compiler_fails":4,"compiler_test262_both_fail":4,"compiler_test262_interpreter_fail_compiler_pass":1,"compatibility_pass":83,"compatibility_cases":92,"compiler_errors":0,"compiler_crashes":0,"compiler_fails":4,"both_fail":4,"interpreter_fail_compiler_pass":1,"elapsed_ms":11292},"status":"discard","description":"Preserve symbol keys in object copy order metadata","timestamp":1778039029692,"segment":23,"confidence":null,"iterationTokens":5334,"asi":{"hypothesis":"The shared call spread-order failure may be caused by symbol keys being omitted from key_order metadata and copy ordering not following OwnPropertyKeys order.","rollback_reason":"Metric stayed at 9 and focused spread-obj-spread-order still reported Symbol(foo) first; this path is not fixed by Heap.put_obj_key symbol ordering plus enumerable_copy_keys sorting alone.","next_action_hint":"Inspect where Object.defineProperty stores symbol/index properties and whether the source arrives at CopyDataProperties as a converted map without key_order metadata."}}
{"run":643,"commit":"c987c3a","metric":9,"metrics":{"compiler_test262_cases":92,"compiler_test262_pass":83,"compiler_test262_failures":9,"compiler_test262_compiler_errors":0,"compiler_test262_compiler_crashes":0,"compiler_test262_compiler_fails":4,"compiler_test262_both_fail":4,"compiler_test262_interpreter_fail_compiler_pass":1,"compatibility_pass":83,"compatibility_cases":92,"compiler_errors":0,"compiler_crashes":0,"compiler_fails":4,"both_fail":4,"interpreter_fail_compiler_pass":1,"elapsed_ms":11447},"status":"discard","description":"Compile strict direct eval with strict source","timestamp":1778039595018,"segment":23,"confidence":null,"iterationTokens":11644,"asi":{"hypothesis":"Strict direct eval failures may be fixed by prefixing eval source with a strict directive when the caller function/context is strict, and by using QuickJS bytecode for compiled strict eval when a runtime is available.","rollback_reason":"Primary metric stayed at 9; focused compiled strict eval still did not throw, so compiled direct eval is likely not seeing ctx.current_func as strict or is bypassing this helper path.","next_action_hint":"Inspect compiled eval op lowering/runtime context for top-level strict programs before retrying strict eval source prefixing."}}
{"type":"config","name":"QuickBEAM Object built-in compatibility","metricName":"compatibility_failures","metricUnit":"","bestDirection":"lower"}
{"run":644,"commit":"7c5f812","metric":251,"metrics":{"compiler_test262_cases":500,"compiler_test262_pass":249,"compiler_test262_failures":251,"compiler_test262_compiler_errors":0,"compiler_test262_compiler_crashes":0,"compiler_test262_compiler_fails":5,"compiler_test262_both_fail":227,"compiler_test262_interpreter_fail_compiler_pass":0,"compatibility_pass":249,"compatibility_cases":500,"compiler_errors":0,"compiler_crashes":0,"compiler_fails":5,"both_fail":227,"interpreter_fail_compiler_pass":0,"elapsed_ms":21719},"status":"keep","description":"Baseline Object built-in compatibility workload","timestamp":1778039796439,"segment":24,"confidence":null,"iterationTokens":117,"asi":{"hypothesis":"Call expressions plateaued at 9 hard eval/order failures, so start a bounded built-ins/Object compatibility phase to find broader semantic gaps.","baseline":"Object built-in workload baseline established at 251 compatibility failures out of 500 bounded cases.","next_action_hint":"List and cluster built-ins/Object failures; prioritize large shared runtime semantics clusters over isolated unsupported cases."}}
{"run":645,"commit":"8b18474","metric":241,"metrics":{"compiler_test262_cases":500,"compiler_test262_pass":259,"compiler_test262_failures":241,"compiler_test262_compiler_errors":0,"compiler_test262_compiler_crashes":0,"compiler_test262_compiler_fails":5,"compiler_test262_both_fail":217,"compiler_test262_interpreter_fail_compiler_pass":0,"compatibility_pass":259,"compatibility_cases":500,"compiler_errors":0,"compiler_crashes":0,"compiler_fails":5,"both_fail":217,"interpreter_fail_compiler_pass":0,"elapsed_ms":20255},"status":"keep","description":"Box Object.assign primitive targets","timestamp":1778040053654,"segment":24,"confidence":null,"iterationTokens":19363,"asi":{"hypothesis":"Object.assign should ToObject its target, throw for null/undefined targets, ignore nullish sources, and copy enumerable string indices from string sources.","improvement":"Fixed Object.assign primitive/nullish target and string-source semantics, reducing bounded built-ins/Object failures from 251 to 241.","next_action_hint":"Continue Object.assign cluster: property descriptors, non-extensible/frozen targets, proxy own property descriptor traps, symbol copy order, and array target assignment remain failing."}}
{"run":646,"commit":"d2fee42","metric":235,"metrics":{"compiler_test262_cases":500,"compiler_test262_pass":265,"compiler_test262_failures":235,"compiler_test262_compiler_errors":0,"compiler_test262_compiler_crashes":0,"compiler_test262_compiler_fails":5,"compiler_test262_both_fail":224,"compiler_test262_interpreter_fail_compiler_pass":0,"compatibility_pass":265,"compatibility_cases":500,"compiler_errors":0,"compiler_crashes":0,"compiler_fails":5,"both_fail":224,"interpreter_fail_compiler_pass":0,"elapsed_ms":20554},"status":"keep","description":"Handle array descriptor objects in defineProperty","timestamp":1778040326969,"segment":24,"confidence":2.6666666666666665,"iterationTokens":4141,"asi":{"hypothesis":"Object.defineProperty/Object.create property descriptors can be array objects; descriptor conversion should treat non-map heap representations as descriptor objects with no fields instead of crashing with BadMapError.","improvement":"Eliminated array-descriptor crashes and fixed several Object.create descriptor-default cases, reducing bounded built-ins/Object failures from 241 to 235.","next_action_hint":"Continue Object.create descriptor conversion: many remaining failures expect missing descriptor fields to default configurable/enumerable/writable to false, and inherited descriptor fields should be consulted."}}
{"run":647,"commit":"d2fee42","metric":235,"metrics":{"compiler_test262_cases":500,"compiler_test262_pass":265,"compiler_test262_failures":235,"compiler_test262_compiler_errors":0,"compiler_test262_compiler_crashes":0,"compiler_test262_compiler_fails":5,"compiler_test262_both_fail":226,"compiler_test262_interpreter_fail_compiler_pass":0,"compatibility_pass":265,"compatibility_cases":500,"compiler_errors":0,"compiler_crashes":0,"compiler_fails":5,"both_fail":226,"interpreter_fail_compiler_pass":0,"elapsed_ms":20425},"status":"checks_failed","description":"Default missing property descriptor fields to false","timestamp":1778040402511,"segment":24,"confidence":5.333333333333333,"iterationTokens":2435,"asi":{"hypothesis":"Object.defineProperty missing descriptor fields should default to false for new properties, which should address many Object.create descriptor-default tests.","rollback_reason":"Backpressure checks failed because the helper insertion split define_property/1 clauses, producing a warnings-as-errors compile failure; metric did not improve anyway.","next_action_hint":"If retrying descriptor defaults, group define_property/1 clauses correctly and first inspect why primary stayed flat despite focused descriptor default passing."}}
{"run":648,"commit":"fdd0e0e","metric":230,"metrics":{"compiler_test262_cases":500,"compiler_test262_pass":270,"compiler_test262_failures":230,"compiler_test262_compiler_errors":0,"compiler_test262_compiler_crashes":0,"compiler_test262_compiler_fails":5,"compiler_test262_both_fail":219,"compiler_test262_interpreter_fail_compiler_pass":0,"compatibility_pass":270,"compatibility_cases":500,"compiler_errors":0,"compiler_crashes":0,"compiler_fails":5,"both_fail":219,"interpreter_fail_compiler_pass":0,"elapsed_ms":20618},"status":"keep","description":"Add Object.prototype.toLocaleString","timestamp":1778040656528,"segment":24,"confidence":4.2,"iterationTokens":6071,"asi":{"hypothesis":"Several early Object constructor tests fail because objects inherit toString but not Object.prototype.toLocaleString, which should delegate to toString by default.","improvement":"Added Object.prototype.toLocaleString and non-enumerable descriptor metadata, reducing bounded built-ins/Object failures from 235 to 230.","next_action_hint":"Continue early Object constructor/prototype cluster; remaining failures include wrapper constructor/prototype identity for Boolean/Number/String and Object constructor static/own properties."}}
{"run":649,"commit":"d609829","metric":209,"metrics":{"compiler_test262_cases":500,"compiler_test262_pass":291,"compiler_test262_failures":209,"compiler_test262_compiler_errors":0,"compiler_test262_compiler_crashes":0,"compiler_test262_compiler_fails":11,"compiler_test262_both_fail":192,"compiler_test262_interpreter_fail_compiler_pass":0,"compatibility_pass":291,"compatibility_cases":500,"compiler_errors":0,"compiler_crashes":0,"compiler_fails":11,"both_fail":192,"interpreter_fail_compiler_pass":0,"elapsed_ms":20301},"status":"keep","description":"Preserve Object constructor wrapper prototypes","timestamp":1778040908297,"segment":24,"confidence":7.636363636363637,"iterationTokens":16949,"asi":{"hypothesis":"Object(value) should return callable/object inputs unchanged and should box primitive inputs with the matching wrapper prototype so `.constructor` and `.constructor.prototype` resolve to String/Number/Boolean prototypes.","improvement":"Fixed the large Object(value) wrapper constructor/prototype identity cluster, reducing bounded built-ins/Object failures from 230 to 209.","next_action_hint":"Compiler-only Object(function) identity failures remain; inspect compiled Object constructor invocation or function identity handling. Continue Object.assign metadata and Object.create descriptor clusters."}}
