{"run":773,"commit":"0ec41d9","metric":3,"metrics":{"compiler_test262_cases":1500,"compiler_test262_pass":1497,"compiler_test262_failures":3,"compiler_test262_compiler_errors":0,"compiler_test262_compiler_crashes":0,"compiler_test262_compiler_fails":0,"compiler_test262_both_fail":1,"compiler_test262_interpreter_fail_compiler_pass":0,"compatibility_pass":1497,"compatibility_cases":1500,"compiler_errors":0,"compiler_crashes":0,"compiler_fails":0,"both_fail":1,"interpreter_fail_compiler_pass":0,"elapsed_ms":116279},"status":"keep","description":"Attach Date instances to Date prototype","timestamp":1778108300896,"segment":29,"confidence":8.4,"iterationTokens":11691,"asi":{"hypothesis":"Date constructor results should carry the registered Date.prototype as their internal prototype so descriptor Date objects observe Date.prototype fields in both interpreter and compiler paths","improvement":"Reduced 1500-case Object failures from 9 to 3 and eliminated the six compiler-only Date descriptor failures","next_action_hint":"Remaining failures are the getterless inherited descriptor value case and two interpreter crashes involving typed arrays/array length; inspect current failure list next"}}
{"run":774,"commit":"0ec41d9","metric":35,"metrics":{"compiler_test262_cases":1500,"compiler_test262_pass":1465,"compiler_test262_failures":35,"compiler_test262_compiler_errors":0,"compiler_test262_compiler_crashes":0,"compiler_test262_compiler_fails":0,"compiler_test262_both_fail":34,"compiler_test262_interpreter_fail_compiler_pass":0,"compatibility_pass":1465,"compatibility_cases":1500,"compiler_errors":0,"compiler_crashes":0,"compiler_fails":0,"both_fail":34,"interpreter_fail_compiler_pass":0,"elapsed_ms":105696},"status":"discard","description":"Virtualize huge array length writes","timestamp":1778108788648,"segment":29,"confidence":5.25,"iterationTokens":15018,"asi":{"hypothesis":"Avoiding huge Erlang array resize for sparse length writes would fix propertyHelper length writability timeouts without changing semantics","rollback_reason":"Although the focused length test passed, the broad 1500-case Object workload regressed from 3 to 35 failures; the virtual length representation changed too many array length semantics","next_action_hint":"Do not retry broad virtual array length storage without a fuller representation. For 15.2.3.6-4-116, look for a narrower propertyHelper/isWritable interaction or targeted large-length growth path that preserves existing descriptor/own-property semantics."}}
{"type":"config","name":"QuickBEAM built-ins/Object 2000-case compatibility","metricName":"compatibility_failures","metricUnit":"","bestDirection":"lower"}
{"run":775,"commit":"0910690","metric":35,"metrics":{"compiler_test262_cases":2000,"compiler_test262_pass":1965,"compiler_test262_failures":35,"compiler_test262_compiler_errors":0,"compiler_test262_compiler_crashes":0,"compiler_test262_compiler_fails":0,"compiler_test262_both_fail":33,"compiler_test262_interpreter_fail_compiler_pass":0,"compatibility_pass":1965,"compatibility_cases":2000,"compiler_errors":0,"compiler_crashes":0,"compiler_fails":0,"both_fail":33,"interpreter_fail_compiler_pass":0,"elapsed_ms":182325},"status":"keep","description":"Baseline 2000-case Object workload","timestamp":1778109095374,"segment":30,"confidence":null,"iterationTokens":129,"asi":{"hypothesis":"Rebaseline a broader 2000-case built-ins/Object workload after reducing the 1500-case slice to 3 failures","baseline":"The 2000-case Object workload has 35 failures: no compiler-only semantic failures, 33 shared failures, and likely two timeout/crash cases from the earlier 1500 slice","next_action_hint":"Cluster the additional Object failures beyond the 1500-case slice; likely Object.freeze/getOwnPropertyDescriptor/getOwnPropertyNames/prototype cases now dominate."}}
{"run":776,"commit":"0910690","metric":36,"metrics":{"compiler_test262_cases":2000,"compiler_test262_pass":1964,"compiler_test262_failures":36,"compiler_test262_compiler_errors":0,"compiler_test262_compiler_crashes":0,"compiler_test262_compiler_fails":0,"compiler_test262_both_fail":32,"compiler_test262_interpreter_fail_compiler_pass":0,"compatibility_pass":1964,"compatibility_cases":2000,"compiler_errors":0,"compiler_crashes":0,"compiler_fails":0,"both_fail":32,"interpreter_fail_compiler_pass":0,"elapsed_ms":179972},"status":"checks_failed","description":"Stop prototype lookup after explicit undefined own props","timestamp":1778109363253,"segment":30,"confidence":null,"iterationTokens":5986,"asi":{"hypothesis":"Get should not continue to the prototype chain when an own property exists with value undefined, which should fix inherited-property defineProperty cases","rollback_reason":"The primary metric worsened from 35 to 36 and checks failed because the own-present helper routed symbol keys into array property presence code that expects strings","next_action_hint":"A narrower explicit-undefined own-property fix may still be useful, but must avoid symbols and array presence regressions; focus on ordinary object maps/shapes only."}}
{"run":777,"commit":"fb864b4","metric":34,"metrics":{"compiler_test262_cases":2000,"compiler_test262_pass":1966,"compiler_test262_failures":34,"compiler_test262_compiler_errors":0,"compiler_test262_compiler_crashes":0,"compiler_test262_compiler_fails":0,"compiler_test262_both_fail":32,"compiler_test262_interpreter_fail_compiler_pass":0,"compatibility_pass":1966,"compatibility_cases":2000,"compiler_errors":0,"compiler_crashes":0,"compiler_fails":0,"both_fail":32,"interpreter_fail_compiler_pass":0,"elapsed_ms":181147},"status":"keep","description":"Stop ordinary undefined own prototype fallback","timestamp":1778109736719,"segment":30,"confidence":1,"iterationTokens":6184,"asi":{"hypothesis":"Ordinary objects with an own data property whose value is undefined should not fall through to inherited prototype properties during [[Get]]","improvement":"Reduced 2000-case Object failures from 35 to 34 without breaking symbol iterator checks by limiting own-present detection to ordinary maps/shapes and excluding arrays/proxies","next_action_hint":"Cluster remaining 34 failures; retry getterless inherited descriptor value via descriptor-field presence, but keep it separate from broad Get own-present behavior."}}
{"run":778,"commit":"397d4c0","metric":32,"metrics":{"compiler_test262_cases":2000,"compiler_test262_pass":1968,"compiler_test262_failures":32,"compiler_test262_compiler_errors":0,"compiler_test262_compiler_crashes":0,"compiler_test262_compiler_fails":0,"compiler_test262_both_fail":30,"compiler_test262_interpreter_fail_compiler_pass":0,"compatibility_pass":1968,"compatibility_cases":2000,"compiler_errors":0,"compiler_crashes":0,"compiler_fails":0,"both_fail":30,"interpreter_fail_compiler_pass":0,"elapsed_ms":181928},"status":"keep","description":"Use stored builtin object descriptors","timestamp":1778110098657,"segment":30,"confidence":3,"iterationTokens":4519,"asi":{"hypothesis":"Builtin object descriptors such as Math.foo and JSON.foo should report the descriptor attrs stored by Object.defineProperty instead of falling back to generic builtin default attrs","improvement":"Reduced 2000-case Object failures from 34 to 32 by making OwnProperty.descriptor honor Heap.get_prop_desc for builtin object data properties","next_action_hint":"Remaining defineProperty failures are mostly array/arguments descriptor semantics and typed-array/length timeout crashes; inspect 4-243 and arguments 4-290 clusters."}}
{"run":779,"commit":"8d66ef6","metric":28,"metrics":{"compiler_test262_cases":2000,"compiler_test262_pass":1972,"compiler_test262_failures":28,"compiler_test262_compiler_errors":0,"compiler_test262_compiler_crashes":0,"compiler_test262_compiler_fails":0,"compiler_test262_both_fail":26,"compiler_test262_interpreter_fail_compiler_pass":0,"compatibility_pass":1972,"compatibility_cases":2000,"compiler_errors":0,"compiler_crashes":0,"compiler_fails":0,"both_fail":26,"interpreter_fail_compiler_pass":0,"elapsed_ms":180592},"status":"keep","description":"Invoke array accessors with receiver","timestamp":1778110459232,"segment":30,"confidence":3.5,"iterationTokens":5282,"asi":{"hypothesis":"Array and arguments indexed accessor setters should be invoked with the receiver as this, so setters that write this.setVerifyHelpProp are observable by propertyHelper verifyWritable","improvement":"Reduced 2000-case Object failures from 32 to 28 by invoking indexed array/list accessor setters through Invocation.invoke_with_receiver instead of a receiverless callback","next_action_hint":"Remaining arguments cases around 292-296 now expose parameter-map aliasing expectations; inspect those before broader arguments-object model changes."}}
{"run":780,"commit":"d40d72a","metric":24,"metrics":{"compiler_test262_cases":2000,"compiler_test262_pass":1976,"compiler_test262_failures":24,"compiler_test262_compiler_errors":0,"compiler_test262_compiler_crashes":0,"compiler_test262_compiler_fails":0,"compiler_test262_both_fail":22,"compiler_test262_interpreter_fail_compiler_pass":0,"compatibility_pass":1976,"compatibility_cases":2000,"compiler_errors":0,"compiler_crashes":0,"compiler_fails":0,"both_fail":22,"interpreter_fail_compiler_pass":0,"elapsed_ms":181570},"status":"keep","description":"Support bound function properties","timestamp":1778110892766,"segment":30,"confidence":4.4,"iterationTokens":10464,"asi":{"hypothesis":"Bound functions should inherit through Function.prototype/Object.prototype and also support their own stored properties, matching ordinary callable property behavior","improvement":"Reduced 2000-case Object failures from 28 to 24 by adding bound-function prototype fallback, writes, and own property reads","next_action_hint":"Remaining bound-function enumerable prototype case likely needs for-in enumeration through Function.prototype; other failures remain arguments parameter-map and array accessor/length cases."}}
{"run":781,"commit":"1b1a8fc","metric":23,"metrics":{"compiler_test262_cases":2000,"compiler_test262_pass":1977,"compiler_test262_failures":23,"compiler_test262_compiler_errors":0,"compiler_test262_compiler_crashes":0,"compiler_test262_compiler_fails":0,"compiler_test262_both_fail":21,"compiler_test262_interpreter_fail_compiler_pass":0,"compatibility_pass":1977,"compatibility_cases":2000,"compiler_errors":0,"compiler_crashes":0,"compiler_fails":0,"both_fail":21,"interpreter_fail_compiler_pass":0,"elapsed_ms":182818},"status":"keep","description":"Respect readonly Object prototype writes","timestamp":1778111243215,"segment":30,"confidence":3,"iterationTokens":3158,"asi":{"hypothesis":"Callable and builtin object property writes should not create an own property when Object.prototype has a non-writable inherited data property of the same name","improvement":"Reduced 2000-case Object failures from 24 to 23 by blocking writes through callable/builtin property storage when Object.prototype defines a readonly inherited property","next_action_hint":"Remaining failures are mostly arguments parameter-map aliasing, accessor assignment strictness, bound-function for-in enumerable prototype traversal, and the two timeout/crash cases."}}
{"run":782,"commit":"da2b6bd","metric":11,"metrics":{"compiler_test262_cases":2000,"compiler_test262_pass":1989,"compiler_test262_failures":11,"compiler_test262_compiler_errors":0,"compiler_test262_compiler_crashes":0,"compiler_test262_compiler_fails":0,"compiler_test262_both_fail":9,"compiler_test262_interpreter_fail_compiler_pass":0,"compatibility_pass":1989,"compatibility_cases":2000,"compiler_errors":0,"compiler_crashes":0,"compiler_fails":0,"both_fail":9,"interpreter_fail_compiler_pass":0,"elapsed_ms":184524},"status":"keep","description":"Invoke named array accessors with receiver","timestamp":1778111763550,"segment":30,"confidence":4.363636363636363,"iterationTokens":14141,"asi":{"hypothesis":"Named array/arguments accessor setters need the receiver as this just like indexed accessors, otherwise propertyHelper verifyWritable cannot observe setter writes","improvement":"Reduced 2000-case Object failures from 23 to 11 by invoking named array/list accessor setters with Invocation.invoke_with_receiver and fixing generic arguments accessor descriptor cases","next_action_hint":"Remaining failures are the two timeout/crash cases, getterless inherited descriptor value, strict getter-only array assignment, arguments parameter-map aliasing, and bound-function enumerable inherited prototype traversal."}}
{"run":783,"commit":"da2b6bd","metric":11,"metrics":{"compiler_test262_cases":2000,"compiler_test262_pass":1989,"compiler_test262_failures":11,"compiler_test262_compiler_errors":0,"compiler_test262_compiler_crashes":0,"compiler_test262_compiler_fails":0,"compiler_test262_both_fail":9,"compiler_test262_interpreter_fail_compiler_pass":0,"compatibility_pass":1989,"compatibility_cases":2000,"compiler_errors":0,"compiler_crashes":0,"compiler_fails":0,"both_fail":9,"interpreter_fail_compiler_pass":0,"elapsed_ms":182327},"status":"discard","description":"Throw on getter-only array index writes","timestamp":1778112182016,"segment":30,"confidence":4,"iterationTokens":6955,"asi":{"hypothesis":"Strict assignment to an array index accessor with no setter should throw TypeError and fix 15.2.3.6-4-243-2.js","rollback_reason":"The focused strict accessor assignment passed, but the 2000-case primary metric stayed flat at 11; another case likely regressed or the failure mix shifted","next_action_hint":"Do not make all getter-only array index writes throw unconditionally. Add strict-aware failed-write handling instead if pursuing 4-243-2."}}
{"run":784,"commit":"ca01de1","metric":10,"metrics":{"compiler_test262_cases":2000,"compiler_test262_pass":1990,"compiler_test262_failures":10,"compiler_test262_compiler_errors":0,"compiler_test262_compiler_crashes":0,"compiler_test262_compiler_fails":0,"compiler_test262_both_fail":8,"compiler_test262_interpreter_fail_compiler_pass":0,"compatibility_pass":1990,"compatibility_cases":2000,"compiler_errors":0,"compiler_crashes":0,"compiler_fails":0,"both_fail":8,"interpreter_fail_compiler_pass":0,"elapsed_ms":182645},"status":"keep","description":"Enumerate bound function prototype keys","timestamp":1778112578081,"segment":30,"confidence":2.9411764705882355,"iterationTokens":6333,"asi":{"hypothesis":"for-in over bound functions should enumerate inherited enumerable Function.prototype keys and keep them if [[HasProperty]] finds them on the bound function prototype chain","improvement":"Reduced 2000-case Object failures from 11 to 10 by adding bound-function enumerable key support and has_property lookup","next_action_hint":"Remaining failures are typed-array/length crashes, getterless inherited descriptor value, strict getter-only array assignment, and arguments parameter-map aliasing."}}
{"run":785,"commit":"ca01de1","metric":10,"metrics":{"compiler_test262_cases":2000,"compiler_test262_pass":1990,"compiler_test262_failures":10,"compiler_test262_compiler_errors":0,"compiler_test262_compiler_crashes":0,"compiler_test262_compiler_fails":0,"compiler_test262_both_fail":9,"compiler_test262_interpreter_fail_compiler_pass":0,"compatibility_pass":1990,"compatibility_cases":2000,"compiler_errors":0,"compiler_crashes":0,"compiler_fails":0,"both_fail":9,"interpreter_fail_compiler_pass":0,"elapsed_ms":182872},"status":"discard","description":"Add BigInt typed-array constructor support","timestamp":1778113144540,"segment":30,"confidence":2.272727272727273,"iterationTokens":17333,"asi":{"hypothesis":"The resizable-buffer typed-array Object.defineProperties case crashes because BigInt typed-array constructors and BYTES_PER_ELEMENT statics are missing","rollback_reason":"The focused case moved from crash to semantic TypeError expectation failure, but the 2000-case primary metric stayed flat at 10","next_action_hint":"BigInt typed-array support may be useful later, but for this workload prioritize actual out-of-bounds/resizable ArrayBuffer semantics or other remaining failures."}}
{"type":"config","name":"QuickBEAM built-ins/Object 2500-case compatibility","metricName":"compatibility_failures","metricUnit":"","bestDirection":"lower"}
{"run":786,"commit":"9d4352d","metric":212,"metrics":{"compiler_test262_cases":2500,"compiler_test262_pass":2288,"compiler_test262_failures":212,"compiler_test262_compiler_errors":0,"compiler_test262_compiler_crashes":0,"compiler_test262_compiler_fails":2,"compiler_test262_both_fail":195,"compiler_test262_interpreter_fail_compiler_pass":8,"compatibility_pass":2288,"compatibility_cases":2500,"compiler_errors":0,"compiler_crashes":0,"compiler_fails":2,"both_fail":195,"interpreter_fail_compiler_pass":8,"elapsed_ms":280482},"status":"keep","description":"Baseline 2500-case Object workload","timestamp":1778113623625,"segment":31,"confidence":null,"iterationTokens":129,"asi":{"hypothesis":"Rebaseline a broader 2500-case built-ins/Object workload after reducing the 2000-case slice to 10 failures","baseline":"The 2500-case Object workload exposes a new large cluster with 212 failures, mostly shared both_fail plus 8 interpreter-only failures and 2 compiler-only failures","next_action_hint":"Cluster the additional failures beyond 2000; likely Object.freeze/getOwnPropertyDescriptor/getOwnPropertyNames/prototype clusters dominate and may yield larger wins than the remaining 2000-case edge cases."}}
{"run":787,"commit":"9e5438a","metric":209,"metrics":{"compiler_test262_cases":2500,"compiler_test262_pass":2291,"compiler_test262_failures":209,"compiler_test262_compiler_errors":0,"compiler_test262_compiler_crashes":0,"compiler_test262_compiler_fails":2,"compiler_test262_both_fail":192,"compiler_test262_interpreter_fail_compiler_pass":8,"compatibility_pass":2291,"compatibility_cases":2500,"compiler_errors":0,"compiler_crashes":0,"compiler_fails":2,"both_fail":192,"interpreter_fail_compiler_pass":8,"elapsed_ms":276480},"status":"keep","description":"Reject nullish Object descriptor inputs","timestamp":1778114077424,"segment":31,"confidence":null,"iterationTokens":7538,"asi":{"hypothesis":"Object.getOwnPropertyDescriptor and Object.entries should throw TypeError for null/undefined inputs instead of returning undefined or an empty array","improvement":"Reduced 2500-case Object failures from 212 to 209 by fixing nullish Object.getOwnPropertyDescriptor inputs and Object.entries nullish coercion","next_action_hint":"Continue with large getOwnPropertyDescriptor cluster; inspect primitive/string descriptor behavior and descriptor attribute defaults."}}
{"run":788,"commit":"acad346","metric":193,"metrics":{"compiler_test262_cases":2500,"compiler_test262_pass":2307,"compiler_test262_failures":193,"compiler_test262_compiler_errors":0,"compiler_test262_compiler_crashes":0,"compiler_test262_compiler_fails":2,"compiler_test262_both_fail":176,"compiler_test262_interpreter_fail_compiler_pass":8,"compatibility_pass":2307,"compatibility_cases":2500,"compiler_errors":0,"compiler_crashes":0,"compiler_fails":2,"both_fail":176,"interpreter_fail_compiler_pass":8,"elapsed_ms":276522},"status":"keep","description":"Describe builtin object methods","timestamp":1778114585250,"segment":31,"confidence":6.333333333333333,"iterationTokens":5636,"asi":{"hypothesis":"Object.getOwnPropertyDescriptor on builtin namespace objects like Math should use the builtin object's method map and report builtin method descriptors as writable, non-enumerable, configurable data properties","improvement":"Reduced 2500-case Object failures from 209 to 193 by exposing builtin object map entries through OwnProperty.descriptor with non-enumerable method defaults","next_action_hint":"Continue getOwnPropertyDescriptor cluster: global functions like decodeURIComponent are missing or lack descriptors, and many primitive/string descriptor cases remain."}}
{"run":789,"commit":"ea157d6","metric":182,"metrics":{"compiler_test262_cases":2500,"compiler_test262_pass":2318,"compiler_test262_failures":182,"compiler_test262_compiler_errors":0,"compiler_test262_compiler_crashes":0,"compiler_test262_compiler_fails":2,"compiler_test262_both_fail":165,"compiler_test262_interpreter_fail_compiler_pass":8,"compatibility_pass":2318,"compatibility_cases":2500,"compiler_errors":0,"compiler_crashes":0,"compiler_fails":2,"both_fail":165,"interpreter_fail_compiler_pass":8,"elapsed_ms":275458},"status":"keep","description":"Describe constructor static and prototype methods","timestamp":1778115250592,"segment":31,"confidence":3.1578947368421053,"iterationTokens":17014,"asi":{"hypothesis":"Object.getOwnPropertyDescriptor should expose module-declared constructor static methods and prototype method descriptors with standard builtin function attributes","improvement":"Reduced 2500-case Object failures from 193 to 182 by describing module static methods such as Date.parse/UTC and prototype constructor/method descriptors","next_action_hint":"Date.prototype method value identity is still wrong because Date.prototype.getTime reads undefined while getOwnPropertyDescriptor synthesizes the method; either materialize prototype methods or teach Get.get about constructor prototype objects without broad regressions."}}
