{"run":214,"commit":"cf5a1c1","metric":401,"metrics":{"parser_tests":214,"parser_test_ms":400},"status":"keep","description":"Port strict generator class method diagnostics","timestamp":1777218084659,"segment":0,"confidence":3.94,"iterationTokens":2263,"asi":{"hypothesis":"Strict duplicate-parameter diagnostics should apply to generator class methods.","learned":"Generator class method parsing now runs strict parameter validation after parsing the method body.","quickjs_cases":"Adds QuickJS-compatible strict-mode diagnostics for `class C { *method(a, a) { \"use strict\"; } }`."}}
{"run":215,"commit":"b2d8f14","metric":403,"metrics":{"parser_tests":215,"parser_test_ms":400},"status":"keep","description":"Port strict async class method diagnostics","timestamp":1777218151564,"segment":0,"confidence":3.96,"iterationTokens":882,"asi":{"hypothesis":"Strict duplicate-parameter diagnostics should apply to async class methods after shared validation support.","learned":"No implementation change was required; async class method parsing now shares strict parameter validation with regular and generator class methods.","quickjs_cases":"Adds QuickJS-compatible strict-mode diagnostics for `class C { async method(a, a) { \"use strict\"; } }`."}}
{"run":216,"commit":"783618f","metric":405,"metrics":{"parser_tests":216,"parser_test_ms":400},"status":"keep","description":"Port strict class restricted parameter diagnostics","timestamp":1777218224533,"segment":0,"confidence":3.9405940594059405,"iterationTokens":951,"asi":{"hypothesis":"Strict restricted-name diagnostics should apply to class method parameters just like function parameters.","learned":"No implementation change was required after class method strict validation; restricted parameter names are caught in strict class methods.","quickjs_cases":"Adds QuickJS-compatible strict-mode diagnostics for class method parameters named `eval` and `arguments`."}}
{"run":217,"commit":"7441880","metric":407,"metrics":{"parser_tests":217,"parser_test_ms":400},"status":"keep","description":"Port strict arrow parameter diagnostics","timestamp":1777218364444,"segment":0,"confidence":3.9215686274509802,"iterationTokens":2893,"asi":{"hypothesis":"Strict duplicate-parameter diagnostics should apply to arrow functions with block bodies containing a `use strict` directive.","learned":"Arrow parsing now validates strict block bodies against the parsed arrow parameter list while expression-bodied arrows bypass directive validation.","quickjs_cases":"Adds QuickJS-compatible strict-mode diagnostics for `(a, a) => { \"use strict\"; }`."}}
{"run":218,"commit":"87cf519","metric":409,"metrics":{"parser_tests":218,"parser_test_ms":400},"status":"keep","description":"Port strict async arrow diagnostics","timestamp":1777218435284,"segment":0,"confidence":3.9411764705882355,"iterationTokens":895,"asi":{"hypothesis":"Strict restricted-name diagnostics should apply to async arrow function parameters with strict block bodies.","learned":"No implementation change was required after arrow strict validation; async arrows share the same validation path after parsing their block bodies.","quickjs_cases":"Adds QuickJS-compatible strict-mode diagnostics for `async (eval) => { \"use strict\"; }`."}}
{"run":219,"commit":"7eae3d6","metric":411,"metrics":{"parser_tests":219,"parser_test_ms":400},"status":"keep","description":"Port strict destructured parameter diagnostics","timestamp":1777218514065,"segment":0,"confidence":3.9607843137254903,"iterationTokens":1363,"asi":{"hypothesis":"Strict restricted-name diagnostics should inspect identifiers nested inside object and array binding patterns in parameter lists.","learned":"Strict parameter validation now recursively collects names from identifiers, assignment/rest elements, array patterns, object patterns, and property values.","quickjs_cases":"Adds QuickJS-compatible strict-mode diagnostics for destructured parameters binding `eval`/`arguments`."}}
{"run":220,"commit":"f02ffc4","metric":413,"metrics":{"parser_tests":220,"parser_test_ms":400},"status":"keep","description":"Port strict destructured duplicate diagnostics","timestamp":1777218580852,"segment":0,"confidence":3.941747572815534,"iterationTokens":921,"asi":{"hypothesis":"Strict duplicate-parameter diagnostics should detect duplicates across nested destructuring parameter patterns.","learned":"No implementation change was required after recursive binding-name collection; duplicate detection now sees names from nested object and array patterns.","quickjs_cases":"Adds QuickJS-compatible strict-mode diagnostics for `function f({ a }, [a]) { \"use strict\"; }`."}}
{"run":221,"commit":"a7f3cea","metric":415,"metrics":{"parser_tests":221,"parser_test_ms":400},"status":"keep","description":"Port strict directive prologue diagnostics","timestamp":1777218668371,"segment":0,"confidence":3.923076923076923,"iterationTokens":1195,"asi":{"hypothesis":"Strict mode detection should scan the full directive prologue, not only the first statement.","learned":"Strict directive detection now skips over leading string-literal expression directives until it finds `use strict` or a non-directive statement.","quickjs_cases":"Adds QuickJS-compatible strict-mode diagnostics for a `use strict` directive following another directive string."}}
{"run":222,"commit":"814a9fa","metric":417,"metrics":{"parser_tests":222,"parser_test_ms":400},"status":"keep","description":"Port non-prologue use strict coverage","timestamp":1777218738122,"segment":0,"confidence":3.9805825242718447,"iterationTokens":1006,"asi":{"hypothesis":"A `use strict` string after a non-directive statement should not make the function strict.","learned":"No implementation change was required after directive-prologue scanning; scanning stops at the first non-string directive statement, so duplicate parameters remain valid in this non-strict function.","quickjs_cases":"Adds QuickJS-compatible function coverage for non-prologue `\"use strict\"` string after a call expression."}}
{"run":223,"commit":"a8d5008","metric":419,"metrics":{"parser_tests":223,"parser_test_ms":400},"status":"keep","description":"Port strict object accessor diagnostics","timestamp":1777218846718,"segment":0,"confidence":3.9615384615384617,"iterationTokens":1319,"asi":{"hypothesis":"Strict restricted-name diagnostics should apply to object accessor parameters.","learned":"Object accessor parsing now runs strict parameter validation for getter/setter function bodies.","quickjs_cases":"Adds QuickJS-compatible strict-mode diagnostics for `set value(eval) { \"use strict\"; }` in object literals."}}
{"run":224,"commit":"03f626b","metric":421,"metrics":{"parser_tests":224,"parser_test_ms":400},"status":"keep","description":"Port strict class accessor diagnostics","timestamp":1777218923853,"segment":0,"confidence":3.980769230769231,"iterationTokens":867,"asi":{"hypothesis":"Strict restricted-name diagnostics should apply to class accessor parameters after accessor validation support.","learned":"No implementation change was required after class accessor validation; setter parameters named `arguments` are rejected in strict accessor bodies.","quickjs_cases":"Adds QuickJS-compatible strict-mode diagnostics for `class C { set value(arguments) { \"use strict\"; } }`."}}
{"run":225,"commit":"5b9e650","metric":423,"metrics":{"parser_tests":225,"parser_test_ms":400},"status":"keep","description":"Port strict default parameter duplicate diagnostics","timestamp":1777218989511,"segment":0,"confidence":3.961904761904762,"iterationTokens":1021,"asi":{"hypothesis":"Strict duplicate-parameter diagnostics should include assignment-pattern parameters with default values.","learned":"No implementation change was required after recursive binding-name collection; AssignmentPattern left identifiers participate in duplicate detection.","quickjs_cases":"Adds QuickJS-compatible strict-mode diagnostics for duplicate default parameters `a = 1, a = 2`."}}
{"run":226,"commit":"f52dc3f","metric":425,"metrics":{"parser_tests":226,"parser_test_ms":400},"status":"keep","description":"Port strict rest parameter diagnostics","timestamp":1777219064374,"segment":0,"confidence":3.943396226415094,"iterationTokens":876,"asi":{"hypothesis":"Strict restricted-name diagnostics should include rest parameter identifiers.","learned":"No implementation change was required after recursive binding-name collection; RestElement arguments participate in restricted-name validation.","quickjs_cases":"Adds QuickJS-compatible strict-mode diagnostics for `function f(...arguments) { \"use strict\"; }`."}}
{"run":227,"commit":"a9f6e38","metric":427,"metrics":{"parser_tests":227,"parser_test_ms":400},"status":"keep","description":"Port class method implicit strict diagnostics","timestamp":1777219181699,"segment":0,"confidence":3.925233644859813,"iterationTokens":3181,"asi":{"hypothesis":"Class method bodies are strict code, so duplicate parameters should be rejected even without an explicit `use strict` directive.","learned":"Class method parsing now validates parameter lists as strict unconditionally for regular, generator, async, and accessor methods.","quickjs_cases":"Adds QuickJS-compatible class diagnostics for `class C { method(a, a) { return a; } }`."}}
{"run":228,"commit":"c9301bb","metric":429,"metrics":{"parser_tests":228,"parser_test_ms":500},"status":"keep","description":"Port class generator implicit strict diagnostics","timestamp":1777219248665,"segment":0,"confidence":3.94392523364486,"iterationTokens":916,"asi":{"hypothesis":"Generator class methods should also reject duplicate parameters because class method bodies are strict code.","learned":"No implementation change was required after unconditional class method parameter validation; generator class methods share the same strict validation path.","quickjs_cases":"Adds QuickJS-compatible class diagnostics for `class C { *method(a, a) { yield a; } }`."}}
{"run":229,"commit":"243bf7e","metric":431,"metrics":{"parser_tests":229,"parser_test_ms":400},"status":"keep","description":"Port class accessor implicit strict diagnostics","timestamp":1777219312668,"segment":0,"confidence":3.9626168224299065,"iterationTokens":906,"asi":{"hypothesis":"Class accessor parameters should reject restricted names because class method bodies are strict even without directive prologues.","learned":"No implementation change was required after unconditional class accessor validation; setter parameters named `eval` are rejected.","quickjs_cases":"Adds QuickJS-compatible class diagnostics for `class C { set value(eval) { this.value = eval; } }`."}}
{"run":230,"commit":"2a73aa9","metric":433,"metrics":{"parser_tests":230,"parser_test_ms":400},"status":"keep","description":"Port regexp control keyword coverage","timestamp":1777219406378,"segment":0,"confidence":3.9813084112149535,"iterationTokens":1221,"asi":{"hypothesis":"Regexp lexical-goal heuristics should allow regexp literals after control-flow delimiters such as if/while conditions and switch case labels.","learned":"No implementation change was required; regexp literals in these control-flow positions are tokenized and parsed through normal expression parsing.","quickjs_cases":"Adds QuickJS-compatible regexp coverage in `if`, `while`, and `switch case` expression contexts."}}
{"run":231,"commit":"83b81ba","metric":435,"metrics":{"parser_tests":231,"parser_test_ms":400},"status":"keep","description":"Port regexp operator context coverage","timestamp":1777219479539,"segment":0,"confidence":4,"iterationTokens":1074,"asi":{"hypothesis":"Regexp lexical-goal heuristics should allow regexp literals after conditional and logical operators.","learned":"No implementation change was required; regexp literals after `?`, `:`, `||`, and `&&` parse as expression operands.","quickjs_cases":"Adds QuickJS-compatible regexp coverage for conditional branches and logical-expression operands."}}
{"run":232,"commit":"e9cbbb3","metric":437,"metrics":{"parser_tests":232,"parser_test_ms":400},"status":"keep","description":"Port regexp assignment context coverage","timestamp":1777219564864,"segment":0,"confidence":3.9814814814814814,"iterationTokens":1015,"asi":{"hypothesis":"Regexp lexical-goal heuristics should allow regexp literals as right-hand operands of assignment and logical-assignment operators.","learned":"No implementation change was required; assignment operator contexts parse regexp literals as right-hand AssignmentExpression operands.","quickjs_cases":"Adds QuickJS-compatible regexp coverage after `=`, `||=`, and `??=` operators."}}
{"run":233,"commit":"3589f95","metric":439,"metrics":{"parser_tests":233,"parser_test_ms":400},"status":"keep","description":"Port unterminated regexp diagnostics","timestamp":1777219642470,"segment":0,"confidence":3.963302752293578,"iterationTokens":1026,"asi":{"hypothesis":"Regexp scanner should report unterminated regexp literals at EOF or before a line terminator.","learned":"No implementation change was required; lexer diagnostics already report `unterminated regular expression literal` for EOF and newline termination.","quickjs_cases":"Adds QuickJS-compatible regexp diagnostics for EOF-terminated and newline-terminated regexp literals."}}
{"run":234,"commit":"8058388","metric":441,"metrics":{"parser_tests":234,"parser_test_ms":400},"status":"keep","description":"Port unterminated template diagnostics","timestamp":1777219736614,"segment":0,"confidence":3.981651376146789,"iterationTokens":1140,"asi":{"hypothesis":"Template literal scanning should report unterminated templates at EOF.","learned":"No implementation change was required; template scanning emits `unterminated template literal` while preserving the partial template literal token for recovery.","quickjs_cases":"Adds QuickJS-compatible template literal diagnostic coverage for EOF before closing backtick."}}
{"run":235,"commit":"760e909","metric":443,"metrics":{"parser_tests":235,"parser_test_ms":400},"status":"keep","description":"Port unterminated string diagnostics","timestamp":1777219801653,"segment":0,"confidence":4,"iterationTokens":884,"asi":{"hypothesis":"String literal scanning should report unterminated strings at EOF or before an unescaped line terminator.","learned":"No implementation change was required; string scanning emits `unterminated string literal` for EOF and newline termination while recovering with the cooked prefix.","quickjs_cases":"Adds QuickJS-compatible string literal diagnostics for EOF-terminated and newline-terminated strings."}}
{"run":236,"commit":"6d02d89","metric":445,"metrics":{"parser_tests":236,"parser_test_ms":400},"status":"keep","description":"Port import source diagnostics","timestamp":1777219873848,"segment":0,"confidence":3.981818181818182,"iterationTokens":1015,"asi":{"hypothesis":"Static import declarations should require a string literal module source after `from`.","learned":"No implementation change was required; module source parsing emits `expected module source` when `from` is followed by an identifier.","quickjs_cases":"Adds QuickJS-compatible module diagnostics for default, named, and namespace imports with non-string sources."}}
{"run":237,"commit":"ef97273","metric":447,"metrics":{"parser_tests":237,"parser_test_ms":500},"status":"keep","description":"Port export source diagnostics","timestamp":1777219944748,"segment":0,"confidence":3.963963963963964,"iterationTokens":912,"asi":{"hypothesis":"Re-export declarations should require a string literal module source after `from`.","learned":"No implementation change was required; named and export-all source parsing share module source diagnostics for non-string sources.","quickjs_cases":"Adds QuickJS-compatible module diagnostics for named, export-all, and namespace re-exports with non-string sources."}}
{"run":238,"commit":"1343a52","metric":449,"metrics":{"parser_tests":238,"parser_test_ms":500},"status":"keep","description":"Port import missing from diagnostics","timestamp":1777220030518,"segment":0,"confidence":3.981981981981982,"iterationTokens":917,"asi":{"hypothesis":"Static import declarations with specifiers should require a `from` keyword before the module source.","learned":"No implementation change was required; import parsing emits `expected from` when default, named, or namespace specifiers are followed directly by a string source.","quickjs_cases":"Adds QuickJS-compatible module diagnostics for default, named, and namespace imports missing `from`."}}
{"run":239,"commit":"3f6b5e3","metric":451,"metrics":{"parser_tests":239,"parser_test_ms":400},"status":"keep","description":"Port arrow duplicate parameter diagnostics","timestamp":1777220127225,"segment":0,"confidence":4,"iterationTokens":2005,"asi":{"hypothesis":"Arrow functions should reject duplicate parameter names even with expression bodies and without a `use strict` directive.","learned":"Arrow parameter validation now always applies duplicate-name checks, while still using directive-sensitive validation for restricted names in strict block bodies.","quickjs_cases":"Adds QuickJS-compatible diagnostics for duplicate parameters in sync and async arrow functions."}}
{"run":240,"commit":"d6d81bb","metric":453,"metrics":{"parser_tests":240,"parser_test_ms":400},"status":"keep","description":"Port arrow destructured duplicate diagnostics","timestamp":1777220191272,"segment":0,"confidence":3.982142857142857,"iterationTokens":897,"asi":{"hypothesis":"Arrow duplicate-parameter diagnostics should inspect nested binding patterns, not only simple parameters.","learned":"No implementation change was required after recursive binding-name collection and unconditional arrow duplicate checks; destructured arrow parameters now participate in duplicate detection.","quickjs_cases":"Adds QuickJS-compatible diagnostics for duplicate names across object and array destructuring arrow parameters."}}
{"run":241,"commit":"7463f71","metric":455,"metrics":{"parser_tests":241,"parser_test_ms":400},"status":"keep","description":"Port async line terminator arrow coverage","timestamp":1777220298617,"segment":0,"confidence":3.9646017699115044,"iterationTokens":1335,"asi":{"hypothesis":"A line terminator after `async` should prevent it from being parsed as an async arrow-function modifier.","learned":"No implementation change was required; async arrow lookahead already checks token line-terminator metadata and falls back to an identifier expression followed by a normal arrow expression statement.","quickjs_cases":"Adds QuickJS-compatible async-arrow coverage for `async\\nx => x`."}}
{"run":242,"commit":"c04b36f","metric":457,"metrics":{"parser_tests":242,"parser_test_ms":400},"status":"keep","description":"Port trailing parameter comma coverage","timestamp":1777220421405,"segment":0,"confidence":3.982300884955752,"iterationTokens":2220,"asi":{"hypothesis":"Function and arrow formal parameter parsers should accept trailing commas before the closing parenthesis.","learned":"No implementation change was required; parameter-list parsing already stops cleanly on `)` after a comma for function declarations and parenthesized arrows.","quickjs_cases":"Adds QuickJS-compatible function coverage for `function f(a, b,)` and `(a, b,) => a`."}}
{"run":243,"commit":"f936104","metric":459,"metrics":{"parser_tests":243,"parser_test_ms":400},"status":"keep","description":"Port rest trailing comma diagnostics","timestamp":1777220495199,"segment":0,"confidence":4,"iterationTokens":1713,"asi":{"hypothesis":"Rest parameters should reject trailing commas in function and arrow parameter lists.","learned":"No implementation change was required; the parameter parser expects `)` immediately after a rest binding and reports parser errors for comma forms.","quickjs_cases":"Adds QuickJS-compatible diagnostics for `function f(...rest,) {}` and `(...rest,) => rest`."}}
{"run":244,"commit":"cabcd73","metric":461,"metrics":{"parser_tests":244,"parser_test_ms":400},"status":"keep","description":"Port empty for loop coverage","timestamp":1777220605066,"segment":0,"confidence":4.017699115044247,"iterationTokens":1256,"asi":{"hypothesis":"Classic for-loop parsing should support omitted init, test, and update clauses.","learned":"No implementation change was required; classic for-tail parsing preserves nil init/test/update fields for `for (;;)`.","quickjs_cases":"Adds QuickJS-compatible control-flow coverage for `for (;;) { break; }`."}}
{"run":245,"commit":"5263c49","metric":463,"metrics":{"parser_tests":245,"parser_test_ms":400},"status":"keep","description":"Port for loop sequence clause coverage","timestamp":1777220691750,"segment":0,"confidence":4.035398230088496,"iterationTokens":977,"asi":{"hypothesis":"Classic for-loop init and update clauses should preserve comma sequence expressions.","learned":"No implementation change was required; expression parsing in for-loop clauses already produces SequenceExpression nodes for comma-separated assignment/update operands.","quickjs_cases":"Adds QuickJS-compatible control-flow coverage for sequence init/update clauses in a classic for loop."}}
{"run":246,"commit":"5175c69","metric":465,"metrics":{"parser_tests":246,"parser_test_ms":400},"status":"keep","description":"Port for-await destructuring coverage","timestamp":1777220770453,"segment":0,"confidence":4.017543859649122,"iterationTokens":1062,"asi":{"hypothesis":"For-await-of parsing should compose with const object destructuring bindings inside async functions.","learned":"No implementation change was required; for-await parsing reuses the for-of declaration left-hand parser and preserves `await: true`.","quickjs_cases":"Adds QuickJS-compatible async control-flow coverage for `for await (const { value } of stream)`."}}
