{"run":392,"commit":"a29770f","metric":2928,"metrics":{"class_private_parser_us":26,"function_control_parser_us":31,"quickjs_parser_tests":759,"parser_tests":421,"parser_test_ms":700},"status":"keep","description":"Scan raw identifier offsets before updating lexer","timestamp":1777289589795,"segment":1,"confidence":3.604449938195303,"iterationTokens":3515,"asi":{"hypothesis":"advance_identifier_raw/1 remains hot and previously rebuilt the lexer map for every ASCII identifier byte. Scanning the raw offset first and updating lexer offset/column once per ASCII run should reduce allocation and map update overhead.","changes":"Added advance_identifier_raw_offset/3 to scan ASCII identifier bytes as an offset loop. The lexer struct is updated once for the run; unicode escape and non-ASCII fallbacks preserve existing behavior.","benchmark_after":"test_language_parser_us=2928, improving over kept best 2974. class_private_parser_us=26; function_control_parser_us=31. Parser coverage unchanged at 421 tests / 759 QuickJS-port tests; backpressure checks passed.","next_action_hint":"Look for other per-byte lexer paths that rebuild the lexer map repeatedly, especially skip_trivia/1, advance_bytes/2 consumers, and string/template scanners."}}
{"run":393,"commit":"59f8bb4","metric":3036,"metrics":{"class_private_parser_us":26,"function_control_parser_us":32,"quickjs_parser_tests":759,"parser_tests":421,"parser_test_ms":600},"status":"discard","description":"Try binary-pattern raw identifier scanning","timestamp":1777289705244,"segment":1,"confidence":3.9619565217391304,"iterationTokens":4903,"asi":{"hypothesis":"advance_identifier_raw_offset/3 still shows as hot; scanning a subbinary with binary pattern matching could avoid repeated :binary.at calls and inline ASCII identifier checks.","result":"Regression versus kept best: test_language_parser_us=3036 vs 2928. Small snippets remained good but primary worsened.","rollback_reason":"Creating/scanning subbinaries with pattern recursion was slower than direct :binary.at offset recursion for the large benchmark.","next_action_hint":"Keep the offset-loop optimization, but do not convert raw identifier scanning to subbinary pattern recursion. Investigate lexer skip_trivia/advance/current instead."}}
{"run":394,"commit":"185e2c1","metric":2938,"metrics":{"class_private_parser_us":27,"function_control_parser_us":33,"quickjs_parser_tests":759,"parser_tests":421,"parser_test_ms":600},"status":"discard","description":"Try batched inline whitespace skipping","timestamp":1777289793695,"segment":1,"confidence":4.2322206095791,"iterationTokens":3862,"asi":{"hypothesis":"skip_trivia/1 is still hot and rebuilds lexer state for each inline whitespace byte; scanning spaces/tabs/vtab/formfeed in an offset loop and updating once might reduce lexer overhead.","result":"No improvement versus kept best: test_language_parser_us=2938 vs 2928. Parser tests and backpressure checks passed.","rollback_reason":"Within noise/slightly worse than kept best, so not enough to keep.","next_action_hint":"Whitespace batching is not worthwhile in current benchmark. Investigate string/template scanning or parser validation passes."}}
{"run":395,"commit":"9e658d6","metric":3031,"metrics":{"class_private_parser_us":26,"function_control_parser_us":32,"quickjs_parser_tests":759,"parser_tests":421,"parser_test_ms":700},"status":"discard","description":"Try current-token argument parsing","timestamp":1777289895832,"segment":1,"confidence":4.703225806451613,"iterationTokens":3318,"asi":{"hypothesis":"parse_arguments/2 shows in profile and repeatedly calls eof?/match_value? at argument starts and separators; using current-token dispatch and a separator helper could reduce parser helper calls.","result":"Regression versus kept best: test_language_parser_us=3031 vs 2928. Parser tests and checks passed.","rollback_reason":"The extra helper/case structure did not improve primary benchmark, likely due overhead and limited call volume.","next_action_hint":"Avoid small parser loop rewrites unless they reduce much higher call counts. Look at lexer current/codepoint paths or AST validation traversal."}}
{"run":396,"commit":"4cac597","metric":2950,"metrics":{"class_private_parser_us":26,"function_control_parser_us":32,"quickjs_parser_tests":759,"parser_tests":421,"parser_test_ms":700},"status":"discard","description":"Try ASCII string raw chunk scanning","timestamp":1777291916195,"segment":1,"confidence":4.851913477537438,"iterationTokens":5025,"asi":{"hypothesis":"scan_string_body/4 appears in eprof and currently advances one codepoint at a time while accumulating single-character binaries. Scanning raw ASCII string chunks by offset and appending a sliced chunk should reduce lexer map updates and allocations for ordinary strings.","result":"No improvement versus kept best: test_language_parser_us=2950 vs 2928. Manual run was noisy/promising at 2847, but authoritative run_experiment did not beat best. Parser tests and backpressure checks passed.","rollback_reason":"The raw chunk fast path likely adds overhead to many short strings or is within benchmark noise; not worth keeping without primary improvement.","next_action_hint":"String raw chunking is not a clear win. Consider template scanning, comment scanning, or validation traversal consolidation next."}}
{"run":397,"commit":"81f5103","metric":3433,"metrics":{"class_private_parser_us":27,"function_control_parser_us":33,"quickjs_parser_tests":759,"parser_tests":421,"parser_test_ms":800},"status":"checks_failed","description":"Try template raw chunk scanning","timestamp":1777292022277,"segment":1,"confidence":4.703225806451613,"iterationTokens":3166,"asi":{"hypothesis":"scan_template_body/2 appears in eprof and advances one byte/codepoint at a time through raw template text. Scanning raw template chunks by offset could reduce lexer map updates similarly to identifiers.","result":"Regression versus kept best: test_language_parser_us=3433 vs 2928. Backpressure checks also failed due known transient Process.monitor noproc/kaboom flake.","rollback_reason":"Primary benchmark regressed and checks failed; revert.","next_action_hint":"Template chunk scanning is not promising in this form. Focus on validation traversal or a much more targeted lexer hot path.","check_failure":"test/web_apis/beam_process_test.exs Process.monitor callback fires with exit reason returned noproc instead of kaboom, known transient flake."}}
{"run":398,"commit":"2d83965","metric":3047,"metrics":{"class_private_parser_us":35,"function_control_parser_us":52,"quickjs_parser_tests":759,"parser_tests":421,"parser_test_ms":700},"status":"discard","description":"Try single-current keyword helper","timestamp":1777292128853,"segment":1,"confidence":5.301818181818182,"iterationTokens":5627,"asi":{"hypothesis":"keyword?/2 is still hot and currently calls current/1 twice; pattern matching on one current token should reduce token_at/current overhead.","result":"Regression versus kept best: test_language_parser_us=3047 vs 2928, and small snippet secondaries regressed substantially. Parser tests and checks passed.","rollback_reason":"Pattern-match helper shape was slower despite fewer current calls, consistent with earlier failed helper micro-optimizations.","next_action_hint":"Do not revisit isolated keyword?/match_value? helper micro-optimizations. Need algorithmic or call-site-specific changes."}}
{"run":399,"commit":"9b75fff","metric":3137,"metrics":{"class_private_parser_us":24,"function_control_parser_us":30,"quickjs_parser_tests":759,"parser_tests":421,"parser_test_ms":700},"status":"discard","description":"Try direct current token elem access","timestamp":1777292225785,"segment":1,"confidence":6.075,"iterationTokens":1651,"asi":{"hypothesis":"current/1 is hot and routes through token_at/2 with bounds fallback intended for peek. Since current index should always point at a valid token, direct elem(tokens, index) might reduce overhead.","result":"Regression versus kept best: test_language_parser_us=3137 vs 2928. Some secondary snippets improved but primary worsened. Parser tests and checks passed.","rollback_reason":"Direct current/1 did not improve the primary benchmark, likely due BEAM pattern/guard/code layout effects or noise despite fewer token_at calls.","next_action_hint":"Do not assume token_at/current micro-optimizations help. Continue with algorithmic lexer/parser changes only."}}
{"run":400,"commit":"020d417","metric":3171,"metrics":{"class_private_parser_us":32,"function_control_parser_us":35,"quickjs_parser_tests":759,"parser_tests":421,"parser_test_ms":900},"status":"discard","description":"Try keyword case dispatch","timestamp":1777292343256,"segment":1,"confidence":6.177966101694915,"iterationTokens":3152,"asi":{"hypothesis":"sets:is_element/2 from MapSet keyword lookup appears in lexer profiling; replacing it with a binary case dispatch may avoid set lookup overhead for identifiers.","result":"Regression versus kept best: test_language_parser_us=3171 vs 2928; parser test time also increased. Parser tests and checks passed.","rollback_reason":"Large binary case dispatch is slower than MapSet lookup in this workload/code layout.","next_action_hint":"Keep MapSet keyword lookup. Avoid hand-written keyword case dispatch."}}
{"run":401,"commit":"80d8736","metric":3312,"metrics":{"class_private_parser_us":27,"function_control_parser_us":34,"quickjs_parser_tests":759,"parser_tests":421,"parser_test_ms":900},"status":"checks_failed","description":"Try targeted raw identifier inlining","timestamp":1777292428419,"segment":1,"confidence":6.230769230769231,"iterationTokens":1608,"asi":{"hypothesis":"advance_identifier_raw_offset/3 remains hot after the offset-scanning win; targeted @compile inline for the raw identifier offset loop and ASCII predicate might reduce call overhead without broad inline bloat.","result":"Regression versus kept best: test_language_parser_us=3312 vs 2928. Checks also failed due known Process.monitor noproc/kaboom flake.","rollback_reason":"Primary benchmark regressed and checks failed; targeted inlining is not useful here.","next_action_hint":"Avoid @compile inline for lexer hot helpers; broad and targeted variants both regressed.","check_failure":"test/web_apis/beam_process_test.exs Process.monitor callback fires with exit reason returned noproc instead of kaboom, known transient flake."}}
{"run":402,"commit":"23e19b3","metric":7183,"metrics":{"class_private_parser_us":35,"function_control_parser_us":34,"quickjs_parser_tests":759,"parser_tests":421,"parser_test_ms":1200},"status":"discard","description":"Try case-based operator precedence","timestamp":1777292692618,"segment":1,"confidence":5.785714285714286,"iterationTokens":8004,"asi":{"hypothesis":"parse_binary_tail/3 is a hot expression call site and performs Map.get(@precedence, operator) for every expression tail. Replacing the map with a function/case dispatch might reduce map lookup overhead.","result":"Large regression: test_language_parser_us=7183 vs kept best 2928; parser tests and checks passed.","rollback_reason":"BEAM binary case dispatch for many operators is much slower here than the module attribute map lookup.","next_action_hint":"Keep @precedence map. Avoid large operator case dispatch; if optimizing binary expressions, target avoiding parse_binary_tail calls when token value is clearly not an operator rather than replacing precedence lookup."}}
{"run":403,"commit":"01afa9e","metric":3034,"metrics":{"class_private_parser_us":27,"function_control_parser_us":32,"quickjs_parser_tests":759,"parser_tests":421,"parser_test_ms":700},"status":"discard","description":"Try binary-tail terminator fast path","timestamp":1777292793750,"segment":1,"confidence":6.230769230769231,"iterationTokens":3159,"asi":{"hypothesis":"Instead of replacing precedence lookup, avoid it for common expression terminators in parse_binary_tail/3. Many expression tails likely see ), ;, }, or ] where no binary operator can follow.","result":"Regression versus kept best: test_language_parser_us=3034 vs 2928. Parser tests and checks passed.","rollback_reason":"The extra terminator membership check cost more than the avoided Map.get calls, or did not match enough hot cases.","next_action_hint":"Avoid simple binary-tail prefilters. The expression loop may need a deeper restructuring or parser-state metadata rather than local guard checks."}}
{"run":404,"commit":"1952c1e","metric":3312,"metrics":{"class_private_parser_us":34,"function_control_parser_us":33,"quickjs_parser_tests":759,"parser_tests":421,"parser_test_ms":900},"status":"discard","description":"Try early identifier prefix branch","timestamp":1777292895408,"segment":1,"confidence":5.890909090909091,"iterationTokens":2221,"asi":{"hypothesis":"Many parse_prefix/1 calls start on plain identifiers but still check async/import/new/class/function keyword branches first. Handling token.type == :identifier immediately after literals could avoid repeated keyword?/current calls at a hot expression site.","result":"Regression versus kept best: test_language_parser_us=3312 vs 2928. Parser tests and checks passed.","rollback_reason":"Moving identifier handling earlier changed branch layout and added peek work enough to hurt the primary benchmark.","next_action_hint":"Avoid parse_prefix branch reordering; previous full and focused parse_prefix rewrites both regressed. Consider parser state metadata or different AST construction strategy instead."}}
{"run":405,"commit":"6ed816a","metric":3984,"metrics":{"class_private_parser_us":29,"function_control_parser_us":34,"quickjs_parser_tests":759,"parser_tests":421,"parser_test_ms":800},"status":"discard","description":"Try direct binary-tail token value","timestamp":1777293013427,"segment":1,"confidence":5.5227272727272725,"iterationTokens":1906,"asi":{"hypothesis":"parse_binary_tail/3 only needs token.value for operators, including keyword operators in/instanceof. Avoiding operator_value/1 at this hot call site might reduce expression overhead.","result":"Regression versus kept best: test_language_parser_us=3984 vs 2928. Parser tests and checks passed.","rollback_reason":"Direct field access in this context unexpectedly worsened primary benchmark, likely due code generation/layout effects; keep operator_value/1.","next_action_hint":"Expression micro-optimizations remain unreliable. Consider a larger architecture experiment, such as storing token kind metadata during lexing only if profiling justifies it."}}
{"type":"config","name":"JavaScript Parser Compatibility","metricName":"test_language_errors","metricUnit":"","bestDirection":"lower"}
{"run":406,"commit":"d73e56b","metric":42,"metrics":{"test_language_unique_errors":3,"test_language_parse_ok":0,"quickjs_parser_tests":759,"parser_tests":421,"parser_test_ms":700},"status":"keep","description":"Set compatibility autoresearch baseline","timestamp":1777293414397,"segment":2,"confidence":null,"iterationTokens":99,"asi":{"hypothesis":"Switch autoresearch from parser throughput to closing QuickJS-compatible syntax gaps by measuring parser errors on test/vm/test_language.js while preserving focused parser tests.","changes":"Added bench/js_parser_compat.exs, rewrote autoresearch.md and autoresearch.sh for compatibility metrics, and initialized a new test_language_errors baseline.","baseline":"test_language_errors=42, test_language_unique_errors=3, test_language_parse_ok=0, quickjs_parser_tests=759, parser_tests=421.","next_action_hint":"Inspect earliest errors by line. First gaps appear to be invalid numeric literal handling at lines 93/649 and repeated expected expression/expected ) around object literal calls using unusual property keys or syntax."}}
{"run":407,"commit":"009866b","metric":4,"metrics":{"test_language_unique_errors":3,"test_language_parse_ok":0,"quickjs_parser_tests":760,"parser_tests":423,"parser_test_ms":1000},"status":"keep","description":"Parse string values that look like operators","timestamp":1777293565578,"segment":2,"confidence":null,"iterationTokens":6307,"asi":{"hypothesis":"Most test_language errors come from string literals whose values are ++/-- being interpreted as update operators because parse_prefix/1 used match_value?/2 without checking token type.","changes":"Restricted prefix/postfix update operators to punctuator tokens and unary operators to punctuator/keyword tokens. Added QuickJS-port tests for string literals whose values match update/unary operators.","benchmark_after":"test_language_errors reduced from 42 to 4. Parser tests increased to 423 and QuickJS-port coverage to 760. Backpressure checks passed.","next_action_hint":"Fix remaining number/member gap around 0x7ffffffe and 01.a/0x1.a numeric property access without weakening invalid numeric literal diagnostics."}}
{"run":408,"commit":"65f97f7","metric":0,"metrics":{"test_language_unique_errors":0,"test_language_parse_ok":1,"quickjs_parser_tests":761,"parser_tests":426,"parser_test_ms":1200},"status":"keep","description":"Parse remaining numeric literal member cases","timestamp":1777293670978,"segment":2,"confidence":null,"iterationTokens":7435,"asi":{"hypothesis":"The remaining test_language gaps are numeric literal edge cases: hex literals ending with e were incorrectly checked as malformed exponents, and legacy leading-zero integer member access like 01.a was scanned as a decimal with trailing dot.","changes":"Limited exponent-separator validation to non-prefixed decimal literals, and prevented decimal fraction scanning for leading-zero integer literals followed by dot plus identifier. Added QuickJS-port tests for 0x7ffffffe, 01.a, and keeping 0.a invalid.","benchmark_after":"test_language_errors reduced from 4 to 0; test_language_parse_ok=1; parser tests increased to 426 and QuickJS-port coverage to 761. Backpressure checks passed.","next_action_hint":"Since test_language.js now parses cleanly, broaden the compatibility benchmark to additional QuickJS-compatible sources or QuickJS-derived focused tests rather than overfitting this file."}}
{"type":"config","name":"JavaScript Parser Test262 Compatibility Sample","metricName":"test262_language_sample_errors","metricUnit":"","bestDirection":"lower"}
{"run":409,"commit":"9868247","metric":10,"metrics":{"test262_language_sample_error_files":3,"test262_language_sample_unique_errors":4,"test262_language_sample_files":300,"test_language_errors":0,"test_language_unique_errors":0,"test_language_parse_ok":1,"quickjs_parser_tests":761,"parser_tests":426,"parser_test_ms":700},"status":"keep","description":"Set Test262 language sample baseline","timestamp":1777293968563,"segment":3,"confidence":null,"iterationTokens":104,"asi":{"hypothesis":"test_language.js now parses cleanly, so broaden compatibility autoresearch to a deterministic non-negative Test262 language sample to find remaining accepted syntax gaps.","changes":"Expanded bench/js_parser_compat.exs to parse the first 300 sorted non-negative test/test262/test/language/**/*.js files, updated autoresearch docs, and switched the primary metric to test262_language_sample_errors.","baseline":"test262_language_sample_errors=10 across 3 files; test_language_errors remains 0; parser_tests=426; quickjs_parser_tests=761.","first_failures":"arguments-object/S10.6_A7.js expected private name for object #{...}; mapped descriptor tests expected } around getter/setter descriptor literals.","next_action_hint":"Inspect object literal syntax in the three failing files; likely gaps include legacy SpiderMonkey object literal sharp variables or getter/setter property forms."}}
{"run":410,"commit":"47db273","metric":0,"metrics":{"test262_language_sample_error_files":0,"test262_language_sample_unique_errors":0,"test262_language_sample_files":300,"test_language_errors":0,"test_language_unique_errors":0,"test_language_parse_ok":1,"quickjs_parser_tests":763,"parser_tests":429,"parser_test_ms":900},"status":"keep","description":"Parse Test262 sample arrow and string punctuator gaps","timestamp":1777294098953,"segment":3,"confidence":null,"iterationTokens":6040,"asi":{"hypothesis":"The three failing Test262 sample files are due two broad grammar gaps: string literal values like \"#\" are interpreted as private-name punctuators, and arrow concise bodies incorrectly consume comma separators inside object literal properties.","changes":"Restricted private identifier expression parsing to punctuator # tokens, and parsed arrow concise bodies at assignment precedence so comma remains available to surrounding object/sequence parsing. Added QuickJS-port regression tests for string # literals and arrow bodies before object property separators/sequence commas.","benchmark_after":"test262_language_sample_errors reduced from 10 to 0 across 300 files; test_language_errors remains 0; parser tests increased to 429 and QuickJS-port coverage to 763. Backpressure checks passed.","next_action_hint":"Broaden the deterministic Test262 language sample beyond 300 files to expose the next compatibility gaps."}}
{"type":"config","name":"JavaScript Parser Test262 Compatibility 1000 Sample","metricName":"test262_language_sample_errors","metricUnit":"","bestDirection":"lower"}
