{"run":685,"commit":"7ddd78b","metric":28,"metrics":{"compiler_test262_cases":500,"compiler_test262_pass":472,"compiler_test262_failures":28,"compiler_test262_compiler_errors":0,"compiler_test262_compiler_crashes":0,"compiler_test262_compiler_fails":2,"compiler_test262_both_fail":25,"compiler_test262_interpreter_fail_compiler_pass":0,"compatibility_pass":472,"compatibility_cases":500,"compiler_errors":0,"compiler_crashes":0,"compiler_fails":2,"both_fail":25,"interpreter_fail_compiler_pass":0,"elapsed_ms":37151},"status":"keep","description":"Store undefined accessors as absent","timestamp":1778059408104,"segment":24,"confidence":3.878260869565217,"iterationTokens":3843,"asi":{"hypothesis":"Accessor descriptors with get/set explicitly undefined should store absent accessor slots, not the JS :undefined sentinel as a callable getter/setter.","improvement":"Fixed remaining getter/setter-undefined descriptor cases, reducing bounded built-ins/Object failures from 31 to 28 with checks passing.","next_action_hint":"Remaining failures are concentrated in Object.assign Throw=true/target array, Object static metadata/constructability, Date/arguments receiver identity, and two compiler-only descriptor cases."}}
{"run":686,"commit":"7ddd78b","metric":28,"metrics":{"compiler_test262_cases":500,"compiler_test262_pass":472,"compiler_test262_failures":28,"compiler_test262_compiler_errors":0,"compiler_test262_compiler_crashes":0,"compiler_test262_compiler_fails":2,"compiler_test262_both_fail":23,"compiler_test262_interpreter_fail_compiler_pass":2,"compatibility_pass":472,"compatibility_cases":500,"compiler_errors":0,"compiler_crashes":0,"compiler_fails":2,"both_fail":23,"interpreter_fail_compiler_pass":2,"elapsed_ms":37752},"status":"discard","description":"Tag arguments objects for toString","timestamp":1778059820298,"segment":24,"confidence":3.716666666666667,"iterationTokens":3679,"asi":{"hypothesis":"Arguments objects should be distinguishable from arrays for Object.prototype.toString and descriptor-container receiver checks.","rollback_reason":"Primary metric stayed at 28 and introduced interpreter/compiler skew; broad argument tagging is not sufficient and may perturb compiled argument identity.","next_action_hint":"Do not retry broad arguments tagging alone. Focus remaining failures on smaller clusters or implement a full arguments object model."}}
{"run":687,"commit":"7ddd78b","metric":0,"metrics":{"compiler_test262_cases":0,"compiler_test262_pass":0,"compiler_test262_failures":0,"compiler_test262_compiler_errors":0,"compiler_test262_compiler_crashes":0,"compiler_test262_compiler_fails":0,"compiler_test262_both_fail":0,"compiler_test262_interpreter_fail_compiler_pass":0,"compatibility_pass":0,"compatibility_cases":0,"compiler_errors":0,"compiler_crashes":0,"compiler_fails":0,"both_fail":0,"interpreter_fail_compiler_pass":0,"elapsed_ms":400},"status":"crash","description":"Honor wrapped primitive valueOf overrides","timestamp":1778060353180,"segment":24,"confidence":3.716666666666667,"iterationTokens":3679,"asi":{"hypothesis":"Wrapped primitive objects should let own valueOf overrides participate in ToPrimitive before falling back to the internal wrapped primitive, enabling Object(Infinity) == Infinity while respecting user-defined valueOf.","rollback_reason":"Compile failed because function_like?/1 cannot be used in a guard.","next_action_hint":"Retry with callable check moved out of the guard, then evaluate whether wrapped number equality failures improve."}}
{"run":688,"commit":"7ddd78b","metric":28,"metrics":{"compiler_test262_cases":500,"compiler_test262_pass":472,"compiler_test262_failures":28,"compiler_test262_compiler_errors":0,"compiler_test262_compiler_crashes":0,"compiler_test262_compiler_fails":2,"compiler_test262_both_fail":25,"compiler_test262_interpreter_fail_compiler_pass":0,"compatibility_pass":472,"compatibility_cases":500,"compiler_errors":0,"compiler_crashes":0,"compiler_fails":2,"both_fail":25,"interpreter_fail_compiler_pass":0,"elapsed_ms":39373},"status":"discard","description":"Honor wrapped primitive valueOf overrides","timestamp":1778060553095,"segment":24,"confidence":3.140845070422535,"iterationTokens":1514,"asi":{"hypothesis":"Wrapped primitive objects should let own valueOf overrides participate in ToPrimitive before falling back to the internal wrapped primitive, enabling Object(Infinity) == Infinity.","rollback_reason":"Primary bounded built-ins/Object metric stayed at 28; the legacy Object(Infinity) case likely fails for another reason such as Infinity token representation or assert path.","next_action_hint":"Avoid standalone wrapped-primitive ToPrimitive tweaks until focused S15.2 failures are inspected in both modes."}}
{"run":689,"commit":"7ddd78b","metric":0,"metrics":{"compiler_test262_cases":0,"compiler_test262_pass":0,"compiler_test262_failures":0,"compiler_test262_compiler_errors":0,"compiler_test262_compiler_crashes":0,"compiler_test262_compiler_fails":0,"compiler_test262_both_fail":0,"compiler_test262_interpreter_fail_compiler_pass":0,"compatibility_pass":0,"compatibility_cases":0,"compiler_errors":0,"compiler_crashes":0,"compiler_fails":0,"both_fail":0,"interpreter_fail_compiler_pass":0,"elapsed_ms":655000},"status":"crash","description":"Default wrapper prototypes to Object.prototype","timestamp":1778061384079,"segment":24,"confidence":3.140845070422535,"iterationTokens":1514,"asi":{"hypothesis":"Built-in wrapper prototypes such as Number.prototype and Date.prototype should inherit from Object.prototype so wrapper instances can use Object.prototype methods while preserving constructor links.","rollback_reason":"Experiment hung suspiciously for over ten minutes on the bounded Object workload, likely due prototype cycle or pathological prototype traversal after defaulting registered prototypes to Object.prototype.","next_action_hint":"Do not retry broad register_proto defaulting. If needed, set prototype inheritance explicitly for individual builtins after checking for cycles and run focused hasOwnProperty probes first."}}
{"run":690,"commit":"689e972","metric":32,"metrics":{"compiler_test262_cases":500,"compiler_test262_pass":468,"compiler_test262_failures":32,"compiler_test262_compiler_errors":0,"compiler_test262_compiler_crashes":0,"compiler_test262_compiler_fails":6,"compiler_test262_both_fail":25,"compiler_test262_interpreter_fail_compiler_pass":0,"compatibility_pass":468,"compatibility_cases":500,"compiler_errors":0,"compiler_crashes":0,"compiler_fails":6,"both_fail":25,"interpreter_fail_compiler_pass":0,"elapsed_ms":40930},"status":"checks_failed","description":"Reject non-constructor builtin newTargets","timestamp":1778062243961,"segment":24,"confidence":3.2794117647058822,"iterationTokens":1514,"asi":{"hypothesis":"Reflect.construct should validate both target and newTarget constructability, and Object static builtin methods like Object.assign/Object.create should not be constructors.","rollback_reason":"Primary metric regressed from 28 to 32 and backpressure compiler tests failed because Proxy/Reflect helper tests rely on non-constructor callable builtin targets/newTargets under current representation.","next_action_hint":"Do not use broad builtin name allowlists. If constructability is revisited, represent builtin constructability explicitly at registration instead of inferring from names."}}
{"run":691,"commit":"2cf1fe9","metric":27,"metrics":{"compiler_test262_cases":500,"compiler_test262_pass":473,"compiler_test262_failures":27,"compiler_test262_compiler_errors":0,"compiler_test262_compiler_crashes":0,"compiler_test262_compiler_fails":2,"compiler_test262_both_fail":24,"compiler_test262_interpreter_fail_compiler_pass":0,"compatibility_pass":473,"compatibility_cases":500,"compiler_errors":0,"compiler_crashes":0,"compiler_fails":2,"both_fail":24,"interpreter_fail_compiler_pass":0,"elapsed_ms":40916},"status":"keep","description":"Invoke setters on frozen objects","timestamp":1778062526021,"segment":24,"confidence":3.1773049645390072,"iterationTokens":5448,"asi":{"hypothesis":"Writing an existing accessor property with a setter should invoke the setter even when the target object is frozen; frozen prevents data writes and extensions, not setter calls.","improvement":"Fixed the Object.assign frozen accessor target case, reducing bounded built-ins/Object failures from 28 to 27 with checks passing.","next_action_hint":"Remaining Object.assign Throw=true failures need strict failed-write handling without regressing checks; continue focused changes rather than broad Put.set replacement."}}
{"run":692,"commit":"2cf1fe9","metric":43,"metrics":{"compiler_test262_cases":500,"compiler_test262_pass":457,"compiler_test262_failures":43,"compiler_test262_compiler_errors":0,"compiler_test262_compiler_crashes":0,"compiler_test262_compiler_fails":2,"compiler_test262_both_fail":19,"compiler_test262_interpreter_fail_compiler_pass":0,"compatibility_pass":457,"compatibility_cases":500,"compiler_errors":0,"compiler_crashes":0,"compiler_fails":2,"both_fail":19,"interpreter_fail_compiler_pass":0,"elapsed_ms":20731},"status":"checks_failed","description":"Throw on Object.assign failed writes","timestamp":1778062728803,"segment":24,"confidence":3.0684931506849313,"iterationTokens":3786,"asi":{"hypothesis":"Object.assign should throw when strict target writes fail for read-only or non-extensible targets while still invoking setters for accessor properties.","rollback_reason":"Primary metric regressed badly and checks failed because Get.get_own/2 is private/undefined from Object runtime; this targeted precheck approach also disturbed many cases.","next_action_hint":"Do not retry this exact assign precheck. If revisiting, expose or implement a local raw own-property helper and first run focused frozen/non-extensible snippets."}}
{"run":693,"commit":"2cf1fe9","metric":27,"metrics":{"compiler_test262_cases":500,"compiler_test262_pass":473,"compiler_test262_failures":27,"compiler_test262_compiler_errors":0,"compiler_test262_compiler_crashes":0,"compiler_test262_compiler_fails":2,"compiler_test262_both_fail":24,"compiler_test262_interpreter_fail_compiler_pass":0,"compatibility_pass":473,"compatibility_cases":500,"compiler_errors":0,"compiler_crashes":0,"compiler_fails":2,"both_fail":24,"interpreter_fail_compiler_pass":0,"elapsed_ms":39908},"status":"checks_failed","description":"Expose builtin length reads","timestamp":1778063061997,"segment":24,"confidence":3.111111111111111,"iterationTokens":7911,"asi":{"hypothesis":"Builtin functions should expose direct length values for Object.create/defineProperties metadata tests.","rollback_reason":"Primary metric stayed at 27 and checks failed due ungrouped get_own/2 clauses under warnings-as-errors.","next_action_hint":"Standalone builtin length reads remain flat; only revisit as part of a coherent builtin function own-property/descriptor implementation."}}
{"run":694,"commit":"2c8b318","metric":26,"metrics":{"compiler_test262_cases":500,"compiler_test262_pass":474,"compiler_test262_failures":26,"compiler_test262_compiler_errors":0,"compiler_test262_compiler_crashes":0,"compiler_test262_compiler_fails":2,"compiler_test262_both_fail":23,"compiler_test262_interpreter_fail_compiler_pass":0,"compatibility_pass":474,"compatibility_cases":500,"compiler_errors":0,"compiler_crashes":0,"compiler_fails":2,"both_fail":23,"interpreter_fail_compiler_pass":0,"elapsed_ms":36389},"status":"keep","description":"Expose globals on globalThis","timestamp":1778063447170,"segment":24,"confidence":3.1690140845070425,"iterationTokens":7919,"asi":{"hypothesis":"The global object should expose global bindings such as Object as own properties so top-level this.Object matches the Object binding.","improvement":"Fixed the legacy Object globalThis binding case, reducing bounded built-ins/Object failures from 27 to 26 with checks passing.","next_action_hint":"Remaining legacy Object constructor prototype/length cases need function prototype/static metadata; continue avoiding standalone flat builtin metadata tweaks."}}
{"run":695,"commit":"2c8b318","metric":26,"metrics":{"compiler_test262_cases":500,"compiler_test262_pass":474,"compiler_test262_failures":26,"compiler_test262_compiler_errors":0,"compiler_test262_compiler_crashes":0,"compiler_test262_compiler_fails":2,"compiler_test262_both_fail":23,"compiler_test262_interpreter_fail_compiler_pass":0,"compatibility_pass":474,"compatibility_cases":500,"compiler_errors":0,"compiler_crashes":0,"compiler_fails":2,"both_fail":23,"interpreter_fail_compiler_pass":0,"elapsed_ms":39652},"status":"discard","description":"Fallback Object constructor reads to Object prototype","timestamp":1778063716625,"segment":24,"confidence":3.1690140845070425,"iterationTokens":2897,"asi":{"hypothesis":"The Object constructor should fall back to Object.prototype methods like hasOwnProperty after Object static lookup misses.","rollback_reason":"Primary metric stayed at 26; this repeats the earlier flat single-path Object fallback result even after globalThis improvements.","next_action_hint":"Do not retry Object constructor fallback alone. S15.2.3_A1/A2 need coherent Function.prototype/prototype own-property semantics."}}
{"run":696,"commit":"8fdcd6c","metric":25,"metrics":{"compiler_test262_cases":500,"compiler_test262_pass":475,"compiler_test262_failures":25,"compiler_test262_compiler_errors":0,"compiler_test262_compiler_crashes":0,"compiler_test262_compiler_fails":2,"compiler_test262_both_fail":22,"compiler_test262_interpreter_fail_compiler_pass":0,"compatibility_pass":475,"compatibility_cases":500,"compiler_errors":0,"compiler_crashes":0,"compiler_fails":2,"both_fail":22,"interpreter_fail_compiler_pass":0,"elapsed_ms":36501},"status":"keep","description":"Keep Date component construction in stored time","timestamp":1778064120458,"segment":24,"confidence":3.183098591549296,"iterationTokens":9692,"asi":{"hypothesis":"Date component construction and Date prototype field getters should use a consistent stored-time basis; applying local timezone conversion while getters read UTC shifts month/day backward.","improvement":"Fixed legacy new Object(Date) month semantics, reducing bounded built-ins/Object failures from 26 to 25 with checks passing.","next_action_hint":"Continue Date receiver identity compiler-only failures and arguments toStringTag cases; avoid broader timezone work unless covered by checks."}}
{"run":697,"commit":"4ae22b0","metric":23,"metrics":{"compiler_test262_cases":500,"compiler_test262_pass":477,"compiler_test262_failures":23,"compiler_test262_compiler_errors":0,"compiler_test262_compiler_crashes":0,"compiler_test262_compiler_fails":2,"compiler_test262_both_fail":20,"compiler_test262_interpreter_fail_compiler_pass":0,"compatibility_pass":477,"compatibility_cases":500,"compiler_errors":0,"compiler_crashes":0,"compiler_fails":2,"both_fail":20,"interpreter_fail_compiler_pass":0,"elapsed_ms":40689},"status":"keep","description":"Compare wrapped infinities by primitive value","timestamp":1778064414783,"segment":24,"confidence":3.3043478260869565,"iterationTokens":4086,"asi":{"hypothesis":"Abstract equality with boxed numbers must ToPrimitive object operands when the other operand is the VM's special infinity/nan number atom representation, just like ordinary numbers.","improvement":"Fixed legacy Object(Infinity) and new Object(Infinity) equality cases, reducing bounded built-ins/Object failures from 25 to 23 with checks passing.","next_action_hint":"Remaining legacy Object constructor failures are prototype/length metadata; continue with coherent function/static property model or inspect descriptor failures."}}
{"run":698,"commit":"4ae22b0","metric":23,"metrics":{"compiler_test262_cases":500,"compiler_test262_pass":477,"compiler_test262_failures":23,"compiler_test262_compiler_errors":0,"compiler_test262_compiler_crashes":0,"compiler_test262_compiler_fails":2,"compiler_test262_both_fail":20,"compiler_test262_interpreter_fail_compiler_pass":0,"compatibility_pass":477,"compatibility_cases":500,"compiler_errors":0,"compiler_crashes":0,"compiler_fails":2,"both_fail":20,"interpreter_fail_compiler_pass":0,"elapsed_ms":37969},"status":"checks_failed","description":"Expose builtin own metadata coherently","timestamp":1778064615796,"segment":24,"confidence":3.5625,"iterationTokens":3858,"asi":{"hypothesis":"Builtin constructors and static functions need consistent own-property, read, and descriptor metadata for name/length/prototype.","rollback_reason":"Primary metric stayed at 23 and checks failed due ungrouped get_own/2 clauses; even coherent metadata did not move the bounded workload.","next_action_hint":"Do not retry metadata without restructuring Get.get_own grouping and focused confirmation that S15.2.3_A1/A3 pass."}}
{"run":699,"commit":"4ae22b0","metric":0,"metrics":{"compiler_test262_cases":0,"compiler_test262_pass":0,"compiler_test262_failures":0,"compiler_test262_compiler_errors":0,"compiler_test262_compiler_crashes":0,"compiler_test262_compiler_fails":0,"compiler_test262_both_fail":0,"compiler_test262_interpreter_fail_compiler_pass":0,"compatibility_pass":0,"compatibility_cases":0,"compiler_errors":0,"compiler_crashes":0,"compiler_fails":0,"both_fail":0,"interpreter_fail_compiler_pass":0,"elapsed_ms":400},"status":"crash","description":"Recognize Date objects in instanceof","timestamp":1778064913744,"segment":24,"confidence":3.5625,"iterationTokens":10586,"asi":{"hypothesis":"Date wrapper objects should satisfy instanceof Date even when their prototype chain is incomplete, matching existing Array/Object special handling.","rollback_reason":"Compile failed because date_ms() macro cannot be used directly as a map pattern key in that context.","next_action_hint":"Retry using Map.has_key?(Heap.get_obj(ref, %{}), date_ms()) or bind the date key before the match."}}
{"run":700,"commit":"4ae22b0","metric":0,"metrics":{"compiler_test262_cases":0,"compiler_test262_pass":0,"compiler_test262_failures":0,"compiler_test262_compiler_errors":0,"compiler_test262_compiler_crashes":0,"compiler_test262_compiler_fails":0,"compiler_test262_both_fail":0,"compiler_test262_interpreter_fail_compiler_pass":0,"compatibility_pass":0,"compatibility_cases":0,"compiler_errors":0,"compiler_crashes":0,"compiler_fails":0,"both_fail":0,"interpreter_fail_compiler_pass":0,"elapsed_ms":500},"status":"crash","description":"Recognize Date objects in instanceof","timestamp":1778064988964,"segment":24,"confidence":3.5625,"iterationTokens":1323,"asi":{"hypothesis":"Date wrapper objects should satisfy instanceof Date via date_ms marker detection.","rollback_reason":"Compile failed because RuntimeHelpers does not import the date_ms key macro.","next_action_hint":"Retry after importing QuickBEAM.VM.Heap.Keys.date_ms/0 or use the existing imported key module if present."}}
{"run":701,"commit":"349bacb","metric":21,"metrics":{"compiler_test262_cases":500,"compiler_test262_pass":479,"compiler_test262_failures":21,"compiler_test262_compiler_errors":0,"compiler_test262_compiler_crashes":0,"compiler_test262_compiler_fails":0,"compiler_test262_both_fail":20,"compiler_test262_interpreter_fail_compiler_pass":0,"compatibility_pass":479,"compatibility_cases":500,"compiler_errors":0,"compiler_crashes":0,"compiler_fails":0,"both_fail":20,"interpreter_fail_compiler_pass":0,"elapsed_ms":37488},"status":"keep","description":"Recognize Date objects in instanceof","timestamp":1778065216582,"segment":24,"confidence":3.7704918032786887,"iterationTokens":1577,"asi":{"hypothesis":"Date wrapper objects should satisfy instanceof Date through their internal date marker, matching existing special handling for Array/Object where prototype identity is incomplete.","improvement":"Fixed the compiler-only Date properties-object receiver checks, reducing bounded built-ins/Object failures from 23 to 21 and compiler-only failures from 2 to 0 with checks passing.","next_action_hint":"Remaining failures are now shared: Object.assign strict/target-array/metadata, Arguments toStringTag, BigInt wrapper instanceof/prototype, and legacy Object metadata."}}
{"run":702,"commit":"349bacb","metric":21,"metrics":{"compiler_test262_cases":500,"compiler_test262_pass":479,"compiler_test262_failures":21,"compiler_test262_compiler_errors":0,"compiler_test262_compiler_crashes":0,"compiler_test262_compiler_fails":0,"compiler_test262_both_fail":20,"compiler_test262_interpreter_fail_compiler_pass":0,"compatibility_pass":479,"compatibility_cases":500,"compiler_errors":0,"compiler_crashes":0,"compiler_fails":0,"both_fail":20,"interpreter_fail_compiler_pass":0,"elapsed_ms":39983},"status":"discard","description":"Add BigInt prototype registration","timestamp":1778065555910,"segment":24,"confidence":3.7704918032786887,"iterationTokens":2899,"asi":{"hypothesis":"BigInt should have a registered prototype so Object(0n) can satisfy instanceof BigInt and valueOf semantics.","rollback_reason":"Primary metric stayed at 21; registering a BigInt prototype alone does not fix the BigInt Object conversion case.","next_action_hint":"Inspect wrapped BigInt object prototype and special instanceof handling before retrying; BigInt may need explicit marker-based instanceof like Date."}}
