{"run":650,"commit":"315b9c3","metric":203,"metrics":{"compiler_test262_cases":500,"compiler_test262_pass":297,"compiler_test262_failures":203,"compiler_test262_compiler_errors":0,"compiler_test262_compiler_crashes":0,"compiler_test262_compiler_fails":5,"compiler_test262_both_fail":192,"compiler_test262_interpreter_fail_compiler_pass":0,"compatibility_pass":297,"compatibility_cases":500,"compiler_errors":0,"compiler_crashes":0,"compiler_fails":5,"both_fail":192,"interpreter_fail_compiler_pass":0,"elapsed_ms":20444},"status":"keep","description":"Preserve VM function values in Object constructor","timestamp":1778041225042,"segment":24,"confidence":8,"iterationTokens":18843,"asi":{"hypothesis":"Compiled function expressions can reach Object(value) as bare VM function structs rather than closures, so Object should treat VM function structs as object/callable inputs and return them unchanged.","improvement":"Eliminated the compiler-only Object(function) identity cluster, reducing bounded built-ins/Object failures from 209 to 203 and compiler-only failures from 11 to 5.","next_action_hint":"Continue wrapper/valueOf and Object.assign/Object.create clusters. Remaining early failures include Number wrapper edge cases and Object constructor static/prototype metadata."}}
{"run":651,"commit":"44299e8","metric":200,"metrics":{"compiler_test262_cases":500,"compiler_test262_pass":300,"compiler_test262_failures":200,"compiler_test262_compiler_errors":0,"compiler_test262_compiler_crashes":0,"compiler_test262_compiler_fails":5,"compiler_test262_both_fail":189,"compiler_test262_interpreter_fail_compiler_pass":0,"compatibility_pass":300,"compatibility_cases":500,"compiler_errors":0,"compiler_crashes":0,"compiler_fails":5,"both_fail":189,"interpreter_fail_compiler_pass":0,"elapsed_ms":20384},"status":"keep","description":"Box non-finite numbers in Object constructor","timestamp":1778041471378,"segment":24,"confidence":3.7777777777777777,"iterationTokens":7874,"asi":{"hypothesis":"Number wrapper creation through Object(value) must treat VM non-finite number atoms (`:nan`, `:infinity`, `:neg_infinity`) as numbers, not plain objects.","improvement":"Fixed Object(Number.POSITIVE_INFINITY/NEGATIVE_INFINITY/NaN).valueOf behavior, reducing bounded built-ins/Object failures from 203 to 200.","next_action_hint":"Remaining Object constructor/prototype failures include Date/function identity/static metadata and many Object.assign/Object.create descriptor semantics."}}
{"run":652,"commit":"21bc7c5","metric":183,"metrics":{"compiler_test262_cases":500,"compiler_test262_pass":317,"compiler_test262_failures":183,"compiler_test262_compiler_errors":0,"compiler_test262_compiler_crashes":0,"compiler_test262_compiler_fails":7,"compiler_test262_both_fail":158,"compiler_test262_interpreter_fail_compiler_pass":12,"compatibility_pass":317,"compatibility_cases":500,"compiler_errors":0,"compiler_crashes":0,"compiler_fails":7,"both_fail":158,"interpreter_fail_compiler_pass":12,"elapsed_ms":20548},"status":"keep","description":"Read descriptors through DefineProperties semantics","timestamp":1778041671622,"segment":24,"confidence":3.238095238095238,"iterationTokens":2502,"asi":{"hypothesis":"Object.create/defineProperties must enumerate the properties object and read each descriptor via [[Get]], invoking accessors on Date/Array/Arguments/etc. descriptor containers instead of treating the raw heap map values as descriptor objects.","improvement":"Fixed a large Object.create properties-object cluster, reducing bounded built-ins/Object failures from 200 to 183.","next_action_hint":"There is now interpreter/compiler skew for some descriptor getter cases; inspect compiled builtins context/getter receiver handling. Continue descriptor defaults and inherited descriptor fields."}}
{"run":653,"commit":"21bc7c5","metric":185,"metrics":{"compiler_test262_cases":500,"compiler_test262_pass":315,"compiler_test262_failures":185,"compiler_test262_compiler_errors":0,"compiler_test262_compiler_crashes":0,"compiler_test262_compiler_fails":7,"compiler_test262_both_fail":160,"compiler_test262_interpreter_fail_compiler_pass":12,"compatibility_pass":315,"compatibility_cases":500,"compiler_errors":0,"compiler_crashes":0,"compiler_fails":7,"both_fail":160,"interpreter_fail_compiler_pass":12,"elapsed_ms":20524},"status":"discard","description":"Default defineProperty descriptor attributes to false","timestamp":1778042019766,"segment":24,"confidence":3.7777777777777777,"iterationTokens":2502,"asi":{"hypothesis":"Missing fields in property descriptors should default writable/enumerable/configurable to false for Object.defineProperty/Object.create.","rollback_reason":"Focused descriptor default behavior passed and checks passed, but bounded built-ins/Object primary metric regressed from 183 to 185, likely because existing incomplete descriptor update semantics incorrectly need separate handling for absent fields vs new descriptor defaults.","next_action_hint":"Retry only with full ValidateAndApplyPropertyDescriptor semantics: distinguish new vs existing properties and preserve existing attributes when fields are absent on redefinition."}}
{"run":654,"commit":"e087379","metric":178,"metrics":{"compiler_test262_cases":500,"compiler_test262_pass":322,"compiler_test262_failures":178,"compiler_test262_compiler_errors":0,"compiler_test262_compiler_crashes":0,"compiler_test262_compiler_fails":2,"compiler_test262_both_fail":158,"compiler_test262_interpreter_fail_compiler_pass":12,"compatibility_pass":322,"compatibility_cases":500,"compiler_errors":0,"compiler_crashes":0,"compiler_fails":2,"both_fail":158,"interpreter_fail_compiler_pass":12,"elapsed_ms":20222},"status":"keep","description":"Create ordinary Object results with prototype","timestamp":1778042212309,"segment":24,"confidence":2.8076923076923075,"iterationTokens":4310,"asi":{"hypothesis":"Object() and new Object() with null/undefined/no primitive object input should create ordinary objects linked to the canonical Object.prototype, not bare heap maps.","improvement":"Fixed the compiler-only new Object prototype cluster and reduced bounded built-ins/Object failures from 183 to 178; compiler-only failures dropped from 7 to 2.","next_action_hint":"Investigate remaining two compiler-only descriptor getter cases separately, and continue Object.create descriptor conversion/default/inherited field semantics."}}
{"run":655,"commit":"b416a4d","metric":164,"metrics":{"compiler_test262_cases":500,"compiler_test262_pass":336,"compiler_test262_failures":164,"compiler_test262_compiler_errors":0,"compiler_test262_compiler_crashes":0,"compiler_test262_compiler_fails":2,"compiler_test262_both_fail":144,"compiler_test262_interpreter_fail_compiler_pass":12,"compatibility_pass":336,"compatibility_cases":500,"compiler_errors":0,"compiler_crashes":0,"compiler_fails":2,"both_fail":144,"interpreter_fail_compiler_pass":12,"elapsed_ms":21651},"status":"keep","description":"Read inherited descriptor fields","timestamp":1778042404170,"segment":24,"confidence":3.3461538461538463,"iterationTokens":4620,"asi":{"hypothesis":"Property descriptor conversion must read value/get/set/writable/enumerable/configurable through ordinary property access so inherited descriptor fields participate in Object.defineProperty/Object.create.","improvement":"Fixed inherited data/accessor descriptor field cases, reducing bounded built-ins/Object failures from 178 to 164.","next_action_hint":"A remaining large cluster is descriptor defaults/full redefinition semantics; retry with field-presence aware new-vs-existing descriptor handling rather than blanket false defaults."}}
{"run":656,"commit":"1f559c2","metric":155,"metrics":{"compiler_test262_cases":500,"compiler_test262_pass":345,"compiler_test262_failures":155,"compiler_test262_compiler_errors":0,"compiler_test262_compiler_crashes":0,"compiler_test262_compiler_fails":2,"compiler_test262_both_fail":135,"compiler_test262_interpreter_fail_compiler_pass":12,"compatibility_pass":345,"compatibility_cases":500,"compiler_errors":0,"compiler_crashes":0,"compiler_fails":2,"both_fail":135,"interpreter_fail_compiler_pass":12,"elapsed_ms":20924},"status":"keep","description":"Preserve existing descriptor attributes","timestamp":1778042575967,"segment":24,"confidence":3.5555555555555554,"iterationTokens":3216,"asi":{"hypothesis":"Descriptor attributes absent from a new descriptor should default to false for new properties but preserve existing property attributes during redefinition.","improvement":"Recovered the descriptor-default cluster without the previous regression, reducing bounded built-ins/Object failures from 164 to 155.","next_action_hint":"Continue full descriptor semantics: accessor/data validation, non-object descriptor inputs, and descriptor container edge cases such as array/arguments/proxy properties."}}
{"run":657,"commit":"1f559c2","metric":155,"metrics":{"compiler_test262_cases":500,"compiler_test262_pass":345,"compiler_test262_failures":155,"compiler_test262_compiler_errors":0,"compiler_test262_compiler_crashes":0,"compiler_test262_compiler_fails":2,"compiler_test262_both_fail":134,"compiler_test262_interpreter_fail_compiler_pass":12,"compatibility_pass":345,"compatibility_cases":500,"compiler_errors":0,"compiler_crashes":0,"compiler_fails":2,"both_fail":134,"interpreter_fail_compiler_pass":12,"elapsed_ms":35144},"status":"discard","description":"Enumerate sparse array object keys","timestamp":1778049451012,"segment":24,"confidence":3.096774193548387,"iterationTokens":3216,"asi":{"hypothesis":"Object built-in failures involving array-like descriptor/property containers may come from sparse VM array objects not exposing enumerable index keys through object key enumeration.","rollback_reason":"Primary metric stayed at 155 despite a slight both_fail category shift; sparse array key enumeration is not sufficient for the bounded Object workload.","next_action_hint":"Cluster remaining failures and target broader descriptor/defineProperty semantics instead of raw qb_arr key enumeration."}}
{"run":658,"commit":"1f559c2","metric":155,"metrics":{"compiler_test262_cases":500,"compiler_test262_pass":345,"compiler_test262_failures":155,"compiler_test262_compiler_errors":0,"compiler_test262_compiler_crashes":0,"compiler_test262_compiler_fails":2,"compiler_test262_both_fail":135,"compiler_test262_interpreter_fail_compiler_pass":12,"compatibility_pass":345,"compatibility_cases":500,"compiler_errors":0,"compiler_crashes":0,"compiler_fails":2,"both_fail":135,"interpreter_fail_compiler_pass":12,"elapsed_ms":19471},"status":"discard","description":"Expose descriptors for module static builtins","timestamp":1778049947982,"segment":24,"confidence":2.742857142857143,"iterationTokens":44667,"asi":{"hypothesis":"Object constructor static methods supplied by module.static_property/1 should still have own property descriptors, fixing descriptor tests for Object.assign/Object.create without needing eager static registration.","rollback_reason":"Primary metric stayed at 155; failures likely require function length/name descriptor metadata or hasOwnProperty semantics beyond Object.getOwnPropertyDescriptor visibility.","next_action_hint":"Inspect Object.assign descriptor focused failures and builtin function own-property lookup before retrying static metadata changes."}}
{"run":659,"commit":"1f559c2","metric":155,"metrics":{"compiler_test262_cases":500,"compiler_test262_pass":345,"compiler_test262_failures":155,"compiler_test262_compiler_errors":0,"compiler_test262_compiler_crashes":0,"compiler_test262_compiler_fails":2,"compiler_test262_both_fail":135,"compiler_test262_interpreter_fail_compiler_pass":12,"compatibility_pass":345,"compatibility_cases":500,"compiler_errors":0,"compiler_crashes":0,"compiler_fails":2,"both_fail":135,"interpreter_fail_compiler_pass":12,"elapsed_ms":19287},"status":"discard","description":"Add virtual builtin name and length descriptors","timestamp":1778050154426,"segment":24,"confidence":2.56,"iterationTokens":2382,"asi":{"hypothesis":"Built-in functions like Object.assign and Object.create need own non-enumerable non-writable name/length descriptors for Test262 propertyHelper checks.","rollback_reason":"Primary metric stayed at 155; the failing Object static descriptor cases are not reached through builtin getOwnPropertyDescriptor alone, likely because Object.hasOwnProperty/own-property checks for builtins still ignore virtual descriptors or module statics.","next_action_hint":"Do not retry name/length descriptors in isolation; trace propertyHelper's hasOwnProperty path for builtin values first."}}
{"run":660,"commit":"1f559c2","metric":154,"metrics":{"compiler_test262_cases":500,"compiler_test262_pass":346,"compiler_test262_failures":154,"compiler_test262_compiler_errors":0,"compiler_test262_compiler_crashes":0,"compiler_test262_compiler_fails":2,"compiler_test262_both_fail":134,"compiler_test262_interpreter_fail_compiler_pass":12,"compatibility_pass":346,"compatibility_cases":500,"compiler_errors":0,"compiler_crashes":0,"compiler_fails":2,"both_fail":134,"interpreter_fail_compiler_pass":12,"elapsed_ms":19604},"status":"checks_failed","description":"Throw on failed Object.assign writes","timestamp":1778050324788,"segment":24,"confidence":3.2,"iterationTokens":3710,"asi":{"hypothesis":"Object.assign should use [[Set]] with Throw=true, so assigning to read-only or non-extensible targets must throw instead of silently ignoring failed writes.","rollback_reason":"Primary metric improved by one but backpressure checks failed, so the change cannot be kept as-is.","next_action_hint":"Reproduce the check failure; likely Put.set/assign_put interacts incorrectly with array targets or legacy assignment expectations. Retry with narrower failure-aware Object.assign semantics after preserving checks."}}
{"run":661,"commit":"61d8e33","metric":150,"metrics":{"compiler_test262_cases":500,"compiler_test262_pass":350,"compiler_test262_failures":150,"compiler_test262_compiler_errors":0,"compiler_test262_compiler_crashes":0,"compiler_test262_compiler_fails":2,"compiler_test262_both_fail":130,"compiler_test262_interpreter_fail_compiler_pass":12,"compatibility_pass":350,"compatibility_cases":500,"compiler_errors":0,"compiler_crashes":0,"compiler_fails":2,"both_fail":130,"interpreter_fail_compiler_pass":12,"elapsed_ms":20670},"status":"keep","description":"Copy symbol keys in Object.assign","timestamp":1778050572039,"segment":24,"confidence":3.4827586206896552,"iterationTokens":3344,"asi":{"hypothesis":"Object.assign should copy enumerable own symbol properties after enumerable string keys from ordinary object sources.","improvement":"Fixed symbol-copy/order Object.assign cases, reducing bounded built-ins/Object failures from 155 to 150 with checks passing.","next_action_hint":"Continue Object.assign semantics: proxy ownKeys/getOwnPropertyDescriptor traps and Throw=true failed-write behavior remain, but failed-write variant needs check-safe refinement."}}
{"run":662,"commit":"779da89","metric":149,"metrics":{"compiler_test262_cases":500,"compiler_test262_pass":351,"compiler_test262_failures":149,"compiler_test262_compiler_errors":0,"compiler_test262_compiler_crashes":0,"compiler_test262_compiler_fails":2,"compiler_test262_both_fail":129,"compiler_test262_interpreter_fail_compiler_pass":12,"compatibility_pass":351,"compatibility_cases":500,"compiler_errors":0,"compiler_crashes":0,"compiler_fails":2,"both_fail":129,"interpreter_fail_compiler_pass":12,"elapsed_ms":19471},"status":"keep","description":"Use copy-property enumeration for Object.assign","timestamp":1778050831696,"segment":24,"confidence":3.642857142857143,"iterationTokens":5111,"asi":{"hypothesis":"Object.assign should use the same enumerable own property collection as object spread so proxy ownKeys/getOwnPropertyDescriptor traps and symbol keys are observed consistently.","improvement":"Fixed an additional Object.assign proxy descriptor case, reducing bounded built-ins/Object failures from 150 to 149 with checks passing.","next_action_hint":"Continue refining Object.assign: source/target array assignment and Throw=true failed writes remain. For Throw=true, first identify/check the backpressure regression from the earlier all-failed-write variant."}}
{"run":663,"commit":"0b029ad","metric":148,"metrics":{"compiler_test262_cases":500,"compiler_test262_pass":352,"compiler_test262_failures":148,"compiler_test262_compiler_errors":0,"compiler_test262_compiler_crashes":0,"compiler_test262_compiler_fails":2,"compiler_test262_both_fail":128,"compiler_test262_interpreter_fail_compiler_pass":12,"compatibility_pass":352,"compatibility_cases":500,"compiler_errors":0,"compiler_crashes":0,"compiler_fails":2,"both_fail":128,"interpreter_fail_compiler_pass":12,"elapsed_ms":20202},"status":"keep","description":"Preserve Object.assign key order and sparse holes","timestamp":1778051218650,"segment":24,"confidence":3.9615384615384617,"iterationTokens":5825,"asi":{"hypothesis":"Object.assign should enumerate ordinary source string keys before symbol keys, while sparse array sources should only copy present elements rather than materializing holes.","improvement":"Fixed Object.assign string/symbol getter order and sparse-array source behavior, reducing bounded built-ins/Object failures from 149 to 148 with checks passing.","next_action_hint":"Object.assign target-array still has additional expectations for overwriting present elements; continue array target/source semantics or move to descriptor redefinition clusters."}}
{"run":664,"commit":"0b029ad","metric":148,"metrics":{"compiler_test262_cases":500,"compiler_test262_pass":352,"compiler_test262_failures":148,"compiler_test262_compiler_errors":0,"compiler_test262_compiler_crashes":0,"compiler_test262_compiler_fails":2,"compiler_test262_both_fail":127,"compiler_test262_interpreter_fail_compiler_pass":12,"compatibility_pass":352,"compatibility_cases":500,"compiler_errors":0,"compiler_crashes":0,"compiler_fails":2,"both_fail":127,"interpreter_fail_compiler_pass":12,"elapsed_ms":39132},"status":"discard","description":"Use sparse array entries for Object.assign sources","timestamp":1778051487463,"segment":24,"confidence":4.12,"iterationTokens":3895,"asi":{"hypothesis":"Object.assign array sources represented as sparse qb_arr values should enumerate present indices through the copy helper so array target assignment sees element 0.","rollback_reason":"Primary metric stayed at 148; target-Array still fails or the improvement was offset elsewhere, so sparse source enumeration alone is insufficient.","next_action_hint":"Debug target-Array with a focused snippet and inspect whether source [1] is represented as a dense list, sparse qb_arr with no ord entries, or whether target writes are ignored."}}
{"run":665,"commit":"0b029ad","metric":148,"metrics":{"compiler_test262_cases":500,"compiler_test262_pass":352,"compiler_test262_failures":148,"compiler_test262_compiler_errors":0,"compiler_test262_compiler_crashes":0,"compiler_test262_compiler_fails":2,"compiler_test262_both_fail":128,"compiler_test262_interpreter_fail_compiler_pass":12,"compatibility_pass":352,"compatibility_cases":500,"compiler_errors":0,"compiler_crashes":0,"compiler_fails":2,"both_fail":128,"interpreter_fail_compiler_pass":12,"elapsed_ms":20240},"status":"discard","description":"Enumerate sparse qb_arr indices in Object keys","timestamp":1778051958456,"segment":24,"confidence":4.5777777777777775,"iterationTokens":15548,"asi":{"hypothesis":"Object.keys/Object.assign target-array failures may come from qb_arr values reaching array_indices/1 and not exposing sparse present elements.","rollback_reason":"Primary metric stayed at 148; although the focused Object.keys([1]) crash is addressed, the bounded Object workload did not improve.","next_action_hint":"Do not pursue raw qb_arr key enumeration alone for this workload. Debug Object.assign target-array value flow; likely the source list is not copied due to assign clause/target write semantics rather than key enumeration."}}
{"run":666,"commit":"0b029ad","metric":117,"metrics":{"compiler_test262_cases":500,"compiler_test262_pass":383,"compiler_test262_failures":117,"compiler_test262_compiler_errors":0,"compiler_test262_compiler_crashes":0,"compiler_test262_compiler_fails":2,"compiler_test262_both_fail":109,"compiler_test262_interpreter_fail_compiler_pass":0,"compatibility_pass":383,"compatibility_cases":500,"compiler_errors":0,"compiler_crashes":0,"compiler_fails":2,"both_fail":109,"interpreter_fail_compiler_pass":0,"elapsed_ms":20394},"status":"checks_failed","description":"Accept callable property descriptor objects","timestamp":1778052334679,"segment":24,"confidence":6.4375,"iterationTokens":10649,"asi":{"hypothesis":"Object.create/defineProperties descriptor containers may be callable objects with own/inherited descriptor fields; treating functions/builtins/closures as descriptor objects should fix a large descriptor cluster.","rollback_reason":"Metric improved strongly from 148 to 117, but checks failed due compile warnings from ungrouped define_property/1 clauses.","next_action_hint":"Retry immediately with define_property/1 clauses grouped before helper functions; the semantic change is promising and likely check-clean after clause ordering is fixed."}}
