{"run":1790,"commit":"8bbd4be","metric":69,"metrics":{"compiler_test262_cases":500,"compiler_test262_pass":431,"compiler_test262_failures":69,"compiler_test262_compiler_errors":0,"compiler_test262_compiler_crashes":6,"compiler_test262_compiler_fails":0,"compiler_test262_both_fail":47,"compiler_test262_interpreter_fail_compiler_pass":1,"compatibility_pass":431,"compatibility_cases":500,"compiler_errors":0,"compiler_crashes":6,"compiler_fails":0,"both_fail":47,"interpreter_fail_compiler_pass":1,"elapsed_ms":285039},"status":"discard","description":"Spread shape-backed iterable helpers","timestamp":1778899271814,"segment":180,"confidence":6.873015873015873,"iterationTokens":16263,"asi":{"hypothesis":"Array spread should consume shape-backed objects with own/inherited Symbol.iterator via Get.get and invoke iterator methods with the iterator receiver, fixing spread over Iterator.concat helper objects.","rollback_reason":"Focused concat/get-iterator-method-only-once passed in both modes and core compiler tests passed, but the broad Iterator slice regressed from 60 to 69 with compiler crashes rising to 6. Enabling spread consumption exposed existing helper/generator crash paths before enough cases could pass.","next_action_hint":"Do not land broad spread-over-shape iterable support alone in this active slice. Revisit after generator-running/helper crash paths are addressed or narrow the change to avoid activating crash-heavy cases."}}
{"run":1791,"commit":"8bbd4be","metric":64,"metrics":{"compiler_test262_cases":500,"compiler_test262_pass":436,"compiler_test262_failures":64,"compiler_test262_compiler_errors":0,"compiler_test262_compiler_crashes":3,"compiler_test262_compiler_fails":0,"compiler_test262_both_fail":47,"compiler_test262_interpreter_fail_compiler_pass":1,"compatibility_pass":436,"compatibility_cases":500,"compiler_errors":0,"compiler_crashes":3,"compiler_fails":0,"both_fail":47,"interpreter_fail_compiler_pass":1,"elapsed_ms":241326},"status":"discard","description":"Return undefined for unregistered well-known Symbol.keyFor","timestamp":1778900033065,"segment":180,"confidence":5.094117647058823,"iterationTokens":23434,"asi":{"hypothesis":"Symbol.keyFor should only return keys for symbols present in the global registry, not well-known symbols. This may fix Iterator/from return-method observation tests that compare Symbol.iterator formatting without changing Iterator wrapper caching.","rollback_reason":"Focused Symbol.keyFor semantics improved, but the active Iterator primary regressed from 60 to 64 and compiler crashes rose to 3; the current slice apparently relies on broader symbol behavior or exposes crash-heavy branches before enough Iterator cases pass.","next_action_hint":"Do not land Symbol.keyFor registry-only behavior solely for the active Iterator slice. Revisit with a dedicated Symbol/Temporal harness workload or after Iterator generator crash clusters are reduced."}}
{"run":1792,"commit":"8bbd4be","metric":62,"metrics":{"compiler_test262_cases":500,"compiler_test262_pass":438,"compiler_test262_failures":62,"compiler_test262_compiler_errors":0,"compiler_test262_compiler_crashes":1,"compiler_test262_compiler_fails":0,"compiler_test262_both_fail":45,"compiler_test262_interpreter_fail_compiler_pass":1,"compatibility_pass":438,"compatibility_cases":500,"compiler_errors":0,"compiler_crashes":1,"compiler_fails":0,"both_fail":45,"interpreter_fail_compiler_pass":1,"elapsed_ms":259873},"status":"discard","description":"Forward flatMap return to inner iterator","timestamp":1778900669311,"segment":180,"confidence":4.046728971962617,"iterationTokens":24587,"asi":{"hypothesis":"Iterator.prototype.flatMap helper return should forward to the currently active mapper-result iterator before closing the outer iterator, fixing return-is-forwarded-to-mapper-result.","rollback_reason":"Focused flatMap return forwarding passed in both modes, but the active Iterator primary regressed from 60 to 62 and reintroduced one compiler crash. This likely changes close ordering across broader flatMap/generator cases without enough net wins.","next_action_hint":"Do not land flatMap inner-return forwarding alone. If revisiting, implement full IteratorClose ordering/error preservation for inner and outer iterators and validate crash-heavy generator cases."}}
{"run":1793,"commit":"8bbd4be","metric":70,"metrics":{"compiler_test262_cases":500,"compiler_test262_pass":430,"compiler_test262_failures":70,"compiler_test262_compiler_errors":0,"compiler_test262_compiler_crashes":8,"compiler_test262_compiler_fails":0,"compiler_test262_both_fail":34,"compiler_test262_interpreter_fail_compiler_pass":1,"compatibility_pass":430,"compatibility_cases":500,"compiler_errors":0,"compiler_crashes":8,"compiler_fails":0,"both_fail":34,"interpreter_fail_compiler_pass":1,"elapsed_ms":372096},"status":"discard","description":"Reject primitive Iterator zip inputs","timestamp":1778901807511,"segment":180,"confidence":4.308457711442786,"iterationTokens":12027,"asi":{"hypothesis":"Iterator.zip and zipKeyed should reject primitive outer inputs before reading options, without changing inner iteration semantics. This should clear iterables-primitive residuals while avoiding the prior eager protocol collection attempt.","rollback_reason":"Focused primitive-input tests passed, but the active Iterator primary regressed from 60 to 70 and compiler crashes rose to 8. Rejecting primitive/missing inputs changes failure shape enough to expose crash-heavy zip paths in the first 500 slice.","next_action_hint":"Do not land primitive zip-input validation alone in the active slice. Pair zip input validation with broader zip generator/crash fixes or validate under a narrower zip-specific workload."}}
{"run":1794,"commit":"e5b50d2","metric":55,"metrics":{"compiler_test262_cases":500,"compiler_test262_pass":445,"compiler_test262_failures":55,"compiler_test262_compiler_errors":0,"compiler_test262_compiler_crashes":0,"compiler_test262_compiler_fails":0,"compiler_test262_both_fail":54,"compiler_test262_interpreter_fail_compiler_pass":1,"compatibility_pass":445,"compatibility_cases":500,"compiler_errors":0,"compiler_crashes":0,"compiler_fails":0,"both_fail":54,"interpreter_fail_compiler_pass":1,"elapsed_ms":31601},"status":"keep","description":"Reject reentrant Iterator helper next calls","timestamp":1778902041945,"segment":180,"confidence":4.659574468085107,"iterationTokens":5145,"asi":{"hypothesis":"Iterator helper objects should behave like closure generators while executing: a nested `.next()` on the same helper must throw TypeError instead of recursing/hanging. Track an executing flag on helper state and clear it after completion or abrupt exit.","result":"Iterator failures improved from 60 to 55; focused map/filter/drop/flatMap/take and concat-next reentrancy cases pass in both modes; checks passed.","remaining":"concat return reentrancy still fails because helper `.return()` needs a matching executing-state guard/TypeError path."}}
{"run":1795,"commit":"e5b50d2","metric":55,"metrics":{"compiler_test262_cases":500,"compiler_test262_pass":445,"compiler_test262_failures":55,"compiler_test262_compiler_errors":0,"compiler_test262_compiler_crashes":0,"compiler_test262_compiler_fails":0,"compiler_test262_both_fail":54,"compiler_test262_interpreter_fail_compiler_pass":1,"compatibility_pass":445,"compatibility_cases":500,"compiler_errors":0,"compiler_crashes":0,"compiler_fails":0,"both_fail":54,"interpreter_fail_compiler_pass":1,"elapsed_ms":32868},"status":"discard","description":"Reject reentrant Iterator helper return calls","timestamp":1778902368119,"segment":180,"confidence":4.5625,"iterationTokens":5072,"asi":{"hypothesis":"Iterator helper `.return()` should also reject reentrant calls while executing, matching GeneratorResumeAbrupt validation and fixing concat return reentrancy.","rollback_reason":"Focused concat return reentrancy passed in both modes and no-return-after-exhaustion remained stable, but the active Iterator primary stayed unchanged at 55.","next_action_hint":"Do not land helper-return reentrancy alone for this active slice; combine it with another return/close ordering fix that reduces total failures."}}
{"run":1796,"commit":"270fd30","metric":53,"metrics":{"compiler_test262_cases":500,"compiler_test262_pass":447,"compiler_test262_failures":53,"compiler_test262_compiler_errors":0,"compiler_test262_compiler_crashes":0,"compiler_test262_compiler_fails":0,"compiler_test262_both_fail":52,"compiler_test262_interpreter_fail_compiler_pass":1,"compatibility_pass":447,"compatibility_cases":500,"compiler_errors":0,"compiler_crashes":0,"compiler_fails":0,"both_fail":52,"interpreter_fail_compiler_pass":1,"elapsed_ms":31323},"status":"keep","description":"Finish completed Iterator helpers cleanly","timestamp":1778902691423,"segment":180,"confidence":4.489795918367347,"iterationTokens":7673,"asi":{"hypothesis":"After adding iterator-helper executing state, helpers that become done must clear the executing flag and later `.next()` calls should return done immediately without entering the executing path.","result":"Iterator failures improved from 55 to 53; focused filter and flatMap exhaustion-does-not-call-return cases pass in both modes; checks passed.","remaining":"take exhaustion still fails due underlying next getter/closure semantics, not the helper executing flag."}}
{"run":1797,"commit":"40bdb04","metric":52,"metrics":{"compiler_test262_cases":500,"compiler_test262_pass":448,"compiler_test262_failures":52,"compiler_test262_compiler_errors":0,"compiler_test262_compiler_crashes":0,"compiler_test262_compiler_fails":0,"compiler_test262_both_fail":51,"compiler_test262_interpreter_fail_compiler_pass":1,"compatibility_pass":448,"compatibility_cases":500,"compiler_errors":0,"compiler_crashes":0,"compiler_fails":0,"both_fail":51,"interpreter_fail_compiler_pass":1,"elapsed_ms":31711},"status":"keep","description":"Cache Iterator.from wrapper next methods after reentrancy fixes","timestamp":1778902932747,"segment":180,"confidence":4.617801047120419,"iterationTokens":3366,"asi":{"hypothesis":"After helper reentrancy fixes removed the crash-prone paths that made earlier wrapper caching regress, Iterator.from wrappers can safely cache the underlying next method at construction and reuse it for wrapper next calls.","result":"Iterator failures improved from 53 to 52; focused get-next-method-only-once passes in both modes and checks passed.","remaining":"Return-method observation tests still fail on Symbol.keyFor/property-name formatting, so this is only the next-method caching part of Iterator.from semantics."}}
{"run":1798,"commit":"6575c57","metric":51,"metrics":{"compiler_test262_cases":500,"compiler_test262_pass":449,"compiler_test262_failures":51,"compiler_test262_compiler_errors":0,"compiler_test262_compiler_crashes":0,"compiler_test262_compiler_fails":0,"compiler_test262_both_fail":50,"compiler_test262_interpreter_fail_compiler_pass":1,"compatibility_pass":449,"compatibility_cases":500,"compiler_errors":0,"compiler_crashes":0,"compiler_fails":0,"both_fail":50,"interpreter_fail_compiler_pass":1,"elapsed_ms":31539},"status":"keep","description":"Spread shape-backed iterable helpers after reentrancy fixes","timestamp":1778903221757,"segment":180,"confidence":4.752688172043011,"iterationTokens":5479,"asi":{"hypothesis":"After reentrant helper calls no longer recurse/crash, array/spread consumption can safely honor shape-backed helper iterators by using Get.get(Symbol.iterator) and invoking iterator next with the iterator receiver.","result":"Iterator failures improved from 52 to 51; focused concat/get-iterator-method-only-once passes in both modes; checks passed.","remaining":"The same spread fix regressed before reentrancy fixes, but is now stable because crash-heavy helper paths are guarded."}}
{"run":1799,"commit":"6575c57","metric":51,"metrics":{"compiler_test262_cases":500,"compiler_test262_pass":449,"compiler_test262_failures":51,"compiler_test262_compiler_errors":0,"compiler_test262_compiler_crashes":0,"compiler_test262_compiler_fails":0,"compiler_test262_both_fail":50,"compiler_test262_interpreter_fail_compiler_pass":1,"compatibility_pass":449,"compatibility_cases":500,"compiler_errors":0,"compiler_crashes":0,"compiler_fails":0,"both_fail":50,"interpreter_fail_compiler_pass":1,"elapsed_ms":31721},"status":"discard","description":"Retry helper return reentrancy after spread fixes","timestamp":1778903416079,"segment":180,"confidence":4.778378378378378,"iterationTokens":1661,"asi":{"hypothesis":"After spread-over-helper is stable, helper `.return()` reentrancy might now reduce the remaining concat return-running failure without shifting crash shape.","rollback_reason":"Focused concat return reentrancy passed in both modes, but the active Iterator primary stayed unchanged at 51.","next_action_hint":"Keep helper-return reentrancy as a focused semantic fix for later, but do not land it alone in this active slice."}}
{"run":1800,"commit":"2c6a6ee","metric":50,"metrics":{"compiler_test262_cases":500,"compiler_test262_pass":450,"compiler_test262_failures":50,"compiler_test262_compiler_errors":0,"compiler_test262_compiler_crashes":0,"compiler_test262_compiler_fails":0,"compiler_test262_both_fail":49,"compiler_test262_interpreter_fail_compiler_pass":1,"compatibility_pass":450,"compatibility_cases":500,"compiler_errors":0,"compiler_crashes":0,"compiler_fails":0,"both_fail":49,"interpreter_fail_compiler_pass":1,"elapsed_ms":31561},"status":"keep","description":"Forward flatMap return after helper fixes","timestamp":1778903613484,"segment":180,"confidence":4.815217391304348,"iterationTokens":3038,"asi":{"hypothesis":"After helper executing-state fixes and stable helper spread consumption, flatMap helper return can safely close an active mapper-result iterator before the outer iterator without reintroducing crashes.","result":"Iterator failures improved from 51 to 50; focused flatMap return-is-forwarded-to-mapper-result passes in both modes; checks passed.","remaining":"Full flatMap close ordering/error preservation may still need refinement, but the simple active-inner forwarding is now stable."}}
{"run":1801,"commit":"731e27d","metric":49,"metrics":{"compiler_test262_cases":500,"compiler_test262_pass":451,"compiler_test262_failures":49,"compiler_test262_compiler_errors":0,"compiler_test262_compiler_crashes":0,"compiler_test262_compiler_fails":0,"compiler_test262_both_fail":48,"compiler_test262_interpreter_fail_compiler_pass":1,"compatibility_pass":451,"compatibility_cases":500,"compiler_errors":0,"compiler_crashes":0,"compiler_fails":0,"both_fail":48,"interpreter_fail_compiler_pass":1,"elapsed_ms":31693},"status":"keep","description":"Honor primitive iterators in Array.from","timestamp":1778903826166,"segment":180,"confidence":6.626865671641791,"iterationTokens":3548,"asi":{"hypothesis":"Array.from should consult primitive prototype @@iterator methods for primitives such as numbers, unlike Iterator.from which rejects non-string primitives. This should clear flatMap primitive-iterability coverage without changing Iterator.from string wrapper behavior.","result":"Iterator failures improved from 50 to 49; focused flatMap/iterable-primitives now passes in both modes; checks passed.","remaining":"Iterator.from/iterable-primitives still fails on observing String.prototype[Symbol.iterator] receiver type for primitive vs boxed strings."}}
{"run":1802,"commit":"879175e","metric":48,"metrics":{"compiler_test262_cases":500,"compiler_test262_pass":452,"compiler_test262_failures":48,"compiler_test262_compiler_errors":0,"compiler_test262_compiler_crashes":0,"compiler_test262_compiler_fails":0,"compiler_test262_both_fail":47,"compiler_test262_interpreter_fail_compiler_pass":1,"compatibility_pass":452,"compatibility_cases":500,"compiler_errors":0,"compiler_crashes":0,"compiler_fails":0,"both_fail":47,"interpreter_fail_compiler_pass":1,"elapsed_ms":32249},"status":"keep","description":"Call string iterator getters with correct receivers","timestamp":1778904299002,"segment":180,"confidence":14.833333333333334,"iterationTokens":3548,"asi":{"hypothesis":"Iterator.from must consult String.prototype[Symbol.iterator] for string primitives with the primitive receiver and for boxed String objects with the object receiver, rather than silently using the built-in fallback.","result":"Iterator failures improved from 49 to 48; Iterator/from/iterable-primitives passes in both modes; checks passed.","remaining":"This is intentionally String-specific for Iterator.from and avoids broad primitive symbol lookup that previously regressed/hung."}}
{"run":1803,"commit":"42e4a00","metric":47,"metrics":{"compiler_test262_cases":500,"compiler_test262_pass":453,"compiler_test262_failures":47,"compiler_test262_compiler_errors":0,"compiler_test262_compiler_crashes":0,"compiler_test262_compiler_fails":0,"compiler_test262_both_fail":46,"compiler_test262_interpreter_fail_compiler_pass":1,"compatibility_pass":453,"compatibility_cases":500,"compiler_errors":0,"compiler_crashes":0,"compiler_fails":0,"both_fail":46,"interpreter_fail_compiler_pass":1,"elapsed_ms":31949},"status":"keep","description":"Expose Iterator in Test262 realms after helper fixes","timestamp":1778904679257,"segment":180,"confidence":15.649122807017545,"iterationTokens":19428,"asi":{"hypothesis":"With helper reentrancy and spread crashes fixed, exposing a realm-local Iterator constructor/prototype and using it as the realm default prototype for Reflect.construct should no longer activate crash-heavy residuals.","result":"Iterator failures improved from 48 to 47; proto-from-ctor-realm passes in both modes; checks passed.","remaining":"Realm Iterator is minimal and should be expanded cautiously only when tests require actual helper methods on other-realm Iterator.prototype."}}
{"run":1804,"commit":"42e4a00","metric":50,"metrics":{"compiler_test262_cases":500,"compiler_test262_pass":450,"compiler_test262_failures":50,"compiler_test262_compiler_errors":0,"compiler_test262_compiler_crashes":0,"compiler_test262_compiler_fails":0,"compiler_test262_both_fail":50,"compiler_test262_interpreter_fail_compiler_pass":0,"compatibility_pass":450,"compatibility_cases":500,"compiler_errors":0,"compiler_crashes":0,"compiler_fails":0,"both_fail":50,"interpreter_fail_compiler_pass":0,"elapsed_ms":23365},"status":"discard","description":"Validate Iterator zip primitive inputs after helper fixes","timestamp":1778904905785,"segment":180,"confidence":17.153846153846153,"iterationTokens":5584,"asi":{"hypothesis":"With helper crashes fixed, eager validation of Iterator.zip/zipKeyed outer primitive arguments and primitive inner records might now pass focused primitive tests without broad regressions.","rollback_reason":"Focused primitive zip tests passed in both modes, but active Iterator regressed from 47 to 50 failures due changed ordering/interleaving in zip residuals.","next_action_hint":"Do not land zip primitive validation alone; implement full lazy outer iteration/GetIteratorFlattenable ordering and close semantics before retrying zip validation."}}
{"run":1805,"commit":"d7e494e","metric":45,"metrics":{"compiler_test262_cases":500,"compiler_test262_pass":455,"compiler_test262_failures":45,"compiler_test262_compiler_errors":0,"compiler_test262_compiler_crashes":0,"compiler_test262_compiler_fails":0,"compiler_test262_both_fail":44,"compiler_test262_interpreter_fail_compiler_pass":1,"compatibility_pass":455,"compatibility_cases":500,"compiler_errors":0,"compiler_crashes":0,"compiler_fails":0,"both_fail":44,"interpreter_fail_compiler_pass":1,"elapsed_ms":31401},"status":"keep","description":"Recover nested iterator next records","timestamp":1778905160715,"segment":180,"confidence":18.285714285714285,"iterationTokens":5267,"asi":{"hypothesis":"Getter-created generator closures can leave a getter returning the generator iterator object instead of its next function after helper exhaustion. Treating a non-callable next value that is itself iterator-like as the direct iterator record should preserve forward progress without changing normal callable next paths.","result":"Iterator failures improved from 47 to 45; focused drop exhaustion-does-not-call-return and take exhaustion-calls-return pass in both modes; checks passed.","remaining":"This is a compatibility recovery for a deeper closure/getter corruption; revisit root cause in generator closure state later."}}
{"run":1806,"commit":"87c0233","metric":43,"metrics":{"compiler_test262_cases":500,"compiler_test262_pass":457,"compiler_test262_failures":43,"compiler_test262_compiler_errors":0,"compiler_test262_compiler_crashes":0,"compiler_test262_compiler_fails":0,"compiler_test262_both_fail":40,"compiler_test262_interpreter_fail_compiler_pass":0,"compatibility_pass":457,"compatibility_cases":500,"compiler_errors":0,"compiler_crashes":0,"compiler_fails":0,"both_fail":40,"interpreter_fail_compiler_pass":0,"elapsed_ms":60457},"status":"keep","description":"Read Iterator zip inputs after options","timestamp":1778905630698,"segment":180,"confidence":19.565217391304348,"iterationTokens":45177,"asi":{"hypothesis":"Iterator.zip and zipKeyed should read options mode/padding before iterating the outer iterables/own keys, while still eagerly building the helper records for now. This should fix observable ordering without reintroducing helper crashes.","result":"Iterator failures improved from 45 to 43; focused option-before-iteration zip and zipKeyed tests pass in both modes; checks passed.","remaining":"Full zip primitive validation and inner GetIteratorFlattenable/IteratorClose ordering still fail; elapsed time increased because outer/padding iteration now uses observable iterator protocol."}}
