{"run":1640,"commit":"70fcbb2","metric":205,"metrics":{"compiler_test262_cases":296,"compiler_test262_pass":91,"compiler_test262_failures":205,"compiler_test262_compiler_errors":0,"compiler_test262_compiler_crashes":0,"compiler_test262_compiler_fails":2,"compiler_test262_both_fail":194,"compiler_test262_interpreter_fail_compiler_pass":0,"compatibility_pass":91,"compatibility_cases":296,"compiler_errors":0,"compiler_crashes":0,"compiler_fails":2,"both_fail":194,"interpreter_fail_compiler_pass":0,"elapsed_ms":15986},"status":"keep","description":"Baseline Promise built-ins slice after Function completion","timestamp":1778847422967,"segment":150,"confidence":null,"iterationTokens":125,"asi":{"hypothesis":"Baseline Promise built-ins after completing smaller built-in categories; large residual may expose missing Promise static/prototype metadata and thenable/microtask semantics."}}
{"run":1641,"commit":"4201d3c","metric":164,"metrics":{"compiler_test262_cases":296,"compiler_test262_pass":132,"compiler_test262_failures":164,"compiler_test262_compiler_errors":0,"compiler_test262_compiler_crashes":0,"compiler_test262_compiler_fails":2,"compiler_test262_both_fail":154,"compiler_test262_interpreter_fail_compiler_pass":0,"compatibility_pass":132,"compatibility_cases":296,"compiler_errors":0,"compiler_crashes":0,"compiler_fails":2,"both_fail":154,"interpreter_fail_compiler_pass":0,"elapsed_ms":16917},"status":"keep","description":"Install Promise metadata and species","timestamp":1778847718871,"segment":150,"confidence":null,"iterationTokens":8648,"asi":{"hypothesis":"Promise should expose constructor/static/prototype method metadata and Symbol.species like other constructors, which should clear descriptor/name/length/species failures before deeper async semantics work."}}
{"run":1642,"commit":"4f4f10a","metric":160,"metrics":{"compiler_test262_cases":296,"compiler_test262_pass":136,"compiler_test262_failures":160,"compiler_test262_compiler_errors":0,"compiler_test262_compiler_crashes":0,"compiler_test262_compiler_fails":2,"compiler_test262_both_fail":150,"compiler_test262_interpreter_fail_compiler_pass":0,"compatibility_pass":136,"compatibility_cases":296,"compiler_errors":0,"compiler_crashes":0,"compiler_fails":2,"both_fail":150,"interpreter_fail_compiler_pass":0,"elapsed_ms":16830},"status":"keep","description":"Install Promise prototype descriptors","timestamp":1778847947632,"segment":150,"confidence":11.25,"iterationTokens":3950,"asi":{"hypothesis":"Promise.prototype methods and Symbol.toStringTag need ordinary descriptor metadata, object-prototype parentage, and constructor linkage like other built-in prototypes."}}
{"run":1643,"commit":"fbc91f4","metric":150,"metrics":{"compiler_test262_cases":296,"compiler_test262_pass":146,"compiler_test262_failures":150,"compiler_test262_compiler_errors":0,"compiler_test262_compiler_crashes":0,"compiler_test262_compiler_fails":2,"compiler_test262_both_fail":138,"compiler_test262_interpreter_fail_compiler_pass":0,"compatibility_pass":146,"compatibility_cases":296,"compiler_errors":0,"compiler_crashes":0,"compiler_fails":2,"both_fail":138,"interpreter_fail_compiler_pass":0,"elapsed_ms":16618},"status":"keep","description":"Expose Promise keyed combinators","timestamp":1778848210203,"segment":150,"confidence":7.857142857142857,"iterationTokens":3444,"asi":{"hypothesis":"Promise.allKeyed and Promise.allSettledKeyed should exist as non-constructable statics with metadata; a basic keyed implementation can clear current property/descriptor tests and simple resolved-object cases."}}
{"run":1644,"commit":"ebfe804","metric":149,"metrics":{"compiler_test262_cases":296,"compiler_test262_pass":147,"compiler_test262_failures":149,"compiler_test262_compiler_errors":0,"compiler_test262_compiler_crashes":0,"compiler_test262_compiler_fails":2,"compiler_test262_both_fail":137,"compiler_test262_interpreter_fail_compiler_pass":0,"compatibility_pass":147,"compatibility_cases":296,"compiler_errors":0,"compiler_crashes":0,"compiler_fails":2,"both_fail":137,"interpreter_fail_compiler_pass":0,"elapsed_ms":17065},"status":"keep","description":"Set Promise prototype descriptor","timestamp":1778848625140,"segment":150,"confidence":5.6,"iterationTokens":3444,"asi":{"hypothesis":"Promise constructor prototype static should be non-writable/non-enumerable/non-configurable like other built-in constructor prototype properties."}}
{"run":1645,"commit":"cb0fba1","metric":148,"metrics":{"compiler_test262_cases":296,"compiler_test262_pass":148,"compiler_test262_failures":148,"compiler_test262_compiler_errors":0,"compiler_test262_compiler_crashes":0,"compiler_test262_compiler_fails":2,"compiler_test262_both_fail":136,"compiler_test262_interpreter_fail_compiler_pass":0,"compatibility_pass":148,"compatibility_cases":296,"compiler_errors":0,"compiler_crashes":0,"compiler_fails":2,"both_fail":136,"interpreter_fail_compiler_pass":0,"elapsed_ms":16034},"status":"keep","description":"Reject non-callable Promise executors","timestamp":1778848829167,"segment":150,"confidence":8.76923076923077,"iterationTokens":4277,"asi":{"hypothesis":"The Promise constructor must throw TypeError when the executor is missing or non-callable rather than creating an empty object."}}
{"type":"config","name":"QuickBEAM Error built-ins compatibility slice","metricName":"compatibility_failures","metricUnit":"","bestDirection":"lower"}
{"run":1646,"commit":"a4615d5","metric":33,"metrics":{"compiler_test262_cases":58,"compiler_test262_pass":25,"compiler_test262_failures":33,"compiler_test262_compiler_errors":0,"compiler_test262_compiler_crashes":0,"compiler_test262_compiler_fails":0,"compiler_test262_both_fail":33,"compiler_test262_interpreter_fail_compiler_pass":0,"compatibility_pass":25,"compatibility_cases":58,"compiler_errors":0,"compiler_crashes":0,"compiler_fails":0,"both_fail":33,"interpreter_fail_compiler_pass":0,"elapsed_ms":3387},"status":"keep","description":"Baseline Error built-ins slice after Promise metadata work","timestamp":1778848973311,"segment":151,"confidence":null,"iterationTokens":124,"asi":{"hypothesis":"Survey Error built-ins for smaller residuals likely around constructor/prototype metadata and cause/options semantics."}}
{"run":1647,"commit":"1415fd3","metric":15,"metrics":{"compiler_test262_cases":58,"compiler_test262_pass":43,"compiler_test262_failures":15,"compiler_test262_compiler_errors":0,"compiler_test262_compiler_crashes":0,"compiler_test262_compiler_fails":0,"compiler_test262_both_fail":13,"compiler_test262_interpreter_fail_compiler_pass":0,"compatibility_pass":43,"compatibility_cases":58,"compiler_errors":0,"compiler_crashes":0,"compiler_fails":0,"both_fail":13,"interpreter_fail_compiler_pass":0,"elapsed_ms":3419},"status":"keep","description":"Install Error metadata and cause","timestamp":1778849241641,"segment":151,"confidence":null,"iterationTokens":6104,"asi":{"hypothesis":"Error constructors and prototypes need standard constructability, length/name/prototype descriptors, Error.isError, Object prototype linkage, and non-enumerable cause installation."}}
{"run":1648,"commit":"93fa112","metric":13,"metrics":{"compiler_test262_cases":58,"compiler_test262_pass":45,"compiler_test262_failures":13,"compiler_test262_compiler_errors":0,"compiler_test262_compiler_crashes":0,"compiler_test262_compiler_fails":0,"compiler_test262_both_fail":11,"compiler_test262_interpreter_fail_compiler_pass":0,"compatibility_pass":45,"compatibility_cases":58,"compiler_errors":0,"compiler_crashes":0,"compiler_fails":0,"both_fail":11,"interpreter_fail_compiler_pass":0,"elapsed_ms":3415},"status":"keep","description":"Link Error constructors to Function","timestamp":1778849591637,"segment":151,"confidence":10,"iterationTokens":10423,"asi":{"hypothesis":"Error constructor callables should inherit from Function.prototype, exposing Function as their constructor and inherited Function metadata."}}
{"run":1649,"commit":"7bc6ddd","metric":6,"metrics":{"compiler_test262_cases":58,"compiler_test262_pass":52,"compiler_test262_failures":6,"compiler_test262_compiler_errors":0,"compiler_test262_compiler_crashes":0,"compiler_test262_compiler_fails":0,"compiler_test262_both_fail":4,"compiler_test262_interpreter_fail_compiler_pass":0,"compatibility_pass":52,"compatibility_cases":58,"compiler_errors":0,"compiler_crashes":0,"compiler_fails":0,"both_fail":4,"interpreter_fail_compiler_pass":0,"elapsed_ms":3404},"status":"keep","description":"Fix Error toString semantics","timestamp":1778849829659,"segment":151,"confidence":6,"iterationTokens":5269,"asi":{"hypothesis":"Error.prototype.toString must reject primitive receivers, throw on Symbol name/message coercion, handle empty name/message formatting, and Error instances should present the Error built-in tag to Object.prototype.toString."}}
{"run":1650,"commit":"164f8ea","metric":1,"metrics":{"compiler_test262_cases":58,"compiler_test262_pass":57,"compiler_test262_failures":1,"compiler_test262_compiler_errors":0,"compiler_test262_compiler_crashes":0,"compiler_test262_compiler_fails":0,"compiler_test262_both_fail":1,"compiler_test262_interpreter_fail_compiler_pass":0,"compatibility_pass":57,"compatibility_cases":58,"compiler_errors":0,"compiler_crashes":0,"compiler_fails":0,"both_fail":1,"interpreter_fail_compiler_pass":0,"elapsed_ms":3399},"status":"keep","description":"Complete Error constructor details","timestamp":1778850047015,"segment":151,"confidence":4.571428571428571,"iterationTokens":4165,"asi":{"hypothesis":"Error construction must not create an own message for omitted message, must throw when message ToString sees Symbol, must read options.cause through HasProperty/Get, and Error.isError must tolerate non-map object backing stores."}}
{"run":1651,"commit":"9b79ebe","metric":0,"metrics":{"compiler_test262_cases":58,"compiler_test262_pass":58,"compiler_test262_failures":0,"compiler_test262_compiler_errors":0,"compiler_test262_compiler_crashes":0,"compiler_test262_compiler_fails":0,"compiler_test262_both_fail":0,"compiler_test262_interpreter_fail_compiler_pass":0,"compatibility_pass":58,"compatibility_cases":58,"compiler_errors":0,"compiler_crashes":0,"compiler_fails":0,"both_fail":0,"interpreter_fail_compiler_pass":0,"elapsed_ms":3300},"status":"keep","description":"Expose all Error constructors in realms","timestamp":1778850251939,"segment":151,"confidence":4.571428571428571,"iterationTokens":2462,"asi":{"hypothesis":"Test262-created realms must expose the full standard Error constructor family so Error.isError can recognize cross-realm EvalError and URIError instances."}}
{"type":"config","name":"QuickBEAM AggregateError built-ins compatibility slice","metricName":"compatibility_failures","metricUnit":"","bestDirection":"lower"}
{"run":1652,"commit":"f6e9767","metric":25,"metrics":{"compiler_test262_cases":25,"compiler_test262_pass":0,"compiler_test262_failures":25,"compiler_test262_compiler_errors":0,"compiler_test262_compiler_crashes":0,"compiler_test262_compiler_fails":0,"compiler_test262_both_fail":25,"compiler_test262_interpreter_fail_compiler_pass":0,"compatibility_pass":0,"compatibility_cases":25,"compiler_errors":0,"compiler_crashes":0,"compiler_fails":0,"both_fail":25,"interpreter_fail_compiler_pass":0,"elapsed_ms":2129},"status":"keep","description":"Baseline AggregateError built-ins slice after Error completion","timestamp":1778850397854,"segment":152,"confidence":null,"iterationTokens":128,"asi":{"hypothesis":"AggregateError likely lacks a global constructor; Error completion should make it straightforward to implement as an Error subtype with errors/cause semantics."}}
{"run":1653,"commit":"3201648","metric":3,"metrics":{"compiler_test262_cases":25,"compiler_test262_pass":22,"compiler_test262_failures":3,"compiler_test262_compiler_errors":0,"compiler_test262_compiler_crashes":0,"compiler_test262_compiler_fails":0,"compiler_test262_both_fail":3,"compiler_test262_interpreter_fail_compiler_pass":0,"compatibility_pass":22,"compatibility_cases":25,"compiler_errors":0,"compiler_crashes":0,"compiler_fails":0,"both_fail":3,"interpreter_fail_compiler_pass":0,"elapsed_ms":2285},"status":"keep","description":"Add AggregateError constructor","timestamp":1778850841707,"segment":152,"confidence":null,"iterationTokens":13092,"asi":{"hypothesis":"AggregateError can share Error constructor/prototype machinery with special iterable collection for errors, length 2 metadata, errors property, message/cause handling, and realm exposure."}}
{"run":1654,"commit":"b4ae9cd","metric":1,"metrics":{"compiler_test262_cases":25,"compiler_test262_pass":24,"compiler_test262_failures":1,"compiler_test262_compiler_errors":0,"compiler_test262_compiler_crashes":0,"compiler_test262_compiler_fails":0,"compiler_test262_both_fail":1,"compiler_test262_interpreter_fail_compiler_pass":0,"compatibility_pass":24,"compatibility_cases":25,"compiler_errors":0,"compiler_crashes":0,"compiler_fails":0,"both_fail":1,"interpreter_fail_compiler_pass":0,"elapsed_ms":2351},"status":"keep","description":"Finish AggregateError coercion and newTarget","timestamp":1778851236221,"segment":152,"confidence":12,"iterationTokens":35077,"asi":{"hypothesis":"AggregateError should perform message ToString through full string-hint ToPrimitive semantics and builtin construction should populate the preallocated this object so Reflect.construct can honor a custom newTarget prototype."}}
{"run":1655,"commit":"bcd621d","metric":0,"metrics":{"compiler_test262_cases":25,"compiler_test262_pass":25,"compiler_test262_failures":0,"compiler_test262_compiler_errors":0,"compiler_test262_compiler_crashes":0,"compiler_test262_compiler_fails":0,"compiler_test262_both_fail":0,"compiler_test262_interpreter_fail_compiler_pass":0,"compatibility_pass":25,"compatibility_cases":25,"compiler_errors":0,"compiler_crashes":0,"compiler_fails":0,"both_fail":0,"interpreter_fail_compiler_pass":0,"elapsed_ms":2338},"status":"keep","description":"Use realm AggregateError prototype fallback","timestamp":1778851557207,"segment":152,"confidence":12,"iterationTokens":10576,"asi":{"hypothesis":"When AggregateError is constructed with a cross-realm newTarget whose prototype is not an object, GetPrototypeFromConstructor should fall back to that realm's AggregateError.prototype rather than Object.prototype."}}
{"type":"config","name":"QuickBEAM NativeErrors built-ins compatibility slice","metricName":"compatibility_failures","metricUnit":"","bestDirection":"lower"}
{"run":1656,"commit":"10b67a2","metric":6,"metrics":{"compiler_test262_cases":94,"compiler_test262_pass":88,"compiler_test262_failures":6,"compiler_test262_compiler_errors":0,"compiler_test262_compiler_crashes":0,"compiler_test262_compiler_fails":0,"compiler_test262_both_fail":6,"compiler_test262_interpreter_fail_compiler_pass":0,"compatibility_pass":88,"compatibility_cases":94,"compiler_errors":0,"compiler_crashes":0,"compiler_fails":0,"both_fail":6,"interpreter_fail_compiler_pass":0,"elapsed_ms":5899},"status":"keep","description":"Baseline NativeErrors slice after Error completion","timestamp":1778851718286,"segment":153,"confidence":null,"iterationTokens":127,"asi":{"hypothesis":"Survey NativeErrors after the generic Error constructor/prototype fixes; remaining failures should be small subtype-specific metadata or realm prototype gaps."}}
{"run":1657,"commit":"4522938","metric":0,"metrics":{"compiler_test262_cases":94,"compiler_test262_pass":94,"compiler_test262_failures":0,"compiler_test262_compiler_errors":0,"compiler_test262_compiler_crashes":0,"compiler_test262_compiler_fails":0,"compiler_test262_both_fail":0,"compiler_test262_interpreter_fail_compiler_pass":0,"compatibility_pass":94,"compatibility_cases":94,"compiler_errors":0,"compiler_crashes":0,"compiler_fails":0,"both_fail":0,"interpreter_fail_compiler_pass":0,"elapsed_ms":6106},"status":"keep","description":"Use realm NativeError prototype fallbacks","timestamp":1778852014225,"segment":153,"confidence":null,"iterationTokens":4914,"asi":{"hypothesis":"NativeError constructors should use the newTarget realm's matching NativeError.prototype fallback when Reflect.construct receives a cross-realm newTarget with a primitive prototype."}}
{"type":"config","name":"QuickBEAM SuppressedError built-ins compatibility slice","metricName":"compatibility_failures","metricUnit":"","bestDirection":"lower"}
{"run":1658,"commit":"0efd56c","metric":22,"metrics":{"compiler_test262_cases":22,"compiler_test262_pass":0,"compiler_test262_failures":22,"compiler_test262_compiler_errors":0,"compiler_test262_compiler_crashes":0,"compiler_test262_compiler_fails":0,"compiler_test262_both_fail":22,"compiler_test262_interpreter_fail_compiler_pass":0,"compatibility_pass":0,"compatibility_cases":22,"compiler_errors":0,"compiler_crashes":0,"compiler_fails":0,"both_fail":22,"interpreter_fail_compiler_pass":0,"elapsed_ms":1802},"status":"keep","description":"Baseline SuppressedError built-ins slice after Error completion","timestamp":1778852164083,"segment":154,"confidence":null,"iterationTokens":129,"asi":{"hypothesis":"SuppressedError likely lacks a global constructor; Error/AggregateError machinery should provide most constructor, prototype, and property semantics."}}
{"run":1659,"commit":"4ac2297","metric":0,"metrics":{"compiler_test262_cases":22,"compiler_test262_pass":22,"compiler_test262_failures":0,"compiler_test262_compiler_errors":0,"compiler_test262_compiler_crashes":0,"compiler_test262_compiler_fails":0,"compiler_test262_both_fail":0,"compiler_test262_interpreter_fail_compiler_pass":0,"compatibility_pass":22,"compatibility_cases":22,"compiler_errors":0,"compiler_crashes":0,"compiler_fails":0,"both_fail":0,"interpreter_fail_compiler_pass":0,"elapsed_ms":1981},"status":"keep","description":"Add SuppressedError constructor","timestamp":1778852495830,"segment":154,"confidence":null,"iterationTokens":8784,"asi":{"hypothesis":"SuppressedError can share the Error constructor/prototype machinery with length 3 metadata, explicit error/suppressed own properties, message coercion ordering, and realm prototype fallback support."}}
{"type":"config","name":"QuickBEAM Iterator built-ins compatibility slice","metricName":"compatibility_failures","metricUnit":"","bestDirection":"lower"}
{"run":1660,"commit":"27f4867","metric":493,"metrics":{"compiler_test262_cases":500,"compiler_test262_pass":7,"compiler_test262_failures":493,"compiler_test262_compiler_errors":0,"compiler_test262_compiler_crashes":0,"compiler_test262_compiler_fails":0,"compiler_test262_both_fail":491,"compiler_test262_interpreter_fail_compiler_pass":0,"compatibility_pass":7,"compatibility_cases":500,"compiler_errors":0,"compiler_crashes":0,"compiler_fails":0,"both_fail":491,"interpreter_fail_compiler_pass":0,"elapsed_ms":23870},"status":"keep","description":"Baseline Iterator built-ins slice after Error completion","timestamp":1778852686140,"segment":155,"confidence":null,"iterationTokens":125,"asi":{"hypothesis":"Survey Iterator helpers as a broad future phase; likely too large but may expose missing Iterator constructor/prototype metadata clusters."}}
{"type":"config","name":"QuickBEAM Iterator prototype built-ins compatibility slice","metricName":"compatibility_failures","metricUnit":"","bestDirection":"lower"}
{"run":1661,"commit":"9a676fd","metric":16,"metrics":{"compiler_test262_cases":27,"compiler_test262_pass":11,"compiler_test262_failures":16,"compiler_test262_compiler_errors":0,"compiler_test262_compiler_crashes":0,"compiler_test262_compiler_fails":0,"compiler_test262_both_fail":16,"compiler_test262_interpreter_fail_compiler_pass":0,"compatibility_pass":11,"compatibility_cases":27,"compiler_errors":0,"compiler_crashes":0,"compiler_fails":0,"both_fail":16,"interpreter_fail_compiler_pass":0,"elapsed_ms":2071},"status":"keep","description":"Baseline ArrayIteratorPrototype built-ins slice","timestamp":1778852838517,"segment":156,"confidence":null,"iterationTokens":128,"asi":{"hypothesis":"ArrayIteratorPrototype is a small tractable iterator-prototype slice; failures may be mostly missing prototype chain, toStringTag, or iterator helper metadata."}}
{"run":1662,"commit":"HEAD","metric":9,"metrics":{"compiler_test262_cases":27,"compiler_test262_pass":18,"compiler_test262_failures":9,"compiler_test262_compiler_errors":0,"compiler_test262_compiler_crashes":0,"compiler_test262_compiler_fails":0,"compiler_test262_both_fail":9,"compiler_test262_interpreter_fail_compiler_pass":0,"compatibility_pass":18,"compatibility_cases":27,"compiler_errors":0,"compiler_crashes":0,"compiler_fails":0,"both_fail":9,"interpreter_fail_compiler_pass":0,"elapsed_ms":2048},"status":"checks_failed","description":"Try materialized Array iterator prototype","timestamp":1778853060042,"segment":156,"confidence":null,"iterationTokens":8934,"asi":{"hypothesis":"Array iterators need a materialized prototype with next, @@iterator, and @@toStringTag descriptors plus receiver validation for internal slots.","rollback_reason":"Backpressure compiler generator yield-star test failed: the materialized next method now requires Array-iterator internal markers and rejects generator iterator delegation paths that reuse the same next metadata.","next_action_hint":"Do not retry this exact prototype-next refactor. If revisiting, distinguish Array iterator prototype methods from generic generator iterator delegation or preserve existing own next closures while exposing a separate prototype for descriptor-only tests."}}
