{"run":347,"commit":"e0f9c9c","metric":688,"metrics":{"parser_tests":374,"parser_test_ms":700},"status":"keep","description":"Add structured template literal AST","timestamp":1777278577528,"segment":0,"confidence":4.203703703703703,"iterationTokens":11947,"asi":{"hypothesis":"Replacing whole-template literal tokens with TemplateLiteral/TemplateElement AST nodes closes a major compatibility gap before adding more narrow syntax diagnostics.","learned":"Template tokens are now converted into TemplateLiteral AST nodes with quasis and parsed embedded expressions; tagged templates now carry structured quasi nodes, including nested template expressions.","quickjs_cases":"Adds QuickJS-compatible coverage for template literal quasis/expressions and tagged template quasi AST, while updating older whole-template expectations.","compat_gap":"Template literals moved from raw token preservation toward structured ESTree-like shape, one of the largest parser AST fidelity gaps."}}
{"run":348,"commit":"a4815d1","metric":690,"metrics":{"parser_tests":375,"parser_test_ms":1000},"status":"keep","description":"Convert destructuring assignment targets to patterns","timestamp":1777278917657,"segment":0,"confidence":4.216049382716049,"iterationTokens":8662,"asi":{"hypothesis":"Destructuring assignment left-hand sides should use ObjectPattern/ArrayPattern and RestElement/AssignmentPattern nodes instead of expression literal nodes for AST compatibility.","learned":"Assignment node construction now converts object/array expression targets into pattern nodes recursively, including spread-to-rest and nested default assignment expressions to AssignmentPattern.","quickjs_cases":"Adds QuickJS-compatible AST-shape coverage for nested object/array destructuring assignment patterns and updates earlier expression-shaped expectations.","compat_gap":"Destructuring assignment AST fidelity moved closer to parser compatibility rather than preserving expression placeholders."}}
{"run":349,"commit":"7d96e21","metric":693,"metrics":{"parser_tests":377,"parser_test_ms":600},"status":"keep","description":"Require module source for import export declarations","timestamp":1777279088178,"segment":0,"confidence":4.234567901234568,"iterationTokens":6960,"asi":{"hypothesis":"Static import/export declarations should be diagnosed when parsing script source, while module-source tests remain valid with source_type: :module.","learned":"Program validation now reports `import/export declarations only allowed in modules` for module declarations outside module source; earlier assertion/attribute module tests were corrected to parse as modules.","quickjs_cases":"Adds QuickJS-compatible diagnostics for script-source `import value from \"dep\"` and `export var value = 1`.","compat_gap":"Module/script source type validation now covers a broad grammar boundary instead of accepting all module syntax in scripts."}}
{"run":350,"commit":"bb9638d","metric":695,"metrics":{"parser_tests":378,"parser_test_ms":900},"status":"keep","description":"Port no-substitution template AST coverage","timestamp":1777279552761,"segment":0,"confidence":4.220858895705521,"iterationTokens":2956,"asi":{"hypothesis":"No-substitution templates should produce a TemplateLiteral with one tail quasi and no expressions after the structured template AST change.","learned":"No implementation change was required; structured template literal conversion handles raw templates without substitutions as a single tail TemplateElement.","quickjs_cases":"Adds QuickJS-compatible AST-shape coverage for `value = `plain text`;`."}}
{"run":351,"commit":"d8bd00e","metric":699,"metrics":{"parser_tests":381,"parser_test_ms":800},"status":"keep","description":"Port invalid assignment target diagnostics","timestamp":1777279701939,"segment":0,"confidence":4.219512195121951,"iterationTokens":4119,"asi":{"hypothesis":"Non-reference expressions such as binary expressions and calls should be diagnosed as invalid assignment/update targets.","learned":"Assignment/update validation now rejects targets outside identifiers, member expressions, and plain destructuring patterns, while keeping optional-chain-specific diagnostics first.","quickjs_cases":"Adds QuickJS-compatible diagnostics for `(a + b) = value`, `call() = value`, and `call()++`.","compat_gap":"General assignment target validation closes a broad early-error gap beyond optional-chain targets."}}
{"run":352,"commit":"36da3a6","metric":702,"metrics":{"parser_tests":383,"parser_test_ms":700},"status":"checks_failed","description":"Port duplicate lexical declaration diagnostics","timestamp":1777279829830,"segment":0,"confidence":4.245398773006135,"iterationTokens":1923,"asi":{"hypothesis":"Duplicate lexical declarations in the same program scope should be diagnosed.","rollback_reason":"Backpressure failed in known unrelated Process.monitor flake while parser tests passed.","next_action_hint":"Re-add duplicate lexical declaration validation and rerun; keep only if checks pass.","quickjs_cases":"Attempted QuickJS-compatible diagnostics for `let value; let value;` and `const C = 1; class C {}`."}}
{"run":353,"commit":"8ff35df","metric":702,"metrics":{"parser_tests":383,"parser_test_ms":700},"status":"keep","description":"Port duplicate lexical declaration diagnostics","timestamp":1777279923984,"segment":0,"confidence":4.237804878048781,"iterationTokens":1932,"asi":{"hypothesis":"Duplicate lexical declarations in the same program scope should be diagnosed.","learned":"Program validation now collects top-level let/const/class lexical binding names and emits `duplicate lexical declaration` when names repeat.","quickjs_cases":"Adds QuickJS-compatible diagnostics for `let value; let value;` and `const C = 1; class C {}` after retrying a transient web API flake.","compat_gap":"Introduces broad lexical binding early-error validation rather than isolated syntax-shape coverage."}}
{"run":354,"commit":"22bb081","metric":705,"metrics":{"parser_tests":385,"parser_test_ms":700},"status":"keep","description":"Port lexical var conflict diagnostics","timestamp":1777280050832,"segment":0,"confidence":4.2560975609756095,"iterationTokens":1615,"asi":{"hypothesis":"Top-level lexical declarations should conflict with var/function bindings of the same name.","learned":"Program lexical validation now also collects top-level var and function binding names and reports `lexical declaration conflicts with var declaration` when a lexical binding overlaps.","quickjs_cases":"Adds QuickJS-compatible diagnostics for `var value; let value;` and `function value() {} const value = 1;`."}}
{"run":355,"commit":"225fdde","metric":708,"metrics":{"parser_tests":387,"parser_test_ms":700},"status":"keep","description":"Port duplicate label diagnostics","timestamp":1777280223786,"segment":0,"confidence":4.274390243902439,"iterationTokens":4098,"asi":{"hypothesis":"Nested labels should report duplicate-label diagnostics when a label name is already visible.","learned":"Control-flow validation now checks visible label names before extending label context and emits `duplicate label` for nested duplicate labels.","quickjs_cases":"Adds QuickJS-compatible diagnostics for `label: label: statement;` and a duplicate label inside a labelled loop."}}
{"run":356,"commit":"225fdde","metric":711,"metrics":{"parser_tests":389,"parser_test_ms":700},"status":"checks_failed","description":"Port block duplicate lexical diagnostics","timestamp":1777280373819,"segment":0,"confidence":4.248484848484848,"iterationTokens":2342,"asi":{"hypothesis":"Duplicate lexical declarations should be diagnosed inside block and function-body lexical scopes, not just program scope.","rollback_reason":"Backpressure failed in known unrelated Process.monitor flake while parser tests passed.","next_action_hint":"Re-add block duplicate lexical declaration validation and rerun; keep only if checks pass.","quickjs_cases":"Attempted QuickJS-compatible diagnostics for `{ let value; const value = 1; }` and `function f() { let value; let value; }`."}}
{"run":357,"commit":"dee261b","metric":711,"metrics":{"parser_tests":389,"parser_test_ms":900},"status":"keep","description":"Port block duplicate lexical diagnostics","timestamp":1777280478747,"segment":0,"confidence":4.240963855421687,"iterationTokens":2083,"asi":{"hypothesis":"Duplicate lexical declarations should be diagnosed inside block and function-body lexical scopes, not just program scope.","learned":"Block parsing now validates duplicate let/const/class lexical names within that block, covering nested blocks and function bodies while leaving var conflicts to program-scope validation.","quickjs_cases":"Adds QuickJS-compatible diagnostics for `{ let value; const value = 1; }` and `function f() { let value; let value; }` after retrying a transient web API flake."}}
{"run":358,"commit":"6b6519e","metric":714,"metrics":{"parser_tests":391,"parser_test_ms":600},"status":"keep","description":"Port top-level return diagnostics","timestamp":1777280653107,"segment":0,"confidence":4.259036144578313,"iterationTokens":2083,"asi":{"hypothesis":"Return statements outside function bodies should be parsed into the partial AST but reported as early syntax errors.","learned":"Control-flow validation now emits `return statement not within function` for returns reached from program/block validation; function bodies are not traversed by that validator, so valid function returns remain accepted.","quickjs_cases":"Adds QuickJS-compatible diagnostics for `return value;` and `{ return; }`, and updates the ASI return test to expect an error while preserving the split AST."}}
{"run":359,"commit":"092d47a","metric":717,"metrics":{"parser_tests":393,"parser_test_ms":600},"status":"keep","description":"Port nested module declaration diagnostics","timestamp":1777281828830,"segment":0,"confidence":4.27710843373494,"iterationTokens":38313,"asi":{"hypothesis":"Static import/export declarations should remain in the partial AST but be reported when they appear outside the module top level.","learned":"Program validation now recursively scans statement bodies for nested import/export declarations and reports `import/export declarations only allowed at top level` while preserving top-level module imports/exports.","quickjs_cases":"Adds QuickJS-compatible diagnostics for `{ import value from \"mod\"; }` and `function f() { export const value = 1; }` in module source."}}
{"run":360,"commit":"dc8e287","metric":720,"metrics":{"parser_tests":395,"parser_test_ms":700},"status":"keep","description":"Port yield context diagnostics","timestamp":1777282001165,"segment":0,"confidence":4.269461077844311,"iterationTokens":11220,"asi":{"hypothesis":"Yield expressions parsed outside generator bodies should be preserved in partial ASTs but reported as syntax diagnostics.","learned":"Program validation now scans non-generator statement/expression trees for YieldExpression nodes and reports `yield expression not within generator`; generator function bodies remain allowed.","quickjs_cases":"Adds QuickJS-compatible diagnostics for module `yield value;` and `function f() { yield value; }`."}}
{"run":361,"commit":"9b593a4","metric":723,"metrics":{"parser_tests":397,"parser_test_ms":600},"status":"keep","description":"Port await context diagnostics","timestamp":1777282139001,"segment":0,"confidence":4.261904761904762,"iterationTokens":6489,"asi":{"hypothesis":"Await expressions should be accepted at module top level and inside async functions, but diagnosed in script or non-async function contexts.","learned":"Program validation now scans statement/expression trees with a module-top-level allowance and reports `await expression not within async function or module` when AwaitExpression appears in script or non-async function contexts.","quickjs_cases":"Adds QuickJS-compatible diagnostics for script `await value;` and `function f() { await value; }`."}}
{"run":362,"commit":"c7d501c","metric":726,"metrics":{"parser_tests":399,"parser_test_ms":900},"status":"keep","description":"Port new.target context diagnostics","timestamp":1777282222878,"segment":0,"confidence":4.279761904761905,"iterationTokens":2085,"asi":{"hypothesis":"`new.target` should parse as a meta-property but be diagnosed outside function contexts.","learned":"Program validation now scans top-level/block expression statements and variable initializers for `new.target` meta-properties and reports `new.target not allowed outside function`; function declarations remain exempt.","quickjs_cases":"Adds QuickJS-compatible diagnostics for `new.target;` and `let value = new.target;`."}}
{"run":363,"commit":"c45b686","metric":729,"metrics":{"parser_tests":401,"parser_test_ms":700},"status":"keep","description":"Port import.meta context diagnostics","timestamp":1777283131598,"segment":0,"confidence":4.2976190476190474,"iterationTokens":13755,"asi":{"hypothesis":"`import.meta` should parse as a meta-property but be diagnosed when script source uses it outside modules.","learned":"Program validation now leaves module-source import.meta untouched, but scans script statement/expression trees for `import.meta` meta-properties and reports `import.meta only allowed in modules`.","quickjs_cases":"Adds QuickJS-compatible diagnostics for `let url = import.meta.url;` and `function f() { return import.meta.url; }` in script source."}}
{"run":364,"commit":"bab950c","metric":732,"metrics":{"parser_tests":403,"parser_test_ms":700},"status":"keep","description":"Port super context diagnostics","timestamp":1777283225865,"segment":0,"confidence":4.289940828402367,"iterationTokens":2936,"asi":{"hypothesis":"`super` calls and property access should be preserved in partial ASTs but diagnosed outside class method contexts.","learned":"Program validation now scans top-level and regular function statement/expression trees for `super` identifier usage while skipping class declarations, reporting `super not allowed outside class method`.","quickjs_cases":"Adds QuickJS-compatible diagnostics for `super();` and `function f() { return super.value; }`."}}
{"run":365,"commit":"48a91b8","metric":735,"metrics":{"parser_tests":405,"parser_test_ms":600},"status":"keep","description":"Port class super call diagnostics","timestamp":1777283334294,"segment":0,"confidence":4.2823529411764705,"iterationTokens":3821,"asi":{"hypothesis":"Direct `super()` calls should be diagnosed unless they appear in a derived class constructor.","learned":"Program validation now inspects class methods for direct super calls, allowing only constructors with an `extends` clause while preserving super property access in methods.","quickjs_cases":"Adds QuickJS-compatible diagnostics for `class C { constructor() { super(); } }` and `class C extends B { method() { super(); } }`."}}
{"run":366,"commit":"a4e5c19","metric":738,"metrics":{"parser_tests":407,"parser_test_ms":700},"status":"keep","description":"Port class element super call diagnostics","timestamp":1777283427442,"segment":0,"confidence":4.3,"iterationTokens":1533,"asi":{"hypothesis":"Direct `super()` calls should also be rejected from class static blocks and field initializers, not only ordinary methods.","learned":"Class super-call validation now checks static block statement bodies and field initializer expressions for direct `super()` calls.","quickjs_cases":"Adds QuickJS-compatible diagnostics for `class C extends B { static { super(); } }` and `class C extends B { field = super(); }`."}}
{"run":367,"commit":"b6aceb9","metric":741,"metrics":{"parser_tests":409,"parser_test_ms":700},"status":"keep","description":"Port duplicate private name diagnostics","timestamp":1777283534919,"segment":0,"confidence":4.317647058823529,"iterationTokens":3010,"asi":{"hypothesis":"Class private names should be unique, except for the standard getter/setter pair shape.","learned":"Class validation now collects private field/method/accessor names and reports `duplicate private name` for duplicate field/method declarations while allowing complementary private accessor pairs.","quickjs_cases":"Adds QuickJS-compatible diagnostics for `class C { #value; #value; }` and `class C { #value() {} #value() {} }`."}}
{"run":368,"commit":"600d7dc","metric":744,"metrics":{"parser_tests":411,"parser_test_ms":700},"status":"keep","description":"Port private accessor duplicate diagnostics","timestamp":1777284427499,"segment":0,"confidence":4.309941520467836,"iterationTokens":2267,"asi":{"hypothesis":"Private accessors should reject duplicate getters or duplicate setters but allow a complementary getter/setter pair.","learned":"Existing private-name validation already handles accessor-kind uniqueness correctly: duplicate private getters are rejected, while get/set pairs parse successfully.","quickjs_cases":"Adds QuickJS-compatible coverage for `class C { get #value() {} get #value() {} }` and `class C { get #value() {} set #value(value) {} }`."}}
{"run":369,"commit":"38624c7","metric":747,"metrics":{"parser_tests":413,"parser_test_ms":700},"status":"keep","description":"Port undeclared private name diagnostics","timestamp":1777284586226,"segment":0,"confidence":4.3023255813953485,"iterationTokens":7678,"asi":{"hypothesis":"Private names used inside a class should be declared by that class before the parser accepts the class without diagnostics.","learned":"Class validation now collects declared private names from fields/methods/accessors and scans field initializers, methods, and static blocks for undeclared private identifiers. Existing private accessor syntax tests now declare their backing private slot explicitly.","quickjs_cases":"Adds QuickJS-compatible diagnostics for `this.#missing` and `#missing in this` inside class methods."}}
{"run":370,"commit":"2032ff3","metric":750,"metrics":{"parser_tests":415,"parser_test_ms":1000},"status":"checks_failed","description":"Port private name outside class diagnostics","timestamp":1777284671877,"segment":0,"confidence":4.3023255813953485,"iterationTokens":1620,"asi":{"hypothesis":"Private identifiers outside any class body should be diagnosed as undeclared private names.","rollback_reason":"Backpressure failed in known unrelated Process.monitor flake while parser tests passed.","next_action_hint":"Re-add the private-name outside class validation and tests, then rerun; keep only if checks pass.","quickjs_cases":"Attempted QuickJS-compatible diagnostics for `object.#missing;` and `#missing in object;`."}}
{"run":371,"commit":"8a68159","metric":750,"metrics":{"parser_tests":415,"parser_test_ms":900},"status":"keep","description":"Port private name outside class diagnostics","timestamp":1777284751008,"segment":0,"confidence":4.319767441860465,"iterationTokens":1838,"asi":{"hypothesis":"Private identifiers outside any class body should be diagnosed as undeclared private names.","learned":"Declared-private-name validation now treats non-class program statements as having an empty private-name environment, so member/private-in expressions outside classes report `undeclared private name`.","quickjs_cases":"Adds QuickJS-compatible diagnostics for `object.#missing;` and `#missing in object;` after retrying a transient web API flake."}}
{"run":372,"commit":"a3f0a9a","metric":753,"metrics":{"parser_tests":417,"parser_test_ms":700},"status":"keep","description":"Port block lexical var conflict diagnostics","timestamp":1777284852222,"segment":0,"confidence":4.337209302325581,"iterationTokens":2302,"asi":{"hypothesis":"Lexical declarations should conflict with var declarations within block/function-body validation, not only at the program top level.","learned":"Block parsing now reuses lexical-vs-var conflict validation and the older duplicate-only helper was removed, preserving duplicate lexical diagnostics while adding block var conflicts.","quickjs_cases":"Adds QuickJS-compatible diagnostics for `{ let value; var value; }` and `function f() { const value = 1; var value; }`."}}
{"run":373,"commit":"05b4d79","metric":756,"metrics":{"parser_tests":419,"parser_test_ms":1000},"status":"keep","description":"Port catch parameter lexical conflict diagnostics","timestamp":1777284936910,"segment":0,"confidence":4.354651162790698,"iterationTokens":2414,"asi":{"hypothesis":"Catch parameter binding names should conflict with lexical declarations in the catch body.","learned":"Catch clause parsing now compares binding names from the optional catch parameter with direct lexical declarations in the catch body and emits `catch parameter conflicts with lexical declaration`.","quickjs_cases":"Adds QuickJS-compatible diagnostics for `try {} catch (error) { let error; }` and destructured catch parameter conflict with `const error`."}}
{"run":374,"commit":"a6a87ce","metric":759,"metrics":{"parser_tests":421,"parser_test_ms":800},"status":"keep","description":"Port import binding conflict diagnostics","timestamp":1777285041981,"segment":0,"confidence":4.3468208092485545,"iterationTokens":2911,"asi":{"hypothesis":"Static import local names should participate in module lexical duplicate/conflict diagnostics.","learned":"Lexical binding collection now includes local identifiers from default, namespace, and named import specifiers, so duplicate imports and import-vs-let conflicts report duplicate lexical declarations.","quickjs_cases":"Adds QuickJS-compatible diagnostics for duplicate local import bindings and `import value from \"a\"; let value;`."}}
{"type":"config","name":"Optimizing experimental JS parser performance","metricName":"test_language_parser_us","metricUnit":"µs","bestDirection":"lower"}
