{"run":375,"commit":"7830c20","metric":4386,"metrics":{"class_private_parser_us":49,"function_control_parser_us":49,"quickjs_parser_tests":759,"parser_tests":421,"parser_test_ms":600},"status":"keep","description":"Optimize parser token access and lexer hot paths","timestamp":1777286293793,"segment":1,"confidence":null,"iterationTokens":2412,"asi":{"hypothesis":"eprof-identified O(n²) token position lookup and list-based token access dominate parser time on larger inputs.","profile_before":"eprof on an 80-class corpus showed Enum.drop_list/2 at 52.6%, Enum.reduce list fold at 29.9%, and Lexer.position_for/2 path at ~45%+ due recomputing line/column from source start per token; parser current/peek used Enum.at/List.last repeatedly.","changes":"Lexer now records token start line/column when scanning begins, eliminating position_for/2; parser stores tokens as a tuple with cached count/last token for O(1) current/peek/advance; punctuator scanning uses direct binary pattern matching instead of Enum.find/String.starts_with over all punctuators; added benchmark script and shifted autoresearch segment to parser performance.","benchmark_after":"bench/js_parser_vs_quickjs.exs: test_language_parser_us=4386, class_private_parser_us=49, function_control_parser_us=49. Earlier manual baseline before fixes was ~304497µs on test_language.js and ~956086µs on a 25KB generated class corpus; after fixes the generated corpus was ~8213µs.","quickjs_comparison":"Current test_language parse is ~1.7x slower than QuickJS compile including NIF/bytecode overhead; generated valid class corpus is now faster than QuickJS compile in the manual benchmark.","next_action_hint":"Re-run eprof after this commit; remaining hot spots are ordinary lexer/parser dispatch such as keyword?/match_value?, current/peek, scan_identifier_parts, and validation passes."}}
{"run":376,"commit":"39b55fb","metric":4313,"metrics":{"class_private_parser_us":49,"function_control_parser_us":49,"quickjs_parser_tests":759,"parser_tests":421,"parser_test_ms":700},"status":"keep","description":"Trim lexer advance overhead","timestamp":1777286437010,"segment":1,"confidence":null,"iterationTokens":4311,"asi":{"hypothesis":"After eliminating O(n²) token positioning and list token access, eprof showed lexer advance helpers still contributed measurable overhead through Range/Enum construction and UTF-8 binary allocation.","profile_before":"Post-fix eprof top functions included Lexer.peek/current/scan_identifier_parts/advance and advance_bytes-related Range/Enum calls. Advance itself remained ~4.9% of profiled time.","changes":"Replaced advance_bytes/2 Enum.reduce over ranges with direct recursion and replaced byte_size(<<ch::utf8>>) allocation with utf8_size/1 guards.","benchmark_after":"test_language_parser_us improved from 4386 to 4313; parser suite remained 421 tests, 0 failures; backpressure checks passed.","next_action_hint":"Remaining profile is dominated by normal scanner/parser dispatch (Lexer.peek/current, skip_trivia, Parser.current/token_at, match_value?/keyword?). Further gains likely require structural changes such as caching current token in parser state or reducing repeated current/peek calls."}}
{"run":377,"commit":"4cb2904","metric":4645,"metrics":{"class_private_parser_us":51,"function_control_parser_us":53,"quickjs_parser_tests":759,"parser_tests":421,"parser_test_ms":1200},"status":"discard","description":"Try cached parser lookahead tokens","timestamp":1777286804949,"segment":1,"confidence":1,"iterationTokens":8481,"asi":{"hypothesis":"Caching current and three lookahead tokens in parser state would reduce current/peek/token_at overhead enough to improve parser throughput.","result":"Regression: test_language_parser_us worsened from best 4313/4386 range to 4645, class_private/function_control also worsened to 51/53, despite tests and checks passing.","rollback_reason":"Refreshing four cached tokens on every advance costs more than the saved elem(tuple, index) lookups; added larger parser state updates appear to dominate.","next_action_hint":"Do not retry broad lookahead caching. If revisiting, only cache current_token and maybe next_token, or instead reduce repeated current/peek calls locally in hot helpers without mutating parser state on every advance.","profiling_context":"Before this experiment, remaining eprof hot spots were normal dispatch: Parser.current/token_at/match_value?/keyword? and Lexer.peek/current/scan_identifier_parts."}}
{"run":378,"commit":"3e47778","metric":4409,"metrics":{"class_private_parser_us":47,"function_control_parser_us":48,"quickjs_parser_tests":759,"parser_tests":421,"parser_test_ms":900},"status":"discard","description":"Try local parser token helper simplification","timestamp":1777286928315,"segment":1,"confidence":1.5208333333333333,"iterationTokens":2936,"asi":{"hypothesis":"Reducing repeated current/peek helper work locally, without cached parser state, could improve hot keyword?/peek_value? dispatch.","result":"No primary improvement: test_language_parser_us=4409, worse than the 4313 kept best and slightly worse than the segment baseline; small snippets improved but primary regressed.","rollback_reason":"The pattern-matching keyword?/2 and peek_value clauses did not improve the large-file primary benchmark; likely noise or extra function clause dispatch offsets savings.","next_action_hint":"Avoid micro-optimizing Parser.current/keyword? helpers without a profiler-backed targeted call-site change. Focus next on bigger structural work such as collapsing validation passes or optimizing lexer current/peek."}}
{"run":379,"commit":"2a37f29","metric":4212,"metrics":{"class_private_parser_us":44,"function_control_parser_us":43,"quickjs_parser_tests":759,"parser_tests":421,"parser_test_ms":800},"status":"keep","description":"Fast-path ASCII lexer codepoint reads","timestamp":1777287064605,"segment":1,"confidence":2.3835616438356166,"iterationTokens":2628,"asi":{"hypothesis":"eprof showed Lexer.peek/current still hot; most JavaScript source is ASCII, so avoiding binary_part UTF-8 pattern matching for ASCII codepoints should improve scanner throughput.","changes":"Replaced current/peek implementation with codepoint_at/3 using :binary.at for an ASCII fast path and falling back to binary_part UTF-8 decoding only for non-ASCII bytes.","benchmark_after":"test_language_parser_us=4212, improving over the kept best 4313; class_private_parser_us=44 and function_control_parser_us=43 also improved materially; parser tests and backpressure checks passed.","prior_dead_end":"Cached parser lookahead tokens and local keyword?/peek_value helper changes both regressed or failed to improve the primary benchmark and were discarded.","next_action_hint":"Re-profile after this keep; remaining likely wins are further scanner ASCII fast paths or reducing validation passes, not parser-state lookahead caching."}}
{"run":380,"commit":"d6aec78","metric":4019,"metrics":{"class_private_parser_us":39,"function_control_parser_us":43,"quickjs_parser_tests":759,"parser_tests":421,"parser_test_ms":900},"status":"keep","description":"Reduce lexer current calls in hot loops","timestamp":1777287333543,"segment":1,"confidence":3.7258883248730963,"iterationTokens":6761,"asi":{"hypothesis":"eprof after ASCII codepoint fast path still showed Lexer.current/peek/codepoint_at/advance and scan_identifier_parts hot; reducing repeated current calls and making ASCII advance cheaper should improve throughput.","profile_before":"Recent eprof tail showed codepoint_at 10.4%, binary:at 6.9%, Lexer.advance 5.7%, Lexer.current 5.1%, scan_identifier_parts 5.0%, plus line_terminator?/utf8_size costs.","changes":"scan_identifier_parts/2 now reads the current codepoint once and uses a direct backslash/u check; advance/1 now uses :binary.at and direct ASCII/newline branches before falling back to UTF-8 codepoint decoding.","benchmark_after":"test_language_parser_us=4019, improving over kept best 4212; class_private_parser_us=39 and function_control_parser_us=43; parser tests and backpressure checks passed.","next_action_hint":"Continue with scanner hot paths. skip_trivia still uses multiple current/starts_with calls and likely can be rewritten around a single byte read/pattern match."}}
{"run":381,"commit":"0e8dde7","metric":3415,"metrics":{"class_private_parser_us":36,"function_control_parser_us":43,"quickjs_parser_tests":759,"parser_tests":421,"parser_test_ms":800},"status":"keep","description":"Fast-path lexer trivia scanning","timestamp":1777287499233,"segment":1,"confidence":9.613861386138614,"iterationTokens":3403,"asi":{"hypothesis":"eprof and previous ASI pointed at skip_trivia as a remaining scanner hot path; rewriting it around one byte read instead of repeated current/starts_with calls should reduce lexer overhead.","changes":"skip_trivia/1 now exits on offset/length, reads the current byte once with :binary.at, branches directly for ASCII whitespace/newlines/hashbang/comments, and uses byte_at/3 for one-byte lookahead. It avoids repeated codepoint decoding and starts_with? calls in normal trivia scanning.","benchmark_after":"test_language_parser_us=3415, a large improvement over kept best 4019; class_private_parser_us=36; function_control_parser_us=43; parser tests and backpressure checks passed.","next_action_hint":"Re-profile. Remaining starts_with? calls are mostly string/template/escape/comment internals. Further gains may come from reducing parser validation traversals or optimizing identifier scanning/keyword lookup."}}
{"run":382,"commit":"fef1f75","metric":3973,"metrics":{"class_private_parser_us":43,"function_control_parser_us":42,"quickjs_parser_tests":759,"parser_tests":421,"parser_test_ms":900},"status":"discard","description":"Try guard-based lexer character predicates","timestamp":1777287684887,"segment":1,"confidence":4.97948717948718,"iterationTokens":5406,"asi":{"hypothesis":"Replacing `in` range/list predicates in lexer identifier/hex/line-terminator checks with guard-style comparisons would reduce Enum predicate overhead seen in eprof.","result":"No improvement over current kept best: test_language_parser_us=3973 versus best 3415; small manual run was noisy, but confirmed benchmark did not improve primary.","rollback_reason":"Predicate micro-optimization did not improve the primary parser benchmark and worsened class_private from kept best 36 to 43.","next_action_hint":"Do not pursue isolated predicate rewrites. Continue with larger hotspots: parser current/token_at/match_value or validation pass collapse, and benchmark with run_experiment rather than one-off noisy runs."}}
{"run":383,"commit":"17c0a01","metric":3353,"metrics":{"class_private_parser_us":35,"function_control_parser_us":38,"quickjs_parser_tests":759,"parser_tests":421,"parser_test_ms":900},"status":"keep","description":"Replace lexer prefix checks with byte lookahead","timestamp":1777287856347,"segment":1,"confidence":5.243654822335025,"iterationTokens":4437,"asi":{"hypothesis":"After trivia fast paths, remaining eprof still showed lexer starts_with?/String.starts_with? overhead; replacing remaining lexer prefix tests with byte lookahead should reduce scanning overhead.","changes":"Removed lexer starts_with?/2 and replaced unicode escape, number prefix, block-comment terminator, CRLF, and token-start unicode checks with direct byte_at/3 or peek/2 comparisons.","benchmark_after":"test_language_parser_us=3353, improving over kept best 3415; class_private_parser_us=35; function_control_parser_us=38; parser suite and backpressure checks passed.","profile_context":"Previous profile showed starts_with? still around 1.6% plus String.starts_with? callers. This removes the lexer helper entirely.","next_action_hint":"Re-profile. Remaining large items are parser current/token_at/match_value/keyword and identifier scanning; consider targeted parser call-site reductions or validation-pass consolidation."}}
{"run":384,"commit":"47ae670","metric":3220,"metrics":{"class_private_parser_us":30,"function_control_parser_us":35,"quickjs_parser_tests":759,"parser_tests":421,"parser_test_ms":600},"status":"keep","description":"Fast-path raw identifier scanning","timestamp":1777288032784,"segment":1,"confidence":4.134751773049645,"iterationTokens":5337,"asi":{"hypothesis":"Identifier scanning remained hot because every identifier built an iolist of per-codepoint binaries; most identifiers contain only raw ASCII and can be sliced directly.","changes":"scan_identifier/1 now scans raw ASCII identifier bytes with advance_identifier_raw/1, slices the original source as the identifier value when no unicode escape appears, and only falls back to the existing escaped/codepoint path when `\\u` is encountered. Added ascii_identifier_part?/1 for the byte loop.","benchmark_after":"test_language_parser_us=3220, improving over kept best 3353; class_private_parser_us=30 and function_control_parser_us=35; parser suite and backpressure checks passed.","profile_context":"Previous eprof showed scan_identifier/1, scan_identifier_parts/2, identifier_start?/part?, iolist_to_binary, and reverse still visible after trivia/prefix fast paths.","next_action_hint":"Re-profile; remaining gains may come from parser current/match_value or validation pass consolidation. Be cautious with character predicate rewrites: previous guard-based broad rewrite was discarded."}}
{"run":385,"commit":"3e01ff6","metric":3263,"metrics":{"class_private_parser_us":30,"function_control_parser_us":35,"quickjs_parser_tests":759,"parser_tests":421,"parser_test_ms":600},"status":"discard","description":"Try inlining ASCII identifier predicate","timestamp":1777288141786,"segment":1,"confidence":2.98974358974359,"iterationTokens":3504,"asi":{"hypothesis":"Inlining ascii_identifier_part?/1 inside the raw identifier scan loop would reduce a hot function call shown in eprof.","result":"No primary improvement: test_language_parser_us=3263 versus kept best 3220. Secondary metrics were unchanged from the best kept raw identifier scan.","rollback_reason":"The micro-optimization did not beat the current best; function-call savings were within benchmark noise or offset by larger generated code/branching.","next_action_hint":"Avoid smaller predicate tweaks. Move to parser current/token_at/match_value reductions or validation pass consolidation."}}
{"run":386,"commit":"d778323","metric":3265,"metrics":{"class_private_parser_us":31,"function_control_parser_us":35,"quickjs_parser_tests":759,"parser_tests":421,"parser_test_ms":600},"status":"discard","description":"Try inlining parser and lexer hot helpers","timestamp":1777288262144,"segment":1,"confidence":2.346076458752515,"iterationTokens":2007,"asi":{"hypothesis":"Inlining hot private helpers reported by eprof, including parser current/token_at/match_value and lexer current/peek/codepoint_at, could reduce function call overhead without semantic changes.","result":"No primary improvement: test_language_parser_us=3265 versus kept best 3220. Secondary metrics also slightly worse for class_private.","rollback_reason":"BEAM inlining did not beat the existing compiled code for the primary benchmark; increased code size or optimizer behavior likely offset call savings.","next_action_hint":"Avoid broad @compile inline for this parser. Focus on algorithmic reductions such as validation pass consolidation or specific scanner loops with clear eprof evidence."}}
{"run":387,"commit":"a571b60","metric":2974,"metrics":{"class_private_parser_us":27,"function_control_parser_us":33,"quickjs_parser_tests":759,"parser_tests":421,"parser_test_ms":600},"status":"keep","description":"Dispatch statements from current token","timestamp":1777288400275,"segment":1,"confidence":2.5304659498207887,"iterationTokens":4394,"asi":{"hypothesis":"Parser keyword?/match_value? and current/token_at remain hot; parse_statement/1 repeatedly checks the same current token against many keywords and punctuators, so dispatching once on current token should reduce helper calls.","changes":"Rewrote parse_statement/1 to case on current(state) once, dispatching keyword and punctuation statements directly. Preserved async function declaration handling and label fallback.","benchmark_after":"test_language_parser_us=2974, improving over kept best 3220; class_private_parser_us=27; function_control_parser_us=33; parser tests and backpressure checks passed.","profile_context":"Previous eprof showed parser current/token_at, keyword?/2, and match_value?/2 together among the largest remaining costs.","next_action_hint":"Look for similar repeated current-token checks in parse_prefix/parse_class_element/import parsing, or begin consolidating validation passes."}}
{"run":388,"commit":"5135614","metric":3455,"metrics":{"class_private_parser_us":28,"function_control_parser_us":33,"quickjs_parser_tests":759,"parser_tests":421,"parser_test_ms":800},"status":"discard","description":"Try current-token parse_prefix dispatch","timestamp":1777288629473,"segment":1,"confidence":2.9883597883597885,"iterationTokens":9565,"asi":{"hypothesis":"parse_prefix/1 was a visible eprof hotspot and repeatedly used match_value?/keyword? against the same current token; a single current-token case dispatch might reduce parser helper overhead as parse_statement/1 did.","result":"Regression: test_language_parser_us=3455 versus kept best 2974/3220; although small class/function snippets stayed good, primary large-file benchmark worsened.","rollback_reason":"The larger case dispatch and additional helper functions did not help the primary benchmark, likely because parse_prefix hot cost is in recursive expression parsing/postfix handling rather than repeated current-token tests alone.","next_action_hint":"Do not rewrite parse_prefix wholesale. If optimizing expressions, target parse_postfix_tail/parse_binary_tail or validation passes with profiler evidence."}}
{"run":389,"commit":"9c746a1","metric":3295,"metrics":{"class_private_parser_us":34,"function_control_parser_us":40,"quickjs_parser_tests":759,"parser_tests":421,"parser_test_ms":900},"status":"discard","description":"Try current-token postfix dispatch","timestamp":1777289157430,"segment":1,"confidence":2.9355509355509355,"iterationTokens":5306,"asi":{"hypothesis":"parse_postfix_tail/2 remained visible in eprof and used several match_value?/current calls; dispatching once on the current token could reduce expression parsing overhead.","result":"Regression versus kept best: test_language_parser_us=3295 vs 2974, with secondary snippets also worse than best. Parser tests and checks passed.","rollback_reason":"The single case dispatch did not improve the primary benchmark; as with parse_prefix, expression parsing overhead appears elsewhere or the rewrite worsens branch/layout behavior.","next_action_hint":"Avoid broad expression dispatch rewrites. Focus on validation pass consolidation or more targeted parser current/match_value reductions where call count is provably high."}}
{"run":390,"commit":"f889248","metric":2985,"metrics":{"class_private_parser_us":28,"function_control_parser_us":33,"quickjs_parser_tests":759,"parser_tests":421,"parser_test_ms":700},"status":"discard","description":"Try statement terminator current-token checks","timestamp":1777289368093,"segment":1,"confidence":3.0998902305159164,"iterationTokens":5306,"asi":{"hypothesis":"parse_statement_list/2, consume_semicolon/1, and statement_end?/1 perform repeated eof?/match_value?/current calls on common statement boundaries; using one current token should shave parser helper overhead.","result":"No primary improvement versus kept best 2974: test_language_parser_us=2985. Parser tests and checks passed.","rollback_reason":"Change is within noise/slightly worse than kept best, so not worth preserving despite being locally clean.","next_action_hint":"Boundary helper rewrites are too small to overcome noise. Look for larger algorithmic wins in lexer current/codepoint usage, template/string scanning, or validation traversal."}}
{"run":391,"commit":"79668ba","metric":3025,"metrics":{"class_private_parser_us":27,"function_control_parser_us":32,"quickjs_parser_tests":759,"parser_tests":421,"parser_test_ms":600},"status":"checks_failed","description":"Try numeric prefix pattern helpers","timestamp":1777289498745,"segment":1,"confidence":3.2837209302325583,"iterationTokens":4100,"asi":{"hypothesis":"String.starts_with?/2 still appeared in test_language profiling from numeric literal parsing/validation; replacing prefix checks with binary pattern helpers might reduce lexer overhead.","result":"Benchmark was not better than kept best (3025 vs 2974) and backpressure checks failed due known transient Process.monitor noproc/kaboom flake.","rollback_reason":"Checks failed and primary metric did not improve kept best; change should be reverted.","next_action_hint":"Do not pursue numeric prefix helper refactor; remaining starts_with?/regex number validation is not a large enough win for primary benchmark. Retry from clean state and focus elsewhere.","check_failure":"test/web_apis/beam_process_test.exs Process.monitor callback fires with exit reason returned noproc instead of kaboom, known transient flake."}}
