{"run":1684,"commit":"d9aeb48","metric":0,"metrics":{"compiler_test262_cases":11,"compiler_test262_pass":11,"compiler_test262_failures":0,"compiler_test262_compiler_errors":0,"compiler_test262_compiler_crashes":0,"compiler_test262_compiler_fails":0,"compiler_test262_both_fail":0,"compiler_test262_interpreter_fail_compiler_pass":0,"compatibility_pass":11,"compatibility_cases":11,"compiler_errors":0,"compiler_crashes":0,"compiler_fails":0,"both_fail":0,"interpreter_fail_compiler_pass":0,"elapsed_ms":1236},"status":"keep","description":"Complete Map iterator next semantics","timestamp":1778858814933,"segment":165,"confidence":null,"iterationTokens":7868,"asi":{"hypothesis":"Map iterators need internal marker/state slots on iterator objects, a next closure that accepts any marked Map iterator receiver, and live ordered-key scanning until the iterator reaches done.","result":"MapIteratorPrototype slice completed at 0 failures; checks passed.","remaining":"SetIteratorPrototype likely can reuse the same scoped marker/live-state pattern; ArrayIteratorPrototype needs extra caution due prior generator yield-star backpressure failure."}}
{"type":"config","name":"Improve SetIteratorPrototype Test262 compatibility","metricName":"compatibility_failures","metricUnit":"","bestDirection":"lower"}
{"run":1685,"commit":"595b576","metric":7,"metrics":{"compiler_test262_cases":11,"compiler_test262_pass":4,"compiler_test262_failures":7,"compiler_test262_compiler_errors":0,"compiler_test262_compiler_crashes":0,"compiler_test262_compiler_fails":0,"compiler_test262_both_fail":7,"compiler_test262_interpreter_fail_compiler_pass":0,"compatibility_pass":4,"compatibility_cases":11,"compiler_errors":0,"compiler_crashes":0,"compiler_fails":0,"both_fail":7,"interpreter_fail_compiler_pass":0,"elapsed_ms":1308},"status":"keep","description":"Baseline SetIteratorPrototype residual","timestamp":1778858962085,"segment":166,"confidence":null,"iterationTokens":126,"asi":{"hypothesis":"SetIteratorPrototype has the same residual shape as MapIteratorPrototype; baseline before applying a similarly scoped iterator marker/live-state fix."}}
{"run":1686,"commit":"64d9e75","metric":0,"metrics":{"compiler_test262_cases":11,"compiler_test262_pass":11,"compiler_test262_failures":0,"compiler_test262_compiler_errors":0,"compiler_test262_compiler_crashes":0,"compiler_test262_compiler_fails":0,"compiler_test262_both_fail":0,"compiler_test262_interpreter_fail_compiler_pass":0,"compatibility_pass":11,"compatibility_cases":11,"compiler_errors":0,"compiler_crashes":0,"compiler_fails":0,"both_fail":0,"interpreter_fail_compiler_pass":0,"elapsed_ms":1112},"status":"keep","description":"Complete Set iterator next semantics","timestamp":1778859207659,"segment":166,"confidence":null,"iterationTokens":4802,"asi":{"hypothesis":"Set iterators can use the same scoped hidden iterator-state marker pattern as Map iterators, with live Set data scanning until done and receiver validation on next.","result":"SetIteratorPrototype slice completed at 0 failures; checks passed.","remaining":"ArrayIteratorPrototype remains the last small iterator-prototype residual and needs a version of this pattern that does not break generator yield-star delegation."}}
{"type":"config","name":"Improve ArrayIteratorPrototype Test262 compatibility","metricName":"compatibility_failures","metricUnit":"","bestDirection":"lower"}
{"run":1687,"commit":"ab0d2b4","metric":10,"metrics":{"compiler_test262_cases":27,"compiler_test262_pass":17,"compiler_test262_failures":10,"compiler_test262_compiler_errors":0,"compiler_test262_compiler_crashes":0,"compiler_test262_compiler_fails":0,"compiler_test262_both_fail":10,"compiler_test262_interpreter_fail_compiler_pass":0,"compatibility_pass":17,"compatibility_cases":27,"compiler_errors":0,"compiler_crashes":0,"compiler_fails":0,"both_fail":10,"interpreter_fail_compiler_pass":0,"elapsed_ms":1939},"status":"keep","description":"Baseline ArrayIteratorPrototype residual","timestamp":1778859367782,"segment":167,"confidence":null,"iterationTokens":126,"asi":{"hypothesis":"ArrayIteratorPrototype is the last small iterator-prototype residual after completing Map/Set/String/RegExpString iterator prototype slices; establish baseline before carefully attempting receiver validation without breaking generator yield-star delegation."}}
{"run":1688,"commit":"c318ea5","metric":2,"metrics":{"compiler_test262_cases":27,"compiler_test262_pass":25,"compiler_test262_failures":2,"compiler_test262_compiler_errors":0,"compiler_test262_compiler_crashes":0,"compiler_test262_compiler_fails":0,"compiler_test262_both_fail":2,"compiler_test262_interpreter_fail_compiler_pass":0,"compatibility_pass":25,"compatibility_cases":27,"compiler_errors":0,"compiler_crashes":0,"compiler_fails":0,"both_fail":2,"interpreter_fail_compiler_pass":0,"elapsed_ms":2212},"status":"keep","description":"Expose arguments Array iterator","timestamp":1778859762622,"segment":167,"confidence":null,"iterationTokens":17812,"asi":{"hypothesis":"Arguments exotic objects should inherit only Array.prototype @@iterator behavior while still using Object.prototype for ordinary named properties, fixing mapped/unmapped arguments iterator protocol tests without turning arguments into full arrays.","result":"ArrayIteratorPrototype failures improved from 10 to 2; checks passed.","remaining":"Residual failures are Array iterator internal-slot validation and typed-array detach-in-progress behavior."}}
{"run":1689,"commit":"c318ea5","metric":1,"metrics":{"compiler_test262_cases":27,"compiler_test262_pass":26,"compiler_test262_failures":1,"compiler_test262_compiler_errors":0,"compiler_test262_compiler_crashes":0,"compiler_test262_compiler_fails":0,"compiler_test262_both_fail":1,"compiler_test262_interpreter_fail_compiler_pass":0,"compatibility_pass":26,"compatibility_cases":27,"compiler_errors":0,"compiler_crashes":0,"compiler_fails":0,"both_fail":1,"interpreter_fail_compiler_pass":0,"elapsed_ms":1785},"status":"checks_failed","description":"Try exact Array iterator receiver validation","timestamp":1778859845536,"segment":167,"confidence":8,"iterationTokens":2241,"asi":{"hypothesis":"Array iterator own next closure can validate exact receiver like String iterators to fix non-own-slots without moving next to the prototype.","rollback_reason":"Backpressure compiler generator yield-star test failed again: compiled generator delegation invokes an Array-iterator-derived next closure with a receiver shape that the exact check rejects.","next_action_hint":"Do not retry exact Array iterator receiver validation. Need to distinguish genuine Array iterators from generator delegation, perhaps via a marker accepted on generator delegation objects or by leaving Array next permissive and fixing non-own-slots another way."}}
{"run":1690,"commit":"c318ea5","metric":2,"metrics":{"compiler_test262_cases":27,"compiler_test262_pass":25,"compiler_test262_failures":2,"compiler_test262_compiler_errors":0,"compiler_test262_compiler_crashes":0,"compiler_test262_compiler_fails":1,"compiler_test262_both_fail":1,"compiler_test262_interpreter_fail_compiler_pass":0,"compatibility_pass":25,"compatibility_cases":27,"compiler_errors":0,"compiler_crashes":0,"compiler_fails":1,"both_fail":1,"interpreter_fail_compiler_pass":0,"elapsed_ms":1780},"status":"discard","description":"Expose typed-array iterator methods and detach host","timestamp":1778860226739,"segment":167,"confidence":16,"iterationTokens":10892,"asi":{"hypothesis":"Installing typed-array keys/values/entries plus Test262 detachArrayBuffer host support should fix detach-in-progress typed-array iterator behavior.","rollback_reason":"Primary metric stayed at 2: interpreter detach case passed, but compiler still failed the same case, shifting it to compiler-only.","next_action_hint":"If revisiting, inspect compiled typed-array iterator/context path for $262.detachArrayBuffer visibility and buffer detachment propagation; do not keep interpreter-only movement."}}
{"type":"config","name":"Recheck Set built-ins compatibility after iterator fixes","metricName":"compatibility_failures","metricUnit":"","bestDirection":"lower"}
{"run":1691,"commit":"fcc84d4","metric":4,"metrics":{"compiler_test262_cases":300,"compiler_test262_pass":296,"compiler_test262_failures":4,"compiler_test262_compiler_errors":0,"compiler_test262_compiler_crashes":0,"compiler_test262_compiler_fails":0,"compiler_test262_both_fail":4,"compiler_test262_interpreter_fail_compiler_pass":0,"compatibility_pass":296,"compatibility_cases":300,"compiler_errors":0,"compiler_crashes":0,"compiler_fails":0,"both_fail":4,"interpreter_fail_compiler_pass":0,"elapsed_ms":13035},"status":"keep","description":"Baseline Set residual after iterator fixes","timestamp":1778860420273,"segment":168,"confidence":null,"iterationTokens":126,"asi":{"hypothesis":"Recheck the Set built-ins residual after Map/Set iterator prototype completion and ArrayIterator partial progress; previous residual was four set-like class-order tests tied to closure/iterator invocation state."}}
{"run":1692,"commit":"fcc84d4","metric":4,"metrics":{"compiler_test262_cases":300,"compiler_test262_pass":296,"compiler_test262_failures":4,"compiler_test262_compiler_errors":0,"compiler_test262_compiler_crashes":0,"compiler_test262_compiler_fails":0,"compiler_test262_both_fail":0,"compiler_test262_interpreter_fail_compiler_pass":0,"compatibility_pass":296,"compatibility_cases":300,"compiler_errors":0,"compiler_crashes":0,"compiler_fails":0,"both_fail":0,"interpreter_fail_compiler_pass":0,"elapsed_ms":69098},"status":"discard","description":"Reuse Set-like record across algebra methods","timestamp":1778860991334,"segment":168,"confidence":null,"iterationTokens":7105,"asi":{"hypothesis":"After Map/Set iterator marker fixes, reusing the validated Set-like record might avoid repeated size/has/key getter observations without previous iterator timeouts.","rollback_reason":"Primary metric stayed at 4 and runtime increased substantially; focused class-order cases still timed out around Set-like iterator collection.","next_action_hint":"Do not retry Set-like record reuse unchanged. The getter/iterator closure-state issue remains even after iterator prototype fixes; inspect closure invocation state before changing Set algebra again."}}
{"type":"config","name":"Improve Promise built-ins compatibility","metricName":"compatibility_failures","metricUnit":"","bestDirection":"lower"}
{"run":1693,"commit":"efa29d4","metric":148,"metrics":{"compiler_test262_cases":296,"compiler_test262_pass":148,"compiler_test262_failures":148,"compiler_test262_compiler_errors":0,"compiler_test262_compiler_crashes":0,"compiler_test262_compiler_fails":2,"compiler_test262_both_fail":136,"compiler_test262_interpreter_fail_compiler_pass":0,"compatibility_pass":148,"compatibility_cases":296,"compiler_errors":0,"compiler_crashes":0,"compiler_fails":2,"both_fail":136,"interpreter_fail_compiler_pass":0,"elapsed_ms":15953},"status":"keep","description":"Baseline Promise residual after iterator work","timestamp":1778861161756,"segment":169,"confidence":null,"iterationTokens":122,"asi":{"hypothesis":"Promise is the next medium-size residual after the iterator-prototype mini-phase and Set residual plateau; establish current baseline before looking for metadata/combinator clusters."}}
{"run":1694,"commit":"1924b05","metric":147,"metrics":{"compiler_test262_cases":296,"compiler_test262_pass":149,"compiler_test262_failures":147,"compiler_test262_compiler_errors":0,"compiler_test262_compiler_crashes":0,"compiler_test262_compiler_fails":2,"compiler_test262_both_fail":135,"compiler_test262_interpreter_fail_compiler_pass":0,"compatibility_pass":149,"compatibility_cases":296,"compiler_errors":0,"compiler_crashes":0,"compiler_fails":2,"both_fail":135,"interpreter_fail_compiler_pass":0,"elapsed_ms":14828},"status":"keep","description":"Normalize symbol element access for accessors","timestamp":1778861787587,"segment":169,"confidence":null,"iterationTokens":26218,"asi":{"hypothesis":"Element access through well-known symbols should normalize symbol keys and invoke builtin accessor getters with the correct receiver; this should restore Promise[Symbol.species] and may help other symbol metadata tests.","result":"Promise failures improved from 148 to 147; checks passed.","remaining":"Large Promise residual remains dominated by combinator capability/resolve/then semantics and constructor context crashes."}}
{"run":1695,"commit":"1924b05","metric":161,"metrics":{"compiler_test262_cases":296,"compiler_test262_pass":135,"compiler_test262_failures":161,"compiler_test262_compiler_errors":0,"compiler_test262_compiler_crashes":0,"compiler_test262_compiler_fails":2,"compiler_test262_both_fail":153,"compiler_test262_interpreter_fail_compiler_pass":0,"compatibility_pass":135,"compatibility_cases":296,"compiler_errors":0,"compiler_crashes":0,"compiler_fails":2,"both_fail":153,"interpreter_fail_compiler_pass":0,"elapsed_ms":14478},"status":"discard","description":"Route Promise combinators through this.resolve","timestamp":1778862200215,"segment":169,"confidence":1,"iterationTokens":8443,"asi":{"hypothesis":"Promise.all/allSettled should call the receiver constructor's resolve for each input, fixing invoke-resolve call-count clusters.","rollback_reason":"Primary metric regressed from 147 to 161 even though a focused invoke-resolve test passed; the simplistic resolve routing broke existing fulfilled/rejected combinator behavior and thenable timing assumptions.","next_action_hint":"Do not retry simple Promise combinator resolve routing unchanged. Implement proper NewPromiseCapability/PerformPromiseAll semantics with capability records and thenable jobs rather than replacing the current adoption path piecemeal."}}
{"type":"config","name":"Improve DataView built-ins compatibility","metricName":"compatibility_failures","metricUnit":"","bestDirection":"lower"}
{"run":1696,"commit":"ef25a2f","metric":427,"metrics":{"compiler_test262_cases":500,"compiler_test262_pass":73,"compiler_test262_failures":427,"compiler_test262_compiler_errors":0,"compiler_test262_compiler_crashes":0,"compiler_test262_compiler_fails":0,"compiler_test262_both_fail":418,"compiler_test262_interpreter_fail_compiler_pass":9,"compatibility_pass":73,"compatibility_cases":500,"compiler_errors":0,"compiler_crashes":0,"compiler_fails":0,"both_fail":418,"interpreter_fail_compiler_pass":9,"elapsed_ms":22091},"status":"keep","description":"Baseline DataView residual after Promise symbol fix","timestamp":1778862398664,"segment":170,"confidence":null,"iterationTokens":123,"asi":{"hypothesis":"DataView is the next broad high-failure slice after Promise proved to require deeper combinator semantics; establish baseline before looking for constructor/prototype metadata clusters."}}
{"run":1697,"commit":"c4d980a","metric":386,"metrics":{"compiler_test262_cases":500,"compiler_test262_pass":114,"compiler_test262_failures":386,"compiler_test262_compiler_errors":0,"compiler_test262_compiler_crashes":0,"compiler_test262_compiler_fails":0,"compiler_test262_both_fail":386,"compiler_test262_interpreter_fail_compiler_pass":0,"compatibility_pass":114,"compatibility_cases":500,"compiler_errors":0,"compiler_crashes":0,"compiler_fails":0,"both_fail":386,"interpreter_fail_compiler_pass":0,"elapsed_ms":20336},"status":"keep","description":"Install basic DataView constructor and accessors","timestamp":1778862738872,"segment":170,"confidence":null,"iterationTokens":17413,"asi":{"hypothesis":"DataView lacks a real constructor/prototype shape; installing buffer/byteOffset/byteLength internal fields and accessors plus metadata should clear constructor/accessor descriptor clusters.","result":"DataView failures improved from 427 to 386; checks passed.","remaining":"Most residual DataView failures are getter/setter numeric methods, SharedArrayBuffer support, detach host support, and resizable-buffer edge cases."}}
{"run":1698,"commit":"8bdf8b0","metric":342,"metrics":{"compiler_test262_cases":500,"compiler_test262_pass":158,"compiler_test262_failures":342,"compiler_test262_compiler_errors":0,"compiler_test262_compiler_crashes":0,"compiler_test262_compiler_fails":0,"compiler_test262_both_fail":342,"compiler_test262_interpreter_fail_compiler_pass":0,"compatibility_pass":158,"compatibility_cases":500,"compiler_errors":0,"compiler_crashes":0,"compiler_fails":0,"both_fail":342,"interpreter_fail_compiler_pass":0,"elapsed_ms":20319},"status":"keep","description":"Handle DataView detach accessors","timestamp":1778863064595,"segment":170,"confidence":2.073170731707317,"iterationTokens":4966,"asi":{"hypothesis":"DataView public buffer/byteOffset/byteLength should be prototype accessors over internal slots, with detached buffers checked by length/offset accessors and Test262 host detachment support installed.","result":"DataView failures improved from 386 to 342; checks passed.","remaining":"Residual DataView failures should now be mostly numeric get/set methods, SharedArrayBuffer absence, resizable ArrayBuffer cases, and detailed constructor/newTarget semantics."}}
{"run":1699,"commit":"4a3d809","metric":75,"metrics":{"compiler_test262_cases":500,"compiler_test262_pass":425,"compiler_test262_failures":75,"compiler_test262_compiler_errors":0,"compiler_test262_compiler_crashes":0,"compiler_test262_compiler_fails":0,"compiler_test262_both_fail":75,"compiler_test262_interpreter_fail_compiler_pass":0,"compatibility_pass":425,"compatibility_cases":500,"compiler_errors":0,"compiler_crashes":0,"compiler_fails":0,"both_fail":75,"interpreter_fail_compiler_pass":0,"elapsed_ms":21364},"status":"keep","description":"Implement DataView scalar methods","timestamp":1778863733357,"segment":170,"confidence":8.282352941176471,"iterationTokens":4966,"asi":{"hypothesis":"Installing real DataView numeric get/set prototype methods with endian-aware ArrayBuffer reads/writes and method metadata should clear the large not-a-function/descriptor clusters without special-casing tests.","result":"DataView failures improved from 342 to 75; checks passed.","remaining":"Residuals likely involve SharedArrayBuffer constructor availability, exact ToIndex/ToNumber abrupt ordering, resizable-buffer edge cases, immutable buffers, and realm/newTarget prototype selection."}}
{"run":1700,"commit":"d06246b","metric":44,"metrics":{"compiler_test262_cases":500,"compiler_test262_pass":456,"compiler_test262_failures":44,"compiler_test262_compiler_errors":0,"compiler_test262_compiler_crashes":0,"compiler_test262_compiler_fails":0,"compiler_test262_both_fail":44,"compiler_test262_interpreter_fail_compiler_pass":0,"compatibility_pass":456,"compatibility_cases":500,"compiler_errors":0,"compiler_crashes":0,"compiler_fails":0,"both_fail":44,"interpreter_fail_compiler_pass":0,"elapsed_ms":22495},"status":"keep","description":"Expose SharedArrayBuffer for DataView","timestamp":1778863974622,"segment":170,"confidence":4.5058823529411764,"iterationTokens":12340,"asi":{"hypothesis":"DataView only needs SharedArrayBuffer to behave like a non-detachable ArrayBuffer for the current slice, and DataView should reject typed-array objects despite their internal buffer slots.","result":"DataView failures improved from 75 to 44; checks passed.","remaining":"Residual failures now concentrate on setter conversion/range ordering, float16 rounding/NaN writes, immutable buffers, newTarget/realm prototype semantics, and a few resizable-buffer cases."}}
{"run":1701,"commit":"faddaf3","metric":8,"metrics":{"compiler_test262_cases":500,"compiler_test262_pass":492,"compiler_test262_failures":8,"compiler_test262_compiler_errors":0,"compiler_test262_compiler_crashes":0,"compiler_test262_compiler_fails":0,"compiler_test262_both_fail":8,"compiler_test262_interpreter_fail_compiler_pass":0,"compatibility_pass":492,"compatibility_cases":500,"compiler_errors":0,"compiler_crashes":0,"compiler_fails":0,"both_fail":8,"interpreter_fail_compiler_pass":0,"elapsed_ms":21550},"status":"keep","description":"Fix DataView setter conversion ordering","timestamp":1778864304932,"segment":170,"confidence":2.4502923976608186,"iterationTokens":11727,"asi":{"hypothesis":"DataView setters require a specific ordering: immutable buffer check first, then byteOffset and value conversion before detach/range checks; float setters should preserve NaN writes for missing/undefined values.","result":"DataView failures improved from 44 to 8; checks passed.","remaining":"Only constructor/newTarget/realm prototype and initial-buffer-length validation/resizable-buffer edge cases appear to remain in the 500-case slice."}}
{"run":1702,"commit":"675c110","metric":3,"metrics":{"compiler_test262_cases":500,"compiler_test262_pass":497,"compiler_test262_failures":3,"compiler_test262_compiler_errors":0,"compiler_test262_compiler_crashes":0,"compiler_test262_compiler_fails":0,"compiler_test262_both_fail":3,"compiler_test262_interpreter_fail_compiler_pass":0,"compatibility_pass":497,"compatibility_cases":500,"compiler_errors":0,"compiler_crashes":0,"compiler_fails":0,"both_fail":3,"interpreter_fail_compiler_pass":0,"elapsed_ms":21723},"status":"keep","description":"Refine DataView BigInt and float16 writes","timestamp":1778864849747,"segment":170,"confidence":5.888888888888889,"iterationTokens":19832,"asi":{"hypothesis":"Remaining scalar DataView failures are from BigInt conversion error classes and half-float rounding at carry/subnormal boundaries; aligning these should leave only constructor/newTarget/prototype-order issues.","result":"DataView failures improved from 8 to 3; checks passed.","remaining":"Residual failures are byteOffset initial-buffer-length validation and proto-from-ctor-realm for ArrayBuffer/SharedArrayBuffer DataView construction."}}
