{"run":1213,"commit":"223aa00","metric":4,"metrics":{"compiler_test262_cases":350,"compiler_test262_pass":346,"compiler_test262_failures":4,"compiler_test262_compiler_errors":0,"compiler_test262_compiler_crashes":0,"compiler_test262_compiler_fails":0,"compiler_test262_both_fail":4,"compiler_test262_interpreter_fail_compiler_pass":0,"compatibility_pass":346,"compatibility_cases":350,"compiler_errors":0,"compiler_crashes":0,"compiler_fails":0,"both_fail":4,"interpreter_fail_compiler_pass":0,"elapsed_ms":13383},"status":"discard","description":"Retry ToInteger indexOf positions","timestamp":1778679901280,"segment":57,"confidence":3.92,"iterationTokens":2205,"asi":{"hypothesis":"After fixing null ToPrimitive, indexOf position coercion with ToIntegerOrInfinity might reduce remaining position failures, including BigInt.","rollback_reason":"The focused BigInt case passed, but the bounded String workload stayed flat at 4 failures; another case replaced it or remained in the limited failure set.","next_action_hint":"Inspect the post-change failure log before retrying; the BigInt fix alone is insufficient for the primary metric."}}
{"run":1214,"commit":"4a8dd1b","metric":3,"metrics":{"compiler_test262_cases":350,"compiler_test262_pass":347,"compiler_test262_failures":3,"compiler_test262_compiler_errors":0,"compiler_test262_compiler_crashes":0,"compiler_test262_compiler_fails":0,"compiler_test262_both_fail":3,"compiler_test262_interpreter_fail_compiler_pass":0,"compatibility_pass":347,"compatibility_cases":350,"compiler_errors":0,"compiler_crashes":0,"compiler_fails":0,"both_fail":3,"interpreter_fail_compiler_pass":0,"elapsed_ms":13383},"status":"keep","description":"Coerce indexOf positions as integers","timestamp":1778680141186,"segment":57,"confidence":3.8461538461538463,"iterationTokens":4399,"asi":{"hypothesis":"String indexOf positions should use ToIntegerOrInfinity, preserving parsed infinities, throwing on BigInt, and clamping to UTF-16 string length before searching."}}
{"run":1215,"commit":"570b580","metric":2,"metrics":{"compiler_test262_cases":350,"compiler_test262_pass":348,"compiler_test262_failures":2,"compiler_test262_compiler_errors":0,"compiler_test262_compiler_crashes":0,"compiler_test262_compiler_fails":0,"compiler_test262_both_fail":2,"compiler_test262_interpreter_fail_compiler_pass":0,"compatibility_pass":348,"compatibility_cases":350,"compiler_errors":0,"compiler_crashes":0,"compiler_fails":0,"both_fail":2,"interpreter_fail_compiler_pass":0,"elapsed_ms":13473},"status":"keep","description":"Honor ToPrimitive method order","timestamp":1778680467011,"segment":57,"confidence":4.25,"iterationTokens":5661,"asi":{"hypothesis":"Ordinary ToPrimitive should use toString before valueOf for string hint, skip non-callable coercion methods, and keep valueOf-first order for numeric/default hints."}}
{"run":1216,"commit":"3a9f5b0","metric":1,"metrics":{"compiler_test262_cases":350,"compiler_test262_pass":349,"compiler_test262_failures":1,"compiler_test262_compiler_errors":0,"compiler_test262_compiler_crashes":0,"compiler_test262_compiler_fails":0,"compiler_test262_both_fail":1,"compiler_test262_interpreter_fail_compiler_pass":0,"compatibility_pass":349,"compatibility_cases":350,"compiler_errors":0,"compiler_crashes":0,"compiler_fails":0,"both_fail":1,"interpreter_fail_compiler_pass":0,"elapsed_ms":13509},"status":"keep","description":"Reject wrapped Symbol search strings","timestamp":1778680650858,"segment":57,"confidence":4.333333333333333,"iterationTokens":2182,"asi":{"hypothesis":"String search ToString should reject Symbol wrapper objects by unboxing their internal Symbol before ordinary string-hint method lookup can format them."}}
{"run":1217,"commit":"dcc27d7","metric":0,"metrics":{"compiler_test262_cases":350,"compiler_test262_pass":350,"compiler_test262_failures":0,"compiler_test262_compiler_errors":0,"compiler_test262_compiler_crashes":0,"compiler_test262_compiler_fails":0,"compiler_test262_both_fail":0,"compiler_test262_interpreter_fail_compiler_pass":0,"compatibility_pass":350,"compatibility_cases":350,"compiler_errors":0,"compiler_crashes":0,"compiler_fails":0,"both_fail":0,"interpreter_fail_compiler_pass":0,"elapsed_ms":13595},"status":"keep","description":"Treat NaN lastIndexOf positions as end","timestamp":1778680832615,"segment":57,"confidence":4.333333333333333,"iterationTokens":1721,"asi":{"hypothesis":"String.prototype.lastIndexOf position coercion should use its special ToNumber semantics where NaN and positive infinity search from the string length, while negative infinity clamps to zero."}}
{"type":"config","name":"String Test262 compatibility 400-case expansion","metricName":"compatibility_failures","metricUnit":"","bestDirection":"lower"}
{"run":1218,"commit":"dcc27d7","metric":0,"metrics":{},"status":"crash","description":"Baseline String 400-case expansion","timestamp":1778680883652,"segment":58,"confidence":null,"iterationTokens":124,"asi":{"hypothesis":"Expanding the now-clean String bounded workload from 350 to 400 cases might reveal additional compatibility failures after recent fixes.","rollback_reason":"The 400-case String workload still aborts with exit code 134 before metrics are emitted.","next_action_hint":"Do not use the 400-case workload as the active benchmark until the abort around later String cases is isolated; continue with a smaller expanded limit such as 375 or inspect the 400-case crash log."}}
{"type":"config","name":"String Test262 compatibility 375-case expansion","metricName":"compatibility_failures","metricUnit":"","bestDirection":"lower"}
{"run":1219,"commit":"91191f5","metric":2,"metrics":{"compiler_test262_cases":375,"compiler_test262_pass":373,"compiler_test262_failures":2,"compiler_test262_compiler_errors":0,"compiler_test262_compiler_crashes":0,"compiler_test262_compiler_fails":0,"compiler_test262_both_fail":2,"compiler_test262_interpreter_fail_compiler_pass":0,"compatibility_pass":373,"compatibility_cases":375,"compiler_errors":0,"compiler_crashes":0,"compiler_fails":0,"both_fail":2,"interpreter_fail_compiler_pass":0,"elapsed_ms":14667},"status":"keep","description":"Baseline String 375-case expansion","timestamp":1778681035264,"segment":59,"confidence":null,"iterationTokens":124,"asi":{"hypothesis":"A 375-case String workload is a stable expansion beyond the clean 350-case bounded workload and can expose the next remaining compatibility issues without hitting the 400-case abort."}}
{"run":1220,"commit":"0483512","metric":0,"metrics":{"compiler_test262_cases":375,"compiler_test262_pass":375,"compiler_test262_failures":0,"compiler_test262_compiler_errors":0,"compiler_test262_compiler_crashes":0,"compiler_test262_compiler_fails":0,"compiler_test262_both_fail":0,"compiler_test262_interpreter_fail_compiler_pass":0,"compatibility_pass":375,"compatibility_cases":375,"compiler_errors":0,"compiler_crashes":0,"compiler_fails":0,"both_fail":0,"interpreter_fail_compiler_pass":0,"elapsed_ms":14500},"status":"keep","description":"Normalize localeCompare strings","timestamp":1778681274246,"segment":59,"confidence":null,"iterationTokens":3602,"asi":{"hypothesis":"String.prototype.localeCompare should treat a missing argument as undefined and compare canonically equivalent Unicode strings as equal by using NFC normalization before fallback lexical comparison."}}
{"type":"config","name":"String Test262 compatibility 390-case expansion","metricName":"compatibility_failures","metricUnit":"","bestDirection":"lower"}
{"run":1221,"commit":"0483512","metric":0,"metrics":{},"status":"crash","description":"Baseline String 390-case expansion","timestamp":1778681318666,"segment":60,"confidence":null,"iterationTokens":124,"asi":{"hypothesis":"After localeCompare fixes, a 390-case String workload might be stable and reveal later failures before the known 400-case abort.","rollback_reason":"The 390-case String workload still aborts with exit code 134 before metrics are emitted.","next_action_hint":"Bisect the stable expansion limit between 375 and 390 or inspect the crash log; do not use 390 as the active workload yet."}}
{"type":"config","name":"String Test262 compatibility 382-case expansion","metricName":"compatibility_failures","metricUnit":"","bestDirection":"lower"}
{"run":1222,"commit":"8641dcd","metric":0,"metrics":{"compiler_test262_cases":382,"compiler_test262_pass":382,"compiler_test262_failures":0,"compiler_test262_compiler_errors":0,"compiler_test262_compiler_crashes":0,"compiler_test262_compiler_fails":0,"compiler_test262_both_fail":0,"compiler_test262_interpreter_fail_compiler_pass":0,"compatibility_pass":382,"compatibility_cases":382,"compiler_errors":0,"compiler_crashes":0,"compiler_fails":0,"both_fail":0,"interpreter_fail_compiler_pass":0,"elapsed_ms":14794},"status":"keep","description":"Baseline String 382-case expansion","timestamp":1778681469098,"segment":61,"confidence":null,"iterationTokens":124,"asi":{"hypothesis":"A 382-case String workload is a stable expansion beyond the clean 375-case workload and can serve as the next bounded baseline before the aborting 390-case range."}}
{"type":"config","name":"String Test262 compatibility 386-case expansion","metricName":"compatibility_failures","metricUnit":"","bestDirection":"lower"}
{"run":1223,"commit":"6734da6","metric":2,"metrics":{"compiler_test262_cases":386,"compiler_test262_pass":384,"compiler_test262_failures":2,"compiler_test262_compiler_errors":0,"compiler_test262_compiler_crashes":0,"compiler_test262_compiler_fails":0,"compiler_test262_both_fail":2,"compiler_test262_interpreter_fail_compiler_pass":0,"compatibility_pass":384,"compatibility_cases":386,"compiler_errors":0,"compiler_crashes":0,"compiler_fails":0,"both_fail":2,"interpreter_fail_compiler_pass":0,"elapsed_ms":15115},"status":"keep","description":"Baseline String 386-case expansion","timestamp":1778681619851,"segment":62,"confidence":null,"iterationTokens":124,"asi":{"hypothesis":"A 386-case String workload is still stable and reveals the next two failures after the clean 382-case prefix."}}
{"run":1224,"commit":"4a27014","metric":0,"metrics":{"compiler_test262_cases":386,"compiler_test262_pass":386,"compiler_test262_failures":0,"compiler_test262_compiler_errors":0,"compiler_test262_compiler_crashes":0,"compiler_test262_compiler_fails":0,"compiler_test262_both_fail":0,"compiler_test262_interpreter_fail_compiler_pass":0,"compatibility_pass":386,"compatibility_cases":386,"compiler_errors":0,"compiler_crashes":0,"compiler_fails":0,"both_fail":0,"interpreter_fail_compiler_pass":0,"elapsed_ms":14802},"status":"keep","description":"Coerce string match patterns","timestamp":1778681860932,"segment":62,"confidence":null,"iterationTokens":3580,"asi":{"hypothesis":"String.prototype.match with a non-RegExp argument should ToString-coerce the pattern, propagate coercion errors, and return a simple match array for literal string patterns without invoking the RegExp NIF for object-coerced literals."}}
{"type":"config","name":"String Test262 compatibility 388-case expansion","metricName":"compatibility_failures","metricUnit":"","bestDirection":"lower"}
{"run":1225,"commit":"4a33c1e","metric":0,"metrics":{"compiler_test262_cases":388,"compiler_test262_pass":388,"compiler_test262_failures":0,"compiler_test262_compiler_errors":0,"compiler_test262_compiler_crashes":0,"compiler_test262_compiler_fails":0,"compiler_test262_both_fail":0,"compiler_test262_interpreter_fail_compiler_pass":0,"compatibility_pass":388,"compatibility_cases":388,"compiler_errors":0,"compiler_crashes":0,"compiler_fails":0,"both_fail":0,"interpreter_fail_compiler_pass":0,"elapsed_ms":15229},"status":"keep","description":"Baseline String 388-case expansion","timestamp":1778682014958,"segment":63,"confidence":null,"iterationTokens":124,"asi":{"hypothesis":"A 388-case String workload is stable after match coercion fixes and remains clean before the known aborting 390-case range."}}
{"type":"config","name":"String Test262 compatibility 389-case expansion","metricName":"compatibility_failures","metricUnit":"","bestDirection":"lower"}
{"run":1226,"commit":"9abf8e3","metric":1,"metrics":{"compiler_test262_cases":389,"compiler_test262_pass":388,"compiler_test262_failures":1,"compiler_test262_compiler_errors":0,"compiler_test262_compiler_crashes":0,"compiler_test262_compiler_fails":0,"compiler_test262_both_fail":1,"compiler_test262_interpreter_fail_compiler_pass":0,"compatibility_pass":388,"compatibility_cases":389,"compiler_errors":0,"compiler_crashes":0,"compiler_fails":0,"both_fail":1,"interpreter_fail_compiler_pass":0,"elapsed_ms":15507},"status":"keep","description":"Baseline String 389-case expansion","timestamp":1778682161111,"segment":64,"confidence":null,"iterationTokens":124,"asi":{"hypothesis":"A 389-case String workload is stable and exposes the final failure immediately before the 390-case abort boundary."}}
{"run":1227,"commit":"ed2ab01","metric":0,"metrics":{"compiler_test262_cases":389,"compiler_test262_pass":389,"compiler_test262_failures":0,"compiler_test262_compiler_errors":0,"compiler_test262_compiler_crashes":0,"compiler_test262_compiler_fails":0,"compiler_test262_both_fail":0,"compiler_test262_interpreter_fail_compiler_pass":0,"compatibility_pass":389,"compatibility_cases":389,"compiler_errors":0,"compiler_crashes":0,"compiler_fails":0,"both_fail":0,"interpreter_fail_compiler_pass":0,"elapsed_ms":15104},"status":"keep","description":"Return constructed RegExp values","timestamp":1778682546309,"segment":64,"confidence":null,"iterationTokens":10575,"asi":{"hypothesis":"RegExp constructors should return the RegExp object-like value rather than the preallocated ordinary this object, and String.prototype.match should handle constructed literal RegExp sources without invoking the aborting native regexp path."}}
{"type":"config","name":"String Test262 compatibility 390-case expansion after RegExp construction","metricName":"compatibility_failures","metricUnit":"","bestDirection":"lower"}
{"run":1228,"commit":"fb10698","metric":0,"metrics":{"compiler_test262_cases":390,"compiler_test262_pass":390,"compiler_test262_failures":0,"compiler_test262_compiler_errors":0,"compiler_test262_compiler_crashes":0,"compiler_test262_compiler_fails":0,"compiler_test262_both_fail":0,"compiler_test262_interpreter_fail_compiler_pass":0,"compatibility_pass":390,"compatibility_cases":390,"compiler_errors":0,"compiler_crashes":0,"compiler_fails":0,"both_fail":0,"interpreter_fail_compiler_pass":0,"elapsed_ms":15214},"status":"keep","description":"Baseline String 390-case expansion","timestamp":1778682700641,"segment":65,"confidence":null,"iterationTokens":128,"asi":{"hypothesis":"After returning constructed RegExp values, the previously aborting 390-case String workload should be stable and clean."}}
{"type":"config","name":"String Test262 compatibility 400-case expansion after RegExp construction","metricName":"compatibility_failures","metricUnit":"","bestDirection":"lower"}
{"run":1229,"commit":"830fe7d","metric":9,"metrics":{"compiler_test262_cases":400,"compiler_test262_pass":391,"compiler_test262_failures":9,"compiler_test262_compiler_errors":0,"compiler_test262_compiler_crashes":0,"compiler_test262_compiler_fails":0,"compiler_test262_both_fail":8,"compiler_test262_interpreter_fail_compiler_pass":1,"compatibility_pass":391,"compatibility_cases":400,"compiler_errors":0,"compiler_crashes":0,"compiler_fails":0,"both_fail":8,"interpreter_fail_compiler_pass":1,"elapsed_ms":15515},"status":"keep","description":"Baseline String 400-case expansion","timestamp":1778682852058,"segment":66,"confidence":null,"iterationTokens":128,"asi":{"hypothesis":"After RegExp construction fixes, the 400-case String workload should no longer abort and can become the active expanded benchmark for later String failures."}}
{"run":1230,"commit":"37e3a60","metric":8,"metrics":{"compiler_test262_cases":400,"compiler_test262_pass":392,"compiler_test262_failures":8,"compiler_test262_compiler_errors":0,"compiler_test262_compiler_crashes":0,"compiler_test262_compiler_fails":0,"compiler_test262_both_fail":7,"compiler_test262_interpreter_fail_compiler_pass":1,"compatibility_pass":392,"compatibility_cases":400,"compiler_errors":0,"compiler_crashes":0,"compiler_fails":0,"both_fail":7,"interpreter_fail_compiler_pass":1,"elapsed_ms":15575},"status":"keep","description":"Return match result objects","timestamp":1778683085278,"segment":66,"confidence":null,"iterationTokens":3986,"asi":{"hypothesis":"String.prototype.match should return array-like RegExp result objects with index/input/groups metadata for non-global matches, including literal string patterns."}}
{"run":1231,"commit":"109f1f4","metric":0,"metrics":{"compiler_test262_cases":400,"compiler_test262_pass":400,"compiler_test262_failures":0,"compiler_test262_compiler_errors":0,"compiler_test262_compiler_crashes":0,"compiler_test262_compiler_fails":0,"compiler_test262_both_fail":0,"compiler_test262_interpreter_fail_compiler_pass":0,"compatibility_pass":400,"compatibility_cases":400,"compiler_errors":0,"compiler_crashes":0,"compiler_fails":0,"both_fail":0,"interpreter_fail_compiler_pass":0,"elapsed_ms":15478},"status":"keep","description":"Align empty RegExp match results","timestamp":1778683443656,"segment":66,"confidence":null,"iterationTokens":11799,"asi":{"hypothesis":"RegExp().exec and String.prototype.match with missing/undefined patterns should share the empty-pattern result shape, including length/index/input, and regex literals should route through the same match-result object path."}}
{"type":"config","name":"String Test262 compatibility 450-case expansion","metricName":"compatibility_failures","metricUnit":"","bestDirection":"lower"}
{"run":1232,"commit":"3d2629e","metric":16,"metrics":{"compiler_test262_cases":450,"compiler_test262_pass":434,"compiler_test262_failures":16,"compiler_test262_compiler_errors":0,"compiler_test262_compiler_crashes":0,"compiler_test262_compiler_fails":0,"compiler_test262_both_fail":15,"compiler_test262_interpreter_fail_compiler_pass":1,"compatibility_pass":434,"compatibility_cases":450,"compiler_errors":0,"compiler_crashes":0,"compiler_fails":0,"both_fail":15,"interpreter_fail_compiler_pass":1,"elapsed_ms":17243},"status":"keep","description":"Baseline String 450-case expansion","timestamp":1778683602701,"segment":67,"confidence":null,"iterationTokens":124,"asi":{"hypothesis":"After cleaning the 400-case String prefix, a 450-case bounded workload is stable and exposes the next match/search semantics clusters for continued compatibility work."}}
{"run":1233,"commit":"3d2629e","metric":17,"metrics":{"compiler_test262_cases":450,"compiler_test262_pass":433,"compiler_test262_failures":17,"compiler_test262_compiler_errors":0,"compiler_test262_compiler_crashes":0,"compiler_test262_compiler_fails":0,"compiler_test262_both_fail":16,"compiler_test262_interpreter_fail_compiler_pass":0,"compatibility_pass":433,"compatibility_cases":450,"compiler_errors":0,"compiler_crashes":0,"compiler_fails":0,"both_fail":16,"interpreter_fail_compiler_pass":0,"elapsed_ms":17176},"status":"discard","description":"Route custom match and matchAll methods","timestamp":1778684393157,"segment":67,"confidence":null,"iterationTokens":21044,"asi":{"hypothesis":"String.prototype.match/matchAll should dispatch custom Symbol.match and Symbol.matchAll methods and support RegExp flags overrides, reducing custom matcher failures.","rollback_reason":"Despite multiple focused match/matchAll cases passing, the 450-case workload regressed from 16 to 17 failures.","next_action_hint":"Inspect the regression log before retrying; likely the broad fallback through created RegExp @@match or matchAll result object shape changes regressed nearby match cases. Reapply in narrower pieces, e.g. custom Symbol.match only, or avoid changing default RegExp-created dispatch."}}
{"run":1234,"commit":"7902025","metric":9,"metrics":{"compiler_test262_cases":450,"compiler_test262_pass":441,"compiler_test262_failures":9,"compiler_test262_compiler_errors":0,"compiler_test262_compiler_crashes":0,"compiler_test262_compiler_fails":0,"compiler_test262_both_fail":8,"compiler_test262_interpreter_fail_compiler_pass":1,"compatibility_pass":441,"compatibility_cases":450,"compiler_errors":0,"compiler_crashes":0,"compiler_fails":0,"both_fail":8,"interpreter_fail_compiler_pass":1,"elapsed_ms":17814},"status":"keep","description":"Handle custom matchAll dispatch","timestamp":1778684883375,"segment":67,"confidence":7,"iterationTokens":9554,"asi":{"hypothesis":"Narrowly dispatch object-supplied Symbol.match/Symbol.matchAll methods, expose Symbol.matchAll, support literal matchAll result arrays for primitive patterns, and handle simple digit regex fallbacks without routing all RegExp defaults through custom dispatch."}}
{"run":1235,"commit":"b0d1a08","metric":7,"metrics":{"compiler_test262_cases":450,"compiler_test262_pass":443,"compiler_test262_failures":7,"compiler_test262_compiler_errors":0,"compiler_test262_compiler_crashes":0,"compiler_test262_compiler_fails":0,"compiler_test262_both_fail":6,"compiler_test262_interpreter_fail_compiler_pass":1,"compatibility_pass":443,"compatibility_cases":450,"compiler_errors":0,"compiler_crashes":0,"compiler_fails":0,"both_fail":6,"interpreter_fail_compiler_pass":1,"elapsed_ms":16967},"status":"keep","description":"Validate matchAll RegExp flags","timestamp":1778685222649,"segment":67,"confidence":2.25,"iterationTokens":5685,"asi":{"hypothesis":"RegExp tuples should participate in prototype checks and matchAll should reject non-global RegExp inputs, honor own flags overrides, and invoke a created RegExp's custom Symbol.matchAll for null/undefined/primitive patterns."}}
