{"run":1343,"commit":"e65dc05","metric":7,"metrics":{"compiler_test262_cases":1200,"compiler_test262_pass":1193,"compiler_test262_failures":7,"compiler_test262_compiler_errors":0,"compiler_test262_compiler_crashes":0,"compiler_test262_compiler_fails":2,"compiler_test262_both_fail":4,"compiler_test262_interpreter_fail_compiler_pass":0,"compatibility_pass":1193,"compatibility_cases":1200,"compiler_errors":0,"compiler_crashes":0,"compiler_fails":2,"both_fail":4,"interpreter_fail_compiler_pass":0,"elapsed_ms":52725},"status":"keep","description":"Apply generic includes and indexOf semantics","timestamp":1778717650008,"segment":100,"confidence":null,"iterationTokens":15940,"asi":{"hypothesis":"Array.prototype.includes and indexOf should use generic array-like semantics: nullish receiver rejection, LengthOfArrayLike/Get observability, ToIntegerOrInfinity fromIndex, hole-skipping only for indexOf, SameValueZero for includes, and primitive/builtin/callable receiver wrapping consistent with other array iteration methods.","fixed_focus":["Array/prototype/includes/no-arg.js","Array/prototype/includes/fromIndex-infinity.js","Array/prototype/includes/get-prop.js","Array/prototype/includes/length-boundaries.js","Array/prototype/includes/samevaluezero.js","Array/prototype/indexOf/15.4.4.14-1-10.js","Array/prototype/indexOf/15.4.4.14-1-7.js"],"tradeoff":"Primary improved 45 to 7, but compiler_fails increased from 0 to 2; inspect remaining log to ensure these are not broad compiler regressions before expanding further."}}
{"run":1344,"commit":"e65dc05","metric":7,"metrics":{"compiler_test262_cases":1200,"compiler_test262_pass":1193,"compiler_test262_failures":7,"compiler_test262_compiler_errors":0,"compiler_test262_compiler_crashes":0,"compiler_test262_compiler_fails":2,"compiler_test262_both_fail":5,"compiler_test262_interpreter_fail_compiler_pass":0,"compatibility_pass":1193,"compatibility_cases":1200,"compiler_errors":0,"compiler_crashes":0,"compiler_fails":2,"both_fail":5,"interpreter_fail_compiler_pass":0,"elapsed_ms":52698},"status":"discard","description":"Coerce undefined typed-array float writes","timestamp":1778717960263,"segment":100,"confidence":null,"iterationTokens":7681,"asi":{"hypothesis":"Avoid ArithmeticError when typed-array writes receive undefined during resizable-buffer includes cases by coercing float/integer writes before binary encoding.","rollback_reason":"Focused includes/resizable-buffer passed, but broad Array 1200 primary stayed unchanged at 7 and secondary both_fail worsened from 4 to 5; not worth keeping.","next_action_hint":"Keep typed-array write coercion in mind for crash hygiene, but pursue primary reduction first; inspect remaining compiler_fail cases and index/includes parity before retrying."}}
{"type":"config","name":"Array Test262 compatibility 1300-case expansion","metricName":"compatibility_failures","metricUnit":"","bestDirection":"lower"}
{"run":1345,"commit":"5117eda","metric":12,"metrics":{"compiler_test262_cases":1300,"compiler_test262_pass":1288,"compiler_test262_failures":12,"compiler_test262_compiler_errors":0,"compiler_test262_compiler_crashes":0,"compiler_test262_compiler_fails":2,"compiler_test262_both_fail":9,"compiler_test262_interpreter_fail_compiler_pass":0,"compatibility_pass":1288,"compatibility_cases":1300,"compiler_errors":0,"compiler_crashes":0,"compiler_fails":2,"both_fail":9,"interpreter_fail_compiler_pass":0,"elapsed_ms":55619},"status":"keep","description":"Baseline Array 1300-case expansion","timestamp":1778718189534,"segment":101,"confidence":null,"iterationTokens":127,"asi":{"hypothesis":"Expand Array workload from 1200 to 1300 cases after generic includes/indexOf reduced the 1200 slice to seven failures.","workload":"AUTORESEARCH_TEST262_CATEGORY=built-ins/Array TEST262_LIMIT=1300 TEST262_ERROR_LIMIT=850 ./autoresearch.sh","baseline_note":"Array 1300 baseline has 12 compatibility failures, including the existing includes compiler-only resizable-buffer cases and new join-related shared failures."}}
{"run":1346,"commit":"07fb520","metric":10,"metrics":{"compiler_test262_cases":1300,"compiler_test262_pass":1290,"compiler_test262_failures":10,"compiler_test262_compiler_errors":0,"compiler_test262_compiler_crashes":0,"compiler_test262_compiler_fails":2,"compiler_test262_both_fail":7,"compiler_test262_interpreter_fail_compiler_pass":0,"compatibility_pass":1290,"compatibility_cases":1300,"compiler_errors":0,"compiler_crashes":0,"compiler_fails":2,"both_fail":7,"interpreter_fail_compiler_pass":0,"elapsed_ms":55039},"status":"keep","description":"Align indexOf list equality semantics","timestamp":1778718481788,"segment":101,"confidence":null,"iterationTokens":9014,"asi":{"hypothesis":"Array.prototype.indexOf over dense internal list receivers should use JavaScript strict equality where +/-0 compare equal and NaN does not compare equal to itself; the previous Runtime.strict_equal?/2 path over-distinguished zeros and matched NaN.","fixed_focus":["Array/prototype/indexOf/15.4.4.14-9-10.js","Array/prototype/indexOf/15.4.4.14-9-2.js"],"remaining_index_failures":["Array/prototype/indexOf/15.4.4.14-9-4.js","Array/prototype/indexOf/15.4.4.14-9-9.js","Array/prototype/indexOf/15.4.4.14-3-22.js"]}}
{"run":1347,"commit":"c862327","metric":9,"metrics":{"compiler_test262_cases":1300,"compiler_test262_pass":1291,"compiler_test262_failures":9,"compiler_test262_compiler_errors":0,"compiler_test262_compiler_crashes":0,"compiler_test262_compiler_fails":2,"compiler_test262_both_fail":6,"compiler_test262_interpreter_fail_compiler_pass":0,"compatibility_pass":1291,"compatibility_cases":1300,"compiler_errors":0,"compiler_crashes":0,"compiler_fails":2,"both_fail":6,"interpreter_fail_compiler_pass":0,"elapsed_ms":54974},"status":"keep","description":"Read indexOf length without search argument","timestamp":1778718746107,"segment":101,"confidence":3,"iterationTokens":5424,"asi":{"hypothesis":"Array.prototype.indexOf with no searchElement argument should still perform ToObject and LengthOfArrayLike before searching for undefined, so abrupt length coercions are observable.","fixed_focus":"Array/prototype/indexOf/15.4.4.14-3-22.js","remaining_index_failures":["Array/prototype/indexOf/15.4.4.14-9-4.js","Array/prototype/indexOf/15.4.4.14-9-9.js"]}}
{"run":1348,"commit":"f966380","metric":8,"metrics":{"compiler_test262_cases":1300,"compiler_test262_pass":1292,"compiler_test262_failures":8,"compiler_test262_compiler_errors":0,"compiler_test262_compiler_crashes":0,"compiler_test262_compiler_fails":2,"compiler_test262_both_fail":5,"compiler_test262_interpreter_fail_compiler_pass":0,"compatibility_pass":1292,"compatibility_cases":1300,"compiler_errors":0,"compiler_crashes":0,"compiler_fails":2,"both_fail":5,"interpreter_fail_compiler_pass":0,"elapsed_ms":55164},"status":"keep","description":"Mark undefined Array constructor arguments present","timestamp":1778719183934,"segment":101,"confidence":4,"iterationTokens":15125,"asi":{"hypothesis":"Array constructor calls with multiple arguments create own data properties for every argument, including explicit undefined values; marking those indices present lets indexOf find explicit undefined without treating Array(length) holes as present.","fixed_focus":"Array/prototype/indexOf/15.4.4.14-9-4.js","remaining_index_failures":"Array/prototype/indexOf/15.4.4.14-9-9.js still needs sparse high-index presence/length handling."}}
{"run":1349,"commit":"f966380","metric":8,"metrics":{"compiler_test262_cases":1300,"compiler_test262_pass":1292,"compiler_test262_failures":8,"compiler_test262_compiler_errors":0,"compiler_test262_compiler_crashes":0,"compiler_test262_compiler_fails":2,"compiler_test262_both_fail":5,"compiler_test262_interpreter_fail_compiler_pass":0,"compatibility_pass":1292,"compatibility_cases":1300,"compiler_errors":0,"compiler_crashes":0,"compiler_fails":2,"both_fail":5,"interpreter_fail_compiler_pass":0,"elapsed_ms":55427},"status":"discard","description":"Probe sparse high-index indexOf presence","timestamp":1778719586587,"segment":101,"confidence":4,"iterationTokens":7574,"asi":{"hypothesis":"Make sparse high-index array properties visible to OwnProperty and scan sparse array props in indexOf to fix high-index sparse indexOf.","rollback_reason":"Primary stayed unchanged at 8 and focused indexOf/15.4.4.14-9-9.js still failed; the method path likely does not see the sparse side props in the way assumed.","next_action_hint":"Inspect Array method receiver representation and Heap array side-property access during indexOf before retrying sparse high-index fixes."}}
{"type":"config","name":"Array Test262 compatibility 1400-case expansion","metricName":"compatibility_failures","metricUnit":"","bestDirection":"lower"}
{"run":1350,"commit":"0946ef9","metric":25,"metrics":{"compiler_test262_cases":1400,"compiler_test262_pass":1375,"compiler_test262_failures":25,"compiler_test262_compiler_errors":0,"compiler_test262_compiler_crashes":0,"compiler_test262_compiler_fails":5,"compiler_test262_both_fail":18,"compiler_test262_interpreter_fail_compiler_pass":0,"compatibility_pass":1375,"compatibility_cases":1400,"compiler_errors":0,"compiler_crashes":0,"compiler_fails":5,"both_fail":18,"interpreter_fail_compiler_pass":0,"elapsed_ms":61144},"status":"keep","description":"Baseline Array 1400-case expansion","timestamp":1778719801043,"segment":102,"confidence":null,"iterationTokens":128,"asi":{"hypothesis":"Expand Array workload from 1300 to 1400 cases after reducing the 1300 slice to eight failures; new cases likely introduce Array iterator/key/join clusters.","workload":"AUTORESEARCH_TEST262_CATEGORY=built-ins/Array TEST262_LIMIT=1400 TEST262_ERROR_LIMIT=930 ./autoresearch.sh","baseline_note":"Array 1400 baseline has 25 compatibility failures, 1375 passes, five compiler-only semantic failures, no compiler errors/crashes."}}
{"run":1351,"commit":"03ec06d","metric":22,"metrics":{"compiler_test262_cases":1400,"compiler_test262_pass":1378,"compiler_test262_failures":22,"compiler_test262_compiler_errors":0,"compiler_test262_compiler_crashes":0,"compiler_test262_compiler_fails":5,"compiler_test262_both_fail":15,"compiler_test262_interpreter_fail_compiler_pass":0,"compatibility_pass":1378,"compatibility_cases":1400,"compiler_errors":0,"compiler_crashes":0,"compiler_fails":5,"both_fail":15,"interpreter_fail_compiler_pass":0,"elapsed_ms":60746},"status":"keep","description":"Apply generic lastIndexOf semantics","timestamp":1778720084602,"segment":102,"confidence":null,"iterationTokens":3676,"asi":{"hypothesis":"Array.prototype.lastIndexOf should share generic array-like semantics with indexOf: nullish receiver rejection, LengthOfArrayLike/Get/HasProperty, primitive/builtin receiver wrapping, fromIndex handling, and JavaScript strict equality for +/-0 and NaN.","fixed_focus":["Array/prototype/lastIndexOf/15.4.4.15-1-1.js","Array/prototype/lastIndexOf/15.4.4.15-1-10.js","Array/prototype/lastIndexOf/15.4.4.15-1-11.js"],"remaining_cluster":"Array 1400 still has join cluster plus typed-array/resizable-buffer residuals and sparse high-index indexOf."}}
{"run":1352,"commit":"9365011","metric":14,"metrics":{"compiler_test262_cases":1400,"compiler_test262_pass":1386,"compiler_test262_failures":14,"compiler_test262_compiler_errors":0,"compiler_test262_compiler_crashes":0,"compiler_test262_compiler_fails":5,"compiler_test262_both_fail":7,"compiler_test262_interpreter_fail_compiler_pass":0,"compatibility_pass":1386,"compatibility_cases":1400,"compiler_errors":0,"compiler_crashes":0,"compiler_fails":5,"both_fail":7,"interpreter_fail_compiler_pass":0,"elapsed_ms":60492},"status":"keep","description":"Apply generic Array join semantics","timestamp":1778720356100,"segment":102,"confidence":3.6666666666666665,"iterationTokens":4308,"asi":{"hypothesis":"Array.prototype.join should be generic: reject nullish receivers, use LengthOfArrayLike and indexed Get for array-like objects, default an undefined separator to comma, and stringify null/undefined elements as empty fields.","fixed_focus":["Array/prototype/join/S15.4.4.5_A1.2_T2.js","Array/prototype/join/S15.4.4.5_A2_T3.js","Array/prototype/join/S15.4.4.5_A2_T4.js"],"remaining_join_note":"S15.4.4.5_A2_T1 still exposes an ordinary-object length lookup/prototype issue unrelated to join iteration itself."}}
{"type":"config","name":"Array Test262 compatibility 1500-case expansion","metricName":"compatibility_failures","metricUnit":"","bestDirection":"lower"}
{"run":1353,"commit":"9093e7b","metric":16,"metrics":{"compiler_test262_cases":1500,"compiler_test262_pass":1484,"compiler_test262_failures":16,"compiler_test262_compiler_errors":0,"compiler_test262_compiler_crashes":0,"compiler_test262_compiler_fails":5,"compiler_test262_both_fail":9,"compiler_test262_interpreter_fail_compiler_pass":0,"compatibility_pass":1484,"compatibility_cases":1500,"compiler_errors":0,"compiler_crashes":0,"compiler_fails":5,"both_fail":9,"interpreter_fail_compiler_pass":0,"elapsed_ms":62954},"status":"keep","description":"Baseline Array 1500-case expansion","timestamp":1778720619170,"segment":103,"confidence":null,"iterationTokens":129,"asi":{"hypothesis":"Expand Array workload from 1400 to 1500 cases after reducing the 1400 slice to 14 failures; check whether new keys/lastIndexOf/map clusters appear.","workload":"AUTORESEARCH_TEST262_CATEGORY=built-ins/Array TEST262_LIMIT=1500 TEST262_ERROR_LIMIT=1000 ./autoresearch.sh","baseline_note":"Array 1500 baseline has 16 compatibility failures with the same five compiler-only semantic failures and no compiler errors/crashes."}}
{"type":"config","name":"Array Test262 compatibility 1600-case expansion","metricName":"compatibility_failures","metricUnit":"","bestDirection":"lower"}
{"run":1354,"commit":"66544bd","metric":26,"metrics":{"compiler_test262_cases":1600,"compiler_test262_pass":1574,"compiler_test262_failures":26,"compiler_test262_compiler_errors":0,"compiler_test262_compiler_crashes":0,"compiler_test262_compiler_fails":8,"compiler_test262_both_fail":16,"compiler_test262_interpreter_fail_compiler_pass":0,"compatibility_pass":1574,"compatibility_cases":1600,"compiler_errors":0,"compiler_crashes":0,"compiler_fails":8,"both_fail":16,"interpreter_fail_compiler_pass":0,"elapsed_ms":67875},"status":"keep","description":"Baseline Array 1600-case expansion","timestamp":1778720920318,"segment":104,"confidence":null,"iterationTokens":129,"asi":{"hypothesis":"Expand Array workload from 1500 to 1600 cases after generic join and lastIndexOf improvements; this likely enters more map/lastIndexOf/map iterator cases.","workload":"AUTORESEARCH_TEST262_CATEGORY=built-ins/Array TEST262_LIMIT=1600 TEST262_ERROR_LIMIT=1080 ./autoresearch.sh","baseline_note":"Array 1600 baseline has 26 compatibility failures, 1574 passes, eight compiler-only semantic failures, no compiler errors/crashes."}}
{"run":1355,"commit":"173db67","metric":23,"metrics":{"compiler_test262_cases":1600,"compiler_test262_pass":1577,"compiler_test262_failures":23,"compiler_test262_compiler_errors":0,"compiler_test262_compiler_crashes":0,"compiler_test262_compiler_fails":8,"compiler_test262_both_fail":13,"compiler_test262_interpreter_fail_compiler_pass":0,"compatibility_pass":1577,"compatibility_cases":1600,"compiler_errors":0,"compiler_crashes":0,"compiler_fails":8,"both_fail":13,"interpreter_fail_compiler_pass":0,"elapsed_ms":67990},"status":"keep","description":"Apply generic Array map semantics","timestamp":1778721209311,"segment":104,"confidence":null,"iterationTokens":3682,"asi":{"hypothesis":"Array.prototype.map should use generic array-like semantics: nullish rejection, LengthOfArrayLike/Get/HasProperty, callback validation/thisArg binding, and species-backed result creation with original length.","fixed_focus":["Array/prototype/map/15.4.4.19-1-1.js","Array/prototype/map/15.4.4.19-1-10.js","Array/prototype/map/15.4.4.19-1-11.js","Array/prototype/map/15.4.4.19-1-12.js"],"remaining_cluster":"Array 1600 reduced 26 to 23; map cluster likely has more callback/order/species cases in later slices."}}
{"run":1356,"commit":"173db67","metric":63,"metrics":{"compiler_test262_cases":1600,"compiler_test262_pass":1537,"compiler_test262_failures":63,"compiler_test262_compiler_errors":0,"compiler_test262_compiler_crashes":0,"compiler_test262_compiler_fails":8,"compiler_test262_both_fail":43,"compiler_test262_interpreter_fail_compiler_pass":0,"compatibility_pass":1537,"compatibility_cases":1600,"compiler_errors":0,"compiler_crashes":0,"compiler_fails":8,"both_fail":43,"interpreter_fail_compiler_pass":0,"elapsed_ms":65576},"status":"discard","description":"Route dense arrays through list indexOf paths","timestamp":1778721775758,"segment":104,"confidence":1,"iterationTokens":28938,"asi":{"hypothesis":"Dense array-backed object receivers for indexOf/lastIndexOf can reuse list equality semantics to see explicit undefined elements while preserving generic object paths for virtual-length arrays.","rollback_reason":"Focused explicit undefined indexOf/lastIndexOf cases passed, but broad Array 1600 regressed badly from 23 to 63 failures, so dense-array routing bypassed important generic side-property/prototype semantics.","next_action_hint":"Do not route all dense array objects through list paths. If revisiting, narrowly mark explicit undefined presence or fix HasProperty without bypassing generic object semantics."}}
{"run":1357,"commit":"a9c50db","metric":22,"metrics":{"compiler_test262_cases":1600,"compiler_test262_pass":1578,"compiler_test262_failures":22,"compiler_test262_compiler_errors":0,"compiler_test262_compiler_crashes":0,"compiler_test262_compiler_fails":8,"compiler_test262_both_fail":12,"compiler_test262_interpreter_fail_compiler_pass":0,"compatibility_pass":1578,"compatibility_cases":1600,"compiler_errors":0,"compiler_crashes":0,"compiler_fails":8,"both_fail":12,"interpreter_fail_compiler_pass":0,"elapsed_ms":67201},"status":"keep","description":"Mark Array.from undefined results present","timestamp":1778722060056,"segment":104,"confidence":2,"iterationTokens":6874,"asi":{"hypothesis":"Array.from array-like results should create present data properties even when indexed values are undefined, so downstream map sees those elements rather than holes.","fixed_focus":"Array/from/array-like-has-length-but-no-indexes-with-values.js","remaining_cluster":"Array 1600 reduced from 23 to 22; remaining failures are persistent typed-array/resizable-buffer, sparse high-index search, join length lookup, and prototype length descriptor cases."}}
{"run":1358,"commit":"a9c50db","metric":22,"metrics":{"compiler_test262_cases":1600,"compiler_test262_pass":1578,"compiler_test262_failures":22,"compiler_test262_compiler_errors":0,"compiler_test262_compiler_crashes":0,"compiler_test262_compiler_fails":8,"compiler_test262_both_fail":12,"compiler_test262_interpreter_fail_compiler_pass":0,"compatibility_pass":1578,"compatibility_cases":1600,"compiler_errors":0,"compiler_crashes":0,"compiler_fails":8,"both_fail":12,"interpreter_fail_compiler_pass":0,"elapsed_ms":68945},"status":"discard","description":"Synthesize Array prototype length descriptor","timestamp":1778722409311,"segment":104,"confidence":4,"iterationTokens":10053,"asi":{"hypothesis":"Array.prototype virtual length descriptor should report value 0 with writable true, enumerable false, configurable false.","rollback_reason":"Focused Array/prototype/length.js still failed after verifyWritable because descriptor configurability changed, and broad primary stayed unchanged at 22.","next_action_hint":"If revisiting Array.prototype.length, handle assignment/defineProperty descriptor state coherently rather than only synthesizing getOwnPropertyDescriptor."}}
{"type":"config","name":"Array Test262 compatibility 1700-case expansion","metricName":"compatibility_failures","metricUnit":"","bestDirection":"lower"}
{"run":1359,"commit":"6c714ce","metric":26,"metrics":{"compiler_test262_cases":1700,"compiler_test262_pass":1674,"compiler_test262_failures":26,"compiler_test262_compiler_errors":0,"compiler_test262_compiler_crashes":0,"compiler_test262_compiler_fails":8,"compiler_test262_both_fail":12,"compiler_test262_interpreter_fail_compiler_pass":0,"compatibility_pass":1674,"compatibility_cases":1700,"compiler_errors":0,"compiler_crashes":0,"compiler_fails":8,"both_fail":12,"interpreter_fail_compiler_pass":0,"elapsed_ms":121039},"status":"keep","description":"Baseline Array 1700-case expansion","timestamp":1778722669735,"segment":105,"confidence":null,"iterationTokens":129,"asi":{"hypothesis":"Expand Array workload from 1600 to 1700 cases after reducing the 1600 slice to 22 failures; next slice may expose additional map/order/property cases.","workload":"AUTORESEARCH_TEST262_CATEGORY=built-ins/Array TEST262_LIMIT=1700 TEST262_ERROR_LIMIT=1160 ./autoresearch.sh","baseline_note":"Array 1700 baseline has 26 compatibility failures, 1674 passes, eight compiler-only semantic failures, and no compiler errors/crashes."}}
