{"run":703,"commit":"349bacb","metric":21,"metrics":{"compiler_test262_cases":500,"compiler_test262_pass":479,"compiler_test262_failures":21,"compiler_test262_compiler_errors":0,"compiler_test262_compiler_crashes":0,"compiler_test262_compiler_fails":0,"compiler_test262_both_fail":20,"compiler_test262_interpreter_fail_compiler_pass":0,"compatibility_pass":479,"compatibility_cases":500,"compiler_errors":0,"compiler_crashes":0,"compiler_fails":0,"both_fail":20,"interpreter_fail_compiler_pass":0,"elapsed_ms":43690},"status":"discard","description":"Recognize BigInt wrappers in instanceof","timestamp":1778065800174,"segment":24,"confidence":4.6938775510204085,"iterationTokens":2326,"asi":{"hypothesis":"BigInt wrapper objects should satisfy instanceof BigInt through their internal wrapped-bigint marker before checking a missing prototype.","rollback_reason":"Primary metric stayed at 21; focused failure is likely valueOf/prototype method lookup or BigInt callable constructability, not only instanceof.","next_action_hint":"Inspect Object(0n).valueOf() and Object(0n) instanceof BigInt separately before changing instanceof again."}}
{"run":704,"commit":"349bacb","metric":0,"metrics":{"compiler_test262_cases":0,"compiler_test262_pass":0,"compiler_test262_failures":0,"compiler_test262_compiler_errors":0,"compiler_test262_compiler_crashes":0,"compiler_test262_compiler_fails":0,"compiler_test262_both_fail":0,"compiler_test262_interpreter_fail_compiler_pass":0,"compatibility_pass":0,"compatibility_cases":0,"compiler_errors":0,"compiler_crashes":0,"compiler_fails":0,"both_fail":0,"interpreter_fail_compiler_pass":0,"elapsed_ms":400},"status":"crash","description":"Forward wrapped BigInt prototype methods","timestamp":1778066012651,"segment":24,"confidence":4.6938775510204085,"iterationTokens":7501,"asi":{"hypothesis":"Wrapped BigInt objects should expose BigInt primitive methods such as valueOf through wrapped prototype property lookup.","rollback_reason":"Compile failed because wrapped_shape_proto_property/2 did not receive vals but attempted to read shape values.","next_action_hint":"Retry only map-wrapped BigInt method forwarding, or change wrapped_shape_proto_property arity carefully."}}
{"run":705,"commit":"349bacb","metric":21,"metrics":{"compiler_test262_cases":500,"compiler_test262_pass":479,"compiler_test262_failures":21,"compiler_test262_compiler_errors":0,"compiler_test262_compiler_crashes":0,"compiler_test262_compiler_fails":0,"compiler_test262_both_fail":20,"compiler_test262_interpreter_fail_compiler_pass":0,"compatibility_pass":479,"compatibility_cases":500,"compiler_errors":0,"compiler_crashes":0,"compiler_fails":0,"both_fail":20,"interpreter_fail_compiler_pass":0,"elapsed_ms":38017},"status":"discard","description":"Forward wrapped BigInt methods","timestamp":1778066208839,"segment":24,"confidence":5.75,"iterationTokens":991,"asi":{"hypothesis":"Map-backed wrapped BigInt objects should forward missing method reads like valueOf to the wrapped BigInt primitive.","rollback_reason":"Primary metric stayed at 21; valueOf alone does not satisfy the Object/bigint.js case, likely because instanceof still throws before valueOf assertion.","next_action_hint":"If retrying BigInt, combine safe marker-based instanceof with method forwarding and focused probes before full run."}}
{"run":706,"commit":"349bacb","metric":20,"metrics":{"compiler_test262_cases":500,"compiler_test262_pass":480,"compiler_test262_failures":20,"compiler_test262_compiler_errors":0,"compiler_test262_compiler_crashes":0,"compiler_test262_compiler_fails":0,"compiler_test262_both_fail":19,"compiler_test262_interpreter_fail_compiler_pass":0,"compatibility_pass":480,"compatibility_cases":500,"compiler_errors":0,"compiler_crashes":0,"compiler_fails":0,"both_fail":19,"interpreter_fail_compiler_pass":0,"elapsed_ms":36460},"status":"checks_failed","description":"Combine BigInt wrapper methods and instanceof","timestamp":1778066929011,"segment":24,"confidence":5.75,"iterationTokens":2597,"asi":{"hypothesis":"Combining marker-based BigInt instanceof with wrapped BigInt valueOf forwarding should fix Object(0n) semantics.","rollback_reason":"Primary metric improved from 21 to 20, but backpressure checks timed out during the default VM compiler Test262 phase; cannot keep without full checks.","next_action_hint":"Retry BigInt combination in isolation after reducing check timeout flakiness or running default vm compiler Test262 separately to verify it is not a semantic hang."}}
{"run":707,"commit":"0fdbe51","metric":20,"metrics":{"compiler_test262_cases":500,"compiler_test262_pass":480,"compiler_test262_failures":20,"compiler_test262_compiler_errors":0,"compiler_test262_compiler_crashes":0,"compiler_test262_compiler_fails":0,"compiler_test262_both_fail":19,"compiler_test262_interpreter_fail_compiler_pass":0,"compatibility_pass":480,"compatibility_cases":500,"compiler_errors":0,"compiler_crashes":0,"compiler_fails":0,"both_fail":19,"interpreter_fail_compiler_pass":0,"elapsed_ms":44352},"status":"keep","description":"Handle BigInt wrappers consistently","timestamp":1778067668805,"segment":24,"confidence":5.775,"iterationTokens":25039,"asi":{"hypothesis":"BigInt wrapper objects need both marker-based instanceof recognition and wrapped primitive method forwarding so Object(0n) behaves like a BigInt object.","improvement":"Fixed Object(0n) instanceof BigInt and Object(0n).valueOf() semantics, reducing bounded built-ins/Object failures from 21 to 20 with checks passing.","next_action_hint":"Remaining failures are Object.assign strict/target-array/metadata, Arguments toStringTag in create/defineProperties, and legacy Object metadata; prefer using the new Builtin metadata hooks for metadata work."}}
{"run":708,"commit":"3f933df","metric":19,"metrics":{"compiler_test262_cases":500,"compiler_test262_pass":481,"compiler_test262_failures":19,"compiler_test262_compiler_errors":0,"compiler_test262_compiler_crashes":0,"compiler_test262_compiler_fails":0,"compiler_test262_both_fail":18,"compiler_test262_interpreter_fail_compiler_pass":0,"compatibility_pass":481,"compatibility_cases":500,"compiler_errors":0,"compiler_crashes":0,"compiler_fails":0,"both_fail":18,"interpreter_fail_compiler_pass":0,"elapsed_ms":46302},"status":"keep","description":"Read builtin metadata through Builtin","timestamp":1778068087811,"segment":24,"confidence":6.105263157894737,"iterationTokens":7644,"asi":{"hypothesis":"Object static methods and the Object constructor should expose name/length/prototype metadata consistently through the new Builtin metadata helpers and descriptor/own-property paths.","improvement":"Fixed one remaining Object builtin metadata case, reducing bounded built-ins/Object failures from 20 to 19 with checks passing.","next_action_hint":"List remaining 19 failures; likely Object.assign strict writes/target-array, Arguments toStringTag, and Function.prototype/Object legacy metadata remain."}}
{"run":709,"commit":"4cabdc6","metric":16,"metrics":{"compiler_test262_cases":500,"compiler_test262_pass":484,"compiler_test262_failures":16,"compiler_test262_compiler_errors":0,"compiler_test262_compiler_crashes":0,"compiler_test262_compiler_fails":0,"compiler_test262_both_fail":15,"compiler_test262_interpreter_fail_compiler_pass":0,"compatibility_pass":484,"compatibility_cases":500,"compiler_errors":0,"compiler_crashes":0,"compiler_fails":0,"both_fail":15,"interpreter_fail_compiler_pass":0,"elapsed_ms":46449},"status":"keep","description":"Expose builtin length through length opcode","timestamp":1778068607266,"segment":24,"confidence":6.527777777777778,"iterationTokens":7004,"asi":{"hypothesis":"Bytecode property access for .length uses the dedicated length opcode, so builtin metadata must also feed ObjectModel.Get.length_of/1, not only ordinary get_own/2.","improvement":"Fixed Object.length/Object.create.length/Object.defineProperties.length and related metadata reads, reducing bounded built-ins/Object failures from 19 to 16 with checks passing.","next_action_hint":"Remaining failures are mostly Object.assign strict writes/target-array/constructability/descriptor ownership, Arguments toStringTag, and Function.prototype.isPrototypeOf(Object)."}}
{"run":710,"commit":"4cabdc6","metric":16,"metrics":{"compiler_test262_cases":500,"compiler_test262_pass":484,"compiler_test262_failures":16,"compiler_test262_compiler_errors":0,"compiler_test262_compiler_crashes":0,"compiler_test262_compiler_fails":0,"compiler_test262_both_fail":13,"compiler_test262_interpreter_fail_compiler_pass":2,"compatibility_pass":484,"compatibility_cases":500,"compiler_errors":0,"compiler_crashes":0,"compiler_fails":0,"both_fail":13,"interpreter_fail_compiler_pass":2,"elapsed_ms":38289},"status":"discard","description":"Tag arguments objects for toString","timestamp":1778068962673,"segment":24,"confidence":7.704918032786885,"iterationTokens":2415,"asi":{"hypothesis":"Arguments objects should be tagged so Object.prototype.toString.call(arguments) reports [object Arguments] in Object.create/defineProperties property-container getter receivers.","rollback_reason":"Primary metric stayed at 16 and introduced two interpreter-fail/compiler-pass skews; same broad arguments tagging problem as earlier.","next_action_hint":"Do not retry broad arguments tagging. A full arguments object model or focused interpreter/compiler identity alignment is needed."}}
{"run":711,"commit":"4cabdc6","metric":16,"metrics":{"compiler_test262_cases":500,"compiler_test262_pass":484,"compiler_test262_failures":16,"compiler_test262_compiler_errors":0,"compiler_test262_compiler_crashes":0,"compiler_test262_compiler_fails":0,"compiler_test262_both_fail":15,"compiler_test262_interpreter_fail_compiler_pass":0,"compatibility_pass":484,"compatibility_cases":500,"compiler_errors":0,"compiler_crashes":0,"compiler_fails":0,"both_fail":15,"interpreter_fail_compiler_pass":0,"elapsed_ms":39488},"status":"discard","description":"Reject nonconstructable named builtins","timestamp":1778069205171,"segment":24,"confidence":9.4,"iterationTokens":1468,"asi":{"hypothesis":"Builtin metadata constructable:false should make new Object.assign/new Object.create throw without using broad builtin allowlists.","rollback_reason":"Primary metric stayed at 16; Test262 isConstructor helpers likely use Reflect.construct newTarget semantics or another constructability path not covered by direct validate_constructor!/1.","next_action_hint":"If retrying constructability, inspect isConstructor harness and Reflect.construct target/newTarget flow with focused Object.assign/Object.create probes."}}
{"run":712,"commit":"d4a4548","metric":15,"metrics":{"compiler_test262_cases":500,"compiler_test262_pass":485,"compiler_test262_failures":15,"compiler_test262_compiler_errors":0,"compiler_test262_compiler_crashes":0,"compiler_test262_compiler_fails":0,"compiler_test262_both_fail":14,"compiler_test262_interpreter_fail_compiler_pass":0,"compatibility_pass":485,"compatibility_cases":500,"compiler_errors":0,"compiler_crashes":0,"compiler_fails":0,"both_fail":14,"interpreter_fail_compiler_pass":0,"elapsed_ms":40722},"status":"keep","description":"Treat builtins as Function prototype instances","timestamp":1778069821313,"segment":24,"confidence":8.90566037735849,"iterationTokens":6673,"asi":{"hypothesis":"Builtin constructor functions should appear in the Function.prototype prototype chain for Object.prototype.isPrototypeOf/Function.prototype.isPrototypeOf checks.","improvement":"Fixed Function.prototype.isPrototypeOf(Object), reducing bounded built-ins/Object failures from 16 to 15 with checks passing.","next_action_hint":"Remaining failures are Object.assign strict writes/target-array/constructability/metadata and Arguments toStringTag in create/defineProperties."}}
{"run":713,"commit":"d4a4548","metric":16,"metrics":{"compiler_test262_cases":500,"compiler_test262_pass":484,"compiler_test262_failures":16,"compiler_test262_compiler_errors":0,"compiler_test262_compiler_crashes":0,"compiler_test262_compiler_fails":0,"compiler_test262_both_fail":13,"compiler_test262_interpreter_fail_compiler_pass":0,"compatibility_pass":484,"compatibility_cases":500,"compiler_errors":0,"compiler_crashes":0,"compiler_fails":0,"both_fail":13,"interpreter_fail_compiler_pass":0,"elapsed_ms":40068},"status":"checks_failed","description":"Expose Object static own descriptors","timestamp":1778070807383,"segment":24,"confidence":8.428571428571429,"iterationTokens":7453,"asi":{"hypothesis":"Object static methods such as assign should be own properties of the Object constructor for hasOwnProperty and getOwnPropertyDescriptor.","rollback_reason":"Primary metric regressed from 15 to 16 and checks failed because the module referred to Object.static_property/1 instead of the current module's function.","next_action_hint":"Retry with __MODULE__.static_property/1 only if focused probes show descriptor metadata fixes without regressing constructability cases."}}
{"run":714,"commit":"d4a4548","metric":16,"metrics":{"compiler_test262_cases":500,"compiler_test262_pass":484,"compiler_test262_failures":16,"compiler_test262_compiler_errors":0,"compiler_test262_compiler_crashes":0,"compiler_test262_compiler_fails":0,"compiler_test262_both_fail":15,"compiler_test262_interpreter_fail_compiler_pass":0,"compatibility_pass":484,"compatibility_cases":500,"compiler_errors":0,"compiler_crashes":0,"compiler_fails":0,"both_fail":15,"interpreter_fail_compiler_pass":0,"elapsed_ms":43853},"status":"discard","description":"Expose Object static own descriptors via module","timestamp":1778071050984,"segment":24,"confidence":8.581818181818182,"iterationTokens":4528,"asi":{"hypothesis":"Using __MODULE__.static_property/1 should expose Object static method own descriptors without compile warnings.","rollback_reason":"Primary metric regressed from 15 to 16 even with checks passing; exposing Object statics this way perturbs another Object.assign metadata/constructability case more than it helps.","next_action_hint":"Do not retry raw Object static own-property exposure alone. Inspect propertyHelper expectations and constructability together before changing Object static descriptors."}}
{"run":715,"commit":"d4a4548","metric":15,"metrics":{"compiler_test262_cases":500,"compiler_test262_pass":485,"compiler_test262_failures":15,"compiler_test262_compiler_errors":0,"compiler_test262_compiler_crashes":0,"compiler_test262_compiler_fails":0,"compiler_test262_both_fail":14,"compiler_test262_interpreter_fail_compiler_pass":0,"compatibility_pass":485,"compatibility_cases":500,"compiler_errors":0,"compiler_crashes":0,"compiler_fails":0,"both_fail":14,"interpreter_fail_compiler_pass":0,"elapsed_ms":43721},"status":"discard","description":"Validate builtin constructability metadata","timestamp":1778071355536,"segment":24,"confidence":8.74074074074074,"iterationTokens":1929,"asi":{"hypothesis":"Validating constructable:false metadata for builtin target and newTarget should make isConstructor(Object.assign/Object.create) false without broad name allowlists.","rollback_reason":"Primary metric stayed at 15; constructability failures are not fixed by validate_constructor!/validate_new_target! alone, likely due Reflect.construct or harness path bypassing this metadata.","next_action_hint":"Inspect Test262 isConstructor harness execution and Reflect.construct helper path before retrying constructability."}}
{"run":716,"commit":"d4a4548","metric":15,"metrics":{"compiler_test262_cases":500,"compiler_test262_pass":485,"compiler_test262_failures":15,"compiler_test262_compiler_errors":0,"compiler_test262_compiler_crashes":0,"compiler_test262_compiler_fails":0,"compiler_test262_both_fail":14,"compiler_test262_interpreter_fail_compiler_pass":0,"compatibility_pass":485,"compatibility_cases":500,"compiler_errors":0,"compiler_crashes":0,"compiler_fails":0,"both_fail":14,"interpreter_fail_compiler_pass":0,"elapsed_ms":37531},"status":"discard","description":"Validate Reflect.construct builtin newTarget","timestamp":1778071958334,"segment":24,"confidence":8.90566037735849,"iterationTokens":7164,"asi":{"hypothesis":"Reflect.construct should reject builtin newTargets marked constructable:false by Builtin metadata, making isConstructor(Object.assign/Object.create) false.","rollback_reason":"Focused isConstructor(Object.assign) passed, but primary metric stayed at 15; the workload likely has paired direct-construction or descriptor failures offsetting/no measured improvement in first 500 cases.","next_action_hint":"Do not keep constructability-only Reflect.construct validation yet. Inspect Object.assign/not-a-constructor and invoked-as-ctor together with direct new path."}}
{"run":717,"commit":"d4a4548","metric":11,"metrics":{"compiler_test262_cases":500,"compiler_test262_pass":489,"compiler_test262_failures":11,"compiler_test262_compiler_errors":0,"compiler_test262_compiler_crashes":0,"compiler_test262_compiler_fails":0,"compiler_test262_both_fail":10,"compiler_test262_interpreter_fail_compiler_pass":0,"compatibility_pass":489,"compatibility_cases":500,"compiler_errors":0,"compiler_crashes":0,"compiler_fails":0,"both_fail":10,"interpreter_fail_compiler_pass":0,"elapsed_ms":37404},"status":"checks_failed","description":"Throw on Object.assign failed target writes","timestamp":1778072931571,"segment":24,"confidence":9.076923076923077,"iterationTokens":4235,"asi":{"hypothesis":"Object.assign should use strict assignment semantics and throw for non-writable own data properties or adding properties to non-extensible targets while still invoking accessor setters.","rollback_reason":"Primary metric improved from 15 to 11, but backpressure core compiler test expected Object.assign to ignore non-extensible target additions; behavior change needs test alignment or narrower semantics before keep.","next_action_hint":"Inspect test/vm/compiler_test.exs Object extensibility helper expectations and update only if Test262/ECMAScript semantics clearly require TypeError for Object.assign."}}
{"run":718,"commit":"8b93c53","metric":11,"metrics":{"compiler_test262_cases":500,"compiler_test262_pass":489,"compiler_test262_failures":11,"compiler_test262_compiler_errors":0,"compiler_test262_compiler_crashes":0,"compiler_test262_compiler_fails":0,"compiler_test262_both_fail":10,"compiler_test262_interpreter_fail_compiler_pass":0,"compatibility_pass":489,"compatibility_cases":500,"compiler_errors":0,"compiler_crashes":0,"compiler_fails":0,"both_fail":10,"interpreter_fail_compiler_pass":0,"elapsed_ms":37739},"status":"keep","description":"Throw on Object.assign failed target writes","timestamp":1778073356384,"segment":24,"confidence":10.212765957446809,"iterationTokens":6715,"asi":{"hypothesis":"Object.assign should use strict assignment semantics and throw for non-writable own data properties or adding properties to non-extensible targets while still invoking accessor setters.","improvement":"Aligned Object.assign with Test262 strict target-write semantics and updated the backpressure expectation, reducing bounded built-ins/Object failures from 15 to 11 with checks passing.","next_action_hint":"Remaining failures are Object.assign target-Array/metadata/constructability and Arguments toStringTag in Object.create/defineProperties."}}
{"run":719,"commit":"8b93c53","metric":11,"metrics":{"compiler_test262_cases":500,"compiler_test262_pass":489,"compiler_test262_failures":11,"compiler_test262_compiler_errors":0,"compiler_test262_compiler_crashes":0,"compiler_test262_compiler_fails":0,"compiler_test262_both_fail":10,"compiler_test262_interpreter_fail_compiler_pass":0,"compatibility_pass":489,"compatibility_cases":500,"compiler_errors":0,"compiler_crashes":0,"compiler_fails":0,"both_fail":10,"interpreter_fail_compiler_pass":0,"elapsed_ms":48028},"status":"discard","description":"Delete builtin metadata properties","timestamp":1778076957202,"segment":24,"confidence":10.909090909090908,"iterationTokens":9647,"asi":{"hypothesis":"propertyHelper delete/redefine checks need builtins to honor configurable name/length metadata deletion through ctor static tombstones.","rollback_reason":"Primary metric stayed at 11; Object.assign name/length propertyHelper failures need descriptor/defineProperty semantics, not only delete tombstones.","next_action_hint":"Inspect propertyHelper failure messages after focused probes; next metadata work should target defineProperty on builtin name/length descriptors."}}
{"run":720,"commit":"8b93c53","metric":11,"metrics":{"compiler_test262_cases":500,"compiler_test262_pass":489,"compiler_test262_failures":11,"compiler_test262_compiler_errors":0,"compiler_test262_compiler_crashes":0,"compiler_test262_compiler_fails":0,"compiler_test262_both_fail":10,"compiler_test262_interpreter_fail_compiler_pass":0,"compatibility_pass":489,"compatibility_cases":500,"compiler_errors":0,"compiler_crashes":0,"compiler_fails":0,"both_fail":10,"interpreter_fail_compiler_pass":0,"elapsed_ms":41230},"status":"discard","description":"Read redefined builtin name and length","timestamp":1778077448118,"segment":24,"confidence":10.909090909090908,"iterationTokens":7039,"asi":{"hypothesis":"Builtin name/length reads should consult ctor static overrides so Object.defineProperty(Object.assign,'name',...) affects later reads and propertyHelper redefinition checks.","rollback_reason":"Primary metric stayed at 11; focused name redefinition improved but length/descriptor attributes still do not satisfy remaining propertyHelper failures.","next_action_hint":"Do not keep partial name/length override read. Next metadata attempt should implement full defineStaticProperty descriptor flags for builtin length/name, especially writable/configurable changes."}}
