{"type":"config","name":"Optimize QuickBEAM built-ins/Set compatibility slice","metricName":"compatibility_failures","metricUnit":"","bestDirection":"lower"}
{"run":1512,"commit":"8729aa6","metric":4,"metrics":{"compiler_test262_cases":300,"compiler_test262_pass":296,"compiler_test262_failures":4,"compiler_test262_compiler_errors":0,"compiler_test262_compiler_crashes":0,"compiler_test262_compiler_fails":0,"compiler_test262_both_fail":4,"compiler_test262_interpreter_fail_compiler_pass":0,"compatibility_pass":296,"compatibility_cases":300,"compiler_errors":0,"compiler_crashes":0,"compiler_fails":0,"both_fail":4,"interpreter_fail_compiler_pass":0,"elapsed_ms":10951},"status":"keep","description":"Baseline Set 300-case slice after Function reprise","timestamp":1778816118909,"segment":134,"confidence":null,"iterationTokens":127,"asi":{"hypothesis":"Set retains a small bounded plateau after Array/Object/Reflect completion; establish fresh baseline before revisiting focused Set-like ordering behavior."}}
{"run":1513,"commit":"HEAD","metric":4,"metrics":{"compiler_test262_cases":300,"compiler_test262_pass":296,"compiler_test262_failures":4,"compiler_test262_compiler_errors":0,"compiler_test262_compiler_crashes":0,"compiler_test262_compiler_fails":0,"compiler_test262_both_fail":0,"compiler_test262_interpreter_fail_compiler_pass":0,"compatibility_pass":296,"compatibility_cases":300,"compiler_errors":0,"compiler_crashes":0,"compiler_fails":0,"both_fail":0,"interpreter_fail_compiler_pass":0,"elapsed_ms":66475},"status":"checks_failed","description":"Reuse Set-like method records for Set operations","timestamp":1778816244491,"segment":134,"confidence":null,"iterationTokens":8682,"asi":{"hypothesis":"Set-like methods should be retrieved once during validation and then reused to preserve observable getter order.","rollback_reason":"Checks failed due warnings-as-errors from an unused helper, and the primary metric remained at 4 failures even though failure classification changed.","next_action_hint":"If retrying Set ordering, remove unused helpers first and inspect the exact remaining failure mode; cached records alone are insufficient, likely iterator close/next-result handling remains wrong."}}
{"type":"config","name":"Optimize QuickBEAM built-ins/Math compatibility slice","metricName":"compatibility_failures","metricUnit":"","bestDirection":"lower"}
{"run":1514,"commit":"378fa37","metric":188,"metrics":{"compiler_test262_cases":327,"compiler_test262_pass":139,"compiler_test262_failures":188,"compiler_test262_compiler_errors":0,"compiler_test262_compiler_crashes":0,"compiler_test262_compiler_fails":0,"compiler_test262_both_fail":78,"compiler_test262_interpreter_fail_compiler_pass":0,"compatibility_pass":139,"compatibility_cases":327,"compiler_errors":0,"compiler_crashes":0,"compiler_fails":0,"both_fail":78,"interpreter_fail_compiler_pass":0,"elapsed_ms":15420},"status":"keep","description":"Baseline Math compatibility slice","timestamp":1778816418664,"segment":135,"confidence":null,"iterationTokens":127,"asi":{"hypothesis":"Math has a larger unoptimized built-ins surface and may contain broad semantic wins after small residual categories plateaued."}}
{"run":1515,"commit":"HEAD","metric":0,"metrics":{"compiler_test262_cases":0,"compiler_test262_pass":0,"compiler_test262_failures":0,"compiler_test262_compiler_errors":0,"compiler_test262_compiler_crashes":0,"compiler_test262_compiler_fails":0,"compiler_test262_both_fail":0,"compiler_test262_interpreter_fail_compiler_pass":0,"compatibility_pass":0,"compatibility_cases":0,"compiler_errors":0,"compiler_crashes":0,"compiler_fails":0,"both_fail":0,"interpreter_fail_compiler_pass":0,"elapsed_ms":0},"status":"crash","description":"Install Math metadata for descriptors and lengths","timestamp":1778816523699,"segment":135,"confidence":null,"iterationTokens":11651,"asi":{"hypothesis":"Math methods and constants need Reflect-like installer metadata for length, descriptor, prototype, and Symbol.toStringTag compatibility.","rollback_reason":"Compilation failed because Math installer referenced proto/0 without importing Heap.Keys.","next_action_hint":"Retry with `import QuickBEAM.VM.Heap.Keys, only: [proto: 0]` or fully qualify the prototype key before rerunning Math slice."}}
{"run":1516,"commit":"9e87aa1","metric":151,"metrics":{"compiler_test262_cases":327,"compiler_test262_pass":176,"compiler_test262_failures":151,"compiler_test262_compiler_errors":0,"compiler_test262_compiler_crashes":0,"compiler_test262_compiler_fails":0,"compiler_test262_both_fail":41,"compiler_test262_interpreter_fail_compiler_pass":0,"compatibility_pass":176,"compatibility_cases":327,"compiler_errors":0,"compiler_crashes":0,"compiler_fails":0,"both_fail":41,"interpreter_fail_compiler_pass":0,"elapsed_ms":16812},"status":"keep","description":"Install Math property metadata","timestamp":1778816687612,"segment":135,"confidence":null,"iterationTokens":2343,"asi":{"hypothesis":"Math built-in object should publish non-enumerable methods, read-only constants, method length metadata, prototype linkage, and Symbol.toStringTag like other intrinsic objects."}}
{"run":1517,"commit":"1f61d2a","metric":107,"metrics":{"compiler_test262_cases":327,"compiler_test262_pass":220,"compiler_test262_failures":107,"compiler_test262_compiler_errors":0,"compiler_test262_compiler_crashes":0,"compiler_test262_compiler_fails":0,"compiler_test262_both_fail":29,"compiler_test262_interpreter_fail_compiler_pass":0,"compatibility_pass":220,"compatibility_cases":327,"compiler_errors":0,"compiler_crashes":0,"compiler_fails":0,"both_fail":29,"interpreter_fail_compiler_pass":0,"elapsed_ms":17087},"status":"keep","description":"Tighten Math constants and constructor metadata","timestamp":1778816878648,"segment":135,"confidence":2.189189189189189,"iterationTokens":9456,"asi":{"hypothesis":"Math numeric constants are non-configurable read-only data properties, and Math function builtins must be marked non-constructable so `new Math.*` throws before invoking callbacks."}}
{"run":1518,"commit":"a9c95f4","metric":64,"metrics":{"compiler_test262_cases":327,"compiler_test262_pass":263,"compiler_test262_failures":64,"compiler_test262_compiler_errors":0,"compiler_test262_compiler_crashes":0,"compiler_test262_compiler_fails":0,"compiler_test262_both_fail":38,"compiler_test262_interpreter_fail_compiler_pass":0,"compatibility_pass":263,"compatibility_cases":327,"compiler_errors":0,"compiler_crashes":0,"compiler_fails":0,"both_fail":38,"interpreter_fail_compiler_pass":0,"elapsed_ms":17087},"status":"keep","description":"Handle Math infinities and invalid domains","timestamp":1778817110240,"segment":135,"confidence":3.0617283950617282,"iterationTokens":7942,"asi":{"hypothesis":"Math methods should explicitly map JavaScript NaN and infinities to ECMAScript results instead of passing atoms into Erlang :math functions and crashing."}}
{"run":1519,"commit":"HEAD","metric":51,"metrics":{"compiler_test262_cases":327,"compiler_test262_pass":276,"compiler_test262_failures":51,"compiler_test262_compiler_errors":0,"compiler_test262_compiler_crashes":0,"compiler_test262_compiler_fails":0,"compiler_test262_both_fail":33,"compiler_test262_interpreter_fail_compiler_pass":0,"compatibility_pass":276,"compatibility_cases":327,"compiler_errors":0,"compiler_crashes":0,"compiler_fails":0,"both_fail":33,"interpreter_fail_compiler_pass":0,"elapsed_ms":17119},"status":"checks_failed","description":"Improve Math extrema, hypot, trunc, and f16round","timestamp":1778817205567,"segment":135,"confidence":2.8181818181818183,"iterationTokens":4098,"asi":{"hypothesis":"Additional Math methods need ToNumber coercion and explicit special-value handling for extrema, hypot, trunc, and f16round.","rollback_reason":"Backpressure checks failed: a core JS compiler bitwise expression returned 2.0 instead of integer 2, likely from broad numeric coercion side effects or metadata name collision.","next_action_hint":"Retry narrower pieces separately; start with f16round or hypot only, and avoid changes that alter integer-vs-float behavior in shared paths."}}
{"run":1520,"commit":"90d351f","metric":60,"metrics":{"compiler_test262_cases":327,"compiler_test262_pass":267,"compiler_test262_failures":60,"compiler_test262_compiler_errors":0,"compiler_test262_compiler_crashes":0,"compiler_test262_compiler_fails":0,"compiler_test262_both_fail":34,"compiler_test262_interpreter_fail_compiler_pass":0,"compatibility_pass":267,"compatibility_cases":327,"compiler_errors":0,"compiler_crashes":0,"compiler_fails":0,"both_fail":34,"interpreter_fail_compiler_pass":0,"elapsed_ms":17144},"status":"keep","description":"Add Math.f16round builtin","timestamp":1778817373323,"segment":135,"confidence":4.266666666666667,"iterationTokens":2554,"asi":{"hypothesis":"A basic Math.f16round entry with metadata closes the absence/descriptor/name/constructor failures without touching shared numeric paths."}}
{"run":1521,"commit":"cc4a377","metric":55,"metrics":{"compiler_test262_cases":327,"compiler_test262_pass":272,"compiler_test262_failures":55,"compiler_test262_compiler_errors":0,"compiler_test262_compiler_crashes":0,"compiler_test262_compiler_fails":0,"compiler_test262_both_fail":34,"compiler_test262_interpreter_fail_compiler_pass":0,"compatibility_pass":272,"compatibility_cases":327,"compiler_errors":0,"compiler_crashes":0,"compiler_fails":0,"both_fail":34,"interpreter_fail_compiler_pass":0,"elapsed_ms":17713},"status":"keep","description":"Handle Math.hypot special values","timestamp":1778817526626,"segment":135,"confidence":10.23076923076923,"iterationTokens":1248,"asi":{"hypothesis":"Math.hypot should return infinity when any argument is infinite and NaN when any finite argument is NaN, avoiding atom crashes in exponentiation."}}
{"run":1522,"commit":"53662ff","metric":52,"metrics":{"compiler_test262_cases":327,"compiler_test262_pass":275,"compiler_test262_failures":52,"compiler_test262_compiler_errors":0,"compiler_test262_compiler_crashes":0,"compiler_test262_compiler_fails":0,"compiler_test262_both_fail":35,"compiler_test262_interpreter_fail_compiler_pass":0,"compatibility_pass":275,"compatibility_cases":327,"compiler_errors":0,"compiler_crashes":0,"compiler_fails":0,"both_fail":35,"interpreter_fail_compiler_pass":0,"elapsed_ms":17806},"status":"keep","description":"Handle more Math special values","timestamp":1778817760093,"segment":135,"confidence":12.952380952380953,"iterationTokens":25868,"asi":{"hypothesis":"Math.trunc, Math.log1p, and Math.acosh need the same atom-based NaN/infinity handling as the other Math functions to avoid interpreter crashes and return ECMAScript sentinel values."}}
{"run":1523,"commit":"deac009","metric":51,"metrics":{"compiler_test262_cases":327,"compiler_test262_pass":276,"compiler_test262_failures":51,"compiler_test262_compiler_errors":0,"compiler_test262_compiler_crashes":0,"compiler_test262_compiler_fails":0,"compiler_test262_both_fail":38,"compiler_test262_interpreter_fail_compiler_pass":0,"compatibility_pass":276,"compatibility_cases":327,"compiler_errors":0,"compiler_crashes":0,"compiler_fails":0,"both_fail":38,"interpreter_fail_compiler_pass":0,"elapsed_ms":17151},"status":"keep","description":"Handle floating zero Math logs","timestamp":1778817926705,"segment":135,"confidence":15.222222222222221,"iterationTokens":3983,"asi":{"hypothesis":"Math.log/log1p/log2/log10 zero handling must treat both integer and float zero as the ECMAScript negative-infinity logarithm boundary instead of only matching the integer literal 0."}}
{"run":1524,"commit":"HEAD","metric":44,"metrics":{"compiler_test262_cases":327,"compiler_test262_pass":283,"compiler_test262_failures":44,"compiler_test262_compiler_errors":0,"compiler_test262_compiler_crashes":0,"compiler_test262_compiler_fails":0,"compiler_test262_both_fail":31,"compiler_test262_interpreter_fail_compiler_pass":0,"compatibility_pass":283,"compatibility_cases":327,"compiler_errors":0,"compiler_crashes":0,"compiler_fails":0,"both_fail":31,"interpreter_fail_compiler_pass":0,"elapsed_ms":17083},"status":"checks_failed","description":"Coerce Math min and max arguments","timestamp":1778818018772,"segment":135,"confidence":21.076923076923077,"iterationTokens":4247,"asi":{"hypothesis":"Math.min and Math.max should ToNumber-coerce every argument in order and preserve NaN/infinity/zero edge cases rather than comparing raw VM values.","rollback_reason":"Checks failed under warnings-as-errors because matching on literal 0.0 emits an OTP 27 warning; implementation needs a guard-only zero check.","next_action_hint":"Retry the same semantic change without a 0.0 pattern, e.g. bind value and use `when value == 0 and acc == 0` plus negative-zero predicates."}}
{"run":1525,"commit":"f58ea80","metric":43,"metrics":{"compiler_test262_cases":327,"compiler_test262_pass":284,"compiler_test262_failures":43,"compiler_test262_compiler_errors":0,"compiler_test262_compiler_crashes":0,"compiler_test262_compiler_fails":0,"compiler_test262_both_fail":30,"compiler_test262_interpreter_fail_compiler_pass":0,"compatibility_pass":284,"compatibility_cases":327,"compiler_errors":0,"compiler_crashes":0,"compiler_fails":0,"both_fail":30,"interpreter_fail_compiler_pass":0,"elapsed_ms":16968},"status":"keep","description":"Coerce Math min and max arguments","timestamp":1778818178404,"segment":135,"confidence":16.11111111111111,"iterationTokens":1921,"asi":{"hypothesis":"Math.min and Math.max should ToNumber-coerce every argument in order and preserve NaN/infinity/zero edge cases rather than comparing raw VM values."}}
{"run":1526,"commit":"a6a01a4","metric":32,"metrics":{"compiler_test262_cases":327,"compiler_test262_pass":295,"compiler_test262_failures":32,"compiler_test262_compiler_errors":0,"compiler_test262_compiler_crashes":0,"compiler_test262_compiler_fails":0,"compiler_test262_both_fail":19,"compiler_test262_interpreter_fail_compiler_pass":0,"compatibility_pass":295,"compatibility_cases":327,"compiler_errors":0,"compiler_crashes":0,"compiler_fails":0,"both_fail":19,"interpreter_fail_compiler_pass":0,"elapsed_ms":17073},"status":"keep","description":"Preserve Math zero boundaries","timestamp":1778818385933,"segment":135,"confidence":15.6,"iterationTokens":4751,"asi":{"hypothesis":"Math floor/ceil/trunc/log/log1p/log2/log10 should use ToNumber and preserve ECMAScript signed-zero boundary cases instead of collapsing undefined to 0 or negative zero to positive zero."}}
{"run":1527,"commit":"312dd5d","metric":27,"metrics":{"compiler_test262_cases":327,"compiler_test262_pass":300,"compiler_test262_failures":27,"compiler_test262_compiler_errors":0,"compiler_test262_compiler_crashes":0,"compiler_test262_compiler_fails":0,"compiler_test262_both_fail":14,"compiler_test262_interpreter_fail_compiler_pass":0,"compatibility_pass":300,"compatibility_cases":327,"compiler_errors":0,"compiler_crashes":0,"compiler_fails":0,"both_fail":14,"interpreter_fail_compiler_pass":0,"elapsed_ms":17004},"status":"keep","description":"Preserve Math signed zero results","timestamp":1778818568152,"segment":135,"confidence":17.88888888888889,"iterationTokens":4688,"asi":{"hypothesis":"Math.round, Math.sign, Math.cbrt, and Math.expm1 have observable signed-zero behavior and should ToNumber-coerce inputs before preserving or producing -0/+0 results."}}
{"run":1528,"commit":"HEAD","metric":23,"metrics":{"compiler_test262_cases":327,"compiler_test262_pass":304,"compiler_test262_failures":23,"compiler_test262_compiler_errors":0,"compiler_test262_compiler_crashes":0,"compiler_test262_compiler_fails":0,"compiler_test262_both_fail":10,"compiler_test262_interpreter_fail_compiler_pass":0,"compatibility_pass":304,"compatibility_cases":327,"compiler_errors":0,"compiler_crashes":0,"compiler_fails":0,"both_fail":10,"interpreter_fail_compiler_pass":0,"elapsed_ms":17148},"status":"checks_failed","description":"Add Math builtin lengths and atan2 signed zero","timestamp":1778818667676,"segment":135,"confidence":15.333333333333334,"iterationTokens":4895,"asi":{"hypothesis":"Remaining Math.max/min length tests need named metadata lengths, and Math.atan2 must preserve negative-zero results for signed zero and positive-infinity x cases.","rollback_reason":"Checks failed because inserting a private helper between grouped `named_meta/1` clauses caused an Elixir grouped-clause warning under warnings-as-errors.","next_action_hint":"Retry by keeping all `def named_meta/1` clauses contiguous, e.g. place `math_method_length/1` after the final `named_meta/1` clause or use a module attribute map."}}
{"run":1529,"commit":"b0e2ae7","metric":23,"metrics":{"compiler_test262_cases":327,"compiler_test262_pass":304,"compiler_test262_failures":23,"compiler_test262_compiler_errors":0,"compiler_test262_compiler_crashes":0,"compiler_test262_compiler_fails":0,"compiler_test262_both_fail":10,"compiler_test262_interpreter_fail_compiler_pass":0,"compatibility_pass":304,"compatibility_cases":327,"compiler_errors":0,"compiler_crashes":0,"compiler_fails":0,"both_fail":10,"interpreter_fail_compiler_pass":0,"elapsed_ms":17063},"status":"keep","description":"Add Math builtin lengths and atan2 signed zero","timestamp":1778818831434,"segment":135,"confidence":12.692307692307692,"iterationTokens":1945,"asi":{"hypothesis":"Remaining Math.max/min length tests need named metadata lengths, and Math.atan2 must preserve negative-zero results for signed zero and positive-infinity x cases."}}
{"run":1530,"commit":"484b0d9","metric":16,"metrics":{"compiler_test262_cases":327,"compiler_test262_pass":311,"compiler_test262_failures":16,"compiler_test262_compiler_errors":0,"compiler_test262_compiler_crashes":0,"compiler_test262_compiler_fails":0,"compiler_test262_both_fail":5,"compiler_test262_interpreter_fail_compiler_pass":0,"compatibility_pass":311,"compatibility_cases":327,"compiler_errors":0,"compiler_crashes":0,"compiler_fails":0,"both_fail":5,"interpreter_fail_compiler_pass":0,"elapsed_ms":17107},"status":"keep","description":"Handle Math.pow infinity and zero cases","timestamp":1778819027991,"segment":135,"confidence":10.75,"iterationTokens":5305,"asi":{"hypothesis":"Math.pow needs ECMAScript-specific handling for zero exponents, signed zero bases, and positive/negative infinity bases before delegating to Erlang pow."}}
{"run":1531,"commit":"00764cc","metric":8,"metrics":{"compiler_test262_cases":327,"compiler_test262_pass":319,"compiler_test262_failures":8,"compiler_test262_compiler_errors":0,"compiler_test262_compiler_crashes":0,"compiler_test262_compiler_fails":0,"compiler_test262_both_fail":5,"compiler_test262_interpreter_fail_compiler_pass":0,"compatibility_pass":319,"compatibility_cases":327,"compiler_errors":0,"compiler_crashes":0,"compiler_fails":0,"both_fail":5,"interpreter_fail_compiler_pass":0,"elapsed_ms":16960},"status":"keep","description":"Handle Math.pow infinite exponents","timestamp":1778819217569,"segment":135,"confidence":9.473684210526315,"iterationTokens":3143,"asi":{"hypothesis":"Math.pow should handle positive/negative infinite exponents before generic exponentiation, including |base| greater than, less than, or equal to 1 and infinite bases."}}
{"run":1532,"commit":"HEAD","metric":8,"metrics":{"compiler_test262_cases":327,"compiler_test262_pass":319,"compiler_test262_failures":8,"compiler_test262_compiler_errors":0,"compiler_test262_compiler_crashes":0,"compiler_test262_compiler_fails":0,"compiler_test262_both_fail":5,"compiler_test262_interpreter_fail_compiler_pass":0,"compatibility_pass":319,"compatibility_cases":327,"compiler_errors":0,"compiler_crashes":0,"compiler_fails":0,"both_fail":5,"interpreter_fail_compiler_pass":0,"elapsed_ms":17100},"status":"discard","description":"Use floor half-up Math.round","timestamp":1778819388991,"segment":135,"confidence":9.72972972972973,"iterationTokens":1832,"asi":{"hypothesis":"Math.round should use the ECMAScript floor(x + 0.5) rule outside the negative-zero interval rather than Erlang round's half-away behavior.","rollback_reason":"Stable Math metric stayed flat at 8 despite fixing the focused A6 failure, likely exposing another round edge or not affecting the bounded aggregate.","next_action_hint":"If revisiting Math.round, inspect all round residuals/focused failures together and add targeted assertions before rerunning; do not keep flat changes."}}
{"run":1533,"commit":"7bae8e7","metric":5,"metrics":{"compiler_test262_cases":327,"compiler_test262_pass":322,"compiler_test262_failures":5,"compiler_test262_compiler_errors":0,"compiler_test262_compiler_crashes":0,"compiler_test262_compiler_fails":0,"compiler_test262_both_fail":4,"compiler_test262_interpreter_fail_compiler_pass":0,"compatibility_pass":322,"compatibility_cases":327,"compiler_errors":0,"compiler_crashes":0,"compiler_fails":0,"both_fail":4,"interpreter_fail_compiler_pass":0,"elapsed_ms":17038},"status":"keep","description":"Handle Math.sumPrecise special values","timestamp":1778819581709,"segment":135,"confidence":9.15,"iterationTokens":5549,"asi":{"hypothesis":"Math.sumPrecise should reject non-number elements and handle NaN, infinities, and all-negative-zero inputs before finite compensated summation."}}
