{"run":151,"commit":"2c6555c","metric":289,"metrics":{"parser_tests":158,"parser_test_ms":300},"status":"keep","description":"Port numeric separator diagnostics","timestamp":1777213392222,"segment":0,"confidence":4.147058823529412,"iterationTokens":3509,"asi":{"hypothesis":"Numeric separator diagnostics should reject repeated, trailing, and prefix-adjacent separators in QuickJS-compatible numeric literals.","learned":"Validation already rejected repeated and trailing separators; added prefix-adjacent separator checks for binary/octal/hex numeric prefixes.","quickjs_cases":"Adds QuickJS-compatible numeric separator diagnostics for `1__0`, `1_`, `0x_F`, and `0b_1`."}}
{"run":152,"commit":"ecc1348","metric":291,"metrics":{"parser_tests":159,"parser_test_ms":400},"status":"keep","description":"Port bigint separator diagnostics","timestamp":1777213443497,"segment":0,"confidence":4.115942028985507,"iterationTokens":1026,"asi":{"hypothesis":"BigInt literals should share numeric separator validation for repeated and prefix-adjacent separators.","learned":"No implementation change was required after prefix-adjacent separator validation; BigInt raw literals include the suffix but still match repeated and prefixed separator diagnostics.","quickjs_cases":"Adds QuickJS-compatible BigInt separator diagnostics for `1__0n`, `0x_Fn`, and `0b_1n`."}}
{"run":153,"commit":"ecc1348","metric":291,"metrics":{"parser_tests":159,"parser_test_ms":300},"status":"discard","description":"Extend bigint separator diagnostics in same case","timestamp":1777213525553,"segment":0,"confidence":4.115942028985507,"iterationTokens":1402,"asi":{"hypothesis":"Trailing numeric separators before a BigInt `n` suffix should be diagnosed like trailing separators on normal numeric literals.","rollback_reason":"The focused benchmark metric did not increase because this added an assertion to an existing QuickJS-port test module; preserve metric integrity by reverting and reintroducing as a separate focused case if still useful.","next_action_hint":"Add a distinct focused QuickJS-port test file for trailing BigInt separator diagnostics and keep it only if it increases coverage while checks pass.","learned":"Using a suffix-trimmed raw literal for separator edge checks fixes `1_n`; avoid bundling it into an existing counted case during autoresearch."}}
{"run":154,"commit":"d425438","metric":293,"metrics":{"parser_tests":160,"parser_test_ms":400},"status":"keep","description":"Port bigint trailing separator diagnostics","timestamp":1777213592771,"segment":0,"confidence":4.085714285714285,"iterationTokens":1474,"asi":{"hypothesis":"A numeric separator immediately before the BigInt `n` suffix should be rejected as a trailing separator.","learned":"Separator validation now checks a suffix-trimmed literal so `1_n` is diagnosed while preserving the raw BigInt literal token for valid cases.","quickjs_cases":"Adds a focused QuickJS-compatible diagnostic case for `value = 1_n`."}}
{"run":155,"commit":"b896844","metric":295,"metrics":{"parser_tests":161,"parser_test_ms":300},"status":"keep","description":"Port invalid exponent diagnostics","timestamp":1777213665340,"segment":0,"confidence":4.056338028169014,"iterationTokens":2350,"asi":{"hypothesis":"Decimal numeric literals with missing exponent digits or separator immediately after exponent markers should be diagnosed.","learned":"Numeric validation now rejects decimal literals whose normalized raw text has `e`/`E` followed by an optional sign and then end-of-token or `_`.","quickjs_cases":"Adds QuickJS-compatible numeric diagnostics for `1e`, `1e+`, `1e-`, and `1e_1`."}}
{"run":156,"commit":"b896844","metric":297,"metrics":{"parser_tests":162,"parser_test_ms":400},"status":"checks_failed","description":"Port exponent separator coverage","timestamp":1777213720522,"segment":0,"confidence":4.056338028169014,"iterationTokens":1013,"asi":{"hypothesis":"Valid exponent numeric separators should parse in decimal literals after the first exponent digit.","rollback_reason":"Backpressure failed in the known unrelated Process.monitor web API flake (`noproc` instead of `kaboom`) while parser tests passed.","next_action_hint":"Re-add the exponent separator coverage test and rerun; keep if checks pass.","quickjs_cases":"Attempted QuickJS-compatible numeric literal coverage for `1.5e1_0` and `1e+1_2`."}}
{"run":157,"commit":"ec8bb89","metric":297,"metrics":{"parser_tests":162,"parser_test_ms":300},"status":"keep","description":"Port exponent separator coverage","timestamp":1777213800511,"segment":0,"confidence":4.084507042253521,"iterationTokens":1562,"asi":{"hypothesis":"Valid exponent numeric separators should parse in decimal literals after the first exponent digit.","learned":"No implementation change was required; decimal scanning and number parsing already strip separators in exponent-bearing literals when separators are placed after exponent digits.","quickjs_cases":"Adds QuickJS-compatible numeric literal coverage for `1.5e1_0` and `1e+1_2` after retrying a transient web API flake."}}
{"run":158,"commit":"d924477","metric":299,"metrics":{"parser_tests":163,"parser_test_ms":300},"status":"keep","description":"Port missing prefixed digit diagnostics","timestamp":1777213872233,"segment":0,"confidence":4.055555555555555,"iterationTokens":1808,"asi":{"hypothesis":"Prefixed numeric literals must contain at least one digit after `0x`, `0b`, or `0o`.","learned":"Numeric validation now rejects prefix-only normalized raw literals before parsing them to `:nan`.","quickjs_cases":"Adds QuickJS-compatible diagnostics for missing digits in `0x`, `0b`, and `0o` literals."}}
{"run":159,"commit":"a09bfb0","metric":301,"metrics":{"parser_tests":164,"parser_test_ms":300},"status":"keep","description":"Port invalid prefixed digit diagnostics","timestamp":1777213937674,"segment":0,"confidence":4.027397260273973,"iterationTokens":1302,"asi":{"hypothesis":"Prefixed numeric literal scanning should report invalid trailing identifier/digit characters that are not valid in the prefix radix.","learned":"After scanning a prefixed literal, validation now emits an invalid-number diagnostic if the next character is identifier-like, catching cases such as `0b2`, `0o8`, and `0xg`.","quickjs_cases":"Adds QuickJS-compatible prefixed numeric diagnostics for invalid binary, octal, and hexadecimal digits."}}
{"run":160,"commit":"586f9d5","metric":303,"metrics":{"parser_tests":165,"parser_test_ms":300},"status":"keep","description":"Port default namespace re-export coverage","timestamp":1777214009000,"segment":0,"confidence":4.054794520547945,"iterationTokens":1397,"asi":{"hypothesis":"Namespace re-export aliases should accept contextual export names such as `default`, not only binding identifiers.","learned":"Export-all alias parsing now uses property-key parsing after `as`, allowing keyword-style exported names while preserving existing identifier aliases.","quickjs_cases":"Adds QuickJS-compatible module coverage for `export * as default from \"dep\"`."}}
{"run":161,"commit":"13b2742","metric":305,"metrics":{"parser_tests":166,"parser_test_ms":300},"status":"keep","description":"Port string namespace re-export coverage","timestamp":1777214072025,"segment":0,"confidence":4.082191780821918,"iterationTokens":1010,"asi":{"hypothesis":"The export-all alias path should also accept string-literal exported module names where the grammar allows module export names.","learned":"No implementation change was required after switching export-all aliases to property-key parsing; string aliases are represented as Literal exported names.","quickjs_cases":"Adds QuickJS-compatible module coverage for `export * as \"external-name\" from \"dep\"`."}}
{"run":162,"commit":"9746898","metric":307,"metrics":{"parser_tests":167,"parser_test_ms":300},"status":"keep","description":"Port namespace export source diagnostics","timestamp":1777214120781,"segment":0,"confidence":4.054054054054054,"iterationTokens":930,"asi":{"hypothesis":"Namespace re-exports must require a `from` source clause whether their alias is an identifier or string module export name.","learned":"No implementation change was required; export-all parsing expects `from` after the optional alias and reports a diagnostic if it is missing.","quickjs_cases":"Adds QuickJS-compatible module diagnostics for `export * as ns;` and `export * as \"external-name\";`."}}
{"run":163,"commit":"5714b9a","metric":309,"metrics":{"parser_tests":168,"parser_test_ms":300},"status":"keep","description":"Port numeric property key coverage","timestamp":1777214169191,"segment":0,"confidence":4.026666666666666,"iterationTokens":1013,"asi":{"hypothesis":"Object literal property-key parsing should accept numeric literal property names across decimal and prefixed forms.","learned":"No implementation change was required; property-key parsing already accepts number tokens and preserves parsed numeric values for object keys.","quickjs_cases":"Adds QuickJS-compatible object literal coverage for numeric property names `0`, `1.5`, and `0x10`."}}
{"run":164,"commit":"eba8c7e","metric":311,"metrics":{"parser_tests":169,"parser_test_ms":800},"status":"keep","description":"Port numeric class method key coverage","timestamp":1777214224170,"segment":0,"confidence":4.053333333333334,"iterationTokens":990,"asi":{"hypothesis":"Class element key parsing should accept numeric literal method names, including static methods with prefixed numeric names.","learned":"No implementation change was required; class key parsing shares property-key parsing, so decimal and prefixed numeric keys become Literal method keys.","quickjs_cases":"Adds QuickJS-compatible class coverage for methods named `0`, `1.5`, and static `0x10`."}}
{"run":165,"commit":"5f76bfa","metric":313,"metrics":{"parser_tests":170,"parser_test_ms":300},"status":"keep","description":"Port destructured parameter coverage","timestamp":1777214284471,"segment":0,"confidence":4.08,"iterationTokens":1173,"asi":{"hypothesis":"Function and arrow formal parameter parsing should compose with object/array destructuring, defaults, and rest patterns.","learned":"No implementation change was required; formal parameter parsing already delegates to binding-pattern parsing for both function declarations and parenthesized arrow parameters.","quickjs_cases":"Adds QuickJS-compatible function parameter coverage for object rest/default patterns, array rest patterns, and arrow destructuring defaults."}}
{"run":166,"commit":"1d255a2","metric":315,"metrics":{"parser_tests":171,"parser_test_ms":300},"status":"keep","description":"Port nested destructuring assignment coverage","timestamp":1777214366590,"segment":0,"confidence":4.052631578947368,"iterationTokens":2718,"asi":{"hypothesis":"Destructuring assignment-left parsing should preserve nested object and array destructuring shapes with defaults and rest elements.","learned":"No implementation change was required; nested object/array literal parsing already creates AssignmentPattern for default values and SpreadElement for rest-like assignment shapes.","quickjs_cases":"Adds QuickJS-compatible destructuring assignment coverage for nested object defaults and array rest elements."}}
{"run":167,"commit":"1d255a2","metric":317,"metrics":{"parser_tests":172,"parser_test_ms":300},"status":"checks_failed","description":"Port nested destructuring binding coverage","timestamp":1777214412573,"segment":0,"confidence":4,"iterationTokens":1035,"asi":{"hypothesis":"Variable declaration binding-pattern parsing should support nested object/array patterns with defaults and rest elements.","rollback_reason":"Backpressure failed in known unrelated Process.monitor flake (`noproc` instead of `kaboom`) while parser tests passed.","next_action_hint":"Re-add nested destructuring binding test and rerun; keep when web API checks pass.","quickjs_cases":"Attempted QuickJS-compatible binding coverage for nested object defaults and array rest in a const declaration."}}
{"run":168,"commit":"1b4e931","metric":317,"metrics":{"parser_tests":172,"parser_test_ms":300},"status":"keep","description":"Port nested destructuring binding coverage","timestamp":1777214474743,"segment":0,"confidence":3.9743589743589745,"iterationTokens":1600,"asi":{"hypothesis":"Variable declaration binding-pattern parsing should support nested object/array patterns with defaults and rest elements.","learned":"No implementation change was required; variable declaration parsing delegates to binding-pattern parsing, which preserves nested ObjectPattern, ArrayPattern, AssignmentPattern, and RestElement nodes.","quickjs_cases":"Adds QuickJS-compatible const binding coverage for nested object defaults and array rest after retrying a transient web API flake."}}
{"run":169,"commit":"fe0531e","metric":319,"metrics":{"parser_tests":173,"parser_test_ms":400},"status":"keep","description":"Port for-of nested destructuring coverage","timestamp":1777214530439,"segment":0,"confidence":3.949367088607595,"iterationTokens":1019,"asi":{"hypothesis":"For-of loop declaration parsing should compose with nested object and array binding patterns.","learned":"No implementation change was required; for-of left declaration parsing reuses the variable declarator binding-pattern parser.","quickjs_cases":"Adds QuickJS-compatible loop coverage for `for (const { a: [first, ...rest] } of entries)`."}}
{"run":170,"commit":"82de442","metric":321,"metrics":{"parser_tests":174,"parser_test_ms":300},"status":"keep","description":"Port async destructured arrow coverage","timestamp":1777214589220,"segment":0,"confidence":3.925,"iterationTokens":991,"asi":{"hypothesis":"Async arrow parsing should support destructured parameters with default await expressions and rest parameters.","learned":"No implementation change was required; async arrow parsing uses formal-parameter parsing and default initializers can contain AwaitExpression nodes.","quickjs_cases":"Adds QuickJS-compatible function coverage for `async ({ value = await fallback() }, ...rest) => value`."}}
{"run":171,"commit":"4e5a5df","metric":323,"metrics":{"parser_tests":175,"parser_test_ms":300},"status":"keep","description":"Port string class method key coverage","timestamp":1777214649204,"segment":0,"confidence":3.9012345679012346,"iterationTokens":986,"asi":{"hypothesis":"Class method key parsing should accept string literal method names for instance and static methods.","learned":"No implementation change was required; class key parsing reuses property-key parsing and represents string-named methods with Literal keys.","quickjs_cases":"Adds QuickJS-compatible class coverage for string-literal instance and static method names."}}
{"run":172,"commit":"4e4545c","metric":325,"metrics":{"parser_tests":176,"parser_test_ms":400},"status":"keep","description":"Port string object method key coverage","timestamp":1777214745734,"segment":0,"confidence":3.925925925925926,"iterationTokens":3092,"asi":{"hypothesis":"Object literal async-method lookahead should recognize string and numeric literal method keys, not only identifiers and computed keys.","learned":"Async method detection now includes string/number literal keys and async-generator literal keys; regular string method keys already worked through property-key parsing.","quickjs_cases":"Adds QuickJS-compatible object literal coverage for string-literal methods and async string-literal methods."}}
{"run":173,"commit":"f634133","metric":327,"metrics":{"parser_tests":177,"parser_test_ms":300},"status":"keep","description":"Port async string class method coverage","timestamp":1777214808863,"segment":0,"confidence":3.950617283950617,"iterationTokens":1014,"asi":{"hypothesis":"The expanded async-method lookahead should also let class parsing recognize async string-literal method keys, including static methods.","learned":"No implementation change was required after the async-method lookahead expansion; class async method parsing now handles string literal keys for instance and static members.","quickjs_cases":"Adds QuickJS-compatible class coverage for `async \"method-name\"()` and `static async \"static-name\"()`."}}
{"run":174,"commit":"ec662a9","metric":329,"metrics":{"parser_tests":178,"parser_test_ms":300},"status":"checks_failed","description":"Port async numeric object method coverage","timestamp":1777214863246,"segment":0,"confidence":3.902439024390244,"iterationTokens":1104,"asi":{"hypothesis":"Async object method lookahead should recognize numeric literal keys for normal async and async-generator methods.","rollback_reason":"Backpressure failed in known unrelated Process.monitor flake while parser tests passed.","next_action_hint":"Re-add async numeric object method coverage and rerun; keep if checks pass.","quickjs_cases":"Attempted QuickJS-compatible object method coverage for `async 0()` and `async *1.5()`."}}
{"run":175,"commit":"9836514","metric":329,"metrics":{"parser_tests":178,"parser_test_ms":400},"status":"keep","description":"Port async numeric object method coverage","timestamp":1777214936888,"segment":0,"confidence":3.8795180722891565,"iterationTokens":1561,"asi":{"hypothesis":"Async object method lookahead should recognize numeric literal keys for normal async and async-generator methods.","learned":"No implementation change was required after the async-method lookahead expansion; numeric literal keys now parse in async and async-generator object methods.","quickjs_cases":"Adds QuickJS-compatible object method coverage for `async 0()` and `async *1.5()` after retrying a transient web API flake."}}
{"run":176,"commit":"f60de1e","metric":331,"metrics":{"parser_tests":179,"parser_test_ms":300},"status":"keep","description":"Port async numeric class method coverage","timestamp":1777215000331,"segment":0,"confidence":3.9036144578313254,"iterationTokens":1005,"asi":{"hypothesis":"Class async method parsing should share numeric literal key support with object async methods, including static async generators.","learned":"No implementation change was required after the shared async-method lookahead expansion; class async and static async-generator numeric keys parse correctly.","quickjs_cases":"Adds QuickJS-compatible class coverage for `async 0()` and `static async *1.5()`."}}
{"run":177,"commit":"17501eb","metric":333,"metrics":{"parser_tests":180,"parser_test_ms":300},"status":"keep","description":"Port generator literal object method coverage","timestamp":1777215106120,"segment":0,"confidence":3.927710843373494,"iterationTokens":1023,"asi":{"hypothesis":"Generator object method parsing should accept string and numeric literal method keys.","learned":"No implementation change was required; generator method parsing already delegates its key to property-key parsing, which supports literal keys.","quickjs_cases":"Adds QuickJS-compatible object literal coverage for generator methods named by string and numeric literals."}}
{"run":178,"commit":"d71bb21","metric":335,"metrics":{"parser_tests":181,"parser_test_ms":300},"status":"keep","description":"Port generator literal class method coverage","timestamp":1777215164091,"segment":0,"confidence":3.9047619047619047,"iterationTokens":966,"asi":{"hypothesis":"Generator class method parsing should accept string and numeric literal keys for instance and static methods.","learned":"No implementation change was required; generator class method parsing shares class property-key parsing with regular methods.","quickjs_cases":"Adds QuickJS-compatible class coverage for generator methods named by string and numeric literals."}}
{"run":179,"commit":"3362051","metric":337,"metrics":{"parser_tests":182,"parser_test_ms":300},"status":"keep","description":"Port object accessor literal key coverage","timestamp":1777215243350,"segment":0,"confidence":3.9285714285714284,"iterationTokens":2605,"asi":{"hypothesis":"Object accessor lookahead should recognize literal keys for `get`/`set` accessors, not only identifier and computed keys.","learned":"Extracted shared accessor-key lookahead and added string/number literal key support while preserving private/computed support for classes.","quickjs_cases":"Adds QuickJS-compatible object literal coverage for string-literal getters and numeric setters."}}
{"run":180,"commit":"aa786b6","metric":339,"metrics":{"parser_tests":183,"parser_test_ms":300},"status":"keep","description":"Port class accessor literal key coverage","timestamp":1777215307588,"segment":0,"confidence":3.9058823529411764,"iterationTokens":975,"asi":{"hypothesis":"The shared accessor-key lookahead should let class accessors use string and numeric literal keys, including static setters.","learned":"No implementation change was required after extracting accessor-key lookahead; class accessor parsing now recognizes literal keys for getters and setters.","quickjs_cases":"Adds QuickJS-compatible class coverage for string-literal getters and static numeric setters."}}
{"run":181,"commit":"4b2a34c","metric":341,"metrics":{"parser_tests":184,"parser_test_ms":300},"status":"keep","description":"Port literal class field key coverage","timestamp":1777215390416,"segment":0,"confidence":3.883720930232558,"iterationTokens":1085,"asi":{"hypothesis":"Class field parsing should accept string and numeric literal keys with initializer expressions.","learned":"No implementation change was required; class field parsing shares class property-key parsing with methods/accessors and preserves literal keys.","quickjs_cases":"Adds QuickJS-compatible class field coverage for string-literal instance fields and static numeric fields."}}
