{"run":1096,"commit":"8be618b","metric":76,"metrics":{"compiler_test262_cases":509,"compiler_test262_pass":433,"compiler_test262_failures":76,"compiler_test262_compiler_errors":0,"compiler_test262_compiler_crashes":0,"compiler_test262_compiler_fails":2,"compiler_test262_both_fail":69,"compiler_test262_interpreter_fail_compiler_pass":3,"compatibility_pass":433,"compatibility_cases":509,"compiler_errors":0,"compiler_crashes":0,"compiler_fails":2,"both_fail":69,"interpreter_fail_compiler_pass":3,"elapsed_ms":55003},"status":"keep","description":"Preserve Function constructor parameter coercion order","timestamp":1778630958862,"segment":54,"confidence":5,"iterationTokens":7019,"asi":{"hypothesis":"Function constructor parameter arguments must be stringified in left-to-right source order; mapping before reversing assigned side-effectful parameter names backwards."}}
{"run":1097,"commit":"4a01658","metric":74,"metrics":{"compiler_test262_cases":509,"compiler_test262_pass":435,"compiler_test262_failures":74,"compiler_test262_compiler_errors":0,"compiler_test262_compiler_crashes":0,"compiler_test262_compiler_fails":2,"compiler_test262_both_fail":66,"compiler_test262_interpreter_fail_compiler_pass":4,"compatibility_pass":435,"compatibility_cases":509,"compiler_errors":0,"compiler_crashes":0,"compiler_fails":2,"both_fail":66,"interpreter_fail_compiler_pass":4,"elapsed_ms":53779},"status":"keep","description":"Remap bound constructor newTarget","timestamp":1778631444235,"segment":54,"confidence":5.4,"iterationTokens":23993,"asi":{"hypothesis":"When a bound function is constructed with itself as newTarget, construction should forward the target function as newTarget; this fixes Reflect.construct bound-target cases and partially improves bound constructor semantics."}}
{"run":1098,"commit":"9ce744e","metric":73,"metrics":{"compiler_test262_cases":509,"compiler_test262_pass":436,"compiler_test262_failures":73,"compiler_test262_compiler_errors":0,"compiler_test262_compiler_crashes":0,"compiler_test262_compiler_fails":2,"compiler_test262_both_fail":66,"compiler_test262_interpreter_fail_compiler_pass":3,"compatibility_pass":436,"compatibility_cases":509,"compiler_errors":0,"compiler_crashes":0,"compiler_fails":2,"both_fail":66,"interpreter_fail_compiler_pass":3,"elapsed_ms":53580},"status":"keep","description":"Construct bound functions through runtime path","timestamp":1778631682999,"segment":54,"confidence":4.666666666666667,"iterationTokens":2397,"asi":{"hypothesis":"Interpreter bound-constructor execution should reuse the runtime construct path so nested bound functions recursively remap newTarget and invoke their original target instead of stopping at one bound layer."}}
{"run":1099,"commit":"e51dd96","metric":67,"metrics":{"compiler_test262_cases":509,"compiler_test262_pass":442,"compiler_test262_failures":67,"compiler_test262_compiler_errors":0,"compiler_test262_compiler_crashes":0,"compiler_test262_compiler_fails":2,"compiler_test262_both_fail":60,"compiler_test262_interpreter_fail_compiler_pass":3,"compatibility_pass":442,"compatibility_cases":509,"compiler_errors":0,"compiler_crashes":0,"compiler_fails":2,"both_fail":60,"interpreter_fail_compiler_pass":3,"elapsed_ms":52710},"status":"keep","description":"Box primitive this values for non-strict calls","timestamp":1778631907681,"segment":54,"confidence":5.230769230769231,"iterationTokens":2699,"asi":{"hypothesis":"Non-strict function calls through Function.prototype.call/apply should box primitive thisArg values before invoking the target, while strict functions preserve the original receiver."}}
{"run":1100,"commit":"8427431","metric":66,"metrics":{"compiler_test262_cases":509,"compiler_test262_pass":443,"compiler_test262_failures":66,"compiler_test262_compiler_errors":0,"compiler_test262_compiler_crashes":0,"compiler_test262_compiler_fails":2,"compiler_test262_both_fail":59,"compiler_test262_interpreter_fail_compiler_pass":3,"compatibility_pass":443,"compatibility_cases":509,"compiler_errors":0,"compiler_crashes":0,"compiler_fails":2,"both_fail":59,"interpreter_fail_compiler_pass":3,"elapsed_ms":54121},"status":"keep","description":"Expose error constructors in test realms","timestamp":1778632184001,"segment":54,"confidence":5,"iterationTokens":5007,"asi":{"hypothesis":"Test262-created realms need distinct Error/TypeError constructors so cross-realm assert.throws cases can compare against the expected realm error constructor."}}
{"run":1101,"commit":"bfa6001","metric":65,"metrics":{"compiler_test262_cases":509,"compiler_test262_pass":444,"compiler_test262_failures":65,"compiler_test262_compiler_errors":0,"compiler_test262_compiler_crashes":0,"compiler_test262_compiler_fails":2,"compiler_test262_both_fail":58,"compiler_test262_interpreter_fail_compiler_pass":3,"compatibility_pass":444,"compatibility_cases":509,"compiler_errors":0,"compiler_crashes":0,"compiler_fails":2,"both_fail":58,"interpreter_fail_compiler_pass":3,"elapsed_ms":53853},"status":"keep","description":"Respect callable setter-only own properties","timestamp":1778632730368,"segment":54,"confidence":4.8,"iterationTokens":5007,"asi":{"hypothesis":"Callable objects with own accessor descriptors that have no getter must shadow inherited Function.prototype accessors; ctor descriptor metadata should count as an explicit undefined own property during Get."}}
{"run":1102,"commit":"08d0ccf","metric":63,"metrics":{"compiler_test262_cases":509,"compiler_test262_pass":446,"compiler_test262_failures":63,"compiler_test262_compiler_errors":0,"compiler_test262_compiler_crashes":0,"compiler_test262_compiler_fails":2,"compiler_test262_both_fail":56,"compiler_test262_interpreter_fail_compiler_pass":3,"compatibility_pass":446,"compatibility_cases":509,"compiler_errors":0,"compiler_crashes":0,"compiler_fails":2,"both_fail":56,"interpreter_fail_compiler_pass":3,"elapsed_ms":53710},"status":"keep","description":"Handle callable revoked proxy constructors","timestamp":1778633048762,"segment":54,"confidence":4.75,"iterationTokens":28993,"asi":{"hypothesis":"Function proxies should be callable/constructable for typeof and construction, Test262 realms should expose Proxy.revocable, and construction must throw when prototype lookup revokes the proxy newTarget before realm fallback."}}
{"run":1103,"commit":"0c8a3ac","metric":60,"metrics":{"compiler_test262_cases":509,"compiler_test262_pass":449,"compiler_test262_failures":60,"compiler_test262_compiler_errors":0,"compiler_test262_compiler_crashes":0,"compiler_test262_compiler_fails":2,"compiler_test262_both_fail":53,"compiler_test262_interpreter_fail_compiler_pass":3,"compatibility_pass":449,"compatibility_cases":509,"compiler_errors":0,"compiler_crashes":0,"compiler_fails":2,"both_fail":53,"interpreter_fail_compiler_pass":3,"elapsed_ms":52538},"status":"keep","description":"Expose eval in Test262 realms","timestamp":1778633281931,"segment":54,"confidence":4.823529411764706,"iterationTokens":8817,"asi":{"hypothesis":"Minimal Test262 realm globals should expose eval so cross-realm class constructor tests create real QuickBEAM class functions rather than failing on an undefined eval property."}}
{"run":1104,"commit":"2b39254","metric":59,"metrics":{"compiler_test262_cases":509,"compiler_test262_pass":450,"compiler_test262_failures":59,"compiler_test262_compiler_errors":0,"compiler_test262_compiler_crashes":0,"compiler_test262_compiler_fails":2,"compiler_test262_both_fail":52,"compiler_test262_interpreter_fail_compiler_pass":3,"compatibility_pass":450,"compatibility_cases":509,"compiler_errors":0,"compiler_crashes":0,"compiler_fails":2,"both_fail":52,"interpreter_fail_compiler_pass":3,"elapsed_ms":54064},"status":"keep","description":"Box realm function receivers with realm prototypes","timestamp":1778633591494,"segment":54,"confidence":4.666666666666667,"iterationTokens":9057,"asi":{"hypothesis":"Non-strict functions created through Test262 realms should box primitive receivers using that realm's Boolean/Number/String prototypes so constructor and instanceof checks observe the callee realm."}}
{"run":1105,"commit":"f1a9e83","metric":58,"metrics":{"compiler_test262_cases":509,"compiler_test262_pass":451,"compiler_test262_failures":58,"compiler_test262_compiler_errors":0,"compiler_test262_compiler_crashes":0,"compiler_test262_compiler_fails":2,"compiler_test262_both_fail":51,"compiler_test262_interpreter_fail_compiler_pass":3,"compatibility_pass":451,"compatibility_cases":509,"compiler_errors":0,"compiler_crashes":0,"compiler_fails":2,"both_fail":51,"interpreter_fail_compiler_pass":3,"elapsed_ms":54072},"status":"keep","description":"Bind realm functions to realm globalThis","timestamp":1778633833229,"segment":54,"confidence":4.526315789473684,"iterationTokens":2799,"asi":{"hypothesis":"Non-strict functions created by a Test262 realm Function constructor should use that realm's global object for implicit, null, and undefined this bindings."}}
{"run":1106,"commit":"HEAD","metric":58,"metrics":{"compiler_test262_cases":509,"compiler_test262_pass":451,"compiler_test262_failures":58,"compiler_test262_compiler_errors":0,"compiler_test262_compiler_crashes":0,"compiler_test262_compiler_fails":2,"compiler_test262_both_fail":51,"compiler_test262_interpreter_fail_compiler_pass":3,"compatibility_pass":451,"compatibility_cases":509,"compiler_errors":0,"compiler_crashes":0,"compiler_fails":2,"both_fail":51,"interpreter_fail_compiler_pass":3,"elapsed_ms":55512},"status":"discard","description":"Use array-like argument lists in Function.apply","timestamp":1778634084848,"segment":54,"confidence":4.3,"iterationTokens":5831,"asi":{"hypothesis":"Replacing Function.apply's list-only argArray handling with CreateListFromArrayLike semantics should fix primitive argArray rejection and array-like observable reads without regressing Sputnik apply cases.","rollback_reason":"The focused apply cases passed but the broad Function workload stayed unchanged at the current best of 58 failures, so the change is not worth keeping in this loop.","next_action_hint":"If revisiting apply, first identify which case was fixed and which case regressed or stayed blocked; likely remaining apply/resizable-buffer and compiler-only this binding issues need typed-array or compiled call context work rather than generic array-like conversion."}}
{"run":1107,"commit":"HEAD","metric":60,"metrics":{"compiler_test262_cases":509,"compiler_test262_pass":449,"compiler_test262_failures":60,"compiler_test262_compiler_errors":0,"compiler_test262_compiler_crashes":0,"compiler_test262_compiler_fails":2,"compiler_test262_both_fail":53,"compiler_test262_interpreter_fail_compiler_pass":3,"compatibility_pass":449,"compatibility_cases":509,"compiler_errors":0,"compiler_crashes":0,"compiler_fails":2,"both_fail":53,"interpreter_fail_compiler_pass":3,"elapsed_ms":53418},"status":"discard","description":"Use Function.prototype Symbol.hasInstance inheritance","timestamp":1778634415718,"segment":54,"confidence":3.739130434782609,"iterationTokens":5905,"asi":{"hypothesis":"Callable symbol property lookup should inherit Function.prototype[Symbol.hasInstance], whose implementation should use OrdinaryHasInstance semantics including bound-function target recursion.","rollback_reason":"Although focused Symbol.hasInstance cases passed, the broad Function workload regressed from 58 to 60 failures, consistent with earlier hasInstance attempts causing edge-case regressions.","next_action_hint":"Before retrying, diff the new failures; likely the fallback symbol lookup or OrdinaryHasInstance prototype-chain walk changes proxy/class/builtin edge cases. Keep focused hasInstance successes as probes but do not reapply unchanged."}}
{"run":1108,"commit":"1f1cf39","metric":54,"metrics":{"compiler_test262_cases":509,"compiler_test262_pass":455,"compiler_test262_failures":54,"compiler_test262_compiler_errors":0,"compiler_test262_compiler_crashes":0,"compiler_test262_compiler_fails":2,"compiler_test262_both_fail":47,"compiler_test262_interpreter_fail_compiler_pass":3,"compatibility_pass":455,"compatibility_cases":509,"compiler_errors":0,"compiler_crashes":0,"compiler_fails":2,"both_fail":47,"interpreter_fail_compiler_pass":3,"elapsed_ms":53153},"status":"keep","description":"Expose configurable bound function descriptors","timestamp":1778634837743,"segment":54,"confidence":3.6153846153846154,"iterationTokens":13551,"asi":{"hypothesis":"Bound function virtual name/length properties need proper own property descriptors and delete tombstones, and the bytecode delete opcode must route bound functions through static callable deletion."}}
{"run":1109,"commit":"6d3d51c","metric":52,"metrics":{"compiler_test262_cases":509,"compiler_test262_pass":457,"compiler_test262_failures":52,"compiler_test262_compiler_errors":0,"compiler_test262_compiler_crashes":0,"compiler_test262_compiler_fails":2,"compiler_test262_both_fail":47,"compiler_test262_interpreter_fail_compiler_pass":1,"compatibility_pass":457,"compatibility_cases":509,"compiler_errors":0,"compiler_crashes":0,"compiler_fails":2,"both_fail":47,"interpreter_fail_compiler_pass":1,"elapsed_ms":53553},"status":"keep","description":"Describe callable prototype properties","timestamp":1778635184048,"segment":54,"confidence":4.083333333333333,"iterationTokens":14426,"asi":{"hypothesis":"Constructable callable values with virtual prototype objects should expose a non-configurable own prototype descriptor through Object.getOwnPropertyDescriptor and propertyHelper delete/configurability checks."}}
{"run":1110,"commit":"ef8a453","metric":43,"metrics":{"compiler_test262_cases":509,"compiler_test262_pass":466,"compiler_test262_failures":43,"compiler_test262_compiler_errors":0,"compiler_test262_compiler_crashes":0,"compiler_test262_compiler_fails":2,"compiler_test262_both_fail":38,"compiler_test262_interpreter_fail_compiler_pass":1,"compatibility_pass":466,"compatibility_cases":509,"compiler_errors":0,"compiler_crashes":0,"compiler_fails":2,"both_fail":38,"interpreter_fail_compiler_pass":1,"elapsed_ms":53010},"status":"keep","description":"Inherit Function prototype from callable proxies","timestamp":1778635400470,"segment":54,"confidence":4.461538461538462,"iterationTokens":8348,"asi":{"hypothesis":"Proxy objects whose target is callable should inherit missing string-key properties from Function.prototype rather than Object.prototype, fixing Function.prototype.toString and related callable proxy behavior."}}
{"run":1111,"commit":"0146865","metric":43,"metrics":{"compiler_test262_cases":509,"compiler_test262_pass":466,"compiler_test262_failures":43,"compiler_test262_compiler_errors":0,"compiler_test262_compiler_crashes":0,"compiler_test262_compiler_fails":2,"compiler_test262_both_fail":38,"compiler_test262_interpreter_fail_compiler_pass":1,"compatibility_pass":466,"compatibility_cases":509,"compiler_errors":0,"compiler_crashes":0,"compiler_fails":2,"both_fail":38,"interpreter_fail_compiler_pass":1,"elapsed_ms":54997},"status":"keep","description":"Rebaseline Function workload after static-analysis refactor","timestamp":1778637650969,"segment":54,"confidence":4.461538461538462,"iterationTokens":8348,"asi":{"hypothesis":"The static-analysis-only refactor should preserve the current built-ins/Function compatibility metric while updating the autoresearch baseline after the dependency/tooling commit.","workload":"AUTORESEARCH_TEST262_CATEGORY=built-ins/Function TEST262_LIMIT=600 TEST262_ERROR_LIMIT=140 ./autoresearch.sh","checks":"Backpressure checks passed."}}
{"run":1112,"commit":"46e9aab","metric":41,"metrics":{"compiler_test262_cases":509,"compiler_test262_pass":468,"compiler_test262_failures":41,"compiler_test262_compiler_errors":0,"compiler_test262_compiler_crashes":0,"compiler_test262_compiler_fails":0,"compiler_test262_both_fail":38,"compiler_test262_interpreter_fail_compiler_pass":1,"compatibility_pass":468,"compatibility_cases":509,"compiler_errors":0,"compiler_crashes":0,"compiler_fails":0,"both_fail":38,"interpreter_fail_compiler_pass":1,"elapsed_ms":52777},"status":"keep","description":"Compile void unary expressions","timestamp":1778637950442,"segment":54,"confidence":4.285714285714286,"iterationTokens":22328,"asi":{"hypothesis":"Source-compiled eval in old Function.prototype.call/apply Sputnik tests failed only because the JS source compiler rejected unary void; emitting evaluated argument, drop, undefined should remove the two compiler-only failures without changing interpreter semantics.","focused_cases":["built-ins/Function/prototype/apply/S15.3.4.3_A3_T9.js","built-ins/Function/prototype/call/S15.3.4.4_A3_T9.js"],"focused_result":"Both focused cases pass in beam and beam_compiler modes.","checks":"Backpressure checks passed."}}
{"run":1113,"commit":"46e9aab","metric":48,"metrics":{"compiler_test262_cases":509,"compiler_test262_pass":461,"compiler_test262_failures":48,"compiler_test262_compiler_errors":0,"compiler_test262_compiler_crashes":0,"compiler_test262_compiler_fails":0,"compiler_test262_both_fail":46,"compiler_test262_interpreter_fail_compiler_pass":0,"compatibility_pass":461,"compatibility_cases":509,"compiler_errors":0,"compiler_crashes":0,"compiler_fails":0,"both_fail":46,"interpreter_fail_compiler_pass":0,"elapsed_ms":53806},"status":"discard","description":"Install restricted accessors on Function prototype","timestamp":1778638210956,"segment":54,"confidence":4.444444444444445,"iterationTokens":12250,"asi":{"hypothesis":"Adding same %ThrowTypeError%-style accessor pair for Function.prototype caller/arguments should fix descriptor/accessor identity cases.","rollback_reason":"Broad Function workload regressed from 41 to 48 despite focused caller/arguments descriptor cases improving, likely because the accessor became visible/invoked in older Sputnik caller-stack cases and changed expected Annex B sloppy-function behavior.","next_action_hint":"Do not retry broad Function.prototype restricted accessor installation unchanged; split descriptor synthesis for Object.getOwnPropertyDescriptor from runtime get/set semantics or implement full Annex B caller/arguments stack semantics first.","checks":"Backpressure checks passed but primary metric worsened."}}
{"run":1114,"commit":"ff734be","metric":40,"metrics":{"compiler_test262_cases":509,"compiler_test262_pass":469,"compiler_test262_failures":40,"compiler_test262_compiler_errors":0,"compiler_test262_compiler_crashes":0,"compiler_test262_compiler_fails":0,"compiler_test262_both_fail":37,"compiler_test262_interpreter_fail_compiler_pass":1,"compatibility_pass":469,"compatibility_cases":509,"compiler_errors":0,"compiler_crashes":0,"compiler_fails":0,"both_fail":37,"interpreter_fail_compiler_pass":1,"elapsed_ms":54469},"status":"keep","description":"Keep named builtin objects non-callable","timestamp":1778638570358,"segment":54,"confidence":4.357142857142857,"iterationTokens":17829,"asi":{"hypothesis":"Named builtin objects represented as {:builtin, name, map} should behave like ordinary non-callable objects, not inherit Function.prototype call/apply/bind through builtin fallback paths.","focused_cases":["built-ins/Function/prototype/bind/15.3.4.5-2-7.js"],"focused_result":"JSON.bind is undefined and JSON.bind() throws TypeError in both beam and beam_compiler modes.","checks":"Backpressure checks passed."}}
{"run":1115,"commit":"ff734be","metric":40,"metrics":{"compiler_test262_cases":509,"compiler_test262_pass":469,"compiler_test262_failures":40,"compiler_test262_compiler_errors":0,"compiler_test262_compiler_crashes":0,"compiler_test262_compiler_fails":0,"compiler_test262_both_fail":37,"compiler_test262_interpreter_fail_compiler_pass":1,"compatibility_pass":469,"compatibility_cases":509,"compiler_errors":0,"compiler_crashes":0,"compiler_fails":0,"both_fail":37,"interpreter_fail_compiler_pass":1,"elapsed_ms":52921},"status":"discard","description":"Expose Date in Test262 realms","timestamp":1778638904422,"segment":54,"confidence":3.935483870967742,"iterationTokens":16364,"asi":{"hypothesis":"Adding Date constructors/prototypes to minimal Test262 realms and using realm Date.prototype as the default Date construction prototype should fix bound GetFunctionRealm Date cases.","rollback_reason":"The broad Function workload stayed flat at 40 failures; focused get-fn-realm cases changed shape but still failed prototype identity, so this partial realm intrinsic expansion is not worth keeping alone.","next_action_hint":"Retry only with exact Date construction prototype identity and instanceof semantics for realm Date; exposing realm Date alone is insufficient.","checks":"Backpressure checks passed but primary metric did not improve."}}
{"run":1116,"commit":"3583851","metric":37,"metrics":{"compiler_test262_cases":509,"compiler_test262_pass":472,"compiler_test262_failures":37,"compiler_test262_compiler_errors":0,"compiler_test262_compiler_crashes":0,"compiler_test262_compiler_fails":0,"compiler_test262_both_fail":34,"compiler_test262_interpreter_fail_compiler_pass":1,"compatibility_pass":472,"compatibility_cases":509,"compiler_errors":0,"compiler_crashes":0,"compiler_fails":0,"both_fail":34,"interpreter_fail_compiler_pass":1,"elapsed_ms":53749},"status":"keep","description":"Use array-like argument lists in Function.apply","timestamp":1778639348782,"segment":54,"confidence":3.764705882352941,"iterationTokens":25433,"asi":{"hypothesis":"Now that named builtin object callability is fixed, Function.prototype.apply can use CreateListFromArrayLike-style argument handling: nullish argArray stays empty, object/function values are read by length/index, and primitives including Symbols throw TypeError.","focused_cases":["built-ins/Function/prototype/apply/argarray-not-object.js","built-ins/Function/prototype/apply/argarray-not-object-realm.js"],"focused_result":"Both focused primitive argArray rejection cases pass in beam and beam_compiler modes.","checks":"Backpressure checks passed."}}
