{"run":1446,"commit":"0232147","metric":4,"metrics":{"compiler_test262_cases":300,"compiler_test262_pass":296,"compiler_test262_failures":4,"compiler_test262_compiler_errors":0,"compiler_test262_compiler_crashes":0,"compiler_test262_compiler_fails":0,"compiler_test262_both_fail":4,"compiler_test262_interpreter_fail_compiler_pass":0,"compatibility_pass":296,"compatibility_cases":300,"compiler_errors":0,"compiler_crashes":0,"compiler_fails":0,"both_fail":4,"interpreter_fail_compiler_pass":0,"elapsed_ms":11022},"status":"discard","description":"Read captured locals in paired local opcode","timestamp":1778796299674,"segment":119,"confidence":null,"iterationTokens":9368,"asi":{"hypothesis":"The repeated Set-like iterator values may come from the optimized get_loc0_loc1 opcode bypassing captured-cell reads for closure variables, so making it closure-aware could repair accessor closure mutation visibility.","rollback_reason":"Primary metric stayed at 4 and focused getter probes still returned stale outer state/repeated iterator values. The issue is not the paired local read opcode alone.","next_action_hint":"Inspect closure builder and captured-local cell synchronization for object-literal/class accessor functions. In probes, getter invocations update the accessor closure cell across calls but direct outer local reads still see the original local, suggesting captured local initialization/writeback or close_loc handling rather than get_loc0_loc1."}}
{"run":1447,"commit":"0232147","metric":4,"metrics":{"compiler_test262_cases":300,"compiler_test262_pass":296,"compiler_test262_failures":4,"compiler_test262_compiler_errors":0,"compiler_test262_compiler_crashes":0,"compiler_test262_compiler_fails":0,"compiler_test262_both_fail":0,"compiler_test262_interpreter_fail_compiler_pass":0,"compatibility_pass":296,"compatibility_cases":300,"compiler_errors":0,"compiler_crashes":0,"compiler_fails":0,"both_fail":0,"interpreter_fail_compiler_pass":0,"elapsed_ms":64640},"status":"checks_failed","description":"Reuse validated Set-like records for algebra methods","timestamp":1778796893488,"segment":119,"confidence":null,"iterationTokens":32201,"asi":{"hypothesis":"Reusing the validated Set-like record avoids repeated observable size/has/keys getter calls in Set algebra methods and may convert the four class-order failures from shared semantic mismatches to remaining timeout/order issues.","rollback_reason":"Checks failed on an unused helper warning and the primary metric stayed at 4. Benchmark category shifted away from shared failures but did not improve total failures; focused class-order cases still hang in larger iterator branches.","next_action_hint":"If retrying record reuse, remove stale other_has helper and first fix the larger-branch iterator hang. Focus on why Set.collect_iterator inside a JS builtin sees the observable iterator as non-terminating while a direct Elixir Invocation/Get loop over the same next closure terminates correctly."}}
{"type":"config","name":"Optimize QuickBEAM built-ins/String Test262 compatibility reprise","metricName":"compatibility_failures","metricUnit":"","bestDirection":"lower"}
{"run":1448,"commit":"658d228","metric":5,"metrics":{"compiler_test262_cases":1223,"compiler_test262_pass":1218,"compiler_test262_failures":5,"compiler_test262_compiler_errors":0,"compiler_test262_compiler_crashes":0,"compiler_test262_compiler_fails":1,"compiler_test262_both_fail":4,"compiler_test262_interpreter_fail_compiler_pass":0,"compatibility_pass":1218,"compatibility_cases":1223,"compiler_errors":0,"compiler_crashes":0,"compiler_fails":1,"both_fail":4,"interpreter_fail_compiler_pass":0,"elapsed_ms":43321},"status":"keep","description":"Baseline String full bounded workload after Set plateau","timestamp":1778797178665,"segment":120,"confidence":null,"iterationTokens":128,"asi":{"hypothesis":"Set is plateaued on a deeper builtin-invocation iterator closure issue, so rebaseline the full bounded String workload to pursue the known five-failure cluster.","result":"String baseline remains 5 failures out of 1223: duplicate named RegExp group match cases, one compiler-only replace evaluation-order case, and two RegExp subclass replaceAll cases.","next_action_hint":"Focus on the compiler-only replace evaluation-order failure first because it may be narrower than QuickJS duplicate named group acceptance or derived RegExp constructor forwarding."}}
{"run":1449,"commit":"658d228","metric":5,"metrics":{"compiler_test262_cases":1223,"compiler_test262_pass":1218,"compiler_test262_failures":5,"compiler_test262_compiler_errors":0,"compiler_test262_compiler_crashes":0,"compiler_test262_compiler_fails":1,"compiler_test262_both_fail":4,"compiler_test262_interpreter_fail_compiler_pass":0,"compatibility_pass":1218,"compatibility_cases":1223,"compiler_errors":0,"compiler_crashes":0,"compiler_fails":1,"both_fail":4,"interpreter_fail_compiler_pass":0,"elapsed_ms":41980},"status":"discard","description":"Read capture cells in compiled paired local loads","timestamp":1778797518323,"segment":120,"confidence":null,"iterationTokens":15292,"asi":{"hypothesis":"The compiler-only replace evaluation-order failure may be caused by optimized get_loc0_loc1 lowering reading stale slot values instead of capture cells after a replacement object's toString callback increments a captured local.","rollback_reason":"Primary metric stayed at 5 and the focused compiler replace evaluation-order case still reported calls=0 after the replace call. Captured paired local loads are not the cause of this String failure.","next_action_hint":"Inspect compiled invocation of String.prototype.replace and local/capture synchronization after builtins invoke JS callbacks. The replacement object's direct toString call increments calls, but the toString call inside the builtin does not update the compiled caller-visible binding."}}
{"run":1450,"commit":"618b1e6","metric":4,"metrics":{"compiler_test262_cases":1223,"compiler_test262_pass":1219,"compiler_test262_failures":4,"compiler_test262_compiler_errors":0,"compiler_test262_compiler_crashes":0,"compiler_test262_compiler_fails":0,"compiler_test262_both_fail":4,"compiler_test262_interpreter_fail_compiler_pass":0,"compatibility_pass":1219,"compatibility_cases":1223,"compiler_errors":0,"compiler_crashes":0,"compiler_fails":0,"both_fail":4,"interpreter_fail_compiler_pass":0,"elapsed_ms":42054},"status":"keep","description":"Preserve closure context for empty-capture compiled functions","timestamp":1778797860120,"segment":120,"confidence":null,"iterationTokens":10225,"asi":{"hypothesis":"Compiled fclosure lowering returns raw Function structs for empty-capture functions while the interpreter returns closure tuples; raw functions lose the active closure/global context when stored as RegExp.toString callbacks inside builtins. Returning {:closure, %{}, fun} even for empty captures should preserve callback side effects.","result":"Reduced String full bounded workload from 5 to 4 by fixing compiler-only replaceValue-evaluation-order-regexp-object.js; compiler_fails dropped from 1 to 0 and checks passed.","next_action_hint":"Remaining String failures are four shared cases: two duplicate named RegExp group match tests rejected before VM fallback, and two RegExp subclass replaceAll cases likely involving default derived RegExp constructor argument forwarding/internal metadata."}}
{"run":1451,"commit":"618b1e6","metric":4,"metrics":{"compiler_test262_cases":1223,"compiler_test262_pass":1219,"compiler_test262_failures":4,"compiler_test262_compiler_errors":0,"compiler_test262_compiler_crashes":0,"compiler_test262_compiler_fails":0,"compiler_test262_both_fail":4,"compiler_test262_interpreter_fail_compiler_pass":0,"compatibility_pass":1219,"compatibility_cases":1223,"compiler_errors":0,"compiler_crashes":0,"compiler_fails":0,"both_fail":4,"interpreter_fail_compiler_pass":0,"elapsed_ms":45836},"status":"discard","description":"Preserve subclass RegExp prototype metadata","timestamp":1778798331816,"segment":120,"confidence":2,"iterationTokens":19286,"asi":{"hypothesis":"The replaceAll RegExp subclass failures need default derived RegExp constructors to forward arguments and RegExp instances to preserve the newTarget prototype so overridden Symbol.replace is visible.","rollback_reason":"Primary metric stayed at 4. Focused probes improved: `new RE('b','g')` now preserved source/flags and `r[Symbol.replace]` resolved to RE.prototype, incrementing `called`. The remaining replaceAll cases still fail on sticky `gy` semantics and functional replacement application, so this partial metadata/prototype fix is insufficient alone.","next_action_hint":"If revisiting RegExp subclass replaceAll, combine prototype/newTarget preservation with correct sticky/global RegExp.replace behavior and functional replacer handling; do not keep only the partial prototype fix while primary is flat."}}
{"run":1452,"commit":"618b1e6","metric":0,"metrics":{"compiler_test262_cases":0,"compiler_test262_pass":0,"compiler_test262_failures":0,"compiler_test262_compiler_errors":0,"compiler_test262_compiler_crashes":0,"compiler_test262_compiler_fails":0,"compiler_test262_both_fail":0,"compiler_test262_interpreter_fail_compiler_pass":0,"compatibility_pass":0,"compatibility_cases":0,"compiler_errors":0,"compiler_crashes":0,"compiler_fails":0,"both_fail":0,"interpreter_fail_compiler_pass":0,"elapsed_ms":16600},"status":"crash","description":"Compile constructor RegExp bytecode with subclass forwarding","timestamp":1778798643673,"segment":120,"confidence":2,"iterationTokens":26724,"asi":{"hypothesis":"Combining default derived RegExp constructor argument forwarding, per-instance RegExp prototype metadata, and native regexp_compile for RegExp constructor patterns may fix the remaining replaceAll subclass failures by enabling real regex semantics for constructed subclass instances.","rollback_reason":"Focused replaceAll test aborted the BEAM with exit 134, and the broad run crashed before metrics. Native regexp_compile for constructor-created complex patterns is unsafe in this path.","next_action_hint":"Do not compile arbitrary RegExp constructor patterns in this Elixir runtime path. If revisiting replaceAll subclass cases, keep nil-bytecode path safe and implement missing sticky/function replacement semantics or isolate native compile crash first."}}
{"run":1453,"commit":"618b1e6","metric":0,"metrics":{"compiler_test262_cases":0,"compiler_test262_pass":0,"compiler_test262_failures":0,"compiler_test262_compiler_errors":0,"compiler_test262_compiler_crashes":0,"compiler_test262_compiler_fails":0,"compiler_test262_both_fail":0,"compiler_test262_interpreter_fail_compiler_pass":0,"compatibility_pass":0,"compatibility_cases":0,"compiler_errors":0,"compiler_crashes":0,"compiler_fails":0,"both_fail":0,"interpreter_fail_compiler_pass":0,"elapsed_ms":21300},"status":"crash","description":"Use Elixir Regex fallback for constructed RegExp replace","timestamp":1778798943677,"segment":120,"confidence":2,"iterationTokens":9878,"asi":{"hypothesis":"Constructed RegExp instances with nil bytecode can use a safe Elixir Regex fallback for replacement, combined with default derived constructor forwarding and per-instance prototype metadata, to fix RegExp subclass replaceAll tests without native regexp_compile crashes.","rollback_reason":"Broad String run crashed with Regex.run offset past end for some String replace case; focused subclass replaceAll cases passed, but the generic fallback is too broad and unsafe as implemented.","next_action_hint":"If retrying, guard Regex.run offsets greater than byte_size and restrict the Elixir Regex fallback to constructed RegExp cases that need it, or implement a safer nil-bytecode replace loop. Preserve the insight that focused subclass replaceAll passed."}}
{"run":1454,"commit":"fd4d972","metric":3,"metrics":{"compiler_test262_cases":1223,"compiler_test262_pass":1220,"compiler_test262_failures":3,"compiler_test262_compiler_errors":0,"compiler_test262_compiler_crashes":0,"compiler_test262_compiler_fails":0,"compiler_test262_both_fail":3,"compiler_test262_interpreter_fail_compiler_pass":0,"compatibility_pass":1220,"compatibility_cases":1223,"compiler_errors":0,"compiler_crashes":0,"compiler_fails":0,"both_fail":3,"interpreter_fail_compiler_pass":0,"elapsed_ms":43671},"status":"keep","description":"Handle constructed RegExp replacement semantics","timestamp":1778799276056,"segment":120,"confidence":2,"iterationTokens":5582,"asi":{"hypothesis":"RegExp subclass replaceAll failures need default derived constructor forwarding, newTarget prototype preservation for constructed RegExp instances, and a safe nil-bytecode replacement path that supports global/sticky matching, captures, named substitutions, and functional replacements without native regexp_compile.","result":"Reduced String full bounded workload from 4 to 3; both RegExp subclass replaceAll tests pass, while one older replace case now remains alongside duplicate named group tests.","next_action_hint":"Investigate the new residual replace/S15.5.4.11_A1_T17.js regression from the Elixir Regex fallback; likely the fallback should be restricted or adjusted for constructor-created RegExp behavior before tackling duplicate named groups."}}
{"run":1455,"commit":"27ec0d9","metric":2,"metrics":{"compiler_test262_cases":1223,"compiler_test262_pass":1221,"compiler_test262_failures":2,"compiler_test262_compiler_errors":0,"compiler_test262_compiler_crashes":0,"compiler_test262_compiler_fails":0,"compiler_test262_both_fail":2,"compiler_test262_interpreter_fail_compiler_pass":0,"compatibility_pass":1221,"compatibility_cases":1223,"compiler_errors":0,"compiler_crashes":0,"compiler_fails":0,"both_fail":2,"interpreter_fail_compiler_pass":0,"elapsed_ms":43821},"status":"keep","description":"Advance empty constructed RegExp replacements","timestamp":1778799548072,"segment":120,"confidence":3,"iterationTokens":3925,"asi":{"hypothesis":"The Elixir Regex nil-bytecode fallback fixed RegExp subclass replaceAll but mishandled global empty RegExp replacement by not appending the advanced character after zero-length matches. Adding zero-length advance output should recover the old Sputnik replace case while preserving subclass replaceAll wins.","result":"Reduced String full bounded workload from 3 to 2; remaining failures are only duplicate named RegExp group match/indices cases rejected before runtime matching.","next_action_hint":"The remaining String blocker is duplicate named group parsing/compilation. Simple lexer validation changes are insufficient because QuickJS native bytecode rejects duplicate names before VM fallback."}}
{"type":"config","name":"Optimize QuickBEAM built-ins/Date Test262 compatibility reprise","metricName":"compatibility_failures","metricUnit":"","bestDirection":"lower"}
{"run":1456,"commit":"9b1e83f","metric":10,"metrics":{"compiler_test262_cases":594,"compiler_test262_pass":584,"compiler_test262_failures":10,"compiler_test262_compiler_errors":0,"compiler_test262_compiler_crashes":0,"compiler_test262_compiler_fails":0,"compiler_test262_both_fail":9,"compiler_test262_interpreter_fail_compiler_pass":0,"compatibility_pass":584,"compatibility_cases":594,"compiler_errors":0,"compiler_crashes":0,"compiler_fails":0,"both_fail":9,"interpreter_fail_compiler_pass":0,"elapsed_ms":26231},"status":"keep","description":"Baseline Date reprise after String improvements","timestamp":1778799726639,"segment":121,"confidence":null,"iterationTokens":129,"asi":{"hypothesis":"String is down to duplicate named RegExp group cases blocked before runtime fallback, so rebaseline Date reprise to search for semantic runtime wins.","result":"Date baseline is 10 failures out of 594: six 1899/1900 local constructor cases, Date Symbol.toPrimitive invalid hint, setFullYear year coercion/BCE offset, one toISOString year boundary case, and a toJSON ToObject interpreter crash.","next_action_hint":"Start with toJSON/to-object crash or Symbol.toPrimitive invalid-hint because they are narrower than timezone/local-constructor historical offset cases."}}
{"run":1457,"commit":"3eff26c","metric":9,"metrics":{"compiler_test262_cases":594,"compiler_test262_pass":585,"compiler_test262_failures":9,"compiler_test262_compiler_errors":0,"compiler_test262_compiler_crashes":0,"compiler_test262_compiler_fails":0,"compiler_test262_both_fail":9,"compiler_test262_interpreter_fail_compiler_pass":0,"compatibility_pass":585,"compatibility_cases":594,"compiler_errors":0,"compiler_crashes":0,"compiler_fails":0,"both_fail":9,"interpreter_fail_compiler_pass":0,"elapsed_ms":26011},"status":"keep","description":"Coerce Date.toJSON primitive receivers through ToObject","timestamp":1778799972273,"segment":121,"confidence":null,"iterationTokens":7623,"asi":{"hypothesis":"Date.prototype.toJSON first applies ToObject to its receiver; symbol primitives should remain valid primitives for ToPrimitive and then find Symbol.prototype.toISOString, while nullish receivers must throw TypeError.","result":"Reduced Date reprise from 10 to 9 by fixing toJSON/to-object; interpreter crash category disappeared and checks passed.","next_action_hint":"Remaining Date failures are six 1899/1900 local constructor cases, Symbol.toPrimitive invalid hint, setFullYear year-to-number BCE offset, and one toISOString boundary case."}}
{"run":1458,"commit":"6d0ba14","metric":8,"metrics":{"compiler_test262_cases":594,"compiler_test262_pass":586,"compiler_test262_failures":8,"compiler_test262_compiler_errors":0,"compiler_test262_compiler_crashes":0,"compiler_test262_compiler_fails":0,"compiler_test262_both_fail":8,"compiler_test262_interpreter_fail_compiler_pass":0,"compatibility_pass":586,"compatibility_cases":594,"compiler_errors":0,"compiler_crashes":0,"compiler_fails":0,"both_fail":8,"interpreter_fail_compiler_pass":0,"elapsed_ms":25808},"status":"keep","description":"Expose Date Symbol.toPrimitive on instances","timestamp":1778800582753,"segment":121,"confidence":2,"iterationTokens":15580,"asi":{"hypothesis":"Date instances bypassed symbol-key prototype lookup through Put.get_element/Get date branches, so d[Symbol.toPrimitive] was undefined. Preserving symbol keys in element reads and falling back Date instances to Date.prototype symbol methods should expose the method; missing/undefined hints must throw rather than defaulting to string.","result":"Reduced Date reprise from 9 to 8 by fixing Date/prototype/Symbol.toPrimitive/hint-invalid; checks passed.","next_action_hint":"Remaining Date failures are six 1899/1900 local constructor timezone/history cases, setFullYear arg-year-to-number BCE offset, and toISOString year-boundary case."}}
{"run":1459,"commit":"6d0ba14","metric":21,"metrics":{"compiler_test262_cases":594,"compiler_test262_pass":573,"compiler_test262_failures":21,"compiler_test262_compiler_errors":0,"compiler_test262_compiler_crashes":0,"compiler_test262_compiler_fails":0,"compiler_test262_both_fail":21,"compiler_test262_interpreter_fail_compiler_pass":0,"compatibility_pass":573,"compatibility_cases":594,"compiler_errors":0,"compiler_crashes":0,"compiler_fails":0,"both_fail":21,"interpreter_fail_compiler_pass":0,"elapsed_ms":25749},"status":"discard","description":"Apply local timezone offset to Date component constructor","timestamp":1778800787686,"segment":121,"confidence":2,"iterationTokens":4087,"asi":{"hypothesis":"Date component constructors should convert local time to UTC by applying getTimezoneOffset broadly, which should fix the remaining toISOString localDate offset and historical local-constructor failures.","rollback_reason":"Primary regressed from 8 to 21 despite fixing the focused toISOString localDate case; broad local-constructor timezone offset changes reintroduce many Date failures.","next_action_hint":"Do not broadly apply tz_offset_minutes in local_from_components. Future Date timezone work needs targeted historical/year-boundary handling rather than global local constructor offset."}}
{"run":1460,"commit":"ce26796","metric":7,"metrics":{"compiler_test262_cases":594,"compiler_test262_pass":587,"compiler_test262_failures":7,"compiler_test262_compiler_errors":0,"compiler_test262_compiler_crashes":0,"compiler_test262_compiler_fails":0,"compiler_test262_both_fail":7,"compiler_test262_interpreter_fail_compiler_pass":0,"compatibility_pass":587,"compatibility_cases":594,"compiler_errors":0,"compiler_crashes":0,"compiler_fails":0,"both_fail":7,"interpreter_fail_compiler_pass":0,"elapsed_ms":25774},"status":"keep","description":"Use positive time-within-day for Date setters","timestamp":1778801083446,"segment":121,"confidence":3,"iterationTokens":5042,"asi":{"hypothesis":"Date setter MakeDate uses TimeWithinDay(t), which must be a positive modulo for negative timestamps. Using rem/2 directly made setFullYear after BCE dates carry a negative time remainder and shift the day backward.","result":"Reduced Date reprise from 8 to 7 by fixing Date/prototype/setFullYear/arg-year-to-number; checks passed.","next_action_hint":"Remaining Date failures are six local constructor 1899/1900 cases plus toISOString localDate timezone behavior. Avoid broad local_from_components timezone offset because it regressed to 21 failures."}}
