{"run":981,"commit":"418ea86","metric":71,"metrics":{"compiler_test262_cases":500,"compiler_test262_pass":429,"compiler_test262_failures":71,"compiler_test262_compiler_errors":0,"compiler_test262_compiler_crashes":0,"compiler_test262_compiler_fails":0,"compiler_test262_both_fail":67,"compiler_test262_interpreter_fail_compiler_pass":0,"compatibility_pass":429,"compatibility_cases":500,"compiler_errors":0,"compiler_crashes":0,"compiler_fails":0,"both_fail":67,"interpreter_fail_compiler_pass":0,"elapsed_ms":43881},"status":"keep","description":"Recognize float array indices","timestamp":1778557765153,"segment":42,"confidence":5.2,"iterationTokens":5493,"asi":{"hypothesis":"Integral non-negative floating-point property keys within the array-index range should be classified as array indices so high numeric writes grow array length","improvement":"Reduced Array failures from 72 to 71 (−1), fixing high boundary numeric index length growth","next_action_hint":"Runtime slower on this run likely from noise/large-index case; continue targeting remaining Array length coercion, Array.from descriptor, and concat species/proxy clusters."}}
{"run":982,"commit":"2a66481","metric":70,"metrics":{"compiler_test262_cases":500,"compiler_test262_pass":430,"compiler_test262_failures":70,"compiler_test262_compiler_errors":0,"compiler_test262_compiler_crashes":0,"compiler_test262_compiler_fails":0,"compiler_test262_both_fail":67,"compiler_test262_interpreter_fail_compiler_pass":0,"compatibility_pass":430,"compatibility_cases":500,"compiler_errors":0,"compiler_crashes":0,"compiler_fails":0,"both_fail":67,"interpreter_fail_compiler_pass":0,"elapsed_ms":30575},"status":"keep","description":"Virtualize huge array index writes","timestamp":1778558132615,"segment":42,"confidence":6.310344827586207,"iterationTokens":8508,"asi":{"hypothesis":"Writes far beyond current array storage should be represented sparsely with a virtual length instead of materializing enormous array storage, and length shrink should delete sparse indexed side properties","improvement":"Reduced Array failures from 71 to 70 (−1), fixing high index deletion after length shrink without timeout","next_action_hint":"Continue with length coercion-order/realm failures and Array.from/Array.of/concat clusters. Watch for sparse-array presence semantics before extending this beyond huge writes."}}
{"run":983,"commit":"2a66481","metric":0,"metrics":{"compiler_test262_cases":0,"compiler_test262_pass":0,"compiler_test262_failures":0,"compiler_test262_compiler_errors":0,"compiler_test262_compiler_crashes":0,"compiler_test262_compiler_fails":0,"compiler_test262_both_fail":0,"compiler_test262_interpreter_fail_compiler_pass":0,"compatibility_pass":0,"compatibility_cases":0,"compiler_errors":0,"compiler_crashes":0,"compiler_fails":0,"both_fail":0,"interpreter_fail_compiler_pass":0,"elapsed_ms":47400},"status":"crash","description":"Add Array.prototype length property","timestamp":1778558259977,"segment":42,"confidence":6.310344827586207,"iterationTokens":8920,"asi":{"hypothesis":"Array.prototype should have an own length property with value 0 rather than deriving length from method map size","rollback_reason":"Broad Array run was killed with exit 137 after adding length directly to the Array.prototype map, likely interacting with array prototype lookup/copyWithin paths or increasing resource use unexpectedly","next_action_hint":"Do not retry unchanged. If revisiting, represent Array.prototype.length via descriptor/virtual lookup without making it part of enumerable object storage or altering map size semantics."}}
{"run":984,"commit":"c6f8cc6","metric":69,"metrics":{"compiler_test262_cases":500,"compiler_test262_pass":431,"compiler_test262_failures":69,"compiler_test262_compiler_errors":0,"compiler_test262_compiler_crashes":0,"compiler_test262_compiler_fails":0,"compiler_test262_both_fail":66,"compiler_test262_interpreter_fail_compiler_pass":0,"compatibility_pass":431,"compatibility_cases":500,"compiler_errors":0,"compiler_crashes":0,"compiler_fails":0,"both_fail":66,"interpreter_fail_compiler_pass":0,"elapsed_ms":30561},"status":"keep","description":"Virtualize Array prototype length reads","timestamp":1778558726456,"segment":42,"confidence":6.6909090909090905,"iterationTokens":13241,"asi":{"hypothesis":"Array.prototype length should be read as 0 without storing length in the prototype's method map, avoiding the previous OOM/killed attempt","improvement":"Reduced Array failures from 70 to 69 (−1), fixing Array.prototype.length while preserving broad run stability","next_action_hint":"Descriptor semantics for Array.prototype.length may still be incomplete; continue with remaining Array.from non-writable overwrite, length coercion, and concat species clusters."}}
{"run":985,"commit":"0ba5487","metric":66,"metrics":{"compiler_test262_cases":500,"compiler_test262_pass":434,"compiler_test262_failures":66,"compiler_test262_compiler_errors":0,"compiler_test262_compiler_crashes":0,"compiler_test262_compiler_fails":0,"compiler_test262_both_fail":63,"compiler_test262_interpreter_fail_compiler_pass":0,"compatibility_pass":434,"compatibility_cases":500,"compiler_errors":0,"compiler_crashes":0,"compiler_fails":0,"both_fail":63,"interpreter_fail_compiler_pass":0,"elapsed_ms":30538},"status":"keep","description":"Construct Array.of custom results","timestamp":1778559091112,"segment":42,"confidence":7.1923076923076925,"iterationTokens":16475,"asi":{"hypothesis":"Array.of should use constructable this values, pass the argument count to the constructor, define elements with CreateDataPropertyOrThrow, and set length through ordinary setter semantics","improvement":"Reduced Array failures from 69 to 66 (−3), fixing Array.of constructor count/custom instance/length setter/data-property abrupt cases","next_action_hint":"Array.of proto-from-ctor-realm may remain due realm support; continue with Array.from non-writable descriptor overwrite or concat species/proxy cluster."}}
{"run":986,"commit":"e29bb4d","metric":65,"metrics":{"compiler_test262_cases":500,"compiler_test262_pass":435,"compiler_test262_failures":65,"compiler_test262_compiler_errors":0,"compiler_test262_compiler_crashes":0,"compiler_test262_compiler_fails":0,"compiler_test262_both_fail":62,"compiler_test262_interpreter_fail_compiler_pass":0,"compatibility_pass":435,"compatibility_cases":500,"compiler_errors":0,"compiler_crashes":0,"compiler_fails":0,"both_fail":62,"interpreter_fail_compiler_pass":0,"elapsed_ms":30587},"status":"keep","description":"Respect bound constructor targets in Array factories","timestamp":1778559276852,"segment":42,"confidence":7.09433962264151,"iterationTokens":3446,"asi":{"hypothesis":"Bound functions used as Array.of/Array.from this constructors should be considered constructable only when their target is constructable","improvement":"Reduced Array failures from 66 to 65 (−1), fixing Array.of.call(Math.cos.bind(Math)) fallback to a normal Array","next_action_hint":"This helper is local to Array factories; consider broader IsConstructor semantics later, but continue with Array.from descriptor overwrite or concat species clusters."}}
{"run":987,"commit":"56596cf","metric":62,"metrics":{"compiler_test262_cases":500,"compiler_test262_pass":438,"compiler_test262_failures":62,"compiler_test262_compiler_errors":0,"compiler_test262_compiler_crashes":0,"compiler_test262_compiler_fails":0,"compiler_test262_both_fail":59,"compiler_test262_interpreter_fail_compiler_pass":0,"compatibility_pass":438,"compatibility_cases":500,"compiler_errors":0,"compiler_crashes":0,"compiler_fails":0,"both_fail":59,"interpreter_fail_compiler_pass":0,"elapsed_ms":30414},"status":"keep","description":"Return Array prototypes for array objects","timestamp":1778559521005,"segment":42,"confidence":7.074074074074074,"iterationTokens":7053,"asi":{"hypothesis":"Object.getPrototypeOf should return the cached Array.prototype for heap-backed array objects rather than nil","improvement":"Reduced Array failures from 65 to 62 (−3), fixing concat result prototype checks for ordinary array creation paths","next_action_hint":"Remaining concat species failures likely require ArraySpeciesCreate and constructor/proxy semantics; Array.from descriptor overwrite remains another targeted path."}}
{"run":988,"commit":"1c8cd35","metric":58,"metrics":{"compiler_test262_cases":500,"compiler_test262_pass":442,"compiler_test262_failures":58,"compiler_test262_compiler_errors":0,"compiler_test262_compiler_crashes":0,"compiler_test262_compiler_fails":0,"compiler_test262_both_fail":55,"compiler_test262_interpreter_fail_compiler_pass":0,"compatibility_pass":442,"compatibility_cases":500,"compiler_errors":0,"compiler_crashes":0,"compiler_fails":0,"both_fail":55,"interpreter_fail_compiler_pass":0,"elapsed_ms":39981},"status":"keep","description":"Read Array.every length before callback validation","timestamp":1778559929929,"segment":42,"confidence":7.090909090909091,"iterationTokens":15241,"asi":{"hypothesis":"Array.prototype.every should perform LengthOfArrayLike before rejecting a non-callable callback so observable length getters run in spec order","improvement":"Reduced Array failures from 62 to 58 (−4), fixing observable length getter order cases in Array.every","next_action_hint":"Remaining every failures likely involve sparse/presence/prototype semantics; continue with Array.from descriptor overwrite or concat species after checking latest cluster."}}
{"run":989,"commit":"9ebc3d5","metric":56,"metrics":{"compiler_test262_cases":500,"compiler_test262_pass":444,"compiler_test262_failures":56,"compiler_test262_compiler_errors":0,"compiler_test262_compiler_crashes":0,"compiler_test262_compiler_fails":0,"compiler_test262_both_fail":53,"compiler_test262_interpreter_fail_compiler_pass":0,"compatibility_pass":444,"compatibility_cases":500,"compiler_errors":0,"compiler_crashes":0,"compiler_fails":0,"both_fail":53,"interpreter_fail_compiler_pass":0,"elapsed_ms":30559},"status":"keep","description":"Clamp Array.every lengths with ToLength","timestamp":1778560182678,"segment":42,"confidence":7.035714285714286,"iterationTokens":6633,"asi":{"hypothesis":"Array.prototype.every LengthOfArrayLike should use ToLength semantics, including clamping positive Infinity to the maximum safe integer instead of treating it as zero","improvement":"Reduced Array failures from 58 to 56 (−2), fixing Infinity and string Infinity length cases that short-circuit on index 0","next_action_hint":"Remaining every failures are mostly sparse/prototype presence and mutation semantics; continue with targeted every presence checks or concat species."}}
{"run":990,"commit":"0fbf34b","metric":53,"metrics":{"compiler_test262_cases":500,"compiler_test262_pass":447,"compiler_test262_failures":53,"compiler_test262_compiler_errors":0,"compiler_test262_compiler_crashes":0,"compiler_test262_compiler_fails":1,"compiler_test262_both_fail":50,"compiler_test262_interpreter_fail_compiler_pass":0,"compatibility_pass":447,"compatibility_cases":500,"compiler_errors":0,"compiler_crashes":0,"compiler_fails":1,"both_fail":50,"interpreter_fail_compiler_pass":0,"elapsed_ms":18658},"status":"keep","description":"Apply Array.every property checks and thisArg presence","timestamp":1778560420317,"segment":42,"confidence":6.896551724137931,"iterationTokens":11899,"asi":{"hypothesis":"Array.prototype.every should preserve explicit false/null thisArg values, read length before missing-callback TypeError, and skip indices that no longer have a property after mutation","improvement":"Reduced Array failures from 56 to 53 (−3), fixing explicit boolean thisArg, no-callback length getter ordering, and shrink/delete iteration cases","caution":"Run introduced one compiler_fails while still improving the primary metric; monitor whether this is an existing descriptor-leak/compiler-only case or caused by every property checks","next_action_hint":"Inspect latest compiler-only failure before further every changes; if stable, continue with arguments object element presence or concat species."}}
{"run":991,"commit":"88ae9cf","metric":52,"metrics":{"compiler_test262_cases":500,"compiler_test262_pass":448,"compiler_test262_failures":52,"compiler_test262_compiler_errors":0,"compiler_test262_compiler_crashes":0,"compiler_test262_compiler_fails":1,"compiler_test262_both_fail":49,"compiler_test262_interpreter_fail_compiler_pass":0,"compatibility_pass":448,"compatibility_cases":500,"compiler_errors":0,"compiler_crashes":0,"compiler_fails":1,"both_fail":49,"interpreter_fail_compiler_pass":0,"elapsed_ms":18634},"status":"keep","description":"Keep arguments length fixed on out-of-range writes","timestamp":1778560654604,"segment":42,"confidence":6.7,"iterationTokens":6153,"asi":{"hypothesis":"Arguments exotic objects backed by qb_arr storage should preserve their initial length when writing out-of-range indices, storing those writes as side properties instead of extending dense storage","improvement":"Reduced Array failures from 53 to 52 (−1), fixing Array.every over arguments objects after arguments[2] assignment","caution":"The same compiler-only descriptor/prototype leakage failure remains; not worsened by this change.","next_action_hint":"Continue with remaining every sparse/prototype cases or shift to concat species; avoid broad sparse constructor holes."}}
{"run":992,"commit":"cb163a4","metric":44,"metrics":{"compiler_test262_cases":500,"compiler_test262_pass":456,"compiler_test262_failures":44,"compiler_test262_compiler_errors":0,"compiler_test262_compiler_crashes":0,"compiler_test262_compiler_fails":1,"compiler_test262_both_fail":41,"compiler_test262_interpreter_fail_compiler_pass":0,"compatibility_pass":456,"compatibility_cases":500,"compiler_errors":0,"compiler_crashes":0,"compiler_fails":1,"both_fail":41,"interpreter_fail_compiler_pass":0,"elapsed_ms":18842},"status":"keep","description":"Track undefined array elements for every","timestamp":1778560876400,"segment":42,"confidence":6.634920634920635,"iterationTokens":5473,"asi":{"hypothesis":"Array element writes of explicit undefined need descriptor presence metadata, and Array HasProperty should include Array.prototype so Array.every visits explicit undefined elements and inherited index properties while still skipping holes","improvement":"Reduced Array failures from 52 to 44 (−8), fixing multiple Array.every sparse, deleted, and inherited-index property cases","caution":"The same compiler-only prototype leakage case remains; descriptor presence changes improved broad metric substantially but should be monitored across Object/Function later.","next_action_hint":"Latest failures now concentrate in concat species/proxy, remaining every mutation cases, Array.from non-writable descriptor overwrite, and realm/resizable-buffer tests."}}
{"run":993,"commit":"d9e481f","metric":42,"metrics":{"compiler_test262_cases":500,"compiler_test262_pass":458,"compiler_test262_failures":42,"compiler_test262_compiler_errors":0,"compiler_test262_compiler_crashes":0,"compiler_test262_compiler_fails":1,"compiler_test262_both_fail":39,"compiler_test262_interpreter_fail_compiler_pass":0,"compatibility_pass":458,"compatibility_cases":500,"compiler_errors":0,"compiler_crashes":0,"compiler_fails":1,"both_fail":39,"interpreter_fail_compiler_pass":0,"elapsed_ms":19070},"status":"keep","description":"Check callable properties in Array.every","timestamp":1778561059806,"segment":42,"confidence":6.393939393939394,"iterationTokens":2884,"asi":{"hypothesis":"HasProperty for callable objects should observe their own properties so Array.every over function objects with indexed properties invokes the callback","improvement":"Reduced Array failures from 44 to 42 (−2), fixing Array.every applied to Function objects and a related callable indexed-property case","caution":"Compiler-only prototype leakage case remains unchanged.","next_action_hint":"Remaining failures are mostly concat species/proxy/spreadable plus a smaller Array.every mutation cluster and realm/resizable-buffer unsupported cases."}}
{"run":994,"commit":"cd9804e","metric":41,"metrics":{"compiler_test262_cases":500,"compiler_test262_pass":459,"compiler_test262_failures":41,"compiler_test262_compiler_errors":0,"compiler_test262_compiler_crashes":0,"compiler_test262_compiler_fails":1,"compiler_test262_both_fail":38,"compiler_test262_interpreter_fail_compiler_pass":0,"compatibility_pass":459,"compatibility_cases":500,"compiler_errors":0,"compiler_crashes":0,"compiler_fails":1,"both_fail":38,"interpreter_fail_compiler_pass":0,"elapsed_ms":19214},"status":"keep","description":"Read Function prototype concat spreadability","timestamp":1778561288735,"segment":42,"confidence":6.3283582089552235,"iterationTokens":4506,"asi":{"hypothesis":"Array.prototype.concat should observe Function.prototype[Symbol.isConcatSpreadable] for callable items without enabling broad symbol fallback that previously regressed Function tests","improvement":"Reduced Array failures from 42 to 41 (−1), fixing function concat spreadability through Function.prototype","next_action_hint":"RegExp/string-wrapper spreadability still need prototype/own property semantics; continue with concat species or remaining every cases."}}
{"run":995,"commit":"5867239","metric":34,"metrics":{"compiler_test262_cases":500,"compiler_test262_pass":466,"compiler_test262_failures":34,"compiler_test262_compiler_errors":0,"compiler_test262_compiler_crashes":0,"compiler_test262_compiler_fails":1,"compiler_test262_both_fail":31,"compiler_test262_interpreter_fail_compiler_pass":0,"compatibility_pass":466,"compatibility_cases":500,"compiler_errors":0,"compiler_crashes":0,"compiler_fails":1,"both_fail":31,"interpreter_fail_compiler_pass":0,"elapsed_ms":18908},"status":"keep","description":"Use species constructors for Array.concat","timestamp":1778561501752,"segment":42,"confidence":6.4411764705882355,"iterationTokens":4275,"asi":{"hypothesis":"Array.prototype.concat should use ArraySpeciesCreate for array receivers, constructing custom species targets, validating non-constructors, defining result elements, and setting length on the target","improvement":"Reduced Array failures from 41 to 34 (−7), fixing multiple concat species constructor and non-configurable/non-extensible result cases","caution":"Implementation is intentionally limited to array receivers and avoids broad spreadable materialization; remaining realm/proxy species tests likely need deeper constructor/proxy support.","next_action_hint":"Continue with remaining concat proxy/realm/spreadable RegExp/string wrapper or Array.from descriptor overwrite."}}
{"run":996,"commit":"7f6f51e","metric":33,"metrics":{"compiler_test262_cases":500,"compiler_test262_pass":467,"compiler_test262_failures":33,"compiler_test262_compiler_errors":0,"compiler_test262_compiler_crashes":0,"compiler_test262_compiler_fails":1,"compiler_test262_both_fail":30,"compiler_test262_interpreter_fail_compiler_pass":0,"compatibility_pass":467,"compatibility_cases":500,"compiler_errors":0,"compiler_crashes":0,"compiler_fails":1,"both_fail":30,"interpreter_fail_compiler_pass":0,"elapsed_ms":19145},"status":"keep","description":"Read inherited array elements within length","timestamp":1778561799670,"segment":42,"confidence":6.3768115942028984,"iterationTokens":15502,"asi":{"hypothesis":"Array index reads for holes within the current length should consult the prototype chain unless the array has explicit undefined descriptor presence","improvement":"Reduced Array failures from 34 to 33 (−1), fixing concat copying of inherited indexed properties from Array/Object prototype","caution":"Same-process prototype mutation can still leave one compiler-only failure in sequential interpreter/compiler runs.","next_action_hint":"Continue with concat spreadable RegExp/string wrapper or Array.from descriptor overwrite; avoid turning all holes into own undefined properties."}}
{"run":997,"commit":"7f6f51e","metric":33,"metrics":{"compiler_test262_cases":500,"compiler_test262_pass":467,"compiler_test262_failures":33,"compiler_test262_compiler_errors":0,"compiler_test262_compiler_crashes":0,"compiler_test262_compiler_fails":2,"compiler_test262_both_fail":29,"compiler_test262_interpreter_fail_compiler_pass":0,"compatibility_pass":467,"compatibility_cases":500,"compiler_errors":0,"compiler_crashes":0,"compiler_fails":2,"both_fail":29,"interpreter_fail_compiler_pass":0,"elapsed_ms":19141},"status":"discard","description":"Make generator iterators self-iterable","timestamp":1778562083536,"segment":42,"confidence":6.285714285714286,"iterationTokens":7716,"asi":{"hypothesis":"Generator iterator objects should expose [Symbol.iterator] returning themselves so Array.from consumes generator sources through the iterable path","rollback_reason":"Primary metric stayed flat at 33 and compiler-only failures increased from 1 to 2 despite moving one failure from both_fail to compiler_fail","next_action_hint":"Do not retry unchanged. Fix compiled generator iterator parity or same-process constructor/descriptor leakage before reintroducing generator self-iterability."}}
