{"run":1054,"commit":"72c47a9","metric":6,"metrics":{"compiler_test262_cases":47,"compiler_test262_pass":41,"compiler_test262_failures":6,"compiler_test262_compiler_errors":0,"compiler_test262_compiler_crashes":0,"compiler_test262_compiler_fails":1,"compiler_test262_both_fail":5,"compiler_test262_interpreter_fail_compiler_pass":0,"compatibility_pass":41,"compatibility_cases":47,"compiler_errors":0,"compiler_crashes":0,"compiler_fails":1,"both_fail":5,"interpreter_fail_compiler_pass":0,"elapsed_ms":2861},"status":"keep","description":"Cover builtin definition DSL metadata","timestamp":1778614736282,"segment":48,"confidence":null,"iterationTokens":2354,"asi":{"hypothesis":"Adding a focused ExUnit assertion for builtin_definition macro output should document the new separation-of-concerns path without changing FinalizationRegistry compatibility."}}
{"run":1055,"commit":"3fe5f6a","metric":3,"metrics":{"compiler_test262_cases":47,"compiler_test262_pass":44,"compiler_test262_failures":3,"compiler_test262_compiler_errors":0,"compiler_test262_compiler_crashes":0,"compiler_test262_compiler_fails":1,"compiler_test262_both_fail":2,"compiler_test262_interpreter_fail_compiler_pass":0,"compatibility_pass":44,"compatibility_cases":47,"compiler_errors":0,"compiler_crashes":0,"compiler_fails":1,"both_fail":2,"interpreter_fail_compiler_pass":0,"elapsed_ms":2842},"status":"keep","description":"Handle FinalizationRegistry function keys and realm intrinsic","timestamp":1778615070610,"segment":48,"confidence":null,"iterationTokens":13074,"asi":{"hypothesis":"FinalizationRegistry register/unregister semantics share CanBeHeldWeakly with weak collections but must accept callable objects as weak targets and reject null unregister tokens; realm-created constructors also need a FinalizationRegistry intrinsic default prototype."}}
{"run":1056,"commit":"5bd4320","metric":1,"metrics":{"compiler_test262_cases":47,"compiler_test262_pass":46,"compiler_test262_failures":1,"compiler_test262_compiler_errors":0,"compiler_test262_compiler_crashes":0,"compiler_test262_compiler_fails":1,"compiler_test262_both_fail":0,"compiler_test262_interpreter_fail_compiler_pass":0,"compatibility_pass":46,"compatibility_cases":47,"compiler_errors":0,"compiler_crashes":0,"compiler_fails":1,"both_fail":0,"interpreter_fail_compiler_pass":0,"elapsed_ms":2835},"status":"keep","description":"Treat bound functions as constructor newTargets","timestamp":1778615310414,"segment":48,"confidence":null,"iterationTokens":6592,"asi":{"hypothesis":"Bound functions are function objects and constructable newTargets; Object.defineProperty must accept them and Reflect.construct must preserve the bound newTarget so prototype accessors are observed for FinalizationRegistry construction."}}
{"run":1057,"commit":"7dc9cd0","metric":0,"metrics":{"compiler_test262_cases":47,"compiler_test262_pass":47,"compiler_test262_failures":0,"compiler_test262_compiler_errors":0,"compiler_test262_compiler_crashes":0,"compiler_test262_compiler_fails":0,"compiler_test262_both_fail":0,"compiler_test262_interpreter_fail_compiler_pass":0,"compatibility_pass":47,"compatibility_cases":47,"compiler_errors":0,"compiler_crashes":0,"compiler_fails":0,"both_fail":0,"interpreter_fail_compiler_pass":0,"elapsed_ms":3728},"status":"keep","description":"Respect overwritten function prototype statics","timestamp":1778615713422,"segment":48,"confidence":null,"iterationTokens":11218,"asi":{"hypothesis":"BEAM-compiled function objects can store an overwritten own 'prototype' static; Get must consult that static before falling back to the virtual default function prototype so Reflect.construct sees non-object newTarget.prototype values correctly."}}
{"type":"config","name":"QuickBEAM Test262 built-ins/WeakRef compatibility follow-up","metricName":"compatibility_failures","metricUnit":"","bestDirection":"lower"}
{"run":1058,"commit":"c99a0b6","metric":0,"metrics":{"compiler_test262_cases":29,"compiler_test262_pass":29,"compiler_test262_failures":0,"compiler_test262_compiler_errors":0,"compiler_test262_compiler_crashes":0,"compiler_test262_compiler_fails":0,"compiler_test262_both_fail":0,"compiler_test262_interpreter_fail_compiler_pass":0,"compatibility_pass":29,"compatibility_cases":29,"compiler_errors":0,"compiler_crashes":0,"compiler_fails":0,"both_fail":0,"interpreter_fail_compiler_pass":0,"elapsed_ms":2419},"status":"keep","description":"Rebaseline built-ins/WeakRef after newTarget fixes","timestamp":1778615873947,"segment":49,"confidence":null,"iterationTokens":131,"asi":{"hypothesis":"The FinalizationRegistry newTarget and function-prototype fixes should also clear WeakRef's remaining analogous newTarget failures, so rebaseline the bounded WeakRef workload before selecting a new category."}}
{"type":"config","name":"QuickBEAM Test262 built-ins/Function compatibility after function prototype fixes","metricName":"compatibility_failures","metricUnit":"","bestDirection":"lower"}
{"run":1059,"commit":"85ee3b3","metric":101,"metrics":{"compiler_test262_cases":509,"compiler_test262_pass":408,"compiler_test262_failures":101,"compiler_test262_compiler_errors":0,"compiler_test262_compiler_crashes":0,"compiler_test262_compiler_fails":2,"compiler_test262_both_fail":94,"compiler_test262_interpreter_fail_compiler_pass":3,"compatibility_pass":408,"compatibility_cases":509,"compiler_errors":0,"compiler_crashes":0,"compiler_fails":2,"both_fail":94,"interpreter_fail_compiler_pass":3,"elapsed_ms":60116},"status":"keep","description":"Rebaseline built-ins/Function after weak newTarget fixes","timestamp":1778616112962,"segment":50,"confidence":null,"iterationTokens":131,"asi":{"hypothesis":"Function prototype-static and bound-newTarget fixes may have improved the previously plateaued Function built-ins workload, so establish a fresh baseline and carry the weak-ref solved-ideas pruning forward."}}
{"run":1060,"commit":"HEAD","metric":105,"metrics":{"compiler_test262_cases":509,"compiler_test262_pass":404,"compiler_test262_failures":105,"compiler_test262_compiler_errors":0,"compiler_test262_compiler_crashes":0,"compiler_test262_compiler_fails":2,"compiler_test262_both_fail":99,"compiler_test262_interpreter_fail_compiler_pass":2,"compatibility_pass":404,"compatibility_cases":509,"compiler_errors":0,"compiler_crashes":0,"compiler_fails":2,"both_fail":99,"interpreter_fail_compiler_pass":2,"elapsed_ms":56172},"status":"discard","description":"Materialize Function.prototype restricted and metadata properties","timestamp":1778616667640,"segment":50,"confidence":null,"iterationTokens":20767,"asi":{"hypothesis":"Adding length/name and restricted caller/arguments properties directly to the current object-backed Function.prototype could fix descriptor failures without changing Function.prototype callability.","rollback_reason":"Broad Function workload regressed from 101 to 105; same-process and Function.prototype object/callability semantics interact badly with the partial materialization.","next_action_hint":"Do not retry partial Function.prototype property materialization unchanged. If revisiting Function.prototype, address it coherently as a callable Function object with descriptor storage and avoid self-prototype cycles first."}}
{"type":"config","name":"QuickBEAM Test262 built-ins/Set compatibility after weak/function fixes","metricName":"compatibility_failures","metricUnit":"","bestDirection":"lower"}
{"run":1061,"commit":"1a56f3d","metric":4,"metrics":{"compiler_test262_cases":300,"compiler_test262_pass":296,"compiler_test262_failures":4,"compiler_test262_compiler_errors":0,"compiler_test262_compiler_crashes":0,"compiler_test262_compiler_fails":0,"compiler_test262_both_fail":4,"compiler_test262_interpreter_fail_compiler_pass":0,"compatibility_pass":296,"compatibility_cases":300,"compiler_errors":0,"compiler_crashes":0,"compiler_fails":0,"both_fail":4,"interpreter_fail_compiler_pass":0,"elapsed_ms":13313},"status":"keep","description":"Rebaseline built-ins/Set after weak/function fixes","timestamp":1778616818135,"segment":51,"confidence":null,"iterationTokens":131,"asi":{"hypothesis":"Set remains a small partially solved collection workload after weak refs reached zero; rebaseline the bounded slice before targeting the remaining set-like ordering failures."}}
{"type":"config","name":"QuickBEAM Test262 built-ins/Reflect compatibility","metricName":"compatibility_failures","metricUnit":"","bestDirection":"lower"}
{"run":1062,"commit":"5643e2c","metric":67,"metrics":{"compiler_test262_cases":153,"compiler_test262_pass":86,"compiler_test262_failures":67,"compiler_test262_compiler_errors":0,"compiler_test262_compiler_crashes":0,"compiler_test262_compiler_fails":0,"compiler_test262_both_fail":66,"compiler_test262_interpreter_fail_compiler_pass":0,"compatibility_pass":86,"compatibility_cases":153,"compiler_errors":0,"compiler_crashes":0,"compiler_fails":0,"both_fail":66,"interpreter_fail_compiler_pass":0,"elapsed_ms":7355},"status":"keep","description":"Baseline built-ins/Reflect compatibility","timestamp":1778617225797,"segment":52,"confidence":null,"iterationTokens":127,"asi":{"hypothesis":"Reflect is a bounded runtime/object-model workload with many methods likely missing descriptor or dispatch semantics, and may expose tractable improvements after collections/weak-ref categories reached zero or small plateaus."}}
{"run":1063,"commit":"39662ea","metric":54,"metrics":{"compiler_test262_cases":153,"compiler_test262_pass":99,"compiler_test262_failures":54,"compiler_test262_compiler_errors":0,"compiler_test262_compiler_crashes":0,"compiler_test262_compiler_fails":0,"compiler_test262_both_fail":53,"compiler_test262_interpreter_fail_compiler_pass":0,"compatibility_pass":99,"compatibility_cases":153,"compiler_errors":0,"compiler_crashes":0,"compiler_fails":0,"both_fail":53,"interpreter_fail_compiler_pass":0,"elapsed_ms":7602},"status":"keep","description":"Install Reflect method descriptors","timestamp":1778617537425,"segment":52,"confidence":null,"iterationTokens":18790,"asi":{"hypothesis":"Reflect is a named builtin object whose methods need own non-enumerable descriptors, per-method length statics, Symbol.toStringTag, and Object.prototype linkage; installing this metadata should clear descriptor and constructor-shape failures without changing method algorithms."}}
{"run":1064,"commit":"HEAD","metric":37,"metrics":{"compiler_test262_cases":153,"compiler_test262_pass":116,"compiler_test262_failures":37,"compiler_test262_compiler_errors":0,"compiler_test262_compiler_crashes":0,"compiler_test262_compiler_fails":0,"compiler_test262_both_fail":36,"compiler_test262_interpreter_fail_compiler_pass":0,"compatibility_pass":116,"compatibility_cases":153,"compiler_errors":0,"compiler_crashes":0,"compiler_fails":0,"both_fail":36,"interpreter_fail_compiler_pass":0,"elapsed_ms":7366},"status":"checks_failed","description":"Require Reflect object targets and array-like arguments","timestamp":1778617646786,"segment":52,"confidence":1,"iterationTokens":11666,"asi":{"hypothesis":"Reflect methods should reject primitive targets and Reflect.apply/construct should use CreateListFromArrayLike instead of Heap.to_list so object/function wrappers with length getters produce argument lists.","rollback_reason":"Backpressure checks expect current compile helper semantics where Reflect.preventExtensions on a primitive returns false; the broad primitive-target change violates existing core tests despite improving Test262.","next_action_hint":"Retry a narrower version that keeps CreateListFromArrayLike and primitive throws for get/has/delete/ownKeys if safe, but preserves existing preventExtensions/isExtensible primitive behavior or updates core tests only with explicit product decision."}}
{"run":1065,"commit":"6b17916","metric":41,"metrics":{"compiler_test262_cases":153,"compiler_test262_pass":112,"compiler_test262_failures":41,"compiler_test262_compiler_errors":0,"compiler_test262_compiler_crashes":0,"compiler_test262_compiler_fails":0,"compiler_test262_both_fail":40,"compiler_test262_interpreter_fail_compiler_pass":0,"compatibility_pass":112,"compatibility_cases":153,"compiler_errors":0,"compiler_crashes":0,"compiler_fails":0,"both_fail":40,"interpreter_fail_compiler_pass":0,"elapsed_ms":7366},"status":"keep","description":"Use array-like arguments in Reflect calls","timestamp":1778617839550,"segment":52,"confidence":3.0588235294117645,"iterationTokens":2753,"asi":{"hypothesis":"A narrower Reflect fix can preserve existing preventExtensions/isExtensible primitive behavior while using CreateListFromArrayLike for Reflect.apply/construct and rejecting primitive targets for get/set/delete/has/ownKeys."}}
{"run":1066,"commit":"b9c0fe5","metric":38,"metrics":{"compiler_test262_cases":153,"compiler_test262_pass":115,"compiler_test262_failures":38,"compiler_test262_compiler_errors":0,"compiler_test262_compiler_crashes":0,"compiler_test262_compiler_fails":0,"compiler_test262_both_fail":37,"compiler_test262_interpreter_fail_compiler_pass":0,"compatibility_pass":115,"compatibility_cases":153,"compiler_errors":0,"compiler_crashes":0,"compiler_fails":0,"both_fail":37,"interpreter_fail_compiler_pass":0,"elapsed_ms":7733},"status":"keep","description":"Preserve descriptor object key order","timestamp":1778618124486,"segment":52,"confidence":7.25,"iterationTokens":11087,"asi":{"hypothesis":"Property descriptor objects should enumerate data descriptor keys as value/writable/enumerable/configurable and accessor descriptors as get/set/enumerable/configurable; storing explicit key_order in descriptor objects should fix Reflect.getOwnPropertyDescriptor order failures."}}
{"run":1067,"commit":"74c65dd","metric":36,"metrics":{"compiler_test262_cases":153,"compiler_test262_pass":117,"compiler_test262_failures":36,"compiler_test262_compiler_errors":0,"compiler_test262_compiler_crashes":0,"compiler_test262_compiler_fails":0,"compiler_test262_both_fail":35,"compiler_test262_interpreter_fail_compiler_pass":0,"compatibility_pass":117,"compatibility_cases":153,"compiler_errors":0,"compiler_crashes":0,"compiler_fails":0,"both_fail":35,"interpreter_fail_compiler_pass":0,"elapsed_ms":7335},"status":"keep","description":"Reject primitive Reflect descriptors","timestamp":1778618290732,"segment":52,"confidence":10.333333333333334,"iterationTokens":1614,"asi":{"hypothesis":"Reflect.getOwnPropertyDescriptor differs from Object.getOwnPropertyDescriptor by rejecting primitive targets instead of coercing them, so adding an object check should clear primitive target cases without affecting existing preventExtensions/isExtensible compatibility checks."}}
{"run":1068,"commit":"ed35f35","metric":31,"metrics":{"compiler_test262_cases":153,"compiler_test262_pass":122,"compiler_test262_failures":31,"compiler_test262_compiler_errors":0,"compiler_test262_compiler_crashes":0,"compiler_test262_compiler_fails":0,"compiler_test262_both_fail":30,"compiler_test262_interpreter_fail_compiler_pass":0,"compatibility_pass":122,"compatibility_cases":153,"compiler_errors":0,"compiler_crashes":0,"compiler_fails":0,"both_fail":30,"interpreter_fail_compiler_pass":0,"elapsed_ms":7506},"status":"keep","description":"Implement Reflect setPrototypeOf result semantics","timestamp":1778618533034,"segment":52,"confidence":12,"iterationTokens":4056,"asi":{"hypothesis":"Reflect.setPrototypeOf should return the boolean result of ordinary [[SetPrototypeOf]], including false for cycles and non-extensible mismatches, while preserving proxy trap behavior expected by existing compiler tests."}}
{"run":1069,"commit":"f1c851a","metric":17,"metrics":{"compiler_test262_cases":153,"compiler_test262_pass":136,"compiler_test262_failures":17,"compiler_test262_compiler_errors":0,"compiler_test262_compiler_crashes":0,"compiler_test262_compiler_fails":0,"compiler_test262_both_fail":16,"compiler_test262_interpreter_fail_compiler_pass":0,"compatibility_pass":136,"compatibility_cases":153,"compiler_errors":0,"compiler_crashes":0,"compiler_fails":0,"both_fail":16,"interpreter_fail_compiler_pass":0,"elapsed_ms":7677},"status":"keep","description":"Store Reflect properties as builtin statics","timestamp":1778618796906,"segment":52,"confidence":10,"iterationTokens":20363,"asi":{"hypothesis":"Named builtin objects backed by builtin maps need their methods and Symbol.toStringTag mirrored into constructor static storage so OwnProperty.present?/descriptor/delete/write paths see them consistently, while non-writable static descriptors should block Reflect tag writes."}}
{"run":1070,"commit":"c003392","metric":12,"metrics":{"compiler_test262_cases":153,"compiler_test262_pass":141,"compiler_test262_failures":12,"compiler_test262_compiler_errors":0,"compiler_test262_compiler_crashes":0,"compiler_test262_compiler_fails":0,"compiler_test262_both_fail":11,"compiler_test262_interpreter_fail_compiler_pass":0,"compatibility_pass":141,"compatibility_cases":153,"compiler_errors":0,"compiler_crashes":0,"compiler_fails":0,"both_fail":11,"interpreter_fail_compiler_pass":0,"elapsed_ms":7487},"status":"keep","description":"Use receivers in Reflect accessors","timestamp":1778619092752,"segment":52,"confidence":9.166666666666666,"iterationTokens":10371,"asi":{"hypothesis":"Reflect.get must pass the explicit receiver through accessor lookups across the prototype chain, Reflect.set accessor writes should return true after invoking setters, non-object receivers should fail data writes, and Reflect.construct should reject non-constructable newTargets while preserving constructable proxies."}}
{"run":1071,"commit":"d21dfa2","metric":9,"metrics":{"compiler_test262_cases":153,"compiler_test262_pass":144,"compiler_test262_failures":9,"compiler_test262_compiler_errors":0,"compiler_test262_compiler_crashes":0,"compiler_test262_compiler_fails":0,"compiler_test262_both_fail":8,"compiler_test262_interpreter_fail_compiler_pass":0,"compatibility_pass":144,"compatibility_cases":153,"compiler_errors":0,"compiler_crashes":0,"compiler_fails":0,"both_fail":8,"interpreter_fail_compiler_pass":0,"elapsed_ms":7542},"status":"keep","description":"Return sparse array keys from Reflect.ownKeys","timestamp":1778619399284,"segment":52,"confidence":5.043478260869565,"iterationTokens":9484,"asi":{"hypothesis":"Reflect.ownKeys on sparse arrays should include present indexed elements and non-enumerable length, not dense hole indices; using sparse array storage and side-property keys should clear array ownKeys cases while preserving core proxy checks."}}
{"run":1072,"commit":"dcd64f1","metric":8,"metrics":{"compiler_test262_cases":153,"compiler_test262_pass":145,"compiler_test262_failures":8,"compiler_test262_compiler_errors":0,"compiler_test262_compiler_crashes":0,"compiler_test262_compiler_fails":0,"compiler_test262_both_fail":7,"compiler_test262_interpreter_fail_compiler_pass":0,"compatibility_pass":145,"compatibility_cases":153,"compiler_errors":0,"compiler_crashes":0,"compiler_fails":0,"both_fail":7,"interpreter_fail_compiler_pass":0,"elapsed_ms":7498},"status":"keep","description":"Reject Reflect.set data writes over receiver accessors","timestamp":1778619815185,"segment":52,"confidence":3.2777777777777777,"iterationTokens":4648,"asi":{"hypothesis":"Ordinary [[Set]] data-property writes should return false when the receiver already has an own accessor descriptor for the key; receiver accessors must not be invoked on this path."}}
{"run":1073,"commit":"a5d5f7d","metric":7,"metrics":{"compiler_test262_cases":153,"compiler_test262_pass":146,"compiler_test262_failures":7,"compiler_test262_compiler_errors":0,"compiler_test262_compiler_crashes":0,"compiler_test262_compiler_fails":0,"compiler_test262_both_fail":6,"compiler_test262_interpreter_fail_compiler_pass":0,"compatibility_pass":146,"compatibility_cases":153,"compiler_errors":0,"compiler_crashes":0,"compiler_fails":0,"both_fail":6,"interpreter_fail_compiler_pass":0,"elapsed_ms":9927},"status":"keep","description":"Include wrapped string length in Reflect.ownKeys","timestamp":1778620047581,"segment":52,"confidence":3.2432432432432434,"iterationTokens":4648,"asi":{"hypothesis":"Reflect.ownKeys should treat wrapped String objects as string exotic objects, returning virtual length before ordinary side properties and hiding inherited prototype helper names exposed by the current wrapper representation."}}
{"run":1074,"commit":"HEAD","metric":7,"metrics":{"compiler_test262_cases":153,"compiler_test262_pass":146,"compiler_test262_failures":7,"compiler_test262_compiler_errors":0,"compiler_test262_compiler_crashes":0,"compiler_test262_compiler_fails":0,"compiler_test262_both_fail":6,"compiler_test262_interpreter_fail_compiler_pass":0,"compatibility_pass":146,"compatibility_cases":153,"compiler_errors":0,"compiler_crashes":0,"compiler_fails":0,"both_fail":6,"interpreter_fail_compiler_pass":0,"elapsed_ms":6910},"status":"discard","description":"Let boxed primitives see Object prototype helpers","timestamp":1778620253688,"segment":52,"confidence":3.1578947368421053,"iterationTokens":4954,"asi":{"hypothesis":"Primitive wrapper prototype lookup might need to fall through to Object.prototype so string primitive receiver.hasOwnProperty works after Reflect.set returns false.","rollback_reason":"Reflect workload stayed at 7 failures; the receiver-is-not-object case still failed, so the Object.prototype fallback did not improve the primary metric.","next_action_hint":"Inspect actual primitive member access/call lowering for receiver.hasOwnProperty rather than adding wrapper prototype fallback in Get."}}
