{"run":1377,"commit":"fa69a92","metric":24,"metrics":{"compiler_test262_cases":2300,"compiler_test262_pass":2276,"compiler_test262_failures":24,"compiler_test262_compiler_errors":0,"compiler_test262_compiler_crashes":0,"compiler_test262_compiler_fails":8,"compiler_test262_both_fail":11,"compiler_test262_interpreter_fail_compiler_pass":0,"compatibility_pass":2276,"compatibility_cases":2300,"compiler_errors":0,"compiler_crashes":0,"compiler_fails":8,"both_fail":11,"interpreter_fail_compiler_pass":0,"elapsed_ms":153283},"status":"keep","description":"Baseline Array 2300-case expansion","timestamp":1778729337235,"segment":111,"confidence":null,"iterationTokens":129,"asi":{"hypothesis":"Expand Array workload to 2300 after eliminating reduce/reduceRight compiler-only inherited prototype failures in the 2200 slice.","workload":"AUTORESEARCH_TEST262_CATEGORY=built-ins/Array TEST262_LIMIT=2300 TEST262_ERROR_LIMIT=1570 ./autoresearch.sh","baseline_note":"Array 2300 baseline remains 24 failures; no new failures in the added slice."}}
{"type":"config","name":"Array Test262 compatibility 2400-case expansion","metricName":"compatibility_failures","metricUnit":"","bestDirection":"lower"}
{"run":1378,"commit":"5567f04","metric":38,"metrics":{"compiler_test262_cases":2400,"compiler_test262_pass":2362,"compiler_test262_failures":38,"compiler_test262_compiler_errors":0,"compiler_test262_compiler_crashes":0,"compiler_test262_compiler_fails":8,"compiler_test262_both_fail":24,"compiler_test262_interpreter_fail_compiler_pass":0,"compatibility_pass":2362,"compatibility_cases":2400,"compiler_errors":0,"compiler_crashes":0,"compiler_fails":8,"both_fail":24,"interpreter_fail_compiler_pass":0,"elapsed_ms":175446},"status":"keep","description":"Baseline Array 2400-case expansion","timestamp":1778729645001,"segment":112,"confidence":null,"iterationTokens":129,"asi":{"hypothesis":"Expand Array workload to 2400 after the 2300 slice remained flat; the next slice likely introduces shift/slice/sort/splice clusters.","workload":"AUTORESEARCH_TEST262_CATEGORY=built-ins/Array TEST262_LIMIT=2400 TEST262_ERROR_LIMIT=1640 ./autoresearch.sh","baseline_note":"Array 2400 baseline is 38 failures, with both_fail increasing by 13 and compiler-only failures unchanged at 8."}}
{"run":1379,"commit":"5cd1ec1","metric":36,"metrics":{"compiler_test262_cases":2400,"compiler_test262_pass":2364,"compiler_test262_failures":36,"compiler_test262_compiler_errors":0,"compiler_test262_compiler_crashes":0,"compiler_test262_compiler_fails":8,"compiler_test262_both_fail":22,"compiler_test262_interpreter_fail_compiler_pass":0,"compatibility_pass":2364,"compatibility_cases":2400,"compiler_errors":0,"compiler_crashes":0,"compiler_fails":8,"both_fail":22,"interpreter_fail_compiler_pass":0,"elapsed_ms":175685},"status":"keep","description":"Describe reduceRight builtin metadata","timestamp":1778730014952,"segment":112,"confidence":null,"iterationTokens":4390,"asi":{"hypothesis":"Array.prototype.reduceRight should expose builtin metadata matching reduce: length 1 and non-constructability.","fixed_focus":["Array/prototype/reduceRight/length.js","Array/prototype/reduceRight/not-a-constructor.js"],"remaining_cluster":"Array 2400 remains dominated by persistent typed-array/sparse search failures plus reverse generic semantics and reduceRight length-near-integer-limit."}}
{"run":1380,"commit":"8a65dfc","metric":28,"metrics":{"compiler_test262_cases":2400,"compiler_test262_pass":2372,"compiler_test262_failures":28,"compiler_test262_compiler_errors":0,"compiler_test262_compiler_crashes":0,"compiler_test262_compiler_fails":8,"compiler_test262_both_fail":14,"compiler_test262_interpreter_fail_compiler_pass":0,"compatibility_pass":2372,"compatibility_cases":2400,"compiler_errors":0,"compiler_crashes":0,"compiler_fails":8,"both_fail":14,"interpreter_fail_compiler_pass":0,"elapsed_ms":175547},"status":"keep","description":"Apply generic Array reverse semantics","timestamp":1778730467614,"segment":112,"confidence":5,"iterationTokens":6853,"asi":{"hypothesis":"Array.prototype.reverse is intentionally generic and should swap properties through LengthOfArrayLike, HasProperty, Get, Set, and Delete instead of materializing heap lists.","fixed_focus":["Array/prototype/reverse/S15.4.4.8_A2_T1.js","Array/prototype/reverse/call-with-boolean.js","Array/prototype/reverse/length-exceeding-integer-limit-with-object.js"],"remaining_cluster":"Array 2400 reduced 36 to 28; reverse generic object cases largely resolved, remaining reverse residual likely resizable-buffer/proxy or failure semantics."}}
{"run":1381,"commit":"ce753e6","metric":27,"metrics":{"compiler_test262_cases":2400,"compiler_test262_pass":2373,"compiler_test262_failures":27,"compiler_test262_compiler_errors":0,"compiler_test262_compiler_crashes":0,"compiler_test262_compiler_fails":8,"compiler_test262_both_fail":13,"compiler_test262_interpreter_fail_compiler_pass":0,"compatibility_pass":2373,"compatibility_cases":2400,"compiler_errors":0,"compiler_crashes":0,"compiler_fails":8,"both_fail":13,"interpreter_fail_compiler_pass":0,"elapsed_ms":176435},"status":"keep","description":"Observe reverse property access order","timestamp":1778730827073,"segment":112,"confidence":2.4444444444444446,"iterationTokens":2956,"asi":{"hypothesis":"Array.prototype.reverse must perform lower HasProperty/Get before checking upper HasProperty/Get so side effects from a lower getter can delete the upper property before it is observed.","fixed_focus":"Array/prototype/reverse/get_if_present_with_delete.js","remaining_cluster":"Reverse residuals now appear limited to proxy and resizable-buffer cases."}}
{"run":1382,"commit":"5d4406e","metric":26,"metrics":{"compiler_test262_cases":2400,"compiler_test262_pass":2374,"compiler_test262_failures":26,"compiler_test262_compiler_errors":0,"compiler_test262_compiler_crashes":0,"compiler_test262_compiler_fails":8,"compiler_test262_both_fail":13,"compiler_test262_interpreter_fail_compiler_pass":0,"compatibility_pass":2374,"compatibility_cases":2400,"compiler_errors":0,"compiler_crashes":0,"compiler_fails":8,"both_fail":13,"interpreter_fail_compiler_pass":0,"elapsed_ms":161509},"status":"keep","description":"Use sparse indexes for huge Array reduce ranges","timestamp":1778731259971,"segment":112,"confidence":6,"iterationTokens":9656,"asi":{"hypothesis":"Array reduce/reduceRight on enormous array-like ranges should process present sparse indexed keys without materializing a full 2^53-sized index list.","fixed_focus":"Array/prototype/reduceRight/length-near-integer-limit.js","semantic_scope":"For len > 100000, reduce/reduceRight builds candidate indexes from own descriptor keys, sorted in iteration direction."}}
{"type":"config","name":"Array Test262 compatibility 2500-case expansion","metricName":"compatibility_failures","metricUnit":"","bestDirection":"lower"}
{"run":1383,"commit":"09057d0","metric":96,"metrics":{"compiler_test262_cases":2500,"compiler_test262_pass":2404,"compiler_test262_failures":96,"compiler_test262_compiler_errors":0,"compiler_test262_compiler_crashes":0,"compiler_test262_compiler_fails":8,"compiler_test262_both_fail":82,"compiler_test262_interpreter_fail_compiler_pass":0,"compatibility_pass":2404,"compatibility_cases":2500,"compiler_errors":0,"compiler_crashes":0,"compiler_fails":8,"both_fail":82,"interpreter_fail_compiler_pass":0,"elapsed_ms":169121},"status":"keep","description":"Baseline Array 2500-case expansion","timestamp":1778731567315,"segment":113,"confidence":null,"iterationTokens":129,"asi":{"hypothesis":"Expand Array workload to 2500 after reducing 2400 to 26 failures; the added slice likely introduces shift/slice/splice clusters.","workload":"AUTORESEARCH_TEST262_CATEGORY=built-ins/Array TEST262_LIMIT=2500 TEST262_ERROR_LIMIT=1710 ./autoresearch.sh","baseline_note":"Array 2500 baseline jumps to 96 failures with both_fail increasing to 82 and compiler-only failures remaining at 8."}}
{"run":1384,"commit":"adc3e5c","metric":46,"metrics":{"compiler_test262_cases":2500,"compiler_test262_pass":2454,"compiler_test262_failures":46,"compiler_test262_compiler_errors":0,"compiler_test262_compiler_crashes":0,"compiler_test262_compiler_fails":8,"compiler_test262_both_fail":29,"compiler_test262_interpreter_fail_compiler_pass":0,"compatibility_pass":2454,"compatibility_cases":2500,"compiler_errors":0,"compiler_crashes":0,"compiler_fails":8,"both_fail":29,"interpreter_fail_compiler_pass":0,"elapsed_ms":223654},"status":"keep","description":"Apply generic Array slice semantics","timestamp":1778732045285,"segment":113,"confidence":null,"iterationTokens":7961,"asi":{"hypothesis":"Array.prototype.slice should operate on generic array-like receivers using LengthOfArrayLike, HasProperty/Get, CreateDataProperty, and ArraySpeciesCreate-style result construction rather than materializing lists.","fixed_focus":["Array/prototype/slice/S15.4.4.10_A1.1_T1.js","Array/prototype/slice/S15.4.4.10_A2_T1.js","Array/prototype/slice/create-species.js"],"tradeoff":"Primary improved substantially on the 2500 slice, but elapsed time increased; monitor large slice cases and consider sparse candidate iteration for huge ranges if needed."}}
{"run":1385,"commit":"222061b","metric":36,"metrics":{"compiler_test262_cases":2500,"compiler_test262_pass":2464,"compiler_test262_failures":36,"compiler_test262_compiler_errors":0,"compiler_test262_compiler_crashes":0,"compiler_test262_compiler_fails":8,"compiler_test262_both_fail":19,"compiler_test262_interpreter_fail_compiler_pass":0,"compatibility_pass":2464,"compatibility_cases":2500,"compiler_errors":0,"compiler_crashes":0,"compiler_fails":8,"both_fail":19,"interpreter_fail_compiler_pass":0,"elapsed_ms":226099},"status":"keep","description":"Apply generic Array shift semantics","timestamp":1778732468466,"segment":113,"confidence":6,"iterationTokens":3958,"asi":{"hypothesis":"Array.prototype.shift should use generic LengthOfArrayLike, indexed Get/Set/Delete shifting, and Throw=true final length writes rather than list materialization.","fixed_focus":["Array/prototype/shift/S15.4.4.9_A2_T1.js","Array/prototype/shift/S15.4.4.9_A3_T3.js","Array/prototype/shift/set-length-zero-array-length-is-non-writable.js"],"remaining_cluster":"Shift generic object cluster mostly resolved; remaining failures are dominated by persistent typed-array/sparse cases and slice edge cases."}}
{"run":1386,"commit":"e497263","metric":34,"metrics":{"compiler_test262_cases":2500,"compiler_test262_pass":2466,"compiler_test262_failures":34,"compiler_test262_compiler_errors":0,"compiler_test262_compiler_crashes":0,"compiler_test262_compiler_fails":8,"compiler_test262_both_fail":17,"compiler_test262_interpreter_fail_compiler_pass":0,"compatibility_pass":2466,"compatibility_cases":2500,"compiler_errors":0,"compiler_crashes":0,"compiler_fails":8,"both_fail":17,"interpreter_fail_compiler_pass":0,"elapsed_ms":223379},"status":"keep","description":"Treat undefined Array slice end as length","timestamp":1778732873117,"segment":113,"confidence":10.333333333333334,"iterationTokens":8733,"asi":{"hypothesis":"Array.prototype.slice treats an omitted or explicit undefined end argument as the receiver length, not ToIntegerOrInfinity(undefined).","fixed_focus":["Array/prototype/slice/S15.4.4.10_A1.5_T1.js","Array/prototype/slice/S15.4.4.10_A2_T6.js"],"remaining_slice_cluster":"Remaining slice failures are now mostly invalid species result length, huge sparse tail, and target property write failures."}}
{"run":1387,"commit":"eb99809","metric":30,"metrics":{"compiler_test262_cases":2500,"compiler_test262_pass":2470,"compiler_test262_failures":30,"compiler_test262_compiler_errors":0,"compiler_test262_compiler_crashes":0,"compiler_test262_compiler_fails":8,"compiler_test262_both_fail":17,"compiler_test262_interpreter_fail_compiler_pass":0,"compatibility_pass":2470,"compatibility_cases":2500,"compiler_errors":0,"compiler_crashes":0,"compiler_fails":8,"both_fail":17,"interpreter_fail_compiler_pass":0,"elapsed_ms":169316},"status":"keep","description":"Reject oversized Array slice results","timestamp":1778733243239,"segment":113,"confidence":11,"iterationTokens":2516,"asi":{"hypothesis":"Array.prototype.slice creates an ordinary Array when the receiver is not an Array, and ArrayCreate must reject result lengths above 2^32-1 before any property modifications occur.","fixed_focus":["Array/prototype/slice/create-non-array-invalid-len.js","Array/prototype/slice/create-proxied-array-invalid-len.js"],"remaining_slice_cluster":"Remaining slice failures include huge sparse tail"}}
{"type":"config","name":"Array Test262 compatibility 2600-case expansion","metricName":"compatibility_failures","metricUnit":"","bestDirection":"lower"}
{"run":1388,"commit":"da2dd15","metric":30,"metrics":{"compiler_test262_cases":2600,"compiler_test262_pass":2570,"compiler_test262_failures":30,"compiler_test262_compiler_errors":0,"compiler_test262_compiler_crashes":0,"compiler_test262_compiler_fails":8,"compiler_test262_both_fail":17,"compiler_test262_interpreter_fail_compiler_pass":0,"compatibility_pass":2570,"compatibility_cases":2600,"compiler_errors":0,"compiler_crashes":0,"compiler_fails":8,"both_fail":17,"interpreter_fail_compiler_pass":0,"elapsed_ms":175952},"status":"keep","description":"Baseline Array 2600-case expansion","timestamp":1778734019142,"segment":114,"confidence":null,"iterationTokens":129,"asi":{"hypothesis":"Expand Array workload to 2600 after reducing 2500 to 30; added slice has no new failures in this range.","workload":"AUTORESEARCH_TEST262_CATEGORY=built-ins/Array TEST262_LIMIT=2600 TEST262_ERROR_LIMIT=1760 ./autoresearch.sh","baseline_note":"Array 2600 baseline remains 30 failures, indicating the 2501-2600 slice is clean under current semantics."}}
{"type":"config","name":"Array Test262 compatibility 2700-case expansion","metricName":"compatibility_failures","metricUnit":"","bestDirection":"lower"}
{"run":1389,"commit":"392c9fa","metric":30,"metrics":{"compiler_test262_cases":2700,"compiler_test262_pass":2670,"compiler_test262_failures":30,"compiler_test262_compiler_errors":0,"compiler_test262_compiler_crashes":0,"compiler_test262_compiler_fails":8,"compiler_test262_both_fail":17,"compiler_test262_interpreter_fail_compiler_pass":0,"compatibility_pass":2670,"compatibility_cases":2700,"compiler_errors":0,"compiler_crashes":0,"compiler_fails":8,"both_fail":17,"interpreter_fail_compiler_pass":0,"elapsed_ms":180927},"status":"keep","description":"Baseline Array 2700-case expansion","timestamp":1778734338056,"segment":115,"confidence":null,"iterationTokens":129,"asi":{"hypothesis":"Expand Array workload to 2700 after 2600 remained flat; added range may contain sort/splice/unshift/toReversed clusters.","workload":"AUTORESEARCH_TEST262_CATEGORY=built-ins/Array TEST262_LIMIT=2700 TEST262_ERROR_LIMIT=1810 ./autoresearch.sh","baseline_note":"Array 2700 baseline remains 30 failures, so 2601-2700 is clean under current semantics."}}
{"type":"config","name":"Array Test262 compatibility 2800-case expansion","metricName":"compatibility_failures","metricUnit":"","bestDirection":"lower"}
{"run":1390,"commit":"a0d6cb5","metric":102,"metrics":{"compiler_test262_cases":2800,"compiler_test262_pass":2698,"compiler_test262_failures":102,"compiler_test262_compiler_errors":0,"compiler_test262_compiler_crashes":0,"compiler_test262_compiler_fails":8,"compiler_test262_both_fail":87,"compiler_test262_interpreter_fail_compiler_pass":0,"compatibility_pass":2698,"compatibility_cases":2800,"compiler_errors":0,"compiler_crashes":0,"compiler_fails":8,"both_fail":87,"interpreter_fail_compiler_pass":0,"elapsed_ms":196291},"status":"keep","description":"Baseline Array 2800-case expansion","timestamp":1778734664807,"segment":116,"confidence":null,"iterationTokens":129,"asi":{"hypothesis":"Expand Array workload to 2800 after 2700 remained flat; the new slice likely introduces sort/splice/unshift clusters.","workload":"AUTORESEARCH_TEST262_CATEGORY=built-ins/Array TEST262_LIMIT=2800 TEST262_ERROR_LIMIT=1860 ./autoresearch.sh","baseline_note":"Array 2800 baseline jumps to 102 failures, with both_fail increasing to 87 and compiler-only failures still at 8."}}
{"run":1391,"commit":"bb40586","metric":67,"metrics":{"compiler_test262_cases":2800,"compiler_test262_pass":2733,"compiler_test262_failures":67,"compiler_test262_compiler_errors":0,"compiler_test262_compiler_crashes":0,"compiler_test262_compiler_fails":8,"compiler_test262_both_fail":53,"compiler_test262_interpreter_fail_compiler_pass":0,"compatibility_pass":2733,"compatibility_cases":2800,"compiler_errors":0,"compiler_crashes":0,"compiler_fails":8,"both_fail":53,"interpreter_fail_compiler_pass":0,"elapsed_ms":195578},"status":"keep","description":"Apply generic Array splice semantics","timestamp":1778735075555,"segment":116,"confidence":null,"iterationTokens":7233,"asi":{"hypothesis":"Array.prototype.splice should operate on generic array-like receivers with LengthOfArrayLike, ArraySpeciesCreate-style removed array, indexed HasProperty/Get/Set/Delete shifts, insertion writes, and Throw=true final length set.","fixed_focus":["Array/prototype/splice/S15.4.4.12_A1.1_T1.js","Array/prototype/splice/S15.4.4.12_A1.5_T1.js","Array/prototype/splice/15.4.4.12-9-c-ii-1.js"],"remaining_cluster":"Splice generic object basics improved; remaining 2800 failures are dominated by sort and residual typed-array/sparse/proxy/frozen-length cases."}}
{"run":1392,"commit":"ee41039","metric":41,"metrics":{"compiler_test262_cases":2800,"compiler_test262_pass":2759,"compiler_test262_failures":41,"compiler_test262_compiler_errors":0,"compiler_test262_compiler_crashes":0,"compiler_test262_compiler_fails":8,"compiler_test262_both_fail":27,"compiler_test262_interpreter_fail_compiler_pass":1,"compatibility_pass":2759,"compatibility_cases":2800,"compiler_errors":0,"compiler_crashes":0,"compiler_fails":8,"both_fail":27,"interpreter_fail_compiler_pass":1,"elapsed_ms":196218},"status":"keep","description":"Apply generic Array sort semantics","timestamp":1778735559442,"segment":116,"confidence":2.3461538461538463,"iterationTokens":8293,"asi":{"hypothesis":"Array.prototype.sort should validate comparefn before observing length, collect present generic array-like elements with HasProperty/Get, stably sort defined values before undefined, write sorted elements back, and delete trailing holes.","fixed_focus":["Array/prototype/sort/S15.4.4.11_A1.2_T2.js","Array/prototype/sort/comparefn-nonfunction-call-throws.js","Array/prototype/sort/stability-5-elements.js"],"tradeoff":"Introduces one interpreter_fail_compiler_pass while improving primary by 26 on the 2800 workload; investigate after remaining sort precise/resizable cases."}}
{"type":"config","name":"Array Test262 compatibility 2900-case expansion","metricName":"compatibility_failures","metricUnit":"","bestDirection":"lower"}
{"run":1393,"commit":"624164b","metric":87,"metrics":{"compiler_test262_cases":2900,"compiler_test262_pass":2813,"compiler_test262_failures":87,"compiler_test262_compiler_errors":0,"compiler_test262_compiler_crashes":0,"compiler_test262_compiler_fails":8,"compiler_test262_both_fail":73,"compiler_test262_interpreter_fail_compiler_pass":1,"compatibility_pass":2813,"compatibility_cases":2900,"compiler_errors":0,"compiler_crashes":0,"compiler_fails":8,"both_fail":73,"interpreter_fail_compiler_pass":1,"elapsed_ms":206094},"status":"keep","description":"Baseline Array 2900-case expansion","timestamp":1778736043633,"segment":117,"confidence":null,"iterationTokens":129,"asi":{"hypothesis":"Expand Array workload to 2900 after reducing 2800 to 41; new slice likely introduces unshift/toReversed/toSorted clusters.","workload":"AUTORESEARCH_TEST262_CATEGORY=built-ins/Array TEST262_LIMIT=2900 TEST262_ERROR_LIMIT=1910 ./autoresearch.sh","baseline_note":"Array 2900 baseline jumps to 87 failures; compiler-only remains 8 and interpreter-only remains 1."}}
{"run":1394,"commit":"2c7f189","metric":79,"metrics":{"compiler_test262_cases":2900,"compiler_test262_pass":2821,"compiler_test262_failures":79,"compiler_test262_compiler_errors":0,"compiler_test262_compiler_crashes":0,"compiler_test262_compiler_fails":8,"compiler_test262_both_fail":65,"compiler_test262_interpreter_fail_compiler_pass":1,"compatibility_pass":2821,"compatibility_cases":2900,"compiler_errors":0,"compiler_crashes":0,"compiler_fails":8,"both_fail":65,"interpreter_fail_compiler_pass":1,"elapsed_ms":202933},"status":"keep","description":"Install change-array-by-copy methods","timestamp":1778736584006,"segment":117,"confidence":null,"iterationTokens":10932,"asi":{"hypothesis":"Array.prototype.toReversed/toSorted/toSpliced should be installed with metadata and implemented as non-mutating array-copy methods using LengthOfArrayLike, ordinary array creation, element reads, and CreateDataProperty writes.","fixed_focus":["Array/prototype/toSorted/comparefn-controls-sort.js","Array/prototype/toSpliced/deleteCount-undefined.js"],"remaining_cluster":"Only a subset of change-array-by-copy cases improved; toReversed holes still exposes inherited prototype value instead of own undefined, so explicit undefined CreateDataProperty on list-backed arrays remains incomplete."}}
