{"run":776,"commit":"9aa325f","metric":16,"metrics":{"js_bytecode_existing_cases":157,"js_bytecode_existing_compiled":143,"js_bytecode_existing_unsupported":13,"js_bytecode_existing_mismatches":2,"js_bytecode_existing_native_loadable":141,"js_bytecode_compiler_cases":132,"js_bytecode_compiler_compiled":132,"js_bytecode_compiler_unsupported":0,"js_bytecode_compiler_mismatches":0,"js_bytecode_compiler_native_loadable":132,"js_bytecode_compiler_failures":0},"status":"keep","description":"Confirm stable at 16 — all remaining failures require deep infrastructure","timestamp":1777849324525,"segment":28,"confidence":4.222222222222222,"iterationTokens":10834,"asi":{"hypothesis":"Confirm plateau.","result":"Stable at 16. Full corpus 2157 cases, 2141 pass (99.3%). Remaining 16: 5 private class, 5 super-write (blocked by interpreter accessor-on-heap bug), 2 mismatches (eval scope + derived constructor), 1 instanceof, 1 Symbol.iterator, 1 parse error, 1 test_language.js.","scope":"Also checked with(o){delete x;} parse error — it's a parser ASI issue with string literals after }, not a bytecode compiler issue."}}
{"run":529,"commit":"7e46591","metric":16,"metrics":{"js_bytecode_existing_cases":157,"js_bytecode_existing_compiled":143,"js_bytecode_existing_unsupported":13,"js_bytecode_existing_mismatches":2,"js_bytecode_existing_native_loadable":141,"js_bytecode_compiler_cases":132,"js_bytecode_compiler_compiled":132,"js_bytecode_compiler_unsupported":0,"js_bytecode_compiler_mismatches":0,"js_bytecode_compiler_native_loadable":132,"js_bytecode_compiler_failures":0},"status":"keep","description":"Fix store_function_atoms and Runner cache atom shadowing","timestamp":1777871202223,"segment":19,"confidence":4.108108108108108,"iterationTokens":10834,"asi":{"hypothesis":"Fixed store_function_atoms to respect inner functions with own atoms, and Runner.invoke_target to use function's own atoms instead of cached atoms. Also traced define_method atom resolution - verified atoms are consistent between compile-time and runtime. The accessor-on-heap bug persists despite correct atom tables - root cause is elsewhere.","result":"No metric change (16). Correctness fixes to atom resolution paths.","next_action_hint":"The accessor-on-heap issue is NOT an atom table bug - atoms are now verified consistent. Something else modifies the heap object between define_method and getOwnPropertyDescriptor. Need to trace Process.put calls on the specific ref during interpreter execution."}}
{"run":530,"commit":"d54415f","metric":16,"metrics":{"js_bytecode_existing_cases":157,"js_bytecode_existing_compiled":143,"js_bytecode_existing_unsupported":13,"js_bytecode_existing_mismatches":2,"js_bytecode_existing_native_loadable":141,"js_bytecode_compiler_cases":132,"js_bytecode_compiler_compiled":132,"js_bytecode_compiler_unsupported":0,"js_bytecode_compiler_mismatches":0,"js_bytecode_compiler_native_loadable":132,"js_bytecode_compiler_failures":0},"status":"keep","description":"Fix accessor-on-heap bug — attach_constant_atoms was overwriting nested function atom tables","timestamp":1777871961980,"segment":19,"confidence":4,"iterationTokens":16478,"asi":{"hypothesis":"The accessor-on-heap bug was caused by attach_constant_atoms unconditionally overwriting nested function atom tables with the parent's atoms. The factory function's bytecode was encoded against its own atom table (e.g., index 2 = 'x'), but at runtime the atoms field was replaced with the program's different ordering (index 2 = 'y'). Fixed by skipping attach_atoms for constants that already have their own atoms.","result":"No metric change (16) but the long-standing accessor-on-heap bug is FIXED. Object.getOwnPropertyDescriptor now correctly finds accessor properties on objects returned from functions. Super-write cases can now be re-implemented.","scope":"Changed attach_constant_atoms to skip Function constants with existing atoms, matching the attach_own_constant_atoms pattern."}}
{"run":531,"commit":"d54415f","metric":16,"metrics":{"js_bytecode_existing_cases":157,"js_bytecode_existing_compiled":144,"js_bytecode_existing_unsupported":12,"js_bytecode_existing_mismatches":3,"js_bytecode_existing_native_loadable":141,"js_bytecode_compiler_cases":132,"js_bytecode_compiler_compiled":132,"js_bytecode_compiler_unsupported":0,"js_bytecode_compiler_mismatches":0,"js_bytecode_compiler_native_loadable":132,"js_bytecode_compiler_failures":0},"status":"discard","description":"Try super setter with fixed accessor bug (native load mismatch)","timestamp":1777872194211,"segment":19,"confidence":3.8,"iterationTokens":6737,"asi":{"hypothesis":"Super setter via put_super_value with fixed accessor bug.","rollback_reason":"Native load returns nil for super setter cases — the factory bytecode pattern doesn't provide proper class/prototype context for QuickJS. Net zero: 1 unsupported became 1 mismatch.","next_action_hint":"The accessor-on-heap bug is fixed. Super setter works in interpreter/compiler but not native load. Need to investigate native load failure or accept super-write as interpreter-only."}}
{"run":532,"commit":"d54415f","metric":16,"metrics":{"js_bytecode_existing_cases":157,"js_bytecode_existing_compiled":144,"js_bytecode_existing_unsupported":12,"js_bytecode_existing_mismatches":3,"js_bytecode_existing_native_loadable":141,"js_bytecode_compiler_cases":132,"js_bytecode_compiler_compiled":132,"js_bytecode_compiler_unsupported":0,"js_bytecode_compiler_mismatches":0,"js_bytecode_compiler_native_loadable":132,"js_bytecode_compiler_failures":0},"status":"discard","description":"Try super setter + define_method for methods (native load still fails)","timestamp":1777872615726,"segment":19,"confidence":3.619047619047619,"iterationTokens":12088,"asi":{"hypothesis":"Super setter via put_super_value + define_method for regular methods + need_home_object flag.","rollback_reason":"Native load still fails. QuickJS native put_super_value needs define_class infrastructure, not the factory approach. Works in interpreter+compiler but not native. Net zero.","next_action_hint":"Super-write cases are genuinely blocked by the factory approach's native load incompatibility. All 5 cases need define_class infrastructure for native QuickJS compatibility."}}
{"run":533,"commit":"5b8369d","metric":16,"metrics":{"js_bytecode_existing_cases":157,"js_bytecode_existing_compiled":143,"js_bytecode_existing_unsupported":13,"js_bytecode_existing_mismatches":2,"js_bytecode_existing_native_loadable":141,"js_bytecode_compiler_cases":132,"js_bytecode_compiler_compiled":132,"js_bytecode_compiler_unsupported":0,"js_bytecode_compiler_mismatches":0,"js_bytecode_compiler_native_loadable":132,"js_bytecode_compiler_failures":0},"status":"keep","description":"Confirm stable at 16 with accessor-on-heap fix preserved","timestamp":1777872678111,"segment":19,"confidence":3.707317073170732,"iterationTokens":1911,"asi":{"hypothesis":"Confirm stable after reverting super setter experiments. Accessor-on-heap fix is preserved.","result":"Stable at 16. The accessor fix from earlier in the session is committed and working."}}
{"run":534,"commit":"8d6da6f","metric":16,"metrics":{"js_bytecode_existing_cases":157,"js_bytecode_existing_compiled":143,"js_bytecode_existing_unsupported":13,"js_bytecode_existing_mismatches":2,"js_bytecode_existing_native_loadable":141,"js_bytecode_compiler_cases":132,"js_bytecode_compiler_compiled":132,"js_bytecode_compiler_unsupported":0,"js_bytecode_compiler_mismatches":0,"js_bytecode_compiler_native_loadable":132,"js_bytecode_compiler_failures":0},"status":"keep","description":"Confirm genuine plateau at 16 — factory approach limit reached","timestamp":1777872964582,"segment":19,"confidence":3.8,"iterationTokens":3303,"asi":{"hypothesis":"Confirm genuine plateau.","result":"Stable at 16. Full corpus 2157 cases, 2141 pass (99.3%). All 3778 tests pass. Remaining 16: 10 need define_class (5 super-write + 5 private), 2 mismatches (eval scope + derived constructor), 1 instanceof, 1 Symbol.iterator, 1 parse error, 1 test_language.js. The factory approach has reached its practical limit. Further progress requires implementing define_class with real prototype chains.","next_action_hint":"Consider implementing define_class opcode emission for real QuickJS-compatible class hierarchies, or switch to Test262-derived windows for broader coverage."}}
{"run":535,"commit":"8d6da6f","metric":17,"metrics":{"js_bytecode_existing_cases":157,"js_bytecode_existing_compiled":141,"js_bytecode_existing_unsupported":15,"js_bytecode_existing_mismatches":1,"js_bytecode_existing_native_loadable":140,"js_bytecode_compiler_cases":132,"js_bytecode_compiler_compiled":132,"js_bytecode_compiler_unsupported":0,"js_bytecode_compiler_mismatches":0,"js_bytecode_compiler_native_loadable":132,"js_bytecode_compiler_failures":0},"status":"checks_failed","description":"Implement define_class for real class semantics (Credo redundant with)","timestamp":1777874097284,"segment":19,"confidence":3.3777777777777778,"iterationTokens":2426,"asi":{"hypothesis":"Replace class factory with define_class opcode emission for real class semantics.","rollback_reason":"Credo redundant with at compile_class_with_define_class.","next_action_hint":"Fix Credo issue and re-run. NOTE: metric went UP from 16 to 17 — need to investigate regression."}}
{"run":536,"commit":"328c9b9","metric":15,"metrics":{"js_bytecode_existing_cases":157,"js_bytecode_existing_compiled":144,"js_bytecode_existing_unsupported":12,"js_bytecode_existing_mismatches":2,"js_bytecode_existing_native_loadable":142,"js_bytecode_compiler_cases":132,"js_bytecode_compiler_compiled":132,"js_bytecode_compiler_unsupported":0,"js_bytecode_compiler_mismatches":0,"js_bytecode_compiler_native_loadable":132,"js_bytecode_compiler_failures":0},"status":"keep","description":"Implement define_class with real prototype chains, instanceof, and super property read","timestamp":1777875185233,"segment":19,"confidence":3.347826086956522,"iterationTokens":2905,"asi":{"hypothesis":"Replace class factory with define_class opcode for real QuickJS class semantics. Classes now get proper prototype chains, enabling instanceof and super property access. Falls back to factory approach for unsupported constructor bodies.","result":"Offset-2000 failures 16 -> 15. instanceof now passes (define_class creates real prototypes). super.x getter read now passes (get_super_value with prototype chain traversal). Mismatches remain at 2 (eval scope + derived constructor).","scope":"Added define_class/close_loc/set_loc_uninitialized/define_method_computed/instanceof/set_home_object/get_super_value/put_super_value/check_ctor to assembler. New compile_class_define with proper prototype chain setup. Added super.m() call and super.x read handlers. Falls back to factory for private fields/unsupported."}}
{"run":537,"commit":"c8ec20e","metric":13,"metrics":{"js_bytecode_existing_cases":157,"js_bytecode_existing_compiled":146,"js_bytecode_existing_unsupported":10,"js_bytecode_existing_mismatches":2,"js_bytecode_existing_native_loadable":144,"js_bytecode_compiler_cases":132,"js_bytecode_compiler_compiled":132,"js_bytecode_compiler_unsupported":0,"js_bytecode_compiler_mismatches":0,"js_bytecode_compiler_native_loadable":132,"js_bytecode_compiler_failures":0},"status":"keep","description":"Support super property write and compound assignment","timestamp":1777875608567,"segment":19,"confidence":3.4347826086956523,"iterationTokens":10158,"asi":{"hypothesis":"With define_class providing real prototype chains, super.x = v and super.x += v can be lowered to put_super_value opcode with prototype chain traversal (this.__proto__.__proto__).","result":"Offset-2000 failures 15 -> 13. Simple super assignment and compound super assignment now pass all 4 paths (interpreter, compiler, native load, oracle). Super postincrement and destructuring targets remain unsupported.","scope":"Added super assignment clause for = operator, and super compound assignment clause for +=/-= etc. Both emit put_super_value with prototype chain lookup. Postincrement and destructuring super targets not yet handled."}}
{"run":538,"commit":"d178cbe","metric":13,"metrics":{"js_bytecode_existing_cases":157,"js_bytecode_existing_compiled":146,"js_bytecode_existing_unsupported":10,"js_bytecode_existing_mismatches":2,"js_bytecode_existing_native_loadable":144,"js_bytecode_compiler_cases":132,"js_bytecode_compiler_compiled":132,"js_bytecode_compiler_unsupported":0,"js_bytecode_compiler_mismatches":0,"js_bytecode_compiler_native_loadable":132,"js_bytecode_compiler_failures":0},"status":"keep","description":"Confirm stable at 13","timestamp":1777875808917,"segment":19,"confidence":3.4347826086956523,"iterationTokens":3480,"asi":{"hypothesis":"Confirm 13.","result":"Stable at 13. Corpus 2157, 2144 pass (99.4%). Remaining: 5 private class, 3 super (postinc + 2 destructuring), 2 mismatches, 1 Symbol, 1 throw, 1 parse."}}
{"run":539,"commit":"0eaf975","metric":12,"metrics":{"js_bytecode_existing_cases":157,"js_bytecode_existing_compiled":147,"js_bytecode_existing_unsupported":9,"js_bytecode_existing_mismatches":2,"js_bytecode_existing_native_loadable":145,"js_bytecode_compiler_cases":132,"js_bytecode_compiler_compiled":132,"js_bytecode_compiler_unsupported":0,"js_bytecode_compiler_mismatches":0,"js_bytecode_compiler_native_loadable":132,"js_bytecode_compiler_failures":0},"status":"keep","description":"Support super postincrement via perm5 + post_inc + put_super_value","timestamp":1777876113282,"segment":19,"confidence":3.4782608695652173,"iterationTokens":7521,"asi":{"hypothesis":"Super postincrement (super.x++) can be compiled by: pushing super context twice (for get and put), get_super_value, post_inc to produce [new_val, old_val], perm5 to move old_val past the put context, put_super_value with new_val, leaving old_val as expression result.","result":"Offset-2000 failures 13 -> 12. super.x++ now passes all 4 paths."}}
{"run":540,"commit":"515601e","metric":12,"metrics":{"js_bytecode_existing_cases":157,"js_bytecode_existing_compiled":147,"js_bytecode_existing_unsupported":9,"js_bytecode_existing_mismatches":2,"js_bytecode_existing_native_loadable":145,"js_bytecode_compiler_cases":132,"js_bytecode_compiler_compiled":132,"js_bytecode_compiler_unsupported":0,"js_bytecode_compiler_mismatches":0,"js_bytecode_compiler_native_loadable":132,"js_bytecode_compiler_failures":0},"status":"keep","description":"Confirm stable at 12 — remaining failures need private fields, complex stack ops, or scope eval","timestamp":1777876421951,"segment":19,"confidence":3.4782608695652173,"iterationTokens":5519,"asi":{"hypothesis":"Confirm plateau at 12.","result":"Stable at 12. Corpus 2157, 2145 pass (99.4%). Remaining: 5 private class (needs private_symbol), 2 super destructuring (no rot4 opcode), 2 mismatches (eval scope + derived constructor), 1 Symbol.iterator, 1 test_language.js, 1 parse error."}}
{"run":541,"commit":"6aff19a","metric":12,"metrics":{"js_bytecode_existing_cases":157,"js_bytecode_existing_compiled":147,"js_bytecode_existing_unsupported":9,"js_bytecode_existing_mismatches":2,"js_bytecode_existing_native_loadable":145,"js_bytecode_compiler_cases":132,"js_bytecode_compiler_compiled":132,"js_bytecode_compiler_unsupported":0,"js_bytecode_compiler_mismatches":0,"js_bytecode_compiler_native_loadable":132,"js_bytecode_compiler_failures":0},"status":"keep","description":"Confirm 12 after super destructuring investigation (error comes from elsewhere)","timestamp":1777877495078,"segment":19,"confidence":3.4782608695652173,"iterationTokens":17554,"asi":{"hypothesis":"Investigate super destructuring targets. Added compile_destructuring_target clause for super member targets but the error still occurs — the unresolved_identifier 'super' comes from a different code path (not from the destructuring target catchall). The destructuring target clause exists but is never reached for these cases.","result":"Stable at 12. The super destructuring issue needs deeper investigation — the 'super' identifier is being resolved somewhere outside the destructuring system.","next_action_hint":"The error for super destructuring targets likely comes from Captures or some other analysis pass that encounters super as an identifier. Need to trace the exact call path."}}
{"run":542,"commit":"1d2fa92","metric":11,"metrics":{"js_bytecode_existing_cases":157,"js_bytecode_existing_compiled":149,"js_bytecode_existing_unsupported":7,"js_bytecode_existing_mismatches":3,"js_bytecode_existing_native_loadable":146,"js_bytecode_compiler_cases":132,"js_bytecode_compiler_compiled":132,"js_bytecode_compiler_unsupported":0,"js_bytecode_compiler_mismatches":0,"js_bytecode_compiler_native_loadable":132,"js_bytecode_compiler_failures":0},"status":"keep","description":"Fix super destructuring targets — clause ordering was shadowing super-specific handler","timestamp":1777878110980,"segment":19,"confidence":3.5217391304347827,"iterationTokens":10134,"asi":{"hypothesis":"The super destructuring target clause was shadowed by a more general MemberExpression{Identifier{obj_name}} clause. Moving the super-specific clause before the generic one fixes the non-computed case. The computed variant ({[p]: super.x} = ...) compiles correctly for interpreter but native load fails.","result":"Offset-2000 failures 12 -> 11. Non-computed super destructuring target passes all paths. Computed variant becomes mismatch (native load nil). Net: -1 failure.","scope":"Reordered compile_destructuring_target and compile_computed_destructuring_target clauses to put super-specific patterns before generic MemberExpression patterns."}}
{"run":543,"commit":"3fbbe17","metric":11,"metrics":{"js_bytecode_existing_cases":157,"js_bytecode_existing_compiled":149,"js_bytecode_existing_unsupported":7,"js_bytecode_existing_mismatches":3,"js_bytecode_existing_native_loadable":146,"js_bytecode_compiler_cases":132,"js_bytecode_compiler_compiled":132,"js_bytecode_compiler_unsupported":0,"js_bytecode_compiler_mismatches":0,"js_bytecode_compiler_native_loadable":132,"js_bytecode_compiler_failures":0},"status":"keep","description":"Confirm stable at 11 — 99.5% pass rate, remaining need private fields or are mismatches","timestamp":1777878401456,"segment":19,"confidence":3.5217391304347827,"iterationTokens":3257,"asi":{"hypothesis":"Confirm plateau at 11.","result":"Stable at 11. Full corpus 2157 cases, 2146 pass (99.5%). All 3778 tests pass. Remaining 11: 5 private class (needs private_symbol/brand infrastructure), 3 mismatches (eval scope + derived constructor + computed super destructuring native load), 1 Symbol.iterator (iterator protocol), 1 test_language.js (multi-feature file), 1 parse error (ASI bug).","next_action_hint":"All remaining failures need major infrastructure: private field tracking (5 cases), iterator protocol (1), or are inherent mismatches/parser bugs. Consider implementing private fields or switching to Test262 windows."}}
{"run":544,"commit":"f64d00a","metric":11,"metrics":{"js_bytecode_existing_cases":157,"js_bytecode_existing_compiled":149,"js_bytecode_existing_unsupported":7,"js_bytecode_existing_mismatches":3,"js_bytecode_existing_native_loadable":146,"js_bytecode_compiler_cases":132,"js_bytecode_compiler_compiled":132,"js_bytecode_compiler_unsupported":0,"js_bytecode_compiler_mismatches":0,"js_bytecode_compiler_native_loadable":132,"js_bytecode_compiler_failures":0},"status":"keep","description":"Add private field assembler opcodes (private_symbol, get/put/define_private_field, add/check_brand)","timestamp":1777878962196,"segment":19,"confidence":3.5217391304347827,"iterationTokens":7618,"asi":{"hypothesis":"Add assembler infrastructure for private class fields: private_symbol, add_brand, check_brand, get_private_field, put_private_field, define_private_field opcodes with encoding, sizes, atom collection, and stack effects.","result":"No metric change (11). Infrastructure added for future private field compilation.","scope":"Assembler-only change. The opcodes are available for use but no compilation logic emits them yet. All interpreter support already exists."}}
{"run":545,"commit":"f64d00a","metric":11,"metrics":{"js_bytecode_existing_cases":157,"js_bytecode_existing_compiled":150,"js_bytecode_existing_unsupported":6,"js_bytecode_existing_mismatches":4,"js_bytecode_existing_native_loadable":146,"js_bytecode_compiler_cases":132,"js_bytecode_compiler_compiled":132,"js_bytecode_compiler_unsupported":0,"js_bytecode_compiler_mismatches":0,"js_bytecode_compiler_native_loadable":132,"js_bytecode_compiler_failures":0},"status":"discard","description":"Partial private field compilation (unsupported->mismatch, no improvement)","timestamp":1777879846200,"segment":19,"confidence":3.375,"iterationTokens":17030,"asi":{"hypothesis":"Partial private field compilation with private_symbol emission and get_private_field in methods.","rollback_reason":"Private fields compile but throw at runtime because define_private_field is never called (no field initializer). Net zero: 1 unsupported became 1 mismatch. Full implementation needs constructor augmentation with field initializer that emits define_private_field.","next_action_hint":"Complete private field implementation requires: 1) generate field initializer function that uses define_private_field, 2) augment constructor to call the field initializer, 3) handle put_private_field for this.#x = v assignments."}}
