{"run":1291,"commit":"559619d","metric":6,"metrics":{"compiler_test262_cases":1050,"compiler_test262_pass":1044,"compiler_test262_failures":6,"compiler_test262_compiler_errors":0,"compiler_test262_compiler_crashes":0,"compiler_test262_compiler_fails":1,"compiler_test262_both_fail":5,"compiler_test262_interpreter_fail_compiler_pass":0,"compatibility_pass":1044,"compatibility_cases":1050,"compiler_errors":0,"compiler_crashes":0,"compiler_fails":1,"both_fail":5,"interpreter_fail_compiler_pass":0,"elapsed_ms":36775},"status":"keep","description":"Baseline String 1050-case expansion","timestamp":1778701827397,"segment":79,"confidence":null,"iterationTokens":126,"asi":{"hypothesis":"Expand String workload after 1000-case workload returned to the known five-failure plateau; 1050 exposes the next remaining String semantics.","workload":"AUTORESEARCH_TEST262_CATEGORY=built-ins/String TEST262_LIMIT=1050 TEST262_ERROR_LIMIT=860 ./autoresearch.sh","baseline_note":"New 1050-case baseline has 6 failures, 1044 passes, one compiler-only semantic failure, and no compiler errors/crashes."}}
{"run":1292,"commit":"e905106","metric":5,"metrics":{"compiler_test262_cases":1050,"compiler_test262_pass":1045,"compiler_test262_failures":5,"compiler_test262_compiler_errors":0,"compiler_test262_compiler_crashes":0,"compiler_test262_compiler_fails":1,"compiler_test262_both_fail":4,"compiler_test262_interpreter_fail_compiler_pass":0,"compatibility_pass":1045,"compatibility_cases":1050,"compiler_errors":0,"compiler_crashes":0,"compiler_fails":1,"both_fail":4,"interpreter_fail_compiler_pass":0,"elapsed_ms":36619},"status":"keep","description":"Preserve well formed surrogate pairs","timestamp":1778702154193,"segment":79,"confidence":null,"iterationTokens":7276,"asi":{"hypothesis":"String.prototype.toWellFormed should replace only unpaired WTF-8 surrogate code units while preserving already paired surrogate sequences and ordinary Unicode code points.","fixed_focus":"toWellFormed/returns-well-formed-string.js","remaining_failures":"1050-case workload improved from 6 to 5; remaining failures are duplicate named RegExp groups, default-derived RegExp subclass replaceAll, and compiler-only replacement RegExp toString override."}}
{"type":"config","name":"String Test262 compatibility 1100-case expansion","metricName":"compatibility_failures","metricUnit":"","bestDirection":"lower"}
{"run":1293,"commit":"5ea6991","metric":13,"metrics":{"compiler_test262_cases":1100,"compiler_test262_pass":1087,"compiler_test262_failures":13,"compiler_test262_compiler_errors":0,"compiler_test262_compiler_crashes":0,"compiler_test262_compiler_fails":1,"compiler_test262_both_fail":12,"compiler_test262_interpreter_fail_compiler_pass":0,"compatibility_pass":1087,"compatibility_cases":1100,"compiler_errors":0,"compiler_crashes":0,"compiler_fails":1,"both_fail":12,"interpreter_fail_compiler_pass":0,"elapsed_ms":37755},"status":"keep","description":"Baseline String 1100-case expansion","timestamp":1778702330764,"segment":80,"confidence":null,"iterationTokens":126,"asi":{"hypothesis":"Expand String workload after 1050-case workload returned to the known five-failure plateau; 1100 exposes the next String semantics cluster.","workload":"AUTORESEARCH_TEST262_CATEGORY=built-ins/String TEST262_LIMIT=1100 TEST262_ERROR_LIMIT=920 ./autoresearch.sh","baseline_note":"New 1100-case baseline has 13 failures, 1087 passes, one compiler-only semantic failure, and no compiler errors/crashes."}}
{"run":1294,"commit":"fdec0fb","metric":5,"metrics":{"compiler_test262_cases":1100,"compiler_test262_pass":1095,"compiler_test262_failures":5,"compiler_test262_compiler_errors":0,"compiler_test262_compiler_crashes":0,"compiler_test262_compiler_fails":1,"compiler_test262_both_fail":4,"compiler_test262_interpreter_fail_compiler_pass":0,"compatibility_pass":1095,"compatibility_cases":1100,"compiler_errors":0,"compiler_crashes":0,"compiler_fails":1,"both_fail":4,"interpreter_fail_compiler_pass":0,"elapsed_ms":37802},"status":"keep","description":"Align String trim whitespace coercion","timestamp":1778702734488,"segment":80,"confidence":null,"iterationTokens":9849,"asi":{"hypothesis":"String trim methods should use the ECMAScript whitespace set including BOM/line separators, and String receiver coercion for arguments objects should stringify as [object Arguments] rather than array-join text.","fixed_focus":"trim/15.5.4.20-2-51.js and whitespace/BOM trim cases 3-2 through 4-18","remaining_failures":"1100-case workload improved from 13 to 5; remaining failures are duplicate named RegExp groups, default-derived RegExp subclass replaceAll, and compiler-only replacement RegExp toString override."}}
{"type":"config","name":"String Test262 compatibility 1150-case expansion","metricName":"compatibility_failures","metricUnit":"","bestDirection":"lower"}
{"run":1295,"commit":"1295df2","metric":5,"metrics":{"compiler_test262_cases":1150,"compiler_test262_pass":1145,"compiler_test262_failures":5,"compiler_test262_compiler_errors":0,"compiler_test262_compiler_crashes":0,"compiler_test262_compiler_fails":1,"compiler_test262_both_fail":4,"compiler_test262_interpreter_fail_compiler_pass":0,"compatibility_pass":1145,"compatibility_cases":1150,"compiler_errors":0,"compiler_crashes":0,"compiler_fails":1,"both_fail":4,"interpreter_fail_compiler_pass":0,"elapsed_ms":39188},"status":"keep","description":"Baseline String 1150-case expansion","timestamp":1778702950850,"segment":81,"confidence":null,"iterationTokens":126,"asi":{"hypothesis":"Expand String workload after 1100-case workload returned to the known five-failure plateau; 1150 checks whether remaining bounded String cases reveal additional semantic clusters.","workload":"AUTORESEARCH_TEST262_CATEGORY=built-ins/String TEST262_LIMIT=1150 TEST262_ERROR_LIMIT=980 ./autoresearch.sh","baseline_note":"New 1150-case baseline remains at 5 failures, 1145 passes, one compiler-only semantic failure, and no compiler errors/crashes."}}
{"type":"config","name":"String Test262 compatibility 1200-case expansion","metricName":"compatibility_failures","metricUnit":"","bestDirection":"lower"}
{"run":1296,"commit":"340cefc","metric":10,"metrics":{"compiler_test262_cases":1200,"compiler_test262_pass":1190,"compiler_test262_failures":10,"compiler_test262_compiler_errors":0,"compiler_test262_compiler_crashes":0,"compiler_test262_compiler_fails":1,"compiler_test262_both_fail":6,"compiler_test262_interpreter_fail_compiler_pass":0,"compatibility_pass":1190,"compatibility_cases":1200,"compiler_errors":0,"compiler_crashes":0,"compiler_fails":1,"both_fail":6,"interpreter_fail_compiler_pass":0,"elapsed_ms":41150},"status":"keep","description":"Baseline String 1200-case expansion","timestamp":1778703137810,"segment":82,"confidence":null,"iterationTokens":127,"asi":{"hypothesis":"Expand String workload beyond the 1150-case plateau to expose the next remaining String/iterator/constructor semantics.","workload":"AUTORESEARCH_TEST262_CATEGORY=built-ins/String TEST262_LIMIT=1200 TEST262_ERROR_LIMIT=1040 ./autoresearch.sh","baseline_note":"New 1200-case baseline has 10 failures, 1190 passes, one compiler-only semantic failure, and no compiler errors/crashes."}}
{"run":1297,"commit":"cda2d1c","metric":5,"metrics":{"compiler_test262_cases":1200,"compiler_test262_pass":1195,"compiler_test262_failures":5,"compiler_test262_compiler_errors":0,"compiler_test262_compiler_crashes":0,"compiler_test262_compiler_fails":1,"compiler_test262_both_fail":4,"compiler_test262_interpreter_fail_compiler_pass":0,"compatibility_pass":1195,"compatibility_cases":1200,"compiler_errors":0,"compiler_crashes":0,"compiler_fails":1,"both_fail":4,"interpreter_fail_compiler_pass":0,"elapsed_ms":41245},"status":"keep","description":"Use object access in String raw","timestamp":1778703420294,"segment":82,"confidence":null,"iterationTokens":10775,"asi":{"hypothesis":"String.raw should read template.raw and indexed segments through ordinary Get, apply ToLength to raw.length, and throw on Symbol segment/substitution ToString rather than directly Map.get-ing object storage.","fixed_focus":"String/raw nextkey symbol, empty array length, undefined/not-defined/negative-infinity length cases","remaining_failures":"1200-case workload improved from 10 to 5; remaining failures are duplicate named RegExp groups, default-derived RegExp subclass replaceAll, and compiler-only replacement RegExp toString override."}}
{"type":"config","name":"String Test262 compatibility 1250-case expansion","metricName":"compatibility_failures","metricUnit":"","bestDirection":"lower"}
{"run":1298,"commit":"e846037","metric":7,"metrics":{"compiler_test262_cases":1223,"compiler_test262_pass":1216,"compiler_test262_failures":7,"compiler_test262_compiler_errors":0,"compiler_test262_compiler_crashes":0,"compiler_test262_compiler_fails":1,"compiler_test262_both_fail":6,"compiler_test262_interpreter_fail_compiler_pass":0,"compatibility_pass":1216,"compatibility_cases":1223,"compiler_errors":0,"compiler_crashes":0,"compiler_fails":1,"both_fail":6,"interpreter_fail_compiler_pass":0,"elapsed_ms":41496},"status":"keep","description":"Baseline String full bounded expansion","timestamp":1778703614442,"segment":83,"confidence":null,"iterationTokens":127,"asi":{"hypothesis":"Raise the String limit beyond the available case count to cover the full current built-ins/String workload and identify final residual String failures.","workload":"AUTORESEARCH_TEST262_CATEGORY=built-ins/String TEST262_LIMIT=1250 TEST262_ERROR_LIMIT=1100 ./autoresearch.sh","baseline_note":"Full current String bounded workload has 1223 cases, 7 failures, 1216 passes, one compiler-only semantic failure, and no compiler errors/crashes."}}
{"run":1299,"commit":"e3eb3de","metric":5,"metrics":{"compiler_test262_cases":1223,"compiler_test262_pass":1218,"compiler_test262_failures":5,"compiler_test262_compiler_errors":0,"compiler_test262_compiler_crashes":0,"compiler_test262_compiler_fails":1,"compiler_test262_both_fail":4,"compiler_test262_interpreter_fail_compiler_pass":0,"compatibility_pass":1218,"compatibility_cases":1223,"compiler_errors":0,"compiler_crashes":0,"compiler_fails":1,"both_fail":4,"interpreter_fail_compiler_pass":0,"elapsed_ms":41662},"status":"keep","description":"Limit String raw substitutions","timestamp":1778703874628,"segment":83,"confidence":null,"iterationTokens":4017,"asi":{"hypothesis":"String.raw should append substitutions only between raw segments, and constructed String wrappers must reject Symbol values while callable String(Symbol) remains descriptive.","fixed_focus":"String/raw/substitutions-are-limited-to-template-raw-length.js and String/symbol-wrapping.js","remaining_failures":"Full bounded String workload improved from 7 to 5; remaining failures are duplicate named RegExp groups, default-derived RegExp subclass replaceAll, and compiler-only replacement RegExp toString override."}}
{"type":"config","name":"Date Test262 compatibility 700-case reprise","metricName":"compatibility_failures","metricUnit":"","bestDirection":"lower"}
{"run":1300,"commit":"63b8ddc","metric":10,"metrics":{"compiler_test262_cases":594,"compiler_test262_pass":584,"compiler_test262_failures":10,"compiler_test262_compiler_errors":0,"compiler_test262_compiler_crashes":0,"compiler_test262_compiler_fails":0,"compiler_test262_both_fail":9,"compiler_test262_interpreter_fail_compiler_pass":0,"compatibility_pass":584,"compatibility_cases":594,"compiler_errors":0,"compiler_crashes":0,"compiler_fails":0,"both_fail":9,"interpreter_fail_compiler_pass":0,"elapsed_ms":26898},"status":"keep","description":"Baseline Date 700-case reprise","timestamp":1778704198268,"segment":84,"confidence":null,"iterationTokens":125,"asi":{"hypothesis":"Rebaseline Date after full String reached a persistent five-failure plateau requiring deeper RegExp/compiler work; Date still has bounded shared semantic failures likely addressable independently.","workload":"AUTORESEARCH_TEST262_CATEGORY=built-ins/Date TEST262_LIMIT=700 TEST262_ERROR_LIMIT=260 ./autoresearch.sh","baseline_note":"Date reprise remains at 10 failures across 594 cases with no compiler-only failures/errors/crashes."}}
{"type":"config","name":"Function Test262 compatibility 600-case reprise","metricName":"compatibility_failures","metricUnit":"","bestDirection":"lower"}
{"run":1301,"commit":"3c7638d","metric":13,"metrics":{"compiler_test262_cases":509,"compiler_test262_pass":496,"compiler_test262_failures":13,"compiler_test262_compiler_errors":0,"compiler_test262_compiler_crashes":0,"compiler_test262_compiler_fails":0,"compiler_test262_both_fail":13,"compiler_test262_interpreter_fail_compiler_pass":0,"compatibility_pass":496,"compatibility_cases":509,"compiler_errors":0,"compiler_crashes":0,"compiler_fails":0,"both_fail":13,"interpreter_fail_compiler_pass":0,"elapsed_ms":27188},"status":"keep","description":"Baseline Function 600-case reprise","timestamp":1778704964720,"segment":85,"confidence":null,"iterationTokens":125,"asi":{"hypothesis":"Rebaseline Function after Date remained at the known difficult local-time/Symbol.toPrimitive plateau; Function may expose independently addressable remaining callable semantics.","workload":"AUTORESEARCH_TEST262_CATEGORY=built-ins/Function TEST262_LIMIT=600 TEST262_ERROR_LIMIT=260 ./autoresearch.sh","baseline_note":"Function reprise has 13 failures across 509 cases with no compiler-only failures/errors/crashes."}}
{"run":1302,"commit":"aa1a82a","metric":12,"metrics":{"compiler_test262_cases":509,"compiler_test262_pass":497,"compiler_test262_failures":12,"compiler_test262_compiler_errors":0,"compiler_test262_compiler_crashes":0,"compiler_test262_compiler_fails":0,"compiler_test262_both_fail":12,"compiler_test262_interpreter_fail_compiler_pass":0,"compatibility_pass":497,"compatibility_cases":509,"compiler_errors":0,"compiler_crashes":0,"compiler_fails":0,"both_fail":12,"interpreter_fail_compiler_pass":0,"elapsed_ms":26208},"status":"keep","description":"Box realm builtin call receivers","timestamp":1778705321272,"segment":85,"confidence":null,"iterationTokens":12626,"asi":{"hypothesis":"Function.prototype.call on realm-created functions should box primitive this values using the callee realm intrinsics, even when the realm function is represented as a builtin callback.","fixed_focus":"Function/call-bind-this-realm-value.js","remaining_failures":"Function workload improved from 13 to 12; remaining cases are mostly strict caller/arguments stack semantics plus proto-from-ctor-realm-prototype."}}
{"type":"config","name":"Set Test262 compatibility 300-case reprise","metricName":"compatibility_failures","metricUnit":"","bestDirection":"lower"}
{"run":1303,"commit":"78b4eb3","metric":4,"metrics":{"compiler_test262_cases":300,"compiler_test262_pass":296,"compiler_test262_failures":4,"compiler_test262_compiler_errors":0,"compiler_test262_compiler_crashes":0,"compiler_test262_compiler_fails":0,"compiler_test262_both_fail":4,"compiler_test262_interpreter_fail_compiler_pass":0,"compatibility_pass":296,"compatibility_cases":300,"compiler_errors":0,"compiler_crashes":0,"compiler_fails":0,"both_fail":4,"interpreter_fail_compiler_pass":0,"elapsed_ms":11663},"status":"keep","description":"Baseline Set 300-case reprise","timestamp":1778705558306,"segment":86,"confidence":null,"iterationTokens":125,"asi":{"hypothesis":"Rebaseline Set after String/Function plateaus; remaining set-like ordering failures may still be independently addressable.","workload":"AUTORESEARCH_TEST262_CATEGORY=built-ins/Set TEST262_LIMIT=300 TEST262_ERROR_LIMIT=180 ./autoresearch.sh","baseline_note":"Set 300-case reprise has 4 failures, 296 passes, and no compiler-only failures/errors/crashes."}}
{"type":"config","name":"Map Test262 compatibility 700-case reprise","metricName":"compatibility_failures","metricUnit":"","bestDirection":"lower"}
{"run":1304,"commit":"c180fb9","metric":0,"metrics":{"compiler_test262_cases":204,"compiler_test262_pass":204,"compiler_test262_failures":0,"compiler_test262_compiler_errors":0,"compiler_test262_compiler_crashes":0,"compiler_test262_compiler_fails":0,"compiler_test262_both_fail":0,"compiler_test262_interpreter_fail_compiler_pass":0,"compatibility_pass":204,"compatibility_cases":204,"compiler_errors":0,"compiler_crashes":0,"compiler_fails":0,"both_fail":0,"interpreter_fail_compiler_pass":0,"elapsed_ms":8779},"status":"keep","description":"Baseline Map 700-case reprise","timestamp":1778706024965,"segment":87,"confidence":null,"iterationTokens":125,"asi":{"hypothesis":"Rebaseline Map after Set remained at its set-like order plateau; prior Map residual failures may have been resolved by later collection/runtime work.","workload":"AUTORESEARCH_TEST262_CATEGORY=built-ins/Map TEST262_LIMIT=700 TEST262_ERROR_LIMIT=260 ./autoresearch.sh","baseline_note":"Map bounded workload is now clean: 204/204 passing with no compiler errors/crashes/fails."}}
{"type":"config","name":"Array Test262 compatibility 500-case reprise","metricName":"compatibility_failures","metricUnit":"","bestDirection":"lower"}
{"run":1305,"commit":"d103686","metric":4,"metrics":{"compiler_test262_cases":500,"compiler_test262_pass":496,"compiler_test262_failures":4,"compiler_test262_compiler_errors":0,"compiler_test262_compiler_crashes":0,"compiler_test262_compiler_fails":0,"compiler_test262_both_fail":4,"compiler_test262_interpreter_fail_compiler_pass":0,"compatibility_pass":496,"compatibility_cases":500,"compiler_errors":0,"compiler_crashes":0,"compiler_fails":0,"both_fail":4,"interpreter_fail_compiler_pass":0,"elapsed_ms":20993},"status":"keep","description":"Baseline Array 500-case reprise","timestamp":1778706248446,"segment":88,"confidence":null,"iterationTokens":125,"asi":{"hypothesis":"Rebaseline Array after Map reached zero and Set remains at order plateau; recent String/Function changes may have shifted bounded Array failures.","workload":"AUTORESEARCH_TEST262_CATEGORY=built-ins/Array TEST262_LIMIT=500 TEST262_ERROR_LIMIT=260 ./autoresearch.sh","baseline_note":"Array 500-case reprise has 4 failures, 496 passes, and no compiler-only failures/errors/crashes."}}
{"run":1306,"commit":"e514875","metric":1,"metrics":{"compiler_test262_cases":500,"compiler_test262_pass":499,"compiler_test262_failures":1,"compiler_test262_compiler_errors":0,"compiler_test262_compiler_crashes":0,"compiler_test262_compiler_fails":0,"compiler_test262_both_fail":1,"compiler_test262_interpreter_fail_compiler_pass":0,"compatibility_pass":499,"compatibility_cases":500,"compiler_errors":0,"compiler_crashes":0,"compiler_fails":0,"both_fail":1,"interpreter_fail_compiler_pass":0,"elapsed_ms":20667},"status":"keep","description":"Treat builtins and regexps as array-like every receivers","timestamp":1778706993185,"segment":88,"confidence":null,"iterationTokens":125,"asi":{"hypothesis":"Array.prototype.every should apply generic array-like semantics to builtin objects such as Math/JSON and RegExp tuple values, using ordinary length/property lookup instead of rejecting them as non-callable receivers.","fixed_focus":["Array/prototype/every/15.4.4.16-1-10.js","Array/prototype/every/15.4.4.16-1-12.js","Array/prototype/every/15.4.4.16-1-13.js"],"remaining_failures":"Array 500-case workload is back to the known resizable-buffer copyWithin plateau."}}
{"type":"config","name":"Array Test262 compatibility 550-case expansion","metricName":"compatibility_failures","metricUnit":"","bestDirection":"lower"}
{"run":1307,"commit":"b73dd9e","metric":12,"metrics":{"compiler_test262_cases":550,"compiler_test262_pass":538,"compiler_test262_failures":12,"compiler_test262_compiler_errors":0,"compiler_test262_compiler_crashes":0,"compiler_test262_compiler_fails":0,"compiler_test262_both_fail":12,"compiler_test262_interpreter_fail_compiler_pass":0,"compatibility_pass":538,"compatibility_cases":550,"compiler_errors":0,"compiler_crashes":0,"compiler_fails":0,"both_fail":12,"interpreter_fail_compiler_pass":0,"elapsed_ms":22854},"status":"keep","description":"Baseline Array 550-case expansion","timestamp":1778707149227,"segment":89,"confidence":null,"iterationTokens":125,"asi":{"hypothesis":"Expand Array workload from the now-1-failure 500-case plateau to expose the next generic array-method compatibility cluster.","workload":"AUTORESEARCH_TEST262_CATEGORY=built-ins/Array TEST262_LIMIT=550 TEST262_ERROR_LIMIT=300 ./autoresearch.sh","baseline_note":"Array 550-case expansion has 12 failures, no compiler-only failures/errors/crashes."}}
{"run":1308,"commit":"82a01a2","metric":8,"metrics":{"compiler_test262_cases":550,"compiler_test262_pass":542,"compiler_test262_failures":8,"compiler_test262_compiler_errors":0,"compiler_test262_compiler_crashes":0,"compiler_test262_compiler_fails":0,"compiler_test262_both_fail":8,"compiler_test262_interpreter_fail_compiler_pass":0,"compatibility_pass":542,"compatibility_cases":550,"compiler_errors":0,"compiler_crashes":0,"compiler_fails":0,"both_fail":8,"interpreter_fail_compiler_pass":0,"elapsed_ms":22719},"status":"keep","description":"Align Array fill index coercion","timestamp":1778707432231,"segment":89,"confidence":null,"iterationTokens":8558,"asi":{"hypothesis":"Array.prototype.fill should treat explicit undefined start/end like omitted values and apply relative negative start/end indexes instead of using raw argument values as absolute indexes.","fixed_focus":["Array/prototype/fill/coerced-indexes.js","Array/prototype/fill/fill-values-custom-start-and-end.js","Array/prototype/fill/fill-values-relative-end.js","Array/prototype/fill/fill-values-relative-start.js"],"remaining_failures":"Remaining Array 550 failures are resizable-buffer/every typed-array parity, exotic array length, Boolean wrapper instance check for fill.call(true), and near-integer-limit fill object semantics."}}
