{"run":1663,"commit":"1017401","metric":10,"metrics":{"compiler_test262_cases":27,"compiler_test262_pass":17,"compiler_test262_failures":10,"compiler_test262_compiler_errors":0,"compiler_test262_compiler_crashes":0,"compiler_test262_compiler_fails":0,"compiler_test262_both_fail":10,"compiler_test262_interpreter_fail_compiler_pass":0,"compatibility_pass":17,"compatibility_cases":27,"compiler_errors":0,"compiler_crashes":0,"compiler_fails":0,"both_fail":10,"interpreter_fail_compiler_pass":0,"elapsed_ms":1959},"status":"keep","description":"Expose Array iterator prototype metadata","timestamp":1778853256591,"segment":156,"confidence":6,"iterationTokens":3158,"asi":{"hypothesis":"Array iterator instances can keep their existing closure-backed own next while exposing a prototype object with next, @@iterator, and @@toStringTag descriptors for Test262 prototype metadata without changing generator delegation behavior."}}
{"type":"config","name":"QuickBEAM MapIteratorPrototype built-ins compatibility slice","metricName":"compatibility_failures","metricUnit":"","bestDirection":"lower"}
{"run":1664,"commit":"2a086e7","metric":10,"metrics":{"compiler_test262_cases":11,"compiler_test262_pass":1,"compiler_test262_failures":10,"compiler_test262_compiler_errors":0,"compiler_test262_compiler_crashes":0,"compiler_test262_compiler_fails":0,"compiler_test262_both_fail":10,"compiler_test262_interpreter_fail_compiler_pass":0,"compatibility_pass":1,"compatibility_cases":11,"compiler_errors":0,"compiler_crashes":0,"compiler_fails":0,"both_fail":10,"interpreter_fail_compiler_pass":0,"elapsed_ms":1206},"status":"keep","description":"Baseline MapIteratorPrototype built-ins slice","timestamp":1778853412531,"segment":157,"confidence":null,"iterationTokens":129,"asi":{"hypothesis":"MapIteratorPrototype likely has a small metadata/prototype gap similar to ArrayIteratorPrototype."}}
{"run":1665,"commit":"cac4cff","metric":7,"metrics":{"compiler_test262_cases":11,"compiler_test262_pass":4,"compiler_test262_failures":7,"compiler_test262_compiler_errors":0,"compiler_test262_compiler_crashes":0,"compiler_test262_compiler_fails":0,"compiler_test262_both_fail":7,"compiler_test262_interpreter_fail_compiler_pass":0,"compatibility_pass":4,"compatibility_cases":11,"compiler_errors":0,"compiler_crashes":0,"compiler_fails":0,"both_fail":7,"interpreter_fail_compiler_pass":0,"elapsed_ms":1253},"status":"keep","description":"Expose Map iterator prototype metadata","timestamp":1778853615428,"segment":157,"confidence":null,"iterationTokens":3035,"asi":{"hypothesis":"Map iterator instances can preserve existing own next closures while exposing a prototype object with next, @@iterator, and @@toStringTag descriptor metadata, mirroring the Array iterator metadata fix."}}
{"type":"config","name":"QuickBEAM SetIteratorPrototype built-ins compatibility slice","metricName":"compatibility_failures","metricUnit":"","bestDirection":"lower"}
{"run":1666,"commit":"360aa72","metric":10,"metrics":{"compiler_test262_cases":11,"compiler_test262_pass":1,"compiler_test262_failures":10,"compiler_test262_compiler_errors":0,"compiler_test262_compiler_crashes":0,"compiler_test262_compiler_fails":0,"compiler_test262_both_fail":10,"compiler_test262_interpreter_fail_compiler_pass":0,"compatibility_pass":1,"compatibility_cases":11,"compiler_errors":0,"compiler_crashes":0,"compiler_fails":0,"both_fail":10,"interpreter_fail_compiler_pass":0,"elapsed_ms":1772},"status":"keep","description":"Baseline SetIteratorPrototype built-ins slice","timestamp":1778853771135,"segment":158,"confidence":null,"iterationTokens":129,"asi":{"hypothesis":"SetIteratorPrototype likely has the same small metadata/prototype gap as MapIteratorPrototype."}}
{"run":1667,"commit":"07690f6","metric":7,"metrics":{"compiler_test262_cases":11,"compiler_test262_pass":4,"compiler_test262_failures":7,"compiler_test262_compiler_errors":0,"compiler_test262_compiler_crashes":0,"compiler_test262_compiler_fails":0,"compiler_test262_both_fail":7,"compiler_test262_interpreter_fail_compiler_pass":0,"compatibility_pass":4,"compatibility_cases":11,"compiler_errors":0,"compiler_crashes":0,"compiler_fails":0,"both_fail":7,"interpreter_fail_compiler_pass":0,"elapsed_ms":1288},"status":"keep","description":"Expose Set iterator prototype metadata","timestamp":1778854068516,"segment":158,"confidence":null,"iterationTokens":5802,"asi":{"hypothesis":"Set iterator instances can preserve existing closure-backed own next while exposing a prototype object with next, @@iterator, and @@toStringTag descriptors, matching the Map iterator metadata pattern."}}
{"type":"config","name":"QuickBEAM StringIteratorPrototype built-ins compatibility slice","metricName":"compatibility_failures","metricUnit":"","bestDirection":"lower"}
{"run":1668,"commit":"dcb7503","metric":6,"metrics":{"compiler_test262_cases":7,"compiler_test262_pass":1,"compiler_test262_failures":6,"compiler_test262_compiler_errors":0,"compiler_test262_compiler_crashes":0,"compiler_test262_compiler_fails":0,"compiler_test262_both_fail":6,"compiler_test262_interpreter_fail_compiler_pass":0,"compatibility_pass":1,"compatibility_cases":7,"compiler_errors":0,"compiler_crashes":0,"compiler_fails":0,"both_fail":6,"interpreter_fail_compiler_pass":0,"elapsed_ms":1230},"status":"keep","description":"Baseline StringIteratorPrototype built-ins slice","timestamp":1778854251346,"segment":159,"confidence":null,"iterationTokens":128,"asi":{"hypothesis":"StringIteratorPrototype likely has a small missing prototype metadata cluster similar to Array/Map/Set iterator prototypes."}}
{"run":1669,"commit":"c9e2a60","metric":2,"metrics":{"compiler_test262_cases":7,"compiler_test262_pass":5,"compiler_test262_failures":2,"compiler_test262_compiler_errors":0,"compiler_test262_compiler_crashes":0,"compiler_test262_compiler_fails":0,"compiler_test262_both_fail":2,"compiler_test262_interpreter_fail_compiler_pass":0,"compatibility_pass":5,"compatibility_cases":7,"compiler_errors":0,"compiler_crashes":0,"compiler_fails":0,"both_fail":2,"interpreter_fail_compiler_pass":0,"elapsed_ms":1145},"status":"keep","description":"Expose String iterator prototype metadata","timestamp":1778854486618,"segment":159,"confidence":null,"iterationTokens":4815,"asi":{"hypothesis":"String iterator instances can preserve existing list-backed next behavior while exposing a prototype object with next, @@iterator, and @@toStringTag descriptor metadata like the collection iterators."}}
{"type":"config","name":"QuickBEAM RegExpStringIteratorPrototype built-ins compatibility slice","metricName":"compatibility_failures","metricUnit":"","bestDirection":"lower"}
{"run":1670,"commit":"88bdbfd","metric":9,"metrics":{"compiler_test262_cases":17,"compiler_test262_pass":8,"compiler_test262_failures":9,"compiler_test262_compiler_errors":0,"compiler_test262_compiler_crashes":0,"compiler_test262_compiler_fails":0,"compiler_test262_both_fail":9,"compiler_test262_interpreter_fail_compiler_pass":0,"compatibility_pass":8,"compatibility_cases":17,"compiler_errors":0,"compiler_crashes":0,"compiler_fails":0,"both_fail":9,"interpreter_fail_compiler_pass":0,"elapsed_ms":1510},"status":"keep","description":"Baseline RegExpStringIteratorPrototype built-ins slice","timestamp":1778854646031,"segment":160,"confidence":null,"iterationTokens":133,"asi":{"hypothesis":"RegExpStringIteratorPrototype may have the same small metadata/prototype gap as the other iterator prototype slices."}}
{"run":1671,"commit":"d96479d","metric":5,"metrics":{"compiler_test262_cases":17,"compiler_test262_pass":12,"compiler_test262_failures":5,"compiler_test262_compiler_errors":0,"compiler_test262_compiler_crashes":0,"compiler_test262_compiler_fails":0,"compiler_test262_both_fail":5,"compiler_test262_interpreter_fail_compiler_pass":0,"compatibility_pass":12,"compatibility_cases":17,"compiler_errors":0,"compiler_crashes":0,"compiler_fails":0,"both_fail":5,"interpreter_fail_compiler_pass":0,"elapsed_ms":1522},"status":"keep","description":"Expose RegExp string iterator prototype metadata","timestamp":1778854857499,"segment":160,"confidence":null,"iterationTokens":3030,"asi":{"hypothesis":"RegExp matchAll iterators can preserve precomputed own next behavior while exposing a RegExp String Iterator prototype with next, @@iterator, and @@toStringTag descriptor metadata."}}
{"type":"config","name":"QuickBEAM DataView built-ins compatibility slice","metricName":"compatibility_failures","metricUnit":"","bestDirection":"lower"}
{"run":1672,"commit":"0f80138","metric":427,"metrics":{"compiler_test262_cases":500,"compiler_test262_pass":73,"compiler_test262_failures":427,"compiler_test262_compiler_errors":0,"compiler_test262_compiler_crashes":0,"compiler_test262_compiler_fails":0,"compiler_test262_both_fail":418,"compiler_test262_interpreter_fail_compiler_pass":9,"compatibility_pass":73,"compatibility_cases":500,"compiler_errors":0,"compiler_crashes":0,"compiler_fails":0,"both_fail":418,"interpreter_fail_compiler_pass":9,"elapsed_ms":21576},"status":"keep","description":"Baseline DataView built-ins slice after iterator metadata work","timestamp":1778855051162,"segment":161,"confidence":null,"iterationTokens":126,"asi":{"hypothesis":"Survey DataView as a broader typed-buffer future phase; likely large but may expose easy constructor/prototype metadata gaps."}}
{"type":"config","name":"QuickBEAM ThrowTypeError built-ins compatibility slice","metricName":"compatibility_failures","metricUnit":"","bestDirection":"lower"}
{"run":1673,"commit":"239f03b","metric":14,"metrics":{"compiler_test262_cases":14,"compiler_test262_pass":0,"compiler_test262_failures":14,"compiler_test262_compiler_errors":0,"compiler_test262_compiler_crashes":0,"compiler_test262_compiler_fails":0,"compiler_test262_both_fail":9,"compiler_test262_interpreter_fail_compiler_pass":5,"compatibility_pass":0,"compatibility_cases":14,"compiler_errors":0,"compiler_crashes":0,"compiler_fails":0,"both_fail":9,"interpreter_fail_compiler_pass":5,"elapsed_ms":1252},"status":"keep","description":"Baseline ThrowTypeError built-ins slice","timestamp":1778855199620,"segment":162,"confidence":null,"iterationTokens":129,"asi":{"hypothesis":"ThrowTypeError is a small slice that may be tied to restricted caller/arguments accessor semantics and function prototype metadata."}}
{"run":1674,"commit":"94be5a3","metric":2,"metrics":{"compiler_test262_cases":14,"compiler_test262_pass":12,"compiler_test262_failures":2,"compiler_test262_compiler_errors":0,"compiler_test262_compiler_crashes":0,"compiler_test262_compiler_fails":0,"compiler_test262_both_fail":1,"compiler_test262_interpreter_fail_compiler_pass":1,"compatibility_pass":12,"compatibility_cases":14,"compiler_errors":0,"compiler_crashes":0,"compiler_fails":0,"both_fail":1,"interpreter_fail_compiler_pass":1,"elapsed_ms":1334},"status":"keep","description":"Model ThrowTypeError intrinsic for arguments callee","timestamp":1778856651402,"segment":162,"confidence":null,"iterationTokens":129,"asi":{"hypothesis":"Installing a real anonymous ThrowTypeError intrinsic on arguments callee descriptors with non-configurable name/length metadata should satisfy most built-ins/ThrowTypeError tests without weakening backpressure checks.","result":"ThrowTypeError slice improved from 14 failures to 2; checks passed.","remaining":"Likely remaining failures are cross-realm uniqueness/strict-only arguments semantics refinements."}}
{"run":1675,"commit":"48ba4cb","metric":1,"metrics":{"compiler_test262_cases":14,"compiler_test262_pass":13,"compiler_test262_failures":1,"compiler_test262_compiler_errors":0,"compiler_test262_compiler_crashes":0,"compiler_test262_compiler_fails":0,"compiler_test262_both_fail":0,"compiler_test262_interpreter_fail_compiler_pass":1,"compatibility_pass":13,"compatibility_cases":14,"compiler_errors":0,"compiler_crashes":0,"compiler_fails":0,"both_fail":0,"interpreter_fail_compiler_pass":1,"elapsed_ms":1190},"status":"keep","description":"Reuse ThrowTypeError for Function prototype","timestamp":1778856843768,"segment":162,"confidence":13,"iterationTokens":5397,"asi":{"hypothesis":"Function.prototype caller/arguments restricted accessors should share the same realm ThrowTypeError intrinsic as strict arguments callee.","result":"ThrowTypeError residual dropped from 2 failures to 1; checks passed.","remaining":"distinct-cross-realm remains interpreter-only, likely due other-realm Function-created strict arguments not exposing callee descriptor."}}
{"run":1676,"commit":"23cad70","metric":0,"metrics":{"compiler_test262_cases":14,"compiler_test262_pass":14,"compiler_test262_failures":0,"compiler_test262_compiler_errors":0,"compiler_test262_compiler_crashes":0,"compiler_test262_compiler_fails":0,"compiler_test262_both_fail":0,"compiler_test262_interpreter_fail_compiler_pass":0,"compatibility_pass":14,"compatibility_cases":14,"compiler_errors":0,"compiler_crashes":0,"compiler_fails":0,"both_fail":0,"interpreter_fail_compiler_pass":0,"elapsed_ms":1202},"status":"keep","description":"Complete ThrowTypeError realm behavior","timestamp":1778857224232,"segment":162,"confidence":13,"iterationTokens":14624,"asi":{"hypothesis":"Realm-created Function bodies that return arguments need realm-local ThrowTypeError accessors, and distinct realm throwers must have distinct callable identity.","result":"ThrowTypeError slice completed at 0 failures; checks passed.","remaining":"The arguments callee accessor is currently installed broadly to match available strict-mode plumbing; future strict/non-strict arguments separation can refine this if broader tests expose regressions."}}
{"type":"config","name":"Improve StringIteratorPrototype Test262 compatibility","metricName":"compatibility_failures","metricUnit":"","bestDirection":"lower"}
{"run":1677,"commit":"e7b5e89","metric":2,"metrics":{"compiler_test262_cases":7,"compiler_test262_pass":5,"compiler_test262_failures":2,"compiler_test262_compiler_errors":0,"compiler_test262_compiler_crashes":0,"compiler_test262_compiler_fails":0,"compiler_test262_both_fail":2,"compiler_test262_interpreter_fail_compiler_pass":0,"compatibility_pass":5,"compatibility_cases":7,"compiler_errors":0,"compiler_crashes":0,"compiler_fails":0,"both_fail":2,"interpreter_fail_compiler_pass":0,"elapsed_ms":1135},"status":"keep","description":"Baseline StringIteratorPrototype residual","timestamp":1778857372835,"segment":163,"confidence":null,"iterationTokens":125,"asi":{"hypothesis":"StringIteratorPrototype is the next small residual slice after completing ThrowTypeError; establish a fresh baseline before semantic iterator-slot work."}}
{"run":1678,"commit":"e7b5e89","metric":1,"metrics":{"compiler_test262_cases":7,"compiler_test262_pass":6,"compiler_test262_failures":1,"compiler_test262_compiler_errors":0,"compiler_test262_compiler_crashes":0,"compiler_test262_compiler_fails":0,"compiler_test262_both_fail":1,"compiler_test262_interpreter_fail_compiler_pass":0,"compatibility_pass":6,"compatibility_cases":7,"compiler_errors":0,"compiler_crashes":0,"compiler_fails":0,"both_fail":1,"interpreter_fail_compiler_pass":0,"elapsed_ms":1075},"status":"checks_failed","description":"Combine string iterator surrogate pairs as WTF-8 units","timestamp":1778857482313,"segment":163,"confidence":null,"iterationTokens":6803,"asi":{"hypothesis":"Combining adjacent UTF-16 high/low surrogate units in String iterator output should satisfy surrogate-pair iteration tests.","rollback_reason":"Backpressure compiler tests require boxed and primitive astral string iterators to return canonical UTF-8 scalar strings, but this attempt returned concatenated WTF-8 surrogate bytes.","next_action_hint":"Retry by combining valid surrogate pairs into a single Unicode scalar UTF-8 codepoint while preserving lone surrogate WTF-8 units."}}
{"run":1679,"commit":"067e928","metric":1,"metrics":{"compiler_test262_cases":7,"compiler_test262_pass":6,"compiler_test262_failures":1,"compiler_test262_compiler_errors":0,"compiler_test262_compiler_crashes":0,"compiler_test262_compiler_fails":0,"compiler_test262_both_fail":1,"compiler_test262_interpreter_fail_compiler_pass":0,"compatibility_pass":6,"compatibility_cases":7,"compiler_errors":0,"compiler_crashes":0,"compiler_fails":0,"both_fail":1,"interpreter_fail_compiler_pass":0,"elapsed_ms":1155},"status":"keep","description":"Preserve string iterator surrogate pairs","timestamp":1778857685560,"segment":163,"confidence":null,"iterationTokens":3484,"asi":{"hypothesis":"String iteration should scan the original binary representation so escaped UTF-16 surrogate pairs stay paired while canonical astral UTF-8 scalars remain scalars.","result":"StringIteratorPrototype failures improved from 2 to 1; checks passed.","remaining":"next-missing-internal-slots still needs real receiver validation for String Iterator next without breaking generator delegation."}}
{"run":1680,"commit":"61e237c","metric":0,"metrics":{"compiler_test262_cases":7,"compiler_test262_pass":7,"compiler_test262_failures":0,"compiler_test262_compiler_errors":0,"compiler_test262_compiler_crashes":0,"compiler_test262_compiler_fails":0,"compiler_test262_both_fail":0,"compiler_test262_interpreter_fail_compiler_pass":0,"compatibility_pass":7,"compatibility_cases":7,"compiler_errors":0,"compiler_crashes":0,"compiler_fails":0,"both_fail":0,"interpreter_fail_compiler_pass":0,"elapsed_ms":1026},"status":"keep","description":"Validate String iterator receivers","timestamp":1778857863230,"segment":163,"confidence":null,"iterationTokens":2775,"asi":{"hypothesis":"A String iterator next closure can safely validate that the receiver is its exact iterator object, fixing the remaining internal-slot test without changing Array/generator iterator delegation.","result":"StringIteratorPrototype slice completed at 0 failures; checks passed.","remaining":"Other iterator prototypes still need their own carefully scoped slot validation; avoid broad shared prototype-only next refactors."}}
{"type":"config","name":"Improve RegExpStringIteratorPrototype Test262 compatibility","metricName":"compatibility_failures","metricUnit":"","bestDirection":"lower"}
{"run":1681,"commit":"4a47c5c","metric":5,"metrics":{"compiler_test262_cases":17,"compiler_test262_pass":12,"compiler_test262_failures":5,"compiler_test262_compiler_errors":0,"compiler_test262_compiler_crashes":0,"compiler_test262_compiler_fails":0,"compiler_test262_both_fail":5,"compiler_test262_interpreter_fail_compiler_pass":0,"compatibility_pass":12,"compatibility_cases":17,"compiler_errors":0,"compiler_crashes":0,"compiler_fails":0,"both_fail":5,"interpreter_fail_compiler_pass":0,"elapsed_ms":1525},"status":"keep","description":"Baseline RegExpStringIteratorPrototype residual","timestamp":1778858015084,"segment":164,"confidence":null,"iterationTokens":130,"asi":{"hypothesis":"RegExpStringIteratorPrototype is the next bounded iterator metadata residual after completing StringIteratorPrototype; establish baseline before scoped iterator fixes."}}
{"run":1682,"commit":"6a3339d","metric":0,"metrics":{"compiler_test262_cases":17,"compiler_test262_pass":17,"compiler_test262_failures":0,"compiler_test262_compiler_errors":0,"compiler_test262_compiler_crashes":0,"compiler_test262_compiler_fails":0,"compiler_test262_both_fail":0,"compiler_test262_interpreter_fail_compiler_pass":0,"compatibility_pass":17,"compatibility_cases":17,"compiler_errors":0,"compiler_crashes":0,"compiler_fails":0,"both_fail":0,"interpreter_fail_compiler_pass":0,"elapsed_ms":1517},"status":"keep","description":"Complete RegExp string iterator next semantics","timestamp":1778858400956,"segment":164,"confidence":null,"iterationTokens":32119,"asi":{"hypothesis":"RegExp string iterators need a scoped next closure that validates its receiver, observes a later-customized RegExp.prototype.exec, handles null/custom match results, and stops after one non-global match.","result":"RegExpStringIteratorPrototype slice completed at 0 failures; checks passed.","remaining":"Array/Map/Set iterator prototype residuals remain; apply receiver validation carefully without the previously discarded prototype-only Array next refactor."}}
{"type":"config","name":"Improve MapIteratorPrototype Test262 compatibility","metricName":"compatibility_failures","metricUnit":"","bestDirection":"lower"}
{"run":1683,"commit":"df0595f","metric":7,"metrics":{"compiler_test262_cases":11,"compiler_test262_pass":4,"compiler_test262_failures":7,"compiler_test262_compiler_errors":0,"compiler_test262_compiler_crashes":0,"compiler_test262_compiler_fails":0,"compiler_test262_both_fail":7,"compiler_test262_interpreter_fail_compiler_pass":0,"compatibility_pass":4,"compatibility_cases":11,"compiler_errors":0,"compiler_crashes":0,"compiler_fails":0,"both_fail":7,"interpreter_fail_compiler_pass":0,"elapsed_ms":1300},"status":"keep","description":"Baseline MapIteratorPrototype residual","timestamp":1778858557103,"segment":165,"confidence":null,"iterationTokens":126,"asi":{"hypothesis":"MapIteratorPrototype is the next small iterator residual after completing String and RegExpString iterator slices; establish baseline before scoped receiver/iteration semantics changes."}}
