{"run":1756,"commit":"248d0d7","metric":0,"metrics":{"compiler_test262_cases":0,"compiler_test262_pass":0,"compiler_test262_failures":0,"compiler_test262_compiler_errors":0,"compiler_test262_compiler_crashes":1,"compiler_test262_compiler_fails":0,"compiler_test262_both_fail":0,"compiler_test262_interpreter_fail_compiler_pass":0,"compatibility_pass":0,"compatibility_cases":0,"compiler_errors":0,"compiler_crashes":1,"compiler_fails":0,"both_fail":0,"interpreter_fail_compiler_pass":0,"elapsed_ms":2200},"status":"crash","description":"Decode WTF-8 surrogates in RegExp.escape","timestamp":1778883101301,"segment":179,"confidence":null,"iterationTokens":3137,"asi":{"hypothesis":"RegExp.escape should decode QuickBEAM/WTF-8 lone surrogate byte sequences itself instead of using String.to_charlist, fixing escaped-surrogates without affecting native RegExp execution.","rollback_reason":"Focused escaped-surrogates passed, but the broad RegExp workload segfaulted immediately with exit 139; even this local escape decoding destabilized the current RegExp run in-process.","next_action_hint":"Do not retry RegExp.escape WTF-8 decoding unchanged. Reproduce the early crash under a smaller RegExp prefix before attempting another escape/surrogate fix."}}
{"type":"config","name":"Improve Iterator built-ins compatibility after completed iterator prototypes","metricName":"compatibility_failures","metricUnit":"","bestDirection":"lower"}
{"run":1757,"commit":"c50c346","metric":493,"metrics":{"compiler_test262_cases":500,"compiler_test262_pass":7,"compiler_test262_failures":493,"compiler_test262_compiler_errors":0,"compiler_test262_compiler_crashes":0,"compiler_test262_compiler_fails":0,"compiler_test262_both_fail":491,"compiler_test262_interpreter_fail_compiler_pass":0,"compatibility_pass":7,"compatibility_cases":500,"compiler_errors":0,"compiler_crashes":0,"compiler_fails":0,"both_fail":491,"interpreter_fail_compiler_pass":0,"elapsed_ms":22880},"status":"keep","description":"Baseline Iterator built-ins after prototype completions","timestamp":1778883394677,"segment":180,"confidence":null,"iterationTokens":126,"asi":{"hypothesis":"After completing several concrete iterator prototype categories, the broad Iterator built-ins slice may expose large missing Iterator helper clusters that are more tractable than RegExp native crashes.","result":"Iterator baseline is 493 failures out of 500 with checks passing.","remaining":"Inspect failure clustering; likely missing global Iterator constructor/prototype/helper methods."}}
{"run":1758,"commit":"aa1e205","metric":423,"metrics":{"compiler_test262_cases":500,"compiler_test262_pass":77,"compiler_test262_failures":423,"compiler_test262_compiler_errors":0,"compiler_test262_compiler_crashes":2,"compiler_test262_compiler_fails":0,"compiler_test262_both_fail":419,"compiler_test262_interpreter_fail_compiler_pass":0,"compatibility_pass":77,"compatibility_cases":500,"compiler_errors":0,"compiler_crashes":2,"compiler_fails":0,"both_fail":419,"interpreter_fail_compiler_pass":0,"elapsed_ms":22285},"status":"keep","description":"Add basic Iterator constructor and from","timestamp":1778884015289,"segment":180,"confidence":null,"iterationTokens":19715,"asi":{"hypothesis":"The broad Iterator slice is dominated by the missing Iterator constructor, Iterator.prototype identity, Iterator.from wrapping, and concrete iterator prototypes not inheriting from Iterator.prototype.","result":"Iterator failures improved from 493 to 423; checks passed. Constructor/prototype/from and concrete iterator @@iterator focused tests now pass.","remaining":"Most residuals are Iterator helper methods such as drop/every/filter/find/flatMap/map/reduce/some/take/toArray/forEach plus concat."}}
{"run":1759,"commit":"af3c2de","metric":373,"metrics":{"compiler_test262_cases":500,"compiler_test262_pass":127,"compiler_test262_failures":373,"compiler_test262_compiler_errors":0,"compiler_test262_compiler_crashes":6,"compiler_test262_compiler_fails":33,"compiler_test262_both_fail":329,"compiler_test262_interpreter_fail_compiler_pass":0,"compatibility_pass":127,"compatibility_cases":500,"compiler_errors":0,"compiler_crashes":6,"compiler_fails":33,"both_fail":329,"interpreter_fail_compiler_pass":0,"elapsed_ms":61231},"status":"keep","description":"Add basic Iterator helper methods","timestamp":1778884400863,"segment":180,"confidence":2.4,"iterationTokens":6278,"asi":{"hypothesis":"Early Iterator residuals include missing prototype helpers; adding basic drop/filter/every/find helper semantics should clear method metadata and core behavior cases in the first 500-case slice.","result":"Iterator failures improved from 423 to 373; checks passed. Focused drop/every/find behavior cases pass.","remaining":"Compiler-only failures/crashes increased for some helper paths; later fixes should preserve interpreter behavior while improving compiler contexts. Remaining helpers include concat/map/flatMap/reduce/some/take/toArray/forEach and stricter close/error ordering."}}
{"run":1760,"commit":"ea591a5","metric":335,"metrics":{"compiler_test262_cases":500,"compiler_test262_pass":165,"compiler_test262_failures":335,"compiler_test262_compiler_errors":0,"compiler_test262_compiler_crashes":11,"compiler_test262_compiler_fails":57,"compiler_test262_both_fail":262,"compiler_test262_interpreter_fail_compiler_pass":0,"compatibility_pass":165,"compatibility_cases":500,"compiler_errors":0,"compiler_crashes":11,"compiler_fails":57,"both_fail":262,"interpreter_fail_compiler_pass":0,"elapsed_ms":84692},"status":"keep","description":"Add Iterator map flatMap and forEach","timestamp":1778884772363,"segment":180,"confidence":3.590909090909091,"iterationTokens":4229,"asi":{"hypothesis":"The next Iterator cluster is missing map/flatMap/forEach helpers; basic lazy helper objects and consuming forEach should clear core behavior and metadata cases in the current slice.","result":"Iterator failures improved from 373 to 335; checks passed. Focused map, flatMap, and forEach behavior cases pass.","remaining":"The implementation is still simplified around closing/error ordering and compiler helper contexts. Remaining large clusters include concat and helper edge cases plus some static/prototype metadata."}}
{"run":1761,"commit":"937f67a","metric":292,"metrics":{"compiler_test262_cases":500,"compiler_test262_pass":208,"compiler_test262_failures":292,"compiler_test262_compiler_errors":0,"compiler_test262_compiler_crashes":15,"compiler_test262_compiler_fails":82,"compiler_test262_both_fail":187,"compiler_test262_interpreter_fail_compiler_pass":0,"compatibility_pass":208,"compatibility_cases":500,"compiler_errors":0,"compiler_crashes":15,"compiler_fails":82,"both_fail":187,"interpreter_fail_compiler_pass":0,"elapsed_ms":110087},"status":"keep","description":"Add Iterator take reduce some and toArray","timestamp":1778885199765,"segment":180,"confidence":4.02,"iterationTokens":3853,"asi":{"hypothesis":"The next Iterator helper cluster is missing take/some/reduce/toArray; adding basic lazy take plus consuming helpers should clear core behavior and metadata cases in the first 500-case slice.","result":"Iterator failures improved from 335 to 292; checks passed. Focused take/some cases pass.","remaining":"Residual now has many compiler-only failures/crashes from simplified helper builtins and remaining concat/edge-order cases; future fixes should target correctness and compiler context stability, not just adding method names."}}
{"run":1762,"commit":"bb462f5","metric":250,"metrics":{"compiler_test262_cases":500,"compiler_test262_pass":250,"compiler_test262_failures":250,"compiler_test262_compiler_errors":0,"compiler_test262_compiler_crashes":15,"compiler_test262_compiler_fails":82,"compiler_test262_both_fail":138,"compiler_test262_interpreter_fail_compiler_pass":0,"compatibility_pass":250,"compatibility_cases":500,"compiler_errors":0,"compiler_crashes":15,"compiler_fails":82,"both_fail":138,"interpreter_fail_compiler_pass":0,"elapsed_ms":147299},"status":"keep","description":"Add Iterator concat and method descriptors","timestamp":1778885611562,"segment":180,"confidence":3.7099236641221376,"iterationTokens":5598,"asi":{"hypothesis":"The remaining early Iterator static cluster includes Iterator.concat and method length/name descriptor checks; adding basic concat plus readonly hidden length/name descriptors should reduce broad failures.","result":"Iterator failures improved from 292 to 250; checks passed. Focused concat behavior and method descriptor cases pass.","remaining":"Residuals are now primarily edge-order/closing cases and compiler-only failures/crashes in helper paths; broad runtime is slower due simplified recursive helper loops."}}
{"run":1763,"commit":"599b2fa","metric":244,"metrics":{"compiler_test262_cases":500,"compiler_test262_pass":256,"compiler_test262_failures":244,"compiler_test262_compiler_errors":0,"compiler_test262_compiler_crashes":18,"compiler_test262_compiler_fails":81,"compiler_test262_both_fail":119,"compiler_test262_interpreter_fail_compiler_pass":0,"compatibility_pass":256,"compatibility_cases":500,"compiler_errors":0,"compiler_crashes":18,"compiler_fails":81,"both_fail":119,"interpreter_fail_compiler_pass":0,"elapsed_ms":152388},"status":"keep","description":"Add basic Iterator zip and zipKeyed","timestamp":1778886295083,"segment":180,"confidence":2.929411764705882,"iterationTokens":11788,"asi":{"hypothesis":"The first 500 Iterator slice still includes Iterator.zip/zipKeyed clusters; a basic shortest/longest zip helper over list and iterator inputs should clear many core behavior and metadata cases.","result":"Iterator failures improved from 250 to 244; checks passed. Focused basic shortest zip and zipKeyed cases pass, but longest padding iterator remains incomplete.","remaining":"Zip improvements are modest because padding/closing/order semantics remain incomplete and compiler-only failures dominate; avoid overextending zip without targeted focused failures."}}
{"run":1764,"commit":"9bc7a87","metric":243,"metrics":{"compiler_test262_cases":500,"compiler_test262_pass":257,"compiler_test262_failures":243,"compiler_test262_compiler_errors":0,"compiler_test262_compiler_crashes":17,"compiler_test262_compiler_fails":81,"compiler_test262_both_fail":119,"compiler_test262_interpreter_fail_compiler_pass":0,"compatibility_pass":257,"compatibility_cases":500,"compiler_errors":0,"compiler_crashes":17,"compiler_fails":81,"both_fail":119,"interpreter_fail_compiler_pass":0,"elapsed_ms":166008},"status":"keep","description":"Rebaseline Iterator after context resume","timestamp":1778886813571,"segment":180,"confidence":3.7593984962406015,"iterationTokens":11788,"asi":{"hypothesis":"Re-running the active Iterator workload after context compaction establishes the current residual list and checks whether the last Iterator zip changes are stable.","result":"Metric rebaselined at 243 failures out of 500 with checks passing, one better than the previous logged 244 likely due failure-shape/runtime stability rather than a new semantic code change.","next_action_hint":"Use the failure log to target shared semantic clusters, especially dispose metadata and Iterator.from/wrap/closing behavior, while avoiding filename-specific patches."}}
{"run":1765,"commit":"dd366e7","metric":233,"metrics":{"compiler_test262_cases":500,"compiler_test262_pass":267,"compiler_test262_failures":233,"compiler_test262_compiler_errors":0,"compiler_test262_compiler_crashes":17,"compiler_test262_compiler_fails":81,"compiler_test262_both_fail":109,"compiler_test262_interpreter_fail_compiler_pass":0,"compatibility_pass":267,"compatibility_cases":500,"compiler_errors":0,"compiler_crashes":17,"compiler_fails":81,"both_fail":109,"interpreter_fail_compiler_pass":0,"elapsed_ms":145253},"status":"keep","description":"Install Iterator dispose and prototype parents","timestamp":1778887267963,"segment":180,"confidence":5.3061224489795915,"iterationTokens":24435,"asi":{"hypothesis":"Concrete iterator prototypes should inherit from %Iterator.prototype% rather than %WrapForValidIteratorPrototype%, and %Iterator.prototype% should expose Symbol.dispose with normal built-in method descriptors.","result":"Iterator failures improved from 243 to 233; Symbol.dispose focused cases now pass and checks passed.","remaining":"WrapForValidIteratorPrototype remains distinct for Iterator.from wrappers; residuals still include callable/compiler crashes, close/error ordering, and special accessor descriptor weird-setter semantics for constructor/toStringTag."}}
{"run":1766,"commit":"7865b19","metric":230,"metrics":{"compiler_test262_cases":500,"compiler_test262_pass":270,"compiler_test262_failures":230,"compiler_test262_compiler_errors":0,"compiler_test262_compiler_crashes":17,"compiler_test262_compiler_fails":81,"compiler_test262_both_fail":106,"compiler_test262_interpreter_fail_compiler_pass":0,"compatibility_pass":270,"compatibility_cases":500,"compiler_errors":0,"compiler_crashes":17,"compiler_fails":81,"both_fail":106,"interpreter_fail_compiler_pass":0,"elapsed_ms":158307},"status":"keep","description":"Use Iterator prototype accessors","timestamp":1778887937320,"segment":180,"confidence":6.658227848101266,"iterationTokens":11766,"asi":{"hypothesis":"The Iterator proposal models Iterator.prototype.constructor and Symbol.toStringTag as special accessors with setters that ignore prototype properties, not ordinary data properties.","result":"Iterator failures improved from 233 to 230; Symbol.toStringTag prop-desc/weird-setter focused cases pass and checks passed.","remaining":"Iterator.prototype.constructor weird-setter still fails because assignment to inherited constructor accessor is not routed through the setter in the current object write path; avoid constructor-specific hacks without fixing generic inherited accessor writes."}}
{"run":1767,"commit":"7865b19","metric":230,"metrics":{"compiler_test262_cases":500,"compiler_test262_pass":270,"compiler_test262_failures":230,"compiler_test262_compiler_errors":0,"compiler_test262_compiler_crashes":18,"compiler_test262_compiler_fails":82,"compiler_test262_both_fail":104,"compiler_test262_interpreter_fail_compiler_pass":0,"compatibility_pass":270,"compatibility_cases":500,"compiler_errors":0,"compiler_crashes":18,"compiler_fails":82,"both_fail":104,"interpreter_fail_compiler_pass":0,"elapsed_ms":156587},"status":"discard","description":"Cache Iterator.from wrapper next records","timestamp":1778888375765,"segment":180,"confidence":13.15,"iterationTokens":17886,"asi":{"hypothesis":"Iterator.from wrappers should capture the underlying next method once and reject non-callable non-null Symbol.iterator values, matching GetIteratorFlattenable behavior.","rollback_reason":"Focused interpreter cases improved, but the primary Iterator metric stayed at 230 and compiler-only failures/crashes increased because generator-backed fallback cases still crash through compiled generator calls.","next_action_hint":"Do not retry wrapper next caching alone; pair it with compiled generator call stability or target shared semantic failures that improve both modes."}}
{"run":1768,"commit":"58a1a9d","metric":224,"metrics":{"compiler_test262_cases":500,"compiler_test262_pass":276,"compiler_test262_failures":224,"compiler_test262_compiler_errors":0,"compiler_test262_compiler_crashes":17,"compiler_test262_compiler_fails":81,"compiler_test262_both_fail":98,"compiler_test262_interpreter_fail_compiler_pass":2,"compatibility_pass":276,"compatibility_cases":500,"compiler_errors":0,"compiler_crashes":17,"compiler_fails":81,"both_fail":98,"interpreter_fail_compiler_pass":2,"elapsed_ms":141682},"status":"keep","description":"Close Iterator helpers on invalid arguments","timestamp":1778888779204,"segment":180,"confidence":13.45,"iterationTokens":5381,"asi":{"hypothesis":"Iterator helper methods validate callbacks/limits after acquiring the receiver as an iterator-like object and must invoke return on the underlying iterator when argument validation fails, without reading next for invalid drop/take limits.","result":"Iterator failures improved from 230 to 224; focused argument-validation closure cases for map/filter/every/find/flatMap/forEach/drop/take pass and checks passed.","remaining":"A small interpreter/compiler skew appeared in this slice, and many callback-throw/IteratorClose ordering cases plus compiler generator crashes remain."}}
{"run":1769,"commit":"9a30b4b","metric":208,"metrics":{"compiler_test262_cases":500,"compiler_test262_pass":292,"compiler_test262_failures":208,"compiler_test262_compiler_errors":0,"compiler_test262_compiler_crashes":17,"compiler_test262_compiler_fails":81,"compiler_test262_both_fail":82,"compiler_test262_interpreter_fail_compiler_pass":2,"compatibility_pass":292,"compatibility_cases":500,"compiler_errors":0,"compiler_crashes":17,"compiler_fails":81,"both_fail":82,"interpreter_fail_compiler_pass":2,"elapsed_ms":150103},"status":"keep","description":"Close Iterator helpers when callbacks throw","timestamp":1778889153834,"segment":180,"confidence":14.25,"iterationTokens":6136,"asi":{"hypothesis":"Iterator helper callback abrupt completions should perform IfAbruptCloseIterator: call the underlying iterator return method and preserve the original callback throw even if return also throws.","result":"Iterator failures improved from 224 to 208; focused map/filter/every/find/forEach/reduce callback-throw closure cases pass and checks passed.","remaining":"Residual shared failures now lean toward return forwarding/exhaustion semantics, flatMap inner iterator closing/string flattening, concat ordering/return semantics, and compiler-only generator/helper paths."}}
{"run":1770,"commit":"35fdf5c","metric":197,"metrics":{"compiler_test262_cases":500,"compiler_test262_pass":303,"compiler_test262_failures":197,"compiler_test262_compiler_errors":0,"compiler_test262_compiler_crashes":18,"compiler_test262_compiler_fails":81,"compiler_test262_both_fail":84,"compiler_test262_interpreter_fail_compiler_pass":2,"compatibility_pass":303,"compatibility_cases":500,"compiler_errors":0,"compiler_crashes":18,"compiler_fails":81,"both_fail":84,"interpreter_fail_compiler_pass":2,"elapsed_ms":150827},"status":"keep","description":"Track Iterator helper completion state","timestamp":1778889538235,"segment":180,"confidence":10.763636363636364,"iterationTokens":6720,"asi":{"hypothesis":"Iterator helper return must forward closure to the underlying iterator exactly once and helpers must remember when their source iterator has been exhausted to avoid later return calls.","result":"Iterator failures improved from 208 to 197; focused drop/filter/take return forwarding and no-return-after-exhaustion cases pass and checks passed.","remaining":"Compiler generator call crashes increased slightly; remaining failures include concat return/order, flatMap inner return forwarding, Iterator.from edge cases, and many compiler-only helper behavior mismatches."}}
{"run":1771,"commit":"1360609","metric":194,"metrics":{"compiler_test262_cases":500,"compiler_test262_pass":306,"compiler_test262_failures":194,"compiler_test262_compiler_errors":0,"compiler_test262_compiler_crashes":19,"compiler_test262_compiler_fails":81,"compiler_test262_both_fail":80,"compiler_test262_interpreter_fail_compiler_pass":2,"compatibility_pass":306,"compatibility_cases":500,"compiler_errors":0,"compiler_crashes":19,"compiler_fails":81,"both_fail":80,"interpreter_fail_compiler_pass":2,"elapsed_ms":165332},"status":"keep","description":"Validate Iterator drop take receiver first","timestamp":1778889869962,"segment":180,"confidence":8.542857142857143,"iterationTokens":4866,"asi":{"hypothesis":"Iterator.prototype.drop/take must reject non-object receivers before coercing the limit, so hostile valueOf on the limit or primitive prototype next getters cannot mask the TypeError.","result":"Iterator failures improved from 197 to 194; focused drop/take non-object receiver cases pass and checks passed.","remaining":"The extra compiler crash appears tied to existing generator-heavy helper cases; primary still improved. Continue favoring shared runtime semantics over compiler-only generator work unless targeting the crash cluster directly."}}
{"run":1772,"commit":"c30bf69","metric":188,"metrics":{"compiler_test262_cases":500,"compiler_test262_pass":312,"compiler_test262_failures":188,"compiler_test262_compiler_errors":0,"compiler_test262_compiler_crashes":18,"compiler_test262_compiler_fails":81,"compiler_test262_both_fail":75,"compiler_test262_interpreter_fail_compiler_pass":2,"compatibility_pass":312,"compatibility_cases":500,"compiler_errors":0,"compiler_crashes":18,"compiler_fails":81,"both_fail":75,"interpreter_fail_compiler_pass":2,"elapsed_ms":152919},"status":"keep","description":"Defer Iterator concat opening","timestamp":1778890239264,"segment":180,"confidence":8.591549295774648,"iterationTokens":4303,"asi":{"hypothesis":"Iterator.concat validates iterable objects and captures their @@iterator methods at construction, but opens each inner iterator lazily when the concat helper advances.","result":"Iterator failures improved from 194 to 188; focused concat primitive/non-callable/non-object validation and inner iterator ordering cases pass and checks passed.","remaining":"Concat spread-based method-call counting still exposes broader array/spread consumption gaps for helper iterators; concat return forwarding should close the active inner iterator rather than only top-level state."}}
