{"run":878,"commit":"a9fe615","metric":73,"metrics":{"compiler_test262_cases":594,"compiler_test262_pass":521,"compiler_test262_failures":73,"compiler_test262_compiler_errors":0,"compiler_test262_compiler_crashes":0,"compiler_test262_compiler_fails":0,"compiler_test262_both_fail":72,"compiler_test262_interpreter_fail_compiler_pass":0,"compatibility_pass":521,"compatibility_cases":594,"compiler_errors":0,"compiler_crashes":0,"compiler_fails":0,"both_fail":72,"interpreter_fail_compiler_pass":0,"elapsed_ms":24379},"status":"keep","description":"Fix Date.UTC no-arg and year-offset semantics","timestamp":1778276902281,"segment":35,"confidence":5.586206896551724,"iterationTokens":5292,"asi":{"hypothesis":"Date.UTC with no args should return NaN, and year truncation should happen before the 0-99 offset check","improvement":"Reduced Date failures from 75 to 73 by fixing UTC no-arg NaN return and year-offset truncation order","next_action_hint":"Remaining 73: toTemporalInstant (8), toISOString (6), Symbol.toPrimitive (5), toJSON (4), setHours coercion (4), getTimezoneOffset (3), constructor/value edge cases."}}
{"run":879,"commit":"d0695b1","metric":66,"metrics":{"compiler_test262_cases":594,"compiler_test262_pass":528,"compiler_test262_failures":66,"compiler_test262_compiler_errors":0,"compiler_test262_compiler_crashes":0,"compiler_test262_compiler_fails":0,"compiler_test262_both_fail":65,"compiler_test262_interpreter_fail_compiler_pass":0,"compatibility_pass":528,"compatibility_cases":594,"compiler_errors":0,"compiler_crashes":0,"compiler_fails":0,"both_fail":65,"interpreter_fail_compiler_pass":0,"elapsed_ms":24581},"status":"keep","description":"Fix Date constructor ToPrimitive and getTimezoneOffset validation","timestamp":1778277307941,"segment":35,"confidence":7.3478260869565215,"iterationTokens":10136,"asi":{"hypothesis":"Date constructor should call ToPrimitive on object args, and getTimezoneOffset should validate this and return NaN for invalid dates","improvement":"Reduced Date failures from 73 to 66 (−7) by fixing Date constructor ToPrimitive for object args and getTimezoneOffset this/invalid-date validation","next_action_hint":"Remaining 66: toTemporalInstant (8 — Temporal API), toISOString (6), Symbol.toPrimitive (5), toJSON (4), constructor A3/A5 (12 — toString override), setHours (4 — timezone), parse (2)."}}
{"run":880,"commit":"d0695b1","metric":74,"metrics":{"compiler_test262_cases":594,"compiler_test262_pass":520,"compiler_test262_failures":74,"compiler_test262_compiler_errors":0,"compiler_test262_compiler_crashes":0,"compiler_test262_compiler_fails":0,"compiler_test262_both_fail":73,"compiler_test262_interpreter_fail_compiler_pass":0,"compatibility_pass":520,"compatibility_cases":594,"compiler_errors":0,"compiler_crashes":0,"compiler_fails":0,"both_fail":73,"interpreter_fail_compiler_pass":0,"elapsed_ms":24404},"status":"discard","description":"Apply timezone offset in local Date constructor","timestamp":1778277590045,"segment":35,"confidence":9.941176470588236,"iterationTokens":5921,"asi":{"hypothesis":"local_from_components should add timezone offset to convert local time to UTC timestamp","rollback_reason":"Regressed 66 to 74; the timezone offset is already implicitly handled by our UTC-based getters, so adding it to the constructor doubles the offset","next_action_hint":"The S15.9.3.1_A5 tests use assertRelativeDateMs which subtracts getTimezoneOffset; on UTC machines the offset is 0 so the tests pass/fail based on constructor correctness, not timezone. Do not add timezone offset to constructor without fixing getter timezone semantics."}}
{"run":881,"commit":"1d127b6","metric":63,"metrics":{"compiler_test262_cases":594,"compiler_test262_pass":531,"compiler_test262_failures":63,"compiler_test262_compiler_errors":0,"compiler_test262_compiler_crashes":0,"compiler_test262_compiler_fails":0,"compiler_test262_both_fail":62,"compiler_test262_interpreter_fail_compiler_pass":0,"compatibility_pass":531,"compatibility_cases":594,"compiler_errors":0,"compiler_crashes":0,"compiler_fails":0,"both_fail":62,"interpreter_fail_compiler_pass":0,"elapsed_ms":24364},"status":"keep","description":"Fix OrdinaryToPrimitive TypeError for no-callables","timestamp":1778277883568,"segment":35,"confidence":9.555555555555555,"iterationTokens":6182,"asi":{"hypothesis":"OrdinaryToPrimitive should throw TypeError when neither toString nor valueOf are callable, not silently return the object","improvement":"Reduced Date failures from 66 to 63 by fixing OrdinaryToPrimitive to throw TypeError for non-callable hint methods","next_action_hint":"Remaining 63: toTemporalInstant (8), toISOString extreme dates (6), Symbol.toPrimitive compiler (5), toJSON (4), setHours timezone (4), constructor/toString override (12), parse (2)."}}
{"run":882,"commit":"08ef473","metric":60,"metrics":{"compiler_test262_cases":594,"compiler_test262_pass":534,"compiler_test262_failures":60,"compiler_test262_compiler_errors":0,"compiler_test262_compiler_crashes":0,"compiler_test262_compiler_fails":0,"compiler_test262_both_fail":59,"compiler_test262_interpreter_fail_compiler_pass":0,"compatibility_pass":534,"compatibility_cases":594,"compiler_errors":0,"compiler_crashes":0,"compiler_fails":0,"both_fail":59,"interpreter_fail_compiler_pass":0,"elapsed_ms":24618},"status":"keep","description":"Fix Date constructor for booleans and Date-to-Date copy","timestamp":1778278230056,"segment":35,"confidence":8.974358974358974,"iterationTokens":8314,"asi":{"hypothesis":"Date constructor should handle boolean/null/undefined single args and copy DateValue directly from existing Date objects","improvement":"Reduced Date failures from 63 to 60 by fixing constructor for true/false/null/undefined args and Date-to-Date copy without ToPrimitive","next_action_hint":"Remaining 60: toTemporalInstant (8), toISOString extreme dates (6), constructor toString override (12), Symbol.toPrimitive (2), setHours/setter timezone (4), parse (2), negative year formatting (3), misc."}}
{"run":883,"commit":"13b7bef","metric":58,"metrics":{"compiler_test262_cases":594,"compiler_test262_pass":536,"compiler_test262_failures":58,"compiler_test262_compiler_errors":0,"compiler_test262_compiler_crashes":0,"compiler_test262_compiler_fails":0,"compiler_test262_both_fail":55,"compiler_test262_interpreter_fail_compiler_pass":0,"compatibility_pass":536,"compatibility_cases":594,"compiler_errors":0,"compiler_crashes":0,"compiler_fails":0,"both_fail":55,"interpreter_fail_compiler_pass":0,"elapsed_ms":24471},"status":"keep","description":"Fix Date constructor coercion and component ToNumber","timestamp":1778278518333,"segment":35,"confidence":8.428571428571429,"iterationTokens":5225,"asi":{"hypothesis":"Date constructor component args need ToNumber coercion via to_num, ToPrimitive result should handle null→0 and symbol→TypeError","improvement":"Reduced Date failures from 60 to 58 by fixing constructor component ToNumber coercion, ToPrimitive null→0, and symbol TypeError","next_action_hint":"Remaining 58: toTemporalInstant (8), toISOString (6), constructor A3 toString override (6), A5 timezone (6), Symbol.toPrimitive (2), toJSON (4), negative year (3), parse/UTC (3)."}}
{"type":"config","name":"QuickBEAM built-ins/Number compatibility","metricName":"compatibility_failures","metricUnit":"","bestDirection":"lower"}
{"run":884,"commit":"1d74996","metric":184,"metrics":{"compiler_test262_cases":340,"compiler_test262_pass":156,"compiler_test262_failures":184,"compiler_test262_compiler_errors":0,"compiler_test262_compiler_crashes":0,"compiler_test262_compiler_fails":0,"compiler_test262_both_fail":179,"compiler_test262_interpreter_fail_compiler_pass":0,"compatibility_pass":156,"compatibility_cases":340,"compiler_errors":0,"compiler_crashes":0,"compiler_fails":0,"both_fail":179,"interpreter_fail_compiler_pass":0,"elapsed_ms":21336},"status":"keep","description":"Baseline built-ins/Number with isSafeInteger","timestamp":1778279299631,"segment":36,"confidence":null,"iterationTokens":213,"asi":{"hypothesis":"Baseline built-ins/Number with Number.isSafeInteger and metadata","improvement":"Initial Number baseline: 184/340 failures (earlier scan was 201)"}}
{"run":885,"commit":"3ce8780","metric":177,"metrics":{"compiler_test262_cases":340,"compiler_test262_pass":163,"compiler_test262_failures":177,"compiler_test262_compiler_errors":0,"compiler_test262_compiler_crashes":0,"compiler_test262_compiler_fails":0,"compiler_test262_both_fail":172,"compiler_test262_interpreter_fail_compiler_pass":0,"compatibility_pass":163,"compatibility_cases":340,"compiler_errors":0,"compiler_crashes":0,"compiler_fails":0,"both_fail":172,"interpreter_fail_compiler_pass":0,"elapsed_ms":21440},"status":"keep","description":"Route all builtin prototype lookups through Function.prototype","timestamp":1778279712023,"segment":36,"confidence":null,"iterationTokens":11237,"asi":{"hypothesis":"All builtin constructors (Array, Object, Number, String, Map, Set) need to fall through to Function.prototype for inherited methods like hasOwnProperty and call/apply/bind","improvement":"Reduced Number failures from 184 to 177 (−7) by routing all builtin constructor prototype lookups through Function.prototype fallback instead of stopping at their static properties","next_action_hint":"Remaining: prototype/toFixed and toString descriptor tests, S15.7 constructor tests, S9 type coercion edge cases."}}
{"run":886,"commit":"517b2b7","metric":161,"metrics":{"compiler_test262_cases":340,"compiler_test262_pass":179,"compiler_test262_failures":161,"compiler_test262_compiler_errors":0,"compiler_test262_compiler_crashes":0,"compiler_test262_compiler_fails":0,"compiler_test262_both_fail":154,"compiler_test262_interpreter_fail_compiler_pass":2,"compatibility_pass":179,"compatibility_cases":340,"compiler_errors":0,"compiler_crashes":0,"compiler_fails":0,"both_fail":154,"interpreter_fail_compiler_pass":2,"elapsed_ms":20382},"status":"keep","description":"Materialize Number prototype methods","timestamp":1778280020851,"segment":36,"confidence":3.2857142857142856,"iterationTokens":6471,"asi":{"hypothesis":"Number prototype methods need to be materialized onto the actual prototype object for hasOwnProperty and descriptor tests, plus constructor property needs to be set","improvement":"Reduced Number failures from 177 to 161 (−16) by materializing Number prototype methods, adding toLocaleString, and setting constructor property on Number.prototype","next_action_hint":"Remaining: S15.7.5 instanceof tests, S9.3 type coercion, Number prototype value/toString, constant descriptor tests, toExponential edge cases."}}
{"run":887,"commit":"517b2b7","metric":161,"metrics":{"compiler_test262_cases":340,"compiler_test262_pass":179,"compiler_test262_failures":161,"compiler_test262_compiler_errors":0,"compiler_test262_compiler_crashes":0,"compiler_test262_compiler_fails":0,"compiler_test262_both_fail":154,"compiler_test262_interpreter_fail_compiler_pass":2,"compatibility_pass":179,"compatibility_cases":340,"compiler_errors":0,"compiler_crashes":0,"compiler_fails":0,"both_fail":154,"interpreter_fail_compiler_pass":2,"elapsed_ms":21534},"status":"discard","description":"Confirm 161-failure baseline stability","timestamp":1778280364138,"segment":36,"confidence":2.875,"iterationTokens":8975,"asi":{"hypothesis":"Confirm stability","rollback_reason":"Confirmation only, no changes","next_action_hint":"The Number workload has many prototype/toExponential semantic fixes needed. Many remaining failures are ToNumber coercion edge cases and prototype value tests. Consider continuing Number or moving to another category."}}
{"type":"config","name":"QuickBEAM built-ins/String compatibility","metricName":"compatibility_failures","metricUnit":"","bestDirection":"lower"}
{"run":888,"commit":"f24c381","metric":169,"metrics":{"compiler_test262_cases":400,"compiler_test262_pass":231,"compiler_test262_failures":169,"compiler_test262_compiler_errors":0,"compiler_test262_compiler_crashes":0,"compiler_test262_compiler_fails":0,"compiler_test262_both_fail":160,"compiler_test262_interpreter_fail_compiler_pass":6,"compatibility_pass":231,"compatibility_cases":400,"compiler_errors":0,"compiler_crashes":0,"compiler_fails":0,"both_fail":160,"interpreter_fail_compiler_pass":6,"elapsed_ms":23703},"status":"keep","description":"Baseline built-ins/String with broad metadata registration","timestamp":1778320901369,"segment":37,"confidence":null,"iterationTokens":213,"asi":{"hypothesis":"Register metadata for String, Array, RegExp, Object prototype methods — broad constructable:false and length registration","improvement":"Initial String baseline with broad metadata: 169/400 failures (earlier scan was 200; metadata registration improved to 169)"}}
{"run":889,"commit":"63e5048","metric":157,"metrics":{"compiler_test262_cases":400,"compiler_test262_pass":243,"compiler_test262_failures":157,"compiler_test262_compiler_errors":0,"compiler_test262_compiler_crashes":0,"compiler_test262_compiler_fails":0,"compiler_test262_both_fail":148,"compiler_test262_interpreter_fail_compiler_pass":6,"compatibility_pass":243,"compatibility_cases":400,"compiler_errors":0,"compiler_crashes":0,"compiler_fails":0,"both_fail":148,"interpreter_fail_compiler_pass":6,"elapsed_ms":22829},"status":"keep","description":"Validate String prototype this-value coercion","timestamp":1778321284185,"segment":37,"confidence":null,"iterationTokens":5696,"asi":{"hypothesis":"String prototype methods should throw TypeError for null/undefined this and coerce non-string this via ToString","improvement":"Reduced String failures from 169 to 157 (−12) by validating null/undefined this in charAt/charCodeAt/codePointAt and coercing non-string this values","next_action_hint":"Apply same this-coercion pattern to remaining String methods (indexOf, includes, slice, etc.); also fix position argument ToNumber coercion."}}
{"run":890,"commit":"64af54c","metric":110,"metrics":{"compiler_test262_cases":350,"compiler_test262_pass":240,"compiler_test262_failures":110,"compiler_test262_compiler_errors":0,"compiler_test262_compiler_crashes":0,"compiler_test262_compiler_fails":0,"compiler_test262_both_fail":106,"compiler_test262_interpreter_fail_compiler_pass":1,"compatibility_pass":240,"compatibility_cases":350,"compiler_errors":0,"compiler_crashes":0,"compiler_fails":0,"both_fail":106,"interpreter_fail_compiler_pass":1,"elapsed_ms":21135},"status":"keep","description":"Broaden String prototype this-coercion to all methods","timestamp":1778322658082,"segment":37,"confidence":4.916666666666667,"iterationTokens":1375,"asi":{"hypothesis":"All String prototype methods should coerce this via ToString and throw for null/undefined, plus at() should coerce position via ToNumber","improvement":"Using 350-case slice (400-case crashes at ~390), reduced from 169 baseline. Applied coerce_string_this to all String prototype methods and fixed at() position coercion.","next_action_hint":"Investigate the SIGABRT crash at 400 cases. Continue String improvements with fromCharCode/fromCodePoint arg coercion."}}
{"run":891,"commit":"236f79f","metric":90,"metrics":{"compiler_test262_cases":350,"compiler_test262_pass":260,"compiler_test262_failures":90,"compiler_test262_compiler_errors":0,"compiler_test262_compiler_crashes":0,"compiler_test262_compiler_fails":0,"compiler_test262_both_fail":86,"compiler_test262_interpreter_fail_compiler_pass":1,"compatibility_pass":260,"compatibility_cases":350,"compiler_errors":0,"compiler_crashes":0,"compiler_fails":0,"both_fail":86,"interpreter_fail_compiler_pass":1,"elapsed_ms":21446},"status":"keep","description":"Fix Runtime.to_int coercion and fromCodePoint validation","timestamp":1778326416483,"segment":37,"confidence":2.6779661016949152,"iterationTokens":7600,"asi":{"hypothesis":"Runtime.to_int needs proper ToNumber coercion for objects (calls valueOf), and fromCodePoint needs RangeError for non-integers, out-of-range, and TypeError for symbols","improvement":"Reduced String failures from 110 to 90 (−20) by fixing to_int object coercion and fromCodePoint validation","next_action_hint":"Remaining: charAt/charCodeAt with wrapped objects, codePointAt, Symbol.iterator, endsWith, prototype descriptor tests."}}
{"run":892,"commit":"d0ccc44","metric":74,"metrics":{"compiler_test262_cases":350,"compiler_test262_pass":276,"compiler_test262_failures":74,"compiler_test262_compiler_errors":0,"compiler_test262_compiler_crashes":0,"compiler_test262_compiler_fails":0,"compiler_test262_both_fail":70,"compiler_test262_interpreter_fail_compiler_pass":1,"compatibility_pass":276,"compatibility_cases":350,"compiler_errors":0,"compiler_crashes":0,"compiler_fails":0,"both_fail":70,"interpreter_fail_compiler_pass":1,"elapsed_ms":21141},"status":"keep","description":"Reject regexp search and symbol this in String methods","timestamp":1778326798972,"segment":37,"confidence":2.638888888888889,"iterationTokens":6162,"asi":{"hypothesis":"String.prototype.includes/startsWith/endsWith should throw TypeError for regexp search strings, and all String methods should throw TypeError for Symbol this values","improvement":"Reduced String failures from 90 to 74 (−16) by rejecting regexp search strings in includes/startsWith/endsWith, adding symbol TypeError, and fixing includes/endsWith position handling","next_action_hint":"Remaining: charAt/charCodeAt wrapped object ToString, codePointAt, Symbol.iterator, prototype descriptor tests, indexOf position coercion."}}
{"run":893,"commit":"2870bb7","metric":57,"metrics":{"compiler_test262_cases":350,"compiler_test262_pass":293,"compiler_test262_failures":57,"compiler_test262_compiler_errors":0,"compiler_test262_compiler_crashes":0,"compiler_test262_compiler_fails":0,"compiler_test262_both_fail":53,"compiler_test262_interpreter_fail_compiler_pass":1,"compatibility_pass":293,"compatibility_cases":350,"compiler_errors":0,"compiler_crashes":0,"compiler_fails":0,"both_fail":53,"interpreter_fail_compiler_pass":1,"elapsed_ms":21547},"status":"keep","description":"Fix indexOf/lastIndexOf arg coercion and position handling","timestamp":1778332094527,"segment":37,"confidence":3.246376811594203,"iterationTokens":9320,"asi":{"hypothesis":"indexOf/lastIndexOf need ToString coercion for search string and proper ToNumber/ToInteger for position with Infinity/NaN handling","improvement":"Reduced String failures from 74 to 57 (−17) by fixing indexOf/lastIndexOf search string coercion, position ToNumber with Infinity/NaN/string handling","next_action_hint":"Remaining: Symbol.iterator (5), prototype (4), codePointAt (3), charAt (3), includes (3), endsWith (2), charCodeAt (2), misc."}}
{"run":894,"commit":"75a7b9c","metric":51,"metrics":{"compiler_test262_cases":350,"compiler_test262_pass":299,"compiler_test262_failures":51,"compiler_test262_compiler_errors":0,"compiler_test262_compiler_crashes":0,"compiler_test262_compiler_fails":0,"compiler_test262_both_fail":47,"compiler_test262_interpreter_fail_compiler_pass":1,"compatibility_pass":299,"compatibility_cases":350,"compiler_errors":0,"compiler_crashes":0,"compiler_fails":0,"both_fail":47,"interpreter_fail_compiler_pass":1,"elapsed_ms":22790},"status":"keep","description":"Implement String.prototype.isWellFormed and toWellFormed","timestamp":1778333683627,"segment":37,"confidence":3.5757575757575757,"iterationTokens":7213,"asi":{"hypothesis":"String.prototype.isWellFormed and toWellFormed are newer ECMAScript methods that check/replace lone surrogates","improvement":"Reduced String failures from 57 to 51 (−6) by implementing isWellFormed/toWellFormed with metadata and materialization","next_action_hint":"Remaining 51: indexOf coercion edge cases (7), Symbol.iterator (5), prototype (4), codePointAt (3), charAt (3), includes (3), endsWith (2), charCodeAt (2), misc."}}
{"run":895,"commit":"7fa571f","metric":49,"metrics":{"compiler_test262_cases":350,"compiler_test262_pass":301,"compiler_test262_failures":49,"compiler_test262_compiler_errors":0,"compiler_test262_compiler_crashes":0,"compiler_test262_compiler_fails":0,"compiler_test262_both_fail":45,"compiler_test262_interpreter_fail_compiler_pass":1,"compatibility_pass":301,"compatibility_cases":350,"compiler_errors":0,"compiler_crashes":0,"compiler_fails":0,"both_fail":45,"interpreter_fail_compiler_pass":1,"elapsed_ms":21733},"status":"keep","description":"Fix String.prototype descriptor and constructor property","timestamp":1778334000116,"segment":37,"confidence":4.067796610169491,"iterationTokens":4061,"asi":{"hypothesis":"String constructor prototype descriptor should be non-writable/non-configurable, and String.prototype should have constructor property","improvement":"Reduced String failures from 51 to 49 by fixing String.prototype descriptor and constructor property","next_action_hint":"Remaining 49: indexOf coercion (7), Symbol.iterator (5), isWellFormed surrogate (3), codePointAt (3), charAt (3), includes (3), endsWith (2), charCodeAt (2), misc."}}
