{"run":721,"commit":"8b93c53","metric":11,"metrics":{"compiler_test262_cases":500,"compiler_test262_pass":489,"compiler_test262_failures":11,"compiler_test262_compiler_errors":0,"compiler_test262_compiler_crashes":0,"compiler_test262_compiler_fails":0,"compiler_test262_both_fail":10,"compiler_test262_interpreter_fail_compiler_pass":0,"compatibility_pass":489,"compatibility_cases":500,"compiler_errors":0,"compiler_crashes":0,"compiler_fails":0,"both_fail":10,"interpreter_fail_compiler_pass":0,"elapsed_ms":44238},"status":"discard","description":"Reject nonconstructable Reflect newTarget","timestamp":1778077739495,"segment":24,"confidence":10.909090909090908,"iterationTokens":4652,"asi":{"hypothesis":"After Object.assign strict-write fixes, Reflect.construct should reject builtin newTargets marked constructable:false and reduce remaining Object.assign/Object.create not-a-constructor failures.","rollback_reason":"Primary metric stayed at 11; constructability-only validation still does not improve the bounded workload.","next_action_hint":"Avoid constructability-only retries. Remaining metadata/constructability cases likely need function object descriptor model changes together."}}
{"run":722,"commit":"8b93c53","metric":11,"metrics":{"compiler_test262_cases":500,"compiler_test262_pass":489,"compiler_test262_failures":11,"compiler_test262_compiler_errors":0,"compiler_test262_compiler_crashes":0,"compiler_test262_compiler_fails":0,"compiler_test262_both_fail":11,"compiler_test262_interpreter_fail_compiler_pass":0,"compatibility_pass":489,"compatibility_cases":500,"compiler_errors":0,"compiler_crashes":0,"compiler_fails":0,"both_fail":11,"interpreter_fail_compiler_pass":0,"elapsed_ms":23729},"status":"discard","description":"Bound array index property keys","timestamp":1778080580591,"segment":24,"confidence":10.909090909090908,"iterationTokens":7475,"asi":{"hypothesis":"Array index detection should reject non-canonical or out-of-range keys such as -0, 1.5, and 4294967295 to avoid huge array growth during Object.assign target-array.","rollback_reason":"Primary metric stayed at 11; it removed the timeout but target-Array still fails due non-index array properties not being read after assignment.","next_action_hint":"Keep the bounded-index idea in mind, but combine with array auxiliary property reads for non-index keys before retrying."}}
{"run":723,"commit":"5ac7917","metric":9,"metrics":{"compiler_test262_cases":500,"compiler_test262_pass":491,"compiler_test262_failures":9,"compiler_test262_compiler_errors":0,"compiler_test262_compiler_crashes":0,"compiler_test262_compiler_fails":0,"compiler_test262_both_fail":8,"compiler_test262_interpreter_fail_compiler_pass":0,"compatibility_pass":491,"compatibility_cases":500,"compiler_errors":0,"compiler_crashes":0,"compiler_fails":0,"both_fail":8,"interpreter_fail_compiler_pass":0,"elapsed_ms":43365},"status":"keep","description":"Delete configurable builtin metadata","timestamp":1778080822961,"segment":24,"confidence":11,"iterationTokens":5446,"asi":{"hypothesis":"Builtin name/length property descriptors marked configurable:true must be deletable, and hasOwnProperty must honor ctor-static deletion tombstones.","improvement":"Fixed Object.assign name/length configurability propertyHelper checks, reducing bounded built-ins/Object failures from 11 to 9 with checks passing.","next_action_hint":"Remaining failures are Object.assign descriptor ownership/constructability/target-array and Arguments toStringTag create/defineProperties."}}
{"run":724,"commit":"478d380","metric":8,"metrics":{"compiler_test262_cases":500,"compiler_test262_pass":492,"compiler_test262_failures":8,"compiler_test262_compiler_errors":0,"compiler_test262_compiler_crashes":0,"compiler_test262_compiler_fails":0,"compiler_test262_both_fail":7,"compiler_test262_interpreter_fail_compiler_pass":0,"compatibility_pass":492,"compatibility_cases":500,"compiler_errors":0,"compiler_crashes":0,"compiler_fails":0,"both_fail":7,"interpreter_fail_compiler_pass":0,"elapsed_ms":39676},"status":"keep","description":"Delete static builtin metadata in compiler","timestamp":1778081071156,"segment":24,"confidence":10.8,"iterationTokens":4709,"asi":{"hypothesis":"Compiler/static delete path must treat configurable builtin name/length metadata like ordinary configurable properties and install deletion tombstones instead of refusing numeric metadata deletes.","improvement":"Fixed remaining Object.assign.length configurability path in compiled/static helpers, reducing bounded built-ins/Object failures from 9 to 8 with checks passing.","next_action_hint":"Remaining failures are Object.assign descriptor ownership/constructability/target-array and Arguments toStringTag create/defineProperties."}}
{"run":725,"commit":"1cd54f2","metric":7,"metrics":{"compiler_test262_cases":500,"compiler_test262_pass":493,"compiler_test262_failures":7,"compiler_test262_compiler_errors":0,"compiler_test262_compiler_crashes":0,"compiler_test262_compiler_fails":0,"compiler_test262_both_fail":6,"compiler_test262_interpreter_fail_compiler_pass":0,"compatibility_pass":493,"compatibility_cases":500,"compiler_errors":0,"compiler_crashes":0,"compiler_fails":0,"both_fail":6,"interpreter_fail_compiler_pass":0,"elapsed_ms":39809},"status":"keep","description":"Reject Object.assign writes to string indices","timestamp":1778081307190,"segment":24,"confidence":11.090909090909092,"iterationTokens":2330,"asi":{"hypothesis":"String wrapper indexed properties are read-only, so Object.assign('a', [1]) must throw when assigning to index 0 with Throw=true.","improvement":"Fixed Object.assign readonly string target semantics, reducing bounded built-ins/Object failures from 8 to 7 with checks passing.","next_action_hint":"Remaining failures are Object.assign descriptor ownership/constructability/target-array and Arguments toStringTag create/defineProperties."}}
{"run":726,"commit":"1cd54f2","metric":7,"metrics":{"compiler_test262_cases":500,"compiler_test262_pass":493,"compiler_test262_failures":7,"compiler_test262_compiler_errors":0,"compiler_test262_compiler_crashes":0,"compiler_test262_compiler_fails":0,"compiler_test262_both_fail":6,"compiler_test262_interpreter_fail_compiler_pass":0,"compatibility_pass":493,"compatibility_cases":500,"compiler_errors":0,"compiler_crashes":0,"compiler_fails":0,"both_fail":6,"interpreter_fail_compiler_pass":0,"elapsed_ms":39518},"status":"discard","description":"Validate builtin newTarget constructability","timestamp":1778081553296,"segment":24,"confidence":11.090909090909092,"iterationTokens":2273,"asi":{"hypothesis":"Validating builtin constructable:false metadata for newTarget should make Test262 isConstructor(Object.assign/Object.create) false after other Object.assign fixes.","rollback_reason":"Focused isConstructor probes pass but primary metric stays at 7; direct new Object.assign/Object.create still bypasses this path, so paired invoked-as-ctor failures remain.","next_action_hint":"Find the direct new builtin construction path rather than retrying Invocation.construct_runtime validation."}}
{"run":727,"commit":"73a4266","metric":4,"metrics":{"compiler_test262_cases":500,"compiler_test262_pass":496,"compiler_test262_failures":4,"compiler_test262_compiler_errors":0,"compiler_test262_compiler_crashes":0,"compiler_test262_compiler_fails":0,"compiler_test262_both_fail":3,"compiler_test262_interpreter_fail_compiler_pass":0,"compatibility_pass":496,"compatibility_cases":500,"compiler_errors":0,"compiler_crashes":0,"compiler_fails":0,"both_fail":3,"interpreter_fail_compiler_pass":0,"elapsed_ms":48058},"status":"keep","description":"Reject nonconstructable builtin construction","timestamp":1778085229586,"segment":24,"confidence":11.227272727272727,"iterationTokens":2273,"asi":{"hypothesis":"Direct new builtin opcodes and Reflect.construct newTarget checks both need to consult Builtin metadata constructable?: false for Object.assign/Object.create.","improvement":"Combining direct interpreter construction validation with Invocation.construct_runtime validation fixed invoked-as-ctor and isConstructor failures, reducing bounded built-ins/Object failures from 7 to 4 with checks passing.","next_action_hint":"Remaining failures should be Object.assign descriptor ownership, target-Array timeout/non-index properties, and Arguments toStringTag create/defineProperties."}}
{"run":728,"commit":"73a4266","metric":5,"metrics":{"compiler_test262_cases":500,"compiler_test262_pass":495,"compiler_test262_failures":5,"compiler_test262_compiler_errors":0,"compiler_test262_compiler_crashes":0,"compiler_test262_compiler_fails":0,"compiler_test262_both_fail":4,"compiler_test262_interpreter_fail_compiler_pass":0,"compatibility_pass":495,"compatibility_cases":500,"compiler_errors":0,"compiler_crashes":0,"compiler_fails":0,"both_fail":4,"interpreter_fail_compiler_pass":0,"elapsed_ms":46188},"status":"discard","description":"Expose Object static builtin descriptors","timestamp":1778085481153,"segment":24,"confidence":11.488372093023257,"iterationTokens":5544,"asi":{"hypothesis":"Object static builtins declared via Builtin.static_meta should appear as own data properties of Object with descriptor attributes from metadata.","rollback_reason":"Regressed bounded built-ins/Object from 4 to 5 despite targeting assign-descriptor; broad Object static own exposure still perturbs other descriptor/enumeration cases.","next_action_hint":"Do not retry raw Object static own-descriptor exposure. If fixing assign-descriptor, inspect new failure list and implement narrower coherent builtin property store semantics."}}
{"run":729,"commit":"73a4266","metric":4,"metrics":{"compiler_test262_cases":500,"compiler_test262_pass":496,"compiler_test262_failures":4,"compiler_test262_compiler_errors":0,"compiler_test262_compiler_crashes":0,"compiler_test262_compiler_fails":0,"compiler_test262_both_fail":3,"compiler_test262_interpreter_fail_compiler_pass":0,"compatibility_pass":496,"compatibility_cases":500,"compiler_errors":0,"compiler_crashes":0,"compiler_fails":0,"both_fail":3,"interpreter_fail_compiler_pass":0,"elapsed_ms":41072},"status":"discard","description":"Wrap arguments as tagged objects","timestamp":1778085679725,"segment":24,"confidence":11.761904761904763,"iterationTokens":5453,"asi":{"hypothesis":"Replacing arguments list wrappers with tagged ordinary objects should make Object.prototype.toString.call(arguments) report [object Arguments] during descriptor getter calls.","rollback_reason":"Primary metric stayed at 4; either the targeted failures do not use the replaced arguments creation paths or added object representation is insufficient to affect the descriptor getter receiver path.","next_action_hint":"Use focused probes to inspect `this` inside Properties getter for Object.create/defineProperties before retrying arguments modeling."}}
{"run":730,"commit":"73a4266","metric":4,"metrics":{"compiler_test262_cases":500,"compiler_test262_pass":496,"compiler_test262_failures":4,"compiler_test262_compiler_errors":0,"compiler_test262_compiler_crashes":0,"compiler_test262_compiler_fails":0,"compiler_test262_both_fail":4,"compiler_test262_interpreter_fail_compiler_pass":0,"compatibility_pass":496,"compatibility_cases":500,"compiler_errors":0,"compiler_crashes":0,"compiler_fails":0,"both_fail":4,"interpreter_fail_compiler_pass":0,"elapsed_ms":22068},"status":"discard","description":"Use canonical array-index keys","timestamp":1778085845683,"segment":24,"confidence":12.048780487804878,"iterationTokens":4519,"asi":{"hypothesis":"Canonical ECMAScript array-index detection should prevent target-Array timeout by treating -0, fractional strings, and 2^32-1 as ordinary properties.","rollback_reason":"Primary metric stayed at 4; target-Array moved out of timeout class but the suite still has four failures, so canonical index detection alone is not enough.","next_action_hint":"Inspect target-Array exact assertion after canonical index patch; likely requires preserving ordinary array auxiliary properties through Object.assign/readback."}}
{"run":731,"commit":"73a4266","metric":4,"metrics":{"compiler_test262_cases":500,"compiler_test262_pass":496,"compiler_test262_failures":4,"compiler_test262_compiler_errors":0,"compiler_test262_compiler_crashes":0,"compiler_test262_compiler_fails":0,"compiler_test262_both_fail":4,"compiler_test262_interpreter_fail_compiler_pass":0,"compatibility_pass":496,"compatibility_cases":500,"compiler_errors":0,"compiler_crashes":0,"compiler_fails":0,"both_fail":4,"interpreter_fail_compiler_pass":0,"elapsed_ms":21084},"status":"discard","description":"Preserve non-index array properties","timestamp":1778086147677,"segment":24,"confidence":12.35,"iterationTokens":15264,"asi":{"hypothesis":"Canonical array indices plus array auxiliary property get/put for bracket element ops should make Object.assign target-Array pass beyond the timeout/non-index property failure.","rollback_reason":"Primary metric stayed at 4; focused target-Array advanced to the proxy ownKeys ordering case but still fails, and the change also converts the timeout into a shared failure without improving total failures.","next_action_hint":"If revisiting target-Array, preserve Proxy ownKeys order through Object.assign instead of Map.to_list sorting/reordering proxy enumerable props."}}
{"run":732,"commit":"73a4266","metric":5,"metrics":{"compiler_test262_cases":500,"compiler_test262_pass":495,"compiler_test262_failures":5,"compiler_test262_compiler_errors":0,"compiler_test262_compiler_crashes":0,"compiler_test262_compiler_fails":0,"compiler_test262_both_fail":5,"compiler_test262_interpreter_fail_compiler_pass":0,"compatibility_pass":495,"compatibility_cases":500,"compiler_errors":0,"compiler_crashes":0,"compiler_fails":0,"both_fail":5,"interpreter_fail_compiler_pass":0,"elapsed_ms":20731},"status":"checks_failed","description":"Preserve proxy assign order with array props","timestamp":1778086209671,"segment":24,"confidence":12.35,"iterationTokens":3148,"asi":{"hypothesis":"Combining canonical array indices, auxiliary array properties, and ordered proxy ownKeys entries should complete Object.assign target-Array.","rollback_reason":"Regressed primary metric to 5 and failed checks due unused Copy alias; focused probe still failed the proxy ordering case, so the ordered proxy path did not actually take effect.","next_action_hint":"Before retrying target-Array, inspect Proxy ownKeys trap execution/Heap.to_list result directly; do not keep broad proxy/array changes without focused pass."}}
{"run":733,"commit":"73a4266","metric":6,"metrics":{"compiler_test262_cases":500,"compiler_test262_pass":494,"compiler_test262_failures":6,"compiler_test262_compiler_errors":0,"compiler_test262_compiler_crashes":0,"compiler_test262_compiler_fails":0,"compiler_test262_both_fail":5,"compiler_test262_interpreter_fail_compiler_pass":0,"compatibility_pass":494,"compatibility_cases":500,"compiler_errors":0,"compiler_crashes":0,"compiler_fails":0,"both_fail":5,"interpreter_fail_compiler_pass":0,"elapsed_ms":38083},"status":"discard","description":"Create tagged arguments objects","timestamp":1778086604069,"segment":24,"confidence":12.35,"iterationTokens":15356,"asi":{"hypothesis":"Replacing special arguments object creation paths with tagged object wrappers should make Object.prototype.toString.call(arguments) and descriptor getter receivers report [object Arguments].","rollback_reason":"Regressed bounded built-ins/Object from 4 to 6. Focused probes showed direct toString passed, but Object.defineProperty on the returned arguments object started throwing non-object, so representation is inconsistent with defineProperty/property storage.","next_action_hint":"Do not retry broad tagged arguments wrappers. Investigate why function return/special object arguments are not accepted by defineProperty before changing representation."}}
{"run":734,"commit":"73a4266","metric":4,"metrics":{"compiler_test262_cases":500,"compiler_test262_pass":496,"compiler_test262_failures":4,"compiler_test262_compiler_errors":0,"compiler_test262_compiler_crashes":0,"compiler_test262_compiler_fails":0,"compiler_test262_both_fail":3,"compiler_test262_interpreter_fail_compiler_pass":0,"compatibility_pass":496,"compatibility_cases":500,"compiler_errors":0,"compiler_crashes":0,"compiler_fails":0,"both_fail":3,"interpreter_fail_compiler_pass":0,"elapsed_ms":38844},"status":"discard","description":"Expose Object.assign own descriptor narrowly","timestamp":1778086763788,"segment":24,"confidence":12.666666666666666,"iterationTokens":1517,"asi":{"hypothesis":"A narrow Object.assign own-property/descriptor path should satisfy assign-descriptor without broad Object static exposure regressions.","rollback_reason":"Primary metric stayed at 4, so assign-descriptor still fails or another case regressed in its place; narrow own descriptor alone is incomplete.","next_action_hint":"Probe verifyProperty(Object,'assign') under the narrow patch before retrying; likely propertyHelper writability/configurability delete/write behavior needs coherent static property storage."}}
{"run":735,"commit":"73a4266","metric":4,"metrics":{"compiler_test262_cases":500,"compiler_test262_pass":496,"compiler_test262_failures":4,"compiler_test262_compiler_errors":0,"compiler_test262_compiler_crashes":0,"compiler_test262_compiler_fails":0,"compiler_test262_both_fail":3,"compiler_test262_interpreter_fail_compiler_pass":0,"compatibility_pass":496,"compatibility_cases":500,"compiler_errors":0,"compiler_crashes":0,"compiler_fails":0,"both_fail":3,"interpreter_fail_compiler_pass":0,"elapsed_ms":37337},"status":"discard","description":"Expose Object.assign descriptor attributes","timestamp":1778087023359,"segment":24,"confidence":13,"iterationTokens":4390,"asi":{"hypothesis":"Adding Object.assign own descriptor value plus non-enumerable configurable writable attributes may satisfy assign-descriptor without broad Object static exposure.","rollback_reason":"Primary metric stayed at 4. Focused probe showed interpreter reaches descriptor checks but writability fails, while compiled hasOwnProperty still reports false; descriptor-only exposure is still incoherent.","next_action_hint":"Do not retry descriptor-only patches. Need coherent Object builtin static write/read/hasOwn across interpreter and compiler call-binding paths."}}
{"run":736,"commit":"7934069","metric":3,"metrics":{"compiler_test262_cases":500,"compiler_test262_pass":497,"compiler_test262_failures":3,"compiler_test262_compiler_errors":0,"compiler_test262_compiler_crashes":0,"compiler_test262_compiler_fails":0,"compiler_test262_both_fail":3,"compiler_test262_interpreter_fail_compiler_pass":0,"compatibility_pass":497,"compatibility_cases":500,"compiler_errors":0,"compiler_crashes":0,"compiler_fails":0,"both_fail":3,"interpreter_fail_compiler_pass":0,"elapsed_ms":20802},"status":"keep","description":"Preserve Object.assign proxy source order","timestamp":1778087264304,"segment":24,"confidence":12.717948717948717,"iterationTokens":8788,"asi":{"hypothesis":"Object.assign must preserve proxy ownKeys order and canonical array-index semantics, including auxiliary non-index array properties, so length can shrink before later indexed writes.","improvement":"Fixed target-Array by avoiding proxy source Map.to_list reordering and supporting canonical array indices plus non-index array auxiliary get/put; bounded built-ins/Object dropped from 4 to 3 with checks passing.","next_action_hint":"Remaining failures should be Object.assign descriptor ownership and the two Arguments toStringTag create/defineProperties cases."}}
{"run":737,"commit":"f654bc6","metric":1,"metrics":{"compiler_test262_cases":500,"compiler_test262_pass":499,"compiler_test262_failures":1,"compiler_test262_compiler_errors":0,"compiler_test262_compiler_crashes":0,"compiler_test262_compiler_fails":0,"compiler_test262_both_fail":1,"compiler_test262_interpreter_fail_compiler_pass":0,"compatibility_pass":499,"compatibility_cases":500,"compiler_errors":0,"compiler_crashes":0,"compiler_fails":0,"both_fail":1,"interpreter_fail_compiler_pass":0,"elapsed_ms":20937},"status":"keep","description":"Tag arguments array objects","timestamp":1778087458294,"segment":24,"confidence":12.5,"iterationTokens":2593,"asi":{"hypothesis":"Arguments objects can keep the existing array-like backing but need a non-enumerable heap-side marker so Object.prototype.toString reports [object Arguments] without breaking Object.defineProperty on list-backed objects.","improvement":"Fixed Object.create/defineProperties arguments receiver cases by tagging existing arguments array objects instead of replacing them with maps; bounded built-ins/Object dropped from 3 to 1 with checks passing.","next_action_hint":"Only remaining bounded Object failure should be Object.assign descriptor ownership/writability/configurability."}}
