{"run":790,"commit":"ea157d6","metric":146,"metrics":{"compiler_test262_cases":2500,"compiler_test262_pass":2354,"compiler_test262_failures":146,"compiler_test262_compiler_errors":0,"compiler_test262_compiler_crashes":0,"compiler_test262_compiler_fails":2,"compiler_test262_both_fail":129,"compiler_test262_interpreter_fail_compiler_pass":8,"compatibility_pass":2354,"compatibility_cases":2500,"compiler_errors":0,"compiler_crashes":0,"compiler_fails":2,"both_fail":129,"interpreter_fail_compiler_pass":8,"elapsed_ms":335477},"status":"checks_failed","description":"Read Date prototype virtual methods","timestamp":1778116591116,"segment":31,"confidence":1.875,"iterationTokens":2391,"asi":{"hypothesis":"Date.prototype should read virtual Date prototype methods so Object.getOwnPropertyDescriptor(Date.prototype, name).value matches Date.prototype[name]","rollback_reason":"The compatibility metric improved substantially, but autoresearch checks timed out during the core test phase, so the change cannot be kept without further investigation","next_action_hint":"Retry a narrower/materialized Date prototype method solution or run core tests with diagnostics to find the timeout. The shape virtual lookup may create recursive prototype behavior in some test."}}
{"run":791,"commit":"ea157d6","metric":0,"metrics":{"compiler_test262_cases":0,"compiler_test262_pass":0,"compiler_test262_failures":0,"compiler_test262_compiler_errors":0,"compiler_test262_compiler_crashes":0,"compiler_test262_compiler_fails":0,"compiler_test262_both_fail":0,"compiler_test262_interpreter_fail_compiler_pass":0,"compatibility_pass":0,"compatibility_cases":0,"compiler_errors":0,"compiler_crashes":0,"compiler_fails":0,"both_fail":0,"interpreter_fail_compiler_pass":0,"elapsed_ms":2213700},"status":"crash","description":"Materialize Date prototype methods","timestamp":1778121993554,"segment":31,"confidence":1.875,"iterationTokens":8352,"asi":{"hypothesis":"Materializing Date.prototype methods at global construction time should avoid virtual prototype lookup recursion while preserving Date.prototype method descriptor identity","rollback_reason":"The 2500-case benchmark timed out after 2213s, despite focused cases and core checks passing locally; likely a pathological interaction in broad Test262 or retained state","next_action_hint":"Do not retry materializing all Date.prototype methods on broad workload without isolating the hang. Consider a smaller focused Date getOwnPropertyDescriptor window or materialize only requested methods if benchmark-safe."}}
{"run":792,"commit":"ea157d6","metric":0,"metrics":{"compiler_test262_cases":0,"compiler_test262_pass":0,"compiler_test262_failures":0,"compiler_test262_compiler_errors":0,"compiler_test262_compiler_crashes":0,"compiler_test262_compiler_fails":0,"compiler_test262_both_fail":0,"compiler_test262_interpreter_fail_compiler_pass":0,"compatibility_pass":0,"compatibility_cases":0,"compiler_errors":0,"compiler_crashes":0,"compiler_fails":0,"both_fail":0,"interpreter_fail_compiler_pass":0,"elapsed_ms":1989200},"status":"crash","description":"Describe global built-in property descriptors","timestamp":1778132786559,"segment":31,"confidence":1.875,"iterationTokens":8352,"asi":{"hypothesis":"Installing standard non-enumerable descriptors for global built-in functions and constants plus missing URI globals should fix global Object.getOwnPropertyDescriptor cases without broad object-model changes","rollback_reason":"Broad 2500-case workload timed out before metrics even though focused global descriptor cases and core checks passed","next_action_hint":"The timeout may be due to active workload/check duration rather than semantic failure; inspect logs or rerun a smaller bounded Object slice before retrying. Keep the global descriptor idea in backlog because focused cases are valid."}}
{"run":793,"commit":"ea157d6","metric":0,"metrics":{"compiler_test262_cases":0,"compiler_test262_pass":0,"compiler_test262_failures":0,"compiler_test262_compiler_errors":0,"compiler_test262_compiler_crashes":0,"compiler_test262_compiler_fails":0,"compiler_test262_both_fail":0,"compiler_test262_interpreter_fail_compiler_pass":0,"compatibility_pass":0,"compatibility_cases":0,"compiler_errors":0,"compiler_crashes":0,"compiler_fails":0,"both_fail":0,"interpreter_fail_compiler_pass":0,"elapsed_ms":2011000},"status":"crash","description":"Stringify integral float property keys","timestamp":1778135451103,"segment":31,"confidence":1.875,"iterationTokens":14092,"asi":{"hypothesis":"Property keys produced from floats should use JavaScript ToString formatting, so large integral numbers remain exponential strings like 1e+21 instead of decimal expansion","rollback_reason":"Focused large numeric property-key descriptor cases passed and core checks passed, but the 2500-case workload timed out before metrics","next_action_hint":"Because several focused-valid changes now timeout only on the broad command, diagnose the 2500-case harness/runtime timeout before further broad runs; test smaller slices or reduce error-limit to locate the long-running case."}}
{"run":794,"commit":"ea157d6","metric":0,"metrics":{"compiler_test262_cases":0,"compiler_test262_pass":0,"compiler_test262_failures":0,"compiler_test262_compiler_errors":0,"compiler_test262_compiler_crashes":0,"compiler_test262_compiler_fails":0,"compiler_test262_both_fail":0,"compiler_test262_interpreter_fail_compiler_pass":0,"compatibility_pass":0,"compatibility_cases":0,"compiler_errors":0,"compiler_crashes":0,"compiler_fails":0,"both_fail":0,"interpreter_fail_compiler_pass":0,"elapsed_ms":920600},"status":"crash","description":"Recheck current 2500-case baseline runtime","timestamp":1778136383807,"segment":31,"confidence":1.875,"iterationTokens":1023,"asi":{"hypothesis":"The repeated broad-workload timeouts may be independent of individual focused-valid edits, so re-run the clean current baseline to confirm harness health","rollback_reason":"The clean current baseline also timed out before metrics, suggesting a harness/runtime state issue or current environment slowdown rather than a specific source edit","next_action_hint":"Before further 2500-case experiments, diagnose the broad harness by running smaller TEST262_LIMIT windows or the benchmark directly with visible progress; avoid treating focused-valid changes as semantic crashes until baseline broad run is healthy."}}
{"type":"config","name":"QuickBEAM built-ins/Object 2300-case compatibility","metricName":"compatibility_failures","metricUnit":"","bestDirection":"lower"}
{"run":795,"commit":"b84910c","metric":95,"metrics":{"compiler_test262_cases":2300,"compiler_test262_pass":2205,"compiler_test262_failures":95,"compiler_test262_compiler_errors":0,"compiler_test262_compiler_crashes":0,"compiler_test262_compiler_fails":2,"compiler_test262_both_fail":78,"compiler_test262_interpreter_fail_compiler_pass":8,"compatibility_pass":2205,"compatibility_cases":2300,"compiler_errors":0,"compiler_crashes":0,"compiler_fails":2,"both_fail":78,"interpreter_fail_compiler_pass":8,"elapsed_ms":278318},"status":"keep","description":"Baseline 2300-case Object workload","timestamp":1778137292669,"segment":32,"confidence":null,"iterationTokens":130,"asi":{"hypothesis":"Use a stable 2300-case built-ins/Object workload while the broader 2500-case command currently times out even on a clean baseline","baseline":"The stable 2300-case slice completes with 95 failures and passes checks; it includes global descriptor, Object.fromEntries, and numeric property-key clusters without the later 2500-case timeout region","next_action_hint":"Target focused semantic fixes in the 2300-case slice first, then re-expand once the later hanging region is diagnosed."}}
{"run":796,"commit":"242ede6","metric":91,"metrics":{"compiler_test262_cases":2300,"compiler_test262_pass":2209,"compiler_test262_failures":91,"compiler_test262_compiler_errors":0,"compiler_test262_compiler_crashes":0,"compiler_test262_compiler_fails":2,"compiler_test262_both_fail":74,"compiler_test262_interpreter_fail_compiler_pass":8,"compatibility_pass":2209,"compatibility_cases":2300,"compiler_errors":0,"compiler_crashes":0,"compiler_fails":2,"both_fail":74,"interpreter_fail_compiler_pass":8,"elapsed_ms":287572},"status":"keep","description":"Stringify float property keys","timestamp":1778137730002,"segment":32,"confidence":null,"iterationTokens":1561,"asi":{"hypothesis":"Property keys produced from floats should use JavaScript ToString formatting, so large integral numbers remain exponential strings like 1e+21 instead of decimal expansion","improvement":"Fixed four Object.getOwnPropertyDescriptor large numeric property-key cases in the stable 2300-case Object workload","next_action_hint":"Continue targeting descriptor clusters in the 2300-case slice, especially global built-in descriptors and Object.fromEntries semantics."}}
{"run":797,"commit":"242ede6","metric":91,"metrics":{"compiler_test262_cases":2300,"compiler_test262_pass":2209,"compiler_test262_failures":91,"compiler_test262_compiler_errors":0,"compiler_test262_compiler_crashes":0,"compiler_test262_compiler_fails":2,"compiler_test262_both_fail":74,"compiler_test262_interpreter_fail_compiler_pass":8,"compatibility_pass":2209,"compatibility_cases":2300,"compiler_errors":0,"compiler_crashes":0,"compiler_fails":2,"both_fail":74,"interpreter_fail_compiler_pass":8,"elapsed_ms":320850},"status":"checks_failed","description":"Describe global property descriptors","timestamp":1778138175126,"segment":32,"confidence":null,"iterationTokens":2301,"asi":{"hypothesis":"Installing standard global descriptors and missing URI functions should fix global descriptor cases","rollback_reason":"Benchmark was flat at current best and checks timed out during default vm compiler Test262 after core tests, indicating a possible slow/hanging check path","next_action_hint":"Diagnose where time is eaten now: run checks sections manually with timing, especially default vm compiler Test262, and inspect whether current baseline also slows."}}
{"type":"config","name":"QuickBEAM built-ins/Object 2500-case compatibility after timeout fixes","metricName":"compatibility_failures","metricUnit":"","bestDirection":"lower"}
{"run":798,"commit":"9198d5f","metric":179,"metrics":{"compiler_test262_cases":2500,"compiler_test262_pass":2321,"compiler_test262_failures":179,"compiler_test262_compiler_errors":0,"compiler_test262_compiler_crashes":0,"compiler_test262_compiler_fails":2,"compiler_test262_both_fail":166,"compiler_test262_interpreter_fail_compiler_pass":8,"compatibility_pass":2321,"compatibility_cases":2500,"compiler_errors":0,"compiler_crashes":0,"compiler_fails":2,"both_fail":166,"interpreter_fail_compiler_pass":8,"elapsed_ms":219436},"status":"keep","description":"Remove Object workload timeout cases","timestamp":1778141016054,"segment":33,"confidence":null,"iterationTokens":132,"asi":{"hypothesis":"Timeout-class Object cases come from missing iterator validation, missing proxy get receiver, and huge Array.length writes that physically resize arrays; narrow semantic fixes should remove pathological runtime without broad sparse-array regressions","improvement":"2500-case workload now completes in 219s with checks passing; per-case profiler shows no remaining cases above 500ms, and focused fromEntries iterator and array length cases pass in both interpreter and compiler","next_action_hint":"Resume compatibility work on remaining descriptor clusters. Keep an eye on virtual huge length semantics beyond writes; avoid broad sparse array representation changes."}}
{"run":799,"commit":"0feda3f","metric":174,"metrics":{"compiler_test262_cases":2500,"compiler_test262_pass":2326,"compiler_test262_failures":174,"compiler_test262_compiler_errors":0,"compiler_test262_compiler_crashes":0,"compiler_test262_compiler_fails":2,"compiler_test262_both_fail":161,"compiler_test262_interpreter_fail_compiler_pass":8,"compatibility_pass":2326,"compatibility_cases":2500,"compiler_errors":0,"compiler_crashes":0,"compiler_fails":2,"both_fail":161,"interpreter_fail_compiler_pass":8,"elapsed_ms":201247},"status":"keep","description":"Describe global builtin descriptors","timestamp":1778141411901,"segment":33,"confidence":null,"iterationTokens":12141,"asi":{"hypothesis":"Global built-in functions/constants should have standard global-object property descriptors, and URI global functions should exist so descriptor tests do not observe undefined","improvement":"Reduced 2500-case Object failures from 179 to 174 by fixing global Object.getOwnPropertyDescriptor cases for eval/parse/isFinite/URI functions and constants","next_action_hint":"Continue getOwnPropertyDescriptor cluster; Date.prototype method value identity remains large but needs a non-timeout materialization strategy."}}
{"run":800,"commit":"7d3786b","metric":136,"metrics":{"compiler_test262_cases":2500,"compiler_test262_pass":2364,"compiler_test262_failures":136,"compiler_test262_compiler_errors":0,"compiler_test262_compiler_crashes":0,"compiler_test262_compiler_fails":2,"compiler_test262_both_fail":123,"compiler_test262_interpreter_fail_compiler_pass":8,"compatibility_pass":2364,"compatibility_cases":2500,"compiler_errors":0,"compiler_crashes":0,"compiler_fails":2,"both_fail":123,"interpreter_fail_compiler_pass":8,"elapsed_ms":204579},"status":"keep","description":"Materialize Date prototype methods","timestamp":1778141777449,"segment":33,"confidence":8.6,"iterationTokens":4020,"asi":{"hypothesis":"Date.prototype methods should be actual non-enumerable data properties so descriptor values match Date.prototype[name] without virtual lookup","improvement":"Reduced 2500-case Object failures from 174 to 136 after the timeout cases were fixed; Date.prototype getOwnPropertyDescriptor identity cluster now passes checks","next_action_hint":"Continue Object.getOwnPropertyDescriptor cluster beyond Date; remaining failures include Object.fromEntries semantics, Object.freeze/proxy/symbol handling, and descriptor edge cases."}}
{"run":801,"commit":"e9b7131","metric":118,"metrics":{"compiler_test262_cases":2500,"compiler_test262_pass":2382,"compiler_test262_failures":118,"compiler_test262_compiler_errors":0,"compiler_test262_compiler_crashes":0,"compiler_test262_compiler_fails":2,"compiler_test262_both_fail":105,"compiler_test262_interpreter_fail_compiler_pass":8,"compatibility_pass":2382,"compatibility_cases":2500,"compiler_errors":0,"compiler_crashes":0,"compiler_fails":2,"both_fail":105,"interpreter_fail_compiler_pass":8,"elapsed_ms":203206},"status":"keep","description":"Expose Object statics and UTC Date methods","timestamp":1778142191290,"segment":33,"confidence":2.8372093023255816,"iterationTokens":10846,"asi":{"hypothesis":"Object constructor should be registered with its builtin module so static methods are readable as properties, and missing Date UTC getter prototype methods should be materialized like the rest of Date.prototype","improvement":"Reduced 2500-case Object failures from 136 to 118 by fixing Object static method descriptor value identity and Date UTC prototype getter descriptors","next_action_hint":"Continue remaining getOwnPropertyDescriptor builtin clusters, especially RegExp/String/Function static and prototype property descriptors."}}
{"run":802,"commit":"b6a2c60","metric":106,"metrics":{"compiler_test262_cases":2500,"compiler_test262_pass":2394,"compiler_test262_failures":106,"compiler_test262_compiler_errors":0,"compiler_test262_compiler_crashes":0,"compiler_test262_compiler_fails":2,"compiler_test262_both_fail":86,"compiler_test262_interpreter_fail_compiler_pass":8,"compatibility_pass":2394,"compatibility_cases":2500,"compiler_errors":0,"compiler_crashes":0,"compiler_fails":2,"both_fail":86,"interpreter_fail_compiler_pass":8,"elapsed_ms":202559},"status":"keep","description":"Describe builtin constants and RegExp methods","timestamp":1778142721316,"segment":33,"confidence":2.433333333333333,"iterationTokens":15768,"asi":{"hypothesis":"Builtin namespace constants and constructor static values need non-writable/non-enumerable/non-configurable descriptors, and RegExp.prototype methods should be materialized like Date prototype methods","improvement":"Reduced 2500-case Object failures from 118 to 106 by fixing Math/Number/String length and constant descriptors plus RegExp.prototype exec/test/toString descriptor identity","next_action_hint":"Remaining descriptor failures include RegExp prototype accessors and Error prototype methods; continue materializing or describing builtin prototype/accessor properties semantically."}}
{"run":803,"commit":"c0c2d4b","metric":100,"metrics":{"compiler_test262_cases":2500,"compiler_test262_pass":2400,"compiler_test262_failures":100,"compiler_test262_compiler_errors":0,"compiler_test262_compiler_crashes":0,"compiler_test262_compiler_fails":2,"compiler_test262_both_fail":83,"compiler_test262_interpreter_fail_compiler_pass":8,"compatibility_pass":2400,"compatibility_cases":2500,"compiler_errors":0,"compiler_crashes":0,"compiler_fails":2,"both_fail":83,"interpreter_fail_compiler_pass":8,"elapsed_ms":202413},"status":"keep","description":"Describe callable and string lengths","timestamp":1778143203782,"segment":33,"confidence":3.2916666666666665,"iterationTokens":9709,"asi":{"hypothesis":"Function instances and String wrapper instances should expose own length data descriptors with standard non-enumerable attributes, and builtin descriptor fallback should not crash when a module has no static properties","improvement":"Reduced 2500-case Object failures from 106 to 100 by fixing Function instance length descriptors, String wrapper length descriptors, and Boolean/RegExp prototype descriptor crashes","next_action_hint":"Remaining getOwnPropertyDescriptor cluster includes RegExp.prototype accessors and Error.prototype.toString, plus larger defineProperty/fromEntries/freeze semantic clusters."}}
{"run":804,"commit":"80def44","metric":96,"metrics":{"compiler_test262_cases":2500,"compiler_test262_pass":2404,"compiler_test262_failures":96,"compiler_test262_compiler_errors":0,"compiler_test262_compiler_crashes":0,"compiler_test262_compiler_fails":2,"compiler_test262_both_fail":79,"compiler_test262_interpreter_fail_compiler_pass":8,"compatibility_pass":2404,"compatibility_cases":2500,"compiler_errors":0,"compiler_crashes":0,"compiler_fails":2,"both_fail":79,"interpreter_fail_compiler_pass":8,"elapsed_ms":213251},"status":"keep","description":"Describe RegExp prototype accessors","timestamp":1778143602214,"segment":33,"confidence":4.611111111111111,"iterationTokens":3055,"asi":{"hypothesis":"RegExp.prototype standard properties source/global/ignoreCase/multiline are own accessor descriptors, not missing data properties","improvement":"Reduced 2500-case Object failures from 100 to 96 by materializing RegExp.prototype accessor descriptors","next_action_hint":"Remaining getOwnPropertyDescriptor descriptor failure includes Error.prototype.toString; larger remaining clusters are defineProperty builtin/prototype descriptor copying, Object.entries ordering, freeze/proxy/symbol behavior, and fromEntries iterator semantics."}}
{"run":805,"commit":"4c1c7ad","metric":95,"metrics":{"compiler_test262_cases":2500,"compiler_test262_pass":2405,"compiler_test262_failures":95,"compiler_test262_compiler_errors":0,"compiler_test262_compiler_crashes":0,"compiler_test262_compiler_fails":2,"compiler_test262_both_fail":78,"compiler_test262_interpreter_fail_compiler_pass":8,"compatibility_pass":2405,"compatibility_cases":2500,"compiler_errors":0,"compiler_crashes":0,"compiler_fails":2,"both_fail":78,"interpreter_fail_compiler_pass":8,"elapsed_ms":225353},"status":"keep","description":"Describe Error prototype toString","timestamp":1778143987186,"segment":33,"confidence":5.090909090909091,"iterationTokens":2748,"asi":{"hypothesis":"Error.prototype.toString should be a writable, non-enumerable, configurable own data property on Error.prototype","improvement":"Reduced 2500-case Object failures from 96 to 95 by fixing Error.prototype.toString descriptor attributes","next_action_hint":"Remaining 95 failures are mostly defineProperty, entries, freeze, fromEntries, typed-array/resizable, and symbol/proxy semantics rather than simple builtin descriptor identity."}}
{"run":806,"commit":"ccd0caa","metric":84,"metrics":{"compiler_test262_cases":2500,"compiler_test262_pass":2416,"compiler_test262_failures":84,"compiler_test262_compiler_errors":0,"compiler_test262_compiler_crashes":0,"compiler_test262_compiler_fails":2,"compiler_test262_both_fail":67,"compiler_test262_interpreter_fail_compiler_pass":8,"compatibility_pass":2416,"compatibility_cases":2500,"compiler_errors":0,"compiler_crashes":0,"compiler_fails":2,"both_fail":67,"interpreter_fail_compiler_pass":8,"elapsed_ms":224230},"status":"keep","description":"Describe prototype method attributes","timestamp":1778144513783,"segment":33,"confidence":7.916666666666667,"iterationTokens":7476,"asi":{"hypothesis":"Function.prototype, Array.prototype, and String.prototype methods should be own non-enumerable writable/configurable data properties; Array.prototype.reduceRight should exist","improvement":"Reduced 2500-case Object failures from 95 to 84 by fixing prototype method descriptor attributes for bind/indexOf/lastIndexOf/every/some/forEach/map/filter/reduce/reduceRight/trim and related cases","next_action_hint":"Remaining clusters include defineProperty descriptor edge cases, Object.entries ordering/proxy/primitive strings, Object.freeze proxy/symbol behavior, Object.fromEntries semantics, typed-array resizable-buffer crashes, strict getter-only array writes, and arguments parameter-map aliasing."}}
