{"run":1739,"commit":"0f04fc4","metric":16,"metrics":{"compiler_test262_cases":296,"compiler_test262_pass":280,"compiler_test262_failures":16,"compiler_test262_compiler_errors":0,"compiler_test262_compiler_crashes":0,"compiler_test262_compiler_fails":0,"compiler_test262_both_fail":13,"compiler_test262_interpreter_fail_compiler_pass":0,"compatibility_pass":280,"compatibility_cases":296,"compiler_errors":0,"compiler_crashes":0,"compiler_fails":0,"both_fail":13,"interpreter_fail_compiler_pass":0,"elapsed_ms":17007},"status":"keep","description":"Preserve Promise prototype when settling","timestamp":1778878012242,"segment":174,"confidence":3.5405405405405403,"iterationTokens":2154,"asi":{"hypothesis":"Settling a Promise capability should update its state slots without replacing a subclass/newTarget prototype selected at construction time; otherwise resolved/rejected subclass promises fall back to Promise.prototype.","result":"Promise failures improved from 22 to 16; checks passed. Static resolve/reject/all/try ctx-ctor focused cases now pass.","remaining":"Residual failures are dominated by same-thenable combinator behavior plus prototype.then species/capability wiring and the realm Function prototype case."}}
{"run":1740,"commit":"86d4304","metric":15,"metrics":{"compiler_test262_cases":296,"compiler_test262_pass":281,"compiler_test262_failures":15,"compiler_test262_compiler_errors":0,"compiler_test262_compiler_crashes":0,"compiler_test262_compiler_fails":0,"compiler_test262_both_fail":12,"compiler_test262_interpreter_fail_compiler_pass":0,"compatibility_pass":281,"compatibility_cases":296,"compiler_errors":0,"compiler_crashes":0,"compiler_fails":0,"both_fail":12,"interpreter_fail_compiler_pass":0,"elapsed_ms":16777},"status":"keep","description":"Perform Promise.all with element functions","timestamp":1778878410531,"segment":174,"confidence":3.473684210526316,"iterationTokens":8492,"asi":{"hypothesis":"Promise.all on custom constructors needs direct PerformPromiseAll-style resolve-element functions passed to nextPromise.then, instead of adopting thenables before the combinator element callbacks exist.","result":"Promise failures improved from 16 to 15; checks passed. Focused Promise.all same-thenable and resolve-before-loop-exit cases now pass.","remaining":"Apply the same direct element-function approach to allSettled/any/race if it continues to improve, while watching for duplicated then calls and backpressure regressions."}}
{"run":1741,"commit":"9298dd8","metric":13,"metrics":{"compiler_test262_cases":296,"compiler_test262_pass":283,"compiler_test262_failures":13,"compiler_test262_compiler_errors":0,"compiler_test262_compiler_crashes":0,"compiler_test262_compiler_fails":0,"compiler_test262_both_fail":10,"compiler_test262_interpreter_fail_compiler_pass":0,"compatibility_pass":283,"compatibility_cases":296,"compiler_errors":0,"compiler_crashes":0,"compiler_fails":0,"both_fail":10,"interpreter_fail_compiler_pass":0,"elapsed_ms":16999},"status":"keep","description":"Perform Promise.allSettled with element functions","timestamp":1778878653775,"segment":174,"confidence":4.32258064516129,"iterationTokens":2529,"asi":{"hypothesis":"Promise.allSettled has the same same-thenable issue as Promise.all and should call each resolved nextPromise.then with per-element fulfillment/rejection functions that store status records.","result":"Promise failures improved from 15 to 13; checks passed. Focused allSettled same-thenable and ctx-ctor cases now pass.","remaining":"Apply direct element-function logic to Promise.any/race; prototype.then species and realm residual remain."}}
{"run":1742,"commit":"576350a","metric":12,"metrics":{"compiler_test262_cases":296,"compiler_test262_pass":284,"compiler_test262_failures":12,"compiler_test262_compiler_errors":0,"compiler_test262_compiler_crashes":0,"compiler_test262_compiler_fails":0,"compiler_test262_both_fail":9,"compiler_test262_interpreter_fail_compiler_pass":0,"compatibility_pass":284,"compatibility_cases":296,"compiler_errors":0,"compiler_crashes":0,"compiler_fails":0,"both_fail":9,"interpreter_fail_compiler_pass":0,"elapsed_ms":16977},"status":"keep","description":"Perform Promise.any and race with element functions","timestamp":1778878917013,"segment":174,"confidence":5,"iterationTokens":3628,"asi":{"hypothesis":"Promise.any and Promise.race on custom constructors need direct nextPromise.then element functions just like all/allSettled to preserve ctx-ctor behavior and same-thenable rejection/early-loop semantics.","result":"Promise failures improved from 13 to 12; checks passed. Focused any rejection and ctx-ctor cases now pass; race same-thenable fulfillment/rejection still needs multi-resolution behavior beyond current once wrappers.","remaining":"Residual Promise failures include race/any fulfillment same-thenable behavior, prototype.then custom species/capability, and realm Function prototype handling."}}
{"run":1743,"commit":"9ea755d","metric":6,"metrics":{"compiler_test262_cases":296,"compiler_test262_pass":290,"compiler_test262_failures":6,"compiler_test262_compiler_errors":0,"compiler_test262_compiler_crashes":0,"compiler_test262_compiler_fails":0,"compiler_test262_both_fail":4,"compiler_test262_interpreter_fail_compiler_pass":0,"compatibility_pass":290,"compatibility_cases":296,"compiler_errors":0,"compiler_crashes":0,"compiler_fails":0,"both_fail":4,"interpreter_fail_compiler_pass":0,"elapsed_ms":16792},"status":"keep","description":"Reuse Promise combinator capability handlers","timestamp":1778879231521,"segment":174,"confidence":4.947368421052632,"iterationTokens":4841,"asi":{"hypothesis":"PerformPromiseAll should pass the same reject capability to every element, while Promise.any/race should pass the shared capability resolve/reject directly so multiple calls remain observable where the spec permits.","result":"Promise failures improved from 12 to 6; checks passed. Focused same-reject and same-thenable any/race cases now pass.","remaining":"Only prototype.then custom species/capability and realm Function prototype residuals appear to remain."}}
{"run":1744,"commit":"872cbd8","metric":4,"metrics":{"compiler_test262_cases":296,"compiler_test262_pass":292,"compiler_test262_failures":4,"compiler_test262_compiler_errors":0,"compiler_test262_compiler_crashes":0,"compiler_test262_compiler_fails":0,"compiler_test262_both_fail":4,"compiler_test262_interpreter_fail_compiler_pass":0,"compatibility_pass":292,"compatibility_cases":296,"compiler_errors":0,"compiler_crashes":0,"compiler_fails":0,"both_fail":4,"interpreter_fail_compiler_pass":0,"elapsed_ms":16885},"status":"keep","description":"Unwrap keyed Promise result arrays","timestamp":1778879514000,"segment":174,"confidence":4.612903225806452,"iterationTokens":4332,"asi":{"hypothesis":"Promise.allKeyed/allSettledKeyed crash because resolved result arrays can be qb_arr-backed heap objects; converting through Heap.to_list before zipping entries should preserve semantics and remove the ctx-non-ctor crashes.","result":"Promise failures improved from 6 to 4; checks passed.","remaining":"Only prototype.then custom species/capability tests and proto-from-ctor-realm remain in the current Promise slice."}}
{"run":1745,"commit":"5061951","metric":2,"metrics":{"compiler_test262_cases":296,"compiler_test262_pass":294,"compiler_test262_failures":2,"compiler_test262_compiler_errors":0,"compiler_test262_compiler_crashes":0,"compiler_test262_compiler_fails":0,"compiler_test262_both_fail":2,"compiler_test262_interpreter_fail_compiler_pass":0,"compatibility_pass":294,"compatibility_cases":296,"compiler_errors":0,"compiler_crashes":0,"compiler_fails":0,"both_fail":2,"interpreter_fail_compiler_pass":0,"elapsed_ms":17437},"status":"keep","description":"Honor inherited Promise species","timestamp":1778880226666,"segment":174,"confidence":4.754098360655738,"iterationTokens":4332,"asi":{"hypothesis":"Promise.prototype.then should treat subclasses inheriting Promise[Symbol.species] as using the subclass constructor, because the inherited accessor returns the receiver constructor. This enables NewPromiseCapability to observe subclass constructor executor behavior.","result":"Promise failures improved from 4 to 2; checks passed. The capability-executor-called-twice and not-callable tests now pass.","remaining":"Residual Promise failures are prototype/then/ctor-custom and proto-from-ctor-realm."}}
{"run":1746,"commit":"2c16c80","metric":1,"metrics":{"compiler_test262_cases":296,"compiler_test262_pass":295,"compiler_test262_failures":1,"compiler_test262_compiler_errors":0,"compiler_test262_compiler_crashes":0,"compiler_test262_compiler_fails":0,"compiler_test262_both_fail":1,"compiler_test262_interpreter_fail_compiler_pass":0,"compatibility_pass":295,"compatibility_cases":296,"compiler_errors":0,"compiler_crashes":0,"compiler_fails":0,"both_fail":1,"interpreter_fail_compiler_pass":0,"elapsed_ms":17321},"status":"keep","description":"Expose Promise in Test262 realms","timestamp":1778880801545,"segment":174,"confidence":4.709677419354839,"iterationTokens":56407,"asi":{"hypothesis":"Promise proto-from-ctor-realm now needs complete Test262 realm exposure: other.Promise must exist, realm-created Function constructors must carry a Promise prototype intrinsic, and Promise construction must use that intrinsic when newTarget.prototype is non-object.","result":"Promise failures improved from 2 to 1; checks passed. Focused proto-from-ctor-realm now passes.","remaining":"The only current Promise residual is prototype/then/ctor-custom, which appears tied to derived Promise subclass construction plus arguments.length/class-constructor context rather than missing species capability ordering."}}
{"run":1747,"commit":"2bd0930","metric":0,"metrics":{"compiler_test262_cases":296,"compiler_test262_pass":296,"compiler_test262_failures":0,"compiler_test262_compiler_errors":0,"compiler_test262_compiler_crashes":0,"compiler_test262_compiler_fails":0,"compiler_test262_both_fail":0,"compiler_test262_interpreter_fail_compiler_pass":0,"compatibility_pass":296,"compatibility_cases":296,"compiler_errors":0,"compiler_crashes":0,"compiler_fails":0,"both_fail":0,"interpreter_fail_compiler_pass":0,"elapsed_ms":17389},"status":"keep","description":"Fallback construct class constructors correctly","timestamp":1778881096079,"segment":174,"confidence":4.709677419354839,"iterationTokens":6941,"asi":{"hypothesis":"When compiled constructor invocation cannot handle a class constructor, falling back through ordinary function invocation rejects class constructors as calls and loses constructor-specific var refs; a dedicated interpreter constructor fallback should preserve newTarget/this and arguments semantics.","result":"Promise slice completed at 0/296; checks passed. Focused prototype/then/ctor-custom now passes because derived Promise species constructors can read arguments.length after super.","remaining":"Promise bounded slice is complete. Rebaseline another residual category next rather than overfitting further to Promise."}}
{"type":"config","name":"Improve Set set-like residual after Promise completion","metricName":"compatibility_failures","metricUnit":"","bestDirection":"lower"}
{"run":1748,"commit":"d5ec450","metric":4,"metrics":{"compiler_test262_cases":300,"compiler_test262_pass":296,"compiler_test262_failures":4,"compiler_test262_compiler_errors":0,"compiler_test262_compiler_crashes":0,"compiler_test262_compiler_fails":0,"compiler_test262_both_fail":4,"compiler_test262_interpreter_fail_compiler_pass":0,"compatibility_pass":296,"compatibility_cases":300,"compiler_errors":0,"compiler_crashes":0,"compiler_fails":0,"both_fail":4,"interpreter_fail_compiler_pass":0,"elapsed_ms":12396},"status":"keep","description":"Baseline Set residual after Promise completion","timestamp":1778881260613,"segment":175,"confidence":null,"iterationTokens":125,"asi":{"hypothesis":"After completing Promise, Set remains a small known residual around set-like class-order semantics; rebaseline before trying non-cached semantic fixes.","result":"Set remains at 4 failures out of 300 with checks passing.","remaining":"Investigate invocation/closure state for set-like keys/has order; avoid retrying cached Set-like records or iterator caps unchanged."}}
{"run":1749,"commit":"d5ec450","metric":4,"metrics":{"compiler_test262_cases":300,"compiler_test262_pass":296,"compiler_test262_failures":4,"compiler_test262_compiler_errors":0,"compiler_test262_compiler_crashes":0,"compiler_test262_compiler_fails":0,"compiler_test262_both_fail":0,"compiler_test262_interpreter_fail_compiler_pass":0,"compatibility_pass":296,"compatibility_cases":300,"compiler_errors":0,"compiler_crashes":0,"compiler_fails":0,"both_fail":0,"interpreter_fail_compiler_pass":0,"elapsed_ms":73349},"status":"discard","description":"Reuse Set-like validation records","timestamp":1778881657991,"segment":175,"confidence":null,"iterationTokens":9600,"asi":{"hypothesis":"Using the Set-like validation record for size/has/keys should remove duplicate getter observations in the four class-order failures.","rollback_reason":"Primary metric stayed at 4 and focused class-order tests became timeout-slow, matching the known stale record-caching failure mode; the secondary both_fail drop is just timeout/failure-shape movement, not a compatibility improvement.","next_action_hint":"Do not retry Set-like record reuse unchanged. Investigate why iterator next closures called inside Set builtins repeat or fail to advance before using cached records."}}
{"run":1750,"commit":"d5ec450","metric":4,"metrics":{"compiler_test262_cases":300,"compiler_test262_pass":296,"compiler_test262_failures":4,"compiler_test262_compiler_errors":0,"compiler_test262_compiler_crashes":0,"compiler_test262_compiler_fails":0,"compiler_test262_both_fail":4,"compiler_test262_interpreter_fail_compiler_pass":0,"compatibility_pass":296,"compatibility_cases":300,"compiler_errors":0,"compiler_crashes":0,"compiler_fails":0,"both_fail":4,"interpreter_fail_compiler_pass":0,"elapsed_ms":11442},"status":"discard","description":"Keep closed local cells shared","timestamp":1778881891108,"segment":175,"confidence":null,"iterationTokens":6848,"asi":{"hypothesis":"OP_close_loc may be breaking shared closure cell state by copying an already heap-backed cell; leaving existing cells in place might fix accessor/getter closure increments before cached Set-like records are retried.","rollback_reason":"Primary metric stayed at 4 and focused closure probes were unchanged; object accessor closure state still returned [0,1,2,0] and iterator value getters still repeated the first value.","next_action_hint":"Inspect closure variable mapping/capture types for nested accessor getters rather than OP_close_loc cell copying alone."}}
{"type":"config","name":"Recheck Function residual after constructor fallback","metricName":"compatibility_failures","metricUnit":"","bestDirection":"lower"}
{"run":1751,"commit":"c221a69","metric":0,"metrics":{"compiler_test262_cases":509,"compiler_test262_pass":509,"compiler_test262_failures":0,"compiler_test262_compiler_errors":0,"compiler_test262_compiler_crashes":0,"compiler_test262_compiler_fails":0,"compiler_test262_both_fail":0,"compiler_test262_interpreter_fail_compiler_pass":0,"compatibility_pass":509,"compatibility_cases":509,"compiler_errors":0,"compiler_crashes":0,"compiler_fails":0,"both_fail":0,"interpreter_fail_compiler_pass":0,"elapsed_ms":27319},"status":"keep","description":"Rebaseline Function residual after Promise fixes","timestamp":1778882063312,"segment":176,"confidence":null,"iterationTokens":124,"asi":{"hypothesis":"The constructor fallback and Promise realm work may have also cleared the previous Function residuals around realm Function construction/newTarget and caller restrictions; rebaseline before further Function-specific work.","result":"Function bounded workload is complete at 0/509 with checks passing.","remaining":"No Function residual in this bounded slice; move to another small residual category."}}
{"type":"config","name":"Recheck String residual after Function completion","metricName":"compatibility_failures","metricUnit":"","bestDirection":"lower"}
{"run":1752,"commit":"d095a40","metric":2,"metrics":{"compiler_test262_cases":1223,"compiler_test262_pass":1221,"compiler_test262_failures":2,"compiler_test262_compiler_errors":0,"compiler_test262_compiler_crashes":0,"compiler_test262_compiler_fails":0,"compiler_test262_both_fail":2,"compiler_test262_interpreter_fail_compiler_pass":0,"compatibility_pass":1221,"compatibility_cases":1223,"compiler_errors":0,"compiler_crashes":0,"compiler_fails":0,"both_fail":2,"interpreter_fail_compiler_pass":0,"elapsed_ms":44228},"status":"keep","description":"Rebaseline String residual after Function completion","timestamp":1778882246495,"segment":177,"confidence":null,"iterationTokens":124,"asi":{"hypothesis":"String previously had only duplicate named RegExp group residuals; rebaseline after recent Function/Promise constructor fixes before choosing the next target.","result":"String remains at 2 failures out of 1223 with checks passing.","remaining":"Residual is likely still duplicate named RegExp groups rejected before runtime fallback; avoid parser-only retry unchanged."}}
{"type":"config","name":"Recheck Object residual after constructor fallback","metricName":"compatibility_failures","metricUnit":"","bestDirection":"lower"}
{"run":1753,"commit":"3caa658","metric":2,"metrics":{"compiler_test262_cases":2500,"compiler_test262_pass":2498,"compiler_test262_failures":2,"compiler_test262_compiler_errors":0,"compiler_test262_compiler_crashes":0,"compiler_test262_compiler_fails":0,"compiler_test262_both_fail":0,"compiler_test262_interpreter_fail_compiler_pass":2,"compatibility_pass":2498,"compatibility_cases":2500,"compiler_errors":0,"compiler_crashes":0,"compiler_fails":0,"both_fail":0,"interpreter_fail_compiler_pass":2,"elapsed_ms":127062},"status":"keep","description":"Rebaseline Object residual after constructor fallback","timestamp":1778882593237,"segment":178,"confidence":null,"iterationTokens":124,"asi":{"hypothesis":"Recheck the known Object 2500-case residual after Promise/Function constructor fallback changes in case typed-array Object.defineProperty skew moved.","result":"Object remains at 2 failures out of 2500 with checks passing; both are interpreter-fail/compiler-pass residuals.","remaining":"Avoid broad typed-array/resizable changes unchanged; residual still likely native bytecode/interpreter harness skew."}}
{"type":"config","name":"Recheck RegExp residual after Promise and Function completion","metricName":"compatibility_failures","metricUnit":"","bestDirection":"lower"}
{"run":1754,"commit":"248d0d7","metric":28,"metrics":{"compiler_test262_cases":500,"compiler_test262_pass":472,"compiler_test262_failures":28,"compiler_test262_compiler_errors":0,"compiler_test262_compiler_crashes":0,"compiler_test262_compiler_fails":0,"compiler_test262_both_fail":19,"compiler_test262_interpreter_fail_compiler_pass":0,"compatibility_pass":472,"compatibility_cases":500,"compiler_errors":0,"compiler_crashes":0,"compiler_fails":0,"both_fail":19,"interpreter_fail_compiler_pass":0,"elapsed_ms":68659},"status":"keep","description":"Rebaseline RegExp residual after Promise and Function completion","timestamp":1778882806609,"segment":179,"confidence":null,"iterationTokens":128,"asi":{"hypothesis":"RegExp remains the next larger bounded residual after Promise/Function completion; rebaseline before selecting a focused RegExp cluster.","result":"RegExp remains at 28 failures out of 500 with checks passing.","remaining":"Inspect current failure list for clusters; avoid broad native constructor compile and duplicate-group parser-only retries unchanged."}}
{"run":1755,"commit":"248d0d7","metric":0,"metrics":{"compiler_test262_cases":0,"compiler_test262_pass":0,"compiler_test262_failures":0,"compiler_test262_compiler_errors":0,"compiler_test262_compiler_crashes":1,"compiler_test262_compiler_fails":0,"compiler_test262_both_fail":0,"compiler_test262_interpreter_fail_compiler_pass":0,"compatibility_pass":0,"compatibility_cases":0,"compiler_errors":0,"compiler_crashes":1,"compiler_fails":0,"both_fail":0,"interpreter_fail_compiler_pass":0,"elapsed_ms":13500},"status":"crash","description":"Map fromCodePoint lone surrogates","timestamp":1778883036073,"segment":179,"confidence":null,"iterationTokens":11727,"asi":{"hypothesis":"RegExp CharacterClassEscapes crashes originate in String.fromCodePoint trying to build invalid UTF-8 for surrogate code points; mapping lone surrogates through QuickBEAM's existing WTF-8/PUA representation may turn crashes into ordinary RegExp assertions.","rollback_reason":"The broad RegExp workload crashed with exit 139 after the change; focused negative digit case segfaulted. Mapping surrogates into PUA before passing strings to native RegExp can destabilize the native engine.","next_action_hint":"Do not retry broad fromCodePoint surrogate remapping unchanged. If revisiting, isolate native RegExp input sanitization or test harness code-point generation without feeding PUA surrogate encodings into QuickJS regexp execution."}}
