{"run":546,"commit":"6ccfb06","metric":11,"metrics":{"js_bytecode_existing_cases":157,"js_bytecode_existing_compiled":149,"js_bytecode_existing_unsupported":7,"js_bytecode_existing_mismatches":3,"js_bytecode_existing_native_loadable":146,"js_bytecode_compiler_cases":132,"js_bytecode_compiler_compiled":132,"js_bytecode_compiler_unsupported":0,"js_bytecode_compiler_mismatches":0,"js_bytecode_compiler_native_loadable":132,"js_bytecode_compiler_failures":0},"status":"keep","description":"Confirm stable at 11 after private field revert","timestamp":1777879924352,"segment":19,"confidence":3.24,"iterationTokens":1773,"asi":{"hypothesis":"Confirm stable after revert.","result":"Stable at 11. Private field partial implementation reverted. Assembler opcodes remain for future use."}}
{"run":547,"commit":"6ccfb06","metric":11,"metrics":{"js_bytecode_existing_cases":157,"js_bytecode_existing_compiled":152,"js_bytecode_existing_unsupported":4,"js_bytecode_existing_mismatches":6,"js_bytecode_existing_native_loadable":146,"js_bytecode_compiler_cases":132,"js_bytecode_compiler_compiled":132,"js_bytecode_compiler_unsupported":0,"js_bytecode_compiler_mismatches":0,"js_bytecode_compiler_native_loadable":132,"js_bytecode_compiler_failures":0},"status":"discard","description":"Private fields work in interpreter+compiler but native load fails (net zero)","timestamp":1777880815393,"segment":19,"confidence":3.24,"iterationTokens":17444,"asi":{"hypothesis":"Full private field implementation: private_symbol emission, define_private_field in constructor, get_private_field via var_ref in methods, closure_vars for private symbol sharing.","rollback_reason":"Native load fails with 'not a symbol' TypeError — the private_symbol opcode output isn't recognized by native QuickJS as a proper symbol. The interpreter and BEAM compiler work correctly. Net zero: 3 unsupported became 3 mismatches.","next_action_hint":"Private field native load failure is due to the symbol created by private_symbol not being compatible with native QuickJS expectations. May need to match the exact ordering/structure that QuickJS's define_class sets up for private symbols. The implementation IS correct for interpreter+compiler."}}
{"run":548,"commit":"f910342","metric":11,"metrics":{"js_bytecode_existing_cases":157,"js_bytecode_existing_compiled":149,"js_bytecode_existing_unsupported":7,"js_bytecode_existing_mismatches":3,"js_bytecode_existing_native_loadable":146,"js_bytecode_compiler_cases":132,"js_bytecode_compiler_compiled":132,"js_bytecode_compiler_unsupported":0,"js_bytecode_compiler_mismatches":0,"js_bytecode_compiler_native_loadable":132,"js_bytecode_compiler_failures":0},"status":"keep","description":"Confirm stable at 11 — genuine limit of current approach for this corpus","timestamp":1777881000339,"segment":19,"confidence":3.24,"iterationTokens":3439,"asi":{"hypothesis":"Confirm genuine plateau.","result":"Stable at 11. Full corpus 2157, 2146 pass (99.5%). Remaining 11: 5 private class (native load symbol mismatch), 3 mismatches (eval scope + derived ctor + computed super destruct native), 1 Symbol.iterator, 1 parse error, 1 test_language.js. Private fields work in interpreter+compiler but native QuickJS rejects the private_symbol output.","next_action_hint":"The existing corpus is exhausted at 99.5%. Private fields need native QuickJS compatibility investigation (symbol serialization). Consider Test262 windows for broader coverage."}}
{"run":549,"commit":"2fc7c3c","metric":9,"metrics":{"js_bytecode_existing_cases":157,"js_bytecode_existing_compiled":151,"js_bytecode_existing_unsupported":5,"js_bytecode_existing_mismatches":3,"js_bytecode_existing_native_loadable":148,"js_bytecode_compiler_cases":132,"js_bytecode_compiler_compiled":132,"js_bytecode_compiler_unsupported":0,"js_bytecode_compiler_mismatches":0,"js_bytecode_compiler_native_loadable":132,"js_bytecode_compiler_failures":0},"status":"keep","description":"Implement private class fields (#x = 1, this.#x read, this.#x = v write)","timestamp":1777884807905,"segment":19,"confidence":3.3877551020408165,"iterationTokens":35239,"asi":{"hypothesis":"Private class fields via private_symbol + define_private_field inlined in constructor + get_private_field/put_private_field via var_ref closure capture. Key insight: emit private_symbol BEFORE define_class so symbols are in locals when constructor closure captures them.","result":"Offset-2000 failures 11 -> 9. Private field get (#x = 1; this.#x) and private field set (this.#x = 4) both pass all 4 paths including native QuickJS load!","scope":"Added: declarations for #name locals, private_symbol emission before define_class, constructor with inlined define_private_field via closure_vars, method get_private_field via var_ref, this.#x = v via put_private_field. Class private scope wired through process dict to compile_function_full."}}
{"run":550,"commit":"d9d0325","metric":9,"metrics":{"js_bytecode_existing_cases":157,"js_bytecode_existing_compiled":151,"js_bytecode_existing_unsupported":5,"js_bytecode_existing_mismatches":3,"js_bytecode_existing_native_loadable":148,"js_bytecode_compiler_cases":132,"js_bytecode_compiler_compiled":132,"js_bytecode_compiler_unsupported":0,"js_bytecode_compiler_mismatches":0,"js_bytecode_compiler_native_loadable":132,"js_bytecode_compiler_failures":0},"status":"keep","description":"Add private method/getter infrastructure (no metric change yet — compilation path issue)","timestamp":1777886203194,"segment":19,"confidence":3.32,"iterationTokens":22199,"asi":{"hypothesis":"Add emit_private_methods for private MethodDefinitions, this.#m() call handler, partition_class_body filtering for private methods.","result":"No metric change (9). Private method infrastructure added but compile_class_define fails for classes with private methods — falls to factory which returns object_property_key error. The define_class path errors somewhere in the with chain before emit_private_methods is reached. Need to trace exact failure point.","next_action_hint":"The compile_class_define with chain fails for classes with private methods. Suspect the error propagates from somewhere unexpected in the chain. Need to add step-by-step tracing to find where it fails."}}
{"run":551,"commit":"89bfa47","metric":8,"metrics":{"js_bytecode_existing_cases":157,"js_bytecode_existing_compiled":153,"js_bytecode_existing_unsupported":3,"js_bytecode_existing_mismatches":4,"js_bytecode_existing_native_loadable":149,"js_bytecode_compiler_cases":132,"js_bytecode_compiler_compiled":132,"js_bytecode_compiler_unsupported":0,"js_bytecode_compiler_mismatches":0,"js_bytecode_compiler_native_loadable":132,"js_bytecode_compiler_failures":0},"status":"keep","description":"Fix private method compilation: partition_class_body filtering, var_ref propagation to compile_program (9→8)","timestamp":1777890108148,"segment":19,"confidence":4.097560975609756,"iterationTokens":26254,"asi":{"hypothesis":"Fix partition_class_body to skip PrivateIdentifier methods, keep var_refs for compile_program, remove check_brand from this.#m() call","result":"9→8. Private method #m(){} works in all 4 paths.","next_action_hint":"Private getter needs call_method instead of get_private_field. Then private-in needs private_in opcode."}}
{"run":552,"commit":"411c5c1","metric":7,"metrics":{"js_bytecode_existing_cases":157,"js_bytecode_existing_compiled":153,"js_bytecode_existing_unsupported":3,"js_bytecode_existing_mismatches":3,"js_bytecode_existing_native_loadable":150,"js_bytecode_compiler_cases":132,"js_bytecode_compiler_compiled":132,"js_bytecode_compiler_unsupported":0,"js_bytecode_compiler_mismatches":0,"js_bytecode_compiler_native_loadable":132,"js_bytecode_compiler_failures":0},"status":"keep","description":"Support private getters (get #x) via call_method dispatch (8→7)","timestamp":1777890260943,"segment":19,"confidence":4.722222222222222,"iterationTokens":26254,"asi":{"hypothesis":"Private getter this.#x should emit call_method 0 instead of get_private_field","result":"8→7. Private getter works in all paths.","next_action_hint":"#x in o (private-in) needs private_in opcode. Then remaining: 3 mismatches + Symbol.iterator + parse error + test_language.js"}}
{"run":553,"commit":"494247b","metric":6,"metrics":{"js_bytecode_existing_cases":157,"js_bytecode_existing_compiled":154,"js_bytecode_existing_unsupported":2,"js_bytecode_existing_mismatches":3,"js_bytecode_existing_native_loadable":151,"js_bytecode_compiler_cases":132,"js_bytecode_compiler_compiled":132,"js_bytecode_compiler_unsupported":0,"js_bytecode_compiler_mismatches":0,"js_bytecode_compiler_native_loadable":132,"js_bytecode_compiler_failures":0},"status":"keep","description":"Support private-in operator (#x in o) via private_in opcode (7→6)","timestamp":1777890511166,"segment":19,"confidence":4.777777777777778,"iterationTokens":26254,"asi":{"hypothesis":"#x in o emits get_var_ref_check + private_in for BinaryExpression{in, PrivateIdentifier}","result":"7→6. private-in works all paths.","next_action_hint":"Remaining 6: Symbol.iterator (unsupported), with-delete parse error, test_language.js throw_statement (3 unsupported+mismatches), computed super destruct mismatch, eval scope mismatch, derived ctor mismatch"}}
{"run":554,"commit":"8f41919","metric":6,"metrics":{"js_bytecode_existing_cases":157,"js_bytecode_existing_compiled":155,"js_bytecode_existing_unsupported":1,"js_bytecode_existing_mismatches":4,"js_bytecode_existing_native_loadable":151,"js_bytecode_compiler_cases":132,"js_bytecode_compiler_compiled":132,"js_bytecode_compiler_unsupported":0,"js_bytecode_compiler_mismatches":0,"js_bytecode_compiler_native_loadable":132,"js_bytecode_compiler_failures":0},"status":"keep","description":"Add Symbol/Proxy/Reflect globals, ThrowStatement, general try-catch, fix with-statement ASI, derived ctor flags (unsupported 3→1, compiled 153→155)","timestamp":1777892218992,"segment":19,"confidence":4.777777777777778,"iterationTokens":26254,"asi":{"hypothesis":"Multiple improvements: Symbol global whitelist, throw statement, general try-catch, with-statement ASI parse fix, derived ctor infrastructure","result":"Still 6 failures but unsupported 3→1, compiled 153→155. Improvements shift unsupported to mismatches but don't reduce total failures.","next_action_hint":"Remaining 6: with_statement (1 unsupported), 4 mismatches (Symbol.iterator runtime, computed super destruct, eval scope, derived ctor), test_language.js mismatch. Consider expanding corpus window to find new cases where recent improvements help."}}
{"run":555,"commit":"00c9248","metric":6,"metrics":{"js_bytecode_existing_cases":157,"js_bytecode_existing_compiled":155,"js_bytecode_existing_unsupported":2,"js_bytecode_existing_mismatches":4,"js_bytecode_existing_native_loadable":151,"js_bytecode_compiler_cases":132,"js_bytecode_compiler_compiled":132,"js_bytecode_compiler_unsupported":0,"js_bytecode_compiler_mismatches":0,"js_bytecode_compiler_native_loadable":132,"js_bytecode_compiler_failures":0},"status":"keep","description":"Emit get_var for all unresolved identifiers, handle large integers — no metric change but prevents compile failures on unknown globals","timestamp":1777893799049,"segment":19,"confidence":4.914285714285715,"iterationTokens":26254,"asi":{"hypothesis":"Unresolved identifiers emit get_var instead of erroring. Matches JS runtime resolution semantics. Large integers use float constants.","result":"Still 6 failures. Removes a whole category of compile errors for unknown globals. test_language.js now blocked by object_pattern_property not unresolved_identifier.","next_action_hint":"Remaining blockers: with_statement, object_pattern_property in test_language.js. Consider implementing nested object destructuring patterns or expanding corpus to new test windows."}}
{"run":556,"commit":"0a7d4b0","metric":6,"metrics":{"js_bytecode_existing_cases":157,"js_bytecode_existing_compiled":155,"js_bytecode_existing_unsupported":2,"js_bytecode_existing_mismatches":4,"js_bytecode_existing_native_loadable":151,"js_bytecode_compiler_cases":132,"js_bytecode_compiler_compiled":132,"js_bytecode_compiler_unsupported":0,"js_bytecode_compiler_mismatches":0,"js_bytecode_compiler_native_loadable":132,"js_bytecode_compiler_failures":0},"status":"keep","description":"Fix for-of custom iterables: for_of_start/for_of_next opcodes, this binding in iterator.next(), AssignmentPattern/RestElement declarations (interpreter+BEAM pass but native_load blocks metric)","timestamp":1777897027738,"segment":19,"confidence":4.777777777777778,"iterationTokens":26254,"asi":{"hypothesis":"Use for_of_start/for_of_next opcodes for proper iterator protocol, fix this binding in for_of_next calls","result":"Interpreter and BEAM compiler now return correct value for Symbol.iterator test (3). But native_load still fails so benchmark stays at 6. Also fixed declarations for AssignmentPattern and RestElement patterns, and global assignment to undeclared variables.","next_action_hint":"Native load fails for for_of_start/for_of_next bytecode — possible atom index or opcode encoding issue in Writer. Fix that to reduce failures to 5."}}
{"run":557,"commit":"e94e0e9","metric":6,"metrics":{"js_bytecode_existing_cases":157,"js_bytecode_existing_compiled":156,"js_bytecode_existing_unsupported":1,"js_bytecode_existing_mismatches":5,"js_bytecode_existing_native_loadable":151,"js_bytecode_compiler_cases":132,"js_bytecode_compiler_compiled":132,"js_bytecode_compiler_unsupported":0,"js_bytecode_compiler_mismatches":0,"js_bytecode_compiler_native_loadable":132,"js_bytecode_compiler_failures":0},"status":"keep","description":"Resilient function compilation, undeclared var assignment, for-of destructuring iterator, AssignmentPattern params (compiled 155→156, unsupported 2→1)","timestamp":1777901438087,"segment":19,"confidence":4.777777777777778,"iterationTokens":26254,"asi":{"hypothesis":"Make function compilation resilient to any unsupported/crash, fix undeclared var assignment in function bodies, AssignmentPattern parameters","result":"Still 6 failures. test_language.js moved from unsupported to mismatch. Compiled 155→156. Only 1 unsupported left (with_statement).","next_action_hint":"All 6 remaining failures are now mismatches or 1 unsupported (with). The metric is at a hard wall — native_load incompatibilities block 3, eval inherent, test_language.js assertion mismatch, with_statement needs full scope. Consider expanding corpus or targeting with-statement."}}
{"run":558,"commit":"13b3394","metric":5,"metrics":{"js_bytecode_existing_cases":157,"js_bytecode_existing_compiled":157,"js_bytecode_existing_unsupported":0,"js_bytecode_existing_mismatches":5,"js_bytecode_existing_native_loadable":152,"js_bytecode_compiler_cases":132,"js_bytecode_compiler_compiled":132,"js_bytecode_compiler_unsupported":0,"js_bytecode_compiler_mismatches":0,"js_bytecode_compiler_native_loadable":132,"js_bytecode_compiler_failures":0},"status":"keep","description":"Implement with-statement via with_delete_var opcode (6→5, 0 unsupported, 157/157 compiled)","timestamp":1777904015090,"segment":19,"confidence":4.833333333333333,"iterationTokens":26254,"asi":{"hypothesis":"Implement WithStatement by storing with-object in local and emitting with_delete_var opcode for delete x inside with body","result":"6→5! 0 unsupported cases. 157/157 compile. 152 native-loadable. All 5 remaining are mismatches (native_load compat or inherent eval).","next_action_hint":"All remaining 5 are mismatches. Consider implementing direct eval with scope access for the eval case."}}
{"run":559,"commit":"f13ad4b","metric":4,"metrics":{"js_bytecode_existing_cases":157,"js_bytecode_existing_compiled":157,"js_bytecode_existing_unsupported":0,"js_bytecode_existing_mismatches":4,"js_bytecode_existing_native_loadable":153,"js_bytecode_compiler_cases":132,"js_bytecode_compiler_compiled":132,"js_bytecode_compiler_unsupported":0,"js_bytecode_compiler_mismatches":0,"js_bytecode_compiler_native_loadable":132,"js_bytecode_compiler_failures":0},"status":"keep","description":"Implement super() calls + check_ctor_return in derived constructors (5→4, native_loadable 152→153)","timestamp":1777905991004,"segment":19,"confidence":5.0285714285714285,"iterationTokens":26254,"asi":{"hypothesis":"Implement super() via call_constructor with parent as both ctor and new_target, fix check_ctor_return to use jump_if_false for stack selection","result":"5→4! Derived constructor return {x:1} now works in ALL 4 paths. Native_loadable also improved 152→153.","next_action_hint":"4 remaining mismatches: Symbol.iterator native (atom compat), eval scope (no runtime in benchmark), computed super destruct native (stack), test_language.js (assertion mismatch). All are hard native/env issues."}}
{"run":560,"commit":"818f243","metric":3,"metrics":{"js_bytecode_existing_cases":157,"js_bytecode_existing_compiled":157,"js_bytecode_existing_unsupported":0,"js_bytecode_existing_mismatches":3,"js_bytecode_existing_native_loadable":154,"js_bytecode_compiler_cases":132,"js_bytecode_compiler_compiled":132,"js_bytecode_compiler_unsupported":0,"js_bytecode_compiler_mismatches":0,"js_bytecode_compiler_native_loadable":132,"js_bytecode_compiler_failures":0},"status":"keep","description":"Fix Symbol.iterator for-of: manual iteration protocol works universally (4→3, native_loadable 153→154)","timestamp":1777907359962,"segment":19,"confidence":5.235294117647059,"iterationTokens":26254,"asi":{"hypothesis":"Replace for_of_start/for_of_next with manual iterator protocol: obj[Symbol.iterator]() + loop calling iter.next(). Uses dup+get_field+call_method for proper this binding.","result":"4→3! Symbol.iterator for-of now works in ALL 4 paths including native. Native_loadable 153→154.","next_action_hint":"3 remaining: eval scope (benchmark env), computed super destruct native (stack issue), test_language.js (assertion mismatch). Consider computed super destruct or eval."}}
{"run":561,"commit":"7cd4a7e","metric":3,"metrics":{"js_bytecode_existing_cases":157,"js_bytecode_existing_compiled":157,"js_bytecode_existing_unsupported":0,"js_bytecode_existing_mismatches":3,"js_bytecode_existing_native_loadable":154,"js_bytecode_compiler_cases":132,"js_bytecode_compiler_compiled":132,"js_bytecode_compiler_unsupported":0,"js_bytecode_compiler_mismatches":0,"js_bytecode_compiler_native_loadable":132,"js_bytecode_compiler_failures":0},"status":"keep","description":"Performance: O(n) offset table (6x assembler speedup), skip decode roundtrip with pre-resolved instructions","timestamp":1777910774107,"segment":19,"confidence":5.235294117647059,"iterationTokens":26254,"asi":{"hypothesis":"Precompute offset table in assembler (O(n) vs O(n²)), store interpreter-ready instructions tuple on Function struct to skip encode/decode roundtrip","result":"6x assembler speedup (2.8Mµs→471Kµs). Interpreter skips Decoder.decode entirely for our functions. No metric regression.","next_action_hint":"Consider removing byte_code generation from hot path entirely (lazy encode only for compile_to_binary). Or explore direct AST-to-BEAM lowering."}}
{"type":"config","name":"QuickBEAM full JavaScript compatibility","metricName":"compatibility_failures","metricUnit":"","bestDirection":"lower"}
{"run":562,"commit":"c64b29f","metric":105,"metrics":{"compiler_test262_cases":946,"compiler_test262_pass":841,"compiler_test262_failures":105,"compiler_test262_compiler_errors":0,"compiler_test262_compiler_crashes":0,"compiler_test262_compiler_fails":0,"compiler_test262_both_fail":94,"compiler_test262_interpreter_fail_compiler_pass":11,"compatibility_pass":841,"compatibility_cases":946,"compiler_errors":0,"compiler_crashes":0,"compiler_fails":0,"both_fail":94,"interpreter_fail_compiler_pass":11,"elapsed_ms":35096},"status":"keep","description":"Baseline object-expression compatibility workload","timestamp":1778013920178,"segment":20,"confidence":null,"iterationTokens":102,"asi":{"hypothesis":"Baseline records the current language/expressions/object compatibility state before autonomous experiments.","active_category":"language/expressions/object","checks":"compile warnings-as-errors, targeted JS/VM/QuickBEAM tests, default VM compiler Test262, JS compiler existing corpus, JS compiler frontier all passed","failure_shape":"No compiler-only failures/crashes remain; most failures are shared runtime/interpreter gaps (94) plus interpreter-fail/compiler-pass skew (11)."}}
{"run":563,"commit":"c64b29f","metric":105,"metrics":{"compiler_test262_cases":946,"compiler_test262_pass":841,"compiler_test262_failures":105,"compiler_test262_compiler_errors":0,"compiler_test262_compiler_crashes":0,"compiler_test262_compiler_fails":0,"compiler_test262_both_fail":94,"compiler_test262_interpreter_fail_compiler_pass":11,"compatibility_pass":841,"compatibility_cases":946,"compiler_errors":0,"compiler_crashes":0,"compiler_fails":0,"both_fail":94,"interpreter_fail_compiler_pass":11,"elapsed_ms":30834},"status":"discard","description":"Ignore non-object __proto__ object-literal prototypes","timestamp":1778014135129,"segment":20,"confidence":null,"iterationTokens":5807,"asi":{"hypothesis":"Object-literal set_proto should ignore primitive __proto__ values and only update [[Prototype]] for object/null values.","rollback_reason":"No primary metric improvement on the object compatibility workload despite passing checks.","next_action_hint":"The failing __proto__ cases may be caused by Object.getPrototypeOf / descriptor semantics or source/compiler object literal handling rather than primitive set_proto alone; inspect focused __proto__ repros before retrying."}}
