{"run":1807,"commit":"6221c3b","metric":41,"metrics":{"compiler_test262_cases":500,"compiler_test262_pass":459,"compiler_test262_failures":41,"compiler_test262_compiler_errors":0,"compiler_test262_compiler_crashes":0,"compiler_test262_compiler_fails":0,"compiler_test262_both_fail":41,"compiler_test262_interpreter_fail_compiler_pass":0,"compatibility_pass":459,"compatibility_cases":500,"compiler_errors":0,"compiler_crashes":0,"compiler_fails":0,"both_fail":41,"interpreter_fail_compiler_pass":0,"elapsed_ms":35542},"status":"keep","description":"Bound Iterator zip padding collection","timestamp":1778905888250,"segment":180,"confidence":18.833333333333332,"iterationTokens":5973,"asi":{"hypothesis":"Iterator.zip longest padding is a per-input list of padding values, so eager validation only needs to pull at most one padding value per input rather than consuming an entire potentially infinite padding iterator.","result":"Iterator failures improved from 43 to 41; basic-longest zip/zipKeyed no longer time out or crash and checks passed.","remaining":"Padding iterators still need IteratorClose when stopped after bounded collection, and broader zip IteratorClose/error ordering failures remain."}}
{"run":1808,"commit":"13d66f2","metric":40,"metrics":{"compiler_test262_cases":500,"compiler_test262_pass":460,"compiler_test262_failures":40,"compiler_test262_compiler_errors":0,"compiler_test262_compiler_crashes":0,"compiler_test262_compiler_fails":0,"compiler_test262_both_fail":40,"compiler_test262_interpreter_fail_compiler_pass":0,"compatibility_pass":460,"compatibility_cases":500,"compiler_errors":0,"compiler_crashes":0,"compiler_fails":0,"both_fail":40,"interpreter_fail_compiler_pass":0,"elapsed_ms":35716},"status":"keep","description":"Close bounded Iterator zip padding","timestamp":1778906079975,"segment":180,"confidence":18.12,"iterationTokens":2750,"asi":{"hypothesis":"When Iterator.zip longest mode gathers only the required padding values, it must close the padding iterator if collection stops before the padding iterator is exhausted.","result":"Iterator failures improved from 41 to 40; focused padding-iteration passes in both modes; checks passed.","remaining":"If padding iterator close itself is abrupt, already-open input iterators still need to be closed in reverse order."}}
{"run":1809,"commit":"044af5f","metric":36,"metrics":{"compiler_test262_cases":500,"compiler_test262_pass":464,"compiler_test262_failures":36,"compiler_test262_compiler_errors":0,"compiler_test262_compiler_crashes":0,"compiler_test262_compiler_fails":0,"compiler_test262_both_fail":36,"compiler_test262_interpreter_fail_compiler_pass":0,"compatibility_pass":464,"compatibility_cases":500,"compiler_errors":0,"compiler_crashes":0,"compiler_fails":0,"both_fail":36,"interpreter_fail_compiler_pass":0,"elapsed_ms":35642},"status":"keep","description":"Close zip inputs when padding close throws","timestamp":1778906289364,"segment":180,"confidence":17.92156862745098,"iterationTokens":2935,"asi":{"hypothesis":"If closing the bounded padding iterator is abrupt, Iterator.zip construction must close already-created input iterator records in reverse order while preserving the original padding abrupt completion.","result":"Iterator failures improved from 40 to 36; focused padding close abrupt completion passes in both modes; checks passed.","remaining":"Zip construction still needs similar reverse closing for abrupt inner GetIteratorFlattenable and later iteration-step/value errors."}}
{"run":1810,"commit":"044af5f","metric":38,"metrics":{"compiler_test262_cases":500,"compiler_test262_pass":462,"compiler_test262_failures":38,"compiler_test262_compiler_errors":0,"compiler_test262_compiler_crashes":0,"compiler_test262_compiler_fails":0,"compiler_test262_both_fail":38,"compiler_test262_interpreter_fail_compiler_pass":0,"compatibility_pass":462,"compatibility_cases":500,"compiler_errors":0,"compiler_crashes":0,"compiler_fails":0,"both_fail":38,"interpreter_fail_compiler_pass":0,"elapsed_ms":35678},"status":"discard","description":"Interleave Iterator zip input record creation","timestamp":1778906628516,"segment":180,"confidence":17.576923076923077,"iterationTokens":11210,"asi":{"hypothesis":"Building Iterator.zip input records while stepping the outer iterables iterator should fix GetIteratorFlattenable abrupt-order cases and primitive rejection without waiting for full zip iteration semantics.","rollback_reason":"Focused GetIteratorFlattenable abrupt close ordering passed, but active Iterator regressed from 36 to 38 because stricter inner primitive handling broke broad basic zip sequence cases represented internally as primitive/list values.","next_action_hint":"Retry only after separating internal list-backed arrays from true JS primitive values and preserving existing basic-shortest/basic-longest behavior."}}
{"run":1811,"commit":"829920c","metric":34,"metrics":{"compiler_test262_cases":500,"compiler_test262_pass":466,"compiler_test262_failures":34,"compiler_test262_compiler_errors":0,"compiler_test262_compiler_crashes":0,"compiler_test262_compiler_fails":0,"compiler_test262_both_fail":34,"compiler_test262_interpreter_fail_compiler_pass":0,"compatibility_pass":466,"compatibility_cases":500,"compiler_errors":0,"compiler_crashes":0,"compiler_fails":0,"both_fail":34,"interpreter_fail_compiler_pass":0,"elapsed_ms":35897},"status":"keep","description":"Format Iterator return observations correctly","timestamp":1778906909471,"segment":180,"confidence":17.653846153846153,"iterationTokens":5142,"asi":{"hypothesis":"Iterator.from return-observation tests rely on correct well-known Symbol.keyFor semantics and Unicode-regexp matching of ASCII identifier property names. Returning undefined for unregistered well-known symbols and handling ASCII identifier regex under /u should fix those semantic observations.","result":"Iterator failures improved from 36 to 34; focused Iterator.from return-method observation tests pass in both modes; checks passed.","remaining":"The regexp fix is intentionally limited to the common ASCII identifier pattern until broader Unicode RegExp character-class handling can be addressed safely."}}
{"run":1812,"commit":"34bce4e","metric":30,"metrics":{"compiler_test262_cases":500,"compiler_test262_pass":470,"compiler_test262_failures":30,"compiler_test262_compiler_errors":0,"compiler_test262_compiler_crashes":0,"compiler_test262_compiler_fails":0,"compiler_test262_both_fail":30,"compiler_test262_interpreter_fail_compiler_pass":0,"compatibility_pass":470,"compatibility_cases":500,"compiler_errors":0,"compiler_crashes":0,"compiler_fails":0,"both_fail":30,"interpreter_fail_compiler_pass":0,"elapsed_ms":35841},"status":"keep","description":"Filter zipKeyed inputs by descriptors","timestamp":1778907143947,"segment":180,"confidence":17.807692307692307,"iterationTokens":5289,"asi":{"hypothesis":"Iterator.zipKeyed should snapshot OwnPropertyKeys, then consult each current own descriptor for enumerability before reading the value, preserving symbol keys and skipping deleted, non-enumerable, and undefined-valued properties.","result":"Iterator failures improved from 34 to 30; focused zipKeyed symbol/undefined/deleted/enumerable cases pass in both modes; checks passed.","remaining":"zipKeyed still needs abrupt descriptor/get/inner-iterator close ordering and general zip iteration IteratorClose semantics."}}
{"run":1813,"commit":"ce332e2","metric":27,"metrics":{"compiler_test262_cases":500,"compiler_test262_pass":473,"compiler_test262_failures":27,"compiler_test262_compiler_errors":0,"compiler_test262_compiler_crashes":0,"compiler_test262_compiler_fails":0,"compiler_test262_both_fail":27,"compiler_test262_interpreter_fail_compiler_pass":0,"compatibility_pass":473,"compatibility_cases":500,"compiler_errors":0,"compiler_crashes":0,"compiler_fails":0,"both_fail":27,"interpreter_fail_compiler_pass":0,"elapsed_ms":35657},"status":"keep","description":"Close zipKeyed inputs during key processing","timestamp":1778907488937,"segment":180,"confidence":17.58490566037736,"iterationTokens":8596,"asi":{"hypothesis":"Iterator.zipKeyed processes keys and builds iterator records in one pass; if descriptor lookup, value get, or flattenable iterator creation is abrupt, previously-created iterator records must close in reverse order.","result":"Iterator failures improved from 30 to 27; focused getOwnProperty and GetIteratorFlattenable abrupt close-order cases pass in both modes; checks passed.","remaining":"zipKeyed property Get abrupts and outer primitive validation still fail, and zip/zipKeyed per-step IteratorClose semantics remain incomplete."}}
{"run":1814,"commit":"9313832","metric":26,"metrics":{"compiler_test262_cases":500,"compiler_test262_pass":474,"compiler_test262_failures":26,"compiler_test262_compiler_errors":0,"compiler_test262_compiler_crashes":0,"compiler_test262_compiler_fails":0,"compiler_test262_both_fail":26,"compiler_test262_interpreter_fail_compiler_pass":0,"compatibility_pass":474,"compatibility_cases":500,"compiler_errors":0,"compiler_crashes":0,"compiler_fails":0,"both_fail":26,"interpreter_fail_compiler_pass":0,"elapsed_ms":35934},"status":"keep","description":"Close zipKeyed inputs when value get throws","timestamp":1778907697569,"segment":180,"confidence":17.296296296296298,"iterationTokens":3311,"asi":{"hypothesis":"Iterator.zipKeyed must close already-created iterator records if reading an enumerable property value throws during key processing.","result":"Iterator failures improved from 27 to 26; focused zipKeyed value-get abrupt close-order test passes in both modes; checks passed.","remaining":"Remaining zipKeyed failures are now mostly primitive validation and per-step IteratorClose semantics shared with Iterator.zip."}}
{"run":1815,"commit":"c609124","metric":22,"metrics":{"compiler_test262_cases":500,"compiler_test262_pass":478,"compiler_test262_failures":22,"compiler_test262_compiler_errors":0,"compiler_test262_compiler_crashes":0,"compiler_test262_compiler_fails":0,"compiler_test262_both_fail":22,"compiler_test262_interpreter_fail_compiler_pass":0,"compatibility_pass":478,"compatibility_cases":500,"compiler_errors":0,"compiler_crashes":0,"compiler_fails":0,"both_fail":22,"interpreter_fail_compiler_pass":0,"elapsed_ms":36226},"status":"keep","description":"Close remaining zip inputs on step errors","timestamp":1778907958183,"segment":180,"confidence":17.12727272727273,"iterationTokens":4383,"asi":{"hypothesis":"During Iterator.zip/zipKeyed advancement, if an iterator next/result-value operation throws, later iterator records in the zip list must be closed in reverse order while the throwing current iterator is not closed.","result":"Iterator failures improved from 26 to 22; focused zip and zipKeyed iterator-step-value abrupt close-order tests pass in both modes; checks passed.","remaining":"Shortest/strict/longest completion close semantics and primitive/outer construction validation remain incomplete."}}
{"run":1816,"commit":"b664724","metric":20,"metrics":{"compiler_test262_cases":500,"compiler_test262_pass":480,"compiler_test262_failures":20,"compiler_test262_compiler_errors":0,"compiler_test262_compiler_crashes":0,"compiler_test262_compiler_fails":0,"compiler_test262_both_fail":20,"compiler_test262_interpreter_fail_compiler_pass":0,"compatibility_pass":480,"compatibility_cases":500,"compiler_errors":0,"compiler_crashes":0,"compiler_fails":0,"both_fail":20,"interpreter_fail_compiler_pass":0,"elapsed_ms":36195},"status":"keep","description":"Close open zip inputs in shortest mode","timestamp":1778908251534,"segment":180,"confidence":16.892857142857142,"iterationTokens":4954,"asi":{"hypothesis":"In shortest mode, once an input iterator reports done, Iterator.zip must stop stepping later inputs and close all still-open records in reverse order. Internal list-backed iterators also need an own benign return method so closing them does not hit wrapper-only return semantics.","result":"Iterator failures improved from 22 to 20; focused zip/zipKeyed shortest close-abrupt tests and basic-shortest pass; checks passed.","remaining":"Strict and longest close semantics plus construction-time primitive/flattenable ordering failures remain."}}
{"run":1817,"commit":"62237f7","metric":18,"metrics":{"compiler_test262_cases":500,"compiler_test262_pass":482,"compiler_test262_failures":18,"compiler_test262_compiler_errors":0,"compiler_test262_compiler_crashes":0,"compiler_test262_compiler_fails":0,"compiler_test262_both_fail":16,"compiler_test262_interpreter_fail_compiler_pass":0,"compatibility_pass":482,"compatibility_cases":500,"compiler_errors":0,"compiler_crashes":0,"compiler_fails":0,"both_fail":16,"interpreter_fail_compiler_pass":0,"elapsed_ms":35828},"status":"keep","description":"Close open zip inputs in strict mode","timestamp":1778908497747,"segment":180,"confidence":16.666666666666668,"iterationTokens":5158,"asi":{"hypothesis":"In strict mode, Iterator.zip must detect length mismatches while stepping sequentially, stop at the first mismatch, and close the still-open records in reverse order while throwing TypeError.","result":"Iterator failures improved from 20 to 18; focused zip and zipKeyed strict close-order tests pass in both modes; checks passed.","remaining":"Longest-mode close semantics, zip construction ordering/primitive validation, and concat return reentrancy remain."}}
{"run":1818,"commit":"daa4b87","metric":17,"metrics":{"compiler_test262_cases":500,"compiler_test262_pass":483,"compiler_test262_failures":17,"compiler_test262_compiler_errors":0,"compiler_test262_compiler_crashes":0,"compiler_test262_compiler_fails":0,"compiler_test262_both_fail":16,"compiler_test262_interpreter_fail_compiler_pass":0,"compatibility_pass":483,"compatibility_cases":500,"compiler_errors":0,"compiler_crashes":0,"compiler_fails":0,"both_fail":16,"interpreter_fail_compiler_pass":0,"elapsed_ms":38941},"status":"keep","description":"Complete strict zip steps without mismatch","timestamp":1778908703291,"segment":180,"confidence":16.413793103448278,"iterationTokens":2731,"asi":{"hypothesis":"The strict-mode sequential zip stepper needs a normal completion path when every iterator yields a value; missing that clause turned basic strict cases into interpreter crashes.","result":"Iterator failures improved from 18 to 17; focused basic-strict passes and checks passed.","remaining":"Remaining zip failures are real close/iteration semantics rather than the strict normal-path crash."}}
{"run":1819,"commit":"8c1f1f8","metric":14,"metrics":{"compiler_test262_cases":500,"compiler_test262_pass":486,"compiler_test262_failures":14,"compiler_test262_compiler_errors":0,"compiler_test262_compiler_crashes":0,"compiler_test262_compiler_fails":0,"compiler_test262_both_fail":14,"compiler_test262_interpreter_fail_compiler_pass":0,"compatibility_pass":486,"compatibility_cases":500,"compiler_errors":0,"compiler_crashes":0,"compiler_fails":0,"both_fail":14,"interpreter_fail_compiler_pass":0,"elapsed_ms":36185},"status":"keep","description":"Read zip values during iterator steps","timestamp":1778909091784,"segment":180,"confidence":15.966666666666667,"iterationTokens":23454,"asi":{"hypothesis":"Iterator.zip should read each iterator result's value immediately after observing done=false for that iterator, instead of collecting all done flags and reading values later.","result":"Iterator failures improved from 17 to 14; focused zip and zipKeyed iterator-zip-iteration ordering cases pass in both modes; checks passed.","remaining":"Residuals now focus on zip construction primitive/flattenable validation, longest close-abrupt semantics, suspended generator close cases, and concat return reentrancy."}}
{"run":1820,"commit":"8bd45fa","metric":8,"metrics":{"compiler_test262_cases":500,"compiler_test262_pass":492,"compiler_test262_failures":8,"compiler_test262_compiler_errors":0,"compiler_test262_compiler_crashes":0,"compiler_test262_compiler_fails":0,"compiler_test262_both_fail":8,"compiler_test262_interpreter_fail_compiler_pass":0,"compatibility_pass":492,"compatibility_cases":500,"compiler_errors":0,"compiler_crashes":0,"compiler_fails":0,"both_fail":8,"interpreter_fail_compiler_pass":0,"elapsed_ms":36261},"status":"keep","description":"Track open zip inputs for helper return","timestamp":1778909399653,"segment":180,"confidence":15.64516129032258,"iterationTokens":6902,"asi":{"hypothesis":"Iterator.zip helper return must close exactly the currently open input iterator records after prior next steps; longest mode must drop records that already reported done while shortest/strict successful yields keep all records open.","result":"Iterator failures improved from 14 to 8; focused zip/zipKeyed return close-abrupt and longest close-abrupt cases pass in both modes; checks passed.","remaining":"Residual is mostly zip construction interleaving/primitive validation and suspended generator close behavior plus concat return reentrancy."}}
{"run":1821,"commit":"aedd556","metric":6,"metrics":{"compiler_test262_cases":500,"compiler_test262_pass":494,"compiler_test262_failures":6,"compiler_test262_compiler_errors":0,"compiler_test262_compiler_crashes":0,"compiler_test262_compiler_fails":0,"compiler_test262_both_fail":6,"compiler_test262_interpreter_fail_compiler_pass":0,"compatibility_pass":494,"compatibility_cases":500,"compiler_errors":0,"compiler_crashes":0,"compiler_fails":0,"both_fail":6,"interpreter_fail_compiler_pass":0,"elapsed_ms":37118},"status":"keep","description":"Reject primitive Iterator zip inputs safely","timestamp":1778909614966,"segment":180,"confidence":14.984615384615385,"iterationTokens":2554,"asi":{"hypothesis":"After zip close semantics are stable, Iterator.zip/zipKeyed can reject missing or primitive outer iterables before reading options while still allowing QuickBEAM's internal list-backed arrays.","result":"Iterator failures improved from 8 to 6; focused zip and zipKeyed primitive outer-input tests pass in both modes; checks passed.","remaining":"Residual is now concat return reentrancy, zip construction GetIteratorFlattenable/IteratorStepValue close ordering, and suspended generator close cases."}}
{"run":1822,"commit":"4c38d2a","metric":4,"metrics":{"compiler_test262_cases":500,"compiler_test262_pass":496,"compiler_test262_failures":4,"compiler_test262_compiler_errors":0,"compiler_test262_compiler_crashes":0,"compiler_test262_compiler_fails":0,"compiler_test262_both_fail":4,"compiler_test262_interpreter_fail_compiler_pass":0,"compatibility_pass":496,"compatibility_cases":500,"compiler_errors":0,"compiler_crashes":0,"compiler_fails":0,"both_fail":4,"interpreter_fail_compiler_pass":0,"elapsed_ms":36338},"status":"keep","description":"Interleave Iterator zip input records safely","timestamp":1778909887633,"segment":180,"confidence":14.382352941176471,"iterationTokens":4326,"asi":{"hypothesis":"After preserving internal list-backed array inputs and stabilizing zip close semantics, Iterator.zip can build inner iterator records while stepping the outer iterables iterator, closing prior records and the outer iterator on flattenable/step-value abrupt completions.","result":"Iterator failures improved from 6 to 4; focused zip GetIteratorFlattenable and outer IteratorStepValue abrupt close-order tests pass in both modes; checks passed.","remaining":"Residual active cases are zip iterables-iteration receiver/call details, suspended-yield close tests, and concat return reentrancy."}}
{"run":1823,"commit":"047fb42","metric":3,"metrics":{"compiler_test262_cases":500,"compiler_test262_pass":497,"compiler_test262_failures":3,"compiler_test262_compiler_errors":0,"compiler_test262_compiler_crashes":0,"compiler_test262_compiler_fails":0,"compiler_test262_both_fail":3,"compiler_test262_interpreter_fail_compiler_pass":0,"compatibility_pass":497,"compatibility_cases":500,"compiler_errors":0,"compiler_crashes":0,"compiler_fails":0,"both_fail":3,"interpreter_fail_compiler_pass":0,"elapsed_ms":36501},"status":"keep","description":"Defer zip inner next callability checks","timestamp":1778910144921,"segment":180,"confidence":14,"iterationTokens":3007,"asi":{"hypothesis":"GetIteratorFlattenable for Iterator.zip creates direct iterator records without validating next callability, so non-callable inner next values should not throw during zip construction.","result":"Iterator failures improved from 4 to 3; focused zip/iterables-iteration passes in both modes; checks passed.","remaining":"Residual active cases are concat return reentrancy and suspended-yield zip close behavior."}}
{"run":1824,"commit":"047fb42","metric":3,"metrics":{"compiler_test262_cases":500,"compiler_test262_pass":497,"compiler_test262_failures":3,"compiler_test262_compiler_errors":0,"compiler_test262_compiler_crashes":0,"compiler_test262_compiler_fails":0,"compiler_test262_both_fail":3,"compiler_test262_interpreter_fail_compiler_pass":0,"compatibility_pass":497,"compatibility_cases":500,"compiler_errors":0,"compiler_crashes":0,"compiler_fails":0,"both_fail":3,"interpreter_fail_compiler_pass":0,"elapsed_ms":36449},"status":"discard","description":"Reject reentrant helper returns after zip fixes","timestamp":1778910366589,"segment":180,"confidence":13.61111111111111,"iterationTokens":4202,"asi":{"hypothesis":"Now that zip helpers track open iterators, helper return can set executing=true while closing inputs so reentrant next/return calls throw TypeError for concat and suspended-yield zip tests.","rollback_reason":"Focused concat return reentrancy and suspended-yield zip close tests passed in both modes, but active Iterator primary stayed unchanged at 3.","next_action_hint":"Do not land helper-return reentrancy alone; pair it only if it reduces a future active slice or if the current residual three are already solved by another change."}}
