{"run":1395,"commit":"5062039","metric":78,"metrics":{"compiler_test262_cases":2900,"compiler_test262_pass":2822,"compiler_test262_failures":78,"compiler_test262_compiler_errors":0,"compiler_test262_compiler_crashes":0,"compiler_test262_compiler_fails":8,"compiler_test262_both_fail":64,"compiler_test262_interpreter_fail_compiler_pass":1,"compatibility_pass":2822,"compatibility_cases":2900,"compiler_errors":0,"compiler_crashes":0,"compiler_fails":8,"both_fail":64,"interpreter_fail_compiler_pass":1,"elapsed_ms":203056},"status":"keep","description":"Invoke Array toLocaleString elements","timestamp":1778736980398,"segment":117,"confidence":9,"iterationTokens":2744,"asi":{"hypothesis":"Array.prototype.toLocaleString should call each non-nullish element's toLocaleString method and stringify the result instead of delegating directly to join.","fixed_focus":["Array/prototype/toLocaleString/S15.4.4.3_A1_T1.js","Array/prototype/toLocaleString/invoke-element-tolocalestring.js"],"remaining_cluster":"Only one broad failure improved; remaining toLocaleString cases likely need primitive wrapper getters and mutation/length observation details."}}
{"run":1396,"commit":"b66e601","metric":56,"metrics":{"compiler_test262_cases":2900,"compiler_test262_pass":2844,"compiler_test262_failures":56,"compiler_test262_compiler_errors":0,"compiler_test262_compiler_crashes":0,"compiler_test262_compiler_fails":8,"compiler_test262_both_fail":42,"compiler_test262_interpreter_fail_compiler_pass":1,"compatibility_pass":2844,"compatibility_cases":2900,"compiler_errors":0,"compiler_crashes":0,"compiler_fails":8,"both_fail":42,"interpreter_fail_compiler_pass":1,"elapsed_ms":203381},"status":"keep","description":"Expose change-array-by-copy methods on Array prototype","timestamp":1778737435397,"segment":117,"confidence":6.888888888888889,"iterationTokens":30462,"asi":{"hypothesis":"Array.prototype.toReversed/toSorted/toSpliced must be actual prototype properties with normal descriptors so name/length/property/constructability tests and calls through the cached prototype observe them.","fixed_focus":["Array/prototype/toReversed/length.js","Array/prototype/toReversed/name.js","Array/prototype/toSorted/length.js","Array/prototype/toSpliced/elements-read-in-order.js"],"semantic_scope":"Add the three change-array-by-copy methods to the concrete Array.prototype method map; semantic bodies were already installed."}}
{"run":1397,"commit":"2158ebb","metric":54,"metrics":{"compiler_test262_cases":2900,"compiler_test262_pass":2846,"compiler_test262_failures":54,"compiler_test262_compiler_errors":0,"compiler_test262_compiler_crashes":0,"compiler_test262_compiler_fails":8,"compiler_test262_both_fail":40,"compiler_test262_interpreter_fail_compiler_pass":1,"compatibility_pass":2846,"compatibility_cases":2900,"compiler_errors":0,"compiler_crashes":0,"compiler_fails":8,"both_fail":40,"interpreter_fail_compiler_pass":1,"elapsed_ms":202064},"status":"keep","description":"Propagate Array sort comparator throws","timestamp":1778737859034,"segment":117,"confidence":3.6666666666666665,"iterationTokens":5684,"asi":{"hypothesis":"Array sort and toSorted comparators must propagate abrupt completions immediately; Runtime.call_callback swallowed builtin throws and let Enum.sort keep comparing.","fixed_focus":["Array/prototype/toSorted/comparefn-stop-after-error.js","Array/prototype/sort/precise-comparefn-throws.js"],"semantic_scope":"Use invoke_with_receiver for comparator calls so JS throws are not converted to undefined."}}
{"run":1398,"commit":"2158eb","metric":54,"metrics":{"compiler_test262_cases":2900,"compiler_test262_pass":2846,"compiler_test262_failures":54,"compiler_test262_compiler_errors":0,"compiler_test262_compiler_crashes":0,"compiler_test262_compiler_fails":8,"compiler_test262_both_fail":40,"compiler_test262_interpreter_fail_compiler_pass":1,"compatibility_pass":2846,"compatibility_cases":2900,"compiler_errors":0,"compiler_crashes":0,"compiler_fails":8,"both_fail":40,"interpreter_fail_compiler_pass":1,"elapsed_ms":202622},"status":"discard","description":"Route Object toLocaleString through toString lookup","timestamp":1778738498678,"segment":117,"confidence":2.64,"iterationTokens":16071,"asi":{"hypothesis":"Object.prototype.toLocaleString should invoke this.toString, which might fix Array.prototype.toLocaleString primitive element override cases.","rollback_reason":"Broad Array 2900 primary stayed unchanged at 54 and focused primitive Boolean toLocaleString cases still failed because primitive wrapper prototype overrides were not observed.","next_action_hint":"Inspect Boolean/String/Number primitive wrapper property lookup and prototype override storage before retrying toLocaleString primitive cases; Object.toLocaleString alone is insufficient."}}
{"run":1399,"commit":"5f7ad87","metric":52,"metrics":{"compiler_test262_cases":2900,"compiler_test262_pass":2848,"compiler_test262_failures":52,"compiler_test262_compiler_errors":0,"compiler_test262_compiler_crashes":0,"compiler_test262_compiler_fails":8,"compiler_test262_both_fail":38,"compiler_test262_interpreter_fail_compiler_pass":1,"compatibility_pass":2848,"compatibility_cases":2900,"compiler_errors":0,"compiler_crashes":0,"compiler_fails":8,"both_fail":38,"interpreter_fail_compiler_pass":1,"elapsed_ms":203105},"status":"keep","description":"Describe Array splice builtin metadata","timestamp":1778738897425,"segment":117,"confidence":8.75,"iterationTokens":3109,"asi":{"hypothesis":"Array.prototype.splice should expose builtin metadata matching spec: length 2 and non-constructability.","fixed_focus":["Array/prototype/splice/length.js","Array/prototype/splice/not-a-constructor.js"],"semantic_scope":"Add named metadata for splice so descriptor reflection and constructor checks match other Array prototype methods."}}
{"run":1400,"commit":"7d51048","metric":48,"metrics":{"compiler_test262_cases":2900,"compiler_test262_pass":2852,"compiler_test262_failures":48,"compiler_test262_compiler_errors":0,"compiler_test262_compiler_crashes":0,"compiler_test262_compiler_fails":8,"compiler_test262_both_fail":34,"compiler_test262_interpreter_fail_compiler_pass":1,"compatibility_pass":2852,"compatibility_cases":2900,"compiler_errors":0,"compiler_crashes":0,"compiler_fails":8,"both_fail":34,"interpreter_fail_compiler_pass":1,"elapsed_ms":203514},"status":"keep","description":"Allow generic splice safe-integer lengths","timestamp":1778739284883,"segment":117,"confidence":7.8,"iterationTokens":3386,"asi":{"hypothesis":"Generic Array.prototype.splice length updates are bounded by the safe-integer limit, not the Array exotic 2^32-1 length limit; ordinary array-like receivers may keep clamped 2^53-1 lengths.","fixed_focus":["Array/prototype/splice/clamps-length-to-integer-limit.js","Array/prototype/splice/length-and-deleteCount-exceeding-integer-limit.js"],"semantic_scope":"Only the computed final receiver length check changes from max array length to max safe integer; removed-result Array creation still uses Array length bounds."}}
{"run":1401,"commit":"8331aac","metric":47,"metrics":{"compiler_test262_cases":2900,"compiler_test262_pass":2853,"compiler_test262_failures":47,"compiler_test262_compiler_errors":0,"compiler_test262_compiler_crashes":0,"compiler_test262_compiler_fails":8,"compiler_test262_both_fail":33,"compiler_test262_interpreter_fail_compiler_pass":1,"compatibility_pass":2853,"compatibility_cases":2900,"compiler_errors":0,"compiler_crashes":0,"compiler_fails":8,"both_fail":33,"interpreter_fail_compiler_pass":1,"elapsed_ms":202261},"status":"keep","description":"Throw on getter-only Array length writes","timestamp":1778739688560,"segment":117,"confidence":6.666666666666667,"iterationTokens":9212,"asi":{"hypothesis":"Array methods that perform Set(O, 'length', ..., true) must throw when the receiver has an own getter-only length accessor, even outside strict mode.","fixed_focus":"Array/prototype/splice/S15.4.4.12_A6.1_T3.js","remaining_length_cluster":"Function receiver length failures still need callable length descriptor handling; this change only covers object-map getter-only accessors."}}
{"type":"config","name":"Array Test262 compatibility 3000-case expansion","metricName":"compatibility_failures","metricUnit":"","bestDirection":"lower"}
{"run":1402,"commit":"ba65221","metric":84,"metrics":{"compiler_test262_cases":2991,"compiler_test262_pass":2907,"compiler_test262_failures":84,"compiler_test262_compiler_errors":0,"compiler_test262_compiler_crashes":0,"compiler_test262_compiler_fails":8,"compiler_test262_both_fail":70,"compiler_test262_interpreter_fail_compiler_pass":1,"compatibility_pass":2907,"compatibility_cases":2991,"compiler_errors":0,"compiler_crashes":0,"compiler_fails":8,"both_fail":70,"interpreter_fail_compiler_pass":1,"elapsed_ms":209980},"status":"keep","description":"Baseline Array 3000-case expansion","timestamp":1778740094697,"segment":118,"confidence":null,"iterationTokens":129,"asi":{"hypothesis":"Expand Array workload to the full available bounded built-ins/Array set after reducing the 2900 slice to 47 failures; remaining added cases likely expose toSpliced/unshift/value methods.","workload":"AUTORESEARCH_TEST262_CATEGORY=built-ins/Array TEST262_LIMIT=3000 TEST262_ERROR_LIMIT=1960 ./autoresearch.sh","baseline_note":"The category contains 2991 cases in this setup; full bounded Array baseline is 84 failures with compiler-only still at 8 and one interpreter-only failure."}}
{"run":1403,"commit":"238d010","metric":71,"metrics":{"compiler_test262_cases":2991,"compiler_test262_pass":2920,"compiler_test262_failures":71,"compiler_test262_compiler_errors":0,"compiler_test262_compiler_crashes":0,"compiler_test262_compiler_fails":8,"compiler_test262_both_fail":57,"compiler_test262_interpreter_fail_compiler_pass":1,"compatibility_pass":2920,"compatibility_cases":2991,"compiler_errors":0,"compiler_crashes":0,"compiler_fails":8,"both_fail":57,"interpreter_fail_compiler_pass":1,"elapsed_ms":211890},"status":"keep","description":"Apply generic Array unshift semantics","timestamp":1778740498597,"segment":118,"confidence":null,"iterationTokens":4877,"asi":{"hypothesis":"Array.prototype.unshift should use generic LengthOfArrayLike, safe-integer length validation, descending indexed Get/Set/Delete moves, inserted argument writes, string receiver rejection, and Throw=true final length set.","fixed_focus":["Array/prototype/unshift/S15.4.4.13_A2_T1.js","Array/prototype/unshift/S15.4.4.13_A4_T1.js","Array/prototype/unshift/throws-with-string-receiver.js"],"remaining_cluster":"Unshift basics improved; remaining full Array failures are now mostly old typed-array/sparse/proxy/frozen-length cases plus Array.prototype.with."}}
{"run":1404,"commit":"8951534","metric":52,"metrics":{"compiler_test262_cases":2991,"compiler_test262_pass":2939,"compiler_test262_failures":52,"compiler_test262_compiler_errors":0,"compiler_test262_compiler_crashes":0,"compiler_test262_compiler_fails":8,"compiler_test262_both_fail":38,"compiler_test262_interpreter_fail_compiler_pass":1,"compatibility_pass":2939,"compatibility_cases":2991,"compiler_errors":0,"compiler_crashes":0,"compiler_fails":8,"both_fail":38,"interpreter_fail_compiler_pass":1,"elapsed_ms":212738},"status":"keep","description":"Implement Array.prototype.with","timestamp":1778740926464,"segment":118,"confidence":2.4615384615384617,"iterationTokens":2778,"asi":{"hypothesis":"Array.prototype.with is a change-array-by-copy method that creates a fresh ordinary Array, validates relative indexes, reads all non-replaced source elements with Get, writes the replacement without reading the replaced index, and exposes length/name/non-constructability metadata.","fixed_focus":["Array/prototype/with/immutable.js","Array/prototype/with/index-negative.js","Array/prototype/with/no-get-replaced-index.js","Array/prototype/with/length.js"],"remaining_cluster":"with cluster mostly resolved; remaining failures are the longstanding typed-array/sparse/proxy/frozen-length cases plus explicit undefined hole representation."}}
{"run":1405,"commit":"3c7664c","metric":51,"metrics":{"compiler_test262_cases":2991,"compiler_test262_pass":2940,"compiler_test262_failures":51,"compiler_test262_compiler_errors":0,"compiler_test262_compiler_crashes":0,"compiler_test262_compiler_fails":8,"compiler_test262_both_fail":37,"compiler_test262_interpreter_fail_compiler_pass":1,"compatibility_pass":2940,"compatibility_cases":2991,"compiler_errors":0,"compiler_crashes":0,"compiler_fails":8,"both_fail":37,"interpreter_fail_compiler_pass":1,"elapsed_ms":210901},"status":"keep","description":"Align Array unscopables copy methods","timestamp":1778741336777,"segment":118,"confidence":3.3,"iterationTokens":4071,"asi":{"hypothesis":"Array.prototype[Symbol.unscopables] includes toReversed/toSorted/toSpliced but not Array.prototype.with in the current Test262 expectation set.","fixed_focus":"Array/prototype/Symbol.unscopables/change-array-by-copy.js","semantic_scope":"Remove with from the unscopables map while keeping the method itself installed on Array.prototype."}}
{"run":1406,"commit":"31b7428","metric":50,"metrics":{"compiler_test262_cases":2991,"compiler_test262_pass":2941,"compiler_test262_failures":50,"compiler_test262_compiler_errors":0,"compiler_test262_compiler_crashes":0,"compiler_test262_compiler_fails":8,"compiler_test262_both_fail":36,"compiler_test262_interpreter_fail_compiler_pass":1,"compatibility_pass":2941,"compatibility_cases":2991,"compiler_errors":0,"compiler_crashes":0,"compiler_fails":8,"both_fail":36,"interpreter_fail_compiler_pass":1,"elapsed_ms":211250},"status":"keep","description":"Fallback Array toString for primitive receivers","timestamp":1778741895195,"segment":118,"confidence":17,"iterationTokens":6756,"asi":{"hypothesis":"Array.prototype.toString should call receiver.join only when callable, otherwise it should use Object.prototype.toString-style tag formatting; primitive boolean receivers therefore produce [object Boolean].","fixed_focus":"Array/prototype/toString/call-with-boolean.js","remaining_toString":"non-callable-join-string-tag still fails for proxy/explicit undefined join because proxy/array own undefined presence falls through to Array.prototype.join."}}
{"run":1407,"commit":"29e9ad1","metric":49,"metrics":{"compiler_test262_cases":2991,"compiler_test262_pass":2942,"compiler_test262_failures":49,"compiler_test262_compiler_errors":0,"compiler_test262_compiler_crashes":0,"compiler_test262_compiler_fails":8,"compiler_test262_both_fail":35,"compiler_test262_interpreter_fail_compiler_pass":1,"compatibility_pass":2942,"compatibility_cases":2991,"compiler_errors":0,"compiler_crashes":0,"compiler_fails":8,"both_fail":35,"interpreter_fail_compiler_pass":1,"elapsed_ms":211036},"status":"keep","description":"Validate toSpliced safe-integer length","timestamp":1778742273673,"segment":118,"confidence":17.5,"iterationTokens":2208,"asi":{"hypothesis":"Array.prototype.toSpliced first rejects result lengths above the safe-integer limit with TypeError, while ordinary Array creation rejects lengths above 2^32-1 with RangeError.","fixed_focus":"Array/prototype/toSpliced/length-exceeding-array-length-limit.js","semantic_scope":"Add the safe-integer TypeError check before ArrayCreate-style result allocation for toSpliced."}}
{"run":1408,"commit":"5ef0bf7","metric":48,"metrics":{"compiler_test262_cases":2991,"compiler_test262_pass":2943,"compiler_test262_failures":48,"compiler_test262_compiler_errors":0,"compiler_test262_compiler_crashes":0,"compiler_test262_compiler_fails":8,"compiler_test262_both_fail":34,"compiler_test262_interpreter_fail_compiler_pass":1,"compatibility_pass":2943,"compatibility_cases":2991,"compiler_errors":0,"compiler_crashes":0,"compiler_fails":8,"both_fail":34,"interpreter_fail_compiler_pass":1,"elapsed_ms":210582},"status":"keep","description":"Throw on read-only unshift writes","timestamp":1778742734895,"segment":118,"confidence":18,"iterationTokens":3660,"asi":{"hypothesis":"Array.prototype.unshift uses Set(..., true) for element moves and inserted arguments, so getter-only or non-writable target properties must throw instead of silently failing.","fixed_focus":"Array/prototype/unshift/read-only-property.js","semantic_scope":"Introduce a narrow put_or_throw helper for unshift indexed writes; final length writes already use put_length_or_throw."}}
{"run":1409,"commit":"5ef0bf","metric":48,"metrics":{"compiler_test262_cases":2991,"compiler_test262_pass":2943,"compiler_test262_failures":48,"compiler_test262_compiler_errors":0,"compiler_test262_compiler_crashes":0,"compiler_test262_compiler_fails":8,"compiler_test262_both_fail":34,"compiler_test262_interpreter_fail_compiler_pass":1,"compatibility_pass":2943,"compatibility_cases":2991,"compiler_errors":0,"compiler_crashes":0,"compiler_fails":8,"both_fail":34,"interpreter_fail_compiler_pass":1,"elapsed_ms":210732},"status":"discard","description":"Mark undefined named array writes present","timestamp":1778743204059,"segment":118,"confidence":18,"iterationTokens":7810,"asi":{"hypothesis":"Named array writes of explicit undefined should create an own present property so a proxy target with join = undefined does not fall through to Array.prototype.join.","rollback_reason":"Focused toString non-callable join still failed and the full Array primary stayed unchanged at 48.","next_action_hint":"The failing proxy case likely needs proxy/Reflect.get own-undefined handling or proxy set fallback semantics, not just named array descriptor marking."}}
{"run":1410,"commit":"d2c4d21","metric":47,"metrics":{"compiler_test262_cases":2991,"compiler_test262_pass":2944,"compiler_test262_failures":47,"compiler_test262_compiler_errors":0,"compiler_test262_compiler_crashes":0,"compiler_test262_compiler_fails":8,"compiler_test262_both_fail":33,"compiler_test262_interpreter_fail_compiler_pass":1,"compatibility_pass":2944,"compatibility_cases":2991,"compiler_errors":0,"compiler_crashes":0,"compiler_fails":8,"both_fail":33,"interpreter_fail_compiler_pass":1,"elapsed_ms":211013},"status":"keep","description":"Throw on callable length writes in Array methods","timestamp":1778743674285,"segment":118,"confidence":18.5,"iterationTokens":9040,"asi":{"hypothesis":"Array methods that Set(O, 'length', ..., true) should also throw for callable receivers whose virtual length descriptor is non-writable.","fixed_focus":"Array/prototype/shift/throws-when-this-value-length-is-writable-false.js","semantic_scope":"Generalize put_length_or_throw to inspect OwnProperty.descriptor(receiver, 'length') for non-object receivers such as functions before writing."}}
{"run":1411,"commit":"1b9605c","metric":45,"metrics":{"compiler_test262_cases":2991,"compiler_test262_pass":2946,"compiler_test262_failures":45,"compiler_test262_compiler_errors":0,"compiler_test262_compiler_crashes":0,"compiler_test262_compiler_fails":8,"compiler_test262_both_fail":31,"compiler_test262_interpreter_fail_compiler_pass":1,"compatibility_pass":2946,"compatibility_cases":2991,"compiler_errors":0,"compiler_crashes":0,"compiler_fails":8,"both_fail":31,"interpreter_fail_compiler_pass":1,"elapsed_ms":211183},"status":"keep","description":"Honor primitive prototype overrides in locale strings","timestamp":1778744542760,"segment":118,"confidence":19.5,"iterationTokens":21679,"asi":{"hypothesis":"Array.prototype.toLocaleString invokes Object.prototype.toLocaleString for primitive elements, and Object.prototype.toLocaleString must dynamically call this.toString while primitive prototype accessors observe the primitive receiver.","fixed_focus":["Array/prototype/toLocaleString/primitive_this_value.js","Array/prototype/toLocaleString/primitive_this_value_getter.js"],"semantic_scope":"Object.prototype.toLocaleString now dispatches through this.toString; primitive prototype lookup prefers the live class prototype and calls accessors with the original primitive receiver."}}
{"run":1412,"commit":"25b486a","metric":43,"metrics":{"compiler_test262_cases":2991,"compiler_test262_pass":2948,"compiler_test262_failures":43,"compiler_test262_compiler_errors":0,"compiler_test262_compiler_crashes":0,"compiler_test262_compiler_fails":8,"compiler_test262_both_fail":29,"compiler_test262_interpreter_fail_compiler_pass":1,"compatibility_pass":2948,"compatibility_cases":2991,"compiler_errors":0,"compiler_crashes":0,"compiler_fails":8,"both_fail":29,"interpreter_fail_compiler_pass":1,"elapsed_ms":212121},"status":"keep","description":"Preserve explicit undefined array properties","timestamp":1778745205815,"segment":118,"confidence":20.5,"iterationTokens":8798,"asi":{"hypothesis":"Named array writes of explicit undefined should still be own properties and proxy Array toString fallback should retain Array branding for array proxies.","fixed_focus":"partial progress on Array/prototype/toString/non-callable-join-string-tag.js","semantic_scope":"Mark undefined named array writes present, let Get treat array prop descriptors as explicit undefined own properties, and tag proxies to arrays/functions in Array.prototype.toString fallback.","remaining_toString":"Focused non-callable join still fails the revoked proxy TypeError subcase; proxy revocation or Reflect.get ordering remains incomplete."}}
