{"run":964,"commit":"061236f","metric":92,"metrics":{"compiler_test262_cases":500,"compiler_test262_pass":408,"compiler_test262_failures":92,"compiler_test262_compiler_errors":0,"compiler_test262_compiler_crashes":0,"compiler_test262_compiler_fails":0,"compiler_test262_both_fail":86,"compiler_test262_interpreter_fail_compiler_pass":0,"compatibility_pass":408,"compatibility_cases":500,"compiler_errors":0,"compiler_crashes":0,"compiler_fails":0,"both_fail":86,"interpreter_fail_compiler_pass":0,"elapsed_ms":30213},"status":"discard","description":"Try strict non-writable Array length write rejection","timestamp":1778534487559,"segment":42,"confidence":7.666666666666667,"iterationTokens":5192,"asi":{"hypothesis":"Strict writes to non-writable Array length should coerce the incoming value before rejecting the failed write","rollback_reason":"Primary metric stayed flat at 92 and the focused coercion-order case still failed because ToNumber uses Symbol.toPrimitive hint 'default' instead of 'number' in this path","next_action_hint":"Do not retry strict length write rejection until ToNumber/ToUint32 can pass the correct Symbol.toPrimitive hint; explore concat or Array.from clusters instead."}}
{"run":965,"commit":"061236f","metric":92,"metrics":{"compiler_test262_cases":500,"compiler_test262_pass":408,"compiler_test262_failures":92,"compiler_test262_compiler_errors":0,"compiler_test262_compiler_crashes":0,"compiler_test262_compiler_fails":0,"compiler_test262_both_fail":86,"compiler_test262_interpreter_fail_compiler_pass":0,"compatibility_pass":408,"compatibility_cases":500,"compiler_errors":0,"compiler_crashes":0,"compiler_fails":0,"both_fail":86,"interpreter_fail_compiler_pass":0,"elapsed_ms":30336},"status":"discard","description":"Return UTF-16 code units for wrapped string indexes","timestamp":1778534842050,"segment":42,"confidence":7,"iterationTokens":13513,"asi":{"hypothesis":"Wrapped String indexed access should return UTF-16 code units rather than Unicode codepoints, fixing concat spread over String objects containing surrogate pairs","rollback_reason":"Primary metric stayed flat at 92; focused concat string-wrapper still failed because expected surrogate representation uses the VM's private surrogate mapping differently than this Get-level conversion","next_action_hint":"Do not retry wrapped string UTF-16 indexing without first aligning internal surrogate representation across parser literals, fromCharCode, and comparison/stringification."}}
{"run":966,"commit":"061236f","metric":93,"metrics":{"compiler_test262_cases":500,"compiler_test262_pass":407,"compiler_test262_failures":93,"compiler_test262_compiler_errors":0,"compiler_test262_compiler_crashes":0,"compiler_test262_compiler_fails":0,"compiler_test262_both_fail":87,"compiler_test262_interpreter_fail_compiler_pass":0,"compatibility_pass":407,"compatibility_cases":500,"compiler_errors":0,"compiler_crashes":0,"compiler_fails":0,"both_fail":87,"interpreter_fail_compiler_pass":0,"elapsed_ms":30414},"status":"discard","description":"Reuse Array.from constructor path for Array.of","timestamp":1778535026472,"segment":42,"confidence":6.44,"iterationTokens":2582,"asi":{"hypothesis":"Array.of can share the Array.from result-construction path by constructing this with the element count and putting indexed elements plus length","rollback_reason":"Primary metric regressed from 92 to 93; focused constructor/custom-instance cases improved but length setter and abrupt data property semantics remained wrong","next_action_hint":"Do not retry broad Array.of custom constructor until Put/DefineProperty can invoke length setters and propagate abrupt element-definition failures correctly."}}
{"run":967,"commit":"061236f","metric":93,"metrics":{"compiler_test262_cases":500,"compiler_test262_pass":407,"compiler_test262_failures":93,"compiler_test262_compiler_errors":0,"compiler_test262_compiler_crashes":0,"compiler_test262_compiler_fails":1,"compiler_test262_both_fail":87,"compiler_test262_interpreter_fail_compiler_pass":0,"compatibility_pass":407,"compatibility_cases":500,"compiler_errors":0,"compiler_crashes":0,"compiler_fails":1,"both_fail":87,"interpreter_fail_compiler_pass":0,"elapsed_ms":18526},"status":"discard","description":"Try sparse virtual arrays for Array constructor holes","timestamp":1778535305402,"segment":42,"confidence":5.278688524590164,"iterationTokens":8124,"asi":{"hypothesis":"Single-length Array construction should create holes with virtual length rather than materialized undefined elements, allowing Array.every to skip absent indexes","rollback_reason":"Primary metric regressed from 92 to 93 and introduced a compiler-only failure; focused hole assignment still failed because writes to virtual sparse arrays did not become observable to `in`/hasOwnProperty","next_action_hint":"Do not retry sparse virtual Array constructor without a coherent sparse element presence model shared by assignment, OwnProperty.present?, `in`, hasOwnProperty, and list/qb_arr storage."}}
{"run":968,"commit":"b6e6a52","metric":90,"metrics":{"compiler_test262_cases":500,"compiler_test262_pass":410,"compiler_test262_failures":90,"compiler_test262_compiler_errors":0,"compiler_test262_compiler_crashes":0,"compiler_test262_compiler_fails":0,"compiler_test262_both_fail":84,"compiler_test262_interpreter_fail_compiler_pass":0,"compatibility_pass":410,"compatibility_cases":500,"compiler_errors":0,"compiler_crashes":0,"compiler_fails":0,"both_fail":84,"interpreter_fail_compiler_pass":0,"elapsed_ms":30239},"status":"keep","description":"Treat named builtin objects as objects","timestamp":1778535685359,"segment":42,"confidence":4.527777777777778,"iterationTokens":17258,"asi":{"hypothesis":"Named builtin singleton objects like Math/JSON should behave as ordinary objects for property writes and Object.prototype.toString tagging rather than as Function objects","improvement":"Reduced Array failures from 92 to 90 (−2), fixing Array.every cases that use Math/JSON as array-like receivers or callback thisArg objects","next_action_hint":"Remaining every failures likely require sparse array element presence and arguments length fixes; avoid sparse virtual constructor retry until a coherent presence model exists."}}
{"run":969,"commit":"3da15f7","metric":89,"metrics":{"compiler_test262_cases":500,"compiler_test262_pass":411,"compiler_test262_failures":89,"compiler_test262_compiler_errors":0,"compiler_test262_compiler_crashes":0,"compiler_test262_compiler_fails":0,"compiler_test262_both_fail":83,"compiler_test262_interpreter_fail_compiler_pass":0,"compatibility_pass":411,"compatibility_cases":500,"compiler_errors":0,"compiler_crashes":0,"compiler_fails":0,"both_fail":83,"interpreter_fail_compiler_pass":0,"elapsed_ms":30330},"status":"keep","description":"Close Array.from iterators on map errors","timestamp":1778535939730,"segment":42,"confidence":4.205128205128205,"iterationTokens":5857,"asi":{"hypothesis":"Array.from iterator consumption should call iterator.return when mapfn throws, then rethrow the original abrupt completion","improvement":"Reduced Array failures from 90 to 89 (−1), fixing iter-map-fn-err for both interpreter and compiler paths","next_action_hint":"Remaining Array.from iterator failures involve constructor/element Put abrupt paths; implementing those requires constructing target before iteration and closing on element definition errors."}}
{"run":970,"commit":"f62bd63","metric":87,"metrics":{"compiler_test262_cases":500,"compiler_test262_pass":413,"compiler_test262_failures":87,"compiler_test262_compiler_errors":0,"compiler_test262_compiler_crashes":0,"compiler_test262_compiler_fails":0,"compiler_test262_both_fail":81,"compiler_test262_interpreter_fail_compiler_pass":0,"compatibility_pass":413,"compatibility_cases":500,"compiler_errors":0,"compiler_crashes":0,"compiler_fails":0,"both_fail":81,"interpreter_fail_compiler_pass":0,"elapsed_ms":29648},"status":"keep","description":"Use CreateDataProperty for Array.from results","timestamp":1778539286717,"segment":42,"confidence":3.9523809523809526,"iterationTokens":4904,"asi":{"hypothesis":"Array.from should define result elements with CreateDataPropertyOrThrow rather than ordinary Put so configurable non-writable slots can be overwritten and non-configurable conflicts throw","improvement":"Reduced Array failures from 89 to 87 (−2), fixing source-object-length element definition abrupt/non-writable cases and preserving checks","limitations":"Iterator element-definition errors still do not close the iterator, and some descriptor overwrite metadata remains incomplete for iterable non-writable cases.","next_action_hint":"Wrap iterable result element definition in try/catch to close iterator on CreateDataProperty errors; investigate Define.property descriptor overwrite for configurable non-writable existing properties."}}
{"run":971,"commit":"b3746e0","metric":85,"metrics":{"compiler_test262_cases":500,"compiler_test262_pass":415,"compiler_test262_failures":85,"compiler_test262_compiler_errors":0,"compiler_test262_compiler_crashes":0,"compiler_test262_compiler_fails":0,"compiler_test262_both_fail":79,"compiler_test262_interpreter_fail_compiler_pass":0,"compatibility_pass":415,"compatibility_cases":500,"compiler_errors":0,"compiler_crashes":0,"compiler_fails":0,"both_fail":79,"interpreter_fail_compiler_pass":0,"elapsed_ms":29516},"status":"keep","description":"Construct Array.from iterable targets before iteration","timestamp":1778540555723,"segment":42,"confidence":3.652173913043478,"iterationTokens":19220,"asi":{"hypothesis":"For iterable sources with a constructable this value, Array.from should construct the result before consuming the iterator, then close the iterator on element-definition or mapping abrupt completions","improvement":"Reduced Array failures from 87 to 85 (−2), fixing custom-constructor abrupt creation and iterator close on element definition errors","limitations":"Configurable non-writable existing element overwrite metadata still fails for iterable Array.from, indicating Define.property does not fully reset descriptors for CreateDataProperty semantics.","next_action_hint":"Investigate Define.property descriptor overwrite for configurable non-writable properties, or move to concat species/proxy cluster."}}
{"run":972,"commit":"a4fd583","metric":84,"metrics":{"compiler_test262_cases":500,"compiler_test262_pass":416,"compiler_test262_failures":84,"compiler_test262_compiler_errors":0,"compiler_test262_compiler_crashes":0,"compiler_test262_compiler_fails":0,"compiler_test262_both_fail":78,"compiler_test262_interpreter_fail_compiler_pass":0,"compatibility_pass":416,"compatibility_cases":500,"compiler_errors":0,"compiler_crashes":0,"compiler_fails":0,"both_fail":78,"interpreter_fail_compiler_pass":0,"elapsed_ms":29989},"status":"keep","description":"Box boolean copyWithin receivers","timestamp":1778540810374,"segment":42,"confidence":3.38,"iterationTokens":9000,"asi":{"hypothesis":"Array.prototype.copyWithin should ToObject boolean primitive receivers and return the boxed receiver when there is no array-like work to perform","improvement":"Reduced Array failures from 85 to 84 (−1) with a narrow boolean-only receiver boxing path, avoiding the earlier broad primitive ToObject regression","next_action_hint":"Other copyWithin failures need exact LengthOfArrayLike and abrupt property/delete semantics; avoid broad primitive wrapping retry."}}
{"run":973,"commit":"9ccf187","metric":83,"metrics":{"compiler_test262_cases":500,"compiler_test262_pass":417,"compiler_test262_failures":83,"compiler_test262_compiler_errors":0,"compiler_test262_compiler_crashes":0,"compiler_test262_compiler_fails":0,"compiler_test262_both_fail":77,"compiler_test262_interpreter_fail_compiler_pass":0,"compatibility_pass":417,"compatibility_cases":500,"compiler_errors":0,"compiler_crashes":0,"compiler_fails":0,"both_fail":77,"interpreter_fail_compiler_pass":0,"elapsed_ms":30201},"status":"keep","description":"Reject nullish copyWithin receivers","timestamp":1778540996707,"segment":42,"confidence":2.4817518248175183,"iterationTokens":13957,"asi":{"hypothesis":"Array.prototype.copyWithin should perform RequireObjectCoercible on its receiver, throwing TypeError for null or undefined before length/index work","improvement":"Reduced Array failures from 84 to 83 (−1), fixing nullish receiver abrupt completion","next_action_hint":"Remaining copyWithin length-as-Symbol failure needs LengthOfArrayLike/ToLength to reject Symbol length; other copyWithin failures need coercion-order and delete semantics."}}
{"run":974,"commit":"8ec5ead","metric":82,"metrics":{"compiler_test262_cases":500,"compiler_test262_pass":418,"compiler_test262_failures":82,"compiler_test262_compiler_errors":0,"compiler_test262_compiler_crashes":0,"compiler_test262_compiler_fails":0,"compiler_test262_both_fail":76,"compiler_test262_interpreter_fail_compiler_pass":0,"compatibility_pass":418,"compatibility_cases":500,"compiler_errors":0,"compiler_crashes":0,"compiler_fails":0,"both_fail":76,"interpreter_fail_compiler_pass":0,"elapsed_ms":30277},"status":"keep","description":"Reject Symbol copyWithin lengths","timestamp":1778541203524,"segment":42,"confidence":3.2264150943396226,"iterationTokens":10279,"asi":{"hypothesis":"Array.prototype.copyWithin must perform LengthOfArrayLike/ToLength on ordinary object receivers and reject Symbol-valued length properties","improvement":"Reduced Array failures from 83 to 82 (−1), fixing copyWithin length-as-Symbol abrupt completion","next_action_hint":"Remaining copyWithin failures involve coercion-order, delete failures, and resizable buffers; continue with focused semantic fixes or move to concat species/proxy cluster."}}
{"run":975,"commit":"45a6acf","metric":80,"metrics":{"compiler_test262_cases":500,"compiler_test262_pass":420,"compiler_test262_failures":80,"compiler_test262_compiler_errors":0,"compiler_test262_compiler_crashes":0,"compiler_test262_compiler_fails":0,"compiler_test262_both_fail":74,"compiler_test262_interpreter_fail_compiler_pass":0,"compatibility_pass":420,"compatibility_cases":500,"compiler_errors":0,"compiler_crashes":0,"compiler_fails":0,"both_fail":74,"interpreter_fail_compiler_pass":0,"elapsed_ms":29510},"status":"keep","description":"Apply copyWithin object delete semantics","timestamp":1778548947448,"segment":42,"confidence":3.326923076923077,"iterationTokens":16195,"asi":{"hypothesis":"Array.prototype.copyWithin on ordinary objects should use HasProperty/Get/Set/DeletePropertyOrThrow rather than list-only copying, throwing when deleting a non-configurable target property fails","improvement":"Reduced Array failures from 82 to 80 (−2), fixing ordinary-object delete failure semantics while preserving checks","next_action_hint":"Remaining copyWithin failures are coercion-order, large length, and resizable buffer cases; array-like object branch may be extendable but avoid broad primitive ToObject retry."}}
{"run":976,"commit":"45a6acf","metric":80,"metrics":{"compiler_test262_cases":500,"compiler_test262_pass":420,"compiler_test262_failures":80,"compiler_test262_compiler_errors":0,"compiler_test262_compiler_crashes":0,"compiler_test262_compiler_fails":1,"compiler_test262_both_fail":74,"compiler_test262_interpreter_fail_compiler_pass":0,"compatibility_pass":420,"compatibility_cases":500,"compiler_errors":0,"compiler_crashes":0,"compiler_fails":1,"both_fail":74,"interpreter_fail_compiler_pass":0,"elapsed_ms":18437},"status":"discard","description":"Retry sparse Array constructor holes with every presence checks","timestamp":1778555804886,"segment":42,"confidence":3.392156862745098,"iterationTokens":23283,"asi":{"hypothesis":"Single-length Array construction can use virtual sparse length if Array.every checks property presence and undefined writes mark actual elements","rollback_reason":"Primary metric stayed flat at 80 and introduced a compiler-only failure despite focused hole cases improving","next_action_hint":"Do not retry sparse constructor holes until array presence semantics are unified without compiler-only leakage; focus on concat, Array.from descriptor overwrite, or non-sparse copyWithin cases."}}
{"run":977,"commit":"d0a461a","metric":79,"metrics":{"compiler_test262_cases":500,"compiler_test262_pass":421,"compiler_test262_failures":79,"compiler_test262_compiler_errors":0,"compiler_test262_compiler_crashes":0,"compiler_test262_compiler_fails":0,"compiler_test262_both_fail":73,"compiler_test262_interpreter_fail_compiler_pass":0,"compatibility_pass":421,"compatibility_cases":500,"compiler_errors":0,"compiler_crashes":0,"compiler_fails":0,"both_fail":73,"interpreter_fail_compiler_pass":0,"elapsed_ms":30677},"status":"keep","description":"Reject nullish Array iterator receivers","timestamp":1778556186665,"segment":42,"confidence":3.48,"iterationTokens":9937,"asi":{"hypothesis":"Array.prototype values/keys/entries/Symbol.iterator should perform RequireObjectCoercible on their receiver before creating an iterator","improvement":"Reduced Array failures from 80 to 79 (−1), fixing entries nullish receiver abrupt completion","next_action_hint":"Continue with remaining Array.from descriptor overwrite, concat species/proxy cases, or Array.every sparse/presence issues."}}
{"run":978,"commit":"ec9456d","metric":76,"metrics":{"compiler_test262_cases":500,"compiler_test262_pass":424,"compiler_test262_failures":76,"compiler_test262_compiler_errors":0,"compiler_test262_compiler_crashes":0,"compiler_test262_compiler_fails":0,"compiler_test262_both_fail":73,"compiler_test262_interpreter_fail_compiler_pass":0,"compatibility_pass":424,"compatibility_cases":500,"compiler_errors":0,"compiler_crashes":0,"compiler_fails":0,"both_fail":73,"interpreter_fail_compiler_pass":0,"elapsed_ms":30669},"status":"keep","description":"Follow array prototypes in isPrototypeOf","timestamp":1778556647239,"segment":42,"confidence":3.6122448979591835,"iterationTokens":9090,"asi":{"hypothesis":"Object.prototype.isPrototypeOf should walk array exotic objects via their cached Array.prototype instead of treating array storage as a map","improvement":"Reduced Array failures from 79 to 76 (−3), fixing Array() and new Array() prototype-chain checks and eliminating BadMapError crashes","next_action_hint":"Remaining top-level Array constructor/function cases include Array.toString expected Function tag; investigate Function.prototype.toString vs Object.prototype.toString dispatch for builtin constructors."}}
{"run":979,"commit":"b20240a","metric":75,"metrics":{"compiler_test262_cases":500,"compiler_test262_pass":425,"compiler_test262_failures":75,"compiler_test262_compiler_errors":0,"compiler_test262_compiler_crashes":0,"compiler_test262_compiler_fails":0,"compiler_test262_both_fail":72,"compiler_test262_interpreter_fail_compiler_pass":0,"compatibility_pass":425,"compatibility_cases":500,"compiler_errors":0,"compiler_crashes":0,"compiler_fails":0,"both_fail":72,"interpreter_fail_compiler_pass":0,"elapsed_ms":30434},"status":"keep","description":"Let Function prototype overrides shadow builtin constructors","timestamp":1778557151596,"segment":42,"confidence":3.7473684210526317,"iterationTokens":9090,"asi":{"hypothesis":"Builtin constructors should inherit Function.prototype overrides such as a reassigned toString instead of always returning virtual per-constructor Function.proto_property values","improvement":"Reduced Array failures from 76 to 75 (−1), fixing Array constructor Function.prototype.toString override semantics","next_action_hint":"Continue from latest failure log; remaining top-level failures include Array length and Array.of/from/concat species clusters."}}
{"run":980,"commit":"284a065","metric":72,"metrics":{"compiler_test262_cases":500,"compiler_test262_pass":428,"compiler_test262_failures":72,"compiler_test262_compiler_errors":0,"compiler_test262_compiler_crashes":0,"compiler_test262_compiler_fails":0,"compiler_test262_both_fail":69,"compiler_test262_interpreter_fail_compiler_pass":0,"compatibility_pass":428,"compatibility_cases":500,"compiler_errors":0,"compiler_crashes":0,"compiler_fails":0,"both_fail":69,"interpreter_fail_compiler_pass":0,"elapsed_ms":30739},"status":"keep","description":"Read inherited array indices beyond length","timestamp":1778557536778,"segment":42,"confidence":3.9347826086956523,"iterationTokens":16289,"asi":{"hypothesis":"Array element reads beyond the current length should miss own indexed storage and continue to Array.prototype, including mutated Array.prototype indexed properties","improvement":"Reduced Array failures from 75 to 72 (−3), fixing inherited index lookup after length shrink and related prototype-index reads","next_action_hint":"Continue with remaining Array length upper-bound writes, Array.from descriptor overwrite, Array.of constructor semantics, and concat species/proxy clusters."}}
