{"run":1494,"commit":"afd4c36","metric":49,"metrics":{"compiler_test262_cases":500,"compiler_test262_pass":451,"compiler_test262_failures":49,"compiler_test262_compiler_errors":0,"compiler_test262_compiler_crashes":0,"compiler_test262_compiler_fails":0,"compiler_test262_both_fail":40,"compiler_test262_interpreter_fail_compiler_pass":0,"compatibility_pass":451,"compatibility_cases":500,"compiler_errors":0,"compiler_crashes":0,"compiler_fails":0,"both_fail":40,"interpreter_fail_compiler_pass":0,"elapsed_ms":66578},"status":"keep","description":"Handle simple constructed RegExp escapes","timestamp":1778811166091,"segment":127,"confidence":3.4186046511627906,"iterationTokens":3580,"asi":{"hypothesis":"Constructor-created RegExp values still use a literal fallback rather than compiled bytecode, so simple literal execution should recognize ES escape forms such as \\0, \\cX, and pure nested capturing groups over literals.","result":"RegExp 500-case slice improved from 53 to 49 failures; focused control escape, NUL escape, and nested capture cases pass; checks pass.","next_action_hint":"Remaining legacy failures include more control/escape variants and XML shallow parsing, while most remaining modern failures are named groups/match indices/lookbehind."}}
{"run":1495,"commit":"121bc6c","metric":44,"metrics":{"compiler_test262_cases":500,"compiler_test262_pass":456,"compiler_test262_failures":44,"compiler_test262_compiler_errors":0,"compiler_test262_compiler_crashes":0,"compiler_test262_compiler_fails":0,"compiler_test262_both_fail":35,"compiler_test262_interpreter_fail_compiler_pass":0,"compatibility_pass":456,"compatibility_cases":500,"compiler_errors":0,"compiler_crashes":0,"compiler_fails":0,"both_fail":35,"interpreter_fail_compiler_pass":0,"elapsed_ms":66239},"status":"keep","description":"Decode RegExp literal escape fallbacks","timestamp":1778811460834,"segment":127,"confidence":3.5764705882352943,"iterationTokens":7206,"asi":{"hypothesis":"RegExp fallback execution should decode simple hex, unicode, and identity escapes and non-capturing literal groups rather than matching constructor source text literally.","result":"RegExp 500-case slice improved from 49 to 44 failures; focused hex/unicode/identity escape and non-capturing nested literal tests pass; checks pass.","next_action_hint":"Remaining failures are now mainly XML shallow parsing plus named groups/match-indices/lookbehind clusters. Consider whether bounded RegExp 500 has reached a diminishing-return plateau before expanding or switching slices."}}
{"run":1496,"commit":"b9dc7d8","metric":36,"metrics":{"compiler_test262_cases":500,"compiler_test262_pass":464,"compiler_test262_failures":36,"compiler_test262_compiler_errors":0,"compiler_test262_compiler_crashes":0,"compiler_test262_compiler_fails":0,"compiler_test262_both_fail":27,"compiler_test262_interpreter_fail_compiler_pass":0,"compatibility_pass":464,"compatibility_cases":500,"compiler_errors":0,"compiler_crashes":0,"compiler_fails":0,"both_fail":27,"interpreter_fail_compiler_pass":0,"elapsed_ms":65781},"status":"keep","description":"Expose RegExp groups and match indices","timestamp":1778811970227,"segment":127,"confidence":3.8095238095238093,"iterationTokens":13725,"asi":{"hypothesis":"RegExp exec result arrays should materialize groups and indices data properties from parsed group names and the d flag; the VM already receives capture offsets, but d was not exposed in flag decoding and result side-properties were virtual/non-writable.","result":"RegExp 500-case slice improved from 44 to 36 failures; focused named groups object and match-indices property/array cases pass; checks pass.","next_action_hint":"Remaining failures include duplicate named-group behavior, more named-groups edge cases, lookbehind, and XML shallow parsing. Verify that result property materialization does not overfit by keeping descriptors ordinary and writable/enumerable/configurable."}}
{"run":1497,"commit":"f7c3fc0","metric":33,"metrics":{"compiler_test262_cases":500,"compiler_test262_pass":467,"compiler_test262_failures":33,"compiler_test262_compiler_errors":0,"compiler_test262_compiler_crashes":0,"compiler_test262_compiler_fails":0,"compiler_test262_both_fail":24,"compiler_test262_interpreter_fail_compiler_pass":0,"compatibility_pass":467,"compatibility_cases":500,"compiler_errors":0,"compiler_crashes":0,"compiler_fails":0,"both_fail":24,"interpreter_fail_compiler_pass":0,"elapsed_ms":66026},"status":"keep","description":"Refine RegExp group and escape handling","timestamp":1778812224384,"segment":127,"confidence":3.835294117647059,"iterationTokens":4354,"asi":{"hypothesis":"Remaining easy RegExp failures include UTF-8 decoding for \\xFF, writable materialized indices.groups properties, and duplicate named-group syntax only within the same alternative.","result":"RegExp 500-case slice improved from 36 to 33 failures; focused \\xFF, indices groups descriptor, and duplicate named group syntax tests pass; checks pass.","next_action_hint":"Remaining failures are mostly duplicate-named group runtime semantics, named group replace/subclass edge cases, lookbehind, and XML shallow parsing. Further work likely needs deeper regexp result/group semantics rather than validation heuristics."}}
{"run":1498,"commit":"c647565","metric":32,"metrics":{"compiler_test262_cases":500,"compiler_test262_pass":468,"compiler_test262_failures":32,"compiler_test262_compiler_errors":0,"compiler_test262_compiler_crashes":0,"compiler_test262_compiler_fails":0,"compiler_test262_both_fail":23,"compiler_test262_interpreter_fail_compiler_pass":0,"compatibility_pass":468,"compatibility_cases":500,"compiler_errors":0,"compiler_crashes":0,"compiler_fails":0,"both_fail":23,"interpreter_fail_compiler_pass":0,"elapsed_ms":67138},"status":"keep","description":"Materialize empty RegExp indices groups","timestamp":1778812467617,"segment":127,"confidence":3.813953488372093,"iterationTokens":5450,"asi":{"hypothesis":"RegExp match-indices arrays should always have an own groups data property when the d flag is present, with value undefined when there are no named groups.","result":"RegExp 500-case slice improved from 33 to 32 failures; focused indices-groups-object-undefined passes; checks pass.","next_action_hint":"Remaining failures likely require deeper String.match integration for indices, named group replacement semantics, duplicate named group runtime behavior, lookbehind, or XML shallow parsing."}}
{"type":"config","name":"Optimize QuickBEAM built-ins/RegExp 1000-case compatibility slice","metricName":"compatibility_failures","metricUnit":"","bestDirection":"lower"}
{"run":1499,"commit":"c647565","metric":0,"metrics":{},"status":"crash","description":"Baseline RegExp 1000-case slice","timestamp":1778812702461,"segment":128,"confidence":null,"iterationTokens":134,"asi":{"hypothesis":"Expanding beyond the 500-case RegExp slice may expose the next useful compatibility clusters after the 500-case slice plateaued at 32 failures.","result":"The 1000-case RegExp run crashed with exit code 139 before producing metrics.","rollback_reason":"Expanded workload is unstable at this limit, likely due to a later RegExp engine/native crash; no production code changes were part of the experiment aside from ideas/autoresearch bookkeeping.","next_action_hint":"Use a smaller expanded limit or inspect the crash log to identify the first crashing RegExp file before making semantic changes."}}
{"type":"config","name":"Optimize QuickBEAM built-ins/RegExp 500-case compatibility slice reprise","metricName":"compatibility_failures","metricUnit":"","bestDirection":"lower"}
{"run":1500,"commit":"0f90f79","metric":32,"metrics":{"compiler_test262_cases":500,"compiler_test262_pass":468,"compiler_test262_failures":32,"compiler_test262_compiler_errors":0,"compiler_test262_compiler_crashes":0,"compiler_test262_compiler_fails":0,"compiler_test262_both_fail":23,"compiler_test262_interpreter_fail_compiler_pass":0,"compatibility_pass":468,"compatibility_cases":500,"compiler_errors":0,"compiler_crashes":0,"compiler_fails":0,"both_fail":23,"interpreter_fail_compiler_pass":0,"elapsed_ms":67154},"status":"keep","description":"Baseline RegExp 500-case reprise after expansion crash","timestamp":1778812917713,"segment":129,"confidence":null,"iterationTokens":133,"asi":{"hypothesis":"The 1000-case RegExp expansion crashed, so return to the stable 500-case slice for further focused improvements while retaining the crash caution in ideas.","result":"Stable RegExp 500-case baseline remains 32 failures out of 500; checks pass.","next_action_hint":"Continue focused work on the 32 remaining cases or choose another stable category if remaining RegExp cases are mostly deep engine features."}}
{"type":"config","name":"Optimize QuickBEAM built-ins/String full bounded compatibility reprise","metricName":"compatibility_failures","metricUnit":"","bestDirection":"lower"}
{"run":1501,"commit":"5f1b1a7","metric":2,"metrics":{"compiler_test262_cases":1223,"compiler_test262_pass":1221,"compiler_test262_failures":2,"compiler_test262_compiler_errors":0,"compiler_test262_compiler_crashes":0,"compiler_test262_compiler_fails":0,"compiler_test262_both_fail":2,"compiler_test262_interpreter_fail_compiler_pass":0,"compatibility_pass":1221,"compatibility_cases":1223,"compiler_errors":0,"compiler_crashes":0,"compiler_fails":0,"both_fail":2,"interpreter_fail_compiler_pass":0,"elapsed_ms":41923},"status":"keep","description":"Baseline String full reprise after RegExp work","timestamp":1778813097743,"segment":130,"confidence":null,"iterationTokens":128,"asi":{"hypothesis":"RegExp constructor/runtime improvements may affect the prior String residuals, so rebaseline the full bounded String workload before deciding whether duplicate named groups remain blocked.","result":"String remains at 2 failures out of 1223, both shared failures; checks pass.","next_action_hint":"The two remaining failures are still likely duplicate named RegExp group cases rejected before VM runtime. If unchanged, avoid VM-parser-only duplicate group retries."}}
{"type":"config","name":"Optimize QuickBEAM built-ins/RegExp 500-case compatibility continuation","metricName":"compatibility_failures","metricUnit":"","bestDirection":"lower"}
{"run":1502,"commit":"3e8f096","metric":32,"metrics":{"compiler_test262_cases":500,"compiler_test262_pass":468,"compiler_test262_failures":32,"compiler_test262_compiler_errors":0,"compiler_test262_compiler_crashes":0,"compiler_test262_compiler_fails":0,"compiler_test262_both_fail":23,"compiler_test262_interpreter_fail_compiler_pass":0,"compatibility_pass":468,"compatibility_cases":500,"compiler_errors":0,"compiler_crashes":0,"compiler_fails":0,"both_fail":23,"interpreter_fail_compiler_pass":0,"elapsed_ms":65747},"status":"keep","description":"Baseline RegExp 500-case continuation after String reprise","timestamp":1778813305623,"segment":131,"confidence":null,"iterationTokens":132,"asi":{"hypothesis":"String remains blocked at duplicate named group compilation, so return to the stable RegExp 500-case slice for remaining tractable runtime fixes.","result":"RegExp 500-case continuation baseline remains 32 failures; checks pass.","next_action_hint":"Continue only focused RegExp fixes; if remaining cases are all named groups/lookbehind/XML engine behavior, consider a different stable category."}}
{"run":1503,"commit":"df7d3c0","metric":31,"metrics":{"compiler_test262_cases":500,"compiler_test262_pass":469,"compiler_test262_failures":31,"compiler_test262_compiler_errors":0,"compiler_test262_compiler_crashes":0,"compiler_test262_compiler_fails":0,"compiler_test262_both_fail":22,"compiler_test262_interpreter_fail_compiler_pass":0,"compatibility_pass":469,"compatibility_cases":500,"compiler_errors":0,"compiler_crashes":0,"compiler_fails":0,"both_fail":22,"interpreter_fail_compiler_pass":0,"elapsed_ms":65670},"status":"keep","description":"Pass RegExp named groups to replacements","timestamp":1778813640361,"segment":131,"confidence":null,"iterationTokens":6494,"asi":{"hypothesis":"RegExp replacement paths should derive named capture maps from group names and pass a groups object to functional replacers, while replacement-string $<name> substitutions should treat unmatched captures as empty strings.","result":"RegExp 500-case slice improved from 32 to 31 failures; groups-object-unmatched remains fixed, some functional replacement edge cases still fail; checks pass.","next_action_hint":"Functional replacement for constructor-created RegExp with alternative named groups still lacks groups in the Elixir-regex fallback path. Avoid broad String.match routing through @@match because it crashed symbol HasProperty."}}
{"run":1504,"commit":"ee0b413","metric":30,"metrics":{"compiler_test262_cases":500,"compiler_test262_pass":470,"compiler_test262_failures":30,"compiler_test262_compiler_errors":0,"compiler_test262_compiler_crashes":0,"compiler_test262_compiler_fails":0,"compiler_test262_both_fail":21,"compiler_test262_interpreter_fail_compiler_pass":0,"compatibility_pass":470,"compatibility_cases":500,"compiler_errors":0,"compiler_crashes":0,"compiler_fails":0,"both_fail":21,"interpreter_fail_compiler_pass":0,"elapsed_ms":65881},"status":"keep","description":"Hide RegExp groups internal prototype keys","timestamp":1778813995280,"segment":131,"confidence":2,"iterationTokens":5673,"asi":{"hypothesis":"Null-prototype RegExp groups objects store an internal prototype marker that should not enumerate as an own property, and group key order should follow textual group order.","result":"RegExp 500-case slice improved from 31 to 30 failures; focused indices group property-order/descriptor case passes; checks pass.","next_action_hint":"Remaining failures are mostly duplicate named group runtime behavior, String.match indices integration, lookbehind, and XML shallow parsing."}}
{"run":1505,"commit":"cb8c636","metric":29,"metrics":{"compiler_test262_cases":500,"compiler_test262_pass":471,"compiler_test262_failures":29,"compiler_test262_compiler_errors":0,"compiler_test262_compiler_crashes":0,"compiler_test262_compiler_fails":0,"compiler_test262_both_fail":20,"compiler_test262_interpreter_fail_compiler_pass":0,"compatibility_pass":471,"compatibility_cases":500,"compiler_errors":0,"compiler_crashes":0,"compiler_fails":0,"both_fail":20,"interpreter_fail_compiler_pass":0,"elapsed_ms":65962},"status":"keep","description":"Preserve named replacement literals without groups","timestamp":1778814249339,"segment":131,"confidence":3,"iterationTokens":3065,"asi":{"hypothesis":"Replacement strings containing $<name> should only perform named capture substitution when the match result has a named groups object; otherwise the token remains literal.","result":"RegExp 500-case slice improved from 30 to 29 failures; focused groups-object-undefined passes; checks pass.","next_action_hint":"Remaining named-group replacement failures involving RegExp subclasses require honoring custom exec result groups/prototype inheritance, not just parsed group names."}}
{"run":1506,"commit":"b138b1c","metric":28,"metrics":{"compiler_test262_cases":500,"compiler_test262_pass":472,"compiler_test262_failures":28,"compiler_test262_compiler_errors":0,"compiler_test262_compiler_crashes":0,"compiler_test262_compiler_fails":0,"compiler_test262_both_fail":19,"compiler_test262_interpreter_fail_compiler_pass":0,"compatibility_pass":472,"compatibility_cases":500,"compiler_errors":0,"compiler_crashes":0,"compiler_fails":0,"both_fail":19,"interpreter_fail_compiler_pass":0,"elapsed_ms":67083},"status":"keep","description":"Slice RegExp match captures by code units","timestamp":1778814558027,"segment":131,"confidence":4,"iterationTokens":5936,"asi":{"hypothesis":"RegExp NIF capture offsets are JavaScript string indices, so String.prototype.match should build capture strings with String.slice rather than binary_part to preserve non-ASCII code points.","result":"RegExp 500-case slice improved from 29 to 28 failures; focused lookBehind/start-of-line passes; checks pass.","next_action_hint":"Remaining lookBehind/sticky failure involves lastIndex/global progression; remaining named groups/match indices need deeper result semantics."}}
{"run":1507,"commit":"8fb7272","metric":28,"metrics":{"compiler_test262_cases":500,"compiler_test262_pass":472,"compiler_test262_failures":28,"compiler_test262_compiler_errors":0,"compiler_test262_compiler_crashes":0,"compiler_test262_compiler_fails":0,"compiler_test262_both_fail":19,"compiler_test262_interpreter_fail_compiler_pass":0,"compatibility_pass":472,"compatibility_cases":500,"compiler_errors":0,"compiler_crashes":0,"compiler_fails":0,"both_fail":19,"interpreter_fail_compiler_pass":0,"elapsed_ms":67292},"status":"keep","description":"Record RegExp continuation notes","timestamp":1778814776700,"segment":131,"confidence":2.6666666666666665,"iterationTokens":1889,"asi":{"hypothesis":"After updating the ideas backlog with current RegExp cautions, rerun the stable 500-case slice to ensure the current 28-failure state remains reproducible and check-clean.","result":"RegExp 500-case slice remains at 28 failures and checks pass; ideas backlog now records the 1000-case crash and discarded String.match routing attempt.","next_action_hint":"Next work should target remaining RegExp failures: String.match indices integration without symbol HasProperty crashes, duplicate named-group runtime behavior, lookbehind sticky lastIndex progression, XML shallow parsing, or switch to another stable category."}}
{"run":1508,"commit":"HEAD","metric":28,"metrics":{"compiler_test262_cases":500,"compiler_test262_pass":472,"compiler_test262_failures":28,"compiler_test262_compiler_errors":0,"compiler_test262_compiler_crashes":0,"compiler_test262_compiler_fails":0,"compiler_test262_both_fail":19,"compiler_test262_interpreter_fail_compiler_pass":0,"compatibility_pass":472,"compatibility_cases":500,"compiler_errors":0,"compiler_crashes":0,"compiler_fails":0,"both_fail":19,"interpreter_fail_compiler_pass":0,"elapsed_ms":65488},"status":"discard","description":"Route String.match non-global through RegExp.exec for indices metadata","timestamp":1778815445656,"segment":131,"confidence":4,"iterationTokens":1889,"asi":{"hypothesis":"Non-global String.prototype.match should reuse RegExp.exec so match results include indices/groups metadata and avoid duplicate construction paths.","rollback_reason":"Stable RegExp 500 primary metric stayed at 28 failures; focused probes showed this exposes additional UTF-16 lone-surrogate length issues and leaves unicode named group parsing failures unresolved.","next_action_hint":"If revisiting match indices, first fix WTF-8/lone-surrogate string length semantics for non-unicode dot matches or parser support for unicode group names, then reintroduce RegExp.exec routing narrowly."}}
{"type":"config","name":"Optimize QuickBEAM built-ins/Reflect compatibility slice","metricName":"compatibility_failures","metricUnit":"","bestDirection":"lower"}
{"run":1509,"commit":"809e775","metric":4,"metrics":{"compiler_test262_cases":153,"compiler_test262_pass":149,"compiler_test262_failures":4,"compiler_test262_compiler_errors":0,"compiler_test262_compiler_crashes":0,"compiler_test262_compiler_fails":0,"compiler_test262_both_fail":4,"compiler_test262_interpreter_fail_compiler_pass":0,"compatibility_pass":149,"compatibility_cases":153,"compiler_errors":0,"compiler_crashes":0,"compiler_fails":0,"both_fail":4,"interpreter_fail_compiler_pass":0,"elapsed_ms":8032},"status":"keep","description":"Baseline Reflect compatibility slice after RegExp plateau","timestamp":1778815581667,"segment":132,"confidence":null,"iterationTokens":127,"asi":{"hypothesis":"Reflect’s bounded built-ins slice remains a tractable follow-up after RegExp 500 plateaued at 28 failures; establish a fresh baseline before focused primitive-target TypeError fixes."}}
{"run":1510,"commit":"c8f77bc","metric":0,"metrics":{"compiler_test262_cases":153,"compiler_test262_pass":153,"compiler_test262_failures":0,"compiler_test262_compiler_errors":0,"compiler_test262_compiler_crashes":0,"compiler_test262_compiler_fails":0,"compiler_test262_both_fail":0,"compiler_test262_interpreter_fail_compiler_pass":0,"compatibility_pass":153,"compatibility_cases":153,"compiler_errors":0,"compiler_crashes":0,"compiler_fails":0,"both_fail":0,"interpreter_fail_compiler_pass":0,"elapsed_ms":6750},"status":"keep","description":"Throw on primitive Reflect extensibility targets","timestamp":1778815765375,"segment":132,"confidence":null,"iterationTokens":2243,"asi":{"hypothesis":"Reflect.isExtensible and Reflect.preventExtensions must throw TypeError for primitive targets rather than returning false, matching the four residual Reflect failures.","checks_note":"Updated the compiler smoke expectation to the spec-conformant TypeError result for primitive Reflect extensibility calls."}}
{"type":"config","name":"Optimize QuickBEAM built-ins/Function compatibility slice","metricName":"compatibility_failures","metricUnit":"","bestDirection":"lower"}
{"run":1511,"commit":"0cf16b2","metric":2,"metrics":{"compiler_test262_cases":509,"compiler_test262_pass":507,"compiler_test262_failures":2,"compiler_test262_compiler_errors":0,"compiler_test262_compiler_crashes":0,"compiler_test262_compiler_fails":0,"compiler_test262_both_fail":2,"compiler_test262_interpreter_fail_compiler_pass":0,"compatibility_pass":507,"compatibility_cases":509,"compiler_errors":0,"compiler_crashes":0,"compiler_fails":0,"both_fail":2,"interpreter_fail_compiler_pass":0,"elapsed_ms":24404},"status":"keep","description":"Baseline Function compatibility slice after Reflect completion","timestamp":1778815917909,"segment":133,"confidence":null,"iterationTokens":127,"asi":{"hypothesis":"Function has only two residual bounded failures after prior caller/closure fixes; establish a fresh baseline for focused follow-up."}}
