{"run":860,"commit":"11b8a54","metric":118,"metrics":{"compiler_test262_cases":509,"compiler_test262_pass":391,"compiler_test262_failures":118,"compiler_test262_compiler_errors":0,"compiler_test262_compiler_crashes":0,"compiler_test262_compiler_fails":2,"compiler_test262_both_fail":111,"compiler_test262_interpreter_fail_compiler_pass":3,"compatibility_pass":391,"compatibility_cases":509,"compiler_errors":0,"compiler_crashes":0,"compiler_fails":2,"both_fail":111,"interpreter_fail_compiler_pass":3,"elapsed_ms":51040},"status":"keep","description":"Describe builtin function length and metadata","timestamp":1778269640803,"segment":34,"confidence":25,"iterationTokens":10745,"asi":{"hypothesis":"Builtin functions need own length descriptors derived from named_meta or function arity, plus call/apply/bind/Symbol.hasInstance need registered metadata","improvement":"Reduced Function failures from 130 to 118 (−12) by adding builtin function length descriptors and registering call/apply/bind/Symbol.hasInstance metadata with correct lengths and non-constructable flags","next_action_hint":"The remaining clusters are prototype/bind object semantics (bound functions as objects), prototype/apply this-coercion, and Symbol.hasInstance prototype chain."}}
{"run":861,"commit":"690fa2c","metric":114,"metrics":{"compiler_test262_cases":509,"compiler_test262_pass":395,"compiler_test262_failures":114,"compiler_test262_compiler_errors":0,"compiler_test262_compiler_crashes":0,"compiler_test262_compiler_fails":2,"compiler_test262_both_fail":107,"compiler_test262_interpreter_fail_compiler_pass":3,"compatibility_pass":395,"compatibility_cases":509,"compiler_errors":0,"compiler_crashes":0,"compiler_fails":2,"both_fail":107,"interpreter_fail_compiler_pass":3,"elapsed_ms":51183},"status":"keep","description":"Fix callable property enumerability and Function.prototype descriptor","timestamp":1778270188203,"segment":34,"confidence":15.176470588235293,"iterationTokens":8114,"asi":{"hypothesis":"Callable length/name/prototype should be non-enumerable for propertyIsEnumerable, and Function constructor's prototype descriptor should be writable:false, configurable:false","improvement":"Reduced Function failures from 118 to 114 (−4) by fixing callable property enumerability and Function.prototype non-writable/non-configurable descriptor","next_action_hint":"Remaining clusters: prototype/bind object semantics (24), prototype/apply (10), prototype root (9), Symbol.hasInstance (6)."}}
{"run":862,"commit":"9dceb2f","metric":113,"metrics":{"compiler_test262_cases":509,"compiler_test262_pass":396,"compiler_test262_failures":113,"compiler_test262_compiler_errors":0,"compiler_test262_compiler_crashes":0,"compiler_test262_compiler_fails":2,"compiler_test262_both_fail":106,"compiler_test262_interpreter_fail_compiler_pass":3,"compatibility_pass":396,"compatibility_cases":509,"compiler_errors":0,"compiler_crashes":0,"compiler_fails":2,"both_fail":106,"interpreter_fail_compiler_pass":3,"elapsed_ms":51411},"status":"keep","description":"Route builtin prototype lookup through Function.prototype","timestamp":1778270485376,"segment":34,"confidence":10.833333333333334,"iterationTokens":5271,"asi":{"hypothesis":"Builtin constructor prototype chain should go through Function.prototype for inherited property access, not skip to Object.prototype","improvement":"Reduced Function failures from 114 to 113 by routing builtin get_from_prototype through Function.prototype fallback","next_action_hint":"Remaining clusters: prototype/bind (24), prototype/apply (10), prototype root (9), Symbol.hasInstance (6)."}}
{"run":863,"commit":"9dceb2f","metric":113,"metrics":{"compiler_test262_cases":509,"compiler_test262_pass":396,"compiler_test262_failures":113,"compiler_test262_compiler_errors":0,"compiler_test262_compiler_crashes":0,"compiler_test262_compiler_fails":2,"compiler_test262_both_fail":106,"compiler_test262_interpreter_fail_compiler_pass":3,"compatibility_pass":396,"compatibility_cases":509,"compiler_errors":0,"compiler_crashes":0,"compiler_fails":2,"both_fail":106,"interpreter_fail_compiler_pass":3,"elapsed_ms":51393},"status":"discard","description":"Investigate function length delete within eval","timestamp":1778270976477,"segment":34,"confidence":10.4,"iterationTokens":13926,"asi":{"hypothesis":"Delete f.length within a single eval should make subsequent f.length return undefined or Function.prototype.length","rollback_reason":"Metric flat at 113; the get_own `:deleted` handling works correctly when tested externally but within a single interpreter eval f.length still returns the virtual value, likely due to process-boundary issues with ctor_statics or a code path not reaching the modified get_own","next_action_hint":"The function length delete issue is a deep process-boundary/ctor-key issue; move on to other fixable clusters."}}
{"run":864,"commit":"9dceb2f","metric":121,"metrics":{"compiler_test262_cases":509,"compiler_test262_pass":388,"compiler_test262_failures":121,"compiler_test262_compiler_errors":0,"compiler_test262_compiler_crashes":0,"compiler_test262_compiler_fails":7,"compiler_test262_both_fail":108,"compiler_test262_interpreter_fail_compiler_pass":4,"compatibility_pass":388,"compatibility_cases":509,"compiler_errors":0,"compiler_crashes":0,"compiler_fails":7,"both_fail":108,"interpreter_fail_compiler_pass":4,"elapsed_ms":51276},"status":"discard","description":"Narrow Symbol.hasInstance with OrdinaryHasInstance","timestamp":1778271360434,"segment":34,"confidence":10,"iterationTokens":7513,"asi":{"hypothesis":"Narrow Symbol.hasInstance lookup for closures/functions through Function.prototype plus OrdinaryHasInstance","rollback_reason":"Regressed from 113 to 121; compiler_fails jumped from 2 to 7 as compiled path doesn't find Symbol.hasInstance via get_callable_has_instance","next_action_hint":"The compiled path uses a different symbol resolution mechanism for instanceof; need to also update the compiler path or change how Symbol.hasInstance is resolved in the compiled op_instanceof."}}
{"run":865,"commit":"9dceb2f","metric":116,"metrics":{"compiler_test262_cases":509,"compiler_test262_pass":393,"compiler_test262_failures":116,"compiler_test262_compiler_errors":0,"compiler_test262_compiler_crashes":0,"compiler_test262_compiler_fails":2,"compiler_test262_both_fail":109,"compiler_test262_interpreter_fail_compiler_pass":3,"compatibility_pass":393,"compatibility_cases":509,"compiler_errors":0,"compiler_crashes":0,"compiler_fails":2,"both_fail":109,"interpreter_fail_compiler_pass":3,"elapsed_ms":51643},"status":"discard","description":"Narrow Symbol.hasInstance for callable types","timestamp":1778271669505,"segment":34,"confidence":8.125,"iterationTokens":4678,"asi":{"hypothesis":"Narrow Symbol.hasInstance lookup for closures/functions/bound/builtins through Function.prototype with OrdinaryHasInstance","rollback_reason":"Regressed from 113 to 116; fixing the compiler path tuple guard prevented the previous regression but OrdinaryHasInstance itself introduced 3 new both_fail regressions, likely from incorrect instanceof behavior for builtin or edge cases","next_action_hint":"The OrdinaryHasInstance implementation walks __proto__ chain which may not work for all object prototype representations; inspect what specific cases regressed."}}
{"run":866,"commit":"42dd98b","metric":112,"metrics":{"compiler_test262_cases":509,"compiler_test262_pass":397,"compiler_test262_failures":112,"compiler_test262_compiler_errors":0,"compiler_test262_compiler_crashes":0,"compiler_test262_compiler_fails":2,"compiler_test262_both_fail":105,"compiler_test262_interpreter_fail_compiler_pass":3,"compatibility_pass":397,"compatibility_cases":509,"compiler_errors":0,"compiler_crashes":0,"compiler_fails":2,"both_fail":105,"interpreter_fail_compiler_pass":3,"elapsed_ms":51388},"status":"keep","description":"Enumerate callable own property names","timestamp":1778272017494,"segment":34,"confidence":6.894736842105263,"iterationTokens":6160,"asi":{"hypothesis":"Object.getOwnPropertyNames should handle callable (non-obj) values by delegating to OwnProperty.descriptor_keys instead of returning empty","improvement":"Reduced Function failures from 113 to 112 by routing getOwnPropertyNames for callables through descriptor_keys","next_action_hint":"Remaining clusters: prototype/bind (24), prototype/apply (10), prototype root (7), Symbol.hasInstance (6), prototype/call (6)."}}
{"run":867,"commit":"42dd98b","metric":112,"metrics":{"compiler_test262_cases":509,"compiler_test262_pass":397,"compiler_test262_failures":112,"compiler_test262_compiler_errors":0,"compiler_test262_compiler_crashes":0,"compiler_test262_compiler_fails":2,"compiler_test262_both_fail":104,"compiler_test262_interpreter_fail_compiler_pass":4,"compatibility_pass":397,"compatibility_cases":509,"compiler_errors":0,"compiler_crashes":0,"compiler_fails":2,"both_fail":104,"interpreter_fail_compiler_pass":4,"elapsed_ms":51114},"status":"discard","description":"Resolve predefined atom names in callable descriptors","timestamp":1778272624376,"segment":34,"confidence":6.55,"iterationTokens":16084,"asi":{"hypothesis":"Predefined atom function names need resolution in proto_property, callable_name, and generic callable descriptors for bound function name and descriptor tests","rollback_reason":"Metric flat at 112; the name resolution is correct but the actual test failures need additional fixes (verifyProperty tests need descriptor support on bound functions)","next_action_hint":"The name/descriptor fixes are semantically correct but alone don't improve the metric; batch with other bound-function descriptor fixes if found."}}
{"run":868,"commit":"42dd98b","metric":121,"metrics":{"compiler_test262_cases":509,"compiler_test262_pass":388,"compiler_test262_failures":121,"compiler_test262_compiler_errors":0,"compiler_test262_compiler_crashes":0,"compiler_test262_compiler_fails":2,"compiler_test262_both_fail":107,"compiler_test262_interpreter_fail_compiler_pass":3,"compatibility_pass":388,"compatibility_cases":509,"compiler_errors":0,"compiler_crashes":0,"compiler_fails":2,"both_fail":107,"interpreter_fail_compiler_pass":3,"elapsed_ms":51608},"status":"discard","description":"Reject non-object apply argArray v2","timestamp":1778272922790,"segment":34,"confidence":7.277777777777778,"iterationTokens":4344,"asi":{"hypothesis":"apply should throw TypeError for non-object argArray, handling nil/undefined as empty","rollback_reason":"Regressed from 112 to 121; argArray rejection causes widespread failures where the runtime passes non-object values as apply args internally","next_action_hint":"Do not retry apply argArray rejection; the internal runtime uses apply with non-object values in many places. The built-ins/Function workload is plateauing at 112; consider moving to a new category."}}
{"type":"config","name":"QuickBEAM built-ins/Date compatibility","metricName":"compatibility_failures","metricUnit":"","bestDirection":"lower"}
{"run":869,"commit":"5b9c21c","metric":235,"metrics":{"compiler_test262_cases":594,"compiler_test262_pass":359,"compiler_test262_failures":235,"compiler_test262_compiler_errors":0,"compiler_test262_compiler_crashes":0,"compiler_test262_compiler_fails":0,"compiler_test262_both_fail":221,"compiler_test262_interpreter_fail_compiler_pass":0,"compatibility_pass":359,"compatibility_cases":594,"compiler_errors":0,"compiler_crashes":0,"compiler_fails":0,"both_fail":221,"interpreter_fail_compiler_pass":0,"elapsed_ms":24765},"status":"keep","description":"Date this-validation and NaN constructor baseline","timestamp":1778273764830,"segment":35,"confidence":null,"iterationTokens":213,"asi":{"hypothesis":"Date prototype methods need this-type validation and constructor should handle NaN/Infinity as invalid date","improvement":"Initial built-ins/Date baseline with this-validation for non-Date objects and NaN/Infinity Date constructor handling: 235/594 failures (down from 315 in earlier scan)"}}
{"run":870,"commit":"f1893fd","metric":224,"metrics":{"compiler_test262_cases":594,"compiler_test262_pass":370,"compiler_test262_failures":224,"compiler_test262_compiler_errors":0,"compiler_test262_compiler_crashes":0,"compiler_test262_compiler_fails":0,"compiler_test262_both_fail":210,"compiler_test262_interpreter_fail_compiler_pass":0,"compatibility_pass":370,"compatibility_cases":594,"compiler_errors":0,"compiler_crashes":0,"compiler_fails":0,"both_fail":210,"interpreter_fail_compiler_pass":0,"elapsed_ms":24919},"status":"keep","description":"Fix Date setFullYear with invalid date and multi-arg","timestamp":1778274186178,"segment":35,"confidence":null,"iterationTokens":11839,"asi":{"hypothesis":"Date.prototype.setFullYear needs: base time of 0 for invalid dates, multi-arg support for month/date, MakeDay-style month overflow/underflow handling","improvement":"Reduced Date failures from 235 to 224 (−11) by fixing setFullYear invalid-date base, multi-arg month/date, and negative month overflow","next_action_hint":"Continue fixing setHours multi-arg invalid-date handling and remaining Date setter semantics."}}
{"run":871,"commit":"17188c4","metric":199,"metrics":{"compiler_test262_cases":594,"compiler_test262_pass":395,"compiler_test262_failures":199,"compiler_test262_compiler_errors":0,"compiler_test262_compiler_crashes":0,"compiler_test262_compiler_fails":0,"compiler_test262_both_fail":189,"compiler_test262_interpreter_fail_compiler_pass":0,"compatibility_pass":395,"compatibility_cases":594,"compiler_errors":0,"compiler_crashes":0,"compiler_fails":0,"both_fail":189,"interpreter_fail_compiler_pass":0,"elapsed_ms":24806},"status":"keep","description":"Fix Date setters with ms arg and TimeClip","timestamp":1778274523560,"segment":35,"confidence":3.272727272727273,"iterationTokens":9060,"asi":{"hypothesis":"Date setters need multi-arg support (setHours takes hour/min/sec/ms), proper TimeClip for overflow, and ms component handling","improvement":"Reduced Date failures from 224 to 199 (−25) by rewriting time setters with multi-arg support, ms component, TimeClip, and fixing put_ms for NaN/overflow","next_action_hint":"Remaining clusters: Symbol.toPrimitive (14), remaining setFullYear (4), setDate (8), getTimezoneOffset (4), parse (4), UTC (5), constructor edge cases."}}
{"run":872,"commit":"9e0ced0","metric":133,"metrics":{"compiler_test262_cases":594,"compiler_test262_pass":461,"compiler_test262_failures":133,"compiler_test262_compiler_errors":0,"compiler_test262_compiler_crashes":0,"compiler_test262_compiler_fails":0,"compiler_test262_both_fail":123,"compiler_test262_interpreter_fail_compiler_pass":0,"compatibility_pass":461,"compatibility_cases":594,"compiler_errors":0,"compiler_crashes":0,"compiler_fails":0,"both_fail":123,"interpreter_fail_compiler_pass":0,"elapsed_ms":24176},"status":"keep","description":"Register Date method metadata for length and constructability","timestamp":1778274814918,"segment":35,"confidence":5.666666666666667,"iterationTokens":7704,"asi":{"hypothesis":"Date prototype methods need named_meta registration for spec-correct .length values and non-constructable flags","improvement":"Reduced Date failures from 199 to 133 (−66) by registering all Date prototype methods and static methods with correct length and constructable:false metadata","next_action_hint":"Remaining clusters: Symbol.toPrimitive, ToNumber coercion order for setter args, getTimezoneOffset, parse, UTC, constructor edge cases."}}
{"run":873,"commit":"d0afc89","metric":128,"metrics":{"compiler_test262_cases":594,"compiler_test262_pass":466,"compiler_test262_failures":128,"compiler_test262_compiler_errors":0,"compiler_test262_compiler_crashes":0,"compiler_test262_compiler_fails":0,"compiler_test262_both_fail":117,"compiler_test262_interpreter_fail_compiler_pass":0,"compatibility_pass":466,"compatibility_cases":594,"compiler_errors":0,"compiler_crashes":0,"compiler_fails":0,"both_fail":117,"interpreter_fail_compiler_pass":0,"elapsed_ms":24345},"status":"keep","description":"Fix toISOString RangeError and setTime this-validation","timestamp":1778275117127,"segment":35,"confidence":2.9722222222222223,"iterationTokens":5834,"asi":{"hypothesis":"toISOString should throw RangeError for invalid dates and produce Z-suffix UTC strings; setTime should validate this is a Date object","improvement":"Reduced Date failures from 133 to 128 by fixing toISOString invalid-date RangeError, Z-suffix format, toJSON null-for-invalid, and setTime this-validation","next_action_hint":"Remaining: Symbol.toPrimitive (14), setter arg ToNumber coercion order, getTimezoneOffset, parse, UTC, constructor edge cases."}}
{"run":874,"commit":"a3513cb","metric":89,"metrics":{"compiler_test262_cases":594,"compiler_test262_pass":505,"compiler_test262_failures":89,"compiler_test262_compiler_errors":0,"compiler_test262_compiler_crashes":0,"compiler_test262_compiler_fails":0,"compiler_test262_both_fail":88,"compiler_test262_interpreter_fail_compiler_pass":0,"compatibility_pass":505,"compatibility_cases":594,"compiler_errors":0,"compiler_crashes":0,"compiler_fails":0,"both_fail":88,"interpreter_fail_compiler_pass":0,"elapsed_ms":24826},"status":"keep","description":"Fix Date setter ToNumber coercion and MakeDay routing","timestamp":1778275693369,"segment":35,"confidence":3.0416666666666665,"iterationTokens":16514,"asi":{"hypothesis":"Date setters need proper ToNumber coercion (valueOf), NaN guard in make_date, setDate/setMonth through make_date for day/month overflow, and pre-coerce args before invalid-date check","improvement":"Reduced Date failures from 128 to 89 (−39) by fixing ToNumber coercion for all setter args, routing setDate/setMonth through make_date, and adding NaN guards","next_action_hint":"Remaining clusters: Symbol.toPrimitive (14), remaining setter arg coercion order, toISOString edge cases, getTimezoneOffset, parse, UTC, constructor edge cases."}}
{"run":875,"commit":"5c08ee9","metric":84,"metrics":{"compiler_test262_cases":594,"compiler_test262_pass":510,"compiler_test262_failures":84,"compiler_test262_compiler_errors":0,"compiler_test262_compiler_crashes":0,"compiler_test262_compiler_fails":0,"compiler_test262_both_fail":83,"compiler_test262_interpreter_fail_compiler_pass":0,"compatibility_pass":510,"compatibility_cases":594,"compiler_errors":0,"compiler_crashes":0,"compiler_fails":0,"both_fail":83,"interpreter_fail_compiler_pass":0,"elapsed_ms":24152},"status":"keep","description":"Fix toJSON spec compliance for non-Date objects","timestamp":1778276029465,"segment":35,"confidence":3.0816326530612246,"iterationTokens":8031,"asi":{"hypothesis":"toJSON should use ToPrimitive then call toISOString on any object, not just Date objects, returning null for non-finite ToPrimitive results","improvement":"Reduced Date failures from 89 to 84 (−5) by fixing toJSON to use ToPrimitive and call toISOString on any object per spec","next_action_hint":"Remaining: Symbol.toPrimitive (14), toISOString edge cases (6), toTemporalInstant (8), setHours coercion (4), getTimezoneOffset (3), parse (2), UTC (3)."}}
{"run":876,"commit":"5c08ee9","metric":84,"metrics":{"compiler_test262_cases":594,"compiler_test262_pass":510,"compiler_test262_failures":84,"compiler_test262_compiler_errors":0,"compiler_test262_compiler_crashes":0,"compiler_test262_compiler_fails":0,"compiler_test262_both_fail":83,"compiler_test262_interpreter_fail_compiler_pass":0,"compatibility_pass":510,"compatibility_cases":594,"compiler_errors":0,"compiler_crashes":0,"compiler_fails":0,"both_fail":83,"interpreter_fail_compiler_pass":0,"elapsed_ms":24383},"status":"discard","description":"Confirm 84-failure baseline is stable","timestamp":1778276310043,"segment":35,"confidence":3.247311827956989,"iterationTokens":5349,"asi":{"hypothesis":"Verify 84-failure baseline stability","rollback_reason":"Confirmation run only, no changes","next_action_hint":"Remaining 84 failures: Symbol.toPrimitive (14), toTemporalInstant (8), toISOString (6), setHours coercion (4), getTimezoneOffset (3), parse (2), UTC (3), setter coercion order (~8), constructor edge cases (~10). Many require timezone or Temporal API support."}}
{"run":877,"commit":"ee305a3","metric":75,"metrics":{"compiler_test262_cases":594,"compiler_test262_pass":519,"compiler_test262_failures":75,"compiler_test262_compiler_errors":0,"compiler_test262_compiler_crashes":0,"compiler_test262_compiler_fails":0,"compiler_test262_both_fail":74,"compiler_test262_interpreter_fail_compiler_pass":0,"compatibility_pass":519,"compatibility_cases":594,"compiler_errors":0,"compiler_crashes":0,"compiler_fails":0,"both_fail":74,"interpreter_fail_compiler_pass":0,"elapsed_ms":24223},"status":"keep","description":"Implement Date Symbol.toPrimitive","timestamp":1778276642333,"segment":35,"confidence":3.6363636363636362,"iterationTokens":7440,"asi":{"hypothesis":"Date.prototype needs Symbol.toPrimitive method that uses OrdinaryToPrimitive with string-first for default/string hints and number-first for number hint","improvement":"Reduced Date failures from 84 to 75 (−9) by implementing Date.prototype[Symbol.toPrimitive] with OrdinaryToPrimitive dispatch","next_action_hint":"Remaining 75: toTemporalInstant (8 — needs Temporal API), toISOString (6), toJSON (4), setHours coercion (4), getTimezoneOffset (3), parse (2), UTC (3), constructor/value edge cases."}}
