{"run":1075,"commit":"9c96965","metric":6,"metrics":{"compiler_test262_cases":153,"compiler_test262_pass":147,"compiler_test262_failures":6,"compiler_test262_compiler_errors":0,"compiler_test262_compiler_crashes":0,"compiler_test262_compiler_fails":0,"compiler_test262_both_fail":5,"compiler_test262_interpreter_fail_compiler_pass":0,"compatibility_pass":147,"compatibility_cases":153,"compiler_errors":0,"compiler_crashes":0,"compiler_fails":0,"both_fail":5,"interpreter_fail_compiler_pass":0,"elapsed_ms":10489},"status":"keep","description":"Reject prototype changes on non-extensible objects","timestamp":1778620473812,"segment":52,"confidence":3.935483870967742,"iterationTokens":5312,"asi":{"hypothesis":"Object.setPrototypeOf should throw when changing the prototype of a non-extensible ordinary object; Reflect.preventExtensions tests observe this through Object.setPrototypeOf after preventing extensions."}}
{"run":1076,"commit":"7ea2535","metric":5,"metrics":{"compiler_test262_cases":153,"compiler_test262_pass":148,"compiler_test262_failures":5,"compiler_test262_compiler_errors":0,"compiler_test262_compiler_crashes":0,"compiler_test262_compiler_fails":0,"compiler_test262_both_fail":5,"compiler_test262_interpreter_fail_compiler_pass":0,"compatibility_pass":148,"compatibility_cases":153,"compiler_errors":0,"compiler_crashes":0,"compiler_fails":0,"both_fail":5,"interpreter_fail_compiler_pass":0,"elapsed_ms":7006},"status":"keep","description":"Allow missing Reflect.set value arguments","timestamp":1778620641743,"segment":52,"confidence":5.166666666666667,"iterationTokens":4518,"asi":{"hypothesis":"Reflect.set only requires target and propertyKey before ToPropertyKey; missing value should default to undefined instead of crashing pattern matching so abrupt property-key coercions propagate correctly."}}
{"run":1077,"commit":"f5e5af9","metric":4,"metrics":{"compiler_test262_cases":153,"compiler_test262_pass":149,"compiler_test262_failures":4,"compiler_test262_compiler_errors":0,"compiler_test262_compiler_crashes":0,"compiler_test262_compiler_fails":0,"compiler_test262_both_fail":4,"compiler_test262_interpreter_fail_compiler_pass":0,"compatibility_pass":149,"compatibility_cases":153,"compiler_errors":0,"compiler_crashes":0,"compiler_fails":0,"both_fail":4,"interpreter_fail_compiler_pass":0,"elapsed_ms":6853},"status":"keep","description":"Fall primitive property lookup back to Object prototype","timestamp":1778620877409,"segment":52,"confidence":6.3,"iterationTokens":6343,"asi":{"hypothesis":"Raw primitive property lookup should fall through from the primitive prototype to Object.prototype so calls like string.hasOwnProperty() resolve the inherited Object helper after Reflect.set correctly returns false for primitive receivers."}}
{"type":"config","name":"QuickBEAM Test262 built-ins/Set compatibility","metricName":"compatibility_failures","metricUnit":"","bestDirection":"lower"}
{"run":1078,"commit":"c008608","metric":5,"metrics":{"compiler_test262_cases":300,"compiler_test262_pass":295,"compiler_test262_failures":5,"compiler_test262_compiler_errors":0,"compiler_test262_compiler_crashes":0,"compiler_test262_compiler_fails":0,"compiler_test262_both_fail":5,"compiler_test262_interpreter_fail_compiler_pass":0,"compatibility_pass":295,"compatibility_cases":300,"compiler_errors":0,"compiler_crashes":0,"compiler_fails":0,"both_fail":5,"interpreter_fail_compiler_pass":0,"elapsed_ms":11094},"status":"keep","description":"Baseline built-ins/Set after Reflect improvements","timestamp":1778621022492,"segment":53,"confidence":null,"iterationTokens":127,"asi":{"hypothesis":"Rebaseline the Set bounded workload after the Reflect/Object primitive and property-model fixes; ideas note records Reflect's remaining primitive-target compatibility conflict with core checks."}}
{"run":1079,"commit":"HEAD","metric":5,"metrics":{"compiler_test262_cases":300,"compiler_test262_pass":295,"compiler_test262_failures":5,"compiler_test262_compiler_errors":0,"compiler_test262_compiler_crashes":0,"compiler_test262_compiler_fails":0,"compiler_test262_both_fail":5,"compiler_test262_interpreter_fail_compiler_pass":0,"compatibility_pass":295,"compatibility_cases":300,"compiler_errors":0,"compiler_crashes":0,"compiler_fails":0,"both_fail":5,"interpreter_fail_compiler_pass":0,"elapsed_ms":10909},"status":"discard","description":"Mark Function-constructor output constructable","timestamp":1778621250831,"segment":53,"confidence":null,"iterationTokens":8089,"asi":{"hypothesis":"Functions created by the Function constructor should be constructable, which might clear Set proto-from-newTarget realm construction.","rollback_reason":"Set workload remained at baseline 5 failures; the proto-from-ctor-realm failure did not improve, so constructability was not the active issue or another realm mapping remains broken.","next_action_hint":"Probe Set proto-from-ctor-realm directly and inspect the actual newTarget value/prototype realm metadata rather than changing Function constructor output broadly."}}
{"run":1080,"commit":"b99707a","metric":4,"metrics":{"compiler_test262_cases":300,"compiler_test262_pass":296,"compiler_test262_failures":4,"compiler_test262_compiler_errors":0,"compiler_test262_compiler_crashes":0,"compiler_test262_compiler_fails":0,"compiler_test262_both_fail":4,"compiler_test262_interpreter_fail_compiler_pass":0,"compatibility_pass":296,"compatibility_cases":300,"compiler_errors":0,"compiler_crashes":0,"compiler_fails":0,"both_fail":4,"interpreter_fail_compiler_pass":0,"elapsed_ms":10888},"status":"keep","description":"Treat realm-created functions as constructable newTargets","timestamp":1778621535447,"segment":53,"confidence":null,"iterationTokens":7902,"asi":{"hypothesis":"Realm-created Function-constructor products are anonymous builtin function values with realm intrinsic metadata; Reflect.construct should accept them as constructable newTargets while still rejecting ordinary non-constructable builtins."}}
{"run":1081,"commit":"HEAD","metric":4,"metrics":{"compiler_test262_cases":300,"compiler_test262_pass":296,"compiler_test262_failures":4,"compiler_test262_compiler_errors":0,"compiler_test262_compiler_crashes":0,"compiler_test262_compiler_fails":0,"compiler_test262_both_fail":3,"compiler_test262_interpreter_fail_compiler_pass":0,"compatibility_pass":296,"compatibility_cases":300,"compiler_errors":0,"compiler_crashes":0,"compiler_fails":0,"both_fail":3,"interpreter_fail_compiler_pass":0,"elapsed_ms":22939},"status":"discard","description":"Reuse Set-like record in isSupersetOf","timestamp":1778621709541,"segment":53,"confidence":2,"iterationTokens":1675,"asi":{"hypothesis":"isSupersetOf can reuse the validated Set-like record's size and keys to avoid extra observable size access.","rollback_reason":"Primary compatibility_failures stayed at 4, so the change did not improve the tracked metric even though both_fail dropped; it may have shifted one case to a different failure mode or non-both bucket.","next_action_hint":"Inspect the full log before retrying narrower Set-like ordering changes; do not rely on secondary both_fail alone."}}
{"type":"config","name":"QuickBEAM Test262 built-ins/Function compatibility","metricName":"compatibility_failures","metricUnit":"","bestDirection":"lower"}
{"run":1082,"commit":"b90e95f","metric":101,"metrics":{"compiler_test262_cases":509,"compiler_test262_pass":408,"compiler_test262_failures":101,"compiler_test262_compiler_errors":0,"compiler_test262_compiler_crashes":0,"compiler_test262_compiler_fails":2,"compiler_test262_both_fail":94,"compiler_test262_interpreter_fail_compiler_pass":3,"compatibility_pass":408,"compatibility_cases":509,"compiler_errors":0,"compiler_crashes":0,"compiler_fails":2,"both_fail":94,"interpreter_fail_compiler_pass":3,"elapsed_ms":52527},"status":"keep","description":"Baseline built-ins/Function after Reflect and Set work","timestamp":1778622111742,"segment":54,"confidence":null,"iterationTokens":127,"asi":{"hypothesis":"Rebaseline built-ins/Function after recent Reflect/object-model improvements and document stale Set-like record retries before moving to a larger remaining compatibility cluster."}}
{"run":1083,"commit":"b19614d","metric":96,"metrics":{"compiler_test262_cases":509,"compiler_test262_pass":413,"compiler_test262_failures":96,"compiler_test262_compiler_errors":0,"compiler_test262_compiler_crashes":0,"compiler_test262_compiler_fails":2,"compiler_test262_both_fail":89,"compiler_test262_interpreter_fail_compiler_pass":3,"compatibility_pass":413,"compatibility_cases":509,"compiler_errors":0,"compiler_crashes":0,"compiler_fails":2,"both_fail":89,"interpreter_fail_compiler_pass":3,"elapsed_ms":52785},"status":"keep","description":"Make Function prototype callable","timestamp":1778622404838,"segment":54,"confidence":null,"iterationTokens":20875,"asi":{"hypothesis":"Function.prototype is itself callable and returns undefined; treating the cached Function prototype object as callable in builtin/invocation dispatch and as [object Function] should fix prototype callability and toStringTag semantics without materializing broad descriptor state."}}
{"run":1084,"commit":"aab9478","metric":94,"metrics":{"compiler_test262_cases":509,"compiler_test262_pass":415,"compiler_test262_failures":94,"compiler_test262_compiler_errors":0,"compiler_test262_compiler_crashes":0,"compiler_test262_compiler_fails":2,"compiler_test262_both_fail":87,"compiler_test262_interpreter_fail_compiler_pass":3,"compatibility_pass":415,"compatibility_cases":509,"compiler_errors":0,"compiler_crashes":0,"compiler_fails":2,"both_fail":87,"interpreter_fail_compiler_pass":3,"elapsed_ms":53446},"status":"keep","description":"Allow function objects as prototypes","timestamp":1778622781590,"segment":54,"confidence":3.5,"iterationTokens":20820,"asi":{"hypothesis":"JS function values are objects and can be used as constructor prototypes; construction should honor function-valued prototype properties in interpreter and runtime-helper paths so instances inherit Function.prototype methods through function object prototypes."}}
{"run":1085,"commit":"de789a2","metric":92,"metrics":{"compiler_test262_cases":509,"compiler_test262_pass":417,"compiler_test262_failures":92,"compiler_test262_compiler_errors":0,"compiler_test262_compiler_crashes":0,"compiler_test262_compiler_fails":2,"compiler_test262_both_fail":85,"compiler_test262_interpreter_fail_compiler_pass":3,"compatibility_pass":417,"compatibility_cases":509,"compiler_errors":0,"compiler_crashes":0,"compiler_fails":2,"both_fail":85,"interpreter_fail_compiler_pass":3,"elapsed_ms":52621},"status":"keep","description":"Read target name and length when binding functions","timestamp":1778623104123,"segment":54,"confidence":4.5,"iterationTokens":8839,"asi":{"hypothesis":"Function.prototype.bind should read the target's observable name and length properties instead of only VM metadata, preserving overwritten descriptor values, chained bound names, and ToIntegerOrInfinity length semantics."}}
{"run":1086,"commit":"HEAD","metric":92,"metrics":{"compiler_test262_cases":509,"compiler_test262_pass":417,"compiler_test262_failures":92,"compiler_test262_compiler_errors":0,"compiler_test262_compiler_crashes":0,"compiler_test262_compiler_fails":2,"compiler_test262_both_fail":82,"compiler_test262_interpreter_fail_compiler_pass":6,"compatibility_pass":417,"compatibility_cases":509,"compiler_errors":0,"compiler_crashes":0,"compiler_fails":2,"both_fail":82,"interpreter_fail_compiler_pass":6,"elapsed_ms":52840},"status":"discard","description":"Synthesize bound function name and length descriptors","timestamp":1778623412769,"segment":54,"confidence":4.5,"iterationTokens":6970,"asi":{"hypothesis":"Bound functions need virtual own name/length descriptors in addition to value lookup.","rollback_reason":"Primary metric stayed at 92 and interpreter/compiler split worsened; focused descriptor configurability still failed, likely due DefineProperty/delete semantics for tuple callables rather than descriptor synthesis alone.","next_action_hint":"Before retrying bound descriptors, inspect propertyHelper's verifyConfigurable path on tuple callables and implement coherent Define/Delete support for configurable virtual callable properties."}}
{"run":1087,"commit":"0b212f0","metric":87,"metrics":{"compiler_test262_cases":509,"compiler_test262_pass":422,"compiler_test262_failures":87,"compiler_test262_compiler_errors":0,"compiler_test262_compiler_crashes":0,"compiler_test262_compiler_fails":2,"compiler_test262_both_fail":80,"compiler_test262_interpreter_fail_compiler_pass":3,"compatibility_pass":422,"compatibility_cases":509,"compiler_errors":0,"compiler_crashes":0,"compiler_fails":2,"both_fail":80,"interpreter_fail_compiler_pass":3,"elapsed_ms":52808},"status":"keep","description":"Install Function prototype toString","timestamp":1778623625682,"segment":54,"confidence":7,"iterationTokens":2101,"asi":{"hypothesis":"Function.prototype needs its own toString method that validates the receiver is callable instead of inheriting Object.prototype.toString; this should clear TypeError receiver cases and provide callable native source strings."}}
{"run":1088,"commit":"HEAD","metric":87,"metrics":{"compiler_test262_cases":509,"compiler_test262_pass":422,"compiler_test262_failures":87,"compiler_test262_compiler_errors":0,"compiler_test262_compiler_crashes":0,"compiler_test262_compiler_fails":2,"compiler_test262_both_fail":80,"compiler_test262_interpreter_fail_compiler_pass":3,"compatibility_pass":422,"compatibility_cases":509,"compiler_errors":0,"compiler_crashes":0,"compiler_fails":2,"both_fail":80,"interpreter_fail_compiler_pass":3,"elapsed_ms":52799},"status":"discard","description":"Treat callable proxies as callable","timestamp":1778623875229,"segment":54,"confidence":3.5,"iterationTokens":2918,"asi":{"hypothesis":"Proxy objects with callable targets should be considered callable by Builtin.callable?/1.","rollback_reason":"Function workload stayed at 87 failures and focused Function.prototype.toString proxy case still returned Object.prototype output, so this isolated callable? change did not affect the active failure paths.","next_action_hint":"Inspect Function.prototype.toString proxy path and Get/call dispatch before retrying proxy callable semantics."}}
{"run":1089,"commit":"HEAD","metric":89,"metrics":{"compiler_test262_cases":509,"compiler_test262_pass":420,"compiler_test262_failures":89,"compiler_test262_compiler_errors":0,"compiler_test262_compiler_crashes":0,"compiler_test262_compiler_fails":2,"compiler_test262_both_fail":82,"compiler_test262_interpreter_fail_compiler_pass":3,"compatibility_pass":420,"compatibility_cases":509,"compiler_errors":0,"compiler_crashes":0,"compiler_fails":2,"both_fail":82,"interpreter_fail_compiler_pass":3,"elapsed_ms":52967},"status":"discard","description":"Reject primitive Function.apply argArray","timestamp":1778624104227,"segment":54,"confidence":4,"iterationTokens":1782,"asi":{"hypothesis":"Function.prototype.apply should treat null/undefined argArray as an empty list and reject other primitive argArrays.","rollback_reason":"Focused argarray-not-object passed, but broad Function workload regressed from 87 to 89, likely because legacy Sputnik apply cases depend on current permissive primitive/list handling or need full array-like CreateListFromArrayLike semantics.","next_action_hint":"Do not retry primitive apply rejection alone; implement full CreateListFromArrayLike with length/index reads and verify old Sputnik apply cases together."}}
{"run":1090,"commit":"8fdcca2","metric":85,"metrics":{"compiler_test262_cases":509,"compiler_test262_pass":424,"compiler_test262_failures":85,"compiler_test262_compiler_errors":0,"compiler_test262_compiler_crashes":0,"compiler_test262_compiler_fails":2,"compiler_test262_both_fail":78,"compiler_test262_interpreter_fail_compiler_pass":3,"compatibility_pass":424,"compatibility_cases":509,"compiler_errors":0,"compiler_crashes":0,"compiler_fails":2,"both_fail":78,"interpreter_fail_compiler_pass":3,"elapsed_ms":53528},"status":"keep","description":"Expose bound function prototypes","timestamp":1778629401330,"segment":54,"confidence":4,"iterationTokens":10636,"asi":{"hypothesis":"Bound function exotic objects should expose Function.prototype as their [[Prototype]] to Object.getPrototypeOf and prototype-chain checks such as Function.prototype.isPrototypeOf."}}
{"run":1091,"commit":"c9e6f0a","metric":83,"metrics":{"compiler_test262_cases":509,"compiler_test262_pass":426,"compiler_test262_failures":83,"compiler_test262_compiler_errors":0,"compiler_test262_compiler_crashes":0,"compiler_test262_compiler_fails":2,"compiler_test262_both_fail":76,"compiler_test262_interpreter_fail_compiler_pass":3,"compatibility_pass":426,"compatibility_cases":509,"compiler_errors":0,"compiler_crashes":0,"compiler_fails":2,"both_fail":76,"interpreter_fail_compiler_pass":3,"elapsed_ms":53330},"status":"keep","description":"Stringify bound functions as functions","timestamp":1778629619626,"segment":54,"confidence":5.142857142857143,"iterationTokens":12873,"asi":{"hypothesis":"Bound function exotic objects should have Function branding for Object.prototype.toString rather than falling through to ordinary object branding."}}
{"run":1092,"commit":"bcf4eb0","metric":82,"metrics":{"compiler_test262_cases":509,"compiler_test262_pass":427,"compiler_test262_failures":82,"compiler_test262_compiler_errors":0,"compiler_test262_compiler_crashes":0,"compiler_test262_compiler_fails":2,"compiler_test262_both_fail":75,"compiler_test262_interpreter_fail_compiler_pass":3,"compatibility_pass":427,"compatibility_cases":509,"compiler_errors":0,"compiler_crashes":0,"compiler_fails":2,"both_fail":75,"interpreter_fail_compiler_pass":3,"elapsed_ms":54589},"status":"keep","description":"Reject direct class constructor calls","timestamp":1778629843507,"segment":54,"confidence":4.75,"iterationTokens":2678,"asi":{"hypothesis":"Class constructor function objects should throw TypeError when dispatched via [[Call]] while still remaining constructable via [[Construct]]."}}
{"run":1093,"commit":"HEAD","metric":84,"metrics":{"compiler_test262_cases":509,"compiler_test262_pass":425,"compiler_test262_failures":84,"compiler_test262_compiler_errors":0,"compiler_test262_compiler_crashes":0,"compiler_test262_compiler_fails":2,"compiler_test262_both_fail":77,"compiler_test262_interpreter_fail_compiler_pass":3,"compatibility_pass":425,"compatibility_cases":509,"compiler_errors":0,"compiler_crashes":0,"compiler_fails":2,"both_fail":77,"interpreter_fail_compiler_pass":3,"elapsed_ms":53551},"status":"discard","description":"Implement ordinary Function hasInstance","timestamp":1778630158968,"segment":54,"confidence":4.75,"iterationTokens":5330,"asi":{"hypothesis":"Function.prototype[Symbol.hasInstance] should use OrdinaryHasInstance prototype-chain semantics instead of invoking the constructor.","rollback_reason":"Focused Symbol.hasInstance cases passed, but broad Function regressed from 83 to 84, confirming previous notes that broad OrdinaryHasInstance/prototype-chain changes have edge-case regressions.","next_action_hint":"Before retrying, diff which case regressed and handle poisoned prototype / TypeError propagation precisely; do not reapply broad OrdinaryHasInstance unchanged."}}
{"run":1094,"commit":"4173641","metric":79,"metrics":{"compiler_test262_cases":509,"compiler_test262_pass":430,"compiler_test262_failures":79,"compiler_test262_compiler_errors":0,"compiler_test262_compiler_crashes":0,"compiler_test262_compiler_fails":2,"compiler_test262_both_fail":72,"compiler_test262_interpreter_fail_compiler_pass":3,"compatibility_pass":430,"compatibility_cases":509,"compiler_errors":0,"compiler_crashes":0,"compiler_fails":2,"both_fail":72,"interpreter_fail_compiler_pass":3,"elapsed_ms":54858},"status":"keep","description":"Materialize Function prototype name and length","timestamp":1778630401289,"segment":54,"confidence":4.4,"iterationTokens":2930,"asi":{"hypothesis":"Function.prototype should have own non-enumerable configurable length and name data properties, with length ordered before name, while avoiding the previously regressing broader caller/arguments materialization."}}
{"run":1095,"commit":"HEAD","metric":86,"metrics":{"compiler_test262_cases":509,"compiler_test262_pass":423,"compiler_test262_failures":86,"compiler_test262_compiler_errors":0,"compiler_test262_compiler_crashes":0,"compiler_test262_compiler_fails":2,"compiler_test262_both_fail":80,"compiler_test262_interpreter_fail_compiler_pass":2,"compatibility_pass":423,"compatibility_cases":509,"compiler_errors":0,"compiler_crashes":0,"compiler_fails":2,"both_fail":80,"interpreter_fail_compiler_pass":2,"elapsed_ms":56200},"status":"discard","description":"Materialize Function prototype restricted accessors","timestamp":1778630670116,"segment":54,"confidence":4.888888888888889,"iterationTokens":7140,"asi":{"hypothesis":"Function.prototype caller/arguments should be own restricted accessor properties sharing one thrower function.","rollback_reason":"Focused descriptor/accessor cases passed, but broad Function regressed from 83 to 86, matching earlier warning that broad caller/arguments materialization has interactions with legacy Function tests.","next_action_hint":"Do not retry Function.prototype caller/arguments materialization unchanged; isolate which legacy gs cases regress and implement restricted accessors without breaking non-strict function caller/arguments behavior."}}
