{"run":1556,"commit":"da80c75","metric":49,"metrics":{"compiler_test262_cases":165,"compiler_test262_pass":116,"compiler_test262_failures":49,"compiler_test262_compiler_errors":0,"compiler_test262_compiler_crashes":0,"compiler_test262_compiler_fails":0,"compiler_test262_both_fail":46,"compiler_test262_interpreter_fail_compiler_pass":0,"compatibility_pass":116,"compatibility_cases":165,"compiler_errors":0,"compiler_crashes":0,"compiler_fails":0,"both_fail":46,"interpreter_fail_compiler_pass":0,"elapsed_ms":48732},"status":"keep","description":"Honor JSON replacer array property lists","timestamp":1778824508787,"segment":136,"confidence":8,"iterationTokens":2017,"asi":{"hypothesis":"JSON.stringify should treat array replacers as ordered unique property lists with only String/Number primitives and wrappers contributing keys, while non-array object replacers are ignored."}}
{"run":1557,"commit":"438fe7d","metric":45,"metrics":{"compiler_test262_cases":165,"compiler_test262_pass":120,"compiler_test262_failures":45,"compiler_test262_compiler_errors":0,"compiler_test262_compiler_crashes":0,"compiler_test262_compiler_fails":0,"compiler_test262_both_fail":42,"compiler_test262_interpreter_fail_compiler_pass":0,"compatibility_pass":120,"compatibility_cases":165,"compiler_errors":0,"compiler_crashes":0,"compiler_fails":0,"both_fail":42,"interpreter_fail_compiler_pass":0,"elapsed_ms":48974},"status":"keep","description":"Apply JSON replacer arrays recursively","timestamp":1778824798773,"segment":136,"confidence":10.285714285714286,"iterationTokens":5744,"asi":{"hypothesis":"JSON replacer arrays define a recursive property list for all serialized objects, non-callable non-array replacers are ignored, and numeric special values in replacer arrays stringify to their property names."}}
{"run":1558,"commit":"e64e96b","metric":44,"metrics":{"compiler_test262_cases":165,"compiler_test262_pass":121,"compiler_test262_failures":44,"compiler_test262_compiler_errors":0,"compiler_test262_compiler_crashes":0,"compiler_test262_compiler_fails":0,"compiler_test262_both_fail":41,"compiler_test262_interpreter_fail_compiler_pass":0,"compatibility_pass":121,"compatibility_cases":165,"compiler_errors":0,"compiler_crashes":0,"compiler_fails":0,"both_fail":41,"interpreter_fail_compiler_pass":0,"elapsed_ms":48346},"status":"keep","description":"Honor Number wrapper own properties","timestamp":1778825001931,"segment":136,"confidence":12.333333333333334,"iterationTokens":2615,"asi":{"hypothesis":"Number wrapper objects should let own properties shadow prototype methods before primitive wrapper prototype fallback, matching String and Boolean wrappers and allowing JSON space object coercion to observe overridden valueOf."}}
{"run":1559,"commit":"HEAD","metric":44,"metrics":{"compiler_test262_cases":165,"compiler_test262_pass":121,"compiler_test262_failures":44,"compiler_test262_compiler_errors":0,"compiler_test262_compiler_crashes":0,"compiler_test262_compiler_fails":0,"compiler_test262_both_fail":41,"compiler_test262_interpreter_fail_compiler_pass":0,"compatibility_pass":121,"compatibility_cases":165,"compiler_errors":0,"compiler_crashes":0,"compiler_fails":0,"both_fail":41,"interpreter_fail_compiler_pass":0,"elapsed_ms":49930},"status":"discard","description":"Try JSON boxed primitive serialization","timestamp":1778825200161,"segment":136,"confidence":10.571428571428571,"iterationTokens":2626,"asi":{"hypothesis":"JSON.stringify should serialize boxed String/Number/Boolean objects as their primitive values after any callable toJSON hook.","rollback_reason":"Primary metric stayed unchanged at 44, so wrapper serialization alone does not reduce the active slice.","next_action_hint":"Inspect focused wrapper failures; object shape or WrappedPrimitive slots may not match this hook, or failures are offset by other regressions."}}
{"run":1560,"commit":"HEAD","metric":44,"metrics":{"compiler_test262_cases":165,"compiler_test262_pass":121,"compiler_test262_failures":44,"compiler_test262_compiler_errors":0,"compiler_test262_compiler_crashes":0,"compiler_test262_compiler_fails":0,"compiler_test262_both_fail":41,"compiler_test262_interpreter_fail_compiler_pass":0,"compatibility_pass":121,"compatibility_cases":165,"compiler_errors":0,"compiler_crashes":0,"compiler_fails":0,"both_fail":41,"interpreter_fail_compiler_pass":0,"elapsed_ms":52236},"status":"discard","description":"Throw on direct JSON BigInt serialization","timestamp":1778825406115,"segment":136,"confidence":9.25,"iterationTokens":2183,"asi":{"hypothesis":"JSON.stringify should throw TypeError for direct BigInt values that are not converted by toJSON or a replacer.","rollback_reason":"Primary metric stayed unchanged; direct throwing alone likely swaps some BigInt failures while replacer/toJSON BigInt semantics remain missing.","next_action_hint":"Implement correct SerializeJSONProperty order so toJSON and replacer run before BigInt rejection, rather than rejecting BigInt in the initial to_json conversion."}}
{"run":1561,"commit":"2992f9b","metric":41,"metrics":{"compiler_test262_cases":165,"compiler_test262_pass":124,"compiler_test262_failures":41,"compiler_test262_compiler_errors":0,"compiler_test262_compiler_crashes":0,"compiler_test262_compiler_fails":0,"compiler_test262_both_fail":41,"compiler_test262_interpreter_fail_compiler_pass":0,"compatibility_pass":124,"compatibility_cases":165,"compiler_errors":0,"compiler_crashes":0,"compiler_fails":0,"both_fail":41,"interpreter_fail_compiler_pass":0,"elapsed_ms":7654},"status":"keep","description":"Detect circular JSON structures","timestamp":1778825580503,"segment":136,"confidence":8.88888888888889,"iterationTokens":2809,"asi":{"hypothesis":"JSON.stringify should track the active object stack and throw TypeError for circular object/array structures instead of recursing until the interpreter crashes."}}
{"run":1562,"commit":"HEAD","metric":42,"metrics":{"compiler_test262_cases":165,"compiler_test262_pass":123,"compiler_test262_failures":42,"compiler_test262_compiler_errors":0,"compiler_test262_compiler_crashes":0,"compiler_test262_compiler_fails":0,"compiler_test262_both_fail":42,"compiler_test262_interpreter_fail_compiler_pass":0,"compatibility_pass":123,"compatibility_cases":165,"compiler_errors":0,"compiler_crashes":0,"compiler_fails":0,"both_fail":42,"interpreter_fail_compiler_pass":0,"elapsed_ms":7564},"status":"discard","description":"Pass keys and receiver to JSON toJSON hooks","timestamp":1778825774916,"segment":136,"confidence":8,"iterationTokens":5215,"asi":{"hypothesis":"JSON.stringify should call toJSON with the current property key and with the value as receiver, including array index keys.","rollback_reason":"Primary metric regressed from 41 to 42; the partial arity/key refactor likely changed array/object serialization ordering or exposed missing replacer ordering semantics.","next_action_hint":"Retry only after inspecting which previously passing case regressed; toJSON key/receiver support may need full SerializeJSONProperty ordering with replacer and BigInt handling."}}
{"run":1563,"commit":"HEAD","metric":41,"metrics":{"compiler_test262_cases":165,"compiler_test262_pass":124,"compiler_test262_failures":41,"compiler_test262_compiler_errors":0,"compiler_test262_compiler_crashes":0,"compiler_test262_compiler_fails":0,"compiler_test262_both_fail":41,"compiler_test262_interpreter_fail_compiler_pass":0,"compatibility_pass":124,"compatibility_cases":165,"compiler_errors":0,"compiler_crashes":0,"compiler_fails":0,"both_fail":41,"interpreter_fail_compiler_pass":0,"elapsed_ms":7590},"status":"discard","description":"Treat symbols as omitted JSON values","timestamp":1778825938738,"segment":136,"confidence":6.666666666666667,"iterationTokens":1841,"asi":{"hypothesis":"JSON.stringify should treat Symbol values like undefined: top-level undefined, array slots null, and object properties omitted.","rollback_reason":"Primary metric stayed unchanged at 41; symbol handling alone did not improve the active workload or was offset by another case.","next_action_hint":"Inspect focused value-symbol after the change before retrying; array symbol behavior may require distinguishing top-level from array/object positions."}}
{"run":1564,"commit":"HEAD","metric":42,"metrics":{"compiler_test262_cases":165,"compiler_test262_pass":123,"compiler_test262_failures":42,"compiler_test262_compiler_errors":0,"compiler_test262_compiler_crashes":0,"compiler_test262_compiler_fails":0,"compiler_test262_both_fail":42,"compiler_test262_interpreter_fail_compiler_pass":0,"compatibility_pass":123,"compatibility_cases":165,"compiler_errors":0,"compiler_crashes":0,"compiler_fails":0,"both_fail":42,"interpreter_fail_compiler_pass":0,"elapsed_ms":7599},"status":"discard","description":"Quote JSON strings through UTF-16 units","timestamp":1778826261714,"segment":136,"confidence":6.666666666666667,"iterationTokens":17599,"asi":{"hypothesis":"JSON.stringify should quote strings from UTF-16 code units so lone surrogates become lowercase \\u escapes while valid surrogate pairs remain code points.","rollback_reason":"Primary metric regressed from 41 to 42; replacing all strings with raw placeholders likely interfered with existing raw JSON placeholder restoration or object key/value behavior.","next_action_hint":"Retry only for invalid/WTF-8 strings or integrate custom string quoting at encode boundaries without replacing all ordinary strings with raw fragments."}}
{"run":1565,"commit":"HEAD","metric":41,"metrics":{"compiler_test262_cases":165,"compiler_test262_pass":124,"compiler_test262_failures":41,"compiler_test262_compiler_errors":0,"compiler_test262_compiler_crashes":0,"compiler_test262_compiler_fails":0,"compiler_test262_both_fail":41,"compiler_test262_interpreter_fail_compiler_pass":0,"compatibility_pass":124,"compatibility_cases":165,"compiler_errors":0,"compiler_crashes":0,"compiler_fails":0,"both_fail":41,"interpreter_fail_compiler_pass":0,"elapsed_ms":7582},"status":"discard","description":"Quote invalid JSON strings through UTF-16 units","timestamp":1778826422894,"segment":136,"confidence":6.153846153846154,"iterationTokens":1937,"asi":{"hypothesis":"Only invalid/WTF-8 strings need custom UTF-16 quoting; valid UTF-8 strings can continue through Jason encoding.","rollback_reason":"Primary metric stayed unchanged at 41, so lone-surrogate quoting did not reduce the active slice or focused case still fails elsewhere.","next_action_hint":"Inspect value-string-escape-unicode with the change before retrying; String.valid? may not detect QuickBEAM's surrogate representation or raw placeholders may not restore for top-level strings."}}
{"run":1566,"commit":"a06a47c","metric":37,"metrics":{"compiler_test262_cases":165,"compiler_test262_pass":128,"compiler_test262_failures":37,"compiler_test262_compiler_errors":0,"compiler_test262_compiler_crashes":0,"compiler_test262_compiler_fails":0,"compiler_test262_both_fail":37,"compiler_test262_interpreter_fail_compiler_pass":0,"compatibility_pass":128,"compatibility_cases":165,"compiler_errors":0,"compiler_crashes":0,"compiler_fails":0,"both_fail":37,"interpreter_fail_compiler_pass":0,"elapsed_ms":7570},"status":"keep","description":"Reject revoked proxies during JSON operations","timestamp":1778826596375,"segment":136,"confidence":6.285714285714286,"iterationTokens":5960,"asi":{"hypothesis":"JSON.stringify and replacer-array processing should throw TypeError when they encounter revoked proxies instead of silently serializing proxy internals."}}
{"run":1567,"commit":"HEAD","metric":34,"metrics":{"compiler_test262_cases":165,"compiler_test262_pass":131,"compiler_test262_failures":34,"compiler_test262_compiler_errors":0,"compiler_test262_compiler_crashes":0,"compiler_test262_compiler_fails":0,"compiler_test262_both_fail":34,"compiler_test262_interpreter_fail_compiler_pass":0,"compatibility_pass":131,"compatibility_cases":165,"compiler_errors":0,"compiler_crashes":0,"compiler_fails":0,"both_fail":34,"interpreter_fail_compiler_pass":0,"elapsed_ms":7642},"status":"checks_failed","description":"Try serializing JSON proxy targets through traps","timestamp":1778826738699,"segment":136,"confidence":6.285714285714286,"iterationTokens":7513,"asi":{"hypothesis":"JSON.stringify should treat non-revoked proxies as their target kind, using proxy length/get for array proxies and ownKeys/enumerable/get for object proxies; proxy array replacers should filter keys like arrays.","rollback_reason":"Checks failed due warnings: unused variable and helper placement split grouped `to_json/1` clauses.","next_action_hint":"Retry with proxy helpers placed after all `to_json/1` clauses and unused variable removed; benchmark indicated a likely real reduction to 34."}}
{"run":1568,"commit":"dadbd28","metric":34,"metrics":{"compiler_test262_cases":165,"compiler_test262_pass":131,"compiler_test262_failures":34,"compiler_test262_compiler_errors":0,"compiler_test262_compiler_crashes":0,"compiler_test262_compiler_fails":0,"compiler_test262_both_fail":34,"compiler_test262_interpreter_fail_compiler_pass":0,"compatibility_pass":131,"compatibility_cases":165,"compiler_errors":0,"compiler_crashes":0,"compiler_fails":0,"both_fail":34,"interpreter_fail_compiler_pass":0,"elapsed_ms":7733},"status":"keep","description":"Serialize JSON proxies through traps","timestamp":1778826911188,"segment":136,"confidence":6.714285714285714,"iterationTokens":3952,"asi":{"hypothesis":"JSON.stringify should treat non-revoked proxies according to their target kind, using proxy length/get for array proxies, ownKeys/enumerable/get for object proxies, and proxy array replacers as property lists."}}
{"run":1569,"commit":"57d4714","metric":33,"metrics":{"compiler_test262_cases":165,"compiler_test262_pass":132,"compiler_test262_failures":33,"compiler_test262_compiler_errors":0,"compiler_test262_compiler_crashes":0,"compiler_test262_compiler_fails":0,"compiler_test262_both_fail":33,"compiler_test262_interpreter_fail_compiler_pass":0,"compatibility_pass":132,"compatibility_cases":165,"compiler_errors":0,"compiler_crashes":0,"compiler_fails":0,"both_fail":33,"interpreter_fail_compiler_pass":0,"elapsed_ms":7798},"status":"keep","description":"Invoke JSON root replacer with wrapper","timestamp":1778827101145,"segment":136,"confidence":6.857142857142857,"iterationTokens":4351,"asi":{"hypothesis":"A callable JSON replacer should first be invoked for the root value with an ordinary wrapper object holding the empty-string property."}}
{"run":1570,"commit":"2c8beff","metric":30,"metrics":{"compiler_test262_cases":165,"compiler_test262_pass":135,"compiler_test262_failures":30,"compiler_test262_compiler_errors":0,"compiler_test262_compiler_crashes":0,"compiler_test262_compiler_fails":0,"compiler_test262_both_fail":30,"compiler_test262_interpreter_fail_compiler_pass":0,"compatibility_pass":135,"compatibility_cases":165,"compiler_errors":0,"compiler_crashes":0,"compiler_fails":0,"both_fail":30,"interpreter_fail_compiler_pass":0,"elapsed_ms":7672},"status":"keep","description":"Apply JSON replacer functions to properties","timestamp":1778827319050,"segment":136,"confidence":7.285714285714286,"iterationTokens":3734,"asi":{"hypothesis":"Callable JSON replacers should be invoked for object properties and array indices with the holder as receiver, and their returned values should be serialized recursively."}}
{"run":1571,"commit":"HEAD","metric":30,"metrics":{"compiler_test262_cases":165,"compiler_test262_pass":135,"compiler_test262_failures":30,"compiler_test262_compiler_errors":0,"compiler_test262_compiler_crashes":0,"compiler_test262_compiler_fails":0,"compiler_test262_both_fail":30,"compiler_test262_interpreter_fail_compiler_pass":0,"compatibility_pass":135,"compatibility_cases":165,"compiler_errors":0,"compiler_crashes":0,"compiler_fails":0,"both_fail":30,"interpreter_fail_compiler_pass":0,"elapsed_ms":7704},"status":"discard","description":"Omit root JSON replacer undefined results","timestamp":1778827501321,"segment":136,"confidence":6.8,"iterationTokens":2496,"asi":{"hypothesis":"If the root JSON replacer returns undefined, JSON.stringify should return undefined rather than serializing null.","rollback_reason":"Primary metric stayed unchanged at 30; focused root-undefined semantics alone did not reduce the active slice or was offset.","next_action_hint":"Inspect focused replacer-function-result-undefined after this tweak; array/object property undefined handling may still be wrong."}}
{"run":1572,"commit":"fec1e59","metric":29,"metrics":{"compiler_test262_cases":165,"compiler_test262_pass":136,"compiler_test262_failures":29,"compiler_test262_compiler_errors":0,"compiler_test262_compiler_crashes":0,"compiler_test262_compiler_fails":0,"compiler_test262_both_fail":29,"compiler_test262_interpreter_fail_compiler_pass":0,"compatibility_pass":136,"compatibility_cases":165,"compiler_errors":0,"compiler_crashes":0,"compiler_fails":0,"both_fail":29,"interpreter_fail_compiler_pass":0,"elapsed_ms":9246},"status":"keep","description":"Bind JSON replacer receivers","timestamp":1778827677727,"segment":136,"confidence":6.5,"iterationTokens":2624,"asi":{"hypothesis":"JSON replacer callbacks should be invoked with the root wrapper or current holder as `this`, not through the generic callback path that drops receiver binding."}}
{"run":1573,"commit":"HEAD","metric":29,"metrics":{"compiler_test262_cases":165,"compiler_test262_pass":136,"compiler_test262_failures":29,"compiler_test262_compiler_errors":0,"compiler_test262_compiler_crashes":0,"compiler_test262_compiler_fails":0,"compiler_test262_both_fail":29,"compiler_test262_interpreter_fail_compiler_pass":0,"compatibility_pass":136,"compatibility_cases":165,"compiler_errors":0,"compiler_crashes":0,"compiler_fails":0,"both_fail":29,"interpreter_fail_compiler_pass":0,"elapsed_ms":7708},"status":"discard","description":"Omit root JSON replacer undefined after binding","timestamp":1778827840724,"segment":136,"confidence":6.933333333333334,"iterationTokens":1886,"asi":{"hypothesis":"With receiver binding fixed, a root replacer returning undefined should now reduce replacer-result failures by returning undefined instead of null.","rollback_reason":"Primary metric stayed unchanged at 29; remaining replacer-result failure likely needs array/object property handling rather than root handling.","next_action_hint":"Inspect focused replacer-function-result-undefined; array property undefined may still be serialized as whole-call undefined due encode behavior."}}
{"run":1574,"commit":"HEAD","metric":28,"metrics":{"compiler_test262_cases":165,"compiler_test262_pass":137,"compiler_test262_failures":28,"compiler_test262_compiler_errors":0,"compiler_test262_compiler_crashes":0,"compiler_test262_compiler_fails":0,"compiler_test262_both_fail":28,"compiler_test262_interpreter_fail_compiler_pass":0,"compatibility_pass":137,"compatibility_cases":165,"compiler_errors":0,"compiler_crashes":0,"compiler_fails":0,"both_fail":28,"interpreter_fail_compiler_pass":0,"elapsed_ms":7789},"status":"checks_failed","description":"Try array JSON toJSON hooks","timestamp":1778827900187,"segment":136,"confidence":5.777777777777778,"iterationTokens":2394,"asi":{"hypothesis":"Array objects with own callable toJSON should call that hook before array element serialization, covering array toJSON result/undefined cases.","rollback_reason":"Checks failed because helper placement split grouped to_json/1 clauses.","next_action_hint":"Retry with `json_array_values/2` placed after all `to_json/1` clauses; benchmark indicated likely improvement to 28."}}
{"run":1575,"commit":"b83cc71","metric":28,"metrics":{"compiler_test262_cases":165,"compiler_test262_pass":137,"compiler_test262_failures":28,"compiler_test262_compiler_errors":0,"compiler_test262_compiler_crashes":0,"compiler_test262_compiler_fails":0,"compiler_test262_both_fail":28,"compiler_test262_interpreter_fail_compiler_pass":0,"compatibility_pass":137,"compatibility_cases":165,"compiler_errors":0,"compiler_crashes":0,"compiler_fails":0,"both_fail":28,"interpreter_fail_compiler_pass":0,"elapsed_ms":7723},"status":"keep","description":"Honor array JSON toJSON hooks","timestamp":1778828056171,"segment":136,"confidence":5.3,"iterationTokens":1693,"asi":{"hypothesis":"Array objects with callable toJSON should invoke that hook before array element serialization, including hooks returning undefined or replacement arrays."}}
{"run":1576,"commit":"d55ae38","metric":27,"metrics":{"compiler_test262_cases":165,"compiler_test262_pass":138,"compiler_test262_failures":27,"compiler_test262_compiler_errors":0,"compiler_test262_compiler_crashes":0,"compiler_test262_compiler_fails":0,"compiler_test262_both_fail":27,"compiler_test262_interpreter_fail_compiler_pass":0,"compatibility_pass":138,"compatibility_cases":165,"compiler_errors":0,"compiler_crashes":0,"compiler_fails":0,"both_fail":27,"interpreter_fail_compiler_pass":0,"elapsed_ms":7745},"status":"keep","description":"Serialize boxed JSON primitives","timestamp":1778828228891,"segment":136,"confidence":5.4,"iterationTokens":2567,"asi":{"hypothesis":"JSON.stringify should serialize boxed String, Number, and Boolean objects as their wrapped primitive values when no rawJSON handling applies."}}
