{"run":1461,"commit":"ce26796","metric":20,"metrics":{"compiler_test262_cases":594,"compiler_test262_pass":574,"compiler_test262_failures":20,"compiler_test262_compiler_errors":0,"compiler_test262_compiler_crashes":0,"compiler_test262_compiler_fails":0,"compiler_test262_both_fail":20,"compiler_test262_interpreter_fail_compiler_pass":0,"compatibility_pass":574,"compatibility_cases":594,"compiler_errors":0,"compiler_crashes":0,"compiler_fails":0,"both_fail":20,"interpreter_fail_compiler_pass":0,"elapsed_ms":25553},"status":"discard","description":"Apply timezone offset only to Date component constructor","timestamp":1778801475490,"segment":121,"confidence":1.5,"iterationTokens":5042,"asi":{"hypothesis":"Applying the local timezone offset only for multi-argument Date construction, while leaving local parsing behavior unchanged, should fix the six assertRelativeDateMs local constructor cases plus the localDate toISOString case without the prior parse-related broad regression.","rollback_reason":"Focused remaining cases passed, but the full Date workload regressed from 7 to 20. Many existing constructor/local Date tests rely on the current UTC-like constructor behavior, so even constructor-only offset is too broad.","next_action_hint":"Do not broadly offset all multi-argument Date construction. Target the remaining historical/assertRelativeDateMs and localDate cases via a narrower local timezone model or specific boundary behavior that preserves other constructor tests."}}
{"run":1462,"commit":"ce26796","metric":0,"metrics":{"compiler_test262_cases":594,"compiler_test262_pass":594,"compiler_test262_failures":0,"compiler_test262_compiler_errors":0,"compiler_test262_compiler_crashes":0,"compiler_test262_compiler_fails":0,"compiler_test262_both_fail":0,"compiler_test262_interpreter_fail_compiler_pass":0,"compatibility_pass":594,"compatibility_cases":594,"compiler_errors":0,"compiler_crashes":0,"compiler_fails":0,"both_fail":0,"interpreter_fail_compiler_pass":0,"elapsed_ms":25283},"status":"checks_failed","description":"Use stable zero timezone offset for Date semantics","timestamp":1778801609676,"segment":121,"confidence":1.5,"iterationTokens":6057,"asi":{"hypothesis":"QuickBEAM's Date model is already UTC-based for constructors/getters; returning a stable zero timezone offset should make local Date helpers internally consistent and remove host-timezone-dependent residual Date failures without special-casing individual tests.","rollback_reason":"Benchmark improved Date to 0 failures, but backpressure checks timed out before completing, so the run cannot be kept under autoresearch rules.","next_action_hint":"Retry the same semantic zero-offset change with a longer checks timeout or run checks separately; if checks pass, keep it. This is not benchmark-specific: it removes host-dependent local timezone behavior from the VM Date model."}}
{"run":1463,"commit":"4466d04","metric":0,"metrics":{"compiler_test262_cases":594,"compiler_test262_pass":594,"compiler_test262_failures":0,"compiler_test262_compiler_errors":0,"compiler_test262_compiler_crashes":0,"compiler_test262_compiler_fails":0,"compiler_test262_both_fail":0,"compiler_test262_interpreter_fail_compiler_pass":0,"compatibility_pass":594,"compatibility_cases":594,"compiler_errors":0,"compiler_crashes":0,"compiler_fails":0,"both_fail":0,"interpreter_fail_compiler_pass":0,"elapsed_ms":29196},"status":"keep","description":"Use stable zero timezone offset for Date semantics","timestamp":1778801778425,"segment":121,"confidence":1.5,"iterationTokens":4043,"asi":{"hypothesis":"QuickBEAM's Date implementation has historically used a UTC-only local-time model for component constructors, local getters, and formatting. Returning a stable zero timezone offset makes the Date model internally consistent and removes host-timezone-dependent residual failures without special-casing tests.","result":"Reduced the Date reprise from 7 to 0 failures across 594 cases; backpressure checks passed with an extended timeout.","next_action_hint":"Date is complete for the bounded workload. Rebaseline the next promising compatibility phase, likely Function reprise or Reflect primitive-target semantics, before further experiments."}}
{"type":"config","name":"Optimize QuickBEAM built-ins/Function Test262 compatibility reprise","metricName":"compatibility_failures","metricUnit":"","bestDirection":"lower"}
{"run":1464,"commit":"8395752","metric":12,"metrics":{"compiler_test262_cases":509,"compiler_test262_pass":497,"compiler_test262_failures":12,"compiler_test262_compiler_errors":0,"compiler_test262_compiler_crashes":0,"compiler_test262_compiler_fails":0,"compiler_test262_both_fail":12,"compiler_test262_interpreter_fail_compiler_pass":0,"compatibility_pass":497,"compatibility_cases":509,"compiler_errors":0,"compiler_crashes":0,"compiler_fails":0,"both_fail":12,"interpreter_fail_compiler_pass":0,"elapsed_ms":25474},"status":"keep","description":"Baseline Function reprise after Date completion","timestamp":1778801934845,"segment":122,"confidence":null,"iterationTokens":129,"asi":{"hypothesis":"Date bounded workload is complete, so rebaseline Function reprise to look for remaining broad compatibility wins.","result":"Function baseline is 12 failures out of 509, all shared interpreter/compiler failures.","next_action_hint":"Inspect the 12 failure list; likely old Sputnik strict caller/arguments stack cases plus realm prototype construction behavior."}}
{"run":1465,"commit":"2aa1494","metric":3,"metrics":{"compiler_test262_cases":509,"compiler_test262_pass":506,"compiler_test262_failures":3,"compiler_test262_compiler_errors":0,"compiler_test262_compiler_crashes":0,"compiler_test262_compiler_fails":0,"compiler_test262_both_fail":2,"compiler_test262_interpreter_fail_compiler_pass":1,"compatibility_pass":506,"compatibility_cases":509,"compiler_errors":0,"compiler_crashes":0,"compiler_fails":0,"both_fail":2,"interpreter_fail_compiler_pass":1,"elapsed_ms":25181},"status":"keep","description":"Track active callers for restricted function properties","timestamp":1778802499083,"segment":122,"confidence":null,"iterationTokens":48560,"asi":{"hypothesis":"Non-strict function caller/arguments access must throw when the active caller is a strict function. Maintaining a process-local active function stack for interpreter and compiled calls, and routing virtual caller/arguments reads through Function.proto_property, should fix the Sputnik strict caller cluster.","result":"Reduced Function reprise from 12 to 3 failures; checks passed. Most strict caller/arguments stack cases now throw TypeError as expected.","next_action_hint":"Inspect remaining Function failures. One indirect-eval strict caller case may still lack caller stack propagation through eval, and proto-from-ctor-realm-prototype remains a realm dynamic Function construction issue."}}
{"run":1466,"commit":"5a1f8e0","metric":2,"metrics":{"compiler_test262_cases":509,"compiler_test262_pass":507,"compiler_test262_failures":2,"compiler_test262_compiler_errors":0,"compiler_test262_compiler_crashes":0,"compiler_test262_compiler_fails":0,"compiler_test262_both_fail":2,"compiler_test262_interpreter_fail_compiler_pass":0,"compatibility_pass":507,"compatibility_cases":509,"compiler_errors":0,"compiler_crashes":0,"compiler_fails":0,"both_fail":2,"interpreter_fail_compiler_pass":0,"elapsed_ms":27734},"status":"keep","description":"Skip eval frames for restricted caller checks","timestamp":1778802760167,"segment":122,"confidence":10,"iterationTokens":6653,"asi":{"hypothesis":"Strict eval frames are not ordinary function callers for Function.prototype.caller restrictions. Skipping VM predefined/eval frames in the active caller stack should preserve strict-function caller TypeErrors while avoiding false positives for direct strict eval scripts.","result":"Reduced Function reprise from 3 to 2 failures and removed the interpreter/compiler split for 15.3.5.4_2-12gs; checks passed.","next_action_hint":"Remaining failures are likely only inherited strictness for indirect eval inside strict functions (15.3.5.4_2-13gs) and realm dynamic Function prototype semantics."}}
{"type":"config","name":"Optimize QuickBEAM built-ins/Object Test262 compatibility sanity slice","metricName":"compatibility_failures","metricUnit":"","bestDirection":"lower"}
{"run":1467,"commit":"5571d48","metric":30,"metrics":{"compiler_test262_cases":1000,"compiler_test262_pass":970,"compiler_test262_failures":30,"compiler_test262_compiler_errors":0,"compiler_test262_compiler_crashes":0,"compiler_test262_compiler_fails":0,"compiler_test262_both_fail":30,"compiler_test262_interpreter_fail_compiler_pass":0,"compatibility_pass":970,"compatibility_cases":1000,"compiler_errors":0,"compiler_crashes":0,"compiler_fails":0,"both_fail":30,"interpreter_fail_compiler_pass":0,"elapsed_ms":49731},"status":"keep","description":"Baseline Object sanity slice after Function reprise","timestamp":1778803014963,"segment":123,"confidence":null,"iterationTokens":129,"asi":{"hypothesis":"Function is down to two hard residual cases, so rebaseline the 1000-case Object sanity slice to look for larger remaining semantic clusters.","result":"Object sanity baseline is 30 failures out of 1000, all shared interpreter/compiler failures.","next_action_hint":"Cluster the Object failures and prefer real descriptor/prototype/defineProperty semantic fixes over broad descriptor-field presence changes that regressed previous Object runs."}}
{"run":1468,"commit":"0325a5b","metric":22,"metrics":{"compiler_test262_cases":1000,"compiler_test262_pass":978,"compiler_test262_failures":22,"compiler_test262_compiler_errors":0,"compiler_test262_compiler_crashes":0,"compiler_test262_compiler_fails":0,"compiler_test262_both_fail":22,"compiler_test262_interpreter_fail_compiler_pass":0,"compatibility_pass":978,"compatibility_cases":1000,"compiler_errors":0,"compiler_crashes":0,"compiler_fails":0,"both_fail":22,"interpreter_fail_compiler_pass":0,"elapsed_ms":48410},"status":"keep","description":"Reject array length shrink over nonconfigurable indices","timestamp":1778803472037,"segment":123,"confidence":null,"iterationTokens":23148,"asi":{"hypothesis":"Array [[DefineOwnProperty]] for length must reject shrinking below non-configurable indexed properties even outside strict assignment semantics. The existing path routed through Put.put, which silently preserved length for non-strict failed writes instead of throwing for defineProperty/defineProperties.","result":"Reduced Object sanity slice from 30 to 22 failures; checks passed. The array length descriptor cluster in Object.defineProperties now rejects invalid shrinks correctly.","next_action_hint":"Inspect remaining Object failures; RegExp-as-properties-object cases still look promising but require defining/enumerating RegExp side properties through Object.defineProperty without treating RegExp as non-object."}}
{"run":1469,"commit":"0c76473","metric":6,"metrics":{"compiler_test262_cases":1000,"compiler_test262_pass":994,"compiler_test262_failures":6,"compiler_test262_compiler_errors":0,"compiler_test262_compiler_crashes":0,"compiler_test262_compiler_fails":0,"compiler_test262_both_fail":6,"compiler_test262_interpreter_fail_compiler_pass":0,"compatibility_pass":994,"compatibility_cases":1000,"compiler_errors":0,"compiler_crashes":0,"compiler_fails":0,"both_fail":6,"interpreter_fail_compiler_pass":0,"elapsed_ms":48787},"status":"keep","description":"Enumerate RegExp side properties for descriptors","timestamp":1778803836813,"segment":123,"confidence":3,"iterationTokens":6729,"asi":{"hypothesis":"RegExp instances can be ordinary properties objects for Object.create/Object.defineProperties. RegExp side-table properties created via Object.defineProperty should make the RegExp value descriptor-like and enumerable, while internal RegExp state keys such as flags/source/lastIndex must not appear as descriptor properties.","result":"Reduced Object sanity slice from 22 to 6 failures; checks passed. RegExp-as-properties-object create/defineProperties cases now invoke descriptor getters with the RegExp receiver and define target properties.","next_action_hint":"Inspect the remaining six Object sanity failures; they are likely residual array length descriptor attribute edge cases or descriptor-object field presence issues."}}
{"run":1470,"commit":"e62fdd0","metric":2,"metrics":{"compiler_test262_cases":1000,"compiler_test262_pass":998,"compiler_test262_failures":2,"compiler_test262_compiler_errors":0,"compiler_test262_compiler_crashes":0,"compiler_test262_compiler_fails":0,"compiler_test262_both_fail":2,"compiler_test262_interpreter_fail_compiler_pass":0,"compatibility_pass":998,"compatibility_cases":1000,"compiler_errors":0,"compiler_crashes":0,"compiler_fails":0,"both_fail":2,"interpreter_fail_compiler_pass":0,"elapsed_ms":48384},"status":"keep","description":"Preserve partial array length shrink semantics","timestamp":1778804091095,"segment":123,"confidence":2.8,"iterationTokens":4890,"asi":{"hypothesis":"Array length DefineOwnProperty shrink attempts over non-configurable indices must perform the spec's partial deletion/length preservation before throwing: delete configurable indices above the blocking index, preserve length at blocking+1, and apply a requested non-writable length attribute.","result":"Reduced Object sanity slice from 6 to 2 failures; checks passed. Remaining Object failures are now a RegExp descriptor incompatibility case and an array index descriptor default attribute case.","next_action_hint":"Inspect the remaining two failures: Object.defineProperties 6-a-19 needs RegExp side-property descriptor compatibility checks; 6-a-219 needs existing array-index descriptor defaults for omitted configurable/enumerable fields."}}
{"run":1471,"commit":"d34a18c","metric":1,"metrics":{"compiler_test262_cases":1000,"compiler_test262_pass":999,"compiler_test262_failures":1,"compiler_test262_compiler_errors":0,"compiler_test262_compiler_crashes":0,"compiler_test262_compiler_fails":0,"compiler_test262_both_fail":1,"compiler_test262_interpreter_fail_compiler_pass":0,"compatibility_pass":999,"compatibility_cases":1000,"compiler_errors":0,"compiler_crashes":0,"compiler_fails":0,"both_fail":1,"interpreter_fail_compiler_pass":0,"elapsed_ms":49253},"status":"keep","description":"Respect RegExp side property descriptors","timestamp":1778804604843,"segment":123,"confidence":5.8,"iterationTokens":28529,"asi":{"hypothesis":"RegExp side-table properties defined through Object.defineProperty need ordinary descriptor attributes for OwnProperty, Put, Delete, and incompatible redefinition checks; otherwise RegExp targets behave like non-descriptor side storage.","result":"Reduced Object sanity slice from 2 to 1 failures; checks passed. The remaining failure is the array index descriptor configurability verification case 15.2.3.7-6-a-219.","next_action_hint":"Investigate why propertyHelper's isConfigurable path still observes array index 0 as configurable in 6-a-219 despite direct descriptor/delete probes showing configurable:false and delete returning false."}}
{"run":1472,"commit":"36b6456","metric":0,"metrics":{"compiler_test262_cases":1000,"compiler_test262_pass":1000,"compiler_test262_failures":0,"compiler_test262_compiler_errors":0,"compiler_test262_compiler_crashes":0,"compiler_test262_compiler_fails":0,"compiler_test262_both_fail":0,"compiler_test262_interpreter_fail_compiler_pass":0,"compatibility_pass":1000,"compatibility_cases":1000,"compiler_errors":0,"compiler_crashes":0,"compiler_fails":0,"both_fail":0,"interpreter_fail_compiler_pass":0,"elapsed_ms":48130},"status":"keep","description":"Preserve array index descriptor attrs on undefined writes","timestamp":1778804835020,"segment":123,"confidence":5.8,"iterationTokens":3454,"asi":{"hypothesis":"Writing undefined to an existing array index should preserve that property's descriptor attributes. The previous explicit-undefined marker overwrote non-configurable/non-enumerable descriptors with default enumerable configurable metadata during propertyHelper writability probes.","result":"Reduced the Object 1000-case sanity slice from 1 to 0 failures; checks passed.","next_action_hint":"The Object sanity slice is complete. Rebaseline the next compatibility phase, likely Reflect primitive-target behavior or full Function residuals, before continuing."}}
{"type":"config","name":"Optimize QuickBEAM built-ins/Object 2500-case compatibility slice","metricName":"compatibility_failures","metricUnit":"","bestDirection":"lower"}
{"run":1473,"commit":"6906ac0","metric":7,"metrics":{"compiler_test262_cases":2500,"compiler_test262_pass":2493,"compiler_test262_failures":7,"compiler_test262_compiler_errors":0,"compiler_test262_compiler_crashes":0,"compiler_test262_compiler_fails":0,"compiler_test262_both_fail":5,"compiler_test262_interpreter_fail_compiler_pass":2,"compatibility_pass":2493,"compatibility_cases":2500,"compiler_errors":0,"compiler_crashes":0,"compiler_fails":0,"both_fail":5,"interpreter_fail_compiler_pass":2,"elapsed_ms":124273},"status":"keep","description":"Baseline Object 2500-case slice after sanity completion","timestamp":1778805098444,"segment":124,"confidence":null,"iterationTokens":130,"asi":{"hypothesis":"The 1000-case Object sanity slice is complete, so rebaseline the broader stable 2500-case Object workload to find remaining semantic gaps exposed later in the suite.","result":"Object 2500-case baseline is 7 failures: 5 shared failures and 2 interpreter-only/compiler-pass path skews.","next_action_hint":"Inspect the 7 failure list from the broad Object run; prefer clusters that are not known Test262/Node expectation mismatches before making changes."}}
{"run":1474,"commit":"b4c392b","metric":6,"metrics":{"compiler_test262_cases":2500,"compiler_test262_pass":2494,"compiler_test262_failures":6,"compiler_test262_compiler_errors":0,"compiler_test262_compiler_crashes":0,"compiler_test262_compiler_fails":0,"compiler_test262_both_fail":4,"compiler_test262_interpreter_fail_compiler_pass":2,"compatibility_pass":2494,"compatibility_cases":2500,"compiler_errors":0,"compiler_crashes":0,"compiler_fails":0,"both_fail":4,"interpreter_fail_compiler_pass":2,"elapsed_ms":123063},"status":"keep","description":"Give descriptor objects ordinary prototypes","timestamp":1778805417001,"segment":124,"confidence":null,"iterationTokens":4708,"asi":{"hypothesis":"Objects returned by Object.getOwnPropertyDescriptor are ordinary descriptor objects, so they should inherit from Object.prototype and satisfy instanceof Object instead of being prototype-less heap maps.","result":"Reduced Object 2500-case slice from 7 to 6 by fixing getOwnPropertyDescriptor/15.2.3.3-4-247.js; checks passed.","next_action_hint":"Remaining shared Object failures are inherited RegExp prototype enumeration and JSON inherited read-only/getter write semantics; two typed-array resizable-buffer cases are interpreter-only/compiler-pass and may be deeper typed-array/native-bytecode skew."}}
{"run":1475,"commit":"c852aaf","metric":2,"metrics":{"compiler_test262_cases":2500,"compiler_test262_pass":2498,"compiler_test262_failures":2,"compiler_test262_compiler_errors":0,"compiler_test262_compiler_crashes":0,"compiler_test262_compiler_fails":0,"compiler_test262_both_fail":0,"compiler_test262_interpreter_fail_compiler_pass":2,"compatibility_pass":2498,"compatibility_cases":2500,"compiler_errors":0,"compiler_crashes":0,"compiler_fails":0,"both_fail":0,"interpreter_fail_compiler_pass":2,"elapsed_ms":123920},"status":"keep","description":"Respect inherited Object prototype writes on builtin objects","timestamp":1778805896970,"segment":124,"confidence":5,"iterationTokens":24581,"asi":{"hypothesis":"Non-callable builtin namespace objects such as JSON should use the same callable/static property write path as other builtin objects so inherited Object.prototype read-only data properties and getter-only accessors prevent creating shadowing own statics.","result":"Reduced Object 2500-case slice from 6 to 2 failures; checks passed. Shared failures are gone; remaining failures are interpreter-only/compiler-pass typed-array resizable-buffer cases.","next_action_hint":"Remaining Object 2500 failures are typedarray-backed-by-resizable-buffer for Object.defineProperty/defineProperties. Treat them as native-bytecode/interpreter typed-array skew; avoid broad typed-array copyWithin/presence retries known to regress."}}
{"type":"config","name":"Optimize QuickBEAM built-ins/Function residual compatibility","metricName":"compatibility_failures","metricUnit":"","bestDirection":"lower"}
{"run":1476,"commit":"93383b0","metric":2,"metrics":{"compiler_test262_cases":509,"compiler_test262_pass":507,"compiler_test262_failures":2,"compiler_test262_compiler_errors":0,"compiler_test262_compiler_crashes":0,"compiler_test262_compiler_fails":0,"compiler_test262_both_fail":2,"compiler_test262_interpreter_fail_compiler_pass":0,"compatibility_pass":507,"compatibility_cases":509,"compiler_errors":0,"compiler_crashes":0,"compiler_fails":0,"both_fail":2,"interpreter_fail_compiler_pass":0,"elapsed_ms":25199},"status":"keep","description":"Baseline Function residual after Object improvements","timestamp":1778806247996,"segment":125,"confidence":null,"iterationTokens":127,"asi":{"hypothesis":"Object 2500 remaining failures are typed-array interpreter-only skew, so rebaseline Function residual workload to see if the two hard failures remain isolated and potentially tractable.","result":"Function residual baseline remains 2 failures out of 509, both shared interpreter/compiler failures.","next_action_hint":"Inspect 15.3.5.4_2-13gs indirect eval strict caller and proto-from-ctor-realm-prototype; avoid previously discarded broad caller stack and partial realm Function metadata attempts."}}
{"type":"config","name":"Optimize QuickBEAM built-ins/Reflect bounded compatibility","metricName":"compatibility_failures","metricUnit":"","bestDirection":"lower"}
