{"run":247,"commit":"d923cec","metric":467,"metrics":{"parser_tests":247,"parser_test_ms":500},"status":"keep","description":"Port labeled break continue coverage","timestamp":1777220916194,"segment":0,"confidence":4,"iterationTokens":3888,"asi":{"hypothesis":"Nested labeled statements should compose with for/while loops and labeled break/continue targets.","learned":"No implementation change was required; labeled statements preserve identifier labels and break/continue statements preserve optional label identifiers.","quickjs_cases":"Adds QuickJS-compatible control-flow coverage for nested labels with `continue outer` and `break inner`."}}
{"run":248,"commit":"d923cec","metric":469,"metrics":{"parser_tests":248,"parser_test_ms":600},"status":"checks_failed","description":"Port empty statement coverage","timestamp":1777221002943,"segment":0,"confidence":4,"iterationTokens":1120,"asi":{"hypothesis":"Empty statements should parse both as standalone statements and as loop/branch bodies.","rollback_reason":"Backpressure failed in known unrelated Process.monitor flake (`noproc` instead of `kaboom`) while parser tests passed.","next_action_hint":"Re-add empty statement coverage and rerun; keep if checks pass.","quickjs_cases":"Attempted QuickJS-compatible coverage for standalone empty statements and empty loop/if bodies."}}
{"run":249,"commit":"ed21306","metric":469,"metrics":{"parser_tests":248,"parser_test_ms":500},"status":"keep","description":"Port empty statement coverage","timestamp":1777221081341,"segment":0,"confidence":4.017391304347826,"iterationTokens":1535,"asi":{"hypothesis":"Empty statements should parse both as standalone statements and as loop/branch bodies.","learned":"No implementation change was required; empty statements are represented as EmptyStatement and can appear as statement bodies for while/if branches.","quickjs_cases":"Adds QuickJS-compatible coverage for standalone empty statements and empty loop/if bodies after retrying a transient web API flake."}}
{"run":250,"commit":"8341533","metric":471,"metrics":{"parser_tests":249,"parser_test_ms":500},"status":"keep","description":"Port throw line terminator diagnostics","timestamp":1777221171135,"segment":0,"confidence":4,"iterationTokens":1127,"asi":{"hypothesis":"Throw statements should report a diagnostic when a line terminator appears before the thrown expression.","learned":"No implementation change was required; throw parsing emits `line terminator after throw`, returns a nil argument, and continues parsing the following expression statement.","quickjs_cases":"Adds QuickJS-compatible diagnostic coverage for `throw\\nerror`."}}
{"run":251,"commit":"f7eb64d","metric":473,"metrics":{"parser_tests":250,"parser_test_ms":600},"status":"keep","description":"Port return line terminator coverage","timestamp":1777221252662,"segment":0,"confidence":3.982905982905983,"iterationTokens":944,"asi":{"hypothesis":"Return statements should apply ASI when a line terminator appears before an expression.","learned":"No implementation change was required; return parsing preserves nil argument before a line terminator and parses the next line as a separate expression statement.","quickjs_cases":"Adds QuickJS-compatible ASI coverage for `return\\nvalue` inside a function."}}
{"run":252,"commit":"e44ad93","metric":475,"metrics":{"parser_tests":251,"parser_test_ms":500},"status":"checks_failed","description":"Port yield line terminator coverage","timestamp":1777221357341,"segment":0,"confidence":3.982905982905983,"iterationTokens":1048,"asi":{"hypothesis":"Yield expressions should apply ASI when a line terminator appears before the yielded expression.","rollback_reason":"Backpressure failed in known unrelated Process.monitor flake while parser tests passed.","next_action_hint":"Re-add yield line terminator coverage and rerun; keep if checks pass.","quickjs_cases":"Attempted QuickJS-compatible ASI coverage for `yield\\nvalue` inside a generator."}}
{"run":253,"commit":"69cefc6","metric":475,"metrics":{"parser_tests":251,"parser_test_ms":500},"status":"keep","description":"Port yield line terminator coverage","timestamp":1777221443648,"segment":0,"confidence":4,"iterationTokens":1551,"asi":{"hypothesis":"Yield expressions should apply ASI when a line terminator appears before the yielded expression.","learned":"No implementation change was required; yield parsing returns an expression with nil argument before a line terminator and the following identifier becomes a separate statement.","quickjs_cases":"Adds QuickJS-compatible ASI coverage for `yield\\nvalue` inside a generator after retrying a transient web API flake."}}
{"run":254,"commit":"fc3efe0","metric":477,"metrics":{"parser_tests":252,"parser_test_ms":500},"status":"keep","description":"Port do-while optional semicolon coverage","timestamp":1777221520170,"segment":0,"confidence":3.983050847457627,"iterationTokens":1052,"asi":{"hypothesis":"Do-while parsing should accept omitted trailing semicolons and continue with the next statement.","learned":"No implementation change was required; do-while parsing consumes an optional semicolon and leaves the following identifier as a separate expression statement.","quickjs_cases":"Adds QuickJS-compatible control-flow coverage for `do { ... } while (test)` without a semicolon."}}
{"run":255,"commit":"01370ca","metric":479,"metrics":{"parser_tests":253,"parser_test_ms":500},"status":"keep","description":"Port switch middle default coverage","timestamp":1777221640870,"segment":0,"confidence":4.034188034188034,"iterationTokens":1135,"asi":{"hypothesis":"Switch parsing should allow the default clause to appear between case clauses while preserving order.","learned":"No implementation change was required; switch case parsing stores clauses in source order and represents default with nil test regardless of position.","quickjs_cases":"Adds QuickJS-compatible switch coverage for `case`, `default`, then another `case`."}}
{"run":256,"commit":"8248b8b","metric":481,"metrics":{"parser_tests":254,"parser_test_ms":500},"status":"keep","description":"Port duplicate switch default diagnostics","timestamp":1777221768724,"segment":0,"confidence":4.016949152542373,"iterationTokens":3185,"asi":{"hypothesis":"Switch parsing should report duplicate default clauses while still recovering the full switch body.","learned":"Switch case parsing now tracks whether a default clause was already seen and emits `duplicate default clause` on later defaults while preserving all clauses.","quickjs_cases":"Adds QuickJS-compatible switch diagnostics for two default clauses separated by a case."}}
{"run":257,"commit":"91c374b","metric":483,"metrics":{"parser_tests":255,"parser_test_ms":500},"status":"keep","description":"Port duplicate constructor diagnostics","timestamp":1777221887485,"segment":0,"confidence":4,"iterationTokens":2081,"asi":{"hypothesis":"Class parsing should report duplicate non-static constructor methods while preserving both method nodes for recovery.","learned":"Class tail parsing now validates the parsed class body and emits `duplicate constructor` when more than one MethodDefinition has kind `:constructor`.","quickjs_cases":"Adds QuickJS-compatible class diagnostics for two constructor methods in one class body."}}
{"run":258,"commit":"541f49a","metric":485,"metrics":{"parser_tests":256,"parser_test_ms":500},"status":"keep","description":"Port static constructor non-duplicate coverage","timestamp":1777221986286,"segment":0,"confidence":4.016806722689076,"iterationTokens":1069,"asi":{"hypothesis":"A static method named `constructor` should not count as a duplicate class constructor.","learned":"No implementation change was required after duplicate-constructor validation; static `constructor` methods keep kind `:method` and are excluded from duplicate constructor counting.","quickjs_cases":"Adds QuickJS-compatible class coverage for a real constructor plus a static method named `constructor`."}}
{"run":259,"commit":"eecdd87","metric":487,"metrics":{"parser_tests":257,"parser_test_ms":500},"status":"keep","description":"Port constructor accessor non-duplicate coverage","timestamp":1777222058149,"segment":0,"confidence":4.033613445378151,"iterationTokens":1004,"asi":{"hypothesis":"Class accessors named `constructor` should not count as duplicate constructors when a real constructor is present.","learned":"No implementation change was required; duplicate-constructor validation only counts MethodDefinition nodes with kind `:constructor`, excluding `:get`/`:set` accessors.","quickjs_cases":"Adds QuickJS-compatible class coverage for a constructor plus a getter named `constructor`."}}
{"run":260,"commit":"5d18838","metric":489,"metrics":{"parser_tests":258,"parser_test_ms":500},"status":"keep","description":"Port break continue line terminator coverage","timestamp":1777222169074,"segment":0,"confidence":4.016666666666667,"iterationTokens":4044,"asi":{"hypothesis":"Break and continue statements should apply ASI when a line terminator appears before a potential label identifier.","learned":"No implementation change was required; break/continue parsing checks token line-terminator metadata and leaves the next-line identifier as a separate expression statement.","quickjs_cases":"Adds QuickJS-compatible ASI coverage for `break\\nlabel` and `continue\\nlabel`."}}
{"run":261,"commit":"4cd9209","metric":491,"metrics":{"parser_tests":259,"parser_test_ms":500},"status":"keep","description":"Port try finally coverage","timestamp":1777222263965,"segment":0,"confidence":4,"iterationTokens":1036,"asi":{"hypothesis":"Try statement parsing should support a finalizer without a catch clause.","learned":"No implementation change was required; try parsing preserves nil handler and a populated finalizer block for `try ... finally`.","quickjs_cases":"Adds QuickJS-compatible control-flow coverage for `try { work(); } finally { cleanup(); }`."}}
{"run":262,"commit":"059b3b3","metric":493,"metrics":{"parser_tests":260,"parser_test_ms":500},"status":"keep","description":"Port try catch finally coverage","timestamp":1777222343641,"segment":0,"confidence":4.016528925619835,"iterationTokens":971,"asi":{"hypothesis":"Try statement parsing should support catch and finally clauses together in source order.","learned":"No implementation change was required; try parsing preserves block, catch clause with parameter, and finalizer block in a single TryStatement.","quickjs_cases":"Adds QuickJS-compatible control-flow coverage for `try ... catch (error) ... finally ...`."}}
{"run":263,"commit":"d71c4c6","metric":495,"metrics":{"parser_tests":261,"parser_test_ms":500},"status":"keep","description":"Port try missing handler diagnostics","timestamp":1777222448829,"segment":0,"confidence":4.033057851239669,"iterationTokens":1197,"asi":{"hypothesis":"Try statements without catch or finally should report a syntax diagnostic while preserving the try block for recovery.","learned":"No implementation change was required; try parsing emits `expected catch or finally` and keeps a TryStatement with nil handler/finalizer.","quickjs_cases":"Adds QuickJS-compatible diagnostics for `try { work(); }` without catch/finally."}}
{"run":264,"commit":"d71c4c6","metric":495,"metrics":{"parser_tests":261,"parser_test_ms":500},"status":"discard","description":"Refresh optional catch binding coverage","timestamp":1777222549064,"segment":0,"confidence":4,"iterationTokens":1481,"asi":{"hypothesis":"Optional catch binding coverage may add focused QuickJS-compatible parser coverage.","rollback_reason":"The primary metric did not increase because an optional catch binding test already existed; keeping would be metric gaming rather than meaningful coverage growth.","next_action_hint":"Avoid replacing existing parser coverage; add only genuinely new focused QuickJS-derived cases.","learned":"Optional catch binding is already represented in the current parser test tree."}}
{"run":265,"commit":"42d12ff","metric":497,"metrics":{"parser_tests":262,"parser_test_ms":500},"status":"keep","description":"Port empty catch binding diagnostics","timestamp":1777222757335,"segment":0,"confidence":3.983739837398374,"iterationTokens":1481,"asi":{"hypothesis":"A catch clause with empty parentheses should be diagnosed rather than treated as optional catch binding.","learned":"No implementation change was required; catch binding parsing emits `expected binding identifier` for `catch ()` and recovers a catch clause node.","quickjs_cases":"Adds QuickJS-compatible diagnostics for `try { ... } catch () { ... }`."}}
{"run":266,"commit":"8d468c4","metric":499,"metrics":{"parser_tests":263,"parser_test_ms":500},"status":"keep","description":"Port reserved property name coverage","timestamp":1777222826180,"segment":0,"confidence":4,"iterationTokens":5081,"asi":{"hypothesis":"Reserved words should be accepted as object literal property names and method names even when they are invalid binding identifiers.","learned":"No implementation change was required; property-key parsing accepts keyword tokens for data properties and methods.","quickjs_cases":"Adds QuickJS-compatible object literal coverage for reserved keys `default`, `class`, and method name `import`."}}
{"run":267,"commit":"dc36d30","metric":501,"metrics":{"parser_tests":264,"parser_test_ms":500},"status":"keep","description":"Port reserved class member coverage","timestamp":1777222889953,"segment":0,"confidence":4.016260162601626,"iterationTokens":1561,"asi":{"hypothesis":"Reserved words should be accepted as class member names for methods, fields, and static methods.","learned":"No implementation change was required; class property-key parsing accepts keyword tokens across method, field, and static member forms.","quickjs_cases":"Adds QuickJS-compatible class coverage for reserved member names `default`, `class`, and static `import`."}}
{"run":268,"commit":"fee7d7a","metric":503,"metrics":{"parser_tests":265,"parser_test_ms":500},"status":"keep","description":"Port duplicate proto property diagnostics","timestamp":1777222970764,"segment":0,"confidence":4,"iterationTokens":3597,"asi":{"hypothesis":"Object literal parsing should report duplicate non-computed data properties named `__proto__` while preserving the object AST for recovery.","learned":"Object expression parsing now validates completed property lists and emits `duplicate __proto__ property` when multiple non-computed data properties use the prototype special name.","quickjs_cases":"Adds QuickJS-compatible diagnostics for `{ __proto__: first, \"__proto__\": second }`."}}
{"run":269,"commit":"a2a9ec4","metric":505,"metrics":{"parser_tests":266,"parser_test_ms":500},"status":"keep","description":"Port proto method non-duplicate coverage","timestamp":1777223018252,"segment":0,"confidence":4.048780487804878,"iterationTokens":1054,"asi":{"hypothesis":"Only non-computed data properties named `__proto__` should participate in duplicate-prototype diagnostics; methods and computed keys should remain valid.","learned":"No implementation change was required after duplicate-proto validation; method and computed `__proto__` properties are excluded from the duplicate data-property count.","quickjs_cases":"Adds QuickJS-compatible object literal coverage for `__proto__` data property plus method and computed forms."}}
{"run":270,"commit":"9f4046e","metric":507,"metrics":{"parser_tests":267,"parser_test_ms":500},"status":"keep","description":"Port proto shorthand non-duplicate coverage","timestamp":1777223080093,"segment":0,"confidence":4.032258064516129,"iterationTokens":993,"asi":{"hypothesis":"A shorthand property named `__proto__` should not count as a prototype data property duplicate.","learned":"No implementation change was required; duplicate-proto validation excludes shorthand properties and still permits one prototype data property in the same object literal.","quickjs_cases":"Adds QuickJS-compatible object literal coverage for `{ __proto__, __proto__: base }`."}}
{"run":271,"commit":"c6bac93","metric":509,"metrics":{"parser_tests":268,"parser_test_ms":500},"status":"keep","description":"Port side-effect import attributes coverage","timestamp":1777223185602,"segment":0,"confidence":4.016,"iterationTokens":2000,"asi":{"hypothesis":"Side-effect-only import declarations should accept import attributes and attach them to the ImportDeclaration AST.","learned":"No implementation change was required; import declaration parsing handles attributes for empty-specifier side-effect imports.","quickjs_cases":"Adds QuickJS-compatible module coverage for `import \"dep\" with { type: \"json\" };`."}}
{"run":272,"commit":"160fa34","metric":511,"metrics":{"parser_tests":269,"parser_test_ms":500},"status":"keep","description":"Port side-effect import assertions coverage","timestamp":1777223232469,"segment":0,"confidence":4.032,"iterationTokens":1628,"asi":{"hypothesis":"Side-effect-only import declarations should also accept legacy assertion attributes.","learned":"No implementation change was required; module attribute parsing accepts `assert` as well as `with` after side-effect import sources.","quickjs_cases":"Adds QuickJS-compatible module coverage for `import \"dep\" assert { type: \"json\" };`."}}
{"run":273,"commit":"6953536","metric":513,"metrics":{"parser_tests":270,"parser_test_ms":500},"status":"keep","description":"Port named re-export assertions coverage","timestamp":1777223281664,"segment":0,"confidence":4.048,"iterationTokens":959,"asi":{"hypothesis":"Named re-export declarations should preserve legacy assertion attributes together with aliased export specifiers.","learned":"No implementation change was required; export source and attribute parsing handles `assert` after named re-exports.","quickjs_cases":"Adds QuickJS-compatible module coverage for `export { name as alias } from \"dep\" assert { ... };`."}}
{"run":274,"commit":"ec85416","metric":515,"metrics":{"parser_tests":271,"parser_test_ms":500},"status":"keep","description":"Port export-all assertions coverage","timestamp":1777223334458,"segment":0,"confidence":4.031746031746032,"iterationTokens":1467,"asi":{"hypothesis":"Export-all declarations should preserve legacy assertion attributes on the declaration AST.","learned":"No implementation change was required; export-all parsing already attaches `assert` attributes to ExportAllDeclaration.","quickjs_cases":"Adds QuickJS-compatible module coverage for `export * from \"dep\" assert { type: \"json\" };`."}}
{"run":275,"commit":"06b3988","metric":517,"metrics":{"parser_tests":272,"parser_test_ms":500},"status":"keep","description":"Port export-all alias assertions coverage","timestamp":1777223389523,"segment":0,"confidence":4.015748031496063,"iterationTokens":926,"asi":{"hypothesis":"Namespace export-all declarations should preserve legacy assertion attributes and exported alias names together.","learned":"No implementation change was required; export-all parsing handles `* as namespace` and attaches assertion attributes.","quickjs_cases":"Adds QuickJS-compatible module coverage for `export * as namespace from \"dep\" assert { ... };`."}}
{"run":276,"commit":"8fea13a","metric":519,"metrics":{"parser_tests":273,"parser_test_ms":500},"status":"keep","description":"Port class meta property coverage","timestamp":1777223451185,"segment":0,"confidence":4.031496062992126,"iterationTokens":1769,"asi":{"hypothesis":"Class field initializers and method bodies should preserve `new.target` and chained `import.meta` meta-property expressions.","learned":"No implementation change was required; class member expression parsing keeps meta-property AST nodes in fields and member-expression chains.","quickjs_cases":"Adds QuickJS-compatible class coverage for `field = new.target` and `return import.meta.url`."}}
{"run":277,"commit":"12d0435","metric":521,"metrics":{"parser_tests":274,"parser_test_ms":500},"status":"checks_failed","description":"Port super member access coverage","timestamp":1777223518382,"segment":0,"confidence":4.031496062992126,"iterationTokens":1586,"asi":{"hypothesis":"Class methods should preserve `super.property` member expressions when parsing derived classes.","rollback_reason":"Backpressure failed in the known unrelated Process.monitor flake: expected `kaboom`, got `noproc`, while parser tests passed.","next_action_hint":"Re-add the super member access coverage and rerun; keep only if web API checks pass.","quickjs_cases":"Attempted QuickJS-compatible class coverage for `return super.value` in a derived class method."}}
{"run":278,"commit":"6e67267","metric":521,"metrics":{"parser_tests":274,"parser_test_ms":500},"status":"keep","description":"Port super member access coverage","timestamp":1777223579649,"segment":0,"confidence":4.015625,"iterationTokens":1580,"asi":{"hypothesis":"Class methods should preserve `super.property` member expressions when parsing derived classes.","learned":"No implementation change was required; `super` is represented as an identifier object in the member expression and the derived superclass identifier is preserved.","quickjs_cases":"Adds QuickJS-compatible class coverage for `class C extends B { method() { return super.value; } }` after retrying a transient web API flake."}}
{"run":279,"commit":"b9d47ea","metric":523,"metrics":{"parser_tests":275,"parser_test_ms":500},"status":"keep","description":"Port super computed call coverage","timestamp":1777223651172,"segment":0,"confidence":4,"iterationTokens":4560,"asi":{"hypothesis":"Derived class methods should preserve computed super member calls in the parser AST.","learned":"No implementation change was required; computed member access on `super` is parsed as a MemberExpression callee inside a CallExpression.","quickjs_cases":"Adds QuickJS-compatible class coverage for `return super[expr]();`."}}
