{"run":314,"commit":"6bb3692","metric":605,"metrics":{"parser_tests":322,"parser_test_ms":600},"status":"keep","description":"Port module escaped restricted binding diagnostics","timestamp":1777226525798,"segment":0,"confidence":4.095890410958904,"iterationTokens":1263,"asi":{"hypothesis":"Module diagnostics should apply after Unicode escapes in identifier text are decoded, including escaped `await` and `eval`.","learned":"No implementation change was required; lexer-normalized identifier values flow through module await and strict restricted-binding checks.","quickjs_cases":"Adds QuickJS-compatible module diagnostics for `var aw\\u0061it;` and `var ev\\u0061l;`."}}
{"run":315,"commit":"9df9bb1","metric":608,"metrics":{"parser_tests":324,"parser_test_ms":600},"status":"keep","description":"Port strict destructuring binding diagnostics","timestamp":1777226596773,"segment":0,"confidence":4.116438356164384,"iterationTokens":4837,"asi":{"hypothesis":"Strict destructuring declarations should reject `eval` and `arguments` inside binding patterns.","learned":"No implementation change was required; strict binding-name collection already descends through object and array binding patterns.","quickjs_cases":"Adds QuickJS-compatible diagnostics for strict `var { eval } = object` and `var [arguments] = array`."}}
{"run":316,"commit":"1c6d150","metric":610,"metrics":{"parser_tests":325,"parser_test_ms":600},"status":"keep","description":"Port module destructuring binding diagnostics","timestamp":1777226662741,"segment":0,"confidence":4.1020408163265305,"iterationTokens":895,"asi":{"hypothesis":"Module destructuring declarations should reject restricted names inside binding patterns because modules are strict.","learned":"No implementation change was required; module strict binding collection reuses recursive binding-name extraction for patterns.","quickjs_cases":"Adds QuickJS-compatible module diagnostics for `var { eval } = object;`."}}
{"run":317,"commit":"5ae3605","metric":613,"metrics":{"parser_tests":327,"parser_test_ms":600},"status":"keep","description":"Port strict octal escape diagnostics","timestamp":1777226772576,"segment":0,"confidence":4.094594594594595,"iterationTokens":2589,"asi":{"hypothesis":"Strict code should reject octal escape sequences in string literals while sloppy scripts remain accepted.","learned":"Strict validation now traverses string literal raw forms and reports `octal escape sequence not allowed in strict mode` for escapes like `\\1`.","quickjs_cases":"Adds QuickJS-compatible strict diagnostics for `\"use strict\"; value = \"\\1\";` plus sloppy allowance coverage."}}
{"run":318,"commit":"79a9593","metric":615,"metrics":{"parser_tests":328,"parser_test_ms":600},"status":"keep","description":"Port module octal escape diagnostics","timestamp":1777226840128,"segment":0,"confidence":4.108108108108108,"iterationTokens":910,"asi":{"hypothesis":"Module source should reject octal string escapes because modules are strict contexts.","learned":"No implementation change was required after strict octal escape validation; module strict mode feeds the same string raw-form check.","quickjs_cases":"Adds QuickJS-compatible module diagnostics for `value = \"\\1\";`."}}
{"run":319,"commit":"b8f7be6","metric":617,"metrics":{"parser_tests":329,"parser_test_ms":1200},"status":"keep","description":"Port class octal escape diagnostics","timestamp":1777226924724,"segment":0,"confidence":4.121621621621622,"iterationTokens":981,"asi":{"hypothesis":"Class method bodies should reject octal string escapes because class method code is strict.","learned":"No implementation change was required after class strict body validation; class method return expressions feed strict octal escape checks.","quickjs_cases":"Adds QuickJS-compatible diagnostics for `return \"\\1\"` inside a class method."}}
{"run":320,"commit":"d225249","metric":619,"metrics":{"parser_tests":330,"parser_test_ms":600},"status":"keep","description":"Port module await parameter diagnostics","timestamp":1777226990984,"segment":0,"confidence":4.10738255033557,"iterationTokens":1124,"asi":{"hypothesis":"Module function parameter lists should reject `await` as a binding identifier.","learned":"No implementation change was required; formal parameter parsing uses the module-aware binding identifier parser.","quickjs_cases":"Adds QuickJS-compatible module diagnostics for `function f(await) {}`."}}
{"run":321,"commit":"6795338","metric":621,"metrics":{"parser_tests":331,"parser_test_ms":600},"status":"keep","description":"Port module await arrow parameter diagnostics","timestamp":1777227051359,"segment":0,"confidence":4.093333333333334,"iterationTokens":979,"asi":{"hypothesis":"Module arrow parameter lists should reject `await` as a binding identifier.","learned":"No implementation change was required; parenthesized arrow parameter parsing uses module-aware binding pattern parsing.","quickjs_cases":"Adds QuickJS-compatible module diagnostics for `(await) => await` in an assignment expression."}}
{"run":322,"commit":"7bc96c1","metric":623,"metrics":{"parser_tests":332,"parser_test_ms":1100},"status":"keep","description":"Port module await class method parameter diagnostics","timestamp":1777227114873,"segment":0,"confidence":4.079470198675497,"iterationTokens":928,"asi":{"hypothesis":"Module class method parameter lists should reject `await` as a binding identifier.","learned":"No implementation change was required; class method formal parameters use the module-aware binding parser.","quickjs_cases":"Adds QuickJS-compatible module diagnostics for `class C { method(await) {} }`."}}
{"run":323,"commit":"24d4810","metric":625,"metrics":{"parser_tests":333,"parser_test_ms":600},"status":"checks_failed","description":"Port module await catch parameter diagnostics","timestamp":1777227177963,"segment":0,"confidence":4.052631578947368,"iterationTokens":998,"asi":{"hypothesis":"Module catch parameters should reject `await` as a binding identifier.","rollback_reason":"Backpressure failed in the known unrelated Process.monitor flake: expected `kaboom`, got `noproc`, while parser tests passed.","next_action_hint":"Re-add module await catch parameter coverage and rerun; keep only if web API checks pass.","quickjs_cases":"Attempted QuickJS-compatible module diagnostics for `try { work(); } catch (await) { recover(); }`."}}
{"run":324,"commit":"fdea26c","metric":625,"metrics":{"parser_tests":333,"parser_test_ms":600},"status":"keep","description":"Port module await catch parameter diagnostics","timestamp":1777227252540,"segment":0,"confidence":4.065789473684211,"iterationTokens":1524,"asi":{"hypothesis":"Module catch parameters should reject `await` as a binding identifier.","learned":"No implementation change was required; catch parameter parsing uses module-aware binding pattern parsing.","quickjs_cases":"Adds QuickJS-compatible module diagnostics for `try { work(); } catch (await) { recover(); }` after retrying a transient web API flake."}}
{"run":325,"commit":"1acae9d","metric":628,"metrics":{"parser_tests":335,"parser_test_ms":500},"status":"keep","description":"Port async await parameter diagnostics","timestamp":1777228480505,"segment":0,"confidence":4.0855263157894735,"iterationTokens":8202,"asi":{"hypothesis":"Async function and async arrow parameter lists should reject `await` as a binding name.","learned":"Async function declaration/expression and async arrow parsing now validate formal parameter names and emit `await parameter not allowed in async function`.","quickjs_cases":"Adds QuickJS-compatible diagnostics for `async function f(await) {}` and `async (await) => await`."}}
{"run":326,"commit":"aa33c70","metric":631,"metrics":{"parser_tests":337,"parser_test_ms":600},"status":"keep","description":"Port async method await parameter diagnostics","timestamp":1777229644043,"segment":0,"confidence":4.078431372549019,"iterationTokens":964,"asi":{"hypothesis":"Async object and class methods should reject `await` as a formal parameter binding name.","learned":"Async object/class method parsing now applies async parameter validation before the existing strict parameter and body checks.","quickjs_cases":"Adds QuickJS-compatible diagnostics for async object method and async class method parameters named `await`."}}
{"run":327,"commit":"a7ac111","metric":633,"metrics":{"parser_tests":338,"parser_test_ms":600},"status":"keep","description":"Port async function expression await parameter diagnostics","timestamp":1777229909757,"segment":0,"confidence":4.064935064935065,"iterationTokens":997,"asi":{"hypothesis":"Async function expressions should reject `await` as a formal parameter binding name.","learned":"No implementation change was required after async function parameter validation; function expressions share the same async parameter check.","quickjs_cases":"Adds QuickJS-compatible diagnostics for `async function named(await) {}` in expression position."}}
{"run":328,"commit":"a7ac111","metric":635,"metrics":{"parser_tests":339,"parser_test_ms":600},"status":"checks_failed","description":"Port async destructured await parameter diagnostics","timestamp":1777231622975,"segment":0,"confidence":4.064935064935065,"iterationTokens":914,"asi":{"hypothesis":"Async functions should reject `await` inside destructured formal parameter binding patterns.","rollback_reason":"Backpressure checks timed out while parser tests passed; no correctness result was available to keep the experiment.","next_action_hint":"Re-add async destructured await parameter coverage and rerun; keep only if checks complete successfully.","quickjs_cases":"Attempted QuickJS-compatible diagnostics for `async function f({ await }) {}`."}}
{"run":329,"commit":"3bfab14","metric":635,"metrics":{"parser_tests":339,"parser_test_ms":700},"status":"keep","description":"Port async destructured await parameter diagnostics","timestamp":1777231699968,"segment":0,"confidence":4.077922077922078,"iterationTokens":1026,"asi":{"hypothesis":"Async functions should reject `await` inside destructured formal parameter binding patterns.","learned":"No implementation change was required after async parameter validation; identifier collection descends through object binding patterns.","quickjs_cases":"Adds QuickJS-compatible diagnostics for `async function f({ await }) {}` after retrying a checks timeout."}}
{"run":330,"commit":"75ec5c8","metric":637,"metrics":{"parser_tests":340,"parser_test_ms":600},"status":"keep","description":"Port generator yield parameter diagnostics","timestamp":1777231815778,"segment":0,"confidence":4.064516129032258,"iterationTokens":994,"asi":{"hypothesis":"Generator function parameter lists should reject `yield` as a binding identifier.","learned":"No implementation change was required; `yield` is tokenized as a keyword and the binding identifier parser rejects it.","quickjs_cases":"Adds QuickJS-compatible diagnostics for `function *g(yield) {}`."}}
{"run":331,"commit":"26f3637","metric":639,"metrics":{"parser_tests":341,"parser_test_ms":600},"status":"keep","description":"Port generator destructured yield parameter diagnostics","timestamp":1777231929438,"segment":0,"confidence":4.103896103896104,"iterationTokens":2987,"asi":{"hypothesis":"Generator functions should reject `yield` inside destructured formal parameter binding patterns.","learned":"Generator function declaration/expression and generator method parsing now validate collected formal parameter names and report `yield parameter not allowed in generator function`.","quickjs_cases":"Adds QuickJS-compatible diagnostics for `function *g({ yield }) {}`."}}
{"run":332,"commit":"1f5f934","metric":642,"metrics":{"parser_tests":343,"parser_test_ms":600},"status":"keep","description":"Port generator method yield parameter diagnostics","timestamp":1777231996481,"segment":0,"confidence":4.096774193548387,"iterationTokens":1064,"asi":{"hypothesis":"Generator object and class methods should reject `yield` inside destructured formal parameters.","learned":"No implementation change was required after generator parameter validation; generator object/class methods use the same parameter-name check.","quickjs_cases":"Adds QuickJS-compatible diagnostics for object and class generator methods with `{ yield }` parameters."}}
{"run":333,"commit":"26da280","metric":645,"metrics":{"parser_tests":345,"parser_test_ms":600},"status":"keep","description":"Port async generator yield parameter diagnostics","timestamp":1777232075793,"segment":0,"confidence":4.089743589743589,"iterationTokens":1315,"asi":{"hypothesis":"Async generator object and class methods should reject `yield` inside destructured formal parameters.","learned":"Async generator object/class method parsing now applies generator parameter validation in addition to async parameter validation.","quickjs_cases":"Adds QuickJS-compatible diagnostics for async generator object and class methods with `{ yield }` parameters."}}
{"run":334,"commit":"9050ad9","metric":648,"metrics":{"parser_tests":347,"parser_test_ms":600},"status":"keep","description":"Port async generator parameter diagnostics","timestamp":1777232170933,"segment":0,"confidence":4.108974358974359,"iterationTokens":4274,"asi":{"hypothesis":"Async generator declarations should reject both `await` and `yield` in formal parameter binding names.","learned":"No implementation change was required; async generator declarations already apply both async await-parameter and generator yield-parameter validation.","quickjs_cases":"Adds QuickJS-compatible diagnostics for `async function *g(await) {}` and `async function *g({ yield }) {}`."}}
{"run":335,"commit":"dde4f15","metric":650,"metrics":{"parser_tests":348,"parser_test_ms":600},"status":"keep","description":"Port async generator expression parameter diagnostics","timestamp":1777232238201,"segment":0,"confidence":4.121794871794871,"iterationTokens":917,"asi":{"hypothesis":"Async generator function expressions should reject both `await` and `yield` formal parameter bindings.","learned":"No implementation change was required; async generator function expressions share async and generator parameter validation with declarations.","quickjs_cases":"Adds QuickJS-compatible diagnostics for `async function *g(await, { yield }) {}` in expression position."}}
{"run":336,"commit":"2c98b41","metric":653,"metrics":{"parser_tests":350,"parser_test_ms":600},"status":"keep","description":"Port module async generator parameter diagnostics","timestamp":1777232293720,"segment":0,"confidence":4.114649681528663,"iterationTokens":1117,"asi":{"hypothesis":"Module async generator parameters should combine module `await` restrictions with generator `yield` restrictions.","learned":"No implementation change was required; module-aware binding parsing rejects `await`, while generator parameter validation rejects destructured `yield`.","quickjs_cases":"Adds QuickJS-compatible module diagnostics for async generator parameters named `await` and destructured `{ yield }`."}}
{"run":337,"commit":"02899ef","metric":656,"metrics":{"parser_tests":352,"parser_test_ms":600},"status":"keep","description":"Port optional chain assignment diagnostics","timestamp":1777232380339,"segment":0,"confidence":4.160256410256411,"iterationTokens":2038,"asi":{"hypothesis":"Optional chains should be rejected as assignment and update targets while preserving expression AST recovery.","learned":"Assignment and update parsing now detect optional-chain member/call expressions in the target and emit `optional chain is not a valid assignment target`.","quickjs_cases":"Adds QuickJS-compatible diagnostics for `object?.property = value` and `object?.property++`."}}
{"run":338,"commit":"6c8e942","metric":659,"metrics":{"parser_tests":354,"parser_test_ms":600},"status":"keep","description":"Port optional chain destructuring diagnostics","timestamp":1777232470687,"segment":0,"confidence":4.1528662420382165,"iterationTokens":1617,"asi":{"hypothesis":"Optional chains nested inside object or array assignment patterns should be rejected as invalid assignment targets.","learned":"Optional-chain assignment target detection now descends through object/array expression targets, properties, and spread elements.","quickjs_cases":"Adds QuickJS-compatible diagnostics for `({ target: object?.property } = source)` and `[object?.property] = source`."}}
{"run":339,"commit":"70b2d88","metric":662,"metrics":{"parser_tests":356,"parser_test_ms":600},"status":"keep","description":"Port optional call assignment diagnostics","timestamp":1777232570852,"segment":0,"confidence":4.1455696202531644,"iterationTokens":994,"asi":{"hypothesis":"Optional call chains should be rejected as assignment and update targets.","learned":"No implementation change was required after recursive optional-chain target detection; optional CallExpression targets are diagnosed.","quickjs_cases":"Adds QuickJS-compatible diagnostics for `object?.method() = value` and `object?.method()++`."}}
{"run":340,"commit":"0705268","metric":665,"metrics":{"parser_tests":358,"parser_test_ms":600},"status":"keep","description":"Port new optional chain diagnostics","timestamp":1777232689046,"segment":0,"confidence":4.1645569620253164,"iterationTokens":1426,"asi":{"hypothesis":"Optional chaining directly after a `new` expression should be diagnosed while preserving recovery AST.","learned":"Postfix optional-chain parsing now emits `optional chain not allowed after new` when `?.` follows a NewExpression.","quickjs_cases":"Adds QuickJS-compatible diagnostics for `new object?.Ctor()` and `new object?.[Ctor]()`."}}
{"run":341,"commit":"6524ecb","metric":668,"metrics":{"parser_tests":360,"parser_test_ms":600},"status":"keep","description":"Port optional chain tagged template diagnostics","timestamp":1777232771142,"segment":0,"confidence":4.1835443037974684,"iterationTokens":1733,"asi":{"hypothesis":"Optional chains should be rejected as tagged template callees while regular tagged templates remain accepted.","learned":"Tagged template postfix parsing now emits `optional chain not allowed as tagged template callee` when the tag expression contains an optional chain.","quickjs_cases":"Adds QuickJS-compatible diagnostics for `tag?.method`template`` and allowance coverage for `tag`template``."}}
{"run":342,"commit":"19238e2","metric":671,"metrics":{"parser_tests":362,"parser_test_ms":600},"status":"keep","description":"Port super optional chain diagnostics","timestamp":1777232868428,"segment":0,"confidence":4.176100628930818,"iterationTokens":1404,"asi":{"hypothesis":"Optional chaining should be rejected when the base expression is `super`.","learned":"Optional-chain parsing now validates its base expression and emits `optional chain not allowed on super` for super optional member/call forms.","quickjs_cases":"Adds QuickJS-compatible diagnostics for `super?.property` and `super?.()` inside classes."}}
{"run":343,"commit":"bf7566c","metric":673,"metrics":{"parser_tests":363,"parser_test_ms":600},"status":"keep","description":"Port for-of initializer diagnostics","timestamp":1777232993962,"segment":0,"confidence":4.1625,"iterationTokens":4076,"asi":{"hypothesis":"For-of declaration heads should report a diagnostic when the declaration includes an initializer.","learned":"For-in/of tail parsing now validates variable declaration heads and reports `for-in/of declaration cannot have initializer`; for-in with initializer still needs better lexical-goal recovery because `in` is currently consumed as a binary operator in the initializer expression.","quickjs_cases":"Adds QuickJS-compatible diagnostics for `for (let value = first of values) {}`.","deferred":"Improve for-in declaration initializer recovery so `for (var key = first in object)` becomes a ForInStatement diagnostic instead of classic-for recovery errors."}}
{"run":344,"commit":"ed7d11a","metric":677,"metrics":{"parser_tests":366,"parser_test_ms":600},"status":"keep","description":"Port rest initializer diagnostics","timestamp":1777233148273,"segment":0,"confidence":4.1875,"iterationTokens":4710,"asi":{"hypothesis":"Rest elements in array/object binding patterns and formal parameter lists should reject initializers.","learned":"Rest parsing now emits `rest element cannot have initializer` when `=` follows a rest binding before the expected closing delimiter.","quickjs_cases":"Adds QuickJS-compatible diagnostics for `var [...rest = value]`, `var { ...rest = value }`, and `function f(...rest = value)`."}}
{"run":345,"commit":"efb54cf","metric":681,"metrics":{"parser_tests":369,"parser_test_ms":700},"status":"keep","description":"Port break continue context diagnostics","timestamp":1777233292931,"segment":0,"confidence":4.2125,"iterationTokens":2880,"asi":{"hypothesis":"Break and continue statements should be diagnosed when they appear outside valid loop/switch contexts.","learned":"Program validation now walks statement bodies with loop/switch context and reports unlabelled `break` outside loop/switch plus `continue` outside loops, including switch consequents.","quickjs_cases":"Adds QuickJS-compatible diagnostics for top-level `break`, top-level `continue`, and `continue` inside switch without an enclosing loop."}}
{"run":346,"commit":"3b06ef1","metric":685,"metrics":{"parser_tests":372,"parser_test_ms":800},"status":"keep","description":"Port labeled break continue diagnostics","timestamp":1777233438953,"segment":0,"confidence":4.211180124223603,"iterationTokens":4758,"asi":{"hypothesis":"Labelled break/continue should be validated against visible labels, and labelled continue should require an iteration label.","learned":"Control-flow validation now tracks visible labels and whether each labels an iteration statement, reporting undefined break labels and non-iteration continue labels.","quickjs_cases":"Adds QuickJS-compatible diagnostics for `break missing`, `continue label` to a block label, and allowance for `continue loop` to a loop label."}}
