{"run":738,"commit":"f8d99a6","metric":0,"metrics":{"compiler_test262_cases":500,"compiler_test262_pass":500,"compiler_test262_failures":0,"compiler_test262_compiler_errors":0,"compiler_test262_compiler_crashes":0,"compiler_test262_compiler_fails":0,"compiler_test262_both_fail":0,"compiler_test262_interpreter_fail_compiler_pass":0,"compatibility_pass":500,"compatibility_cases":500,"compiler_errors":0,"compiler_crashes":0,"compiler_fails":0,"both_fail":0,"interpreter_fail_compiler_pass":0,"elapsed_ms":22955},"status":"keep","description":"Expose Object.assign static descriptor","timestamp":1778087814897,"segment":24,"confidence":12.5,"iterationTokens":7823,"asi":{"hypothesis":"Object.assign must be modeled as a real configurable, writable, non-enumerable own static property of Object, and deleting builtin static overrides must leave tombstones so fallback metadata does not reappear.","improvement":"Completed the bounded built-ins/Object workload by exposing Object.assign own descriptor semantics, supporting computed assignment through Put.put_element for builtins, and tombstoning deleted builtin statics; failures dropped from 1 to 0 with checks passing.","next_action_hint":"The bounded built-ins/Object phase is complete at 0/500 failures. Move to another compatibility workload or broaden Object limit before further Object-specific changes."}}
{"type":"config","name":"QuickBEAM built-ins/Object broader Test262 compatibility","metricName":"compatibility_failures","metricUnit":"","bestDirection":"lower"}
{"run":739,"commit":"2e40359","metric":212,"metrics":{"compiler_test262_cases":1000,"compiler_test262_pass":788,"compiler_test262_failures":212,"compiler_test262_compiler_errors":0,"compiler_test262_compiler_crashes":0,"compiler_test262_compiler_fails":3,"compiler_test262_both_fail":205,"compiler_test262_interpreter_fail_compiler_pass":0,"compatibility_pass":788,"compatibility_cases":1000,"compiler_errors":0,"compiler_crashes":0,"compiler_fails":3,"both_fail":205,"interpreter_fail_compiler_pass":0,"elapsed_ms":135747},"status":"keep","description":"Baseline broader Object workload","timestamp":1778088110503,"segment":25,"confidence":null,"iterationTokens":123,"asi":{"hypothesis":"After completing the bounded 500-case built-ins/Object phase, broaden to the first 1000 built-ins/Object cases to expose the next semantic clusters without changing implementation.","improvement":"Established the new broader built-ins/Object baseline at 212 failures out of 1000 with checks passing; no production behavior change intended beyond the previous kept code.","next_action_hint":"Cluster the broader failure list and target large semantic groups rather than overfitting individual tests."}}
{"run":740,"commit":"cd8e1b3","metric":211,"metrics":{"compiler_test262_cases":1000,"compiler_test262_pass":789,"compiler_test262_failures":211,"compiler_test262_compiler_errors":0,"compiler_test262_compiler_crashes":0,"compiler_test262_compiler_fails":3,"compiler_test262_both_fail":204,"compiler_test262_interpreter_fail_compiler_pass":0,"compatibility_pass":789,"compatibility_cases":1000,"compiler_errors":0,"compiler_crashes":0,"compiler_fails":3,"both_fail":204,"interpreter_fail_compiler_pass":0,"elapsed_ms":144050},"status":"keep","description":"Clear undefined accessor fields","timestamp":1778088556909,"segment":25,"confidence":null,"iterationTokens":7210,"asi":{"hypothesis":"When redefining an accessor property, an explicitly present get/set field with value undefined should clear that accessor slot instead of preserving the old getter/setter.","improvement":"Fixed the first broadened defineProperties accessor redefinition case, reducing the 1000-case built-ins/Object workload from 212 to 211 with checks passing.","next_action_hint":"Continue clustering 15.2.3.7-6-a failures; many likely cover related descriptor redefinition edge cases."}}
{"run":741,"commit":"cd8e1b3","metric":0,"metrics":{"compiler_test262_cases":0,"compiler_test262_pass":0,"compiler_test262_failures":0,"compiler_test262_compiler_errors":0,"compiler_test262_compiler_crashes":0,"compiler_test262_compiler_fails":0,"compiler_test262_both_fail":0,"compiler_test262_interpreter_fail_compiler_pass":0,"compatibility_pass":0,"compatibility_cases":0,"compiler_errors":0,"compiler_crashes":0,"compiler_fails":0,"both_fail":0,"interpreter_fail_compiler_pass":0,"elapsed_ms":500},"status":"crash","description":"Define array length descriptors","timestamp":1778088737849,"segment":25,"confidence":null,"iterationTokens":6722,"asi":{"hypothesis":"Handling array length as a real non-enumerable non-configurable data descriptor in Object.defineProperty/getOwnPropertyDescriptor should fix the large defineProperties array-length cluster.","rollback_reason":"Compilation failed because the array-length branch referenced value_present before it was bound in define_object_property/4.","next_action_hint":"Move the array length branch after descriptor presence variables are computed, then retry."}}
{"run":742,"commit":"cd8e1b3","metric":0,"metrics":{"compiler_test262_cases":0,"compiler_test262_pass":0,"compiler_test262_failures":0,"compiler_test262_compiler_errors":0,"compiler_test262_compiler_crashes":0,"compiler_test262_compiler_fails":0,"compiler_test262_both_fail":0,"compiler_test262_interpreter_fail_compiler_pass":0,"compatibility_pass":0,"compatibility_cases":0,"compiler_errors":0,"compiler_crashes":0,"compiler_fails":0,"both_fail":0,"interpreter_fail_compiler_pass":0,"elapsed_ms":459100},"status":"crash","description":"Define array length descriptors after validation","timestamp":1778089223975,"segment":25,"confidence":null,"iterationTokens":2894,"asi":{"hypothesis":"Handling array length as a real descriptor after descriptor validation should reduce the broadened defineProperties array-length cluster.","rollback_reason":"Experiment was killed with exit code 137 after a long run, suggesting the length descriptor path introduced a hang or memory blowup in the 1000-case workload.","next_action_hint":"Do not retry broad array length descriptor changes without focused probes on 15.2.3.7-6-a-114/120 and resize semantics."}}
{"run":743,"commit":"f41e287","metric":0,"metrics":{"compiler_test262_cases":0,"compiler_test262_pass":0,"compiler_test262_failures":0,"compiler_test262_compiler_errors":0,"compiler_test262_compiler_crashes":0,"compiler_test262_compiler_fails":0,"compiler_test262_both_fail":0,"compiler_test262_interpreter_fail_compiler_pass":0,"compatibility_pass":0,"compatibility_cases":0,"compiler_errors":0,"compiler_crashes":0,"compiler_fails":0,"both_fail":0,"interpreter_fail_compiler_pass":0,"elapsed_ms":297900},"status":"crash","description":"Broader Object workload after array exotic extraction","timestamp":1778093374593,"segment":25,"confidence":null,"iterationTokens":10332,"asi":{"hypothesis":"Extracted array exotic object semantics should preserve behavior and prepare length fixes for broader defineProperties cluster","rollback_reason":"TEST262_LIMIT=1000 workload was killed with exit code 137 after ~298s, suggesting hang/OOM in current array length define-property behavior","next_action_hint":"Run focused defineProperties array length probes and inspect for hangs before retrying full broader workload"}}
{"run":744,"commit":"f41e287","metric":0,"metrics":{"compiler_test262_cases":0,"compiler_test262_pass":0,"compiler_test262_failures":0,"compiler_test262_compiler_errors":0,"compiler_test262_compiler_crashes":0,"compiler_test262_compiler_fails":0,"compiler_test262_both_fail":0,"compiler_test262_interpreter_fail_compiler_pass":0,"compatibility_pass":0,"compatibility_cases":0,"compiler_errors":0,"compiler_crashes":0,"compiler_fails":0,"both_fail":0,"interpreter_fail_compiler_pass":0,"elapsed_ms":370900},"status":"crash","description":"Avoid dense array allocation for large length writes","timestamp":1778094074773,"segment":25,"confidence":null,"iterationTokens":28702,"asi":{"hypothesis":"Use sparse :array resize for huge array length writes to prevent propertyHelper writable checks from allocating billions of undefined elements","rollback_reason":"Full TEST262_LIMIT=1000 workload was still killed with exit code 137 after ~371s","next_action_hint":"Do not retry full workload until exact hanging/OOM case is isolated; run smaller defineProperties slices or implement exact per-case filtering"}}
{"type":"config","name":"QuickBEAM built-ins/Object 800-case compatibility","metricName":"compatibility_failures","metricUnit":"","bestDirection":"lower"}
{"run":745,"commit":"c3efc1d","metric":0,"metrics":{"compiler_test262_cases":0,"compiler_test262_pass":0,"compiler_test262_failures":0,"compiler_test262_compiler_errors":0,"compiler_test262_compiler_crashes":0,"compiler_test262_compiler_fails":0,"compiler_test262_both_fail":0,"compiler_test262_interpreter_fail_compiler_pass":0,"compatibility_pass":0,"compatibility_cases":0,"compiler_errors":0,"compiler_crashes":0,"compiler_fails":0,"both_fail":0,"interpreter_fail_compiler_pass":0,"elapsed_ms":426900},"status":"crash","description":"Baseline pooled 800-case Object workload","timestamp":1778097022983,"segment":26,"confidence":null,"iterationTokens":132,"asi":{"hypothesis":"Pooled context runner should make the 800-case Object slice faster while preserving failure signal","rollback_reason":"800-case pooled run was killed with exit 137, likely due pooled contexts retaining dynamic compiled modules/heap state across many compiler cases or OOMing before metrics","next_action_hint":"Do not use pooled runner for large beam_compiler Test262 sweeps yet; add worker recycling or compiled-module cleanup before retrying"}}
{"type":"config","name":"QuickBEAM built-ins/Object 800-case compatibility","metricName":"compatibility_failures","metricUnit":"","bestDirection":"lower"}
{"run":746,"commit":"7b70cae","metric":27,"metrics":{"compiler_test262_cases":800,"compiler_test262_pass":773,"compiler_test262_failures":27,"compiler_test262_compiler_errors":0,"compiler_test262_compiler_crashes":0,"compiler_test262_compiler_fails":3,"compiler_test262_both_fail":22,"compiler_test262_interpreter_fail_compiler_pass":0,"compatibility_pass":773,"compatibility_cases":800,"compiler_errors":0,"compiler_crashes":0,"compiler_fails":3,"both_fail":22,"interpreter_fail_compiler_pass":0,"elapsed_ms":65240},"status":"keep","description":"Baseline 800-case Object workload","timestamp":1778097211809,"segment":27,"confidence":null,"iterationTokens":126,"asi":{"hypothesis":"Use the first 800 built-ins/Object cases as a stable broader workload with enough defineProperties failures but without the 1000-case OOM behavior","improvement":"Established baseline: 27 failures out of 800 cases, with checks passing","next_action_hint":"Cluster the 27 failures and target general defineProperties array exotic semantics rather than individual filenames"}}
{"run":747,"commit":"b3c4a38","metric":24,"metrics":{"compiler_test262_cases":800,"compiler_test262_pass":776,"compiler_test262_failures":24,"compiler_test262_compiler_errors":0,"compiler_test262_compiler_crashes":0,"compiler_test262_compiler_fails":3,"compiler_test262_both_fail":16,"compiler_test262_interpreter_fail_compiler_pass":0,"compatibility_pass":776,"compatibility_cases":800,"compiler_errors":0,"compiler_crashes":0,"compiler_fails":3,"both_fail":16,"interpreter_fail_compiler_pass":0,"elapsed_ms":106114},"status":"keep","description":"Route dynamic array length element access","timestamp":1778097540346,"segment":27,"confidence":null,"iterationTokens":15271,"asi":{"hypothesis":"Dynamic bracket access and assignment of array 'length' should route through ordinary array length Get/Put semantics instead of auxiliary array props","improvement":"Fixed length descriptor/propertyHelper cases like 15.2.3.7-6-a-114/-114-b/-115/-120, reducing the 800-case Object workload from 27 to 24 failures","next_action_hint":"Continue array exotic defineProperties cluster; inspect remaining hasOwnProperty/index value failures and large-length timeout cases"}}
{"run":748,"commit":"b8ac4f4","metric":20,"metrics":{"compiler_test262_cases":800,"compiler_test262_pass":780,"compiler_test262_failures":20,"compiler_test262_compiler_errors":0,"compiler_test262_compiler_crashes":0,"compiler_test262_compiler_fails":3,"compiler_test262_both_fail":12,"compiler_test262_interpreter_fail_compiler_pass":0,"compatibility_pass":780,"compatibility_cases":800,"compiler_errors":0,"compiler_crashes":0,"compiler_fails":3,"both_fail":12,"interpreter_fail_compiler_pass":0,"elapsed_ms":105395},"status":"keep","description":"Treat array holes as absent own properties","timestamp":1778097880250,"segment":27,"confidence":2.3333333333333335,"iterationTokens":13923,"asi":{"hypothesis":"Array own-property checks should treat holes as absent unless an explicit descriptor exists, rather than reporting every index below length as present","improvement":"Fixed defineProperties cases where array holes must remain non-own properties after length changes, reducing the 800-case workload from 24 to 20 failures","next_action_hint":"Continue array length shrink semantics for non-configurable elements and compiler-only callable descriptor receiver cases"}}
{"run":749,"commit":"9311a65","metric":15,"metrics":{"compiler_test262_cases":800,"compiler_test262_pass":785,"compiler_test262_failures":15,"compiler_test262_compiler_errors":0,"compiler_test262_compiler_crashes":0,"compiler_test262_compiler_fails":3,"compiler_test262_both_fail":10,"compiler_test262_interpreter_fail_compiler_pass":0,"compatibility_pass":785,"compatibility_cases":800,"compiler_errors":0,"compiler_crashes":0,"compiler_fails":3,"both_fail":10,"interpreter_fail_compiler_pass":0,"elapsed_ms":65711},"status":"keep","description":"Honor array length writability during shrink","timestamp":1778098187157,"segment":27,"confidence":3.4285714285714284,"iterationTokens":5951,"asi":{"hypothesis":"Array length writes should respect non-writable length descriptors, and shrink failures with requested writable:false should leave length non-writable","improvement":"Fixed non-writable length and shrink rollback cases such as 15.2.3.7-6-a-159/-164 and eliminated timeout/OOM paths from propertyHelper length writability probes, reducing failures from 20 to 15","next_action_hint":"Remaining failures are compiler-only callable descriptor receiver cases and array shrink/non-configurable index cases 165/166/168/169/170/172/173 plus early descriptor TypeError cases"}}
{"run":750,"commit":"26a0a0e","metric":7,"metrics":{"compiler_test262_cases":800,"compiler_test262_pass":793,"compiler_test262_failures":7,"compiler_test262_compiler_errors":0,"compiler_test262_compiler_crashes":0,"compiler_test262_compiler_fails":3,"compiler_test262_both_fail":2,"compiler_test262_interpreter_fail_compiler_pass":0,"compatibility_pass":793,"compatibility_cases":800,"compiler_errors":0,"compiler_crashes":0,"compiler_fails":3,"both_fail":2,"interpreter_fail_compiler_pass":0,"elapsed_ms":65152},"status":"keep","description":"Preserve array index descriptors during shrink","timestamp":1778098617334,"segment":27,"confidence":4,"iterationTokens":8448,"asi":{"hypothesis":"Array index defineProperty without value should preserve existing indexed values/accessors, and shrink deletion should clear descriptor metadata for removed indices","improvement":"Fixed most remaining array length shrink/non-configurable index cases, reducing the 800-case workload from 15 to 7 failures","next_action_hint":"Only two shared failures remain in the 800-case slice; three compiler-only callable descriptor cases also remain"}}
{"run":751,"commit":"db40646","metric":4,"metrics":{"compiler_test262_cases":800,"compiler_test262_pass":796,"compiler_test262_failures":4,"compiler_test262_compiler_errors":0,"compiler_test262_compiler_crashes":0,"compiler_test262_compiler_fails":4,"compiler_test262_both_fail":0,"compiler_test262_interpreter_fail_compiler_pass":0,"compatibility_pass":796,"compatibility_cases":800,"compiler_errors":0,"compiler_crashes":0,"compiler_fails":4,"both_fail":0,"interpreter_fail_compiler_pass":0,"elapsed_ms":38189},"status":"keep","description":"Use sparse array length and preserve static attributes","timestamp":1778099640837,"segment":27,"confidence":2.875,"iterationTokens":8448,"asi":{"hypothesis":"Sparse array resizing plus descriptor-aware array/callable static deletion and writes should fix huge length boundaries and shared defineProperties descriptor cases without reintroducing dense allocation","improvement":"Eliminated shared failures and timeouts in the 800-case Object slice; remaining failures are compiler-only callable/arguments descriptor cases","next_action_hint":"Investigate compiler-only defineProperties failures, especially function property persistence in 15.2.3.7-6-a-12 and arguments descriptor objects in 5-b-*"}}
{"run":752,"commit":"db40646","metric":8,"metrics":{"compiler_test262_cases":800,"compiler_test262_pass":792,"compiler_test262_failures":8,"compiler_test262_compiler_errors":0,"compiler_test262_compiler_crashes":0,"compiler_test262_compiler_fails":4,"compiler_test262_both_fail":4,"compiler_test262_interpreter_fail_compiler_pass":0,"compatibility_pass":792,"compatibility_cases":800,"compiler_errors":0,"compiler_crashes":0,"compiler_fails":4,"both_fail":4,"interpreter_fail_compiler_pass":0,"elapsed_ms":37446},"status":"discard","description":"Use descriptors as hasOwnProperty fallback","timestamp":1778099885863,"segment":27,"confidence":2.875,"iterationTokens":4041,"asi":{"hypothesis":"Falling back to OwnProperty.descriptor for hasOwnProperty would fix compiled callable static properties whose descriptor exists but present? returns false","rollback_reason":"Primary metric regressed from 4 to 8 by introducing shared hasOwnProperty/descriptors behavior changes","next_action_hint":"Do not broaden hasOwnProperty fallback; instead inspect compiled callable representation or bound Function.prototype.call receiver handling for the 6-a-12 compiler-only failure"}}
{"run":753,"commit":"db40646","metric":4,"metrics":{"compiler_test262_cases":800,"compiler_test262_pass":796,"compiler_test262_failures":4,"compiler_test262_compiler_errors":0,"compiler_test262_compiler_crashes":0,"compiler_test262_compiler_fails":4,"compiler_test262_both_fail":0,"compiler_test262_interpreter_fail_compiler_pass":0,"compatibility_pass":796,"compatibility_cases":800,"compiler_errors":0,"compiler_crashes":0,"compiler_fails":4,"both_fail":0,"interpreter_fail_compiler_pass":0,"elapsed_ms":49374},"status":"discard","description":"Confirm current Object best before next compiler-slot work","timestamp":1778100860678,"segment":27,"confidence":3.066666666666667,"iterationTokens":47802,"asi":{"hypothesis":"Re-run the current best after reverting exploratory compiler local-slot changes to ensure the active baseline is stable","rollback_reason":"No primary metric improvement; this was a confirmation run at the current best","next_action_hint":"Investigate QuickJS local-slot vs argument-slot indexing for compiled get_loc/put_loc; naive global offset caused compile errors, but disassembly shows object literal {property: arguments} stores the wrong slot value"}}
{"run":754,"commit":"7061371","metric":1,"metrics":{"compiler_test262_cases":800,"compiler_test262_pass":799,"compiler_test262_failures":1,"compiler_test262_compiler_errors":0,"compiler_test262_compiler_crashes":0,"compiler_test262_compiler_fails":1,"compiler_test262_both_fail":0,"compiler_test262_interpreter_fail_compiler_pass":0,"compatibility_pass":799,"compatibility_cases":800,"compiler_errors":0,"compiler_crashes":0,"compiler_fails":1,"both_fail":0,"interpreter_fail_compiler_pass":0,"elapsed_ms":41230},"status":"keep","description":"Honor compact local opcode slot arguments","timestamp":1778101345623,"segment":27,"confidence":3.7142857142857144,"iterationTokens":20398,"asi":{"hypothesis":"Object-literal fast collection should read the slot index encoded in compact get_loc/get_arg op arguments, not infer slot index from the compact opcode suffix","improvement":"Fixed compiler-only arguments descriptor object cases by preserving the actual arguments object in optimized object literals","remaining_failure":"Only 15.2.3.7-6-a-12 remains compiler-only in the 800-case Object slice","next_action_hint":"Investigate compiled callable static/property hasOwnProperty or deletion semantics for Object.defineProperties on function objects"}}
{"run":755,"commit":"7061371","metric":1,"metrics":{"compiler_test262_cases":800,"compiler_test262_pass":799,"compiler_test262_failures":1,"compiler_test262_compiler_errors":0,"compiler_test262_compiler_crashes":0,"compiler_test262_compiler_fails":1,"compiler_test262_both_fail":0,"compiler_test262_interpreter_fail_compiler_pass":0,"compatibility_pass":799,"compatibility_cases":800,"compiler_errors":0,"compiler_crashes":0,"compiler_fails":1,"both_fail":0,"interpreter_fail_compiler_pass":0,"elapsed_ms":41315},"status":"discard","description":"Target callable descriptor presence and writes","timestamp":1778102087248,"segment":27,"confidence":4,"iterationTokens":31523,"asi":{"hypothesis":"Targeted callable descriptor presence plus stricter non-writable static redefinition/write checks might fix the remaining function defineProperties case without broad builtin metadata regressions","rollback_reason":"Primary metric stayed at 1; focused 6-a-12 still failed because compiled bracket access in propertyHelper reads undefined for function properties even though dot access and descriptors see the value","next_action_hint":"Investigate compiled/source bracket member access for function objects; focused probe shows fun.prop and Object.getOwnPropertyDescriptor(fun,'prop').value are 11 while fun['prop'] is undefined under beam_compiler"}}
