{"run":182,"commit":"0f19f44","metric":343,"metrics":{"parser_tests":185,"parser_test_ms":400},"status":"keep","description":"Port constructor super call coverage","timestamp":1777215543297,"segment":0,"confidence":3.884393063583815,"iterationTokens":6253,"asi":{"hypothesis":"Class constructor methods should be distinguished in the AST while preserving super-call and this-assignment parsing.","learned":"Class method construction now tags identifier key `constructor` as `kind: :constructor` across regular/generator/async class method paths, while `super(value)` remains a CallExpression over the super identifier.","quickjs_cases":"Adds QuickJS-compatible class coverage for derived constructor `super(value); this.value = value;`."}}
{"run":183,"commit":"165e88c","metric":345,"metrics":{"parser_tests":186,"parser_test_ms":300},"status":"keep","description":"Port static constructor method coverage","timestamp":1777215648950,"segment":0,"confidence":3.8850574712643677,"iterationTokens":2119,"asi":{"hypothesis":"A static method named `constructor` should remain a normal method, while only non-static `constructor` is the class constructor.","learned":"Class method kind classification now receives the static flag and only marks non-static identifier key `constructor` as `kind: :constructor`.","quickjs_cases":"Adds QuickJS-compatible class coverage for `static constructor() { return 1; }`."}}
{"run":184,"commit":"b760efb","metric":347,"metrics":{"parser_tests":187,"parser_test_ms":400},"status":"keep","description":"Port non-constructor method name coverage","timestamp":1777215751833,"segment":0,"confidence":3.8636363636363638,"iterationTokens":2966,"asi":{"hypothesis":"Generator and async methods named `constructor` should remain ordinary method definitions, not class constructors.","learned":"Only regular non-static methods named `constructor` are tagged as constructor; generator and async class methods keep the default `:method` kind even when their key is `constructor`.","quickjs_cases":"Adds QuickJS-compatible class coverage for `*constructor()` and `async constructor()` method forms."}}
{"run":185,"commit":"b760efb","metric":349,"metrics":{"parser_tests":188,"parser_test_ms":400},"status":"checks_failed","description":"Port constructor field coverage","timestamp":1777215808641,"segment":0,"confidence":3.8202247191011236,"iterationTokens":1008,"asi":{"hypothesis":"Class fields named `constructor`, including static fields, should remain field definitions rather than constructor methods.","rollback_reason":"Backpressure failed in known unrelated Process.monitor flake while parser tests passed.","next_action_hint":"Re-add constructor field coverage and rerun; keep if checks pass.","quickjs_cases":"Attempted QuickJS-compatible class field coverage for instance/static fields named `constructor`."}}
{"run":186,"commit":"4eeee98","metric":349,"metrics":{"parser_tests":188,"parser_test_ms":600},"status":"keep","description":"Port constructor field coverage","timestamp":1777215857281,"segment":0,"confidence":3.8863636363636362,"iterationTokens":1481,"asi":{"hypothesis":"Class fields named `constructor`, including static fields, should remain field definitions rather than constructor methods.","learned":"No implementation change was required; class element parsing only marks `constructor` as a constructor when it is a regular non-static method with parameters/body.","quickjs_cases":"Adds QuickJS-compatible class field coverage for instance and static fields named `constructor` after retrying a transient web API flake."}}
{"run":187,"commit":"16ef93f","metric":351,"metrics":{"parser_tests":189,"parser_test_ms":400},"status":"keep","description":"Port constructor accessor coverage","timestamp":1777215930006,"segment":0,"confidence":3.909090909090909,"iterationTokens":984,"asi":{"hypothesis":"Class accessors named `constructor` should remain getter/setter methods rather than constructor methods.","learned":"No implementation change was required; accessor parsing assigns `:get`/`:set` kinds independently of the property key name.","quickjs_cases":"Adds QuickJS-compatible class coverage for `get constructor()` and `set constructor(value)`."}}
{"run":188,"commit":"9b5400a","metric":353,"metrics":{"parser_tests":190,"parser_test_ms":500},"status":"keep","description":"Port namespace import attributes coverage","timestamp":1777216002156,"segment":0,"confidence":3.9096045197740112,"iterationTokens":1593,"asi":{"hypothesis":"Namespace static imports should compose with import attribute clauses after the source string.","learned":"No implementation change was required; import attributes are parsed after the source independently of the specifier shape, including namespace specifiers.","quickjs_cases":"Adds QuickJS-compatible module coverage for `import * as data from \"./data.json\" with { type: \"json\" }`."}}
{"run":189,"commit":"568340a","metric":355,"metrics":{"parser_tests":191,"parser_test_ms":400},"status":"keep","description":"Port named import attributes coverage","timestamp":1777216068299,"segment":0,"confidence":3.9101123595505616,"iterationTokens":988,"asi":{"hypothesis":"Named static imports should compose with import assertion clauses after the source string.","learned":"No implementation change was required; the attribute parser runs after source parsing for all static import specifier forms.","quickjs_cases":"Adds QuickJS-compatible module coverage for `import { value as localValue } from \"./data.json\" assert { type: \"json\" }`."}}
{"run":190,"commit":"4a40c3a","metric":357,"metrics":{"parser_tests":192,"parser_test_ms":400},"status":"keep","description":"Port default namespace import coverage","timestamp":1777216125158,"segment":0,"confidence":3.910614525139665,"iterationTokens":990,"asi":{"hypothesis":"Import specifier parsing should support a default import followed by a namespace import.","learned":"No implementation change was required; default specifier parsing continues after a comma and then accepts the namespace import branch.","quickjs_cases":"Adds QuickJS-compatible module coverage for `import defaultValue, * as namespaceValue from \"dep\"`."}}
{"run":191,"commit":"0c54318","metric":359,"metrics":{"parser_tests":193,"parser_test_ms":400},"status":"keep","description":"Port default import trailing comma diagnostics","timestamp":1777216216292,"segment":0,"confidence":3.911111111111111,"iterationTokens":2387,"asi":{"hypothesis":"A default import followed by a comma must be followed by named or namespace specifiers, not directly by `from`.","learned":"Import specifier parsing now reports `expected import specifier` when `from` appears immediately after the default-import comma.","quickjs_cases":"Adds QuickJS-compatible module diagnostic coverage for `import defaultValue, from \"dep\"`."}}
{"run":192,"commit":"0680767","metric":361,"metrics":{"parser_tests":194,"parser_test_ms":400},"status":"keep","description":"Port named import trailing comma coverage","timestamp":1777216288833,"segment":0,"confidence":3.911602209944751,"iterationTokens":1096,"asi":{"hypothesis":"Named import specifier lists should allow a trailing comma before the closing brace.","learned":"No implementation change was required; named import specifier parsing already stops cleanly on `}` after consuming a comma.","quickjs_cases":"Adds QuickJS-compatible module coverage for `import { value, other as aliasValue, } from \"dep\"`."}}
{"run":193,"commit":"d62b510","metric":363,"metrics":{"parser_tests":195,"parser_test_ms":400},"status":"keep","description":"Port named export trailing comma coverage","timestamp":1777216347287,"segment":0,"confidence":3.912087912087912,"iterationTokens":969,"asi":{"hypothesis":"Named export specifier lists should allow a trailing comma before the closing brace.","learned":"No implementation change was required; export specifier parsing already accepts `}` after a comma and preserves the export specifier list.","quickjs_cases":"Adds QuickJS-compatible module coverage for `export { value, other as aliasValue, }`."}}
{"run":194,"commit":"d62b510","metric":365,"metrics":{"parser_tests":196,"parser_test_ms":600},"status":"checks_failed","description":"Port re-export trailing comma coverage","timestamp":1777216407885,"segment":0,"confidence":3.869565217391304,"iterationTokens":975,"asi":{"hypothesis":"Named re-export specifier lists should allow a trailing comma before the closing brace and source clause.","rollback_reason":"Backpressure failed in known unrelated Process.monitor flake while parser tests passed.","next_action_hint":"Re-add re-export trailing comma coverage and rerun; keep if checks pass.","quickjs_cases":"Attempted QuickJS-compatible module coverage for `export { value, other as aliasValue, } from \"dep\"`."}}
{"run":195,"commit":"6edcf13","metric":365,"metrics":{"parser_tests":196,"parser_test_ms":500},"status":"keep","description":"Port re-export trailing comma coverage","timestamp":1777216477384,"segment":0,"confidence":3.891304347826087,"iterationTokens":1524,"asi":{"hypothesis":"Named re-export specifier lists should allow a trailing comma before the closing brace and source clause.","learned":"No implementation change was required; export specifier parsing accepts trailing commas whether or not a `from` source follows the closing brace.","quickjs_cases":"Adds QuickJS-compatible module coverage for `export { value, other as aliasValue, } from \"dep\"` after retrying a transient web API flake."}}
{"run":196,"commit":"db05b28","metric":367,"metrics":{"parser_tests":197,"parser_test_ms":500},"status":"keep","description":"Port multiple static block coverage","timestamp":1777216571909,"segment":0,"confidence":3.870967741935484,"iterationTokens":1219,"asi":{"hypothesis":"Class body parsing should allow multiple static blocks interleaved with static fields and methods.","learned":"No implementation change was required; class element parsing recognizes each `static {` block independently and resumes parsing subsequent elements.","quickjs_cases":"Adds QuickJS-compatible class coverage for multiple static initialization blocks interleaved with fields and methods."}}
{"run":197,"commit":"ad0f7bc","metric":369,"metrics":{"parser_tests":198,"parser_test_ms":400},"status":"keep","description":"Port static block declaration coverage","timestamp":1777216640113,"segment":0,"confidence":3.851063829787234,"iterationTokens":961,"asi":{"hypothesis":"Static block parsing should reuse normal block statement parsing for declarations and expressions inside class static blocks.","learned":"No implementation change was required; static blocks store the body from `parse_block_statement/1`, preserving variable declarations, function declarations, and assignment expressions.","quickjs_cases":"Adds QuickJS-compatible static block coverage with const declaration, nested function declaration, and assignment."}}
{"run":198,"commit":"370eb06","metric":371,"metrics":{"parser_tests":199,"parser_test_ms":400},"status":"keep","description":"Port constructor new.target coverage","timestamp":1777216687384,"segment":0,"confidence":3.872340425531915,"iterationTokens":1005,"asi":{"hypothesis":"Constructor body expression parsing should preserve `new.target` meta-property syntax.","learned":"No implementation change was required; `new.target` parsing already produces MetaProperty nodes inside class constructor bodies.","quickjs_cases":"Adds QuickJS-compatible class constructor coverage for assignment from `new.target`."}}
{"run":199,"commit":"97c71ae","metric":373,"metrics":{"parser_tests":200,"parser_test_ms":400},"status":"keep","description":"Port anonymous class expression extends coverage","timestamp":1777216796118,"segment":0,"confidence":3.893617021276596,"iterationTokens":1125,"asi":{"hypothesis":"Class expression parsing should support anonymous classes with `extends` clauses and super method calls in methods.","learned":"No implementation change was required; class expression tail parsing accepts optional names and superclasses, and method bodies reuse call/member parsing for `super.method()`.","quickjs_cases":"Adds QuickJS-compatible class expression coverage for `class extends Base { method() { return super.method(); } }`."}}
{"run":200,"commit":"ba346b0","metric":375,"metrics":{"parser_tests":201,"parser_test_ms":600},"status":"keep","description":"Port named class expression static block coverage","timestamp":1777216852866,"segment":0,"confidence":3.873684210526316,"iterationTokens":963,"asi":{"hypothesis":"Class expression parsing should share static block support with class declarations, including named class expressions.","learned":"No implementation change was required; class expression tail parsing uses the same class element parser that recognizes `static { ... }`.","quickjs_cases":"Adds QuickJS-compatible class expression coverage for `class Named { static { this.value = 1; } }`."}}
{"run":201,"commit":"12facf3","metric":377,"metrics":{"parser_tests":202,"parser_test_ms":400},"status":"keep","description":"Port class extends expression coverage","timestamp":1777216925453,"segment":0,"confidence":3.8541666666666665,"iterationTokens":1004,"asi":{"hypothesis":"Class `extends` clauses should accept general left-hand expressions such as calls and member expressions in declarations and expressions.","learned":"No implementation change was required; superclass parsing already uses expression parsing, so call and member expressions are preserved as super_class nodes.","quickjs_cases":"Adds QuickJS-compatible class coverage for `class D extends mixin(Base)` and `class extends namespace.Base`."}}
{"run":202,"commit":"4da4760","metric":379,"metrics":{"parser_tests":203,"parser_test_ms":400},"status":"keep","description":"Port class extends null coverage","timestamp":1777217022459,"segment":0,"confidence":3.875,"iterationTokens":3477,"asi":{"hypothesis":"Class heritage parsing should accept `null` as a valid superclass expression for declarations and expressions.","learned":"No implementation change was required; superclass parsing uses expression parsing and preserves `null` as a Literal node.","quickjs_cases":"Adds QuickJS-compatible class coverage for `class D extends null` and `class extends null` expressions."}}
{"run":203,"commit":"315d57c","metric":381,"metrics":{"parser_tests":204,"parser_test_ms":400},"status":"keep","description":"Port anonymous default class extends coverage","timestamp":1777217086688,"segment":0,"confidence":3.8958333333333335,"iterationTokens":1042,"asi":{"hypothesis":"Default export class parsing should allow anonymous classes with extends clauses and constructor bodies.","learned":"No implementation change was required; optional-name default export class parsing shares class tail parsing for superclasses and constructor method recognition.","quickjs_cases":"Adds QuickJS-compatible module coverage for `export default class extends Base { constructor() { super(); } }`."}}
{"run":204,"commit":"315d57c","metric":383,"metrics":{"parser_tests":205,"parser_test_ms":400},"status":"checks_failed","description":"Port default await export coverage","timestamp":1777217160290,"segment":0,"confidence":3.8958333333333335,"iterationTokens":1567,"asi":{"hypothesis":"Default export expression parsing should preserve top-level await and dynamic import syntax in modules.","rollback_reason":"Backpressure failed in known unrelated Process.monitor flake while parser tests passed.","next_action_hint":"Re-add default await export coverage and rerun; keep if checks pass.","quickjs_cases":"Attempted QuickJS-compatible module coverage for `export default await import(\"dep\")`."}}
{"run":205,"commit":"e02f524","metric":383,"metrics":{"parser_tests":205,"parser_test_ms":500},"status":"keep","description":"Port default await export coverage","timestamp":1777217228027,"segment":0,"confidence":3.9166666666666665,"iterationTokens":1474,"asi":{"hypothesis":"Default export expression parsing should preserve top-level await and dynamic import syntax in modules.","learned":"No implementation change was required; export default falls through to expression parsing, where `await import(\"dep\")` is represented as AwaitExpression over a CallExpression.","quickjs_cases":"Adds QuickJS-compatible module coverage for `export default await import(\"dep\")` after retrying a transient web API flake."}}
{"run":206,"commit":"035e524","metric":385,"metrics":{"parser_tests":206,"parser_test_ms":400},"status":"keep","description":"Port default sequence export coverage","timestamp":1777217312381,"segment":0,"confidence":3.8969072164948453,"iterationTokens":970,"asi":{"hypothesis":"Default export expression parsing should preserve parenthesized sequence expressions.","learned":"No implementation change was required; parenthesized expression parsing returns the inner SequenceExpression, and export default stores it as the declaration expression.","quickjs_cases":"Adds QuickJS-compatible module coverage for `export default (setup(), value)`."}}
{"run":207,"commit":"644d639","metric":387,"metrics":{"parser_tests":207,"parser_test_ms":400},"status":"keep","description":"Port strict duplicate parameter diagnostics","timestamp":1777217503148,"segment":0,"confidence":3.877551020408163,"iterationTokens":8569,"asi":{"hypothesis":"Functions with a `use strict` directive should reject duplicate simple parameter names.","learned":"Function declaration parsing now validates strict directive bodies and emits a diagnostic when simple identifier parameter names are duplicated.","quickjs_cases":"Adds QuickJS-compatible strict-mode diagnostic coverage for `function f(a, a) { \"use strict\"; }`."}}
{"run":208,"commit":"4fb93a2","metric":389,"metrics":{"parser_tests":208,"parser_test_ms":400},"status":"keep","description":"Port strict restricted parameter diagnostics","timestamp":1777217573330,"segment":0,"confidence":3.9381443298969074,"iterationTokens":891,"asi":{"hypothesis":"Strict functions should reject `eval` and `arguments` as parameter binding names.","learned":"No implementation change was required after strict parameter validation; the restricted-name check catches both `eval` and `arguments` simple parameters.","quickjs_cases":"Adds QuickJS-compatible strict-mode diagnostics for function parameters named `eval` and `arguments`."}}
{"run":209,"commit":"c6e3d25","metric":391,"metrics":{"parser_tests":209,"parser_test_ms":400},"status":"keep","description":"Port strict function expression diagnostics","timestamp":1777217655605,"segment":0,"confidence":3.9183673469387754,"iterationTokens":1998,"asi":{"hypothesis":"Strict duplicate-parameter diagnostics should apply to function expressions, not only declarations.","learned":"Function expression parsing now runs the same strict directive parameter validation as function declarations.","quickjs_cases":"Adds QuickJS-compatible strict-mode diagnostics for `function(a, a) { \"use strict\"; }` expressions."}}
{"run":210,"commit":"8682b52","metric":393,"metrics":{"parser_tests":210,"parser_test_ms":400},"status":"keep","description":"Port strict object method diagnostics","timestamp":1777217759353,"segment":0,"confidence":3.938775510204082,"iterationTokens":2373,"asi":{"hypothesis":"Strict duplicate-parameter diagnostics should apply to object literal methods with `use strict` directive bodies.","learned":"Regular object method parsing now runs strict parameter validation after parsing the method body.","quickjs_cases":"Adds QuickJS-compatible strict-mode diagnostics for `method(a, a) { \"use strict\"; }` in object literals."}}
{"run":211,"commit":"63fc2ae","metric":395,"metrics":{"parser_tests":211,"parser_test_ms":400},"status":"keep","description":"Port strict generator object method diagnostics","timestamp":1777217837166,"segment":0,"confidence":3.9591836734693877,"iterationTokens":2433,"asi":{"hypothesis":"Strict duplicate-parameter diagnostics should apply to generator object methods.","learned":"Generator object method parsing now runs strict directive parameter validation after parsing the method body.","quickjs_cases":"Adds QuickJS-compatible strict-mode diagnostics for `*method(a, a) { \"use strict\"; }` in object literals."}}
{"run":212,"commit":"ee34294","metric":397,"metrics":{"parser_tests":212,"parser_test_ms":400},"status":"keep","description":"Port strict async object method diagnostics","timestamp":1777217909723,"segment":0,"confidence":3.9393939393939394,"iterationTokens":895,"asi":{"hypothesis":"Strict duplicate-parameter diagnostics should apply to async object methods after shared validation support.","learned":"No implementation change was required; async object method parsing now shares strict parameter validation with regular and generator object methods.","quickjs_cases":"Adds QuickJS-compatible strict-mode diagnostics for `async method(a, a) { \"use strict\"; }` in object literals."}}
{"run":213,"commit":"b5face3","metric":399,"metrics":{"parser_tests":213,"parser_test_ms":500},"status":"keep","description":"Port strict class method diagnostics","timestamp":1777217985574,"segment":0,"confidence":3.92,"iterationTokens":1131,"asi":{"hypothesis":"Strict duplicate-parameter diagnostics should apply to class methods with explicit `use strict` directive bodies.","learned":"Regular class method parsing now runs strict parameter validation after parsing the method body.","quickjs_cases":"Adds QuickJS-compatible strict-mode diagnostics for `class C { method(a, a) { \"use strict\"; } }`."}}
