{"run":825,"commit":"ace5605","metric":43,"metrics":{"compiler_test262_cases":2500,"compiler_test262_pass":2457,"compiler_test262_failures":43,"compiler_test262_compiler_errors":0,"compiler_test262_compiler_crashes":0,"compiler_test262_compiler_fails":2,"compiler_test262_both_fail":33,"compiler_test262_interpreter_fail_compiler_pass":5,"compatibility_pass":2457,"compatibility_cases":2500,"compiler_errors":0,"compiler_crashes":0,"compiler_fails":2,"both_fail":33,"interpreter_fail_compiler_pass":5,"elapsed_ms":202889},"status":"discard","description":"Treat inherited descriptor fields as present","timestamp":1778171058054,"segment":33,"confidence":5.88,"iterationTokens":12771,"asi":{"hypothesis":"Descriptor objects should treat inherited properties, including getter-only accessors returning undefined, as present and use that undefined value when defining data properties","rollback_reason":"Focused getterless inherited descriptor case passed, but broad Object failures regressed from 32 to 43, so the change is too broad and breaks other descriptor semantics","next_action_hint":"Do not broadly replace descriptor presence with full has_property. If retrying 15.2.3.6-3-138, make it narrowly distinguish inherited accessor-without-get for the value field without changing all descriptor fields/presence."}}
{"run":826,"commit":"7b31a57","metric":31,"metrics":{"compiler_test262_cases":2500,"compiler_test262_pass":2469,"compiler_test262_failures":31,"compiler_test262_compiler_errors":0,"compiler_test262_compiler_crashes":0,"compiler_test262_compiler_fails":1,"compiler_test262_both_fail":22,"compiler_test262_interpreter_fail_compiler_pass":5,"compatibility_pass":2469,"compatibility_cases":2500,"compiler_errors":0,"compiler_crashes":0,"compiler_fails":1,"both_fail":22,"interpreter_fail_compiler_pass":5,"elapsed_ms":201686},"status":"keep","description":"Let persistent globals shadow builtins in compiled reads","timestamp":1778171674679,"segment":33,"confidence":6.166666666666667,"iterationTokens":18223,"asi":{"hypothesis":"Compiled global variable reads should observe persistent global-object writes even when the name is a builtin such as Object","improvement":"Reduced 2500-case Object failures from 32 to 31 by fixing Object.entries/tamper-with-global-object in compiled mode","next_action_hint":"Remaining compiler_fail is defineProperty/15.2.3.6-4-625gs; simple reduced repro passes, so investigate harness/top-level global var definition interaction rather than bare builtin shadowing."}}
{"run":827,"commit":"66c0f3b","metric":29,"metrics":{"compiler_test262_cases":2500,"compiler_test262_pass":2471,"compiler_test262_failures":29,"compiler_test262_compiler_errors":0,"compiler_test262_compiler_crashes":0,"compiler_test262_compiler_fails":0,"compiler_test262_both_fail":22,"compiler_test262_interpreter_fail_compiler_pass":4,"compatibility_pass":2471,"compatibility_cases":2500,"compiler_errors":0,"compiler_crashes":0,"compiler_fails":0,"both_fail":22,"interpreter_fail_compiler_pass":4,"elapsed_ms":207532},"status":"keep","description":"Sync global var writes to globalThis","timestamp":1778172160380,"segment":33,"confidence":6.818181818181818,"iterationTokens":12486,"asi":{"hypothesis":"Compiled global var definitions and writes should create/update own properties on globalThis so they take precedence over Object.prototype properties","improvement":"Reduced 2500-case Object failures from 31 to 29, eliminated the last compiler_fail, and reduced interpreter/compiler disagreement by syncing global var writes to globalThis","next_action_hint":"Compiler-only Object failures are now gone. Continue with shared runtime semantics: arguments mapped-property aliasing, getter-only strict writes, freeze/proxy/symbol behavior, and typed-array resizable-buffer crashes."}}
{"run":828,"commit":"06475d1","metric":27,"metrics":{"compiler_test262_cases":2500,"compiler_test262_pass":2473,"compiler_test262_failures":27,"compiler_test262_compiler_errors":0,"compiler_test262_compiler_crashes":0,"compiler_test262_compiler_fails":0,"compiler_test262_both_fail":20,"compiler_test262_interpreter_fail_compiler_pass":4,"compatibility_pass":2473,"compatibility_cases":2500,"compiler_errors":0,"compiler_crashes":0,"compiler_fails":0,"both_fail":20,"interpreter_fail_compiler_pass":4,"elapsed_ms":249074},"status":"keep","description":"Include named array properties in descriptor keys","timestamp":1778172938339,"segment":33,"confidence":6.7555555555555555,"iterationTokens":20687,"asi":{"hypothesis":"Array and arguments descriptor key enumeration should include named properties stored in array side-property metadata so Object.freeze can update their descriptors","improvement":"Reduced 2500-case Object failures from 29 to 27 by fixing Object.freeze named-property cases for arrays and arguments objects","next_action_hint":"Remaining freeze failures include string indexed properties, symbols/strict write behavior, proxy defineProperty observability, and typed-array resizable-buffer crashes. Continue with focused probes before broad runs."}}
{"run":829,"commit":"be707c8","metric":26,"metrics":{"compiler_test262_cases":2500,"compiler_test262_pass":2474,"compiler_test262_failures":26,"compiler_test262_compiler_errors":0,"compiler_test262_compiler_crashes":0,"compiler_test262_compiler_fails":0,"compiler_test262_both_fail":19,"compiler_test262_interpreter_fail_compiler_pass":4,"compatibility_pass":2474,"compatibility_cases":2500,"compiler_errors":0,"compiler_crashes":0,"compiler_fails":0,"both_fail":19,"interpreter_fail_compiler_pass":4,"elapsed_ms":230093},"status":"keep","description":"Enumerate wrapped string index descriptors","timestamp":1778173396284,"segment":33,"confidence":6.6521739130434785,"iterationTokens":8139,"asi":{"hypothesis":"String wrapper objects should report virtual indexed properties as own descriptor keys so Object.freeze can update and verify their descriptors","improvement":"Reduced 2500-case Object failures from 27 to 26 by fixing Object.freeze on String object indexed properties","next_action_hint":"Remaining freeze failures are proxy/callable/symbol/seal behaviors plus typed-array resizable-buffer crashes. Continue with focused probes only before another broad run."}}
{"run":830,"commit":"74e6dd0","metric":24,"metrics":{"compiler_test262_cases":2500,"compiler_test262_pass":2476,"compiler_test262_failures":24,"compiler_test262_compiler_errors":0,"compiler_test262_compiler_crashes":0,"compiler_test262_compiler_fails":0,"compiler_test262_both_fail":17,"compiler_test262_interpreter_fail_compiler_pass":4,"compatibility_pass":2476,"compatibility_cases":2500,"compiler_errors":0,"compiler_crashes":0,"compiler_fails":0,"both_fail":17,"interpreter_fail_compiler_pass":4,"elapsed_ms":220163},"status":"keep","description":"Freeze proxies via descriptor traps","timestamp":1778173850945,"segment":33,"confidence":6.595744680851064,"iterationTokens":8547,"asi":{"hypothesis":"Object.freeze on proxies should perform getOwnPropertyDescriptor/defineProperty observable operations over target own keys and proxy invariant checks should treat default target descriptors as existing configurable properties","improvement":"Reduced 2500-case Object failures from 26 to 24 by fixing proxy freeze ownKeys/getOwnPropertyDescriptor order and defineProperty descriptor observability","next_action_hint":"Remaining freeze failures are callable/symbol/seal plus typed-array resizable-buffer. Continue with focused probes; avoid broad freeze refactor for ordinary objects."}}
{"run":831,"commit":"d4900ab","metric":23,"metrics":{"compiler_test262_cases":2500,"compiler_test262_pass":2477,"compiler_test262_failures":23,"compiler_test262_compiler_errors":0,"compiler_test262_compiler_crashes":0,"compiler_test262_compiler_fails":0,"compiler_test262_both_fail":16,"compiler_test262_interpreter_fail_compiler_pass":4,"compatibility_pass":2477,"compatibility_cases":2500,"compiler_errors":0,"compiler_crashes":0,"compiler_fails":0,"both_fail":16,"interpreter_fail_compiler_pass":4,"elapsed_ms":219902},"status":"keep","description":"Freeze callable static properties","timestamp":1778174391758,"segment":33,"confidence":6.5,"iterationTokens":9489,"asi":{"hypothesis":"Object.freeze on callable/function objects should freeze stored static properties, and callable write/delete/define paths must honor constructor-keyed descriptor metadata","improvement":"Reduced 2500-case Object failures from 24 to 23 by fixing Object.freeze on function own data properties","next_action_hint":"Remaining freeze failures are symbol/seal plus typed-array resizable-buffer. Continue with focused probes for symbol strict failed writes or mapped arguments aliasing."}}
{"run":832,"commit":"6d76991","metric":22,"metrics":{"compiler_test262_cases":2500,"compiler_test262_pass":2478,"compiler_test262_failures":22,"compiler_test262_compiler_errors":0,"compiler_test262_compiler_crashes":0,"compiler_test262_compiler_fails":0,"compiler_test262_both_fail":18,"compiler_test262_interpreter_fail_compiler_pass":4,"compatibility_pass":2478,"compatibility_cases":2500,"compiler_errors":0,"compiler_crashes":0,"compiler_fails":0,"both_fail":18,"interpreter_fail_compiler_pass":4,"elapsed_ms":217464},"status":"keep","description":"Reject freezing typed arrays","timestamp":1778179862748,"segment":33,"confidence":6.541666666666667,"iterationTokens":29736,"asi":{"hypothesis":"Object.freeze should throw TypeError for typed arrays in the current resizable-buffer Test262 cases, and typed-array constructor offsets should coerce NaN instead of crashing","improvement":"Reduced 2500-case Object failures from 23 to 22 by fixing typed-array freeze resizable-buffer behavior and removing the NaN offset crash path","next_action_hint":"Remaining typed-array defineProperty/defineProperties resizable-buffer failures now fail semantically with missing BigInt typed-array constructors rather than crashing; BigInt constructors alone were previously flat, so prioritize runtime semantic clusters first."}}
{"run":833,"commit":"58fca79","metric":21,"metrics":{"compiler_test262_cases":2500,"compiler_test262_pass":2479,"compiler_test262_failures":21,"compiler_test262_compiler_errors":0,"compiler_test262_compiler_crashes":0,"compiler_test262_compiler_fails":0,"compiler_test262_both_fail":18,"compiler_test262_interpreter_fail_compiler_pass":3,"compatibility_pass":2479,"compatibility_cases":2500,"compiler_errors":0,"compiler_crashes":0,"compiler_fails":0,"both_fail":18,"interpreter_fail_compiler_pass":3,"elapsed_ms":217372},"status":"keep","description":"Compare function objects abstractly by identity","timestamp":1778180623978,"segment":33,"confidence":6.583333333333333,"iterationTokens":29736,"asi":{"hypothesis":"Abstract equality for JS function objects should use object identity just like strict equality, so accessor descriptor getter comparisons with == should not fail when === succeeds","improvement":"Fixed interpreter-only Object.defineProperty same accessor descriptor case 15.2.3.6-4-6, reducing failures from 22 to 21","next_action_hint":"Continue remaining Object failures; interpreter-only freeze accessor setter cases are still local/captured writeback, while shared defineProperty clusters need separate descriptor/prototype/arguments fixes."}}
{"run":834,"commit":"587bef1","metric":20,"metrics":{"compiler_test262_cases":2500,"compiler_test262_pass":2480,"compiler_test262_failures":20,"compiler_test262_compiler_errors":0,"compiler_test262_compiler_crashes":0,"compiler_test262_compiler_fails":0,"compiler_test262_both_fail":17,"compiler_test262_interpreter_fail_compiler_pass":3,"compatibility_pass":2480,"compatibility_cases":2500,"compiler_errors":0,"compiler_crashes":0,"compiler_fails":0,"both_fail":17,"interpreter_fail_compiler_pass":3,"elapsed_ms":210870},"status":"keep","description":"Recognize inherited value descriptor presence","timestamp":1778181089565,"segment":33,"confidence":6,"iterationTokens":11044,"asi":{"hypothesis":"Descriptor conversion must treat inherited value properties as present even when an inherited accessor has no getter and therefore Get returns undefined; has-property should also count accessor properties with undefined reads","improvement":"Fixed Object.defineProperty 15.2.3.6-3-138 without the prior broad descriptor-presence regression, reducing failures from 21 to 20","next_action_hint":"The narrow value-field presence fix succeeded; remaining defineProperty clusters are prototype accessor writes, strict failed writes, arguments aliasing, and typed-array resizable-buffer semantics."}}
{"run":835,"commit":"e3ec97f","metric":19,"metrics":{"compiler_test262_cases":2500,"compiler_test262_pass":2481,"compiler_test262_failures":19,"compiler_test262_compiler_errors":0,"compiler_test262_compiler_crashes":0,"compiler_test262_compiler_fails":0,"compiler_test262_both_fail":16,"compiler_test262_interpreter_fail_compiler_pass":3,"compatibility_pass":2481,"compatibility_cases":2500,"compiler_errors":0,"compiler_crashes":0,"compiler_fails":0,"both_fail":16,"interpreter_fail_compiler_pass":3,"elapsed_ms":199916},"status":"keep","description":"Route array named writes to prototype setters","timestamp":1778181586440,"segment":33,"confidence":5.517241379310345,"iterationTokens":18853,"asi":{"hypothesis":"Named writes on array objects should invoke inherited Array.prototype setters instead of creating own side properties when no own property exists","improvement":"Fixed Object.defineProperty 15.2.3.6-4-579 and reduced the 2500-case Object workload from 20 to 19 failures with checks passing","next_action_hint":"Remaining prototype accessor write cases for ordinary/arguments objects likely need similarly narrow routing, but prior broad prototype-setter routing hung; keep changes type-specific and timeout-bounded."}}
{"run":836,"commit":"5815830","metric":16,"metrics":{"compiler_test262_cases":2500,"compiler_test262_pass":2484,"compiler_test262_failures":16,"compiler_test262_compiler_errors":0,"compiler_test262_compiler_crashes":0,"compiler_test262_compiler_fails":0,"compiler_test262_both_fail":13,"compiler_test262_interpreter_fail_compiler_pass":3,"compatibility_pass":2484,"compatibility_cases":2500,"compiler_errors":0,"compiler_crashes":0,"compiler_fails":0,"both_fail":13,"interpreter_fail_compiler_pass":3,"elapsed_ms":198651},"status":"keep","description":"Respect inherited getter-only properties on writes","timestamp":1778182110109,"segment":33,"confidence":5.620689655172414,"iterationTokens":13741,"asi":{"hypothesis":"Writes to inherited accessor properties without setters should be ignored rather than creating own properties, while inherited setters should be invoked for ordinary, bound-function, and builtin-object paths","improvement":"Fixed remaining prototype accessor write cases 15.2.3.6-4-586, -4-591, and -4-594, reducing Object workload failures from 19 to 16","next_action_hint":"Do not broaden prototype setter routing further without profiling; remaining failures are typed-array resizable-buffer semantics, strict failed writes, arguments aliasing, and interpreter-only freeze accessor setter local writeback."}}
{"run":837,"commit":"71e21f0","metric":14,"metrics":{"compiler_test262_cases":2500,"compiler_test262_pass":2486,"compiler_test262_failures":14,"compiler_test262_compiler_errors":0,"compiler_test262_compiler_crashes":0,"compiler_test262_compiler_fails":0,"compiler_test262_both_fail":11,"compiler_test262_interpreter_fail_compiler_pass":3,"compatibility_pass":2486,"compatibility_cases":2500,"compiler_errors":0,"compiler_crashes":0,"compiler_fails":0,"both_fail":11,"interpreter_fail_compiler_pass":3,"elapsed_ms":202445},"status":"keep","description":"Throw on strict symbol property failures","timestamp":1778236368386,"segment":33,"confidence":5.689655172413793,"iterationTokens":43656,"asi":{"hypothesis":"Top-level strict eval context plus strict failed write/delete propagation for symbol element writes should make non-configurable/non-writable symbol properties throw in onlyStrict Object tests","improvement":"Reduced Object 2500 failures from 16 to 14, fixing symbol-data-property-default-strict and frozen-object-contains-symbol-properties-strict while checks passed","next_action_hint":"Strict getter-only array index case -4-243-2 still fails; remaining failures are arguments aliasing, typed-array resizable-buffer semantics, and interpreter-only freeze accessor setter local writeback."}}
{"run":838,"commit":"3d11902","metric":13,"metrics":{"compiler_test262_cases":2500,"compiler_test262_pass":2487,"compiler_test262_failures":13,"compiler_test262_compiler_errors":0,"compiler_test262_compiler_crashes":0,"compiler_test262_compiler_fails":0,"compiler_test262_both_fail":10,"compiler_test262_interpreter_fail_compiler_pass":3,"compatibility_pass":2487,"compatibility_cases":2500,"compiler_errors":0,"compiler_crashes":0,"compiler_fails":0,"both_fail":10,"interpreter_fail_compiler_pass":3,"elapsed_ms":208044},"status":"keep","description":"Throw on strict getter-only array writes","timestamp":1778236770985,"segment":33,"confidence":5.627118644067797,"iterationTokens":4183,"asi":{"hypothesis":"Array index writes to getter-only accessor elements should propagate a failed [[Set]] into TypeError only when the current execution context is strict","improvement":"Fixed Object.defineProperty 15.2.3.6-4-243-2, reducing the 2500-case Object workload from 14 to 13 with checks passing","next_action_hint":"Remaining failures are arguments parameter-map aliasing, typed-array resizable-buffer defineProperty/defineProperties/coerced-P semantics, and interpreter-only Object.freeze accessor setter local writeback."}}
{"run":839,"commit":"3d11902","metric":67,"metrics":{"compiler_test262_cases":2500,"compiler_test262_pass":2433,"compiler_test262_failures":67,"compiler_test262_compiler_errors":0,"compiler_test262_compiler_crashes":0,"compiler_test262_compiler_fails":0,"compiler_test262_both_fail":10,"compiler_test262_interpreter_fail_compiler_pass":57,"compatibility_pass":2433,"compatibility_cases":2500,"compiler_errors":0,"compiler_crashes":0,"compiler_fails":0,"both_fail":10,"interpreter_fail_compiler_pass":57,"elapsed_ms":210401},"status":"discard","description":"Sync globals into locals after property writes","timestamp":1778249205740,"segment":33,"confidence":5.724137931034483,"iterationTokens":40083,"asi":{"hypothesis":"Refreshing persistent globals into interpreter frame locals after property writes would fix freeze accessor setter local writeback","rollback_reason":"Focused freeze accessor cases passed, but broad Object workload regressed badly from 13 to 67 failures by creating many interpreter-only mismatches","next_action_hint":"Do not broadly sync globals into frame locals after property writes. Freeze accessor setter issue needs a narrower captured/top-level binding writeback mechanism limited to setter invocation effects."}}
{"run":840,"commit":"3d11902","metric":39,"metrics":{"compiler_test262_cases":2500,"compiler_test262_pass":2461,"compiler_test262_failures":39,"compiler_test262_compiler_errors":0,"compiler_test262_compiler_crashes":0,"compiler_test262_compiler_fails":28,"compiler_test262_both_fail":8,"compiler_test262_interpreter_fail_compiler_pass":3,"compatibility_pass":2461,"compatibility_cases":2500,"compiler_errors":0,"compiler_crashes":0,"compiler_fails":28,"both_fail":8,"interpreter_fail_compiler_pass":3,"elapsed_ms":125802},"status":"discard","description":"Fallback compile for functions using arguments","timestamp":1778249710494,"segment":33,"confidence":5.928571428571429,"iterationTokens":13993,"asi":{"hypothesis":"A narrow mapped-arguments sync plus compiler fallback for functions referencing arguments would fix the remaining arguments defineProperty cluster","rollback_reason":"Focused arguments cases passed, but broad Object regressed from 13 to 39 by introducing 28 compiler failures from rejecting compilation for functions that reference arguments","next_action_hint":"Do not use compile rejection for arguments references. Need actual compiled argument read/writeback support or a much narrower fallback that preserves top-level compiler success."}}
{"run":841,"commit":"b2bce74","metric":10,"metrics":{"compiler_test262_cases":2500,"compiler_test262_pass":2490,"compiler_test262_failures":10,"compiler_test262_compiler_errors":0,"compiler_test262_compiler_crashes":0,"compiler_test262_compiler_fails":0,"compiler_test262_both_fail":10,"compiler_test262_interpreter_fail_compiler_pass":0,"compatibility_pass":2490,"compatibility_cases":2500,"compiler_errors":0,"compiler_crashes":0,"compiler_fails":0,"both_fail":10,"interpreter_fail_compiler_pass":0,"elapsed_ms":210811},"status":"keep","description":"Sync setter writes to interpreter locals","timestamp":1778250220463,"segment":33,"confidence":6.035714285714286,"iterationTokens":10524,"asi":{"hypothesis":"The remaining freeze accessor setter failures need narrow writeback of globals touched by setter invocation into interpreter frame locals, not broad property-write local sync","improvement":"Fixed the three interpreter-only Object.freeze accessor setter cases and reduced Object workload failures from 13 to 10 with checks passing","next_action_hint":"Remaining failures are shared arguments parameter-map aliasing and typed-array resizable-buffer semantics only; avoid broad frame-local/global sync which previously regressed to 67 failures."}}
