{"run":615,"commit":"a6f6a29","metric":0,"metrics":{"compiler_test262_cases":0,"compiler_test262_pass":0,"compiler_test262_failures":0,"compiler_test262_compiler_errors":0,"compiler_test262_compiler_crashes":0,"compiler_test262_compiler_fails":0,"compiler_test262_both_fail":0,"compiler_test262_interpreter_fail_compiler_pass":0,"compatibility_pass":0,"compatibility_cases":0,"compiler_errors":0,"compiler_crashes":0,"compiler_fails":0,"both_fail":0,"interpreter_fail_compiler_pass":0,"elapsed_ms":0},"status":"crash","description":"Honor onlyStrict Test262 flag in VM compiler bench","timestamp":1778031419541,"segment":21,"confidence":null,"iterationTokens":3965,"asi":{"hypothesis":"The function-expression workload includes Test262 onlyStrict cases, but the bench currently runs them after harness code so strict directive expectations are not honored; prepending a strict directive should correct those cases.","rollback_reason":"The edit referenced flags outside the per-case scope and caused a bench compile error.","next_action_hint":"Reapply inside the case map where meta/flags are available, or derive flags inside the per-case execution loop before constructing full source."}}
{"run":616,"commit":"ea2261d","metric":9,"metrics":{"compiler_test262_cases":264,"compiler_test262_pass":255,"compiler_test262_failures":9,"compiler_test262_compiler_errors":0,"compiler_test262_compiler_crashes":0,"compiler_test262_compiler_fails":4,"compiler_test262_both_fail":5,"compiler_test262_interpreter_fail_compiler_pass":0,"compatibility_pass":255,"compatibility_cases":264,"compiler_errors":0,"compiler_crashes":0,"compiler_fails":4,"both_fail":5,"interpreter_fail_compiler_pass":0,"elapsed_ms":9482},"status":"keep","description":"Honor onlyStrict Test262 flag in VM compiler bench","timestamp":1778031570620,"segment":21,"confidence":null,"iterationTokens":1845,"asi":{"hypothesis":"The Test262 `onlyStrict` flag means the case must run with a strict directive before harness and test source; the bench was running these cases non-strict because harness code preceded source directives.","improvement":"Correctly honoring onlyStrict in the function-expression workload reduced compatibility failures from 13 to 9 by fixing strict-only named function expression expectations.","next_action_hint":"Remaining function failures are length/name descriptors, compiler-only parameter scoping, static-init-await syntax, and with/unscopables behavior."}}
{"run":617,"commit":"ea2261d","metric":0,"metrics":{"compiler_test262_cases":0,"compiler_test262_pass":0,"compiler_test262_failures":0,"compiler_test262_compiler_errors":0,"compiler_test262_compiler_crashes":0,"compiler_test262_compiler_fails":0,"compiler_test262_both_fail":0,"compiler_test262_interpreter_fail_compiler_pass":0,"compatibility_pass":0,"compatibility_cases":0,"compiler_errors":0,"compiler_crashes":0,"compiler_fails":0,"both_fail":0,"interpreter_fail_compiler_pass":0,"elapsed_ms":0},"status":"crash","description":"Retry local reference writes after strict flag fix","timestamp":1778031617204,"segment":21,"confidence":null,"iterationTokens":3255,"asi":{"hypothesis":"After honoring onlyStrict, the local-reference write fix might now reduce the remaining unscopables failures in the function workload.","rollback_reason":"Manual edit malformed the get_ref_value clause and caused a compile syntax error.","next_action_hint":"Reapply carefully by inspecting the current clause structure; ensure the function head is syntactically valid before running the benchmark."}}
{"run":618,"commit":"ea2261d","metric":9,"metrics":{"compiler_test262_cases":264,"compiler_test262_pass":255,"compiler_test262_failures":9,"compiler_test262_compiler_errors":0,"compiler_test262_compiler_crashes":0,"compiler_test262_compiler_fails":4,"compiler_test262_both_fail":5,"compiler_test262_interpreter_fail_compiler_pass":0,"compatibility_pass":255,"compatibility_cases":264,"compiler_errors":0,"compiler_crashes":0,"compiler_fails":4,"both_fail":5,"interpreter_fail_compiler_pass":0,"elapsed_ms":10855},"status":"discard","description":"Retry local reference writes after strict flag fix","timestamp":1778031795822,"segment":21,"confidence":2,"iterationTokens":3672,"asi":{"hypothesis":"After honoring onlyStrict, tagging global variable references separately from local/captured cell references may reduce the remaining unscopables failures.","rollback_reason":"Focused with/unscopables assignment probe passed, but function-expression primary metric stayed at 9.","next_action_hint":"The remaining unscopables failures are not solved by simple local/global cell separation; inspect the full generated test bytecode and captured var refs before retrying."}}
{"run":619,"commit":"3529d7e","metric":9,"metrics":{"compiler_test262_cases":264,"compiler_test262_pass":255,"compiler_test262_failures":9,"compiler_test262_compiler_errors":0,"compiler_test262_compiler_crashes":0,"compiler_test262_compiler_fails":4,"compiler_test262_both_fail":5,"compiler_test262_interpreter_fail_compiler_pass":0,"compatibility_pass":255,"compatibility_cases":264,"compiler_errors":0,"compiler_crashes":0,"compiler_fails":4,"both_fail":5,"interpreter_fail_compiler_pass":0,"elapsed_ms":9420},"status":"discard","description":"Propagate simple compiled eval var declarations to persistent globals","timestamp":1778032112350,"segment":21,"confidence":null,"iterationTokens":8201,"asi":{"hypothesis":"Compiled direct eval of simple `var` declarations in parameter initializers should update the environment seen by closures, fixing scope-param-* compiler-only failures.","rollback_reason":"Focused probe still returned outside for compiled closures and primary metric stayed at 9.","next_action_hint":"The closures capture the pre-eval value rather than resolving through persistent globals; inspect compiled capture analysis/hidden params for parameter default functions instead of changing eval globals."}}
{"run":620,"commit":"3529d7e","metric":13,"metrics":{"compiler_test262_cases":264,"compiler_test262_pass":251,"compiler_test262_failures":13,"compiler_test262_compiler_errors":0,"compiler_test262_compiler_crashes":0,"compiler_test262_compiler_fails":6,"compiler_test262_both_fail":7,"compiler_test262_interpreter_fail_compiler_pass":0,"compatibility_pass":251,"compatibility_cases":264,"compiler_errors":0,"compiler_crashes":0,"compiler_fails":6,"both_fail":7,"interpreter_fail_compiler_pass":0,"elapsed_ms":9472},"status":"discard","description":"Expose virtual function name and length descriptors in function workload","timestamp":1778032304626,"segment":21,"confidence":2,"iterationTokens":3269,"asi":{"hypothesis":"Function expression name/length failures can be fixed by exposing virtual own non-writable, non-enumerable, configurable descriptors for callable metadata.","rollback_reason":"Focused descriptor probe passed, but active function workload regressed from best 9 to 13 and compiler-only failures increased to 6.","next_action_hint":"Virtual callable metadata still conflicts with compiled propertyHelper restore/delete semantics. Do not retry without isolating compiler-only failures; focus on parser/bench or compiler scope bugs instead."}}
{"run":621,"commit":"3529d7e","metric":9,"metrics":{"compiler_test262_cases":264,"compiler_test262_pass":255,"compiler_test262_failures":9,"compiler_test262_compiler_errors":0,"compiler_test262_compiler_crashes":0,"compiler_test262_compiler_fails":5,"compiler_test262_both_fail":4,"compiler_test262_interpreter_fail_compiler_pass":0,"compatibility_pass":255,"compatibility_cases":264,"compiler_errors":0,"compiler_crashes":0,"compiler_fails":5,"both_fail":4,"interpreter_fail_compiler_pass":0,"elapsed_ms":9388},"status":"discard","description":"Update local frame state for with fallthrough references","timestamp":1778032539903,"segment":21,"confidence":null,"iterationTokens":4639,"asi":{"hypothesis":"When a with environment is skipped due Symbol.unscopables, make_loc_ref/put_ref_value should update the actual local/captured frame state rather than a global binding.","rollback_reason":"Primary metric stayed at 9 and compiler-only failures increased to 5; focused full unscopables probe still returned local value 10 instead of expected 20.","next_action_hint":"The local index used by make_loc_ref does not correspond to the value later read in this bytecode shape. Inspect frame local/arg slot mapping and short-form get_loc operands before retrying."}}
{"type":"config","name":"QuickBEAM array-expression compatibility","metricName":"compatibility_failures","metricUnit":"","bestDirection":"lower"}
{"run":622,"commit":"f5c18e1","metric":33,"metrics":{"compiler_test262_cases":52,"compiler_test262_pass":19,"compiler_test262_failures":33,"compiler_test262_compiler_errors":0,"compiler_test262_compiler_crashes":0,"compiler_test262_compiler_fails":18,"compiler_test262_both_fail":14,"compiler_test262_interpreter_fail_compiler_pass":1,"compatibility_pass":19,"compatibility_cases":52,"compiler_errors":0,"compiler_crashes":0,"compiler_fails":18,"both_fail":14,"interpreter_fail_compiler_pass":1,"elapsed_ms":3807},"status":"keep","description":"Baseline array-expression compatibility workload","timestamp":1778032697560,"segment":22,"confidence":null,"iterationTokens":114,"asi":{"hypothesis":"Function-expression compatibility is plateauing at 9 after strict flag and several neutral/regressing semantic trials, so move to the next planned phase: language/expressions/array.","improvement":"Established the array-expression workload baseline: 33 compatibility failures across 52 cases.","next_action_hint":"List array-expression failures and target broad clusters such as iterator closing, elisions/spread semantics, or compiler-only array destructuring failures."}}
{"run":623,"commit":"f5c18e1","metric":33,"metrics":{"compiler_test262_cases":52,"compiler_test262_pass":19,"compiler_test262_failures":33,"compiler_test262_compiler_errors":0,"compiler_test262_compiler_crashes":0,"compiler_test262_compiler_fails":18,"compiler_test262_both_fail":14,"compiler_test262_interpreter_fail_compiler_pass":1,"compatibility_pass":19,"compatibility_cases":52,"compiler_errors":0,"compiler_crashes":0,"compiler_fails":18,"both_fail":14,"interpreter_fail_compiler_pass":1,"elapsed_ms":2491},"status":"discard","description":"Preserve globals when converting fast invocation context maps","timestamp":1778032912375,"segment":22,"confidence":null,"iterationTokens":10351,"asi":{"hypothesis":"Array spread compiler failures reporting `assert is not defined` may be caused by Invocation.active_ctx converting fast context maps while replacing their globals with base globals.","rollback_reason":"Focused spread-sngl-literal passed after the change, but the active array workload stayed at 33; no primary improvement.","next_action_hint":"The focused result may already pass on current baseline or only affect a non-representative invocation path. Inspect bench full source and exact compiled stack for the failing spread cases before retrying context conversion."}}
{"run":624,"commit":"f5c18e1","metric":33,"metrics":{"compiler_test262_cases":52,"compiler_test262_pass":19,"compiler_test262_failures":33,"compiler_test262_compiler_errors":0,"compiler_test262_compiler_crashes":0,"compiler_test262_compiler_fails":18,"compiler_test262_both_fail":14,"compiler_test262_interpreter_fail_compiler_pass":1,"compatibility_pass":19,"compatibility_cases":52,"compiler_errors":0,"compiler_crashes":0,"compiler_fails":18,"both_fail":14,"interpreter_fail_compiler_pass":1,"elapsed_ms":2546},"status":"checks_failed","description":"Route Function call/apply through invocation dispatch","timestamp":1778033141306,"segment":22,"confidence":null,"iterationTokens":8514,"asi":{"hypothesis":"Function.prototype.call/apply compiler spread failures may come from invoke_with_receiver compiled closure side effects, so routing call/apply through Invocation.dispatch could avoid duplicate closure execution or global loss.","rollback_reason":"Focused call/apply duplicate counter bug remained, primary stayed at 33, and backpressure checks failed.","next_action_hint":"The duplicate callCount issue is not in Runtime.Function.invoke_fun dispatch choice. Inspect Runner.invoke_with_receiver or compiled captured global writes for method-call invocation paths."}}
{"run":625,"commit":"ea67e40","metric":25,"metrics":{"compiler_test262_cases":52,"compiler_test262_pass":27,"compiler_test262_failures":25,"compiler_test262_compiler_errors":0,"compiler_test262_compiler_crashes":0,"compiler_test262_compiler_fails":18,"compiler_test262_both_fail":6,"compiler_test262_interpreter_fail_compiler_pass":1,"compatibility_pass":27,"compatibility_cases":52,"compiler_errors":0,"compiler_crashes":0,"compiler_fails":18,"both_fail":6,"interpreter_fail_compiler_pass":1,"elapsed_ms":4042},"status":"keep","description":"Preserve Array.prototype method identity","timestamp":1778033367196,"segment":22,"confidence":null,"iterationTokens":4373,"asi":{"hypothesis":"Array instances should retrieve methods from the cached Array.prototype object so identity checks like array.toString === Array.prototype.toString pass, instead of constructing fresh builtin tuples via Array.proto_property/1.","improvement":"Fixed the S11.1.4_A1.* Array.prototype.toString identity cluster, reducing array-expression failures from 33 to 25.","next_action_hint":"Next array clusters are compiler-only spread/apply failures and object spread symbol/order semantics."}}
{"run":626,"commit":"ea67e40","metric":25,"metrics":{"compiler_test262_cases":52,"compiler_test262_pass":27,"compiler_test262_failures":25,"compiler_test262_compiler_errors":0,"compiler_test262_compiler_crashes":0,"compiler_test262_compiler_fails":19,"compiler_test262_both_fail":5,"compiler_test262_interpreter_fail_compiler_pass":1,"compatibility_pass":27,"compatibility_cases":52,"compiler_errors":0,"compiler_crashes":0,"compiler_fails":19,"both_fail":5,"interpreter_fail_compiler_pass":1,"elapsed_ms":2605},"status":"discard","description":"Copy symbol keys in object spread sources","timestamp":1778033671560,"segment":22,"confidence":null,"iterationTokens":11180,"asi":{"hypothesis":"Object spread inside array tests should copy enumerable symbol keys and avoid crashing Object.hasOwnProperty on symbol keys.","rollback_reason":"Focused interpreter spread symbol case passed and both_fail dropped by one, but total compatibility_failures stayed at 25 while compiler-only failures increased to 19.","next_action_hint":"Symbol copying fixes interpreter/shared semantics but exposes compiled source-compiler symbol spread mismatch. Revisit together with compiler object spread symbol support, not alone."}}
{"run":627,"commit":"0cc8aca","metric":23,"metrics":{"compiler_test262_cases":52,"compiler_test262_pass":29,"compiler_test262_failures":23,"compiler_test262_compiler_errors":0,"compiler_test262_compiler_crashes":0,"compiler_test262_compiler_fails":18,"compiler_test262_both_fail":4,"compiler_test262_interpreter_fail_compiler_pass":1,"compatibility_pass":29,"compatibility_cases":52,"compiler_errors":0,"compiler_crashes":0,"compiler_fails":18,"both_fail":4,"interpreter_fail_compiler_pass":1,"elapsed_ms":2586},"status":"keep","description":"Fall back from Array.prototype to Object.prototype","timestamp":1778033961715,"segment":22,"confidence":2.5,"iterationTokens":7365,"asi":{"hypothesis":"Array instances should inherit Object.prototype through Array.prototype, so methods like hasOwnProperty remain available even when Array.prototype has a read-only indexed property.","improvement":"Fixed legacy read-only Array.prototype indexed property cases, reducing array-expression failures from 25 to 23.","next_action_hint":"Remaining array failures are dominated by compiler-only spread/apply assert scope issues and shared object spread getter/symbol/order semantics."}}
{"run":628,"commit":"0df9d2a","metric":5,"metrics":{"compiler_test262_cases":52,"compiler_test262_pass":47,"compiler_test262_failures":5,"compiler_test262_compiler_errors":0,"compiler_test262_compiler_crashes":0,"compiler_test262_compiler_fails":0,"compiler_test262_both_fail":2,"compiler_test262_interpreter_fail_compiler_pass":3,"compatibility_pass":47,"compatibility_cases":52,"compiler_errors":0,"compiler_crashes":0,"compiler_fails":0,"both_fail":2,"interpreter_fail_compiler_pass":3,"elapsed_ms":2576},"status":"keep","description":"Preserve compiled method call context for builtins","timestamp":1778034233258,"segment":22,"confidence":3.5,"iterationTokens":6475,"asi":{"hypothesis":"Compiler-only array spread/apply failures reporting `assert is not defined` come from invoking builtin methods without installing the compiled call context, so callbacks run with base globals instead of Test262 harness globals.","improvement":"Wrapping builtin method calls in Invocation.invoke_method_runtime with the supplied context eliminated the array compiler-only spread/apply cluster, reducing failures from 23 to 5.","next_action_hint":"Remaining array failures are shared/interpreter-skew object spread semantics: getters/descriptors, symbols/order, and override behavior."}}
{"run":629,"commit":"fb7c95d","metric":4,"metrics":{"compiler_test262_cases":52,"compiler_test262_pass":48,"compiler_test262_failures":4,"compiler_test262_compiler_errors":0,"compiler_test262_compiler_crashes":0,"compiler_test262_compiler_fails":0,"compiler_test262_both_fail":1,"compiler_test262_interpreter_fail_compiler_pass":3,"compatibility_pass":48,"compatibility_cases":52,"compiler_errors":0,"compiler_crashes":0,"compiler_fails":0,"both_fail":1,"interpreter_fail_compiler_pass":3,"elapsed_ms":2440},"status":"keep","description":"Copy symbol keys during object spread","timestamp":1778034525834,"segment":22,"confidence":3.625,"iterationTokens":6475,"asi":{"hypothesis":"With compiled builtin callbacks now preserving the caller context, enumerable symbol-key copying in CopyDataProperties should improve real object-spread semantics instead of merely shifting failures to compiler-only.","improvement":"Symbol-key object spread now passes in both interpreter and compiler, reducing array failures from 5 to 4.","next_action_hint":"Remaining array failures are getter/descriptor initialization skew and spread key order/override semantics."}}
{"run":630,"commit":"fb7c95d","metric":4,"metrics":{"compiler_test262_cases":52,"compiler_test262_pass":48,"compiler_test262_failures":4,"compiler_test262_compiler_errors":0,"compiler_test262_compiler_crashes":0,"compiler_test262_compiler_fails":0,"compiler_test262_both_fail":1,"compiler_test262_interpreter_fail_compiler_pass":3,"compatibility_pass":48,"compatibility_cases":52,"compiler_errors":0,"compiler_crashes":0,"compiler_fails":0,"both_fail":1,"interpreter_fail_compiler_pass":3,"elapsed_ms":2409},"status":"discard","description":"Order object spread keys before copying","timestamp":1778034749108,"segment":22,"confidence":3.625,"iterationTokens":6266,"asi":{"hypothesis":"CopyDataProperties should visit integer indices, string keys, then symbols in OwnPropertyKeys order for spread getter side effects.","rollback_reason":"Focused spread-order case passed in both modes, but total array compatibility_failures stayed at 4 because another case regressed into the remaining failure set.","next_action_hint":"Do not retry as a standalone order-only change. Inspect the new failing case and design copy order together with override/getter descriptor behavior."}}
{"run":631,"commit":"7d9a7f5","metric":2,"metrics":{"compiler_test262_cases":52,"compiler_test262_pass":50,"compiler_test262_failures":2,"compiler_test262_compiler_errors":0,"compiler_test262_compiler_crashes":0,"compiler_test262_compiler_fails":0,"compiler_test262_both_fail":1,"compiler_test262_interpreter_fail_compiler_pass":1,"compatibility_pass":50,"compatibility_cases":52,"compiler_errors":0,"compiler_crashes":0,"compiler_fails":0,"both_fail":1,"interpreter_fail_compiler_pass":1,"elapsed_ms":2430},"status":"keep","description":"Include unordered object keys in Object.keys","timestamp":1778034961686,"segment":22,"confidence":3.4444444444444446,"iterationTokens":7285,"asi":{"hypothesis":"Native-bytecode object spread leaves some subsequent literal properties outside key_order metadata, so Object.keys should enumerate remaining own string/integer keys instead of trusting key_order as exhaustive.","improvement":"Fixed interpreter skew for spread getter descriptor/init and override length checks, reducing array failures from 4 to 2.","next_action_hint":"Remaining failures are spread-order (shared) and manipulate-outer-object-in-getter (interpreter/compiler skew or shared depending on ordering changes)."}}
{"run":632,"commit":"f4aa5c7","metric":1,"metrics":{"compiler_test262_cases":52,"compiler_test262_pass":51,"compiler_test262_failures":1,"compiler_test262_compiler_errors":0,"compiler_test262_compiler_crashes":0,"compiler_test262_compiler_fails":0,"compiler_test262_both_fail":1,"compiler_test262_interpreter_fail_compiler_pass":0,"compatibility_pass":51,"compatibility_cases":52,"compiler_errors":0,"compiler_crashes":0,"compiler_fails":0,"both_fail":1,"interpreter_fail_compiler_pass":0,"elapsed_ms":2472},"status":"keep","description":"Include unordered object keys in for-in enumeration","timestamp":1778035173712,"segment":22,"confidence":3.2,"iterationTokens":9078,"asi":{"hypothesis":"for-in enumeration also treats key_order metadata as exhaustive, so properties added outside key_order after native-bytecode object spread are invisible to propertyHelper's enumerability check.","improvement":"Fixed the remaining getter descriptor interpreter skew, reducing array failures from 2 to 1.","next_action_hint":"Only spread-obj-spread-order remains; standalone CopyDataProperties ordering passed it but regressed manipulate-outter-obj-in-getter, so solve ordering and source object evaluation/getter mutation together."}}
