{"run":756,"commit":"4ebf028","metric":0,"metrics":{"compiler_test262_cases":800,"compiler_test262_pass":800,"compiler_test262_failures":0,"compiler_test262_compiler_errors":0,"compiler_test262_compiler_crashes":0,"compiler_test262_compiler_fails":0,"compiler_test262_both_fail":0,"compiler_test262_interpreter_fail_compiler_pass":0,"compatibility_pass":800,"compatibility_cases":800,"compiler_errors":0,"compiler_crashes":0,"compiler_fails":0,"both_fail":0,"interpreter_fail_compiler_pass":0,"elapsed_ms":40554},"status":"keep","description":"Read function properties through bracket access","timestamp":1778102435643,"segment":27,"confidence":4,"iterationTokens":7716,"asi":{"hypothesis":"Compiled bracket access should treat function structs like JS objects instead of generic maps, and hasOwnProperty on functions should see stored descriptor-backed properties","improvement":"Fixed the final compiler-only defineProperties function-object case in the 800-case Object slice","validation":"The first 500-case Object slice remained clean and checks passed","next_action_hint":"Rebaseline a broader Object slice or move to the next compatibility workload; avoid pooled broad sweeps until compiler retention is addressed"}}
{"type":"config","name":"QuickBEAM built-ins/Object 1000-case compatibility","metricName":"compatibility_failures","metricUnit":"","bestDirection":"lower"}
{"run":757,"commit":"21cf87f","metric":116,"metrics":{"compiler_test262_cases":1000,"compiler_test262_pass":884,"compiler_test262_failures":116,"compiler_test262_compiler_errors":0,"compiler_test262_compiler_crashes":0,"compiler_test262_compiler_fails":0,"compiler_test262_both_fail":116,"compiler_test262_interpreter_fail_compiler_pass":0,"compatibility_pass":884,"compatibility_cases":1000,"compiler_errors":0,"compiler_crashes":0,"compiler_fails":0,"both_fail":116,"interpreter_fail_compiler_pass":0,"elapsed_ms":71195},"status":"keep","description":"Baseline 1000-case Object workload","timestamp":1778102644648,"segment":28,"confidence":null,"iterationTokens":128,"asi":{"hypothesis":"Rebaseline the broader 1000-case built-ins/Object workload after the 800-case slice reached zero failures","baseline":"The broader workload now runs without OOM and has 116 shared failures with no compiler-only failures","next_action_hint":"Cluster the 116 shared failures and target broad semantic gaps beyond the first 800 cases"}}
{"run":758,"commit":"59586b3","metric":79,"metrics":{"compiler_test262_cases":1000,"compiler_test262_pass":921,"compiler_test262_failures":79,"compiler_test262_compiler_errors":0,"compiler_test262_compiler_crashes":0,"compiler_test262_compiler_fails":0,"compiler_test262_both_fail":79,"compiler_test262_interpreter_fail_compiler_pass":0,"compatibility_pass":921,"compatibility_cases":1000,"compiler_errors":0,"compiler_crashes":0,"compiler_fails":0,"both_fail":79,"interpreter_fail_compiler_pass":0,"elapsed_ms":72483},"status":"keep","description":"Respect array index descriptor semantics","timestamp":1778103298618,"segment":28,"confidence":null,"iterationTokens":19849,"asi":{"hypothesis":"Use canonical array-index classification for array defineProperty and honor array index descriptors for accessor/data conflicts, writability, and enumeration","improvement":"Fixed boundary non-index properties and many array-index descriptor/enumerability/accessor cases in the 1000-case Object workload","next_action_hint":"Continue clustering remaining 79 shared failures in defineProperties 6-a, likely additional array index descriptor update edge cases"}}
{"run":759,"commit":"5965e47","metric":49,"metrics":{"compiler_test262_cases":1000,"compiler_test262_pass":951,"compiler_test262_failures":49,"compiler_test262_compiler_errors":0,"compiler_test262_compiler_crashes":0,"compiler_test262_compiler_fails":0,"compiler_test262_both_fail":49,"compiler_test262_interpreter_fail_compiler_pass":0,"compatibility_pass":951,"compatibility_cases":1000,"compiler_errors":0,"compiler_crashes":0,"compiler_fails":0,"both_fail":49,"interpreter_fail_compiler_pass":0,"elapsed_ms":72357},"status":"keep","description":"Tighten array descriptor updates","timestamp":1778103739825,"segment":28,"confidence":2.2333333333333334,"iterationTokens":13065,"asi":{"hypothesis":"Remaining defineProperties cases include array length writability, deletion/configurability, enumerability and non-configurable accessor slot update semantics","improvement":"Reduced 1000-case Object failures from 79 to 49 by enforcing non-writable length index growth rejection, respecting array index deletion/configurability, filtering sparse enumerable keys, preserving existing array index attrs, and rejecting non-configurable accessor slot changes","next_action_hint":"Cluster the remaining 49 failures; likely later Arguments object parameter-map descriptor interactions and additional non-configurable data/accessor edge cases"}}
{"run":760,"commit":"5965e47","metric":237,"metrics":{"compiler_test262_cases":1000,"compiler_test262_pass":763,"compiler_test262_failures":237,"compiler_test262_compiler_errors":0,"compiler_test262_compiler_crashes":0,"compiler_test262_compiler_fails":0,"compiler_test262_both_fail":237,"compiler_test262_interpreter_fail_compiler_pass":0,"compatibility_pass":763,"compatibility_cases":1000,"compiler_errors":0,"compiler_crashes":0,"compiler_fails":0,"both_fail":237,"interpreter_fail_compiler_pass":0,"elapsed_ms":73924},"status":"discard","description":"Preserve generic descriptor attrs for ordinary objects","timestamp":1778104087213,"segment":28,"confidence":2,"iterationTokens":9476,"asi":{"hypothesis":"Preserving existing attributes for generic descriptors and accessor/data conversion would fix remaining array and ordinary defineProperties clusters","rollback_reason":"Primary metric regressed badly from 49 to 237 despite fixing focused cases, likely because broad ordinary/object descriptor changes altered expected default attributes or property updates elsewhere","next_action_hint":"Reapply narrower fixes only if needed: avoid broad Define.define_map_property changes; focus on array-exotic-only clusters and validate on 1000-case before keep"}}
{"run":761,"commit":"db66436","metric":45,"metrics":{"compiler_test262_cases":1000,"compiler_test262_pass":955,"compiler_test262_failures":45,"compiler_test262_compiler_errors":0,"compiler_test262_compiler_crashes":0,"compiler_test262_compiler_fails":0,"compiler_test262_both_fail":45,"compiler_test262_interpreter_fail_compiler_pass":0,"compatibility_pass":955,"compatibility_cases":1000,"compiler_errors":0,"compiler_crashes":0,"compiler_fails":0,"both_fail":45,"interpreter_fail_compiler_pass":0,"elapsed_ms":73763},"status":"keep","description":"Handle array accessor descriptor updates","timestamp":1778104316399,"segment":28,"confidence":2.088235294117647,"iterationTokens":2415,"asi":{"hypothesis":"A narrower array-exotic-only change can fix accessor generic descriptors and accessor/data conversion without regressing ordinary object defineProperty semantics","improvement":"Reduced 1000-case Object failures from 49 to 45 by preserving array accessor properties on generic descriptors, converting configurable accessors to data descriptors correctly, and treating explicit undefined accessors as absent during slot comparisons","next_action_hint":"Remaining failures still include ordinary object generic descriptor attrs and arguments parameter-map cases; avoid broad define_map_property changes that regressed to 237 failures"}}
{"run":762,"commit":"d2fa5a9","metric":43,"metrics":{"compiler_test262_cases":1000,"compiler_test262_pass":957,"compiler_test262_failures":43,"compiler_test262_compiler_errors":0,"compiler_test262_compiler_crashes":0,"compiler_test262_compiler_fails":0,"compiler_test262_both_fail":43,"compiler_test262_interpreter_fail_compiler_pass":0,"compatibility_pass":957,"compatibility_cases":1000,"compiler_errors":0,"compiler_crashes":0,"compiler_fails":0,"both_fail":43,"interpreter_fail_compiler_pass":0,"elapsed_ms":74080},"status":"keep","description":"Create array data props for attribute descriptors","timestamp":1778104575805,"segment":28,"confidence":3.65,"iterationTokens":6913,"asi":{"hypothesis":"Array attribute-only descriptors for absent array indexes should create data properties when descriptor attributes are present, while generic empty descriptors on existing accessors should remain no-ops","improvement":"Reduced 1000-case Object failures from 45 to 43, restoring generic descriptor case 195 without regressing accessor no-op case 207","next_action_hint":"Cluster remaining 43 failures; ordinary object generic descriptor attrs and arguments parameter-map descriptor interactions still look likely"}}
{"run":763,"commit":"036ff6c","metric":19,"metrics":{"compiler_test262_cases":1000,"compiler_test262_pass":981,"compiler_test262_failures":19,"compiler_test262_compiler_errors":0,"compiler_test262_compiler_crashes":0,"compiler_test262_compiler_fails":0,"compiler_test262_both_fail":19,"compiler_test262_interpreter_fail_compiler_pass":0,"compatibility_pass":981,"compatibility_cases":1000,"compiler_errors":0,"compiler_crashes":0,"compiler_fails":0,"both_fail":19,"interpreter_fail_compiler_pass":0,"elapsed_ms":76293},"status":"keep","description":"Preserve ordinary descriptor semantics","timestamp":1778105020849,"segment":28,"confidence":3.2333333333333334,"iterationTokens":13109,"asi":{"hypothesis":"A refined ordinary defineProperty implementation that preserves existing attrs, creates absent generic/data props, handles configurable accessor/data conversion, and compares SameValue should fix broad ordinary-object clusters without the earlier regression","improvement":"Reduced 1000-case Object failures from 43 to 19 by fixing ordinary object generic descriptor no-ops/updates, null descriptors, signed-zero SameValue checks, and retaining array attribute-only descriptor behavior","next_action_hint":"Remaining failures are likely arguments object parameter-map descriptor edge cases and a smaller set of array/ordinary non-configurable transitions; cluster current 19 failures next"}}
{"run":764,"commit":"fcf764a","metric":4,"metrics":{"compiler_test262_cases":1000,"compiler_test262_pass":996,"compiler_test262_failures":4,"compiler_test262_compiler_errors":0,"compiler_test262_compiler_crashes":0,"compiler_test262_compiler_fails":0,"compiler_test262_both_fail":4,"compiler_test262_interpreter_fail_compiler_pass":0,"compatibility_pass":996,"compatibility_cases":1000,"compiler_errors":0,"compiler_crashes":0,"compiler_fails":0,"both_fail":4,"interpreter_fail_compiler_pass":0,"elapsed_ms":77521},"status":"keep","description":"Complete descriptor deletion and SameValue handling","timestamp":1778105341285,"segment":28,"confidence":3.7333333333333334,"iterationTokens":5356,"asi":{"hypothesis":"The remaining Object.defineProperties failures need SameValue for signed zero, descriptor deletion cleanup, named accessor setter writes, and preserving dense undefined array element attributes","improvement":"Reduced 1000-case Object failures from 19 to 4 by fixing signed-zero descriptor comparisons, configurable deletion cleanup, named array/arguments accessor writes, and dense undefined index attribute preservation","next_action_hint":"Inspect the final four failures in the 1000-case slice; likely remaining arguments parameter-map or descriptor edge cases"}}
{"run":765,"commit":"e49fae7","metric":0,"metrics":{"compiler_test262_cases":1000,"compiler_test262_pass":1000,"compiler_test262_failures":0,"compiler_test262_compiler_errors":0,"compiler_test262_compiler_crashes":0,"compiler_test262_compiler_fails":0,"compiler_test262_both_fail":0,"compiler_test262_interpreter_fail_compiler_pass":0,"compatibility_pass":1000,"compatibility_cases":1000,"compiler_errors":0,"compiler_crashes":0,"compiler_fails":0,"both_fail":0,"interpreter_fail_compiler_pass":0,"elapsed_ms":76740},"status":"keep","description":"Expose undefined array named descriptors","timestamp":1778105630281,"segment":28,"confidence":3.7333333333333334,"iterationTokens":4041,"asi":{"hypothesis":"The final Object.defineProperties failures are descriptor-only array/arguments named properties whose value is undefined; getOwnPropertyDescriptor must expose them when descriptor metadata exists","improvement":"Reduced the 1000-case built-ins/Object workload from 4 failures to 0 by returning descriptors for undefined named array/arguments properties with descriptor metadata","next_action_hint":"Move to a broader Object workload or switch to the next compatibility category; keep avoiding pooled broad sweeps until compiler retention is fixed"}}
{"type":"config","name":"QuickBEAM built-ins/Object 1500-case compatibility","metricName":"compatibility_failures","metricUnit":"","bestDirection":"lower"}
{"run":766,"commit":"7c35321","metric":24,"metrics":{"compiler_test262_cases":1500,"compiler_test262_pass":1476,"compiler_test262_failures":24,"compiler_test262_compiler_errors":0,"compiler_test262_compiler_crashes":0,"compiler_test262_compiler_fails":6,"compiler_test262_both_fail":16,"compiler_test262_interpreter_fail_compiler_pass":0,"compatibility_pass":1476,"compatibility_cases":1500,"compiler_errors":0,"compiler_crashes":0,"compiler_fails":6,"both_fail":16,"interpreter_fail_compiler_pass":0,"elapsed_ms":117118},"status":"keep","description":"Baseline 1500-case Object workload","timestamp":1778105878572,"segment":29,"confidence":null,"iterationTokens":129,"asi":{"hypothesis":"Rebaseline a broader 1500-case built-ins/Object workload after the 1000-case slice reached zero failures","baseline":"The 1500-case Object workload has 24 failures: 6 compiler-only and 16 shared, with no compiler crashes/errors","next_action_hint":"Cluster the 24 failures; new cases are likely Object.freeze/getPrototypeOf/getOwnPropertyNames/prototype edge cases beyond defineProperties"}}
{"run":767,"commit":"bcced80","metric":20,"metrics":{"compiler_test262_cases":1500,"compiler_test262_pass":1480,"compiler_test262_failures":20,"compiler_test262_compiler_errors":0,"compiler_test262_compiler_crashes":0,"compiler_test262_compiler_fails":6,"compiler_test262_both_fail":12,"compiler_test262_interpreter_fail_compiler_pass":0,"compatibility_pass":1480,"compatibility_cases":1500,"compiler_errors":0,"compiler_crashes":0,"compiler_fails":6,"both_fail":12,"interpreter_fail_compiler_pass":0,"elapsed_ms":115454},"status":"keep","description":"Allow configurable data value updates","timestamp":1778106275584,"segment":29,"confidence":null,"iterationTokens":129,"asi":{"hypothesis":"Ordinary descriptor rejection should only block non-writable value changes on non-configurable properties, and explicit undefined accessor slots should compare equal to absent slots","improvement":"Reduced 1500-case Object failures from 24 to 20 by fixing configurable data value updates and explicit undefined accessor-slot equality","next_action_hint":"Remaining failures include ToPropertyKey coercion for defineProperty property keys, descriptor function prototype field lookup, proxy ownKeys order, typedarray/resizable crash, and compiler-only object defineProperty cases"}}
{"run":768,"commit":"839d153","metric":16,"metrics":{"compiler_test262_cases":1500,"compiler_test262_pass":1484,"compiler_test262_failures":16,"compiler_test262_compiler_errors":0,"compiler_test262_compiler_crashes":0,"compiler_test262_compiler_fails":6,"compiler_test262_both_fail":8,"compiler_test262_interpreter_fail_compiler_pass":0,"compatibility_pass":1484,"compatibility_cases":1500,"compiler_errors":0,"compiler_crashes":0,"compiler_fails":6,"both_fail":8,"interpreter_fail_compiler_pass":0,"elapsed_ms":116186},"status":"keep","description":"Use string-hint object key coercion","timestamp":1778106577245,"segment":29,"confidence":2,"iterationTokens":7617,"asi":{"hypothesis":"Object.defineProperty property keys need string-hint object-to-primitive coercion, including fallback from object-returning toString to valueOf and inherited toString lookup","improvement":"Reduced 1500-case Object failures from 20 to 16 by fixing object property-key coercion cases 15.2.3.6-2-44/45/47/48","next_action_hint":"Remaining failures are proxy ownKeys order, descriptor function prototype lookup, typedarray/resizable crash, and compiler-only defineProperty cases"}}
{"run":769,"commit":"839d153","metric":16,"metrics":{"compiler_test262_cases":1500,"compiler_test262_pass":1484,"compiler_test262_failures":16,"compiler_test262_compiler_errors":0,"compiler_test262_compiler_crashes":0,"compiler_test262_compiler_fails":6,"compiler_test262_both_fail":8,"compiler_test262_interpreter_fail_compiler_pass":0,"compatibility_pass":1484,"compatibility_cases":1500,"compiler_errors":0,"compiler_crashes":0,"compiler_fails":6,"both_fail":8,"interpreter_fail_compiler_pass":0,"elapsed_ms":116320},"status":"discard","description":"Check custom Function.prototype fallback","timestamp":1778106889528,"segment":29,"confidence":4,"iterationTokens":9100,"asi":{"hypothesis":"Looking up custom Function.prototype properties through Heap.get_func_proto from function prototype fallback might fix descriptor function-object cases","rollback_reason":"The 1500-case primary metric was unchanged at 16 failures; the fallback did not affect the failing function descriptor cases, likely because the issue is elsewhere in callable prototype/property lookup","next_action_hint":"Probe Function.prototype.value visibility from descriptor function objects directly before editing Get fallback again; inspect Heap.get_func_proto and Function.prototype assignment path"}}
{"run":770,"commit":"839d153","metric":16,"metrics":{"compiler_test262_cases":1500,"compiler_test262_pass":1484,"compiler_test262_failures":16,"compiler_test262_compiler_errors":0,"compiler_test262_compiler_crashes":0,"compiler_test262_compiler_fails":6,"compiler_test262_both_fail":8,"compiler_test262_interpreter_fail_compiler_pass":0,"compatibility_pass":1484,"compatibility_cases":1500,"compiler_errors":0,"compiler_crashes":0,"compiler_fails":6,"both_fail":8,"interpreter_fail_compiler_pass":0,"elapsed_ms":116333},"status":"discard","description":"Probe descriptor inherited presence","timestamp":1778107334982,"segment":29,"confidence":null,"iterationTokens":14940,"asi":{"hypothesis":"Function.prototype fallback plus descriptor inherited presence detection might fix descriptor objects whose fields are inherited from Function.prototype or accessor-only prototypes","rollback_reason":"The primary metric stayed flat at 16 failures; focused Function.prototype value/get cases improved but getterless inherited value case remained broken and broad workload did not improve","next_action_hint":"Do not retry this broad presence helper as-is. Instrument Get.present?/prototype traversal or inspect raw heap prototype storage for constructed descriptor objects before changing PropertyDescriptor.present? again"}}
{"run":771,"commit":"f1f003f","metric":15,"metrics":{"compiler_test262_cases":1500,"compiler_test262_pass":1485,"compiler_test262_failures":15,"compiler_test262_compiler_errors":0,"compiler_test262_compiler_crashes":0,"compiler_test262_compiler_fails":6,"compiler_test262_both_fail":7,"compiler_test262_interpreter_fail_compiler_pass":0,"compatibility_pass":1485,"compatibility_cases":1500,"compiler_errors":0,"compiler_crashes":0,"compiler_fails":6,"both_fail":7,"interpreter_fail_compiler_pass":0,"elapsed_ms":115463},"status":"keep","description":"Preserve proxy descriptor key order","timestamp":1778107698884,"segment":29,"confidence":18,"iterationTokens":8585,"asi":{"hypothesis":"Object.defineProperties should enumerate proxy Properties via [[OwnPropertyKeys]]/getOwnPropertyDescriptor in ordinary key order, preserving symbol identity instead of stringifying symbols","improvement":"Reduced 1500-case Object failures from 16 to 15 by fixing proxy fallback own-key order and symbol key preservation in OwnProperty.descriptor","next_action_hint":"Continue with remaining defineProperty descriptor-function and typedarray/resizable failures; compiler-only cases remain a distinct cluster"}}
{"run":772,"commit":"276f925","metric":9,"metrics":{"compiler_test262_cases":1500,"compiler_test262_pass":1491,"compiler_test262_failures":9,"compiler_test262_compiler_errors":0,"compiler_test262_compiler_crashes":0,"compiler_test262_compiler_fails":6,"compiler_test262_both_fail":1,"compiler_test262_interpreter_fail_compiler_pass":0,"compatibility_pass":1491,"compatibility_cases":1500,"compiler_errors":0,"compiler_crashes":0,"compiler_fails":6,"both_fail":1,"interpreter_fail_compiler_pass":0,"elapsed_ms":116077},"status":"keep","description":"Read custom Function prototype properties","timestamp":1778107952825,"segment":29,"confidence":15,"iterationTokens":2869,"asi":{"hypothesis":"Function objects with no parent constructor should still read through the cached Function.prototype object before falling back to built-in Function.prototype defaults/Object.prototype","improvement":"Reduced 1500-case Object failures from 15 to 9 by fixing descriptor function objects that inherit value/writable/get/set/enumerable fields from Function.prototype","next_action_hint":"Only one shared failure remains plus six compiler-only failures and two crashes; inspect current failure list and prioritize compiler-only descriptor lowering or typed-array crash handling"}}
