{"run":705,"commit":"2c2981c","metric":5,"metrics":{"js_bytecode_frontier_cases":20,"js_bytecode_frontier_compiled":16,"js_bytecode_frontier_unsupported":4,"js_bytecode_frontier_mismatches":1,"js_bytecode_frontier_native_loadable":15,"js_bytecode_compiler_cases":87,"js_bytecode_compiler_compiled":87,"js_bytecode_compiler_unsupported":0,"js_bytecode_compiler_mismatches":0,"js_bytecode_compiler_native_loadable":87,"js_bytecode_compiler_failures":0},"status":"keep","description":"Support constructor calls","timestamp":1777828531443,"segment":23,"confidence":5,"iterationTokens":5731,"asi":{"hypothesis":"NewExpression should emit QuickJS call_constructor with duplicated constructor target instead of lowering to a normal direct call, enabling this binding and prototype semantics for constructors.","result":"Frontier failures improved 7 -> 5; constructor-property mismatch and prototype-method mismatch were fixed; stable audit expanded 86 -> 87; checks passed.","scope":"Adds call_constructor assembler support and lowers new C(args) as callee, duplicate new_target, args, call_constructor. Relies on existing VM/interpreter/compiler constructor semantics rather than frontend-specific object factories.","next_action_hint":"Remaining frontier failures: block let shadowing mismatch, function var/let block scoping, and closure captures."}}
{"run":706,"commit":"391d920","metric":4,"metrics":{"js_bytecode_frontier_cases":20,"js_bytecode_frontier_compiled":16,"js_bytecode_frontier_unsupported":4,"js_bytecode_frontier_mismatches":0,"js_bytecode_frontier_native_loadable":16,"js_bytecode_compiler_cases":87,"js_bytecode_compiler_compiled":87,"js_bytecode_compiler_unsupported":0,"js_bytecode_compiler_mismatches":0,"js_bytecode_compiler_native_loadable":87,"js_bytecode_compiler_failures":0},"status":"keep","description":"Isolate simple block lexical declarations","timestamp":1777828706300,"segment":23,"confidence":4,"iterationTokens":5702,"asi":{"hypothesis":"A minimal block lexical isolation can fix the frontier shadowing mismatch by evaluating block let/const initializers without overwriting outer local slots, while leaving full lexical environments for later.","result":"Frontier failures improved 5 -> 4; mismatches reached 0; stable audit remained 87/87 clean and checks passed.","scope":"Inside non-tail block statements, let/const declarators compile initializer expressions and drop/store into the return scratch slot instead of writing outer slots. This handles simple shadowing without claiming full block scope, TDZ, or lexical environment semantics.","next_action_hint":"Remaining frontier failures: function var/let block scoping and closure captures. Closure metadata remains unsafe; next safer path is function-body var hoisting or typeof unresolved lexical behavior."}}
{"run":707,"commit":"79e0061","metric":2,"metrics":{"js_bytecode_frontier_cases":20,"js_bytecode_frontier_compiled":18,"js_bytecode_frontier_unsupported":2,"js_bytecode_frontier_mismatches":0,"js_bytecode_frontier_native_loadable":18,"js_bytecode_compiler_cases":89,"js_bytecode_compiler_compiled":89,"js_bytecode_compiler_unsupported":0,"js_bytecode_compiler_mismatches":0,"js_bytecode_compiler_native_loadable":89,"js_bytecode_compiler_failures":0},"status":"keep","description":"Broaden function block scoping","timestamp":1777828880856,"segment":23,"confidence":4,"iterationTokens":9265,"asi":{"hypothesis":"Function-body var declarations inside nested blocks should be hoisted into the function local scope, while unresolved typeof identifiers should evaluate to the JS string undefined. This should cover block var and hidden let frontier cases without full lexical environment implementation.","result":"Frontier failures improved 4 -> 2; all frontier mismatches remain 0; stable audit expanded 87 -> 89; checks passed.","scope":"Adds nested var declaration discovery for block/if statements and special typeof-unresolved handling. Also keeps simple block let initializers isolated from outer slots via scratch storage. Does not implement full lexical scopes, TDZ, or closure captures.","next_action_hint":"Only remaining frontier failures are closure captures. Closure metadata attempts have segfaulted, so next work should focus on decoded QuickJS closure bytecode/writer roundtrips before emitting closures."}}
{"run":708,"commit":"bf800d5","metric":0,"metrics":{"js_bytecode_frontier_cases":20,"js_bytecode_frontier_compiled":20,"js_bytecode_frontier_unsupported":0,"js_bytecode_frontier_mismatches":0,"js_bytecode_frontier_native_loadable":20,"js_bytecode_compiler_cases":91,"js_bytecode_compiler_compiled":91,"js_bytecode_compiler_unsupported":0,"js_bytecode_compiler_mismatches":0,"js_bytecode_compiler_native_loadable":91,"js_bytecode_compiler_failures":0},"status":"keep","description":"Support value-captured closures","timestamp":1777829191069,"segment":23,"confidence":4,"iterationTokens":10174,"asi":{"hypothesis":"A safe closure subset can avoid fragile closure metadata by rewriting captured function expressions as explicit-parameter functions bound with Function.prototype.bind to current captured values.","result":"Frontier diagnostic is now 20/20 with zero failures; existing 200-case corpus is also 200/200 clean; stable audit expanded 89 -> 91 with zero failures; checks passed.","scope":"Supports value-captured function expressions for captures from currently visible args/locals by prepending capture params and emitting function.bind(undefined, captures...). This intentionally captures values, not mutable cells, so full JS closure mutation semantics remain future work.","next_action_hint":"Re-baseline a broader existing corpus/Test262-derived window to expose next gaps. Keep full closure metadata/mutable cells in ideas for later parity work."}}
{"type":"config","name":"JS bytecode compiler existing corpus 1000","metricName":"js_bytecode_existing_failures","metricUnit":"","bestDirection":"lower"}
{"run":709,"commit":"0ed9977","metric":0,"metrics":{"js_bytecode_existing_cases":1000,"js_bytecode_existing_compiled":1000,"js_bytecode_existing_unsupported":0,"js_bytecode_existing_mismatches":0,"js_bytecode_existing_native_loadable":1000,"js_bytecode_compiler_cases":91,"js_bytecode_compiler_compiled":91,"js_bytecode_compiler_unsupported":0,"js_bytecode_compiler_mismatches":0,"js_bytecode_compiler_native_loadable":91,"js_bytecode_compiler_failures":0},"status":"keep","description":"Baseline existing corpus 1000 clean","timestamp":1777829257043,"segment":24,"confidence":null,"iterationTokens":118,"asi":{"hypothesis":"After closing the frontier diagnostic gaps, a wider existing-corpus window should remain clean if fixes are generic rather than overfit.","result":"Existing corpus limit 1000 is 1000/1000 clean, all compiled and native-loadable; stable audit remains 91/91 clean; checks passed.","scope":"No code changes beyond existing kept compiler improvements; establishes broader corpus baseline for future experiments.","next_action_hint":"Move to Test262-derived executable windows or a new broader corpus source to expose remaining real parity gaps."}}
{"type":"config","name":"JS bytecode compiler existing corpus all","metricName":"js_bytecode_existing_failures","metricUnit":"","bestDirection":"lower"}
{"run":710,"commit":"0ed9977","metric":0,"metrics":{},"status":"crash","description":"Try all existing corpus at once","timestamp":1777829371658,"segment":25,"confidence":null,"iterationTokens":116,"asi":{"hypothesis":"Running the entire existing corpus in one benchmark should expose any remaining corpus gaps beyond the clean 1000-case window.","rollback_reason":"The all-corpus run exited nonzero after the ExUnit step without parsed metrics; likely benchmark workload/timeout/resource issue rather than a measured compiler regression.","next_action_hint":"Use chunked existing-corpus windows (offset/limit) to isolate broader gaps and avoid noisy monolithic all-corpus execution."}}
{"type":"config","name":"JS bytecode compiler existing corpus offset 1000","metricName":"js_bytecode_existing_failures","metricUnit":"","bestDirection":"lower"}
{"run":711,"commit":"3997dd8","metric":80,"metrics":{"js_bytecode_existing_cases":1000,"js_bytecode_existing_compiled":920,"js_bytecode_existing_unsupported":80,"js_bytecode_existing_mismatches":0,"js_bytecode_existing_native_loadable":920,"js_bytecode_compiler_cases":91,"js_bytecode_compiler_compiled":91,"js_bytecode_compiler_unsupported":0,"js_bytecode_compiler_mismatches":0,"js_bytecode_compiler_native_loadable":91,"js_bytecode_compiler_failures":0},"status":"keep","description":"Baseline existing corpus offset 1000","timestamp":1777829434598,"segment":26,"confidence":null,"iterationTokens":128,"asi":{"hypothesis":"Chunked existing-corpus offset 1000 should expose broader semantic gaps safely after the first 1000 clean cases.","result":"Offset 1000 window baseline has 80 unsupported failures, zero mismatches; stable audit remains clean.","scope":"No code changes; establishes next workload for generic gap filling.","next_action_hint":"Inspect unsupported reasons in the benchmark log and target broad clusters rather than individual strings."}}
{"run":712,"commit":"c8b82f1","metric":0,"metrics":{"js_bytecode_existing_cases":1000,"js_bytecode_existing_compiled":1000,"js_bytecode_existing_unsupported":0,"js_bytecode_existing_mismatches":0,"js_bytecode_existing_native_loadable":1000,"js_bytecode_compiler_cases":93,"js_bytecode_compiler_compiled":93,"js_bytecode_compiler_unsupported":0,"js_bytecode_compiler_mismatches":0,"js_bytecode_compiler_native_loadable":93,"js_bytecode_compiler_failures":0},"status":"keep","description":"Support exponentiation corpus window","timestamp":1777829792690,"segment":26,"confidence":null,"iterationTokens":11698,"asi":{"hypothesis":"The offset-1000 corpus is dominated by exponentiation; adding generic **/**= lowering plus JS-compatible VM pow handling should clear the window.","result":"Offset-1000 existing corpus improved 80 -> 0 failures; stable audit expanded 91 -> 93; checks passed.","scope":"Adds frontend pow/compound-pow opcode emission and fixes interpreter pow coercion/0-negative behavior. Does not change benchmark inputs.","next_action_hint":"Continue chunked corpus exploration at later offsets or Test262-derived windows to expose next semantic clusters."}}
{"type":"config","name":"JS bytecode compiler existing corpus offset 2000","metricName":"js_bytecode_existing_failures","metricUnit":"","bestDirection":"lower"}
{"run":713,"commit":"c8b82f1","metric":0,"metrics":{},"status":"crash","description":"Try existing corpus offset 2000 baseline","timestamp":1777829937373,"segment":27,"confidence":null,"iterationTokens":128,"asi":{"hypothesis":"The final existing-corpus chunk should expose any remaining gaps after offset 0 and 1000 are clean.","rollback_reason":"The benchmark exited nonzero without parsed metrics after the ExUnit precheck, so the final chunk likely hits a benchmark crash or unclassified runtime exception.","next_action_hint":"Run the benchmark script directly or bisect final offsets to identify the crashing case, then harden the audit or compiler generically."}}
{"type":"config","name":"JS bytecode compiler existing corpus offset 2000 classified","metricName":"js_bytecode_existing_failures","metricUnit":"","bestDirection":"lower"}
{"run":714,"commit":"44085ba","metric":92,"metrics":{"js_bytecode_existing_cases":157,"js_bytecode_existing_compiled":73,"js_bytecode_existing_unsupported":71,"js_bytecode_existing_mismatches":8,"js_bytecode_existing_native_loadable":67,"js_bytecode_compiler_cases":93,"js_bytecode_compiler_compiled":93,"js_bytecode_compiler_unsupported":0,"js_bytecode_compiler_mismatches":0,"js_bytecode_compiler_native_loadable":93,"js_bytecode_compiler_failures":0},"status":"keep","description":"Classify offset 2000 corpus failures","timestamp":1777830060381,"segment":28,"confidence":null,"iterationTokens":129,"asi":{"hypothesis":"The final chunk benchmark crash is caused by unclassified interpreter/compiler/native-load exceptions; wrapping audit stages should make failures actionable without hiding them.","result":"Offset-2000 benchmark now completes and reports 92 failures: 71 unsupported, 8 mismatches, 13 errors/native-load gaps; checks passed.","scope":"Hardened JS bytecode compiler audit stage execution to return structured error tuples on exceptions/throws. Does not suppress failures; mismatches/errors still count in the primary metric.","next_action_hint":"Target broad offset-2000 clusters: generic arg/local slot opcodes, nested-loop lexical scopes, function declaration captures, update expressions/member increments, array holes, instanceof, mutable closures."}}
{"run":715,"commit":"5042ef7","metric":91,"metrics":{"js_bytecode_existing_cases":157,"js_bytecode_existing_compiled":75,"js_bytecode_existing_unsupported":71,"js_bytecode_existing_mismatches":9,"js_bytecode_existing_native_loadable":69,"js_bytecode_compiler_cases":95,"js_bytecode_compiler_compiled":95,"js_bytecode_compiler_unsupported":0,"js_bytecode_compiler_mismatches":0,"js_bytecode_compiler_native_loadable":95,"js_bytecode_compiler_failures":0},"status":"keep","description":"Support generic argument reads","timestamp":1777830170399,"segment":28,"confidence":null,"iterationTokens":6417,"asi":{"hypothesis":"Argument reads beyond arg3 are a broad bytecode emission gap and should use QuickJS's generic get_arg opcode instead of failing assembler encoding.","result":"Offset-2000 failures improved 92 -> 91; stable audit expanded 93 -> 95; checks passed. One former compile error now reveals an interpreter mismatch for generic set_arg handling, so a later VM interpreter fix is needed.","scope":"Adds generic get_arg encoding for frontend bytecode. Existing set_arg/put_arg encoders were already present; no benchmark special-casing.","next_action_hint":"Fix VM interpreter handling of generic set_arg/put_arg or choose another broad unsupported cluster such as member update expressions or array holes."}}
{"run":716,"commit":"d9fd46f","metric":90,"metrics":{"js_bytecode_existing_cases":157,"js_bytecode_existing_compiled":75,"js_bytecode_existing_unsupported":71,"js_bytecode_existing_mismatches":8,"js_bytecode_existing_native_loadable":69,"js_bytecode_compiler_cases":96,"js_bytecode_compiler_compiled":96,"js_bytecode_compiler_unsupported":0,"js_bytecode_compiler_mismatches":0,"js_bytecode_compiler_native_loadable":96,"js_bytecode_compiler_failures":0},"status":"keep","description":"Drop non-tail expression results","timestamp":1777830349344,"segment":28,"confidence":2,"iterationTokens":10288,"asi":{"hypothesis":"Non-tail expression statements should discard their completion value instead of writing to loc0, which may not exist in functions without local slots.","result":"Offset-2000 failures improved 91 -> 90 and removed the strict arg4 interpreter mismatch; stable audit expanded to 96; checks passed.","scope":"Changes generic non-tail expression statement lowering from put_loc0 to drop. Tail expression statements still set the result slot.","next_action_hint":"Next broad clusters: generic large local opcodes, member update expressions, function declaration capture support, or array holes."}}
{"run":717,"commit":"82140a5","metric":88,"metrics":{"js_bytecode_existing_cases":157,"js_bytecode_existing_compiled":77,"js_bytecode_existing_unsupported":69,"js_bytecode_existing_mismatches":8,"js_bytecode_existing_native_loadable":71,"js_bytecode_compiler_cases":100,"js_bytecode_compiler_compiled":100,"js_bytecode_compiler_unsupported":0,"js_bytecode_compiler_mismatches":0,"js_bytecode_compiler_native_loadable":100,"js_bytecode_compiler_failures":0},"status":"keep","description":"Support member update expressions","timestamp":1777830583411,"segment":28,"confidence":4,"iterationTokens":13680,"asi":{"hypothesis":"Computed and named member ++/-- expressions are a generic unsupported update-expression cluster in the final corpus chunk.","result":"Offset-2000 failures improved 90 -> 88; unsupported count dropped 71 -> 69; stable audit expanded 96 -> 100; checks passed.","scope":"Adds stack/opcode emission for member update expressions using QuickJS stack ops dup2/perm3/perm4/to_propkey2 and existing put_field/put_array_el semantics.","next_action_hint":"Investigate remaining clusters: large generic local slot encoders, array elisions, instanceof, nested loop block scoping, and declared function captures."}}
{"run":718,"commit":"eaa3307","metric":87,"metrics":{"js_bytecode_existing_cases":157,"js_bytecode_existing_compiled":78,"js_bytecode_existing_unsupported":68,"js_bytecode_existing_mismatches":8,"js_bytecode_existing_native_loadable":72,"js_bytecode_compiler_cases":101,"js_bytecode_compiler_compiled":101,"js_bytecode_compiler_unsupported":0,"js_bytecode_compiler_mismatches":0,"js_bytecode_compiler_native_loadable":101,"js_bytecode_compiler_failures":0},"status":"keep","description":"Support sparse array elisions","timestamp":1777830819003,"segment":28,"confidence":2.5,"iterationTokens":11661,"asi":{"hypothesis":"Array elisions can be lowered generically by creating an empty array and defining only present numeric indexes, preserving sparse length better than filling holes with undefined.","result":"Offset-2000 failures improved 88 -> 87; unsupported count dropped 69 -> 68; stable audit expanded to 101; checks passed.","scope":"Adds sparse-array lowering and integer tagged atom encoding for define_field operands. Does not replace holes with undefined.","next_action_hint":"Next target candidates are generic large local opcodes, nested loop block scopes, declared-function captures, instanceof, or static class elements."}}
{"run":719,"commit":"9cf52c7","metric":86,"metrics":{"js_bytecode_existing_cases":157,"js_bytecode_existing_compiled":79,"js_bytecode_existing_unsupported":68,"js_bytecode_existing_mismatches":8,"js_bytecode_existing_native_loadable":73,"js_bytecode_compiler_cases":101,"js_bytecode_compiler_compiled":101,"js_bytecode_compiler_unsupported":0,"js_bytecode_compiler_mismatches":0,"js_bytecode_compiler_native_loadable":101,"js_bytecode_compiler_failures":0},"status":"keep","description":"Support generic local slot encoders","timestamp":1777830937575,"segment":28,"confidence":3,"iterationTokens":8129,"asi":{"hypothesis":"Large local slot indexes beyond loc8 are a generic assembler gap and should emit QuickJS's wide get_loc/set_loc/put_loc forms.","result":"Offset-2000 failures improved 87 -> 86 by compiling the generic-local-write corpus case; checks passed.","scope":"Adds wide local slot encoders for get_loc/set_loc/put_loc. The eval-forced generic-local-read case remains unsupported because eval/global semantics are still out of frontend scope.","next_action_hint":"Continue with clusters that do not require full eval/closure cells: instanceof, spread calls, or nested loop block scope."}}
{"run":720,"commit":"1687927","metric":85,"metrics":{"js_bytecode_existing_cases":157,"js_bytecode_existing_compiled":80,"js_bytecode_existing_unsupported":68,"js_bytecode_existing_mismatches":8,"js_bytecode_existing_native_loadable":74,"js_bytecode_compiler_cases":102,"js_bytecode_compiler_compiled":102,"js_bytecode_compiler_unsupported":0,"js_bytecode_compiler_mismatches":0,"js_bytecode_compiler_native_loadable":102,"js_bytecode_compiler_failures":0},"status":"keep","description":"Support int32 literal emission","timestamp":1777831244265,"segment":28,"confidence":3.5,"iterationTokens":16781,"asi":{"hypothesis":"Large integer literals within signed 32-bit range are a generic assembler gap and should emit QuickJS push_i32 rather than crashing after i16.","result":"Offset-2000 failures improved 86 -> 85; stable audit expanded to 102; checks passed.","scope":"Adds push_i32 encoding for integer literals in signed int32 range and permanent audit coverage for 2147483647.","next_action_hint":"Continue targeting remaining generic clusters: spread calls, simple rest/default params, logical member assignment, compound member assignment, or dead-code-tolerant unsupported function bodies."}}
{"run":721,"commit":"6fcfdc6","metric":84,"metrics":{"js_bytecode_existing_cases":157,"js_bytecode_existing_compiled":81,"js_bytecode_existing_unsupported":67,"js_bytecode_existing_mismatches":8,"js_bytecode_existing_native_loadable":75,"js_bytecode_compiler_cases":103,"js_bytecode_compiler_compiled":103,"js_bytecode_compiler_unsupported":0,"js_bytecode_compiler_mismatches":0,"js_bytecode_compiler_native_loadable":103,"js_bytecode_compiler_failures":0},"status":"keep","description":"Support array literal spread calls","timestamp":1777831383312,"segment":28,"confidence":3.2,"iterationTokens":8415,"asi":{"hypothesis":"Call spreads over array literals can be lowered generically by expanding the literal elements into positional call arguments without implementing the full iterator protocol.","result":"Offset-2000 failures improved 85 -> 84; unsupported count dropped 68 -> 67; stable audit expanded to 103; checks passed.","scope":"Supports spread elements in direct/member/new calls only when the spread operand is an array literal without holes or nested spreads. Other spread operands still report unsupported rather than fabricating iterator semantics.","next_action_hint":"Next generic clusters include simple rest/default params, logical/compound member assignment, declared-function value captures, or unused unsupported nested functions."}}
