{"run":564,"commit":"4c20d46","metric":104,"metrics":{"compiler_test262_cases":946,"compiler_test262_pass":842,"compiler_test262_failures":104,"compiler_test262_compiler_errors":0,"compiler_test262_compiler_crashes":0,"compiler_test262_compiler_fails":0,"compiler_test262_both_fail":93,"compiler_test262_interpreter_fail_compiler_pass":11,"compatibility_pass":842,"compatibility_cases":946,"compiler_errors":0,"compiler_crashes":0,"compiler_fails":0,"both_fail":93,"interpreter_fail_compiler_pass":11,"elapsed_ms":32419},"status":"keep","description":"Hide object-literal prototype slot from descriptors","timestamp":1778014363098,"segment":20,"confidence":null,"iterationTokens":4562,"asi":{"hypothesis":"Object-literal __proto__ must update the internal prototype without exposing an own property descriptor, and primitive __proto__ values should leave the default prototype unchanged.","learned":"Combining primitive set_proto filtering with getOwnPropertyDescriptor hiding for the internal prototype slot reduces object-suite failures by one and passes all backpressure checks.","active_category":"language/expressions/object","fixed_cluster":"At least one __proto__ descriptor/prototype Test262 case now passes; remaining __proto__ cases likely need duplicate/computed/poisoned semantics."}}
{"run":565,"commit":"4c20d46","metric":104,"metrics":{"compiler_test262_cases":946,"compiler_test262_pass":842,"compiler_test262_failures":104,"compiler_test262_compiler_errors":0,"compiler_test262_compiler_crashes":0,"compiler_test262_compiler_fails":0,"compiler_test262_both_fail":92,"compiler_test262_interpreter_fail_compiler_pass":12,"compatibility_pass":842,"compatibility_cases":946,"compiler_errors":0,"compiler_crashes":0,"compiler_fails":0,"both_fail":92,"interpreter_fail_compiler_pass":12,"elapsed_ms":40730},"status":"discard","description":"Canonicalize computed accessor property keys","timestamp":1778014670241,"segment":20,"confidence":2,"iterationTokens":12142,"asi":{"hypothesis":"Computed accessor method definition should ToPropertyKey object/array names instead of using an empty display-name fallback as the actual property key.","rollback_reason":"Primary compatibility_failures was unchanged at the current best, despite shifting one both_fail into interpreter_fail_compiler_pass.","next_action_hint":"This idea likely fixed source/compiler side for one computed accessor but not interpreter/native bytecode; revisit only with a native bytecode interpreter fix or if primary metric weights compiler/interpreter categories separately."}}
{"run":566,"commit":"315224c","metric":86,"metrics":{"compiler_test262_cases":946,"compiler_test262_pass":860,"compiler_test262_failures":86,"compiler_test262_compiler_errors":0,"compiler_test262_compiler_crashes":0,"compiler_test262_compiler_fails":0,"compiler_test262_both_fail":74,"compiler_test262_interpreter_fail_compiler_pass":12,"compatibility_pass":860,"compatibility_cases":946,"compiler_errors":0,"compiler_crashes":0,"compiler_fails":0,"both_fail":74,"interpreter_fail_compiler_pass":12,"elapsed_ms":28735},"status":"keep","description":"Normalize computed accessor keys and honor bracket accessors","timestamp":1778015222701,"segment":20,"confidence":19,"iterationTokens":14788,"asi":{"hypothesis":"Computed object accessor keys need ToPropertyKey normalization, and bracket get/set must invoke accessor descriptors instead of returning/writing raw map values.","learned":"The previous computed-key attempt only shifted categories because bracket element access bypassed getters/setters. Fixing get_element/put_element accessor handling unlocks a large object-suite improvement.","active_category":"language/expressions/object","fixed_cluster":"accessor-name-computed and numeric/computed accessor object initializer cases; failures dropped by 18."}}
{"run":567,"commit":"2146282","metric":74,"metrics":{"compiler_test262_cases":946,"compiler_test262_pass":872,"compiler_test262_failures":74,"compiler_test262_compiler_errors":0,"compiler_test262_compiler_crashes":0,"compiler_test262_compiler_fails":0,"compiler_test262_both_fail":62,"compiler_test262_interpreter_fail_compiler_pass":12,"compatibility_pass":872,"compatibility_cases":946,"compiler_errors":0,"compiler_crashes":0,"compiler_fails":0,"both_fail":62,"interpreter_fail_compiler_pass":12,"elapsed_ms":31342},"status":"keep","description":"Normalize computed data property keys","timestamp":1778015543801,"segment":20,"confidence":31,"iterationTokens":8642,"asi":{"hypothesis":"Computed data property names should use the same ToPropertyKey normalization on define/read paths as computed accessor names.","learned":"define_array_el and get_element map paths still used partial integer-only normalization; switching to PropertyKey.normalize fixes decimal/function/null/math computed property name clusters.","active_category":"language/expressions/object","fixed_cluster":"computed-property-name object literal cases; failures dropped by 12."}}
{"run":568,"commit":"2146282","metric":74,"metrics":{"compiler_test262_cases":946,"compiler_test262_pass":872,"compiler_test262_failures":74,"compiler_test262_compiler_errors":0,"compiler_test262_compiler_crashes":0,"compiler_test262_compiler_fails":0,"compiler_test262_both_fail":62,"compiler_test262_interpreter_fail_compiler_pass":12,"compatibility_pass":872,"compatibility_cases":946,"compiler_errors":0,"compiler_crashes":0,"compiler_fails":0,"both_fail":62,"interpreter_fail_compiler_pass":12,"elapsed_ms":43057},"status":"discard","description":"Expose function name and length descriptors","timestamp":1778015869297,"segment":20,"confidence":31,"iterationTokens":9382,"asi":{"hypothesis":"Object.getOwnPropertyDescriptor on function-like values should report own name/length descriptors for object literal function-name Test262 cases.","rollback_reason":"Focused repro improved, but primary object compatibility metric was unchanged; likely verifyProperty also needs defineProperty/hasOwnProperty/descriptor behavior beyond getOwnPropertyDescriptor or cases involve function-valued object fields differently.","next_action_hint":"Before retrying function name descriptors, run the full fn-name helper case and inspect which verifyProperty assertion fails."}}
{"run":569,"commit":"a24fa8a","metric":73,"metrics":{"compiler_test262_cases":946,"compiler_test262_pass":873,"compiler_test262_failures":73,"compiler_test262_compiler_errors":0,"compiler_test262_compiler_crashes":0,"compiler_test262_compiler_fails":0,"compiler_test262_both_fail":61,"compiler_test262_interpreter_fail_compiler_pass":12,"compatibility_pass":873,"compatibility_cases":946,"compiler_errors":0,"compiler_crashes":0,"compiler_fails":0,"both_fail":61,"interpreter_fail_compiler_pass":12,"elapsed_ms":39197},"status":"keep","description":"Preserve computed __proto__ as own data property","timestamp":1778016203073,"segment":20,"confidence":3.2,"iterationTokens":5514,"asi":{"hypothesis":"Computed __proto__ object literal keys are data properties, not prototype mutations; descriptors can distinguish own computed __proto__ from the VM internal prototype slot.","learned":"Adding data descriptors for define_array_el plus using get_own_prototype for Object.getPrototypeOf fixed computed-__proto__ without regressing backpressure checks.","active_category":"language/expressions/object","fixed_cluster":"computed-__proto__ ordinary object/null/primitive semantics; failures dropped by one."}}
{"run":570,"commit":"a24fa8a","metric":77,"metrics":{"compiler_test262_cases":946,"compiler_test262_pass":869,"compiler_test262_failures":77,"compiler_test262_compiler_errors":0,"compiler_test262_compiler_crashes":0,"compiler_test262_compiler_fails":4,"compiler_test262_both_fail":61,"compiler_test262_interpreter_fail_compiler_pass":12,"compatibility_pass":869,"compatibility_cases":946,"compiler_errors":0,"compiler_crashes":0,"compiler_fails":4,"both_fail":61,"interpreter_fail_compiler_pass":12,"elapsed_ms":40616},"status":"checks_failed","description":"Treat nil shape prototype as null prototype","timestamp":1778016571789,"segment":20,"confidence":2.4615384615384617,"iterationTokens":15853,"asi":{"hypothesis":"Shape proto nil should represent a true null prototype, which would make Object.create(null) lack toString/valueOf and cause ToPropertyKey to throw.","rollback_reason":"Backpressure checks failed and object benchmark regressed from current best 73 to 77 failures with new compiler-only failures.","next_action_hint":"Need a representation that distinguishes absent/default prototype from explicit null prototype; do not broadly reinterpret nil shape proto."}}
{"run":571,"commit":"a89fd66","metric":69,"metrics":{"compiler_test262_cases":946,"compiler_test262_pass":877,"compiler_test262_failures":69,"compiler_test262_compiler_errors":0,"compiler_test262_compiler_crashes":0,"compiler_test262_compiler_fails":0,"compiler_test262_both_fail":57,"compiler_test262_interpreter_fail_compiler_pass":12,"compatibility_pass":877,"compatibility_cases":946,"compiler_errors":0,"compiler_crashes":0,"compiler_fails":0,"both_fail":57,"interpreter_fail_compiler_pass":12,"elapsed_ms":33072},"status":"keep","description":"Skip non-enumerable object rest properties","timestamp":1778016808754,"segment":20,"confidence":3.4285714285714284,"iterationTokens":3470,"asi":{"hypothesis":"Object rest/spread copying should consult property descriptors and skip non-enumerable own properties.","learned":"Map-backed enumerable_string_props copied all string keys regardless of descriptor metadata; filtering enumerable:false fixes object destructuring rest cases.","active_category":"language/expressions/object","fixed_cluster":"object rest destructuring skip-non-enumerable cases; failures dropped by four."}}
{"run":572,"commit":"ab435b8","metric":66,"metrics":{"compiler_test262_cases":946,"compiler_test262_pass":880,"compiler_test262_failures":66,"compiler_test262_compiler_errors":0,"compiler_test262_compiler_crashes":0,"compiler_test262_compiler_fails":0,"compiler_test262_both_fail":54,"compiler_test262_interpreter_fail_compiler_pass":12,"compatibility_pass":880,"compatibility_cases":946,"compiler_errors":0,"compiler_crashes":0,"compiler_fails":0,"both_fail":54,"interpreter_fail_compiler_pass":12,"elapsed_ms":45510},"status":"keep","description":"Invoke proxy descriptor traps during object copy","timestamp":1778017296550,"segment":20,"confidence":4.333333333333333,"iterationTokens":16574,"asi":{"hypothesis":"Object spread/rest over Proxy sources must call ownKeys and getOwnPropertyDescriptor traps for candidate keys, even when no properties are copied.","learned":"copy_data_properties previously treated proxy objects as plain maps and skipped all traps; minimal proxy trap enumeration fixes several spread/rest proxy ordering/call-observation cases.","active_category":"language/expressions/object","fixed_cluster":"object spread/rest proxy ownKeys/getOwnPropertyDescriptor trap observation cases; failures dropped by three."}}
{"run":573,"commit":"ab435b8","metric":66,"metrics":{"compiler_test262_cases":946,"compiler_test262_pass":880,"compiler_test262_failures":66,"compiler_test262_compiler_errors":0,"compiler_test262_compiler_crashes":0,"compiler_test262_compiler_fails":0,"compiler_test262_both_fail":52,"compiler_test262_interpreter_fail_compiler_pass":12,"compatibility_pass":880,"compatibility_cases":946,"compiler_errors":0,"compiler_crashes":0,"compiler_fails":0,"both_fail":52,"interpreter_fail_compiler_pass":12,"elapsed_ms":41524},"status":"discard","description":"Copy enumerable proxy symbol properties","timestamp":1778017616854,"segment":20,"confidence":4.105263157894737,"iterationTokens":10576,"asi":{"hypothesis":"Object spread/rest over proxy sources should copy enumerable symbol keys as well as string keys.","rollback_reason":"Primary compatibility_failures was unchanged even though failure categorization shifted; likely symbol descriptor verification still fails elsewhere.","next_action_hint":"If revisiting, add symbol-aware Object.getOwnPropertyDescriptor/verifyProperty support before copying symbols so full proxy symbol cases can pass."}}
{"run":574,"commit":"ab435b8","metric":66,"metrics":{"compiler_test262_cases":946,"compiler_test262_pass":880,"compiler_test262_failures":66,"compiler_test262_compiler_errors":0,"compiler_test262_compiler_crashes":0,"compiler_test262_compiler_fails":0,"compiler_test262_both_fail":52,"compiler_test262_interpreter_fail_compiler_pass":12,"compatibility_pass":880,"compatibility_cases":946,"compiler_errors":0,"compiler_crashes":0,"compiler_fails":0,"both_fail":52,"interpreter_fail_compiler_pass":12,"elapsed_ms":56843},"status":"discard","description":"Support symbol descriptors during object copy","timestamp":1778017899605,"segment":20,"confidence":4.875,"iterationTokens":1912,"asi":{"hypothesis":"Adding symbol-aware getOwnPropertyDescriptor support alongside symbol copying should complete proxy symbol spread/rest cases.","rollback_reason":"Primary compatibility_failures unchanged; the remaining proxy symbol cases still fail, likely due compareArray/symbol stringification or excluded-name handling rather than descriptor lookup alone.","next_action_hint":"Inspect exact proxy symbol Test262 actual after this change before retrying; avoid partial symbol-copy changes that only shift both_fail count."}}
{"run":575,"commit":"ab435b8","metric":65,"metrics":{"compiler_test262_cases":946,"compiler_test262_pass":881,"compiler_test262_failures":65,"compiler_test262_compiler_errors":0,"compiler_test262_compiler_crashes":0,"compiler_test262_compiler_fails":0,"compiler_test262_both_fail":53,"compiler_test262_interpreter_fail_compiler_pass":12,"compatibility_pass":881,"compatibility_cases":946,"compiler_errors":0,"compiler_crashes":0,"compiler_fails":0,"both_fail":53,"interpreter_fail_compiler_pass":12,"elapsed_ms":33153},"status":"checks_failed","description":"Reject non-constructor methods by prototype flag","timestamp":1778018084544,"segment":20,"confidence":4.875,"iterationTokens":4257,"asi":{"hypothesis":"Functions with has_prototype=false, including object methods, are not constructors and new should throw TypeError.","rollback_reason":"Metric improved by one but backpressure checks failed, so change cannot be kept.","next_action_hint":"Inspect checks output by rerunning targeted tests; likely some non-method function without prototype is expected to construct or has_prototype metadata is too broad. A safer fix may need an explicit constructable flag rather than has_prototype."}}
{"run":576,"commit":"d8c331d","metric":74,"metrics":{"compiler_test262_cases":946,"compiler_test262_pass":872,"compiler_test262_failures":74,"compiler_test262_compiler_errors":0,"compiler_test262_compiler_crashes":0,"compiler_test262_compiler_fails":0,"compiler_test262_both_fail":62,"compiler_test262_interpreter_fail_compiler_pass":12,"compatibility_pass":872,"compatibility_cases":946,"compiler_errors":0,"compiler_crashes":0,"compiler_fails":0,"both_fail":62,"interpreter_fail_compiler_pass":12,"elapsed_ms":54191},"status":"checks_failed","description":"Compile direct eval through source compiler","timestamp":1778018290996,"segment":20,"confidence":4.875,"iterationTokens":6927,"asi":{"hypothesis":"Native-bytecode direct eval causes interpreter_fail/compiler_pass object accessor skew; using the source compiler for eval could align paths.","rollback_reason":"Checks failed due unused BytecodeParser alias and metric regressed badly from current best 66, so the broad switch is not viable.","next_action_hint":"Do not switch all runtime eval to JS.Compiler. If targeting eval skew, use narrow semantic fixes or remove unused alias only after a metric-improving change."}}
{"run":577,"commit":"70c1589","metric":65,"metrics":{"compiler_test262_cases":946,"compiler_test262_pass":881,"compiler_test262_failures":65,"compiler_test262_compiler_errors":0,"compiler_test262_compiler_crashes":0,"compiler_test262_compiler_fails":0,"compiler_test262_both_fail":54,"compiler_test262_interpreter_fail_compiler_pass":11,"compatibility_pass":881,"compatibility_cases":946,"compiler_errors":0,"compiler_crashes":0,"compiler_fails":0,"both_fail":54,"interpreter_fail_compiler_pass":11,"elapsed_ms":34021},"status":"keep","description":"Hide internal prototype from hasOwnProperty","timestamp":1778018541379,"segment":20,"confidence":5,"iterationTokens":2412,"asi":{"hypothesis":"Internal object prototype storage should not make hasOwnProperty('__proto__') true when there is no explicit own descriptor.","learned":"Descriptor hiding for Object.getOwnPropertyDescriptor was not enough; hasOwnProperty needed the same internal-prototype distinction. This fixes poisoned Object.prototype __proto__ object literal semantics.","active_category":"language/expressions/object","fixed_cluster":"__proto__ poisoned Object.prototype / internal prototype own-property visibility; failures dropped by one."}}
{"run":578,"commit":"7596e4e","metric":63,"metrics":{"compiler_test262_cases":946,"compiler_test262_pass":883,"compiler_test262_failures":63,"compiler_test262_compiler_errors":0,"compiler_test262_compiler_crashes":0,"compiler_test262_compiler_fails":0,"compiler_test262_both_fail":52,"compiler_test262_interpreter_fail_compiler_pass":11,"compatibility_pass":883,"compatibility_cases":946,"compiler_errors":0,"compiler_crashes":0,"compiler_fails":0,"both_fail":52,"interpreter_fail_compiler_pass":11,"elapsed_ms":32290},"status":"keep","description":"Preserve internal prototype beside computed __proto__ property","timestamp":1778018840758,"segment":20,"confidence":5.25,"iterationTokens":2412,"asi":{"hypothesis":"Computed ['__proto__'] own properties should not overwrite the object literal's internal prototype set by an earlier literal __proto__ property.","learned":"A separate internal prototype slot is needed once an own computed __proto__ data descriptor exists; getPrototypeOf and prototype lookup must prefer it.","fixed_cluster":"__proto__ duplicate computed / computed __proto__ prototype preservation","active_category":"language/expressions/object"}}
{"run":579,"commit":"7596e4e","metric":64,"metrics":{"compiler_test262_cases":946,"compiler_test262_pass":882,"compiler_test262_failures":64,"compiler_test262_compiler_errors":0,"compiler_test262_compiler_crashes":0,"compiler_test262_compiler_fails":2,"compiler_test262_both_fail":51,"compiler_test262_interpreter_fail_compiler_pass":11,"compatibility_pass":882,"compatibility_cases":946,"compiler_errors":0,"compiler_crashes":0,"compiler_fails":2,"both_fail":51,"interpreter_fail_compiler_pass":11,"elapsed_ms":33428},"status":"checks_failed","description":"Define object literal fields as data properties","timestamp":1778019061551,"segment":20,"confidence":5.25,"iterationTokens":14288,"asi":{"hypothesis":"Object-literal define_field opcodes should create own data properties instead of going through ordinary Put, fixing shorthand __proto__ and setter bypass semantics.","rollback_reason":"Primary metric regressed from current best 63 and backpressure checks failed; broad shaped-object compiler lowering change introduced compiler-only failures.","next_action_hint":"Retry narrower: keep interpreter define_field using define_array_el if checks allow, but avoid disabling shaped-object fast path globally. Source compiler may need only shorthand __proto__ to emit computed define_array_el."}}
{"run":580,"commit":"d31298e","metric":62,"metrics":{"compiler_test262_cases":946,"compiler_test262_pass":884,"compiler_test262_failures":62,"compiler_test262_compiler_errors":0,"compiler_test262_compiler_crashes":0,"compiler_test262_compiler_fails":0,"compiler_test262_both_fail":51,"compiler_test262_interpreter_fail_compiler_pass":11,"compatibility_pass":884,"compatibility_cases":946,"compiler_errors":0,"compiler_crashes":0,"compiler_fails":0,"both_fail":51,"interpreter_fail_compiler_pass":11,"elapsed_ms":33333},"status":"keep","description":"Treat shorthand __proto__ as data property","timestamp":1778019304179,"segment":20,"confidence":5.375,"iterationTokens":4322,"asi":{"hypothesis":"Object literal shorthand __proto__ is an own data property, not the special prototype setter form; both interpreter and compiler define_field paths need a data-property path for this key.","learned":"A broad define_field-as-data-property lowering regressed checks; a narrow __proto__ branch preserves shaped-object fast paths while fixing the shorthand duplicate case.","fixed_cluster":"__proto__ permitted duplicate shorthand","active_category":"language/expressions/object"}}
{"run":581,"commit":"d31298e","metric":63,"metrics":{"compiler_test262_cases":946,"compiler_test262_pass":883,"compiler_test262_failures":63,"compiler_test262_compiler_errors":0,"compiler_test262_compiler_crashes":0,"compiler_test262_compiler_fails":0,"compiler_test262_both_fail":52,"compiler_test262_interpreter_fail_compiler_pass":11,"compatibility_pass":883,"compatibility_cases":946,"compiler_errors":0,"compiler_crashes":0,"compiler_fails":0,"both_fail":52,"interpreter_fail_compiler_pass":11,"elapsed_ms":38366},"status":"discard","description":"Throw on null-prototype object ToPropertyKey","timestamp":1778019582626,"segment":20,"confidence":7.166666666666667,"iterationTokens":8508,"asi":{"hypothesis":"ToPropertyKey on Object.create(null) computed accessor names should throw TypeError instead of stringifying through Object.prototype.","rollback_reason":"No primary improvement from current best 62; it likely only changed compiler/interpreter skew because interpreter try/catch does not catch this abrupt completion path correctly.","next_action_hint":"If retrying accessor-name-computed-err-to-prop-key, first inspect computed accessor exception dispatch in interpreter so TypeError thrown during define_method_computed is catchable."}}
