{"run":1274,"commit":"4ac0f30","metric":9,"metrics":{"compiler_test262_cases":700,"compiler_test262_pass":691,"compiler_test262_failures":9,"compiler_test262_compiler_errors":0,"compiler_test262_compiler_crashes":0,"compiler_test262_compiler_fails":1,"compiler_test262_both_fail":8,"compiler_test262_interpreter_fail_compiler_pass":0,"compatibility_pass":691,"compatibility_cases":700,"compiler_errors":0,"compiler_crashes":0,"compiler_fails":1,"both_fail":8,"interpreter_fail_compiler_pass":0,"elapsed_ms":25135},"status":"keep","description":"Handle simple String split separators","timestamp":1778697197714,"segment":72,"confidence":2,"iterationTokens":4164,"asi":{"hypothesis":"String.prototype.split should ToString-coerce null separators and handle constructed/simple RegExp separator sources that current native regexp splitting misses.","fixed_focus":"split/argument-is-null-and-instance-is-function-call-that-returned-string.js, argument-is-new-reg-exp-and-instance-is-string-hello.js, argument-is-reg-exp-a-z-and-instance-is-string-abc.js","remaining_failures":"700-case workload improved from 12 to 9; remaining failures are duplicate named groups, RegExp subclass replaceAll/default gaps, RegExp.prototype@@search default/u/v, and the compiler-only replacement RegExp coercion case."}}
{"run":1275,"commit":"f4b2b8c","metric":5,"metrics":{"compiler_test262_cases":700,"compiler_test262_pass":695,"compiler_test262_failures":5,"compiler_test262_compiler_errors":0,"compiler_test262_compiler_crashes":0,"compiler_test262_compiler_fails":1,"compiler_test262_both_fail":4,"compiler_test262_interpreter_fail_compiler_pass":0,"compatibility_pass":695,"compatibility_cases":700,"compiler_errors":0,"compiler_crashes":0,"compiler_fails":1,"both_fail":4,"interpreter_fail_compiler_pass":0,"elapsed_ms":25018},"status":"keep","description":"Install RegExp search support","timestamp":1778697910517,"segment":72,"confidence":3.3333333333333335,"iterationTokens":4164,"asi":{"hypothesis":"String.prototype.search should create/invoke RegExp @@search, and RegExp.prototype@@search should return UTF-16 indices with the same narrow Unicode/v fallback coverage already used by match/replace.","fixed_focus":"search/invoke-builtin-search.js, invoke-builtin-search-searcher-undef.js, regexp-prototype-search-v-flag.js, regexp-prototype-search-v-u-flag.js","remaining_failures":"700-case workload improved from 9 to 5; remaining failures now match the 650 plateau: duplicate named groups, RegExp subclass replaceAll/default construction gaps, and the compiler-only replacement RegExp coercion case."}}
{"type":"config","name":"String Test262 compatibility 750-case expansion","metricName":"compatibility_failures","metricUnit":"","bestDirection":"lower"}
{"run":1276,"commit":"3a74d6b","metric":11,"metrics":{"compiler_test262_cases":750,"compiler_test262_pass":739,"compiler_test262_failures":11,"compiler_test262_compiler_errors":0,"compiler_test262_compiler_crashes":0,"compiler_test262_compiler_fails":1,"compiler_test262_both_fail":10,"compiler_test262_interpreter_fail_compiler_pass":0,"compatibility_pass":739,"compatibility_cases":750,"compiler_errors":0,"compiler_crashes":0,"compiler_fails":1,"both_fail":10,"interpreter_fail_compiler_pass":0,"elapsed_ms":26463},"status":"keep","description":"Baseline String 750-case expansion","timestamp":1778698342635,"segment":73,"confidence":null,"iterationTokens":124,"asi":{"hypothesis":"Expand String workload after 700-case plateau reached known deep failures; 750 exposes the next String.prototype cluster while retaining compiler parity checks.","workload":"AUTORESEARCH_TEST262_CATEGORY=built-ins/String TEST262_LIMIT=750 TEST262_ERROR_LIMIT=480 ./autoresearch.sh","baseline_note":"New 750-case baseline has 11 failures, 739 passes, one compiler-only semantic failure, and no compiler errors/crashes."}}
{"run":1277,"commit":"b73019c","metric":5,"metrics":{"compiler_test262_cases":750,"compiler_test262_pass":745,"compiler_test262_failures":5,"compiler_test262_compiler_errors":0,"compiler_test262_compiler_crashes":0,"compiler_test262_compiler_fails":1,"compiler_test262_both_fail":4,"compiler_test262_interpreter_fail_compiler_pass":0,"compatibility_pass":745,"compatibility_cases":750,"compiler_errors":0,"compiler_crashes":0,"compiler_fails":1,"both_fail":4,"interpreter_fail_compiler_pass":0,"elapsed_ms":26278},"status":"keep","description":"Tighten String split limit and regex fallbacks","timestamp":1778698741290,"segment":73,"confidence":null,"iterationTokens":10244,"asi":{"hypothesis":"String.prototype.split should apply ToUint32 semantics to explicit limits and provide simple RegExp separator behavior for current literal digit and character-class sources, rather than treating non-integer limits as omitted.","fixed_focus":"split false/string/negative-large limits, RegExp('\\\\d+') splitting, and simple constructed RegExp separator cases","remaining_failures":"750-case workload improved from 11 to 5; remaining failures are the same deep plateau: duplicate named RegExp groups, default-derived RegExp subclass replaceAll construction, and compiler-only replacement RegExp toString override."}}
{"type":"config","name":"String Test262 compatibility 800-case expansion","metricName":"compatibility_failures","metricUnit":"","bestDirection":"lower"}
{"run":1278,"commit":"1cc5e7e","metric":7,"metrics":{"compiler_test262_cases":800,"compiler_test262_pass":793,"compiler_test262_failures":7,"compiler_test262_compiler_errors":0,"compiler_test262_compiler_crashes":0,"compiler_test262_compiler_fails":1,"compiler_test262_both_fail":6,"compiler_test262_interpreter_fail_compiler_pass":0,"compatibility_pass":793,"compatibility_cases":800,"compiler_errors":0,"compiler_crashes":0,"compiler_fails":1,"both_fail":6,"interpreter_fail_compiler_pass":0,"elapsed_ms":27789},"status":"keep","description":"Baseline String 800-case expansion","timestamp":1778698940503,"segment":74,"confidence":null,"iterationTokens":124,"asi":{"hypothesis":"Expand String workload after 750-case workload again reached the same five-failure deep plateau; 800 should expose the next semantic cluster without changing the optimization target.","workload":"AUTORESEARCH_TEST262_CATEGORY=built-ins/String TEST262_LIMIT=800 TEST262_ERROR_LIMIT=540 ./autoresearch.sh","baseline_note":"New 800-case baseline has 7 failures, 793 passes, one compiler-only semantic failure, and no compiler errors/crashes."}}
{"run":1279,"commit":"449e754","metric":5,"metrics":{"compiler_test262_cases":800,"compiler_test262_pass":795,"compiler_test262_failures":5,"compiler_test262_compiler_errors":0,"compiler_test262_compiler_crashes":0,"compiler_test262_compiler_fails":1,"compiler_test262_both_fail":4,"compiler_test262_interpreter_fail_compiler_pass":0,"compatibility_pass":795,"compatibility_cases":800,"compiler_errors":0,"compiler_crashes":0,"compiler_fails":1,"both_fail":4,"interpreter_fail_compiler_pass":0,"elapsed_ms":28169},"status":"keep","description":"Honor split custom methods and limit order","timestamp":1778699166342,"segment":74,"confidence":null,"iterationTokens":3873,"asi":{"hypothesis":"String.prototype.split should invoke a custom @@split method before built-in splitting, and for built-in splitting should perform explicit limit ToUint32 before separator ToString abrupts.","fixed_focus":"split/cstm-split-invocation.js and split/limit-touint32-error.js","remaining_failures":"800-case workload improved from 7 to 5; remaining failures are the known deep plateau: duplicate named groups, RegExp subclass default-constructor replaceAll, and compiler-only replacement RegExp toString override."}}
{"type":"config","name":"String Test262 compatibility 850-case expansion","metricName":"compatibility_failures","metricUnit":"","bestDirection":"lower"}
{"run":1280,"commit":"067cb40","metric":10,"metrics":{"compiler_test262_cases":850,"compiler_test262_pass":840,"compiler_test262_failures":10,"compiler_test262_compiler_errors":0,"compiler_test262_compiler_crashes":0,"compiler_test262_compiler_fails":1,"compiler_test262_both_fail":9,"compiler_test262_interpreter_fail_compiler_pass":0,"compatibility_pass":840,"compatibility_cases":850,"compiler_errors":0,"compiler_crashes":0,"compiler_fails":1,"both_fail":9,"interpreter_fail_compiler_pass":0,"elapsed_ms":29899},"status":"keep","description":"Baseline String 850-case expansion","timestamp":1778699328971,"segment":75,"confidence":null,"iterationTokens":124,"asi":{"hypothesis":"Expand String workload after 800-case workload returned to the same known five-failure plateau; 850 exposes the next String.prototype semantic cluster.","workload":"AUTORESEARCH_TEST262_CATEGORY=built-ins/String TEST262_LIMIT=850 TEST262_ERROR_LIMIT=600 ./autoresearch.sh","baseline_note":"New 850-case baseline has 10 failures, 840 passes, one compiler-only semantic failure, and no compiler errors/crashes."}}
{"run":1281,"commit":"e170921","metric":6,"metrics":{"compiler_test262_cases":850,"compiler_test262_pass":844,"compiler_test262_failures":6,"compiler_test262_compiler_errors":0,"compiler_test262_compiler_crashes":0,"compiler_test262_compiler_fails":1,"compiler_test262_both_fail":5,"compiler_test262_interpreter_fail_compiler_pass":0,"compatibility_pass":844,"compatibility_cases":850,"compiler_errors":0,"compiler_crashes":0,"compiler_fails":1,"both_fail":5,"interpreter_fail_compiler_pass":0,"elapsed_ms":30133},"status":"keep","description":"Refine split and string bounds semantics","timestamp":1778699600757,"segment":75,"confidence":null,"iterationTokens":5685,"asi":{"hypothesis":"String split should preserve custom @@split receiver ordering, perform built-in ToString/limit ordering correctly, and avoid trailing empty output for end-anchor separators; startsWith/substring should clamp negative/undefined bounds per spec.","fixed_focus":"split/separator-regexp.js, split/separator-tostring-error.js, split/this-value-tostring-error.js, startsWith/out-of-bounds-position.js, substring/S15.5.4.15_A1_T2.js","remaining_failures":"850-case workload improved from 10 to 6; remaining failures include the known five deep plateau plus one new case to inspect."}}
{"run":1282,"commit":"ceb366a","metric":5,"metrics":{"compiler_test262_cases":850,"compiler_test262_pass":845,"compiler_test262_failures":5,"compiler_test262_compiler_errors":0,"compiler_test262_compiler_crashes":0,"compiler_test262_compiler_fails":1,"compiler_test262_both_fail":4,"compiler_test262_interpreter_fail_compiler_pass":0,"compatibility_pass":845,"compatibility_cases":850,"compiler_errors":0,"compiler_crashes":0,"compiler_fails":1,"both_fail":4,"interpreter_fail_compiler_pass":0,"elapsed_ms":29930},"status":"keep","description":"Handle undefined split limit zero","timestamp":1778699787875,"segment":75,"confidence":5,"iterationTokens":2306,"asi":{"hypothesis":"String.prototype.split with undefined separator still honors an explicit zero limit and returns an empty array without converting the separator.","fixed_focus":"split/separator-undef-limit-zero.js","remaining_failures":"850-case workload improved from 6 to 5; remaining failures are duplicate named RegExp groups, RegExp subclass default-constructor replaceAll, and compiler-only replacement RegExp toString override."}}
{"type":"config","name":"String Test262 compatibility 900-case expansion","metricName":"compatibility_failures","metricUnit":"","bestDirection":"lower"}
{"run":1283,"commit":"65f7e21","metric":21,"metrics":{"compiler_test262_cases":900,"compiler_test262_pass":879,"compiler_test262_failures":21,"compiler_test262_compiler_errors":0,"compiler_test262_compiler_crashes":0,"compiler_test262_compiler_fails":1,"compiler_test262_both_fail":20,"compiler_test262_interpreter_fail_compiler_pass":0,"compatibility_pass":879,"compatibility_cases":900,"compiler_errors":0,"compiler_crashes":0,"compiler_fails":1,"both_fail":20,"interpreter_fail_compiler_pass":0,"elapsed_ms":31317},"status":"keep","description":"Baseline String 900-case expansion","timestamp":1778699963281,"segment":76,"confidence":null,"iterationTokens":124,"asi":{"hypothesis":"Expand String workload after 850-case workload returned to the five-failure plateau; 900 exposes the next String.prototype semantic cluster.","workload":"AUTORESEARCH_TEST262_CATEGORY=built-ins/String TEST262_LIMIT=900 TEST262_ERROR_LIMIT=660 ./autoresearch.sh","baseline_note":"New 900-case baseline has 21 failures, 879 passes, one compiler-only semantic failure, and no compiler errors/crashes."}}
{"run":1284,"commit":"ceda04d","metric":8,"metrics":{"compiler_test262_cases":900,"compiler_test262_pass":892,"compiler_test262_failures":8,"compiler_test262_compiler_errors":0,"compiler_test262_compiler_crashes":0,"compiler_test262_compiler_fails":1,"compiler_test262_both_fail":7,"compiler_test262_interpreter_fail_compiler_pass":0,"compatibility_pass":892,"compatibility_cases":900,"compiler_errors":0,"compiler_crashes":0,"compiler_fails":1,"both_fail":7,"interpreter_fail_compiler_pass":0,"elapsed_ms":32048},"status":"keep","description":"Add locale case string methods","timestamp":1778700163339,"segment":76,"confidence":null,"iterationTokens":4340,"asi":{"hypothesis":"String.prototype.toLocaleLowerCase and toLocaleUpperCase should exist and share ordinary case-conversion behavior for the broad ES5 locale-insensitive cases.","fixed_focus":"toLocaleLowerCase/S15.5.4.17_A1_T1.js and A1_T11.js; broad run fixed most missing-method locale lower cases","remaining_failures":"900-case workload improved from 21 to 8; remaining failures are the known five deep plateau plus final-sigma locale lower casing and likely locale edge cases."}}
{"run":1285,"commit":"9291e09","metric":6,"metrics":{"compiler_test262_cases":900,"compiler_test262_pass":894,"compiler_test262_failures":6,"compiler_test262_compiler_errors":0,"compiler_test262_compiler_crashes":0,"compiler_test262_compiler_fails":1,"compiler_test262_both_fail":5,"compiler_test262_interpreter_fail_compiler_pass":0,"compatibility_pass":894,"compatibility_cases":900,"compiler_errors":0,"compiler_crashes":0,"compiler_fails":1,"both_fail":5,"interpreter_fail_compiler_pass":0,"elapsed_ms":31462},"status":"keep","description":"Describe locale case methods","timestamp":1778700418848,"segment":76,"confidence":7.5,"iterationTokens":5951,"asi":{"hypothesis":"Locale case methods need prototype installation metadata/descriptors, and borrowed String methods on RegExp receivers should use RegExp toString semantics rather than generic object stringification.","fixed_focus":"toLocaleLowerCase/S15.5.4.17_A11.js and A1_T14.js","remaining_failures":"900-case workload improved from 8 to 6; remaining failures are the known five deep plateau plus final-sigma locale lower casing."}}
{"run":1286,"commit":"d8d6c5b","metric":5,"metrics":{"compiler_test262_cases":900,"compiler_test262_pass":895,"compiler_test262_failures":5,"compiler_test262_compiler_errors":0,"compiler_test262_compiler_crashes":0,"compiler_test262_compiler_fails":1,"compiler_test262_both_fail":4,"compiler_test262_interpreter_fail_compiler_pass":0,"compatibility_pass":895,"compatibility_cases":900,"compiler_errors":0,"compiler_crashes":0,"compiler_fails":1,"both_fail":4,"interpreter_fail_compiler_pass":0,"elapsed_ms":31547},"status":"keep","description":"Handle final sigma lowercasing","timestamp":1778700638275,"segment":76,"confidence":10.666666666666666,"iterationTokens":2170,"asi":{"hypothesis":"Locale lowercasing should apply Unicode final-sigma context rules, treating case-ignorable characters such as U+180E and combining marks as transparent around cased letters.","fixed_focus":"toLocaleLowerCase/Final_Sigma_U180E.js","remaining_failures":"900-case workload improved from 6 to 5; remaining failures are the persistent deep plateau: duplicate named RegExp groups, default-derived RegExp subclass replaceAll, and compiler-only replacement RegExp toString override."}}
{"type":"config","name":"String Test262 compatibility 950-case expansion","metricName":"compatibility_failures","metricUnit":"","bestDirection":"lower"}
{"run":1287,"commit":"af9cdfb","metric":7,"metrics":{"compiler_test262_cases":950,"compiler_test262_pass":943,"compiler_test262_failures":7,"compiler_test262_compiler_errors":0,"compiler_test262_compiler_crashes":0,"compiler_test262_compiler_fails":1,"compiler_test262_both_fail":6,"compiler_test262_interpreter_fail_compiler_pass":0,"compatibility_pass":943,"compatibility_cases":950,"compiler_errors":0,"compiler_crashes":0,"compiler_fails":1,"both_fail":6,"interpreter_fail_compiler_pass":0,"elapsed_ms":33561},"status":"keep","description":"Baseline String 950-case expansion","timestamp":1778700805803,"segment":77,"confidence":null,"iterationTokens":124,"asi":{"hypothesis":"Expand String workload after 900-case workload returned to the known five-failure plateau; 950 exposes the next remaining String.prototype semantics.","workload":"AUTORESEARCH_TEST262_CATEGORY=built-ins/String TEST262_LIMIT=950 TEST262_ERROR_LIMIT=720 ./autoresearch.sh","baseline_note":"New 950-case baseline has 7 failures, 943 passes, one compiler-only semantic failure, and no compiler errors/crashes."}}
{"run":1288,"commit":"fb49d7f","metric":5,"metrics":{"compiler_test262_cases":950,"compiler_test262_pass":945,"compiler_test262_failures":5,"compiler_test262_compiler_errors":0,"compiler_test262_compiler_crashes":0,"compiler_test262_compiler_fails":1,"compiler_test262_both_fail":4,"compiler_test262_interpreter_fail_compiler_pass":0,"compatibility_pass":945,"compatibility_cases":950,"compiler_errors":0,"compiler_crashes":0,"compiler_fails":1,"both_fail":4,"interpreter_fail_compiler_pass":0,"elapsed_ms":33624},"status":"keep","description":"Broaden final sigma casing","timestamp":1778701047326,"segment":77,"confidence":null,"iterationTokens":4731,"asi":{"hypothesis":"Final-sigma lowercasing should operate over Unicode code points and treat cased Unicode categories plus common case-ignorable code points consistently for both toLowerCase and toLocaleLowerCase.","fixed_focus":"toLocaleLowerCase/special_casing_conditional.js and toLowerCase/Final_Sigma_U180E.js","remaining_failures":"950-case workload improved from 7 to 5; remaining failures are the persistent plateau: duplicate named RegExp groups, default-derived RegExp subclass replaceAll, and compiler-only replacement RegExp toString override."}}
{"type":"config","name":"String Test262 compatibility 1000-case expansion","metricName":"compatibility_failures","metricUnit":"","bestDirection":"lower"}
{"run":1289,"commit":"743b56f","metric":7,"metrics":{"compiler_test262_cases":1000,"compiler_test262_pass":993,"compiler_test262_failures":7,"compiler_test262_compiler_errors":0,"compiler_test262_compiler_crashes":0,"compiler_test262_compiler_fails":1,"compiler_test262_both_fail":6,"compiler_test262_interpreter_fail_compiler_pass":0,"compatibility_pass":993,"compatibility_cases":1000,"compiler_errors":0,"compiler_crashes":0,"compiler_fails":1,"both_fail":6,"interpreter_fail_compiler_pass":0,"elapsed_ms":35639},"status":"keep","description":"Baseline String 1000-case expansion","timestamp":1778701302671,"segment":78,"confidence":null,"iterationTokens":126,"asi":{"hypothesis":"Expand String workload after 950-case workload returned to the known five-failure plateau; 1000 exposes the next remaining String.prototype semantics while retaining both interpreter/compiler parity.","workload":"AUTORESEARCH_TEST262_CATEGORY=built-ins/String TEST262_LIMIT=1000 TEST262_ERROR_LIMIT=800 ./autoresearch.sh","baseline_note":"New 1000-case baseline has 7 failures, 993 passes, one compiler-only semantic failure, and no compiler errors/crashes."}}
{"run":1290,"commit":"e1da3ed","metric":5,"metrics":{"compiler_test262_cases":1000,"compiler_test262_pass":995,"compiler_test262_failures":5,"compiler_test262_compiler_errors":0,"compiler_test262_compiler_crashes":0,"compiler_test262_compiler_fails":1,"compiler_test262_both_fail":4,"compiler_test262_interpreter_fail_compiler_pass":0,"compatibility_pass":995,"compatibility_cases":1000,"compiler_errors":0,"compiler_crashes":0,"compiler_fails":1,"both_fail":4,"interpreter_fail_compiler_pass":0,"elapsed_ms":35409},"status":"keep","description":"Enforce String toString receiver type","timestamp":1778701652858,"segment":78,"confidence":null,"iterationTokens":8729,"asi":{"hypothesis":"String.prototype.toString/valueOf should use thisStringValue semantics and throw TypeError for non-String receivers, including cross-realm String.prototype methods.","fixed_focus":"toString/non-generic.js and toString/non-generic-realm.js","remaining_failures":"1000-case workload improved from 7 to 5; remaining failures are the persistent plateau: duplicate named RegExp groups, default-derived RegExp subclass replaceAll, and compiler-only replacement RegExp toString override."}}
{"type":"config","name":"String Test262 compatibility 1050-case expansion","metricName":"compatibility_failures","metricUnit":"","bestDirection":"lower"}
