{"run":896,"commit":"7fa571f","metric":49,"metrics":{"compiler_test262_cases":350,"compiler_test262_pass":301,"compiler_test262_failures":49,"compiler_test262_compiler_errors":0,"compiler_test262_compiler_crashes":0,"compiler_test262_compiler_fails":0,"compiler_test262_both_fail":45,"compiler_test262_interpreter_fail_compiler_pass":1,"compatibility_pass":301,"compatibility_cases":350,"compiler_errors":0,"compiler_crashes":0,"compiler_fails":0,"both_fail":45,"interpreter_fail_compiler_pass":1,"elapsed_ms":22123},"status":"discard","description":"Add coerce_position for charAt/charCodeAt/codePointAt","timestamp":1778340099772,"segment":37,"confidence":4.8,"iterationTokens":9053,"asi":{"hypothesis":"charAt/charCodeAt/codePointAt position coercion needs to propagate TypeError for un-coercible objects","rollback_reason":"Metric flat at 49; the coerce_position helper doesn't fix the underlying issue — ToPrimitive for Object.create(null) doesn't throw TypeError","next_action_hint":"The remaining failures are hitting deep ToPrimitive/ToNumber edge cases and UTF-16 vs Unicode codepoint mismatches. The String workload is plateauing at 49."}}
{"type":"config","name":"QuickBEAM built-ins/Array compatibility","metricName":"compatibility_failures","metricUnit":"","bestDirection":"lower"}
{"run":897,"commit":"2622771","metric":270,"metrics":{"compiler_test262_cases":500,"compiler_test262_pass":230,"compiler_test262_failures":270,"compiler_test262_compiler_errors":0,"compiler_test262_compiler_crashes":0,"compiler_test262_compiler_fails":4,"compiler_test262_both_fail":257,"compiler_test262_interpreter_fail_compiler_pass":0,"compatibility_pass":230,"compatibility_cases":500,"compiler_errors":0,"compiler_crashes":0,"compiler_fails":4,"both_fail":257,"interpreter_fail_compiler_pass":0,"elapsed_ms":39593},"status":"keep","description":"Baseline built-ins/Array with from/of fixes","timestamp":1778491065495,"segment":38,"confidence":null,"iterationTokens":213,"asi":{"hypothesis":"Array.from should wrap results as heap objects for instanceof, throw for null/undefined; Array.of should wrap","improvement":"Initial Array baseline: 270/500 failures with from/of wrap fixes and null/undefined validation"}}
{"run":898,"commit":"af2997b","metric":267,"metrics":{"compiler_test262_cases":500,"compiler_test262_pass":233,"compiler_test262_failures":267,"compiler_test262_compiler_errors":0,"compiler_test262_compiler_crashes":0,"compiler_test262_compiler_fails":6,"compiler_test262_both_fail":252,"compiler_test262_interpreter_fail_compiler_pass":0,"compatibility_pass":233,"compatibility_cases":500,"compiler_errors":0,"compiler_crashes":0,"compiler_fails":6,"both_fail":252,"interpreter_fail_compiler_pass":0,"elapsed_ms":33394},"status":"keep","description":"Fix Array.from mapfn validation and this-arg","timestamp":1778491524423,"segment":38,"confidence":null,"iterationTokens":7191,"asi":{"hypothesis":"Array.from needs mapfn callable validation (throw TypeError for non-callable non-undefined), proper this-arg forwarding to mapfn, and invoke_with_receiver for map callback","improvement":"Reduced Array failures from 270 to 267 (−3) by fixing mapfn validation and symbol throws","next_action_hint":"compiler_fails increased from 4 to 6 due to Heap.wrap changing how from results are handled in compiled path; investigate or focus on other clusters."}}
{"run":899,"commit":"89813a9","metric":263,"metrics":{"compiler_test262_cases":500,"compiler_test262_pass":237,"compiler_test262_failures":263,"compiler_test262_compiler_errors":0,"compiler_test262_compiler_crashes":0,"compiler_test262_compiler_fails":6,"compiler_test262_both_fail":248,"compiler_test262_interpreter_fail_compiler_pass":0,"compatibility_pass":237,"compatibility_cases":500,"compiler_errors":0,"compiler_crashes":0,"compiler_fails":6,"both_fail":248,"interpreter_fail_compiler_pass":0,"elapsed_ms":31666},"status":"keep","description":"Fix Array.prototype.at validation and isArray for arguments","timestamp":1778494987969,"segment":38,"confidence":2.3333333333333335,"iterationTokens":9915,"asi":{"hypothesis":"Array.prototype.at needs null/undefined this check and ToInteger index coercion; isArray should exclude arguments objects stored with __arguments__ marker","improvement":"Reduced Array failures from 267 to 263 (−4) by fixing at() this-validation + ToInteger, and isArray arguments-object exclusion for {:obj, ref} path","next_action_hint":"Remaining: from (18), length (16), of (6), fromAsync (5), Symbol.species (4), Symbol.unscopables (4), isArray (3 remaining). Most need deep array-like/iterator protocol work."}}
{"run":900,"commit":"10fda1e","metric":259,"metrics":{"compiler_test262_cases":500,"compiler_test262_pass":241,"compiler_test262_failures":259,"compiler_test262_compiler_errors":0,"compiler_test262_compiler_crashes":0,"compiler_test262_compiler_fails":6,"compiler_test262_both_fail":244,"compiler_test262_interpreter_fail_compiler_pass":0,"compatibility_pass":241,"compatibility_cases":500,"compiler_errors":0,"compiler_crashes":0,"compiler_fails":6,"both_fail":244,"interpreter_fail_compiler_pass":0,"elapsed_ms":32814},"status":"keep","description":"Add Array.prototype Symbol.unscopables","timestamp":1778498991167,"segment":38,"confidence":3.142857142857143,"iterationTokens":643,"asi":{"hypothesis":"Array.prototype needs Symbol.unscopables with standard entries for with-statement exclusion","improvement":"Reduced Array failures from 263 to 259 (−4) by adding Symbol.unscopables on Array.prototype","next_action_hint":"Remaining: from (18), length (16), of (6), fromAsync (5), Symbol.species (4), isArray (4), misc. Most need deep iterator/array-like work."}}
{"type":"config","name":"QuickBEAM built-ins/Map compatibility","metricName":"compatibility_failures","metricUnit":"","bestDirection":"lower"}
{"run":901,"commit":"289ec19","metric":135,"metrics":{"compiler_test262_cases":204,"compiler_test262_pass":69,"compiler_test262_failures":135,"compiler_test262_compiler_errors":0,"compiler_test262_compiler_crashes":0,"compiler_test262_compiler_fails":3,"compiler_test262_both_fail":118,"compiler_test262_interpreter_fail_compiler_pass":0,"compatibility_pass":69,"compatibility_cases":204,"compiler_errors":0,"compiler_crashes":0,"compiler_fails":3,"both_fail":118,"interpreter_fail_compiler_pass":0,"elapsed_ms":8910},"status":"keep","description":"Baseline built-ins/Map with Map.groupBy","timestamp":1778507133537,"segment":39,"confidence":null,"iterationTokens":213,"asi":{"hypothesis":"Map.groupBy implementation plus metadata reduces Map workload failures","improvement":"Initial Map baseline with groupBy: 135/204 (earlier scan was 140)"}}
{"run":902,"commit":"6937eba","metric":107,"metrics":{"compiler_test262_cases":204,"compiler_test262_pass":97,"compiler_test262_failures":107,"compiler_test262_compiler_errors":0,"compiler_test262_compiler_crashes":0,"compiler_test262_compiler_fails":4,"compiler_test262_both_fail":85,"compiler_test262_interpreter_fail_compiler_pass":0,"compatibility_pass":97,"compatibility_cases":204,"compiler_errors":0,"compiler_crashes":0,"compiler_fails":4,"both_fail":85,"interpreter_fail_compiler_pass":0,"elapsed_ms":9060},"status":"keep","description":"Materialize Map prototype methods and metadata","timestamp":1778507483746,"segment":39,"confidence":null,"iterationTokens":4131,"asi":{"hypothesis":"Map prototype methods need materialization onto actual prototype object for hasOwnProperty, typeof, and descriptor tests; plus metadata for length/constructable","improvement":"Reduced Map failures from 135 to 107 (−28) by materializing Map prototype methods, adding Symbol.iterator, constructor, and metadata for get/set/has/delete/clear","next_action_hint":"Remaining 107: groupBy edge cases, Symbol.species, Map constructor iterator protocol, prototype/set semantics."}}
{"type":"config","name":"QuickBEAM built-ins/Set compatibility","metricName":"compatibility_failures","metricUnit":"","bestDirection":"lower"}
{"run":903,"commit":"2b32343","metric":193,"metrics":{"compiler_test262_cases":300,"compiler_test262_pass":107,"compiler_test262_failures":193,"compiler_test262_compiler_errors":0,"compiler_test262_compiler_crashes":0,"compiler_test262_compiler_fails":0,"compiler_test262_both_fail":132,"compiler_test262_interpreter_fail_compiler_pass":0,"compatibility_pass":107,"compatibility_cases":300,"compiler_errors":0,"compiler_crashes":0,"compiler_fails":0,"both_fail":132,"interpreter_fail_compiler_pass":0,"elapsed_ms":78138},"status":"keep","description":"Baseline built-ins/Set with prototype materialization","timestamp":1778513326167,"segment":40,"confidence":null,"iterationTokens":213,"asi":{"hypothesis":"Set prototype methods materialization should give similar gains as Map materialization","improvement":"Initial Set baseline with materialization: 193/300 (earlier scan was 219)"}}
{"run":904,"commit":"2b32343","metric":193,"metrics":{"compiler_test262_cases":300,"compiler_test262_pass":107,"compiler_test262_failures":193,"compiler_test262_compiler_errors":0,"compiler_test262_compiler_crashes":0,"compiler_test262_compiler_fails":0,"compiler_test262_both_fail":169,"compiler_test262_interpreter_fail_compiler_pass":0,"compatibility_pass":107,"compatibility_cases":300,"compiler_errors":0,"compiler_crashes":0,"compiler_fails":0,"both_fail":169,"interpreter_fail_compiler_pass":0,"elapsed_ms":65471},"status":"discard","description":"Add Set method this-validation","timestamp":1778513759641,"segment":40,"confidence":null,"iterationTokens":5883,"asi":{"hypothesis":"Set prototype methods need this-validation to throw TypeError for non-Set this values instead of crashing","rollback_reason":"Metric flat at 193; the crashes (31) were converted to proper TypeErrors but total failures unchanged because the tests still fail as both_fail","next_action_hint":"The Set this-validation is semantically correct (converts crashes to TypeErrors) but alone doesn't improve the metric. Keep trying with check if the test harness tests actually pass now."}}
{"run":905,"commit":"1fedc09","metric":168,"metrics":{"compiler_test262_cases":300,"compiler_test262_pass":132,"compiler_test262_failures":168,"compiler_test262_compiler_errors":0,"compiler_test262_compiler_crashes":0,"compiler_test262_compiler_fails":0,"compiler_test262_both_fail":158,"compiler_test262_interpreter_fail_compiler_pass":0,"compatibility_pass":132,"compatibility_cases":300,"compiler_errors":0,"compiler_crashes":0,"compiler_fails":0,"both_fail":158,"interpreter_fail_compiler_pass":0,"elapsed_ms":68888},"status":"checks_failed","description":"Materialize Set algebra prototype methods","timestamp":1778516308904,"segment":40,"confidence":null,"iterationTokens":5883,"asi":{"hypothesis":"Set algebra methods are implemented on instances but missing from Set.prototype; materializing them and adding this-validation should reduce Set failures","rollback_reason":"Backpressure checks failed: shared validation rejected WeakSet mutation helpers, breaking compiler_test weakset_delete expectation","next_action_hint":"Retry with validation that preserves WeakSet has/add/delete semantics or separate Set-only validation for algebra methods while old methods accept weak sets."}}
{"run":906,"commit":"373738e","metric":168,"metrics":{"compiler_test262_cases":300,"compiler_test262_pass":132,"compiler_test262_failures":168,"compiler_test262_compiler_errors":0,"compiler_test262_compiler_crashes":0,"compiler_test262_compiler_fails":0,"compiler_test262_both_fail":158,"compiler_test262_interpreter_fail_compiler_pass":0,"compatibility_pass":132,"compatibility_cases":300,"compiler_errors":0,"compiler_crashes":0,"compiler_fails":0,"both_fail":158,"interpreter_fail_compiler_pass":0,"elapsed_ms":61448},"status":"keep","description":"Materialize Set algebra methods and validate receivers","timestamp":1778516567760,"segment":40,"confidence":2,"iterationTokens":6433,"asi":{"hypothesis":"Set algebra methods already exist on instances but are missing from Set.prototype; materializing them and adding receiver validation should reduce Set failures while preserving WeakSet helper compatibility","improvement":"Reduced Set failures from 193 to 168 (−25) with checks passing; previous checks-failed variant fixed by allowing WeakSet shared add/has/delete/clear helpers while algebra methods require strong Set receivers","next_action_hint":"Continue Set algebra/spec semantics: difference/intersection/union/symmetricDifference/isSubsetOf/isSupersetOf/isDisjointFrom clusters now exposed, plus Symbol.species and descriptor leakage."}}
{"run":907,"commit":"373738e","metric":93,"metrics":{"compiler_test262_cases":300,"compiler_test262_pass":207,"compiler_test262_failures":93,"compiler_test262_compiler_errors":0,"compiler_test262_compiler_crashes":0,"compiler_test262_compiler_fails":0,"compiler_test262_both_fail":81,"compiler_test262_interpreter_fail_compiler_pass":0,"compatibility_pass":207,"compatibility_cases":300,"compiler_errors":0,"compiler_crashes":0,"compiler_fails":0,"both_fail":81,"interpreter_fail_compiler_pass":0,"elapsed_ms":95365},"status":"checks_failed","description":"Move Set methods to prototype and normalize zero","timestamp":1778516848784,"segment":40,"confidence":1,"iterationTokens":8958,"asi":{"hypothesis":"Set instances should rely on prototype methods rather than bound own methods; SetData should normalize -0/+0 with SameValueZero semantics","rollback_reason":"Checks failed: Set.prototype.values now returns the list wrapper, breaking iterator self-identity expected by core compiler tests","next_action_hint":"Retry by keeping prototype-only Set methods and zero normalization, but make Set.prototype.values/entries return iterators with Symbol.iterator self-identity (Heap.wrap_iterator or custom iterator)."}}
{"run":908,"commit":"7ece1a8","metric":85,"metrics":{"compiler_test262_cases":300,"compiler_test262_pass":215,"compiler_test262_failures":85,"compiler_test262_compiler_errors":0,"compiler_test262_compiler_crashes":0,"compiler_test262_compiler_fails":0,"compiler_test262_both_fail":75,"compiler_test262_interpreter_fail_compiler_pass":0,"compatibility_pass":215,"compatibility_cases":300,"compiler_errors":0,"compiler_crashes":0,"compiler_fails":0,"both_fail":75,"interpreter_fail_compiler_pass":0,"elapsed_ms":62967},"status":"keep","description":"Use Set prototype methods and SameValueZero zeros","timestamp":1778517115158,"segment":40,"confidence":4.32,"iterationTokens":4811,"asi":{"hypothesis":"Set instances should not expose bound own methods; relying on Set.prototype fixes .call receiver tests. SetData should normalize -0/+0, and values/entries must remain iterators with Symbol.iterator self-identity.","improvement":"Reduced Set failures from 168 to 85 (−83) with checks passing by moving Set instances to prototype methods, normalizing zero values, and returning proper iterators for values/entries.","next_action_hint":"Remaining Set clusters likely new set-method semantics (set-like protocol, species, descriptors). Cluster from latest log before next fix."}}
{"run":909,"commit":"640c3a2","metric":74,"metrics":{"compiler_test262_cases":300,"compiler_test262_pass":226,"compiler_test262_failures":74,"compiler_test262_compiler_errors":0,"compiler_test262_compiler_crashes":0,"compiler_test262_compiler_fails":0,"compiler_test262_both_fail":64,"compiler_test262_interpreter_fail_compiler_pass":0,"compatibility_pass":226,"compatibility_cases":300,"compiler_errors":0,"compiler_crashes":0,"compiler_fails":0,"both_fail":64,"interpreter_fail_compiler_pass":0,"elapsed_ms":63029},"status":"keep","description":"Fix Set.forEach validation and receiver","timestamp":1778517392051,"segment":40,"confidence":4.76,"iterationTokens":5344,"asi":{"hypothesis":"Set.prototype.forEach needs callable callback validation, thisArg forwarding, strong Set receiver validation, and live SetData iteration for values added during iteration","improvement":"Reduced Set failures from 85 to 74 (−11) by fixing forEach validation/receiver/thisArg/live iteration; focused forEach callback-not-callable, thisArg, added-values, and WeakSet receiver tests pass","next_action_hint":"Remaining Set failures: intersection/difference/isSubsetOf/isDisjointFrom set-like protocol details, Symbol.species, descriptor tests."}}
{"run":910,"commit":"8b2d855","metric":50,"metrics":{"compiler_test262_cases":300,"compiler_test262_pass":250,"compiler_test262_failures":50,"compiler_test262_compiler_errors":0,"compiler_test262_compiler_crashes":0,"compiler_test262_compiler_fails":0,"compiler_test262_both_fail":47,"compiler_test262_interpreter_fail_compiler_pass":0,"compatibility_pass":250,"compatibility_cases":300,"compiler_errors":0,"compiler_crashes":0,"compiler_fails":0,"both_fail":47,"interpreter_fail_compiler_pass":0,"elapsed_ms":12301},"status":"keep","description":"Validate Set set-like operands","timestamp":1778517609174,"segment":40,"confidence":2.803921568627451,"iterationTokens":3881,"asi":{"hypothesis":"Set algebra predicates/operators must validate set-like operands (object, numeric non-negative size, callable has and keys) instead of accepting arrays/invalid objects","improvement":"Reduced Set failures from 74 to 50 (−24) by adding set-like operand validation and applying it consistently to subset/superset/disjoint too","next_action_hint":"Remaining Set failures mostly optimal set-like method semantics/order, Symbol.species, descriptor/prototype details."}}
{"run":911,"commit":"bdc8c88","metric":47,"metrics":{"compiler_test262_cases":300,"compiler_test262_pass":253,"compiler_test262_failures":47,"compiler_test262_compiler_errors":0,"compiler_test262_compiler_crashes":0,"compiler_test262_compiler_fails":0,"compiler_test262_both_fail":44,"compiler_test262_interpreter_fail_compiler_pass":0,"compatibility_pass":253,"compatibility_cases":300,"compiler_errors":0,"compiler_crashes":0,"compiler_fails":0,"both_fail":44,"interpreter_fail_compiler_pass":0,"elapsed_ms":12753},"status":"keep","description":"Add Set Symbol.species accessor","timestamp":1778517980789,"segment":40,"confidence":3.1739130434782608,"iterationTokens":13750,"asi":{"hypothesis":"Set constructor needs Symbol.species accessor returning this with non-enumerable configurable descriptor","improvement":"Reduced Set failures from 50 to 47 (−3) by adding Set[Symbol.species] accessor and descriptor metadata","next_action_hint":"Remaining Set failures: set-like order/optimization semantics, Set.prototype.size accessor details, weakset receiver distinctions, prototype/Symbol.toStringTag."}}
{"run":912,"commit":"38cb98e","metric":44,"metrics":{"compiler_test262_cases":300,"compiler_test262_pass":256,"compiler_test262_failures":44,"compiler_test262_compiler_errors":0,"compiler_test262_compiler_crashes":0,"compiler_test262_compiler_fails":0,"compiler_test262_both_fail":41,"compiler_test262_interpreter_fail_compiler_pass":0,"compatibility_pass":256,"compatibility_cases":300,"compiler_errors":0,"compiler_crashes":0,"compiler_fails":0,"both_fail":41,"interpreter_fail_compiler_pass":0,"elapsed_ms":13243},"status":"keep","description":"Add Set.prototype size accessor","timestamp":1778518224829,"segment":40,"confidence":3.425287356321839,"iterationTokens":3593,"asi":{"hypothesis":"Set.prototype.size must be an accessor with getter metadata and non-enumerable configurable descriptor","improvement":"Reduced Set failures from 47 to 44 (−3) by adding Set.prototype.size getter accessor","next_action_hint":"Remaining Set failures: set-like operation order/optimization behavior, weak receiver distinction, Symbol.toStringTag/prototype descriptor."}}
{"run":913,"commit":"94eb0e6","metric":42,"metrics":{"compiler_test262_cases":300,"compiler_test262_pass":258,"compiler_test262_failures":42,"compiler_test262_compiler_errors":0,"compiler_test262_compiler_crashes":0,"compiler_test262_compiler_fails":0,"compiler_test262_both_fail":39,"compiler_test262_interpreter_fail_compiler_pass":0,"compatibility_pass":258,"compatibility_cases":300,"compiler_errors":0,"compiler_crashes":0,"compiler_fails":0,"both_fail":39,"interpreter_fail_compiler_pass":0,"elapsed_ms":12753},"status":"keep","description":"Add Set prototype toStringTag","timestamp":1778518428988,"segment":40,"confidence":3.682926829268293,"iterationTokens":3223,"asi":{"hypothesis":"Set.prototype needs Symbol.toStringTag data property with value Set and non-writable non-enumerable configurable descriptor","improvement":"Reduced Set failures from 44 to 42 (−2) by adding Set.prototype[Symbol.toStringTag]","next_action_hint":"Remaining Set failures are mostly set-like algorithm ordering/optimization and weak receiver separation; descriptor mutations in per-mode run_one can still show compiler skew due prototype mutation leakage."}}
