{"run":1619,"commit":"HEAD","metric":7,"metrics":{"compiler_test262_cases":165,"compiler_test262_pass":158,"compiler_test262_failures":7,"compiler_test262_compiler_errors":0,"compiler_test262_compiler_crashes":0,"compiler_test262_compiler_fails":0,"compiler_test262_both_fail":7,"compiler_test262_interpreter_fail_compiler_pass":0,"compatibility_pass":158,"compatibility_cases":165,"compiler_errors":0,"compiler_crashes":0,"compiler_fails":0,"both_fail":7,"interpreter_fail_compiler_pass":0,"elapsed_ms":8756},"status":"discard","description":"Try source-tree JSON reviver traversal cleanly","timestamp":1778837119433,"segment":138,"confidence":null,"iterationTokens":5612,"asi":{"hypothesis":"A warning-free source-tree based InternalizeJSONProperty implementation should reduce remaining JSON.parse reviver failures by traversing holders with key/source context.","rollback_reason":"Primary metric stayed unchanged at 7; full traversal still does not fix the remaining reviver cluster and may be offset.","next_action_hint":"Inspect focused reviver failures under this clean patch before retrying; likely missing precise mutation/enumeration behavior rather than source tree plumbing."}}
{"run":1620,"commit":"4edd280","metric":0,"metrics":{"compiler_test262_cases":165,"compiler_test262_pass":165,"compiler_test262_failures":0,"compiler_test262_compiler_errors":0,"compiler_test262_compiler_crashes":0,"compiler_test262_compiler_fails":0,"compiler_test262_both_fail":0,"compiler_test262_interpreter_fail_compiler_pass":0,"compatibility_pass":165,"compatibility_cases":165,"compiler_errors":0,"compiler_crashes":0,"compiler_fails":0,"both_fail":0,"interpreter_fail_compiler_pass":0,"elapsed_ms":7900},"status":"keep","description":"Internalize JSON parse revivers","timestamp":1778837945985,"segment":138,"confidence":null,"iterationTokens":5612,"asi":{"hypothesis":"JSON.parse should use Jason ordered objects as the structural source of truth, then run InternalizeJSONProperty over VM holders with CreateDataProperty/delete behavior, proxy-aware array detection, and narrow primitive source contexts only when values still match the parsed primitive."}}
{"type":"config","name":"QuickBEAM Set built-ins compatibility residual","metricName":"compatibility_failures","metricUnit":"","bestDirection":"lower"}
{"run":1621,"commit":"9d66144","metric":4,"metrics":{"compiler_test262_cases":300,"compiler_test262_pass":296,"compiler_test262_failures":4,"compiler_test262_compiler_errors":0,"compiler_test262_compiler_crashes":0,"compiler_test262_compiler_fails":0,"compiler_test262_both_fail":4,"compiler_test262_interpreter_fail_compiler_pass":0,"compatibility_pass":296,"compatibility_cases":300,"compiler_errors":0,"compiler_crashes":0,"compiler_fails":0,"both_fail":4,"interpreter_fail_compiler_pass":0,"elapsed_ms":12160},"status":"keep","description":"Baseline Set residual after JSON and Math completion","timestamp":1778838136361,"segment":139,"confidence":null,"iterationTokens":125,"asi":{"hypothesis":"Rebaseline the Set 300-case residual after completing JSON and Math; remaining failures are expected around Set-like class-order semantics."}}
{"type":"config","name":"QuickBEAM Function built-ins compatibility residual","metricName":"compatibility_failures","metricUnit":"","bestDirection":"lower"}
{"run":1622,"commit":"9bf3518","metric":3,"metrics":{"compiler_test262_cases":509,"compiler_test262_pass":506,"compiler_test262_failures":3,"compiler_test262_compiler_errors":0,"compiler_test262_compiler_crashes":0,"compiler_test262_compiler_fails":0,"compiler_test262_both_fail":3,"compiler_test262_interpreter_fail_compiler_pass":0,"compatibility_pass":506,"compatibility_cases":509,"compiler_errors":0,"compiler_crashes":0,"compiler_fails":0,"both_fail":3,"interpreter_fail_compiler_pass":0,"elapsed_ms":32020},"status":"keep","description":"Baseline Function residual after JSON and Math completion","timestamp":1778839726833,"segment":140,"confidence":null,"iterationTokens":125,"asi":{"hypothesis":"Rebaseline Function 600-case residual after completing JSON and Math, looking for remaining callable descriptor/caller/realm semantics gaps."}}
{"run":1623,"commit":"HEAD","metric":3,"metrics":{"compiler_test262_cases":509,"compiler_test262_pass":506,"compiler_test262_failures":3,"compiler_test262_compiler_errors":0,"compiler_test262_compiler_crashes":0,"compiler_test262_compiler_fails":0,"compiler_test262_both_fail":3,"compiler_test262_interpreter_fail_compiler_pass":0,"compatibility_pass":506,"compatibility_cases":509,"compiler_errors":0,"compiler_crashes":0,"compiler_fails":0,"both_fail":3,"interpreter_fail_compiler_pass":0,"elapsed_ms":30441},"status":"discard","description":"Try bound newTarget realm fallback for Object construction","timestamp":1778840543390,"segment":140,"confidence":null,"iterationTokens":125,"asi":{"hypothesis":"Reflect.construct with bound newTarget should recursively use the target function's realm and realm Object constructor should preserve the preallocated this object for no-argument construction.","rollback_reason":"Primary Function metric stayed unchanged at 3 even though focused recursive bound newTarget test passed; likely another Function case regressed or broader realm Function constructor semantics still incomplete.","next_action_hint":"Inspect the failure list under the patch before retrying; Object construction with bound newTarget alone is insufficient without coherent realm Function dynamic-function prototype/body semantics."}}
{"run":1624,"commit":"f5b5e2d","metric":2,"metrics":{"compiler_test262_cases":509,"compiler_test262_pass":507,"compiler_test262_failures":2,"compiler_test262_compiler_errors":0,"compiler_test262_compiler_crashes":0,"compiler_test262_compiler_fails":0,"compiler_test262_both_fail":2,"compiler_test262_interpreter_fail_compiler_pass":0,"compatibility_pass":507,"compatibility_cases":509,"compiler_errors":0,"compiler_crashes":0,"compiler_fails":0,"both_fail":2,"interpreter_fail_compiler_pass":0,"elapsed_ms":28980},"status":"keep","description":"Improve realm Function construction prototypes","timestamp":1778841074262,"segment":140,"confidence":null,"iterationTokens":15890,"asi":{"hypothesis":"Test262 realm Function constructors should create callable objects with newTarget-derived Function.prototype inheritance and a realm Object.prototype-backed own prototype object; realm Object construction should preserve the preallocated this object so bound newTarget realm fallbacks are observable."}}
{"run":1625,"commit":"HEAD","metric":2,"metrics":{"compiler_test262_cases":509,"compiler_test262_pass":507,"compiler_test262_failures":2,"compiler_test262_compiler_errors":0,"compiler_test262_compiler_crashes":0,"compiler_test262_compiler_fails":0,"compiler_test262_both_fail":2,"compiler_test262_interpreter_fail_compiler_pass":0,"compatibility_pass":507,"compatibility_cases":509,"compiler_errors":0,"compiler_crashes":0,"compiler_fails":0,"both_fail":2,"interpreter_fail_compiler_pass":0,"elapsed_ms":26151},"status":"discard","description":"Try unique realm constructor identities","timestamp":1778842381170,"segment":140,"confidence":2,"iterationTokens":38662,"asi":{"hypothesis":"Realm constructors should have distinct callable identities so Date/Object prototype metadata does not collide across realms while preserving displayed builtin names.","rollback_reason":"Primary metric stayed unchanged at 2; direct bound Date realm test passed but the recursive Object bound-newTarget test regressed, so the identity split is incomplete.","next_action_hint":"Do not retry realm constructor identity splitting unchanged; it needs coherent bound-function realm propagation and constructor prototype metadata for nested bound newTarget first."}}
{"run":1626,"commit":"4cfcfed","metric":1,"metrics":{"compiler_test262_cases":509,"compiler_test262_pass":508,"compiler_test262_failures":1,"compiler_test262_compiler_errors":0,"compiler_test262_compiler_crashes":0,"compiler_test262_compiler_fails":0,"compiler_test262_both_fail":1,"compiler_test262_interpreter_fail_compiler_pass":0,"compatibility_pass":508,"compatibility_cases":509,"compiler_errors":0,"compiler_crashes":0,"compiler_fails":0,"both_fail":1,"interpreter_fail_compiler_pass":0,"elapsed_ms":26383},"status":"keep","description":"Propagate eval JavaScript throws","timestamp":1778842749890,"segment":140,"confidence":2,"iterationTokens":11336,"asi":{"hypothesis":"Indirect eval should propagate JavaScript exceptions from evaluated code instead of converting interpreter {:js_throw, value} results to undefined, so strict caller restrictions remain observable through eval."}}
{"run":1627,"commit":"ee105ab","metric":0,"metrics":{"compiler_test262_cases":509,"compiler_test262_pass":509,"compiler_test262_failures":0,"compiler_test262_compiler_errors":0,"compiler_test262_compiler_crashes":0,"compiler_test262_compiler_fails":0,"compiler_test262_both_fail":0,"compiler_test262_interpreter_fail_compiler_pass":0,"compatibility_pass":509,"compatibility_cases":509,"compiler_errors":0,"compiler_crashes":0,"compiler_fails":0,"both_fail":0,"interpreter_fail_compiler_pass":0,"elapsed_ms":27064},"status":"keep","description":"Give realm constructors distinct identities","timestamp":1778842975987,"segment":140,"confidence":2,"iterationTokens":2391,"asi":{"hypothesis":"Test262 realm constructors should be distinct callable identities while preserving their builtin names, so constructor/prototype metadata and GetFunctionRealm fallback do not collide across realms."}}
{"type":"config","name":"QuickBEAM Set built-ins compatibility residual after Function completion","metricName":"compatibility_failures","metricUnit":"","bestDirection":"lower"}
{"run":1628,"commit":"63bbc5c","metric":4,"metrics":{"compiler_test262_cases":300,"compiler_test262_pass":296,"compiler_test262_failures":4,"compiler_test262_compiler_errors":0,"compiler_test262_compiler_crashes":0,"compiler_test262_compiler_fails":0,"compiler_test262_both_fail":4,"compiler_test262_interpreter_fail_compiler_pass":0,"compatibility_pass":296,"compatibility_cases":300,"compiler_errors":0,"compiler_crashes":0,"compiler_fails":0,"both_fail":4,"interpreter_fail_compiler_pass":0,"elapsed_ms":11470},"status":"keep","description":"Baseline Set residual after Function completion","timestamp":1778843125626,"segment":141,"confidence":null,"iterationTokens":128,"asi":{"hypothesis":"Rebaseline Set 300-case residual after completing Function to see whether realm/eval fixes affected the remaining Set-like class-order failures."}}
{"type":"config","name":"QuickBEAM Object built-ins compatibility residual","metricName":"compatibility_failures","metricUnit":"","bestDirection":"lower"}
{"run":1629,"commit":"HEAD","metric":2,"metrics":{"compiler_test262_cases":2500,"compiler_test262_pass":2498,"compiler_test262_failures":2,"compiler_test262_compiler_errors":0,"compiler_test262_compiler_crashes":0,"compiler_test262_compiler_fails":0,"compiler_test262_both_fail":0,"compiler_test262_interpreter_fail_compiler_pass":2,"compatibility_pass":2498,"compatibility_cases":2500,"compiler_errors":0,"compiler_crashes":0,"compiler_fails":0,"both_fail":0,"interpreter_fail_compiler_pass":2,"elapsed_ms":139600},"status":"keep","description":"Baseline Object residual after Function completion","timestamp":1778844010068,"segment":142,"confidence":null,"iterationTokens":125,"asi":{"hypothesis":"Rebaseline the broad Object 2500-case residual after completing Function to revisit the remaining interpreter-only typed-array resizable-buffer skew."}}
{"type":"config","name":"QuickBEAM String built-ins compatibility residual","metricName":"compatibility_failures","metricUnit":"","bestDirection":"lower"}
{"run":1630,"commit":"694f0b8","metric":2,"metrics":{"compiler_test262_cases":1223,"compiler_test262_pass":1221,"compiler_test262_failures":2,"compiler_test262_compiler_errors":0,"compiler_test262_compiler_crashes":0,"compiler_test262_compiler_fails":0,"compiler_test262_both_fail":2,"compiler_test262_interpreter_fail_compiler_pass":0,"compatibility_pass":1221,"compatibility_cases":1223,"compiler_errors":0,"compiler_crashes":0,"compiler_fails":0,"both_fail":2,"interpreter_fail_compiler_pass":0,"elapsed_ms":53572},"status":"keep","description":"Baseline String residual after Function completion","timestamp":1778845281618,"segment":143,"confidence":null,"iterationTokens":125,"asi":{"hypothesis":"Rebaseline the String 1300-case residual after completing Function to revisit the remaining duplicate named RegExp match/indices failures."}}
{"type":"config","name":"QuickBEAM RegExp built-ins compatibility residual","metricName":"compatibility_failures","metricUnit":"","bestDirection":"lower"}
{"run":1631,"commit":"e72dd91","metric":28,"metrics":{"compiler_test262_cases":500,"compiler_test262_pass":472,"compiler_test262_failures":28,"compiler_test262_compiler_errors":0,"compiler_test262_compiler_crashes":0,"compiler_test262_compiler_fails":0,"compiler_test262_both_fail":19,"compiler_test262_interpreter_fail_compiler_pass":0,"compatibility_pass":472,"compatibility_cases":500,"compiler_errors":0,"compiler_crashes":0,"compiler_fails":0,"both_fail":19,"interpreter_fail_compiler_pass":0,"elapsed_ms":84931},"status":"keep","description":"Baseline RegExp residual after Function completion","timestamp":1778845690987,"segment":144,"confidence":null,"iterationTokens":127,"asi":{"hypothesis":"Rebaseline RegExp 500-case residual after completing Function to look for tractable remaining RegExp semantic clusters."}}
{"run":1632,"commit":"HEAD","metric":0,"metrics":{"compiler_test262_cases":0,"compiler_test262_pass":0,"compiler_test262_failures":0,"compiler_test262_compiler_errors":0,"compiler_test262_compiler_crashes":0,"compiler_test262_compiler_fails":0,"compiler_test262_both_fail":0,"compiler_test262_interpreter_fail_compiler_pass":0,"compatibility_pass":0,"compatibility_cases":0,"compiler_errors":0,"compiler_crashes":0,"compiler_fails":0,"both_fail":0,"interpreter_fail_compiler_pass":0,"elapsed_ms":31000},"status":"crash","description":"Handle surrogate code units in fromCodePoint and RegExp.escape","timestamp":1778845897471,"segment":144,"confidence":null,"iterationTokens":17652,"asi":{"hypothesis":"Represent surrogate code units with the existing WTF-8 mapping in String.fromCodePoint and make RegExp.escape iterate UTF-16 code units to eliminate surrogate-related RegExp crashes.","rollback_reason":"Broad RegExp 500-case workload crashed with exit 139 despite focused escaped-surrogates passing; changing surrogate handling likely exposed an unstable native regexp path in the broader RegExp slice.","next_action_hint":"Do not retry the exact combined surrogate patch unchanged; isolate whether fromCodePoint or RegExp.escape causes the exit 139 and validate against the first crashing RegExp file before broad run."}}
{"run":1633,"commit":"HEAD","metric":28,"metrics":{"compiler_test262_cases":500,"compiler_test262_pass":472,"compiler_test262_failures":28,"compiler_test262_compiler_errors":0,"compiler_test262_compiler_crashes":1,"compiler_test262_compiler_fails":0,"compiler_test262_both_fail":19,"compiler_test262_interpreter_fail_compiler_pass":0,"compatibility_pass":472,"compatibility_cases":500,"compiler_errors":0,"compiler_crashes":1,"compiler_fails":0,"both_fail":19,"interpreter_fail_compiler_pass":0,"elapsed_ms":75409},"status":"discard","description":"Escape RegExp surrogate code units without crashing","timestamp":1778846150652,"segment":144,"confidence":null,"iterationTokens":1710,"asi":{"hypothesis":"RegExp.escape should iterate JavaScript UTF-16 code units instead of Elixir codepoints so lone surrogate WTF-8 strings are escaped as \\uXXXX instead of crashing.","rollback_reason":"Focused escaped-surrogates passed, but the broad RegExp primary metric stayed unchanged at 28 and introduced one compiler crash category shift.","next_action_hint":"Do not keep RegExp.escape-only surrogate iteration; if revisiting, pair it with a fix for remaining crashes or isolate the new compiler crash first."}}
{"type":"config","name":"QuickBEAM Map built-ins compatibility slice","metricName":"compatibility_failures","metricUnit":"","bestDirection":"lower"}
{"run":1634,"commit":"8e3817a","metric":0,"metrics":{"compiler_test262_cases":204,"compiler_test262_pass":204,"compiler_test262_failures":0,"compiler_test262_compiler_errors":0,"compiler_test262_compiler_crashes":0,"compiler_test262_compiler_fails":0,"compiler_test262_both_fail":0,"compiler_test262_interpreter_fail_compiler_pass":0,"compatibility_pass":204,"compatibility_cases":204,"compiler_errors":0,"compiler_crashes":0,"compiler_fails":0,"both_fail":0,"interpreter_fail_compiler_pass":0,"elapsed_ms":11614},"status":"keep","description":"Baseline Map built-ins slice after Function completion","timestamp":1778846326128,"segment":145,"confidence":null,"iterationTokens":125,"asi":{"hypothesis":"Check whether Map built-ins have any residual compatibility failures after Function/realm fixes."}}
{"type":"config","name":"QuickBEAM WeakMap built-ins compatibility slice","metricName":"compatibility_failures","metricUnit":"","bestDirection":"lower"}
{"run":1635,"commit":"0d9307e","metric":1,"metrics":{"compiler_test262_cases":141,"compiler_test262_pass":140,"compiler_test262_failures":1,"compiler_test262_compiler_errors":0,"compiler_test262_compiler_crashes":0,"compiler_test262_compiler_fails":0,"compiler_test262_both_fail":1,"compiler_test262_interpreter_fail_compiler_pass":0,"compatibility_pass":140,"compatibility_cases":141,"compiler_errors":0,"compiler_crashes":0,"compiler_fails":0,"both_fail":1,"interpreter_fail_compiler_pass":0,"elapsed_ms":6720},"status":"keep","description":"Baseline WeakMap built-ins slice after Function completion","timestamp":1778846497547,"segment":146,"confidence":null,"iterationTokens":127,"asi":{"hypothesis":"Check WeakMap residual compatibility after Function/realm completion; remaining failures may be small and tractable."}}
{"run":1636,"commit":"1969bdf","metric":0,"metrics":{"compiler_test262_cases":141,"compiler_test262_pass":141,"compiler_test262_failures":0,"compiler_test262_compiler_errors":0,"compiler_test262_compiler_crashes":0,"compiler_test262_compiler_fails":0,"compiler_test262_both_fail":0,"compiler_test262_interpreter_fail_compiler_pass":0,"compatibility_pass":141,"compatibility_cases":141,"compiler_errors":0,"compiler_crashes":0,"compiler_fails":0,"both_fail":0,"interpreter_fail_compiler_pass":0,"elapsed_ms":6529},"status":"keep","description":"Mark weak collection constructors constructable","timestamp":1778846749456,"segment":146,"confidence":null,"iterationTokens":10077,"asi":{"hypothesis":"WeakMap and WeakSet constructors implement [[Construct]] even though direct calls throw, so builtin metadata should mark them constructable for isConstructor/Reflect.construct semantics."}}
{"type":"config","name":"QuickBEAM WeakSet built-ins compatibility slice","metricName":"compatibility_failures","metricUnit":"","bestDirection":"lower"}
{"run":1637,"commit":"b1d48bd","metric":0,"metrics":{"compiler_test262_cases":85,"compiler_test262_pass":85,"compiler_test262_failures":0,"compiler_test262_compiler_errors":0,"compiler_test262_compiler_crashes":0,"compiler_test262_compiler_fails":0,"compiler_test262_both_fail":0,"compiler_test262_interpreter_fail_compiler_pass":0,"compatibility_pass":85,"compatibility_cases":85,"compiler_errors":0,"compiler_crashes":0,"compiler_fails":0,"both_fail":0,"interpreter_fail_compiler_pass":0,"elapsed_ms":3978},"status":"keep","description":"Baseline WeakSet built-ins slice after weak constructor fix","timestamp":1778846909479,"segment":147,"confidence":null,"iterationTokens":127,"asi":{"hypothesis":"Confirm WeakSet built-ins are clean after marking weak collection constructors constructable."}}
{"type":"config","name":"QuickBEAM WeakRef built-ins compatibility slice","metricName":"compatibility_failures","metricUnit":"","bestDirection":"lower"}
{"run":1638,"commit":"5c217b4","metric":0,"metrics":{"compiler_test262_cases":29,"compiler_test262_pass":29,"compiler_test262_failures":0,"compiler_test262_compiler_errors":0,"compiler_test262_compiler_crashes":0,"compiler_test262_compiler_fails":0,"compiler_test262_both_fail":0,"compiler_test262_interpreter_fail_compiler_pass":0,"compatibility_pass":29,"compatibility_cases":29,"compiler_errors":0,"compiler_crashes":0,"compiler_fails":0,"both_fail":0,"interpreter_fail_compiler_pass":0,"elapsed_ms":2263},"status":"keep","description":"Baseline WeakRef built-ins slice after Function completion","timestamp":1778847092922,"segment":148,"confidence":null,"iterationTokens":127,"asi":{"hypothesis":"Confirm WeakRef built-ins are clean after recent constructor/realm fixes."}}
{"type":"config","name":"QuickBEAM FinalizationRegistry built-ins compatibility slice","metricName":"compatibility_failures","metricUnit":"","bestDirection":"lower"}
{"run":1639,"commit":"680aae0","metric":0,"metrics":{"compiler_test262_cases":47,"compiler_test262_pass":47,"compiler_test262_failures":0,"compiler_test262_compiler_errors":0,"compiler_test262_compiler_crashes":0,"compiler_test262_compiler_fails":0,"compiler_test262_both_fail":0,"compiler_test262_interpreter_fail_compiler_pass":0,"compatibility_pass":47,"compatibility_cases":47,"compiler_errors":0,"compiler_crashes":0,"compiler_fails":0,"both_fail":0,"interpreter_fail_compiler_pass":0,"elapsed_ms":2985},"status":"keep","description":"Baseline FinalizationRegistry built-ins slice after Function completion","timestamp":1778847247140,"segment":149,"confidence":null,"iterationTokens":129,"asi":{"hypothesis":"Confirm FinalizationRegistry built-ins are clean after recent constructor/realm fixes."}}
{"type":"config","name":"QuickBEAM Promise built-ins compatibility slice","metricName":"compatibility_failures","metricUnit":"","bestDirection":"lower"}
