{"run":1168,"commit":"a3a1f8f","metric":23,"metrics":{"compiler_test262_cases":340,"compiler_test262_pass":317,"compiler_test262_failures":23,"compiler_test262_compiler_errors":0,"compiler_test262_compiler_crashes":0,"compiler_test262_compiler_fails":0,"compiler_test262_both_fail":16,"compiler_test262_interpreter_fail_compiler_pass":6,"compatibility_pass":317,"compatibility_cases":340,"compiler_errors":0,"compiler_crashes":0,"compiler_fails":0,"both_fail":16,"interpreter_fail_compiler_pass":6,"elapsed_ms":20335},"status":"keep","description":"Register Number formatting builtin metadata","timestamp":1778661794370,"segment":56,"confidence":22.166666666666668,"iterationTokens":15899,"asi":{"hypothesis":"Number prototype formatting methods need builtin metadata so direct length property reads and propertyHelper descriptor checks agree for toFixed, toExponential, and toPrecision."}}
{"run":1169,"commit":"90d0e67","metric":22,"metrics":{"compiler_test262_cases":340,"compiler_test262_pass":318,"compiler_test262_failures":22,"compiler_test262_compiler_errors":0,"compiler_test262_compiler_crashes":0,"compiler_test262_compiler_fails":0,"compiler_test262_both_fail":15,"compiler_test262_interpreter_fail_compiler_pass":6,"compatibility_pass":318,"compatibility_cases":340,"compiler_errors":0,"compiler_crashes":0,"compiler_fails":0,"both_fail":15,"interpreter_fail_compiler_pass":6,"elapsed_ms":19903},"status":"keep","description":"Coerce exponential digits before non-finite formatting","timestamp":1778662208693,"segment":56,"confidence":19.142857142857142,"iterationTokens":8207,"asi":{"hypothesis":"Number.prototype.toExponential must coerce an explicit fractionDigits argument before returning NaN/Infinity strings so abrupt Symbol/BigInt conversions propagate."}}
{"run":1170,"commit":"7ca089e","metric":20,"metrics":{"compiler_test262_cases":340,"compiler_test262_pass":320,"compiler_test262_failures":20,"compiler_test262_compiler_errors":0,"compiler_test262_compiler_crashes":0,"compiler_test262_compiler_fails":0,"compiler_test262_both_fail":13,"compiler_test262_interpreter_fail_compiler_pass":6,"compatibility_pass":320,"compatibility_cases":340,"compiler_errors":0,"compiler_crashes":0,"compiler_fails":0,"both_fail":13,"interpreter_fail_compiler_pass":6,"elapsed_ms":19962},"status":"keep","description":"Validate fixed digits before non-finite formatting","timestamp":1778663053759,"segment":56,"confidence":19.428571428571427,"iterationTokens":2874,"asi":{"hypothesis":"Number.prototype.toFixed must coerce and range-check explicit fractionDigits before returning NaN/Infinity strings, so infinite digits throw RangeError while ordinary NaN digits still return non-finite strings."}}
{"run":1171,"commit":"c9ddd5b","metric":19,"metrics":{"compiler_test262_cases":340,"compiler_test262_pass":321,"compiler_test262_failures":19,"compiler_test262_compiler_errors":0,"compiler_test262_compiler_crashes":0,"compiler_test262_compiler_fails":0,"compiler_test262_both_fail":12,"compiler_test262_interpreter_fail_compiler_pass":6,"compatibility_pass":321,"compatibility_cases":340,"compiler_errors":0,"compiler_crashes":0,"compiler_fails":0,"both_fail":12,"interpreter_fail_compiler_pass":6,"elapsed_ms":20748},"status":"keep","description":"Use exponential form for large fixed numbers","timestamp":1778663402845,"segment":56,"confidence":18.266666666666666,"iterationTokens":5197,"asi":{"hypothesis":"Number.prototype.toFixed should return ToString(x) for finite |x| >= 1e21 after validating an explicit fractionDigits argument, matching spec step ordering without changing smaller fixed formatting."}}
{"run":1172,"commit":"58ab668","metric":18,"metrics":{"compiler_test262_cases":340,"compiler_test262_pass":322,"compiler_test262_failures":18,"compiler_test262_compiler_errors":0,"compiler_test262_compiler_crashes":0,"compiler_test262_compiler_fails":0,"compiler_test262_both_fail":11,"compiler_test262_interpreter_fail_compiler_pass":6,"compatibility_pass":322,"compatibility_cases":340,"compiler_errors":0,"compiler_crashes":0,"compiler_fails":0,"both_fail":11,"interpreter_fail_compiler_pass":6,"elapsed_ms":20783},"status":"keep","description":"Use ordinary ToPrimitive for array objects","timestamp":1778663779611,"segment":56,"confidence":17.25,"iterationTokens":7769,"asi":{"hypothesis":"Non-map heap objects such as arrays should still run ordinary valueOf/toString ToPrimitive fallback before ToNumber, making Number([2]) and formatting precision arrays observe array toString semantics."}}
{"run":1173,"commit":"a4b37d4","metric":16,"metrics":{"compiler_test262_cases":340,"compiler_test262_pass":324,"compiler_test262_failures":16,"compiler_test262_compiler_errors":0,"compiler_test262_compiler_crashes":0,"compiler_test262_compiler_fails":0,"compiler_test262_both_fail":9,"compiler_test262_interpreter_fail_compiler_pass":6,"compatibility_pass":324,"compatibility_cases":340,"compiler_errors":0,"compiler_crashes":0,"compiler_fails":0,"both_fail":9,"interpreter_fail_compiler_pass":6,"elapsed_ms":20327},"status":"keep","description":"Format default Number exponentials","timestamp":1778664101648,"segment":56,"confidence":18.666666666666668,"iterationTokens":5117,"asi":{"hypothesis":"Number.prototype.toExponential with missing or undefined fractionDigits should emit the shortest exponential form rather than ordinary ToString, while preserving explicit digit formatting and non-finite behavior."}}
{"run":1174,"commit":"a4b37d4","metric":16,"metrics":{"compiler_test262_cases":340,"compiler_test262_pass":324,"compiler_test262_failures":16,"compiler_test262_compiler_errors":2,"compiler_test262_compiler_crashes":0,"compiler_test262_compiler_fails":0,"compiler_test262_both_fail":7,"compiler_test262_interpreter_fail_compiler_pass":6,"compatibility_pass":324,"compatibility_cases":340,"compiler_errors":2,"compiler_crashes":0,"compiler_fails":0,"both_fail":7,"interpreter_fail_compiler_pass":6,"elapsed_ms":21149},"status":"discard","description":"Decode and parse numeric infinities","timestamp":1778665318982,"segment":56,"confidence":20,"iterationTokens":5117,"asi":{"hypothesis":"QuickJS bytecode float64 infinity decoding and ToNumber decimal overflow parsing should map overflows to VM infinity sentinels instead of crashing or returning NaN.","rollback_reason":"Primary metric stayed flat at 16 and compiler_errors increased from 0 to 2 because source compiler/top-level path still does not accept infinity literals, so the workload category worsened despite fewer shared failures.","next_action_hint":"Do not keep only interpreter-side infinity decoding/parsing. If retrying, add compiler lowering/source path support for :infinity literals in the same experiment or use a focused broader numeric-literal fix that preserves compiler_errors=0."}}
{"run":1175,"commit":"223643f","metric":13,"metrics":{"compiler_test262_cases":340,"compiler_test262_pass":327,"compiler_test262_failures":13,"compiler_test262_compiler_errors":0,"compiler_test262_compiler_crashes":0,"compiler_test262_compiler_fails":0,"compiler_test262_both_fail":9,"compiler_test262_interpreter_fail_compiler_pass":4,"compatibility_pass":327,"compatibility_cases":340,"compiler_errors":0,"compiler_crashes":0,"compiler_fails":0,"both_fail":9,"interpreter_fail_compiler_pass":4,"elapsed_ms":12997},"status":"keep","description":"Avoid own Number instance methods","timestamp":1778665797937,"segment":56,"confidence":17.875,"iterationTokens":27389,"asi":{"hypothesis":"Interpreted Number construction should rely on the boxed Number internal slot and Number.prototype methods instead of installing own toString/valueOf closures, matching compiler/runtime allocation and eliminating interpreter-only own-property skew."}}
{"run":1176,"commit":"d659deb","metric":12,"metrics":{"compiler_test262_cases":340,"compiler_test262_pass":328,"compiler_test262_failures":12,"compiler_test262_compiler_errors":0,"compiler_test262_compiler_crashes":0,"compiler_test262_compiler_fails":0,"compiler_test262_both_fail":8,"compiler_test262_interpreter_fail_compiler_pass":4,"compatibility_pass":328,"compatibility_cases":340,"compiler_errors":0,"compiler_crashes":0,"compiler_fails":0,"both_fail":8,"interpreter_fail_compiler_pass":4,"elapsed_ms":13135},"status":"keep","description":"Throw on invalid Number string radices","timestamp":1778666386692,"segment":56,"confidence":18,"iterationTokens":5809,"asi":{"hypothesis":"Number.prototype.toString should range-check explicit radix arguments for all numeric receivers, including NaN and infinities, and throw RangeError outside 2..36 instead of falling back to decimal stringification."}}
{"run":1177,"commit":"5c922df","metric":11,"metrics":{"compiler_test262_cases":340,"compiler_test262_pass":329,"compiler_test262_failures":11,"compiler_test262_compiler_errors":0,"compiler_test262_compiler_crashes":0,"compiler_test262_compiler_fails":0,"compiler_test262_both_fail":7,"compiler_test262_interpreter_fail_compiler_pass":4,"compatibility_pass":329,"compatibility_cases":340,"compiler_errors":0,"compiler_crashes":0,"compiler_fails":0,"both_fail":7,"interpreter_fail_compiler_pass":4,"elapsed_ms":13431},"status":"keep","description":"Treat undefined Number radix as decimal","timestamp":1778666648228,"segment":56,"confidence":17.058823529411764,"iterationTokens":4623,"asi":{"hypothesis":"Number.prototype.toString(undefined) should use ordinary decimal stringification while still range-checking other explicit radix values."}}
{"run":1178,"commit":"42f7f92","metric":9,"metrics":{"compiler_test262_cases":340,"compiler_test262_pass":331,"compiler_test262_failures":9,"compiler_test262_compiler_errors":0,"compiler_test262_compiler_crashes":0,"compiler_test262_compiler_fails":0,"compiler_test262_both_fail":7,"compiler_test262_interpreter_fail_compiler_pass":2,"compatibility_pass":331,"compatibility_cases":340,"compiler_errors":0,"compiler_crashes":0,"compiler_fails":0,"both_fail":7,"interpreter_fail_compiler_pass":2,"elapsed_ms":13123},"status":"keep","description":"Let boxed strings shadow virtual methods","timestamp":1778667020568,"segment":56,"confidence":16.333333333333332,"iterationTokens":6484,"asi":{"hypothesis":"Own properties assigned on boxed String objects should shadow virtual String.prototype methods, so transferring Number.prototype.valueOf/toString to String wrappers actually invokes the Number receiver checks instead of the original String methods."}}
{"run":1179,"commit":"d4e7523","metric":7,"metrics":{"compiler_test262_cases":340,"compiler_test262_pass":333,"compiler_test262_failures":7,"compiler_test262_compiler_errors":0,"compiler_test262_compiler_crashes":0,"compiler_test262_compiler_fails":0,"compiler_test262_both_fail":7,"compiler_test262_interpreter_fail_compiler_pass":0,"compatibility_pass":333,"compatibility_cases":340,"compiler_errors":0,"compiler_crashes":0,"compiler_fails":0,"both_fail":7,"interpreter_fail_compiler_pass":0,"elapsed_ms":13345},"status":"keep","description":"Let boxed booleans shadow virtual methods","timestamp":1778667231268,"segment":56,"confidence":15.68421052631579,"iterationTokens":3624,"asi":{"hypothesis":"Own properties assigned on boxed Boolean objects should shadow virtual Boolean.prototype methods, so transferred Number.prototype valueOf/toString methods run receiver validation instead of Boolean wrapper defaults."}}
{"run":1180,"commit":"96cdef4","metric":5,"metrics":{"compiler_test262_cases":340,"compiler_test262_pass":335,"compiler_test262_failures":5,"compiler_test262_compiler_errors":0,"compiler_test262_compiler_crashes":0,"compiler_test262_compiler_fails":0,"compiler_test262_both_fail":5,"compiler_test262_interpreter_fail_compiler_pass":0,"compatibility_pass":335,"compatibility_cases":340,"compiler_errors":0,"compiler_crashes":0,"compiler_fails":0,"both_fail":5,"interpreter_fail_compiler_pass":0,"elapsed_ms":13082},"status":"keep","description":"Preserve negative zero string parsing","timestamp":1778667476360,"segment":56,"confidence":16.77777777777778,"iterationTokens":5624,"asi":{"hypothesis":"ToNumber string parsing should preserve the sign of the exact '-0' string, allowing SameValue/Object.is and reciprocal infinity behavior to distinguish negative zero from positive zero."}}
{"run":1181,"commit":"04b5344","metric":3,"metrics":{"compiler_test262_cases":340,"compiler_test262_pass":337,"compiler_test262_failures":3,"compiler_test262_compiler_errors":0,"compiler_test262_compiler_crashes":0,"compiler_test262_compiler_fails":0,"compiler_test262_both_fail":3,"compiler_test262_interpreter_fail_compiler_pass":0,"compatibility_pass":337,"compatibility_cases":340,"compiler_errors":0,"compiler_crashes":0,"compiler_fails":0,"both_fail":3,"interpreter_fail_compiler_pass":0,"elapsed_ms":13357},"status":"keep","description":"Represent numeric infinities in bytecode","timestamp":1778667754329,"segment":56,"confidence":16.105263157894736,"iterationTokens":7404,"asi":{"hypothesis":"QuickJS float64 constants with IEEE infinity/NaN bit patterns and ToNumber decimal overflows should map to VM sentinel atoms, and the BEAM compiler lowering must accept those sentinel constants to preserve compiler compatibility."}}
{"run":1182,"commit":"8214915","metric":2,"metrics":{"compiler_test262_cases":340,"compiler_test262_pass":338,"compiler_test262_failures":2,"compiler_test262_compiler_errors":0,"compiler_test262_compiler_crashes":0,"compiler_test262_compiler_fails":0,"compiler_test262_both_fail":2,"compiler_test262_interpreter_fail_compiler_pass":0,"compatibility_pass":338,"compatibility_cases":340,"compiler_errors":0,"compiler_crashes":0,"compiler_fails":0,"both_fail":2,"interpreter_fail_compiler_pass":0,"elapsed_ms":13413},"status":"keep","description":"Use realm Number prototypes for construction","timestamp":1778668052138,"segment":56,"confidence":14,"iterationTokens":6521,"asi":{"hypothesis":"Reflect.construct(Number, args, newTarget) should fall back to the newTarget realm's Number.prototype when newTarget.prototype is not an object, matching OrdinaryCreateFromConstructor for Number wrappers."}}
{"run":1183,"commit":"d699cf4","metric":0,"metrics":{"compiler_test262_cases":340,"compiler_test262_pass":340,"compiler_test262_failures":0,"compiler_test262_compiler_errors":0,"compiler_test262_compiler_crashes":0,"compiler_test262_compiler_fails":0,"compiler_test262_both_fail":0,"compiler_test262_interpreter_fail_compiler_pass":0,"compatibility_pass":340,"compatibility_cases":340,"compiler_errors":0,"compiler_crashes":0,"compiler_fails":0,"both_fail":0,"interpreter_fail_compiler_pass":0,"elapsed_ms":13084},"status":"keep","description":"Delegate Number precision formatting","timestamp":1778668264312,"segment":56,"confidence":14,"iterationTokens":2019,"asi":{"hypothesis":"Number.prototype.toPrecision finite formatting should use the embedded JavaScript runtime as an oracle for shortest/rounded decimal rendering when available, matching the existing toString(radix) runtime delegation and falling back to the pure Elixir formatter otherwise."}}
{"type":"config","name":"QuickBEAM String Test262 compatibility rebaseline after Number","metricName":"compatibility_failures","metricUnit":"","bestDirection":"lower"}
{"run":1184,"commit":"49285ba","metric":53,"metrics":{"compiler_test262_cases":350,"compiler_test262_pass":297,"compiler_test262_failures":53,"compiler_test262_compiler_errors":0,"compiler_test262_compiler_crashes":0,"compiler_test262_compiler_fails":0,"compiler_test262_both_fail":50,"compiler_test262_interpreter_fail_compiler_pass":0,"compatibility_pass":297,"compatibility_cases":350,"compiler_errors":0,"compiler_crashes":0,"compiler_fails":0,"both_fail":50,"interpreter_fail_compiler_pass":0,"elapsed_ms":22911},"status":"keep","description":"Rebaseline String workload after Number work","timestamp":1778668451563,"segment":57,"confidence":null,"iterationTokens":127,"asi":{"hypothesis":"Rebaseline bounded built-ins/String after Number reached zero failures; use 350-case cap to avoid the known 400-case crash region and choose the next compatibility cluster from current results."}}
{"run":1185,"commit":"b634648","metric":47,"metrics":{"compiler_test262_cases":350,"compiler_test262_pass":303,"compiler_test262_failures":47,"compiler_test262_compiler_errors":0,"compiler_test262_compiler_crashes":0,"compiler_test262_compiler_fails":0,"compiler_test262_both_fail":45,"compiler_test262_interpreter_fail_compiler_pass":0,"compatibility_pass":303,"compatibility_cases":350,"compiler_errors":0,"compiler_crashes":0,"compiler_fails":0,"both_fail":45,"interpreter_fail_compiler_pass":0,"elapsed_ms":13562},"status":"keep","description":"Honor string-hint object coercion","timestamp":1778669920522,"segment":57,"confidence":null,"iterationTokens":127,"asi":{"hypothesis":"ToString on arrays, functions, and boxed strings should use ordinary string-hint ToPrimitive through observable toString/valueOf methods instead of bypassing overrides or installing own wrapper methods; callable object results from coercion methods must be treated as non-primitive."}}
{"run":1186,"commit":"c978aa4","metric":41,"metrics":{"compiler_test262_cases":350,"compiler_test262_pass":309,"compiler_test262_failures":41,"compiler_test262_compiler_errors":0,"compiler_test262_compiler_crashes":0,"compiler_test262_compiler_fails":3,"compiler_test262_both_fail":36,"compiler_test262_interpreter_fail_compiler_pass":0,"compatibility_pass":309,"compatibility_cases":350,"compiler_errors":0,"compiler_crashes":0,"compiler_fails":3,"both_fail":36,"interpreter_fail_compiler_pass":0,"elapsed_ms":13600},"status":"keep","description":"Materialize String prototype metadata","timestamp":1778670442697,"segment":57,"confidence":2,"iterationTokens":33576,"asi":{"hypothesis":"String.prototype should be a boxed string object with Object.prototype as parent, String instances expose a non-writable virtual length, the String constructor has length metadata, and String.prototype[Symbol.iterator] needs concrete descriptor/name/length metadata."}}
{"run":1187,"commit":"6ba8295","metric":40,"metrics":{"compiler_test262_cases":350,"compiler_test262_pass":310,"compiler_test262_failures":40,"compiler_test262_compiler_errors":0,"compiler_test262_compiler_crashes":0,"compiler_test262_compiler_fails":3,"compiler_test262_both_fail":35,"compiler_test262_interpreter_fail_compiler_pass":0,"compatibility_pass":310,"compatibility_cases":350,"compiler_errors":0,"compiler_crashes":0,"compiler_fails":3,"both_fail":35,"interpreter_fail_compiler_pass":0,"elapsed_ms":14109},"status":"keep","description":"Reject BigInt integer coercions","timestamp":1778670831826,"segment":57,"confidence":3.7142857142857144,"iterationTokens":9248,"asi":{"hypothesis":"Runtime ToInteger-style helpers should reject BigInt rather than silently truncating through Number conversion, fixing String.fromCharCode BigInt abrupt propagation while preserving current bounded workload checks."}}
{"run":1188,"commit":"f7d38a1","metric":38,"metrics":{"compiler_test262_cases":350,"compiler_test262_pass":312,"compiler_test262_failures":38,"compiler_test262_compiler_errors":0,"compiler_test262_compiler_crashes":0,"compiler_test262_compiler_fails":3,"compiler_test262_both_fail":33,"compiler_test262_interpreter_fail_compiler_pass":0,"compatibility_pass":312,"compatibility_cases":350,"compiler_errors":0,"compiler_crashes":0,"compiler_fails":3,"both_fail":33,"interpreter_fail_compiler_pass":0,"elapsed_ms":13907},"status":"keep","description":"Default string character positions to zero","timestamp":1778671030661,"segment":57,"confidence":5,"iterationTokens":2054,"asi":{"hypothesis":"String.prototype.charAt and charCodeAt with no position argument should behave as if position were 0 rather than returning an empty string or NaN."}}
{"run":1189,"commit":"d220625","metric":37,"metrics":{"compiler_test262_cases":350,"compiler_test262_pass":313,"compiler_test262_failures":37,"compiler_test262_compiler_errors":0,"compiler_test262_compiler_crashes":0,"compiler_test262_compiler_fails":3,"compiler_test262_both_fail":32,"compiler_test262_interpreter_fail_compiler_pass":0,"compatibility_pass":313,"compatibility_cases":350,"compiler_errors":0,"compiler_crashes":0,"compiler_fails":3,"both_fail":32,"interpreter_fail_compiler_pass":0,"elapsed_ms":14296},"status":"keep","description":"Clamp String includes positions","timestamp":1778671207415,"segment":57,"confidence":5.333333333333333,"iterationTokens":1495,"asi":{"hypothesis":"String.prototype.includes should clamp the position with ToIntegerOrInfinity semantics so +Infinity starts at the string length and cannot find a non-empty search string."}}
{"run":1190,"commit":"cafaf70","metric":36,"metrics":{"compiler_test262_cases":350,"compiler_test262_pass":314,"compiler_test262_failures":36,"compiler_test262_compiler_errors":0,"compiler_test262_compiler_crashes":0,"compiler_test262_compiler_fails":3,"compiler_test262_both_fail":31,"compiler_test262_interpreter_fail_compiler_pass":0,"compatibility_pass":314,"compatibility_cases":350,"compiler_errors":0,"compiler_crashes":0,"compiler_fails":3,"both_fail":31,"interpreter_fail_compiler_pass":0,"elapsed_ms":13997},"status":"keep","description":"Preserve virtual string descriptors","timestamp":1778671499466,"segment":57,"confidence":5.666666666666667,"iterationTokens":12579,"asi":{"hypothesis":"String exotic virtual length and indexed properties are non-writable/non-configurable; ordinary assignment and delete paths must preserve those virtual descriptors instead of creating mutable own properties or reporting successful deletion."}}
