{"run":932,"commit":"7c6c8e0","metric":19,"metrics":{"compiler_test262_cases":204,"compiler_test262_pass":185,"compiler_test262_failures":19,"compiler_test262_compiler_errors":0,"compiler_test262_compiler_crashes":0,"compiler_test262_compiler_fails":0,"compiler_test262_both_fail":19,"compiler_test262_interpreter_fail_compiler_pass":0,"compatibility_pass":185,"compatibility_cases":204,"compiler_errors":0,"compiler_crashes":0,"compiler_fails":0,"both_fail":19,"interpreter_fail_compiler_pass":0,"elapsed_ms":10083},"status":"keep","description":"Consume iterables in Array.from and Map.groupBy","timestamp":1778525061780,"segment":41,"confidence":8,"iterationTokens":3832,"asi":{"hypothesis":"Array.from and Map.groupBy should consume the iterable protocol instead of treating iterator objects as array-like maps with no length","improvement":"Reduced Map failures from 24 to 19 (−5) by collecting iterator results for Array.from and by making Map.groupBy use GetIterator semantics including string iteration and TypeError for nullish Symbol.iterator","next_action_hint":"Remaining Map: constructor iterator protocol/iterator-close, prototype inheritance/realm, entries/keys/values length metadata, Symbol.species descriptor mutation, live iterator preservation across delete/clear."}}
{"run":933,"commit":"655252f","metric":15,"metrics":{"compiler_test262_cases":204,"compiler_test262_pass":189,"compiler_test262_failures":15,"compiler_test262_compiler_errors":0,"compiler_test262_compiler_crashes":0,"compiler_test262_compiler_fails":0,"compiler_test262_both_fail":15,"compiler_test262_interpreter_fail_compiler_pass":0,"compatibility_pass":189,"compatibility_cases":204,"compiler_errors":0,"compiler_crashes":0,"compiler_fails":0,"both_fail":15,"interpreter_fail_compiler_pass":0,"elapsed_ms":9706},"status":"keep","description":"Consume iterables in Map constructor","timestamp":1778525770703,"segment":41,"confidence":8.363636363636363,"iterationTokens":10633,"asi":{"hypothesis":"Map constructor should initialize from the iterable protocol and reject malformed iterator records/entries instead of silently treating ordinary objects as empty maps","improvement":"Reduced Map failures from 19 to 15 (−4) by making new Map(iterable) walk iterators, reject nullish/non-callable Symbol.iterator, reject non-object iterator results and entries, and close iterators on entry errors","caveat":"Calling a mutated Map.prototype.set during construction is still not kept because the current global prototype cache leaks the overwritten setter across sequential interpreter/compiler same-BEAM runs and can hang the combined focused harness; constructor currently uses the type-specialized set path to preserve benchmark/check stability.","next_action_hint":"Remaining Map: mutable prototype adder semantics need per-runtime prototype isolation or safe current-realm lookup; prototype inheritance/realm, entries/keys/values length metadata, Symbol.species descriptor mutation, live iterator delete/clear."}}
{"run":934,"commit":"bf3de9a","metric":12,"metrics":{"compiler_test262_cases":204,"compiler_test262_pass":192,"compiler_test262_failures":12,"compiler_test262_compiler_errors":0,"compiler_test262_compiler_crashes":0,"compiler_test262_compiler_fails":0,"compiler_test262_both_fail":12,"compiler_test262_interpreter_fail_compiler_pass":0,"compatibility_pass":192,"compatibility_cases":204,"compiler_errors":0,"compiler_crashes":0,"compiler_fails":0,"both_fail":12,"interpreter_fail_compiler_pass":0,"elapsed_ms":10212},"status":"keep","description":"Describe Map iterator method lengths","timestamp":1778526138794,"segment":41,"confidence":8.636363636363637,"iterationTokens":25482,"asi":{"hypothesis":"Map.prototype keys/values/entries functions need own non-writable length descriptors with value 0, and builtin direct length lookup should respect explicit static metadata before name-based defaults","improvement":"Reduced Map failures from 15 to 12 (−3) by attaching length statics/descriptors to Map iterator prototype methods and honoring builtin-specific length statics in Get.get","next_action_hint":"Remaining Map: mutable prototype adder and iterator-close failures, Map.prototype/Object.prototype inheritance/realm, constructor prototype descriptor, Symbol.species descriptor mutation, live iterator delete/clear behavior."}}
{"run":935,"commit":"e43549c","metric":11,"metrics":{"compiler_test262_cases":204,"compiler_test262_pass":193,"compiler_test262_failures":11,"compiler_test262_compiler_errors":0,"compiler_test262_compiler_crashes":0,"compiler_test262_compiler_fails":0,"compiler_test262_both_fail":11,"compiler_test262_interpreter_fail_compiler_pass":0,"compatibility_pass":193,"compatibility_cases":204,"compiler_errors":0,"compiler_crashes":0,"compiler_fails":0,"both_fail":11,"interpreter_fail_compiler_pass":0,"elapsed_ms":9594},"status":"keep","description":"Describe Map constructor prototype","timestamp":1778526318851,"segment":41,"confidence":8.347826086956522,"iterationTokens":1866,"asi":{"hypothesis":"The Map constructor's prototype property should be a non-writable, non-enumerable, non-configurable own data property","improvement":"Reduced Map failures from 12 to 11 (−1) by attaching the correct descriptor metadata to Map.prototype on the constructor","next_action_hint":"Remaining Map: Map.prototype inheritance/realm, mutable prototype adder/iterator close, Symbol.species descriptor mutation, live iterator delete/clear behavior."}}
{"run":936,"commit":"e71314a","metric":8,"metrics":{"compiler_test262_cases":204,"compiler_test262_pass":196,"compiler_test262_failures":8,"compiler_test262_compiler_errors":0,"compiler_test262_compiler_crashes":0,"compiler_test262_compiler_fails":0,"compiler_test262_both_fail":8,"compiler_test262_interpreter_fail_compiler_pass":0,"compatibility_pass":196,"compatibility_cases":204,"compiler_errors":0,"compiler_crashes":0,"compiler_fails":0,"both_fail":8,"interpreter_fail_compiler_pass":0,"elapsed_ms":9040},"status":"keep","description":"Preserve Map iterator traversal across mutations","timestamp":1778526673277,"segment":41,"confidence":8.25,"iterationTokens":8575,"asi":{"hypothesis":"Map iterators and forEach should traverse live MapData rather than a fully materialized snapshot so deletes, clears, and delete/re-add mutations do not expose stale entries or skip new entries","improvement":"Reduced Map failures from 11 to 8 (−3) by replacing Map keys/values/entries snapshots with pending-key iterators that skip deleted entries and by improving forEach pending-key traversal for delete/re-add cases","next_action_hint":"Remaining Map: mutable prototype adder/iterator-close behavior, Map.prototype inheritance/realm, Symbol.species descriptor mutation, undefined new.target/constructor call semantics."}}
{"run":937,"commit":"633e5f1","metric":7,"metrics":{"compiler_test262_cases":204,"compiler_test262_pass":197,"compiler_test262_failures":7,"compiler_test262_compiler_errors":0,"compiler_test262_compiler_crashes":0,"compiler_test262_compiler_fails":0,"compiler_test262_both_fail":7,"compiler_test262_interpreter_fail_compiler_pass":0,"compatibility_pass":197,"compatibility_cases":204,"compiler_errors":0,"compiler_crashes":0,"compiler_fails":0,"both_fail":7,"interpreter_fail_compiler_pass":0,"elapsed_ms":9488},"status":"keep","description":"Validate Map constructor set adder","timestamp":1778526881860,"segment":41,"confidence":10,"iterationTokens":4351,"asi":{"hypothesis":"Map constructor should reject iterable construction if the current Map.prototype.set value is not callable","improvement":"Reduced Map failures from 8 to 7 (−1) by checking the mutable Map.prototype.set adder for callability before using the stable type-specialized set path","caveat":"Callable overridden adders are still not invoked because doing so leaks overwritten prototype functions across sequential interpreter/compiler same-BEAM focused runs and can hang; only the non-callable validation is kept.","next_action_hint":"Remaining Map: callable overridden adder/iterator-close behavior needs runtime/prototype isolation, Map.prototype inheritance/realm, Symbol.species descriptor mutation, undefined new.target/constructor call semantics."}}
{"type":"config","name":"QuickBEAM built-ins/Array compatibility reprise after iterable fixes","metricName":"compatibility_failures","metricUnit":"","bestDirection":"lower"}
{"run":938,"commit":"cbdb4cc","metric":253,"metrics":{"compiler_test262_cases":500,"compiler_test262_pass":247,"compiler_test262_failures":253,"compiler_test262_compiler_errors":0,"compiler_test262_compiler_crashes":0,"compiler_test262_compiler_fails":6,"compiler_test262_both_fail":237,"compiler_test262_interpreter_fail_compiler_pass":0,"compatibility_pass":247,"compatibility_cases":500,"compiler_errors":0,"compiler_crashes":0,"compiler_fails":6,"both_fail":237,"interpreter_fail_compiler_pass":0,"elapsed_ms":51243},"status":"keep","description":"Rebaseline built-ins/Array after iterable fixes","timestamp":1778527070963,"segment":42,"confidence":null,"iterationTokens":130,"asi":{"hypothesis":"Array.from iterable support from the Map work may improve the bounded built-ins/Array workload and provides a new baseline for Array-specific follow-up","improvement":"Rebaseline built-ins/Array at 253/500 failures, improved from prior remembered 259/500 after iterable work","next_action_hint":"Cluster remaining Array failures; likely opportunities include Array.from iterator closing/species, constructor/prototype metadata, and iterator/length semantics."}}
{"run":939,"commit":"a715374","metric":247,"metrics":{"compiler_test262_cases":500,"compiler_test262_pass":253,"compiler_test262_failures":247,"compiler_test262_compiler_errors":0,"compiler_test262_compiler_crashes":0,"compiler_test262_compiler_fails":6,"compiler_test262_both_fail":231,"compiler_test262_interpreter_fail_compiler_pass":0,"compatibility_pass":253,"compatibility_cases":500,"compiler_errors":0,"compiler_crashes":0,"compiler_fails":6,"both_fail":231,"interpreter_fail_compiler_pass":0,"elapsed_ms":51387},"status":"keep","description":"Register Array metadata and species","timestamp":1778527376063,"segment":42,"confidence":null,"iterationTokens":6416,"asi":{"hypothesis":"Array constructor should expose module-backed static methods, constructor length metadata, prototype descriptor metadata, and Array[Symbol.species] accessor like other built-in constructors","improvement":"Reduced Array failures from 253 to 247 (−6) by registering the Array runtime module, adding constructor length/prototype descriptors, and installing Array[Symbol.species]","caveat":"Descriptor tests remain compiler-failing when propertyHelper mutates configurable constructor statics in the interpreter pass before the compiler pass in the same BEAM process; do not make descriptors non-configurable to game this.","next_action_hint":"Continue Array: from/fromAsync/of constructor/species behavior, concat spreadability, array length define semantics. Beware same-process destructive descriptor tests."}}
{"run":940,"commit":"a715374","metric":0,"metrics":{"compiler_test262_cases":0,"compiler_test262_pass":0,"compiler_test262_failures":0,"compiler_test262_compiler_errors":0,"compiler_test262_compiler_crashes":0,"compiler_test262_compiler_fails":0,"compiler_test262_both_fail":0,"compiler_test262_interpreter_fail_compiler_pass":0,"compatibility_pass":0,"compatibility_cases":0,"compiler_errors":0,"compiler_crashes":0,"compiler_fails":0,"both_fail":0,"interpreter_fail_compiler_pass":0,"elapsed_ms":810600},"status":"crash","description":"Spec-like concat spreadability and Array prototype constructor","timestamp":1778528309595,"segment":42,"confidence":null,"iterationTokens":12476,"asi":{"hypothesis":"Array.prototype.concat should use IsConcatSpreadable and Array.prototype should expose constructor so concat results inherit Array constructor","rollback_reason":"Broad Array workload timed out after ~810s, likely due newly exercising expensive concat edge cases such as arg-length-exceeding-integer-limit or spreadable object length handling; changes auto-reverted","next_action_hint":"Retry split: first keep Array.prototype.constructor alone; then make concat spreadability length-capped/ToLength-safe with focused timeout probes before broad run."}}
{"run":941,"commit":"a715374","metric":247,"metrics":{"compiler_test262_cases":500,"compiler_test262_pass":253,"compiler_test262_failures":247,"compiler_test262_compiler_errors":0,"compiler_test262_compiler_crashes":0,"compiler_test262_compiler_fails":6,"compiler_test262_both_fail":231,"compiler_test262_interpreter_fail_compiler_pass":0,"compatibility_pass":253,"compatibility_cases":500,"compiler_errors":0,"compiler_crashes":0,"compiler_fails":6,"both_fail":231,"interpreter_fail_compiler_pass":0,"elapsed_ms":50816},"status":"discard","description":"Add Array prototype constructor","timestamp":1778528528208,"segment":42,"confidence":null,"iterationTokens":2343,"asi":{"hypothesis":"Array.prototype should expose a constructor property pointing back to Array and may fix constructor identity checks without concat changes","rollback_reason":"Array workload stayed flat at 247 failures; focused concat constructor identity became less relevant because remaining failure is concat flattening semantics","next_action_hint":"Implement concat spreadability safely without iterating enormous lengths; avoid the timed-out broad concat variant."}}
{"run":942,"commit":"0825668","metric":238,"metrics":{"compiler_test262_cases":500,"compiler_test262_pass":262,"compiler_test262_failures":238,"compiler_test262_compiler_errors":0,"compiler_test262_compiler_crashes":0,"compiler_test262_compiler_fails":6,"compiler_test262_both_fail":222,"compiler_test262_interpreter_fail_compiler_pass":0,"compatibility_pass":262,"compatibility_cases":500,"compiler_errors":0,"compiler_crashes":0,"compiler_fails":6,"both_fail":222,"interpreter_fail_compiler_pass":0,"elapsed_ms":45905},"status":"keep","description":"Honor concat spreadability without huge iteration","timestamp":1778528760541,"segment":42,"confidence":5,"iterationTokens":5685,"asi":{"hypothesis":"Array.prototype.concat should use IsConcatSpreadable and reject result lengths beyond MAX_SAFE_INTEGER before materializing elements","improvement":"Reduced Array failures from 247 to 238 (−9) by spreading only arrays or values with truthy Symbol.isConcatSpreadable and by checking length overflow before iterating huge array-like objects","lessons":"Previous broad concat attempt timed out because it used Heap.to_list on huge spreadable array-like lengths; this version reads length first and throws before materialization.","next_action_hint":"Remaining concat failures include Array result constructor/prototype/species and string wrapper code-unit behavior; Array.prototype.constructor alone stayed flat but may combine with concat result fixes."}}
{"run":943,"commit":"40ff9a1","metric":237,"metrics":{"compiler_test262_cases":500,"compiler_test262_pass":263,"compiler_test262_failures":237,"compiler_test262_compiler_errors":0,"compiler_test262_compiler_crashes":0,"compiler_test262_compiler_fails":6,"compiler_test262_both_fail":221,"compiler_test262_interpreter_fail_compiler_pass":0,"compatibility_pass":263,"compatibility_cases":500,"compiler_errors":0,"compiler_crashes":0,"compiler_fails":6,"both_fail":221,"interpreter_fail_compiler_pass":0,"elapsed_ms":45584},"status":"keep","description":"Link Array prototype constructor","timestamp":1778528946273,"segment":42,"confidence":2.6666666666666665,"iterationTokens":1860,"asi":{"hypothesis":"With concat returning proper Array objects, Array.prototype.constructor should point to the Array constructor to satisfy result.constructor identity checks","improvement":"Reduced Array failures from 238 to 237 (−1) by installing Array.prototype.constructor with standard descriptor metadata","lessons":"The same change stayed flat before concat spreadability was fixed; it becomes useful once concat result semantics get closer to arrays.","next_action_hint":"Remaining concat failures include species/custom constructor behavior and string wrapper code-unit spreading; other clusters include Array.from constructor/species and length define semantics."}}
{"run":944,"commit":"d30dfac","metric":231,"metrics":{"compiler_test262_cases":500,"compiler_test262_pass":269,"compiler_test262_failures":231,"compiler_test262_compiler_errors":0,"compiler_test262_compiler_crashes":0,"compiler_test262_compiler_fails":0,"compiler_test262_both_fail":221,"compiler_test262_interpreter_fail_compiler_pass":0,"compatibility_pass":269,"compatibility_cases":500,"compiler_errors":0,"compiler_crashes":0,"compiler_fails":0,"both_fail":221,"interpreter_fail_compiler_pass":0,"elapsed_ms":45884},"status":"keep","description":"Read Array.from array-likes dynamically","timestamp":1778529220788,"segment":42,"confidence":4.4,"iterationTokens":7540,"asi":{"hypothesis":"Array.from should handle non-iterable array-like objects by snapshotting length and reading indexed properties through [[Get]] instead of Heap.to_list on raw maps/shapes","improvement":"Reduced Array failures from 237 to 231 (−6) and eliminated the six compiler-only failures by adding array-like length/index Get handling for Array.from","limitations":"Element delete/update-after cases still fail because deleting properties from shaped object literals does not make subsequent Get return undefined for that shape slot; this is a broader delete/shape tombstone issue.","next_action_hint":"Investigate shaped-object delete tombstones for Array.from mutation cases; other Array clusters include Array.of/custom constructors, length define semantics, concat species/string wrapper behavior."}}
{"run":945,"commit":"d30dfac","metric":232,"metrics":{"compiler_test262_cases":500,"compiler_test262_pass":268,"compiler_test262_failures":232,"compiler_test262_compiler_errors":0,"compiler_test262_compiler_crashes":0,"compiler_test262_compiler_fails":0,"compiler_test262_both_fail":222,"compiler_test262_interpreter_fail_compiler_pass":0,"compatibility_pass":268,"compatibility_cases":500,"compiler_errors":0,"compiler_crashes":0,"compiler_fails":0,"both_fail":222,"interpreter_fail_compiler_pass":0,"elapsed_ms":45044},"status":"discard","description":"Construct Array.of with custom this","timestamp":1778529518835,"segment":42,"confidence":3.142857142857143,"iterationTokens":7268,"asi":{"hypothesis":"Array.of should construct with the this value when it is a constructor and populate indexed properties/length","rollback_reason":"Focused Array.of constructor cases improved, but broad Array workload regressed from 231 to 232, likely due swallowing TypeError from constructors or length/data-property abrupt paths","next_action_hint":"Retry Array.of only after distinguishing non-constructors from constructors that throw, and after respecting failed Put/DefineProperty results for non-writable properties."}}
{"run":946,"commit":"8a02c1d","metric":229,"metrics":{"compiler_test262_cases":500,"compiler_test262_pass":271,"compiler_test262_failures":229,"compiler_test262_compiler_errors":0,"compiler_test262_compiler_crashes":0,"compiler_test262_compiler_fails":0,"compiler_test262_both_fail":219,"compiler_test262_interpreter_fail_compiler_pass":0,"compatibility_pass":271,"compatibility_cases":500,"compiler_errors":0,"compiler_crashes":0,"compiler_fails":0,"both_fail":219,"interpreter_fail_compiler_pass":0,"elapsed_ms":45178},"status":"keep","description":"Refine Array.isArray for prototypes and arguments","timestamp":1778529792063,"segment":42,"confidence":3.2,"iterationTokens":5032,"asi":{"hypothesis":"Array.isArray should return true for the cached Array.prototype object and false for arguments objects regardless of their underlying list storage","improvement":"Reduced Array failures from 231 to 229 (−2) by recognizing the cached Array.prototype object as an array and checking the arguments marker before list storage","next_action_hint":"Remaining Array clusters: Array.from mutation/delete shape tombstones, Array.of/custom constructors, length define semantics, concat species/string wrapper behavior, proxy revoked handling."}}
{"run":947,"commit":"4a9ab38","metric":227,"metrics":{"compiler_test262_cases":500,"compiler_test262_pass":273,"compiler_test262_failures":227,"compiler_test262_compiler_errors":0,"compiler_test262_compiler_crashes":0,"compiler_test262_compiler_fails":0,"compiler_test262_both_fail":217,"compiler_test262_interpreter_fail_compiler_pass":0,"compatibility_pass":273,"compatibility_cases":500,"compiler_errors":0,"compiler_crashes":0,"compiler_fails":0,"both_fail":217,"interpreter_fail_compiler_pass":0,"elapsed_ms":45007},"status":"keep","description":"Alias Array iterator to values","timestamp":1778530012268,"segment":42,"confidence":3.25,"iterationTokens":3133,"asi":{"hypothesis":"Array.prototype[Symbol.iterator] should initially be the same builtin function object as Array.prototype.values and inherit the same non-constructable metadata","improvement":"Reduced Array failures from 229 to 227 (−2) by storing the values method as the Symbol.iterator property on Array.prototype","caveat":"The descriptor test still fails in the compiler pass after propertyHelper mutates/deletes the symbol during the interpreter pass in the same BEAM process, but identity and constructability cases now pass before mutation.","next_action_hint":"Remaining Array: same-process descriptor mutation leakage, Array.from delete/update shape tombstones, Array.of precise constructor/Put semantics, length define semantics, concat species/string wrapper behavior."}}
