{"run":1132,"commit":"0000000","metric":13,"metrics":{"compiler_test262_cases":509,"compiler_test262_pass":496,"compiler_test262_failures":13,"compiler_test262_compiler_errors":0,"compiler_test262_compiler_crashes":0,"compiler_test262_compiler_fails":0,"compiler_test262_both_fail":12,"compiler_test262_interpreter_fail_compiler_pass":1,"compatibility_pass":496,"compatibility_cases":509,"compiler_errors":0,"compiler_crashes":0,"compiler_fails":0,"both_fail":12,"interpreter_fail_compiler_pass":1,"elapsed_ms":25638},"status":"discard","description":"Try Trace-backed Function caller lookup","timestamp":1778647142276,"segment":54,"confidence":3.7083333333333335,"iterationTokens":14148,"asi":{"hypothesis":"A narrow own-function caller lookup backed by existing interpreter trace frames might fix some strict caller Sputnik cases without installing broad Function.prototype throwing accessors.","rollback_reason":"Broad Function workload regressed from current 12 to 13 and introduced an interpreter/compiler split; focused apply-based Sputnik cases still failed, so the trace coverage is incomplete and not worth keeping.","next_action_hint":"Do not retry simple Trace-backed own caller lookup unchanged. If revisiting Annex B caller, first trace Function.prototype.call/apply dispatch frames or implement a coherent call stack across Invocation and compiler runner."}}
{"run":1133,"commit":"0000000","metric":12,"metrics":{"compiler_test262_cases":509,"compiler_test262_pass":497,"compiler_test262_failures":12,"compiler_test262_compiler_errors":0,"compiler_test262_compiler_crashes":0,"compiler_test262_compiler_fails":0,"compiler_test262_both_fail":12,"compiler_test262_interpreter_fail_compiler_pass":0,"compatibility_pass":497,"compatibility_cases":509,"compiler_errors":0,"compiler_crashes":0,"compiler_fails":0,"both_fail":12,"interpreter_fail_compiler_pass":0,"elapsed_ms":25856},"status":"discard","description":"Wire realm Function dynamic construction","timestamp":1778647990498,"segment":54,"confidence":3.56,"iterationTokens":47142,"asi":{"hypothesis":"Creating realm dynamic functions through the normal Function constructor while tagging their realm intrinsics, using newTarget realm Function.prototype fallback, and syncing user global writes back to realm globalThis should fix proto-from-ctor-realm-prototype.js.","rollback_reason":"Focused proto-from-ctor-realm-prototype passed in both paths, but the broad Function workload stayed at 12 failures, so the primary metric did not improve and the implementation is too broad to keep without net benefit.","next_action_hint":"If revisiting realm dynamic Function, inspect the new failure that replaced proto-from-ctor-realm-prototype and keep only if it produces a net primary reduction or if the broad workload is intentionally reweighted."}}
{"type":"config","name":"QuickBEAM Date Test262 compatibility rebaseline","metricName":"compatibility_failures","metricUnit":"","bestDirection":"lower"}
{"run":1134,"commit":"8739a7a","metric":52,"metrics":{"compiler_test262_cases":594,"compiler_test262_pass":542,"compiler_test262_failures":52,"compiler_test262_compiler_errors":0,"compiler_test262_compiler_crashes":0,"compiler_test262_compiler_fails":0,"compiler_test262_both_fail":49,"compiler_test262_interpreter_fail_compiler_pass":0,"compatibility_pass":542,"compatibility_cases":594,"compiler_errors":0,"compiler_crashes":0,"compiler_fails":0,"both_fail":49,"interpreter_fail_compiler_pass":0,"elapsed_ms":26345},"status":"keep","description":"Rebaseline Date workload after Function work","timestamp":1778648190423,"segment":55,"confidence":null,"iterationTokens":120,"asi":{"hypothesis":"Rebaseline built-ins/Date after recent global/realm/function fixes to choose the next optimization target using current compatibility data.","learned":"Date bounded workload is now 52/594, improved from the older 58 snapshot without additional Date-specific edits; remaining failures are mostly shared runtime gaps with no compiler-only failures.","checks":"Backpressure checks passed."}}
{"run":1135,"commit":"666a2ef","metric":51,"metrics":{"compiler_test262_cases":594,"compiler_test262_pass":543,"compiler_test262_failures":51,"compiler_test262_compiler_errors":0,"compiler_test262_compiler_crashes":0,"compiler_test262_compiler_fails":0,"compiler_test262_both_fail":48,"compiler_test262_interpreter_fail_compiler_pass":0,"compatibility_pass":543,"compatibility_cases":594,"compiler_errors":0,"compiler_crashes":0,"compiler_fails":0,"both_fail":48,"interpreter_fail_compiler_pass":0,"elapsed_ms":25240},"status":"keep","description":"Describe Date toPrimitive length","timestamp":1778648744924,"segment":55,"confidence":null,"iterationTokens":33253,"asi":{"hypothesis":"The manually installed Date.prototype[Symbol.toPrimitive] builtin needs callable length descriptor metadata so propertyHelper sees length 1, non-writable, non-enumerable, configurable.","focused_cases":["built-ins/Date/prototype/Symbol.toPrimitive/length.js"],"focused_result":"Focused length descriptor case passes in interpreter; compiler/vm core checks pass.","checks":"Backpressure checks passed."}}
{"run":1136,"commit":"651870d","metric":49,"metrics":{"compiler_test262_cases":594,"compiler_test262_pass":545,"compiler_test262_failures":49,"compiler_test262_compiler_errors":0,"compiler_test262_compiler_crashes":0,"compiler_test262_compiler_fails":0,"compiler_test262_both_fail":46,"compiler_test262_interpreter_fail_compiler_pass":0,"compatibility_pass":545,"compatibility_cases":594,"compiler_errors":0,"compiler_crashes":0,"compiler_fails":0,"both_fail":46,"interpreter_fail_compiler_pass":0,"elapsed_ms":25232},"status":"keep","description":"Describe Date prototype descriptors","timestamp":1778648922744,"segment":55,"confidence":3,"iterationTokens":1882,"asi":{"hypothesis":"Date constructor prototype and Date.prototype.constructor descriptors are installed as data properties but lacked spec descriptor flags; adding descriptor metadata should fix Date prop-desc tests without changing semantics.","focused_cases":["built-ins/Date/prototype/constructor/prop-desc.js","built-ins/Date/prototype/prop-desc.js"],"focused_result":"Both focused descriptor cases pass in interpreter; compiler/vm core checks pass.","checks":"Backpressure checks passed."}}
{"run":1137,"commit":"c9455f5","metric":48,"metrics":{"compiler_test262_cases":594,"compiler_test262_pass":546,"compiler_test262_failures":48,"compiler_test262_compiler_errors":0,"compiler_test262_compiler_crashes":0,"compiler_test262_compiler_fails":0,"compiler_test262_both_fail":46,"compiler_test262_interpreter_fail_compiler_pass":0,"compatibility_pass":546,"compatibility_cases":594,"compiler_errors":0,"compiler_crashes":0,"compiler_fails":0,"both_fail":46,"interpreter_fail_compiler_pass":0,"elapsed_ms":25254},"status":"keep","description":"Handle empty Date setTime arguments","timestamp":1778649101233,"segment":55,"confidence":2.6666666666666665,"iterationTokens":1842,"asi":{"hypothesis":"Date.prototype.setTime should treat a missing argument as undefined and ToNumber(undefined) => NaN rather than crashing on hd([]).","focused_cases":["built-ins/Date/prototype/setTime/arg-to-number.js"],"focused_result":"Focused setTime argument coercion case passes; compiler/vm core checks pass.","checks":"Backpressure checks passed."}}
{"run":1138,"commit":"8e8bf82","metric":40,"metrics":{"compiler_test262_cases":594,"compiler_test262_pass":554,"compiler_test262_failures":40,"compiler_test262_compiler_errors":0,"compiler_test262_compiler_crashes":0,"compiler_test262_compiler_fails":0,"compiler_test262_both_fail":38,"compiler_test262_interpreter_fail_compiler_pass":0,"compatibility_pass":554,"compatibility_cases":594,"compiler_errors":0,"compiler_crashes":0,"compiler_fails":0,"both_fail":38,"interpreter_fail_compiler_pass":0,"elapsed_ms":25236},"status":"keep","description":"Coerce missing Date setter arguments","timestamp":1778649370972,"segment":55,"confidence":6,"iterationTokens":19836,"asi":{"hypothesis":"Date setters with required first arguments should treat a missing argument as undefined, coerce to NaN, and store NaN instead of preserving the previous field value.","focused_cases":["built-ins/Date/prototype/setDate/arg-to-number.js","built-ins/Date/prototype/setHours/arg-hour-to-number.js","built-ins/Date/prototype/setMilliseconds/arg-to-number.js","built-ins/Date/prototype/setMinutes/arg-min-to-number.js","built-ins/Date/prototype/setSeconds/arg-sec-to-number.js"],"focused_result":"Missing-argument setter cases pass except setFullYear still has a separate BCE/year-zero semantics issue for null; compiler/vm core checks pass.","checks":"Backpressure checks passed."}}
{"run":1139,"commit":"075db83","metric":38,"metrics":{"compiler_test262_cases":594,"compiler_test262_pass":556,"compiler_test262_failures":38,"compiler_test262_compiler_errors":0,"compiler_test262_compiler_crashes":0,"compiler_test262_compiler_fails":0,"compiler_test262_both_fail":38,"compiler_test262_interpreter_fail_compiler_pass":0,"compatibility_pass":556,"compatibility_cases":594,"compiler_errors":0,"compiler_crashes":0,"compiler_fails":0,"both_fail":38,"interpreter_fail_compiler_pass":0,"elapsed_ms":25259},"status":"keep","description":"Return NaN for non-finite Date components","timestamp":1778649590502,"segment":55,"confidence":4.666666666666667,"iterationTokens":10539,"asi":{"hypothesis":"Date.UTC component extraction should return NaN when any provided component coerces to ±Infinity instead of trying to truncate or do arithmetic on infinities.","focused_cases":["built-ins/Date/UTC/infinity-make-day.js","built-ins/Date/UTC/infinity-make-time.js"],"focused_result":"Focused non-finite Date.UTC cases pass in interpreter; compiler/vm core checks pass.","checks":"Backpressure checks passed."}}
{"run":1140,"commit":"dbded62","metric":37,"metrics":{"compiler_test262_cases":594,"compiler_test262_pass":557,"compiler_test262_failures":37,"compiler_test262_compiler_errors":0,"compiler_test262_compiler_crashes":0,"compiler_test262_compiler_fails":0,"compiler_test262_both_fail":37,"compiler_test262_interpreter_fail_compiler_pass":0,"compatibility_pass":557,"compatibility_cases":594,"compiler_errors":0,"compiler_crashes":0,"compiler_fails":0,"both_fail":37,"interpreter_fail_compiler_pass":0,"elapsed_ms":25271},"status":"keep","description":"Use number hint for Date toJSON","timestamp":1778649825012,"segment":55,"confidence":3.75,"iterationTokens":4609,"asi":{"hypothesis":"Date.prototype.toJSON must call ToPrimitive with number hint, making Symbol.toPrimitive observable with 'number' instead of 'default'.","focused_cases":["built-ins/Date/prototype/toJSON/to-primitive-symbol.js"],"focused_result":"Focused Symbol.toPrimitive hint case passes; abrupt case remains a separate propagation issue; compiler/vm core checks pass.","checks":"Backpressure checks passed."}}
{"run":1141,"commit":"dd67f9c","metric":36,"metrics":{"compiler_test262_cases":594,"compiler_test262_pass":558,"compiler_test262_failures":36,"compiler_test262_compiler_errors":0,"compiler_test262_compiler_crashes":0,"compiler_test262_compiler_fails":0,"compiler_test262_both_fail":36,"compiler_test262_interpreter_fail_compiler_pass":0,"compatibility_pass":558,"compatibility_cases":594,"compiler_errors":0,"compiler_crashes":0,"compiler_fails":0,"both_fail":36,"interpreter_fail_compiler_pass":0,"elapsed_ms":25054},"status":"keep","description":"Use Get in ordinary ToPrimitive","timestamp":1778650087234,"segment":55,"confidence":2.4615384615384617,"iterationTokens":5854,"asi":{"hypothesis":"OrdinaryToPrimitive should retrieve valueOf/toString through ordinary Get so accessor throws propagate instead of being skipped by raw map lookup.","focused_cases":["built-ins/Date/prototype/toJSON/to-primitive-abrupt.js"],"focused_result":"Focused abrupt ToPrimitive case passes; compiler/vm core checks pass.","checks":"Backpressure checks passed."}}
{"run":1142,"commit":"0000000","metric":36,"metrics":{"compiler_test262_cases":594,"compiler_test262_pass":558,"compiler_test262_failures":36,"compiler_test262_compiler_errors":0,"compiler_test262_compiler_crashes":0,"compiler_test262_compiler_fails":0,"compiler_test262_both_fail":36,"compiler_test262_interpreter_fail_compiler_pass":0,"compatibility_pass":558,"compatibility_cases":594,"compiler_errors":0,"compiler_crashes":0,"compiler_fails":0,"both_fail":36,"interpreter_fail_compiler_pass":0,"elapsed_ms":25627},"status":"discard","description":"Use civil day math in Date makeDate","timestamp":1778650274042,"segment":55,"confidence":4,"iterationTokens":2606,"asi":{"hypothesis":"Replacing Date.new!/Date.add in MakeDate with the existing proleptic Gregorian make_day helper might fix BCE setFullYear/year-zero cases without touching formatting.","rollback_reason":"Primary metric stayed flat at 36 and the focused setFullYear null/year-zero case still failed with the same one-day offset.","next_action_hint":"Do not retry make_date civil-day replacement unchanged; investigate MakeDay algorithm for year 0/BCE offset or ms_to_dt/constructor comparison path before another setFullYear attempt."}}
{"run":1143,"commit":"ec1e40e","metric":35,"metrics":{"compiler_test262_cases":594,"compiler_test262_pass":559,"compiler_test262_failures":35,"compiler_test262_compiler_errors":0,"compiler_test262_compiler_crashes":0,"compiler_test262_compiler_fails":0,"compiler_test262_both_fail":35,"compiler_test262_interpreter_fail_compiler_pass":0,"compatibility_pass":559,"compatibility_cases":594,"compiler_errors":0,"compiler_crashes":0,"compiler_fails":0,"both_fail":35,"interpreter_fail_compiler_pass":0,"elapsed_ms":25290},"status":"keep","description":"Add Symbol prototype fallback","timestamp":1778650816606,"segment":55,"confidence":4.857142857142857,"iterationTokens":31830,"asi":{"hypothesis":"Primitive Date.prototype.toJSON tests rely on Number.prototype and Symbol.prototype methods being visible through primitive property lookup; registering Symbol.prototype and falling primitive lookups back to their class prototypes should fix primitive toJSON ToObject behavior.","focused_cases":["built-ins/Date/prototype/toJSON/to-object.js"],"focused_result":"Focused Date.prototype.toJSON primitive ToObject case passes; number and symbol primitive prototype probes pass; compiler/vm core checks pass.","checks":"Backpressure checks passed."}}
{"run":1144,"commit":"7bb8512","metric":28,"metrics":{"compiler_test262_cases":594,"compiler_test262_pass":566,"compiler_test262_failures":28,"compiler_test262_compiler_errors":0,"compiler_test262_compiler_crashes":0,"compiler_test262_compiler_fails":0,"compiler_test262_both_fail":28,"compiler_test262_interpreter_fail_compiler_pass":0,"compatibility_pass":566,"compatibility_cases":594,"compiler_errors":0,"compiler_crashes":0,"compiler_fails":0,"both_fail":28,"interpreter_fail_compiler_pass":0,"elapsed_ms":25072},"status":"keep","description":"Let Date prototype overrides shadow virtual methods","timestamp":1778651115722,"segment":55,"confidence":8,"iterationTokens":13238,"asi":{"hypothesis":"Date instances should inherit Date.prototype methods rather than returning virtual Date methods as own properties, so Date.prototype.toString overrides can shadow the default toString implementation.","focused_cases":["built-ins/Date/S15.9.3.1_A3_T1.2.js","built-ins/Date/S15.9.3.2_A3_T1.2.js"],"focused_result":"Focused Date.prototype.toString override cases pass; Object.prototype.toString.call(new Date()) still reports [object Date]; compiler/vm core checks pass.","checks":"Backpressure checks passed."}}
{"run":1145,"commit":"0000000","metric":41,"metrics":{"compiler_test262_cases":594,"compiler_test262_pass":553,"compiler_test262_failures":41,"compiler_test262_compiler_errors":0,"compiler_test262_compiler_crashes":0,"compiler_test262_compiler_fails":0,"compiler_test262_both_fail":41,"compiler_test262_interpreter_fail_compiler_pass":0,"compatibility_pass":553,"compatibility_cases":594,"compiler_errors":0,"compiler_crashes":0,"compiler_fails":0,"both_fail":41,"interpreter_fail_compiler_pass":0,"elapsed_ms":25296},"status":"discard","description":"Apply timezone offset in Date local constructor","timestamp":1778651370032,"segment":55,"confidence":6.857142857142857,"iterationTokens":8890,"asi":{"hypothesis":"Date constructor component form should interpret components as local time and convert to UTC by applying getTimezoneOffset, fixing assertRelativeDateMs and local toISOString cases.","rollback_reason":"Focused local-constructor cases passed, but broad Date regressed from current best 28 to 41, reproducing the earlier timezone-offset regression pattern.","next_action_hint":"Do not retry a broad fixed-current-offset local constructor conversion unchanged; a viable fix needs historical/date-specific local timezone semantics or must narrowly target assertRelativeDateMs without regressing modern constructor/toISOString cases."}}
{"run":1146,"commit":"0ac014f","metric":20,"metrics":{"compiler_test262_cases":594,"compiler_test262_pass":574,"compiler_test262_failures":20,"compiler_test262_compiler_errors":0,"compiler_test262_compiler_crashes":0,"compiler_test262_compiler_fails":0,"compiler_test262_both_fail":20,"compiler_test262_interpreter_fail_compiler_pass":0,"compatibility_pass":574,"compatibility_cases":594,"compiler_errors":0,"compiler_crashes":0,"compiler_fails":0,"both_fail":20,"interpreter_fail_compiler_pass":0,"elapsed_ms":25170},"status":"keep","description":"Implement Date toTemporalInstant","timestamp":1778651728360,"segment":55,"confidence":10.666666666666666,"iterationTokens":8414,"asi":{"hypothesis":"Date.prototype.toTemporalInstant is a standard Date builtin whose current absence accounts for the Temporal feature cluster; a minimal implementation can validate Date receivers, throw RangeError for invalid dates, and return an Instant-like object exposing epochNanoseconds.","focused_cases":["built-ins/Date/prototype/toTemporalInstant/prop-desc.js","built-ins/Date/prototype/toTemporalInstant/length.js","built-ins/Date/prototype/toTemporalInstant/name.js","built-ins/Date/prototype/toTemporalInstant/not-a-constructor.js","built-ins/Date/prototype/toTemporalInstant/this-value-invalid-date.js","built-ins/Date/prototype/toTemporalInstant/this-value-non-date.js","built-ins/Date/prototype/toTemporalInstant/this-value-non-object.js","built-ins/Date/prototype/toTemporalInstant/this-value-valid-date.js"],"focused_result":"All focused toTemporalInstant cases pass in interpreter after explicit Date receiver validation; compiler/vm core checks pass.","checks":"Backpressure checks passed."}}
{"run":1147,"commit":"9a0e672","metric":18,"metrics":{"compiler_test262_cases":594,"compiler_test262_pass":576,"compiler_test262_failures":18,"compiler_test262_compiler_errors":0,"compiler_test262_compiler_crashes":0,"compiler_test262_compiler_fails":0,"compiler_test262_both_fail":18,"compiler_test262_interpreter_fail_compiler_pass":0,"compatibility_pass":576,"compatibility_cases":594,"compiler_errors":0,"compiler_crashes":0,"compiler_fails":0,"both_fail":18,"interpreter_fail_compiler_pass":0,"elapsed_ms":25217},"status":"keep","description":"Parse extended ISO Date years","timestamp":1778652439773,"segment":55,"confidence":5.230769230769231,"iterationTokens":8414,"asi":{"hypothesis":"Date.parse should accept signed six-digit ISO years and toISOString should emit spec signed extended years outside 0..9999; implementing this fixes negative-year parsing/formatting and max range ISO cases.","focused_cases":["built-ins/Date/prototype/toString/negative-year.js","built-ins/Date/prototype/toDateString/negative-year.js","built-ins/Date/prototype/toUTCString/negative-year.js","built-ins/Date/parse/time-value-maximum-range.js"],"focused_result":"Focused negative-year and max range cases pass in interpreter/compiler; compiler/vm core checks and autoresearch backpressure checks pass."}}
{"run":1148,"commit":"a7ebaee","metric":16,"metrics":{"compiler_test262_cases":594,"compiler_test262_pass":578,"compiler_test262_failures":16,"compiler_test262_compiler_errors":0,"compiler_test262_compiler_crashes":0,"compiler_test262_compiler_fails":0,"compiler_test262_both_fail":16,"compiler_test262_interpreter_fail_compiler_pass":0,"compatibility_pass":578,"compatibility_cases":594,"compiler_errors":0,"compiler_crashes":0,"compiler_fails":0,"both_fail":16,"interpreter_fail_compiler_pass":0,"elapsed_ms":25113},"status":"keep","description":"Honor local ISO parse offsets","timestamp":1778652632426,"segment":55,"confidence":4,"iterationTokens":5626,"asi":{"hypothesis":"The new extended ISO parser must preserve existing Date.parse local-time behavior for date-times without explicit offsets and must reject the invalid -000000 extended year form.","focused_cases":["built-ins/Date/parse/without-utc-offset.js","built-ins/Date/parse/year-zero.js"],"focused_result":"Focused parse local-offset and negative-zero year cases pass in interpreter/compiler; compiler/vm core checks and autoresearch backpressure checks pass."}}
