{"run":1032,"commit":"a3053f5","metric":15,"metrics":{"compiler_test262_cases":141,"compiler_test262_pass":126,"compiler_test262_failures":15,"compiler_test262_compiler_errors":0,"compiler_test262_compiler_crashes":0,"compiler_test262_compiler_fails":0,"compiler_test262_both_fail":15,"compiler_test262_interpreter_fail_compiler_pass":0,"compatibility_pass":126,"compatibility_cases":141,"compiler_errors":0,"compiler_crashes":0,"compiler_fails":0,"both_fail":15,"interpreter_fail_compiler_pass":0,"elapsed_ms":5948},"status":"keep","description":"Add WeakMap getOrInsert prototype methods","timestamp":1778607055485,"segment":43,"confidence":3.257142857142857,"iterationTokens":6829,"asi":{"hypothesis":"WeakMap experimental getOrInsert and getOrInsertComputed methods share Map insertion semantics with weak-key validation; materializing them on WeakMap.prototype should eliminate the large not-a-function cluster."}}
{"run":1033,"commit":"78a0b0b","metric":5,"metrics":{"compiler_test262_cases":141,"compiler_test262_pass":136,"compiler_test262_failures":5,"compiler_test262_compiler_errors":0,"compiler_test262_compiler_crashes":0,"compiler_test262_compiler_fails":0,"compiler_test262_both_fail":5,"compiler_test262_interpreter_fail_compiler_pass":0,"compatibility_pass":136,"compatibility_cases":141,"compiler_errors":0,"compiler_crashes":0,"compiler_fails":0,"both_fail":5,"interpreter_fail_compiler_pass":0,"elapsed_ms":6586},"status":"keep","description":"Tighten WeakMap receiver and symbol-key semantics","timestamp":1778607434196,"segment":43,"confidence":3.526315789473684,"iterationTokens":11241,"asi":{"hypothesis":"WeakMap prototype methods must reject non-WeakMap receivers, getOrInsert must handle missing value arguments, and CanBeHeldWeakly should allow ordinary/well-known symbols while rejecting registry symbols."}}
{"run":1034,"commit":"284f9e7","metric":3,"metrics":{"compiler_test262_cases":141,"compiler_test262_pass":138,"compiler_test262_failures":3,"compiler_test262_compiler_errors":0,"compiler_test262_compiler_crashes":0,"compiler_test262_compiler_fails":0,"compiler_test262_both_fail":3,"compiler_test262_interpreter_fail_compiler_pass":0,"compatibility_pass":138,"compatibility_cases":141,"compiler_errors":0,"compiler_crashes":0,"compiler_fails":0,"both_fail":3,"interpreter_fail_compiler_pass":0,"elapsed_ms":5723},"status":"keep","description":"Set WeakMap prototype parent and descriptor flags","timestamp":1778607616482,"segment":43,"confidence":3.3658536585365852,"iterationTokens":2518,"asi":{"hypothesis":"WeakMap.prototype should inherit from Object.prototype and WeakMap.prototype static descriptor should be non-writable/non-configurable; this should clear prototype object and descriptor tests without weakening methods."}}
{"run":1035,"commit":"e026433","metric":2,"metrics":{"compiler_test262_cases":141,"compiler_test262_pass":139,"compiler_test262_failures":2,"compiler_test262_compiler_errors":0,"compiler_test262_compiler_crashes":0,"compiler_test262_compiler_fails":0,"compiler_test262_both_fail":2,"compiler_test262_interpreter_fail_compiler_pass":0,"compatibility_pass":139,"compatibility_cases":141,"compiler_errors":0,"compiler_crashes":0,"compiler_fails":0,"both_fail":2,"interpreter_fail_compiler_pass":0,"elapsed_ms":5717},"status":"keep","description":"Let WeakMap iterable adder observe empty entry objects","timestamp":1778607804241,"segment":43,"confidence":5.384615384615385,"iterationTokens":2014,"asi":{"hypothesis":"AddEntriesFromIterable should treat array/object entry values as objects even when index 0/1 are missing, letting the observable adder throw and trigger IteratorClose rather than rejecting the entry early."}}
{"run":1036,"commit":"325dcc1","metric":1,"metrics":{"compiler_test262_cases":141,"compiler_test262_pass":140,"compiler_test262_failures":1,"compiler_test262_compiler_errors":0,"compiler_test262_compiler_crashes":0,"compiler_test262_compiler_fails":0,"compiler_test262_both_fail":1,"compiler_test262_interpreter_fail_compiler_pass":0,"compatibility_pass":140,"compatibility_cases":141,"compiler_errors":0,"compiler_crashes":0,"compiler_fails":0,"both_fail":1,"interpreter_fail_compiler_pass":0,"elapsed_ms":6166},"status":"keep","description":"Preserve WeakMap newTarget realm prototypes","timestamp":1778608250590,"segment":43,"confidence":8.352941176470589,"iterationTokens":12279,"asi":{"hypothesis":"Reflect.construct(WeakMap, ..., newTarget) should keep the preallocated this object's prototype, and the minimal Test262 realm should expose WeakMap.prototype as the default realm intrinsic."}}
{"run":1037,"commit":"4cd4408","metric":0,"metrics":{"compiler_test262_cases":141,"compiler_test262_pass":141,"compiler_test262_failures":0,"compiler_test262_compiler_errors":0,"compiler_test262_compiler_crashes":0,"compiler_test262_compiler_fails":0,"compiler_test262_both_fail":0,"compiler_test262_interpreter_fail_compiler_pass":0,"compatibility_pass":141,"compatibility_cases":141,"compiler_errors":0,"compiler_crashes":0,"compiler_fails":0,"both_fail":0,"interpreter_fail_compiler_pass":0,"elapsed_ms":6825},"status":"keep","description":"Reject callable collection constructors","timestamp":1778608455151,"segment":43,"confidence":8.352941176470589,"iterationTokens":7817,"asi":{"hypothesis":"Map, Set, WeakMap, and WeakSet are constructable but not callable as plain functions, so Builtin.call should reject them while constructor paths still invoke their callbacks."}}
{"type":"config","name":"QuickBEAM Test262 built-ins/WeakSet compatibility","metricName":"compatibility_failures","metricUnit":"","bestDirection":"lower"}
{"run":1038,"commit":"9890120","metric":30,"metrics":{"compiler_test262_cases":85,"compiler_test262_pass":55,"compiler_test262_failures":30,"compiler_test262_compiler_errors":0,"compiler_test262_compiler_crashes":0,"compiler_test262_compiler_fails":0,"compiler_test262_both_fail":30,"compiler_test262_interpreter_fail_compiler_pass":0,"compatibility_pass":55,"compatibility_cases":85,"compiler_errors":0,"compiler_crashes":0,"compiler_fails":0,"both_fail":30,"interpreter_fail_compiler_pass":0,"elapsed_ms":4053},"status":"keep","description":"Baseline built-ins/WeakSet compatibility after WeakMap reached zero","timestamp":1778608614769,"segment":44,"confidence":null,"iterationTokens":129,"asi":{"hypothesis":"WeakMap is complete for the bounded workload; WeakSet shares much of the same collection semantics and should benefit from analogous prototype, weak-key, iterable, and constructor fixes."}}
{"run":1039,"commit":"5ebd1ce","metric":10,"metrics":{"compiler_test262_cases":85,"compiler_test262_pass":75,"compiler_test262_failures":10,"compiler_test262_compiler_errors":0,"compiler_test262_compiler_crashes":0,"compiler_test262_compiler_fails":0,"compiler_test262_both_fail":10,"compiler_test262_interpreter_fail_compiler_pass":0,"compatibility_pass":75,"compatibility_cases":85,"compiler_errors":0,"compiler_crashes":0,"compiler_fails":0,"both_fail":10,"interpreter_fail_compiler_pass":0,"elapsed_ms":4167},"status":"keep","description":"Install WeakSet prototype and instance links","timestamp":1778608892856,"segment":44,"confidence":null,"iterationTokens":9955,"asi":{"hypothesis":"WeakSet had the same missing concrete prototype and instance prototype links as WeakMap; materializing WeakSet.prototype methods/descriptors and preserving constructed this prototype should clear metadata and no-iterable clusters."}}
{"run":1040,"commit":"257a9b9","metric":1,"metrics":{"compiler_test262_cases":85,"compiler_test262_pass":84,"compiler_test262_failures":1,"compiler_test262_compiler_errors":0,"compiler_test262_compiler_crashes":0,"compiler_test262_compiler_fails":0,"compiler_test262_both_fail":1,"compiler_test262_interpreter_fail_compiler_pass":0,"compatibility_pass":84,"compatibility_cases":85,"compiler_errors":0,"compiler_crashes":0,"compiler_fails":0,"both_fail":1,"interpreter_fail_compiler_pass":0,"elapsed_ms":3686},"status":"keep","description":"Use observable WeakSet iterable and weak receiver semantics","timestamp":1778609434252,"segment":44,"confidence":3.2222222222222223,"iterationTokens":7430,"asi":{"hypothesis":"WeakSet construction should call the observable add method through the iterator protocol, close iterators on abrupt add failures, and WeakSet methods should reject non-WeakSet receivers and invalid weak values."}}
{"run":1041,"commit":"2c9f095","metric":0,"metrics":{"compiler_test262_cases":85,"compiler_test262_pass":85,"compiler_test262_failures":0,"compiler_test262_compiler_errors":0,"compiler_test262_compiler_crashes":0,"compiler_test262_compiler_fails":0,"compiler_test262_both_fail":0,"compiler_test262_interpreter_fail_compiler_pass":0,"compatibility_pass":85,"compatibility_cases":85,"compiler_errors":0,"compiler_crashes":0,"compiler_fails":0,"both_fail":0,"interpreter_fail_compiler_pass":0,"elapsed_ms":3740},"status":"keep","description":"Preserve WeakSet newTarget realm prototypes","timestamp":1778609702893,"segment":44,"confidence":3.2222222222222223,"iterationTokens":3866,"asi":{"hypothesis":"WeakSet should mirror WeakMap realm behavior by preserving the preallocated this prototype and exposing WeakSet in the minimal Test262 realm."}}
{"type":"config","name":"QuickBEAM Test262 built-ins/Map compatibility reprise","metricName":"compatibility_failures","metricUnit":"","bestDirection":"lower"}
{"run":1042,"commit":"58ce05b","metric":3,"metrics":{"compiler_test262_cases":204,"compiler_test262_pass":201,"compiler_test262_failures":3,"compiler_test262_compiler_errors":0,"compiler_test262_compiler_crashes":0,"compiler_test262_compiler_fails":0,"compiler_test262_both_fail":3,"compiler_test262_interpreter_fail_compiler_pass":0,"compatibility_pass":201,"compatibility_cases":204,"compiler_errors":0,"compiler_crashes":0,"compiler_fails":0,"both_fail":3,"interpreter_fail_compiler_pass":0,"elapsed_ms":9718},"status":"keep","description":"Rebaseline built-ins/Map after weak collection fixes","timestamp":1778609962431,"segment":45,"confidence":null,"iterationTokens":128,"asi":{"hypothesis":"Weak collection fixes also touched shared collection constructor/call/prototype paths, so rebaseline Map before further collection work; prior Map best was 7 failures."}}
{"run":1043,"commit":"f3290f2","metric":0,"metrics":{"compiler_test262_cases":204,"compiler_test262_pass":204,"compiler_test262_failures":0,"compiler_test262_compiler_errors":0,"compiler_test262_compiler_crashes":0,"compiler_test262_compiler_fails":0,"compiler_test262_both_fail":0,"compiler_test262_interpreter_fail_compiler_pass":0,"compatibility_pass":204,"compatibility_cases":204,"compiler_errors":0,"compiler_crashes":0,"compiler_fails":0,"both_fail":0,"interpreter_fail_compiler_pass":0,"elapsed_ms":11226},"status":"keep","description":"Complete Map prototype and realm semantics","timestamp":1778610307287,"segment":45,"confidence":null,"iterationTokens":5989,"asi":{"hypothesis":"Map should mirror weak collection fixes: preserve preallocated this prototypes for Reflect.construct, expose a realm Map intrinsic, inherit Map.prototype from Object.prototype, and keep original adder throws when IteratorClose also throws."}}
{"type":"config","name":"QuickBEAM Test262 built-ins/Set compatibility reprise","metricName":"compatibility_failures","metricUnit":"","bestDirection":"lower"}
{"run":1044,"commit":"79c97c5","metric":8,"metrics":{"compiler_test262_cases":300,"compiler_test262_pass":292,"compiler_test262_failures":8,"compiler_test262_compiler_errors":0,"compiler_test262_compiler_crashes":0,"compiler_test262_compiler_fails":0,"compiler_test262_both_fail":8,"compiler_test262_interpreter_fail_compiler_pass":0,"compatibility_pass":292,"compatibility_cases":300,"compiler_errors":0,"compiler_crashes":0,"compiler_fails":0,"both_fail":8,"interpreter_fail_compiler_pass":0,"elapsed_ms":14593},"status":"keep","description":"Rebaseline built-ins/Set after collection fixes","timestamp":1778610494774,"segment":46,"confidence":null,"iterationTokens":128,"asi":{"hypothesis":"Shared collection fixes completed Map/WeakMap/WeakSet; rebaseline Set, whose previous best was 9/300, before targeting remaining strong Set prototype/realm/iterator gaps."}}
{"run":1045,"commit":"8c0a5b4","metric":5,"metrics":{"compiler_test262_cases":300,"compiler_test262_pass":295,"compiler_test262_failures":5,"compiler_test262_compiler_errors":0,"compiler_test262_compiler_crashes":0,"compiler_test262_compiler_fails":0,"compiler_test262_both_fail":5,"compiler_test262_interpreter_fail_compiler_pass":0,"compatibility_pass":295,"compatibility_cases":300,"compiler_errors":0,"compiler_crashes":0,"compiler_fails":0,"both_fail":5,"interpreter_fail_compiler_pass":0,"elapsed_ms":14322},"status":"keep","description":"Set Set prototype parent and realm semantics","timestamp":1778610810665,"segment":46,"confidence":null,"iterationTokens":5051,"asi":{"hypothesis":"Set should mirror Map collection prototype behavior: preserve preallocated this prototypes for Reflect.construct, expose a realm Set intrinsic, inherit Set.prototype from Object.prototype, and materialize iterator method length metadata."}}
{"run":1046,"commit":"67cf641","metric":4,"metrics":{"compiler_test262_cases":300,"compiler_test262_pass":296,"compiler_test262_failures":4,"compiler_test262_compiler_errors":0,"compiler_test262_compiler_crashes":0,"compiler_test262_compiler_fails":0,"compiler_test262_both_fail":4,"compiler_test262_interpreter_fail_compiler_pass":0,"compatibility_pass":296,"compatibility_cases":300,"compiler_errors":0,"compiler_crashes":0,"compiler_fails":0,"both_fail":4,"interpreter_fail_compiler_pass":0,"elapsed_ms":15380},"status":"keep","description":"Iterate Set.isSubsetOf over live receiver data","timestamp":1778611639584,"segment":46,"confidence":4,"iterationTokens":11981,"asi":{"hypothesis":"Set.prototype.isSubsetOf iterates the receiver's live SetData, so deletions triggered by the set-like has callback should remove later values from consideration instead of using a stale snapshot."}}
{"type":"config","name":"QuickBEAM Test262 built-ins/WeakRef compatibility","metricName":"compatibility_failures","metricUnit":"","bestDirection":"lower"}
{"run":1047,"commit":"e71783f","metric":23,"metrics":{"compiler_test262_cases":29,"compiler_test262_pass":6,"compiler_test262_failures":23,"compiler_test262_compiler_errors":0,"compiler_test262_compiler_crashes":0,"compiler_test262_compiler_fails":0,"compiler_test262_both_fail":23,"compiler_test262_interpreter_fail_compiler_pass":0,"compatibility_pass":6,"compatibility_cases":29,"compiler_errors":0,"compiler_crashes":0,"compiler_fails":0,"both_fail":23,"interpreter_fail_compiler_pass":0,"elapsed_ms":2115},"status":"keep","description":"Baseline built-ins/WeakRef compatibility after weak collections","timestamp":1778612115849,"segment":47,"confidence":null,"iterationTokens":129,"asi":{"hypothesis":"WeakRef is a small adjacent workload likely to share weak-value validation, prototype, descriptor, and callable/constructable semantics with the completed weak collection work."}}
{"run":1048,"commit":"5076b78","metric":3,"metrics":{"compiler_test262_cases":29,"compiler_test262_pass":26,"compiler_test262_failures":3,"compiler_test262_compiler_errors":0,"compiler_test262_compiler_crashes":0,"compiler_test262_compiler_fails":1,"compiler_test262_both_fail":2,"compiler_test262_interpreter_fail_compiler_pass":0,"compatibility_pass":26,"compatibility_cases":29,"compiler_errors":0,"compiler_crashes":0,"compiler_fails":1,"both_fail":2,"interpreter_fail_compiler_pass":0,"elapsed_ms":2115},"status":"keep","description":"Implement WeakRef constructor and deref semantics","timestamp":1778612507448,"segment":47,"confidence":null,"iterationTokens":9753,"asi":{"hypothesis":"WeakRef needs a real target slot, concrete prototype/deref descriptors, CanBeHeldWeakly validation, non-callable constructor behavior, and minimal realm/default-prototype support analogous to weak collections."}}
{"run":1049,"commit":"HEAD","metric":3,"metrics":{"compiler_test262_cases":29,"compiler_test262_pass":26,"compiler_test262_failures":3,"compiler_test262_compiler_errors":0,"compiler_test262_compiler_crashes":0,"compiler_test262_compiler_fails":1,"compiler_test262_both_fail":2,"compiler_test262_interpreter_fail_compiler_pass":0,"compatibility_pass":26,"compatibility_cases":29,"compiler_errors":0,"compiler_crashes":0,"compiler_fails":1,"both_fail":2,"interpreter_fail_compiler_pass":0,"elapsed_ms":1905},"status":"discard","description":"Try correcting WeakRef fallback prototype in constructor for compiler path","timestamp":1778613036061,"segment":47,"confidence":null,"iterationTokens":4922,"asi":{"hypothesis":"The remaining compiler-only WeakRef prototype fallback might come from preserving a preallocated Object-prototype this; try correcting Object-prototype preallocations inside the WeakRef constructor.","rollback_reason":"Metric stayed at 3 failures; compiler-only newTarget prototype fallback still reports Object.prototype, so the issue is lower in compiler Reflect.construct/newTarget preallocation context rather than WeakRef constructor storage.","next_action_hint":"Investigate compiler Reflect.construct pending-this prototype selection or bound-function-as-object support before retrying WeakRef newTarget cases."}}
{"type":"config","name":"QuickBEAM Test262 built-ins/FinalizationRegistry compatibility","metricName":"compatibility_failures","metricUnit":"","bestDirection":"lower"}
{"run":1050,"commit":"9c94e3e","metric":35,"metrics":{"compiler_test262_cases":47,"compiler_test262_pass":12,"compiler_test262_failures":35,"compiler_test262_compiler_errors":0,"compiler_test262_compiler_crashes":0,"compiler_test262_compiler_fails":0,"compiler_test262_both_fail":35,"compiler_test262_interpreter_fail_compiler_pass":0,"compatibility_pass":12,"compatibility_cases":47,"compiler_errors":0,"compiler_crashes":0,"compiler_fails":0,"both_fail":35,"interpreter_fail_compiler_pass":0,"elapsed_ms":5057},"status":"keep","description":"Baseline built-ins/FinalizationRegistry compatibility after WeakRef","timestamp":1778613210034,"segment":48,"confidence":null,"iterationTokens":131,"asi":{"hypothesis":"FinalizationRegistry is the adjacent weak-target workload after WeakMap/WeakSet/WeakRef and likely has concentrated missing-prototype/descriptor/method semantics."}}
{"run":1051,"commit":"8066aab","metric":6,"metrics":{"compiler_test262_cases":47,"compiler_test262_pass":41,"compiler_test262_failures":6,"compiler_test262_compiler_errors":0,"compiler_test262_compiler_crashes":0,"compiler_test262_compiler_fails":1,"compiler_test262_both_fail":5,"compiler_test262_interpreter_fail_compiler_pass":0,"compatibility_pass":41,"compatibility_cases":47,"compiler_errors":0,"compiler_crashes":0,"compiler_fails":1,"both_fail":5,"interpreter_fail_compiler_pass":0,"elapsed_ms":3110},"status":"keep","description":"Implement FinalizationRegistry prototype and registration semantics","timestamp":1778613587191,"segment":48,"confidence":null,"iterationTokens":11315,"asi":{"hypothesis":"FinalizationRegistry needs a concrete prototype, descriptor metadata, callable cleanup validation, weak target/token validation, and minimal register/unregister cell tracking to satisfy observable Test262 semantics without modeling GC cleanup."}}
{"run":1052,"commit":"7c2d78a","metric":6,"metrics":{"compiler_test262_cases":47,"compiler_test262_pass":41,"compiler_test262_failures":6,"compiler_test262_compiler_errors":0,"compiler_test262_compiler_crashes":0,"compiler_test262_compiler_fails":1,"compiler_test262_both_fail":5,"compiler_test262_interpreter_fail_compiler_pass":0,"compatibility_pass":41,"compatibility_cases":47,"compiler_errors":0,"compiler_crashes":0,"compiler_fails":1,"both_fail":5,"interpreter_fail_compiler_pass":0,"elapsed_ms":3243},"status":"keep","description":"Discover WeakRef and FinalizationRegistry builtin definitions","timestamp":1778614289724,"segment":48,"confidence":null,"iterationTokens":32558,"asi":{"hypothesis":"Moving WeakRef and FinalizationRegistry install metadata into module-local builtin definitions with application-module discovery should preserve FinalizationRegistry compatibility while removing constructor/prototype descriptor setup from Globals."}}
{"run":1053,"commit":"1ab0c92","metric":6,"metrics":{"compiler_test262_cases":47,"compiler_test262_pass":41,"compiler_test262_failures":6,"compiler_test262_compiler_errors":0,"compiler_test262_compiler_crashes":0,"compiler_test262_compiler_fails":1,"compiler_test262_both_fail":5,"compiler_test262_interpreter_fail_compiler_pass":0,"compatibility_pass":41,"compatibility_cases":47,"compiler_errors":0,"compiler_crashes":0,"compiler_fails":1,"both_fail":5,"interpreter_fail_compiler_pass":0,"elapsed_ms":2799},"status":"keep","description":"Add builtin definition DSL macro","timestamp":1778614546946,"segment":48,"confidence":null,"iterationTokens":3852,"asi":{"hypothesis":"A builtin_definition DSL macro can emit module-local install metadata for discovered builtins without changing FinalizationRegistry runtime behavior, replacing hand-written struct boilerplate while keeping descriptor metadata beside semantic code."}}
