{"run":1534,"commit":"HEAD","metric":4,"metrics":{"compiler_test262_cases":327,"compiler_test262_pass":323,"compiler_test262_failures":4,"compiler_test262_compiler_errors":0,"compiler_test262_compiler_crashes":0,"compiler_test262_compiler_fails":0,"compiler_test262_both_fail":3,"compiler_test262_interpreter_fail_compiler_pass":0,"compatibility_pass":323,"compatibility_cases":327,"compiler_errors":0,"compiler_crashes":0,"compiler_fails":0,"both_fail":3,"interpreter_fail_compiler_pass":0,"elapsed_ms":17137},"status":"checks_failed","description":"Implement binary16 Math.f16round rounding","timestamp":1778819700635,"segment":135,"confidence":8.926829268292684,"iterationTokens":6022,"asi":{"hypothesis":"Math.f16round should round to binary16 using ties-to-even, signed zero, subnormal, and overflow thresholds instead of approximating via binary32.","rollback_reason":"Checks failed under warnings-as-errors because a helper matched literal 0.0, triggering OTP 27 signed-zero pattern warning.","next_action_hint":"Retry the binary16 rounding implementation with a guard (`when value == 0`) instead of matching 0.0 in the helper head."}}
{"run":1535,"commit":"14fef63","metric":4,"metrics":{"compiler_test262_cases":327,"compiler_test262_pass":323,"compiler_test262_failures":4,"compiler_test262_compiler_errors":0,"compiler_test262_compiler_crashes":0,"compiler_test262_compiler_fails":0,"compiler_test262_both_fail":3,"compiler_test262_interpreter_fail_compiler_pass":0,"compatibility_pass":323,"compatibility_cases":327,"compiler_errors":0,"compiler_crashes":0,"compiler_fails":0,"both_fail":3,"interpreter_fail_compiler_pass":0,"elapsed_ms":16870},"status":"keep","description":"Implement binary16 Math.f16round rounding","timestamp":1778819863269,"segment":135,"confidence":9.2,"iterationTokens":1889,"asi":{"hypothesis":"Math.f16round should round to binary16 using ties-to-even, signed zero, subnormal, and overflow thresholds instead of approximating via binary32."}}
{"run":1536,"commit":"HEAD","metric":4,"metrics":{"compiler_test262_cases":327,"compiler_test262_pass":323,"compiler_test262_failures":4,"compiler_test262_compiler_errors":0,"compiler_test262_compiler_crashes":0,"compiler_test262_compiler_fails":0,"compiler_test262_both_fail":3,"compiler_test262_interpreter_fail_compiler_pass":0,"compatibility_pass":323,"compatibility_cases":327,"compiler_errors":0,"compiler_crashes":0,"compiler_fails":0,"both_fail":3,"interpreter_fail_compiler_pass":0,"elapsed_ms":17067},"status":"discard","description":"Use floor half-up Math.round after f16round","timestamp":1778820025671,"segment":135,"confidence":8.363636363636363,"iterationTokens":1407,"asi":{"hypothesis":"Math.round should use floor(x + 0.5) outside the negative-zero interval.","rollback_reason":"Primary Math metric stayed flat at 4 again; the focused A6 issue is not enough to reduce the bounded workload or is replaced by another round edge.","next_action_hint":"Inspect exact round failures after the change before retrying; only keep if it reduces primary failures."}}
{"run":1537,"commit":"a55a627","metric":3,"metrics":{"compiler_test262_cases":327,"compiler_test262_pass":324,"compiler_test262_failures":3,"compiler_test262_compiler_errors":0,"compiler_test262_compiler_crashes":0,"compiler_test262_compiler_fails":0,"compiler_test262_both_fail":2,"compiler_test262_interpreter_fail_compiler_pass":0,"compatibility_pass":324,"compatibility_cases":327,"compiler_errors":0,"compiler_crashes":0,"compiler_fails":0,"both_fail":2,"interpreter_fail_compiler_pass":0,"elapsed_ms":17169},"status":"keep","description":"Consume Math.sumPrecise iterables","timestamp":1778820232288,"segment":135,"confidence":7.708333333333333,"iterationTokens":5569,"asi":{"hypothesis":"Math.sumPrecise should consume iterable inputs through normal iterator semantics, reject non-iterables, validate elements as numbers without coercion, and close iterators on invalid elements."}}
{"run":1538,"commit":"80db060","metric":2,"metrics":{"compiler_test262_cases":327,"compiler_test262_pass":325,"compiler_test262_failures":2,"compiler_test262_compiler_errors":0,"compiler_test262_compiler_crashes":0,"compiler_test262_compiler_fails":0,"compiler_test262_both_fail":1,"compiler_test262_interpreter_fail_compiler_pass":0,"compatibility_pass":325,"compatibility_cases":327,"compiler_errors":0,"compiler_crashes":0,"compiler_fails":0,"both_fail":1,"interpreter_fail_compiler_pass":0,"elapsed_ms":17048},"status":"keep","description":"Honor array iterator overrides in Math.sumPrecise","timestamp":1778820430952,"segment":135,"confidence":7.914893617021277,"iterationTokens":2045,"asi":{"hypothesis":"Math.sumPrecise should honor an array instance's own Symbol.iterator override instead of always using the default list-backed array iterator."}}
{"type":"config","name":"Optimize QuickBEAM built-ins/JSON compatibility slice","metricName":"compatibility_failures","metricUnit":"","bestDirection":"lower"}
{"run":1539,"commit":"b675fd6","metric":81,"metrics":{"compiler_test262_cases":165,"compiler_test262_pass":84,"compiler_test262_failures":81,"compiler_test262_compiler_errors":0,"compiler_test262_compiler_crashes":0,"compiler_test262_compiler_fails":0,"compiler_test262_both_fail":78,"compiler_test262_interpreter_fail_compiler_pass":0,"compatibility_pass":84,"compatibility_cases":165,"compiler_errors":0,"compiler_crashes":0,"compiler_fails":0,"both_fail":78,"interpreter_fail_compiler_pass":0,"elapsed_ms":46789},"status":"keep","description":"Baseline JSON compatibility slice after Math plateau","timestamp":1778820658445,"segment":136,"confidence":null,"iterationTokens":127,"asi":{"hypothesis":"Math is down to two hard residuals, so establish a fresh JSON built-ins baseline to look for broader tractable runtime wins while preserving the Math continuation notes."}}
{"run":1540,"commit":"fd6cb81","metric":67,"metrics":{"compiler_test262_cases":165,"compiler_test262_pass":98,"compiler_test262_failures":67,"compiler_test262_compiler_errors":0,"compiler_test262_compiler_crashes":0,"compiler_test262_compiler_fails":0,"compiler_test262_both_fail":63,"compiler_test262_interpreter_fail_compiler_pass":0,"compatibility_pass":98,"compatibility_cases":165,"compiler_errors":0,"compiler_crashes":0,"compiler_fails":0,"both_fail":63,"interpreter_fail_compiler_pass":0,"elapsed_ms":47023},"status":"keep","description":"Install JSON metadata and rawJSON basics","timestamp":1778820986594,"segment":136,"confidence":null,"iterationTokens":10535,"asi":{"hypothesis":"JSON should install method metadata, Symbol.toStringTag, and basic rawJSON/isRawJSON support with raw fragments preserved by stringify."}}
{"run":1541,"commit":"daa79ff","metric":64,"metrics":{"compiler_test262_cases":165,"compiler_test262_pass":101,"compiler_test262_failures":64,"compiler_test262_compiler_errors":0,"compiler_test262_compiler_crashes":0,"compiler_test262_compiler_fails":0,"compiler_test262_both_fail":61,"compiler_test262_interpreter_fail_compiler_pass":0,"compatibility_pass":101,"compatibility_cases":165,"compiler_errors":0,"compiler_crashes":0,"compiler_fails":0,"both_fail":61,"interpreter_fail_compiler_pass":0,"elapsed_ms":49594},"status":"keep","description":"Refine JSON raw helpers and metadata","timestamp":1778821253874,"segment":136,"confidence":5.666666666666667,"iterationTokens":24550,"asi":{"hypothesis":"JSON.isRawJSON should return false for array-backed objects rather than crashing, raw JSON placeholder restoration should traverse object pairs, and JSON.parse/stringify builtins should be marked non-constructable."}}
{"run":1542,"commit":"HEAD","metric":60,"metrics":{"compiler_test262_cases":165,"compiler_test262_pass":105,"compiler_test262_failures":60,"compiler_test262_compiler_errors":0,"compiler_test262_compiler_crashes":0,"compiler_test262_compiler_fails":0,"compiler_test262_both_fail":57,"compiler_test262_interpreter_fail_compiler_pass":0,"compatibility_pass":105,"compatibility_cases":165,"compiler_errors":0,"compiler_crashes":0,"compiler_fails":0,"both_fail":57,"interpreter_fail_compiler_pass":0,"elapsed_ms":51825},"status":"checks_failed","description":"Improve JSON primitive serialization and property order","timestamp":1778821393553,"segment":136,"confidence":4.857142857142857,"iterationTokens":4999,"asi":{"hypothesis":"JSON.stringify should serialize undefined array slots as null, non-finite numbers as null, negative zero as 0, and order integer keys before string keys.","rollback_reason":"Checks failed under warnings-as-errors because inserting sort helpers split grouped `to_json/1` clauses.","next_action_hint":"Retry with helper functions placed outside the grouped `to_json/1` clause block."}}
{"run":1543,"commit":"fdac45b","metric":60,"metrics":{"compiler_test262_cases":165,"compiler_test262_pass":105,"compiler_test262_failures":60,"compiler_test262_compiler_errors":0,"compiler_test262_compiler_crashes":0,"compiler_test262_compiler_fails":0,"compiler_test262_both_fail":57,"compiler_test262_interpreter_fail_compiler_pass":0,"compatibility_pass":105,"compatibility_cases":165,"compiler_errors":0,"compiler_crashes":0,"compiler_fails":0,"both_fail":57,"interpreter_fail_compiler_pass":0,"elapsed_ms":50485},"status":"keep","description":"Improve JSON primitive serialization and property order","timestamp":1778821623772,"segment":136,"confidence":5.25,"iterationTokens":2972,"asi":{"hypothesis":"JSON.stringify should serialize undefined array slots as null, non-finite numbers as null, negative zero as 0, and order integer keys before string keys."}}
{"run":1544,"commit":"77f3d2b","metric":57,"metrics":{"compiler_test262_cases":165,"compiler_test262_pass":108,"compiler_test262_failures":57,"compiler_test262_compiler_errors":0,"compiler_test262_compiler_crashes":0,"compiler_test262_compiler_fails":0,"compiler_test262_both_fail":54,"compiler_test262_interpreter_fail_compiler_pass":0,"compatibility_pass":108,"compatibility_cases":165,"compiler_errors":0,"compiler_crashes":0,"compiler_fails":0,"both_fail":54,"interpreter_fail_compiler_pass":0,"elapsed_ms":49889},"status":"keep","description":"Coerce JSON parse text inputs","timestamp":1778822020414,"segment":136,"confidence":6.857142857142857,"iterationTokens":2972,"asi":{"hypothesis":"JSON.parse should apply JavaScript ToString coercion to non-string inputs, reject Symbols with TypeError, and preserve negative zero for textual -0."}}
{"run":1545,"commit":"b52f9ba","metric":55,"metrics":{"compiler_test262_cases":165,"compiler_test262_pass":110,"compiler_test262_failures":55,"compiler_test262_compiler_errors":0,"compiler_test262_compiler_crashes":0,"compiler_test262_compiler_fails":0,"compiler_test262_both_fail":52,"compiler_test262_interpreter_fail_compiler_pass":0,"compatibility_pass":110,"compatibility_cases":165,"compiler_errors":0,"compiler_crashes":0,"compiler_fails":0,"both_fail":52,"interpreter_fail_compiler_pass":0,"elapsed_ms":49857},"status":"keep","description":"Tighten JSON raw object semantics","timestamp":1778822290645,"segment":136,"confidence":6.5,"iterationTokens":10083,"asi":{"hypothesis":"Raw JSON objects should hide internal markers from own keys, reject Symbols with TypeError, and reject object/array raw text as invalid JSON.rawJSON input."}}
{"run":1546,"commit":"HEAD","metric":57,"metrics":{"compiler_test262_cases":165,"compiler_test262_pass":108,"compiler_test262_failures":57,"compiler_test262_compiler_errors":0,"compiler_test262_compiler_crashes":0,"compiler_test262_compiler_fails":0,"compiler_test262_both_fail":54,"compiler_test262_interpreter_fail_compiler_pass":0,"compatibility_pass":108,"compatibility_cases":165,"compiler_errors":0,"compiler_crashes":0,"compiler_fails":0,"both_fail":54,"interpreter_fail_compiler_pass":0,"elapsed_ms":51412},"status":"discard","description":"Try root JSON parse reviver source","timestamp":1778822489116,"segment":136,"confidence":7.428571428571429,"iterationTokens":3152,"asi":{"hypothesis":"A minimal root reviver call with a source object might fix JSON.parse source-based BigInt round-tripping without needing full traversal.","rollback_reason":"Primary metric regressed from 55 to 57; root-only reviver broke/failed reviver semantics more than it helped.","next_action_hint":"Implement full reviver wrapper traversal and correct this-binding/source semantics before retrying reviver support."}}
{"run":1547,"commit":"HEAD","metric":55,"metrics":{"compiler_test262_cases":165,"compiler_test262_pass":110,"compiler_test262_failures":55,"compiler_test262_compiler_errors":0,"compiler_test262_compiler_crashes":0,"compiler_test262_compiler_fails":0,"compiler_test262_both_fail":52,"compiler_test262_interpreter_fail_compiler_pass":0,"compatibility_pass":110,"compatibility_cases":165,"compiler_errors":0,"compiler_crashes":0,"compiler_fails":0,"both_fail":52,"interpreter_fail_compiler_pass":0,"elapsed_ms":51961},"status":"discard","description":"Try boxed primitive JSON serialization","timestamp":1778822702950,"segment":136,"confidence":6.5,"iterationTokens":2684,"asi":{"hypothesis":"JSON.stringify should unbox Number, String, and Boolean wrapper objects to their primitive values before serialization.","rollback_reason":"Primary metric was unchanged at the current best; focused failures likely use wrapper representation or ordering not covered by this narrow hook.","next_action_hint":"Inspect actual heap shape of Number/String/Boolean objects in failing JSON.stringify tests before retrying wrapper unboxing."}}
{"run":1548,"commit":"35e6eed","metric":54,"metrics":{"compiler_test262_cases":165,"compiler_test262_pass":111,"compiler_test262_failures":54,"compiler_test262_compiler_errors":0,"compiler_test262_compiler_crashes":0,"compiler_test262_compiler_fails":0,"compiler_test262_both_fail":51,"compiler_test262_interpreter_fail_compiler_pass":0,"compatibility_pass":111,"compatibility_cases":165,"compiler_errors":0,"compiler_crashes":0,"compiler_fails":0,"both_fail":51,"interpreter_fail_compiler_pass":0,"elapsed_ms":49763},"status":"keep","description":"Normalize JSON Unicode escapes","timestamp":1778822921652,"segment":136,"confidence":7.714285714285714,"iterationTokens":4295,"asi":{"hypothesis":"ECMAScript JSON.stringify expects lowercase hexadecimal digits in \\u escapes; normalizing Jason output should fix control-character and lone-surrogate escape cases without changing parsed JSON values."}}
{"run":1549,"commit":"e30266c","metric":53,"metrics":{"compiler_test262_cases":165,"compiler_test262_pass":112,"compiler_test262_failures":53,"compiler_test262_compiler_errors":0,"compiler_test262_compiler_crashes":0,"compiler_test262_compiler_fails":0,"compiler_test262_both_fail":50,"compiler_test262_interpreter_fail_compiler_pass":0,"compatibility_pass":112,"compatibility_cases":165,"compiler_errors":0,"compiler_crashes":0,"compiler_fails":0,"both_fail":50,"interpreter_fail_compiler_pass":0,"elapsed_ms":49910},"status":"keep","description":"Honor JSON stringify space coercion","timestamp":1778823147378,"segment":136,"confidence":9.333333333333334,"iterationTokens":4993,"asi":{"hypothesis":"JSON.stringify should coerce numeric and string space values, including boxed primitives, into a clamped indentation string before encoding."}}
{"run":1550,"commit":"a888997","metric":52,"metrics":{"compiler_test262_cases":165,"compiler_test262_pass":113,"compiler_test262_failures":52,"compiler_test262_compiler_errors":0,"compiler_test262_compiler_crashes":0,"compiler_test262_compiler_fails":0,"compiler_test262_both_fail":49,"compiler_test262_interpreter_fail_compiler_pass":0,"compatibility_pass":113,"compatibility_cases":165,"compiler_errors":0,"compiler_crashes":0,"compiler_fails":0,"both_fail":49,"interpreter_fail_compiler_pass":0,"elapsed_ms":47250},"status":"keep","description":"Use primitive coercion for JSON space objects","timestamp":1778823434780,"segment":136,"confidence":9.666666666666666,"iterationTokens":6907,"asi":{"hypothesis":"Boxed Number/String space arguments should use full JavaScript ToNumber/ToString primitive coercion so overridden valueOf/toString methods influence indentation."}}
{"run":1551,"commit":"5f25824","metric":51,"metrics":{"compiler_test262_cases":165,"compiler_test262_pass":114,"compiler_test262_failures":51,"compiler_test262_compiler_errors":0,"compiler_test262_compiler_crashes":0,"compiler_test262_compiler_fails":0,"compiler_test262_both_fail":48,"compiler_test262_interpreter_fail_compiler_pass":0,"compatibility_pass":114,"compatibility_cases":165,"compiler_errors":0,"compiler_crashes":0,"compiler_fails":0,"both_fail":48,"interpreter_fail_compiler_pass":0,"elapsed_ms":49692},"status":"keep","description":"Give JSON parsed objects ordinary prototypes","timestamp":1778823664046,"segment":136,"confidence":10,"iterationTokens":3961,"asi":{"hypothesis":"Objects produced by JSON.parse should use Object.prototype via internal prototype metadata so a parsed __proto__ key remains an ordinary data property."}}
{"run":1552,"commit":"HEAD","metric":51,"metrics":{"compiler_test262_cases":165,"compiler_test262_pass":114,"compiler_test262_failures":51,"compiler_test262_compiler_errors":0,"compiler_test262_compiler_crashes":0,"compiler_test262_compiler_fails":0,"compiler_test262_both_fail":48,"compiler_test262_interpreter_fail_compiler_pass":0,"compatibility_pass":114,"compatibility_cases":165,"compiler_errors":0,"compiler_crashes":0,"compiler_fails":0,"both_fail":48,"interpreter_fail_compiler_pass":0,"elapsed_ms":48824},"status":"checks_failed","description":"Try non-callable JSON toJSON handling","timestamp":1778823782437,"segment":136,"confidence":7.5,"iterationTokens":3326,"asi":{"hypothesis":"JSON.stringify should ignore non-callable toJSON properties instead of trying to invoke them.","rollback_reason":"Checks failed because helper extraction split grouped to_json/1 clauses; benchmark was unchanged anyway.","next_action_hint":"If retrying, move helpers after the full to_json/1 clause group and first verify focused value-tojson-not-function improvement."}}
{"run":1553,"commit":"HEAD","metric":51,"metrics":{"compiler_test262_cases":165,"compiler_test262_pass":114,"compiler_test262_failures":51,"compiler_test262_compiler_errors":0,"compiler_test262_compiler_crashes":0,"compiler_test262_compiler_fails":0,"compiler_test262_both_fail":48,"compiler_test262_interpreter_fail_compiler_pass":0,"compatibility_pass":114,"compatibility_cases":165,"compiler_errors":0,"compiler_crashes":0,"compiler_fails":0,"both_fail":48,"interpreter_fail_compiler_pass":0,"elapsed_ms":51385},"status":"discard","description":"Ignore non-callable JSON toJSON values","timestamp":1778824018691,"segment":136,"confidence":7.5,"iterationTokens":21101,"asi":{"hypothesis":"JSON.stringify should ignore non-callable toJSON values and serialize them as ordinary properties rather than invoking them.","rollback_reason":"Primary metric stayed unchanged at 51, so the focused semantics did not reduce the active slice.","next_action_hint":"Inspect the failing value-tojson-not-function case after the change before retrying; it may still fail due RegExp/array object serialization rather than the non-callable check alone."}}
{"run":1554,"commit":"HEAD","metric":51,"metrics":{"compiler_test262_cases":165,"compiler_test262_pass":114,"compiler_test262_failures":51,"compiler_test262_compiler_errors":0,"compiler_test262_compiler_crashes":0,"compiler_test262_compiler_fails":0,"compiler_test262_both_fail":48,"compiler_test262_interpreter_fail_compiler_pass":0,"compatibility_pass":114,"compatibility_cases":165,"compiler_errors":0,"compiler_crashes":0,"compiler_fails":0,"both_fail":48,"interpreter_fail_compiler_pass":0,"elapsed_ms":48693},"status":"discard","description":"Preserve duplicate JSON object keys while parsing","timestamp":1778824244042,"segment":136,"confidence":7.5,"iterationTokens":3793,"asi":{"hypothesis":"JSON.parse should preserve the last value for duplicate object keys, including duplicate __proto__, by constructing VM objects from ordered JSON pairs.","rollback_reason":"Primary metric stayed unchanged; duplicate-proto likely still fails or the improvement is offset in the active slice.","next_action_hint":"Inspect focused duplicate-proto after ordered decode; property access for __proto__ may still prefer an earlier value or prototype path."}}
{"run":1555,"commit":"HEAD","metric":0,"metrics":{"compiler_test262_cases":0,"compiler_test262_pass":0,"compiler_test262_failures":0,"compiler_test262_compiler_errors":0,"compiler_test262_compiler_crashes":0,"compiler_test262_compiler_fails":0,"compiler_test262_both_fail":0,"compiler_test262_interpreter_fail_compiler_pass":0,"compatibility_pass":0,"compatibility_cases":0,"compiler_errors":0,"compiler_crashes":0,"compiler_fails":0,"both_fail":0,"interpreter_fail_compiler_pass":0,"elapsed_ms":0},"status":"crash","description":"Implement JSON replacer array property lists","timestamp":1778824317267,"segment":136,"confidence":7.5,"iterationTokens":3977,"asi":{"hypothesis":"JSON.stringify should treat array replacers as ordered unique property lists with String/Number primitives and wrappers only.","rollback_reason":"Compile failed because a guard used `WrappedPrimitive.type/1` inside `in`, which is not allowed in guards.","next_action_hint":"Retry with a case expression instead of a guard for wrapped primitive type checks."}}
