{"run":1598,"commit":"24c5520","metric":13,"metrics":{"compiler_test262_cases":165,"compiler_test262_pass":152,"compiler_test262_failures":13,"compiler_test262_compiler_errors":0,"compiler_test262_compiler_crashes":0,"compiler_test262_compiler_fails":0,"compiler_test262_both_fail":13,"compiler_test262_interpreter_fail_compiler_pass":0,"compatibility_pass":152,"compatibility_cases":165,"compiler_errors":0,"compiler_crashes":0,"compiler_fails":0,"both_fail":13,"interpreter_fail_compiler_pass":0,"elapsed_ms":7690},"status":"keep","description":"Escape lone surrogates in JSON strings","timestamp":1778832512909,"segment":136,"confidence":5.666666666666667,"iterationTokens":1858,"asi":{"hypothesis":"QuickJS can surface lone surrogate code units as invalid WTF-8 binaries; JSON.stringify should quote those as lowercase \\uXXXX escapes while preserving valid surrogate pairs."}}
{"run":1599,"commit":"c2da4e7","metric":12,"metrics":{"compiler_test262_cases":165,"compiler_test262_pass":153,"compiler_test262_failures":12,"compiler_test262_compiler_errors":0,"compiler_test262_compiler_crashes":0,"compiler_test262_compiler_fails":0,"compiler_test262_both_fail":12,"compiler_test262_interpreter_fail_compiler_pass":0,"compatibility_pass":153,"compatibility_cases":165,"compiler_errors":0,"compiler_crashes":0,"compiler_fails":0,"both_fail":12,"interpreter_fail_compiler_pass":0,"elapsed_ms":7925},"status":"keep","description":"Omit JSON symbol values and keys","timestamp":1778832675659,"segment":136,"confidence":5.75,"iterationTokens":2288,"asi":{"hypothesis":"JSON.stringify should omit Symbol primitives as values according to context and ignore Symbol-keyed object properties during object member enumeration."}}
{"run":1600,"commit":"46e99fd","metric":11,"metrics":{"compiler_test262_cases":165,"compiler_test262_pass":154,"compiler_test262_failures":11,"compiler_test262_compiler_errors":0,"compiler_test262_compiler_crashes":0,"compiler_test262_compiler_fails":0,"compiler_test262_both_fail":11,"compiler_test262_interpreter_fail_compiler_pass":0,"compatibility_pass":154,"compatibility_cases":165,"compiler_errors":0,"compiler_crashes":0,"compiler_fails":0,"both_fail":11,"interpreter_fail_compiler_pass":0,"elapsed_ms":7748},"status":"keep","description":"Resolve accessor methods during primitive coercion","timestamp":1778832898419,"segment":136,"confidence":5.6,"iterationTokens":7285,"asi":{"hypothesis":"ToPrimitive/ToString method lookup should invoke accessor getters for toString/valueOf methods instead of treating accessor descriptors as non-callable data, preserving abrupt completions."}}
{"run":1601,"commit":"HEAD","metric":11,"metrics":{"compiler_test262_cases":165,"compiler_test262_pass":154,"compiler_test262_failures":11,"compiler_test262_compiler_errors":0,"compiler_test262_compiler_crashes":0,"compiler_test262_compiler_fails":0,"compiler_test262_both_fail":11,"compiler_test262_interpreter_fail_compiler_pass":0,"compatibility_pass":154,"compatibility_cases":165,"compiler_errors":0,"compiler_crashes":0,"compiler_fails":0,"both_fail":11,"interpreter_fail_compiler_pass":0,"elapsed_ms":7733},"status":"discard","description":"Try JSON duplicate __proto__ data access","timestamp":1778833127450,"segment":136,"confidence":5,"iterationTokens":7958,"asi":{"hypothesis":"Parsed JSON objects with an own `__proto__` data property should return that data property, and duplicate JSON keys should keep the latest value.","rollback_reason":"Primary metric stayed unchanged at 11; duplicate-proto remains blocked or this gain is offset in the active slice.","next_action_hint":"Do not retry this narrow pair unchanged; inspect focused duplicate-proto to identify whether storage order or `__proto__` lookup is still wrong."}}
{"run":1602,"commit":"HEAD","metric":0,"metrics":{"compiler_test262_cases":0,"compiler_test262_pass":0,"compiler_test262_failures":0,"compiler_test262_compiler_errors":0,"compiler_test262_compiler_crashes":0,"compiler_test262_compiler_fails":0,"compiler_test262_both_fail":0,"compiler_test262_interpreter_fail_compiler_pass":0,"compatibility_pass":0,"compatibility_cases":0,"compiler_errors":0,"compiler_crashes":0,"compiler_fails":0,"both_fail":0,"interpreter_fail_compiler_pass":0,"elapsed_ms":0},"status":"crash","description":"Try full JSON parse reviver traversal with source","timestamp":1778833257966,"segment":136,"confidence":5,"iterationTokens":15246,"asi":{"hypothesis":"Full InternalizeJSONProperty traversal with holder/key receivers and source context should reduce reviver and rawJSON BigInt parse failures.","rollback_reason":"Compile failed because the first implementation referenced a missing revoked_proxy?/1 helper.","next_action_hint":"Retry only with the helper defined or inline proxy map check; keep array wrapping/traversal under review for regressions."}}
{"run":1603,"commit":"HEAD","metric":11,"metrics":{"compiler_test262_cases":165,"compiler_test262_pass":154,"compiler_test262_failures":11,"compiler_test262_compiler_errors":0,"compiler_test262_compiler_crashes":0,"compiler_test262_compiler_fails":0,"compiler_test262_both_fail":11,"compiler_test262_interpreter_fail_compiler_pass":0,"compatibility_pass":154,"compatibility_cases":165,"compiler_errors":0,"compiler_crashes":0,"compiler_fails":0,"both_fail":11,"interpreter_fail_compiler_pass":0,"elapsed_ms":9175},"status":"discard","description":"Try full JSON parse reviver traversal with source","timestamp":1778833442261,"segment":136,"confidence":5,"iterationTokens":2021,"asi":{"hypothesis":"Full InternalizeJSONProperty traversal with holder/key receivers and source context should reduce reviver and rawJSON BigInt parse failures.","rollback_reason":"Primary metric stayed unchanged at 11; this coarse traversal likely fails exact source/mutation semantics or is offset by array representation changes.","next_action_hint":"Do not retry this broad traversal unchanged; inspect focused reviver failures to implement exact key/source semantics incrementally."}}
{"run":1604,"commit":"d60a3f1","metric":10,"metrics":{"compiler_test262_cases":165,"compiler_test262_pass":155,"compiler_test262_failures":10,"compiler_test262_compiler_errors":0,"compiler_test262_compiler_crashes":0,"compiler_test262_compiler_fails":0,"compiler_test262_both_fail":10,"compiler_test262_interpreter_fail_compiler_pass":0,"compatibility_pass":155,"compatibility_cases":165,"compiler_errors":0,"compiler_crashes":0,"compiler_fails":0,"both_fail":10,"interpreter_fail_compiler_pass":0,"elapsed_ms":8909},"status":"keep","description":"Expose BigInt in Test262 realms","timestamp":1778833704783,"segment":136,"confidence":5.071428571428571,"iterationTokens":10161,"asi":{"hypothesis":"Test262-created realms should expose a BigInt constructor and have realm Object wrap BigInt primitives with the realm BigInt prototype so cross-realm BigInt JSON hooks are observable."}}
{"run":1605,"commit":"6bb326c","metric":8,"metrics":{"compiler_test262_cases":165,"compiler_test262_pass":157,"compiler_test262_failures":8,"compiler_test262_compiler_errors":0,"compiler_test262_compiler_crashes":0,"compiler_test262_compiler_fails":0,"compiler_test262_both_fail":8,"compiler_test262_interpreter_fail_compiler_pass":0,"compatibility_pass":157,"compatibility_cases":165,"compiler_errors":0,"compiler_crashes":0,"compiler_fails":0,"both_fail":8,"interpreter_fail_compiler_pass":0,"elapsed_ms":9072},"status":"keep","description":"Call JSON primitive root revivers with source","timestamp":1778833906388,"segment":136,"confidence":5.0344827586206895,"iterationTokens":2342,"asi":{"hypothesis":"JSON.parse should invoke callable revivers for primitive root values with an ordinary wrapper receiver and a source context, enabling BigInt parse-with-source round trips without broad traversal changes."}}
{"run":1606,"commit":"HEAD","metric":8,"metrics":{"compiler_test262_cases":165,"compiler_test262_pass":157,"compiler_test262_failures":8,"compiler_test262_compiler_errors":0,"compiler_test262_compiler_crashes":0,"compiler_test262_compiler_fails":0,"compiler_test262_both_fail":8,"compiler_test262_interpreter_fail_compiler_pass":0,"compatibility_pass":157,"compatibility_cases":165,"compiler_errors":0,"compiler_crashes":0,"compiler_fails":0,"both_fail":8,"interpreter_fail_compiler_pass":0,"elapsed_ms":9277},"status":"discard","description":"Try JSON duplicate __proto__ latest data value","timestamp":1778834120956,"segment":136,"confidence":5.214285714285714,"iterationTokens":2755,"asi":{"hypothesis":"JSON.parse duplicate `__proto__` entries should keep the latest pair value and expose parsed `__proto__` as ordinary data while preserving Object.prototype as the internal prototype.","rollback_reason":"Primary metric stayed unchanged at 8 despite fixing the focused simple duplicate-proto probe; active duplicate-proto failure is either offset or still failing descriptor semantics.","next_action_hint":"Do not retry only ordered duplicate storage plus Get special-case; inspect full duplicate-proto Test262/focused descriptor behavior first."}}
{"run":1607,"commit":"HEAD","metric":10,"metrics":{"compiler_test262_cases":165,"compiler_test262_pass":155,"compiler_test262_failures":10,"compiler_test262_compiler_errors":0,"compiler_test262_compiler_crashes":0,"compiler_test262_compiler_fails":0,"compiler_test262_both_fail":10,"compiler_test262_interpreter_fail_compiler_pass":0,"compatibility_pass":155,"compatibility_cases":165,"compiler_errors":0,"compiler_crashes":0,"compiler_fails":0,"both_fail":10,"interpreter_fail_compiler_pass":0,"elapsed_ms":9082},"status":"discard","description":"Try object-only JSON parse reviver traversal","timestamp":1778834321451,"segment":136,"confidence":5.0344827586206895,"iterationTokens":2737,"asi":{"hypothesis":"Object-only InternalizeJSONProperty traversal should reduce reviver call-order and object reviver failures without changing array representation.","rollback_reason":"Primary metric regressed from 8 to 10; object-only traversal breaks or offsets existing primitive/source improvements and lacks exact array/object semantics.","next_action_hint":"Avoid partial object-only reviver traversal; build exact traversal with array/object mutation and source contexts, or target other remaining clusters."}}
{"run":1608,"commit":"HEAD","metric":10,"metrics":{"compiler_test262_cases":165,"compiler_test262_pass":155,"compiler_test262_failures":10,"compiler_test262_compiler_errors":0,"compiler_test262_compiler_crashes":0,"compiler_test262_compiler_fails":0,"compiler_test262_both_fail":10,"compiler_test262_interpreter_fail_compiler_pass":0,"compatibility_pass":155,"compatibility_cases":165,"compiler_errors":0,"compiler_crashes":0,"compiler_fails":0,"both_fail":10,"interpreter_fail_compiler_pass":0,"elapsed_ms":14724},"status":"checks_failed","description":"Try source-aware full JSON parse reviver traversal","timestamp":1778834496400,"segment":136,"confidence":4.866666666666666,"iterationTokens":9557,"asi":{"hypothesis":"Full JSON.parse reviver traversal with source contexts collected from primitive JSON tokens should reduce remaining reviver failures.","rollback_reason":"Backpressure checks failed due character literal warnings and an unused variable; the primary metric also regressed from 8 to 10, so this direction is not promising unchanged.","next_action_hint":"Do not retry this token-queue traversal unchanged; exact source/mutation semantics need a cleaner design."}}
{"run":1609,"commit":"2e11f4b","metric":7,"metrics":{"compiler_test262_cases":165,"compiler_test262_pass":158,"compiler_test262_failures":7,"compiler_test262_compiler_errors":0,"compiler_test262_compiler_crashes":0,"compiler_test262_compiler_fails":0,"compiler_test262_both_fail":7,"compiler_test262_interpreter_fail_compiler_pass":0,"compatibility_pass":158,"compatibility_cases":165,"compiler_errors":0,"compiler_crashes":0,"compiler_fails":0,"both_fail":7,"interpreter_fail_compiler_pass":0,"elapsed_ms":8637},"status":"keep","description":"Preserve JSON duplicate key values","timestamp":1778834832142,"segment":136,"confidence":5.103448275862069,"iterationTokens":13107,"asi":{"hypothesis":"JSON.parse should build objects from ordered decoded pairs so duplicate keys keep their latest value, while parsed `__proto__` remains an own data property separate from the internal Object.prototype."}}
{"run":1610,"commit":"HEAD","metric":8,"metrics":{"compiler_test262_cases":165,"compiler_test262_pass":157,"compiler_test262_failures":8,"compiler_test262_compiler_errors":0,"compiler_test262_compiler_crashes":0,"compiler_test262_compiler_fails":0,"compiler_test262_both_fail":8,"compiler_test262_interpreter_fail_compiler_pass":0,"compatibility_pass":157,"compatibility_cases":165,"compiler_errors":0,"compiler_crashes":0,"compiler_fails":0,"both_fail":8,"interpreter_fail_compiler_pass":0,"elapsed_ms":9545},"status":"checks_failed","description":"Try exact JSON parse reviver traversal with source tree","timestamp":1778834970247,"segment":136,"confidence":5.285714285714286,"iterationTokens":6293,"asi":{"hypothesis":"A source-tree based InternalizeJSONProperty traversal should provide correct holder/key receivers and source context without token-queue ordering errors.","rollback_reason":"Backpressure checks failed due an unused helper, and the primary metric stayed unchanged at 8; traversal still does not reduce remaining reviver failures.","next_action_hint":"Do not retry this source-tree traversal unchanged; inspect focused failures to find missing array/object/property semantics first."}}
{"type":"config","name":"QuickBEAM Math built-ins compatibility residual","metricName":"compatibility_failures","metricUnit":"","bestDirection":"lower"}
{"run":1611,"commit":"0457c0f","metric":2,"metrics":{"compiler_test262_cases":327,"compiler_test262_pass":325,"compiler_test262_failures":2,"compiler_test262_compiler_errors":0,"compiler_test262_compiler_crashes":0,"compiler_test262_compiler_fails":0,"compiler_test262_both_fail":1,"compiler_test262_interpreter_fail_compiler_pass":0,"compatibility_pass":325,"compatibility_cases":327,"compiler_errors":0,"compiler_crashes":0,"compiler_fails":0,"both_fail":1,"interpreter_fail_compiler_pass":0,"elapsed_ms":19602},"status":"keep","description":"Baseline Math residual after JSON plateau","timestamp":1778835178397,"segment":137,"confidence":null,"iterationTokens":125,"asi":{"hypothesis":"Rebaseline bounded Math workload after JSON residual plateau to pursue remaining Math.round and Math.sumPrecise semantic gaps."}}
{"run":1612,"commit":"HEAD","metric":2,"metrics":{"compiler_test262_cases":327,"compiler_test262_pass":325,"compiler_test262_failures":2,"compiler_test262_compiler_errors":0,"compiler_test262_compiler_crashes":0,"compiler_test262_compiler_fails":0,"compiler_test262_both_fail":1,"compiler_test262_interpreter_fail_compiler_pass":0,"compatibility_pass":325,"compatibility_cases":327,"compiler_errors":0,"compiler_crashes":0,"compiler_fails":0,"both_fail":1,"interpreter_fail_compiler_pass":0,"elapsed_ms":21495},"status":"discard","description":"Try scaled Math.sumPrecise summation","timestamp":1778835387583,"segment":137,"confidence":null,"iterationTokens":1540,"asi":{"hypothesis":"Scaling finite Math.sumPrecise inputs by their maximum magnitude before compensated summation should avoid overflow while preserving cancellation.","rollback_reason":"Primary metric stayed unchanged at 2; the scaled path avoided the earlier crash but still failed sumPrecise semantics or was offset.","next_action_hint":"Inspect focused sumPrecise/sum.js under the scaled patch before retrying; exact rounding of large cancellation cases likely needs a stronger algorithm."}}
{"run":1613,"commit":"HEAD","metric":2,"metrics":{"compiler_test262_cases":327,"compiler_test262_pass":325,"compiler_test262_failures":2,"compiler_test262_compiler_errors":0,"compiler_test262_compiler_crashes":0,"compiler_test262_compiler_fails":0,"compiler_test262_both_fail":1,"compiler_test262_interpreter_fail_compiler_pass":0,"compatibility_pass":325,"compatibility_cases":327,"compiler_errors":0,"compiler_crashes":0,"compiler_fails":0,"both_fail":1,"interpreter_fail_compiler_pass":0,"elapsed_ms":21517},"status":"discard","description":"Try Math.round floor half-up semantics","timestamp":1778835632306,"segment":137,"confidence":null,"iterationTokens":2925,"asi":{"hypothesis":"Math.round should use ECMAScript half-up behavior equivalent to floor(x + 0.5) outside the negative-zero interval, not Elixir's tie-to-even/away rounding.","rollback_reason":"Primary metric stayed unchanged at 2; focused A6 likely improves but broad workload remains offset or another Math.round edge fails.","next_action_hint":"Inspect failure list under this patch before retrying; simple half-up round has now stayed flat again."}}
{"run":1614,"commit":"HEAD","metric":2,"metrics":{"compiler_test262_cases":327,"compiler_test262_pass":325,"compiler_test262_failures":2,"compiler_test262_compiler_errors":0,"compiler_test262_compiler_crashes":0,"compiler_test262_compiler_fails":0,"compiler_test262_both_fail":1,"compiler_test262_interpreter_fail_compiler_pass":0,"compatibility_pass":325,"compatibility_cases":327,"compiler_errors":0,"compiler_crashes":0,"compiler_fails":0,"both_fail":1,"interpreter_fail_compiler_pass":0,"elapsed_ms":18806},"status":"discard","description":"Try Math.round large-integer half-up semantics","timestamp":1778835822969,"segment":137,"confidence":null,"iterationTokens":2418,"asi":{"hypothesis":"Math.round should use half-up rounding for ordinary values while returning already-integral large magnitudes unchanged to satisfy A6 and A7 edge cases together.","rollback_reason":"Primary metric stayed unchanged at 2; A6/A7 may trade off or Math.round remains failing for another edge.","next_action_hint":"Inspect failure list and focused A6/A7 under this patch; do not repeat round-only changes unchanged."}}
{"run":1615,"commit":"1c2f214","metric":1,"metrics":{"compiler_test262_cases":327,"compiler_test262_pass":326,"compiler_test262_failures":1,"compiler_test262_compiler_errors":0,"compiler_test262_compiler_crashes":0,"compiler_test262_compiler_fails":0,"compiler_test262_both_fail":0,"compiler_test262_interpreter_fail_compiler_pass":0,"compatibility_pass":326,"compatibility_cases":327,"compiler_errors":0,"compiler_crashes":0,"compiler_fails":0,"both_fail":0,"interpreter_fail_compiler_pass":0,"elapsed_ms":17667},"status":"keep","description":"Fix Math.round half-up edge cases","timestamp":1778836125304,"segment":137,"confidence":null,"iterationTokens":4735,"asi":{"hypothesis":"Math.round should preserve negative zero, round half values toward +infinity, return already-integral large magnitudes unchanged, and avoid the 0.5 - epsilon/4 addition rounding pitfall."}}
{"run":1616,"commit":"HEAD","metric":1,"metrics":{"compiler_test262_cases":327,"compiler_test262_pass":326,"compiler_test262_failures":1,"compiler_test262_compiler_errors":0,"compiler_test262_compiler_crashes":0,"compiler_test262_compiler_fails":0,"compiler_test262_both_fail":0,"compiler_test262_interpreter_fail_compiler_pass":0,"compatibility_pass":326,"compatibility_cases":327,"compiler_errors":0,"compiler_crashes":0,"compiler_fails":0,"both_fail":0,"interpreter_fail_compiler_pass":0,"elapsed_ms":18865},"status":"checks_failed","description":"Try exact integer Math.sumPrecise summation","timestamp":1778836280309,"segment":137,"confidence":null,"iterationTokens":3786,"asi":{"hypothesis":"Math.sumPrecise can avoid overflow by exactly summing finite IEEE-754 mantissas as integers and rounding the exact binary result back to double.","rollback_reason":"Backpressure checks failed due warnings from unused old fsum helpers, an unused variable, and float-zero pattern matching; benchmark still showed only one failure because round fix was also present.","next_action_hint":"Retry exact summation after removing obsolete fsum helpers and fixing warning sources; combine with the kept round fix if needed."}}
{"run":1617,"commit":"270f640","metric":0,"metrics":{"compiler_test262_cases":327,"compiler_test262_pass":327,"compiler_test262_failures":0,"compiler_test262_compiler_errors":0,"compiler_test262_compiler_crashes":0,"compiler_test262_compiler_fails":0,"compiler_test262_both_fail":0,"compiler_test262_interpreter_fail_compiler_pass":0,"compatibility_pass":327,"compatibility_cases":327,"compiler_errors":0,"compiler_crashes":0,"compiler_fails":0,"both_fail":0,"interpreter_fail_compiler_pass":0,"elapsed_ms":17540},"status":"keep","description":"Sum Math.sumPrecise exactly","timestamp":1778836582740,"segment":137,"confidence":null,"iterationTokens":12800,"asi":{"hypothesis":"Math.sumPrecise should avoid overflow and cancellation loss by exactly summing finite IEEE-754 mantissas as integers and rounding the exact binary result back to a double."}}
{"type":"config","name":"QuickBEAM JSON built-ins compatibility residual","metricName":"compatibility_failures","metricUnit":"","bestDirection":"lower"}
{"run":1618,"commit":"b060da7","metric":7,"metrics":{"compiler_test262_cases":165,"compiler_test262_pass":158,"compiler_test262_failures":7,"compiler_test262_compiler_errors":0,"compiler_test262_compiler_crashes":0,"compiler_test262_compiler_fails":0,"compiler_test262_both_fail":7,"compiler_test262_interpreter_fail_compiler_pass":0,"compatibility_pass":158,"compatibility_cases":165,"compiler_errors":0,"compiler_crashes":0,"compiler_fails":0,"both_fail":7,"interpreter_fail_compiler_pass":0,"elapsed_ms":7527},"status":"keep","description":"Baseline JSON residual after Math completion","timestamp":1778836776782,"segment":138,"confidence":null,"iterationTokens":125,"asi":{"hypothesis":"Rebaseline JSON residual after completing Math, returning to the remaining JSON.parse reviver/internalization failures."}}
